K10D0338_H0343:440a-21	gang zag sems can dmyal ba rnams su skyes ma thag tu 'chi 'pho ba'i las so //	gang_0 zag_5 sems_9 can_14 dmyal_18 ba_24 rnams_27 su_33 skye_36 ma_42 thag_45 tu_50 'chi_53 'pho_58 ba_63 las_68 so_72 
K10D0338_H0343:440a-22	de la las gang dang ldan na /	de_0 la_3 las_6 gang_10 dang_15 ldan_20 na_25 
K10D0338_H0343:440a-23	gang zag sngar bde bar gyur la /	gang_0 zag_5 sngar_9 bde_15 ba_19 gyur_23 la_28 
K10D0338_H0343:440a-24	phyis sdug bsngal bar 'gyur ba'i las gang zhe na /	'byid_0 sdug_6 sngal_11 ba_18 'gyur_22 ba_28 las_33 gang_37 zhe_42 na_46 
K10D0338_H0343:440a-25	'di la gang zag 'ga' zhig sbyin pa sbyin pa na /	'di_0 la_4 gang_7 zag_12 'ga'_16 'jig_21 sbyin_26 ba_32 sbyin_35 ba_41 na_44 
K10D0338_H0343:440a-26	yid rab tu dga' zhing dga' ba dang /	yid_0 rab_4 tu_8 dga'_11 zhing_16 dga'_22 ba_27 dang_30 
K10D0338_H0343:440a-27	yid bde ba skyes la byin nas ni 'gyod pa yin te /	yid_0 bde_4 ba_8 skye_11 la_17 byin_20 nas_25 ni_29 'gyod_32 ba_38 yin_41 te_45 
K10D0338_H0343:440a-28	gang zag de gang gi tshe mi rnams kyi nang du skye ba na phyug pa dang /	gang_0 zag_5 de_9 gang_12 gi_17 tshe_20 mi_25 rnams_28 kyi_34 nang_38 du_43 skye_46 ba_51 na_54 phyug_57 ba_63 dang_66 
K10D0338_H0343:440a-29	nor che ba dang /	nor_0 che_4 ba_8 dang_11 
K10D0338_H0343:440a-30	longs spyod che ba dang /	longs_0 spyod_6 che_12 ba_16 dang_19 
K10D0338_H0343:440a-31	nor dang yo byad mang ba dang /	nor_0 dang_4 yo_9 byad_12 mang_17 ba_22 dang_25 
K10D0338_H0343:440a-32	bdag dbang ba mang ba dang /	bdag_0 dbang_5 ba_11 mang_14 ba_19 dang_22 
K10D0338_H0343:440a-33	mdza' bshes dang /	mdza'_0 bshes_6 dang_12 
K10D0338_H0343:440a-34	blon po dang /	blon_0 po_5 dang_8 
K10D0338_H0343:440a-35	nye du dang /	nye_0 du_4 dang_7 
K10D0338_H0343:440b-0	@440b snag gi gnyen mtshams mang ba dang /	snag_6 gi_11 gnyen_14 mtshams_20 mang_28 ba_33 dang_36 
K10D0338_H0343:440b-1	mdzod dang /	mdzod_0 dang_6 
K10D0338_H0343:440b-2	bang ba yongs su gang ba'i khyim rnams su skye bar 'gyur te /	bang_0 ba_5 yongs_8 su_14 gang_17 ba_22 khyim_27 rnams_33 su_39 skye_42 ba_47 'gyur_51 te_57 
K10D0338_H0343:440b-3	khyim de lta bu dag tu skyes nas /	khyim_0 de_6 lta_9 bu_13 'dag_16 tu_20 skye_23 nas_29 
K10D0338_H0343:440b-4	shin tu skyid la bzhon pa la zhon zhing bde bar spyod la /	shin_0 tu_5 skyid_8 la_14 bzhon_17 ba_23 la_26 zhon_29 zhing_34 bde_40 ba_44 spyod_48 la_54 
K10D0338_H0343:440b-5	de'i longs spyod de dag phyis yongs su nyams zhing yongs su zad par 'gyur te /	de_0 longs_5 spyod_11 de_17 'dag_20 'byid_24 yongs_30 su_36 nyams_39 zhing_45 yongs_51 su_57 zad_60 ba_64 'gyur_68 te_74 
K10D0338_H0343:440b-6	de'i gzhis sdug bsngal bar 'gyur ba ste /	de_0 gzhis_5 sdug_11 sngal_16 ba_23 'gyur_27 ba_33 ste_36 
K10D0338_H0343:440b-7	'di ni las gang dang ldan na /	'di_0 ni_4 las_7 gang_11 dang_16 ldan_21 na_26 
K10D0338_H0343:440b-8	gang zag sngar bde bar 'gyur la /	gang_0 zag_5 sngar_9 bde_15 ba_19 'gyur_23 la_29 
K10D0338_H0343:440b-9	phyis sdug bsngal bar 'gyur ba'i las so ////	'byid_0 sdug_6 sngal_11 ba_18 'gyur_22 ba_28 las_33 so_37 
K10D0338_H0343:440b-10	las rnam par 'byed pa zhes bya ba /	las_0 rnam_4 ba_9 'byed_13 ba_19 zhes_22 byed_27 ba_31 
K10D0338_H0343:440b-11	bam po gnyis pa /	bam_0 po_4 gnyis_7 ba_13 
K10D0338_H0343:440b-12	de la las gang dang ldan na /	de_0 la_3 las_6 gang_10 dang_15 ldan_20 na_25 
K10D0338_H0343:440b-13	gang zag sngar sdug bsngal bar gyur la phyis bde bar 'gyur ba'i las gang zhe na /	gang_0 zag_5 sngar_9 sdug_15 sngal_20 ba_27 gyur_31 la_36 'byid_39 bde_45 ba_49 'gyur_53 ba_59 las_64 gang_68 zhe_73 na_77 
K10D0338_H0343:440b-14	'di la gang zag 'ga' zhig sbyin pa sbyin pa na /	'di_0 la_4 gang_7 zag_12 'ga'_16 'jig_21 sbyin_26 ba_32 sbyin_35 ba_41 na_44 
K10D0338_H0343:440b-15	sdug bsngal bar 'jug cing /	sdug_0 sngal_5 ba_12 'jug_16 cing_21 
K10D0338_H0343:440b-16	sdug bsngal bar sbyin pa byin nas ni mi 'gyod par gyur cing /	sdug_0 sngal_5 ba_12 sbyin_16 ba_22 byin_25 nas_30 ni_34 mi_37 'gyod_40 ba_46 gyur_50 cing_55 
K10D0338_H0343:440b-17	dga' ba dang /	dga'_0 ba_5 dang_8 
K10D0338_H0343:440b-18	yid bde ba skyes pa yin te /	yid_0 bde_4 ba_8 skye_11 ba_17 yin_20 te_24 
K10D0338_H0343:440b-19	gang zag de gang gi tshe mi rnams kyi nang du skye ba na /	gang_0 zag_5 de_9 gang_12 gi_17 tshe_20 mi_25 rnams_28 kyi_34 nang_38 du_43 skye_46 ba_51 na_54 
K10D0338_H0343:440b-20	dbul po bza' ba dang /	'bul_0 po_5 bza'_8 ba_13 dang_16 
K10D0338_H0343:440b-21	btung pa dang /	'thung_0 ba_6 dang_9 
K10D0338_H0343:440b-22	kha zas nyung ba sdug bsngal bas 'tsho ba'i khyim rnams su skye bar 'gyur ba ste /	kha_0 zas_4 nyung_8 ba_14 sdug_17 sngal_22 ba_29 'tsho_33 ba_39 khyim_44 rnams_50 su_56 skye_59 ba_64 'gyur_68 ba_74 ste_77 
K10D0338_H0343:440b-23	der sdug bsngal bar bza' ba dang /	der_0 sdug_4 sngal_9 ba_16 bza'_20 ba_25 dang_28 
K10D0338_H0343:440b-24	bgo ba rnyed la des che 'gras su gyur pa dang /	bgod_0 ba_4 rnyed_7 la_13 des_16 che_20 'gras_24 su_30 gyur_33 ba_38 dang_41 
K10D0338_H0343:440b-25	longs spyod de dag 'phel zhing rgyas par 'gyur ba ste /	longs_0 spyod_6 de_12 'dag_15 'phel_19 zhing_25 rgya_31 ba_37 'gyur_41 ba_47 ste_50 
K10D0338_H0343:440b-26	'di ni las gang dang ldan na /	'di_0 ni_4 las_7 gang_11 dang_16 ldan_21 na_26 
K10D0338_H0343:440b-27	gang zag sngar sdug bsngal bar gyur la /	gang_0 zag_5 sngar_9 sdug_15 sngal_20 ba_27 gyur_31 la_36 
K10D0338_H0343:441a-0	phyis bde @441a *//	'byid_0 bde_6 
K10D0338_H0343:441a-1	bar 'gyur ba'i las so //	ba_0 'gyur_4 ba_10 las_15 so_19 
K10D0338_H0343:441a-2	de la las gang dang ldan na /	de_0 la_3 las_6 gang_10 dang_15 ldan_20 na_25 
K10D0338_H0343:441a-3	gang zag sngar yang bde bar gyur la /	gang_0 zag_5 sngar_9 yang_15 bde_20 ba_24 gyur_28 la_33 
K10D0338_H0343:441a-4	phyis kyang bde bar 'gyur ba'i las gang zhe na /	'byid_0 kyang_6 bde_12 ba_16 'gyur_20 ba_26 las_31 gang_35 zhe_40 na_44 
K10D0338_H0343:441a-5	'di la gang zag 'ga' zhig sbyin pa sbyin pa na /	'di_0 la_4 gang_7 zag_12 'ga'_16 'jig_21 sbyin_26 ba_32 sbyin_35 ba_41 na_44 
K10D0338_H0343:441a-6	yid dga' bzhin du byin te dga' ba dang /	yid_0 dga'_4 bzhin_9 du_15 byin_18 te_23 dga'_26 ba_31 dang_34 
K10D0338_H0343:441a-7	yid bde ba skyes nas /	yid_0 bde_4 ba_8 skye_11 nas_17 
K10D0338_H0343:441a-8	byin nas kyang mi 'gyod pa yin te /	byin_0 nas_5 kyang_9 mi_15 'gyod_18 ba_24 yin_27 te_31 
K10D0338_H0343:441a-9	gang zag de gang gi tshe mi rnams kyi nang du skye ba na /	gang_0 zag_5 de_9 gang_12 gi_17 tshe_20 mi_25 rnams_28 kyi_34 nang_38 du_43 skye_46 ba_51 na_54 
K10D0338_H0343:441a-10	phyug pa dang /	phyug_0 ba_6 dang_9 
K10D0338_H0343:441a-11	nor che ba dang /	nor_0 che_4 ba_8 dang_11 
K10D0338_H0343:441a-12	longs spyod che ba dang /	longs_0 spyod_6 che_12 ba_16 dang_19 
K10D0338_H0343:441a-13	nor dang /	nor_0 dang_4 
K10D0338_H0343:441a-14	yo byad mang ba dang /	yo_0 byad_3 mang_8 ba_13 dang_16 
K10D0338_H0343:441a-15	bdag dbang ba mang ba dang /	bdag_0 dbang_5 ba_11 mang_14 ba_19 dang_22 
K10D0338_H0343:441a-16	mdza' bshes dang /	mdza'_0 bshes_6 dang_12 
K10D0338_H0343:441a-17	blon po dang /	blon_0 po_5 dang_8 
K10D0338_H0343:441a-18	nye du dang /	nye_0 du_4 dang_7 
K10D0338_H0343:441a-19	snag gi gnyen mtshams mang ba dang /	snag_0 gi_5 gnyen_8 mtshams_14 mang_22 ba_27 dang_30 
K10D0338_H0343:441a-20	mdzod dang /	mdzod_0 dang_6 
K10D0338_H0343:441a-21	bang ba yongs su gang ba'i khyim rnams su skye bar 'gyur te /	bang_0 ba_5 yongs_8 su_14 gang_17 ba_22 khyim_27 rnams_33 su_39 skye_42 ba_47 'gyur_51 te_57 
K10D0338_H0343:441a-22	khyim de lta bu dag tu skyes nas shin tu	khyim_0 de_6 lta_9 bu_13 'dag_16 tu_20 skye_23 nas_29 shin_33 tu_38 
K10D0338_H0343:441a-23	skyid la bzhon pa la zhon zhing bde bar spyod	skyid_0 la_6 bzhon_9 ba_15 la_18 zhon_21 zhing_26 bde_32 ba_36 spyod_40 
K10D0338_H0343:441a-24	la / de'i longs spyod de dag phyis kyang 'phel ba ste /	la_0 de_5 longs_10 spyod_16 de_22 'dag_25 'byid_29 kyang_35 'phel_41 ba_47 ste_50 
K10D0338_H0343:441a-25	'di ni las gang dang ldan na /	'di_0 ni_4 las_7 gang_11 dang_16 ldan_21 na_26 
K10D0338_H0343:441a-26	gang zag sngar yang bde bar 'gyur la; phyis kyang bde bar 'gyur ba'i las so //	gang_0 zag_5 sngar_9 yang_15 bde_20 ba_24 'gyur_28 la;_34 'byid_38 kyang_44 bde_50 ba_54 'gyur_58 ba_64 las_69 so_73 
K10D0338_H0343:441a-27	de la las gang dang ldan na /	de_0 la_3 las_6 gang_10 dang_15 ldan_20 na_25 
K10D0338_H0343:441a-28	gang zag sngar yang sdug bsngal bar gyur la /	gang_0 zag_5 sngar_9 yang_15 sdug_20 sngal_25 ba_32 gyur_36 la_41 
K10D0338_H0343:441a-29	phyis kyang sdug bsngal bar 'gyur ba'i las gang zhe na /	'byid_0 kyang_6 sdug_12 sngal_17 ba_24 'gyur_28 ba_34 las_39 gang_43 zhe_48 na_52 
K10D0338_H0343:441a-30	'di la gang zag 'ga' zhig dge ba'i bshes gnyen dang bral bar gyur te /	'di_0 la_4 gang_7 zag_12 'ga'_16 'jig_21 dge_26 ba_30 bshes_35 gnyen_41 dang_47 'bral_52 ba_57 gyur_61 te_66 
K10D0338_H0343:441a-31	de sus kyang sbyin pa yang dag par 'dzin du ma bcug pa yin /	de_0 sus_3 kyang_7 sbyin_13 ba_19 yang_22 'dag_27 ba_31 'dzin_35 du_41 ma_44 'jug_47 ba_52 yin_55 
K10D0338_H0343:441b-0	des kyang sbyin @441b ba ci yang ma byin pa yin /	des_0 kyang_4 sbyin_10 ba_22 ci_25 yang_28 ma_33 byin_36 ba_41 yin_44 
K10D0338_H0343:441b-1	des sdig pa'i las ci yang ma byas shing ma bsags pa yin te /	des_0 sdig_4 ba_9 las_14 ci_18 yang_21 ma_26 byed_29 shing_34 ma_40 bsags_43 ba_49 yin_52 te_56 
K10D0338_H0343:441b-2	gang zag de gang gi tshe mi rnams kyi nang du skye ba na /	gang_0 zag_5 de_9 gang_12 gi_17 tshe_20 mi_25 rnams_28 kyi_34 nang_38 du_43 skye_46 ba_51 na_54 
K10D0338_H0343:441b-3	dbul po bza' ba dang /	'bul_0 po_5 bza'_8 ba_13 dang_16 
K10D0338_H0343:441b-4	btung ba dang /	'thung_0 ba_6 dang_9 
K10D0338_H0343:441b-5	kha zas nyung ba /	kha_0 zas_4 nyung_8 ba_14 
K10D0338_H0343:441b-6	sdug bsngal bas 'tsho ba'i khyim rnams su skye bar 'gyur te /	sdug_0 sngal_5 ba_12 'tsho_16 ba_22 khyim_27 rnams_33 su_39 skye_42 ba_47 'gyur_51 te_57 
K10D0338_H0343:441b-7	de der skyes nas sdug bsngal bar bza' ba dang /	de_0 der_3 skye_7 nas_13 sdug_17 sngal_22 ba_29 bza'_33 ba_38 dang_41 
K10D0338_H0343:441b-8	bgo ba rnyed par mi 'gyur la; de'i longs spyod de dag phyis kyang mi 'phel ba ste /	bgod_0 ba_4 rnyed_7 ba_13 mi_17 'gyur_20 la;_26 de_30 longs_35 spyod_41 de_47 'dag_50 'byid_54 kyang_60 mi_66 'phel_69 ba_75 ste_78 
K10D0338_H0343:441b-9	'di ni las gang dang ldan na /	'di_0 ni_4 las_7 gang_11 dang_16 ldan_21 na_26 
K10D0338_H0343:441b-10	gang zag sngar yang sdug bsngal bar gyur la /	gang_0 zag_5 sngar_9 yang_15 sdug_20 sngal_25 ba_32 gyur_36 la_41 
K10D0338_H0343:441b-11	phyis kyang sdug bsngal bar 'gyur ba'i las so //	'byid_0 kyang_6 sdug_12 sngal_17 ba_24 'gyur_28 ba_34 las_39 so_43 
K10D0338_H0343:441b-12	de la las gang dang ldan na /	de_0 la_3 las_6 gang_10 dang_15 ldan_20 na_25 
K10D0338_H0343:441b-13	gang zag phyug por gyur la gtong ba dang ldan pa'i las gang zhe na /	gang_0 zag_5 phyug_9 por_15 gyur_19 la_24 gtong_27 ba_33 dang_36 ldan_41 ba_46 las_51 gang_55 zhe_60 na_64 
K10D0338_H0343:441b-14	'di la gang zag zhig gis snod bzang por gyur	'di_0 la_4 gang_7 zag_12 'jig_16 gis_21 snod_25 bzang_30 por_36 gyur_40 
K10D0338_H0343:441b-15	pa rnams la sbyin pa dpag tu med pa byin	ba_0 rnams_3 la_9 sbyin_12 ba_18 dpog_21 tu_26 med_29 ba_33 byin_36 
K10D0338_H0343:441b-16	pa yin / des gtong ba goms par byas pa yin te /	ba_0 yin_3 des_9 gtong_13 ba_19 goms_22 ba_27 byed_31 ba_36 yin_39 te_43 
K10D0338_H0343:441b-17	des bsod nams dag bsgoms pas phyug por 'gyur /	des_0 bsod_4 nams_9 'dag_14 sgom_18 ba_25 phyug_29 por_35 'gyur_39 
K10D0338_H0343:441b-18	gtong ba bsgoms pas gtong ba dang ldan par 'gyur te /	gtong_0 ba_6 sgom_9 ba_16 gtong_20 ba_26 dang_29 ldan_34 ba_39 'gyur_43 te_49 
K10D0338_H0343:441b-19	'di ni las gang dang ldan na /	'di_0 ni_4 las_7 gang_11 dang_16 ldan_21 na_26 
K10D0338_H0343:441b-20	gang zag phyug por gyur la gtong ba dang ldan pa'i las so //	gang_0 zag_5 phyug_9 por_15 gyur_19 la_24 gtong_27 ba_33 dang_36 ldan_41 ba_46 las_51 so_55 
K10D0338_H0343:441b-21	de la las gang dang ldan na /	de_0 la_3 las_6 gang_10 dang_15 ldan_20 na_25 
K10D0338_H0343:441b-22	gang zag phyug por gyur la ser sna can du 'gyur ba'i las gang zhe na /	gang_0 zag_5 phyug_9 por_15 gyur_19 la_24 ser_27 sna_31 can_35 du_39 'gyur_42 ba_48 las_53 gang_57 zhe_62 na_66 
K10D0338_H0343:441b-23	'di la gang zag 'ga' zhig gis snod du gyur	'di_0 la_4 gang_7 zag_12 'ga'_16 'jig_21 gis_26 snod_30 du_35 gyur_38 
K10D0338_H0343:441b-24	pa rnams la sbyin pa cung zad tsam byin pa	ba_0 rnams_3 la_9 sbyin_12 ba_18 cung_21 zad_26 tsam_30 byin_35 ba_40 
K10D0338_H0343:442a-0	yin gyi / de gtong ba la cher @442a *//	yin_0 gyi_4 de_10 gtong_13 ba_19 la_22 cher_25 
K10D0338_H0343:442a-1	goms par ma byas pa yin te /	goms_0 ba_5 ma_9 byed_12 ba_17 yin_20 te_24 
K10D0338_H0343:442a-2	gang zag de gang gi tshe mi'i nang du skye ba na /	gang_0 zag_5 de_9 gang_12 gi_17 tshe_20 mi_25 nang_30 du_35 skye_38 ba_43 na_46 
K10D0338_H0343:442a-3	phyug pa dang /	phyug_0 ba_6 dang_9 
K10D0338_H0343:442a-4	nor che ba dang /	nor_0 che_4 ba_8 dang_11 
K10D0338_H0343:442a-5	longs spyod che ba dang /	longs_0 spyod_6 che_12 ba_16 dang_19 
K10D0338_H0343:442a-6	nor dang /	nor_0 dang_4 
K10D0338_H0343:442a-7	yo byad mang ba dang /	yo_0 byad_3 mang_8 ba_13 dang_16 
K10D0338_H0343:442a-8	bdag dbang ba mang ba'i khyim rnams su skye bar 'gyur te /	bdag_0 dbang_5 ba_11 mang_14 ba_19 khyim_24 rnams_30 su_36 skye_39 ba_44 'gyur_48 te_54 
K10D0338_H0343:442a-9	snod bzang po rnams la phul ba ni /	snod_0 bzang_5 po_11 rnams_14 la_20 'bul_23 ba_28 ni_31 
K10D0338_H0343:442a-10	skyid pa 'gyur /	skyid_0 ba_6 'gyur_9 
K10D0338_H0343:442a-11	gtong ba la goms par ma byas pas ni ser sna can du 'gyur te /	gtong_0 ba_6 la_9 goms_12 ba_17 ma_21 byed_24 ba_29 ni_33 ser_36 sna_40 can_44 du_48 'gyur_51 te_57 
K10D0338_H0343:442a-12	'di ni las gang dang ldan na /	'di_0 ni_4 las_7 gang_11 dang_16 ldan_21 na_26 
K10D0338_H0343:442a-13	gang zag phyug por gyur la ser sna can du 'gyur ba'i las so //	gang_0 zag_5 phyug_9 por_15 gyur_19 la_24 ser_27 sna_31 can_35 du_39 'gyur_42 ba_48 las_53 so_57 
K10D0338_H0343:442a-14	de la las gang dang ldan na /	de_0 la_3 las_6 gang_10 dang_15 ldan_20 na_25 
K10D0338_H0343:442a-15	gang zag dbul por gyur la gtong ba dang ldan par 'gyur ba'i las gang zhe na /	gang_0 zag_5 'bul_9 por_14 gyur_18 la_23 gtong_26 ba_32 dang_35 ldan_40 ba_45 'gyur_49 ba_55 las_60 gang_64 zhe_69 na_73 
K10D0338_H0343:442a-16	'di la gang zag 'ga' zhig gis snod du gyur	'di_0 la_4 gang_7 zag_12 'ga'_16 'jig_21 gis_26 snod_30 du_35 gyur_38 
K10D0338_H0343:442a-17	pa ma yin pa rnams la sbyin pa mang du	ba_0 ma_3 yin_6 ba_10 rnams_13 la_19 sbyin_22 ba_28 mang_31 du_36 
K10D0338_H0343:442a-18	byin pa yin te; de 'khor ba na 'khor ba'i	byin_0 ba_5 yin_8 te;_12 de_16 'khor_19 ba_25 na_28 'khor_31 ba_37 
K10D0338_H0343:442a-19	tshe / bsod nams de dag yongs su nyams shing /	tshe_0 bsod_7 nams_12 de_17 'dag_20 yongs_24 su_30 nyams_33 shing_39 
K10D0338_H0343:442a-20	yongs su zad par 'gyur /	yongs_0 su_6 zad_9 ba_13 'gyur_17 
K10D0338_H0343:442a-21	gtong ba'i rgyu yang phyi phyir zhing bsgoms pa yin te /	gtong_0 ba_6 rgyu_11 yang_16 phyi_21 phyir_26 zhing_32 sgom_38 ba_45 yin_48 te_52 
K10D0338_H0343:442a-22	de bsod nams yongs su zad pa'i phyir dbul por 'gyur /	de_0 bsod_3 nams_8 yongs_13 su_19 zad_22 ba_26 phyir_31 'bul_37 por_42 'gyur_46 
K10D0338_H0343:442a-23	sngon goms par byas pas gtong ba dang ldan par 'gyur te /	sngon_0 goms_6 ba_11 byed_15 ba_20 gtong_24 ba_30 dang_33 ldan_38 ba_43 'gyur_47 te_53 
K10D0338_H0343:442a-24	'di ni las gang dang ldan na /	'di_0 ni_4 las_7 gang_11 dang_16 ldan_21 na_26 
K10D0338_H0343:442a-25	gang zag dbul por gyur la gtong ba dang ldan pa'i las so //	gang_0 zag_5 'bul_9 por_14 gyur_18 la_23 gtong_26 ba_32 dang_35 ldan_40 ba_45 las_50 so_54 
K10D0338_H0343:442a-26	de la las gang dang ldan na /	de_0 la_3 las_6 gang_10 dang_15 ldan_20 na_25 
K10D0338_H0343:442a-27	gang zag dbul por gyur la ser sna can du 'gyur ba'i las gang zhe na /	gang_0 zag_5 'bul_9 por_14 gyur_18 la_23 ser_26 sna_30 can_34 du_38 'gyur_41 ba_47 las_52 gang_56 zhe_61 na_65 
K10D0338_H0343:442b-0	'di la @442b gang zag 'ga' zhig dge ba'i bshes gnyen dang bral bar gyur te /	'di_0 la_4 gang_13 zag_18 'ga'_22 'jig_27 dge_32 ba_36 bshes_41 gnyen_47 dang_53 'bral_58 ba_63 gyur_67 te_72 
K10D0338_H0343:442b-1	de sus kyang sbyin pa yang dag par 'dzin du ma bcug pa yin /	de_0 sus_3 kyang_7 sbyin_13 ba_19 yang_22 'dag_27 ba_31 'dzin_35 du_41 ma_44 'jug_47 ba_52 yin_55 
K10D0338_H0343:442b-2	des kyang sbyin pa ci yang ma btang ba yin /	des_0 kyang_4 sbyin_10 ba_16 ci_19 yang_22 ma_27 gtong_30 ba_36 yin_39 
K10D0338_H0343:442b-3	sdig pa'i las kyang ma byas shing ma bsags pa yin te /	sdig_0 ba_5 las_10 kyang_14 ma_20 byed_23 shing_28 ma_34 bsags_37 ba_43 yin_46 te_50 
K10D0338_H0343:442b-4	gang zag de gang gi tshe mi rnams kyi nang du skye ba na /	gang_0 zag_5 de_9 gang_12 gi_17 tshe_20 mi_25 rnams_28 kyi_34 nang_38 du_43 skye_46 ba_51 na_54 
K10D0338_H0343:442b-5	dbul po bza' ba dang /	'bul_0 po_5 bza'_8 ba_13 dang_16 
K10D0338_H0343:442b-6	btung ba dang /	'thung_0 ba_6 dang_9 
K10D0338_H0343:442b-7	kha zas nyung ba /	kha_0 zas_4 nyung_8 ba_14 
K10D0338_H0343:442b-8	sdug bsngal ba /	sdug_0 sngal_5 ba_12 
K10D0338_H0343:442b-9	sdug bsngal bas 'tsho ba'i khyim rnams su skye bar 'gyur te /	sdug_0 sngal_5 ba_12 'tsho_16 ba_22 khyim_27 rnams_33 su_39 skye_42 ba_47 'gyur_51 te_57 
K10D0338_H0343:442b-10	de de na sdug bsngal bar bza' ba dang /	de_0 de_3 na_6 sdug_9 sngal_14 ba_21 bza'_25 ba_30 dang_33 
K10D0338_H0343:442b-11	bgo ba rnyed par 'gyur ro //	bgod_0 ba_4 rnyed_7 ba_13 'gyur_17 ro_23 
K10D0338_H0343:442b-12	gtong ba ma bsgoms pas dbul zhing ser sna can du 'gyur te /	gtong_0 ba_6 ma_9 sgom_12 ba_19 'bul_23 zhing_28 ser_34 sna_38 can_42 du_46 'gyur_49 te_55 
K10D0338_H0343:442b-13	'di ni las gang dang ldan na /	'di_0 ni_4 las_7 gang_11 dang_16 ldan_21 na_26 
K10D0338_H0343:442b-14	gang zag dbul por gyur la ser sna can du 'gyur ba'i las so //	gang_0 zag_5 'bul_9 por_14 gyur_18 la_23 ser_26 sna_30 can_34 du_38 'gyur_41 ba_47 las_52 so_56 
K10D0338_H0343:442b-15	de la las gang dang ldan na /	de_0 la_3 las_6 gang_10 dang_15 ldan_20 na_25 
K10D0338_H0343:442b-16	gang zag lus bde bar gyur la sems kyis ma yin pa'i las gang zhe na /	gang_0 zag_5 lus_9 bde_13 ba_17 gyur_21 la_26 sems_29 kyis_34 ma_39 yin_42 ba_46 las_51 gang_55 zhe_60 na_64 
K10D0338_H0343:442b-17	bsod nams byas pa'i so so'i skye bo ste /	bsod_0 nams_5 byed_10 ba_15 so_20 so_23 skye_28 'bo_33 ste_36 
K10D0338_H0343:442b-18	dper na /	dper_0 na_5 
K10D0338_H0343:442b-19	'khor los sgyur ba'i rgyal po lta bu ste /	'khor_0 los_6 sgyur_10 ba_16 rgyal_21 po_27 lta_30 bu_34 ste_37 
K10D0338_H0343:442b-20	gang zag 'di ni lus bde bar gyur la sems kyis ma yin pa'o //	gang_0 zag_5 'di_9 ni_13 lus_16 bde_20 ba_24 gyur_28 la_33 sems_36 kyis_41 ma_46 yin_49 ba_53 
K10D0338_H0343:442b-21	de la las gang dang ldan na /	de_0 la_3 las_6 gang_10 dang_15 ldan_20 na_25 
K10D0338_H0343:442b-22	gang zag sems bde bar gyur la lus kyis ma	gang_0 zag_5 sems_9 bde_14 ba_18 gyur_22 la_27 lus_30 kyis_34 ma_39 
K10D0338_H0343:442b-23	yin pa'i las gang zhe na; bsod nams ma byas	yin_0 ba_4 las_9 gang_13 zhe_18 na;_22 bsod_26 nams_31 ma_36 byed_39 
K10D0338_H0343:442b-24	pa'i dgra bcom pa ste /	ba_0 dgra_5 'joms_10 ba_15 ste_18 
K10D0338_H0343:442b-25	dper na /	dper_0 na_5 
K10D0338_H0343:442b-26	gnas brtan [?] lta bu ste /	gnas_0 brtan_5 lta_15 bu_19 ste_22 
K10D0338_H0343:442b-27	gang zag 'di ni sems bde bar gyur la lus kyis ma yin pa'o //	gang_0 zag_5 'di_9 ni_13 sems_16 bde_21 ba_25 gyur_29 la_34 lus_37 kyis_41 ma_46 yin_49 ba_53 
K10D0338_H0343:443a-0	@443a *// de la lus kyang bde la sems kyang bde ba'i gang zag gang zhe na /	de_10 la_13 lus_16 kyang_20 bde_26 la_30 sems_33 kyang_38 bde_44 ba_48 gang_53 zag_58 gang_62 zhe_67 na_71 
K10D0338_H0343:443a-1	bsod nams byas pa'i dgra bcom pa ste /	bsod_0 nams_5 byed_10 ba_15 dgra_20 'joms_25 ba_30 ste_33 
K10D0338_H0343:443a-2	dper na /	dper_0 na_5 
K10D0338_H0343:443a-3	gnas brtan she ba la lta bu ste /	gnas_0 brtan_5 she_11 ba_15 la_18 lta_21 bu_25 ste_28 
K10D0338_H0343:443a-4	gang zag 'di ni lus kyang bde la sems kyang bde ba'o //	gang_0 zag_5 'di_9 ni_13 lus_16 kyang_20 bde_26 la_30 sems_33 kyang_38 bde_44 ba_48 
K10D0338_H0343:443a-5	de la lus kyang mi bde la /	de_0 la_3 lus_6 kyang_10 mi_16 bde_19 la_23 
K10D0338_H0343:443a-6	sems kyang mi bde ba'i gang zag gang zhe na /	sems_0 kyang_5 mi_11 bde_14 ba_18 gang_23 zag_28 gang_32 zhe_37 na_41 
K10D0338_H0343:443a-7	'di lta ste /	'di_0 lta_4 ste_8 
K10D0338_H0343:443a-8	bsod nams ma byas pa'i so so'i skye bo ste /	bsod_0 nams_5 ma_10 byed_13 ba_18 so_23 so_26 skye_31 'bo_36 ste_39 
K10D0338_H0343:443a-9	gang zag 'di ni lus kyang mi bde la /	gang_0 zag_5 'di_9 ni_13 lus_16 kyang_20 mi_26 bde_29 la_33 
K10D0338_H0343:443a-10	sems kyang mi bde ba'o //	sems_0 kyang_5 mi_11 bde_14 ba_18 
K10D0338_H0343:443a-11	de la gang zag gang gi tshe zad par gyur la /	de_0 la_3 gang_6 zag_11 gang_15 gi_20 tshe_23 zad_28 ba_32 gyur_36 la_41 
K10D0338_H0343:443a-12	las ma zad pa gang zhe na /	las_0 ma_4 zad_7 ba_11 gang_14 zhe_19 na_23 
K10D0338_H0343:443a-13	gang zag gang sems can dmyal ba nas shi 'phos la sems can dmyal bar skye ba dang /	gang_0 zag_5 gang_9 sems_14 can_19 dmyal_23 ba_29 nas_32 'chi_36 'pho_40 la_46 sems_49 can_54 dmyal_58 ba_64 skye_68 ba_73 dang_76 
K10D0338_H0343:443a-14	dud 'gro nas shi 'phos la dud 'gror skye ba dang /	dud_0 'gro_4 nas_9 'chi_13 'pho_17 la_23 dud_26 'gror_30 skye_36 ba_41 dang_44 
K10D0338_H0343:443a-15	yi dvags las shi 'phos la yi dvags su skye ba dang /	yi_0 dvags_3 las_9 'chi_13 'pho_17 la_23 yi_26 dvags_29 su_35 skye_38 ba_43 dang_46 
K10D0338_H0343:443a-16	lha las shi 'phos la lhar skye ba dang /	lha_0 las_4 'chi_8 'pho_12 la_18 lhar_21 skye_26 ba_31 dang_34 
K10D0338_H0343:443a-17	mi las shi 'phos la mir skye ba ste /	mi_0 las_3 'chi_7 'pho_11 la_17 mir_20 skye_24 ba_29 ste_32 
K10D0338_H0343:443a-18	gang zag 'di tshe zad par gyur la /	gang_0 zag_5 'di_9 tshe_13 zad_18 ba_22 gyur_26 la_31 
K10D0338_H0343:443a-19	las ma zad pa'o //	las_0 ma_4 zad_7 ba_11 
K10D0338_H0343:443a-20	de la gang zag gi las zad par gyur la tshe ma zad pa'i gang zag gang zhe na /	de_0 la_3 gang_6 zag_11 gi_15 las_18 zad_22 ba_26 gyur_30 la_35 tshe_38 ma_43 zad_46 ba_50 gang_55 zag_60 gang_64 zhe_69 na_73 
K10D0338_H0343:443a-21	gang zag gang sngar bde bar gyur la /	gang_0 zag_5 gang_9 sngar_14 bde_20 ba_24 gyur_28 la_33 
K10D0338_H0343:443a-22	phyis sdug bsngal bar gyur pa dang /	'byid_0 sdug_6 sngal_11 ba_18 gyur_22 ba_27 dang_30 
K10D0338_H0343:443a-23	sngar sdug bsngal bar gyur la /	sngar_0 sdug_6 sngal_11 ba_18 gyur_22 la_27 
K10D0338_H0343:443a-24	phyis bde bar gyur pa ste /	'byid_0 bde_6 ba_10 gyur_14 ba_19 ste_22 
K10D0338_H0343:443a-25	gang zag de ni las zad par gyur la tshe ma zad pa'o //	gang_0 zag_5 de_9 ni_12 las_15 zad_19 ba_23 gyur_27 la_32 tshe_35 ma_40 zad_43 ba_47 
K10D0338_H0343:443a-26	de la gang zag gang gi las kyang zad la /	de_0 la_3 gang_6 zag_11 gang_15 gi_20 las_23 kyang_27 zad_33 la_37 
K10D0338_H0343:443b-0	tshe yang @443b zad pa'i gang zag gang zhe na /	tshe_0 yang_5 zad_16 ba_20 gang_25 zag_30 gang_34 zhe_39 na_43 
K10D0338_H0343:443b-1	gang zag gang sems can dmyal ba nas shi 'phos te /	gang_0 zag_5 gang_9 sems_14 can_19 dmyal_23 ba_29 nas_32 'chi_36 'pho_40 te_46 
K10D0338_H0343:443b-2	dud 'gror skye ba dang /	dud_0 'gror_4 skye_10 ba_15 dang_18 
K10D0338_H0343:443b-3	dud 'gro nas shi 'phos te /	dud_0 'gro_4 nas_9 'chi_13 'pho_17 te_23 
K10D0338_H0343:443b-4	yi dvags su skye ba dang /	yi_0 dvags_3 su_9 skye_12 ba_17 dang_20 
K10D0338_H0343:443b-5	yi dvags las shi 'phos te /	yi_0 dvags_3 las_9 'chi_13 'pho_17 te_23 
K10D0338_H0343:443b-6	lha ma yin gyi nang du skye ba dang /	lha_0 ma_4 yin_7 gyi_11 nang_15 du_20 skye_23 ba_28 dang_31 
K10D0338_H0343:443b-7	lha ma yin la shi 'phos te /	lha_0 ma_4 yin_7 la_11 'chi_14 'pho_18 te_24 
K10D0338_H0343:443b-8	mi'i nang du skye ba dang /	mi_0 nang_5 du_10 skye_13 ba_18 dang_21 
K10D0338_H0343:443b-9	mi las shi 'phos te /	mi_0 las_3 'chi_7 'pho_11 te_17 
K10D0338_H0343:443b-10	lha'i nang du skye ba ste /	lha_0 nang_6 du_11 skye_14 ba_19 ste_22 
K10D0338_H0343:443b-11	gang zag de ni tshe yang zad la las kyang zad pa'o //	gang_0 zag_5 de_9 ni_12 tshe_15 yang_20 zad_25 la_29 las_32 kyang_36 zad_42 ba_46 
K10D0338_H0343:443b-12	de la gang zag gang tshe yang ma zad cing las kyang ma zad la /	de_0 la_3 gang_6 zag_11 gang_15 tshe_20 yang_25 ma_30 zad_33 cing_37 las_42 kyang_46 ma_52 zad_55 la_59 
K10D0338_H0343:443b-13	de'i nyon mongs pa rnams zad pa'i gang zag gang zhe na /	de_0 nyon_5 mongs_10 ba_16 rnams_19 zad_25 ba_29 gang_34 zag_39 gang_43 zhe_48 na_52 
K10D0338_H0343:443b-14	rgyun du zhugs pa dang /	rgyun_0 du_6 'jug_9 ba_15 dang_18 
K10D0338_H0343:443b-15	lan gcig phyir 'ong ba dang /	lan_0 gcig_4 phyir_9 'ong_15 ba_20 dang_23 
K10D0338_H0343:443b-16	phyir mi 'ong ba dang /	phyir_0 mi_6 'ong_9 ba_14 dang_17 
K10D0338_H0343:443b-17	dgra bcom pa ste /	dgra_0 'joms_5 ba_10 ste_13 
K10D0338_H0343:443b-18	gang zag de ni tshe yang ma zad cing /	gang_0 zag_5 de_9 ni_12 tshe_15 yang_20 ma_25 zad_28 cing_32 
K10D0338_H0343:443b-19	las kyang ma zad la /	las_0 kyang_4 ma_10 zad_13 la_17 
K10D0338_H0343:443b-20	de'i nyon mongs pa rnams zad pa yin no; ;de la las gang dang ldan na /	de_0 nyon_5 mongs_10 ba_16 rnams_19 zad_25 ba_29 yin_32 no;_36 ;de_40 la_44 las_47 gang_51 dang_56 ldan_61 na_66 
K10D0338_H0343:443b-21	gang zag ngan song rnams su skyes la /	gang_0 zag_5 ngan_9 'gro_14 rnams_19 su_25 skye_28 la_34 
K10D0338_H0343:443b-22	gzugs bzang ba dang /	gzugs_0 bzang_6 ba_12 dang_15 
K10D0338_H0343:443b-23	mdzes pa dang /	mdzes_0 ba_6 dang_9 
K10D0338_H0343:443b-24	blta na sdug pa dang /	lta_0 na_5 sdug_8 ba_13 dang_16 
K10D0338_H0343:443b-25	mdog snum pa dang /	mdog_0 snum_5 ba_10 dang_13 
K10D0338_H0343:443b-26	pags pa snam pa dang /	pags_0 ba_5 snam_8 ba_13 dang_16 
