K10D0272_H0274:80b-0	@80b / / gya gar skad du /	gar_13 skad_17 du_22 
K10D0272_H0274:81a-0	da sha buddha kam n'a @81a *//	da_0 sha_3 buddha_7 kam_14 n_18 
K10D0272_H0274:81a-1	ma ma h'a y'a na s'u tra /	ma_0 ma_3 h_6 y_10 na_14 s_17 tra_21 
K10D0272_H0274:81a-2	bod skad du /	'bod_0 skad_4 du_9 
K10D0272_H0274:81a-3	sangs rgyas bcu pa zhes bya ba theg pa chen po'i mdo /	sangs_0 rgya_6 'chu_12 ba_16 zhes_19 byed_24 ba_28 theg_31 ba_36 chen_39 po_44 mdo_49 
K10D0272_H0274:81a-4	sangs rgyas dang /	sangs_0 rgya_6 dang_12 
K10D0272_H0274:81a-5	byang chub sems dpa' thams cad la phyag 'tshal lo //	byang_0 chub_6 sems_11 dpa'_16 thams_21 cad_27 la_31 phyag_34 'tshal_40 lo_47 
K10D0272_H0274:81a-6	'di skad bdag gis thos pa dus gcig na /	'di_0 skad_4 bdag_9 gis_14 thos_18 ba_23 dus_26 gcig_30 na_35 
K10D0272_H0274:81a-7	bcom ldan 'das rgyal po'i khab bya rgod kyi phung	'joms_0 ldan_5 'da'_10 rgyal_15 po_21 khab_26 byed_31 rgod_35 kyi_40 'phung_44 
K10D0272_H0274:81a-8	po'i ri la dge slong gi dge 'dun stong nyis	po_0 ri_5 la_8 dge_11 slong_15 gi_21 dge_24 'dun_28 stong_33 nyis_39 
K10D0272_H0274:81a-9	brgya lnga bcu dang /	brgya_0 lnga_6 'chu_11 dang_15 
K10D0272_H0274:81a-10	byang chub sems dpa' sems dpa' chen po stong phrag	byang_0 chub_6 sems_11 dpa'_16 sems_21 dpa'_26 chen_31 po_36 stong_39 phrag_45 
K10D0272_H0274:81a-11	rab tu mang po dang thabs gcig tu bzhugs so	rab_0 tu_4 mang_7 po_12 dang_15 thabs_20 gcig_26 tu_31 bzhugs_34 so_41 
K10D0272_H0274:81a-12	// de'i tshe 'khor de nyid du byang chub sems	de_3 tshe_8 'khor_13 de_19 nyid_22 du_27 byang_30 chub_36 sems_41 
K10D0272_H0274:81a-13	dpa' sems dpa' chen po yul yangs pa'i li tsa	dpa'_0 sems_5 dpa'_10 chen_15 po_20 yul_23 yangs_27 ba_33 li_38 tsa_41 
K10D0272_H0274:81a-14	b'i gzhon nu yon tan rin chen me tog rgyas	b_0 gzhon_4 nu_10 yon_13 tan_17 rin_21 chen_25 me_30 tog_33 rgya_37 
K10D0272_H0274:81a-15	pa zhes bya ba 'dus par gyur te 'dug go	ba_0 zhes_3 byed_8 ba_12 'du_15 ba_20 gyur_24 te_29 'dug_32 go_37 
K10D0272_H0274:81a-16	// / de nas byang chub sems dpa' sems dpa'	de_5 nas_8 byang_12 chub_18 sems_23 dpa'_28 sems_33 dpa'_38 
K10D0272_H0274:81a-17	chen po yon tan rin chen me tog rgyas pa	chen_0 po_5 yon_8 tan_12 rin_16 chen_20 me_25 tog_28 rgya_32 ba_38 
K10D0272_H0274:81a-18	stan las langs te /	stan_0 las_5 ldang_9 te_15 
K10D0272_H0274:81a-19	bla gos phrag pa gcig tu gzar nas pus mo g-yas pa'i lha nga sa la btsugs te /	bla_0 gos_4 phrag_8 ba_14 gcig_17 tu_22 gzar_25 nas_30 pus_34 mo_38 g-yas_41 ba_47 lha_52 nga_56 sa_60 la_63 btsugs_66 te_73 
K10D0272_H0274:81a-20	bcom ldan 'das gang na ba de logs su thal	'joms_0 ldan_5 'da'_10 gang_15 na_20 ba_23 de_26 logs_29 su_34 thal_37 
K10D0272_H0274:81a-21	mo sbyar ba btud nas bcom ldan 'das la 'di	mo_0 sbyor_3 ba_9 'dud_12 nas_17 'joms_21 ldan_26 'da'_31 la_36 'di_39 
K10D0272_H0274:81a-22	skad ces gsol to //	skad_0 ces_5 gsol_9 to_14 
K10D0272_H0274:81a-23	gal te bdag cag gis zhu ba zhus pas bcom ldan 'das kyi thugs rangs pa lta na /	gal_0 te_4 bdag_7 cag_12 gis_16 'ju_20 ba_24 zhus_27 ba_32 'joms_36 ldan_41 'da'_46 kyi_51 thugs_55 rangs_61 ba_67 lta_70 na_74 
K10D0272_H0274:81a-24	bcom ldan 'das de bzhin gshegs pa dgra bcom pa	'joms_0 ldan_5 'da'_10 de_15 bzhin_18 gshegs_24 ba_31 dgra_34 'joms_39 ba_44 
K10D0272_H0274:81a-25	yang dag par rdzogs pa'i sangs rgyas la bdag phyogs	yang_0 'dag_5 ba_9 rdzogs_13 ba_20 sangs_25 rgya_31 la_37 bdag_40 phyogs_45 
K10D0272_H0274:81a-26	'ga' zhig zhu'o // de skad ces gsol pa dang /	'ga'_0 'jig_5 'ju_10 de_19 skad_22 ces_27 gsol_31 ba_36 dang_39 
K10D0272_H0274:81a-27	bcom ldan 'das kyis byang chub sems dpa' sems dpa'	'joms_0 ldan_5 'da'_10 kyis_15 byang_20 chub_26 sems_31 dpa'_36 sems_41 dpa'_46 
K10D0272_H0274:81a-28	chen po yon tan rin chen me tog rgyas pa	chen_0 po_5 yon_8 tan_12 rin_16 chen_20 me_25 tog_28 rgya_32 ba_38 
K10D0272_H0274:81b-0	la 'di skad ces bka' stsal @81b to; ;yon tan	la_0 'di_3 skad_7 ces_12 bka'_16 stsal_21 to;_32 ;yon_36 tan_41 
K10D0272_H0274:81b-1	rin chen me tog rgyas pa /	rin_0 chen_4 me_9 tog_12 rgya_16 ba_22 
K10D0272_H0274:81b-2	bcom ldan 'das de bzhin gshegs pa dgra bcom pa	'joms_0 ldan_5 'da'_10 de_15 bzhin_18 gshegs_24 ba_31 dgra_34 'joms_39 ba_44 
K10D0272_H0274:81b-3	yang dag par rdzogs pa'i sangs rgyas la gang dang	yang_0 'dag_5 ba_9 rdzogs_13 ba_20 sangs_25 rgya_31 la_37 gang_40 dang_45 
K10D0272_H0274:81b-4	/ gang 'dod pa dris shig dang /	gang_2 'dod_7 ba_12 'dri_15 shig_20 dang_25 
K10D0272_H0274:81b-5	ngas dris pa de dang /	ngas_0 'dri_5 ba_10 de_13 dang_16 
K10D0272_H0274:81b-6	de'i lung bstan pas khyod kyi sems rangs par bya'o //	de_0 lung_5 ston_10 ba_16 khyod_20 kyi_26 sems_30 rangs_35 ba_41 byed_45 
K10D0272_H0274:81b-7	de nas bcom ldan 'das la byang chub sems dpa'	de_0 nas_3 'joms_7 ldan_12 'da'_17 la_22 byang_25 chub_31 sems_36 dpa'_41 
K10D0272_H0274:81b-8	sems dpa' chen po yon tan rin chen me tog	sems_0 dpa'_5 chen_10 po_15 yon_18 tan_22 rin_26 chen_30 me_35 tog_38 
K10D0272_H0274:81b-9	rgyas pas 'di skad ces gsol to //	rgya_0 ba_6 'di_10 skad_14 ces_19 gsol_23 to_28 
K10D0272_H0274:81b-10	bcom ldan 'das /	'joms_0 ldan_5 'da'_10 
K10D0272_H0274:81b-11	rigs kyi bu'am /	rigs_0 kyi_5 bu_9 
K10D0272_H0274:81b-12	rigs kyi bu mo la las 'jig rten gyi khams	rigs_0 kyi_5 bu_9 mo_12 la_15 las_18 'jig_22 rten_27 gyi_32 khams_36 
K10D0272_H0274:81b-13	gzhan dag na da ltar bcom ldan 'das bzhugs te	gzhan_0 'dag_6 na_10 da_13 ltar_16 'joms_21 ldan_26 'da'_31 bzhugs_36 te_43 
K10D0272_H0274:81b-14	'tsho la gzhes shing chos kyang ston pa gang dag	'tsho_0 la_6 gzhes_9 shing_15 chos_21 kyang_26 ston_32 ba_37 gang_40 'dag_45 
K10D0272_H0274:81b-15	gi mtshan bzung na myur du bla na med pa	gi_0 mtshan_3 bzung_10 na_16 myur_19 du_24 bla_27 na_31 med_34 ba_38 
K10D0272_H0274:81b-16	yang dag par rdzogs pa'i byang chub mngon par rdzogs	yang_0 'dag_5 ba_9 rdzogs_13 ba_20 byang_25 chub_31 mngon_36 ba_42 rdzogs_46 
K10D0272_H0274:81b-17	par 'tshang rgya ba mchis sam /	ba_0 'tshang_4 rgya_12 ba_17 mchis_20 sam_26 
K10D0272_H0274:81b-18	de skad ces gsol ba dang /	de_0 skad_3 ces_8 gsol_12 ba_17 dang_20 
K10D0272_H0274:81b-19	bcom ldan 'das kyis byang chub sems dpa' sems dpa'	'joms_0 ldan_5 'da'_10 kyis_15 byang_20 chub_26 sems_31 dpa'_36 sems_41 dpa'_46 
K10D0272_H0274:81b-20	chen po yon tan rin chen me tog rgyas pa	chen_0 po_5 yon_8 tan_12 rin_16 chen_20 me_25 tog_28 rgya_32 ba_38 
K10D0272_H0274:81b-21	la 'di skad ces bka' stsal to //	la_0 'di_3 skad_7 ces_12 bka'_16 stsal_21 to_27 
K10D0272_H0274:81b-22	yon tan rin chen me tog rgyas pa legs so //	yon_0 tan_4 rin_8 chen_12 me_17 tog_20 rgya_24 ba_30 legs_33 so_38 
K10D0272_H0274:81b-23	legs so //	legs_0 so_5 
K10D0272_H0274:81b-24	yon tan rin chen me tog rgyas pa /	yon_0 tan_4 rin_8 chen_12 me_17 tog_20 rgya_24 ba_30 
K10D0272_H0274:81b-25	khyod 'di ltar 'dir lhags pa'i byang chub sems dpa' sems dpa' chen po rnams dang /	khyod_0 'di_6 ltar_10 'dir_15 lhags_20 ba_26 byang_31 chub_37 sems_42 dpa'_47 sems_52 dpa'_57 chen_62 po_67 rnams_70 dang_76 
K10D0272_H0274:81b-26	lha dang /	lha_0 dang_4 
K10D0272_H0274:81b-27	mi dang /	mi_0 dang_3 
K10D0272_H0274:81b-28	skye bo mang po rnams kyi don dang /	skye_0 'bo_5 mang_8 po_13 rnams_16 kyi_22 don_26 dang_30 
K10D0272_H0274:81b-29	phan pa dang [?]; bde ba dang /	phan_0 ba_5 dang_8 bde_18 ba_22 dang_25 
K10D0272_H0274:81b-30	'jig rten la snying brtse ba'i phyir zhugs te /	'jig_0 rten_5 la_10 snying_13 brtse_20 ba_26 phyir_31 'jug_37 te_43 
K10D0272_H0274:81b-31	de bzhin gshegs pa dgra bcom pa yang dag par	de_0 bzhin_3 gshegs_9 ba_16 dgra_19 'joms_24 ba_29 yang_32 'dag_37 ba_41 
K10D0272_H0274:81b-32	rdzogs pa'i sangs rgyas la don 'di yongs su 'dri	rdzogs_0 ba_7 sangs_12 rgya_18 la_24 don_27 'di_31 yongs_35 su_41 'bri_44 
K10D0272_H0274:82a-0	bar sems pa / yon @82a *//	ba_0 sems_4 ba_9 yon_14 
K10D0272_H0274:82a-1	tan rin chen me tog rgyas pa /	tan_0 rin_4 chen_8 me_13 tog_16 rgya_20 ba_26 
K10D0272_H0274:82a-2	khyod yang legs so //	khyod_0 yang_6 legs_11 so_16 
K10D0272_H0274:82a-3	yon tan rin chen me tog rgyas pa /	yon_0 tan_4 rin_8 chen_12 me_17 tog_20 rgya_24 ba_30 
K10D0272_H0274:82a-4	de'i phyir legs par rab tu nyon la yid la zungs shig dang /	de_0 phyir_5 legs_11 ba_16 rab_20 tu_24 nyon_27 la_32 yid_35 la_39 zungs_42 shig_48 dang_53 
K10D0272_H0274:82a-5	ngas khyod la bshad par bya'o //	ngas_0 khyod_5 la_11 'chad_14 ba_20 byed_24 
K10D0272_H0274:82a-6	bcom ldan 'das /	'joms_0 ldan_5 'da'_10 
K10D0272_H0274:82a-7	de ltar 'tshal lo zhes gsol nas /	de_0 ltar_3 'tshal_8 lo_15 zhes_18 gsol_23 nas_28 
K10D0272_H0274:82a-8	byang chub sems dpa' sems dpa' chen po yon tan	byang_0 chub_6 sems_11 dpa'_16 sems_21 dpa'_26 chen_31 po_36 yon_39 tan_43 
K10D0272_H0274:82a-9	rin chen me tog rgyas pas bcom ldan 'das kyi	rin_0 chen_4 me_9 tog_12 rgya_16 ba_22 'joms_26 ldan_31 'da'_36 kyi_41 
K10D0272_H0274:82a-10	ltar nyan pa dang /	ltar_0 nyan_5 ba_10 dang_13 
K10D0272_H0274:82a-11	bcom ldan 'das kyis 'di skad ces bka' stsal to //	'joms_0 ldan_5 'da'_10 kyis_15 'di_20 skad_24 ces_29 bka'_33 stsal_38 to_44 
K10D0272_H0274:82a-12	yon tan rin chen me tog rgyas pa /	yon_0 tan_4 rin_8 chen_12 me_17 tog_20 rgya_24 ba_30 
K10D0272_H0274:82a-13	shar phyogs logs na yon tan thams cad rnam par	'char_0 phyogs_5 logs_12 na_17 yon_20 tan_24 thams_28 cad_34 rnam_38 ba_43 
K10D0272_H0274:82a-14	dag pa zhes bya ba'i 'jig rten gyi khams yod	'dag_0 ba_4 zhes_7 byed_12 ba_16 'jig_21 rten_26 gyi_31 khams_35 yod_41 
K10D0272_H0274:82a-15	de / de na de bzhin gshegs pa dgra bcom	de_0 de_5 na_8 de_11 bzhin_14 gshegs_20 ba_27 dgra_30 'joms_35 
K10D0272_H0274:82a-16	pa yang dag par rdzogs pa'i sangs rgyas yon tan	ba_0 yang_3 'dag_8 ba_12 rdzogs_16 ba_23 sangs_28 rgya_34 yon_40 tan_44 
K10D0272_H0274:82a-17	bskal pa dpag tu med pa las 'das pa zhes	bskal_0 ba_6 dpog_9 tu_14 med_17 ba_21 las_24 'da'_28 ba_33 zhes_36 
K10D0272_H0274:82a-18	bya ba da ltar bzhugs te 'tsho la gzhes shing	byed_0 ba_4 da_7 ltar_10 bzhugs_15 te_22 'tsho_25 la_31 gzhes_34 shing_40 
K10D0272_H0274:82a-19	chos kyang ston to //	chos_0 kyang_5 ston_11 to_16 
K10D0272_H0274:82a-20	bskal pa de ni thams cad nye bar bsags shing brtsegs pa zhes bya'o //	bskal_0 ba_6 de_9 ni_12 thams_15 cad_21 nye_25 ba_29 bsags_33 shing_39 brtsegs_45 ba_53 zhes_56 byed_61 
K10D0272_H0274:82a-21	de na sems can rnams kyi tshe'ang dpag tu med	de_0 na_3 sems_6 can_11 rnams_15 kyi_21 tshe_25 dpog_34 tu_39 med_42 
K10D0272_H0274:82a-22	do; ;bcom ldan 'das yon tan bskal pa dpag tu	do;_0 ;bcom_4 ldan_10 'da'_15 yon_20 tan_24 bskal_28 ba_34 dpog_37 tu_42 
K10D0272_H0274:82a-23	med pa las 'das pa de'i 'khor thams cad kyang	med_0 ba_4 las_7 'da'_11 ba_16 de_19 'khor_24 thams_30 cad_36 kyang_40 
K10D0272_H0274:82a-24	theg pa chen po la yang dag par zhugs pa	theg_0 ba_5 chen_8 po_13 la_16 yang_19 'dag_24 ba_28 'jug_32 ba_38 
K10D0272_H0274:82a-25	sha stag ste / rigs kyi bu'am /	sha_0 stag_4 ste_9 rigs_15 kyi_20 bu_24 
K10D0272_H0274:82a-26	rigs kyi bu mos de bzhin gshegs pa dgra bcom	rigs_0 kyi_5 bu_9 mos_12 de_16 bzhin_19 gshegs_25 ba_32 dgra_35 'joms_40 
K10D0272_H0274:82a-27	pa yang dag par rdzogs pa'i sangs rgyas yon tan	ba_0 yang_3 'dag_8 ba_12 rdzogs_16 ba_23 sangs_28 rgya_34 yon_40 tan_44 
K10D0272_H0274:82a-28	bskal pa dpag tu med pa las 'das pa zhes	bskal_0 ba_6 dpog_9 tu_14 med_17 ba_21 las_24 'da'_28 ba_33 zhes_36 
K10D0272_H0274:82b-0	bya ba de'i mtshan bzung na @82b bskal pa stong	byed_0 ba_4 de_7 mtshan_12 bzung_19 na_25 bskal_33 ba_39 stong_42 
K10D0272_H0274:82b-1	phrag drug cur 'khor ba la rgyab kyis phyogs par	phrag_0 drug_6 cur_11 'khor_15 ba_21 la_24 rgyab_27 kyis_33 phyogs_38 ba_45 
K10D0272_H0274:82b-2	byed do // shi 'phos nas kyang sgrib pa med pa'i gzungs zhes bya ba 'thob par 'gyur ro //	byed_0 do_5 'chi_11 'pho_15 nas_21 kyang_25 sgrib_31 ba_37 med_40 ba_44 gzungs_49 zhes_56 byed_61 ba_65 'thob_68 ba_74 'gyur_78 ro_84 
K10D0272_H0274:82b-3	sangs rgyas kyi zhing bye ba phrag bcu'i sangs rgyas	sangs_0 rgya_6 kyi_12 zhing_16 'bye_22 ba_26 phrag_29 'chu_35 sangs_41 rgya_47 
K10D0272_H0274:82b-4	bcom ldan 'das rnams kyis kyang spobs pa yang dag	'joms_0 ldan_5 'da'_10 rnams_15 kyis_21 kyang_26 spobs_32 ba_38 yang_41 'dag_46 
K10D0272_H0274:82b-5	par bskyed do // chos ston pa na'ang khengs par mi 'gyur ro //	ba_0 skyed_4 do_11 chos_17 ston_22 ba_27 na_30 kheng_37 ba_44 mi_48 'gyur_51 ro_57 
K10D0272_H0274:82b-6	de la 'di skad ces bya ste /	de_0 la_3 'di_6 skad_10 ces_15 byed_19 ste_23 
K10D0272_H0274:82b-7	gang gis skyob pa'i mtshan ni bzung byas na //	gang_0 gis_5 skyob_9 ba_15 mtshan_20 ni_27 bzung_30 byed_36 na_41 
K10D0272_H0274:82b-8	de la byang chub dam pa rnyed sla zhing //	de_0 la_3 byang_6 chub_12 dam_17 ba_21 rnyed_24 sla_30 zhing_34 
K10D0272_H0274:82b-9	bde bar gshegs pa'i yon tan gzhan rnams dang //	bde_0 ba_4 gshegs_8 ba_15 yon_20 tan_24 gzhan_28 rnams_34 dang_40 
K10D0272_H0274:82b-10	yon tan dri med 'di dag mang 'thob 'gyur //	yon_0 tan_4 'dri_8 med_12 'di_16 'dag_20 mang_24 'thob_29 'gyur_35 
K10D0272_H0274:82b-11	yon tan rin chen me tog rgyas pa /	yon_0 tan_4 rin_8 chen_12 me_17 tog_20 rgya_24 ba_30 
K10D0272_H0274:82b-12	lho phyogs logs na yon tan rin chen bkod pa zhes bya ba'i 'jig rten gyi khams yod de /	lho_0 phyogs_4 logs_11 na_16 yon_19 tan_23 rin_27 chen_31 bkod_36 ba_41 zhes_44 byed_49 ba_53 'jig_58 rten_63 gyi_68 khams_72 yod_78 de_82 
K10D0272_H0274:82b-13	de na de bzhin gshegs pa dgra bcom pa yang	de_0 na_3 de_6 bzhin_9 gshegs_15 ba_22 dgra_25 'joms_30 ba_35 yang_38 
K10D0272_H0274:82b-14	dag par rdzogs pa'i sangs rgyas yon tan rin chen	'dag_0 ba_4 rdzogs_8 ba_15 sangs_20 rgya_26 yon_32 tan_36 rin_40 chen_44 
K10D0272_H0274:82b-15	bkod pa'i dpal gzi brjid kyi phung po'i bskal pa	bkod_0 ba_5 dpal_10 gzi_15 brjid_19 kyi_25 'phung_29 po_35 bskal_40 ba_46 
K10D0272_H0274:82b-16	zhes bya ba da ltar bzhugs te 'tsho la gzhes	zhes_0 byed_5 ba_9 da_12 ltar_15 bzhugs_20 te_27 'tsho_30 la_36 gzhes_39 
K10D0272_H0274:82b-17	shing chos kyang ston to //	shing_0 chos_6 kyang_11 ston_17 to_22 
K10D0272_H0274:82b-18	bskal pa de ni yon tan rgya che ba zhes bya'o //	bskal_0 ba_6 de_9 ni_12 yon_15 tan_19 rgya_23 che_28 ba_32 zhes_35 byed_40 
K10D0272_H0274:82b-19	rigs kyi bu'am /	rigs_0 kyi_5 bu_9 
K10D0272_H0274:82b-20	rigs kyi bu mos de bzhin gshegs pa dgra bcom	rigs_0 kyi_5 bu_9 mos_12 de_16 bzhin_19 gshegs_25 ba_32 dgra_35 'joms_40 
K10D0272_H0274:82b-21	pa yang dag par rdzogs pa'i sangs rgyas rin chen	ba_0 yang_3 'dag_8 ba_12 rdzogs_16 ba_23 sangs_28 rgya_34 rin_40 chen_44 
K10D0272_H0274:82b-22	yon tan bkod pa'i dpal gzi brjid kyi phung po'i	yon_0 tan_4 bkod_8 ba_13 dpal_18 gzi_23 brjid_27 kyi_33 'phung_37 po_43 
K10D0272_H0274:82b-23	bskal pa zhes bya ba de'i mtshan bzung na shi	bskal_0 ba_6 zhes_9 byed_14 ba_18 de_21 mtshan_26 bzung_33 na_39 'chi_42 
K10D0272_H0274:82b-24	'phos nas nyi ma'i dkyil 'khor 'od kyis mthas klas	'pho_0 nas_6 nyi_10 ma_14 dkyil_19 'khor_25 'od_31 kyis_35 mthas_40 klas_46 
K10D0272_H0274:82b-25	pa zhes bya ba'i ting nge 'dzin thob par 'gyur	ba_0 zhes_3 byed_8 ba_12 ting_17 nge_22 'dzin_26 'thob_32 ba_37 'gyur_41 
K10D0272_H0274:83a-0	ro // sangs rgyas kyi zhing yon tan bkod pa dpag tu med pa rnams yongs su @83a *//	ro_0 sangs_6 rgya_12 kyi_18 zhing_22 yon_28 tan_32 bkod_36 ba_41 dpog_44 tu_49 med_52 ba_56 rnams_59 yongs_65 su_71 
K10D0272_H0274:83a-1	'dzin par 'gyur ro //	'dzin_0 ba_6 'gyur_10 ro_16 
K10D0272_H0274:83a-2	sangs rgyas kyi zhing gang dang /	sangs_0 rgya_6 kyi_12 zhing_16 gang_22 dang_27 
K10D0272_H0274:83a-3	gang du smon lam btab pa de dang /	gang_0 du_5 smon_8 lam_13 'debs_17 ba_22 de_25 dang_28 
K10D0272_H0274:83a-4	der skye bar 'gyur ro //	der_0 skye_4 ba_9 'gyur_13 ro_19 
K10D0272_H0274:83a-5	bla na med pa yang dag par rdzogs pa'i sangs rgyas kyang skye ba gcig gis thogs so //	bla_0 na_4 med_7 ba_11 yang_14 'dag_19 ba_23 rdzogs_27 ba_34 sangs_39 rgya_45 kyang_51 skye_57 ba_62 gcig_65 gis_70 thogs_74 so_80 
K10D0272_H0274:83a-6	shi 'phos nas skyes bu chen po'i mtshan sum cu rtsa gnyis kyang 'thob par 'gyur ro //	'chi_0 'pho_4 nas_10 skye_14 bu_20 chen_23 po_28 mtshan_33 sum_40 cu_44 rtsa_47 gnyis_52 kyang_58 'thob_64 ba_70 'gyur_74 ro_80 
K10D0272_H0274:83a-7	de la 'di skad ces bya ste /	de_0 la_3 'di_6 skad_10 ces_15 byed_19 ste_23 
K10D0272_H0274:83a-8	khyab bdag mtshan 'di sus bzung ba //	khyab_0 bdag_6 mtshan_11 'di_18 sus_22 bzung_26 ba_32 
K10D0272_H0274:83a-9	mtha' klas pa yi ting nge 'dzin //	mtha'_0 klas_6 ba_11 yi_14 ting_17 nge_22 'dzin_26 
K10D0272_H0274:83a-10	'od ni nyi ma'i dkyil 'khor can //	'od_0 ni_4 nyi_7 ma_11 dkyil_16 'khor_22 can_28 
K10D0272_H0274:83a-11	mtshan rnams bcas te shi bas 'thob //	mtshan_0 rnams_7 'cha'_13 te_18 'chi_21 ba_25 'thob_29 
K10D0272_H0274:83a-12	yon tan rin chen me tog rgyas pa /	yon_0 tan_4 rin_8 chen_12 me_17 tog_20 rgya_24 ba_30 
K10D0272_H0274:83a-13	nub phyogs na sbyor bas mun pa thams cad dang	nub_0 phyogs_4 na_11 sbyor_14 ba_20 mun_24 ba_28 thams_31 cad_37 dang_41 
K10D0272_H0274:83a-14	bral ba zhes bya ba'i 'jig rten gyi khams yod	'bral_0 ba_5 zhes_8 byed_13 ba_17 'jig_22 rten_27 gyi_32 khams_36 yod_42 
K10D0272_H0274:83a-15	de / de na de bzhin gshegs pa dgra bcom	de_0 de_5 na_8 de_11 bzhin_14 gshegs_20 ba_27 dgra_30 'joms_35 
K10D0272_H0274:83a-16	pa yang dag par rdzogs pa'i sangs rgyas chos thams	ba_0 yang_3 'dag_8 ba_12 rdzogs_16 ba_23 sangs_28 rgya_34 chos_40 thams_45 
K10D0272_H0274:83a-17	cad la spobs pa bkod pa'i dpal da ltar bzhugs	cad_0 la_4 spobs_7 ba_13 bkod_16 ba_21 dpal_26 da_31 ltar_34 bzhugs_39 
K10D0272_H0274:83a-18	te 'tsho la gzhes shing chos kyang ston to //	te_0 'tsho_3 la_9 gzhes_12 shing_18 chos_24 kyang_29 ston_35 to_40 
K10D0272_H0274:83a-19	bskal pa de ni sh'akya'i rgyal po bkod pa zhes bya'o //	bskal_0 ba_6 de_9 ni_12 sh'i_15 rgyal_25 po_31 bkod_34 ba_39 zhes_42 byed_47 
K10D0272_H0274:83a-20	rigs kyi bu'am /	rigs_0 kyi_5 bu_9 
K10D0272_H0274:83a-21	rigs kyi bu mos de bzhin gshegs pa dgra bcom	rigs_0 kyi_5 bu_9 mos_12 de_16 bzhin_19 gshegs_25 ba_32 dgra_35 'joms_40 
K10D0272_H0274:83a-22	pa yang dag par rdzogs pa'i sangs rgyas chos thams	ba_0 yang_3 'dag_8 ba_12 rdzogs_16 ba_23 sangs_28 rgya_34 chos_40 thams_45 
K10D0272_H0274:83a-23	cad la spobs pa bkod pa'i dpal zhes bya ba	cad_0 la_4 spobs_7 ba_13 bkod_16 ba_21 dpal_26 zhes_31 byed_36 ba_40 
K10D0272_H0274:83a-24	de'i mtshan bzung na mtshon cha dang /	de_0 mtshan_5 bzung_12 na_18 mtshon_21 cha_28 dang_32 
K10D0272_H0274:83a-25	me dang /	me_0 dang_3 
K10D0272_H0274:83a-26	chu dang; dug gis 'chi ba'i dus byed par mi 'gyur zhing rdzus te skye bar 'gyur ro //	chu_0 dang;_4 dug_10 gis_14 'chi_18 ba_23 dus_28 byed_32 ba_37 mi_41 'gyur_44 zhing_50 rdzus_56 te_62 skye_65 ba_70 'gyur_74 ro_80 
K10D0272_H0274:83a-27	shi 'phos nas shugs brgya pa zhes bya ba'i ting nge 'dzin thob par 'gyur ro //	'chi_0 'pho_4 nas_10 shugs_14 brgya_20 ba_26 zhes_29 byed_34 ba_38 ting_43 nge_48 'dzin_52 'thob_58 ba_63 'gyur_67 ro_73 
K10D0272_H0274:83b-0	de la 'di skad ces @83b bya ste; rgyal ba de yi mtshan ni sus bzung ba //	de_0 la_3 'di_6 skad_10 ces_15 byed_24 ste;_28 rgyal_33 ba_39 de_42 yi_45 mtshan_48 ni_55 sus_58 bzung_62 ba_68 
K10D0272_H0274:83b-1	me dang chu dang dug gis mi 'chi zhing //	me_0 dang_3 chu_8 dang_12 dug_17 gis_21 mi_25 'chi_28 zhing_33 
K10D0272_H0274:83b-2	'di la mtshon gyis mi tshugs mkhas pa dang //	'di_0 la_4 mtshon_7 gyis_14 mi_19 tshugs_22 mkhas_29 ba_35 dang_38 
K10D0272_H0274:83b-3	mngal du mi skye gzungs rnams mi des 'thob //	mngal_0 du_6 mi_9 skye_12 gzungs_17 rnams_24 mi_30 des_33 'thob_37 
K10D0272_H0274:83b-4	yon tan rin chen me tog rgyas pa /	yon_0 tan_4 rin_8 chen_12 me_17 tog_20 rgya_24 ba_30 
K10D0272_H0274:83b-5	byang phyogs logs na mun pa dang /	byang_0 phyogs_6 logs_13 na_18 mun_21 ba_25 dang_28 
K10D0272_H0274:83b-6	rdul dang bral ba zhes bya'i 'jig rten gyi khams yod de /	rdul_0 dang_5 'bral_10 ba_15 zhes_18 byed_23 'jig_29 rten_34 gyi_39 khams_43 yod_49 de_53 
K10D0272_H0274:83b-7	de na de bzhin gshegs pa dgra bcom pa yang	de_0 na_3 de_6 bzhin_9 gshegs_15 ba_22 dgra_25 'joms_30 ba_35 yang_38 
K10D0272_H0274:83b-8	dag par rdzogs pa'i sangs rgyas spobs pa dpag tu	'dag_0 ba_4 rdzogs_8 ba_15 sangs_20 rgya_26 spobs_32 ba_38 dpog_41 tu_46 
K10D0272_H0274:83b-9	med pa bkod pa yang dag par spyod pa zhes	med_0 ba_4 bkod_7 ba_12 yang_15 'dag_20 ba_24 spyod_28 ba_34 zhes_37 
K10D0272_H0274:83b-10	bya ba da ltar bzhugs te 'tsho la gzhes shing	byed_0 ba_4 da_7 ltar_10 bzhugs_15 te_22 'tsho_25 la_31 gzhes_34 shing_40 
K10D0272_H0274:83b-11	chos kyang ston to //	chos_0 kyang_5 ston_11 to_16 
K10D0272_H0274:83b-12	bskal pa de ni rin che ba zhes bya'o //	bskal_0 ba_6 de_9 ni_12 rin_15 che_19 ba_23 zhes_26 byed_31 
K10D0272_H0274:83b-13	rigs kyi bu 'am; rigs kyi bu mos de bzhin	rigs_0 kyi_5 bu_9 'am;_12 rigs_17 kyi_22 bu_26 mos_29 de_33 bzhin_36 
K10D0272_H0274:83b-14	gshegs pa dgra bcom pa yang dag par rdzogs pa'i	gshegs_0 ba_7 dgra_10 'joms_15 ba_20 yang_23 'dag_28 ba_32 rdzogs_36 ba_43 
K10D0272_H0274:83b-15	sangs rgyas spobs pa dpag tu med pa bkod pa	sangs_0 rgya_6 spobs_12 ba_18 dpog_21 tu_26 med_29 ba_33 bkod_36 ba_41 
K10D0272_H0274:83b-16	yang dag par spyod pa zhes bya ba de'i mtshan	yang_0 'dag_5 ba_9 spyod_13 ba_19 zhes_22 byed_27 ba_31 de_34 mtshan_39 
K10D0272_H0274:83b-17	bzung na sangs rgyas bye ba khrag khrig drug cu	bzung_0 na_6 sangs_9 rgya_15 'bye_21 ba_25 khrag_28 khrig_34 drug_40 cu_45 
K10D0272_H0274:83b-18	mnyes par byed do //	mnyes_0 ba_6 byed_10 do_15 
K10D0272_H0274:83b-19	thams cad kyi rjes su song ba zhes bya ba'i gzungs 'thob par 'gyur ro //	thams_0 cad_6 kyi_10 rjes_14 su_19 'gro_22 ba_27 zhes_30 byed_35 ba_39 gzungs_44 'thob_51 ba_57 'gyur_61 ro_67 
K10D0272_H0274:83b-20	sgyu ma lta bu las nges par 'byung ba zhes bya ba'i ting nge 'dzin 'thob par 'gyur ro //	sgyu_0 ma_5 lta_8 bu_12 las_15 nges_19 ba_24 'byung_28 ba_35 zhes_38 byed_43 ba_47 ting_52 nge_57 'dzin_61 'thob_67 ba_73 'gyur_77 ro_83 
K10D0272_H0274:83b-21	mi zad pa'i za ma tog ces bya ba'i ting nge 'dzin thob par 'gyur ro //	mi_0 zad_3 ba_7 za_12 ma_15 tog_18 ces_22 byed_26 ba_30 ting_35 nge_40 'dzin_44 'thob_50 ba_55 'gyur_59 ro_65 
K10D0272_H0274:83b-22	bla na med pa yang dag par rdzogs pa'i sangs	bla_0 na_4 med_7 ba_11 yang_14 'dag_19 ba_23 rdzogs_27 ba_34 sangs_39 
K10D0272_H0274:83b-23	rgyas su ma gyur gyi bar du nam yang ngan	rgya_0 su_6 ma_9 gyur_12 gyi_17 ba_21 du_25 nam_28 yang_32 ngan_37 
K10D0272_H0274:83b-24	song gsum du mi skye zhing mi spyod par 'gyur	'gro_0 gsum_5 du_10 mi_13 skye_16 zhing_21 mi_27 spyod_30 ba_36 'gyur_40 
K10D0272_H0274:83b-25	ro // sangs rgyas kyi zhing gang dag gang du skyes pa de dang /	ro_0 sangs_6 rgya_12 kyi_18 zhing_22 gang_28 'dag_33 gang_37 du_42 skye_45 ba_51 de_54 dang_57 
K10D0272_H0274:84a-0	der sems can ngan song du song ba thams cad yongs su grol bar byed cing @84a *//	der_0 sems_4 can_9 ngan_13 'gro_18 du_23 'gro_26 ba_31 thams_34 cad_40 yongs_44 su_50 grol_53 ba_58 byed_62 cing_67 
K10D0272_H0274:84a-1	de dag thams cad bla na med pa yang dag	de_0 'dag_3 thams_7 cad_13 bla_17 na_21 med_24 ba_28 yang_31 'dag_36 
K10D0272_H0274:84a-2	par rdzogs pa'i byang chub las phyir mi ldog par	ba_0 rdzogs_4 ba_11 byang_16 chub_22 las_27 phyir_31 mi_37 ldog_40 ba_45 
K10D0272_H0274:84a-3	byed do // de la 'di skad ces bya ste /	byed_0 do_5 de_11 la_14 'di_17 skad_21 ces_26 byed_30 ste_34 
K10D0272_H0274:84a-4	bde gshegs de yi mtshan ni sus bzung ba //	bde_0 gshegs_4 de_11 yi_14 mtshan_17 ni_24 sus_27 bzung_31 ba_37 
K10D0272_H0274:84a-5	sems can mtha' yas byang chub bskyed pa dang //	sems_0 can_5 mtha'_9 yas_15 byang_19 chub_25 skyed_30 ba_37 dang_40 
K10D0272_H0274:84a-6	gzungs dang ting nge 'dzin rnams thob pa dang //	gzungs_0 dang_7 ting_12 nge_17 'dzin_21 rnams_27 'thob_33 ba_38 dang_41 
K10D0272_H0274:84a-7	ngan 'gror skye bas 'jigs par mi 'gyur ro //	ngan_0 'gror_5 skye_11 ba_16 'jigs_20 ba_26 mi_30 'gyur_33 ro_39 
K10D0272_H0274:84a-8	yon tan rin chen me tog rgyas pa /	yon_0 tan_4 rin_8 chen_12 me_17 tog_20 rgya_24 ba_30 
K10D0272_H0274:84a-9	shar lho'i phyogs mtshams logs na yun ring por bde	'char_0 lho_5 phyogs_11 mtshams_18 logs_26 na_31 yun_34 ring_38 por_43 bde_47 
K10D0272_H0274:84a-10	ba bkod pa zhes bya ba'i 'jig rten gyi khams	ba_0 bkod_3 ba_8 zhes_11 byed_16 ba_20 'jig_25 rten_30 gyi_35 khams_39 
K10D0272_H0274:84a-11	yod de / de na de bzhin gshegs pa dgra	yod_0 de_4 de_9 na_12 de_15 bzhin_18 gshegs_24 ba_31 dgra_34 
K10D0272_H0274:84a-12	bcom pa yang dag par rdzogs pa'i sangs rgyas sprin	'joms_0 ba_5 yang_8 'dag_13 ba_17 rdzogs_21 ba_28 sangs_33 rgya_39 sprin_45 
K10D0272_H0274:84a-13	gyi 'brug sgra sgra dbyangs stong pa zhes bya ba	gyi_0 'brug_4 sgra_10 sgra_15 dbyangs_20 stong_28 ba_34 zhes_37 byed_42 ba_46 
K10D0272_H0274:84a-14	da ltar bzhugs te 'tsho la gzhes shing chos kyang	da_0 ltar_3 bzhugs_8 te_15 'tsho_18 la_24 gzhes_27 shing_33 chos_39 kyang_44 
K10D0272_H0274:84a-15	yod de / ston to // bskal pa de ni yon tan 'byung ba zhes bya'o //	yod_0 de_4 ston_9 to_14 bskal_20 ba_26 de_29 ni_32 yon_35 tan_39 'byung_43 ba_50 zhes_53 byed_58 
K10D0272_H0274:84a-16	rigs kyi bu'am /	rigs_0 kyi_5 bu_9 
K10D0272_H0274:84a-17	rigs kyi bu mos de bzhin gshegs pa dgra bcom	rigs_0 kyi_5 bu_9 mos_12 de_16 bzhin_19 gshegs_25 ba_32 dgra_35 'joms_40 
K10D0272_H0274:84a-18	pa yang dag par rdzogs pa'i sangs rgyas sprin gyi	ba_0 yang_3 'dag_8 ba_12 rdzogs_16 ba_23 sangs_28 rgya_34 sprin_40 gyi_46 
K10D0272_H0274:84a-19	'brug sgra sgra dbyangs stong pa zhes bya ba de'i	'brug_0 sgra_6 sgra_11 dbyangs_16 stong_24 ba_30 zhes_33 byed_38 ba_42 de_45 
K10D0272_H0274:84a-20	mtshan bzung na / de shi 'phos nas so so	mtshan_0 bzung_7 na_13 de_18 'chi_21 'pho_25 nas_31 so_35 so_38 
K10D0272_H0274:84a-21	yang dag par rig pa bzhi 'thob par 'gyur ro	yang_0 'dag_5 ba_9 rig_13 ba_17 bzhi_20 'thob_25 ba_31 'gyur_35 ro_41 
K10D0272_H0274:84a-22	mtshan bzung na / // mi 'jigs pa bzhi 'thob par 'gyur ro //	mtshan_0 bzung_7 na_13 mi_21 'jigs_24 ba_30 bzhi_33 'thob_38 ba_44 'gyur_48 ro_54 
K10D0272_H0274:84a-23	byams pa chen po dang /	byams_0 ba_6 chen_9 po_14 dang_17 
