K10D0131_H0133:373a-43	las med pa /	las_0 med_4 ba_8 
K10D0131_H0133:373a-44	rnam par smin pa med pa /	rnam_0 ba_5 smin_9 ba_14 med_17 ba_21 
K10D0131_H0133:373a-45	ma mthong ba /	ma_0 mthong_3 ba_10 
K10D0131_H0133:373a-46	ma thos pa /	ma_0 thos_3 ba_8 
K10D0131_H0133:373a-47	rnam par ma shes pa /	rnam_0 ba_5 ma_9 shes_12 ba_17 
K10D0131_H0133:373a-48	ma chags pa /	ma_0 chags_3 ba_9 
K10D0131_H0133:373a-49	ma bcings pa /	ma_0 'ching_3 ba_10 
K10D0131_H0133:373a-50	ma grol ba /	ma_0 grol_3 ba_8 
K10D0131_H0133:373a-51	yod pa ma yin pa /	yod_0 ba_4 ma_7 yin_10 ba_14 
K10D0131_H0133:373a-52	dran pa ma yin pa /	dran_0 ba_5 ma_8 yin_11 ba_15 
K10D0131_H0133:373a-53	ma bsnams pa; ma myong ba /	ma_0 snom_3 pa;_10 ma_14 myong_17 ba_23 
K10D0131_H0133:373a-54	ma mthong ba /	ma_0 mthong_3 ba_10 
K10D0131_H0133:373a-55	rnam par rig pa med pa /	rnam_0 ba_5 rig_9 ba_13 med_16 ba_20 
K10D0131_H0133:373a-56	rnam par rig par bya ba ma yin pa /	rnam_0 ba_5 rig_9 ba_13 byed_17 ba_21 ma_24 yin_27 ba_31 
K10D0131_H0133:373a-57	rnam par rig pa med pa'i mtshan nyid sems med pa /	rnam_0 ba_5 rig_9 ba_13 med_16 ba_20 mtshan_25 nyid_32 sems_37 med_42 ba_46 
K10D0131_H0133:373a-58	bsam gyis mi khyab pa /	bsam_0 gyis_5 mi_10 khyab_13 ba_19 
K10D0131_H0133:373b-0	bsam @373b par bya ba ma yin pa /	bsam_0 ba_11 byed_15 ba_19 ma_22 yin_25 ba_29 
K10D0131_H0133:373b-1	sems ma yin pa /	sems_0 ma_5 yin_8 ba_12 
K10D0131_H0133:373b-2	sems pa dang bral ba /	sems_0 ba_5 dang_8 'bral_13 ba_18 
K10D0131_H0133:373b-3	sems mnyam pa nyid dang ldan pa /	sems_0 mnyam_5 ba_11 nyid_14 dang_19 ldan_24 ba_29 
K10D0131_H0133:373b-4	mnyam pa med pa /	mnyam_0 ba_6 med_9 ba_13 
K10D0131_H0133:373b-5	sems kyi 'jug pas mi chud pa /	sems_0 kyi_5 'jug_9 ba_14 mi_18 chud_21 ba_26 
K10D0131_H0133:373b-6	'gro bar ma song ba /	'gro_0 ba_5 ma_9 'gro_12 ba_17 
K10D0131_H0133:373b-7	'gro ba med pa; 'gro ba dang bral ba /	'gro_0 ba_5 med_8 pa;_12 'gro_16 ba_21 dang_24 'bral_29 ba_34 
K10D0131_H0133:373b-8	'gro ba thams cad chad pa /	'gro_0 ba_5 thams_8 cad_14 'chad_18 ba_23 
K10D0131_H0133:373b-9	mi chod pa /	mi_0 chod_3 ba_8 
K10D0131_H0133:373b-10	dpags pa med pa /	dpog_0 ba_6 med_9 ba_13 
K10D0131_H0133:373b-11	gcad du med pa /	gcod_0 du_5 med_8 ba_12 
K10D0131_H0133:373b-12	phrag med pa /	phrag_0 med_6 ba_10 
K10D0131_H0133:373b-13	bltar med pa /	bltar_0 med_6 ba_10 
K10D0131_H0133:373b-14	rmad du byung ba /	rmad_0 du_5 'byung_8 ba_14 
K10D0131_H0133:373b-15	rjes med pa /	rjes_0 med_5 ba_9 
K10D0131_H0133:373b-16	rdzas ma yin pa /	rdzas_0 ma_6 yin_9 ba_13 
K10D0131_H0133:373b-17	dngos po med pa; tha dad pa ma yin pa /	dngos_0 po_6 med_9 pa;_13 tha_17 dad_21 ba_25 ma_28 yin_31 ba_35 
K10D0131_H0133:373b-18	tha dad pa med pa /	tha_0 dad_4 ba_8 med_11 ba_15 
K10D0131_H0133:373b-19	ma byung ba /	ma_0 'byung_3 ba_9 
K10D0131_H0133:373b-20	yang dag par ma byung ba /	yang_0 'dag_5 ba_9 ma_13 'byung_16 ba_22 
K10D0131_H0133:373b-21	mi 'khrugs pa /	mi_0 'khrugs_3 ba_11 
K10D0131_H0133:373b-22	mi rtog pa /	mi_0 rtogs_3 ba_8 
K10D0131_H0133:373b-23	rnam par mi rtog pa /	rnam_0 ba_5 mi_9 rtogs_12 ba_17 
K10D0131_H0133:373b-24	rtsom pa med pa /	rtsom_0 ba_6 med_9 ba_13 
K10D0131_H0133:373b-25	ma grub pa /	ma_0 'grub_3 ba_8 
K10D0131_H0133:373b-26	kun tu ma grub pa /	kun_0 tu_4 ma_7 'grub_10 ba_15 
K10D0131_H0133:373b-27	ma bsgrubs pa /	ma_0 sgrub_3 ba_11 
K10D0131_H0133:373b-28	khyab pa med pa /	khyab_0 ba_6 med_9 ba_13 
K10D0131_H0133:373b-29	mi g-yo ba /	mi_0 g-yo_3 ba_8 
K10D0131_H0133:373b-30	mi gsal ba /	mi_0 gsal_3 ba_8 
K10D0131_H0133:373b-31	ma rig pa /	ma_0 rig_3 ba_7 
K10D0131_H0133:373b-32	'dod par bya ba ma yin pa /	'dod_0 ba_5 byed_9 ba_13 ma_16 yin_19 ba_23 
K10D0131_H0133:373b-33	'od med pa /	'od_0 med_4 ba_8 
K10D0131_H0133:373b-34	mi snang ba /	mi_0 snang_3 ba_9 
K10D0131_H0133:373b-35	gzung ba med pa /	gzung_0 ba_6 med_9 ba_13 
K10D0131_H0133:373b-36	snang ba med pa /	snang_0 ba_6 med_9 ba_13 
K10D0131_H0133:373b-37	mun pa med pa /	mun_0 ba_4 med_7 ba_11 
K10D0131_H0133:373b-38	mun pa ma yin pa; mun pa dang bral ba /	mun_0 ba_4 ma_7 yin_10 pa;_14 mun_18 ba_22 dang_25 'bral_30 ba_35 
K10D0131_H0133:373b-39	gsal ba ma yin pa /	gsal_0 ba_5 ma_8 yin_11 ba_15 
K10D0131_H0133:373b-40	gnas med pa /	gnas_0 med_5 ba_9 
K10D0131_H0133:373b-41	gnas dang bral ba /	gnas_0 dang_5 'bral_10 ba_15 
K10D0131_H0133:373b-42	ma zhi ba /	ma_0 zhi_3 ba_7 
K10D0131_H0133:373b-43	rab tu ma zhi ba /	rab_0 tu_4 ma_7 zhi_10 ba_14 
K10D0131_H0133:373b-44	zhi ba med pa /	zhi_0 ba_4 med_7 ba_11 
K10D0131_H0133:373b-45	zhi ba dang bral ba /	zhi_0 ba_4 dang_7 'bral_12 ba_17 
K10D0131_H0133:373b-46	zhi ba mnyam pa /	zhi_0 ba_4 mnyam_7 ba_13 
K10D0131_H0133:373b-47	dag pa /	'dag_0 ba_4 
K10D0131_H0133:373b-48	rnam par dag pa /	rnam_0 ba_5 'dag_9 ba_13 
K10D0131_H0133:373b-49	yongs su dag pa /	yongs_0 su_6 'dag_9 ba_13 
K10D0131_H0133:373b-50	ci'ang med pa /	ci_0 med_7 ba_11 
K10D0131_H0133:373b-51	len pa med pa /	len_0 ba_4 med_7 ba_11 
K10D0131_H0133:373b-52	nye bar len pa med pa /	nye_0 ba_4 len_8 ba_12 med_15 ba_19 
K10D0131_H0133:373b-53	mdza' ba med pa /	mdza'_0 ba_6 med_9 ba_13 
K10D0131_H0133:373b-54	'thab pa med pa /	'thab_0 ba_6 med_9 ba_13 
K10D0131_H0133:373b-55	'thab pa dang bral ba /	'thab_0 ba_6 dang_9 'bral_14 ba_19 
K10D0131_H0133:373b-56	mi gnas pa'i tshul gyis gnas pa /	mi_0 gnas_3 ba_8 tshul_13 gyis_19 gnas_24 ba_29 
K10D0131_H0133:373b-57	mdud pa med pa /	mdud_0 ba_5 med_8 ba_12 
K10D0131_H0133:373b-58	mdud pa dang bral ba /	mdud_0 ba_5 dang_8 'bral_13 ba_18 
K10D0131_H0133:373b-59	dang ba /	dang_0 ba_5 
K10D0131_H0133:373b-60	rnyog pa med pa /	rnyog_0 ba_6 med_9 ba_13 
K10D0131_H0133:373b-61	shi 'pho med pa /	'chi_0 'pho_4 med_9 ba_13 
K10D0131_H0133:373b-62	shi 'phor 'gyur ba med pa /	'chi_0 'phor_4 'gyur_10 ba_16 med_19 ba_23 
K10D0131_H0133:373b-63	chos med pa /	chos_0 med_5 ba_9 
K10D0131_H0133:373b-64	chos ma yin pa med pa /	chos_0 ma_5 yin_8 ba_12 med_15 ba_19 
K10D0131_H0133:373b-65	zhing med pa /	zhing_0 med_6 ba_10 
K10D0131_H0133:373b-66	zhing ma yin pa med pa /	zhing_0 ma_6 yin_9 ba_13 med_16 ba_20 
K10D0131_H0133:373b-67	mi zad pa /	mi_0 zad_3 ba_7 
K10D0131_H0133:373b-68	zad par bya ba ma yin pa /	zad_0 ba_4 byed_8 ba_12 ma_15 yin_18 ba_22 
K10D0131_H0133:374a-0	zad pa @374a *//	zad_0 ba_4 
K10D0131_H0133:374a-1	dang bral ba /	dang_0 'bral_5 ba_10 
K10D0131_H0133:374a-2	rdul med pa /	rdul_0 med_5 ba_9 
K10D0131_H0133:374a-3	skad cig pa /	skad_0 cig_5 ba_9 
K10D0131_H0133:374a-4	mi 'khrugs pa /	mi_0 'khrugs_3 ba_11 
K10D0131_H0133:374a-5	yi ge yongs su spangs pa /	yi_0 ge_3 yongs_6 su_12 spong_15 ba_22 
K10D0131_H0133:374a-6	sgra yongs su spangs pa /	sgra_0 yongs_5 su_11 spong_14 ba_21 
K10D0131_H0133:374a-7	dbyangs yongs su spangs pa /	dbyangs_0 yongs_8 su_14 spong_17 ba_24 
K10D0131_H0133:374a-8	bshad pa yongs su spangs pa /	'chad_0 ba_6 yongs_9 su_15 spong_18 ba_25 
K10D0131_H0133:374a-9	bsgom pa yongs su spangs pa /	bsgom_0 ba_6 yongs_9 su_15 spong_18 ba_25 
K10D0131_H0133:374a-10	sems pa yongs su spangs pa /	sems_0 ba_5 yongs_8 su_14 spong_17 ba_24 
K10D0131_H0133:374a-11	sems yongs su spangs pa /	sems_0 yongs_5 su_11 spong_14 ba_21 
K10D0131_H0133:374a-12	rigs pa med pa /	rigs_0 ba_5 med_8 ba_12 
K10D0131_H0133:374a-13	rigs pa med pa ma yin pa /	rigs_0 ba_5 med_8 ba_12 ma_15 yin_18 ba_22 
K10D0131_H0133:374a-14	rigs pa dang bral ba ma yin pa /	rigs_0 ba_5 dang_8 'bral_13 ba_18 ma_21 yin_24 ba_28 
K10D0131_H0133:374a-15	ldan pa ma yin pa /	ldan_0 ba_5 ma_8 yin_11 ba_15 
K10D0131_H0133:374a-16	ldan pa med pa ma yin pa /	ldan_0 ba_5 med_8 ba_12 ma_15 yin_18 ba_22 
K10D0131_H0133:374a-17	zad pa med pa /	zad_0 ba_4 med_7 ba_11 
K10D0131_H0133:374a-18	zad pa med pa ma yin pa /	zad_0 ba_4 med_7 ba_11 ma_14 yin_17 ba_21 
K10D0131_H0133:374a-19	'chi ba med pa /	'chi_0 ba_5 med_8 ba_12 
K10D0131_H0133:374a-20	'chi ba med pa ma yin pa /	'chi_0 ba_5 med_8 ba_12 ma_15 yin_18 ba_22 
K10D0131_H0133:374a-21	zhi bar bya ba ma yin pa /	zhi_0 ba_4 byed_8 ba_12 ma_15 yin_18 ba_22 
K10D0131_H0133:374a-22	mtshan ma med pa /	mtshan_0 ma_7 med_10 ba_14 
K10D0131_H0133:374a-23	mtshan ma med pa ma yin pa /	mtshan_0 ma_7 med_10 ba_14 ma_17 yin_20 ba_24 
K10D0131_H0133:374a-24	dpag tu med pa /	dpog_0 tu_5 med_8 ba_12 
K10D0131_H0133:374a-25	dpag tu med pa ma yin pa /	dpog_0 tu_5 med_8 ba_12 ma_15 yin_18 ba_22 
K10D0131_H0133:374a-26	dpag par bya ba ma yin pa /	dpog_0 ba_5 byed_9 ba_13 ma_16 yin_19 ba_23 
K10D0131_H0133:374a-27	ma song ba /	ma_0 'gro_3 ba_8 
K10D0131_H0133:374a-28	ma 'ongs pa /	ma_0 'ongs_3 ba_9 
K10D0131_H0133:374a-29	gnyis su med pa /	gnyis_0 su_6 med_9 ba_13 
K10D0131_H0133:374a-30	gnyis su med pa ma yin pa /	gnyis_0 su_6 med_9 ba_13 ma_16 yin_19 ba_23 
K10D0131_H0133:374a-31	dmigs pa med pa /	dmigs_0 ba_6 med_9 ba_13 
K10D0131_H0133:374a-32	tshu rol ma yin pa /	tshu_0 rol_5 ma_9 yin_12 ba_16 
K10D0131_H0133:374a-33	pha rol ma yin pa /	pha_0 rol_4 ma_8 yin_11 ba_15 
K10D0131_H0133:374a-34	gzhi med pa /	gzhi_0 med_5 ba_9 
K10D0131_H0133:374a-35	gnas med pa /	gnas_0 med_5 ba_9 
K10D0131_H0133:374a-36	mi 'byung ba /	mi_0 'byung_3 ba_10 
K10D0131_H0133:374a-37	mi 'jig pa /	mi_0 'jig_3 ba_8 
K10D0131_H0133:374a-38	ma 'phos pa /	ma_0 'pho_3 ba_9 
K10D0131_H0133:374a-39	mnyan du med pa /	nyan_0 du_6 med_9 ba_13 
K10D0131_H0133:374a-40	pha rol gnon pa med pa /	pha_0 rol_4 gnon_8 ba_13 med_16 ba_20 
K10D0131_H0133:374a-41	len pa med pa /	len_0 ba_4 med_7 ba_11 
K10D0131_H0133:374a-42	'dor ba med pa /	'dor_0 ba_5 med_8 ba_12 
K10D0131_H0133:374a-43	mtshan nyid med pa /	mtshan_0 nyid_7 med_12 ba_16 
K10D0131_H0133:374a-44	mtshan nyid dang bral ba /	mtshan_0 nyid_7 dang_12 'bral_17 ba_22 
K10D0131_H0133:374a-45	mtshan nyid ma yin pa /	mtshan_0 nyid_7 ma_12 yin_15 ba_19 
K10D0131_H0133:374a-46	mtshan nyid yongs su spangs pa /	mtshan_0 nyid_7 yongs_12 su_18 spong_21 ba_28 
K10D0131_H0133:374a-47	las med pa /	las_0 med_4 ba_8 
K10D0131_H0133:374a-48	las med pa ma yin pa /	las_0 med_4 ba_8 ma_11 yin_14 ba_18 
K10D0131_H0133:374a-49	mtshan med pa /	mtshan_0 med_7 ba_11 
K10D0131_H0133:374a-50	mtshan med pa ma yin pa /	mtshan_0 med_7 ba_11 ma_14 yin_17 ba_21 
K10D0131_H0133:374a-51	mtshan gyis brgyan pa; sgo med pa /	mtshan_0 gyis_7 rgyan_12 pa;_19 sgo_23 med_27 ba_31 
K10D0131_H0133:374a-52	mi chags pa /	mi_0 chags_3 ba_9 
K10D0131_H0133:374a-53	chags pa dang bral ba /	chags_0 ba_6 dang_9 'bral_14 ba_19 
K10D0131_H0133:374a-54	dad par byed pa /	dad_0 ba_4 byed_8 ba_13 
K10D0131_H0133:374a-55	sbyar ba med pa /	sbyor_0 ba_6 med_9 ba_13 
K10D0131_H0133:374a-56	sbyar ba dang bral ba /	sbyor_0 ba_6 dang_9 'bral_14 ba_19 
K10D0131_H0133:374a-57	bde bar byed pa /	bde_0 ba_4 byed_8 ba_13 
K10D0131_H0133:374a-58	mchog tu bde bar byed pa /	mchog_0 tu_6 bde_9 ba_13 byed_17 ba_22 
K10D0131_H0133:374b-0	skye mched drug las @374b grol ba /	skye_0 mched_5 drug_11 las_16 grol_26 ba_31 
K10D0131_H0133:374b-1	mi snang ba /	mi_0 snang_3 ba_9 
K10D0131_H0133:374b-2	de bzhin nyid kyis rab tu phye ba de kho na nyid /	de_0 bzhin_3 nyid_9 kyis_14 rab_19 tu_23 'byed_26 ba_31 de_34 kho_37 na_41 nyid_44 
K10D0131_H0133:374b-3	de bzhin nyid sems can rnams mi sgrol ba'i tshul gyis sgrol ba /	de_0 bzhin_3 nyid_9 sems_14 can_19 rnams_23 mi_29 sgrol_32 ba_38 tshul_43 gyis_49 sgrol_54 ba_60 
K10D0131_H0133:374b-4	sems can rnams mi 'grol ba'i tshul gyis 'grol ba;	sems_0 can_5 rnams_9 mi_15 'grol_18 ba_24 tshul_29 gyis_35 'grol_40 ba;_46 
K10D0131_H0133:374b-5	sems can rnams yongs su mi sbyong ba'i tshul gyis	sems_0 can_5 rnams_9 yongs_15 su_21 mi_24 sbyong_27 ba_34 tshul_39 gyis_45 
K10D0131_H0133:374b-6	sbyong ba / sems can rnams la mi skyob pa'i tshul gyis skyob pa /	sbyong_0 ba_7 sems_12 can_17 rnams_21 la_27 mi_30 skyob_33 ba_39 tshul_44 gyis_50 skyob_55 ba_61 
K10D0131_H0133:374b-7	gnyis su med pa'i tshul gyis sems can rnams la chos ston pa //	gnyis_0 su_6 med_9 ba_13 tshul_18 gyis_24 sems_29 can_34 rnams_38 la_44 chos_47 ston_52 ba_57 
K10D0131_H0133:374b-8	mnyam pa med pa /	mnyam_0 ba_6 med_9 ba_13 
K10D0131_H0133:374b-9	mi mnyam pa dang mnyam pa /	mi_0 mnyam_3 ba_9 dang_12 mnyam_17 ba_23 
K10D0131_H0133:374b-10	'dra ba med pa /	'dra_0 ba_5 med_8 ba_12 
K10D0131_H0133:374b-11	zla med pa /	zla_0 med_4 ba_8 
K10D0131_H0133:374b-12	mi 'chi ba dang mnyam pa /	mi_0 'chi_3 ba_8 dang_11 mnyam_16 ba_22 
K10D0131_H0133:374b-13	nam mkha' dang mnyam pa /	nam_0 mkha'_4 dang_10 mnyam_15 ba_21 
K10D0131_H0133:374b-14	gnas med pa dang mnyam pa /	gnas_0 med_5 ba_9 dang_12 mnyam_17 ba_23 
K10D0131_H0133:374b-15	shin tu mnyam pa //	shin_0 tu_5 mnyam_8 ba_14 
K10D0131_H0133:374b-16	ma skyes pa /	ma_0 skye_3 ba_9 
K10D0131_H0133:374b-17	skye ba med pa dang mnyam pa /	skye_0 ba_5 med_8 ba_12 dang_15 mnyam_20 ba_26 
K10D0131_H0133:374b-18	mi dmigs pa /	mi_0 dmigs_3 ba_9 
K10D0131_H0133:374b-19	dmigs pa med pa dang mnyam pa /	dmigs_0 ba_6 med_9 ba_13 dang_16 mnyam_21 ba_27 
K10D0131_H0133:374b-20	ma zhi ba /	ma_0 zhi_3 ba_7 
K10D0131_H0133:374b-21	zhi ba dang bral ba /	zhi_0 ba_4 dang_7 'bral_12 ba_17 
K10D0131_H0133:374b-22	zhi ba nyams pa /	zhi_0 ba_4 nyams_7 ba_13 
K10D0131_H0133:374b-23	zhi ba rab tu zhi ba /	zhi_0 ba_4 rab_7 tu_11 zhi_14 ba_18 
K10D0131_H0133:374b-24	nye bar zhi ba /	nye_0 ba_4 zhi_8 ba_12 
K10D0131_H0133:374b-25	'jam pa /	'jam_0 ba_5 
K10D0131_H0133:374b-26	mnyen pa; shin tu dri ma med pa /	mnyen_0 pa;_6 shin_10 tu_15 'dri_18 ma_22 med_25 ba_29 
K10D0131_H0133:374b-27	shin tu dul ba /	shin_0 tu_5 dul_8 ba_12 
K10D0131_H0133:374b-28	rtag pa ma yin pa /	rtag_0 ba_5 ma_8 yin_11 ba_15 
K10D0131_H0133:374b-29	chad pa ma yin pa /	'chad_0 ba_5 ma_8 yin_11 ba_15 
K10D0131_H0133:374b-30	spyod pa las ldog pa /	spyod_0 ba_6 las_9 ldog_13 ba_18 
K10D0131_H0133:374b-31	ldog pa med pa /	ldog_0 ba_5 med_8 ba_12 
K10D0131_H0133:374b-32	nges pa /	nges_0 ba_5 
K10D0131_H0133:374b-33	'jigs pa las ldog pa /	'jigs_0 ba_6 las_9 ldog_13 ba_18 
K10D0131_H0133:374b-34	phyir mi ldog pa /	phyir_0 mi_6 ldog_9 ba_14 
K10D0131_H0133:374b-35	'dzin pa thams cad gcod pa /	'dzin_0 ba_6 thams_9 cad_15 gcod_19 ba_24 
K10D0131_H0133:374b-36	mdud pa thams cad gcod pa /	mdud_0 ba_5 thams_8 cad_14 gcod_18 ba_23 
K10D0131_H0133:374b-37	gsal ba /	gsal_0 ba_5 
K10D0131_H0133:374b-38	tha dad pa med pa /	tha_0 dad_4 ba_8 med_11 ba_15 
K10D0131_H0133:374b-39	gnyis su med pa /	gnyis_0 su_6 med_9 ba_13 
K10D0131_H0133:374b-40	gnyis dang bral ba /	gnyis_0 dang_6 'bral_11 ba_16 
K10D0131_H0133:374b-41	gnyis su med par yongs su bstan pa /	gnyis_0 su_6 med_9 ba_13 yongs_17 su_23 ston_26 ba_32 
K10D0131_H0133:374b-42	ma byas pa'i ngo bo nyid /	ma_0 byed_3 ba_8 ngo_13 'bo_17 nyid_20 
K10D0131_H0133:374b-43	rang bzhin gyis 'od gsal gshin tu kun tu 'byung ba med pa /	rang_0 bzhin_5 gyis_11 'od_16 gsal_20 gshin_25 tu_31 kun_34 tu_38 'byung_41 ba_48 med_51 ba_55 
K10D0131_H0133:374b-44	rnam par grol ba'i tshul gyis spyod pa las rnam par grol ba /	rnam_0 ba_5 grol_9 ba_14 tshul_19 gyis_25 spyod_30 ba_36 las_39 rnam_43 ba_48 grol_52 ba_57 
K10D0131_H0133:374b-45	'du ba med pa /	'du_0 ba_4 med_7 ba_11 
K10D0131_H0133:374b-46	bral ba med pa /	'bral_0 ba_5 med_8 ba_12 
K10D0131_H0133:375a-0	ring po ma yin @375a *//	ring_0 po_5 ma_8 yin_11 
K10D0131_H0133:375a-1	pa; thung du ma yin pa /	pa;_0 thung_4 du_10 ma_13 yin_16 ba_20 
K10D0131_H0133:375a-2	zlum po ma yin pa /	zlum_0 po_5 ma_8 yin_11 ba_15 
K10D0131_H0133:375a-3	gru bzhi ma yin pa /	gru_0 bzhi_4 ma_9 yin_12 ba_16 
K10D0131_H0133:375a-4	kun tu dkyil 'khor ma yin pa /	kun_0 tu_4 dkyil_7 'khor_13 ma_19 yin_22 ba_26 
K10D0131_H0133:375a-5	sbo ma po ma yin pa /	sbo_0 ma_4 po_7 ma_10 yin_13 ba_17 
K10D0131_H0133:375a-6	phung pos rab tu phye ba ma yin pa /	'phung_0 pos_6 rab_10 tu_14 'byed_17 ba_22 ma_25 yin_28 ba_32 
K10D0131_H0133:375a-7	khams kyis rab tu phye ba ma yin pa /	khams_0 kyis_6 rab_11 tu_15 'byed_18 ba_23 ma_26 yin_29 ba_33 
K10D0131_H0133:375a-8	skye mched kyis rab tu phye pa ma yin pa /	skye_0 mched_5 kyis_11 rab_16 tu_20 'byed_23 ba_28 ma_31 yin_34 ba_38 
K10D0131_H0133:375a-9	'dus byas su rnam pa brtag pa ma yin pa /	'du_0 byed_5 su_10 rnam_13 ba_18 rtog_21 ba_27 ma_30 yin_33 ba_37 
K10D0131_H0133:375a-10	'dus ma byas las byung ba ma yin pa /	'du_0 ma_5 byed_8 las_13 'byung_17 ba_23 ma_26 yin_29 ba_33 
K10D0131_H0133:375a-11	'phel ba med pa /	'phel_0 ba_6 med_9 ba_13 
K10D0131_H0133:375a-12	'bri ba med pa /	'bri_0 ba_5 med_8 ba_12 
K10D0131_H0133:375a-13	gsog pa med pa /	gsog_0 ba_5 med_8 ba_12 
K10D0131_H0133:375a-14	ma skyes pa /	ma_0 skye_3 ba_9 
K10D0131_H0133:375a-15	sus kyang ma mthong ba /	sus_0 kyang_4 ma_10 mthong_13 ba_20 
K10D0131_H0133:375a-16	ma thos pa /	ma_0 thos_3 ba_8 
K10D0131_H0133:375a-17	rnam pa ma shes pa /	rnam_0 ba_5 ma_8 shes_11 ba_16 
K10D0131_H0133:375a-18	yang dag pa ma yin pa /	yang_0 'dag_5 ba_9 ma_12 yin_15 ba_19 
K10D0131_H0133:375a-19	yang dag pa ma yin pa'ang ma yin pa /	yang_0 'dag_5 ba_9 ma_12 yin_15 ba_19 ma_26 yin_29 ba_33 
K10D0131_H0133:375a-20	ma skyes pa; 'chi 'pho ma yin pa /	ma_0 skye_3 pa;_9 'chi_13 'pho_18 ma_23 yin_26 ba_30 
K10D0131_H0133:375a-21	'jig rten dang lhan cig pa ma yin pa /	'jig_0 rten_5 dang_10 lhan_15 cig_20 ba_24 ma_27 yin_30 ba_34 
K10D0131_H0133:375a-22	lhan cig pa ma yin pa'ang ma yin pa ste /	lhan_0 cig_5 ba_9 ma_12 yin_15 ba_19 ma_26 yin_29 ba_33 ste_36 
K10D0131_H0133:375a-23	lus de ni g-yo ba med pa /	lus_0 de_4 ni_7 g-yo_10 ba_15 med_18 ba_22 
K10D0131_H0133:375a-24	'khrul pa med pa /	'khrul_0 ba_7 med_10 ba_14 
K10D0131_H0133:375a-25	rgod pa med pa /	rgod_0 ba_5 med_8 ba_12 
K10D0131_H0133:375a-26	rgyu ba med pa /	rgyu_0 ba_5 med_8 ba_12 
K10D0131_H0133:375a-27	rnam par rgyu ba med pa /	rnam_0 ba_5 rgyu_9 ba_14 med_17 ba_21 
K10D0131_H0133:375a-28	bsgom pa med pa /	bsgom_0 ba_6 med_9 ba_13 
K10D0131_H0133:375a-29	bsgom pa dang bral ba ma yin pa /	bsgom_0 ba_6 dang_9 'bral_14 ba_19 ma_22 yin_25 ba_29 
K10D0131_H0133:375a-30	'byung ba ma yin pa /	'byung_0 ba_7 ma_10 yin_13 ba_17 
K10D0131_H0133:375a-31	'jig pa ma yin pa /	'jig_0 ba_5 ma_8 yin_11 ba_15 
K10D0131_H0133:375a-32	ngo bo nyid ma yin pa /	ngo_0 'bo_4 nyid_7 ma_12 yin_15 ba_19 
K10D0131_H0133:375a-33	ngo bo nyid med pa'ang ma yin pa /	ngo_0 'bo_4 nyid_7 med_12 ba_16 ma_23 yin_26 ba_30 
K10D0131_H0133:375a-34	sems pa med pa /	sems_0 ba_5 med_8 ba_12 
K10D0131_H0133:375a-35	ston pa med pa /	ston_0 ba_5 med_8 ba_12 
K10D0131_H0133:375a-36	sbyor ba med pa /	sbyor_0 ba_6 med_9 ba_13 
K10D0131_H0133:375a-37	mi sbyor ba /	mi_0 sbyor_3 ba_9 
K10D0131_H0133:375a-38	mi sbyor ba'ang ma yin pa /	mi_0 sbyor_3 ba_9 ma_16 yin_19 ba_23 
K10D0131_H0133:375a-39	'dod pa la 'dod chags pa ma yin pa /	'dod_0 ba_5 la_8 'dod_11 chags_16 ba_22 ma_25 yin_28 ba_32 
K10D0131_H0133:375a-40	'dod pa la 'dod chags med pa ma yin pa /	'dod_0 ba_5 la_8 'dod_11 chags_16 med_22 ba_26 ma_29 yin_32 ba_36 
K10D0131_H0133:375a-41	med pa /	med_0 ba_4 
K10D0131_H0133:375a-42	med pa ma yin pa /	med_0 ba_4 ma_7 yin_10 ba_14 
K10D0131_H0133:375a-43	mtshan nyid med pa /	mtshan_0 nyid_7 med_12 ba_16 
K10D0131_H0133:375a-44	mtshan nyid med pa ma yin pa /	mtshan_0 nyid_7 med_12 ba_16 ma_19 yin_22 ba_26 
K10D0131_H0133:375a-45	mya ngan las 'da' ba med pa /	mya_0 ngan_4 las_9 'da'_13 ba_18 med_21 ba_25 
K10D0131_H0133:375a-46	yongs su mya ngan las ma 'das pa /	yongs_0 su_6 mya_9 ngan_13 las_18 ma_22 'da'_25 ba_30 
K10D0131_H0133:375a-47	gnas pa med pa /	gnas_0 ba_5 med_8 ba_12 
K10D0131_H0133:375b-0	gnas pa med pa ma @375b yin pa ste /	gnas_0 ba_5 med_8 ba_12 ma_15 yin_24 ba_28 ste_31 
K10D0131_H0133:375b-1	sh'a ratva ti'i bu /	sh_0 ratva_5 ti_11 bu_16 
K10D0131_H0133:375b-2	de bzhin gshegs pa'i sku gnas pa de lta bu	de_0 bzhin_3 gshegs_9 ba_16 sku_21 gnas_25 ba_30 de_33 lta_36 bu_40 
K10D0131_H0133:375b-3	ni mtshan ma la gnas pa'i sems can lta ba	ni_0 mtshan_3 ma_10 la_13 gnas_16 ba_21 sems_26 can_31 lta_35 ba_39 
K10D0131_H0133:375b-4	gnyis su lhung ba gang gis kyang shes par nus	gnyis_0 su_6 lhung_9 ba_15 gang_18 gis_23 kyang_27 shes_33 ba_38 nus_42 
K10D0131_H0133:375b-5	sam / sh'a radva'i bus gsol pa /	sam_0 sh_6 radva_11 'bud_19 gsol_23 ba_28 
K10D0131_H0133:375b-6	bcom ldan 'das /	'joms_0 ldan_5 'da'_10 
K10D0131_H0133:375b-7	de ni gnas ma lags te /	de_0 ni_3 gnas_6 ma_11 lags_14 te_19 
K10D0131_H0133:375b-8	skabs ma mchis so //	skabs_0 ma_6 mchis_9 so_15 
K10D0131_H0133:375b-9	de ci'i slad du zhe na /	de_0 ci_3 slad_8 du_13 zhe_16 na_20 
K10D0131_H0133:375b-10	bcom ldan 'das /	'joms_0 ldan_5 'da'_10 
K10D0131_H0133:375b-11	de bzhin gshegs pa'i sku ni mtshan ma dang /	de_0 bzhin_3 gshegs_9 ba_16 sku_21 ni_25 mtshan_28 ma_35 dang_38 
K10D0131_H0133:375b-12	mtshan ma thams cad dang bral ba lags so //	mtshan_0 ma_7 thams_10 cad_16 dang_20 'bral_25 ba_30 lags_33 so_38 
K10D0131_H0133:375b-13	bcom ldan 'das kyis bka' stsal pa /	'joms_0 ldan_5 'da'_10 kyis_15 bka'_20 stsal_25 ba_31 
K10D0131_H0133:375b-14	sh'a radva ti'i bu /	sh_0 radva_5 ti_11 bu_16 
K10D0131_H0133:375b-15	de de bzhin no //	de_0 de_3 bzhin_6 no_12 
K10D0131_H0133:375b-16	de de bzhin te /	de_0 de_3 bzhin_6 te_12 
K10D0131_H0133:375b-17	de bzhin gshegs pa'i sku ni mtshan ma dang /	de_0 bzhin_3 gshegs_9 ba_16 sku_21 ni_25 mtshan_28 ma_35 dang_38 
K10D0131_H0133:375b-18	mtshan ma thams cad dang bral ba'o //	mtshan_0 ma_7 thams_10 cad_16 dang_20 'bral_25 ba_30 
K10D0131_H0133:375b-19	de nas bcom ldan 'das kyis de bzhin gshegs pa'i	de_0 nas_3 'joms_7 ldan_12 'da'_17 kyis_22 de_27 bzhin_30 gshegs_36 ba_43 
K10D0131_H0133:375b-20	ye shes kyi phyag rgya'i ting nge 'dzin 'di rgyas	ye_0 shes_3 kyi_8 phyag_12 rgya_18 ting_25 nge_30 'dzin_34 'di_40 rgya_44 
K10D0131_H0133:375b-21	par bstan pa dang /	ba_0 ston_4 ba_10 dang_13 
K10D0131_H0133:375b-22	shin tu rgyas pa'ang rgya cher yongs su rdzogs par	shin_0 tu_5 rgya_8 ba_14 rgya_21 cher_26 yongs_31 su_37 rdzogs_40 ba_47 
K10D0131_H0133:375b-23	bya ba'i phyir de'i tshe tshigs su bcad pa 'di	byed_0 ba_4 phyir_9 de_15 tshe_20 tshigs_25 su_32 gcod_35 ba_40 'di_43 
K10D0131_H0133:375b-24	dag bka' stsal to //	'dag_0 bka'_4 stsal_9 to_15 
K10D0131_H0133:375b-25	lus de lus ma yin zhing lus las yongs su grol //	lus_0 de_4 lus_7 ma_11 yin_14 zhing_18 lus_24 las_28 yongs_32 su_38 grol_41 
K10D0131_H0133:375b-26	sus kyang ma byas ma bshig rnyed par gyur pa'ang med //	sus_0 kyang_4 ma_10 byed_13 ma_18 'jig_21 rnyed_27 ba_33 gyur_37 ba_42 med_49 
K10D0131_H0133:375b-27	chos rnams gang na'ang kun tu ldan med mi ldan med //	chos_0 rnams_5 gang_11 na_16 kun_23 tu_27 ldan_30 med_35 mi_39 ldan_42 med_47 
K10D0131_H0133:375b-28	bde bar gshegs pa rnams kyi sku de de ltar bstan //	bde_0 ba_4 gshegs_8 ba_15 rnams_18 kyi_24 sku_28 de_32 de_35 ltar_38 ston_43 
K10D0131_H0133:375b-29	'du med 'bral ba med cing gnas med rdzas kyang med //	'du_0 med_4 'bral_8 ba_14 med_17 cing_21 gnas_26 med_31 rdzas_35 kyang_41 med_47 
K10D0131_H0133:375b-30	ma bzung ma grol mnyam pa med cing ring ba med //	ma_0 bzung_3 ma_9 grol_12 mnyam_17 ba_23 med_26 cing_30 ring_35 ba_40 med_43 
K10D0131_H0133:375b-31	rtsom pa med cing thogs med ci la'ang gnas pa med //	rtsom_0 ba_6 med_9 cing_13 thogs_18 med_24 ci_28 la_31 gnas_38 ba_43 med_46 
K10D0131_H0133:375b-32	bde bar gshegs pa rnams kyi sku ni de 'drar bstan //	bde_0 ba_4 gshegs_8 ba_15 rnams_18 kyi_24 sku_28 ni_32 de_35 'drar_38 ston_44 
K10D0131_H0133:376a-0	gzang ba med cing @376a *//	gzang_0 ba_6 med_9 cing_13 
K10D0131_H0133:376a-1	ma byas ngas med ci yang med //	ma_0 byed_3 ngas_8 med_13 ci_17 yang_20 med_25 
K10D0131_H0133:376a-2	gzugs med sems med gnyis ma yin zhing gcig kyang min //	gzugs_0 med_6 sems_10 med_15 gnyis_19 ma_25 yin_28 zhing_32 gcig_38 kyang_43 min_49 
K10D0131_H0133:376a-3	dngos med dngos med ma yin ma byung med pa ste //	dngos_0 med_6 dngos_10 med_16 ma_20 yin_23 ma_27 'byung_30 med_36 ba_40 ste_43 
K10D0131_H0133:376a-4	yang dag nyid du rgyal ba'i sku de 'di 'dra'o //	yang_0 'dag_5 nyid_9 du_14 rgyal_17 ba_23 sku_28 de_32 'di_35 'dra_39 
K10D0131_H0133:376a-5	snying po de med nyam chung ma yin bcad pa'ang med //	snying_0 po_7 de_10 med_13 nyam_17 chung_22 ma_28 yin_31 gcod_35 ba_40 med_47 
K10D0131_H0133:376a-6	ma bcad ma byung kun tu ma byung zhig pa'ang med //	ma_0 gcod_3 ma_8 'byung_11 kun_17 tu_21 ma_24 'byung_27 'jig_33 ba_38 med_45 
K10D0131_H0133:376a-7	thob pa med cing rdul tsam dag kyang bshig med de //	'thob_0 ba_5 med_8 cing_12 rdul_17 tsam_22 'dag_27 kyang_31 'jig_37 med_43 de_47 
K10D0131_H0133:376a-8	rdul med rnams kyi sku de de 'drar shes par bya //	rdul_0 med_5 rnams_9 kyi_15 sku_19 de_23 de_26 'drar_29 shes_35 ba_40 byed_44 
K10D0131_H0133:376a-9	ma mthong ma thos ma bsnams reg par gyur pa med //	ma_0 mthong_3 ma_10 thos_13 ma_18 snom_21 reg_28 ba_32 gyur_36 ba_41 med_44 
K10D0131_H0133:376a-10	rnam par rig med ma brtags mig yor 'dra ba ste //	rnam_0 ba_5 rig_9 med_13 ma_17 rtog_20 mig_27 yor_31 'dra_35 ba_40 ste_43 
K10D0131_H0133:376a-11	srog chags mthong nas rang gi 'dzin pas sems kyang rangs //	srog_0 chags_5 mthong_11 nas_18 rang_22 gi_27 'dzin_30 ba_36 sems_40 kyang_45 rangs_51 
K10D0131_H0133:376a-12	'di ni sangs rgyas dag gi sku 'grub bstan pa'o //	'di_0 ni_4 sangs_7 rgya_13 'dag_19 gi_23 sku_26 'grub_30 ston_36 ba_42 
K10D0131_H0133:376a-13	phung po ma yin khams min mi rdzun mi bden te //	'phung_0 po_6 ma_9 yin_12 khams_16 min_22 mi_26 rdzun_29 mi_35 bden_38 te_43 
K10D0131_H0133:376a-14	dag med rnam par dag med dbang pos mi reg pa //	'dag_0 med_4 rnam_8 ba_13 'dag_17 med_21 dbang_25 pos_31 mi_35 reg_38 ba_42 
K10D0131_H0133:376a-15	rtog pa med cing rnam par mi rtog chu zla 'dra //	rtogs_0 ba_5 med_8 cing_12 rnam_17 ba_22 mi_26 rtogs_29 chu_34 zla_38 'dra_42 
K10D0131_H0133:376a-16	bde bar gshegs pa'i sku 'di lta bar su 'dod pa //	bde_0 ba_4 gshegs_8 ba_15 sku_20 'di_24 lta_28 ba_32 su_36 'dod_39 ba_44 
K10D0131_H0133:376a-17	sku ni rgyu dang rkyen las gyur te rang bzhin med //	sku_0 ni_4 rgyu_7 dang_12 rkyen_17 las_23 gyur_27 te_32 rang_35 bzhin_40 med_46 
K10D0131_H0133:376a-18	ma skyes ma 'gags song ba med cing 'phos pa'ang med //	ma_0 skye_3 ma_9 'gag_12 'gro_18 ba_23 med_26 cing_30 'pho_35 ba_41 med_48 
