K10D0272_H0274:84a-24	snying rje chen po 'thob par 'gyur ro //	snying_0 rje_7 chen_11 po_16 'thob_19 ba_25 'gyur_29 ro_35 
K10D0272_H0274:84a-25	sangs rgyas kyi chos ma 'dres pa bco brgyad 'thob par 'gyur ro //	sangs_0 rgya_6 kyi_12 chos_16 ma_21 'dre_24 ba_30 'chos_33 brgyad_37 'thob_44 ba_50 'gyur_54 ro_60 
K10D0272_H0274:84a-26	ji ltar de bzhin gshegs pa dgra bcom pa yang	ji_0 ltar_3 de_8 bzhin_11 gshegs_17 ba_24 dgra_27 'joms_32 ba_37 yang_40 
K10D0272_H0274:84a-27	dag par rdzogs pa'i sangs rgyas 'od dpag med kyi	'dag_0 ba_4 rdzogs_8 ba_15 sangs_20 rgya_26 'od_32 dpog_36 med_41 kyi_45 
K10D0272_H0274:84b-0	'jig rten gyi @84b khams bde ba can de 'dra	'jig_0 rten_5 gyi_10 khams_19 bde_25 ba_29 can_32 de_36 'dra_39 
K10D0272_H0274:84b-1	ba'i sangs rgyas kyi zhing yon tan bkod pa rnams	ba_0 sangs_5 rgya_11 kyi_17 zhing_21 yon_27 tan_31 bkod_35 ba_40 rnams_43 
K10D0272_H0274:84b-2	'thob par 'gyur ro //	'thob_0 ba_6 'gyur_10 ro_16 
K10D0272_H0274:84b-3	bud med kyang shi 'phos nas skyes pa'i dngos po	'bud_0 med_4 kyang_8 'chi_14 'pho_18 nas_24 skye_28 ba_34 dngos_39 po_45 
K10D0272_H0274:84b-4	'thob cing sangs rgyas bcom ldan 'das kyi zhal mthong	'thob_0 cing_6 sangs_11 rgya_17 'joms_23 ldan_28 'da'_33 kyi_38 zhal_42 mthong_47 
K10D0272_H0274:84b-5	bar skye bar 'gyur ro //	ba_0 skye_4 ba_9 'gyur_13 ro_19 
K10D0272_H0274:84b-6	de la 'di skad ces bya ste /	de_0 la_3 'di_6 skad_10 ces_15 byed_19 ste_23 
K10D0272_H0274:84b-7	gang gis mtshan 'di dag ni bzung byas na //	gang_0 gis_5 mtshan_9 'di_16 'dag_20 ni_24 bzung_27 byed_33 na_38 
K10D0272_H0274:84b-8	'od dpag med 'dra'i zhing dag 'thob pa dang //	'od_0 dpog_4 med_9 'dra_13 zhing_20 'dag_26 'thob_30 ba_36 dang_39 
K10D0272_H0274:84b-9	bud med phor 'gyur bsam gyis mi khyab pa'i //	'bud_0 med_4 phor_8 'gyur_13 bsam_19 gyis_24 mi_29 khyab_32 ba_38 
K10D0272_H0274:84b-10	yon tan 'di dag gzhan yang 'thob par 'gyur //	yon_0 tan_4 'di_8 'dag_12 gzhan_16 yang_22 'thob_27 ba_33 'gyur_37 
K10D0272_H0274:84b-11	yon tan rin chen me tog rgyas pa /	yon_0 tan_4 rin_8 chen_12 me_17 tog_20 rgya_24 ba_30 
K10D0272_H0274:84b-12	lho nub kyi phyogs mtshams logs na yon tan dpag	lho_0 nub_4 kyi_8 phyogs_12 mtshams_19 logs_27 na_32 yon_35 tan_39 dpog_43 
K10D0272_H0274:84b-13	tu med pa bkod pa zhes bya ba'i 'jig rten	tu_0 med_3 ba_7 bkod_10 ba_15 zhes_18 byed_23 ba_27 'jig_32 rten_37 
K10D0272_H0274:84b-14	gyi khams yod de /	gyi_0 khams_4 yod_10 de_14 
K10D0272_H0274:84b-15	de na de bzhin gshegs pa dgra bcom pa yang	de_0 na_3 de_6 bzhin_9 gshegs_15 ba_22 dgra_25 'joms_30 ba_35 yang_38 
K10D0272_H0274:84b-16	dag par rdzogs pa'i sangs rgyas nyi ma'i 'od dam	'dag_0 ba_4 rdzogs_8 ba_15 sangs_20 rgya_26 nyi_32 ma_36 'od_41 dam_45 
K10D0272_H0274:84b-17	pa dpal gyi gzhi brjid 'byung ba zhes bya ba	ba_0 dpal_3 gyi_8 gzhi_12 brjid_17 'byung_23 ba_30 zhes_33 byed_38 ba_42 
K10D0272_H0274:84b-18	da ltar bzhugs te 'tsho la gzhes shing chos kyang	da_0 ltar_3 bzhugs_8 te_15 'tsho_18 la_24 gzhes_27 shing_33 chos_39 kyang_44 
K10D0272_H0274:84b-19	ston to // bskal pa de ni yid bde ba yang dag par skyed pa zhes bya'o //	ston_0 to_5 bskal_11 ba_17 de_20 ni_23 yid_26 bde_30 ba_34 yang_37 'dag_42 ba_46 skyed_50 ba_56 zhes_59 byed_64 
K10D0272_H0274:84b-20	rigs kyi bu'am /	rigs_0 kyi_5 bu_9 
K10D0272_H0274:84b-21	rigs kyi bu mos bcom ldan 'das de bzhin gshegs	rigs_0 kyi_5 bu_9 mos_12 'joms_16 ldan_21 'da'_26 de_31 bzhin_34 gshegs_40 
K10D0272_H0274:84b-22	pa dgra bcom pa yang dag par rdzogs pa'i sangs	ba_0 dgra_3 'joms_8 ba_13 yang_16 'dag_21 ba_25 rdzogs_29 ba_36 sangs_41 
K10D0272_H0274:84b-23	rgyas nyi ma'i 'od dam pa'i dpal gyi gzi brjid	rgya_0 nyi_6 ma_10 'od_15 dam_19 ba_23 dpal_28 gyi_33 gzi_37 brjid_41 
K10D0272_H0274:84b-24	'byung ba zhes bya ba de'i mtshan thos na mtshan	'byung_0 ba_7 zhes_10 byed_15 ba_19 de_22 mtshan_27 thos_34 na_39 mtshan_42 
K10D0272_H0274:84b-25	de dag thos pa tsam gyis sangs rgyas bye ba	de_0 'dag_3 thos_7 ba_12 tsam_15 gyis_20 sangs_25 rgya_31 'bye_37 ba_41 
K10D0272_H0274:84b-26	mnyes par 'gyur ro //	mnyes_0 ba_6 'gyur_10 ro_16 
K10D0272_H0274:84b-27	thams cad du mdangs lta bu zhes bya ba'i ting nge 'dzin 'thob par 'gyur ro //	thams_0 cad_6 du_10 mdangs_13 lta_20 bu_24 zhes_27 byed_32 ba_36 ting_41 nge_46 'dzin_50 'thob_56 ba_62 'gyur_66 ro_72 
K10D0272_H0274:84b-28	rigs kyi bu'am /	rigs_0 kyi_5 bu_9 
K10D0272_H0274:85a-0	rigs kyi bu mos mtshan de dag rgyun du bzung ba byas na shi @85a *//	rigs_0 kyi_5 bu_9 mos_12 mtshan_16 de_23 'dag_26 rgyun_30 du_36 bzung_39 ba_45 byed_48 na_53 'chi_56 
K10D0272_H0274:85a-1	'phos nas sems can thams cad mdangs lta bu zhes	'pho_0 nas_6 sems_10 can_15 thams_19 cad_25 mdangs_29 lta_36 bu_40 zhes_43 
K10D0272_H0274:85a-2	bya ba'i ting nge 'dzin la 'jog par byed cing	byed_0 ba_4 ting_9 nge_14 'dzin_18 la_24 'jog_27 ba_32 byed_36 cing_41 
K10D0272_H0274:85a-3	/ thams cad kyang bla na med pa yang dag	thams_2 cad_8 kyang_12 bla_18 na_22 med_25 ba_29 yang_32 'dag_37 
K10D0272_H0274:85a-4	par rdzogs pa'i byang chub tu nges par 'gyur ro	ba_0 rdzogs_4 ba_11 byang_16 chub_22 tu_27 nges_30 ba_35 'gyur_39 ro_45 
K10D0272_H0274:85a-5	/ // rgyu gang dang /	rgyu_5 gang_10 dang_15 
K10D0272_H0274:85a-6	rkyen gang gis sems can thams cad mdangs lta bu	rkyen_0 gang_6 gis_11 sems_15 can_20 thams_24 cad_30 mdangs_34 lta_41 bu_45 
K10D0272_H0274:85a-7	zhes bya ba'i ting nge 'dzin thob par byed cing	zhes_0 byed_5 ba_9 ting_14 nge_19 'dzin_23 'thob_29 ba_34 byed_38 cing_43 
K10D0272_H0274:85a-8	thams cad bla na med pa yang dag par rdzogs	thams_0 cad_6 bla_10 na_14 med_17 ba_21 yang_24 'dag_29 ba_33 rdzogs_37 
K10D0272_H0274:85a-9	pa'i byang chub tu nges par 'gyur zhe na /	ba_0 byang_5 chub_11 tu_16 nges_19 ba_24 'gyur_28 zhe_34 na_38 
K10D0272_H0274:85a-10	rigs kyi bu'am /	rigs_0 kyi_5 bu_9 
K10D0272_H0274:85a-11	rigs kyi bu mo gang la las ting nge 'dzin	rigs_0 kyi_5 bu_9 mo_12 gang_15 la_20 las_23 ting_27 nge_32 'dzin_36 
K10D0272_H0274:85a-12	'di la gnas shing chos bstan na de ltar chos	'di_0 la_4 gnas_7 shing_12 chos_18 ston_23 na_29 de_32 ltar_35 chos_40 
K10D0272_H0274:85a-13	bstan pas ting nge 'dzin 'dir thob par 'gyur zhing	ston_0 ba_6 ting_10 nge_15 'dzin_19 'dir_25 'thob_30 ba_35 'gyur_39 zhing_45 
K10D0272_H0274:85a-14	stong gsum gyi stong chen po'i 'jig rten gyi khams	stong_0 gsum_6 gyi_11 stong_15 chen_21 po_26 'jig_31 rten_36 gyi_41 khams_45 
K10D0272_H0274:85a-15	de'i sems can ji snyed pa de dag thams cad	de_0 sems_5 can_10 ji_14 snyed_17 ba_23 de_26 'dag_29 thams_33 cad_39 
K10D0272_H0274:85a-16	kyang bde bar 'gyur ro //	kyang_0 bde_6 ba_10 'gyur_14 ro_20 
K10D0272_H0274:85a-17	dper na /	dper_0 na_5 
K10D0272_H0274:85a-18	de bzhin gshegs pa dgra bcom pa yang dag par	de_0 bzhin_3 gshegs_9 ba_16 dgra_19 'joms_24 ba_29 yang_32 'dag_37 ba_41 
K10D0272_H0274:85a-19	rdzogs pa'i sangs rgyas yid du 'ong ba zhes bya	rdzogs_0 ba_7 sangs_12 rgya_18 yid_24 du_28 'ong_31 ba_36 zhes_39 byed_44 
K10D0272_H0274:85a-20	ba'i zhing na sems can rnams bde ba la gcig	ba_0 zhing_5 na_11 sems_14 can_19 rnams_23 bde_29 ba_33 la_36 gcig_39 
K10D0272_H0274:85a-21	tu bkod pa dang /	tu_0 bkod_3 ba_8 dang_11 
K10D0272_H0274:85a-22	ngan song du song ba'i sems can rnams kyang yongs su grol bar byed cing lha dang /	ngan_0 'gro_5 du_10 'gro_13 ba_18 sems_23 can_28 rnams_32 kyang_38 yongs_44 su_50 grol_53 ba_58 byed_62 cing_67 lha_72 dang_76 
K10D0272_H0274:85a-23	mi'i ngo bo nyid thob par byed pa dang /	mi_0 ngo_5 'bo_9 nyid_12 'thob_17 ba_22 byed_26 ba_31 dang_34 
K10D0272_H0274:85a-24	de dag thams cad kyang bla na med pa yang	de_0 'dag_3 thams_7 cad_13 kyang_17 bla_23 na_27 med_30 ba_34 yang_37 
K10D0272_H0274:85a-25	dag par rdzogs pa'i byang chub tu nges par byed	'dag_0 ba_4 rdzogs_8 ba_15 byang_20 chub_26 tu_31 nges_34 ba_39 byed_43 
K10D0272_H0274:85a-26	pa bzhin no // de la 'di skad ces bya ste /	ba_0 bzhin_3 no_9 de_15 la_18 'di_21 skad_25 ces_30 byed_34 ste_38 
K10D0272_H0274:85a-27	gang gis mgon de'i mtshan ni bzung byas na //	gang_0 gis_5 mgon_9 de_14 mtshan_19 ni_26 bzung_29 byed_35 na_40 
K10D0272_H0274:85a-28	phyi rol ma yin rtog par byed pa dang //	phyi_0 rol_5 ma_9 yin_12 rtogs_16 ba_21 byed_25 ba_30 dang_33 
K10D0272_H0274:85b-0	mdangs lta bu yi ting @85b 'dzin thob byed cing //	mdangs_0 lta_7 bu_11 yi_14 ting_17 'dzin_27 'thob_33 byed_38 cing_43 
K10D0272_H0274:85b-1	de dang gzhan du mang po skyed par byed //	de_0 dang_3 gzhan_8 du_14 mang_17 po_22 skyed_25 ba_31 byed_35 
K10D0272_H0274:85b-2	yon tan rin chen me tog rgyas pa /	yon_0 tan_4 rin_8 chen_12 me_17 tog_20 rgya_24 ba_30 
K10D0272_H0274:85b-3	nub byang gi phyogs mtshams logs na ngan song spangs	nub_0 byang_4 gi_10 phyogs_13 mtshams_20 logs_28 na_33 ngan_36 'gro_41 spong_46 
K10D0272_H0274:85b-4	pa zhes bya ba'i 'jig rten gyi khams yod de	ba_0 zhes_3 byed_8 ba_12 'jig_17 rten_22 gyi_27 khams_31 yod_37 de_41 
K10D0272_H0274:85b-5	/ de na de bzhin gshegs pa dgra bcom pa	de_2 na_5 de_8 bzhin_11 gshegs_17 ba_24 dgra_27 'joms_32 ba_37 
K10D0272_H0274:85b-6	yang dag par rdzogs pa'i sangs rgyas rnam pa mang	yang_0 'dag_5 ba_9 rdzogs_13 ba_20 sangs_25 rgya_31 rnam_37 ba_42 mang_45 
K10D0272_H0274:85b-7	po'i gzi brjid kyi rgyal po dpal 'byung ba zhes	po_0 gzi_5 brjid_9 kyi_15 rgyal_19 po_25 dpal_28 'byung_33 ba_40 zhes_43 
K10D0272_H0274:85b-8	bya ba da ltar bzhugs te 'tsho la gzhes shing	byed_0 ba_4 da_7 ltar_10 bzhugs_15 te_22 'tsho_25 la_31 gzhes_34 shing_40 
K10D0272_H0274:85b-9	chos kyang ston to //	chos_0 kyang_5 ston_11 to_16 
K10D0272_H0274:85b-10	bskal pa de ni dge ba rgya che ba zhes bya'o //	bskal_0 ba_6 de_9 ni_12 dge_15 ba_19 rgya_22 che_27 ba_31 zhes_34 byed_39 
K10D0272_H0274:85b-11	rigs kyi bu'am /	rigs_0 kyi_5 bu_9 
K10D0272_H0274:85b-12	rigs kyi bu mos bcom ldan 'das de bzhin gshegs	rigs_0 kyi_5 bu_9 mos_12 'joms_16 ldan_21 'da'_26 de_31 bzhin_34 gshegs_40 
K10D0272_H0274:85b-13	pa dgra bcom pa yang dag par rdzogs pa'i sangs	ba_0 dgra_3 'joms_8 ba_13 yang_16 'dag_21 ba_25 rdzogs_29 ba_36 sangs_41 
K10D0272_H0274:85b-14	rgyas rnam pa mang po'i gzi brjid kyi rgyal po	rgya_0 rnam_6 ba_11 mang_14 po_19 gzi_24 brjid_28 kyi_34 rgyal_38 po_44 
K10D0272_H0274:85b-15	dpal 'byung ba zhes bya ba de'i mtshan bzung na	dpal_0 'byung_5 ba_12 zhes_15 byed_20 ba_24 de_27 mtshan_32 bzung_39 na_45 
K10D0272_H0274:85b-16	shi 'phos nas spobs pa dpag tu med pa bkod	'chi_0 'pho_4 nas_10 spobs_14 ba_20 dpog_23 tu_28 med_31 ba_35 bkod_38 
K10D0272_H0274:85b-17	pa zhes bya ba'i gzungs 'thob par 'gyur ro //	ba_0 zhes_3 byed_8 ba_12 gzungs_17 'thob_24 ba_30 'gyur_34 ro_40 
K10D0272_H0274:85b-18	tshegs chung ngus de bzhin gshegs pa dgra bcom pa	tshegs_0 chung_7 ngu_13 de_18 bzhin_21 gshegs_27 ba_34 dgra_37 'joms_42 ba_47 
K10D0272_H0274:85b-19	yang dag par rdzogs pa'i sangs rgyas 'od dpag med	yang_0 'dag_5 ba_9 rdzogs_13 ba_20 sangs_25 rgya_31 'od_37 dpog_41 med_46 
K10D0272_H0274:85b-20	kyi sangs rgyas kyi zhing gi yon tan phun sum	kyi_0 sangs_4 rgya_10 kyi_16 zhing_20 gi_26 yon_29 tan_33 phun_37 sum_42 
K10D0272_H0274:85b-21	tshogs pa bkod pa yongs su 'dzin par 'gyur ro	tshogs_0 ba_7 bkod_10 ba_15 yongs_18 su_24 'dzin_27 ba_33 'gyur_37 ro_43 
K10D0272_H0274:85b-22	// skye ba gcig gis bla na med pa yang	skye_3 ba_8 gcig_11 gis_16 bla_20 na_24 med_27 ba_31 yang_34 
K10D0272_H0274:85b-23	dag par rdzogs pa'i byang chub 'grub par 'gyur ro	'dag_0 ba_4 rdzogs_8 ba_15 byang_20 chub_26 'grub_31 ba_37 'gyur_41 ro_47 
K10D0272_H0274:85b-24	// // sangs rgyas bye ba phrag dgu bcus chos bstan pa'ang thos par 'gyur ro //	sangs_6 rgya_12 'bye_18 ba_22 phrag_25 dgu_31 'chu_35 chos_40 ston_45 ba_51 thos_58 ba_63 'gyur_67 ro_73 
K10D0272_H0274:85b-25	de la 'di skad ces bya ste /	de_0 la_3 'di_6 skad_10 ces_15 byed_19 ste_23 
K10D0272_H0274:85b-26	gang gis rgyal ba'i mtshan de bzung byas na //	gang_0 gis_5 rgyal_9 ba_15 mtshan_20 de_27 bzung_30 byed_36 na_41 
K10D0272_H0274:85b-27	skye ba gcig gis byang chub 'thob pa dang //	skye_0 ba_5 gcig_8 gis_13 byang_17 chub_23 'thob_28 ba_34 dang_37 
K10D0272_H0274:85b-28	'od dpag med dang mnyam pa'i zhing dag dang //	'od_0 dpog_4 med_9 dang_13 mnyam_18 ba_24 zhing_29 'dag_35 dang_39 
K10D0272_H0274:86a-0	gzungs @86a *//	gzungs_0 
K10D0272_H0274:86a-1	kyang sems can de yis 'thob par 'gyur //	kyang_0 sems_6 can_11 de_15 yis_18 'thob_22 ba_28 'gyur_32 
K10D0272_H0274:86a-2	yon tan rin chen me tog rgyas pa /	yon_0 tan_4 rin_8 chen_12 me_17 tog_20 rgya_24 ba_30 
K10D0272_H0274:86a-3	byang shar gyi phyogs mtshams logs na mya ngan gyi	byang_0 'char_6 gyi_11 phyogs_15 mtshams_22 logs_30 na_35 mya_38 ngan_42 gyi_47 
K10D0272_H0274:86a-4	gnod pa thams cad dang bral ba zhes bya ba'i	gnod_0 ba_5 thams_8 cad_14 dang_18 'bral_23 ba_28 zhes_31 byed_36 ba_40 
K10D0272_H0274:86a-5	'jig rten gyi khams yod de /	'jig_0 rten_5 gyi_10 khams_14 yod_20 de_24 
K10D0272_H0274:86a-6	de na de bzhin gshegs pa dgra bcom pa yang	de_0 na_3 de_6 bzhin_9 gshegs_15 ba_22 dgra_25 'joms_30 ba_35 yang_38 
K10D0272_H0274:86a-7	dag par rdzogs pa'i sangs rgyas bskal pa bye ba	'dag_0 ba_4 rdzogs_8 ba_15 sangs_20 rgya_26 bskal_32 ba_38 'bye_41 ba_45 
K10D0272_H0274:86a-8	grangs med par kun tu 'byung ba zhes bya ba	grangs_0 med_7 ba_11 kun_15 tu_19 'byung_22 ba_29 zhes_32 byed_37 ba_41 
K10D0272_H0274:86a-9	da ltar bzhugs te 'tsho la gzhes shing chos kyang	da_0 ltar_3 bzhugs_8 te_15 'tsho_18 la_24 gzhes_27 shing_33 chos_39 kyang_44 
K10D0272_H0274:86a-10	ston to // bskal pa de ni spobs pa bkod pa zhes bya'o //	ston_0 to_5 bskal_11 ba_17 de_20 ni_23 spobs_26 ba_32 bkod_35 ba_40 zhes_43 byed_48 
K10D0272_H0274:86a-11	rigs kyi bu'am /	rigs_0 kyi_5 bu_9 
K10D0272_H0274:86a-12	rigs kyi bu mos bcom ldan 'das de bzhin gshegs	rigs_0 kyi_5 bu_9 mos_12 'joms_16 ldan_21 'da'_26 de_31 bzhin_34 gshegs_40 
K10D0272_H0274:86a-13	pa dgra bcom pa yang dag par rdzogs pa'i sangs	ba_0 dgra_3 'joms_8 ba_13 yang_16 'dag_21 ba_25 rdzogs_29 ba_36 sangs_41 
K10D0272_H0274:86a-14	rgyas bskal pa bye ba grangs med par kun tu	rgya_0 bskal_6 ba_12 'bye_15 ba_19 grangs_22 med_29 ba_33 kun_37 tu_41 
K10D0272_H0274:86a-15	'byung ba zhes bya ba de'i mtshan bzung na shi	'byung_0 ba_7 zhes_10 byed_15 ba_19 de_22 mtshan_27 bzung_34 na_40 'chi_43 
K10D0272_H0274:86a-16	'phos nas sgra dbyangs yan lag drug cu dang ldan	'pho_0 nas_6 sgra_10 dbyangs_15 yan_23 lag_27 drug_31 cu_36 dang_39 ldan_44 
K10D0272_H0274:86a-17	pa'i spobs pa phun sum tshogs pa 'thob par 'gyur	ba_0 spobs_5 ba_11 phun_14 sum_19 tshogs_23 ba_30 'thob_33 ba_39 'gyur_43 
K10D0272_H0274:86a-18	ro // sangs rgyas bye ba phrag brgyad cu las dge ba'i rtsa ba bskyed par 'gyur ro //	ro_0 sangs_6 rgya_12 'bye_18 ba_22 phrag_25 brgyad_31 cu_38 las_41 dge_45 ba_49 rtsa_54 ba_59 skyed_62 ba_69 'gyur_73 ro_79 
K10D0272_H0274:86a-19	de la 'di skad ces bya ste /	de_0 la_3 'di_6 skad_10 ces_15 byed_19 ste_23 
K10D0272_H0274:86a-20	gang gis rgyal ba'i mtshan de dag ni bzung byas na //	gang_0 gis_5 rgyal_9 ba_15 mtshan_20 de_27 'dag_30 ni_34 bzung_37 byed_43 na_48 
K10D0272_H0274:86a-21	rgyal ba bye ba khrag khrig brgyad cu mchod pa yi //	rgyal_0 ba_6 'bye_9 ba_13 khrag_16 khrig_22 brgyad_28 cu_35 mchod_38 ba_44 yi_47 
K10D0272_H0274:86a-22	bsod nams de dag de la chung bar mi 'gyur zhing //	bsod_0 nams_5 de_10 'dag_13 de_17 la_20 chung_23 ba_29 mi_33 'gyur_36 zhing_42 
K10D0272_H0274:86a-23	sgra dbyangs phun tshogs yan lag drug cur ldan pa 'thob //	sgra_0 dbyangs_5 phun_13 tshogs_18 yan_25 lag_29 drug_33 cur_38 ldan_42 ba_47 'thob_50 
K10D0272_H0274:86a-24	yon tan rin chen me tog rgyas pa /	yon_0 tan_4 rin_8 chen_12 me_17 tog_20 rgya_24 ba_30 
K10D0272_H0274:86a-25	steng gi phyogs logs na gzi brjid dpag tu med	steng_0 gi_6 phyogs_9 logs_16 na_21 gzi_24 brjid_28 dpog_34 tu_39 med_42 
K10D0272_H0274:86a-26	pa bkod pa zhes bya ba'i 'jig rten gyi khams	ba_0 bkod_3 ba_8 zhes_11 byed_16 ba_20 'jig_25 rten_30 gyi_35 khams_39 
K10D0272_H0274:86b-0	yod de / de na de @86b bzhin gshegs pa	yod_0 de_4 de_9 na_12 de_15 bzhin_23 gshegs_29 ba_36 
K10D0272_H0274:86b-1	dgra bcom pa yang dag par rdzogs pa'i sangs rgyas	dgra_0 'joms_5 ba_10 yang_13 'dag_18 ba_22 rdzogs_26 ba_33 sangs_38 rgya_44 
K10D0272_H0274:86b-2	dge ba gser gyi nam mkha' nges par sgrogs pa	dge_0 ba_4 gser_7 gyi_12 nam_16 mkha'_20 nges_26 ba_31 sgrogs_35 ba_42 
K10D0272_H0274:86b-3	bkod pa dpal gyi gzi brjed 'byung ba zhes bya	bkod_0 ba_5 dpal_8 gyi_13 gzi_17 brjed_21 'byung_27 ba_34 zhes_37 byed_42 
K10D0272_H0274:86b-4	ba da ltar bzhugs te 'tsho la gzhes shing chos	ba_0 da_3 ltar_6 bzhugs_11 te_18 'tsho_21 la_27 gzhes_30 shing_36 chos_42 
K10D0272_H0274:86b-5	yod de / kyang ston to // bskal pa de ni snang ba shin tu gsal ba zhes bya'o //	yod_0 de_4 kyang_9 ston_15 to_20 bskal_26 ba_32 de_35 ni_38 snang_41 ba_47 shin_50 tu_55 gsal_58 ba_63 zhes_66 byed_71 
K10D0272_H0274:86b-6	rigs kyi bu'am /	rigs_0 kyi_5 bu_9 
K10D0272_H0274:86b-7	rigs kyi bu mos bcom ldan 'das de bzhin gshegs	rigs_0 kyi_5 bu_9 mos_12 'joms_16 ldan_21 'da'_26 de_31 bzhin_34 gshegs_40 
K10D0272_H0274:86b-8	pa dgra bcom pa yang dag par rdzogs pa'i sangs	ba_0 dgra_3 'joms_8 ba_13 yang_16 'dag_21 ba_25 rdzogs_29 ba_36 sangs_41 
K10D0272_H0274:86b-9	rgyas dge ba gser gyi nam mkha' nges par sgrogs	rgya_0 dge_6 ba_10 gser_13 gyi_18 nam_22 mkha'_26 nges_32 ba_37 sgrogs_41 
K10D0272_H0274:86b-10	pa bkod pa dpal gyi gzi brjid 'byung ba zhes	ba_0 bkod_3 ba_8 dpal_11 gyi_16 gzi_20 brjid_24 'byung_30 ba_37 zhes_40 
K10D0272_H0274:86b-11	bya ba de'i mtshan bzung na tshul khrims kyi phung	byed_0 ba_4 de_7 mtshan_12 bzung_19 na_25 tshul_28 khrims_34 kyi_41 'phung_45 
K10D0272_H0274:86b-12	po dpag tu med pa yongs su dag pa dang	po_0 dpog_3 tu_8 med_11 ba_15 yongs_18 su_24 'dag_27 ba_31 dang_34 
K10D0272_H0274:86b-13	/ ting nge 'dzin gyi phung po dpag tu med pa dang /	ting_2 nge_7 'dzin_11 gyi_17 'phung_21 po_27 dpog_30 tu_35 med_38 ba_42 dang_45 
K10D0272_H0274:86b-14	shes rab kyi phung po dpag tu med pa dang /	shes_0 rab_5 kyi_9 'phung_13 po_19 dpog_22 tu_27 med_30 ba_34 dang_37 
K10D0272_H0274:86b-15	rnam par grol ba'i phung po dpag tu med pa dang /	rnam_0 ba_5 grol_9 ba_14 'phung_19 po_25 dpog_28 tu_33 med_36 ba_40 dang_43 
K10D0272_H0274:86b-16	rnam par grol ba'i ye shes mthong ba'i phung po	rnam_0 ba_5 grol_9 ba_14 ye_19 shes_22 mthong_27 ba_34 'phung_39 po_45 
K10D0272_H0274:86b-17	dpag tu med pa yongs su dag par byed do	dpog_0 tu_5 med_8 ba_12 yongs_15 su_21 'dag_24 ba_28 byed_32 do_37 
K10D0272_H0274:86b-18	// sa nas sa 'thob par 'gyur ro //	sa_3 nas_6 sa_10 'thob_13 ba_19 'gyur_23 ro_29 
K10D0272_H0274:86b-19	'jig rten dang /	'jig_0 rten_5 dang_10 
K10D0272_H0274:86b-20	'jig rten las 'das pa'i ye shes mchog 'thob par 'gyur ro //	'jig_0 rten_5 las_10 'da'_14 ba_19 ye_24 shes_27 mchog_32 'thob_38 ba_44 'gyur_48 ro_54 
K10D0272_H0274:86b-21	gnyen gyi stobs dang /	gnyen_0 gyi_6 stobs_10 dang_16 
K10D0272_H0274:86b-22	rgyal srid 'thob par 'gyur ro //	rgyal_0 srid_6 'thob_11 ba_17 'gyur_21 ro_27 
K10D0272_H0274:86b-23	spobs pa mi bul ba 'thob par 'gyur ro //	spobs_0 ba_6 mi_9 bul_12 ba_16 'thob_19 ba_25 'gyur_29 ro_35 
K10D0272_H0274:86b-24	myur du bla na med pa yang dag par rdzogs	myur_0 du_5 bla_8 na_12 med_15 ba_19 yang_22 'dag_27 ba_31 rdzogs_35 
K10D0272_H0274:86b-25	pa'i byang chub tu mngon par rdzogs par 'tshang rgya'o	ba_0 byang_5 chub_11 tu_16 mngon_19 ba_25 rdzogs_29 ba_36 'tshang_40 rgya_48 
K10D0272_H0274:86b-26	// sems can thams cad kyang 'chi 'pho dang /	sems_3 can_8 thams_12 cad_18 kyang_22 'chi_28 'pho_33 dang_38 
K10D0272_H0274:86b-27	sngon gyi gnas rjes su dran pa dang /	sngon_0 gyi_6 gnas_10 rjes_15 su_20 dran_23 ba_28 dang_31 
K10D0272_H0274:86b-28	brda skad shes pa thob par 'gyur ro //	brda_0 skad_5 shes_10 ba_15 'thob_18 ba_23 'gyur_27 ro_33 
K10D0272_H0274:86b-29	spobs pa rgyun mi 'chad pa 'thob par 'gyur ro //	spobs_0 ba_6 rgyun_9 mi_15 'chad_18 ba_24 'thob_27 ba_33 'gyur_37 ro_43 
K10D0272_H0274:86b-30	rigs mthon po 'thob par 'gyur ro /	rigs_0 mthon_5 po_11 'thob_14 ba_20 'gyur_24 ro_30 
K10D0272_H0274:87a-0	@87a *// rigs chen po 'thob par 'gyur ro //	rigs_9 chen_14 po_19 'thob_22 ba_28 'gyur_32 ro_38 
K10D0272_H0274:87a-1	tshe rabs dran par 'gyur ro //	tshe_0 rabs_5 dran_10 ba_15 'gyur_19 ro_25 
K10D0272_H0274:87a-2	mngon par shes pa lnga dang /	mngon_0 ba_6 shes_10 ba_15 lnga_18 dang_23 
K10D0272_H0274:87a-3	sangs rgyas kyi chos ma 'dres pa bco brgyad 'thob	sangs_0 rgya_6 kyi_12 chos_16 ma_21 'dre_24 ba_30 'chos_33 brgyad_37 'thob_44 
K10D0272_H0274:87a-4	par 'gyur ro; ;de la 'di skad ces bya ste	ba_0 'gyur_4 ro;_10 ;de_14 la_18 'di_21 skad_25 ces_30 byed_34 ste_38 
K10D0272_H0274:87a-5	/ gang gis sangs rgyas mtshan de dag ni bzung byas na //	gang_2 gis_7 sangs_11 rgya_17 mtshan_23 de_30 'dag_33 ni_37 bzung_40 byed_46 na_51 
K10D0272_H0274:87a-6	yan lag kun dang ldan pa'i phun sum tshogs pa dang //	yan_0 lag_4 kun_8 dang_12 ldan_17 ba_22 phun_27 sum_32 tshogs_36 ba_43 dang_46 
K10D0272_H0274:87a-7	byang chub dam pa sangs rgyas ring por mi thogs shing //	byang_0 chub_6 dam_11 ba_15 sangs_18 rgya_24 ring_30 por_35 mi_39 thogs_42 shing_48 
K10D0272_H0274:87a-8	'jig rten rnams kyi shes pa bla med 'thob par 'gyur //	'jig_0 rten_5 rnams_10 kyi_16 shes_20 ba_25 bla_28 med_32 'thob_36 ba_42 'gyur_46 
K10D0272_H0274:87a-9	yon tan rin chen me tog rgyas pa /	yon_0 tan_4 rin_8 chen_12 me_17 tog_20 rgya_24 ba_30 
K10D0272_H0274:87a-10	'og gi phyogs logs na rdul thams cad 'dus pa zhes bya ba'i 'jig rten gyi khams yod de /	'og_0 gi_4 phyogs_7 logs_14 na_19 rdul_22 thams_27 cad_33 'du_37 ba_42 zhes_45 byed_50 ba_54 'jig_59 rten_64 gyi_69 khams_73 yod_79 de_83 
K10D0272_H0274:87a-11	de na de bzhin gshegs pa dgra bcom pa yang	de_0 na_3 de_6 bzhin_9 gshegs_15 ba_22 dgra_25 'joms_30 ba_35 yang_38 
K10D0272_H0274:87a-12	dag par rdzogs pa'i sangs rgyas chos thams cad kyi	'dag_0 ba_4 rdzogs_8 ba_15 sangs_20 rgya_26 chos_32 thams_37 cad_43 kyi_47 
K10D0272_H0274:87a-13	tshul rnam par 'phrul pa'i gzi brjid 'byung ba zhes	tshul_0 rnam_6 ba_11 'phrul_15 ba_22 gzi_27 brjid_31 'byung_37 ba_44 zhes_47 
K10D0272_H0274:87a-14	bya ba da ltar bzhugs te 'tsho la gzhes shing	byed_0 ba_4 da_7 ltar_10 bzhugs_15 te_22 'tsho_25 la_31 gzhes_34 shing_40 
K10D0272_H0274:87a-15	chos kyang ston to //	chos_0 kyang_5 ston_11 to_16 
K10D0272_H0274:87a-16	bskal pa de ni 'jig rten kun tu bsags pa zhes bya'o //	bskal_0 ba_6 de_9 ni_12 'jig_15 rten_20 kun_25 tu_29 bsags_32 ba_38 zhes_41 byed_46 
K10D0272_H0274:87a-17	rigs kyi bu'am /	rigs_0 kyi_5 bu_9 
K10D0272_H0274:87a-18	rigs kyi bu mos bcom ldan 'das de bzhin gshegs	rigs_0 kyi_5 bu_9 mos_12 'joms_16 ldan_21 'da'_26 de_31 bzhin_34 gshegs_40 
K10D0272_H0274:87a-19	pa dgra bcom pa yang dag par rdzogs pa'i sangs	ba_0 dgra_3 'joms_8 ba_13 yang_16 'dag_21 ba_25 rdzogs_29 ba_36 sangs_41 
K10D0272_H0274:87a-20	rgyas chos thams cad kyi tshul rnam par 'phrul pa'i	rgya_0 chos_6 thams_11 cad_17 kyi_21 tshul_25 rnam_31 ba_36 'phrul_40 ba_47 
K10D0272_H0274:87a-21	gtsi brjod 'byung ba zhes bya ba de'i mtshan bzung	gtsi_0 rjod_5 'byung_11 ba_18 zhes_21 byed_26 ba_30 de_33 mtshan_38 bzung_45 
K10D0272_H0274:87a-22	na zla ba'i gzungs zhes bya ba 'thob par 'gyur	na_0 zla_3 ba_7 gzungs_12 zhes_19 byed_24 ba_28 'thob_31 ba_37 'gyur_41 
K10D0272_H0274:87a-23	ro // skye ba gcig gis bla na med pa	ro_0 skye_6 ba_11 gcig_14 gis_19 bla_23 na_27 med_30 ba_34 
K10D0272_H0274:87a-24	yang dag par rdzogs pa'i byang chub 'thob par 'gyur	yang_0 'dag_5 ba_9 rdzogs_13 ba_20 byang_25 chub_31 'thob_36 ba_42 'gyur_46 
K10D0272_H0274:87b-0	ro // ro // sangs rgyas bye @87b ba phrag dgu bcus chos bstan pa thos par 'gyur ro //	ro_0 ro_6 sangs_12 rgya_18 'bye_24 ba_33 phrag_36 dgu_42 'chu_46 chos_51 ston_56 ba_62 thos_65 ba_70 'gyur_74 ro_80 
K10D0272_H0274:87b-1	thos nas kyang thams cad kun tu 'dzin par 'gyur ro //	thos_0 nas_5 kyang_9 thams_15 cad_21 kun_25 tu_29 'dzin_32 ba_38 'gyur_42 ro_48 
K10D0272_H0274:87b-2	de la 'di skad ces bya ste /	de_0 la_3 'di_6 skad_10 ces_15 byed_19 ste_23 
K10D0272_H0274:87b-3	gang gis mgon de'i mtshan ni bzung byas na //	gang_0 gis_5 mgon_9 de_14 mtshan_19 ni_26 bzung_29 byed_35 na_40 
K10D0272_H0274:87b-4	sangs rgyas bye ba'i chos ni 'dzin byed cing //	sangs_0 rgya_6 'bye_12 ba_16 chos_21 ni_26 'dzin_29 byed_35 cing_40 
K10D0272_H0274:87b-5	skye ba gcig gis byang chub dam pa dang //	skye_0 ba_5 gcig_8 gis_13 byang_17 chub_23 dam_28 ba_32 dang_35 
K10D0272_H0274:87b-6	zla ba zhes bya'i gzungs ni 'dis 'thob 'gyur //	zla_0 ba_4 zhes_7 byed_12 gzungs_18 ni_25 'dis_28 'thob_33 'gyur_39 
K10D0272_H0274:87b-7	de nas byang chub sems dpa' sems dpa' chen po yon tan rin chen me tog rgyas pa dang /	de_0 nas_3 byang_7 chub_13 sems_18 dpa'_23 sems_28 dpa'_33 chen_38 po_43 yon_46 tan_50 rin_54 chen_58 me_63 tog_66 rgya_70 ba_76 dang_79 
K10D0272_H0274:87b-8	byang chub sems dpa' sems dpa' chen po yon tan	byang_0 chub_6 sems_11 dpa'_16 sems_21 dpa'_26 chen_31 po_36 yon_39 tan_43 
K10D0272_H0274:87b-9	thams cad dga' bas ni gzungs thob par gyur to	thams_0 cad_6 dga'_10 ba_15 ni_19 gzungs_22 'thob_29 ba_34 gyur_38 to_43 
K10D0272_H0274:87b-10	// byang chub sems dpa' bye ba phrag brgyad cu	byang_3 chub_9 sems_14 dpa'_19 'bye_24 ba_28 phrag_31 brgyad_37 cu_44 
K10D0272_H0274:87b-11	ni phyir mi ldog pa la gnas pas gnas par	ni_0 phyir_3 mi_9 ldog_12 ba_17 la_20 gnas_23 ba_28 gnas_32 ba_37 
K10D0272_H0274:87b-12	// gyur to // lha dang /	gyur_3 to_8 lha_14 dang_18 
K10D0272_H0274:87b-13	mi khri phrag dpag tu med pas ni bla na med pa'i byang chub tu sems bskyed do //	mi_0 khri_3 phrag_8 dpog_14 tu_19 med_22 ba_26 ni_30 bla_33 na_37 med_40 ba_44 byang_49 chub_55 tu_60 sems_63 skyed_68 do_75 
K10D0272_H0274:87b-14	bcom ldan 'das dgyes shing de skad ces bka' stsal nas /	'joms_0 ldan_5 'da'_10 dgyes_15 shing_21 de_27 skad_30 ces_35 bka'_39 stsal_44 nas_50 
K10D0272_H0274:87b-15	byang chub sems dpa' sems dpa' chen po yon tan rin chen me tog rgyas pa dang /	byang_0 chub_6 sems_11 dpa'_16 sems_21 dpa'_26 chen_31 po_36 yon_39 tan_43 rin_47 chen_51 me_56 tog_59 rgya_63 ba_69 dang_72 
K10D0272_H0274:87b-16	byang chub sems dpa' sems dpa' chen po yon tan thams cad dga' ba dang /	byang_0 chub_6 sems_11 dpa'_16 sems_21 dpa'_26 chen_31 po_36 yon_39 tan_43 thams_47 cad_53 dga'_57 ba_62 dang_65 
