K10D0131_H0133:383a-28	pa'i byang chub las phyir mi ldog pa'i chos su	ba_0 byang_5 chub_11 las_16 phyir_20 mi_26 ldog_29 ba_34 chos_39 su_44 
K10D0131_H0133:383a-29	rig par bya'o // de nas bcom ldan 'das kyis	rig_0 ba_4 byed_8 de_17 nas_20 'joms_24 ldan_29 'da'_34 kyis_39 
K10D0131_H0133:383b-0	@383b de'i tshe tshigs su bcad pa 'di dag bka'	de_6 tshe_11 tshigs_16 su_23 gcod_26 ba_31 'di_34 'dag_38 bka'_42 
K10D0131_H0133:383b-1	rig par bya'o // stsal to // phrag dog can dang shes kyi khe 'dod dang //	rig_0 ba_4 byed_8 stsal_17 to_23 phrag_29 dog_35 can_39 dang_43 shes_48 kyi_53 khe_57 'dod_61 dang_66 
K10D0131_H0133:383b-2	gnod pa byed dang 'chos dang zur za dang //	gnod_0 ba_5 byed_8 dang_13 'chos_18 dang_24 zur_29 za_33 dang_36 
K10D0131_H0133:383b-3	smra ba tsam dang dman pa'i tshul can gyis; ;bde gshegs byang chub 'di ni bsrung mi nus //	smra_0 ba_5 tsam_8 dang_13 dman_18 ba_23 tshul_28 can_34 gyis;_38 ;bde_44 gshegs_49 byang_56 chub_62 'di_67 ni_71 bsrung_74 mi_81 nus_84 
K10D0131_H0133:383b-4	bas mthar dga' zhing dgon dben spyod yul ba //	ba_0 mthar_4 dga'_10 zhing_15 dgon_21 dben_26 spyod_31 yul_37 ba_41 
K10D0131_H0133:383b-5	tshig tsam ma yin zab mo bzod pa dang //	tshig_0 tsam_6 ma_11 yin_14 zab_18 mo_22 bzod_25 ba_30 dang_33 
K10D0131_H0133:383b-6	bse lta bu dang shes khe bde bsrings pa //	bse_0 lta_4 bu_8 dang_11 shes_16 khe_21 bde_25 bsrings_29 ba_37 
K10D0131_H0133:383b-7	de ni byang chub 'jig par 'gyur ba srung //	de_0 ni_3 byang_6 chub_12 'jig_17 ba_22 'gyur_26 ba_32 srung_35 
K10D0131_H0133:383b-8	tshogs las bsrings shing rab tu zhi la mos //	tshogs_0 las_7 bsrings_11 shing_19 rab_25 tu_29 zhi_32 la_36 mos_39 
K10D0131_H0133:383b-9	ri dvags lta bur 'jigs shing gnas med rgyu //	ri_0 dvags_3 lta_9 bur_13 'jigs_17 shing_23 gnas_29 med_34 rgyu_38 
K10D0131_H0133:383b-10	nam mkha' rlung bzhin rnyed la mi chags pa //	nam_0 mkha'_4 rlung_10 bzhin_16 rnyed_22 la_28 mi_31 chags_34 ba_40 
K10D0131_H0133:383b-11	de 'dra de ni rgyal ba'i chos 'dzin yin //	de_0 'dra_3 de_8 ni_11 rgyal_14 ba_20 chos_25 'dzin_30 yin_36 
K10D0131_H0133:383b-12	lus la mi lta srog don mi gnyer na //	lus_0 la_4 mi_7 lta_10 srog_14 don_19 mi_23 gnyer_26 na_32 
K10D0131_H0133:383b-13	shes kyi khe 'dod par lta ga la 'gyur //	shes_0 kyi_5 khe_9 'dod_13 ba_18 lta_22 ga_26 la_29 'gyur_32 
K10D0131_H0133:383b-14	brtson brtsams bdag gi ma yin ci yang min //	brtson_0 brtsams_7 bdag_15 gi_20 ma_23 yin_26 ci_30 yang_33 min_38 
K10D0131_H0133:383b-15	de ni ma 'ongs dus na byang chub snod //	de_0 ni_3 ma_6 'ongs_9 dus_15 na_19 byang_22 chub_28 snod_33 
K10D0131_H0133:383b-16	phyi ma'i dus na sems can 'byung ba ni //	phyi_0 ma_5 dus_10 na_14 sems_17 can_22 'byung_26 ba_33 ni_36 
K10D0131_H0133:383b-17	bdag cag byang chub la ni spyod ces 'dzer //	bdag_0 cag_5 byang_9 chub_15 la_20 ni_23 spyod_26 ces_32 'dzer_36 
K10D0131_H0133:383b-18	de dag sems rgod tshul 'chos nyon mongs bcas //	de_0 'dag_3 sems_7 rgod_12 tshul_17 'chos_23 nyon_29 mongs_34 'cha'_40 
K10D0131_H0133:383b-19	de dag rnams kyis chos 'di bsrung mi nus //	de_0 'dag_3 rnams_7 kyis_13 chos_18 'di_23 bsrung_27 mi_34 nus_37 
K10D0131_H0133:383b-20	'dren pa mar me mdzad kyi pha rol gyi //	bgrang_0 ba_6 mar_9 me_13 mdzad_16 kyi_22 pha_26 rol_30 gyi_34 
K10D0131_H0133:383b-21	bskal pa dag ni stong phrag bye ba na //	bskal_0 ba_6 'dag_9 ni_13 stong_16 phrag_22 'bye_28 ba_32 na_35 
K10D0131_H0133:383b-22	sangs rgyas zla ba'i tog ces bya ba byung //	sangs_0 rgya_6 zla_12 ba_16 tog_21 ces_25 byed_29 ba_33 'byung_36 
K10D0131_H0133:383b-23	'gro ba rnams la ting 'dzin 'di bshad dran //	'gro_0 ba_5 rnams_8 la_14 ting_17 'dzin_22 'di_28 'chad_32 dran_38 
K10D0131_H0133:383b-24	rgyal ba de yi 'dus pa dang po ni //	rgyal_0 ba_6 de_9 yi_12 'du_15 ba_20 dang_23 po_28 ni_31 
K10D0131_H0133:383b-25	phyir mi ldog pa khrag khrig brgyad cu ste //	phyir_0 mi_6 ldog_9 ba_14 khrag_17 khrig_23 brgyad_29 cu_36 ste_39 
K10D0131_H0133:384a-0	'dus pa gnyis pa khrag @384a *//	'du_0 ba_5 gnyis_8 ba_14 khrag_17 
K10D0131_H0133:384a-1	khrig bdun cu yin //	khrig_0 bdun_6 cu_11 yin_14 
K10D0131_H0133:384a-2	'dus pa gsum pa bdun cu rtsa gsum mo //	'du_0 ba_5 gsum_8 ba_13 bdun_16 cu_21 rtsa_24 gsum_29 mo_34 
K10D0131_H0133:384a-3	rgyal ba'i tshe ni bskal pa bye ba mang //	rgyal_0 ba_6 tshe_11 ni_16 bskal_19 ba_25 'bye_28 ba_32 mang_35 
K10D0131_H0133:384a-4	'od kyang dpag tshang drug cu rtsa gsum pa; ;dge 'dun bye ba dgu bcu rtsa dgu ste //	'od_0 kyang_4 dpog_10 tshang_15 drug_22 cu_27 rtsa_30 gsum_35 pa;_40 ;dge_44 'dun_49 'bye_54 ba_58 dgu_61 'chu_65 rtsa_69 dgu_74 ste_78 
K10D0131_H0133:384a-5	thams cad dgra bcom dbang ldan gyur pa'o //	thams_0 cad_6 dgra_10 'joms_15 dbang_20 ldan_26 gyur_31 ba_36 
K10D0131_H0133:384a-6	de yi tshe na rgyal po byung ba ni //	de_0 yi_3 tshe_6 na_11 rgyal_14 po_20 'byung_23 ba_29 ni_32 
K10D0131_H0133:384a-7	'khor los bsgyur ba bsod nams 'phags zhes bya //	'khor_0 los_6 sgyur_10 ba_17 bsod_20 nams_25 'phag_30 zhes_37 byed_42 
K10D0131_H0133:384a-8	dzambu'i gling gi tshad du gyur pa ni //	dzambu_0 gling_9 gi_15 tshad_18 du_24 gyur_27 ba_32 ni_35 
K10D0131_H0133:384a-9	mtshungs par dpag tshad stong phrag nyi shu'o //	mtshungs_0 ba_9 dpog_13 tshad_18 stong_24 phrag_30 nyi_36 shu_40 
K10D0131_H0133:384a-10	gling bzhi rnams kyi tshad kyang de bzhin no //	gling_0 bzhi_6 rnams_11 kyi_17 tshad_21 kyang_27 de_33 bzhin_36 no_42 
K10D0131_H0133:384a-11	rgyal po'i sras ni bye ba drug cu tham; ;bu ni stong tham pa ste nyung ma yin //	rgyal_0 po_6 sras_11 ni_16 'bye_19 ba_23 drug_26 cu_31 tham;_34 ;bu_40 ni_44 stong_47 tham_53 ba_58 ste_61 nyung_65 ma_71 yin_74 
K10D0131_H0133:384a-12	rgyal po'i pho brang dga' ba'i 'od ces bya //	rgyal_0 po_6 pho_11 brang_15 dga'_21 ba_26 'od_31 ces_35 byed_39 
K10D0131_H0133:384a-13	grong khyer dag ni bye ba brgyad cur gyur //	grong_0 'khyer_6 'dag_12 ni_16 'bye_19 ba_23 brgyad_26 cur_33 gyur_37 
K10D0131_H0133:384a-14	thams cad skyed mos tshal rgyas mdzes par gnas //	thams_0 cad_6 skyed_10 mos_16 tshal_20 rgya_26 mdzes_32 ba_38 gnas_42 
K10D0131_H0133:384a-15	thams cad lo legs bde zhing dga' ba ste //	thams_0 cad_6 lo_10 legs_13 bde_18 zhing_22 dga'_28 ba_33 ste_36 
K10D0131_H0133:384a-16	sum cu rtsa gsum rnam rgyal khang gnas 'dra //	sum_0 cu_4 rtsa_7 gsum_12 rnam_17 rgyal_22 khang_28 gnas_34 'dra_39 
K10D0131_H0133:384a-17	rgyal pos rmi lam du ni zla ba'i tog /	rgyal_0 pos_6 rmi_10 lam_14 du_18 ni_21 zla_24 ba_28 tog_33 
K10D0131_H0133:384a-18	sangs rgyas byung ngo zhes ni thos gyur nas //	sangs_0 rgya_6 'byung_12 ngo_18 zhes_22 ni_27 thos_30 gyur_35 nas_40 
K10D0131_H0133:384a-19	g-yog 'khor bye ba brgya phrag drug cu dang //	g-yog_0 'khor_6 'bye_12 ba_16 brgya_19 phrag_25 drug_31 cu_36 dang_39 
K10D0131_H0133:384a-20	rgyal ba de yi drung du nyer song nas //	rgyal_0 ba_6 de_9 yi_12 drung_15 du_21 nyer_24 'gro_29 nas_34 
K10D0131_H0133:384a-21	des ni ting 'dzin zab mo rgyal ba'i sku //	des_0 ni_4 ting_7 'dzin_12 zab_18 mo_22 rgyal_25 ba_31 sku_36 
K10D0131_H0133:384a-22	mdo sde bshad pa 'di ni thos nas su //	mdo_0 sde_4 'chad_8 ba_14 'di_17 ni_21 thos_24 nas_29 su_33 
K10D0131_H0133:384a-23	ston pa ji ltar bzhed bzhin spyad gsol zhes //	ston_0 ba_5 ji_8 ltar_11 bzhed_16 bzhin_22 spyod_28 gsol_34 zhes_39 
K10D0131_H0133:384a-24	rgyal srid thams cad sangs rgyas de la phul //	rgyal_0 srid_6 thams_11 cad_17 sangs_21 rgya_27 de_33 la_36 'bul_39 
K10D0131_H0133:384a-25	grong khyer kun tu de bzhin gshegs pa yis //	grong_0 'khyer_6 kun_12 tu_16 de_19 bzhin_22 gshegs_28 ba_35 yis_38 
K10D0131_H0133:384b-0	gtsug lag khang @384b ni tsandan rgyus bsgrubs byas //	gtsug_0 lag_6 khang_10 ni_22 tsandan_25 rgyus_33 sgrub_39 byed_47 
K10D0131_H0133:384b-1	des ni thams cad rtse rgod bcas par phul //	des_0 ni_4 thams_7 cad_13 rtse_17 rgod_22 'cha'_27 ba_32 'bul_36 
K10D0131_H0133:384b-2	'chag pa'i sa ni gser gyi gyim bag g-yogs //	'chag_0 ba_6 sa_11 ni_14 gser_17 gyi_22 gyim_26 bag_31 g-yogs_35 
K10D0131_H0133:384b-3	lo ni stong phrag brgyad cur tshang bar yang //	lo_0 ni_3 stong_6 phrag_12 brgyad_18 cur_25 tshang_29 ba_36 yang_40 
K10D0131_H0133:384b-4	rgyal po las gzhan mi byed mchod pa byed //	rgyal_0 po_6 las_9 gzhan_13 mi_19 byed_22 mchod_27 ba_33 byed_36 
K10D0131_H0133:384b-5	rgyal po nam du'ang rmugs dang gnyid mi bskyed //	rgyal_0 po_6 nam_9 du_13 rmugs_20 dang_26 rnyid_31 mi_37 skyed_40 
K10D0131_H0133:384b-6	'dod la mi 'dun rgyal srid sred ma yin //	'dod_0 la_5 mi_8 'dun_11 rgyal_16 srid_22 sred_27 ma_32 yin_35 
K10D0131_H0133:384b-7	ting nge 'dzin 'di rab tu 'dod pa'i phyir //	ting_0 nge_5 'dzin_9 'di_15 rab_19 tu_23 'dod_26 ba_31 phyir_36 
K10D0131_H0133:384b-8	de bzhin gshegs pa nyi ma re re zhing //	de_0 bzhin_3 gshegs_9 ba_16 nyi_19 ma_23 re_26 re_29 zhing_32 
K10D0131_H0133:384b-9	bkod pa gang dag phul bar gyur pa ni //	bkod_0 ba_5 gang_8 'dag_13 'bul_17 ba_22 gyur_26 ba_31 ni_34 
K10D0131_H0133:384b-10	thams cad tshig gis bshad par mi nus so //	thams_0 cad_6 tshig_10 gis_16 'chad_20 ba_26 mi_30 nus_33 so_37 
K10D0131_H0133:384b-11	lkog tu song nas rtog pa skyed gyur pa //	lkog_0 tu_5 'gro_8 nas_13 rtogs_17 ba_22 skyed_25 gyur_31 ba_36 
K10D0131_H0133:384b-12	ting 'dzin 'di ni mchog tu zab pa ste //	ting_0 'dzin_5 'di_11 ni_15 mchog_18 tu_24 zab_27 ba_31 ste_34 
K10D0131_H0133:384b-13	zang zing 'dzin pas ye shes phyag rgya yi //	zang_0 zing_5 'dzin_10 ba_16 ye_20 shes_23 phyag_28 rgya_34 yi_39 
K10D0131_H0133:384b-14	ting 'dzin 'di ni bsgrub par mi nus snyam //	ting_0 'dzin_5 'di_11 ni_15 sgrub_18 ba_25 mi_29 nus_32 snyam_36 
K10D0131_H0133:384b-15	de ni rab byung rgyal srid thams cad spangs //	de_0 ni_3 rab_6 'byung_10 rgyal_16 srid_22 thams_27 cad_33 spong_37 
K10D0131_H0133:384b-16	sha na ka yi ras gyon bsod snyoms spyod //	sha_0 na_4 ka_7 yi_10 ras_13 gyon_17 bsod_22 snyom_27 spyod_34 
K10D0131_H0133:384b-17	lo ni stong phrag brgyad cu tshang bar yang //	lo_0 ni_3 stong_6 phrag_12 brgyad_18 cu_25 tshang_28 ba_35 yang_39 
K10D0131_H0133:384b-18	gnyid kyis ma non ting nge 'dzin sgom mo //	rnyid_0 kyis_6 ma_11 non_14 ting_18 nge_23 'dzin_27 sgom_33 mo_38 
K10D0131_H0133:384b-19	skabs der sangs rgyas kyis ni ji tsam gang //	skabs_0 der_6 sangs_10 rgya_16 kyis_22 ni_27 ji_30 tsam_33 gang_38 
K10D0131_H0133:384b-20	rab tu bshad pa'i chos rnams des bzung nas //	rab_0 tu_4 'chad_7 ba_13 chos_18 rnams_23 des_29 bzung_33 nas_39 
K10D0131_H0133:384b-21	bde gshegs yongs su mya ngan 'das 'og des //	bde_0 gshegs_4 yongs_11 su_17 mya_20 ngan_24 'da'_29 'og_34 des_38 
K10D0131_H0133:384b-22	mchod rten bye ba drug cu rtsa bzhi byas //	mchod_0 rten_6 'bye_11 ba_15 drug_18 cu_23 rtsa_26 bzhi_31 byed_36 
K10D0131_H0133:384b-23	rin chen bdun gyis spras shing mdzes byas pa'i //	rin_0 chen_4 bdun_9 gyis_14 spras_19 shing_25 mdzes_31 byed_37 ba_42 
K10D0131_H0133:384b-24	gdugs ni lnga brgya kun la rab tu phul //	gdugs_0 ni_6 lnga_9 brgya_14 kun_20 la_24 rab_27 tu_31 'bul_34 
K10D0131_H0133:384b-25	kun la sil snyan khrol ba brgya rnams dang //	kun_0 la_4 sil_7 snyan_11 khrol_17 ba_23 brgya_26 rnams_32 dang_38 
K10D0131_H0133:384b-26	mar me stong phrag brgya yang rab tu phul //	mar_0 me_4 stong_7 phrag_13 brgya_19 yang_25 rab_30 tu_34 'bul_37 
K10D0131_H0133:384b-27	yo byad bsnyungs pa'i tshul la gnas nas su //	yo_0 byad_3 snyung_8 ba_17 tshul_22 la_28 gnas_31 nas_36 su_40 
K10D0131_H0133:385a-0	lo ni @385a *//	lo_0 ni_3 
K10D0131_H0133:385a-1	bye ba stong phrag bdun cu gsum //	'bye_0 ba_4 stong_7 phrag_13 bdun_19 cu_24 gsum_27 
K10D0131_H0133:385a-2	zang zing med pa'i sems kyis gnas nas ni //	zang_0 zing_5 med_10 ba_14 sems_19 kyis_24 gnas_29 nas_34 ni_38 
K10D0131_H0133:385a-3	ting nge 'dzin 'di 'khor la rab tu bshad //	ting_0 nge_5 'dzin_9 'di_15 'khor_19 la_25 rab_28 tu_32 'chad_35 
K10D0131_H0133:385a-4	legs zhes bya ba'ang 'dod pa ma yin na //	legs_0 zhes_5 byed_10 ba_14 'dod_21 ba_26 ma_29 yin_32 na_36 
K10D0131_H0133:385a-5	shes kyi khe 'dod par lta ga la 'gyur //	shes_0 kyi_5 khe_9 'dod_13 ba_18 lta_22 ga_26 la_29 'gyur_32 
K10D0131_H0133:385a-6	de'i tshe chos bsrung ba yi bsam pa yis //	de_0 tshe_5 chos_10 bsrung_15 ba_22 yi_25 bsam_28 ba_33 yis_36 
K10D0131_H0133:385a-7	mgron du bos pa thams cad rnam par spangs //	mgron_0 du_6 'bod_9 ba_13 thams_16 cad_22 rnam_26 ba_31 spong_35 
K10D0131_H0133:385a-8	de bzhin gshegs pa bye ba brgyad cu dang //	de_0 bzhin_3 gshegs_9 ba_16 'bye_19 ba_23 brgyad_26 cu_33 dang_36 
K10D0131_H0133:385a-9	khrag khrig bdun cu des ni mnyes par byas //	khrag_0 khrig_6 bdun_12 cu_17 des_20 ni_24 mnyes_27 ba_33 byed_37 
K10D0131_H0133:385a-10	de dag kun la de 'dra'i bkod pa byas //	de_0 'dag_3 kun_7 la_11 de_14 'dra_17 bkod_24 ba_29 byed_32 
K10D0131_H0133:385a-11	thams cad las kyang ting 'dzin 'di thob bo //	thams_0 cad_6 las_10 kyang_14 ting_20 'dzin_25 'di_31 'thob_35 'bo_40 
K10D0131_H0133:385a-12	gang dag byang chub 'di ni bsrung 'dod pa //	gang_0 'dag_5 byang_9 chub_15 'di_20 ni_24 bsrung_27 'dod_34 ba_39 
K10D0131_H0133:385a-13	de dag 'dod pa med cing mos pa dang //	de_0 'dag_3 'dod_7 ba_12 med_15 cing_19 mos_24 ba_28 dang_31 
K10D0131_H0133:385a-14	g-yo med lhag pa'i bsam pas sgom pa yis //	g-yo_0 med_5 lhag_9 ba_14 bsam_19 ba_24 sgom_28 ba_33 yis_36 
K10D0131_H0133:385a-15	rgyal po de 'dra bar ni bslab par gyis //	rgyal_0 po_6 de_9 'dra_12 ba_17 ni_21 bslab_24 ba_30 gyis_34 
K10D0131_H0133:385a-16	chos 'dod ma yin rnyed pa don gnyer la //	chos_0 'dod_5 ma_10 yin_13 rnyed_17 ba_23 don_26 gnyer_30 la_36 
K10D0131_H0133:385a-17	bsdams pa min dag byang chub slob bo zhes //	sdom_0 ba_7 min_10 'dag_14 byang_18 chub_24 slob_29 'bo_34 zhes_37 
K10D0131_H0133:385a-18	smra 'gyur kha cig phyi ma'i dus 'byung ste //	smra_0 'gyur_5 kha_11 cig_15 phyi_19 ma_24 dus_29 'byung_33 ste_40 
K10D0131_H0133:385a-19	smra la dga' zhing thams cad stong zhes smra //	smra_0 la_5 dga'_8 zhing_13 thams_19 cad_25 stong_29 zhes_35 smra_40 
K10D0131_H0133:385a-20	stong nyid ji bzhin stong pa mi shes te //	stong_0 nyid_6 ji_11 bzhin_14 stong_20 ba_26 mi_29 shes_32 te_37 
K10D0131_H0133:385a-21	'tsho chags tha bar bcas shing nyon mongs bcas //	'tsho_0 chags_6 tha_12 ba_16 'cha'_20 shing_25 nyon_31 mongs_36 'cha'_42 
K10D0131_H0133:385a-22	tshig gis 'di dag stong nyid 'dzin 'jug cing //	tshig_0 gis_6 'di_10 'dag_14 stong_18 nyid_24 'dzin_29 'jug_35 cing_40 
K10D0131_H0133:385a-23	bdag ni byang chub the tshom med ces smra //	bdag_0 ni_5 byang_8 chub_14 the_19 tshom_23 med_29 ces_33 smra_37 
K10D0131_H0133:385a-24	de tshe rgyal mchog tshe ni dpag med gyur //	de_0 tshe_3 rgyal_8 mchog_14 tshe_20 ni_25 dpog_28 med_33 gyur_37 
K10D0131_H0133:385a-25	bu stong dag ni bskal pa bzang 'di pa //	bu_0 stong_3 'dag_9 ni_13 bskal_16 ba_22 bzang_25 'di_31 ba_35 
K10D0131_H0133:385a-26	mdun na 'dug pa'i 'khor rnams ji snyed pa //	mdun_0 na_5 'dug_8 ba_13 'khor_18 rnams_24 ji_30 snyed_33 ba_39 
K10D0131_H0133:385b-0	de dag thams cad de tshe rab @385b tu byung //	de_0 'dag_3 thams_7 cad_13 de_17 tshe_20 rab_25 tu_35 'byung_38 
K10D0131_H0133:385b-1	rgyal ba bye ba khrag khrig rnams dran te //	rgyal_0 ba_6 'bye_9 ba_13 khrag_16 khrig_22 rnams_28 dran_34 te_39 
K10D0131_H0133:385b-2	de las rab tu byung ste de dag gis //	de_0 las_3 rab_7 tu_11 'byung_14 ste_20 de_24 'dag_27 gis_31 
K10D0131_H0133:385b-3	gang ci bshad pa ngas kun sgra tsam bshad //	gang_0 ci_5 'chad_8 ba_14 ngas_17 kun_22 sgra_26 tsam_31 'chad_36 
K10D0131_H0133:385b-4	ngas ni gnas pas stong pa nyid kyang bsgoms //	ngas_0 ni_5 gnas_8 ba_13 stong_17 ba_23 nyid_26 kyang_31 sgom_37 
K10D0131_H0133:385b-5	da lta'i thabs kyis bskal pa mtha' yas par //	da_0 lta_3 thabs_9 kyis_15 bskal_20 ba_26 mtha'_29 yas_35 ba_39 
K10D0131_H0133:385b-6	ngas ni gnas pas sangs rgyas gang dag mchod //	ngas_0 ni_5 gnas_8 ba_13 sangs_17 rgya_23 gang_29 'dag_34 mchod_38 
K10D0131_H0133:385b-7	nga ni de yi byang chub ma thob kyi //	nga_0 ni_4 de_7 yi_10 byang_13 chub_19 ma_24 'thob_27 kyi_32 
K10D0131_H0133:385b-8	gzhan du 'di la gnas te bsgrubs pas na; ;mar me mdzad pa mthong ma thag tu ni //	gzhan_0 du_6 'di_9 la_13 gnas_16 te_21 sgrub_24 ba_32 na;_36 ;mar_40 me_45 mdzad_48 ba_54 mthong_57 ma_64 thag_67 tu_72 ni_75 
K10D0131_H0133:385b-9	som nyi spangs nas mnyam pa nyid mthong bas //	som_0 nyi_4 spong_8 nas_15 mnyam_19 ba_25 nyid_28 mthong_33 ba_40 
K10D0131_H0133:385b-10	de nas khyod ni sh'akya seng ge yi //	de_0 nas_3 khyod_7 ni_13 sh_16 seng_24 ge_29 yi_32 
K10D0131_H0133:385b-11	sangs rgyas 'gyur zhes 'dren pas bdag lung bstan ////	sangs_0 rgya_6 'gyur_12 zhes_18 bgrang_23 ba_29 bdag_33 lung_38 ston_43 
K10D0131_H0133:385b-12	'phags pa de bzhin gshegs pa'i ye shes kyi phyag	'phag_0 ba_7 de_10 bzhin_13 gshegs_19 ba_26 ye_31 shes_34 kyi_39 phyag_43 
K10D0131_H0133:385b-13	rgya'i ting nge 'dzin ces bya ba theg pa chen	rgya_0 ting_7 nge_12 'dzin_16 ces_22 byed_26 ba_30 theg_33 ba_38 chen_41 
K10D0131_H0133:385b-14	po'i mdo / bam po gnyis pa ste tha ma /	po_0 mdo_5 bam_11 po_15 gnyis_18 ba_24 ste_27 tha_31 ma_35 
K10D0131_H0133:385b-15	de nas rgyal po gzugs can snying po'i btsun mo	de_0 nas_3 rgyal_7 po_13 gzugs_16 can_22 snying_26 po_33 btsun_38 mo_44 
K10D0131_H0133:385b-16	dam pa ma skyes dgra'i ma dpal bzang zhes bya	dam_0 ba_4 ma_7 skye_10 dgra_16 ma_23 dpal_26 bzang_31 zhes_37 byed_42 
K10D0131_H0133:385b-17	ba dang / rgyal po gzugs can snying po'i btsun	ba_0 dang_3 rgyal_10 po_16 gzugs_19 can_25 snying_29 po_36 btsun_41 
K10D0131_H0133:385b-18	mo dam pa bye ba ldan gyi bu mo gser	mo_0 dam_3 ba_7 'bye_10 ba_14 ldan_17 gyi_22 bu_26 mo_29 gser_32 
K10D0131_H0133:385b-19	mchog snang ba zhes bya ba'ang 'khor de nyid du	mchog_0 snang_6 ba_12 zhes_15 byed_20 ba_24 'khor_31 de_37 nyid_40 du_45 
K10D0131_H0133:385b-20	'dus par gyur te 'khod do //	'du_0 ba_5 gyur_9 te_14 'khod_17 do_23 
K10D0131_H0133:385b-21	de nas rgyal po'i btsun mo dpal bzang dang /	de_0 nas_3 rgyal_7 po_13 btsun_18 mo_24 dpal_27 bzang_32 dang_38 
K10D0131_H0133:385b-22	gser mchog snang gnyis stan las langs nas /	gser_0 mchog_5 snang_11 gnyis_17 stan_23 las_28 ldang_32 nas_38 
K10D0131_H0133:385b-23	bcom ldan 'das ga la ba der nye bar song ste phyin pa dang /	'joms_0 ldan_5 'da'_10 ga_15 la_18 ba_21 der_24 nye_28 ba_32 'gro_36 ste_41 phyin_45 ba_51 dang_54 
K10D0131_H0133:385b-24	bla gos phrag pa gcig tu gzar te /	bla_0 gos_4 phrag_8 ba_14 gcig_17 tu_22 gzar_25 te_30 
K10D0131_H0133:385b-25	pus mo g-yas pa'i lhangs la btsugs nas /	pus_0 mo_4 g-yas_7 ba_13 lhangs_18 la_25 btsugs_28 nas_35 
K10D0131_H0133:386a-0	bcom ldan 'das ga la ba de logs @386a *//	'joms_0 ldan_5 'da'_10 ga_15 la_18 ba_21 de_24 logs_27 
K10D0131_H0133:386a-1	su thal mo sbyar ba btud de /	su_0 thal_3 mo_8 sbyor_11 ba_17 'dud_20 de_25 
K10D0131_H0133:386a-2	gus pa dang bcas /	gus_0 ba_4 dang_7 'cha'_12 
K10D0131_H0133:386a-3	zhes dang bcas par so so nas ras bcos ma	zhes_0 dang_5 'cha'_10 ba_15 so_19 so_22 nas_25 ras_29 'chos_33 ma_38 
K10D0131_H0133:386a-4	brgya stong ri ba phrugs res bcom ldan 'das kyi	brgya_0 stong_6 ri_12 ba_15 'phrug_18 res_25 'joms_29 ldan_34 'da'_39 kyi_44 
K10D0131_H0133:386a-5	sku la mngon par gsol to //	sku_0 la_4 mngon_7 ba_13 gsol_17 to_22 
K10D0131_H0133:386a-6	rin po che sna bdun gyi me tog gi skon	rin_0 po_4 che_7 sna_11 bdun_15 gyi_20 me_24 tog_27 gi_31 skon_34 
K10D0131_H0133:386a-7	bu lnga brgyas kyang bcom ldan 'das la mngon par	bu_0 lnga_3 brgyas_8 kyang_15 'joms_21 ldan_26 'da'_31 la_36 mngon_39 ba_45 
K10D0131_H0133:386a-8	gtor nas 'di skad ces gsol to //	'thor_0 nas_5 'di_9 skad_13 ces_18 gsol_22 to_27 
K10D0131_H0133:386a-9	bcom ldan 'das /	'joms_0 ldan_5 'da'_10 
K10D0131_H0133:386a-10	bdag cag gnyis slad ma'i tshe slad ma'i dus lnga	bdag_0 cag_5 gnyis_9 slad_15 ma_20 tshe_25 slad_30 ma_35 dus_40 lnga_44 
K10D0131_H0133:386a-11	brgya tha ma la ting nge 'dzin dkon mchog 'di	brgya_0 tha_6 ma_10 la_13 ting_16 nge_21 'dzin_25 dkon(d)_31 mchog_36 'di_42 
K10D0131_H0133:386a-12	la mos par bgyi /	la_0 mos_3 ba_7 bgyid_11 
K10D0131_H0133:386a-13	yid ches par bgyi /	yid_0 ches_4 ba_9 bgyid_13 
K10D0131_H0133:386a-14	gzung bar bgyi /	gzung_0 ba_6 bgyid_10 
K10D0131_H0133:386a-15	bcang bar bgyi /	'chang_0 ba_6 bgyid_10 
K10D0131_H0133:386a-16	bklag par bgyi /	klog_0 ba_6 bgyid_10 
K10D0131_H0133:386a-17	kun chub par bgyi /	kun_0 chub_4 ba_9 bgyid_13 
K10D0131_H0133:386a-18	gzhan dag la'ang rgya cher yang dag par rab tu bstan par bgyi'o //	gzhan_0 'dag_6 la_10 rgya_17 cher_22 yang_27 'dag_32 ba_36 rab_40 tu_44 ston_47 ba_53 bgyid_57 
K10D0131_H0133:386a-19	chos smra ba mdo sde 'di lta bu 'dzin pa'i	chos_0 smra_5 ba_10 mdo_13 sde_17 'di_21 lta_25 bu_29 'dzin_32 ba_38 
K10D0131_H0133:386a-20	gang zag de dag la'ang bdag cag gis gos dang	gang_0 zag_5 de_9 'dag_12 la_16 bdag_23 cag_28 gis_32 gos_36 dang_40 
K10D0131_H0133:386a-21	/ zas dang /	zas_2 dang_6 
K10D0131_H0133:386a-22	mal cha dang /	mal_0 cha_4 dang_8 
K10D0131_H0133:386a-23	na ba'i gsos sman dang /	na_0 ba_3 gsos_8 sman_13 dang_18 
K10D0131_H0133:386a-24	yo byad rnams kyis bsnyen bkur dang /	yo_0 byad_3 rnams_8 kyis_14 snyen_19 bkur_26 dang_31 
K10D0131_H0133:386a-25	rim gro bgyi bar spro'o //	rim_0 gro_4 bgyid_8 ba_13 spro_17 
K10D0131_H0133:386a-26	sems can rnams kyang bla na med pa yang dag	sems_0 can_5 rnams_9 kyang_15 bla_21 na_25 med_28 ba_32 yang_35 'dag_40 
K10D0131_H0133:386a-27	par rdzogs pa'i byang chub la yongs su smin par	ba_0 rdzogs_4 ba_11 byang_16 chub_22 la_27 yongs_30 su_36 smin_39 ba_44 
K10D0131_H0133:386a-28	bgyi'o // stong pa nyid spangs par mi bgyi'o //	bgyid_0 stong_10 ba_16 nyid_19 spong_24 ba_31 mi_35 bgyid_38 
K10D0131_H0133:386a-29	tshig lhur blangs bar mi bgyi yi /	tshig_0 lhur_6 blangs_11 ba_18 mi_22 bgyid_25 yi_30 
K10D0131_H0133:386a-30	nan tan gyis bsgrub par bgyi'o //	nan_0 tan_4 gyis_8 sgrub_13 ba_20 bgyid_24 
K10D0131_H0133:386a-31	bcom ldan 'das /	'joms_0 ldan_5 'da'_10 
K10D0131_H0133:386a-32	lus dang /	lus_0 dang_4 
K10D0131_H0133:386a-33	srog la'ang blta bar mi bgyi na /	srog_0 la_5 lta_12 ba_17 mi_21 bgyid_24 na_29 
K10D0131_H0133:386a-34	slad rol gyi dngos po rnams la lta smos kyang ci 'tshal /	slad_0 rol_5 gyi_9 dngos_13 po_19 rnams_22 la_28 lta_31 smos_35 kyang_40 ci_46 'tshal_49 
K10D0131_H0133:386a-35	btsun mo dam pa de gnyis 'di lta bur rjes su slob pa na /	btsun_0 mo_6 dam_9 ba_13 de_16 gnyis_19 'di_25 lta_29 bur_33 rjes_37 su_42 slob_45 ba_50 na_53 
K10D0131_H0133:386a-36	rgyal po gzugs can snying po'i btsun mo'i 'khor bud	rgyal_0 po_6 gzugs_9 can_15 snying_19 po_26 btsun_31 mo_37 'khor_42 'bud_48 
K10D0131_H0133:386b-0	@386b med brgya stong stan las langs nas thal mo	med_6 brgya_10 stong_16 stan_22 las_27 ldang_31 nas_37 thal_41 mo_46 
K10D0131_H0133:386b-1	sbyar te / gang dag bla na med pa yang	sbyor_0 te_6 gang_11 'dag_16 bla_20 na_24 med_27 ba_31 yang_34 
K10D0131_H0133:386b-2	dag par rdzogs pa'i byang chub tu yang dag par	'dag_0 ba_4 rdzogs_8 ba_15 byang_20 chub_26 tu_31 yang_34 'dag_39 ba_43 
K10D0131_H0133:386b-3	zhugs pa de dag ni ting nge 'dzin 'di la	'jug_0 ba_6 de_9 'dag_12 ni_16 ting_19 nge_24 'dzin_28 'di_34 la_38 
K10D0131_H0133:386b-4	rjes su yi rang ngo //	rjes_0 su_5 yi_8 rang_11 ngo_16 
K10D0131_H0133:386b-5	rjes su yi rangs nas kyang tshig 'di skad ces smras so //	rjes_0 su_5 yi_8 rangs_11 nas_17 kyang_21 tshig_27 'di_33 skad_37 ces_42 smras_46 so_52 
K10D0131_H0133:386b-6	bcom ldan 'das /	'joms_0 ldan_5 'da'_10 
K10D0131_H0133:386b-7	bdag cag kyang slad ma'i tshe slad ma'i dus lnga	bdag_0 cag_5 kyang_9 slad_15 ma_20 tshe_25 slad_30 ma_35 dus_40 lnga_44 
K10D0131_H0133:386b-8	brgya tha ma la dam pa'i chos yongs su gzung	brgya_0 tha_6 ma_10 la_13 dam_16 ba_20 chos_25 yongs_30 su_36 gzung_39 
K10D0131_H0133:386b-9	bar spro'o // yul ma gangg'a'i dge bsnyen ma yul	ba_0 spro_4 yul_14 ma_18 gangg'i_21 dge_31 snyen_35 ma_42 yul_45 
K10D0131_H0133:386b-10	ma ga dh'a na 'khod pa drug khri las gang	ma_0 ga_3 dh_6 na_11 'khod_14 ba_20 drug_23 khri_28 las_33 gang_37 
K10D0131_H0133:386b-11	dag bla na med pa yang dag par rdzogs pa'i	'dag_0 bla_4 na_8 med_11 ba_15 yang_18 'dag_23 ba_27 rdzogs_31 ba_38 
K10D0131_H0133:386b-12	byang chub tu'ang yang dag par zhugs pa de dag	byang_0 chub_6 tu_11 yang_18 'dag_23 ba_27 'jug_31 ba_37 de_40 'dag_43 
K10D0131_H0133:386b-13	ni ting nge 'dzin 'di la rjes su yi rang	ni_0 ting_3 nge_8 'dzin_12 'di_18 la_22 rjes_25 su_30 yi_33 rang_36 
K10D0131_H0133:386b-14	bar spro'o // ngo // rjes su yi rangs nas	ba_0 spro_4 ngo_14 rjes_21 su_26 yi_29 rangs_32 nas_38 
K10D0131_H0133:386b-15	kyang tshig 'di skad ces slad ma'i tshe slad ma'i	kyang_0 tshig_6 'di_12 skad_16 ces_21 slad_25 ma_30 tshe_35 slad_40 ma_45 
K10D0131_H0133:386b-16	dus lnga brgya tha ma la dam pa'i chos gzung	dus_0 lnga_4 brgya_9 tha_15 ma_19 la_22 dam_25 ba_29 chos_34 gzung_39 
K10D0131_H0133:386b-17	bar spro'o zhes gsol to //	ba_0 spro_4 zhes_11 gsol_16 to_21 
K10D0131_H0133:386b-18	de nas de'i tshe bcom ldan 'das kyis 'dzum pa mdzad do //	de_0 nas_3 de_7 tshe_12 'joms_17 ldan_22 'da'_27 kyis_32 'dzum_37 ba_43 mdzad_46 do_52 
K10D0131_H0133:386b-19	'di ni sangs rgyas bcom ldan 'das rnams kyi chos nyid de /	'di_0 ni_4 sangs_7 rgya_13 'joms_19 ldan_24 'da'_29 rnams_34 kyi_40 chos_44 nyid_49 de_54 
K10D0131_H0133:386b-20	gang gi tshe 'dzum pa mdzad pa de'i tshe /	gang_0 gi_5 tshe_8 'dzum_13 ba_19 mdzad_22 ba_28 de_31 tshe_36 
K10D0131_H0133:386b-21	bcom ldan 'das kyi zhal gyi sgo nas 'od 'phro ba kha dog du ma /	'joms_0 ldan_5 'da'_10 kyi_15 zhal_19 gyi_24 sgo_28 nas_32 'od_36 'phro_40 ba_46 kha_49 dog_53 du_57 ma_60 
K10D0131_H0133:386b-22	kha dog tha dad pa /	kha_0 dog_4 tha_8 dad_12 ba_16 
K10D0131_H0133:386b-23	kha dog brgya stong dang ldan pa 'di lta ste /	kha_0 dog_4 brgya_8 stong_14 dang_20 ldan_25 ba_30 'di_33 lta_37 ste_41 
K10D0131_H0133:386b-24	sngon po dang /	sngon_0 po_6 dang_9 
K10D0131_H0133:386b-25	ser po dang /	ser_0 po_4 dang_7 
K10D0131_H0133:386b-26	dmar po dang /	dmar_0 po_5 dang_8 
K10D0131_H0133:386b-27	dkar po dang /	dkar_0 po_5 dang_8 
K10D0131_H0133:386b-28	le brgan dang /	le_0 brgan_3 dang_9 
K10D0131_H0133:386b-29	shel dang /	shel_0 dang_5 
K10D0131_H0133:386b-30	dngul gyi kha dog lta bu byung ngo //	dngul_0 gyi_6 kha_10 dog_14 lta_18 bu_22 'byung_25 ngo_31 
