K10D0131_H0133:394a-5	gzhan la brnyas so //	gzhan_0 la_6 brnyas_9 so_16 
K10D0131_H0133:394a-6	byams pa /	byams_0 ba_6 
K10D0131_H0133:394a-7	gang dag mthun par gyur nas lan gcig ste /	gang_0 'dag_5 mthun_9 ba_15 gyur_19 nas_24 lan_28 gcig_32 ste_37 
K10D0131_H0133:394a-8	dbyer med pas sngon sangs rgyas brgya la dge ba'i	dbyer_0 med_6 ba_10 sngon_14 sangs_20 rgya_26 brgya_32 la_38 dge_41 ba_45 
K10D0131_H0133:394a-9	rtsa ba bskyed par gyur pa de dag kyang phyi	rtsa_0 ba_5 skyed_8 ba_15 gyur_19 ba_24 de_27 'dag_30 kyang_34 phyi_40 
K10D0131_H0133:394a-10	ma'i tshe phyi ma'i dus na dbye bar 'gyur na	ma_0 tshe_5 phyi_10 ma_15 dus_20 na_24 'byed_27 ba_32 'gyur_36 na_42 
K10D0131_H0133:394a-11	/ de las gzhan pa'i sems can bsam pa ma nges pa /	de_2 las_5 gzhan_9 ba_15 sems_20 can_25 bsam_29 ba_34 ma_37 nges_40 ba_45 
K10D0131_H0133:394a-12	dge ba'i rtsa ba ma bskyed pa /	dge_0 ba_4 rtsa_9 ba_14 ma_17 skyed_20 ba_27 
K10D0131_H0133:394a-13	blo rgod pa rnams lta smos kyang ci dgos /	blo_0 rgod_4 ba_9 rnams_12 lta_18 smos_22 kyang_27 ci_33 dgos_36 
K10D0131_H0133:394a-14	byams pa /	byams_0 ba_6 
K10D0131_H0133:394a-15	de ltar phyis 'jig rten mi bzad pa dag 'byung bar 'gyur ro //	de_0 ltar_3 'byid_8 'jig_14 rten_19 mi_24 bzad_27 ba_32 'dag_35 'byung_39 ba_46 'gyur_50 ro_56 
K10D0131_H0133:394a-16	byams pa /	byams_0 ba_6 
K10D0131_H0133:394a-17	de lta bas na byang chub sems dpa' khyod kyis	de_0 lta_3 ba_7 na_11 byang_14 chub_20 sems_25 dpa'_30 khyod_35 kyis_41 
K10D0131_H0133:394a-18	go cha chen po sra ba shin tu bgo bar	go_0 cha_3 chen_7 po_12 sra_15 ba_19 shin_22 tu_27 bgod_30 ba_34 
K10D0131_H0133:394a-19	bya / lhag pa'i bsam pas bsgrub pa dang /	byed_0 lhag_6 ba_11 bsam_16 ba_21 sgrub_25 ba_32 dang_35 
K10D0131_H0133:394a-20	bzod pa'i stobs dang ldan par bya /	bzod_0 ba_5 stobs_10 dang_16 ldan_21 ba_26 byed_30 
K10D0131_H0133:394a-21	chos zab mo la 'jug pa'i ye shes la mkhas par bya /	chos_0 zab_5 mo_9 la_12 'jug_15 ba_20 ye_25 shes_28 la_33 mkhas_36 ba_42 byed_46 
K10D0131_H0133:394a-22	dmigs pa med pa'i lta ba can du 'gyur bar bya /	dmigs_0 ba_6 med_9 ba_13 lta_18 ba_22 can_25 du_29 'gyur_32 ba_38 byed_42 
K10D0131_H0133:394a-23	sems brtan par bya /	sems_0 brtan_5 ba_11 byed_15 
K10D0131_H0133:394a-24	brtson 'grus brtan par bya /	brtson_0 'grus_7 brtan_13 ba_19 byed_23 
K10D0131_H0133:394a-25	rtul ba brtan pa dang /	rtul_0 ba_5 brtan_8 ba_14 dang_17 
K10D0131_H0133:394a-26	sbyor ba brtan par bya /	sbyor_0 ba_6 brtan_9 ba_15 byed_19 
K10D0131_H0133:394a-27	phyi ma'i tshe phyi ma'i dus na dam pa'i chos yongs su blang ba dang /	phyi_0 ma_5 tshe_10 phyi_15 ma_20 dus_25 na_29 dam_32 ba_36 chos_41 yongs_46 su_52 blang_55 ba_61 dang_64 
K10D0131_H0133:394a-28	dam pa'i chos gzung ba dang /	dam_0 ba_4 chos_9 gzung_14 ba_20 dang_23 
K10D0131_H0133:394a-29	dam pa'i chos kun tu bsrung ba dang /	dam_0 ba_4 chos_9 kun_14 tu_18 bsrung_21 ba_28 dang_31 
K10D0131_H0133:394a-30	dam pa'i chos ring du gnas par bya ba la spro bar bya /	dam_0 ba_4 chos_9 ring_14 du_19 gnas_22 ba_27 byed_31 ba_35 la_38 spro_41 ba_46 byed_50 
K10D0131_H0133:394b-0	brtson 'grus brtsam @394b par bya /	brtson_0 'grus_7 brtsam_13 ba_26 byed_30 
K10D0131_H0133:394b-1	brtson par bya /	brtson_0 ba_7 byed_11 
K10D0131_H0133:394b-2	gzhan yang gzud par bya'o //	gzhan_0 yang_6 gzud_11 ba_16 byed_20 
K10D0131_H0133:394b-3	de nas mchog tu dga' ba'i rgyal po dang /	de_0 nas_3 mchog_7 tu_13 dga'_16 ba_21 rgyal_26 po_32 dang_35 
K10D0131_H0133:394b-4	'jam dpal la sogs pa sems dpa' dpe med pa drug cu dang /	'jam_0 dpal_5 la_10 sogs_13 ba_18 sems_21 dpa'_26 dpe_31 med_35 ba_39 drug_42 cu_47 dang_50 
K10D0131_H0133:394b-5	byams pa dang /	byams_0 ba_6 dang_9 
K10D0131_H0133:394b-6	seng ge rab snang la sogs pa bskal pa bzang	seng_0 ge_5 rab_8 snang_12 la_18 sogs_21 ba_26 bskal_29 ba_35 bzang_38 
K10D0131_H0133:394b-7	po'i byang chub sems dpa' sems dpa' chen po rnams	po_0 byang_5 chub_11 sems_16 dpa'_21 sems_26 dpa'_31 chen_36 po_41 rnams_44 
K10D0131_H0133:394b-8	kyis bcom ldan 'das kyis dam pa'i chos yongs su	kyis_0 'joms_5 ldan_10 'da'_15 kyis_20 dam_25 ba_29 chos_34 yongs_39 su_45 
K10D0131_H0133:394b-9	gzung ba bstan pa 'di thos nas /	gzung_0 ba_6 ston_9 ba_15 'di_18 thos_22 nas_27 
K10D0131_H0133:394b-10	phyi ma'i tshe phyi ma'i dus de na dam pa'i chos yongs su gzung bar spro bar 'gyur te /	phyi_0 ma_5 tshe_10 phyi_15 ma_20 dus_25 de_29 na_32 dam_35 ba_39 chos_44 yongs_49 su_55 gzung_58 ba_64 spro_68 ba_73 'gyur_77 te_83 
K10D0131_H0133:394b-11	de dag gis bcom ldan 'das la 'di skad ces gsol to //	de_0 'dag_3 gis_7 'joms_11 ldan_16 'da'_21 la_26 'di_29 skad_33 ces_38 gsol_42 to_47 
K10D0131_H0133:394b-12	bcom ldan 'das /	'joms_0 ldan_5 'da'_10 
K10D0131_H0133:394b-13	bdag cag lhan cig tu mthun par g-yo dang /	bdag_0 cag_5 lhan_9 cig_14 tu_18 mthun_21 ba_27 g-yo_31 dang_36 
K10D0131_H0133:394b-14	sgyu thams cad spangs shing /	sgyu_0 thams_5 cad_11 spong_15 shing_22 
K10D0131_H0133:394b-15	nga rgyal dang /	nga_0 rgyal_4 dang_10 
K10D0131_H0133:394b-16	rgyags pa dang /	rgyags_0 ba_7 dang_10 
K10D0131_H0133:394b-17	dregs pa thams cad spangs la dga' ba dang /	dregs_0 ba_6 thams_9 cad_15 spong_19 la_26 dga'_29 ba_34 dang_37 
K10D0131_H0133:394b-18	mi dga' ba dang /	mi_0 dga'_3 ba_8 dang_11 
K10D0131_H0133:394b-19	srid pa thams cad bsal te /	srid_0 ba_5 thams_8 cad_14 bsal_18 te_23 
K10D0131_H0133:394b-20	zab mo mi dmigs pa la mos shing de bzhin	zab_0 mo_4 mi_7 dmigs_10 ba_16 la_19 mos_22 shing_26 de_32 bzhin_35 
K10D0131_H0133:394b-21	gshegs pa'i sangs rgyas kyi byang chub bskal pa grangs	gshegs_0 ba_7 sangs_12 rgya_18 kyi_24 byang_28 chub_34 bskal_39 ba_45 grangs_48 
K10D0131_H0133:394b-22	ma mchis pa bye ba khrag khrig brgya stong du	ma_0 mchis_3 ba_9 'bye_12 ba_16 khrag_19 khrig_25 brgya_31 stong_37 du_43 
K10D0131_H0133:394b-23	bsgrubs pa 'di kun tu bsrung bar bgyi /	sgrub_0 ba_8 'di_11 kun_15 tu_19 bsrung_22 ba_29 bgyid_33 
K10D0131_H0133:394b-24	gzung bar bgyi /	gzung_0 ba_6 bgyid_10 
K10D0131_H0133:394b-25	yongs su gzung bar bgyi /	yongs_0 su_6 gzung_9 ba_15 bgyid_19 
K10D0131_H0133:394b-26	gzhan dag la'ang rgya cher yang dag par rab tu bstan par bgyi zhing /	gzhan_0 'dag_6 la_10 rgya_17 cher_22 yang_27 'dag_32 ba_36 rab_40 tu_44 ston_47 ba_53 bgyid_57 zhing_62 
K10D0131_H0133:394b-27	bdag cag lus dang srog la mi blta bar sangs	bdag_0 cag_5 lus_9 dang_13 srog_18 la_23 mi_26 lta_29 ba_34 sangs_38 
K10D0131_H0133:394b-28	rgyas kyi byang chub 'di kun tu bsrung bar bgyi'o	rgya_0 kyi_6 byang_10 chub_16 'di_21 kun_25 tu_29 bsrung_32 ba_39 bgyid_43 
K10D0131_H0133:394b-29	// de nas bcom ldan 'das kyis mchog tu dga' ba'i rgyal po dang /	de_3 nas_6 'joms_10 ldan_15 'da'_20 kyis_25 mchog_30 tu_36 dga'_39 ba_44 rgyal_49 po_55 dang_58 
K10D0131_H0133:395a-0	'jam dpal la @395a *//	'jam_0 dpal_5 la_10 
K10D0131_H0133:395a-1	sogs pa sems dpa' dpe med pa drug cu dang /	sogs_0 ba_5 sems_8 dpa'_13 dpe_18 med_22 ba_26 drug_29 cu_34 dang_37 
K10D0131_H0133:395a-2	byams pa dang /	byams_0 ba_6 dang_9 
K10D0131_H0133:395a-3	seng ger bsnang la sogs pa bskal pa bzang po'i	seng_0 ger_5 bsnang_9 la_16 sogs_19 ba_24 bskal_27 ba_33 bzang_36 po_42 
K10D0131_H0133:395a-4	byang chub sems dpa' sems dpa' chen po de dag	byang_0 chub_6 sems_11 dpa'_16 sems_21 dpa'_26 chen_31 po_36 de_39 'dag_42 
K10D0131_H0133:395a-5	la rjes su bstan pa'i phyir chigs su bcad pa	la_0 rjes_3 su_8 ston_11 ba_17 phyir_22 chigs_28 su_34 gcod_37 ba_42 
K10D0131_H0133:395a-6	'di dag bka' stsal to //	'di_0 'dag_4 bka'_8 stsal_13 to_19 
K10D0131_H0133:395a-7	g-yo med sgyu med nga med tha ba med //	g-yo_0 med_5 sgyu_9 med_14 nga_18 med_22 tha_26 ba_30 med_33 
K10D0131_H0133:395a-8	dran ldan blo gros ldan zhing gnas med gnas //	dran_0 ldan_5 blo_10 gros_14 ldan_19 zhing_24 gnas_30 med_35 gnas_39 
K10D0131_H0133:395a-9	zab mo bzod la mi g-yeng legs gnas te //	zab_0 mo_4 bzod_7 la_12 mi_15 g-yeng_18 legs_25 gnas_30 te_35 
K10D0131_H0133:395a-10	stobs bcu nor 'di rab tu bsrung bar gyis //	stobs_0 'chu_6 nor_10 'di_14 rab_18 tu_22 bsrung_25 ba_32 gyis_36 
K10D0131_H0133:395a-11	sgyu med gcam med 'dod med nga med dang //	sgyu_0 med_5 gcam_9 med_14 'dod_18 med_23 nga_27 med_31 dang_35 
K10D0131_H0133:395a-12	gzung med dga' dang rnam par 'dzin bral dang //	gzung_0 med_6 dga'_10 dang_15 rnam_20 ba_25 'dzin_29 'bral_35 dang_40 
K10D0131_H0133:395a-13	nam mkha'i lam ltar mnyam nyid rab ldan par //	nam_0 mkha_4 lam_11 ltar_15 mnyam_20 nyid_26 rab_31 ldan_35 ba_40 
K10D0131_H0133:395a-14	de ltar sbyor ba'i ting 'dzin 'di 'thob bo //	de_0 ltar_3 sbyor_8 ba_14 ting_19 'dzin_24 'di_30 'thob_34 'bo_40 
K10D0131_H0133:395a-15	rtag tu byang chub 'dun pa brtan par gyis //	rtag_0 tu_5 byang_8 chub_14 'dun_19 ba_24 brtan_27 ba_33 gyis_37 
K10D0131_H0133:395a-16	zab mo rgyal ba dag gi tshul yang bsgoms //	zab_0 mo_4 rgyal_7 ba_13 'dag_16 gi_20 tshul_23 yang_29 sgom_34 
K10D0131_H0133:395a-17	dga' ba kun la 'dris la mi lta na //	dga'_0 ba_5 kun_8 la_12 'dris_15 la_21 mi_24 lta_27 na_31 
K10D0131_H0133:395a-18	des ni ting 'dzin dkon mchog 'di 'thob bo //	des_0 ni_4 ting_7 'dzin_12 dkon(d)_18 mchog_23 'di_29 'thob_33 'bo_39 
K10D0131_H0133:395a-19	rtag tu dga' dang mi dga' sems snyoms shing //	rtag_0 tu_5 dga'_8 dang_13 mi_18 dga'_21 sems_26 snyom_31 shing_38 
K10D0131_H0133:395a-20	skyes bu mchog la ston pa lta bu yi //	skye_0 bu_6 mchog_9 la_15 ston_18 ba_23 lta_26 bu_30 yi_33 
K10D0131_H0133:395a-21	'du shes skyed cing dga' bya rtag dga' ba //	'du_0 shes_4 skyed_9 cing_15 dga'_20 byed_25 rtag_29 dga'_34 ba_39 
K10D0131_H0133:395a-22	des ni myur du ting 'dzin 'di rtogs so //	des_0 ni_4 myur_7 du_12 ting_15 'dzin_20 'di_26 rtogs_30 so_36 
K10D0131_H0133:395a-23	snang ba zad mi shes pa mchog gi gter //	snang_0 ba_6 zad_9 mi_13 shes_16 ba_21 mchog_24 gi_30 gter_33 
K10D0131_H0133:395a-24	spobs pa phyag rgya tshul ni bye nga brgyas //	spobs_0 ba_6 phyag_9 rgya_15 tshul_20 ni_26 'bye_29 nga_33 brgyas_37 
K10D0131_H0133:395a-25	nyi ma'i 'od zer rab rib sel lta bu //	nyi_0 ma_4 'od_9 zer_13 rab_17 rib_21 sel_25 lta_29 bu_33 
K10D0131_H0133:395a-26	ye shes 'jug pa'i tshul ni 'dir brjod do //	ye_0 shes_3 'jug_8 ba_13 tshul_18 ni_24 'dir_27 rjod_32 do_38 
K10D0131_H0133:395b-0	nyi ma zla @395b ba dang ni skar ma dang //	nyi_0 ma_4 zla_7 ba_17 dang_20 ni_25 skar_28 ma_33 dang_36 
K10D0131_H0133:395b-1	ji ltar sa dang gangs kyi ri bo dang //	ji_0 ltar_3 sa_8 dang_11 gangs_16 kyi_22 ri_26 'bo_29 dang_32 
K10D0131_H0133:395b-2	gling bzhi'i bdag po brgya byin tshangs pa dang //	gling_0 bzhi_6 bdag_13 po_18 brgya_21 byin_27 tshangs_32 ba_40 dang_43 
K10D0131_H0133:395b-3	sman pa lta bu'i mdo sde 'di zungs shig /	sman_0 ba_5 lta_8 bu_12 mdo_17 sde_21 'di_25 zungs_29 shig_35 
K10D0131_H0133:395b-4	'di ni sems dag 'di ni las zad byed //	'di_0 ni_4 sems_7 'dag_12 'di_16 ni_20 las_23 zad_27 byed_31 
K10D0131_H0133:395b-5	'di ni bdud rtsi 'di ni 'dud bdul ba //	'di_0 ni_4 bdud_7 rtsi_12 'di_17 ni_21 'dud_24 bdul_29 ba_34 
K10D0131_H0133:395b-6	'di ni pha rol sems spyod rdzu 'phrul mig /	'di_0 ni_4 pha_7 rol_11 sems_15 spyod_20 rdzu_26 'phrul_31 mig_38 
K10D0131_H0133:395b-7	'di ni sems can thams cad rtogs byed sgra //	'di_0 ni_4 sems_7 can_12 thams_16 cad_22 rtogs_26 byed_32 sgra_37 
K10D0131_H0133:395b-8	'di ni bskal pa khrag khrig dran par byed //	'di_0 ni_4 bskal_7 ba_13 khrag_16 khrig_22 dran_28 ba_33 byed_37 
K10D0131_H0133:395b-9	'di ni dri ba thams cad ma lus zad //	'di_0 ni_4 'dri_7 ba_11 thams_14 cad_20 ma_24 lus_27 zad_31 
K10D0131_H0133:395b-10	sangs rgyas phyag rgya 'di ni bde gshegs bstod //	sangs_0 rgya_6 phyag_12 rgya_18 'di_23 ni_27 bde_30 gshegs_34 bstod_41 
K10D0131_H0133:395b-11	'di dang ldan pa'i lag tu byang chub gnas //	'di_0 dang_4 ldan_9 ba_14 lag_19 tu_23 byang_26 chub_32 gnas_37 
K10D0131_H0133:395b-12	ji ltar stong nyid rang bzhin 'dir gnas pa //	ji_0 ltar_3 stong_8 nyid_14 rang_19 bzhin_24 'dir_30 gnas_35 ba_40 
K10D0131_H0133:395b-13	de ltar de yis stong nyid 'di rtogs te //	de_0 ltar_3 de_8 yis_11 stong_15 nyid_21 'di_26 rtogs_30 te_36 
K10D0131_H0133:395b-14	rtog dang rnam par rtog pa'i spros pa 'di //	rtogs_0 dang_5 rnam_10 ba_15 rtogs_19 ba_24 spros_29 ba_35 'di_38 
K10D0131_H0133:395b-15	gnyi ga yongs su spangs na chos 'dzin yin; ;nga ni mya ngan 'das phyi la la zhig /	gnyi_0 ga_5 yongs_8 su_14 spong_17 na_24 chos_27 'dzin_32 yin;_38 ;nga_43 ni_48 mya_51 ngan_55 'da'_60 phyi_65 la_70 la_73 'jig_76 
K10D0131_H0133:395b-16	chos 'di rmi lam lta bur blta zhes 'dzer //	chos_0 'di_5 rmi_9 lam_13 lta_17 bur_21 lta_25 zhes_30 'dzer_35 
K10D0131_H0133:395b-17	gang chos ma byung sus kyang byas ma yin //	gang_0 chos_5 ma_10 'byung_13 sus_19 kyang_23 byed_29 ma_34 yin_37 
K10D0131_H0133:395b-18	rang gi shes pas de dag de la rtog /	rang_0 gi_5 shes_8 ba_13 de_17 'dag_20 de_24 la_27 rtogs_30 
K10D0131_H0133:395b-19	stong nyid ma skyes sus kyang byas ma yin //	stong_0 nyid_6 ma_11 skye_14 sus_20 kyang_24 byed_30 ma_35 yin_38 
K10D0131_H0133:395b-20	ma mthong 'ongs pa ma yin 'pho min na //	ma_0 mthong_3 'ongs_10 ba_16 ma_19 yin_22 'pho_26 min_31 na_35 
K10D0131_H0133:395b-21	dmigs gnas bdag cag stong nyid legs bslabs zhes //	dmigs_0 gnas_6 bdag_11 cag_16 stong_20 nyid_26 legs_31 bslabs_36 zhes_43 
K10D0131_H0133:395b-22	'dzer ba de dag chos kyi rkun po yin //	'dzer_0 ba_6 de_9 'dag_12 chos_16 kyi_21 rkun_25 po_30 yin_33 
K10D0131_H0133:395b-23	gang dag las ni chos 'di thos nas su //	gang_0 'dag_5 las_9 ni_13 chos_16 'di_21 thos_25 nas_30 su_34 
K10D0131_H0133:395b-24	mchi ma 'byung zhing ba spu rab g-yos nas //	mchi_0 ma_5 'byung_8 zhing_15 ba_21 spu_24 rab_28 g-yos_32 nas_38 
K10D0131_H0133:395b-25	de ni byang chub phyir mi ldog ces 'dzer //	de_0 ni_3 byang_6 chub_12 phyir_17 mi_23 ldog_26 ces_31 'dzer_35 
K10D0131_H0133:396a-0	phyi nas bsngags pa ma yin brgya @396a *//	phyi_0 nas_5 bsngags_9 ba_17 ma_20 yin_23 brgya_27 
K10D0131_H0133:396a-1	dag smra //	'dag_0 smra_4 
K10D0131_H0133:396a-2	ma rangs khyim du nor mang zad nas ni //	ma_0 rangs_3 khyim_9 du_15 nor_18 mang_22 zad_27 nas_31 ni_35 
K10D0131_H0133:396a-3	bde ba'i ched du de dag rab 'byung ste //	bde_0 ba_4 ched_9 du_14 de_17 'dag_20 rab_24 'byung_28 ste_35 
K10D0131_H0133:396a-4	bstan pa 'di la bde ba kun rnyed nas //	ston_0 ba_6 'di_9 la_13 bde_16 ba_20 kun_23 rnyed_27 nas_33 
K10D0131_H0133:396a-5	nga yi sras rnams la ni spang bar byed //	nga_0 yi_4 sras_7 rnams_12 la_18 ni_21 spong_24 ba_30 byed_34 
K10D0131_H0133:396a-6	byang chub don gnyer kha cig 'dir rab 'byung //	byang_0 chub_6 don_11 gnyer_15 kha_21 cig_25 'dir_29 rab_34 'byung_38 
K10D0131_H0133:396a-7	byang chub smra ste byang chub gnas ma yin //	byang_0 chub_6 smra_11 ste_16 byang_20 chub_26 gnas_31 ma_36 yin_39 
K10D0131_H0133:396a-8	rgya mtsho chu mtha' phyi mtha' ring ba ltar //	rgya_0 mtsho_5 chu_11 mtha'_15 phyi_21 mtha'_26 ring_32 ba_37 ltar_40 
K10D0131_H0133:396a-9	'dir yang ma bsdams byang chub de bzhin no //	'dir_0 yang_5 ma_10 sdom_13 byang_20 chub_26 de_31 bzhin_34 no_40 
K10D0131_H0133:396a-10	rnyed dang mdza' bo'i khyim la bsten pa'i phyir //	rnyed_0 dang_6 mdza'_11 'bo_17 khyim_22 la_28 sten_31 ba_37 phyir_42 
K10D0131_H0133:396a-11	bdag cag yang dag rab tu byung ba ste //	bdag_0 cag_5 yang_9 'dag_14 rab_18 tu_22 'byung_25 ba_31 ste_34 
K10D0131_H0133:396a-12	spyod lam dang ni dgon pas rnam dag cing //	spyod_0 lam_6 dang_10 ni_15 dgon_18 ba_23 rnam_27 'dag_32 cing_36 
K10D0131_H0133:396a-13	mkhan po dang ni mdza' bos dag ces 'dzer //	mkhan_0 po_6 dang_9 ni_14 mdza'_17 'bod_23 'dag_27 ces_31 'dzer_35 
K10D0131_H0133:396a-14	gang dag nga yi bstan 'dir rab byung nas //	gang_0 'dag_5 nga_9 yi_13 ston_16 'dir_22 rab_27 'byung_31 nas_37 
K10D0131_H0133:396a-15	padma chu ltar 'jig rten chos gnas te //	padma_0 chu_6 ltar_10 'jig_15 rten_20 chos_25 gnas_30 te_35 
K10D0131_H0133:396a-16	tshul 'di ji bzhin mdo sde 'dir brtson pa //	tshul_0 'di_6 ji_10 bzhin_13 mdo_19 sde_23 'dir_27 brtson_32 ba_39 
K10D0131_H0133:396a-17	de dag nga yi byang chub yang dag srung //	de_0 'dag_3 nga_7 yi_11 byang_14 chub_20 yang_25 'dag_30 srung_34 
K10D0131_H0133:396a-18	mchog tu dga' ba'i rgyal po khyod bstan gyi //	mchog_0 tu_6 dga'_9 ba_14 rgyal_19 po_25 khyod_28 ston_34 gyi_40 
K10D0131_H0133:396a-19	blo ngan de dag lta bur bslab mi bya //	blo_0 ngan_4 de_9 'dag_12 lta_16 bur_20 bslab_24 mi_30 byed_33 
K10D0131_H0133:396a-20	nan tan gyis ni sangs rgyas yon tan thob //	nan_0 tan_4 gyis_8 ni_13 sangs_16 rgya_22 yon_28 tan_32 'thob_36 
K10D0131_H0133:396a-21	de phyir rtog pa med par rab tu sbyor //	de_0 phyir_3 rtogs_9 ba_14 med_17 ba_21 rab_25 tu_29 sbyor_32 
K10D0131_H0133:396a-22	khrag khrig zhing gi mi rnams ji snyed pas //	khrag_0 khrig_6 zhing_12 gi_18 mi_21 rnams_24 ji_30 snyed_33 ba_39 
K10D0131_H0133:396a-23	gangg'a'i bye snyed blangs nas btab pa dang /	gangg'i_0 'bye_10 snyed_14 blangs_20 nas_27 'debs_31 ba_36 dang_39 
K10D0131_H0133:396a-24	de la bye snyed sa bon ji tsam par //	de_0 la_3 'bye_6 snyed_10 sa_16 bon_19 ji_23 tsam_26 ba_31 
K10D0131_H0133:396a-25	'bras bu re re byung bar gyur pa yi //	'bras_0 bu_6 re_9 re_12 'byung_15 ba_21 gyur_25 ba_30 yi_33 
K10D0131_H0133:396a-26	de lta'i thabs kyis bye ma rgya che ba //	de_0 lta_3 thabs_9 kyis_15 'bye_20 ma_24 rgya_27 che_32 ba_36 
K10D0131_H0133:396a-27	stong 'gyur du ni yongs su bsgyur byas nas //	stong_0 'gyur_6 du_12 ni_15 yongs_18 su_24 sgyur_27 byed_34 nas_39 
K10D0131_H0133:396a-28	ji snyed zhing rnams mtha' yas rab 'das shing //	ji_0 snyed_3 zhing_9 rnams_15 mtha'_21 yas_27 rab_31 'da'_35 shing_40 
K10D0131_H0133:396b-0	gcig ces bya bar mtshan ma @396b bzhag gyur la //	gcig_0 ces_5 byed_9 ba_13 mtshan_17 ma_24 'jog_33 gyur_39 la_44 
K10D0131_H0133:396b-1	de lta'i tshul gyis snga na yod pa yi //	de_0 lta_3 tshul_9 gyis_15 snga_20 na_25 yod_28 ba_32 yi_35 
K10D0131_H0133:396b-2	bye ma dag ni thams cad zad gyur pa //	'bye_0 ma_4 'dag_7 ni_11 thams_14 cad_20 zad_24 gyur_28 ba_33 
K10D0131_H0133:396b-3	de tsam tshad kyi phyogs bcu ji snyed pa //	de_0 tsam_3 tshad_8 kyi_14 phyogs_18 'chu_25 ji_29 snyed_32 ba_38 
K10D0131_H0133:396b-4	zhing rnams rgyal ba rnams kyis yongs gang la; ;sangs rgyas re re'ang de snyed dbur gyur te //	zhing_0 rnams_6 rgyal_12 ba_18 rnams_21 kyis_27 yongs_32 gang_38 la;_43 ;sangs_47 rgya_54 re_60 re_63 de_70 snyed_73 dbur_79 gyur_84 te_89 
K10D0131_H0133:396b-5	dbu kun la yang de snyed ljags gyur la //	dbu_0 kun_4 la_8 yang_11 de_16 snyed_19 ljags_25 gyur_31 la_36 
K10D0131_H0133:396b-6	de dag bskal pa gangg'a'i bye snyed du //	de_0 'dag_3 bskal_7 ba_13 gangg'i_16 'bye_26 snyed_30 du_36 
K10D0131_H0133:396b-7	mdo sde 'dir gnas de yi bsngags brjod kyang; ;ri rab yungs 'bru nam mkha' rtsva tsam dang //	mdo_0 sde_4 'dir_8 gnas_13 de_18 yi_21 bsngags_24 rjod_32 kyang;_38 ;ri_45 rab_49 yungs_53 'bru_59 nam_64 mkha'_68 rtsva_74 tsam_80 dang_85 
K10D0131_H0133:396b-8	rgya mtsho las ni thigs cig blangs pa bzhin //	rgya_0 mtsho_5 las_11 ni_15 thigs_18 cig_24 blangs_28 ba_35 bzhin_38 
K10D0131_H0133:396b-9	de ltar de yi yon tan brjod gyur pa //	de_0 ltar_3 de_8 yi_11 yon_14 tan_18 rjod_22 gyur_28 ba_33 
K10D0131_H0133:396b-10	de phyir rtog med tshul du rab tu sbyor //	de_0 phyir_3 rtogs_9 med_14 tshul_18 du_24 rab_27 tu_31 sbyor_34 
K10D0131_H0133:396b-11	de nas mchog tu dga' ba'i rgyal po dang /	de_0 nas_3 mchog_7 tu_13 dga'_16 ba_21 rgyal_26 po_32 dang_35 
K10D0131_H0133:396b-12	'jam dpal gzhon nur gyur pa la sogs pa sems dpa' dpe med drug cu dang /	'jam_0 dpal_5 gzhon_10 nur_16 gyur_20 ba_25 la_28 sogs_31 ba_36 sems_39 dpa'_44 dpe_49 med_53 drug_57 cu_62 dang_65 
K10D0131_H0133:396b-13	byams pa dang /	byams_0 ba_6 dang_9 
K10D0131_H0133:396b-14	seng ge rab snang la sogs pa bskal pa bzang	seng_0 ge_5 rab_8 snang_12 la_18 sogs_21 ba_26 bskal_29 ba_35 bzang_38 
K10D0131_H0133:396b-15	po'i byang chub sems dpa' sems dpa' chen po de	po_0 byang_5 chub_11 sems_16 dpa'_21 sems_26 dpa'_31 chen_36 po_41 de_44 
K10D0131_H0133:396b-16	dag gis bcom ldan 'das la 'di skad ces gsol	'dag_0 gis_4 'joms_8 ldan_13 'da'_18 la_23 'di_26 skad_30 ces_35 gsol_39 
K10D0131_H0133:396b-17	to // bcom ldan 'das /	to_0 'joms_6 ldan_11 'da'_16 
K10D0131_H0133:396b-18	chos chos zhes bgyi ba'i chos de chos gang gi tshig bla dvags lags /	chos_0 chos_5 zhes_10 bgyid_15 ba_20 chos_25 de_30 chos_33 gang_38 gi_43 tshig_46 bla_52 dvags_56 lags_62 
K10D0131_H0133:396b-19	de skad ces gsol pa dang /	de_0 skad_3 ces_8 gsol_12 ba_17 dang_20 
K10D0131_H0133:396b-20	bcom ldan 'das kyis mchog tu dga' ba'i rgyal po dang /	'joms_0 ldan_5 'da'_10 kyis_15 mchog_20 tu_26 dga'_29 ba_34 rgyal_39 po_45 dang_48 
K10D0131_H0133:396b-21	'jam dpal la sogs pa sems dpa' dpe med drug cu dang /	'jam_0 dpal_5 la_10 sogs_13 ba_18 sems_21 dpa'_26 dpe_31 med_35 drug_39 cu_44 dang_47 
K10D0131_H0133:396b-22	byams pa dang /	byams_0 ba_6 dang_9 
K10D0131_H0133:396b-23	seng ge rab snang la sogs pa bskal pa bzang	seng_0 ge_5 rab_8 snang_12 la_18 sogs_21 ba_26 bskal_29 ba_35 bzang_38 
K10D0131_H0133:396b-24	po'i byang chub sems dpa' sems dpa' chen po de	po_0 byang_5 chub_11 sems_16 dpa'_21 sems_26 dpa'_31 chen_36 po_41 de_44 
K10D0131_H0133:396b-25	dag la 'di skad ces bka' stsal to //	'dag_0 la_4 'di_7 skad_11 ces_16 bka'_20 stsal_25 to_31 
K10D0131_H0133:397a-0	rigs kyi bu @397a *//	rigs_0 kyi_5 bu_9 
K10D0131_H0133:397a-1	dag ;chos chos zhes bya ba'i chos de ni 'gyur	'dag_0 ;chos_4 chos_10 zhes_15 byed_20 ba_24 chos_29 de_34 ni_37 'gyur_40 
K10D0131_H0133:397a-2	ba med cing rnam par rtog pa med pa'i tshig	ba_0 med_3 cing_7 rnam_12 ba_17 rtogs_21 ba_26 med_29 ba_33 tshig_38 
K10D0131_H0133:397a-3	bla dvags so // gsol pa /	bla_0 dvags_4 so_10 gsol_16 ba_21 
K10D0131_H0133:397a-4	bcom ldan 'das /	'joms_0 ldan_5 'da'_10 
K10D0131_H0133:397a-5	'gyur ba ma mchis shing /	'gyur_0 ba_6 ma_9 mchis_12 shing_18 
K10D0131_H0133:397a-6	rnam par rtog pa ma mchis pa de'ang gang gi tshig bla dvags lags /	rnam_0 ba_5 rtogs_9 ba_14 ma_17 mchis_20 ba_26 de_29 gang_36 gi_41 tshig_44 bla_50 dvags_54 lags_60 
K10D0131_H0133:397a-7	bcom ldan 'das kyis bka' stsal pa /	'joms_0 ldan_5 'da'_10 kyis_15 bka'_20 stsal_25 ba_31 
K10D0131_H0133:397a-8	rigs kyi bu dag /	rigs_0 kyi_5 bu_9 'dag_12 
K10D0131_H0133:397a-9	'gyur ba med cing rnam par rtog pa med pa	'gyur_0 ba_6 med_9 cing_13 rnam_18 ba_23 rtogs_27 ba_32 med_35 ba_39 
K10D0131_H0133:397a-10	zhes bya ba de ni dmigs pa med pa'i tshig	zhes_0 byed_5 ba_9 de_12 ni_15 dmigs_18 ba_24 med_27 ba_31 tshig_36 
K10D0131_H0133:397a-11	bla dvags so // gsol pa /	bla_0 dvags_4 so_10 gsol_16 ba_21 
K10D0131_H0133:397a-12	bcom ldan 'das /	'joms_0 ldan_5 'da'_10 
K10D0131_H0133:397a-13	dmigs pa ma mchis pa de yang gang gi tshig bla dvags lags /	dmigs_0 ba_6 ma_9 mchis_12 ba_18 de_21 yang_24 gang_29 gi_34 tshig_37 bla_43 dvags_47 lags_53 
K10D0131_H0133:397a-14	bcom ldan 'das kyis bka' stsal pa /	'joms_0 ldan_5 'da'_10 kyis_15 bka'_20 stsal_25 ba_31 
K10D0131_H0133:397a-15	rigs kyi bu dag /	rigs_0 kyi_5 bu_9 'dag_12 
K10D0131_H0133:397a-16	dmigs pa med pa zhes bya ba ni mi zad pa'i tshig bla dvags so //	dmigs_0 ba_6 med_9 ba_13 zhes_16 byed_21 ba_25 ni_28 mi_31 zad_34 ba_38 tshig_43 bla_49 dvags_53 so_59 
K10D0131_H0133:397a-17	gsol pa /	gsol_0 ba_5 
K10D0131_H0133:397a-18	bcom ldan 'das /	'joms_0 ldan_5 'da'_10 
K10D0131_H0133:397a-19	mi zad pa de'ang gang gi tshig bla dvags lags /	mi_0 zad_3 ba_7 de_10 gang_17 gi_22 tshig_25 bla_31 dvags_35 lags_41 
K10D0131_H0133:397a-20	bcom ldan 'das kyis bka' stsal pa /	'joms_0 ldan_5 'da'_10 kyis_15 bka'_20 stsal_25 ba_31 
K10D0131_H0133:397a-21	rigs kyi bu dag /	rigs_0 kyi_5 bu_9 'dag_12 
K10D0131_H0133:397a-22	mi zad pa zhes bya ba de ni mi skye ba'i tshig bla dvags so //	mi_0 zad_3 ba_7 zhes_10 byed_15 ba_19 de_22 ni_25 mi_28 skye_31 ba_36 tshig_41 bla_47 dvags_51 so_57 
K10D0131_H0133:397a-23	gsol pa /	gsol_0 ba_5 
K10D0131_H0133:397a-24	bcom ldan 'das /	'joms_0 ldan_5 'da'_10 
K10D0131_H0133:397a-25	mi skye ba de'ang gang gi tshig bla dvags lags /	mi_0 skye_3 ba_8 de_11 gang_18 gi_23 tshig_26 bla_32 dvags_36 lags_42 
K10D0131_H0133:397a-26	bcom ldan 'das kyis bka' stsal pa /	'joms_0 ldan_5 'da'_10 kyis_15 bka'_20 stsal_25 ba_31 
K10D0131_H0133:397a-27	rigs kyi bu dag /	rigs_0 kyi_5 bu_9 'dag_12 
K10D0131_H0133:397a-28	mi skye ba zhes bya ba de ni mi 'gog pa'i tshig bla dvags so; ;gsol pa /	mi_0 skye_3 ba_8 zhes_11 byed_16 ba_20 de_23 ni_26 mi_29 'gog_32 ba_37 tshig_42 bla_48 dvags_52 so;_58 ;gsol_62 ba_68 
K10D0131_H0133:397a-29	bcom ldan 'das mi 'gog pa de'ang gang gi tshig bla dvags /	'joms_0 ldan_5 'da'_10 mi_15 'gog_18 ba_23 de_26 gang_33 gi_38 tshig_41 bla_47 dvags_51 
K10D0131_H0133:397a-30	bcom ldan 'das kyis bka' stsal pa /	'joms_0 ldan_5 'da'_10 kyis_15 bka'_20 stsal_25 ba_31 
K10D0131_H0133:397a-31	rigs kyi bu dag /	rigs_0 kyi_5 bu_9 'dag_12 
K10D0131_H0133:397b-0	mi 'gog pa zhes bya ba de ni @397b sdud pa med pa'i tshig bla dvags so //	mi_0 'gog_3 ba_8 zhes_11 byed_16 ba_20 de_23 ni_26 sdud_35 ba_40 med_43 ba_47 tshig_52 bla_58 dvags_62 so_68 
K10D0131_H0133:397b-1	gsol pa /	gsol_0 ba_5 
K10D0131_H0133:397b-2	bcom ldan 'das /	'joms_0 ldan_5 'da'_10 
K10D0131_H0133:397b-3	sdud pa ma mchis pa de'ang gang gi tshig bla dvags lags /	sdud_0 ba_5 ma_8 mchis_11 ba_17 de_20 gang_27 gi_32 tshig_35 bla_41 dvags_45 lags_51 
K10D0131_H0133:397b-4	bcom ldan 'das kyis bka' stsal pa /	'joms_0 ldan_5 'da'_10 kyis_15 bka'_20 stsal_25 ba_31 
K10D0131_H0133:397b-5	rigs kyi bu dag /	rigs_0 kyi_5 bu_9 'dag_12 
K10D0131_H0133:397b-6	sdud pa med pa zhes bya ba de ni yongs su gzung ba med pa'i tshig bla dvags so //	sdud_0 ba_5 med_8 ba_12 zhes_15 byed_20 ba_24 de_27 ni_30 yongs_33 su_39 gzung_42 ba_48 med_51 ba_55 tshig_60 bla_66 dvags_70 so_76 
K10D0131_H0133:397b-7	gsol pa /	gsol_0 ba_5 
K10D0131_H0133:397b-8	bcom ldan 'das /	'joms_0 ldan_5 'da'_10 
K10D0131_H0133:397b-9	yongs su gzung ba ma mchis pa de'ang gang gi tshig bla dvags lags /	yongs_0 su_6 gzung_9 ba_15 ma_18 mchis_21 ba_27 de_30 gang_37 gi_42 tshig_45 bla_51 dvags_55 lags_61 
K10D0131_H0133:397b-10	bcom ldan 'das kyis bka' stsal pa /	'joms_0 ldan_5 'da'_10 kyis_15 bka'_20 stsal_25 ba_31 
K10D0131_H0133:397b-11	rigs kyi bu dag /	rigs_0 kyi_5 bu_9 'dag_12 
