K10D0338_H0343:433a-6	de la tshe ring bar 'gyur ba'i las gang zhe na /	de_0 la_3 tshe_6 ring_11 ba_16 'gyur_20 ba_26 las_31 gang_35 zhe_40 na_44 
K10D0338_H0343:433a-7	tshe ring bar 'gyur ba'i chos bcu ste /	tshe_0 ring_5 ba_10 'gyur_14 ba_20 chos_25 'chu_30 ste_34 
K10D0338_H0343:433a-8	bcu gang zhe na /	'chu_0 gang_4 zhe_9 na_13 
K10D0338_H0343:433a-9	srog gcod pa spong ba dang /	srog_0 gcod_5 ba_10 spong_13 ba_19 dang_22 
K10D0338_H0343:433a-10	srog gcod pa spong ba yang dag par 'dzin du 'jug pa dang //	srog_0 gcod_5 ba_10 spong_13 ba_19 yang_22 'dag_27 ba_31 'dzin_35 du_41 'jug_44 ba_49 dang_52 
K10D0338_H0343:433a-11	srog gcod pa spong ba'i bsngags pa smra ba dang /	srog_0 gcod_5 ba_10 spong_13 ba_19 bsngags_24 ba_32 smra_35 ba_40 dang_43 
K10D0338_H0343:433a-12	srog gcod pa spong ba la rjes su yi rang ba dang /	srog_0 gcod_5 ba_10 spong_13 ba_19 la_22 rjes_25 su_30 yi_33 rang_36 ba_41 dang_44 
K10D0338_H0343:433a-13	bsad par chad pa'i gang zag rnams rab tu thar bar byed pa dang /	bsad_0 ba_5 'chad_9 ba_14 gang_19 zag_24 rnams_28 rab_34 tu_38 thar_41 ba_46 byed_50 ba_55 dang_58 
K10D0338_H0343:433a-14	dud 'gro'i skye gnas su gyur pa'i srog chags bsad	dud_0 'gro_4 skye_11 gnas_16 su_21 gyur_24 ba_29 srog_34 chags_39 bsad_45 
K10D0338_H0343:433a-15	par chad pa rnams rab tu thar bar byed pa	ba_0 'chad_4 ba_9 rnams_12 rab_18 tu_22 thar_25 ba_30 byed_34 ba_39 
K10D0338_H0343:433a-16	dang / 'jigs skrag pa rnams la mi 'jigs pa sbyin pa dang /	dang_0 'jigs_7 skrag_13 ba_19 rnams_22 la_28 mi_31 'jigs_34 ba_40 sbyin_43 ba_49 dang_52 
K10D0338_H0343:433a-17	mgon med pa rnams la snying rje ba'i sems dang ldan pa dang /	mgon_0 med_5 ba_9 rnams_12 la_18 snying_21 rje_28 ba_32 sems_37 dang_42 ldan_47 ba_52 dang_55 
K10D0338_H0343:433a-18	nad pa rnams la byams pa nye bar sgrub pa dang /	nad_0 ba_4 rnams_7 la_13 byams_16 ba_22 nye_25 ba_29 sgrub_33 ba_39 dang_42 
K10D0338_H0343:433a-19	len pa rnams la zas sbyin pa'o //	len_0 ba_4 rnams_7 la_13 zas_16 sbyin_20 ba_26 
K10D0338_H0343:433a-20	chos bcu po de dag ni tshe ring bar 'gyur ba ste /	chos_0 'chu_5 po_9 de_12 'dag_15 ni_19 tshe_22 ring_27 ba_32 'gyur_36 ba_42 ste_45 
K10D0338_H0343:433a-21	las 'di ni tshe ring bar 'gyur ba'o //	las_0 'di_4 ni_8 tshe_11 ring_16 ba_21 'gyur_25 ba_31 
K10D0338_H0343:433a-22	de la nad mang bar 'gyur ba'i las gang zhe na /	de_0 la_3 nad_6 mang_10 ba_15 'gyur_19 ba_25 las_30 gang_34 zhe_39 na_43 
K10D0338_H0343:433a-23	nad mang bar 'gyur ba'i chos bcu ste /	nad_0 mang_4 ba_9 'gyur_13 ba_19 chos_24 'chu_29 ste_33 
K10D0338_H0343:433a-24	bcu gang zhe na /	'chu_0 gang_4 zhe_9 na_13 
K10D0338_H0343:433a-25	khu tshur dang /	khu_0 tshur_4 dang_10 
K10D0338_H0343:433a-26	thal mo la sogs pas brdeg pa dang /	thal_0 mo_5 la_8 sogs_11 ba_16 brdeg_20 ba_26 dang_29 
K10D0338_H0343:433b-0	khu tshur @433b dang /	khu_0 tshur_4 dang_16 
K10D0338_H0343:433b-1	thal mo la sogs pas brdeg pa yang dag par 'dzin du 'jug pa dang /	thal_0 mo_5 la_8 sogs_11 ba_16 brdeg_20 ba_26 yang_29 'dag_34 ba_38 'dzin_42 du_48 'jug_51 ba_56 dang_59 
K10D0338_H0343:433b-2	khu tshur dang /	khu_0 tshur_4 dang_10 
K10D0338_H0343:433b-3	thal mo la sogs pas brdeg pa'i bsngags pa smra ba dang /	thal_0 mo_5 la_8 sogs_11 ba_16 brdeg_20 ba_26 bsngags_31 ba_39 smra_42 ba_47 dang_50 
K10D0338_H0343:433b-4	khu chur dang /	khu_0 'chur(d)_4 dang_9 
K10D0338_H0343:433b-5	thal mo la sogs pas brdeg pa la rjes su yi rang ba dang /	thal_0 mo_5 la_8 sogs_11 ba_16 brdeg_20 ba_26 la_29 rjes_32 su_37 yi_40 rang_43 ba_48 dang_51 
K10D0338_H0343:433b-6	pha ma na bar sgrub pa dang /	pha_0 ma_4 na_7 ba_10 sgrub_14 ba_20 dang_23 
K10D0338_H0343:433b-7	'phags pa rnams na bar sgrub pa dang /	'phag_0 ba_7 rnams_10 na_16 ba_19 sgrub_23 ba_29 dang_32 
K10D0338_H0343:433b-8	mi mdza' ba rnams nad kyis btab na yid dga' ba dang /	mi_0 mdza'_3 ba_9 rnams_12 nad_18 kyis_22 'debs_27 na_32 yid_35 dga'_39 ba_44 dang_47 
K10D0338_H0343:433b-9	mi mdza' ba rnams nad sos na yid mi dga' ba dang /	mi_0 mdza'_3 ba_9 rnams_12 nad_18 sos_22 na_26 yid_29 mi_33 dga'_36 ba_41 dang_44 
K10D0338_H0343:433b-10	sman ma yin pa sbyin pa dang /	sman_0 ma_5 yin_8 ba_12 sbyin_15 ba_21 dang_24 
K10D0338_H0343:433b-11	zas ma zhu bar za ba ni bcu pa'o //	zas_0 ma_4 'ju_7 ba_11 za_15 ba_18 ni_21 'chu_24 ba_28 
K10D0338_H0343:433b-12	chos bcu po de dag ni nad mang bar 'gyur ba ste /	chos_0 'chu_5 po_9 de_12 'dag_15 ni_19 nad_22 mang_26 ba_31 'gyur_35 ba_41 ste_44 
K10D0338_H0343:433b-13	las 'di ni nad mang bar 'gyur ba'o //	las_0 'di_4 ni_8 nad_11 mang_15 ba_20 'gyur_24 ba_30 
K10D0338_H0343:433b-14	de la nad nyung bar 'gyur ba'i las gang zhe na /	de_0 la_3 nad_6 nyung_10 ba_16 'gyur_20 ba_26 las_31 gang_35 zhe_40 na_44 
K10D0338_H0343:433b-15	nad nyung bar 'gyur ba'i chos bcu ste /	nad_0 nyung_4 ba_10 'gyur_14 ba_20 chos_25 'chu_30 ste_34 
K10D0338_H0343:433b-16	bcu gang zhe na /	'chu_0 gang_4 zhe_9 na_13 
K10D0338_H0343:433b-17	khu tshur dang /	khu_0 tshur_4 dang_10 
K10D0338_H0343:433b-18	thal mo la sogs pas brdeg pa sbong ba dang /	thal_0 mo_5 la_8 sogs_11 ba_16 brdeg_20 ba_26 sbong_29 ba_35 dang_38 
K10D0338_H0343:433b-19	khu tshur dang /	khu_0 tshur_4 dang_10 
K10D0338_H0343:433b-20	thal mo la sogs pas brdeg pa spong ba yang dag par 'dzin du 'jug pa dang /	thal_0 mo_5 la_8 sogs_11 ba_16 brdeg_20 ba_26 spong_29 ba_35 yang_38 'dag_43 ba_47 'dzin_51 du_57 'jug_60 ba_65 dang_68 
K10D0338_H0343:433b-21	khu tshur dang /	khu_0 tshur_4 dang_10 
K10D0338_H0343:433b-22	thal mo la sogs pas brdeg pa spong ba'i bsngags pa smra ba dang /	thal_0 mo_5 la_8 sogs_11 ba_16 brdeg_20 ba_26 spong_29 ba_35 bsngags_40 ba_48 smra_51 ba_56 dang_59 
K10D0338_H0343:433b-23	khu tshur dang thal mo la sogs pas brdeg pa spong ba la rjes su yi rang ba dang /	khu_0 tshur_4 dang_10 thal_15 mo_20 la_23 sogs_26 ba_31 brdeg_35 ba_41 spong_44 ba_50 la_53 rjes_56 su_61 yi_64 rang_67 ba_72 dang_75 
K10D0338_H0343:433b-24	pha ma nad kyis btab na rim gro byed pa dang /	pha_0 ma_4 nad_7 kyis_11 'debs_16 na_21 rim_24 gro_28 byed_32 ba_37 dang_40 
K10D0338_H0343:433b-25	'phags pa rnams nad kyis btab na rim gro byed pa dang /	'phag_0 ba_7 rnams_10 nad_16 kyis_20 'debs_25 na_30 rim_33 gro_37 byed_41 ba_46 dang_49 
K10D0338_H0343:433b-26	mi mdza' ba nad kyis btab na yid mi dga' ba dang /	mi_0 mdza'_3 ba_9 nad_12 kyis_16 'debs_21 na_26 yid_29 mi_33 dga'_36 ba_41 dang_44 
K10D0338_H0343:433b-27	mi mdza' ba nad sos na yid dga' ba dang /	mi_0 mdza'_3 ba_9 nad_12 sos_16 na_20 yid_23 dga'_27 ba_32 dang_35 
K10D0338_H0343:433b-28	nad pa la sman sbyin pa dang /	nad_0 ba_4 la_7 sman_10 sbyin_15 ba_21 dang_24 
K10D0338_H0343:434a-0	kha @434a *//	kha_0 
K10D0338_H0343:434a-1	zas zhu bar gyur nas za ba ni bcu pa'o //	zas_0 'ju_4 ba_8 gyur_12 nas_17 za_21 ba_24 ni_27 'chu_30 ba_34 
K10D0338_H0343:434a-2	chos bcu po de dag ni nad nyung bar 'gyur ba ste /	chos_0 'chu_5 po_9 de_12 'dag_15 ni_19 nad_22 nyung_26 ba_32 'gyur_36 ba_42 ste_45 
K10D0338_H0343:434a-3	las 'di ni nad nyung bar 'gyur ba'o //	las_0 'di_4 ni_8 nad_11 nyung_15 ba_21 'gyur_25 ba_31 
K10D0338_H0343:434a-4	de la mdog mi sdug par 'gyur ba'i las gang zhe na /	de_0 la_3 mdog_6 mi_11 sdug_14 ba_19 'gyur_23 ba_29 las_34 gang_38 zhe_43 na_47 
K10D0338_H0343:434a-5	mdog mi sdug par 'gyur ba'i chos bcu ste /	mdog_0 mi_5 sdug_8 ba_13 'gyur_17 ba_23 chos_28 'chu_33 ste_37 
K10D0338_H0343:434a-6	bcu gang zhe na /	'chu_0 gang_4 zhe_9 na_13 
K10D0338_H0343:434a-7	khro ba dang /	khro_0 ba_5 dang_8 
K10D0338_H0343:434a-8	'chab pa dang /	'chab_0 ba_6 dang_9 
K10D0338_H0343:434a-9	khon du 'dzin pa dang /	khon_0 du_5 'dzin_8 ba_14 dang_17 
K10D0338_H0343:434a-10	'tshig pa dang /	'tshig_0 ba_7 dang_10 
K10D0338_H0343:434a-11	pha ma'i bsngags pa ma yin pa smra ba dang /	pha_0 ma_4 bsngags_9 ba_17 ma_20 yin_23 ba_27 smra_30 ba_35 dang_38 
K10D0338_H0343:434a-12	'phags pa rnams kyi bsngags pa ma yin pa smra ba dang /	'phag_0 ba_7 rnams_10 kyi_16 bsngags_20 ba_28 ma_31 yin_34 ba_38 smra_41 ba_46 dang_49 
K10D0338_H0343:434a-13	'phags pa'i yongs su spyad pa ma rung bar byed pa dang /	'phag_0 ba_7 yongs_12 su_18 spyod_21 ba_27 ma_30 rung_33 ba_38 byed_42 ba_47 dang_50 
K10D0338_H0343:434a-14	de bzhin gshegs pa'i mchod rten gyi mar me'i 'od kyi bar du gcod pa dang /	de_0 bzhin_3 gshegs_9 ba_16 mchod_21 rten_27 gyi_32 mar_36 me_40 'od_45 kyi_49 ba_53 du_57 gcod_60 ba_65 dang_68 
K10D0338_H0343:434a-15	gang zag mdog mi sdug pa rnams la dbang za ba dang /	gang_0 zag_5 mdog_9 mi_14 sdug_17 ba_22 rnams_25 la_31 dbang_34 za_40 ba_43 dang_46 
K10D0338_H0343:434a-16	gtsang sbra med par spyod pa ni bcu pa'o //	gtsang_0 sbra_7 med_12 ba_16 spyod_20 ba_26 ni_29 'chu_32 ba_36 
K10D0338_H0343:434a-17	chos bcu po de dag ni mdog mi sdug par 'gyur ba ste /	chos_0 'chu_5 po_9 de_12 'dag_15 ni_19 mdog_22 mi_27 sdug_30 ba_35 'gyur_39 ba_45 ste_48 
K10D0338_H0343:434a-18	las 'di ni mdog mi sdug par 'gyur ba'o //	las_0 'di_4 ni_8 mdog_11 mi_16 sdug_19 ba_24 'gyur_28 ba_34 
K10D0338_H0343:434a-19	de la mdzes par 'gyur ba'i las gang zhe na /	de_0 la_3 mdzes_6 ba_12 'gyur_16 ba_22 las_27 gang_31 zhe_36 na_40 
K10D0338_H0343:434a-20	mdzes par 'gyur ba'i chos bcu ste /	mdzes_0 ba_6 'gyur_10 ba_16 chos_21 'chu_26 ste_30 
K10D0338_H0343:434a-21	bcu gang zhe na /	'chu_0 gang_4 zhe_9 na_13 
K10D0338_H0343:434a-22	mi khro ba dang /	mi_0 khro_3 ba_8 dang_11 
K10D0338_H0343:434a-23	gos sbyin pa dang /	gos_0 sbyin_4 ba_10 dang_13 
K10D0338_H0343:434a-24	de bzhin gshegs pa'i mchod rten la rdo thal gyis nyug pa dang /	de_0 bzhin_3 gshegs_9 ba_16 mchod_21 rten_27 la_32 rdo_35 thal_39 gyis_44 nyug_49 ba_54 dang_57 
K10D0338_H0343:434a-25	gtsug lag khang phyag dar byed pa dang /	gtsug_0 lag_6 khang_10 phyag_16 dar_22 byed_26 ba_31 dang_34 
K10D0338_H0343:434a-26	de bzhin gshegs pa'i mchod rten gyi khang pa phyag pa dang /	de_0 bzhin_3 gshegs_9 ba_16 mchod_21 rten_27 gyi_32 khang_36 ba_42 phyag_45 ba_51 dang_54 
K10D0338_H0343:434a-27	de bzhin gshegs pa'i sku gzugs 'phyi ba dang /	de_0 bzhin_3 gshegs_9 ba_16 sku_21 gzugs_25 'phyi_31 ba_37 dang_40 
K10D0338_H0343:434a-28	pha ma'i bsngags pa smra ba dang /	pha_0 ma_4 bsngags_9 ba_17 smra_20 ba_25 dang_28 
K10D0338_H0343:434b-0	'phags pa rnams kyi bsngags @434b ba smra ba dang /	'phag_0 ba_7 rnams_10 kyi_16 bsngags_20 ba_34 smra_37 ba_42 dang_45 
K10D0338_H0343:434b-1	gang zag mdog mi sdug rnams la mi brnyas pa dang /	gang_0 zag_5 mdog_9 mi_14 sdug_17 rnams_22 la_28 mi_31 brnyas_34 ba_41 dang_44 
K10D0338_H0343:434b-2	gtsang sbra spyod pa ni bcu pa'o //	gtsang_0 sbra_7 spyod_12 ba_18 ni_21 'chu_24 ba_28 
K10D0338_H0343:434b-3	chos bcu po de dag ni mdzes par 'gyur ba'o //	chos_0 'chu_5 po_9 de_12 'dag_15 ni_19 mdzes_22 ba_28 'gyur_32 ba_38 
K10D0338_H0343:434b-4	de la dbang chung bar grags par 'gyur ba'i las gang zhe na /	de_0 la_3 dbang_6 chung_12 ba_18 grags_22 ba_28 'gyur_32 ba_38 las_43 gang_47 zhe_52 na_56 
K10D0338_H0343:434b-5	dbang chung bar grags par 'gyur ba'i chos bcu ste /	dbang_0 chung_6 ba_12 grags_16 ba_22 'gyur_26 ba_32 chos_37 'chu_42 ste_46 
K10D0338_H0343:434b-6	bcu gang zhe na /	'chu_0 gang_4 zhe_9 na_13 
K10D0338_H0343:434b-7	pha rol gyi rnyed pa la phrag dog byed pa dang /	pha_0 rol_4 gyi_8 rnyed_12 ba_18 la_21 phrag_24 dog_30 byed_34 ba_39 dang_42 
K10D0338_H0343:434b-8	pha rol gyi rnyed pa la yid mi dga' ba dang /	pha_0 rol_4 gyi_8 rnyed_12 ba_18 la_21 yid_24 mi_28 dga'_31 ba_36 dang_39 
K10D0338_H0343:434b-9	pha rol gyis ma rnyed pa la yid dga' ba dang /	pha_0 rol_4 gyis_8 ma_13 rnyed_16 ba_22 la_25 yid_28 dga'_32 ba_37 dang_40 
K10D0338_H0343:434b-10	pha rol gyi grags pa dang /	pha_0 rol_4 gyi_8 grags_12 ba_18 dang_21 
K10D0338_H0343:434b-11	bsngags pa dang /	bsngags_0 ba_8 dang_11 
K10D0338_H0343:434b-12	brjod pa dang /	rjod_0 ba_6 dang_9 
K10D0338_H0343:434b-13	sgra dang tshigs su bcad pa la yid mi dga' ba dang /	sgra_0 dang_5 tshigs_10 su_17 gcod_20 ba_25 la_28 yid_31 mi_35 dga'_38 ba_43 dang_46 
K10D0338_H0343:434b-14	pha rol gyi grags pa dang /	pha_0 rol_4 gyi_8 grags_12 ba_18 dang_21 
K10D0338_H0343:434b-15	bsngags pa dang /	bsngags_0 ba_8 dang_11 
K10D0338_H0343:434b-16	brjod pa dang /	rjod_0 ba_6 dang_9 
K10D0338_H0343:434b-17	sgra dang tshigs su bcad pa ma yin pa la yid dga' ba dang /	sgra_0 dang_5 tshigs_10 su_17 gcod_20 ba_25 ma_28 yin_31 ba_35 la_38 yid_41 dga'_45 ba_50 dang_53 
K10D0338_H0343:434b-18	pha ma la brnyas pa dang /	pha_0 ma_4 la_7 brnyas_10 ba_17 dang_20 
K10D0338_H0343:434b-19	'phags pa rnams la brnyas pa dang /	'phag_0 ba_7 rnams_10 la_16 brnyas_19 ba_26 dang_29 
K10D0338_H0343:434b-20	dge ba'i rtsa ba chung ngu yang dag par 'dzin du 'jug pa dang /	dge_0 ba_4 rtsa_9 ba_14 chung_17 ngu_23 yang_27 'dag_32 ba_36 'dzin_40 du_46 'jug_49 ba_54 dang_57 
K10D0338_H0343:434b-21	dge ba'i rtsa ba chen po'i rgyun gcod pa dang /	dge_0 ba_4 rtsa_9 ba_14 chen_17 po_22 rgyun_27 gcod_33 ba_38 dang_41 
K10D0338_H0343:434b-22	gang zag dbang chung bar grags pa rnams la dbang za ba'o //	gang_0 zag_5 dbang_9 chung_15 ba_21 grags_25 ba_31 rnams_34 la_40 dbang_43 za_49 ba_52 
K10D0338_H0343:434b-23	chos bcu po de dag ni dbang chung bar grags par 'gyur ba ste /	chos_0 'chu_5 po_9 de_12 'dag_15 ni_19 dbang_22 chung_28 ba_34 grags_38 ba_44 'gyur_48 ba_54 ste_57 
K10D0338_H0343:434b-24	las 'di ni dbang chung bar grags par 'gyur ba'o //	las_0 'di_4 ni_8 dbang_11 chung_17 ba_23 grags_27 ba_33 'gyur_37 ba_43 
K10D0338_H0343:434b-25	de la dbang che bar grags par 'gyur ba'i las gang zhe na /	de_0 la_3 dbang_6 che_12 ba_16 grags_20 ba_26 'gyur_30 ba_36 las_41 gang_45 zhe_50 na_54 
K10D0338_H0343:434b-26	dbang che che bar grags par 'gyur ba'i chos bcu ste /	dbang_0 che_6 che_10 ba_14 grags_18 ba_24 'gyur_28 ba_34 chos_39 'chu_44 ste_48 
K10D0338_H0343:434b-27	bcu gang zhe na /	'chu_0 gang_4 zhe_9 na_13 
K10D0338_H0343:434b-28	pha rol gyi rnyed pa la phrag dog med pa dang /	pha_0 rol_4 gyi_8 rnyed_12 ba_18 la_21 phrag_24 dog_30 med_34 ba_38 dang_41 
K10D0338_H0343:434b-29	pha rol gyi rnyed pa la yid dga' ba dang /	pha_0 rol_4 gyi_8 rnyed_12 ba_18 la_21 yid_24 dga'_28 ba_33 dang_36 
K10D0338_H0343:435a-0	pha rol gyis ma rnyed pa la @435a *//	pha_0 rol_4 gyis_8 ma_13 rnyed_16 ba_22 la_25 
K10D0338_H0343:435a-1	yid mi dga' ba dang /	yid_0 mi_4 dga'_7 ba_12 dang_15 
K10D0338_H0343:435a-2	pha rol gyi grags pa dang /	pha_0 rol_4 gyi_8 grags_12 ba_18 dang_21 
K10D0338_H0343:435a-3	bsngags pa dang /	bsngags_0 ba_8 dang_11 
K10D0338_H0343:435a-4	brjod pa dang /	rjod_0 ba_6 dang_9 
K10D0338_H0343:435a-5	sgra dang /	sgra_0 dang_5 
K10D0338_H0343:435a-6	tshigs su bcad pa ma yin pa la yid mi dga' ba dang /	tshigs_0 su_7 gcod_10 ba_15 ma_18 yin_21 ba_25 la_28 yid_31 mi_35 dga'_38 ba_43 dang_46 
K10D0338_H0343:435a-7	pha rol gyi grags pa dang /	pha_0 rol_4 gyi_8 grags_12 ba_18 dang_21 
K10D0338_H0343:435a-8	bsngags pa dang /	bsngags_0 ba_8 dang_11 
K10D0338_H0343:435a-9	brjod pa dang /	rjod_0 ba_6 dang_9 
K10D0338_H0343:435a-10	sgra dang /	sgra_0 dang_5 
K10D0338_H0343:435a-11	tshigs su bcad pa la yid dga' ba dang /	tshigs_0 su_7 gcod_10 ba_15 la_18 yid_21 dga'_25 ba_30 dang_33 
K10D0338_H0343:435a-12	byang chub tu sems bskyed pa dang /	byang_0 chub_6 tu_11 sems_14 skyed_19 ba_26 dang_29 
K10D0338_H0343:435a-13	gdugs sbyin pa dang /	gdugs_0 sbyin_6 ba_12 dang_15 
K10D0338_H0343:435a-14	de bzhin gshegs pa'i mchod rten gyi khang pa byed pa dang /	de_0 bzhin_3 gshegs_9 ba_16 mchod_21 rten_27 gyi_32 khang_36 ba_42 byed_45 ba_50 dang_53 
K10D0338_H0343:435a-15	dge ba'i rtsa ba chung du rgyun mi gcod pa dang /	dge_0 ba_4 rtsa_9 ba_14 chung_17 du_23 rgyun_26 mi_32 gcod_35 ba_40 dang_43 
K10D0338_H0343:435a-16	dge ba'i rtsa ba chen po yang dag par 'dzin du 'jug pa'o //	dge_0 ba_4 rtsa_9 ba_14 chen_17 po_22 yang_25 'dag_30 ba_34 'dzin_38 du_44 'jug_47 ba_52 
K10D0338_H0343:435a-17	chos bcu po de dag ni dbang che bar grags par 'gyur ba ste /	chos_0 'chu_5 po_9 de_12 'dag_15 ni_19 dbang_22 che_28 ba_32 grags_36 ba_42 'gyur_46 ba_52 ste_55 
K10D0338_H0343:435a-18	las 'di ni dbang che bar grags par 'gyur ba'o //	las_0 'di_4 ni_8 dbang_11 che_17 ba_21 grags_25 ba_31 'gyur_35 ba_41 
K10D0338_H0343:435a-19	de la rigs dma' bar 'gyur ba'i las gang zhe na /	de_0 la_3 rigs_6 dma'_11 ba_16 'gyur_20 ba_26 las_31 gang_35 zhe_40 na_44 
K10D0338_H0343:435a-20	rigs dma' bar 'gyur ba'i chos bcu ste /	rigs_0 dma'_5 ba_10 'gyur_14 ba_20 chos_25 'chu_30 ste_34 
K10D0338_H0343:435a-21	bcu gang zhe na /	'chu_0 gang_4 zhe_9 na_13 
K10D0338_H0343:435a-22	khengs pa dang /	kheng_0 ba_7 dang_10 
K10D0338_H0343:435a-23	nga'o snyam pa'i nga rgyal dang /	nga_0 snyam_6 ba_12 nga_17 rgyal_21 dang_27 
K10D0338_H0343:435a-24	mar mi shes pa dang /	mar_0 mi_4 shes_7 ba_12 dang_15 
K10D0338_H0343:435a-25	phar mi shes pa dang /	phar_0 mi_5 shes_8 ba_13 dang_16 
K10D0338_H0343:435a-26	dge sbyong du mi shes pa dang /	dge_0 sbyong_4 du_11 mi_14 shes_17 ba_22 dang_25 
K10D0338_H0343:435a-27	bram zer mi shes pa dang /	bram_0 zer_5 mi_9 shes_12 ba_17 dang_20 
K10D0338_H0343:435a-28	khyim gyi gtso bo la rim gro mi byed pa dang /	khyim_0 gyi_6 gtso_10 'bo_15 la_18 rim_21 gro_25 mi_29 byed_32 ba_37 dang_40 
K10D0338_H0343:435a-29	pha ma la mi ldang ba dang /	pha_0 ma_4 la_7 mi_10 ldang_13 ba_19 dang_22 
K10D0338_H0343:435a-30	'phags pa rnams la mi ldang ba dang /	'phag_0 ba_7 rnams_10 la_16 mi_19 ldang_22 ba_28 dang_31 
K10D0338_H0343:435a-31	rigs dma' bar skyes pa'i gang zag rnams la dbang za ba'o //	rigs_0 dma'_5 ba_10 skye_14 ba_20 gang_25 zag_30 rnams_34 la_40 dbang_43 za_49 ba_52 
K10D0338_H0343:435a-32	chos bcu po de dag ni rigs dma' bar 'gyur ba ste /	chos_0 'chu_5 po_9 de_12 'dag_15 ni_19 rigs_22 dma'_27 ba_32 'gyur_36 ba_42 ste_45 
K10D0338_H0343:435a-33	las 'di ni rigs dma' bar 'gyur ba'o //	las_0 'di_4 ni_8 rigs_11 dma'_16 ba_21 'gyur_25 ba_31 
K10D0338_H0343:435b-0	de la rigs btsun par 'gyur @435b ba'i las gang zhe na /	de_0 la_3 rigs_6 btsun_11 ba_17 'gyur_21 ba_33 las_38 gang_42 zhe_47 na_51 
K10D0338_H0343:435b-1	rigs btsun par 'gyur ba'i chos bcu ste /	rigs_0 btsun_5 ba_11 'gyur_15 ba_21 chos_26 'chu_31 ste_35 
K10D0338_H0343:435b-2	bcu gang zhe na /	'chu_0 gang_4 zhe_9 na_13 
K10D0338_H0343:435b-3	mkhengs pa dang /	mkhengs_0 ba_8 dang_11 
K10D0338_H0343:435b-4	nga'o snyam pa'i nga rgyal med pa dang /	nga_0 snyam_6 ba_12 nga_17 rgyal_21 med_27 ba_31 dang_34 
K10D0338_H0343:435b-5	mar shes pa dang /	mar_0 shes_4 ba_9 dang_12 
K10D0338_H0343:435b-6	phar shes pa dang /	phar_0 shes_5 ba_10 dang_13 
K10D0338_H0343:435b-7	dge sbyong du shes pa dang /	dge_0 sbyong_4 du_11 shes_14 ba_19 dang_22 
K10D0338_H0343:435b-8	bram zer shes pa dang /	bram_0 zer_5 shes_9 ba_14 dang_17 
K10D0338_H0343:435b-9	khyim gyi gtso bo la rim gro byed pa dang /	khyim_0 gyi_6 gtso_10 'bo_15 la_18 rim_21 gro_25 byed_29 ba_34 dang_37 
K10D0338_H0343:435b-10	pha ma la ldang ba dang /	pha_0 ma_4 la_7 ldang_10 ba_16 dang_19 
K10D0338_H0343:435b-11	'phags pa rnams la ldang ba dang /	'phag_0 ba_7 rnams_10 la_16 ldang_19 ba_25 dang_28 
K10D0338_H0343:435b-12	rigs dma' bar skyes pa'i gang zag rnams la dbang mi za ba'o //	rigs_0 dma'_5 ba_10 skye_14 ba_20 gang_25 zag_30 rnams_34 la_40 dbang_43 mi_49 za_52 ba_55 
K10D0338_H0343:435b-13	chos bcu po de dag ni rigs btsun par 'gyur ba'o //	chos_0 'chu_5 po_9 de_12 'dag_15 ni_19 rigs_22 btsun_27 ba_33 'gyur_37 ba_43 
K10D0338_H0343:435b-14	de la longs spyod chung bar 'gyur ba'i las gang zhe na /	de_0 la_3 longs_6 spyod_12 chung_18 ba_24 'gyur_28 ba_34 las_39 gang_43 zhe_48 na_52 
K10D0338_H0343:435b-15	longs spyod chung bar 'gyur ba'i chos bcu ste /	longs_0 spyod_6 chung_12 ba_18 'gyur_22 ba_28 chos_33 'chu_38 ste_42 
K10D0338_H0343:435b-16	bcu gang zhe na /	'chu_0 gang_4 zhe_9 na_13 
K10D0338_H0343:435b-17	ma byin par len pa dang /	ma_0 byin_3 ba_8 len_12 ba_16 dang_19 
K10D0338_H0343:435b-18	ma byin par len pa yang dag par 'dzin du 'jug pa dang /	ma_0 byin_3 ba_8 len_12 ba_16 yang_19 'dag_24 ba_28 'dzin_32 du_38 'jug_41 ba_46 dang_49 
K10D0338_H0343:435b-19	ma byin par len pa'i bsngags pa smre ba dang /	ma_0 byin_3 ba_8 len_12 ba_16 bsngags_21 ba_29 smre_32 ba_37 dang_40 
K10D0338_H0343:435b-20	ma byin par len pa la rjes su yi rang ba dang /	ma_0 byin_3 ba_8 len_12 ba_16 la_19 rjes_22 su_27 yi_30 rang_33 ba_38 dang_41 
K10D0338_H0343:435b-21	pha ma'i 'tsho ba rgyun gcod pa dang /	pha_0 ma_4 'tsho_9 ba_15 rgyun_18 gcod_24 ba_29 dang_32 
K10D0338_H0343:435b-22	'phags pa rnams kyi 'tsho ba rgyun gcod pa dang /	'phag_0 ba_7 rnams_10 kyi_16 'tsho_20 ba_26 rgyun_29 gcod_35 ba_40 dang_43 
K10D0338_H0343:435b-23	pha rol gyi rnyed pa la yid mi dga' ba dang /	pha_0 rol_4 gyi_8 rnyed_12 ba_18 la_21 yid_24 mi_28 dga'_31 ba_36 dang_39 
K10D0338_H0343:435b-24	pha rol gyis ma rnyed pa la yid dga' ba dang /	pha_0 rol_4 gyis_8 ma_13 rnyed_16 ba_22 la_25 yid_28 dga'_32 ba_37 dang_40 
K10D0338_H0343:435b-25	pha rol gyis rnyed pa'i bar chad byed pa dang /	pha_0 rol_4 gyis_8 rnyed_13 ba_19 ba_24 'chad_28 byed_33 ba_38 dang_41 
K10D0338_H0343:435b-26	mu ge byung na dga' ba ni bcu pa'o //	mu_0 ge_3 'byung_6 na_12 dga'_15 ba_20 ni_23 'chu_26 ba_30 
K10D0338_H0343:435b-27	chos bcu po de dag ni longs spyod chung bar 'gyur ba ste /	chos_0 'chu_5 po_9 de_12 'dag_15 ni_19 longs_22 spyod_28 chung_34 ba_40 'gyur_44 ba_50 ste_53 
K10D0338_H0343:435b-28	las 'di ni longs spyod chung bar 'gyur ba'o //	las_0 'di_4 ni_8 longs_11 spyod_17 chung_23 ba_29 'gyur_33 ba_39 
K10D0338_H0343:435b-29	de la longs spyod chen por 'gyur ba'i las gang zhe na /	de_0 la_3 longs_6 spyod_12 chen_18 por_23 'gyur_27 ba_33 las_38 gang_42 zhe_47 na_51 
K10D0338_H0343:435b-30	longs spyod chen por 'gyur ba'i chos bcu ste /	longs_0 spyod_6 chen_12 por_17 'gyur_21 ba_27 chos_32 'chu_37 ste_41 
K10D0338_H0343:436a-0	bcu gang zhe @436a *//	'chu_0 gang_4 zhe_9 
K10D0338_H0343:436a-1	ma byin par len pa spong ba dang /	ma_0 byin_3 ba_8 len_12 ba_16 spong_19 ba_25 dang_28 
K10D0338_H0343:436a-2	ma byin par len pa spong bar yang dag par 'dzin du 'jug pa dang /	ma_0 byin_3 ba_8 len_12 ba_16 spong_19 ba_25 yang_29 'dag_34 ba_38 'dzin_42 du_48 'jug_51 ba_56 dang_59 
K10D0338_H0343:436a-3	ma byin par len pa spong ba'i bsngags pa smra ba dang /	ma_0 byin_3 ba_8 len_12 ba_16 spong_19 ba_25 bsngags_30 ba_38 smra_41 ba_46 dang_49 
K10D0338_H0343:436a-4	ma byin par len pa spong ba la rjes su yi rang ba dang /	ma_0 byin_3 ba_8 len_12 ba_16 spong_19 ba_25 la_28 rjes_31 su_36 yi_39 rang_42 ba_47 dang_50 
K10D0338_H0343:436a-5	pha ma la 'tsho ba sbyin pa dang /	pha_0 ma_4 la_7 'tsho_10 ba_16 sbyin_19 ba_25 dang_28 
K10D0338_H0343:436a-6	'phags pa rnams la 'tsho ba sbyin pa dang /	'phag_0 ba_7 rnams_10 la_16 'tsho_19 ba_25 sbyin_28 ba_34 dang_37 
K10D0338_H0343:436a-7	pha rol gyis ma rnyed pa la yid mi dga' ba dang /	pha_0 rol_4 gyis_8 ma_13 rnyed_16 ba_22 la_25 yid_28 mi_32 dga'_35 ba_40 dang_43 
K10D0338_H0343:436a-8	pha rol gyis rnyed pa la yid dga' ba dang /	pha_0 rol_4 gyis_8 rnyed_13 ba_19 la_22 yid_25 dga'_29 ba_34 dang_37 
K10D0338_H0343:436a-9	pha rol gyis rnyed pa'i bar chad mi byed pa dang /	pha_0 rol_4 gyis_8 rnyed_13 ba_19 ba_24 'chad_28 mi_33 byed_36 ba_41 dang_44 
K10D0338_H0343:436a-10	lo legs na mngon par dga' ba ni bcu pa'o //	lo_0 legs_3 na_8 mngon_11 ba_17 dga'_21 ba_26 ni_29 'chu_32 ba_36 
K10D0338_H0343:436a-11	chos bcu po de dag ni longs spyod chen por 'gyur ba ste /	chos_0 'chu_5 po_9 de_12 'dag_15 ni_19 longs_22 spyod_28 chen_34 por_39 'gyur_43 ba_49 ste_52 
K10D0338_H0343:436a-12	las 'di ni longs spyod chen por 'gyur ba'o //	las_0 'di_4 ni_8 longs_11 spyod_17 chen_23 por_28 'gyur_32 ba_38 
K10D0338_H0343:436a-13	de la shes rab 'chal bar 'gyur ba'i las gang zhe na /	de_0 la_3 shes_6 rab_11 'chal_15 ba_21 'gyur_25 ba_31 las_36 gang_40 zhe_45 na_49 
K10D0338_H0343:436a-14	shes rab 'chal bar 'gyur ba'i chos bcu ste /	shes_0 rab_5 'chal_9 ba_15 'gyur_19 ba_25 chos_30 'chu_35 ste_39 
K10D0338_H0343:436a-15	bcu gang zhe na /	'chu_0 gang_4 zhe_9 na_13 
K10D0338_H0343:436a-16	'di la gang zag dge sbyong dang /	'di_0 la_4 gang_7 zag_12 dge_16 sbyong_20 dang_27 
K10D0338_H0343:436a-17	bram ze mkhas pa dang /	bram_0 ze_5 mkhas_8 ba_14 dang_17 
K10D0338_H0343:436a-18	mkhas pa'i grangs su gtogs pa gang yin pa de	mkhas_0 ba_6 grangs_11 su_18 gtogs_21 ba_27 gang_30 yin_35 ba_39 de_42 
K10D0338_H0343:436a-19	dag gi gan du 'gro yang yongs su mi 'dri	'dag_0 gi_4 gan_7 du_11 'gro_14 yang_19 yongs_24 su_30 mi_33 'bri_36 
K10D0338_H0343:436a-20	/ yongs su 'dri bar mi byed /	yongs_2 su_8 'bri_11 ba_16 mi_20 byed_23 
K10D0338_H0343:436a-21	mi bsnyen /	mi_0 snyen_3 
K10D0338_H0343:436a-22	mi bsten /	mi_0 sten_3 
K10D0338_H0343:436a-23	bsnyen bkur mi byed pa dang /	snyen_0 bkur_7 mi_12 byed_15 ba_20 dang_23 
K10D0338_H0343:436a-24	'chal ba'i shes rab can la bsnyen cing bsten te /	'chal_0 ba_6 shes_11 rab_16 can_20 la_24 snyen_27 cing_34 sten_39 te_45 
K10D0338_H0343:436a-25	bsnyen bkur byed pa dang /	snyen_0 bkur_7 byed_12 ba_17 dang_20 
K10D0338_H0343:436a-26	mkhas pa rnams kyi mi 'jigs pa gcod pa dang /	mkhas_0 ba_6 rnams_9 kyi_15 mi_19 'jigs_22 ba_28 gcod_31 ba_36 dang_39 
K10D0338_H0343:436a-27	legs par bshad pa rnams yongs su spong ba dang /	legs_0 ba_5 'chad_9 ba_15 rnams_18 yongs_24 su_30 spong_33 ba_39 dang_42 
K10D0338_H0343:436b-0	nyes par bshad pa rnams kun tu 'dzin pa @436b dang /	nyes_0 ba_5 'chad_9 ba_15 rnams_18 kun_24 tu_28 'dzin_31 ba_37 dang_46 
K10D0338_H0343:436b-1	dam pa'i chos ma yin pa yongs su ston pa dang /	dam_0 ba_4 chos_9 ma_14 yin_17 ba_21 yongs_24 su_30 ston_33 ba_38 dang_41 
K10D0338_H0343:436b-2	dam pa'i chos yongs su spong ba dang /	dam_0 ba_4 chos_9 yongs_14 su_20 spong_23 ba_29 dang_32 
K10D0338_H0343:436b-3	chos smra ba rnams la legs so zhes bya ba mi sbyin pa dang /	chos_0 smra_5 ba_10 rnams_13 la_19 legs_22 so_27 zhes_30 byed_35 ba_39 mi_42 sbyin_45 ba_51 dang_54 
K10D0338_H0343:436b-4	log par lta ba bsngags par byed pa dang /	log_0 ba_4 lta_8 ba_12 bsngags_15 ba_23 byed_27 ba_32 dang_35 
K10D0338_H0343:436b-5	yang dag par lta ba la smad pa'o //	yang_0 'dag_5 ba_9 lta_13 ba_17 la_20 smad_23 ba_28 
K10D0338_H0343:436b-6	chos bcu po de dag ni shes rab 'chal bar 'gyur ba ste /	chos_0 'chu_5 po_9 de_12 'dag_15 ni_19 shes_22 rab_27 'chal_31 ba_37 'gyur_41 ba_47 ste_50 
