K10D0338_H0343:447b-1	de la mya ngan las 'das pa ring bar 'gyur ba dang /	de_0 la_3 mya_6 ngan_10 las_15 'da'_19 ba_24 ring_27 ba_32 'gyur_36 ba_42 dang_45 
K10D0338_H0343:447b-2	myos par 'gyur ba dang /	myos_0 ba_5 'gyur_9 ba_15 dang_18 
K10D0338_H0343:447b-3	myos par 'gyur ba'i las byed cing gsog pa dang /	myos_0 ba_5 'gyur_9 ba_15 las_20 byed_24 cing_29 gsog_34 ba_39 dang_42 
K10D0338_H0343:447b-4	lus dang bral nas shi ba'i 'og tu ngan song	lus_0 dang_4 'bral_9 nas_14 'chi_18 ba_22 'og_27 tu_31 ngan_34 'gro_39 
K10D0338_H0343:447b-5	ngan 'gro sems can dmyal ba rnams su skye ba'o	ngan_0 'gro_5 sems_10 can_15 dmyal_19 ba_25 rnams_28 su_34 skye_37 ba_42 
K10D0338_H0343:447b-6	// bram ze'i khye'u /	bram_3 ze_8 khye_13 
K10D0338_H0343:447b-7	de bzhin gshegs pa'i mchod rten la thal mo sbyar ba'i phan yod ni /	de_0 bzhin_3 gshegs_9 ba_16 mchod_21 rten_27 la_32 thal_35 mo_40 sbyor_43 ba_49 phan_54 yod_59 ni_63 
K10D0338_H0343:447b-8	bcu po 'di dag ste; bcu gang zhe na /	'chu_0 po_4 'di_7 'dag_11 ste;_15 'chu_20 gang_24 zhe_29 na_33 
K10D0338_H0343:447b-9	rgya chen po'i khyim du skye ba 'thob pa dang /	rgya_0 chen_5 po_10 khyim_15 du_21 skye_24 ba_29 'thob_32 ba_38 dang_41 
K10D0338_H0343:447b-10	rgya che ba'i gzugs dang /	rgya_0 che_5 ba_9 gzugs_14 dang_20 
K10D0338_H0343:447b-11	rgya che ba'i g-yog 'khor dang /	rgya_0 che_5 ba_9 g-yog_14 'khor_20 dang_26 
K10D0338_H0343:447b-12	rgya che ba'i mchod pa dang /	rgya_0 che_5 ba_9 mchod_14 ba_20 dang_23 
K10D0338_H0343:447b-13	bkur sti dang /	bkur_0 sti_5 dang_9 
K10D0338_H0343:447b-14	rgya che ba'i nor dang /	rgya_0 che_5 ba_9 nor_14 dang_18 
K10D0338_H0343:447b-15	rgya che ba'i thos pa dang /	rgya_0 che_5 ba_9 thos_14 ba_19 dang_22 
K10D0338_H0343:447b-16	rgya che ba'i dad pa dang /	rgya_0 che_5 ba_9 dad_14 ba_18 dang_21 
K10D0338_H0343:447b-17	rgya che ba'i dran pa dang /	rgya_0 che_5 ba_9 dran_14 ba_19 dang_22 
K10D0338_H0343:447b-18	rgya che ba'i shes rab dang /	rgya_0 che_5 ba_9 shes_14 rab_19 dang_23 
K10D0338_H0343:447b-19	rgya che ba'i rtogs pa thob pa ste /	rgya_0 che_5 ba_9 rtogs_14 ba_20 'thob_23 ba_28 ste_31 
K10D0338_H0343:447b-20	bcu po de dag ni /	'chu_0 po_4 de_7 'dag_10 ni_14 
K10D0338_H0343:447b-21	de bzhin gshegs pa'i mchod rten la thal mo sbyar ba'i phan yon no //	de_0 bzhin_3 gshegs_9 ba_16 mchod_21 rten_27 la_32 thal_35 mo_40 sbyor_43 ba_49 phan_54 yon_59 no_63 
K10D0338_H0343:447b-22	de bzhin gshegs pa'i mchod rten la phyag 'tshal ba'i phan yon bcu ste /	de_0 bzhin_3 gshegs_9 ba_16 mchod_21 rten_27 la_32 phyag_35 'tshal_41 ba_48 phan_53 yon_58 'chu_62 ste_66 
K10D0338_H0343:447b-23	bcu gang zhe na /	'chu_0 gang_4 zhe_9 na_13 
K10D0338_H0343:447b-24	gzugs bzang ste mdog gser gyi kha dog lta bur 'gyur ba dang /	gzugs_0 bzang_6 ste_12 mdog_16 gser_21 gyi_26 kha_30 dog_34 lta_38 bur_42 'gyur_46 ba_52 dang_55 
K10D0338_H0343:447b-25	mdzes te mig tu sdug par 'gyur ba dang /	mdzes_0 te_6 mig_9 tu_13 sdug_16 ba_21 'gyur_25 ba_31 dang_34 
K10D0338_H0343:447b-26	skad snyan cing gzung ba'i tshigs tu 'gyur ba bag	skad_0 snyan_5 cing_11 gzung_16 ba_22 tshigs_27 tu_34 'gyur_37 ba_43 bag_46 
K10D0338_H0343:447b-27	tsha ba med par 'khor gyi nang du 'gro ba	tsha_0 ba_5 med_8 ba_12 'khor_16 gyi_22 nang_26 du_31 'gro_34 ba_39 
K10D0338_H0343:447b-28	dang / lha dang mi rnams dga' bar 'gyur ba dang /	dang_0 lha_7 dang_11 mi_16 rnams_19 dga'_25 ba_30 'gyur_34 ba_40 dang_43 
K10D0338_H0343:447b-29	gzi brjid chen por 'gyur ba dang /	gzi_0 brjid_4 chen_10 por_15 'gyur_19 ba_25 dang_28 
K10D0338_H0343:447b-30	gzi brjid chen po'i gang zag /	gzi_0 brjid_4 chen_10 po_15 gang_20 zag_25 
K10D0338_H0343:447b-31	'di lta ste /	'di_0 lta_4 ste_8 
K10D0338_H0343:447b-32	sangs rgyas bcom ldan 'das rnams dang /	sangs_0 rgya_6 'joms_12 ldan_17 'da'_22 rnams_27 dang_33 
K10D0338_H0343:448a-0	byang chub @448a *//	byang_0 chub_6 
K10D0338_H0343:448a-1	sems dpa' rnams dang /	sems_0 dpa'_5 rnams_10 dang_16 
K10D0338_H0343:448a-2	sangs rgyas kyi nyan thos rnams dang 'grogs par 'gyur ba dang /	sangs_0 rgya_6 kyi_12 nyan_16 thos_21 rnams_26 dang_32 'grogs_37 ba_44 'gyur_48 ba_54 dang_57 
K10D0338_H0343:448a-3	longs spyod che bar 'gyur ba dang /	longs_0 spyod_6 che_12 ba_16 'gyur_20 ba_26 dang_29 
K10D0338_H0343:448a-4	mtho ris su skye bar 'gyur ba dang /	mtho_0 ris_5 su_9 skye_12 ba_17 'gyur_21 ba_27 dang_30 
K10D0338_H0343:448a-5	myur du yongs su mya ngan las 'da' ba ste /	myur_0 du_5 yongs_8 su_14 mya_17 ngan_21 las_26 'da'_30 ba_35 ste_38 
K10D0338_H0343:448a-6	bcu po 'di dag ni /	'chu_0 po_4 'di_7 'dag_11 ni_15 
K10D0338_H0343:448a-7	de bzhin gshegs pa'i mchod rten la phyag 'tshal ba'i phan yon no //	de_0 bzhin_3 gshegs_9 ba_16 mchod_21 rten_27 la_32 phyag_35 'tshal_41 ba_48 phan_53 yon_58 no_62 
K10D0338_H0343:448a-8	de bzhin gshegs pa'i mchod rten phyags pa'i phan yon bcu ste /	de_0 bzhin_3 gshegs_9 ba_16 mchod_21 rten_27 phyags_32 ba_39 phan_44 yon_49 'chu_53 ste_57 
K10D0338_H0343:448a-9	bcu gang zhe na /	'chu_0 gang_4 zhe_9 na_13 
K10D0338_H0343:448a-10	gzugs bzang ba dang /	gzugs_0 bzang_6 ba_12 dang_15 
K10D0338_H0343:448a-11	blta na sdug par 'gyur ba dang /	lta_0 na_5 sdug_8 ba_13 'gyur_17 ba_23 dang_26 
K10D0338_H0343:448a-12	mdzes par 'gyur ba dang /	mdzes_0 ba_6 'gyur_10 ba_16 dang_19 
K10D0338_H0343:448a-13	skad snyan par 'gyur ba dang /	skad_0 snyan_5 ba_11 'gyur_15 ba_21 dang_24 
K10D0338_H0343:448a-14	de'i 'dod chags dang /	de_0 'dod_5 chags_10 dang_16 
K10D0338_H0343:448a-15	zhe sdang dang /	zhe_0 sdang_4 dang_10 
K10D0338_H0343:448a-16	gti mug bsrab par 'gyur ba dang /	gti_0 mug_4 bsrab_8 ba_14 'gyur_18 ba_24 dang_27 
K10D0338_H0343:448a-17	lam du 'gro na rtsa ba dang /	lam_0 du_4 'gro_7 na_12 rtsa_15 ba_20 dang_23 
K10D0338_H0343:448a-18	gseg ma dang /	gseg_0 ma_5 dang_8 
K10D0338_H0343:448a-19	gyo mo rnams med par 'gyur ba dang /	gyo_0 mo_4 rnams_7 med_13 ba_17 'gyur_21 ba_27 dang_30 
K10D0338_H0343:448a-20	btsun pa'i rigs su skye bar 'gyur ba dang /	btsun_0 ba_6 rigs_11 su_16 skye_19 ba_24 'gyur_28 ba_34 dang_37 
K10D0338_H0343:448a-21	longs spyod che bar 'gyur ba dang /	longs_0 spyod_6 che_12 ba_16 'gyur_20 ba_26 dang_29 
K10D0338_H0343:448a-22	mtho ris su skye bar 'gyur ba dang /	mtho_0 ris_5 su_9 skye_12 ba_17 'gyur_21 ba_27 dang_30 
K10D0338_H0343:448a-23	myur du yongs su mya ngan las 'da' ba ste /	myur_0 du_5 yongs_8 su_14 mya_17 ngan_21 las_26 'da'_30 ba_35 ste_38 
K10D0338_H0343:448a-24	bcu po de dag ni /	'chu_0 po_4 de_7 'dag_10 ni_14 
K10D0338_H0343:448a-25	de bzhin gshegs pa'i mchod rten phyags pa'i phan yon no //	de_0 bzhin_3 gshegs_9 ba_16 mchod_21 rten_27 phyags_32 ba_39 phan_44 yon_49 no_53 
K10D0338_H0343:448a-26	de bzhin gshegs pa'i mchod rten la gdugs phul ba'i phan yon bcu ste /	de_0 bzhin_3 gshegs_9 ba_16 mchod_21 rten_27 la_32 gdugs_35 'bul_41 ba_46 phan_51 yon_56 'chu_60 ste_64 
K10D0338_H0343:448a-27	bcu gang zhe na; 'jig rten na gdugs lta bur 'gyur ba dang /	'chu_0 gang_4 zhe_9 na;_13 'jig_17 rten_22 na_27 gdugs_30 lta_36 bur_40 'gyur_44 ba_50 dang_53 
K10D0338_H0343:448a-28	lus la gdung ba med par 'gyur ba dang /	lus_0 la_4 gdung_7 ba_13 med_16 ba_20 'gyur_24 ba_30 dang_33 
K10D0338_H0343:448a-29	sems la gdung ba med par 'gyur ba dang /	sems_0 la_5 gdung_8 ba_14 med_17 ba_21 'gyur_25 ba_31 dang_34 
K10D0338_H0343:448b-0	'jig rten gyi rten du 'gyur ba @448b dang /	'jig_0 rten_5 gyi_10 rten_14 du_19 'gyur_22 ba_28 dang_37 
K10D0338_H0343:448b-1	bdag por 'gyur ba'i las byed cing gsog pa dang /	bdag_0 por_5 'gyur_9 ba_15 las_20 byed_24 cing_29 gsog_34 ba_39 dang_42 
K10D0338_H0343:448b-2	'khor los sgyur pa'i rgyal srid yang dang /	'khor_0 los_6 sgyur_10 ba_16 rgyal_21 srid_27 yang_32 dang_37 
K10D0338_H0343:448b-3	yang 'thob pa dang /	yang_0 'thob_5 ba_11 dang_14 
K10D0338_H0343:448b-4	dbang che bar grags par 'gyur ba dang /	dbang_0 che_6 ba_10 grags_14 ba_20 'gyur_24 ba_30 dang_33 
K10D0338_H0343:448b-5	longs spyod che bar 'gyur ba dang /	longs_0 spyod_6 che_12 ba_16 'gyur_20 ba_26 dang_29 
K10D0338_H0343:448b-6	mtho ris su skye bar 'gyur ba dang /	mtho_0 ris_5 su_9 skye_12 ba_17 'gyur_21 ba_27 dang_30 
K10D0338_H0343:448b-7	myur du yongs su mya ngan las 'da' ba ste /	myur_0 du_5 yongs_8 su_14 mya_17 ngan_21 las_26 'da'_30 ba_35 ste_38 
K10D0338_H0343:448b-8	bcu po 'di dag ni de bzhin gshegs pa'i mchod rten la gdugs phul ba'i phan yon no //	'chu_0 po_4 'di_7 'dag_11 ni_15 de_18 bzhin_21 gshegs_27 ba_34 mchod_39 rten_45 la_50 gdugs_53 'bul_59 ba_64 phan_69 yon_74 no_78 
K10D0338_H0343:448b-9	de bzhin gshegs pa'i mchod rten la dril bu phul ba'i phan yon bcu ste /	de_0 bzhin_3 gshegs_9 ba_16 mchod_21 rten_27 la_32 'dril_35 bu_40 'bul_43 ba_48 phan_53 yon_58 'chu_62 ste_66 
K10D0338_H0343:448b-10	bcu gang zhe na /	'chu_0 gang_4 zhe_9 na_13 
K10D0338_H0343:448b-11	gzugs bzang bar 'gyur ba dang /	gzugs_0 bzang_6 ba_12 'gyur_16 ba_22 dang_25 
K10D0338_H0343:448b-12	sgra snyan par 'gyur ba dang /	sgra_0 snyan_5 ba_11 'gyur_15 ba_21 dang_24 
K10D0338_H0343:448b-13	yid du 'ong ba smra ba dang ldan par 'gyur ba dang /	yid_0 du_4 'ong_7 ba_12 smra_15 ba_20 dang_23 ldan_28 ba_33 'gyur_37 ba_43 dang_46 
K10D0338_H0343:448b-14	ka la pingka'i sgra lta bur smra ba dang ldan par 'gyur ba dang /	ka_0 la_3 pingka_6 sgra_15 lta_20 bur_24 smra_28 ba_33 dang_36 ldan_41 ba_46 'gyur_50 ba_56 dang_59 
K10D0338_H0343:448b-15	gzung ba'i tshig tu 'gyur ba dang /	gzung_0 ba_6 tshig_11 tu_17 'gyur_20 ba_26 dang_29 
K10D0338_H0343:448b-16	rab tu dga' bar 'gyur ba dang /	rab_0 tu_4 dga'_7 ba_12 'gyur_16 ba_22 dang_25 
K10D0338_H0343:448b-17	kun tu dga' ba'i rgya chen po'i sgra 'thob pa dang /	kun_0 tu_4 dga'_7 ba_12 rgya_17 chen_22 po_27 sgra_32 'thob_37 ba_43 dang_46 
K10D0338_H0343:448b-18	longs spyod che bar 'gyur ba dang /	longs_0 spyod_6 che_12 ba_16 'gyur_20 ba_26 dang_29 
K10D0338_H0343:448b-19	mtho ris su skye bar 'gyur ba dang /	mtho_0 ris_5 su_9 skye_12 ba_17 'gyur_21 ba_27 dang_30 
K10D0338_H0343:448b-20	myur du yongs su mya ngan las 'da' ba ste /	myur_0 du_5 yongs_8 su_14 mya_17 ngan_21 las_26 'da'_30 ba_35 ste_38 
K10D0338_H0343:448b-21	bcu po de dag ni de bzhin gshegs pa'i mchod rten la dril bu dbul pa'i phan yon no //	'chu_0 po_4 de_7 'dag_10 ni_14 de_17 bzhin_20 gshegs_26 ba_33 mchod_38 rten_44 la_49 'dril_52 bu_57 'bul_60 ba_65 phan_70 yon_75 no_79 
K10D0338_H0343:448b-22	de bzhin gshegs pa'i mchod rten la ba dan dbul ba'i phan yon bcu ste; bcu gang zhe na /	de_0 bzhin_3 gshegs_9 ba_16 mchod_21 rten_27 la_32 ba_35 dan_38 'bul_42 ba_47 phan_52 yon_57 'chu_61 ste;_65 'chu_70 gang_74 zhe_79 na_83 
K10D0338_H0343:448b-23	'jig rten na rgyal mtshan lta bur 'gyur ba dang /	'jig_0 rten_5 na_10 rgyal_13 mtshan_19 lta_26 bur_30 'gyur_34 ba_40 dang_43 
K10D0338_H0343:448b-24	mdza' bshes dang /	mdza'_0 bshes_6 dang_12 
K10D0338_H0343:448b-25	blon po dang /	blon_0 po_5 dang_8 
K10D0338_H0343:448b-26	nye du dang /	nye_0 du_4 dang_7 
K10D0338_H0343:448b-27	snag gi gnyen mtshams rnams kyis bsti stang du byed /	snag_0 gi_5 gnyen_8 mtshams_14 rnams_22 kyis_28 sti_33 stang_38 du_44 byed_47 
K10D0338_H0343:449a-0	@449a *// bla mar byed /	bla_10 mar_14 byed_18 
K10D0338_H0343:449a-1	ri mor byed /	ri_0 mor_3 byed_7 
K10D0338_H0343:449a-2	mchod par byed pa dang /	mchod_0 ba_6 byed_10 ba_15 dang_18 
K10D0338_H0343:449a-3	phyogs dang phyogs mtshams rnams su de'i grags pa dang /	phyogs_0 dang_7 phyogs_12 mtshams_19 rnams_27 su_33 de_36 grags_41 ba_47 dang_50 
K10D0338_H0343:449a-4	brjod pa dang /	rjod_0 ba_6 dang_9 
K10D0338_H0343:449a-5	sgra dang tshigs su bcad pa mngon du 'byung ba dang /	sgra_0 dang_5 tshigs_10 su_17 gcod_20 ba_25 mngon_28 du_34 'byung_37 ba_44 dang_47 
K10D0338_H0343:449a-6	gzugs bzang zhing blta na sdug la mdzes par 'gyur ba dang /	gzugs_0 bzang_6 zhing_12 lta_18 na_23 sdug_26 la_31 mdzes_34 ba_40 'gyur_44 ba_50 dang_53 
K10D0338_H0343:449a-7	skye ba gzhan rnams su tshe ring zhing ring du gnas par 'gyur ba dang /	skye_0 ba_5 gzhan_8 rnams_14 su_20 tshe_23 ring_28 zhing_33 ring_39 du_44 gnas_47 ba_52 'gyur_56 ba_62 dang_65 
K10D0338_H0343:449a-8	dbang che bar grags par 'gyur ba dang /	dbang_0 che_6 ba_10 grags_14 ba_20 'gyur_24 ba_30 dang_33 
K10D0338_H0343:449a-9	rigs btsun par skye bar 'gyur ba dang /	rigs_0 btsun_5 ba_11 skye_15 ba_20 'gyur_24 ba_30 dang_33 
K10D0338_H0343:449a-10	longs spyod chen por 'gyur ba dang /	longs_0 spyod_6 chen_12 por_17 'gyur_21 ba_27 dang_30 
K10D0338_H0343:449a-11	mtho ris su skye bar 'gyur ba dang /	mtho_0 ris_5 su_9 skye_12 ba_17 'gyur_21 ba_27 dang_30 
K10D0338_H0343:449a-12	myur du yongs su mya ngan las 'da' ba ste /	myur_0 du_5 yongs_8 su_14 mya_17 ngan_21 las_26 'da'_30 ba_35 ste_38 
K10D0338_H0343:449a-13	bcu po de dag ni de bzhin gshegs pa'i mchod rten la ba dan phul ba'i phan yon no //	'chu_0 po_4 de_7 'dag_10 ni_14 de_17 bzhin_20 gshegs_26 ba_33 mchod_38 rten_44 la_49 ba_52 dan_55 'bul_59 ba_64 phan_69 yon_74 no_78 
K10D0338_H0343:449a-14	de bzhin gshegs pa'i mchod rten la gos phul ba'i phan yon bcu gnyis te /	de_0 bzhin_3 gshegs_9 ba_16 mchod_21 rten_27 la_32 gos_35 'bul_39 ba_44 phan_49 yon_54 'chu_58 gnyis_62 te_68 
K10D0338_H0343:449a-15	bcu gnyis gang zhe na /	'chu_0 gnyis_4 gang_10 zhe_15 na_19 
K10D0338_H0343:449a-16	mdzes shing blta na sdug par 'gyur ba dang /	mdzes_0 shing_6 lta_12 na_17 sdug_20 ba_25 'gyur_29 ba_35 dang_38 
K10D0338_H0343:449a-17	pags pa 'jam pa dang /	pags_0 ba_5 'jam_8 ba_13 dang_16 
K10D0338_H0343:449a-18	pags pa snum pa dang /	pags_0 ba_5 snum_8 ba_13 dang_16 
K10D0338_H0343:449a-19	pags pa srab pa dang /	pags_0 ba_5 srab_8 ba_13 dang_16 
K10D0338_H0343:449a-20	de'i lus la rdul dang /	de_0 lus_5 la_9 rdul_12 dang_17 
K10D0338_H0343:449a-21	dri ma mi 'chags pa dang /	'dri_0 ma_4 mi_7 'chag_10 ba_17 dang_20 
K10D0338_H0343:449a-22	de'i gos bzang por 'gyur ba dang /	de_0 gos_5 bzang_9 por_15 'gyur_19 ba_25 dang_28 
K10D0338_H0343:449a-23	gding ba dang /	'ding_0 ba_6 dang_9 
K10D0338_H0343:449a-24	bgo ba phra mo rnyed par 'gyur ba dang /	bgod_0 ba_4 phra_7 mo_12 rnyed_15 ba_21 'gyur_25 ba_31 dang_34 
K10D0338_H0343:449a-25	ngo tsha shes pa dang /	ngo_0 tsha_4 shes_9 ba_14 dang_17 
K10D0338_H0343:449a-26	khrel yod pa phun sum tshogs par 'gyur ba dang /	'khrel_0 yod_6 ba_10 phun_13 sum_18 tshogs_22 ba_29 'gyur_33 ba_39 dang_42 
K10D0338_H0343:449a-27	mthong na dga' bar 'gyur ba dang /	mthong_0 na_7 dga'_10 ba_15 'gyur_19 ba_25 dang_28 
K10D0338_H0343:449a-28	longs spyod che bar 'gyur ba dang /	longs_0 spyod_6 che_12 ba_16 'gyur_20 ba_26 dang_29 
K10D0338_H0343:449b-0	mtho ris su skye bar 'gyur ba @449b dang /	mtho_0 ris_5 su_9 skye_12 ba_17 'gyur_21 ba_27 dang_36 
K10D0338_H0343:449b-1	myur du yongs su mya ngan las 'da' ba ste /	myur_0 du_5 yongs_8 su_14 mya_17 ngan_21 las_26 'da'_30 ba_35 ste_38 
K10D0338_H0343:449b-2	bcu gnyis po de dag ni de bzhin gshegs pa'i mchod rten la gos phul pa'i phan yon no //	'chu_0 gnyis_4 po_10 de_13 'dag_16 ni_20 de_23 bzhin_26 gshegs_32 ba_39 mchod_44 rten_50 la_55 gos_58 'bul_62 ba_67 phan_72 yon_77 no_81 
K10D0338_H0343:449b-3	de bzhin gshegs pa'i mchod rten la me tog phul ba'i phan yon bcu ste /	de_0 bzhin_3 gshegs_9 ba_16 mchod_21 rten_27 la_32 me_35 tog_38 'bul_42 ba_47 phan_52 yon_57 'chu_61 ste_65 
K10D0338_H0343:449b-4	bcu gang zhe na /	'chu_0 gang_4 zhe_9 na_13 
K10D0338_H0343:449b-5	'jig rten na me tog lta bur 'gyur ba dang /	'jig_0 rten_5 na_10 me_13 tog_16 lta_20 bur_24 'gyur_28 ba_34 dang_37 
K10D0338_H0343:449b-6	de'i sna'i dbang po nam yang nyams par mi 'gyur ba dang /	de_0 sna_5 dbang_11 po_17 nam_20 yang_24 nyams_29 ba_35 mi_39 'gyur_42 ba_48 dang_51 
K10D0338_H0343:449b-7	lus kyi dri nga ba rnam par dag par 'gyur ba dang /	lus_0 kyi_4 'dri_8 nga_12 ba_16 rnam_19 ba_24 'dag_28 ba_32 'gyur_36 ba_42 dang_45 
K10D0338_H0343:449b-8	dri zhim po 'byung bar 'gyur ba dang /	'dri_0 zhim_4 po_9 'byung_12 ba_19 'gyur_23 ba_29 dang_32 
K10D0338_H0343:449b-9	phyogs dang phyogs mtshams rnams su de'i tshul khrims kyi dri'i ngad ldang bar 'gyur ba dang /	phyogs_0 dang_7 phyogs_12 mtshams_19 rnams_27 su_33 de_36 tshul_41 khrims_47 kyi_54 'dri_58 ngad_64 ldang_69 ba_75 'gyur_79 ba_85 dang_88 
K10D0338_H0343:449b-10	'jig rten gyis mngon du 'gro bar bya bar 'gyur ba dang /	'jig_0 rten_5 gyis_10 mngon_15 du_21 'gro_24 ba_29 byed_33 ba_37 'gyur_41 ba_47 dang_50 
K10D0338_H0343:449b-11	sdug pa'i chos rnams 'thob par 'gyur ba dang /	sdug_0 ba_5 chos_10 rnams_15 'thob_21 ba_27 'gyur_31 ba_37 dang_40 
K10D0338_H0343:449b-12	longs spyod che bar 'gyur ba dang /	longs_0 spyod_6 che_12 ba_16 'gyur_20 ba_26 dang_29 
K10D0338_H0343:449b-13	mtho ris su skye bar 'gyur ba dang /	mtho_0 ris_5 su_9 skye_12 ba_17 'gyur_21 ba_27 dang_30 
K10D0338_H0343:449b-14	myur du yongs su mya ngan las 'da' ba ste /	myur_0 du_5 yongs_8 su_14 mya_17 ngan_21 las_26 'da'_30 ba_35 ste_38 
K10D0338_H0343:449b-15	bcu po de dag ni de bzhin gshegs pa'i mchod rten la me tog phul pa'i phan yon no //	'chu_0 po_4 de_7 'dag_10 ni_14 de_17 bzhin_20 gshegs_26 ba_33 mchod_38 rten_44 la_49 me_52 tog_55 'bul_59 ba_64 phan_69 yon_74 no_78 
K10D0338_H0343:449b-16	de bzhin gshegs pa'i mchod rten la phreng ba phul ba'i phan yon bcu ste /	de_0 bzhin_3 gshegs_9 ba_16 mchod_21 rten_27 la_32 phreng_35 ba_42 'bul_45 ba_50 phan_55 yon_60 'chu_64 ste_68 
K10D0338_H0343:449b-17	bcu gang zhe na /	'chu_0 gang_4 zhe_9 na_13 
K10D0338_H0343:449b-18	'jig rten na phreng ba lta bur 'gyur ba dang /	'jig_0 rten_5 na_10 phreng_13 ba_20 lta_23 bur_27 'gyur_31 ba_37 dang_40 
K10D0338_H0343:449b-19	lus kyi dri nga ba rnam par dag par 'gyur ba dang /	lus_0 kyi_4 'dri_8 nga_12 ba_16 rnam_19 ba_24 'dag_28 ba_32 'gyur_36 ba_42 dang_45 
K10D0338_H0343:449b-20	phyogs dang phyogs mtshams rnams su tshul khrims kyi dri zhim po'i ngad ldang ba dang /	phyogs_0 dang_7 phyogs_12 mtshams_19 rnams_27 su_33 tshul_36 khrims_42 kyi_49 'dri_53 zhim_57 po_62 ngad_67 ldang_72 ba_78 dang_81 
K10D0338_H0343:449b-21	rtag tu dri zhim por 'gyur ba dang brgyan par 'gyur ba dang /	rtag_0 tu_5 'dri_8 zhim_12 por_17 'gyur_21 ba_27 dang_30 rgyan_35 ba_42 'gyur_46 ba_52 dang_55 
K10D0338_H0343:450a-0	g-yog 'khor mi phyed par 'gyur @450a *//	g-yog_0 'khor_6 mi_12 phyed_15 ba_21 'gyur_25 
K10D0338_H0343:450a-1	ba dang /	ba_0 dang_3 
K10D0338_H0343:450a-2	skyes pa dang /	skye_0 ba_6 dang_9 
K10D0338_H0343:450a-3	bud med rnams kyi yid du 'ong bar 'gyur ba dang /	'bud_0 med_4 rnams_8 kyi_14 yid_18 du_22 'ong_25 ba_30 'gyur_34 ba_40 dang_43 
K10D0338_H0343:450a-4	longs spyod che bar 'gyur ba dang /	longs_0 spyod_6 che_12 ba_16 'gyur_20 ba_26 dang_29 
K10D0338_H0343:450a-5	mtho ris su skye bar 'gyur ba dang /	mtho_0 ris_5 su_9 skye_12 ba_17 'gyur_21 ba_27 dang_30 
K10D0338_H0343:450a-6	myur du yongs su mya ngan las 'da' ste /	myur_0 du_5 yongs_8 su_14 mya_17 ngan_21 las_26 'da'_30 ste_35 
K10D0338_H0343:450a-7	bcu po de dag ni de bzhin gshegs pa'i mchod rten la phreng ba phul ba'i phan yon no //	'chu_0 po_4 de_7 'dag_10 ni_14 de_17 bzhin_20 gshegs_26 ba_33 mchod_38 rten_44 la_49 phreng_52 ba_59 'bul_62 ba_67 phan_72 yon_77 no_81 
K10D0338_H0343:450a-8	de bzhin gshegs pa'i mchod rten la mar me phul ba'i phan yon bcu ste /	de_0 bzhin_3 gshegs_9 ba_16 mchod_21 rten_27 la_32 mar_35 me_39 'bul_42 ba_47 phan_52 yon_57 'chu_61 ste_65 
K10D0338_H0343:450a-9	bcu gang zhe na /	'chu_0 gang_4 zhe_9 na_13 
K10D0338_H0343:450a-10	'jig rten na mar me lta bur 'gyur ba dang /	'jig_0 rten_5 na_10 mar_13 me_17 lta_20 bur_24 'gyur_28 ba_34 dang_37 
K10D0338_H0343:450a-11	sha'i mig rnam par dag par 'gyur ba dang /	sha_0 mig_6 rnam_10 ba_15 'dag_19 ba_23 'gyur_27 ba_33 dang_36 
K10D0338_H0343:450a-12	lha'i mig 'thob par 'gyur ba dang /	lha_0 mig_6 'thob_10 ba_16 'gyur_20 ba_26 dang_29 
K10D0338_H0343:450a-13	dge ba dang /	dge_0 ba_4 dang_7 
K10D0338_H0343:450a-14	mi dge ba'i chos rnams la shes rab 'byung bar 'gyur ba dang /	mi_0 dge_3 ba_7 chos_12 rnams_17 la_23 shes_26 rab_31 'byung_35 ba_42 'gyur_46 ba_52 dang_55 
K10D0338_H0343:450a-15	ma rig pa dang /	ma_0 rig_3 ba_7 dang_10 
K10D0338_H0343:450a-16	gti mug gi mun pa sel ba dang /	gti_0 mug_4 gi_8 mun_11 ba_15 sel_18 ba_22 dang_25 
K10D0338_H0343:450a-17	shes rab kyi snang ba thob par 'gyur ba dang /	shes_0 rab_5 kyi_9 snang_13 ba_19 'thob_22 ba_27 'gyur_31 ba_37 dang_40 
K10D0338_H0343:450a-18	de 'khor ba na 'khor ba'i tshe /	de_0 'khor_3 ba_9 na_12 'khor_15 ba_21 tshe_26 
K10D0338_H0343:450a-19	nam du yang mun pa na gnas par mi 'gyur ba dang /	nam_0 du_4 yang_7 mun_12 ba_16 na_19 gnas_22 ba_27 mi_31 'gyur_34 ba_40 dang_43 
K10D0338_H0343:450a-20	longs spyod che bar 'gyur ba dang /	longs_0 spyod_6 che_12 ba_16 'gyur_20 ba_26 dang_29 
K10D0338_H0343:450a-21	mtho ris su skye bar 'gyur ba dang /	mtho_0 ris_5 su_9 skye_12 ba_17 'gyur_21 ba_27 dang_30 
K10D0338_H0343:450a-22	myur du yongs su mya ngan las 'da' ba ste /	myur_0 du_5 yongs_8 su_14 mya_17 ngan_21 las_26 'da'_30 ba_35 ste_38 
K10D0338_H0343:450a-23	bcu po de dag ni de bzhin gshegs pa'i mchod rten la mar me phul ba'i phan yon no //	'chu_0 po_4 de_7 'dag_10 ni_14 de_17 bzhin_20 gshegs_26 ba_33 mchod_38 rten_44 la_49 mar_52 me_56 'bul_59 ba_64 phan_69 yon_74 no_78 
K10D0338_H0343:450a-24	de bzhin gshegs pa'i mchod rten la spos phul ba'i phan yon bcu ste /	de_0 bzhin_3 gshegs_9 ba_16 mchod_21 rten_27 la_32 spros_35 'bul_40 ba_45 phan_50 yon_55 'chu_59 ste_63 
K10D0338_H0343:450a-25	bcu gang zhe na /	'chu_0 gang_4 zhe_9 na_13 
K10D0338_H0343:450a-26	'jig rten na spos lta bur 'gyur ba dang /	'jig_0 rten_5 na_10 spros_13 lta_18 bur_22 'gyur_26 ba_32 dang_35 
K10D0338_H0343:450a-27	sna'i dbang po rnam par dag par 'gyur ba dang /	sna_0 dbang_6 po_12 rnam_15 ba_20 'dag_24 ba_28 'gyur_32 ba_38 dang_41 
K10D0338_H0343:450b-0	lus kyi dri mi zhim pa @450b rnam par dag par 'gyur ba dang /	lus_0 kyi_4 'dri_8 mi_12 zhim_15 ba_20 rnam_29 ba_34 'dag_38 ba_42 'gyur_46 ba_52 dang_55 
K10D0338_H0343:450b-1	rtag tu dri zhim par 'gyur ba dang /	rtag_0 tu_5 'dri_8 zhim_12 ba_17 'gyur_21 ba_27 dang_30 
K10D0338_H0343:450b-2	gzugs bzang bar 'gyur ba dang /	gzugs_0 bzang_6 ba_12 'gyur_16 ba_22 dang_25 
K10D0338_H0343:450b-3	'jig rten gyis mngon du 'gro bar 'gyur ba dang /	'jig_0 rten_5 gyis_10 mngon_15 du_21 'gro_24 ba_29 'gyur_33 ba_39 dang_42 
K10D0338_H0343:450b-4	sdug pa'i chos rnams 'thob par 'gyur ba dang /	sdug_0 ba_5 chos_10 rnams_15 'thob_21 ba_27 'gyur_31 ba_37 dang_40 
K10D0338_H0343:450b-5	longs spyod che bar 'gyur ba dang /	longs_0 spyod_6 che_12 ba_16 'gyur_20 ba_26 dang_29 
K10D0338_H0343:450b-6	mtho ris su skye bar 'gyur ba dang /	mtho_0 ris_5 su_9 skye_12 ba_17 'gyur_21 ba_27 dang_30 
K10D0338_H0343:450b-7	myur du yongs su mya ngan las 'da' ba ste /	myur_0 du_5 yongs_8 su_14 mya_17 ngan_21 las_26 'da'_30 ba_35 ste_38 
K10D0338_H0343:450b-8	bcu po de dag ni de bzhin gshegs pa'i mchod rten la spos phul ba'i phan yon no //	'chu_0 po_4 de_7 'dag_10 ni_14 de_17 bzhin_20 gshegs_26 ba_33 mchod_38 rten_44 la_49 spros_52 'bul_57 ba_62 phan_67 yon_72 no_76 
K10D0338_H0343:450b-9	de bzhin gshegs pa'i mchod rten la rol mo sil snyan phul ba'i phan yon bcu ste /	de_0 bzhin_3 gshegs_9 ba_16 mchod_21 rten_27 la_32 rol_35 mo_39 sil_42 snyan_46 'bul_52 ba_57 phan_62 yon_67 'chu_71 ste_75 
K10D0338_H0343:450b-10	bcu gang zhe na /	'chu_0 gang_4 zhe_9 na_13 
K10D0338_H0343:450b-11	gzugs bzang zhing blta na sdug par 'gyur ba dang /	gzugs_0 bzang_6 zhing_12 lta_18 na_23 sdug_26 ba_31 'gyur_35 ba_41 dang_44 
K10D0338_H0343:450b-12	skad snyan par 'gyur ba dang /	skad_0 snyan_5 ba_11 'gyur_15 ba_21 dang_24 
K10D0338_H0343:450b-13	yid du 'ong bar smra ba dang ldan par 'gyur ba dang /	yid_0 du_4 'ong_7 ba_12 smra_16 ba_21 dang_24 ldan_29 ba_34 'gyur_38 ba_44 dang_47 
K10D0338_H0343:450b-14	grags pa dang ldan par 'gyur ba dang /	grags_0 ba_6 dang_9 ldan_14 ba_19 'gyur_23 ba_29 dang_32 
K10D0338_H0343:450b-15	gzung ba'i tshig tu 'gyur ba dang /	gzung_0 ba_6 tshig_11 tu_17 'gyur_20 ba_26 dang_29 
K10D0338_H0343:450b-16	rtag tu dga' bar 'gyur ba dang /	rtag_0 tu_5 dga'_8 ba_13 'gyur_17 ba_23 dang_26 
K10D0338_H0343:450b-17	kun dga' ba'i sgra rgya chen po 'thob par 'gyur ba dang /	kun_0 dga'_4 ba_9 sgra_14 rgya_19 chen_24 po_29 'thob_32 ba_38 'gyur_42 ba_48 dang_51 
K10D0338_H0343:450b-18	longs spyod che bar 'gyur ba dang /	longs_0 spyod_6 che_12 ba_16 'gyur_20 ba_26 dang_29 
K10D0338_H0343:450b-19	mtho ris su skye bar 'gyur ba dang /	mtho_0 ris_5 su_9 skye_12 ba_17 'gyur_21 ba_27 dang_30 
K10D0338_H0343:450b-20	myur du yongs su mya ngan las 'da' ba ste /	myur_0 du_5 yongs_8 su_14 mya_17 ngan_21 las_26 'da'_30 ba_35 ste_38 
K10D0338_H0343:450b-21	bcu po de dag ni de bzhin gshegs pa'i mchod	'chu_0 po_4 de_7 'dag_10 ni_14 de_17 bzhin_20 gshegs_26 ba_33 mchod_38 
K10D0338_H0343:450b-22	rten la rol mo sil snyan phul ba'i phan yon	rten_0 la_5 rol_8 mo_12 sil_15 snyan_19 'bul_25 ba_30 phan_35 yon_40 
K10D0338_H0343:450b-23	no; ;de bzhin gshegs pa'i mchod rten byed pa'i phan	no;_0 ;de_4 bzhin_8 gshegs_14 ba_21 mchod_26 rten_32 byed_37 ba_42 phan_47 
K10D0338_H0343:450b-24	yon bco brgyad de /	yon_0 'chos_4 brgyad_8 de_15 
K10D0338_H0343:450b-25	bco brgyad gang zhe na /	'chos_0 brgyad_4 gang_11 zhe_16 na_20 
K10D0338_H0343:450b-26	rgya chen po'i khyim du skye bar 'gyur ba thob pa dang /	rgya_0 chen_5 po_10 khyim_15 du_21 skye_24 ba_29 'gyur_33 ba_39 'thob_42 ba_47 dang_50 
K10D0338_H0343:451a-0	gzugs bzang @451a *//	gzugs_0 bzang_6 
K10D0338_H0343:451a-1	bar 'gyur ba dang /	ba_0 'gyur_4 ba_10 dang_13 
K10D0338_H0343:451a-2	mdzes shing mig tu sdug par 'gyur ba dang /	mdzes_0 shing_6 mig_12 tu_16 sdug_19 ba_24 'gyur_28 ba_34 dang_37 
K10D0338_H0343:451a-3	dbang che bar grags par 'gyur ba dang /	dbang_0 che_6 ba_10 grags_14 ba_20 'gyur_24 ba_30 dang_33 
K10D0338_H0343:451a-4	g-yog 'khor chen por 'gyur ba dang /	g-yog_0 'khor_6 chen_12 por_17 'gyur_21 ba_27 dang_30 
K10D0338_H0343:451a-5	g-yog 'khor mi phyed par 'gyur ba dang /	g-yog_0 'khor_6 mi_12 phyed_15 ba_21 'gyur_25 ba_31 dang_34 
K10D0338_H0343:451a-6	longs spyod che bar 'gyur ba dang /	longs_0 spyod_6 che_12 ba_16 'gyur_20 ba_26 dang_29 
K10D0338_H0343:451a-7	mngon du 'gro bar bya bar 'gyur ba dang /	mngon_0 du_6 'gro_9 ba_14 byed_18 ba_22 'gyur_26 ba_32 dang_35 
K10D0338_H0343:451a-8	rten du 'gyur ba dang /	rten_0 du_5 'gyur_8 ba_14 dang_17 
