K10D0272_H0274:87b-17	byang chub sems dpa' dang /	byang_0 chub_6 sems_11 dpa'_16 dang_21 
K10D0272_H0274:87b-18	dge slong de dag dang /	dge_0 slong_4 de_10 'dag_13 dang_17 
K10D0272_H0274:87b-19	lha dang /	lha_0 dang_4 
K10D0272_H0274:87b-20	mi dang /	mi_0 dang_3 
K10D0272_H0274:87b-21	lha ma yin dang /	lha_0 ma_4 yin_7 dang_11 
K10D0272_H0274:87b-22	dri zar bcas pa'i 'jig rten rnams yi rang ste /	'dri_0 zar_4 'cha'_8 ba_13 'jig_18 rten_23 rnams_28 yi_34 rang_37 ste_42 
K10D0272_H0274:87b-23	bcom ldan 'das kyis gsungs pa la mngon par dga'//	'joms_0 ldan_5 'da'_10 kyis_15 gsungs_20 ba_27 la_30 mngon_33 ba_39 
K10D0272_H0274:87b-24	sangs rgyas bcu pa zhes bya ba theg pa chen po'i mdo rdzogs so ////	sangs_0 rgya_6 'chu_12 ba_16 zhes_19 byed_24 ba_28 theg_31 ba_36 chen_39 po_44 mdo_49 rdzogs_53 so_60 
K10D0272_H0274:87b-25	rgya gar gyi mkhan po pra dzny'a warma la sogs pa dang /	rgya_0 gar_5 gyi_9 mkhan_13 po_19 pra_22 dzny_26 warma_33 la_39 sogs_42 ba_47 dang_50 
K10D0272_H0274:88a-0	zhus chen @88a *//	zhus_0 chen_5 
K10D0272_H0274:88a-1	gyi lo ts'a ba bande ye shes sde la sogs pas bsgyur cing zhus te gtan la phab pa //	gyi_0 lo_4 ts_7 ba_12 bande_15 ye_21 shes_24 sde_29 la_33 sogs_36 ba_41 sgyur_45 cing_52 zhus_57 te_62 gtan_65 la_70 'bebs_73 ba_78 
