K10D0160_H0161:67a-31	phyin ci log tu mthong ba'i tshul gyis smra ba smig rgyu lta bur blta'o //	phyin_0 ci_6 log_9 tu_13 mthong_16 ba_23 tshul_28 gyis_34 smra_39 ba_44 smig_47 rgyu_52 lta_57 bur_61 lta_65 
K10D0160_H0161:67a-32	mi 'byung mi 'jig pa'i tshul gyis smra ba nam mkha' lta bur blta'o //	mi_0 'byung_3 mi_10 'jig_13 ba_18 tshul_23 gyis_29 smra_34 ba_39 nam_42 mkha'_46 lta_52 bur_56 lta_60 
K10D0160_H0161:67a-33	brjod du med pa'i tshul gyis smra ba smrar med par blta'o //	rjod_0 du_6 med_9 ba_13 tshul_18 gyis_24 smra_29 ba_34 smrar_37 med_43 ba_47 lta_51 
K10D0160_H0161:67a-34	tshangs pa /	tshangs_0 ba_8 
K10D0160_H0161:67a-35	byang chub sems dpa' gang chos smra ba 'di shes	byang_0 chub_6 sems_11 dpa'_16 gang_21 chos_26 smra_31 ba_36 'di_39 shes_43 
K10D0160_H0161:67b-0	na byang chub @67b sems dpa' de dag ni smra	na_0 byang_3 chub_9 sems_19 dpa'_24 de_29 'dag_32 ni_36 smra_39 
K10D0160_H0161:67b-1	ba thams cad smra'ang chos gang la'ang mngon par mi	ba_0 thams_3 cad_9 smra_13 chos_22 gang_27 la_32 mngon_39 ba_45 mi_49 
K10D0160_H0161:67b-2	chags so // de mngon par ma chags pas ye	chags_0 so_6 de_12 mngon_15 ba_21 ma_25 chags_28 ba_34 ye_38 
K10D0160_H0161:67b-3	shes thogs pa med pa'i spobs pa gang gis bskal	shes_0 thogs_5 ba_11 med_14 ba_18 spobs_23 ba_29 gang_32 gis_37 bskal_41 
K10D0160_H0161:67b-4	pa gangg'a'i klung gi bye ma snyed du chos bshad	ba_0 gangg'i_3 klung_13 gi_19 'bye_22 ma_26 snyed_29 du_35 chos_38 'chad_43 
K10D0160_H0161:67b-5	kyang rgyun mi chad pa dang /	kyang_0 rgyun_6 mi_12 'chad_15 ba_20 dang_23 
K10D0160_H0161:67b-6	smra ba thams cad kyang chos kyi dbyings dang tha mi dad par smra ba dang /	smra_0 ba_5 thams_8 cad_14 kyang_18 chos_24 kyi_29 dbyings_33 dang_41 tha_46 mi_50 dad_53 ba_57 smra_61 ba_66 dang_69 
K10D0160_H0161:67b-7	chos rnams kyi tha mi dad pa la'ang mngon par	chos_0 rnams_5 kyi_11 tha_15 mi_19 dad_22 ba_26 la_29 mngon_36 ba_42 
K10D0160_H0161:67b-8	chags par mi 'gyur ba'i ye shes thogs pa med	chags_0 ba_6 mi_10 'gyur_13 ba_19 ye_24 shes_27 thogs_32 ba_38 med_41 
K10D0160_H0161:67b-9	pa'i spobs pa thob bo //	ba_0 spobs_5 ba_11 'thob_14 'bo_19 
K10D0160_H0161:67b-10	tshangs pa /	tshangs_0 ba_8 
K10D0160_H0161:67b-11	de bzhin gshegs pas de ltar gsungs pas chos rnams brjod do //	de_0 bzhin_3 gshegs_9 ba_16 de_20 ltar_23 gsungs_28 ba_35 chos_39 rnams_44 rjod_50 do_56 
K10D0160_H0161:67b-12	tshangs pa /	tshangs_0 ba_8 
K10D0160_H0161:67b-13	de la ji ltar na byang chub sems dpa' de	de_0 la_3 ji_6 ltar_9 na_14 byang_17 chub_23 sems_28 dpa'_33 de_38 
K10D0160_H0161:67b-14	bzhin gshegs pa'i ldem po dag la mkhas pa khong	bzhin_0 gshegs_6 ba_13 ldem_18 po_23 'dag_26 la_30 mkhas_33 ba_39 khong_42 
K10D0160_H0161:67b-15	du chud ce na /	du_0 chud_3 ce_8 na_11 
K10D0160_H0161:67b-16	tshangs pa /	tshangs_0 ba_8 
K10D0160_H0161:67b-17	'di la de bzhin gshegs pa kun nas nyon mongs pa'ang rnam par byang bar ston /	'di_0 la_4 de_7 bzhin_10 gshegs_16 ba_23 kun_26 nas_30 nyon_34 mongs_39 ba_45 rnam_52 ba_57 byang_61 ba_67 ston_71 
K10D0160_H0161:67b-18	rnam par byang ba'ang kun nas nyon mongs par ston te /	rnam_0 ba_5 byang_9 ba_15 kun_22 nas_26 nyon_30 mongs_35 ba_41 ston_45 te_50 
K10D0160_H0161:67b-19	de las byang chub sems dpa' ldem po dag tu shes par bya'o //	de_0 las_3 byang_7 chub_13 sems_18 dpa'_23 ldem_28 po_33 'dag_36 tu_40 shes_43 ba_48 byed_52 
K10D0160_H0161:67b-20	tshangs pa /	tshangs_0 ba_8 
K10D0160_H0161:67b-21	de bzhin gshegs pa kun nas nyon mongs pa la rnam par byang bar ji ltar ston ce na /	de_0 bzhin_3 gshegs_9 ba_16 kun_19 nas_23 nyon_27 mongs_32 ba_38 la_41 rnam_44 ba_49 byang_53 ba_59 ji_63 ltar_66 ston_71 ce_76 na_79 
K10D0160_H0161:67b-22	kun nas nyon mongs pa'i ngo bo nyid rlom sems	kun_0 nas_4 nyon_8 mongs_13 ba_19 ngo_24 'bo_28 nyid_31 rlom_36 sems_41 
K10D0160_H0161:67b-23	med pa'i phyir kun nas nyon mongs pa rnam par	med_0 ba_4 phyir_9 kun_15 nas_19 nyon_23 mongs_28 ba_34 rnam_37 ba_42 
K10D0160_H0161:67b-24	byang bar ston to //	byang_0 ba_6 ston_10 to_15 
K10D0160_H0161:67b-25	rnam par byang ba kun nas nyon mongs par ji ltar ston ce na /	rnam_0 ba_5 byang_9 ba_15 kun_18 nas_22 nyon_26 mongs_31 ba_37 ji_41 ltar_44 ston_49 ce_54 na_57 
K10D0160_H0161:67b-26	rnam par byang ba'i ngo bo nyid rlom sems med pa'i phyir te /	rnam_0 ba_5 byang_9 ba_15 ngo_20 'bo_24 nyid_27 rlom_32 sems_37 med_42 ba_46 phyir_51 te_57 
K10D0160_H0161:68a-0	de ltar rnam par byang ba kun nas nyon mongs par ston @68a *//	de_0 ltar_3 rnam_8 ba_13 byang_17 ba_23 kun_26 nas_30 nyon_34 mongs_39 ba_45 ston_49 
K10D0160_H0161:68a-1	to; ;tshangs pa /	to;_0 ;tshangs_4 ba_13 
K10D0160_H0161:68a-2	nga sbyin pas mya ngan las 'das par ston te /	nga_0 sbyin_4 ba_10 mya_14 ngan_18 las_23 'da'_27 ba_32 ston_36 te_41 
K10D0160_H0161:68a-3	de ni byis pa dag gis mi shes kyi de	de_0 ni_3 byis_6 ba_11 'dag_14 gis_18 mi_22 shes_25 kyi_30 de_34 
K10D0160_H0161:68a-4	la byang chub sems dpa' ldem po dag la mkhas	la_0 byang_3 chub_9 sems_14 dpa'_19 ldem_24 po_29 'dag_32 la_36 mkhas_39 
K10D0160_H0161:68a-5	pa ni sbyin pa'ang phyi ma'i tshe /	ba_0 ni_3 sbyin_6 ba_12 phyi_19 ma_24 tshe_29 
K10D0160_H0161:68a-6	skyid pa chen por 'gyur yang 'di la chos gang yang 'pho ba med do //	skyid_0 ba_6 chen_9 por_14 'gyur_18 yang_24 'di_29 la_33 chos_36 gang_41 yang_46 'pho_51 ba_56 med_59 do_63 
K10D0160_H0161:68a-7	mi 'pho bas na mya ngan las 'das pa'o //	mi_0 'pho_3 ba_8 na_12 mya_15 ngan_19 las_24 'da'_28 ba_33 
K10D0160_H0161:68a-8	mngon par 'du mi byed pa'i tshul gyis tshul khrims kyis mya ngan las 'das pa'o //	mngon_0 ba_6 'du_10 mi_14 byed_17 ba_22 tshul_27 gyis_33 tshul_38 khrims_44 kyis_51 mya_56 ngan_60 las_65 'da'_69 ba_74 
K10D0160_H0161:68a-9	skad cig pa'i tshul gyis bzod pas mya ngan las 'das pa'o //	skad_0 cig_5 ba_9 tshul_14 gyis_20 bzod_25 ba_30 mya_34 ngan_38 las_43 'da'_47 ba_52 
K10D0160_H0161:68a-10	blang ba dang /	blang_0 ba_6 dang_9 
K10D0160_H0161:68a-11	dor ba med pa'i tshul gyis brtson 'grus kyis mya ngan las 'das pa'o //	'dor_0 ba_4 med_7 ba_11 tshul_16 gyis_22 brtson_27 'grus_34 kyis_40 mya_45 ngan_49 las_54 'da'_58 ba_63 
K10D0160_H0161:68a-12	rnam par mi rtog pa'i tshul gyis bsam gtan gyis mya ngan las 'das pa'o //	rnam_0 ba_5 mi_9 rtogs_12 ba_17 tshul_22 gyis_28 bsam_33 gtan_38 gyis_43 mya_48 ngan_52 las_57 'da'_61 ba_66 
K10D0160_H0161:68a-13	thogs pa med pa'i tshul gyis shes rab kyis mya ngan las 'das pa'o //	thogs_0 ba_6 med_9 ba_13 tshul_18 gyis_24 shes_29 rab_34 kyis_38 mya_43 ngan_47 las_52 'da'_56 ba_61 
K10D0160_H0161:68a-14	chos kyi dbyings 'dod chags dang bral bas na 'dod chags ni 'dod chags dang bral ba'i mtha'o //	chos_0 kyi_5 dbyings_9 'dod_17 chags_22 dang_28 'bral_33 ba_38 na_42 'dod_45 chags_50 ni_56 'dod_59 chags_64 dang_70 'bral_75 ba_80 mtha_85 
K10D0160_H0161:68a-15	chos kyi dbyings la gtum pa med pas zhe sdang ni yang dag pa'i mtha'o //	chos_0 kyi_5 dbyings_9 la_17 'thum_20 ba_25 med_28 ba_32 zhe_36 sdang_40 ni_46 yang_49 'dag_54 ba_58 mtha_63 
K10D0160_H0161:68a-16	chos rnams la rmongs pa med pa'i phyir gti mug ni gti mug med pa'i mtha'o //	chos_0 rnams_5 la_11 rmongs_14 ba_21 med_24 ba_28 phyir_33 gti_39 mug_43 ni_47 gti_50 mug_54 med_58 ba_62 mtha_67 
K10D0160_H0161:68a-17	shi 'pho med pa dang /	'chi_0 'pho_4 med_9 ba_13 dang_16 
K10D0160_H0161:68a-18	skye ba med pa'i tshul gyis 'khor ba'ang mya ngan las 'das pa'o //	skye_0 ba_5 med_8 ba_12 tshul_17 gyis_23 'khor_28 ba_34 mya_41 ngan_45 las_50 'da'_54 ba_59 
K10D0160_H0161:68a-19	mngon par chags pa med pa'i tshul gyis mya ngan las 'das pa'ang 'khor ba'o //	mngon_0 ba_6 chags_10 ba_16 med_19 ba_23 tshul_28 gyis_34 mya_39 ngan_43 las_48 'da'_52 ba_57 'khor_64 ba_70 
K10D0160_H0161:68a-20	tha snyad du 'dogs pa'i lta ba bden pa'ang rdzun pa'o //	tha_0 snyad_4 du_10 'dogs_13 ba_19 lta_24 ba_28 bden_31 ba_36 rdzun_43 ba_49 
K10D0160_H0161:68b-0	mngon pa'i nga rgyal can rnams la ni rdzun @68b ba'ang bden pa'o zhes de ltar shes so //	mngon_0 ba_6 nga_11 rgyal_15 can_21 rnams_25 la_31 ni_34 rdzun_37 ba_48 bden_55 ba_60 zhes_65 de_70 ltar_73 shes_78 so_83 
K10D0160_H0161:68b-1	gzhan yang /	gzhan_0 yang_6 
K10D0160_H0161:68b-2	tshangs pa /	tshangs_0 ba_8 
K10D0160_H0161:68b-3	de bzhin gshegs pa ni ldem po dag gi rnam	de_0 bzhin_3 gshegs_9 ba_16 ni_19 ldem_22 po_27 'dag_30 gi_34 rnam_37 
K10D0160_H0161:68b-4	grangs kyis bdag nyid rtag par smra bar zhal gyis	grangs_0 kyis_7 bdag_12 nyid_17 rtag_22 ba_27 smra_31 ba_36 zhal_40 gyis_45 
K10D0160_H0161:68b-5	bzhes so // bdag nyid kun nas nyon mongs par smra ba dang /	bzhes_0 so_6 bdag_12 nyid_17 kun_22 nas_26 nyon_30 mongs_35 ba_41 smra_45 ba_50 dang_53 
K10D0160_H0161:68b-6	chad par smra ba dang /	'chad_0 ba_5 smra_9 ba_14 dang_17 
K10D0160_H0161:68b-7	bya ba med par smra ba dang /	byed_0 ba_4 med_7 ba_11 smra_15 ba_20 dang_23 
K10D0160_H0161:68b-8	log par smra ba dang /	log_0 ba_4 smra_8 ba_13 dang_16 
K10D0160_H0161:68b-9	ma dad pa dang /	ma_0 dad_3 ba_7 dang_10 
K10D0160_H0161:68b-10	byas pa mi gzo ba dang /	byed_0 ba_5 mi_8 gzo_11 ba_15 dang_18 
K10D0160_H0161:68b-11	mtshams gcod pa dang /	mtshams_0 gcod_8 ba_13 dang_16 
K10D0160_H0161:68b-12	skyug pa za ba dang /	skyug_0 ba_6 za_9 ba_12 dang_15 
K10D0160_H0161:68b-13	go skabs mi phyed par zhal gyis bzhes kyang de	go_0 skabs_3 mi_9 phyed_12 ba_18 zhal_22 gyis_27 bzhes_32 kyang_38 de_44 
K10D0160_H0161:68b-14	bzhin gshegs pa ni bshad pa 'di dag la mi	bzhin_0 gshegs_6 ba_13 ni_16 'chad_19 ba_25 'di_28 'dag_32 la_36 mi_39 
K10D0160_H0161:68b-15	'byung mi snang ngo //	'byung_0 mi_7 snang_10 ngo_16 
K10D0160_H0161:68b-16	ldem po dag gang gis sems can rnams lhag pa'i	ldem_0 po_5 'dag_8 gang_12 gis_17 sems_21 can_26 rnams_30 lhag_36 ba_41 
K10D0160_H0161:68b-17	nga rgyal 'dzin pa 'dor bar 'gyur ba'i ldem po	nga_0 rgyal_4 'dzin_10 ba_16 'dor_19 ba_24 'gyur_28 ba_34 ldem_39 po_44 
K10D0160_H0161:68b-18	dag de de bzhin gshegs pa ston te /	'dag_0 de_4 de_7 bzhin_10 gshegs_16 ba_23 ston_26 te_31 
K10D0160_H0161:68b-19	de ni de bzhin gshegs pa'i ldem po dag go /	de_0 ni_3 de_6 bzhin_9 gshegs_15 ba_22 ldem_27 po_32 'dag_35 go_39 
K10D0160_H0161:68b-20	tshangs pa /	tshangs_0 ba_8 
K10D0160_H0161:68b-21	de ltar na de bzhin gshegs pa ldem po dag tu chos ston to //	de_0 ltar_3 na_8 de_11 bzhin_14 gshegs_20 ba_27 ldem_30 po_35 'dag_38 tu_42 chos_45 ston_50 to_55 
K10D0160_H0161:68b-22	de la byang chub sems dpas spyod pa la mkhas par blo dpyad par bya'o //	de_0 la_3 byang_6 chub_12 sems_17 dpas_22 spyod_27 ba_33 la_36 mkhas_39 ba_45 blo_49 dpyod_53 ba_59 byed_63 
K10D0160_H0161:68b-23	de de ltar mthar phyin pas bstan pa thams cad	de_0 de_3 ltar_6 mthar_11 phyin_17 ba_23 ston_27 ba_33 thams_36 cad_42 
K10D0160_H0161:68b-24	la mkhas par 'gyur ro; ;de sems can rnams la	la_0 mkhas_3 ba_9 'gyur_13 ro;_19 ;de_23 sems_27 can_32 rnams_36 la_42 
K10D0160_H0161:68b-25	gzugs kyi sku bstan pas sangs rgyas byung ngo snyam	gzugs_0 kyi_6 sku_10 ston_14 ba_20 sangs_24 rgya_30 'byung_36 ngo_42 snyam_46 
K10D0160_H0161:68b-26	du mos par 'gyur ro //	du_0 mos_3 ba_7 'gyur_11 ro_17 
K10D0160_H0161:68b-27	chos kyi skus rab tu phye ba'i phyir de bzhin	chos_0 kyi_5 skus_9 rab_14 tu_18 'byed_21 ba_26 phyir_31 de_37 bzhin_40 
K10D0160_H0161:68b-28	gshegs pa ma byung ba'o zhes mos par 'gyur ro	gshegs_0 ba_7 ma_10 'byung_13 ba_19 zhes_24 mos_29 ba_33 'gyur_37 ro_43 
K10D0160_H0161:68b-29	// yi ge rnam par rig pa lhur byed pa'i	yi_3 ge_6 rnam_9 ba_14 rig_18 ba_22 lhur_25 byed_30 ba_35 
K10D0160_H0161:68b-30	sems can rnams la de bzhin gshegs pas chos bstan	sems_0 can_5 rnams_9 la_15 de_18 bzhin_21 gshegs_27 ba_34 chos_38 ston_43 
K10D0160_H0161:68b-31	to zhes mos par 'gyur ro //	to_0 zhes_3 mos_8 ba_12 'gyur_16 ro_22 
K10D0160_H0161:69a-0	chos nyid brjod du med par @69a *//	chos_0 nyid_5 rjod_10 du_16 med_19 ba_23 
K10D0160_H0161:69a-1	nges par byas nas chos bstan du med do zhes mos par 'gyur ro //	nges_0 ba_5 byed_9 nas_14 chos_18 ston_23 du_29 med_32 do_36 zhes_39 mos_44 ba_48 'gyur_52 ro_58 
K10D0160_H0161:69a-2	phyin ci log las byung ba'i nyon mongs pa yongs	phyin_0 ci_6 log_9 las_13 'byung_17 ba_23 nyon_28 mongs_33 ba_39 yongs_42 
K10D0160_H0161:69a-3	su mya ngan las bzla ba'i phyir yongs su mya	su_0 mya_3 ngan_7 las_12 bzla_16 ba_21 phyir_26 yongs_32 su_38 mya_41 
K10D0160_H0161:69a-4	ngan las 'das pa yod do zhes mos par 'gyur	ngan_0 las_5 'da'_9 ba_14 yod_17 do_21 zhes_24 mos_29 ba_33 'gyur_37 
K10D0160_H0161:69a-5	ro // ma skyes pa'i chos rnams mi 'jig pa'i	ro_0 ma_6 skye_9 ba_15 chos_20 rnams_25 mi_31 'jig_34 ba_39 
K10D0160_H0161:69a-6	phyir mya ngan las 'das pa med do zhes mos	phyir_0 mya_6 ngan_10 las_15 'da'_19 ba_24 med_27 do_31 zhes_34 mos_39 
K10D0160_H0161:69a-7	ro // par 'gyur ro // kun rdzob la 'jug	ro_0 ba_6 'gyur_10 ro_16 kun_22 rdzob_26 la_32 'jug_35 
K10D0160_H0161:69a-8	pas sems can yod do zhes mos par 'gyur ro	ba_0 sems_4 can_9 yod_13 do_17 zhes_20 mos_25 ba_29 'gyur_33 ro_39 
K10D0160_H0161:69a-9	ro // par 'gyur ro // // don dam pa	ro_0 ba_6 'gyur_10 ro_16 don_25 dam_29 ba_33 
K10D0160_H0161:69a-10	bstan pa sems can med do zhes mos par 'gyur	ston_0 ba_6 sems_9 can_14 med_18 do_22 zhes_25 mos_30 ba_34 'gyur_38 
K10D0160_H0161:69a-11	ro // par 'gyur ro // // te / tshangs pa /	ro_0 ba_6 'gyur_10 ro_16 te_25 tshangs_30 ba_38 
K10D0160_H0161:69a-12	de ltar na de bzhin gshegs pas ldem po dag bstan pas chos ston to //	de_0 ltar_3 na_8 de_11 bzhin_14 gshegs_20 ba_27 ldem_31 po_36 'dag_39 ston_43 ba_49 chos_53 ston_58 to_63 
K10D0160_H0161:69a-13	de la byang chub sems dpas bstan pa thams cad la mi skrag par bya'o //	de_0 la_3 byang_6 chub_12 sems_17 dpas_22 ston_27 ba_33 thams_36 cad_42 la_46 mi_49 skrag_52 ba_58 byed_62 
K10D0160_H0161:69a-14	de la /	de_0 la_3 
K10D0160_H0161:69a-15	tshangs pa /	tshangs_0 ba_8 
K10D0160_H0161:69a-16	de bzhin gshegs pa thabs gang gis sems can rnams la chos ston ce na /	de_0 bzhin_3 gshegs_9 ba_16 thabs_19 gang_25 gis_30 sems_34 can_39 rnams_43 la_49 chos_52 ston_57 ce_62 na_65 
K10D0160_H0161:69a-17	sbyin pas longs spyod 'thob pa dang /	sbyin_0 ba_6 longs_10 spyod_16 'thob_22 ba_28 dang_31 
K10D0160_H0161:69a-18	tshul khrims kyis mtho ris su skye ba dang /	tshul_0 khrims_6 kyis_13 mtho_18 ris_23 su_27 skye_30 ba_35 dang_38 
K10D0160_H0161:69a-19	bzod pas gzugs bzang po 'thob pa dang /	bzod_0 ba_5 gzugs_9 bzang_15 po_21 'thob_24 ba_30 dang_33 
K10D0160_H0161:69a-20	brtson 'grus kyis ye shes 'thob pa dang /	brtson_0 'grus_7 kyis_13 ye_18 shes_21 'thob_26 ba_32 dang_35 
K10D0160_H0161:69a-21	bsam gtan gyis rab tu dben pa 'thob pa dang /	bsam_0 gtan_5 gyis_10 rab_15 tu_19 dben_22 ba_27 'thob_30 ba_36 dang_39 
K10D0160_H0161:69a-22	shes rab kyis nyon mongs pa 'dor ba 'thob pa dang /	shes_0 rab_5 kyis_9 nyon_14 mongs_19 ba_25 'dor_28 ba_33 'thob_36 ba_42 dang_45 
K10D0160_H0161:69a-23	thos pas shes rab 'thob pa dang /	thos_0 ba_5 shes_9 rab_14 'thob_18 ba_24 dang_27 
K10D0160_H0161:69a-24	dge ba bcu'i las kyi lam gyis mi dang /	dge_0 ba_4 'chu_7 las_13 kyi_17 lam_21 gyis_25 mi_30 dang_33 
K10D0160_H0161:69a-25	lha'i phun sum tshogs pa rnams 'thob pa dang /	lha_0 phun_6 sum_11 tshogs_15 ba_22 rnams_25 'thob_31 ba_37 dang_40 
K10D0160_H0161:69a-26	byams pa dang /	byams_0 ba_6 dang_9 
K10D0160_H0161:69a-27	snying rje dang /	snying_0 rje_7 dang_11 
K10D0160_H0161:69a-28	dga' ba dang /	dga'_0 ba_5 dang_8 
K10D0160_H0161:69b-0	btang snyoms kyis tshangs pa'i @69b 'jig rten du skye ba 'thob pa dang /	gtong_0 snyom_6 kyis_13 tshangs_18 ba_26 'jig_36 rten_41 du_46 skye_49 ba_54 'thob_57 ba_63 dang_66 
K10D0160_H0161:69b-1	zhi gnas kyis lhag mthong 'thob pa dang /	zhi_0 gnas_4 kyis_9 lhag_14 mthong_19 'thob_26 ba_32 dang_35 
K10D0160_H0161:69b-2	slob pa'i sas mi slob pa'i sa thob pa dang /	slob_0 ba_5 sas_10 mi_14 slob_17 ba_22 sa_27 'thob_30 ba_35 dang_38 
K10D0160_H0161:69b-3	rang sangs rgyas kyi sas sbyin pa yongs su sbyang ba dang /	rang_0 sangs_5 rgya_11 kyi_17 sas_21 sbyin_25 ba_31 yongs_34 su_40 sbyong_43 ba_50 dang_53 
K10D0160_H0161:69b-4	sangs rgyas kyi sas tshad med pa'i ye shes 'thob pa dang /	sangs_0 rgya_6 kyi_12 sas_16 tshad_20 med_26 ba_30 ye_35 shes_38 'thob_43 ba_49 dang_52 
K10D0160_H0161:69b-5	mya ngan las 'das pas sdug bsngal thams cad nye bar zhi ba 'thob par 'gyur ro zhes /	mya_0 ngan_4 las_9 'da'_13 ba_18 sdug_22 sngal_27 thams_34 cad_40 nye_44 ba_48 zhi_52 ba_56 'thob_59 ba_65 'gyur_69 ro_75 zhes_78 
K10D0160_H0161:69b-6	tshangs pa /	tshangs_0 ba_8 
K10D0160_H0161:69b-7	nga ni thabs kyis sems can rnams chos 'di la mos par byed de /	nga_0 ni_4 thabs_7 kyis_13 sems_18 can_23 rnams_27 chos_33 'di_38 la_42 mos_45 ba_49 byed_53 de_58 
K10D0160_H0161:69b-8	de bzhin gshegs pa ni bdag gam /	de_0 bzhin_3 gshegs_9 ba_16 ni_19 bdag_22 gam_27 
K10D0160_H0161:69b-9	sems can nam /	sems_0 can_5 nam_9 
K10D0160_H0161:69b-10	srog gam /	srog_0 gam_5 
K10D0160_H0161:69b-11	gang zag tu mi dmigs so //	gang_0 zag_5 tu_9 mi_12 dmigs_15 so_21 
K10D0160_H0161:69b-12	de bzhin gshegs pa ni sbyin pa'ang mi dmigs /	de_0 bzhin_3 gshegs_9 ba_16 ni_19 sbyin_22 ba_28 mi_35 dmigs_38 
K10D0160_H0161:69b-13	sbyin pa'i 'bras bu'ang mi dmigs /	sbyin_0 ba_6 'bras_11 bu_17 mi_24 dmigs_27 
K10D0160_H0161:69b-14	ser sna'ang mi dmigs /	ser_0 sna_4 mi_12 dmigs_15 
K10D0160_H0161:69b-15	ser sna'i 'bras bu'ang mi dmigs /	ser_0 sna_4 'bras_10 bu_16 mi_23 dmigs_26 
K10D0160_H0161:69b-16	tshul khrims kyang mi dmigs /	tshul_0 khrims_6 kyang_13 mi_19 dmigs_22 
K10D0160_H0161:69b-17	tshul khrims kyi 'bras bu'ang mi dmigs /	tshul_0 khrims_6 kyi_13 'bras_17 bu_23 mi_30 dmigs_33 
K10D0160_H0161:69b-18	ngang tshul ngan pa'ang mi dmigs /	ngang_0 tshul_6 ngan_12 ba_17 mi_24 dmigs_27 
K10D0160_H0161:69b-19	ngang tshul ngan pa'i 'bras bu'ang mi dmigs /	ngang_0 tshul_6 ngan_12 ba_17 'bras_22 bu_28 mi_35 dmigs_38 
K10D0160_H0161:69b-20	bzod pa'ang mi dmigs /	bzod_0 ba_5 mi_12 dmigs_15 
K10D0160_H0161:69b-21	bzod pa'i 'bras bu'ang mi dmigs /	bzod_0 ba_5 'bras_10 bu_16 mi_23 dmigs_26 
K10D0160_H0161:69b-22	gnod sems kyang mi dmigs /	gnod_0 sems_5 kyang_10 mi_16 dmigs_19 
K10D0160_H0161:69b-23	gnod sems kyi 'bras bu'ang mi dmigs so //	gnod_0 sems_5 kyi_10 'bras_14 bu_20 mi_27 dmigs_30 so_36 
K10D0160_H0161:69b-24	brtson 'grus kyang mi dmigs /	brtson_0 'grus_7 kyang_13 mi_19 dmigs_22 
K10D0160_H0161:69b-25	brtson 'grus kyi 'bras bu'ang mi dmigs /	brtson_0 'grus_7 kyi_13 'bras_17 bu_23 mi_30 dmigs_33 
K10D0160_H0161:69b-26	le lo'ang mi dmigs /	le_0 lo_3 mi_10 dmigs_13 
K10D0160_H0161:69b-27	le lo'i 'bras bu'ang mi dmigs /	le_0 lo_3 'bras_8 bu_14 mi_21 dmigs_24 
K10D0160_H0161:69b-28	bsam gtan yang mi dmigs /	bsam_0 gtan_5 yang_10 mi_15 dmigs_18 
K10D0160_H0161:69b-29	bsam gtan gyi 'bras bu'ang mi dmigs /	bsam_0 gtan_5 gyi_10 'bras_14 bu_20 mi_27 dmigs_30 
K10D0160_H0161:69b-30	g-yeng ba'ang mi dmigs /	g-yeng_0 ba_7 mi_14 dmigs_17 
K10D0160_H0161:69b-31	g-yeng ba'i 'bras bu'ang mi dmigs /	g-yeng_0 ba_7 'bras_12 bu_18 mi_25 dmigs_28 
K10D0160_H0161:70a-0	shes rab @70a *//	shes_0 rab_5 
K10D0160_H0161:70a-1	kyang mi dmigs /	kyang_0 mi_6 dmigs_9 
K10D0160_H0161:70a-2	shes rab kyi 'bras bu'ang mi dmigs /	shes_0 rab_5 kyi_9 'bras_13 bu_19 mi_26 dmigs_29 
K10D0160_H0161:70a-3	'tshal ba'i shes rab kyang mi dmigs /	'tshal_0 ba_7 shes_12 rab_17 kyang_21 mi_27 dmigs_30 
K10D0160_H0161:70a-4	'chal ba'i shes rab kyi 'bras bu'ang mi dmigs /	'chal_0 ba_6 shes_11 rab_16 kyi_20 'bras_24 bu_30 mi_37 dmigs_40 
K10D0160_H0161:70a-5	bde ba'ang mi dmigs /	bde_0 ba_4 mi_11 dmigs_14 
K10D0160_H0161:70a-6	sdug bsngal yang mi dmigs /	sdug_0 sngal_5 yang_12 mi_17 dmigs_20 
K10D0160_H0161:70a-7	rgyun du zhugs pa'i 'bras bu'ang mi dmigs pa nas byang chub kyi bar du'ang mi dmigs /	rgyun_0 du_6 'jug_9 ba_15 'bras_20 bu_26 mi_33 dmigs_36 ba_42 nas_45 byang_49 chub_55 kyi_60 ba_64 du_68 mi_75 dmigs_78 
K10D0160_H0161:70a-8	yongs su mya ngan las 'das pa'ang mi dmigs te /	yongs_0 su_6 mya_9 ngan_13 las_18 'da'_22 ba_27 mi_34 dmigs_37 te_43 
K10D0160_H0161:70a-9	tshangs pa /	tshangs_0 ba_8 
K10D0160_H0161:70a-10	sems can de dag de ltar bstan pas sbyor zhing	sems_0 can_5 de_9 'dag_12 de_16 ltar_19 ston_24 ba_30 sbyor_34 zhing_40 
K10D0160_H0161:70a-11	rtsol te 'bad kyang gang gi phyir sbyor ba dang	rtsol_0 te_6 'bad_9 kyang_14 gang_20 gi_25 phyir_28 sbyor_34 ba_40 dang_43 
K10D0160_H0161:70a-12	/ rtsol ba dang /	rtsol_2 ba_8 dang_11 
K10D0160_H0161:70a-13	'bad pa'i chos de dag khong du mi chud cing mi 'thob ste /	'bad_0 ba_5 chos_10 de_15 'dag_18 khong_22 du_28 mi_31 chud_34 cing_39 mi_44 'thob_47 ste_53 
K10D0160_H0161:70a-14	gang 'di rgyun du zhugs pa'i 'bras bu nas dgra bcom pa nyid kyi bar dang /	gang_0 'di_5 rgyun_9 du_15 'jug_18 ba_24 'bras_29 bu_35 nas_38 dgra_42 'joms_47 ba_52 nyid_55 kyi_60 ba_64 dang_68 
K10D0160_H0161:70a-15	rang byang chub dang /	rang_0 byang_5 chub_11 dang_16 
K10D0160_H0161:70a-16	bla na med pa yang dag par rdzogs pa'i byang	bla_0 na_4 med_7 ba_11 yang_14 'dag_19 ba_23 rdzogs_27 ba_34 byang_39 
K10D0160_H0161:70a-17	chub nas mya ngan las 'das pa'i bar du khong	chub_0 nas_5 mya_9 ngan_13 las_18 'da'_22 ba_27 ba_32 du_36 khong_39 
K10D0160_H0161:70a-18	du mi chud mi 'thob bo //	du_0 mi_3 chud_6 mi_11 'thob_14 'bo_20 
K10D0160_H0161:70a-19	tshangs pa /	tshangs_0 ba_8 
K10D0160_H0161:70a-20	'di ni de bzhin gshegs pa'i thabs kyis chos bstan pa yin te /	'di_0 ni_4 de_7 bzhin_10 gshegs_16 ba_23 thabs_28 kyis_34 chos_39 ston_44 ba_50 yin_53 te_57 
K10D0160_H0161:70a-21	sems can rnams dam pa'i chos yongs su 'dzin du gzhug pa'i phyir /	sems_0 can_5 rnams_9 dam_15 ba_19 chos_24 yongs_29 su_35 'dzin_38 du_44 'jug_47 ba_53 phyir_58 
K10D0160_H0161:70a-22	byang chub sems dpas thabs mkhas pa la sbyor bar bya'o //	byang_0 chub_6 sems_11 dpas_16 thabs_21 mkhas_27 ba_33 la_36 sbyor_39 ba_45 byed_49 
K10D0160_H0161:70a-23	tshangs pa /	tshangs_0 ba_8 
K10D0160_H0161:70a-24	de la de bzhin gshegs pa'i tshul bstan pa gang zhe na /	de_0 la_3 de_6 bzhin_9 gshegs_15 ba_22 tshul_27 ston_33 ba_39 gang_42 zhe_47 na_51 
K10D0160_H0161:70a-25	mig ni thar pa'i tshul lo //	mig_0 ni_4 thar_7 ba_12 tshul_17 lo_23 
K10D0160_H0161:70a-26	de bzhin du rna ba dang /	de_0 bzhin_3 du_9 rna_12 ba_16 dang_19 
K10D0160_H0161:70a-27	sna dang /	sna_0 dang_4 
K10D0160_H0161:70a-28	lce dang /	lce_0 dang_4 
K10D0160_H0161:70a-29	lus dang /	lus_0 dang_4 
K10D0160_H0161:70b-0	yid rnams ni thar pa'i @70b tshul lo //	yid_0 rnams_4 ni_10 thar_13 ba_18 tshul_28 lo_34 
K10D0160_H0161:70b-1	de ci'i phyir zhe na /	de_0 ci_3 phyir_8 zhe_14 na_18 
K10D0160_H0161:70b-2	mig ni bdag dang /	mig_0 ni_4 bdag_7 dang_12 
K10D0160_H0161:70b-3	bdag gis stong ste /	bdag_0 gis_5 stong_9 ste_15 
K10D0160_H0161:70b-4	de'i rang bzhin 'di yin no //	de_0 rang_5 bzhin_10 'di_16 yin_20 no_24 
K10D0160_H0161:70b-5	de bzhin du yid kyi bar du bdag dang /	de_0 bzhin_3 du_9 yid_12 kyi_16 ba_20 du_24 bdag_27 dang_32 
K10D0160_H0161:70b-6	bdag gis stong ste /	bdag_0 gis_5 stong_9 ste_15 
K10D0160_H0161:70b-7	de'i rang bzhin 'di yin no //	de_0 rang_5 bzhin_10 'di_16 yin_20 no_24 
K10D0160_H0161:70b-8	tshangs pa /	tshangs_0 ba_8 
K10D0160_H0161:70b-9	mi slu ba'i phyir /	mi_0 slu_3 ba_7 phyir_12 
K10D0160_H0161:70b-10	skye mched thams cad ni sems can rnams kyis thar pa'i tshul du rig par bya'o //	skye_0 mched_5 thams_11 cad_17 ni_21 sems_24 can_29 rnams_33 kyis_39 thar_44 ba_49 tshul_54 du_60 rig_63 ba_67 byed_71 
K10D0160_H0161:70b-11	'di ni sems can rnams kyi thar pa la brtson par mi slu ba ste /	'di_0 ni_4 sems_7 can_12 rnams_16 kyi_22 thar_26 ba_31 la_34 brtson_37 ba_44 mi_48 slu_51 ba_55 ste_58 
K10D0160_H0161:70b-12	gzugs dang /	gzugs_0 dang_6 
K10D0160_H0161:70b-13	sgra dang /	sgra_0 dang_5 
K10D0160_H0161:70b-14	dri dang /	'dri_0 dang_4 
K10D0160_H0161:70b-15	ro dang /	ro_0 dang_3 
K10D0160_H0161:70b-16	reg dang /	reg_0 dang_4 
K10D0160_H0161:70b-17	chos rnams kyang de bzhin no //	chos_0 rnams_5 kyang_11 de_17 bzhin_20 no_26 
K10D0160_H0161:70b-18	chos thams cad kyi tshul 'di yin te /	chos_0 thams_5 cad_11 kyi_15 tshul_19 'di_25 yin_29 te_33 
K10D0160_H0161:70b-19	gang 'di stong pa nyid kyi tshul dang /	gang_0 'di_5 stong_9 ba_15 nyid_18 kyi_23 tshul_27 dang_33 
K10D0160_H0161:70b-20	mtshan ma med pa'i tshul dang /	mtshan_0 ma_7 med_10 ba_14 tshul_19 dang_25 
K10D0160_H0161:70b-21	smon pa med pa'i tshul dang /	smon_0 ba_5 med_8 ba_12 tshul_17 dang_23 
K10D0160_H0161:70b-22	mngon par 'du mi byed pa'i tshul dang /	mngon_0 ba_6 'du_10 mi_14 byed_17 ba_22 tshul_27 dang_33 
K10D0160_H0161:70b-23	mi skye ba'i tshul dang /	mi_0 skye_3 ba_8 tshul_13 dang_19 
K10D0160_H0161:70b-24	mi 'gag pa'i tshul dang /	mi_0 'gag_3 ba_8 tshul_13 dang_19 
K10D0160_H0161:70b-25	'gro ba med cing 'ong ba med pa'i tshul dang /	'gro_0 ba_5 med_8 cing_12 'ong_17 ba_22 med_25 ba_29 tshul_34 dang_40 
K10D0160_H0161:70b-26	shi 'pho med cing skye ba med pa'i tshul dang /	'chi_0 'pho_4 med_9 cing_13 skye_18 ba_23 med_26 ba_30 tshul_35 dang_41 
K10D0160_H0161:70b-27	rang bzhin gyis 'od gsal ba'i tshul dang /	rang_0 bzhin_5 gyis_11 'od_16 gsal_20 ba_25 tshul_30 dang_36 
K10D0160_H0161:70b-28	dben pa'i tshul lo //	dben_0 ba_5 tshul_10 lo_16 
K10D0160_H0161:70b-29	rang bzhin gyi bems [?] po yin pa'i phyir phan	rang_0 bzhin_5 gyi_11 bems_15 po_24 yin_27 ba_31 phyir_36 phan_42 
K10D0160_H0161:70b-30	tshun mi phrad pas na de bzhin gshegs pas yi	tshun_0 mi_6 'phrad_9 ba_15 na_19 de_22 bzhin_25 gshegs_31 ba_38 yi_42 
K10D0160_H0161:70b-31	ge thams cad las thar pa'i sgo'i tshul smos so	ge_0 thams_3 cad_9 las_13 thar_17 ba_22 sgo_27 tshul_33 smos_39 so_44 
K10D0160_H0161:70b-32	// tshangs pa /	tshangs_3 ba_11 
K10D0160_H0161:70b-33	yi ge thams cad la bden pa'i gtam du lta ste /	yi_0 ge_3 thams_6 cad_12 la_16 bden_19 ba_24 'dam_29 du_34 lta_37 ste_41 
K10D0160_H0161:70b-34	gtam thams cad ni de bzhin gshegs pa'i thar pa'i tshul bden pa bstan pa bstan to //	'dam_0 thams_5 cad_11 ni_15 de_18 bzhin_21 gshegs_27 ba_34 thar_39 ba_44 tshul_49 bden_55 ba_60 ston_63 ba_69 ston_72 to_78 
K10D0160_H0161:70b-35	de bzhin gshegs pa'i chos bstan pa gang kun nas	de_0 bzhin_3 gshegs_9 ba_16 chos_21 ston_26 ba_32 gang_35 kun_40 nas_44 
K10D0160_H0161:70b-36	nyon mongs par 'gyur ba de gang yang med do	nyon_0 mongs_5 ba_11 'gyur_15 ba_21 de_24 gang_27 yang_32 med_37 do_41 
