K10D0131_H0133:367a-0	@367a / / gya gar skad du /	gar_14 skad_18 du_23 
K10D0131_H0133:367a-1	a'arya ta th'a ga ta dzny'a na mu dr'a sa	a_0 ta_7 th_10 ga_15 ta_18 dzny_21 na_28 mu_31 dr_34 sa_39 
K10D0131_H0133:367a-2	m'a dhi n'a ma ma h'a y'a na s'u tra	m_0 dhi_4 n_8 ma_12 ma_15 h_18 y_22 na_26 s_29 tra_33 
K10D0131_H0133:367a-3	/ bod skad du /	'bod_2 skad_6 du_11 
K10D0131_H0133:367a-4	'phags pa de bzhin gshegs pa'i ye shes kyi phyag	'phag_0 ba_7 de_10 bzhin_13 gshegs_19 ba_26 ye_31 shes_34 kyi_39 phyag_43 
K10D0131_H0133:367a-5	rgya'i ting nge 'dzin ces bya ba theg pa chen	rgya_0 ting_7 nge_12 'dzin_16 ces_22 byed_26 ba_30 theg_33 ba_38 chen_41 
K10D0131_H0133:367a-6	po'i mdo / bam po dang po /	po_0 mdo_5 bam_11 po_15 dang_18 po_23 
K10D0131_H0133:367a-7	sangs rgyas dang byang chub sems dpa' thams cad la phyag 'tshal lo //	sangs_0 rgya_6 dang_12 byang_17 chub_23 sems_28 dpa'_33 thams_38 cad_44 la_48 phyag_51 'tshal_57 lo_64 
K10D0131_H0133:367a-8	'di skad bdag gis thos pa dus gcig na /	'di_0 skad_4 bdag_9 gis_14 thos_18 ba_23 dus_26 gcig_30 na_35 
K10D0131_H0133:367a-9	bcom ldan 'das rgyal po'i khab na 'od ma'i tshal bya ka lanta ka'i gnas na /	'joms_0 ldan_5 'da'_10 rgyal_15 po_21 khab_26 na_31 'od_34 ma_38 tshal_43 byed_49 ka_53 lanta_56 ka_62 gnas_67 na_72 
K10D0131_H0133:367a-10	dge slong stong nyis brgya lnga bcu'i dge slong gi dge 'dun chen po dang /	dge_0 slong_4 stong_10 nyis_16 brgya_21 lnga_27 'chu_32 dge_38 slong_42 gi_48 dge_51 'dun_55 chen_60 po_65 dang_68 
K10D0131_H0133:367a-11	byang chub sems dpa' bye ba phrag sum cu thams cad kyang gzungs thob pa /	byang_0 chub_6 sems_11 dpa'_16 'bye_21 ba_25 phrag_28 sum_34 cu_38 thams_41 cad_47 kyang_51 gzungs_57 'thob_64 ba_69 
K10D0131_H0133:367a-12	spobs pa thogs pa med pa /	spobs_0 ba_6 thogs_9 ba_15 med_18 ba_22 
K10D0131_H0133:367a-13	ting nge 'dzin thob pa /	ting_0 nge_5 'dzin_9 'thob_15 ba_20 
K10D0131_H0133:367a-14	stong pa nyid kyi ting nge 'dzin la gnas pa /	stong_0 ba_6 nyid_9 kyi_14 ting_18 nge_23 'dzin_27 la_33 gnas_36 ba_41 
K10D0131_H0133:367a-15	mtshan ma med pa'i spyod yul ba /	mtshan_0 ma_7 med_10 ba_14 spyod_19 yul_25 ba_29 
K10D0131_H0133:367a-16	smon lam bcos ma ma yin pa /	smon_0 lam_5 'chos_9 ma_14 ma_17 yin_20 ba_24 
K10D0131_H0133:367a-17	smon pa med pa la gnas pa /	smon_0 ba_5 med_8 ba_12 la_15 gnas_18 ba_23 
K10D0131_H0133:367a-18	spyod lam bcos pa med pa /	spyod_0 lam_6 'chos_10 ba_15 med_18 ba_22 
K10D0131_H0133:367a-19	sgo mtha' yas pa sgrub pa'i gzungs thob pa /	sgo_0 mtha'_4 yas_10 ba_14 sgrub_17 ba_23 gzungs_28 'thob_35 ba_40 
K10D0131_H0133:367a-20	mnyam pa nyid du bzod pa thob pa /	mnyam_0 ba_6 nyid_9 du_14 bzod_17 ba_22 'thob_25 ba_30 
K10D0131_H0133:367a-21	mnyam pa nyid thob pa /	mnyam_0 ba_6 nyid_9 'thob_14 ba_19 
K10D0131_H0133:367a-22	thogs pa med pa'i gzungs thob pa /	thogs_0 ba_6 med_9 ba_13 gzungs_18 'thob_25 ba_30 
K10D0131_H0133:367a-23	sems can thams cad kyi dbang po mchog dang /	sems_0 can_5 thams_9 cad_15 kyi_19 dbang_23 po_29 mchog_32 dang_38 
K10D0131_H0133:367a-24	mchog ma yin pa shes pa dang /	mchog_0 ma_6 yin_9 ba_13 shes_16 ba_21 dang_24 
K10D0131_H0133:367a-25	bsam pa dang /	bsam_0 ba_5 dang_8 
K10D0131_H0133:367b-0	@367b spyod pa'i tshul shin tu shes pa sha stag dang thabs gcig tu bzhugs te /	spyod_6 ba_12 tshul_17 shin_23 tu_28 shes_31 ba_36 sha_39 stag_43 dang_48 thabs_53 gcig_59 tu_64 bzhugs_67 te_74 
K10D0131_H0133:367b-1	de nas de'i tshe bcom ldan 'das de bzhin gshegs	de_0 nas_3 de_7 tshe_12 'joms_17 ldan_22 'da'_27 de_32 bzhin_35 gshegs_41 
K10D0131_H0133:367b-2	pa'i byin gyi rlabs sangs rgyas thams cad kyi yul	ba_0 byin_5 gyi_10 rlabs_14 sangs_20 rgya_26 thams_32 cad_38 kyi_42 yul_46 
K10D0131_H0133:367b-3	la 'jug pa'i ting nge 'dzin gzugs med pa /	la_0 'jug_3 ba_8 ting_13 nge_18 'dzin_22 gzugs_28 med_34 ba_38 
K10D0131_H0133:367b-4	bstan du med pa /	ston_0 du_6 med_9 ba_13 
K10D0131_H0133:367b-5	gzung ba med pa /	gzung_0 ba_6 med_9 ba_13 
K10D0131_H0133:367b-6	thogs pa med pa /	thogs_0 ba_6 med_9 ba_13 
K10D0131_H0133:367b-7	snang ba med pa /	snang_0 ba_6 med_9 ba_13 
K10D0131_H0133:367b-8	rnam par rig pa med pa /	rnam_0 ba_5 rig_9 ba_13 med_16 ba_20 
K10D0131_H0133:367b-9	rnam par rig par bya ba ma yin pa /	rnam_0 ba_5 rig_9 ba_13 byed_17 ba_21 ma_24 yin_27 ba_31 
K10D0131_H0133:367b-10	sems dang /	sems_0 dang_5 
K10D0131_H0133:367b-11	yid dang /	yid_0 dang_4 
K10D0131_H0133:367b-12	rnam par shes pa dang bral pa /	rnam_0 ba_5 shes_9 ba_14 dang_17 'bral_22 ba_27 
K10D0131_H0133:367b-13	rtsa ba med pa /	rtsa_0 ba_5 med_8 ba_12 
K10D0131_H0133:367b-14	rten pa med pa /	rten_0 ba_5 med_8 ba_12 
K10D0131_H0133:367b-15	dmigs su med pa /	dmigs_0 su_6 med_9 ba_13 
K10D0131_H0133:367b-16	mi mnyam pa dang /	mi_0 mnyam_3 ba_9 dang_12 
K10D0131_H0133:367b-17	mnyam pa med pa /	mnyam_0 ba_6 med_9 ba_13 
K10D0131_H0133:367b-18	zla med pa /	zla_0 med_4 ba_8 
K10D0131_H0133:367b-19	nga yi ba med pa /	nga_0 yi_4 ba_7 med_10 ba_14 
K10D0131_H0133:367b-20	yongs su 'dzin pa med pa /	yongs_0 su_6 'dzin_9 ba_15 med_18 ba_22 
K10D0131_H0133:367b-21	mi bya ba /	mi_0 byed_3 ba_7 
K10D0131_H0133:367b-22	ma byas pa /	ma_0 byed_3 ba_8 
K10D0131_H0133:367b-23	ma song ba /	ma_0 'gro_3 ba_8 
K10D0131_H0133:367b-24	ma 'ongs pa /	ma_0 'ongs_3 ba_9 
K10D0131_H0133:367b-25	'gro ba med pa /	'gro_0 ba_5 med_8 ba_12 
K10D0131_H0133:367b-26	mi gnas pa /	mi_0 gnas_3 ba_8 
K10D0131_H0133:367b-27	rgyun chad pa med pa /	rgyun_0 'chad_6 ba_11 med_14 ba_18 
K10D0131_H0133:367b-28	gnas med pa /	gnas_0 med_5 ba_9 
K10D0131_H0133:367b-29	mtshan ma med pa /	mtshan_0 ma_7 med_10 ba_14 
K10D0131_H0133:367b-30	mtshan ma thams cad dang bral ba /	mtshan_0 ma_7 thams_10 cad_16 dang_20 'bral_25 ba_30 
K10D0131_H0133:367b-31	blang ba med pa /	blang_0 ba_6 med_9 ba_13 
K10D0131_H0133:367b-32	dor ba med pa /	'dor_0 ba_4 med_7 ba_11 
K10D0131_H0133:367b-33	'dus ma byas pa /	'du_0 ma_5 byed_8 ba_13 
K10D0131_H0133:367b-34	mngon par 'du mi byed pa /	mngon_0 ba_6 'du_10 mi_14 byed_17 ba_22 
K10D0131_H0133:367b-35	'du ba med pa /	'du_0 ba_4 med_7 ba_11 
K10D0131_H0133:367b-36	bral ba med pa /	'bral_0 ba_5 med_8 ba_12 
K10D0131_H0133:367b-37	sems med pa /	sems_0 med_5 ba_9 
K10D0131_H0133:367b-38	sems dang bral ba /	sems_0 dang_5 'bral_10 ba_15 
K10D0131_H0133:367b-39	kun tu 'byung ba med pa /	kun_0 tu_4 'byung_7 ba_14 med_17 ba_21 
K10D0131_H0133:367b-40	rtsom pa med pa /	rtsom_0 ba_6 med_9 ba_13 
K10D0131_H0133:367b-41	yong su grub pa med pa /	yong_0 su_5 'grub_8 ba_13 med_16 ba_20 
K10D0131_H0133:367b-42	ma byung ba /	ma_0 'byung_3 ba_9 
K10D0131_H0133:367b-43	kun tu ma byung ba /	kun_0 tu_4 ma_7 'byung_10 ba_16 
K10D0131_H0133:367b-44	rab tu rgyu ba med pa /	rab_0 tu_4 rgyu_7 ba_12 med_15 ba_19 
K10D0131_H0133:367b-45	yang dag par rgyu ba med pa /	yang_0 'dag_5 ba_9 rgyu_13 ba_18 med_21 ba_25 
K10D0131_H0133:367b-46	shin tu stong pa /	shin_0 tu_5 stong_8 ba_14 
K10D0131_H0133:367b-47	'dre ba med pa /	'dre_0 ba_5 med_8 ba_12 
K10D0131_H0133:367b-48	chos thams cad la sgro btags pa med pa /	chos_0 thams_5 cad_11 la_15 sgro_18 'dogs_23 ba_29 med_32 ba_36 
K10D0131_H0133:367b-49	'di lta ste /	'di_0 lta_4 ste_8 
K10D0131_H0133:367b-50	sangs rgyas thams cad kyi yul la 'jug pa'i gzungs	sangs_0 rgya_6 thams_12 cad_18 kyi_22 yul_26 la_30 'jug_33 ba_38 gzungs_43 
K10D0131_H0133:367b-51	kyi sgo de bzhin gshegs pa'i ye shes kyi phyag	kyi_0 sgo_4 de_8 bzhin_11 gshegs_17 ba_24 ye_29 shes_32 kyi_37 phyag_41 
K10D0131_H0133:367b-52	rgya zhes bya ba'i ting nge 'dzin la snyoms par	rgya_0 zhes_5 byed_10 ba_14 ting_19 nge_24 'dzin_28 la_34 snyom_37 ba_44 
K10D0131_H0133:367b-53	zhugs so // ting nge 'dzin de la snyoms par	'jug_0 so_6 ting_12 nge_17 'dzin_21 de_27 la_30 snyom_33 ba_40 
K10D0131_H0133:367b-54	zhugs ma thag tu bcom ldan 'das kyi sku'ang mi	'jug_0 ma_6 thag_9 tu_14 'joms_17 ldan_22 'da'_27 kyi_32 sku_36 mi_44 
K10D0131_H0133:368a-0	zhugs so // snang / sku'i mtshan @368a *//	'jug_0 so_6 snang_12 sku_20 mtshan_26 
K10D0131_H0133:368a-1	ma'ang mi snang /	ma_0 mi_7 snang_10 
K10D0131_H0133:368a-2	sems dang /	sems_0 dang_5 
K10D0131_H0133:368a-3	sems kyi mtshan ma'ang mi snang /	sems_0 kyi_5 mtshan_9 ma_16 mi_23 snang_26 
K10D0131_H0133:368a-4	na bza' dang /	na_0 bza'_3 dang_8 
K10D0131_H0133:368a-5	na bza'i mtshan ma'ang mi snang /	na_0 bza_3 mtshan_9 ma_16 mi_23 snang_26 
K10D0131_H0133:368a-6	gdan dang /	gdan_0 dang_5 
K10D0131_H0133:368a-7	gdan gyi mtshan ma'ang mi snang /	gdan_0 gyi_5 mtshan_9 ma_16 mi_23 snang_26 
K10D0131_H0133:368a-8	gzims pa dang /	gzims_0 ba_6 dang_9 
K10D0131_H0133:368a-9	gzims pa'i mtshan ma'ang mi snang /	gzims_0 ba_6 mtshan_11 ma_18 mi_25 snang_28 
K10D0131_H0133:368a-10	'chag pa dang /	'chag_0 ba_6 dang_9 
K10D0131_H0133:368a-11	'chag pa'i mtshan ma'ang mi snang /	'chag_0 ba_6 mtshan_11 ma_18 mi_25 snang_28 
K10D0131_H0133:368a-12	bzhengs pa dang /	bzhengs_0 ba_8 dang_11 
K10D0131_H0133:368a-13	bzhengs pa'i mtshan ma'ang mi snang /	bzhengs_0 ba_8 mtshan_13 ma_20 mi_27 snang_30 
K10D0131_H0133:368a-14	gnas pa dang /	gnas_0 ba_5 dang_8 
K10D0131_H0133:368a-15	gnas pa'i mtshan ma'ang mi snang /	gnas_0 ba_5 mtshan_10 ma_17 mi_24 snang_27 
K10D0131_H0133:368a-16	grib ma'i dbyibs dang /	'grib_0 ma_5 dbyibs_10 dang_17 
K10D0131_H0133:368a-17	grib ma'i dbyibs kyi mtshan ma'ang mi snang /	'grib_0 ma_5 dbyibs_10 kyi_17 mtshan_21 ma_28 mi_35 snang_38 
K10D0131_H0133:368a-18	bzhugs pa dang /	bzhugs_0 ba_7 dang_10 
K10D0131_H0133:368a-19	bzhugs pa'i mtshan ma'ang mi snang zhing /	bzhugs_0 ba_7 mtshan_12 ma_19 mi_26 snang_29 zhing_35 
K10D0131_H0133:368a-20	sgra dang /	sgra_0 dang_5 
K10D0131_H0133:368a-21	sgra'i mtshan ma'ang mi grag go /	sgra_0 mtshan_7 ma_14 mi_21 grag_24 go_29 
K10D0131_H0133:368a-22	de nas ting nge 'dzin de'i mthu dang /	de_0 nas_3 ting_7 nge_12 'dzin_16 de_22 mthu_27 dang_32 
K10D0131_H0133:368a-23	sangs rgyas kyi byin gyi rlabs kyis stong gsum gyi	sangs_0 rgya_6 kyi_12 byin_16 gyi_21 rlabs_25 kyis_31 stong_36 gsum_42 gyi_47 
K10D0131_H0133:368a-24	stong chen po'i 'jig rten gyi khams 'di snang ba	stong_0 chen_6 po_11 'jig_16 rten_21 gyi_26 khams_30 'di_36 snang_40 ba_46 
K10D0131_H0133:368a-25	chen pos khyab par gyur nas /	chen_0 pos_5 khyab_9 ba_15 gyur_19 nas_24 
K10D0131_H0133:368a-26	'di lta bu'i 'od kyis snang bar byas te /	'di_0 lta_4 bu_8 'od_13 kyis_17 snang_22 ba_28 byed_32 te_37 
K10D0131_H0133:368a-27	'od des stong gsum gyi stong chen po'i 'jig rten	'od_0 des_4 stong_8 gsum_14 gyi_19 stong_23 chen_29 po_34 'jig_39 rten_44 
K10D0131_H0133:368a-28	gyi khams 'di na zla ba'i 'od kyang mi snang	gyi_0 khams_4 'di_10 na_14 zla_17 ba_21 'od_26 kyang_30 mi_36 snang_39 
K10D0131_H0133:368a-29	/ nyi ma dang /	nyi_2 ma_6 dang_9 
K10D0131_H0133:368a-30	skar ma dang /	skar_0 ma_5 dang_8 
K10D0131_H0133:368a-31	me dang /	me_0 dang_3 
K10D0131_H0133:368a-32	nor bu dang /	nor_0 bu_4 dang_7 
K10D0131_H0133:368a-33	glog gi 'od rnams kyang mi snang; dri za rnams dang /	glog_0 gi_5 'od_8 rnams_12 kyang_18 mi_24 snang;_27 'dri_34 za_38 rnams_41 dang_47 
K10D0131_H0133:368a-34	mi 'am ci rnams dang /	mi_0 'am_3 ci_7 rnams_10 dang_16 
K10D0131_H0133:368a-35	'dod pa na spyad pa dang /	'dod_0 ba_5 na_8 spyod_11 ba_17 dang_20 
K10D0131_H0133:368a-36	gzugs na spyod pa'i lha rnams dang /	gzugs_0 na_6 spyod_9 ba_15 lha_20 rnams_24 dang_30 
K10D0131_H0133:368a-37	skar ma rnams dang /	skar_0 ma_5 rnams_8 dang_14 
K10D0131_H0133:368a-38	lha'i gzhal med khang gi 'od kyang mi snang /	lha_0 'jal_6 med_12 khang_16 gi_22 'od_25 kyang_29 mi_35 snang_38 
K10D0131_H0133:368a-39	brgya byin dang /	brgya_0 byin_6 dang_11 
K10D0131_H0133:368a-40	tshangs pa dang /	tshangs_0 ba_8 dang_11 
K10D0131_H0133:368a-41	'jig rten skyong ba rnams kyi 'od kyang mi snang ngo //	'jig_0 rten_5 skyong_10 ba_17 rnams_20 kyi_26 'od_30 kyang_34 mi_40 snang_43 ngo_49 
K10D0131_H0133:368a-42	sangs rgyas kyi byin gyi rlabs dang /	sangs_0 rgya_6 kyi_12 byin_16 gyi_21 rlabs_25 dang_31 
K10D0131_H0133:368a-43	ting nge 'dzin de'i mthus gang lha kha cig kyang lha'i dri mi tshor te /	ting_0 nge_5 'dzin_9 de_15 mthus_20 gang_26 lha_31 kha_35 cig_39 kyang_43 lha_49 'dri_55 mi_59 tshor_62 te_68 
K10D0131_H0133:368b-0	stong @368b gsum gyi stong chen po'i 'jig rten gyi	stong_0 gsum_12 gyi_17 stong_21 chen_27 po_32 'jig_37 rten_42 gyi_47 
K10D0131_H0133:368b-1	khams 'di thams cad lha'i dri las shin tu 'das	khams_0 'di_6 thams_10 cad_16 lha_20 'dri_26 las_30 shin_34 tu_39 'da'_42 
K10D0131_H0133:368b-2	pa'i dris dri rab tu zhim par byas so //	ba_0 'dri_5 'dri_10 rab_14 tu_18 zhim_21 ba_26 byed_30 so_35 
K10D0131_H0133:368b-3	'jig rten gyi bar thams cad kyang snang bar gyur khor yug gi ri dang /	'jig_0 rten_5 gyi_10 ba_14 thams_18 cad_24 kyang_28 snang_34 ba_40 gyur_44 khor_49 yug_54 gi_58 ri_61 dang_64 
K10D0131_H0133:368b-4	khor yug gi ri chen po'ang snang bar byas /	khor_0 yug_5 gi_9 ri_12 chen_15 po_20 snang_27 ba_33 byed_37 
K10D0131_H0133:368b-5	ri rab dang /	ri_0 rab_3 dang_7 
K10D0131_H0133:368b-6	de ma yin pa ri'i rgyal po gzhan dag dang /	de_0 ma_3 yin_6 ba_10 ri_13 rgyal_18 po_24 gzhan_27 'dag_33 dang_37 
K10D0131_H0133:368b-7	ri nag po dag kyang snang bar gyur te /	ri_0 nag_3 po_7 'dag_10 kyang_14 snang_20 ba_26 gyur_30 te_35 
K10D0131_H0133:368b-8	phyis ni sems can gang gi mig gi dbang po la'ang snang bar ma gyur to //	'byid_0 ni_6 sems_9 can_14 gang_18 gi_23 mig_26 gi_30 dbang_33 po_39 la_42 snang_49 ba_55 ma_59 gyur_62 to_67 
K10D0131_H0133:368b-9	stong gsum gyi stong chen po'i 'jig rten gyi khams	stong_0 gsum_6 gyi_11 stong_15 chen_21 po_26 'jig_31 rten_36 gyi_41 khams_45 
K10D0131_H0133:368b-10	'di thams cad kyang rin po che'i dra bas kun	'di_0 thams_4 cad_10 kyang_14 rin_20 po_24 che_27 'dra_33 ba_37 kun_41 
K10D0131_H0133:368b-11	tu bskor bar gyur to //	tu_0 skor_3 ba_9 gyur_13 to_18 
K10D0131_H0133:368b-12	sangs rgyas kyi zhing mi mjed 'di thams cad du'ang	sangs_0 rgya_6 kyi_12 zhing_16 mi_22 mjed_25 'di_30 thams_34 cad_40 du_44 
K10D0131_H0133:368b-13	dar gyi lda ldi bres shing pog snod nas spos	dar_0 gyi_4 lda_8 ldi_12 'bre_16 shing_21 pog_27 snod_31 nas_36 spros_40 
K10D0131_H0133:368b-14	kyis bdugs la me tog sna tshogs bkram par gyur	kyis_0 bdug_5 la_11 me_14 tog_17 sna_21 tshogs_25 'grem_32 ba_38 gyur_42 
K10D0131_H0133:368b-15	to // sangs rgyas kyi mthus 'od ma'i tshal bya	to_0 sangs_6 rgya_12 kyi_18 mthus_22 'od_28 ma_32 tshal_37 byed_43 
K10D0131_H0133:368b-16	ka lanta ka'i gnas kyang bya rgod kyi phung po'i	ka_0 lanta_3 ka_9 gnas_14 kyang_19 byed_25 rgod_29 kyi_34 'phung_38 po_44 
K10D0131_H0133:368b-17	ri dang bcas te /	ri_0 dang_3 'cha'_8 te_13 
K10D0131_H0133:368b-18	de dag thams cad lag mthil bzhin du mnyam par gyur cing /	de_0 'dag_3 thams_7 cad_13 lag_17 mthil_21 bzhin_27 du_33 mnyam_36 ba_42 gyur_46 cing_51 
K10D0131_H0133:368b-19	shing rta'i 'phang lo tsam gyi rin po che sna	shing_0 rta_6 'phen_12 lo_19 tsam_22 gyi_27 rin_31 po_35 che_38 sna_42 
K10D0131_H0133:368b-20	tshogs kyi padma chen po 'dab ma brgya stong yod	tshogs_0 kyi_7 padma_11 chen_17 po_22 'dab_25 ma_30 brgya_33 stong_39 yod_45 
K10D0131_H0133:368b-21	pa / dri rab tu zhim zhing yid du 'ong bas kun gang bar gyur to //	ba_0 'dri_5 rab_9 tu_13 zhim_16 zhing_21 yid_27 du_31 'ong_34 ba_39 kun_43 gang_47 ba_52 gyur_56 to_61 
K10D0131_H0133:368b-22	steng gi bar snang las kyang rin po che'i dra ba'i gdugs kyis g-yogs shing brgyan to //	steng_0 gi_6 ba_9 snang_13 las_19 kyang_23 rin_29 po_33 che_36 'dra_42 ba_46 gdugs_51 kyis_57 g-yogs_62 shing_69 rgyan_75 to_82 
K10D0131_H0133:368b-23	yul ma ga dh'a thams cad kyang gos ka tsa lindi ka ltar reg na bde bar gyur to //	yul_0 ma_4 ga_7 dh_10 thams_15 cad_21 kyang_25 gos_31 ka_35 tsa_38 lindi_42 ka_48 ltar_51 reg_56 na_60 bde_63 ba_67 gyur_71 to_76 
K10D0131_H0133:368b-24	de nas shar phyogs su sangs rgyas kyi zhing gangg'a'i	de_0 nas_3 'char_7 phyogs_12 su_19 sangs_22 rgya_28 kyi_34 zhing_38 gangg'i_44 
K10D0131_H0133:368b-25	klung gi bye ma snyed dag na byang chub sems	klung_0 gi_6 'bye_9 ma_13 snyed_16 'dag_22 na_26 byang_29 chub_35 sems_40 
K10D0131_H0133:368b-26	dpa' sems dpa' chen po bla na med pa yang	dpa'_0 sems_5 dpa'_10 chen_15 po_20 bla_23 na_27 med_30 ba_34 yang_37 
K10D0131_H0133:369a-0	dag par rdzogs pa'i byang chub @369a *//	'dag_0 ba_4 rdzogs_8 ba_15 byang_20 chub_26 
K10D0131_H0133:369a-1	tu skye ba gcig gis thogs pa /	tu_0 skye_3 ba_8 gcig_11 gis_16 thogs_20 ba_26 
K10D0131_H0133:369a-2	tshad med pa /	tshad_0 med_6 ba_10 
K10D0131_H0133:369a-3	grangs med /	grangs_0 med_7 
K10D0131_H0133:369a-4	dpag tu med pa brgya stong rnams kyang so so'i	dpog_0 tu_5 med_8 ba_12 brgya_15 stong_21 rnams_27 kyang_33 so_39 so_42 
K10D0131_H0133:369a-5	sangs rgyas bcom ldan 'das de dag gis bskul te	sangs_0 rgya_6 'joms_12 ldan_17 'da'_22 de_27 'dag_30 gis_34 skul_38 te_44 
K10D0131_H0133:369a-6	/ rigs kyi bu dag /	rigs_2 kyi_7 bu_11 'dag_14 
K10D0131_H0133:369a-7	'jig rten gyi khams mi mjed du dengs shig /	'jig_0 rten_5 gyi_10 khams_14 mi_20 mjed_23 du_28 dengs_31 shig_37 
K10D0131_H0133:369a-8	de na de bzhin gshegs pa dgra bcom pa yang	de_0 na_3 de_6 bzhin_9 gshegs_15 ba_22 dgra_25 'joms_30 ba_35 yang_38 
K10D0131_H0133:369a-9	dag par rdzogs pa'i sangs rgyas sh'akya thub pa zhes	'dag_0 ba_4 rdzogs_8 ba_15 sangs_20 rgya_26 sh_32 thub_40 ba_45 zhes_48 
K10D0131_H0133:369a-10	bya ba da ltar yang bzhugs te /	byed_0 ba_4 da_7 ltar_10 yang_15 bzhugs_20 te_27 
K10D0131_H0133:369a-11	'tsho zhing gzhes la chos kyang ston pa de /	'tsho_0 zhing_6 gzhes_12 la_18 chos_21 kyang_26 ston_32 ba_37 de_40 
K10D0131_H0133:369a-12	sangs rgyas thams cad kyi yul la 'jug pa'i gzungs	sangs_0 rgya_6 thams_12 cad_18 kyi_22 yul_26 la_30 'jug_33 ba_38 gzungs_43 
K10D0131_H0133:369a-13	kyi sgo de bzhin gshegs pa'i ye shes kyi phyag	kyi_0 sgo_4 de_8 bzhin_11 gshegs_17 ba_24 ye_29 shes_32 kyi_37 phyag_41 
K10D0131_H0133:369a-14	rgya zhes bya ba'i ting nge 'dzin la snyoms par	rgya_0 zhes_5 byed_10 ba_14 ting_19 nge_24 'dzin_28 la_34 snyom_37 ba_44 
K10D0131_H0133:369a-15	zhugs so // rigs kyi bu dag /	'jug_0 so_6 rigs_12 kyi_17 bu_21 'dag_24 
K10D0131_H0133:369a-16	ting nge 'dzin de thos pa tsam gyis kyang byang	ting_0 nge_5 'dzin_9 de_15 thos_18 ba_23 tsam_26 gyis_31 kyang_36 byang_42 
K10D0131_H0133:369a-17	chub sems dpa' rnams kyis gces spras byed par 'gyur	chub_0 sems_5 dpa'_10 rnams_15 kyis_21 gces_26 spras_31 byed_37 ba_42 'gyur_46 
K10D0131_H0133:369a-18	te / thabs mkhas pa med par bskal pa brgya	te_0 thabs_5 mkhas_11 ba_17 med_20 ba_24 bskal_28 ba_34 brgya_37 
K10D0131_H0133:369a-19	stong du pha rol tu phyin pa drug la spyad	stong_0 du_6 pha_9 rol_13 tu_17 phyin_20 ba_26 drug_29 la_34 spyod_37 
K10D0131_H0133:369a-20	pa ni de lta ma yin gyi /	ba_0 ni_3 de_6 lta_9 ma_13 yin_16 gyi_20 
K10D0131_H0133:369a-21	ting nge 'dzin de nyan du dengs shig /	ting_0 nge_5 'dzin_9 de_15 nyan_18 du_23 dengs_26 shig_32 
K10D0131_H0133:369a-22	de nas byang chub sems dpa' sems dpa' chen po	de_0 nas_3 byang_7 chub_13 sems_18 dpa'_23 sems_28 dpa'_33 chen_38 po_43 
K10D0131_H0133:369a-23	de dag so so'i de bzhin gshegs pa rnams kyi	de_0 'dag_3 so_7 so_10 de_15 bzhin_18 gshegs_24 ba_31 rnams_34 kyi_40 
K10D0131_H0133:369a-24	ltar mnyan nas / bcom ldan 'das de dag la phyag btsal te /	ltar_0 nyan_5 nas_11 'joms_17 ldan_22 'da'_27 de_32 'dag_35 la_39 phyag_42 btsal_48 te_54 
K10D0131_H0133:369a-25	skad cig thang cig yud tsam cig la sangs rgyas	skad_0 cig_5 thang_9 cig_15 yud_19 tsam_23 cig_28 la_32 sangs_35 rgya_41 
K10D0131_H0133:369a-26	kyi zhing de dag nas mi snang bar gyur nas	kyi_0 zhing_4 de_10 'dag_13 nas_17 mi_21 snang_24 ba_30 gyur_34 nas_39 
K10D0131_H0133:369a-27	rang rang gi mngon par shes pa'i rdzu 'phrul gyi	rang_0 rang_5 gi_10 mngon_13 ba_19 shes_23 ba_28 rdzu_33 'phrul_38 gyi_45 
K10D0131_H0133:369a-28	stobs bskyed pas mi mjed kyi 'jig rten gyi khams	stobs_0 skyed_6 ba_13 mi_17 mjed_20 kyi_25 'jig_29 rten_34 gyi_39 khams_43 
K10D0131_H0133:369a-29	'di ga la ba dang /	'di_0 ga_4 la_7 ba_10 dang_13 
K10D0131_H0133:369a-30	dbus kyi gling bzhi pa ga la ba dang /	dbus_0 kyi_5 gling_9 bzhi_15 ba_20 ga_23 la_26 ba_29 dang_32 
K10D0131_H0133:369a-31	dzambu'i gling ga la ba dang /	dzambu_0 gling_9 ga_15 la_18 ba_21 dang_24 
K10D0131_H0133:369b-0	rgyal po'i khab kyi grong khyer chen po @369b ga la ba dang /	rgyal_0 po_6 khab_11 kyi_16 grong_20 'khyer_26 chen_32 po_37 ga_46 la_49 ba_52 dang_55 
K10D0131_H0133:369b-1	'od ma'i tshal bya ka lanta ka'i gnas ga la ba dang /	'od_0 ma_4 tshal_9 byed_15 ka_19 lanta_22 ka_28 gnas_33 ga_38 la_41 ba_44 dang_47 
K10D0131_H0133:369b-2	bcom ldan 'das de bzhin gshegs pa dgra bcom pa	'joms_0 ldan_5 'da'_10 de_15 bzhin_18 gshegs_24 ba_31 dgra_34 'joms_39 ba_44 
K10D0131_H0133:369b-3	yang dag par rdzogs pa'i sangs rgyas sh'akya thub pa	yang_0 'dag_5 ba_9 rdzogs_13 ba_20 sangs_25 rgya_31 sh_37 thub_45 ba_50 
K10D0131_H0133:369b-4	ga la ba der 'ongs te lhags nas; bcom ldan	ga_0 la_3 ba_6 der_9 'ongs_13 te_19 lhags_22 nas;_28 'joms_33 ldan_38 
K10D0131_H0133:369b-5	'das de bzhin gshegs pa dgra bcom pa yang dag	'da'_0 de_5 bzhin_8 gshegs_14 ba_21 dgra_24 'joms_29 ba_34 yang_37 'dag_42 
K10D0131_H0133:369b-6	par rdzogs pa'i sangs rgyas sh'akya thub pa'i zhabs la	ba_0 rdzogs_4 ba_11 sangs_16 rgya_22 sh_28 thub_36 ba_41 zhabs_46 la_52 
K10D0131_H0133:369b-7	mgo bos phyag btsal te /	mgo_0 'bod_4 phyag_8 btsal_14 te_20 
K10D0131_H0133:369b-8	bcom ldan 'das la lan gsum bskor ba byas nas; phyogs gcig tu 'khod de /	'joms_0 ldan_5 'da'_10 la_15 lan_18 gsum_22 skor_27 ba_33 byed_36 nas;_41 phyogs_46 gcig_53 tu_58 'khod_61 de_67 
K10D0131_H0133:369b-9	bcom ldan 'das kyis gnas nas de dag thams cad	'joms_0 ldan_5 'da'_10 kyis_15 gnas_20 nas_25 de_29 'dag_32 thams_36 cad_42 
K10D0131_H0133:369b-10	rin po che sna tshogs kyi padma chen po la	rin_0 po_4 che_7 sna_11 tshogs_15 kyi_22 padma_26 chen_32 po_37 la_40 
K10D0131_H0133:369b-11	skyil mo krung bcas te 'khod do //	skyil_0 mo_6 krung_9 'cha'_15 te_20 'khod_23 do_29 
K10D0131_H0133:369b-12	de bzhin du sbyor te /	de_0 bzhin_3 du_9 sbyor_12 te_18 
K10D0131_H0133:369b-13	lho phyogs dang /	lho_0 phyogs_4 dang_11 
K10D0131_H0133:369b-14	nub phyogs dang /	nub_0 phyogs_4 dang_11 
K10D0131_H0133:369b-15	byang phyogs dang /	byang_0 phyogs_6 dang_13 
K10D0131_H0133:369b-16	'og gi phyogs dang /	'og_0 gi_4 phyogs_7 dang_14 
K10D0131_H0133:369b-17	steng gi phyogs dang /	steng_0 gi_6 phyogs_9 dang_16 
K10D0131_H0133:369b-18	de bzhin du phyogs dang /	de_0 bzhin_3 du_9 phyogs_12 dang_19 
K10D0131_H0133:369b-19	phyogs mtshams dang /	phyogs_0 mtshams_7 dang_15 
K10D0131_H0133:369b-20	phyogs mtshams dang nye ba dang /	phyogs_0 mtshams_7 dang_15 nye_20 ba_24 dang_27 
K10D0131_H0133:369b-21	phyogs bcu kun tu sangs rgyas kyi zhing gangg'a'i klung gi bye ma snyed dag na /	phyogs_0 'chu_7 kun_11 tu_15 sangs_18 rgya_24 kyi_30 zhing_34 gangg'i_40 klung_50 gi_56 'bye_59 ma_63 snyed_66 'dag_72 na_76 
K10D0131_H0133:369b-22	byang chub sems dpa' sems dpa' chen po bla na	byang_0 chub_6 sems_11 dpa'_16 sems_21 dpa'_26 chen_31 po_36 bla_39 na_43 
K10D0131_H0133:369b-23	med pa yang dag par rdzogs pa'i byang chub tu	med_0 ba_4 yang_7 'dag_12 ba_16 rdzogs_20 ba_27 byang_32 chub_38 tu_43 
K10D0131_H0133:369b-24	skye ba gcig gis thogs pa /	skye_0 ba_5 gcig_8 gis_13 thogs_17 ba_23 
K10D0131_H0133:369b-25	tshad med /	tshad_0 med_6 
K10D0131_H0133:369b-26	grangs med /	grangs_0 med_7 
K10D0131_H0133:369b-27	dpag tu med ba brgya stong de dag so so'i de bzhin gshegs pa de dag gis bkye ste /	dpog_0 tu_5 med_8 ba_12 brgya_15 stong_21 de_27 'dag_30 so_34 so_37 de_42 bzhin_45 gshegs_51 ba_58 de_61 'dag_64 gis_68 'gyed_72 ste_77 
K10D0131_H0133:369b-28	rigs kyi bu dag /	rigs_0 kyi_5 bu_9 'dag_12 
K10D0131_H0133:369b-29	khyed 'jig rten gyi khams mi mjed du dengs shig /	'khyed_0 'jig_6 rten_11 gyi_16 khams_20 mi_26 mjed_29 du_34 dengs_37 shig_43 
K10D0131_H0133:369b-30	de na de bzhin gshegs pa dgra bcom pa yang	de_0 na_3 de_6 bzhin_9 gshegs_15 ba_22 dgra_25 'joms_30 ba_35 yang_38 
K10D0131_H0133:369b-31	dag par rdzogs pa'i sangs rgyas sh'akya thub pa zhes	'dag_0 ba_4 rdzogs_8 ba_15 sangs_20 rgya_26 sh_32 thub_40 ba_45 zhes_48 
K10D0131_H0133:369b-32	bya ba da ltar yang bzhugs te /	byed_0 ba_4 da_7 ltar_10 yang_15 bzhugs_20 te_27 
K10D0131_H0133:369b-33	'tsho zhing gzhes la chos kyang ston pa de /	'tsho_0 zhing_6 gzhes_12 la_18 chos_21 kyang_26 ston_32 ba_37 de_40 
K10D0131_H0133:370a-0	sangs rgyas thams cad kyi yul la 'jug pa'i gzungs kyi sgo de bzhin @370a *//	sangs_0 rgya_6 thams_12 cad_18 kyi_22 yul_26 la_30 'jug_33 ba_38 gzungs_43 kyi_50 sgo_54 de_58 bzhin_61 
K10D0131_H0133:370a-1	gshegs pa'i ye shes kyi phyag rgya zhes bya ba'i ting nge 'dzin la snyoms par zhugs so //	gshegs_0 ba_7 ye_12 shes_15 kyi_20 phyag_24 rgya_30 zhes_35 byed_40 ba_44 ting_49 nge_54 'dzin_58 la_64 snyom_67 ba_74 'jug_78 so_84 
K10D0131_H0133:370a-2	rigs kyi bu dag /	rigs_0 kyi_5 bu_9 'dag_12 
K10D0131_H0133:370a-3	ting nge 'dzin de'i ming thos pa tsam gyis kyang /	ting_0 nge_5 'dzin_9 de_15 ming_20 thos_25 ba_30 tsam_33 gyis_38 kyang_43 
K10D0131_H0133:370a-4	byang chub sems dpa' rnams kyis gces spras byed par gyur te /	byang_0 chub_6 sems_11 dpa'_16 rnams_21 kyis_27 gces_32 spras_37 byed_43 ba_48 gyur_52 te_57 
K10D0131_H0133:370a-5	thabs mkhas pa med par bskal pa brgya stong du	thabs_0 mkhas_6 ba_12 med_15 ba_19 bskal_23 ba_29 brgya_32 stong_38 du_44 
K10D0131_H0133:370a-6	pha rol tu phyin pa drug la spyad pa ni	pha_0 rol_4 tu_8 phyin_11 ba_17 drug_20 la_25 spyod_28 ba_34 ni_37 
K10D0131_H0133:370a-7	de lta ma yin gyi /	de_0 lta_3 ma_7 yin_10 gyi_14 
K10D0131_H0133:370a-8	ting nge 'dzin de nyan du dengs shig de nas	ting_0 nge_5 'dzin_9 de_15 nyan_18 du_23 dengs_26 shig_32 de_37 nas_40 
K10D0131_H0133:370a-9	byang chub sems dpa' sems dpa' chen po de dag	byang_0 chub_6 sems_11 dpa'_16 sems_21 dpa'_26 chen_31 po_36 de_39 'dag_42 
K10D0131_H0133:370a-10	so so'i de bzhin gshegs pa dag gi ltar mnyan	so_0 so_3 de_8 bzhin_11 gshegs_17 ba_24 'dag_27 gi_31 ltar_34 nyan_39 
K10D0131_H0133:370a-11	nas bcom ldan 'das de dag la phyag 'tshal te	nas_0 'joms_4 ldan_9 'da'_14 de_19 'dag_22 la_26 phyag_29 'tshal_35 te_42 
