K12D0499_H0464:357b-21	dang por sngags kyis bzlog par bya //	dang_0 por_5 sngags_9 kyis_16 bzlog_21 ba_27 byed_31 
K12D0499_H0464:357b-22	snying ga'i sngags kyi rgyal po yis //	snying_0 ga_7 sngags_12 kyi_19 rgyal_23 po_29 yis_32 
K12D0499_H0464:357b-23	rlung dang 'grogs te 'byung bar 'gyur //	rlung_0 dang_6 'grogs_11 te_18 'byung_21 ba_28 'gyur_32 
K12D0499_H0464:357b-24	nad kyi snying po h'um bsams te //	nad_0 kyi_4 snying_8 po_15 h_18 bsams_23 te_29 
K12D0499_H0464:357b-25	rgyu rkyen tshogs pas bsreg par bya //	rgyu_0 rkyen_5 tshogs_11 ba_18 bsreg_22 ba_28 byed_32 
K12D0499_H0464:357b-26	de nas phyir bzlog mnan par bya //	de_0 nas_3 phyir_7 bzlog_13 gnon_19 ba_24 byed_28 
K12D0499_H0464:357b-27	sbyin sreg rnam pa gsum du bshad //	sbyin_0 sreg_6 rnam_11 ba_16 gsum_19 du_24 'chad_27 
K12D0499_H0464:357b-28	dang po zhi ba'i sbyin sreg ste //	dang_0 po_5 zhi_8 ba_12 sbyin_17 sreg_23 ste_28 
K12D0499_H0464:357b-29	zlum po khru gang kha dog dkar //	zlum_0 po_5 khru_8 gang_13 kha_18 dog_22 dkar_26 
K12D0499_H0464:357b-30	kha khyer sor bzhir rdo rjes mtshan //	kha_0 'khyer_4 sor_10 bzhir_14 rdo_20 rjes_24 mtshan_29 
K12D0499_H0464:357b-31	gru gsum sor bcu kha dog nag /	gru_0 gsum_4 sor_9 'chu_13 kha_17 dog_21 nag_25 
K12D0499_H0464:357b-32	kha khyer sor gsum rdo rjes mtshan //	kha_0 'khyer_4 sor_10 gsum_14 rdo_19 rjes_23 mtshan_28 
K12D0499_H0464:357b-33	zla dbyibs zla ba dmar 'dra ba //	zla_0 dbyibs_4 zla_11 ba_15 dmar_18 'dra_23 ba_28 
K12D0499_H0464:357b-34	khru do kha khyer de 'drar shes //	khru_0 do_5 kha_8 'khyer_12 de_18 'drar_21 shes_27 
K12D0499_H0464:358a-0	zhi ba 'o ma can shing @358a *//	zhi_0 ba_4 'o_7 ma_10 can_13 shing_17 
K12D0499_H0464:358a-1	gi /	gi_0 
K12D0499_H0464:358a-2	gtum pa 'bigs par byed de'o //	'thum_0 ba_5 'bigs_8 ba_14 byed_18 de_23 
K12D0499_H0464:358a-3	dbang yang zhi ba dag dang mtshungs //	dbang_0 yang_6 zhi_11 ba_15 'dag_18 dang_22 mtshungs_27 
K12D0499_H0464:358a-4	rgyun bzhag me dang rigs ngan khyim //	rgyun_0 'jog_6 me_12 dang_15 rigs_20 ngan_25 khyim_30 
K12D0499_H0464:358a-5	ram las thab dang me lha bskyed //	ram_0 las_4 thab_8 dang_13 me_18 lha_21 skyed_25 
K12D0499_H0464:358a-6	zhi rgyas dbang la bdud rtsi lnga //	zhi_0 rgya_4 dbang_10 la_16 bdud_19 rtsi_24 lnga_29 
K12D0499_H0464:358a-7	gtum pa dmar dang khrag dag dang //	'thum_0 ba_5 dmar_8 dang_13 khrag_18 'dag_24 dang_28 
K12D0499_H0464:358a-8	dug dang gu gul nag po dang //	dug_0 dang_4 gu_9 gul_12 nag_16 po_20 dang_23 
K12D0499_H0464:358a-9	gzugs brnyan dag gis mchod par bya //	gzugs_0 rnyan_6 'dag_13 gis_17 mchod_21 ba_27 byed_31 
K12D0499_H0464:358a-10	'jig rten dbang phyug tshangs pa mchog gi sras //	'jig_0 rten_5 dbang_10 phyug_16 tshangs_22 ba_30 mchog_33 gi_39 sras_42 
K12D0499_H0464:358a-11	me lha'i rgyal po takkis dbang bskur zhing //	me_0 lha_3 rgyal_9 po_15 takkis_18 dbang_25 skur_31 zhing_37 
K12D0499_H0464:358a-12	shes rab mchog gis nyon mongs thams cad sreg /	shes_0 rab_5 mchog_9 gis_15 nyon_19 mongs_24 thams_30 cad_36 sreg_40 
K12D0499_H0464:358a-13	'jigs byed me lha nyid la phyag 'tshal 'dud //	'jigs_0 byed_6 me_11 lha_14 nyid_18 la_23 phyag_26 'tshal_32 'dud_39 
K12D0499_H0464:358a-14	gzi brjid chen po me yi lha //	gzi_0 brjid_4 chen_10 po_15 me_18 yi_21 lha_24 
K12D0499_H0464:358a-15	'dod pa thams cad rab stsol zhing //	'dod_0 ba_5 thams_8 cad_14 rab_18 stsol_22 zhing_28 
K12D0499_H0464:358a-16	bdag gzhan phan sogs la zhugs pa //	bdag_0 gzhan_5 phan_11 sogs_16 la_21 'jug_24 ba_30 
K12D0499_H0464:358a-17	tshangs sras mchog la phyag 'tshal 'dud //	tshangs_0 sras_8 mchog_13 la_19 phyag_22 'tshal_28 'dud_35 
K12D0499_H0464:358a-18	me yi thugs kar drag po ni //	me_0 yi_3 thugs_6 kar_12 drag_16 po_21 ni_24 
K12D0499_H0464:358a-19	cho ga bzhin du bskyed par bya //	cho_0 ga_4 bzhin_7 du_13 skyed_16 ba_23 byed_27 
K12D0499_H0464:358a-20	sbyin sreg de dag 'brel pa yis //	sbyin_0 sreg_6 de_11 'dag_14 'brel_18 ba_24 yis_27 
K12D0499_H0464:358a-21	nor rnams thams cad ster bar byed //	nor_0 rnams_4 thams_10 cad_16 ster_20 ba_25 byed_29 
K12D0499_H0464:358a-22	de nas byang chub sems dpa' phyag na rdo rjes	de_0 nas_3 byang_7 chub_13 sems_18 dpa'_23 phyag_28 na_34 rdo_37 rjes_41 
K12D0499_H0464:358a-23	bcom ldan 'das rdo rje 'dzin pa la zhus pa	'joms_0 ldan_5 'da'_10 rdo_15 rje_19 'dzin_23 ba_29 la_32 zhus_35 ba_40 
K12D0499_H0464:358a-24	/ drag po'i sngags rnams ji ltar lags /	drag_2 po_7 sngags_12 rnams_19 ji_25 ltar_28 lags_33 
K12D0499_H0464:358a-25	de nas rdo rje 'dzin pas lha srin thams cad 'dul ba'i sngags 'di gsungs so //	de_0 nas_3 rdo_7 rje_11 'dzin_15 ba_21 lha_25 srin_29 thams_34 cad_40 'dul_44 ba_49 sngags_54 'di_61 gsungs_65 so_72 
K12D0499_H0464:358a-26	tadya th'a /	tadya_0 th_6 
K12D0499_H0464:358a-27	h'um phat/	h_0 
K12D0499_H0464:358a-28	n'a ga bi dha ra n'a ya h'um phat/	n_0 ga_4 bi_7 dha_10 ra_14 n_17 ya_21 h_24 
K12D0499_H0464:358a-29	n'a ga aut sa da n'a ya h'um phat/	n_0 ga_4 aut_7 sa_11 da_14 n_17 ya_21 h_24 
K12D0499_H0464:358a-30	n'i lam ba sa n'a ya h'um phat/	n_0 lam_4 ba_8 sa_11 n_14 ya_18 h_21 
K12D0499_H0464:358a-31	aa pra ti ha ta ba la pa r'a kra m'a ya h'um phat/	aa_0 pra_3 ti_7 ha_10 ta_13 ba_16 la_19 ba_22 r_25 kra_29 m_33 ya_37 h_40 
K12D0499_H0464:358a-32	kri t'anta ya h'um phat/	kri_0 t_4 ya_11 h_14 
K12D0499_H0464:358a-33	kri t'anta r'u p'a ya h'um phat/	kri_0 t_4 r_11 p_15 ya_19 h_22 
K12D0499_H0464:358a-34	ro sha na ya h'um phat/	ro_0 sha_3 na_7 ya_10 h_13 
K12D0499_H0464:358b-0	@358b tr'a sa n'a ya h'um phat/	tr_6 sa_11 n_14 ya_18 h_21 
K12D0499_H0464:358b-1	kum bh'anda auta sa da n'a ya h'um phat/	kum_0 bh_4 auta_12 sa_17 da_20 n_23 ya_27 h_30 
K12D0499_H0464:358b-2	pre ta pi sh'a tsa bi n'a sha ka r'a ya h'um phat/	pre_0 ta_4 pi_7 sh_10 tsa_15 bi_19 n_22 sha_26 ka_30 r_33 ya_37 h_40 
K12D0499_H0464:358b-3	yaksha aa pasm'a ra bi n'a sha ka r'a ya h'um phat/	yaksha_0 aa_7 pasm_10 ra_17 bi_20 n_23 sha_27 ka_31 r_34 ya_38 h_41 
K12D0499_H0464:358b-4	ha sa ha sa /	ha_0 sa_3 ha_6 sa_9 
K12D0499_H0464:358b-5	dha ra dha ra /	dha_0 ra_4 dha_7 ra_11 
K12D0499_H0464:358b-6	m'a ra ya m'a ra ya /	m_0 ra_4 ya_7 m_10 ra_14 ya_17 
K12D0499_H0464:358b-7	n'a sha ya n'a sha ya /	n_0 sha_4 ya_8 n_11 sha_15 ya_19 
K12D0499_H0464:358b-8	sarba bighna bi n'a sha ka r'a ya h'um phat/	sarba_0 bighna_6 bi_13 n_16 sha_20 ka_24 r_27 ya_31 h_34 
K12D0499_H0464:358b-9	sarba sha tr'um sam barta bi n'a sha ka r'a ya h'um phat/	sarba_0 sha_6 tr_10 sam_16 barta_20 bi_26 n_29 sha_33 ka_37 r_40 ya_44 h_47 
K12D0499_H0464:358b-10	n'i l'amba ra dha ra badzra p'a ni r'a dzny'a pa ya ti sv'ah'a /	n_0 l_4 ra_11 dha_14 ra_18 badzra_21 p_28 ni_32 r_35 dzny_39 ba_46 ya_49 ti_52 sv'a_55 
K12D0499_H0464:358b-11	aom badzra aa na la ma h'a bhu ta dzva la bhasmam ku ru sv'ah'a /	aom_0 badzra_4 aa_11 na_14 la_17 ma_20 h_23 bhu_27 ta_31 dzva_34 la_39 bhasmam_42 ku_50 ru_53 sv'a_56 
K12D0499_H0464:358b-12	m'a ra ya h'um phat/	m_0 ra_4 ya_7 h_10 
K12D0499_H0464:358b-13	pushti ku ru aom/	pushti_0 ku_7 ru_10 
K12D0499_H0464:358b-14	sngags 'di gsungs pa tsam gyis ni //	sngags_0 'di_7 gsungs_11 ba_18 tsam_21 gyis_26 ni_31 
K12D0499_H0464:358b-15	lha srin thams cad brgyal bar gyur //	lha_0 srin_4 thams_9 cad_15 brgyal_19 ba_26 gyur_30 
K12D0499_H0464:358b-16	de nas byang chub sems dpa' phyag na rdo rjes ched du brjod pa /	de_0 nas_3 byang_7 chub_13 sems_18 dpa'_23 phyag_28 na_34 rdo_37 rjes_41 ched_46 du_51 rjod_54 ba_60 
K12D0499_H0464:358b-17	ae ma dus gsum sangs rgyas kyis //	ae_0 ma_3 dus_6 gsum_10 sangs_15 rgya_21 kyis_27 
K12D0499_H0464:358b-18	drag po 'dul bar dbang bskur nas //	drag_0 po_5 'dul_8 ba_13 dbang_17 skur_23 nas_29 
K12D0499_H0464:358b-19	sngags rgyal gsungs pas skrag 'gyur ba //	sngags_0 rgyal_7 gsungs_13 ba_20 skrag_24 'gyur_30 ba_36 
K12D0499_H0464:358b-20	ngo mtshar 'di ni shin tu lhag //	ngo_0 mtshar_4 'di_11 ni_15 shin_18 tu_23 lhag_26 
K12D0499_H0464:358b-21	ces pa'o //	ces_0 ba_4 
K12D0499_H0464:358b-22	de nas rang rang gi srog snying ston pa la phul nas bran gyi tshul du gnas so //	de_0 nas_3 rang_7 rang_12 gi_17 srog_20 snying_25 ston_32 ba_37 la_40 'bul_43 nas_48 bran_52 gyi_57 tshul_61 du_67 gnas_70 so_75 
K12D0499_H0464:358b-23	rdo rje sa 'og gi rgyud las /	rdo_0 rje_4 sa_8 'og_11 gi_15 brgyud_18 las_24 
K12D0499_H0464:358b-24	bcos dka' ba'i nad zlog pa'i le'u ste gsum pa'o ////	'chos_0 dka'_5 ba_10 nad_15 zlog_19 ba_24 le_29 ste_34 gsum_38 ba_43 
K12D0499_H0464:358b-25	de nas byang chub sems dpa' phyag na rdo rjes	de_0 nas_3 byang_7 chub_13 sems_18 dpa'_23 phyag_28 na_34 rdo_37 rjes_41 
K12D0499_H0464:358b-26	rdo rje 'dzin pa la mchod pa dang phyag byas	rdo_0 rje_4 'dzin_8 ba_14 la_17 mchod_20 ba_26 dang_29 phyag_34 byed_40 
K12D0499_H0464:358b-27	nas gsol ba btab pa /	nas_0 gsol_4 ba_9 'debs_12 ba_17 
K12D0499_H0464:358b-28	sku dang gsung dang thugs kyi mchog /	sku_0 dang_4 gsung_9 dang_15 thugs_20 kyi_26 mchog_30 
K12D0499_H0464:358b-29	dkyil 'khor dam pa bshad du gsol /	dkyil_0 'khor_6 dam_12 ba_16 'chad_19 du_25 gsol_28 
K12D0499_H0464:358b-30	de nas rdo rje 'chang rgyal pos; ;gsung ni 'di skad bka' stsal to //	de_0 nas_3 rdo_7 rje_11 'chang_15 rgyal_22 pos;_28 ;gsung_33 ni_40 'di_43 skad_47 bka'_52 stsal_57 to_63 
K12D0499_H0464:358b-31	dkyil 'khor dag tu ma zhugs shing //	dkyil_0 'khor_6 'dag_12 tu_16 ma_19 'jug_22 shing_28 
K12D0499_H0464:358b-32	dbang bskur ba yang ma thob na //	dbang_0 skur_6 ba_12 yang_15 ma_20 'thob_23 na_28 
K12D0499_H0464:358b-33	bsgrubs kyang ci yang mi 'grub bo //	sgrub_0 kyang_8 ci_14 yang_17 mi_22 'grub_25 'bo_31 
K12D0499_H0464:358b-34	de bas da ni bshad bya ba //	de_0 ba_3 da_7 ni_10 'chad_13 byed_19 ba_23 
K12D0499_H0464:359a-0	gru @359a *//	gru_0 
K12D0499_H0464:359a-1	bzhir bgyi zhing sgo bzhir bgyi //	bzhir_0 bgyid_6 zhing_11 sgo_17 bzhir_21 bgyid_27 
K12D0499_H0464:359a-2	thig bzhi dag dang ldan gyur pas //	thig_0 bzhi_5 'dag_10 dang_14 ldan_19 gyur_24 ba_29 
K12D0499_H0464:359a-3	cha chen bzhi ru btab byas na //	cha_0 chen_4 bzhi_9 ru_14 'debs_17 byed_22 na_27 
K12D0499_H0464:359a-4	shar gyi cha chen dang por ni //	'char_0 gyi_5 cha_9 chen_13 dang_18 por_23 ni_27 
K12D0499_H0464:359a-5	bzhir bgos dang po lte ba dang //	bzhir_0 bgod_6 dang_11 po_16 lte_19 ba_23 dang_26 
K12D0499_H0464:359a-6	gnyis pa padma ral gri gnyis //	gnyis_0 ba_6 padma_9 ral_15 gri_19 gnyis_23 
K12D0499_H0464:359a-7	gsum pa lha yi snam bu 'o //	gsum_0 ba_5 lha_8 yi_12 snam_15 bu_20 'o_23 
K12D0499_H0464:359a-8	de nas tshon ni dgye bar bya //	de_0 nas_3 tshon_7 ni_13 dgye_16 ba_21 byed_25 
K12D0499_H0464:359a-9	lte ba dkyil 'khor 'od dang bcas //	lte_0 ba_4 dkyil_7 'khor_13 'od_19 dang_23 'cha'_28 
K12D0499_H0464:359a-10	padma sngon po ral gri sngon //	padma_0 sngon_6 po_12 ral_15 gri_19 sngon_23 
K12D0499_H0464:359a-11	lha snam nag la rdo rje'i sgo //	lha_0 snam_4 nag_9 la_13 rdo_16 rje_20 sgo_26 
K12D0499_H0464:359a-12	bzhi ni dkar po bri bar bya //	bzhi_0 ni_5 dkar_8 po_13 'bri_16 ba_20 byed_24 
K12D0499_H0464:359a-13	sgo yi phyi rol kha dog nag /	sgo_0 yi_4 phyi_7 rol_12 kha_16 dog_20 nag_24 
K12D0499_H0464:359a-14	me ri 'bar ba bri bar bya //	me_0 ri_3 'bar_6 ba_11 'bri_14 ba_18 byed_22 
K12D0499_H0464:359a-15	de la rdo rje phreng bas bskor //	de_0 la_3 rdo_6 rje_10 phreng_14 ba_21 skor_25 
K12D0499_H0464:359a-16	mda' dang phur bu bcu drug la //	mda'_0 dang_5 'phur_10 bu_15 'chu_18 drug_22 la_27 
K12D0499_H0464:359a-17	tshon skud sngon po bri bar bya //	tshon_0 skud_6 sngon_11 po_17 'bri_20 ba_24 byed_28 
K12D0499_H0464:359a-18	dbus su bcom ldan 'das ma la //	dbus_0 su_5 'joms_8 ldan_13 'da'_18 ma_23 la_26 
K12D0499_H0464:359a-19	klu chen phyed gzugs sbrul mgo can //	klu_0 chen_4 phyed_9 gzugs_15 sbrul_21 mgo_27 can_31 
K12D0499_H0464:359a-20	rdzogs par byas nas rnal 'byor ni //	rdzogs_0 ba_7 byed_11 nas_16 rnal_20 'byor_25 ni_31 
K12D0499_H0464:359a-21	cho ga bzhin du gnyis ka yi //	cho_0 ga_4 bzhin_7 du_13 gnyis_16 ka_22 yi_25 
K12D0499_H0464:359a-22	rgyud las gsungs pa bzhin du bskyed //	brgyud_0 las_6 gsungs_10 ba_17 bzhin_20 du_26 skyed_29 
K12D0499_H0464:359a-23	dang po bla ma'i spyan sngar ni //	dang_0 po_5 bla_8 ma_12 spyan_17 sngar_23 ni_29 
K12D0499_H0464:359a-24	phyag 'tshal la sogs bdun rnam dag /	phyag_0 'tshal_6 la_13 sogs_16 bdun_21 rnam_26 'dag_31 
K12D0499_H0464:359a-25	de nas ye shes sems dpa' la //	de_0 nas_3 ye_7 shes_10 sems_15 dpa'_20 la_25 
K12D0499_H0464:359a-26	me tog gtor zhing bstod pa bya //	me_0 tog_3 'thor_7 zhing_12 bstod_18 ba_24 byed_27 
K12D0499_H0464:359a-27	phyag 'tshal bskor ba bdun rnam dag /	phyag_0 'tshal_6 skor_13 ba_19 bdun_22 rnam_27 'dag_32 
K12D0499_H0464:359a-28	byas nas ye shes dbab par bya //	byed_0 nas_5 ye_9 shes_12 'bebs_17 ba_22 byed_26 
K12D0499_H0464:359a-29	gnas gsum ye ge gsum bsams la //	gnas_0 gsum_5 ye_10 ge_13 gsum_16 bsams_21 la_27 
K12D0499_H0464:359a-30	sngags 'di yang ni brjod par bya //	sngags_0 'di_7 yang_11 ni_16 rjod_19 ba_25 byed_29 
K12D0499_H0464:359a-31	a'a be sha ya stambha ya r'a r'a ts'a la ya ts'a la ya h'um a'a aom dzee:/	a_0 be_4 sha_7 ya_11 stambha_14 ya_22 r_25 r_29 ts_33 la_38 ya_41 ts_44 la_49 ya_52 h_55 a_60 aom_64 
K12D0499_H0464:359a-32	de nas dkyil 'khor bstan byas la //	de_0 nas_3 dkyil_7 'khor_13 ston_19 byed_25 la_30 
K12D0499_H0464:359a-33	rig pa'i dbang ni cho ga bzhin //	rig_0 ba_4 dbang_9 ni_15 cho_18 ga_22 bzhin_25 
K12D0499_H0464:359a-34	de nas sngags kyi rjes gnang sbyin //	de_0 nas_3 sngags_7 kyi_14 rjes_18 gnang_23 sbyin_29 
K12D0499_H0464:359b-0	rnal 'byor snying ga'i sa bon @359b las; ;sngags kyi 'od kyis ye shes bskul //	rnal_0 'byor_5 snying_11 ga_18 sa_23 bon_26 las;_36 ;sngags_41 kyi_49 'od_53 kyis_57 ye_62 shes_65 skul_70 
K12D0499_H0464:359b-1	ye shes ljags las 'od byung las //	ye_0 shes_3 ljags_8 las_14 'od_18 'byung_22 las_28 
K12D0499_H0464:359b-2	snod gyur lce la thim par bsam //	snod_0 gyur_5 lce_10 la_14 'thim_17 ba_22 bsam_26 
K12D0499_H0464:359b-3	bsgrub pa'i rdzas kyi bkra shis brjod //	sgrub_0 ba_7 rdzas_12 kyi_18 bkra_22 shis_27 rjod_32 
K12D0499_H0464:359b-4	rdo rje sa 'og gi rgyud las dkyil 'khor gyi le'u ste bzhi pa'o ////	rdo_0 rje_4 sa_8 'og_11 gi_15 brgyud_18 las_24 dkyil_28 'khor_34 gyi_40 le_44 ste_49 bzhi_53 ba_58 
K12D0499_H0464:359b-5	de nas byang chub sems dpa' phyag na rdo rjes	de_0 nas_3 byang_7 chub_13 sems_18 dpa'_23 phyag_28 na_34 rdo_37 rjes_41 
K12D0499_H0464:359b-6	rdo rje 'dzin pa la mchod cing phyag 'tshal nas	rdo_0 rje_4 'dzin_8 ba_14 la_17 mchod_20 cing_26 phyag_31 'tshal_37 nas_44 
K12D0499_H0464:359b-7	gsol ba btab pa /	gsol_0 ba_5 'debs_8 ba_13 
K12D0499_H0464:359b-8	snying po kun la phan gdags dang //	snying_0 po_7 kun_10 la_14 phan_17 'dogs_22 dang_28 
K12D0499_H0464:359b-9	sangs rgyas bstan la gzhug don du //	sangs_0 rgya_6 ston_12 la_18 'jug_21 don_27 du_31 
K12D0499_H0464:359b-10	gnod sbyin bsgrub par bya ba ni //	gnod_0 sbyin_5 sgrub_11 ba_18 byed_22 ba_26 ni_29 
K12D0499_H0464:359b-11	rdo rje chen pos bshad du gsol //	rdo_0 rje_4 chen_8 pos_13 'chad_17 du_23 gsol_26 
K12D0499_H0464:359b-12	de nas ston pa rdo rje 'dzin //	de_0 nas_3 ston_7 ba_12 rdo_15 rje_19 'dzin_23 
K12D0499_H0464:359b-13	sems can kun la phan don du //	sems_0 can_5 kun_9 la_13 phan_16 don_21 du_25 
K12D0499_H0464:359b-14	gnod sbyin bsgrub par bya ba ni //	gnod_0 sbyin_5 sgrub_11 ba_18 byed_22 ba_26 ni_29 
K12D0499_H0464:359b-15	gsung ni 'di skad bka' stsal to //	gsung_0 ni_6 'di_9 skad_13 bka'_18 stsal_23 to_29 
K12D0499_H0464:359b-16	rdo rje slob dpon smod pa dang //	rdo_0 rje_4 slob_8 dpon_13 smod_18 ba_23 dang_26 
K12D0499_H0464:359b-17	theg pa che la smod pa dang //	theg_0 ba_5 che_8 la_12 smod_15 ba_20 dang_23 
K12D0499_H0464:359b-18	de sgrub pa la snying nas brnyas //	de_0 sgrub_3 ba_9 la_12 snying_15 nas_22 brnyas_26 
K12D0499_H0464:359b-19	sgrub pa 'di ni brtsam par bya; ;de la ri	sgrub_0 ba_6 'di_9 ni_13 brtsam_16 ba_23 bya;_27 ;de_32 la_36 ri_39 
K12D0499_H0464:359b-20	rab kyi 'og na las kyi gnod sbyin gyi lus	rab_0 kyi_4 'og_8 na_12 las_15 kyi_19 gnod_23 sbyin_28 gyi_34 lus_38 
K12D0499_H0464:359b-21	blangs la gdong bzhi lag pa bzhi yod pa /	blangs_0 la_7 gdong_10 bzhi_16 lag_21 ba_25 bzhi_28 yod_33 ba_37 
K12D0499_H0464:359b-22	gdong dang po bcom ldan 'das kyi sngags zlos pa /	gdong_0 dang_6 po_11 'joms_14 ldan_19 'da'_24 kyi_29 sngags_33 zlos_40 ba_45 
K12D0499_H0464:359b-23	gnyis pa rang gi srog snying bzla ba /	gnyis_0 ba_6 rang_9 gi_14 srog_17 snying_22 bzla_29 ba_34 
K12D0499_H0464:359b-24	gsum pa na me lce'i dbugs 'byung /	gsum_0 ba_5 na_8 me_11 lce_14 dbugs_20 'byung_26 
K12D0499_H0464:359b-25	bzhi pa na sha dang khrag za ba yong /	bzhi_0 ba_5 na_8 sha_11 dang_15 khrag_20 za_26 ba_29 yong_32 
K12D0499_H0464:359b-26	de sgrub pa'i thabs bshad kyi /	de_0 sgrub_3 ba_9 thabs_14 'chad_20 kyi_26 
K12D0499_H0464:359b-27	legs par nyon la yid la zungs shig /	legs_0 ba_5 nyon_9 la_14 yid_17 la_21 zungs_24 shig_30 
K12D0499_H0464:359b-28	rdo rje 'dzin pa'i ting 'dzin gyis //	rdo_0 rje_4 'dzin_8 ba_14 ting_19 'dzin_24 gyis_30 
K12D0499_H0464:359b-29	sngags kyi rgyal po 'bum bzlas la //	sngags_0 kyi_7 rgyal_11 po_17 'bum_20 bzlas_25 la_31 
K12D0499_H0464:359b-30	'byung [?] bzhi yi dkyil 'khor bri //	'byung_0 bzhi_11 yi_16 dkyil_19 'khor_25 'bri_31 
K12D0499_H0464:359b-31	de yi steng du khrag chen gyis //	de_0 yi_3 steng_6 du_12 khrag_15 chen_21 gyis_26 
K12D0499_H0464:359b-32	padma 'dab ma bcu drug pa //	padma_0 'dab_6 ma_11 'chu_14 drug_18 ba_23 
K12D0499_H0464:359b-33	btson dong tshul du bri bar bya //	btson_0 'dong_6 tshul_11 du_17 'bri_20 ba_24 byed_28 
K12D0499_H0464:360a-0	@360a *// dar sngon de yi nang du bting //	dar_10 sngon_14 de_20 yi_23 nang_26 du_31 bting_34 
K12D0499_H0464:360a-1	dbus su mi yi sha dang khrag /	dbus_0 su_5 mi_8 yi_11 sha_14 dang_18 khrag_23 
K12D0499_H0464:360a-2	dang po khyi ste gnyis pa phag /	dang_0 po_5 khyi_8 ste_13 gnyis_17 ba_23 phag_26 
K12D0499_H0464:360a-3	gsum par rna can zangs gtsug phud //	gsum_0 ba_5 rna_9 can_13 zangs_17 gtsug_23 'bud_29 
K12D0499_H0464:360a-4	lnga par skad can drug par ra; ;bdun par skye gnyis brgyad par glang //	lnga_0 ba_5 skad_9 can_14 drug_18 ba_23 ra;_27 ;bdun_31 ba_37 skye_41 gnyis_46 brgyad_52 ba_59 glang_63 
K12D0499_H0464:360a-5	g-yas kyi phyogs nas bskor ba 'o //	g-yas_0 kyi_6 phyogs_10 nas_17 skor_21 ba_27 'o_30 
K12D0499_H0464:360a-6	ma he lug dang spre 'u dang //	ma_0 he_3 lug_6 dang_10 spre_15 'u_20 dang_23 
K12D0499_H0464:360a-7	g-yon gyi phyogs nas bskor ba 'o //	g-yon_0 gyi_6 phyogs_10 nas_17 skor_21 ba_27 'o_30 
K12D0499_H0464:360a-8	de ni dbul ba'i dam tshig go /	de_0 ni_3 'bul_6 ba_11 dam_16 tshig_20 go_26 
K12D0499_H0464:360a-9	khrag dang dug dang ske tshe yis //	khrag_0 dang_6 dug_11 dang_15 ske_20 tshe_24 yis_29 
K12D0499_H0464:360a-10	nam gyi phyed kyi dus dag tu //	nam_0 gyi_4 phyed_8 kyi_14 dus_18 'dag_22 tu_26 
K12D0499_H0464:360a-11	dur khrod ras la 'di ltar bri //	dur_0 khrod_4 ras_10 la_14 'di_17 ltar_21 'bri_26 
K12D0499_H0464:360a-12	zhal brgyad phyag stong yang na bcu //	zhal_0 brgyad_5 phyag_12 stong_18 yang_24 na_29 'chu_32 
K12D0499_H0464:360a-13	zhal bzhi dang po zhi ba ste //	zhal_0 bzhi_5 dang_10 po_15 zhi_18 ba_22 ste_25 
K12D0499_H0464:360a-14	gnyis pa dmar po chu srin no //	gnyis_0 ba_6 dmar_9 po_14 chu_17 srin_21 no_26 
K12D0499_H0464:360a-15	gsum pa khro nag yid dang khro //	gsum_0 ba_5 khro_8 nag_13 yid_17 dang_21 khro_26 
K12D0499_H0464:360a-16	bzhi pa yi dvags mgo yin no //	bzhi_0 ba_5 yi_8 dvags_11 mgo_17 yin_21 no_25 
K12D0499_H0464:360a-17	skra ni gyen brdzes zhal dang mtshungs //	skra_0 ni_5 gyen_8 brdzes_13 zhal_20 dang_25 mtshungs_30 
K12D0499_H0464:360a-18	sprul pa bya rgod khra dang spyang //	sprul_0 ba_6 byed_9 rgod_13 khra_18 dang_23 spyang_28 
K12D0499_H0464:360a-19	de yi mgo can bri bar bya; ;dgug gzhug dbang ni bskrad par bya'o //	de_0 yi_3 mgo_6 can_10 'bri_14 ba_18 bya;_22 ;dgug_27 'jug_33 dbang_39 ni_45 skrod_48 ba_55 byed_59 
K12D0499_H0464:360a-20	'di ni bsten pa'i dam tshig go /	'di_0 ni_4 sten_7 ba_13 dam_18 tshig_22 go_28 
K12D0499_H0464:360a-21	bsnyen pa'i dam tshig gnyis dag gis //	snyen_0 ba_7 dam_12 tshig_16 gnyis_22 'dag_28 gis_32 
K12D0499_H0464:360a-22	gsum rgyal dag las shes par bya //	gsum_0 rgyal_5 'dag_11 las_15 shes_19 ba_24 byed_28 
K12D0499_H0464:360a-23	aom yaksha ha sa ha sa da ra da ra h'um/	aom_0 yaksha_4 ha_11 sa_14 ha_17 sa_20 da_23 ra_26 da_29 ra_32 
K12D0499_H0464:360a-24	khra dang spyang ki khyi la sogs //	khra_0 dang_5 spyang_10 ki_17 khyi_20 la_25 sogs_28 
K12D0499_H0464:360a-25	rmi lam du 'am dngos su 'byung //	rmi_0 lam_4 du_8 'am_11 dngos_15 su_21 'byung_24 
K12D0499_H0464:360a-26	de nas mchod pa'i dam rdzas kun //	de_0 nas_3 mchod_7 ba_13 dam_18 rdzas_22 kun_28 
K12D0499_H0464:360a-27	bsgrub bya'i rdzas dang bsres byas la //	sgrub_0 byed_7 rdzas_13 dang_19 bsres_24 byed_30 la_35 
K12D0499_H0464:360a-28	gzugs brnyan byas la thod par gzhug /	gzugs_0 rnyan_6 byed_13 la_18 thod_21 ba_26 'jug_30 
K12D0499_H0464:360a-29	mar ngo gnod sbyin gzugs kyis mchod //	mar_0 ngo_4 gnod_8 sbyin_13 gzugs_19 kyis_25 mchod_30 
K12D0499_H0464:360a-30	aom yaksha m'a ra ya m'a ra ya /	aom_0 yaksha_4 m_11 ra_15 ya_18 m_21 ra_25 ya_28 
K12D0499_H0464:360a-31	aa pra ti ha ba la ba r'a kra m'a ya phat/	aa_0 pra_3 ti_7 ha_10 ba_13 la_16 ba_19 r_22 kra_26 m_30 ya_34 
K12D0499_H0464:360a-32	sarba sha tr'um sam gha bi n'a sha ka r'a	sarba_0 sha_6 tr_10 sam_16 gha_20 bi_24 n_27 sha_31 ka_35 r_38 
K12D0499_H0464:360b-0	ya @360b phat; n'i l'am ba ra dha ra badzra	ya_0 phat;_9 n_15 l_19 ba_24 ra_27 dha_30 ra_34 badzra_37 
K12D0499_H0464:360b-1	p'a ni r'a:dzny'a pa ya ti m'a ra ya tsitta	p_0 ni_4 r:dzny_7 ba_18 ya_21 ti_24 m_27 ra_31 ya_34 tsitta_37 
K12D0499_H0464:360b-2	la phat/ des kyang grub par ma gyur na //	la_0 des_9 kyang_13 'grub_19 ba_24 ma_28 gyur_31 na_36 
K12D0499_H0464:360b-3	gzugs brnyan rdul la sbyin sreg bya //	gzugs_0 rnyan_6 rdul_13 la_18 sbyin_21 sreg_27 byed_32 
K12D0499_H0464:360b-4	las skyes gzugs brnyan gong bur gzhug /	las_0 skye_4 gzugs_10 rnyan_16 gong_23 bur_28 'jug_32 
K12D0499_H0464:360b-5	des kyang grub par ma gyur na //	des_0 kyang_4 'grub_10 ba_15 ma_19 gyur_22 na_27 
K12D0499_H0464:360b-6	aom yaksha m'a ra ya m'a ra ya /	aom_0 yaksha_4 m_11 ra_15 ya_18 m_21 ra_25 ya_28 
K12D0499_H0464:360b-7	n'a sha ya n'a sha ya /	n_0 sha_4 ya_8 n_11 sha_15 ya_19 
K12D0499_H0464:360b-8	tsitta la rbad rbad /	tsitta_0 la_7 rbod_10 rbod_15 
K12D0499_H0464:360b-9	phyag gi rdo rjes bsnun par bya //	phyag_0 gi_6 rdo_9 rjes_13 snun_18 ba_24 byed_28 
K12D0499_H0464:360b-10	des kyang grub par ma gyur na //	des_0 kyang_4 'grub_10 ba_15 ma_19 gyur_22 na_27 
K12D0499_H0464:360b-11	n'i l'am ba sa n'a ya phat/	n_0 l_4 ba_9 sa_12 n_15 ya_19 
K12D0499_H0464:360b-12	stong pa nyid du bsgom par bya //	stong_0 ba_6 nyid_9 du_14 bsgom_17 ba_23 byed_27 
K12D0499_H0464:360b-13	de nas byang chub sems dpa' phyag na rdo rjes ngo mtshar nas ched du brjod pa /	de_0 nas_3 byang_7 chub_13 sems_18 dpa'_23 phyag_28 na_34 rdo_37 rjes_41 ngo_46 mtshar_50 nas_57 ched_61 du_66 rjod_69 ba_75 
K12D0499_H0464:360b-14	zung du 'brel bar gnas gyur pa //	zung_0 du_5 'brel_8 ba_14 gnas_18 gyur_23 ba_28 
K12D0499_H0464:360b-15	yam las rlung ste pam las pad; ;'chi ba zhes bya'i rnam rtog 'di //	yam_0 las_4 rlung_8 ste_14 pam_18 las_22 pad;_26 ;'chi_31 ba_37 zhes_40 byed_45 rnam_51 rtogs_56 'di_61 
K12D0499_H0464:360b-16	bde ba can du 'gro bar 'gyur //	bde_0 ba_4 can_7 du_11 'gro_14 ba_19 'gyur_23 
K12D0499_H0464:360b-17	rdo rjes 'og gi rgyud las /	rdo_0 rjes_4 'og_9 gi_13 brgyud_16 las_22 
K12D0499_H0464:360b-18	gnod sbyin sgrub pa'i le'u ste lnga pa'o ////	gnod_0 sbyin_5 sgrub_11 ba_17 le_22 ste_27 lnga_31 ba_36 
K12D0499_H0464:360b-19	de nas byang chub sems dpa' phyag na rdo rjes rdo rje 'chang la gsol ba btab pa /	de_0 nas_3 byang_7 chub_13 sems_18 dpa'_23 phyag_28 na_34 rdo_37 rjes_41 rdo_46 rje_50 'chang_54 la_61 gsol_64 ba_69 'debs_72 ba_77 
K12D0499_H0464:360b-20	snying nas slob dpon smod pa la //	snying_0 nas_7 slob_11 dpon_16 smod_21 ba_26 la_29 
K12D0499_H0464:360b-21	klu gzhug pa ni ji ltar lags //	klu_0 'jug_4 ba_10 ni_13 ji_16 ltar_19 lags_24 
K12D0499_H0464:360b-22	rdo rje can gyis bshad du gsol //	rdo_0 rje_4 can_8 gyis_12 'chad_17 du_23 gsol_26 
K12D0499_H0464:360b-23	klu'i lag na nad bcu gcig yod de /	klu_0 lag_6 na_10 nad_13 'chu_17 gcig_21 yod_26 de_30 
K12D0499_H0464:360b-24	mdze dang /	mdze_0 dang_5 
K12D0499_H0464:360b-25	mdza' to dang /	mdza'_0 to_6 dang_9 
K12D0499_H0464:360b-26	ka ta ma dang /	ka_0 ta_3 ma_6 dang_9 
K12D0499_H0464:360b-27	ka she dang /	ka_0 she_3 dang_7 
K12D0499_H0464:360b-28	'bras dang /	'bras_0 dang_6 
K12D0499_H0464:360b-29	phol dang /	'phol_0 dang_5 
K12D0499_H0464:360b-30	shu ba dang /	shu_0 ba_4 dang_7 
K12D0499_H0464:360b-31	skem pa dang /	skem_0 ba_5 dang_8 
K12D0499_H0464:360b-32	g-yan pa dang /	g-yan_0 ba_6 dang_9 
K12D0499_H0464:360b-33	dmu chu dang /	dmu_0 chu_4 dang_8 
K12D0499_H0464:360b-34	gag pa'o //	gag_0 ba_4 
K12D0499_H0464:360b-35	klu'i gnas ni /	klu_0 gnas_6 ni_11 
K12D0499_H0464:360b-36	sa 'og gi rim pa bdun no //	sa_0 'og_3 gi_7 rim_10 ba_14 bdun_17 no_22 
K12D0499_H0464:360b-37	klu bran ni /	klu_0 bran_4 ni_9 
K12D0499_H0464:360b-38	'dzam bu'i gling na yang yod do //	'dzam_0 bu_6 gling_11 na_17 yang_20 yod_25 do_29 
K12D0499_H0464:360b-39	'khor ni rnam pa bzhi dag gis //	'khor_0 ni_6 rnam_9 ba_14 bzhi_17 'dag_22 gis_26 
K12D0499_H0464:360b-40	gtsang ma'i gos dag gyon nas ni //	gtsang_0 ma_7 gos_12 'dag_16 gyon_20 nas_25 ni_29 
K12D0499_H0464:360b-41	dkar gsum dag kyang bza' bar bya /	dkar_0 gsum_5 'dag_10 kyang_14 bza'_20 ba_25 byed_29 
K12D0499_H0464:361a-0	@361a *// sngags rgyal nyis 'bum bzlas byas la //	sngags_10 rgyal_17 nyis_23 'bum_28 bzlas_33 byed_39 la_44 
K12D0499_H0464:361a-1	dkyil 'khor tsandan gur gum byug /	dkyil_0 'khor_6 tsandan_12 gur_20 'gum_24 'byug_28 
K12D0499_H0464:361a-2	padma 'dab brgyad bri bya ste //	padma_0 'dab_6 brgyad_11 'bri_18 byed_22 ste_26 
K12D0499_H0464:361a-3	bdag nyid lag na rdo rje la //	bdag_0 nyid_5 lag_10 na_14 rdo_17 rje_21 la_25 
K12D0499_H0464:361a-4	klu chen brgyad kyis bskor ba bri //	klu_0 chen_4 brgyad_9 kyis_16 skor_21 ba_27 'bri_30 
K12D0499_H0464:361a-5	de la sogs pa bshad zin to //	de_0 la_3 sogs_6 ba_11 'chad_14 zin_20 to_24 
