K12D0499_H0464:361a-6	dkyil 'khor gyi ni nub phyogs su //	dkyil_0 'khor_6 gyi_12 ni_16 nub_19 phyogs_23 su_30 
K12D0499_H0464:361a-7	klu yi gzugs gcig brtsam bya ste //	klu_0 yi_4 gzugs_7 gcig_13 brtsam_18 byed_25 ste_29 
K12D0499_H0464:361a-8	rin chen lnga 'am gla rtsi 'am //	rin_0 chen_4 lnga_9 'am_14 gla_18 rtsi_22 'am_27 
K12D0499_H0464:361a-9	mchod pa'i rdzas ni 'o ma sogs //	mchod_0 ba_6 rdzas_11 ni_17 'o_20 ma_23 sogs_26 
K12D0499_H0464:361a-10	dang po 'das pa'i mchod pa bya //	dang_0 po_5 'da'_8 ba_13 mchod_18 ba_24 byed_27 
K12D0499_H0464:361a-11	spyan drang mchod dang bstod pa ni //	spyan_0 'dren_6 mchod_12 dang_18 bstod_23 ba_29 ni_32 
K12D0499_H0464:361a-12	cho ga bzhin du bya ba 'o //	cho_0 ga_4 bzhin_7 du_13 byed_16 ba_20 'o_23 
K12D0499_H0464:361a-13	klu yi snying gar h'um bsgoms la //	klu_0 yi_4 snying_7 gar_14 h_18 sgom_23 la_30 
K12D0499_H0464:361a-14	'od zer rnam pa gsum dag gis /	'od_0 zer_4 rnam_8 ba_13 gsum_16 'dag_21 gis_25 
K12D0499_H0464:361a-15	klu chen gnas nas dgug par bya //	klu_0 chen_4 gnas_9 nas_14 'gugs_18 ba_23 byed_27 
K12D0499_H0464:361a-16	gzugs brnyan de la bstims byas la //	gzugs_0 rnyan_6 de_13 la_16 stim_19 byed_26 la_31 
K12D0499_H0464:361a-17	mchod pa dag gis mchod par bya //	mchod_0 ba_6 'dag_9 gis_13 mchod_17 ba_23 byed_27 
K12D0499_H0464:361a-18	gzugs brnyan g-yo ba 'byung ba na //	gzugs_0 rnyan_6 g-yo_13 ba_18 'byung_21 ba_28 na_31 
K12D0499_H0464:361a-19	sdang ba'i lus la gzhug bya ste //	sdang_0 ba_6 lus_11 la_15 'jug_18 byed_24 ste_28 
K12D0499_H0464:361a-20	dbang po brgyad nas gzhug bya ste //	dbang_0 po_6 brgyad_9 nas_16 'jug_20 byed_26 ste_30 
K12D0499_H0464:361a-21	brgyad cha tha ma'i dus dag tu //	brgyad_0 cha_7 tha_11 ma_15 dus_20 'dag_24 tu_28 
K12D0499_H0464:361a-22	'o ma gla rtsi kha ra yis //	'o_0 ma_3 gla_6 rtsi_10 kha_15 ra_19 yis_22 
K12D0499_H0464:361a-23	lam ni drang por drangs byas la //	lam_0 ni_4 'dren_7 por_13 drangs_17 byed_24 la_29 
K12D0499_H0464:361a-24	gong bu dgug pa'i sbyor ba yis //	gong_0 bu_5 'gugs_8 ba_13 sbyor_18 ba_24 yis_27 
K12D0499_H0464:361a-25	de la klu chen gzhug par bya //	de_0 la_3 klu_6 chen_10 'jug_15 ba_21 byed_25 
K12D0499_H0464:361a-26	sgrub pa po yis gu gul bsten //	sgrub_0 ba_6 po_9 yis_12 gu_16 gul_19 sten_23 
K12D0499_H0464:361a-27	gzugs la phur bus gdab par bya //	gzugs_0 la_6 'phur_9 'bud_14 gdab_18 ba_23 byed_27 
K12D0499_H0464:361a-28	des kyang grub par ma gyur na //	des_0 kyang_4 'grub_10 ba_15 ma_19 gyur_22 na_27 
K12D0499_H0464:361a-29	lha yi rnam pa nyid dag la //	lha_0 yi_4 rnam_7 ba_12 nyid_15 'dag_20 la_24 
K12D0499_H0464:361a-30	spogs pa dag gi cho ga bzhin //	spogs_0 ba_6 'dag_9 gi_13 cho_16 ga_20 bzhin_23 
K12D0499_H0464:361a-31	tadya th'a /	tadya_0 th_6 
K12D0499_H0464:361a-32	h'um phat/	h_0 
K12D0499_H0464:361a-33	n'a ga bi d'a ra n'a ya h'um/	n_0 ga_4 bi_7 d_10 ra_14 n_17 ya_21 
K12D0499_H0464:361a-34	n'a ga bi d'a ra n'a ya /	n_0 ga_4 bi_7 d_10 ra_14 n_17 ya_21 
K12D0499_H0464:361a-35	ha sa ha sa /	ha_0 sa_3 ha_6 sa_9 
K12D0499_H0464:361a-36	dha ra dha ra /	dha_0 ra_4 dha_7 ra_11 
K12D0499_H0464:361a-37	m'a ra ya m'a ra ya /	m_0 ra_4 ya_7 m_10 ra_14 ya_17 
K12D0499_H0464:361a-38	sarba sha trum sam gha bi n'a sha ka r'a ya phat/	sarba_0 sha_6 trum_10 sam_15 gha_19 bi_23 n_26 sha_30 ka_34 r_37 ya_41 
K12D0499_H0464:361b-0	n'i l'am ba ra dha ra @361b badzra p'a ni	n_0 l_4 ba_9 ra_12 dha_15 ra_19 badzra_28 p_35 ni_39 
K12D0499_H0464:361b-1	r'a dzny'a pa ya ti sha trum tsitta m'a ra	r_0 dzny_4 ba_11 ya_14 ti_17 sha_20 trum_24 tsitta_29 m_36 ra_40 
K12D0499_H0464:361b-2	ya phat/ aom n'a ga gha gha /	ya_0 aom_9 n_13 ga_17 gha_20 gha_24 
K12D0499_H0464:361b-3	gh'a ta ya gh'a ta ya /	gh_0 ta_5 ya_8 gh_11 ta_16 ya_19 
K12D0499_H0464:361b-4	sarba dushtan phat/	sarba_0 dushtan_6 
K12D0499_H0464:361b-5	k'i l'a ya k'i l'a ya /	k_0 l_4 ya_8 k_11 l_15 ya_19 
K12D0499_H0464:361b-6	h'um h'um h'um badzra k'i la ya /	h_0 h_5 h_10 badzra_15 k_22 la_26 ya_29 
K12D0499_H0464:361b-7	badzra damshtod a'a dzny'a pa ya ti n'a ga k'a ya b'aka tsi ta badzra k'i la ya phat/	badzra_0 damshtod_7 a_16 dzny_20 ba_27 ya_30 ti_33 n_36 ga_40 k_43 ya_47 b_50 tsi_56 ta_60 badzra_63 k_70 la_74 ya_77 
K12D0499_H0464:361b-8	n'a ga bi d'a r'a ya phat/	n_0 ga_4 bi_7 d_10 r_14 ya_18 
K12D0499_H0464:361b-9	n'a ga aut s'a da n'a ya phat/	n_0 ga_4 aut_7 s_11 da_15 n_18 ya_22 
K12D0499_H0464:361b-10	n'i l'am ba sa n'a ya phat/	n_0 l_4 ba_9 sa_12 n_15 ya_19 
K12D0499_H0464:361b-11	sngags 'di gsungs pa tsam gyis khams gsum na gnas	sngags_0 'di_7 gsungs_11 ba_18 tsam_21 gyis_26 khams_31 gsum_37 na_42 gnas_45 
K12D0499_H0464:361b-12	pa'i sems can rnams 'dar zhing brgyal bar gyur to	ba_0 sems_5 can_10 rnams_14 'dar_20 zhing_25 brgyal_31 ba_38 gyur_42 to_47 
K12D0499_H0464:361b-13	// de nas bcom ldan 'das brgyal ba sel ba	de_3 nas_6 'joms_10 ldan_15 'da'_20 brgyal_25 ba_32 sel_35 ba_39 
K12D0499_H0464:361b-14	zhes bya ba'i ting nge 'dzin la snyoms par zhugs	zhes_0 byed_5 ba_9 ting_14 nge_19 'dzin_23 la_29 snyom_32 ba_39 'jug_43 
K12D0499_H0464:361b-15	nas a'a be sha gsungs pas thams cad kyang dbugs	nas_0 a_4 be_8 sha_11 gsungs_15 ba_22 thams_26 cad_32 kyang_36 dbugs_42 
K12D0499_H0464:361b-16	dbyung zhing brgyal ba sangs nas 'dar zhing thal mo	'byin_0 zhing_7 brgyal_13 ba_20 sangs_23 nas_29 'dar_33 zhing_38 thal_44 mo_49 
K12D0499_H0464:361b-17	sbyar nas ched du brjod pa /	sbyor_0 nas_6 ched_10 du_15 rjod_18 ba_24 
K12D0499_H0464:361b-18	sangs rgyas kun gyis dbang bskur zhing //	sangs_0 rgya_6 kun_12 gyis_16 dbang_21 skur_27 zhing_33 
K12D0499_H0464:361b-19	gdug pa thams cad 'joms mdzad pa'i //	gdug_0 ba_5 thams_8 cad_14 'joms_18 mdzad_24 ba_30 
K12D0499_H0464:361b-20	sngags dang ting 'dzin nus pa yis //	sngags_0 dang_7 ting_12 'dzin_17 nus_23 ba_27 yis_30 
K12D0499_H0464:361b-21	sangs rgyas kyis kyang gzhal mi nus //	sangs_0 rgya_6 kyis_12 kyang_17 'jal_23 mi_29 nus_32 
K12D0499_H0464:361b-22	rdo rje sa 'og gi rgyud las /	rdo_0 rje_4 sa_8 'og_11 gi_15 brgyud_18 las_24 
K12D0499_H0464:361b-23	klu sgrub pa'i le'u ste drug pa'o ////	klu_0 sgrub_4 ba_10 le_15 ste_20 drug_24 ba_29 
K12D0499_H0464:361b-24	de nas gtam rgyud bshad par bya ste /	de_0 nas_3 'dam_7 brgyud_12 'chad_18 ba_24 byed_28 ste_32 
K12D0499_H0464:361b-25	bcom ldan 'das rdo rje 'chang chen pos lha gnas	'joms_0 ldan_5 'da'_10 rdo_15 rje_19 'chang_23 chen_30 pos_35 lha_39 gnas_43 
K12D0499_H0464:361b-26	rnam pa brgyad du rgyud thams cad bsdus nas ri	rnam_0 ba_5 brgyad_8 du_15 brgyud_18 thams_24 cad_30 sdud_34 nas_40 ri_44 
K12D0499_H0464:361b-27	rab kyi byang phyogs su 'jig rten gsum 'dul ba'i	rab_0 kyi_4 byang_8 phyogs_14 su_21 'jig_24 rten_29 gsum_34 'dul_39 ba_44 
K12D0499_H0464:361b-28	rgyud gsungs so // de nas zhal gsum pa phyag	brgyud_0 gsungs_6 so_13 de_19 nas_22 zhal_26 gsum_31 ba_36 phyag_39 
K12D0499_H0464:361b-29	drug pa'i sngags gsungs pas lha dang lha ma yin	drug_0 ba_5 sngags_10 gsungs_17 ba_24 lha_28 dang_32 lha_37 ma_41 yin_44 
K12D0499_H0464:361b-30	gyi rna bar song ngo //	gyi_0 rna_4 ba_8 'gro_12 ngo_17 
K12D0499_H0464:361b-31	rig sngags 'chang de rnams ngo mtshar nas bstod pa byas so //	rig_0 sngags_4 'chang_11 de_18 rnams_21 ngo_27 mtshar_31 nas_38 bstod_42 ba_48 byed_51 so_56 
K12D0499_H0464:362a-0	de nas gling gi snying por 'khor gyi snying po gnod @362a *//	de_0 nas_3 gling_7 gi_13 snying_16 por_23 'khor_27 gyi_33 snying_37 po_44 gnod_47 
K12D0499_H0464:362a-1	sbyin gyi cha 'dzin pa /	sbyin_0 gyi_6 cha_10 'dzin_14 ba_20 
K12D0499_H0464:362a-2	byang chub sems dpa' phyag na rdo rje byon nas	byang_0 chub_6 sems_11 dpa'_16 phyag_21 na_27 rdo_30 rje_34 'byon_38 nas_43 
K12D0499_H0464:362a-3	mar gyi snying po dang 'dra ba dam pa'i chos	mar_0 gyi_4 snying_8 po_15 dang_18 'dra_23 ba_28 dam_31 ba_35 chos_40 
K12D0499_H0464:362a-4	rgyud thams cad bsdus so //	brgyud_0 thams_6 cad_12 sdud_16 so_22 
K12D0499_H0464:362a-5	nyid kyi las gnyis kyi bdag nyid can rgyud sde stong phrag brgyad cu yang dag gsungs so //	nyid_0 kyi_5 las_9 gnyis_13 kyi_19 bdag_23 nyid_28 can_33 brgyud_37 sde_43 stong_47 phrag_53 brgyad_59 cu_66 yang_69 'dag_74 gsungs_78 so_85 
K12D0499_H0464:362a-6	de nas 'jig rten du gnod sbyin rnams kyis mchod	de_0 nas_3 'jig_7 rten_12 du_17 gnod_20 sbyin_25 rnams_31 kyis_37 mchod_42 
K12D0499_H0464:362a-7	de sgron ma za ba rdo rjes mgo lus phral	de_0 sgron_3 ma_9 za_12 ba_15 rdo_18 rjes_22 mgo_27 lus_31 'phral_35 
K12D0499_H0464:362a-8	te nyams par byas so; ;de nas klu 'dul bar	te_0 nyams_3 ba_9 byed_13 so;_18 ;de_22 nas_26 klu_30 'dul_34 ba_39 
K12D0499_H0464:362a-9	byed pa zhes bya ba'i ting nge 'dzin la snyoms	byed_0 ba_5 zhes_8 byed_13 ba_17 ting_22 nge_27 'dzin_31 la_37 snyom_40 
K12D0499_H0464:362a-10	par zhugs nas sa 'og rim pa bdun du byon	ba_0 'jug_4 nas_10 sa_14 'og_17 rim_21 ba_25 bdun_28 du_33 'byon_36 
K12D0499_H0464:362a-11	nas rdo rje sa 'og gi rgyud gsungs so //	nas_0 rdo_4 rje_8 sa_12 'og_15 gi_19 brgyud_22 gsungs_28 so_35 
K12D0499_H0464:362a-12	rdo rje sa 'og gi rgyud las /	rdo_0 rje_4 sa_8 'og_11 gi_15 brgyud_18 las_24 
K12D0499_H0464:362a-13	gtam rgyud kyi le'u ste bdun pa'o ////	'dam_0 brgyud_5 kyi_11 le_15 ste_20 bdun_24 ba_29 
K12D0499_H0464:362a-14	rdo rje sa 'og gi rgyud rdzogs so ////	rdo_0 rje_4 sa_8 'og_11 gi_15 brgyud_18 rdzogs_24 so_31 
K12D0499_H0464:362a-15	rgya gar gyi mkhan po d'i pam ka ra dang /	rgya_0 gar_5 gyi_9 mkhan_13 po_19 d_22 pam_26 ka_30 ra_33 dang_36 
K12D0499_H0464:362a-16	sgra sgyur gyi lo ts'a ba dge slong bya'i gdong pa can gyis bsgyur ba'o //	sgra_0 sgyur_5 gyi_11 lo_15 ts_18 ba_23 dge_26 slong_30 byed_36 gdong_42 ba_48 can_51 gyis_55 sgyur_60 ba_67 
