T01D1178:255b-0	@255b # // rgya gar skad du /	rgya_11 gar_16 skad_20 du_25 
T01D1178:255b-1	dz'a ta ka sta ba /	dz_0 ta_5 ka_8 sta_11 ba_15 
T01D1178:255b-2	kshe da nd'a sha ba lam gu nee ra sha wa lam tsa ry'a bi bhu tvam bi bho //	kshe_0 da_5 nd_8 sha_13 ba_17 lam_20 gu_24 nee_27 ra_31 sha_34 wa_38 lam_41 tsa_45 ry_49 bi_54 bhu_57 tvam_61 bi_66 bho_69 
T01D1178:255b-3	dzanma sya nda ni k'a bi ba rtta na dza da nytsee ta kva tse da mma ma /	dzanma_0 sya_7 nda_11 ni_15 k_18 bi_22 ba_25 rtta_28 na_33 dza_36 da_40 nytsee_43 ta_50 kva_53 tse_57 da_61 mma_64 ma_68 
T01D1178:255b-4	ye n'a bandhya pha lo da ya sta yi bha ba ntya byu hi t'a:y'am sha ba /	ye_0 n_3 bandhya_7 pha_15 lo_19 da_22 ya_25 sta_28 yi_32 bha_35 ba_39 ntya_42 byu_47 hi_51 t:y_54 sha_63 ba_67 
T01D1178:255b-5	ste na stu hya nu ba ndhi n'a mu kha ra n'a m'a la mba te bh'a ra t'i /	ste_0 na_4 stu_7 hya_11 nu_15 ba_18 ndhi_21 n_26 mu_30 kha_33 ra_37 n_40 m_44 la_48 mba_51 te_55 bh_58 ra_63 t_66 
T01D1178:255b-6	tsi tt'a la mbha na la ngg'i na:sha ma dri sh'a m'a * //	tsi_0 tt_4 la_9 mbha_12 na_17 la_20 ngg_23 na:sha_29 ma_36 'dri_39 sh_43 m_48 
T01D1178:255b-7	bod skad du /	'bod_0 skad_4 du_9 
T01D1178:255b-8	skyes pa rabs kyi bstod pa /	skye_0 ba_6 rabs_9 kyi_14 bstod_18 ba_24 
T01D1178:255b-9	khyab bdag stobs bcu mnga' ba'i ma 'dres spyod pa dbang 'byor ba'i //	khyab_0 bdag_6 stobs_11 'chu_17 mnga'_21 ba_27 ma_32 'dre_35 spyod_41 ba_47 dbang_50 'byor_56 ba_62 
T01D1178:255b-10	skye ba'i rgyud du rnam par 'jug 'di blun yang bdag gi nam yang ni /	skye_0 ba_5 brgyud_10 du_16 rnam_19 ba_24 'jug_28 'di_33 blun_37 yang_42 bdag_47 gi_52 nam_55 yang_59 ni_64 
T01D1178:255b-11	don yod 'bras bu 'byung phyir khyed lu rdul tsam /	don_0 yod_4 'bras_8 bu_14 'byung_17 phyir_24 'khyed_30 lu_36 rdul_39 tsam_44 
T01D1178:255b-12	des na bstod dang rjes su 'brel ba'i ca co tshig dang ming dag dmigs //	des_0 na_4 bstod_7 dang_13 rjes_18 su_23 'brel_26 ba_32 ca_37 co_40 tshig_43 dang_49 ming_54 'dag_59 dmigs_63 
T01D1178:255b-13	sems kyi dmigs las 'gongs zhi ba'i lta ba be ni k'a:sa ngku n'a /	sems_0 kyi_5 dmigs_9 las_15 'gongs_19 zhi_26 ba_30 lta_35 ba_39 be_42 ni_45 k:sa_48 ngku_55 n_60 
T01D1178:255b-14	b'a ts'am go tsa ra t'am tu y'a nni ka la y'a sbu l'a hi bo m'a dri sh'am /	b_0 ts_4 go_10 tsa_13 ra_17 t_20 tu_25 y_28 nni_32 ka_36 la_39 y_42 sbu_46 l_50 hi_54 'bo_57 m_60 'dri_64 sh_68 
T01D1178:255b-15	ratna n+ya mbu ni dhe ru p'a bhu pu li	ratna_0 n_6 ya_8 mbu_11 ni_15 dhe_18 ru_22 p_25 bhu_29 pu_33 li_36 
T01D1178:255b-16	ne shv'a si rbha pa ntya rthi n'a ma nta	ne_0 shv_3 si_9 rbha_12 ba_17 ntya_20 rthi_25 n_30 ma_34 nta_37 
T01D1178:255b-17	rbhi nna ta ram ga dyoo ta ru ba ka	rbhi_0 nna_5 ta_9 ram_12 ga_16 dyoo_19 ta_24 ru_27 ba_30 ka_33 
T01D1178:255b-18	dzyo t+sn'a ni gri hn'a ti ka:y'a bo bo dhi	dzyo_0 t_5 sn_7 ni_12 gri_15 hn_19 ti_24 ka:y_27 'bo_34 'bo_37 dhi_40 
T01D1178:255b-19	pa th'a nu y'a na ma h'a t'a mu t+s'a	ba_0 th_3 nu_8 y_11 na_15 ma_18 h_21 t_25 mu_29 t_32 s_34 
T01D1178:255b-20	hi n'i ka rmma n'a mpa m'i lle ka hi	hi_0 n_3 ka_7 rmma_10 n_15 mpa_19 m_23 lle_27 ka_31 hi_34 
T01D1178:255b-21	to da ye dzi n'a kri y'a bi pya ndi	to_0 da_3 ye_6 dzi_9 n_13 kri_17 y_21 bi_25 pya_28 ndi_32 
T01D1178:255b-22	n'i sa nta ti:see n'i k'a pa tsi ta:pu na	n_0 sa_4 nta_7 ti:see_11 n_18 k_22 ba_26 tsi_29 ta:pu_33 na_39 
T01D1178:255b-23	ti bha ga b'an sam k'i rtya ma 'dres yon	ti_0 bha_3 ga_7 b_10 sam_15 k_19 rtya_23 ma_28 'dre_31 yon_37 
T01D1178:255b-24	tan mchog / tshig gi spyod yul nyid gyur cha	tan_0 mchog_4 tshig_12 gi_18 spyod_21 yul_27 nyid_31 gyur_36 cha_41 
T01D1178:255b-25	shas che long 'di 'dra ba /	shas_0 che_5 long_9 'di_14 'dra_18 ba_23 
T01D1178:255b-26	chu gter sa yi sgang bur rin chen gsal gyur don med rnams kyis ni //	chu_0 gter_4 sa_9 yi_12 sgang_15 bur_21 rin_25 chen_29 gsal_34 gyur_39 don_44 med_48 rnams_52 kyis_58 ni_63 
T01D1178:255b-27	ba dad nang nas zab cing gsal la 'od ldan len par byed pa bzhin //	ba_0 dad_3 nang_7 nas_12 zab_16 cing_20 gsal_25 la_30 'od_33 ldan_37 len_42 ba_46 byed_50 ba_55 bzhin_58 
T01D1178:255b-28	gang byang chub lam rjes su theg pa chen po	gang_0 byang_5 chub_11 lam_16 rjes_20 su_25 theg_28 ba_33 chen_36 po_41 
T01D1178:255b-29	spro ba las kyi bdag la phan pa 'byung rgyal	spro_0 ba_5 las_8 kyi_12 bdag_16 la_21 phan_24 ba_29 'byung_32 rgyal_39 
T01D1178:255b-30	ba brtse ba rgyud sde tshan dag byed bcom ldan	ba_0 brtse_3 ba_9 brgyud_12 sde_18 tshan_22 'dag_28 byed_32 'joms_37 ldan_42 
T01D1178:256a-0	yang dag grags @256a * //	yang_0 'dag_5 grags_9 
T01D1178:256a-1	m'a n'a dra dhu n'a dzhe y'a bho ga bi	m_0 n_4 'dra_8 dhu_12 n_16 dzhe_20 y_25 bho_29 ga_33 bi_36 
T01D1178:256a-2	snga ri ni ga ta m'a l'a:pr'a ge ba bo	snga_0 ri_5 ni_8 ga_11 ta_14 m_17 l:pr_21 ge_30 ba_33 'bo_36 
T01D1178:256a-3	dho gu na:/ au dd'a ma dvi ra da sya	dho_0 gu_4 au_12 dd_15 ma_20 dvi_23 ra_27 da_30 sya_33 
T01D1178:256a-4	r'a ga bar shi no bri ttim pu ro nm'a	r_0 ga_4 ba_7 'chi_11 no_15 'bri_18 ttim_22 pu_27 ro_30 nm_33 
T01D1178:256a-5	dho gu na:/ di n'i / m'a lo ky'a bya	dho_0 gu_4 di_12 n_15 m_21 lo_25 ky_28 byed_33 
T01D1178:256a-6	ti ba rti n'a pra ni hi h'a bo dho	ti_0 ba_3 rti_6 n_10 pra_14 ni_18 hi_21 h_24 'bo_28 dho_31 
T01D1178:256a-7	rhi yo ya ntra y'a /	rhi_0 yo_4 ya_7 ntra_10 y_15 
T01D1178:256a-8	bi n+ya nta ai b'a ma r'a s+t'a yi tsi	bi_0 n_3 ya_5 nta_8 ai_12 b_15 ma_19 r_22 s_26 t_28 yi_32 tsi_35 
T01D1178:256a-9	ram dha rm'a bhi she ka shri ya nte n'am	ram_0 dha_4 rm_8 bhi_13 she_17 ka_21 shri_24 ya_29 nte_32 n_36 
T01D1178:256a-10	ka mpi ta ke sha r'a nta ma sri dza	ka_0 mpi_3 ta_7 ke_10 sha_13 r_17 nta_21 ma_25 sri_28 dza_32 
T01D1178:256a-11	na pu shpo pa h'a ram di ba:/	na_0 pu_3 shpo_6 ba_11 h_14 ram_18 di_22 
T01D1178:256a-12	kshu ddu:kha gla pi to da r'i gi ri da	kshu_0 ddu:kha_5 gla_13 pi_17 to_20 da_23 r_26 gi_30 ri_33 da_36 
T01D1178:256a-13	r'i r'a ntra nha da na shes bya'i longs spyod	r_0 r_4 ntra_8 nha_13 da_17 na_20 shes_23 byed_28 longs_34 spyod_40 
T01D1178:256a-14	bri bral lta ci smos byang chub yon tan glang	'bri_0 'bral_4 lta_9 ci_13 smos_16 byang_21 chub_27 yon_32 tan_36 glang_40 
T01D1178:256a-15	po myos pa chags pa'i dbang gyur gnas kyi myos	po_0 myos_3 ba_8 chags_11 ba_17 dbang_22 gyur_28 gnas_33 kyi_38 myos_42 
T01D1178:256a-16	ma la // bzlog par ma nus zhugs pa gcig nas khyod kyi byang chub la /	ma_0 la_3 bzlog_9 ba_15 ma_19 nus_22 'jug_26 ba_32 gcig_35 nas_40 khyod_44 kyi_50 byang_54 chub_60 la_65 
T01D1178:256a-17	lha rnams ring nas khyod la chos kyi dbang bskur dpal bzhin thugs dag bkod /	lha_0 rnams_4 ring_10 nas_15 khyod_19 la_25 chos_28 kyi_33 dbang_37 skur_43 dpal_49 bzhin_54 thugs_60 'dag_66 bkod_70 
T01D1178:256a-18	de yis mgul ral pa tha ma spro me tog nye bar za ba /	de_0 yis_3 mgul_7 ral_12 ba_16 tha_19 ma_23 spro_26 me_31 tog_34 nye_38 ba_42 za_46 ba_49 
T01D1178:256a-19	bkres pa'i sdug bsngal nad kyis ri sul bar du ra la sthi t'am /	bkres_0 ba_6 sdug_11 sngal_16 nad_23 kyis_27 ri_32 sul_35 ba_39 du_43 ra_46 la_49 sthi_52 t_57 
T01D1178:256a-20	dri shtv'a sh'a ba ka gh'a ta nee ka ra bha s'am by'a ghr'im da y'a ghr'a ta dh'i:/	'dri_0 shtv_4 sh_11 ba_16 ka_19 gh_22 ta_27 nee_30 ka_34 ra_37 bha_40 s_44 by_49 ghr_54 da_61 y_64 ghr_68 ta_74 
T01D1178:256a-21	ya stvam ba lka li n'im dza ti dza na	ya_0 stvam_3 ba_9 lka_12 li_16 n_19 dza_24 ti_28 dza_31 na_35 
T01D1178:256a-22	ba t'am mu rtim ma mu tnri shta b'a na	ba_0 t_3 mu_8 rtim_11 ma_16 mu_19 tnri_22 shta_27 b_32 na_36 
T01D1178:256a-23	str'a na nte na bha b'a na bha b'a dri	str_0 na_6 nte_9 na_13 bha_16 b_20 na_24 bha_27 b_31 'dri_35 
T01D1178:256a-24	bi ba ra by'a ba rti n'am de hi n'am	bi_0 ba_3 ra_6 by_9 ba_14 rti_17 n_21 de_26 hi_29 n_32 
T01D1178:256a-25	/ y'a tpra le ya si to pa l'a dri	y_2 tpra_6 le_11 ya_14 si_17 to_20 ba_23 l_26 'dri_30 
T01D1178:256a-26	ba ha lam m'a tam ga t'am bi bha t'a	ba_0 ha_3 lam_6 m_10 tam_14 ga_18 t_21 bi_26 bha_29 t_33 
T01D1178:256a-27	k'a nta r'am na ra ba rti n'am ta nu	k_0 nta_4 r_8 na_13 ra_16 ba_19 rti_22 n_26 ta_31 nu_34 
T01D1178:256a-28	bhri t'a mu tstshi tta ye by'a pa d'a ma	bhri_0 t_5 mu_9 tstshi_12 tta_19 ye_23 by_26 ba_31 d_34 ma_38 
T01D1178:256a-29	/ / shee le ndram shi thi lo pa lam	shee_4 le_9 ndram_12 'chi_18 thi_22 lo_26 ba_29 lam_32 
T01D1178:256a-30	tsa la ya t'a nu kta stva gnas gyur pa'o	tsa_0 la_4 ya_7 t_10 nu_14 kta_17 stva_21 gnas_26 gyur_31 ba_36 
T01D1178:256a-31	/ / // stag mo phru gu ma yong nas	stag_7 mo_12 'phru_15 gu_20 ma_23 yong_26 nas_31 
T01D1178:256a-32	za bar rtsom gzigs gcig tu brtse bas bskyab pa'i	za_0 ba_3 rtsom_7 gzigs_13 gcig_19 tu_24 brtse_27 ba_33 bskyab_37 ba_44 
T01D1178:256a-33	/ / // blos // gang khyod shing shun gyis	blos_7 gang_15 khyod_20 shing_26 shun_32 gyis_37 
T01D1178:256a-34	ni ral ba bcings te btags nas sku dag por	ni_0 ral_3 ba_7 'ching_10 te_17 'dogs_20 nas_26 sku_30 'dag_34 por_38 
T01D1178:256a-35	des na skyob pa khyod srid pa'i ri bo'i khung	des_0 na_4 skyob_7 ba_13 khyod_16 srid_22 ba_27 ri_32 'bo_35 khung_40 
T01D1178:256a-36	bur 'khor ba'i lus can rnams la /	bur_0 'khor_4 ba_10 lus_15 can_19 rnams_23 la_29 
T01D1178:256a-37	dkar rdob ri glang po nyid bzung dgon par mi	dkar_0 rdob_5 ri_10 glang_13 po_19 nyid_22 bzung_27 dgon_33 ba_38 mi_42 
T01D1178:256a-38	'khyam pa lus bzung chang 'phogs pa rnams la ri	'khyam_0 ba_7 lus_10 bzung_14 chang_20 'phogs_26 ba_33 rnams_36 la_42 ri_45 
T01D1178:256a-39	dbang yangs pa rdob g-yo ba bor khyod kyis bdag	dbang_0 yangs_6 ba_12 rdob_15 g-yo_20 ba_25 'bor_28 khyod_32 kyis_38 bdag_43 
T01D1178:256a-40	y'a tm'a ta t'a ta /	y_0 tm_4 ta_9 t_12 ta_16 
T01D1178:256a-41	ma n+ye ma t+sa ri n'am ni t'a nta ma li n'a ste na ksha t'a bri tta ya:/	ma_0 n_3 ye_5 ma_8 t_11 sa_13 ri_16 n_19 ni_24 t_27 nta_31 ma_35 li_38 n_41 ste_45 na_49 ksha_52 t_57 'bri_61 tta_65 
T01D1178:256a-42	ya llo k'a mba ra tsa ndra tsa ndra ba pu sh'a tsa ndra pra bha tve tva y'a /	ya_0 llo_3 k_7 mba_11 ra_15 tsa_18 ndra_22 tsa_27 ndra_31 ba_36 pu_39 sh_42 tsa_47 ndra_51 pra_56 bha_60 tve_64 tva_68 y_72 
T01D1178:256a-43	ga lm'a sh'a nta shi kham shi kh'a ma ni ru ts'a da ttam dvi dz'a y'a rtha ne /	ga_0 lm_3 sh_8 nta_13 'chi_17 kham_21 'chi_26 kh_30 ma_35 ni_38 ru_41 ts_44 da_49 ttam_52 dvi_57 dz_61 y_66 rtha_70 ne_75 
T01D1178:256a-44	n'a l'a ll'u na mi b'a ra bi nda ma si n'a pyo tkri tta m'u lam shi ra /	n_0 l_4 ll_8 na_13 mi_16 b_19 ra_23 bi_26 nda_29 ma_33 si_36 n_39 pyo_43 tkri_47 tta_52 m_56 lam_60 'chi_64 ra_68 
T01D1178:256a-45	ste nee sh'a nydza ga t'am ga to si gu ru t'a mu shn'i sha ba nm'u rdha ni /	ste_0 nee_4 sh_8 nydza_13 ga_19 t_22 ga_27 to_30 si_33 gu_36 ru_39 t_42 mu_46 shn_49 sha_55 ba_59 nm_62 rdha_67 ni_72 
T01D1178:256a-46	b'a l'a nb'a la sa ro dza ko ma la	b_0 l_4 nb_8 la_13 sa_16 ro_19 dza_22 ko_26 ma_29 la_32 
T01D1178:256a-47	ta n'u na t+su 'gram du sems ser sna dri	ta_0 n_3 na_7 t_10 su_12 'grams_15 du_21 sems_24 ser_29 sna_33 'dri_37 
T01D1178:256a-48	ma can des nyams spyod pa rnams /	ma_0 can_3 des_7 nyams_11 spyod_17 ba_23 rnams_26 
T01D1178:256a-49	gang 'jig rten nam mkhar zla ba zla ba'i lus	gang_0 'jig_5 rten_10 nam_15 mkhar_19 zla_25 ba_29 zla_32 ba_36 lus_41 
T01D1178:256a-50	zla 'od nyid tshe khyod kyis skyon mthar byed gtsugs	zla_0 'od_4 nyid_8 tshe_13 khyod_18 kyis_24 skyon_29 mthar_35 byed_41 gtsugs_46 
T01D1178:256a-51	phud gtsug gi nor bu 'od ldan byin gnyis skyes	'bud_0 gtsug_5 gi_11 nor_14 bu_18 'od_21 ldan_25 byin_30 gnyis_35 skye_41 
T01D1178:256a-52	slong ba la / sdong bu bcad bzhan pad+ma ral gris bcad rtsa ba dgu /	slong_0 ba_6 la_9 sdong_14 bu_20 gcod_23 bzhan_28 pad_34 ma_38 ral_41 gris_45 gcod_50 rtsa_55 ba_60 dgu_63 
T01D1178:256a-53	des na 'di dag 'gro rnams la bla ma rnams kyi gtsug tor bzhin du mgo la'o //	des_0 na_4 'di_7 'dag_11 'gro_15 rnams_20 la_26 bla_29 ma_33 rnams_36 kyi_42 gtsug_46 tor_52 bzhin_56 du_62 mgo_65 la_69 
T01D1178:256b-0	byis pa byis pa mtsho skyes 'jam pa @256b tra k'a n'a rtha na /	byis_0 ba_5 byis_8 ba_13 mtsho_16 skye_22 'jam_28 ba_33 tra_42 k_46 n_50 rtha_54 na_59 
T01D1178:256b-1	pa r+y'a sh'a hna tsa la tstshi kha nda ka	ba_0 r_3 y_5 sh_9 hna_14 tsa_18 la_22 tstshi_25 kha_32 nda_36 ka_40 
T01D1178:256b-2	bhri to d'a r'am shtsa bh'a b'a nu g'a na	bhri_0 to_5 d_8 r_12 shtsa_17 bh_23 b_28 nu_32 g_35 na_39 
T01D1178:256b-3	/ pr'a d'am styam dzi na te na n'u na	pr_2 d_7 styam_12 dzi_18 na_22 te_25 na_28 n_31 na_35 
T01D1178:256b-4	ma bha ba nm'a ra ng+ga n'a n'am mu kham	ma_0 bha_3 ba_7 nm_10 ra_15 ng_18 ga_21 n_24 n_28 mu_33 kham_36 
T01D1178:256b-5	sa ng+go b'a nytsi ta pa kshma lo tsa na	sa_0 ng_3 go_6 b_9 nytsi_13 ta_19 ba_22 kshma_25 lo_31 tsa_34 na_38 
T01D1178:256b-6	da lam ya dzny'a la s'a ma ntha ram /	da_0 lam_3 ya_7 dzny_10 la_17 s_20 ma_24 ntha_27 ram_32 
T01D1178:256b-7	sha yya sva pna b'i ts'a ri n'a ba na bhu b'a bh'u tr'a pu r'a pa kshi n'a /	sha_0 yya_4 sva_8 pna_12 b_16 ts_20 ri_25 n_28 ba_32 na_35 bhu_38 b_42 bh_46 tr_51 pu_56 r_59 ba_63 kshi_66 n_71 
T01D1178:256b-8	bhi nn'a she sha ka le dze ga tya bi ka le dzy'a ya:pa th'a sham si n'a /	bhi_0 nn_4 she_9 sha_13 ka_17 le_20 dze_23 ga_27 tya_30 bi_34 ka_37 le_40 dzy_43 ya:pa_49 th_55 sham_60 si_65 n_68 
T01D1178:256b-9	bi st'a ram ga mi tam pra ta bhri t'am ya nn'a tha k'a lus bu don gnyer la /	bi_0 st_3 ram_8 ga_12 mi_15 tam_18 pra_22 ta_26 bhri_29 t_34 ya_39 nn_42 tha_47 k_51 lus_55 bu_59 don_62 gnyer_66 la_72 
T01D1178:256b-10	gtsug phud /	gtsug_0 'bud_6 
T01D1178:256b-11	bzung chung ma yang dang po dang rjes mthun /	bzung_0 chung_6 ma_12 yang_15 dang_20 po_25 dang_28 rjes_33 mthun_38 
T01D1178:256b-12	rgyal ba de yis bdud kyi bu ma rnams kyis	rgyal_0 ba_6 de_9 yis_12 bdud_16 kyi_21 bu_25 ma_28 rnams_31 kyis_37 
T01D1178:256b-13	rdzi ma mig 'dab ma gang dva ba snyan tshig	rdzi_0 ma_5 mig_8 'dab_12 ma_17 gang_20 dva_25 ba_29 snyan_32 tshig_38 
T01D1178:256b-14	'dar mal gnyid rnam dpyod nags sa gyur nas grong	'dar_0 mal_5 rnyid_9 rnam_15 dpyod_20 nags_26 sa_31 gyur_34 nas_39 grong_43 
T01D1178:256b-15	bya yis tha dad ma lus 'gro la ma tshang	byed_0 yis_4 tha_8 dad_12 ma_16 lus_19 'gro_23 la_28 ma_31 tshang_34 
T01D1178:256b-16	med rga po'i lam bsngags /	med_0 rga_4 po_8 lam_13 bsngags_17 
T01D1178:256b-17	rgya chen 'grod pa brtul zhugs bzung gang bi nydza lam /	rgya_0 chen_5 'grod_10 ba_16 brtul_19 'jug_25 bzung_31 gang_37 bi_42 nydza_45 lam_51 
T01D1178:256b-18	te n'a dzny'a ma ru t'am gi r'i ta ki	te_0 n_3 dzny_7 ma_14 ru_17 t_20 gi_25 r_28 ta_32 ki_35 
T01D1178:256b-19	ra na tstsh'a yam y'a spa dam po ga t'a	ra_0 na_3 tstsh_6 yam_14 y_18 spa_22 dam_26 po_30 ga_33 t_36 
T01D1178:256b-20	/ ya tpa rnnam mbu pha l'a shi n'i sha	ya_2 tpa_5 rnnam_9 mbu_15 pha_19 l_23 'chi_27 n_31 sha_35 
T01D1178:256b-21	sha ta num tvam n'a tha bi bhra tpu r'a	sha_0 ta_4 num_7 tvam_11 n_16 tha_20 bi_24 bhra_27 tpu_32 r_36 
T01D1178:256b-22	/ / ta tk'a l'a ti tha yi kri p'a	ta_4 tk_7 l_12 ti_16 tha_19 yi_23 kri_26 p_30 
T01D1178:256b-23	ri tsa ya'a d'a ti shya m'a ba da na	ri_0 tsa_3 ya_7 d_12 ti_16 shya_19 m_24 ba_28 da_31 na_34 
T01D1178:256b-24	/ / ya na / a'a:r'u dha: sphu ta bi	ya_4 na_7 a:r_12 dha:_20 sphu_25 ta_30 bi_33 
T01D1178:256b-25	sphu li ng+ga ma na la nte n'a dhu na	sphu_0 li_5 ng_8 ga_11 ma_14 na_17 la_20 nte_23 n_27 dhu_31 na_35 
T01D1178:256b-26	/ / ya na / pi kshi t'a / bi	ya_4 na_7 pi_12 kshi_15 t_20 bi_26 
T01D1178:256b-27	nda ma ndal l'a nytsa nam sha sha ma yam	nda_0 ma_4 ndal_7 l_12 nytsa_16 nam_22 sha_26 sha_30 ma_34 yam_37 
T01D1178:256b-28	yu shma rya sho la kshya te /	yu_0 shma_3 rya_8 sho_12 la_16 kshya_19 te_25 
T01D1178:256b-29	ya tko p'a ru na dri shti n'a ka la mgon /	ya_0 tko_3 p_7 ru_11 na_14 'dri_17 shti_21 n_26 ka_30 la_33 mgon_36 
T01D1178:256b-30	de yis shes cod pan 'od mdzes go 'phang /	de_0 yis_3 shes_7 cod_12 pan_16 'od_20 mdzes_24 go_30 'phen_33 
T01D1178:256b-31	gang zhig lo ma chu dang 'bras bu za ba'i ri bong lus ni mgon khyod bzung ba na /	gang_0 'jig_5 lo_10 ma_13 chu_16 dang_20 'bras_25 bu_31 za_34 ba_37 ri_42 bong_45 lus_50 ni_54 mgon_57 khyod_62 bzung_68 ba_74 na_77 
T01D1178:256b-32	de dus 'gron la brtse bas yongs su 'gris pas	de_0 dus_3 'gron_7 la_13 brtse_16 ba_22 yongs_26 su_32 'gris_35 ba_41 
T01D1178:256b-33	sbyin byar rig nas zhugs 'phro me stag me la	sbyin_0 byar_6 rig_11 nas_15 'jug_19 'phro_25 me_31 stag_34 me_39 la_42 
T01D1178:256b-34	de nas / ltos pa med /	de_0 nas_3 ltos_9 ba_14 med_17 
T01D1178:256b-35	thig le'i dkyil 'khor mtshan ma ri bong rang bzhin khyod kyis grags pa mtshon par byed //	thig_0 le_5 dkyil_10 'khor_16 mtshan_22 ma_29 ri_32 bong_35 rang_40 bzhin_45 khyod_51 kyis_57 grags_62 ba_68 mtshon_71 ba_78 byed_82 
T01D1178:256b-36	gang 'khros skya rangs bhu b'a kri tv'a bh'u bo	gang_0 'khros_5 skya_12 rangs_17 bhu_23 b_27 kri_31 tv_35 bh_40 'bo_45 
T01D1178:256b-37	p+ha ng+ga n'i mu lla si t'a si n'a bi	p_0 ha_2 ng_5 ga_8 n_11 mu_15 lla_18 si_22 t_25 si_29 n_32 bi_36 
T01D1178:256b-38	da li ta pra ng+ga m'a sa ng+gi n'a /	da_0 li_3 ta_6 pra_9 ng_13 ga_16 m_19 sa_23 ng_26 gi_29 n_32 
T01D1178:256b-39	tv'a m'a s'i ta ksha na ma pya bi ksha	tv_0 m_5 s_9 ta_13 ksha_16 na_21 ma_24 pya_27 bi_31 ksha_34 
T01D1178:256b-40	ta dhi yam tya ktu ksha m'a na ksha m'a	ta_0 dhi_3 yam_7 tya_11 ktu_15 ksha_19 m_24 na_28 ksha_31 m_36 
T01D1178:256b-41	n+ye te na ni ra ngku sh'a:sma ra sha r'a:pu	n_0 ye_2 te_5 na_8 ni_11 ra_14 ngku_17 sh:sma_22 ra_31 sha_34 r:pu_38 
T01D1178:256b-42	ngkhe shu bha ng+ga ng+ga t'a /	ngkhe_0 shu_6 bha_10 ng_14 ga_17 ng_20 ga_23 t_26 
T01D1178:256b-43	ya ddve sh'i ha ri n'a tsi r'a ta na	ya_0 ddve_3 sh_8 ha_13 ri_16 n_19 tsi_23 r_27 ta_31 na_34 
T01D1178:256b-44	dha nu rda nte stva y'a nya bhya rtsi ta:sha	dha_0 nu_4 rda_7 nte_11 stva_15 y_20 nya_24 bhya_28 rtsi_33 ta:sha_38 
T01D1178:256b-45	tda nte na sa t'a si to nna ta bri	tda_0 nte_4 na_8 sa_11 t_14 si_18 to_21 nna_24 ta_28 'bri_31 
T01D1178:256b-46	ha dzdz'i m'u ta pu nydza tvi sh'a /	ha_0 dzdz_3 m_10 ta_14 pu_17 nydza_20 tvi_26 sh_30 
T01D1178:256b-47	ko sh'a ka rsha na b'a nta bh'u ri ru	ko_0 sh_3 ka_8 rsha_11 na_16 b_19 nta_23 bh_27 ri_32 ru_35 
T01D1178:256b-48	dhi ra mthong byas nas smin ma g-yo ri mo	dhi_0 ra_4 mthong_7 byed_14 nas_19 smin_23 ma_28 g-yo_31 ri_36 mo_39 
T01D1178:256b-49	ral gris rnam par bcom /	ral_0 gris_4 rnam_9 ba_14 'joms_18 
T01D1178:256b-50	nying lag sha khyod la skad cig kyang /	nying_0 lag_6 sha_10 khyod_14 la_20 skad_23 cig_28 kyang_32 
T01D1178:256b-51	blo btang bzod dang mi bzod sems pa des na lcags kyu med dran pa'i mda' bcom par gyur /	blo_0 gtong_4 bzod_10 dang_15 mi_20 bzod_23 sems_28 ba_33 des_36 na_40 lcags_43 kyu_49 med_53 dran_57 ba_62 mda'_67 'joms_72 ba_77 gyur_81 
T01D1178:256b-52	gang sdang 'phrog pas ring nas gzhu so khyod kyis	gang_0 sdang_5 'phrog_11 ba_18 ring_22 nas_27 gzhu_31 so_36 khyod_39 kyis_45 
T01D1178:256b-53	mngon par mchod so drug pa yis dkar zhing mtho	mngon_0 ba_6 mchod_10 so_16 drug_19 ba_24 yis_27 dkar_31 zhing_36 mtho_42 
T01D1178:256b-54	ba lha yi char sprin phung po 'od 'bar ba	ba_0 lha_3 yi_7 char_10 sprin_15 'phung_21 po_27 'od_30 'bar_34 ba_39 
T01D1178:257a-0	// sbubs nas bkug pas @257a * //	sbub_3 nas_9 'gugs_13 ba_18 
T01D1178:257a-1	k'o d'a ru ne ste na pa:/	k_0 d_4 ru_8 ne_11 ste_14 na_18 
T01D1178:257a-2	p'a t'a le pi bhu dzam ga me: shla tha pa nee ra dy'a pi dam sht'a rtsya ta /	p_0 t_4 le_8 pi_11 bhu_14 dzam_18 ga_23 me:_26 shla_30 tha_35 ba_39 nee_42 ra_46 dy_49 pi_54 dam_57 sht_61 rtsya_67 ta_73 
T01D1178:257a-3	sam ra mbha tpa ni n'am pa n'a ha ti	sam_0 ra_4 mbha_7 tpa_12 ni_16 n_19 ba_24 n_27 ha_31 ti_34 
T01D1178:257a-4	tsa l'a ddh'i mo rmi m'a l'a da p'a mpa	tsa_0 l_4 ddh_8 mo_14 rmi_17 m_21 l_25 da_29 p_32 mpa_36 
T01D1178:257a-5	ty'u r+ya tma ka tstsha t'a bi lu li t'a	ty_0 r_5 ya_7 tma_10 ka_14 tstsha_17 t_24 bi_28 lu_31 li_34 t_37 
T01D1178:257a-6	tpa rya sta noo k'a na r'a:/	tpa_0 rya_4 sta_8 noo_12 k_16 na_20 
T01D1178:257a-7	pre mn'a k'a ya ma h'a pma be na bha	pre_0 mn_4 k_9 ya_13 ma_16 h_19 pma_23 be_27 na_30 bha_33 
T01D1178:257a-8	ba t'a t'i r'a nna m'a p'a di t'a ta	ba_0 t_3 t_7 r_11 nna_15 m_19 p_23 di_27 t_30 ta_34 
T01D1178:257a-9	tka rm'a ti sha ye na te na ni khi	tka_0 rm_4 ti_9 sha_12 ye_16 na_19 te_22 na_25 ni_28 khi_31 
T01D1178:257a-10	l'a lo k'a:ka la tr'i kri t'a /	l_0 lo_4 k:ka_7 la_14 tr_17 kri_22 t_26 
T01D1178:257a-11	shee shugs pa mang po khrag mi bzad //	shee_0 shugs_5 ba_11 mang_14 po_19 khrag_22 mi_28 bzad_31 
T01D1178:257a-12	sa 'og tu yang lag 'gro rnams kyis lhod pa'i gdengs kas dpung yang 'tsho ba mchod par byed /	sa_0 'og_3 tu_7 yang_10 lag_15 'gro_19 rnams_24 kyis_30 lhod_35 ba_40 gdeng_45 kas_52 dpung_56 yang_62 'tsho_67 ba_73 mchod_76 ba_82 byed_86 
T01D1178:257a-13	yang dag brtsams pa gdengs ka:g-yo ba 'jigs su rung rlabs phreng chu bdag chu srin /	yang_0 'dag_5 brtsams_9 ba_17 gdeng_20 ka:g-yo_27 ba_35 'jigs_38 su_44 rung_47 rlabs_52 phreng_58 chu_65 bdag_69 chu_74 srin_78 
T01D1178:257a-14	lus rgyal chen pos /	lus_0 rgyal_4 chen_10 pos_15 
T01D1178:257a-15	khyod kyis 'gram du /	khyod_0 kyis_6 'grams_11 du_17 
T01D1178:257a-16	de'i las phul du byung ba des /	de_0 las_5 'bul_9 du_14 'byung_17 ba_23 des_26 
T01D1178:257a-17	ma lus snang ba /	ma_0 lus_3 snang_7 ba_13 
T01D1178:257a-18	ri yi l'a tma n'a li no bi la ngghya	ri_0 yi_3 l_6 tma_10 n_14 li_18 no_21 bi_24 la_27 ngghya_30 
T01D1178:257a-19	bi sha y'am sto y'a ba l'i ma kha l'a	bi_0 sha_3 y_7 sto_12 y_16 ba_20 l_23 ma_27 kha_30 l_34 
T01D1178:257a-20	nra / ya tstsa nt'i ma ni n'a na re	nra_0 ya_6 tstsa_9 nt_15 ma_20 ni_23 n_26 na_30 re_33 
T01D1178:257a-21	n+ya ba da ra dv'i p'a nna r'a lo da	n_0 ya_2 ba_5 da_8 ra_11 dv_14 p_19 nna_23 r_27 lo_31 da_34 
T01D1178:257a-22	nra / r'a tra / la bdhva p'u rnna pa	nra_0 r_6 tra_10 la_16 bdhva_19 p_25 rnna_29 ba_34 
T01D1178:257a-23	l'a tva y'a pra na yi n'a m'a sh'a ba	l_0 tva_4 y_8 pra_12 na_16 yi_19 n_22 m_26 sh_30 ba_35 
T01D1178:257a-24	ba ndh'a kri t'a /	ba_0 ndh_3 kri_9 t_13 
T01D1178:257a-25	stva tta ste na sa mu dbha ba nti bi du sh'am sa ddha rmma ra tn'a dku r'a:/	stva_0 tta_5 ste_9 na_13 sa_16 mu_19 dbha_22 ba_27 nti_30 bi_34 du_37 sh_40 sa_46 ddha_49 rmma_54 ra_59 tn_62 dku_67 
T01D1178:257a-26	s'a ndra mb'a nta bi t'a na n'i la pa	s_0 ndra_4 mb_9 nta_14 bi_18 t_21 na_25 n_28 la_32 ba_35 
T01D1178:257a-27	pu sh'a mo jo mu pam ra ksha s'am kha	pu_0 sh_3 mo_8 jo_11 mu_14 pam_17 ra_21 ksha_24 s_29 kha_34 
T01D1178:257a-28	dgo tkri tta da lee rbi b'a ti ta shi	dgo_0 tkri_4 tta_9 da_13 lee_16 rbi_20 b_24 ti_28 ta_31 'chi_34 
T01D1178:257a-29	r'a ra ndhra sva ba llo hi tee: dkyil 'khor	r_0 ra_4 ndhra_7 sva_13 ba_17 llo_20 hi_24 tee:_27 dkyil_32 'khor_38 
T01D1178:257a-30	/ 'gongs nas gul gu phreng ba ske rags /	'gongs_2 nas_9 gul_13 gu_17 phreng_20 ba_27 ske_30 rags_34 
T01D1178:257a-31	gang yid bzhin nor bu /	gang_0 yid_5 bzhin_9 nor_15 bu_19 
T01D1178:257a-32	rgya shug gling bar lto ba las thob nas gang ba'i 'bras khu khyod kyis /	rgya_0 shug_5 gling_10 ba_16 lto_20 ba_24 las_27 'thob_31 nas_36 gang_40 ba_45 'bras_50 khu_56 khyod_60 kyis_66 
T01D1178:257a-33	byas khyod las des byung ba mkhas rnams kyis dam chos rin chen myu gu /	byed_0 khyod_5 las_11 des_15 'byung_19 ba_25 mkhas_28 rnams_34 kyis_40 dam_45 chos_49 rin_54 chen_58 myu_63 gu_67 
T01D1178:257a-34	bla re sngon po lus gzi mdangs srung rnams ral	bla_0 re_4 sngon_7 po_13 lus_16 gzi_20 mdangs_24 srung_31 rnams_37 ral_43 
T01D1178:257a-35	gris bcad cing dral bas rtsa yi bug nas 'dzag	gris_0 gcod_5 cing_10 'dral_15 ba_20 rtsa_24 yi_29 'bug_32 nas_36 'dzag_40 
T01D1178:257a-36	khrag rnams kyis ya tm'a see ra kri b'a:kshu dh'a	khrag_0 rnams_6 kyis_12 ya_17 tm_20 see_25 ra_29 kri_32 b:kshu_36 dh_45 
T01D1178:257a-37	byu pa sha mi svee ra bya pe to psa	byu_0 ba_4 sha_7 mi_11 svee_14 ra_19 byed_22 pe_26 to_29 psa_32 
T01D1178:257a-38	bhi r+yo g'a dza nma ru dho bha bho ddha	bhi_0 r_4 yo_6 g_9 dza_13 nma_17 ru_21 dho_24 bha_28 bho_32 ddha_36 
T01D1178:257a-39	wa tri sh'a mu tstshe di na ste na ba:/	wa_0 tri_3 sh_7 mu_12 tstshe_15 di_22 na_25 ste_28 na_32 
T01D1178:257a-40	shye no tta sa bi shu shka pa mpi ta ga la s+yo t+sam ga sam sa pi no /	shye_0 no_5 tta_8 sa_12 bi_15 shu_18 shka_22 ba_27 mpi_30 ta_34 ga_37 la_40 s_43 yo_45 t_48 sam_50 ga_54 sam_57 sa_61 pi_64 no_67 
T01D1178:257a-41	ya nni:sam ga ra t'a shi b'a ya shi bi n'a ra dzny'a ma t'a pa kshi na:/	ya_0 nni:sam_3 ga_11 ra_14 t_17 'chi_21 b_25 ya_29 'chi_32 bi_36 n_39 ra_43 dzny_46 ma_53 t_56 ba_60 kshi_63 
T01D1178:257a-42	ra kto ng+g'a ra ka l'am ki t'a tu la	ra_0 kto_3 ng_7 g_10 ra_14 ka_17 l_20 ki_25 t_28 tu_32 la_35 
T01D1178:257a-43	tu l'a m'a ro ba t'a te ta nu rm'a	tu_0 l_3 m_7 ro_11 ba_14 t_17 te_21 ta_24 nu_27 rm_30 
T01D1178:257a-44	ra sta na du k'u la pa ksha ta ra	ra_0 sta_3 na_7 du_10 k_13 la_17 ba_20 ksha_23 ta_28 ra_31 
T01D1178:257a-45	lam n'i ta stu l'a l'a gha bam /	lam_0 n_4 ta_8 stu_11 l_15 l_19 gha_23 bam_27 
T01D1178:257a-46	la kshmi brtse med /	la_0 kshmi_3 brtse_9 med_15 
T01D1178:257a-47	bkes pa nyer zhi rang 'dod /	bkes_0 ba_5 nyer_8 zhi_13 rang_17 'dod_22 
T01D1178:257a-48	rnal 'byor skye ba srid pa las byung /	rnal_0 'byor_5 skye_11 ba_16 srid_19 ba_24 las_27 'byung_31 
T01D1178:257a-49	skom pa tshad /	skom_0 ba_5 tshad_8 
T01D1178:257a-50	khra yis skrag skams shing mgul mgrin pa 'gags /	khra_0 yis_5 skrag_9 skams_15 shing_21 mgul_27 mgrin_32 ba_38 'gag_41 
T01D1178:257a-51	gang zhig chags med dga' ba zhi phyir zhi ldan	gang_0 'jig_5 chags_10 med_16 dga'_20 ba_25 zhi_28 phyir_32 zhi_38 ldan_42 
T01D1178:257a-52	rgyal pos 'dab chags khrag srang la gzhal yang lus	rgyal_0 pos_6 'dab_10 chags_15 khrag_21 srang_27 la_33 'jal_36 yang_42 lus_47 
T01D1178:257a-53	ni bdud kyis du k'u la yi zegs ma bzhin	ni_0 bdud_3 kyis_8 du_13 k_16 la_20 yi_23 zegs_26 ma_31 bzhin_34 
T01D1178:257b-0	srang la shin tu yang bar bas dbang @257b ma	srang_0 la_6 shin_9 tu_14 yang_17 ba_22 ba_26 dbang_30 ma_42 
T01D1178:257b-1	bya ba dr'u ya b'a nytsi ta pha l'a p'a	byed_0 ba_4 dr_7 ya_12 b_15 nytsi_19 ta_25 pha_28 l_32 p_36 
T01D1178:257b-2	tha nda m'a bhyam si n'am /	tha_0 nda_4 m_8 bhyam_12 si_18 n_21 
