T01D1178:257b-3	ya tti r+ya gna t'i sa ndhi ba ndha ma	ya_0 tti_3 r_7 ya_9 gna_12 t_16 sa_20 ndhi_23 ba_28 ndha_31 ma_36 
T01D1178:257b-4	dha mam kri tv'a bha b'a na dze nmi n'am	dha_0 mam_4 kri_8 tv_12 bha_17 b_21 na_25 dze_28 nmi_32 n_36 
T01D1178:257b-5	/ tsa kre ma rma bhi d'am ru dz'i mva pi shi ta:pr'a ba ndha k'i n'am sha mam /	tsa_2 kre_6 ma_10 rma_13 bhi_17 d_21 ru_26 dz_29 mva_34 pi_38 'chi_41 ta:pr_45 ba_53 ndha_56 k_61 n_65 sha_70 mam_74 
T01D1178:257b-6	te na kle sha bi sha tstshi d'am ta ba dhi y'a ma by'a ha t'a:sha kna ya:/	te_0 na_3 kle_6 sha_10 bi_14 sha_17 tstshi_21 d_28 ta_33 ba_36 dhi_39 y_43 ma_47 by_50 ha_55 t:sha_58 kna_66 
T01D1178:257b-7	ya t+sa ndo ha mi ba shri y'a pha la mi ba bro tstsha yi bu n+yoo dza sam /	ya_0 t_3 sa_5 ndo_8 ha_12 mi_15 ba_18 shri_21 y_26 pha_30 la_34 mi_37 ba_40 bro_43 tstsha_47 yi_54 bu_57 n_60 yoo_62 dza_66 sam_70 
T01D1178:257b-8	di gdham na kta ka nee:sphu ra tku ba la ya tstsh'a y'a bhi n'i l'a ya tam /	di_0 gdham_3 na_9 kta_12 ka_16 nee:sphu_19 ra_28 tku_31 ba_35 la_38 ya_41 tstsh_44 y_52 bhi_56 n_60 l_64 ya_68 tam_71 
T01D1178:257b-9	pos yang ni bdar nas 'dod pa'i 'bras bu dum bu yang ba /	pos_0 yang_4 ni_9 bdar_12 nas_17 'dod_21 ba_26 'bras_31 bu_37 dum_40 bu_44 yang_47 ba_52 
T01D1178:257b-10	gang dud 'gro'i mtshams sbyor 'ching ba tha mar byas nas khyod kyi skye ba'o /	gang_0 dud_5 'gro_9 mtshams_16 sbyor_24 'ching_30 ba_37 tha_40 mar_44 byed_48 nas_53 khyod_57 kyi_63 skye_67 ba_72 
T01D1178:257b-11	'khor lo'i gnad pa byed nad kyis rang gi sha	'khor_0 lo_6 gnad_11 ba_16 byed_19 nad_24 kyis_28 rang_33 gi_38 sha_41 
T01D1178:257b-12	rnams kyis rab bcings zhi ba de yis nyon mongs	rnams_0 kyis_6 rab_11 'ching_15 zhi_22 ba_26 de_29 yis_32 nyon_36 mongs_41 
T01D1178:257b-13	dug bcad khyod kyi blo yis thogs med nus /	dug_0 gcod_4 khyod_9 kyi_15 blo_19 yis_23 thogs_27 med_33 nus_37 
T01D1178:257b-14	gang the tshom bzhin du /	gang_0 the_5 tshom_9 bzhin_15 du_21 
T01D1178:257b-15	dpal gyi 'bras bu bzhin bsod nams mtshan mo'i zegs	dpal_0 gyi_5 'bras_9 bu_15 bzhin_18 bsod_24 nams_29 mtshan_34 mo_41 zegs_46 
T01D1178:257b-16	ma 'phred dang autpala ltar mdzes mngon par au tp'a	ma_0 'phred_3 dang_10 autpala_15 ltar_23 mdzes_28 mngon_34 ba_40 au_44 tp_47 
T01D1178:257b-17	n+y'a ksha nam dva ya sa d'a rmi p'a ya	n_0 y_2 ksha_6 nam_11 dva_15 ya_19 sa_22 d_25 rmi_29 p_33 ya_37 
T01D1178:257b-18	ni shtsa kshu she /	ni_0 shtsa_3 kshu_9 she_14 
T01D1178:257b-19	te na ndha sya ta ma sva to sya dza	te_0 na_3 ndha_6 sya_11 ta_15 ma_18 sva_21 to_25 sya_28 dza_32 
T01D1178:257b-20	ga ta stu ng+gee ka d'i po bha b'a na	ga_0 ta_3 stu_6 ng_10 gee_13 ka_17 d_20 po_24 bha_27 b_31 na_35 
T01D1178:257b-21	/ ai ty'a tm'a rtha ni ba ndhi ke na mri shi b'a kya lam da rshi tam /	ai_2 ty_5 tm_10 rtha_15 ni_20 ba_23 ndhi_26 ke_31 na_34 mri_37 'chi_41 b_45 kya_49 lam_53 da_57 rshi_60 tam_65 
T01D1178:257b-22	le sha sya pi na k'i rta na nydzi na kri tam tva dpa rnna r'a she rmma m'a /	le_0 sha_3 sya_7 pi_11 na_14 k_17 rta_21 na_25 nydzi_28 na_34 kri_37 tam_41 tva_45 dpa_49 rnna_53 r_58 she_62 rmma_66 m_71 
T01D1178:257b-23	t'a ra bdh'a na ba t'a nydza lam dza la pu r'a m'a ka rsha t'a b'a ri ste /	t_0 ra_4 bdh_7 na_13 ba_16 t_19 nydza_23 lam_29 dza_33 la_37 pu_40 r_43 m_47 ka_51 rsha_54 t_59 b_63 ri_67 ste_70 
T01D1178:257b-24	be l'a nte shvi ba ro dha sv'a dza la la ba tstshe do ha sam la kshya te /	be_0 l_3 nte_7 shvi_11 ba_16 ro_19 dha_22 sv_26 dza_31 la_35 la_38 ba_41 tstshe_44 do_51 ha_54 sam_57 la_61 kshya_64 te_70 
T01D1178:257b-25	tva tstsa ry'a ti sha y'am sha le sha ra tsa n'a lya shre sngo khrid yangs pa yi /	tva_0 tstsa_4 ry_10 ti_15 sha_18 y_22 sha_27 le_31 sha_34 ra_38 tsa_41 n_45 lya_49 shre_53 sngo_58 'khrid_63 yangs_69 ba_75 yi_78 
T01D1178:257b-26	spyan gnyis rma med phyung nas bram ze mig med la /	spyan_0 gnyis_6 rma_12 med_16 'byin_20 nas_27 bram_31 ze_36 mig_39 med_43 la_47 
T01D1178:257b-27	de yis long ba'i mun rang 'gro ba mthon po'i sgron me gcig pu khyod //	de_0 yis_3 long_7 ba_12 mun_17 rang_21 'gro_26 ba_31 mthon_34 po_40 sgron_45 me_51 gcig_54 pu_59 khyod_62 
T01D1178:257b-28	de ltar bdag don gyis bcings /	de_0 ltar_3 bdag_8 don_13 gyis_17 'ching_22 
T01D1178:257b-29	drang srong gsung gi rgyan bstan pa /	'dren_0 srong_6 gsung_12 gi_18 rgyan_21 ston_27 ba_33 
T01D1178:257b-30	cha shas kyis kyang grags rgyal byas khyod la bsngags	cha_0 shas_4 kyis_9 kyang_14 grags_20 rgyal_26 byed_32 khyod_37 la_43 bsngags_46 
T01D1178:257b-31	pa'i phung po bdag / de thob sar pa nyid	ba_0 'phung_5 po_11 bdag_14 de_21 'thob_24 sar_29 ba_33 nyid_36 
T01D1178:257b-32	chu chu grong bkug chu gter dus mtha' rnams su	chu_0 chu_4 grong_8 'gugs_14 chu_19 gter_23 dus_28 mtha'_32 rnams_38 su_44 
T01D1178:257b-33	chu bzhin chad pa yang dag mtshon /	chu_0 bzhin_4 'chad_10 ba_15 yang_18 'dag_23 mtshon_27 
T01D1178:257b-34	khyod kyi spyod pa phul rma s'a mu dbha ba /	khyod_0 kyi_6 spyod_10 ba_16 'bul_19 rma_24 s_28 mu_32 dbha_35 ba_40 
T01D1178:257b-35	sam bh'a ro bi bu la pra s'a da bi ka sa dbha ktya tsi t'am sha sya me /	sam_0 bh_4 ro_9 bi_12 bu_15 la_18 pra_21 s_25 da_29 bi_32 ka_35 sa_38 dbha_41 ktya_46 tsi_51 t_55 sha_60 sya_64 me_68 
T01D1178:257b-36	te n'a tya nta pa ro pa k'a ra ni ra ta:sv'a tse bi ma nd'a da ro /	te_0 n_3 tya_7 nta_11 ba_15 ro_18 ba_21 k_24 ra_28 ni_31 ra_34 ta:sv_37 tse_45 bi_49 ma_52 nd_55 da_60 ro_63 
T01D1178:257b-37	bh'u ya t+sa rba bi d'am pa r'a rtha bi	bh_0 ya_5 t_8 sa_10 rba_13 bi_17 d_20 ba_25 r_28 rtha_32 bi_37 
T01D1178:257b-38	du sh'am y'a nee ka t'a no dza na:dz'a ta	du_0 sh_3 y_9 nee_13 ka_17 t_20 no_24 dza_27 na:dz_31 ta_39 
T01D1178:257b-39	ka sta pa a'a ts'a rya dzny'a ya sha sa:/	ka_0 sta_3 ba_7 a_10 ts_14 rya_19 dzny_23 ya_30 sha_33 
T01D1178:257b-41	// / di ni rgya dpe las bod kyi skad du /	ni_8 rgya_11 dpe_16 las_20 'bod_24 kyi_28 skad_32 du_37 
T01D1178:257b-42	zhva lu lo ts'a ba dge slong dha rma p'a la bha dras bsgyur ba'o //	zhva_0 lu_5 lo_8 ts_11 ba_16 dge_19 slong_23 dha_29 rma_33 p_37 la_41 bha_44 'dra_48 sgyur_53 ba_60 
T01D1178:257b-43	byung cha shas bag tsam bkod bdag legs pa las byung /	'byung_0 cha_6 shas_10 bag_15 tsam_19 bkod_24 bdag_29 legs_34 ba_39 las_42 'byung_46 
T01D1178:257b-44	tshogs yangs pa rab dang rgyas pa gus pa stug	tshogs_0 yangs_7 ba_13 rab_16 dang_20 rgya_25 ba_31 gus_34 ba_38 stug_41 
T01D1178:257b-45	po'i cha yis bdag / de yis shin tu gzhan	po_0 cha_5 yis_9 bdag_13 de_20 yis_23 shin_27 tu_32 gzhan_35 
T01D1178:257b-46	phan nges dga' rang gi don la gus pa zhan	phan_0 nges_5 dga'_10 rang_15 gi_20 don_23 la_27 gus_30 ba_34 zhan_37 
T01D1178:257b-47	// thams cad mkhyen pa gzhan don la mkhas breg	thams_3 cad_9 mkhyen_13 ba_20 gzhan_23 don_29 la_33 mkhas_36 breg_42 
T01D1178:257b-48	pa gcig par skye bo rnams gyur cig / skyes	ba_0 gcig_3 ba_8 skye_12 'bo_17 rnams_20 gyur_26 cig_31 skye_37 
T01D1178:257b-49	rabs kyi bstod pa slob dpon ye shes grags pas	rabs_0 kyi_5 bstod_9 ba_15 slob_18 dpon_23 ye_28 shes_31 grags_36 ba_42 
