T02D1407:69a-0	@69a # // rgya gar skad du /	rgya_10 gar_15 skad_19 du_24 
T02D1407:69a-1	shr'i tsakra sam bar sarba s'a dha nam san ni n'a ma t'i k'a /	shr_0 tsakra_6 sam_13 ba_17 sarba_21 s_27 dha_31 nam_35 san_39 ni_43 n_46 ma_50 t_53 k_57 
T02D1407:69a-2	bod skad du /	'bod_0 skad_4 du_9 
T02D1407:69a-3	dpal 'khor lo sdom pa'i sgrub thabs gnas pa thams cad rgya cher 'grel pa zhes bya ba /	dpal_0 'khor_5 lo_11 sdom_14 ba_19 sgrub_24 thabs_30 gnas_36 ba_41 thams_44 cad_50 rgya_54 cher_59 'grel_64 ba_70 zhes_73 byed_78 ba_82 
T02D1407:69a-4	dpal bde mchog 'khor lo mkha' 'gro ma'i tshogs dang bcas pa la phyag 'tshal lo //	dpal_0 bde_5 mchog_9 'khor_15 lo_21 mkha'_24 'gro_30 ma_35 tshogs_40 dang_47 'cha'_52 ba_57 la_60 phyag_63 'tshal_69 lo_76 
T02D1407:69a-5	he ru ka dpal mgon btung nas //	he_0 ru_3 ka_6 dpal_9 mgon_14 'thung_19 nas_25 
T02D1407:69a-6	bla ma brgyud rim pa las 'ongs pa'i //	bla_0 ma_4 brgyud_7 rim_14 ba_18 las_21 'ongs_25 ba_31 
T02D1407:69a-7	sku gsum bdag nyid bde ba ni //	sku_0 gsum_4 bdag_9 nyid_14 bde_19 ba_23 ni_26 
T02D1407:69a-8	dad pas cung zad bri bar bya //	dad_0 ba_4 cung_8 zad_13 'bri_17 ba_21 byed_25 
T02D1407:69a-9	de nas zhes bya ba la sogs pas ni rgyud	de_0 nas_3 zhes_7 byed_12 ba_16 la_19 sogs_22 ba_27 ni_31 brgyud_34 
T02D1407:69a-10	ni rgyud de de ma thag pa dang ldan pa'o	ni_0 brgyud_3 de_9 de_12 ma_15 thag_18 ba_23 dang_26 ldan_31 ba_36 
T02D1407:69a-11	// de bas na 'di'i de nas zhes pa'i sgra rgyud snga ma la ltos pa ste /	de_3 ba_6 na_10 'di_13 de_19 nas_22 zhes_26 ba_31 sgra_36 brgyud_41 snga_47 ma_52 la_55 ltos_58 ba_63 ste_66 
T02D1407:69a-12	rgyud 'di de'i de ma thag par gsal lo //	brgyud_0 'di_6 de_10 de_15 ma_18 thag_21 ba_26 gsal_30 lo_35 
T02D1407:69a-13	gang gi phyir mtshan mngon par brjod pa zhes bya	gang_0 gi_5 phyir_8 mtshan_14 mngon_21 ba_27 rjod_31 ba_37 zhes_40 byed_45 
T02D1407:69a-14	ba'i rgyud stong phrag gsum par 'di skad bdag gis	ba_0 brgyud_5 stong_11 phrag_17 gsum_23 ba_28 'di_32 skad_36 bdag_41 gis_46 
T02D1407:69a-15	thos pa zhes pa gsungs so //	thos_0 ba_5 zhes_8 ba_13 gsungs_16 so_23 
T02D1407:69a-16	de bas na 'dir 'di skad ces pa la sogs	de_0 ba_3 na_7 'dir_10 'di_15 skad_19 ces_24 ba_28 la_31 sogs_34 
T02D1407:69a-17	pa sdud pa po'i tshig rab tu ma bkod de	ba_0 sdud_3 ba_8 po_11 tshig_16 rab_22 tu_26 ma_29 bkod_32 de_37 
T02D1407:69a-18	snga mar bkod pa nyid kyis na'o //	snga_0 mar_5 bkod_9 ba_14 nyid_17 kyis_22 na_27 
T02D1407:69a-19	rgyud ces pa ni bsdus pa ste don ma lus pa'o //	brgyud_0 ces_6 ba_10 ni_13 sdud_16 ba_22 ste_25 don_29 ma_33 lus_36 ba_40 
T02D1407:69a-20	de yang rgyu'i rgyu dang /	de_0 yang_3 rgyu_8 rgyu_15 dang_20 
T02D1407:69a-21	'bras bu'i rgyu dang /	'bras_0 bu_6 rgyu_11 dang_16 
T02D1407:69a-22	thabs kyi rgyud do //	thabs_0 kyi_6 brgyud_10 do_16 
T02D1407:69a-23	rgyud ces pa ni rigs te 'di la sgrub pa po rnams ni shin tu rnyed dka' ba'o //	brgyud_0 ces_6 ba_10 ni_13 rigs_16 te_21 'di_24 la_28 sgrub_31 ba_37 po_40 rnams_43 ni_49 shin_52 tu_57 rnyed_60 dka'_66 ba_71 
T02D1407:69b-0	thabs kyi rgyud ces pa ni sngar @69b snying po'i	thabs_0 kyi_6 brgyud_10 ces_16 ba_20 ni_23 sngar_26 snying_37 po_44 
T02D1407:69b-1	dkyil 'khor du 'jug pa la sogs pa'i rim pas	dkyil_0 'khor_6 du_12 'jug_15 ba_20 la_23 sogs_26 ba_31 rim_36 ba_40 
T02D1407:69b-2	bsgom pa dang / bzlas pa dang /	bsgom_0 ba_6 dang_9 bzlas_16 ba_22 dang_25 
T02D1407:69b-3	gtor ma dang /	'thor_0 ma_5 dang_8 
T02D1407:69b-4	'khrul 'khor dang /	'khrul_0 'khor_7 dang_13 
T02D1407:69b-5	sngags dang /	sngags_0 dang_7 
T02D1407:69b-6	rab tu sbyor ba'o //	rab_0 tu_4 sbyor_7 ba_13 
T02D1407:69b-7	'bras bu zhes pa ni gnyis su med par gyur ba dag gi mi rgyu ba ste /	'bras_0 bu_6 zhes_9 ba_14 ni_17 gnyis_20 su_26 med_29 ba_33 gyur_37 ba_42 'dag_45 gi_49 mi_52 rgyu_55 ba_60 ste_63 
T02D1407:69b-8	'di la sems 'jug pa ni ring ba nyid kyi phyir ro ;	'di_0 la_4 sems_7 'jug_12 ba_17 ni_20 ring_23 ba_28 nyid_31 kyi_36 phyir_40 ro_46 
T02D1407:69b-9	/ de ci'i phyir zhe na /	de_2 ci_5 phyir_10 zhe_16 na_20 
T02D1407:69b-10	gang gis 'di la sangs rgyas kyi chos rnams gnas pa'i don gyis so //	gang_0 gis_5 'di_9 la_13 sangs_16 rgya_22 kyi_28 chos_32 rnams_37 gnas_43 ba_48 don_53 gyis_57 so_62 
T02D1407:69b-11	'di'i phyag rgya aa kun rdzob kyi rnam pa las rigs thams cad 'byung ba'i don to //	'di_0 phyag_6 rgya_12 aa_17 kun_20 rdzob_24 kyi_30 rnam_34 ba_39 las_42 rigs_46 thams_51 cad_57 'byung_61 ba_68 don_73 to_77 
T02D1407:69b-12	dpal rdo rje rgyan gyi dkyil 'khor gyi rgyud la gsungs pa /	dpal_0 rdo_5 rje_9 rgyan_13 gyi_19 dkyil_23 'khor_29 gyi_35 brgyud_39 la_45 gsungs_48 ba_55 
T02D1407:69b-13	rab 'bar mar me ltar snang ba //	rab_0 'bar_4 mar_9 me_13 ltar_16 snang_21 ba_27 
T02D1407:69b-14	snying gi dbus na mi shigs pa //	snying_0 gi_7 dbus_10 na_15 mi_18 shigs_21 ba_27 
T02D1407:69b-15	mi 'gyur mchog tu phra ba ste /	mi_0 'gyur_3 mchog_9 tu_15 phra_18 ba_23 ste_26 
T02D1407:69b-16	aa ni gtso bo dam pa mchog //	aa_0 ni_3 gtso_6 'bo_11 dam_14 ba_18 mchog_21 
T02D1407:69b-17	ces pa dang /	ces_0 ba_4 dang_7 
T02D1407:69b-18	yang rtog pa'i rgyal po gnyis po las kyang gsungs pa /	yang_0 rtogs_5 ba_10 rgyal_15 po_21 gnyis_24 po_30 las_33 kyang_37 gsungs_43 ba_50 
T02D1407:69b-19	lte bar phyag rgya che gnas pa //	lte_0 ba_4 phyag_8 rgya_14 che_19 gnas_23 ba_28 
T02D1407:69b-20	mar me'i rtse ltar 'bar ba ni //	mar_0 me_4 rtse_9 ltar_14 'bar_19 ba_24 ni_27 
T02D1407:69b-21	dang po'i dbyangs kyi rang bzhin te /	dang_0 po_5 dbyangs_10 kyi_18 rang_22 bzhin_27 te_33 
T02D1407:69b-22	de blor sangs rgyas rnams kyis brtags //	de_0 blor_3 sangs_8 rgya_14 rnams_20 kyis_26 rtog_31 
T02D1407:69b-23	zhes pa ste /	zhes_0 ba_5 ste_8 
T02D1407:69b-24	de nas zhes pa ni bshad pa 'di thams cad aar 'brel ba'o //	de_0 nas_3 zhes_7 ba_12 ni_15 'chad_18 ba_24 'di_27 thams_31 cad_37 aar_41 'brel_45 ba_51 
T02D1407:69b-25	de ci'i phyir zhe na /	de_0 ci_3 phyir_8 zhe_14 na_18 
T02D1407:69b-26	gsang ba zhes pa ste /	gsang_0 ba_6 zhes_9 ba_14 ste_17 
T02D1407:69b-27	'di'i rigs med pa rnams la gsal bar mi bya bas so //	'di_0 rigs_6 med_11 ba_15 rnams_18 la_24 gsal_27 ba_32 mi_36 byed_39 ba_43 so_47 
T02D1407:69b-28	gsal bar mi bya ba de ci zhe na /	gsal_0 ba_5 mi_9 byed_12 ba_16 de_19 ci_22 zhe_25 na_29 
T02D1407:69b-29	sba bar 'os pa bdun te /	sbed_0 ba_4 'os_8 ba_12 bdun_15 te_20 
T02D1407:69b-30	gsang ba zhes pa de nyid yul //	gsang_0 ba_6 zhes_9 ba_14 de_17 nyid_20 yul_25 
T02D1407:69b-31	gsang ba rnam rgyal 'khor lo dang //	gsang_0 ba_6 rnam_9 rgyal_14 'khor_20 lo_26 dang_29 
T02D1407:69b-32	gsang ba sba bya yang dag dngos //	gsang_0 ba_6 sbed_9 byed_13 yang_17 'dag_22 dngos_26 
T02D1407:69b-33	gsang ba gsang ba'i padma dang //	gsang_0 ba_6 gsang_9 ba_15 padma_20 dang_26 
T02D1407:69b-34	gsang ba rnam rgyal dga' ba dang //	gsang_0 ba_6 rnam_9 rgyal_14 dga'_20 ba_25 dang_28 
T02D1407:69b-35	gsang ba thams cad bsdus pa dang //	gsang_0 ba_6 thams_9 cad_15 sdud_19 ba_25 dang_28 
T02D1407:69b-36	gsang ba par chad med bde ba'o //	gsang_0 ba_6 ba_9 'chad_13 med_18 bde_22 ba_26 
T02D1407:69b-37	mdor bsdus pa zhes pa ni mdor bsdus pa ste	mdor_0 sdud_5 ba_11 zhes_14 ba_19 ni_22 mdor_25 sdud_30 ba_36 ste_39 
T02D1407:69b-38	gzhung gi tshad yin gyi don ni ma yin te	gzhung_0 gi_7 tshad_10 yin_16 gyi_20 don_24 ni_28 ma_31 yin_34 te_38 
T02D1407:69b-39	sangs rgyas thams cad kyi chos rnams bsdus pa nyid	sangs_0 rgya_6 thams_12 cad_18 kyi_22 chos_26 rnams_31 sdud_37 ba_43 nyid_46 
T02D1407:69b-40	kyi phyir ro // de bas na de dag sdom pas mngon par brjod par yin te /	kyi_0 phyir_4 ro_10 de_16 ba_19 na_23 de_26 'dag_29 sdom_33 ba_38 mngon_42 ba_48 rjod_52 ba_58 yin_62 te_66 
T02D1407:69b-41	thams cad sdom zhing 'dzin zhes pa'i don to //	thams_0 cad_6 sdom_10 zhing_15 'dzin_21 zhes_27 ba_32 don_37 to_41 
T02D1407:69b-42	he ru ka dpal yang dag sbyor //	he_0 ru_3 ka_6 dpal_9 yang_14 'dag_19 sbyor_23 
T02D1407:69b-43	zhes pa ni bdag nyid dpal he ru ka la	zhes_0 ba_5 ni_8 bdag_11 nyid_16 dpal_21 he_26 ru_29 ka_32 la_35 
T02D1407:69b-44	phyag rgya rdo rje phag mo ste de nyid yang	phyag_0 rgya_6 rdo_11 rje_15 phag_19 mo_24 ste_27 de_31 nyid_34 yang_39 
T02D1407:69b-45	dag par sbyor ba phyag rgya chen po'i mtshan nyid	'dag_0 ba_4 sbyor_8 ba_14 phyag_17 rgya_23 chen_28 po_33 mtshan_38 nyid_45 
T02D1407:69b-46	la bya'o // 'dod pa zhes pa ni 'dod bya	la_0 byed_3 'dod_12 ba_17 zhes_20 ba_25 ni_28 'dod_31 byed_36 
T02D1407:69b-47	ste don phun sum tshogs pa rnams skyed par byed	ste_0 don_4 phun_8 sum_13 tshogs_17 ba_24 rnams_27 skyed_33 ba_39 byed_43 
T02D1407:70a-0	la bya'o // pa'i don te / 'dis sangs rgyas rdo rje 'dzin pa nyid @70a * //	la_0 byed_3 ba_12 don_17 te_21 'dis_26 sangs_31 rgya_37 rdo_43 rje_47 'dzin_51 ba_57 nyid_60 
T02D1407:70a-1	'grub par byed ces pa'o //	'grub_0 ba_6 byed_10 ces_15 ba_19 
T02D1407:70a-2	de lta bu'i 'dod pa'i don kun sgrub pa po de gang yin zhe na /	de_0 lta_3 bu_7 'dod_12 ba_17 don_22 kun_26 sgrub_30 ba_36 po_39 de_42 gang_45 yin_50 zhe_54 na_58 
T02D1407:70a-3	phyi ma las kyang phyi ma ste /	phyi_0 ma_5 las_8 kyang_12 phyi_18 ma_23 ste_26 
T02D1407:70a-4	zhes pa ste /	zhes_0 ba_5 ste_8 
T02D1407:70a-5	bla na med par gsungs pa'i don te /	bla_0 na_4 med_7 ba_11 gsungs_15 ba_22 don_27 te_31 
T02D1407:70a-6	mos pa sna tshogs pa'i sems can gyi bsam pas	mos_0 ba_4 sna_7 tshogs_11 ba_18 sems_23 can_28 gyi_32 bsam_36 ba_41 
T02D1407:70a-7	phye ba lus rtag par lta ba las yang dag	'byed_0 ba_5 lus_8 rtag_12 ba_17 lta_21 ba_25 las_28 yang_32 'dag_37 
T02D1407:70a-8	par sbyar ba'i chos kyi phung po brgyang khri bzhi	ba_0 sbyor_4 ba_10 chos_15 kyi_20 'phung_24 po_30 rgyong_33 khri_41 bzhi_46 
T02D1407:70a-9	stong bstan pa de las 'di mchog gi phyir na	stong_0 ston_6 ba_12 de_15 las_18 'di_22 mchog_26 gi_32 phyir_35 na_41 
T02D1407:70a-10	phyi ma ste / bla na med pa de kho na nyid rtogs pa'i thugs so //	phyi_0 ma_5 ste_8 bla_14 na_18 med_21 ba_25 de_28 kho_31 na_35 nyid_38 rtogs_43 ba_49 thugs_54 so_60 
T02D1407:70a-11	de'ang sangs rgyas thams cad dang bcas pa'i rdo rje	de_0 sangs_7 rgya_13 thams_19 cad_25 dang_29 'cha'_34 ba_39 rdo_44 rje_48 
T02D1407:70a-12	so so rang gis rig pa'i rang bzhin tshig gi	so_0 so_3 rang_6 gis_11 rig_15 ba_19 rang_24 bzhin_29 tshig_35 gi_41 
T02D1407:70a-13	lam gyis de dag 'dzin to //	lam_0 gyis_4 de_9 'dag_12 'dzin_16 to_22 
T02D1407:70a-14	de'i phyir na de nyid dman pa pa ni bskal	de_0 phyir_5 na_11 de_14 nyid_17 dman_22 ba_27 ba_30 ni_33 bskal_36 
T02D1407:70a-15	pa bye ba brgya kyang mi 'grub po zhes bcom	ba_0 'bye_3 ba_7 brgya_10 kyang_16 mi_22 'grub_25 po_31 zhes_34 'joms_39 
T02D1407:70a-16	ldan 'das kyis gsungs so //	ldan_0 'da'_5 kyis_10 gsungs_15 so_22 
T02D1407:70a-17	mkha' 'gro ma yi dra ba sdom //	mkha'_0 'gro_6 ma_11 yi_14 'dra_17 ba_21 sdom_24 
T02D1407:70a-18	zhes pas ni 'khor phun sum tshogs pa gsungs te /	zhes_0 ba_5 ni_9 'khor_12 phun_18 sum_23 tshogs_27 ba_34 gsungs_37 te_44 
T02D1407:70a-19	mkha' 'gro ma ni de be ha ya sa g'a ma ne zhes bya ba ste /	mkha'_0 'gro_6 ma_11 ni_14 de_17 be_20 ha_23 ya_26 sa_29 g_32 ma_36 ne_39 zhes_42 byed_47 ba_51 ste_54 
T02D1407:70a-20	de zhes pa ni nam mkha' la 'gro ba'i don du ston te /	de_0 zhes_3 ba_8 ni_11 nam_14 mkha'_18 la_24 'gro_27 ba_32 don_37 du_41 ston_44 te_49 
T02D1407:70a-21	ae dang phral nas a'a dang sbyar bar d'a nyid du 'gyur ro //	ae_0 dang_3 'phral_8 nas_14 a_18 dang_22 sbyor_27 ba_33 d_37 nyid_41 du_46 'gyur_49 ro_55 
T02D1407:70a-22	d'ar gyur pas d'a nam zhes bya bar lugs kyis 'gyur te /	d_0 gyur_5 ba_10 d_14 nam_18 zhes_22 byed_27 ba_31 lugs_35 kyis_40 'gyur_45 te_51 
T02D1407:70a-23	d'a nam gi don ni nam mkha' 'gro ba'i don to //	d_0 nam_4 gi_8 don_11 ni_15 nam_18 mkha'_22 'gro_28 ba_33 don_38 to_42 
T02D1407:70a-24	d'a zhes bya ba'i sgra 'ba' zhig ni gsum pa	d_0 zhes_4 byed_9 ba_13 sgra_18 'ba'_23 'jig_28 ni_33 gsum_36 ba_41 
T02D1407:70a-25	ste des mthar chags su 'gro ba ni aa ka'o	ste_0 des_4 mthar_8 chags_14 su_20 'gro_23 ba_28 ni_31 aa_34 ka_37 
T02D1407:70a-26	// 'di la thams cad kyi rjes su 'gro ba ni mthar chags kyi sa 'gro ba'o //	'di_3 la_7 thams_10 cad_16 kyi_20 rjes_24 su_29 'gro_32 ba_37 ni_40 mthar_43 chags_49 kyi_55 sa_59 'gro_62 ba_67 
T02D1407:70a-27	aa ki tu zhes bya ba ste /	aa_0 ki_3 tu_6 zhes_9 byed_14 ba_18 ste_21 
T02D1407:70a-28	'di'i ngang tshul mkha' la 'gro bas 'di dag mkha' 'gro ma ste /	'di_0 ngang_6 tshul_12 mkha'_18 la_24 'gro_27 ba_32 'di_36 'dag_40 mkha'_44 'gro_50 ma_55 ste_58 
T02D1407:70a-29	rdzu 'phrul gyi sku bye ba khri phrag brgyad stong	rdzu_0 'phrul_5 gyi_12 sku_16 'bye_20 ba_24 khri_27 phrag_32 brgyad_38 stong_45 
T02D1407:70a-30	du ldan pa'i cig car thams cad du 'gro'o zhes	du_0 ldan_3 ba_8 cig_13 car_17 thams_21 cad_27 du_31 'gro_34 zhes_41 
T02D1407:70a-31	pa'i don to // dra ba ni de'i dra ba ste /	ba_0 don_5 to_9 'dra_15 ba_19 ni_22 de_25 'dra_30 ba_34 ste_37 
T02D1407:70a-32	bsdus pa zhes bya ba'i don to //	sdud_0 ba_6 zhes_9 byed_14 ba_18 don_23 to_27 
T02D1407:70a-33	sdom pa ni bde mchog go //	sdom_0 ba_5 ni_8 bde_11 mchog_15 go_21 
T02D1407:70a-34	de rnams kyi lhan cig tu skad cig skad cig	de_0 rnams_3 kyi_9 lhan_13 cig_18 tu_22 skad_25 cig_30 skad_34 cig_39 
T02D1407:70a-35	yang dag par mnyes par bya ba yin pa'i phyir	yang_0 'dag_5 ba_9 mnyes_13 ba_19 byed_23 ba_27 yin_30 ba_34 phyir_39 
T02D1407:70a-36	ro // gsang ba zhes pa la sogs pas ni	ro_0 gsang_6 ba_12 zhes_15 ba_20 la_23 sogs_26 ba_31 ni_35 
T02D1407:70a-37	stong pa'i bdag nyid yi ge bcu drug po de	stong_0 ba_6 bdag_11 nyid_16 yi_21 ge_24 'chu_27 drug_31 po_36 de_39 
T02D1407:70a-38	dag thams cad kyi sgras bstan par bya ste /	'dag_0 thams_4 cad_10 kyi_14 sgras_18 ston_24 ba_30 byed_34 ste_38 
T02D1407:70a-39	ra ni khrag gi khams yin no //	ra_0 ni_3 khrag_6 gi_12 khams_15 yin_21 no_25 
T02D1407:70a-40	ha ni ri sul zhes bya ba ste /	ha_0 ni_3 ri_6 sul_9 zhes_13 byed_18 ba_22 ste_25 
T02D1407:70a-41	ri sul zhes bya ba mgo bor ro //	ri_0 sul_3 zhes_7 byed_12 ba_16 mgo_19 'bor_23 ro_27 
T02D1407:70a-42	s+ye ni dri'i bar bu ste /	s_0 ye_2 ni_5 'dri_8 ba_14 bu_18 ste_21 
T02D1407:70a-43	ji ltar lus la dir gnas pa'o //	ji_0 ltar_3 lus_8 la_12 dir_15 gnas_19 ba_24 
T02D1407:70a-44	pa ni sprin gyi shugs yin no //	ba_0 ni_3 sprin_6 gyi_12 shugs_16 yin_22 no_26 
T02D1407:70a-45	ra ni de bzhin dri ru gsungs //	ra_0 ni_3 de_6 bzhin_9 'dri_15 ru_19 gsungs_22 
T02D1407:70a-46	me ni de bzhin me tog go //	me_0 ni_3 de_6 bzhin_9 me_15 tog_18 go_22 
T02D1407:70a-47	ra ni de bzhin lan tshvar ro //	ra_0 ni_3 de_6 bzhin_9 lan_15 tshvar_19 ro_26 
T02D1407:70b-0	@70b me ni de bzhin sha ru gsungs //	me_5 ni_8 de_11 bzhin_14 sha_20 ru_24 gsungs_27 
T02D1407:70b-1	sa ni de bzhin sbyor ba nyid //	sa_0 ni_3 de_6 bzhin_9 sbyor_15 ba_21 nyid_24 
T02D1407:70b-2	ra ni de bzhin sen mo'o //	ra_0 ni_3 de_6 bzhin_9 sen_15 mo_19 
T02D1407:70b-3	me ni de bzhin rkang du'o //	me_0 ni_3 de_6 bzhin_9 rkang_15 du_21 
T02D1407:70b-4	ne ni de bzhin dri yi mar //	ne_0 ni_3 de_6 bzhin_9 'dri_15 yi_19 mar_22 
T02D1407:70b-5	sa ni de bzhin sen mor gnas //	sa_0 ni_3 de_6 bzhin_9 sen_15 mor_19 gnas_23 
T02D1407:70b-6	d'a ni rgya mtshor skyes pa'o //	d_0 ni_4 rgya_7 mtshor_12 skye_19 ba_25 
T02D1407:70b-7	sti ni kha ba'i snying po'o //	sti_0 ni_4 kha_7 ba_11 snying_16 po_23 
T02D1407:70b-8	tam ni ga pur zhes bya'o //	tam_0 ni_4 ga_7 pur_10 zhes_14 byed_19 
T02D1407:70b-9	yang na thams cad mkhyen pa kun du 'gro ba	yang_0 na_5 thams_8 cad_14 mkhyen_18 ba_25 kun_28 du_32 'gro_35 ba_40 
T02D1407:70b-10	phra mo gcig pu ste thugs kyi gsang ba la	phra_0 mo_5 gcig_8 pu_13 ste_16 thugs_20 kyi_26 gsang_30 ba_36 la_39 
T02D1407:70b-11	sogs pa mnyam pa nyid sgyu ma stong pa rang	sogs_0 ba_5 mnyam_8 ba_14 nyid_17 sgyu_22 ma_27 stong_30 ba_36 rang_39 
T02D1407:70b-12	bzhin sems kyi ngo bo de yid bzhin gyi nor	bzhin_0 sems_6 kyi_11 ngo_15 'bo_19 de_22 yid_25 bzhin_29 gyi_35 nor_39 
T02D1407:70b-13	bu rin po che lta bu bsam gyis mi khyab	bu_0 rin_3 po_7 che_10 lta_14 bu_18 bsam_21 gyis_26 mi_31 khyab_34 
T02D1407:70b-14	pa shes rab mchog ces bya bar bshad de gsang	ba_0 shes_3 rab_8 mchog_12 ces_18 byed_22 ba_26 'chad_30 de_36 gsang_39 
T02D1407:70b-15	ba zhes bya ba de ltar bshad do //	ba_0 zhes_3 byed_8 ba_12 de_15 ltar_18 'chad_23 do_29 
T02D1407:70b-16	mchog ces bya ba la /	mchog_0 ces_6 byed_10 ba_14 la_17 
T02D1407:70b-17	mchog gi don ni de nyid kyi chos kyi skur bshad do //	mchog_0 gi_6 don_9 ni_13 de_16 nyid_19 kyi_24 chos_28 kyi_33 skur_37 'chad_42 do_48 
T02D1407:70b-18	thams cad mkhyen pa'i ye shes la rnam par gsal ba ni 'dir dgyes par gsungs so //	thams_0 cad_6 mkhyen_10 ba_17 ye_22 shes_25 la_30 rnam_33 ba_38 gsal_42 ba_47 ni_50 'dir_53 dgyes_58 ba_64 gsungs_68 so_75 
T02D1407:70b-19	brtan pa dang g-yo ba'i dngos po thams cad kyi	brtan_0 ba_6 dang_9 g-yo_14 ba_19 dngos_24 po_30 thams_33 cad_39 kyi_43 
T02D1407:70b-20	rang gi ngo bo bsam gyis mi khyab pa lhan	rang_0 gi_5 ngo_8 'bo_12 bsam_15 gyis_20 mi_25 khyab_28 ba_34 lhan_37 
T02D1407:70b-21	cig skyes pa dga' ba sgron ma lta bu de	cig_0 skye_4 ba_10 dga'_13 ba_18 sgron_21 ma_27 lta_30 bu_34 de_37 
T02D1407:70b-22	nyid ni thams cad kyi bdag nyid de dbang po	nyid_0 ni_5 thams_8 cad_14 kyi_18 bdag_22 nyid_27 de_32 dbang_35 po_41 
T02D1407:70b-23	thams cad dang rnam par shes pa ni thams cad	thams_0 cad_6 dang_10 rnam_15 ba_20 shes_24 ba_29 ni_32 thams_35 cad_41 
T02D1407:70b-24	nas thams cad du sems te yid kyi rnam par	nas_0 thams_4 cad_10 du_14 sems_17 te_22 yid_25 kyi_29 rnam_33 ba_38 
T02D1407:70b-25	shes pa 'di nyid du gsungs te /	shes_0 ba_5 'di_8 nyid_12 du_17 gsungs_20 te_27 
T02D1407:70b-26	shes rab dang rtog pa dang blo zhes bshad do //	shes_0 rab_5 dang_9 rtogs_14 ba_19 dang_22 blo_27 zhes_31 'chad_36 do_42 
T02D1407:70b-27	rtag pa zhes pa ni 'das pa dang ma 'ongs	rtag_0 ba_5 zhes_8 ba_13 ni_16 'da'_19 ba_24 dang_27 ma_32 'ongs_35 
T02D1407:70b-28	pa dang de ltar gyi dus kyi bdag nyid can	ba_0 dang_3 de_8 ltar_11 gyi_16 dus_20 kyi_24 bdag_28 nyid_33 can_38 
T02D1407:70b-29	gyi mchog ste / de yang skye zhing 'jig pa dang /	gyi_0 mchog_4 ste_10 de_16 yang_19 skye_24 zhing_29 'jig_35 ba_40 dang_43 
T02D1407:70b-30	bral ba dang khyab pa nyid dang sku rdo rje	'bral_0 ba_5 dang_8 khyab_13 ba_19 nyid_22 dang_27 sku_32 rdo_36 rje_40 
T02D1407:70b-31	nyid dang rnam pa med pa nyid dang rtag tu	nyid_0 dang_5 rnam_10 ba_15 med_18 ba_22 nyid_25 dang_30 rtag_35 tu_40 
T02D1407:70b-32	gsal bar skye ba nyid dang dus thams cad pa	gsal_0 ba_5 skye_9 ba_14 nyid_17 dang_22 dus_27 thams_31 cad_37 ba_41 
T02D1407:70b-33	nyid do zhes gsungs par 'gyur ro //	nyid_0 do_5 zhes_8 gsungs_13 ba_20 'gyur_24 ro_30 
T02D1407:70b-34	bzhugs zhes pa ni dngos po thams cad dang sems	bzhugs_0 zhes_7 ba_12 ni_15 dngos_18 po_24 thams_27 cad_33 dang_37 sems_42 
T02D1407:70b-35	can thams cad kyi khams thams cad la dus thams	can_0 thams_4 cad_10 kyi_14 khams_18 thams_24 cad_30 la_34 dus_37 thams_41 
T02D1407:70b-36	cad du lus thams cad la sems kyi rgyun gyis	cad_0 du_4 lus_7 thams_11 cad_17 la_21 sems_24 kyi_29 rgyun_33 gyis_39 
T02D1407:70b-37	mnyam par khyab par bzhugs pa ste /	mnyam_0 ba_6 khyab_10 ba_16 bzhugs_20 ba_27 ste_30 
T02D1407:70b-38	'di ltar nyon mongs pa zad pa dang /	'di_0 ltar_4 nyon_9 mongs_14 ba_20 zad_23 ba_27 dang_30 
T02D1407:70b-39	bsam gyis mi khyab pa dang /	bsam_0 gyis_5 mi_10 khyab_13 ba_19 dang_22 
T02D1407:70b-40	dri ma med pa dang /	'dri_0 ma_4 med_7 ba_11 dang_14 
T02D1407:70b-41	bdag gi ba med pa dang /	bdag_0 gi_5 ba_8 med_11 ba_15 dang_18 
T02D1407:70b-42	rang bzhin stong pa dang /	rang_0 bzhin_5 stong_11 ba_17 dang_20 
T02D1407:70b-43	nam mkha' dang mnyam pa dang /	nam_0 mkha'_4 dang_10 mnyam_15 ba_21 dang_24 
T02D1407:70b-44	dngos po dang /	dngos_0 po_6 dang_9 
T02D1407:70b-45	dngos po med pa rnam par spangs pa dang /	dngos_0 po_6 med_9 ba_13 rnam_16 ba_21 spong_25 ba_32 dang_35 
T02D1407:70b-46	thog ma dang tha ma med pa dang zhi ba dang /	thogs_0 ma_5 dang_8 tha_13 ma_17 med_20 ba_24 dang_27 zhi_32 ba_36 dang_39 
T02D1407:70b-47	chos thams cad kyi dbang phyug tu sku gsal zhing thams cad kyi rang bzhin 'dzin pa dang /	chos_0 thams_5 cad_11 kyi_15 dbang_19 phyug_25 tu_31 sku_34 gsal_38 zhing_43 thams_49 cad_55 kyi_59 rang_63 bzhin_68 'dzin_74 ba_80 dang_83 
T02D1407:70b-48	bden pa gnyis mnyam pa'i gnas dang /	bden_0 ba_5 gnyis_8 mnyam_14 ba_20 gnas_25 dang_30 
T02D1407:71a-0	ji ltar shing gi gzhi la me'i sa bon khyab @71a * //	ji_0 ltar_3 shing_8 gi_14 gzhi_17 la_22 me_25 sa_30 bon_33 khyab_37 
T02D1407:71a-1	par gnas pa dang /	ba_0 gnas_4 ba_9 dang_12 
T02D1407:71a-2	ji ltar til la mar khu lta bur de bzhin	ji_0 ltar_3 til_8 la_12 mar_15 khu_19 lta_23 bur_27 de_31 bzhin_34 
T02D1407:71a-3	du khams thams cad la khyab par bzhugs pa'i phyag	du_0 khams_3 thams_9 cad_15 la_19 khyab_22 ba_28 bzhugs_32 ba_39 phyag_44 
T02D1407:71a-4	rgya chen po'ang rjes su rtogs pa ste /	rgya_0 chen_5 po_10 rjes_17 su_22 rtogs_25 ba_31 ste_34 
T02D1407:71a-5	'di dag gi dgongs pa ni de lta bu'o //	'di_0 'dag_4 gi_8 dgongs_11 ba_18 ni_21 de_24 lta_27 bu_31 
T02D1407:71a-6	mkha' 'gro kun dngos sems dpa' ste /	mkha'_0 'gro_6 kun_11 dngos_15 sems_21 dpa'_26 ste_31 
T02D1407:71a-7	zhes pa la /	zhes_0 ba_5 la_8 
T02D1407:71a-8	mkha' 'gro kun dngos zhes pa'i sgra ni rab tu gtum mo la sogs par gsungs so //	mkha'_0 'gro_6 kun_11 dngos_15 zhes_21 ba_26 sgra_31 ni_36 rab_39 tu_43 'thum_46 mo_51 la_54 sogs_57 ba_62 gsungs_66 so_73 
T02D1407:71a-9	de'i rdul phra rab yongs su bsdus pa'i rang gi ngo bo'i phyir dngos zhes so //	de_0 rdul_5 phra_10 rab_15 yongs_19 su_25 sdud_28 ba_34 rang_39 gi_44 ngo_47 'bo_51 phyir_56 dngos_62 zhes_68 so_73 
T02D1407:71a-10	de gang zhe na /	de_0 gang_3 zhe_8 na_12 
T02D1407:71a-11	sems dpa' zhes pa ste /	sems_0 dpa'_5 zhes_10 ba_15 ste_18 
T02D1407:71a-12	brtan pa dang g-yo ba gnyis kyis phye bas na'o //	brtan_0 ba_6 dang_9 g-yo_14 ba_19 gnyis_22 kyis_28 'byed_33 ba_38 na_42 
T02D1407:71a-13	'di skad du yang /	'di_0 skad_4 du_9 yang_12 
T02D1407:71a-14	g-yo ba sems can zhes byar bshad //	g-yo_0 ba_5 sems_8 can_13 zhes_17 byar_22 'chad_27 
T02D1407:71a-15	brtan pa la sogs snod nyid do //	brtan_0 ba_6 la_9 sogs_12 snod_17 nyid_22 do_27 
T02D1407:71a-16	zhes pa'i tshig 'di'o //	zhes_0 ba_5 tshig_10 'di_16 
T02D1407:71a-17	rdo rje sems dpa' bde ba'i mchog //	rdo_0 rje_4 sems_8 dpa'_13 bde_18 ba_22 mchog_27 
T02D1407:71a-18	ces pa la rdo rje ni mi phyed pa ste /	ces_0 ba_4 la_7 rdo_10 rje_14 ni_18 mi_21 phyed_24 ba_30 ste_33 
T02D1407:71a-19	de rdo rje dang 'dra ba'i chos nyid kyis na gzhan 'bigs pa nyid kyi phyir ro //	de_0 rdo_3 rje_7 dang_11 'dra_16 ba_21 chos_26 nyid_31 kyis_36 na_41 gzhan_44 'bigs_50 ba_56 nyid_59 kyi_64 phyir_68 ro_74 
T02D1407:71a-20	sems dpa' ni bde ba'i dngos po ste dngos po thams cad gcig pa nyid du'o //	sems_0 dpa'_5 ni_10 bde_13 ba_17 dngos_22 po_28 ste_31 dngos_35 po_41 thams_44 cad_50 gcig_54 ba_59 nyid_62 du_67 
T02D1407:71a-21	rdo rje sems dpa' zhes pas [?] rdo rje dang sems dpa' ni rdo rje sems dpa'o //	rdo_0 rje_4 sems_8 dpa'_13 zhes_18 ba_23 rdo_31 rje_35 dang_39 sems_44 dpa'_49 ni_54 rdo_57 rje_61 sems_65 dpa_70 
T02D1407:71a-22	bde ba'i ngo bo dang bde ba ma yin pa'i	bde_0 ba_4 ngo_9 'bo_13 dang_16 bde_21 ba_25 ma_28 yin_31 ba_35 
T02D1407:71a-23	ngo bo gnyis ka bde ba ste rdo rje sems	ngo_0 'bo_4 gnyis_7 ka_13 bde_16 ba_20 ste_23 rdo_27 rje_31 sems_35 
T02D1407:71a-24	dpar bshad do // 'di ni rang 'byung bcom ldan dpal //	dpar_0 'chad_5 do_11 'di_17 ni_21 rang_24 'byung_29 'joms_36 ldan_41 dpal_46 
T02D1407:71a-25	zhes pa la /	zhes_0 ba_5 la_8 
T02D1407:71a-26	'di ni zhes pa ni nges par gzung ba'o //	'di_0 ni_4 zhes_7 ba_12 ni_15 nges_18 ba_23 gzung_27 ba_33 
T02D1407:71a-27	de nyid 'di ltar brtan pa dang g-yo ba'i 'gro	de_0 nyid_3 'di_8 ltar_12 brtan_17 ba_23 dang_26 g-yo_31 ba_36 'gro_41 
T02D1407:71a-28	ba ma lus par rang nyid 'gyur ba ni rang	ba_0 ma_3 lus_6 ba_10 rang_14 nyid_19 'gyur_24 ba_30 ni_33 rang_36 
T02D1407:71a-29	'byung bcom ldan no //	'byung_0 'joms_7 ldan_12 no_17 
T02D1407:71a-30	bcom ldan zhes pa la bcom pa 'di la yod	'joms_0 ldan_5 zhes_10 ba_15 la_18 'joms_21 ba_26 'di_29 la_33 yod_36 
T02D1407:71a-31	pas na bcom ldan te bcom ldan gyi sgra ni	ba_0 na_4 'joms_7 ldan_12 te_17 'joms_20 ldan_25 gyi_30 sgra_34 ni_39 
T02D1407:71a-32	dbang phyug la sogs pa drug dang ldan pas na'o	dbang_0 phyug_6 la_12 sogs_15 ba_20 drug_23 dang_28 ldan_33 ba_38 na_42 
T02D1407:71a-33	// yang na bcom pas na bcom ldan du gsungs te /	yang_3 na_8 'joms_11 ba_16 na_20 'joms_23 ldan_28 du_33 gsungs_36 te_43 
T02D1407:71a-34	nyon mongs pa'i bdud la sogs pa bcom pa ste /	nyon_0 mongs_5 ba_11 bdud_16 la_21 sogs_24 ba_29 'joms_32 ba_37 ste_40 
T02D1407:71a-35	shes rab kyis nyon mongs pa bcom pa'o //	shes_0 rab_5 kyis_9 nyon_14 mongs_19 ba_25 'joms_28 ba_33 
T02D1407:71a-36	de'i phyir na nyon mongs pa shes rab kyis bcom pa zhes gsungs so //	de_0 phyir_5 na_11 nyon_14 mongs_19 ba_25 shes_28 rab_33 kyis_37 'joms_42 ba_47 zhes_50 gsungs_55 so_62 
T02D1407:71a-37	dpa' zhes pa ni nyon mongs pa dang bral ba nyid kyi phyir na'o //	dpa'_0 zhes_5 ba_10 ni_13 nyon_16 mongs_21 ba_27 dang_30 'bral_35 ba_40 nyid_43 kyi_48 phyir_52 na_58 
T02D1407:71a-38	mkha' 'gro ma'i dra ba zhes pa ni kun bsdus pa'o //	mkha'_0 'gro_6 ma_11 'dra_16 ba_20 zhes_23 ba_28 ni_31 kun_34 sdud_38 ba_44 
T02D1407:71a-39	rtsa'i 'khor lo'i gzugs kun rdzob pa ni sdom pa ste bde ba'i mchog la gsungs so //	rtsa_0 'khor_7 lo_13 gzugs_18 kun_24 rdzob_28 ba_34 ni_37 sdom_40 ba_45 ste_48 bde_52 ba_56 mchog_61 la_67 gsungs_70 so_77 
T02D1407:71a-40	yang na phyi ma las kyang zhes pa la sogs pa ni mchog gi khams bcu drug ste /	yang_0 na_5 phyi_8 ma_13 las_16 kyang_20 zhes_26 ba_31 la_34 sogs_37 ba_42 ni_45 mchog_48 gi_54 khams_57 'chu_63 drug_67 ste_72 
T02D1407:71b-0	de'i phyir na phyi ma zhes pa ni dpa' @71b bo nyi shu rtsa bzhi la bya'o //	de_0 phyir_5 na_11 phyi_14 ma_19 zhes_22 ba_27 ni_30 dpa'_33 'bo_43 nyi_46 shu_50 rtsa_54 bzhi_59 la_64 byed_67 
T02D1407:71b-1	de'i dra ba ni tshogs so //	de_0 'dra_5 ba_9 ni_12 tshogs_15 so_22 
