T02D1250:210b-0	@210b # // rgya gar skad du //	rgya_11 gar_16 skad_20 du_25 
T02D1250:210b-1	shr'i he badzra s'a dha nam /	shr_0 he_6 badzra_9 s_16 dha_20 nam_24 
T02D1250:210b-2	bod skad du /	'bod_0 skad_4 du_9 
T02D1250:210b-3	dpal kye'i rdo rje'i sgrub thabs /	dpal_0 kye_5 rdo_11 rje_15 sgrub_21 thabs_27 
T02D1250:211a-0	dpal kye @211a * //	dpal_0 kye_5 
T02D1250:211a-1	rdo rje la phyag 'tshal lo //	rdo_0 rje_4 la_8 phyag_11 'tshal_17 lo_24 
T02D1250:211a-2	dpal ldan dgyes pa'i rdo rje dang //	dpal_0 ldan_5 dgyes_10 ba_16 rdo_21 rje_25 dang_29 
T02D1250:211a-3	sgo bzhir gnas pa'i goo r'i sogs //	sgo_0 bzhir_4 gnas_10 ba_15 goo_20 r_24 sogs_28 
T02D1250:211a-4	mtshams kyi skul byed ma bzhi la //	mtshams_0 kyi_8 skul_12 byed_17 ma_22 bzhi_25 la_30 
T02D1250:211a-5	sgo gsum dad pas phyag 'tshal te //	sgo_0 gsum_4 dad_9 ba_13 phyag_17 'tshal_23 te_30 
T02D1250:211a-6	rnal 'byor blo zhan don du ni //	rnal_0 'byor_5 blo_11 zhan_15 don_20 du_24 ni_27 
T02D1250:211a-7	bdag gis dgyes pa'i rdo rje yi //	bdag_0 gis_5 dgyes_9 ba_15 rdo_20 rje_24 yi_28 
T02D1250:211a-8	zhal gcig phyag gnyis sgrub thabs 'di //	zhal_0 gcig_5 phyag_10 gnyis_16 sgrub_22 thabs_28 'di_34 
T02D1250:211a-9	mi nus bzhin du brtsam par bya //	mi_0 nus_3 bzhin_7 du_13 brtsam_16 ba_23 byed_27 
T02D1250:211a-10	slob dpon de nyid thos pa dang //	slob_0 dpon_5 de_10 nyid_13 thos_18 ba_23 dang_26 
T02D1250:211a-11	dbang rnams tshul bzhin mnos pa dang //	dbang_0 rnams_6 tshul_12 bzhin_18 mno_24 ba_29 dang_32 
T02D1250:211a-12	bsgom dang cho ga mkhas pa dang //	bsgom_0 dang_6 cho_11 ga_15 mkhas_18 ba_24 dang_27 
T02D1250:211a-13	bka' yi gnang ba thob pa yis //	bka'_0 yi_5 gnang_8 ba_14 'thob_17 ba_22 yis_25 
T02D1250:211a-14	dngos grub 'dod pa'i sems kyis su //	dngos_0 'grub_6 'dod_11 ba_16 sems_21 kyis_26 su_31 
T02D1250:211a-15	dur khrod dang ni lha rten dang //	dur_0 khrod_4 dang_10 ni_15 lha_18 rten_22 dang_27 
T02D1250:211a-16	rang gi khyim dang chu 'gram du //	rang_0 gi_5 khyim_8 dang_14 chu_19 'grams_23 du_29 
T02D1250:211a-17	'jigs pa'i sems med bsam gtan bya //	'jigs_0 ba_6 sems_11 med_16 bsam_20 gtan_25 byed_30 
T02D1250:211a-18	dran thar rnam pa bdun dag gis //	dran_0 thar_5 rnam_10 ba_15 bdun_18 'dag_23 gis_27 
T02D1250:211a-19	lus sogs bdun po dag nas ni //	lus_0 sogs_4 bdun_9 po_14 'dag_17 nas_21 ni_25 
T02D1250:211a-20	skad cig ma yi rnal 'byor mas //	skad_0 cig_5 ma_9 yi_12 rnal_15 'byor_20 mas_26 
T02D1250:211a-21	rdo rje sems dpa'i lus byas te //	rdo_0 rje_4 sems_8 dpa_13 lus_19 byed_23 te_28 
T02D1250:211a-22	snying gar padma 'dab brgyad bsgom //	snying_0 gar_7 padma_11 'dab_17 brgyad_22 bsgom_29 
T02D1250:211a-23	de steng nyid dkyil h'u% bsam ste //	de_0 steng_3 nyid_9 dkyil_14 h%_20 bsam_25 ste_30 
T02D1250:211a-24	'bar ba me yis rab bsregs pas //	'bar_0 ba_5 me_8 yis_11 rab_15 bsregs_19 ba_26 
T02D1250:211a-25	ye shes mig dang ldan bya ste //	ye_0 shes_3 mig_8 dang_12 ldan_17 byed_22 ste_26 
T02D1250:211a-26	sngon du dgyes pa'i rdo rje dang //	sngon_0 du_6 dgyes_9 ba_15 rdo_20 rje_24 dang_28 
T02D1250:211a-27	lha mo brgyad dag mngon par mthong //	lha_0 mo_4 brgyad_7 'dag_14 mngon_18 ba_24 mthong_28 
T02D1250:211a-28	phyi dang nang dang bla med pa'i //	phyi_0 dang_5 nang_10 dang_15 bla_20 med_24 ba_28 
T02D1250:211a-29	mchod pa rnams kyis yang dag mchod //	mchod_0 ba_6 rnams_9 kyis_15 yang_20 'dag_25 mchod_29 
T02D1250:211a-30	sngon 'gro rjes su phyag byas te //	sngon_0 'gro_6 rjes_11 su_16 phyag_19 byed_25 te_30 
T02D1250:211a-31	sdig pa byas pa bshags pa dang //	sdig_0 ba_5 byed_8 ba_13 'chags_16 ba_23 dang_26 
T02D1250:211a-32	phyis mi byed par sdom pa gzung //	'byid_0 mi_6 byed_9 ba_14 sdom_18 ba_23 gzung_26 
T02D1250:211a-33	dge ba byas byed yi rang bya //	dge_0 ba_4 byed_7 byed_12 yi_17 rang_20 byed_25 
T02D1250:211a-34	sangs rgyas dgyes pa'i rdo rje dang //	sangs_0 rgya_6 dgyes_12 ba_18 rdo_23 rje_27 dang_31 
T02D1250:211a-35	de gsungs pa yi chos rnams dang //	de_0 gsungs_3 ba_10 yi_13 chos_16 rnams_21 dang_27 
T02D1250:211a-36	ma brgyad lha mo dge 'dun la //	ma_0 brgyad_3 lha_10 mo_14 dge_17 'dun_21 la_26 
T02D1250:211a-37	bdag ni dang bas skyabs su mchi //	bdag_0 ni_5 dang_8 ba_13 skyob_17 su_24 mchi_27 
T02D1250:211a-38	byang chub sems kyang bdag gis bskyed //	byang_0 chub_6 sems_11 kyang_16 bdag_22 gis_27 skyed_31 
T02D1250:211a-39	theg pa chen po la gnas bgyi //	theg_0 ba_5 chen_8 po_13 la_16 gnas_19 bgyid_24 
T02D1250:211a-40	kun gyi don ni bdag nyid dbul //	kun_0 gyi_4 don_8 ni_12 bdag_15 nyid_20 'bul_25 
T02D1250:211a-41	de yang rgya cher bsngo bar bgyi //	de_0 yang_3 rgya_8 cher_13 sngo_18 ba_24 bgyid_28 
T02D1250:211a-42	dang po byams pa bsgom par bya //	dang_0 po_5 byams_8 ba_14 bsgom_17 ba_23 byed_27 
T02D1250:211a-43	gnyis pa snying rje bye brag bsgom //	gnyis_0 ba_6 snying_9 rje_16 'bye_20 brag_24 bsgom_29 
T02D1250:211a-44	gsum pa dga' ba bsgom pa ste //	gsum_0 ba_5 dga'_8 ba_13 bsgom_16 ba_22 ste_25 
T02D1250:211a-45	kun gyi tha mar btang snyoms so //	kun_0 gyi_4 tha_8 mar_12 gtong_16 snyom_22 so_29 
T02D1250:211a-46	dang po stong pa'i byang chub sems //	dang_0 po_5 stong_8 ba_14 byang_19 chub_25 sems_30 
T02D1250:211a-47	gnyis pa la ni sa bon 'dus //	gnyis_0 ba_6 la_9 ni_12 sa_15 bon_18 'du_22 
T02D1250:211a-48	gsum pa la ni gzugs rdzogs te //	gsum_0 ba_5 la_8 ni_11 gzugs_14 rdzogs_20 te_27 
T02D1250:211a-49	bzhi pa la ni yig 'bru dgod //	bzhi_0 ba_5 la_8 ni_11 yig_14 'bru_18 'god_23 
T02D1250:211a-50	de 'og stong pa'i byang chub ni //	de_0 'og_3 stong_7 ba_13 byang_18 chub_24 ni_29 
T02D1250:211a-51	phyi dang nang med stong smin no //	phyi_0 dang_5 nang_10 med_15 stong_19 smin_25 no_30 
T02D1250:211a-52	bsams nas de nyid kho na yi //	bsams_0 nas_6 de_10 nyid_13 kho_18 na_22 yi_25 
T02D1250:211b-0	lus su yang dag @211b bsgom par bya //	lus_0 su_4 yang_7 'dag_12 bsgom_22 ba_28 byed_32 
T02D1250:211b-1	aom sh'u n+ya t'a dznya' na badzra sa bh'a ba a'a tma ko&amp; ham /	aom_0 sh_4 n_9 ya_11 t_14 dznya'_18 na_25 badzra_28 sa_35 bh_38 ba_43 a_46 tma_50 ko&amp;_54 ham_62 
T02D1250:211b-2	sngon gyi smon lam rjes dran na //	sngon_0 gyi_6 smon_10 lam_15 rjes_19 dran_24 na_29 
T02D1250:211b-3	de kho na nyid las langs nas //	de_0 kho_3 na_7 nyid_10 las_15 ldang_19 nas_25 
T02D1250:211b-4	'og phyogs padma 'dab brgyad la //	'og_0 phyogs_4 padma_11 'dab_17 brgyad_22 la_29 
T02D1250:211b-5	de steng nyi ma h'u% bsams pas //	de_0 steng_3 nyi_9 ma_13 h%_16 bsams_21 ba_27 
T02D1250:211b-6	h'u% las rdo rje'i sa gzhir gyur //	h%_0 las_5 rdo_9 rje_13 sa_19 gzhir_22 gyur_28 
T02D1250:211b-7	de steng bgegs skrad h'u% bsams pa'i //	de_0 steng_3 bgegs_9 skrad_15 h%_21 bsams_26 ba_32 
T02D1250:211b-8	raksha sgra dang ldan pa yis //	raksha_0 sgra_7 dang_12 ldan_17 ba_22 yis_25 
T02D1250:211b-9	tshogs kyi bgegs rnams sel bar byed //	tshogs_0 kyi_7 bgegs_11 rnams_17 sel_23 ba_27 byed_31 
T02D1250:211b-10	slar 'dus rdo rje'i gur du gyur //	slar_0 'du_5 rdo_10 rje_14 gur_20 du_24 gyur_27 
T02D1250:211b-11	bla re yang ni bsgom par bya //	bla_0 re_4 yang_7 ni_12 bsgom_15 ba_21 byed_25 
T02D1250:211b-12	steng 'og phyogs med rdo rje'i dbyings //	steng_0 'og_6 phyogs_10 med_17 rdo_21 rje_25 dbyings_31 
T02D1250:211b-13	sgo yi dbyibs 'dra nyid du bsgom //	sgo_0 yi_4 dbyibs_7 'dra_14 nyid_19 du_24 bsgom_27 
T02D1250:211b-14	ae gzugs bdag med ma 'dra bar //	ae_0 gzugs_3 bdag_9 med_14 ma_18 'dra_21 ba_26 
T02D1250:211b-15	bsams te de las 'byung 'gyur ba'i //	bsams_0 te_6 de_9 las_12 'byung_16 'gyur_23 ba_29 
T02D1250:211b-16	chos kyi 'byung gnas de dbyibs ni //	chos_0 kyi_5 'byung_9 gnas_16 de_21 dbyibs_24 ni_31 
T02D1250:211b-17	gru gsum gyen dkar yang dag ldan //	gru_0 gsum_4 gyen_9 dkar_14 yang_19 'dag_24 ldan_28 
T02D1250:211b-18	de yi dbus su bsam pa ni //	de_0 yi_3 dbus_6 su_11 bsam_14 ba_19 ni_22 
T02D1250:211b-19	ya% dang ra% dang ba% dang la% //	ya%_0 dang_4 ra%_9 dang_13 ba%_18 dang_22 la%_27 
T02D1250:211b-20	de steng bdag nyid rnam shes ni //	de_0 steng_3 bdag_9 nyid_14 rnam_19 shes_24 ni_29 
T02D1250:211b-21	ao% ba% nyid ni yang dag gnas //	ao%_0 ba%_4 nyid_8 ni_13 yang_16 'dag_21 gnas_25 
T02D1250:211b-22	spro dang bsdu ba'i sbyor ba yis //	spro_0 dang_5 sdud_10 ba_15 sbyor_20 ba_26 yis_29 
T02D1250:211b-23	gzhal yas khang du gyur pa ste //	'jal_0 yas_6 khang_10 du_16 gyur_19 ba_24 ste_27 
T02D1250:211b-24	thog gcig pa ru bsam par bya //	thogs_0 gcig_5 ba_10 ru_13 bsam_16 ba_21 byed_25 
T02D1250:211b-25	ngos bzhi pa la sgo bzhi pa //	ngos_0 bzhi_5 ba_10 la_13 sgo_16 bzhi_20 ba_25 
T02D1250:211b-26	ka ba brgyad dang yang dag ldan //	ka_0 ba_3 brgyad_6 dang_13 yang_18 'dag_23 ldan_27 
T02D1250:211b-27	rta babs bzhis kyang rnam par mdzes //	rta_0 'bab_4 bzhis_9 kyang_15 rnam_21 ba_26 mdzes_30 
T02D1250:211b-28	dra ba dra phyed kyis brgyan pa //	'dra_0 ba_4 'dra_7 phyed_11 kyis_17 rgyan_22 ba_29 
T02D1250:211b-29	lha mo brgyad kyi 'od kyis kyang //	lha_0 mo_4 brgyad_7 kyi_14 'od_18 kyis_22 kyang_27 
T02D1250:211b-30	gsal bar lha yi rnam par byas //	gsal_0 ba_5 lha_9 yi_13 rnam_16 ba_21 byed_25 
T02D1250:211b-31	de nas padma 'dab brgyad pa ;	de_0 nas_3 padma_7 'dab_13 brgyad_18 ba_25 
T02D1250:211b-32	/ kha dog dmar po nyi ma gnas //	kha_2 dog_6 dmar_10 po_15 nyi_18 ma_22 gnas_25 
T02D1250:211b-33	de steng bdud bzhi rnam par brgyan //	de_0 steng_3 bdud_9 bzhi_14 rnam_19 ba_24 rgyan_28 
T02D1250:211b-34	tshangs pa dbang po nye dbang drag //	tshangs_0 ba_8 dbang_11 po_17 nye_20 dbang_24 drag_30 
T02D1250:211b-35	shar sgo la sogs bzhir gnas pa //	'char_0 sgo_5 la_9 sogs_12 bzhir_17 gnas_23 ba_28 
T02D1250:211b-36	tshangs pa dang ni dbang po dang //	tshangs_0 ba_8 dang_11 ni_16 dbang_19 po_25 dang_28 
T02D1250:211b-37	nye dbang dang ni drag po ste //	nye_0 dbang_4 dang_10 ni_15 drag_18 po_23 ste_26 
T02D1250:211b-38	rim pa bzhin du gnas pa'o //	rim_0 ba_4 bzhin_7 du_13 gnas_16 ba_21 
T02D1250:211b-39	mtshams bzhi por ni shes bya ba //	mtshams_0 bzhi_8 por_13 ni_17 shes_20 byed_25 ba_29 
T02D1250:211b-40	gshin rje dang ni nor bdag dang //	gshin_0 rje_6 dang_10 ni_15 nor_18 bdag_22 dang_27 
T02D1250:211b-41	bden bral dang ni thags bzangs ris //	bden_0 'bral_5 dang_10 ni_15 thags_18 bzangs_24 ris_31 
T02D1250:211b-42	pukka s'i sogs gdan du brtag / de ltar pho brang bye brag rdzogs //	pukka_0 s_6 sogs_10 gdan_15 du_20 rtog_23 de_31 ltar_34 pho_39 brang_43 'bye_49 brag_53 rdzogs_58 
T02D1250:211b-43	de bzhin gshegs pa 'byung ba yi //	de_0 bzhin_3 gshegs_9 ba_16 'byung_19 ba_26 yi_29 
T02D1250:211b-44	nga rgyal 'di yis bya ba ste //	nga_0 rgyal_4 'di_10 yis_14 byed_18 ba_22 ste_25 
T02D1250:211b-45	nga 'am bdag tu bsam par bya //	nga_0 'am_4 bdag_8 tu_13 bsam_16 ba_21 byed_25 
T02D1250:211b-46	aom sarba ta th'a ga ta badzra sva bh'a ba a'a tma kom&amp; ham /	aom_0 sarba_4 ta_10 th_13 ga_18 ta_21 badzra_24 sva_31 bh_35 ba_40 a_43 tma_47 kom&amp;_51 ham_60 
T02D1250:211b-47	dbus kyi gzhi steng a'a li ni //	dbus_0 kyi_5 gzhi_9 steng_14 a_20 li_24 ni_27 
T02D1250:211b-48	bcu drug rim pa gnyis shes bya //	'chu_0 drug_4 rim_9 ba_13 gnyis_16 shes_22 byed_27 
T02D1250:211b-49	de 'gyur zla ba gnyis pa ni //	de_0 'gyur_3 zla_9 ba_13 gnyis_16 ba_22 ni_25 
T02D1250:211b-50	me long lta bu'i ye shes so //	me_0 long_3 lta_8 bu_12 ye_17 shes_20 so_25 
T02D1250:211b-51	de steng yang dag bsam pa ni //	de_0 steng_3 yang_9 'dag_14 bsam_18 ba_23 ni_26 
T02D1250:211b-52	k'a li bzhi bcu nyis 'gyur las //	k_0 li_4 bzhi_7 'chu_12 nyis_16 'gyur_21 las_27 
T02D1250:211b-53	rta bdun pa ru gyur pa ste //	rta_0 bdun_4 ba_9 ru_12 gyur_15 ba_20 ste_23 
T02D1250:211b-54	mnyam pa nyid kyi ye shes so //	mnyam_0 ba_6 nyid_9 kyi_14 ye_18 shes_21 so_26 
T02D1250:212a-0	de @212a * //	de_0 
T02D1250:212a-1	dbus h'u% las byung ba ni //	dbus_0 h%_5 las_10 'byung_14 ba_20 ni_23 
T02D1250:212a-2	rdo rje nag po rtse lnga pa //	rdo_0 rje_4 nag_8 po_12 rtse_15 lnga_20 ba_25 
T02D1250:212a-3	lte ba h'u% gis mtshan pa ste //	lte_0 ba_4 h%_7 gis_12 mtshan_16 ba_23 ste_26 
T02D1250:212a-4	so sor rtog pa'i ye shes so //	so_0 sor_3 rtogs_7 ba_12 ye_17 shes_20 so_25 
T02D1250:212a-5	de las 'od 'phros sems can don //	de_0 las_3 'od_7 'phro_11 sems_18 can_23 don_27 
T02D1250:212a-6	byas te bzhi po nyid la bstim //	byed_0 te_5 bzhi_8 po_13 nyid_16 la_21 stim_24 
T02D1250:212a-7	'od kyi gong bur gyur pa ni //	'od_0 kyi_4 gong_8 bur_13 gyur_17 ba_22 ni_25 
T02D1250:212a-8	bya ba nan tan ye shes so //	byed_0 ba_4 nan_7 tan_11 ye_15 shes_18 so_23 
T02D1250:212a-9	de las thig le brgyad chad de //	de_0 las_3 thig_7 le_12 brgyad_15 'chad_22 de_27 
T02D1250:212a-10	ga% dang tsa% dang ba% dang gha% //	ga%_0 dang_4 tsa%_9 dang_14 ba%_19 dang_23 gha%_28 
T02D1250:212a-11	pa% dang sa% dang la% dang da% //	pa%_0 dang_4 sa%_9 dang_13 la%_18 dang_22 da%_27 
T02D1250:212a-12	zla ba nyi ma yang dag ldan //	zla_0 ba_4 nyi_7 ma_11 yang_14 'dag_19 ldan_23 
T02D1250:212a-13	sa bon brgyad las gyur pa ni //	sa_0 bon_3 brgyad_7 las_14 gyur_18 ba_23 ni_26 
T02D1250:212a-14	gri dang rde'u chung rus sbal sbrul //	gri_0 dang_4 rde_9 chung_15 rus_21 sbal_25 sbrul_30 
T02D1250:212a-15	seng ge dge slong 'khor lo dang //	seng_0 ge_5 dge_8 slong_12 'khor_18 lo_24 dang_27 
T02D1250:212a-16	rdo rje la sogs rim par skyes //	rdo_0 rje_4 la_8 sogs_11 rim_16 ba_20 skye_24 
T02D1250:212a-17	goo r'i shar gyi sgo na gnas //	goo_0 r_4 'char_8 gyi_13 sgo_17 na_21 gnas_24 
T02D1250:212a-18	tsoo r'i lto yi sgo na gnas //	tsoo_0 r_5 lto_9 yi_13 sgo_16 na_20 gnas_23 
T02D1250:212a-19	nub kyi sgo ru be tt'a l'i //	nub_0 kyi_4 sgo_8 ru_12 be_15 tt_18 l_23 
T02D1250:212a-20	byang gi sgo ru gha sma r'i //	byang_0 gi_6 sgo_9 ru_13 gha_16 sma_20 r_24 
T02D1250:212a-21	pukka s'i ni dbang ldan du //	pukka_0 s_6 ni_10 dbang_13 ldan_19 du_24 
T02D1250:212a-22	ri khrod ma ni byin za'i grvar //	ri_0 khrod_3 ma_9 ni_12 byin_15 za_20 grvar_25 
T02D1250:212a-23	gtum mo bden bral la gnas te //	'thum_0 mo_5 bden_8 'bral_13 la_18 gnas_21 te_26 
T02D1250:212a-24	g-yung mo 'di ru rlung na gnas //	g-yung_0 mo_7 'di_10 ru_14 rlung_17 na_23 gnas_26 
T02D1250:212a-25	lha mo bskyed pa rdzogs nas su //	lha_0 mo_4 skyed_7 ba_14 rdzogs_17 nas_24 su_28 
T02D1250:212a-26	gtso bo 'od kyi gong bu la //	gtso_0 'bo_5 'od_8 kyi_12 gong_16 bu_21 la_24 
T02D1250:212a-27	lha mos bdag po med mthong nas //	lha_0 mos_4 bdag_8 po_13 med_16 mthong_20 nas_27 
T02D1250:212a-28	gong bu mchog la gsol pa gdab //	gong_0 bu_5 mchog_8 la_14 gsol_17 ba_22 gdab_25 
T02D1250:212a-29	snying rje yid kyis bcom ldan bzhengs //	snying_0 rje_7 yid_11 kyis_15 'joms_20 ldan_25 bzhengs_30 
T02D1250:212a-30	pukka s'i ni bdag la skyobs //	pukka_0 s_6 ni_10 bdag_13 la_18 skyobs_21 
T02D1250:212a-31	stong pa'i ting 'dzin spangs nas ni //	stong_0 ba_6 ting_11 'dzin_16 spong_22 nas_29 ni_33 
T02D1250:212a-32	bdag la 'dod pa'i bde ba mdzod //	bdag_0 la_5 'dod_8 ba_13 bde_18 ba_22 mdzod_25 
T02D1250:212a-33	khyod mi bzhugs na bdag 'gum pas //	khyod_0 mi_6 bzhugs_9 na_16 bdag_19 'gum_24 ba_29 
T02D1250:212a-34	stong pa'i rang bzhin yangs spangs te //	stong_0 ba_6 rang_11 bzhin_16 yangs_22 spong_28 te_35 
T02D1250:212a-35	ri khrod ma 'bras grub par ni //	ri_0 khrod_3 ma_9 'bras_12 'grub_18 ba_23 ni_27 
T02D1250:212a-36	kye yi rdo rje khyod bzhengs shig / jig rten phyir smon 'dod pa'i gtso //	kye_0 yi_4 rdo_7 rje_11 khyod_15 bzhengs_21 shig_29 rten_40 phyir_45 smon_51 'dod_56 ba_61 gtso_66 
T02D1250:212a-37	ci phyir stong pa nyid la bzhugs //	ci_0 phyir_3 stong_9 ba_15 nyid_18 la_23 bzhugs_26 
T02D1250:212a-38	khyod mi bzhugs na phyogs mi khums //	khyod_0 mi_6 bzhugs_9 na_16 phyogs_19 mi_26 'khum_29 
T02D1250:212a-39	gtum mo bdag ni gsol ba 'debs //	'thum_0 mo_5 bdag_8 ni_13 gsol_16 ba_21 'debs_24 
T02D1250:212a-40	g-yung mo bdag ni yid rmongs pas //	g-yung_0 mo_7 bdag_10 ni_15 yid_18 rmongs_22 ba_29 
T02D1250:212a-41	snying rje rgyun chad ma mdzad par //	snying_0 rje_7 rgyun_11 'chad_17 ma_22 mdzad_25 ba_31 
T02D1250:212a-42	khyod kyi bdag ni thugs 'tshal kyis //	khyod_0 kyi_6 bdag_10 ni_15 thugs_18 'tshal_24 kyis_31 
T02D1250:212a-43	mig 'phrul lta bur khyod bzhengs shig / bskul ba'i glu'o //	mig_0 'phrul_4 lta_11 bur_15 khyod_19 bzhengs_25 shig_33 skul_40 ba_46 glu_51 
T02D1250:212a-44	bskul bas sngon gyi byang chub ni //	skul_0 ba_6 sngon_10 gyi_16 byang_20 chub_26 ni_31 
T02D1250:212a-45	smon lam rjes su dran te bzhengs //	smon_0 lam_5 rjes_9 su_14 dran_17 te_22 bzhengs_25 
T02D1250:212a-46	zhal gcig phyag gnyis nag po chen //	zhal_0 gcig_5 phyag_10 gnyis_16 nag_22 po_26 chen_29 
T02D1250:212a-47	gcer bu spyan gsum mche ba gtsigs //	bcer_0 bu_5 spyan_8 gsum_14 mche_19 ba_24 gtsigs_27 
T02D1250:212a-48	phyag rgya lnga dang yang dag ldan //	phyag_0 rgya_6 lnga_11 dang_16 yang_21 'dag_26 ldan_30 
T02D1250:212a-49	sna tshogs rdo rje spyi bor gnas //	sna_0 tshogs_4 rdo_11 rje_15 spyi_19 'bor_24 gnas_28 
T02D1250:212a-50	g-yas na rdo rje rtse lnga 'dzin //	g-yas_0 na_6 rdo_9 rje_13 rtse_17 lnga_22 'dzin_27 
T02D1250:212a-51	g-yon pa na ni thod pa 'dzin //	g-yon_0 ba_6 na_9 ni_12 thod_15 ba_20 'dzin_23 
T02D1250:212a-52	zhabs kyis bdud bzhi rnam par mnan //	zhabs_0 kyis_6 bdud_11 bzhi_16 rnam_21 ba_26 gnon_30 
T02D1250:212a-53	brkyang bskum tshul du gnas pa'o //	rkyong_0 skum_8 tshul_14 du_20 gnas_23 ba_28 
T02D1250:212a-54	goo r'i kha dog nag mo ste //	goo_0 r_4 kha_8 dog_12 nag_16 mo_20 ste_23 
T02D1250:212b-0	tsoo @212b r'i kha dog btsod dang mtshungs //	tsoo_0 r_11 kha_15 dog_19 btsod_23 dang_29 mtshungs_34 
T02D1250:212b-1	ro langs ma ni gser bsregs mdog / za phod ma ni margat mtshungs //	ro_0 ldang_3 ma_9 ni_12 gser_15 bsregs_20 mdog_27 za_34 phod_37 ma_42 ni_45 margat_48 mtshungs_55 
T02D1250:212b-2	sbos mo'i mdog ni sngon mo'o //	sbo_0 mo_5 mdog_10 ni_15 sngon_18 mo_24 
T02D1250:212b-3	ri khrod ma ni zla nor 'od //	ri_0 khrod_3 ma_9 ni_12 zla_15 nor_19 'od_23 
T02D1250:212b-4	gtum mo nam mkha' ljang gu ste //	'thum_0 mo_5 nam_8 mkha'_12 ljang_18 gu_24 ste_27 
T02D1250:212b-5	g-yung mo sna tshogs pa ru 'dod //	g-yung_0 mo_7 sna_10 tshogs_14 ba_21 ru_24 'dod_27 
T02D1250:212b-6	goo r'i g-yas na gri gug ste //	goo_0 r_4 g-yas_8 na_14 gri_17 gug_21 ste_25 
T02D1250:212b-7	g-yon na nya ni de bzhin no //	g-yon_0 na_6 nya_9 ni_13 de_16 bzhin_19 no_25 
T02D1250:212b-8	chom rkun g-yas na da ma ru //	chom_0 rkun_5 g-yas_10 na_16 da_19 ma_22 ru_25 
T02D1250:212b-9	g-yon pa na ni phag pa'o //	g-yon_0 ba_6 na_9 ni_12 phag_15 ba_20 
T02D1250:212b-10	ro langs g-yas na rus sbal te //	ro_0 ldang_3 g-yas_9 na_15 rus_18 sbal_22 te_27 
T02D1250:212b-11	g-yon pa na ni padma'i snod //	g-yon_0 ba_6 na_9 ni_12 padma_15 snod_23 
T02D1250:212b-12	za phod ma yi g-yas na sbrul //	za_0 phod_3 ma_8 yi_11 g-yas_14 na_20 sbrul_23 
T02D1250:212b-13	g-yon pa'i lag na thod pa'o //	g-yon_0 ba_6 lag_11 na_15 thod_18 ba_23 
T02D1250:212b-14	sbos mo g-yas na seng ge ste //	sbo_0 mo_5 g-yas_8 na_14 seng_17 ge_22 ste_25 
T02D1250:212b-15	g-yon gyi phyag na dgra sta 'dzin //	g-yon_0 gyi_6 phyag_10 na_16 dgra_19 sta_24 'dzin_28 
T02D1250:212b-16	rngon pa ma g-yas dge slong ste //	rngon_0 ba_6 ma_9 g-yas_12 dge_18 slong_22 ste_28 
T02D1250:212b-17	g-yon pa na ni gsil byed do //	g-yon_0 ba_6 na_9 ni_12 gsil_15 byed_20 do_25 
T02D1250:212b-18	gtum mo g-yas na 'khor lo ste //	'thum_0 mo_5 g-yas_8 na_14 'khor_17 lo_23 ste_26 
T02D1250:212b-19	g-yon pa na ni thod pa 'dzin //	g-yon_0 ba_6 na_9 ni_12 thod_15 ba_20 'dzin_23 
T02D1250:212b-20	g-yung mo g-yas na rdo rje ste //	g-yung_0 mo_7 g-yas_10 na_16 rdo_19 rje_23 ste_27 
T02D1250:212b-21	g-yon na sdigs mdzub de bzhin no //	g-yon_0 na_6 sdigs_9 mdzub_15 de_21 bzhin_24 no_30 
T02D1250:212b-22	skyil krung phyed pa'i gar gyis gnas //	skyil_0 krung_6 phyed_12 ba_18 gar_23 gyis_27 gnas_32 
T02D1250:212b-23	goo r'i la sogs phyag gnyis shes //	goo_0 r_4 la_8 sogs_11 phyag_16 gnyis_22 shes_28 
T02D1250:212b-24	spyan gsum sgra ni gyen du yin //	spyan_0 gsum_6 sgra_11 ni_16 gyen_19 du_24 yin_27 
T02D1250:212b-25	phyag rgya lngas ni shin tu mdzes //	phyag_0 rgya_6 lngas_11 ni_17 shin_20 tu_25 mdzes_28 
T02D1250:212b-26	tshangs pa la sogs gdan la bzhugs //	tshangs_0 ba_8 la_11 sogs_14 gdan_19 la_24 bzhugs_27 
T02D1250:212b-27	de ltar sku rnams rdzogs pa dang //	de_0 ltar_3 sku_8 rnams_12 rdzogs_18 ba_25 dang_28 
T02D1250:212b-28	rang gi snying gar padma bsam //	rang_0 gi_5 snying_8 gar_15 padma_19 bsam_25 
T02D1250:212b-29	de dbus nyi ma h'um las bsam //	de_0 dbus_3 nyi_8 ma_12 h_15 las_20 bsam_24 
T02D1250:212b-30	de las rdo rje rtse lnga pa //	de_0 las_3 rdo_7 rje_11 rtse_15 lnga_20 ba_25 
T02D1250:212b-31	de las h'u% gis mtshan pa ste ;	de_0 las_3 h%_7 gis_12 mtshan_16 ba_23 ste_26 
T02D1250:212b-32	/ de 'gyur ye shes sems dpa' bsam //	de_2 'gyur_5 ye_11 shes_14 sems_19 dpa'_24 bsam_29 
T02D1250:212b-33	de nyid pad nyir h'u% rdo rje //	de_0 nyid_3 pad_8 nyir_12 h%_17 rdo_22 rje_26 
T02D1250:212b-34	ye shes sems dpa' rdzogs pa'o //	ye_0 shes_3 sems_8 dpa'_13 rdzogs_18 ba_25 
T02D1250:212b-35	de ltar rim pa kun la yang //	de_0 ltar_3 rim_8 ba_12 kun_15 la_19 yang_22 
T02D1250:212b-36	de ltar nang du shes par bya //	de_0 ltar_3 nang_8 du_13 shes_16 ba_21 byed_25 
T02D1250:212b-37	de las 'od 'phros bde gshegs rnams //	de_0 las_3 'od_7 'phro_11 bde_18 gshegs_22 rnams_29 
T02D1250:212b-38	dza: h'u% ba ho: bka' lung gis //	dza:_0 h%_5 ba_10 ho:_13 bka'_17 lung_22 gis_27 
T02D1250:212b-39	goo r'i la sogs rnams kyis ni //	goo_0 r_4 la_8 sogs_11 rnams_16 kyis_22 ni_27 
T02D1250:212b-40	spyan drangs nas ni de bstims nas //	spyan_0 drangs_6 nas_13 ni_17 de_20 stim_23 nas_30 
T02D1250:212b-41	ye shes 'khor lo chen po 'bar //	ye_0 shes_3 'khor_8 lo_14 chen_17 po_22 'bar_25 
T02D1250:212b-42	sangs rgyas byang chub sems dpa' ni //	sangs_0 rgya_6 byang_12 chub_18 sems_23 dpa'_28 ni_33 
T02D1250:212b-43	bsgrubs te gzhan na yod ma yin / ma% las gti mug rdo rje ma //	sgrub_0 te_8 gzhan_11 na_17 yod_20 ma_24 yin_27 ma%_33 las_37 gti_41 mug_45 rdo_49 rje_53 ma_57 
T02D1250:212b-44	da% las zhe sdang rdo rje ma //	da%_0 las_4 zhe_8 sdang_12 rdo_18 rje_22 ma_26 
T02D1250:212b-45	ma% las ser sna rdo rje ma //	ma%_0 las_4 ser_8 sna_12 rdo_16 rje_20 ma_24 
T02D1250:212b-46	ra% las 'dod chags rdo rje ma //	ra%_0 las_4 'dod_8 chags_13 rdo_19 rje_23 ma_27 
T02D1250:212b-47	aa% las phrag dog rdo rje ma //	aa%_0 las_4 phrag_8 dog_14 rdo_18 rje_22 ma_26 
T02D1250:212b-48	na% las bdag med rdo rje ma //	na%_0 las_4 bdag_8 med_13 rdo_17 rje_21 ma_25 
T02D1250:212b-49	mig dang rna ba sna dang lce //	mig_0 dang_4 rna_9 ba_13 sna_16 dang_20 lce_25 
T02D1250:212b-50	lus yid rim bzhin de ltar dgod //	lus_0 yid_4 rim_8 bzhin_12 de_18 ltar_21 'god_26 
T02D1250:212b-51	phyag gnyis zhal gcig ro yi gdan //	phyag_0 gnyis_6 zhal_12 gcig_17 ro_22 yi_25 gdan_28 
T02D1250:212b-52	gri gug thod pa phyag na bsnams //	gri_0 gug_4 thod_8 ba_13 phyag_16 na_22 snom_25 
T02D1250:212b-53	ao% las mkha' spyod mar shes bya //	ao%_0 las_4 mkha'_8 spyod_14 mar_20 shes_24 byed_29 
T02D1250:213a-0	aa las sa spyod @213a * //	aa_0 las_3 sa_7 spyod_10 
T02D1250:213a-1	ma ru 'dod //	ma_0 ru_3 'dod_6 
T02D1250:213a-2	h'u% las zhabs bskyed 'og nas bsam //	h%_0 las_5 zhabs_9 skyed_15 'og_22 nas_26 bsam_30 
T02D1250:213a-3	de ltar sku gsung thugs de yang //	de_0 ltar_3 sku_8 gsung_12 thugs_18 de_24 yang_27 
T02D1250:213a-4	rnal 'byor ma ni rigs gsum 'dod //	rnal_0 'byor_5 ma_11 ni_14 rigs_17 gsum_22 'dod_27 
T02D1250:213a-5	rang snying sa bo khyad par spro //	rang_0 snying_5 sa_12 'bo_15 khyad_18 ba_24 spro_28 
T02D1250:213a-6	lcags kyu'i gzugs kyi 'od zer gyis //	lcags_0 kyu_6 gzugs_12 kyi_18 'od_22 zer_26 gyis_30 
T02D1250:213a-7	sangs rgyas spyan drangs mdun du mchod//	sangs_0 rgya_6 spyan_12 drangs_18 mdun_25 du_30 
T02D1250:213a-8	dbang bskur ba ni blang ba ste //	dbang_0 skur_6 ba_12 ni_15 blang_18 ba_24 ste_27 
T02D1250:213a-9	mgon po de bzhin gshegs thams cad //	mgon_0 po_5 de_8 bzhin_11 gshegs_17 thams_24 cad_30 
T02D1250:213a-10	khyod kyis bdag la dbang bskur cig / de bzhin gshegs pa khro bo dang //	khyod_0 kyis_6 bdag_11 la_16 dbang_19 skur_25 cig_31 de_37 bzhin_40 gshegs_46 ba_53 khro_56 'bo_61 dang_64 
T02D1250:213a-11	lha rnams kyis ni mdun bdar nas //	lha_0 rnams_4 kyis_10 ni_15 mdun_18 bdar_23 nas_28 
T02D1250:213a-12	bum pas de la dbang bskur bas //	bum_0 ba_4 de_8 la_11 dbang_14 skur_20 ba_26 
T02D1250:213a-13	bi tsi ta //	bi_0 tsi_3 ta_7 
T02D1250:213a-14	pi pa ka //	pi_0 ba_3 ka_6 
T02D1250:213a-15	bi ma rta //	bi_0 ma_3 rta_6 
T02D1250:213a-16	bi la / skad cig bzhi la'o //	bi_0 la_3 skad_8 cig_13 bzhi_17 la_22 
T02D1250:213a-17	a'a nan da //	a_0 nan_4 da_8 
T02D1250:213a-18	pa ra m'a nan da dang //	ba_0 ra_3 m_6 nan_10 da_14 dang_17 
T02D1250:213a-19	bi ra m'a nan da dang /	bi_0 ra_3 m_6 nan_10 da_14 dang_17 
T02D1250:213a-20	sa ma dz'a nan da'o //	sa_0 ma_3 dz_6 nan_11 da_15 
T02D1250:213a-21	dga' bzhi'o //	dga'_0 bzhi_5 
T02D1250:213a-22	dgod pa dang /	'god_0 ba_5 dang_8 
T02D1250:213a-23	blta ba dang /	lta_0 ba_5 dang_8 
T02D1250:213a-24	lag bcangs dang /	lag_0 'chang_4 dang_11 
T02D1250:213a-25	'khyud pa ni slob dpon dang /	'khyud_0 ba_7 ni_10 slob_13 dpon_18 dang_23 
T02D1250:213a-26	gsang ba dang /	gsang_0 ba_6 dang_9 
T02D1250:213a-27	shes rab ye shes dang /	shes_0 rab_5 ye_9 shes_12 dang_17 
T02D1250:213a-28	bde ba chen po'i de kho na nyid do //	bde_0 ba_4 chen_7 po_12 de_17 kho_20 na_24 nyid_27 do_32 
T02D1250:213a-29	mtha' ru dbang rnams 'bras bu ni //	mtha'_0 ru_6 dbang_9 rnams_15 'bras_21 bu_27 ni_30 
T02D1250:213a-30	rtsa bar mi bskyod pas brgyan pa'o //	rtsa_0 ba_5 mi_9 skyod_12 ba_19 rgyan_23 ba_30 
T02D1250:213a-31	sems dang phan pa rin chen dang //	sems_0 dang_5 phan_10 ba_15 rin_18 chen_22 dang_27 
T02D1250:213a-32	'od dpag med pas brgyan pa'o //	'od_0 dpog_4 med_9 ba_13 rgyan_17 ba_24 
T02D1250:213a-33	goo r'i tsoo r'i bett'a l'i //	goo_0 r_4 tsoo_8 r_13 bett_17 l_24 
T02D1250:213a-34	gha sma r'i rnams brgyan pa'o //	gha_0 sma_4 r_8 rnams_12 rgyan_18 ba_25 
T02D1250:213a-35	mi bskyod sangs rgyas rin chen dang //	mi_0 skyod_3 sangs_10 rgya_16 rin_22 chen_26 dang_31 
T02D1250:213a-36	tshe dpag med kyis brgyan pa ni //	tshe_0 dpog_5 med_10 kyis_14 rgyan_19 ba_26 ni_29 
T02D1250:213a-37	sbos mo rngon ma gtum mo dang //	sbo_0 mo_5 rngon_8 ma_14 'thum_17 mo_22 dang_25 
