T02D1644:278b-7	chos rnams thams cad rjes su yang //	chos_0 rnams_5 thams_11 cad_17 rjes_21 su_26 yang_29 
T02D1644:278b-8	'gro ba phan tshun rjes su brjod //	'gro_0 ba_5 phan_8 tshun_13 rjes_19 su_24 rjod_27 
T02D1644:278b-9	ces brjod la ;	ces_0 rjod_4 la_10 
T02D1644:278b-10	slob ma rdo rje mkha' 'gro mar bsgoms pa dang gnyis kyis lhan cig tu bsgril te /	slob_0 ma_5 rdo_8 rje_12 mkha'_16 'gro_22 mar_27 sgom_31 ba_38 dang_41 gnyis_46 kyis_52 lhan_57 cig_62 tu_66 sgril_69 te_76 
T02D1644:278b-11	aom aa n+yo n+ya aa nu ga ta sarba dharm'a:sba	aom_0 aa_4 n_7 yo_9 n_12 ya_14 aa_17 nu_20 ga_23 ta_26 sarba_29 dharm:sba_35 
T02D1644:278b-12	ra spa ra sarba dharm'a: aa nu pra bishtha sarba	ra_0 spa_3 ra_7 sarba_10 dharm:_16 aa_25 nu_28 pra_31 bishtha_35 sarba_43 
T02D1644:278b-13	dharm'a h'um / zhes brjod cing gcig tu bsgril lo //	dharm_0 h_8 zhes_15 rjod_20 cing_26 gcig_31 tu_36 sgril_39 lo_46 
T02D1644:278b-14	de nas bdag nyid nub phyogs su gnas la /	de_0 nas_3 bdag_7 nyid_12 nub_17 phyogs_21 su_28 gnas_31 la_36 
T02D1644:278b-15	rdo rje la dkris pa'i skud pa khu tshur g-yon pas bzung ste /	rdo_0 rje_4 la_8 dkri_11 ba_17 skud_22 ba_27 khu_30 tshur_34 g-yon_40 ba_46 bzung_50 ste_56 
T02D1644:278b-16	shar phyogs na gnas pa'i slob ma la /	'char_0 phyogs_5 na_12 gnas_15 ba_20 slob_25 ma_30 la_33 
T02D1644:278b-17	dza:dza:dza:zhes gtad la tshangs thig dang po gdab ste /	dza:dza:dza:zhes_0 gtod_17 la_22 tshangs_25 thig_33 dang_38 po_43 gdab_46 ste_51 
T02D1644:278b-18	aom badzra s'u tra sa ma ya m'a ti kra ma h'um /	aom_0 badzra_4 s_11 tra_15 sa_19 ma_22 ya_25 m_28 ti_32 kra_35 ma_39 h_42 
T02D1644:278b-19	sems can don du byed dus su ni //	sems_0 can_5 don_9 du_13 byed_16 dus_21 su_25 ni_28 
T02D1644:278b-20	nam mkhar bzhugs pa'i de bzhin gshegs //	nam_0 mkhar_4 bzhugs_10 ba_17 de_22 bzhin_25 gshegs_31 
T02D1644:278b-21	de dag 'dir ni gshegs bya'i phyir //	de_0 'dag_3 'dir_7 ni_12 gshegs_15 byed_22 phyir_28 
T02D1644:278b-22	thig skud sgra yis bskul bar bya //	thig_0 skud_5 sgra_10 yis_15 skul_19 ba_25 byed_29 
T02D1644:278b-23	zhes brjod la gdab po //	zhes_0 rjod_5 la_11 gdab_14 po_19 
T02D1644:278b-24	de ltar nam mkha' la thig thebs pa ni thig	de_0 ltar_3 nam_8 mkha'_12 la_18 thig_21 thebs_26 ba_32 ni_35 thig_38 
T02D1644:278b-25	skud kyi sgras de bzhin gshegs pa rnams bskul te	skud_0 kyi_5 sgras_9 de_15 bzhin_18 gshegs_24 ba_31 rnams_34 skul_40 te_46 
T02D1644:278b-26	byon par 'gyur ro //	'byon_0 ba_5 'gyur_9 ro_15 
T02D1644:278b-27	de nas bskor ba'i phyogs su song ste /	de_0 nas_3 skor_7 ba_13 phyogs_18 su_25 'gro_28 ste_33 
T02D1644:278b-28	gshin rje'i phyogs su gnas pas byang phyogs na gnas	gshin_0 rje_6 phyogs_12 su_19 gnas_22 ba_27 byang_31 phyogs_37 na_44 gnas_47 
T02D1644:278b-29	pa'i slob ma dang tshangs thig gnyis pa gdab po	ba_0 slob_5 ma_10 dang_13 tshangs_18 thig_26 gnyis_31 ba_37 gdab_40 po_45 
T02D1644:278b-30	// de bzhin sa la yang gdab po //	de_3 bzhin_6 sa_12 la_15 yang_18 gdab_23 po_28 
T02D1644:278b-31	de nas me mtshams su song ste /	de_0 nas_3 me_7 mtshams_10 su_18 'gro_21 ste_26 
T02D1644:278b-32	dbang ldan gyi mtshams na gnas pa dang shar phyogs kyi thig gdab po //	dbang_0 ldan_6 gyi_11 mtshams_15 na_23 gnas_26 ba_31 dang_34 'char_39 phyogs_44 kyi_51 thig_55 gdab_60 po_65 
T02D1644:278b-33	de bzhin du skor phyogs dang sbyar las thig ji ltar gnas pa de bzhin du /	de_0 bzhin_3 du_9 skor_12 phyogs_17 dang_24 sbyor_29 las_35 thig_39 ji_44 ltar_47 gnas_52 ba_57 de_60 bzhin_63 du_69 
T02D1644:278b-34	nam mkha' dang sa la yang gdab po //	nam_0 mkha'_4 dang_10 sa_15 la_18 yang_21 gdab_26 po_31 
T02D1644:278b-35	de nas aom badzra mu: zhes pas ye shes kyi skud pa gshegs su gsol lo //	de_0 nas_3 aom_7 badzra_11 mu:_18 zhes_22 ba_27 ye_31 shes_34 kyi_39 skud_43 ba_48 gshegs_51 su_58 gsol_61 lo_66 
T02D1644:278b-36	de nas bri tshon te /	de_0 nas_3 'bri_7 tshon_11 te_17 
T02D1644:278b-37	gser la sogs pa'i tshon rtsi lnga'am /	gser_0 la_5 sogs_8 ba_13 tshon_18 rtsi_24 lnga_29 
T02D1644:278b-38	ma 'byor na 'bras phye la sogs pa'i phye ma zhib tu btags te /	ma_0 'byor_3 na_9 'bras_12 'byed_18 la_23 sogs_26 ba_31 'byed_36 ma_41 zhib_44 tu_49 'dogs_52 te_58 
T02D1644:278b-39	dri zhim pos bdugs te ;	'dri_0 zhim_4 pos_9 bdug_13 te_19 
T02D1644:278b-40	thod pa'i snod du bzhag nas thig gi skabs dang	thod_0 ba_5 snod_10 du_15 'jog_18 nas_24 thig_28 gi_33 skabs_36 dang_42 
T02D1644:278b-41	'dra bar 'bar ba'i lha'i de bzhin gshegs pa thams	'dra_0 ba_5 'bar_9 ba_14 lha_19 de_25 bzhin_28 gshegs_34 ba_41 thams_44 
T02D1644:278b-42	cad bkug la / kha dog ji lta ba bzhin du bstim ste /	cad_0 'gugs_4 la_9 kha_14 dog_18 ji_22 lta_25 ba_29 bzhin_32 du_38 stim_41 ste_47 
T02D1644:278b-43	aom badzra tsi tra sa ma ya h'um zhes brjod cing mngon par bsngags la /	aom_0 badzra_4 tsi_11 tra_15 sa_19 ma_22 ya_25 h_28 zhes_33 rjod_38 cing_44 mngon_49 ba_55 bsngags_59 la_67 
T02D1644:279a-0	chos dbyings 'di ni rnam par dag / sems can khams @279a * //	chos_0 dbyings_5 'di_13 ni_17 rnam_20 ba_25 'dag_29 sems_35 can_40 khams_44 
T02D1644:279a-1	rnams sgrol byed pa'i //	rnams_0 sgrol_6 byed_12 ba_17 
T02D1644:279a-2	he ru ka dpal rgyal chen gyi //	he_0 ru_3 ka_6 dpal_9 rgyal_14 chen_20 gyi_25 
T02D1644:279a-3	dkyil 'khor snying po bri bar bya //	dkyil_0 'khor_6 snying_12 po_19 'bri_22 ba_26 byed_30 
T02D1644:279a-4	zhes brjod nas lag pa g-yon pa'i khu tshur gyis tshon rtsi rnams so sor bzung la /	zhes_0 rjod_5 nas_11 lag_15 ba_19 g-yon_22 ba_28 khu_33 tshur_37 gyis_43 tshon_48 rtsi_54 rnams_59 so_65 sor_68 bzung_72 la_78 
T02D1644:279a-5	dbang ldan gyi phyogs nas brtsams te ri mo phan tshun ma 'byar ba dang /	dbang_0 ldan_6 gyi_11 phyogs_15 nas_22 brtsams_26 te_34 ri_37 mo_40 phan_43 tshun_48 ma_54 'byor_57 ba_63 dang_66 
T02D1644:279a-6	ya yo med par g-yas skor du bri /	ya_0 yo_3 med_6 ba_10 g-yas_14 skor_20 du_25 'bri_28 
T02D1644:279a-7	de'i rim pa la ni nang rol nag po'o //	de_0 rim_5 ba_9 la_12 ni_15 nang_18 rol_23 nag_27 po_31 
T02D1644:279a-8	de'i phyir dkar po'o //	de_0 phyir_5 dkar_11 po_16 
T02D1644:279a-9	de'i phyi rol ser po /	de_0 phyi_5 rol_10 ser_14 po_18 
T02D1644:279a-10	de nas dmar po /	de_0 nas_3 dmar_7 po_12 
T02D1644:279a-11	tha mar ljang gu'o //	tha_0 mar_4 ljang_8 gu_14 
T02D1644:279a-12	de ltar ri mo lnga po cung zad cig bris nas /	de_0 ltar_3 ri_8 mo_11 lnga_14 po_19 cung_22 zad_27 cig_31 'bri_35 nas_40 
T02D1644:279a-13	kham phor la sogs pas bkab la phyi nas mtshan ma brtag go //	kham_0 phor_5 la_10 sogs_13 ba_18 'gebs_22 la_27 phyi_30 nas_35 mtshan_39 ma_46 rtog_49 go_55 
T02D1644:279a-14	phyi nas slob ma rnams kyis ci bder bris te /	phyi_0 nas_5 slob_9 ma_14 rnams_17 kyis_23 ci_28 bder_31 'bri_36 te_41 
T02D1644:279a-15	rdo rje phreng bas bskor ba'i snying po'i dkyil 'khor ni dkar po'o //	rdo_0 rje_4 phreng_8 ba_15 skor_19 ba_25 snying_30 po_37 dkyil_42 'khor_48 ni_54 dkar_57 po_62 
T02D1644:279a-16	de'i phyi rol gyi padma 'dab ma brgyad ni dmar po'o //	de_0 phyi_5 rol_10 gyi_14 padma_18 'dab_24 ma_29 brgyad_32 ni_39 dmar_42 po_47 
T02D1644:279a-17	rdo rje phreng ba ni nag po'o //	rdo_0 rje_4 phreng_8 ba_15 ni_18 nag_21 po_25 
T02D1644:279a-18	de'i phyi rol du nag po la dur khrod brgyad do //	de_0 phyi_5 rol_10 du_14 nag_17 po_21 la_24 dur_27 khrod_31 brgyad_37 do_44 
T02D1644:279a-19	de'i phyi rol du rdo rje ri rab me 'od dang bcas pa'o //	de_0 phyi_5 rol_10 du_14 rdo_17 rje_21 ri_25 rab_28 me_32 'od_35 dang_39 'cha'_44 ba_49 
T02D1644:279a-20	dbus kyi snying po pho brang la /	dbus_0 kyi_5 snying_9 po_16 pho_19 brang_23 la_29 
T02D1644:279a-21	nyi ma la gnas pa'i thod pa'am /	nyi_0 ma_4 la_7 gnas_10 ba_15 thod_20 ba_25 
T02D1644:279a-22	kha tv'am ga bri'o //	kha_0 tv_4 ga_10 'bri_13 
T02D1644:279a-23	shar du nyi ma'i steng du rdo rje'o //	'char_0 du_5 nyi_8 ma_12 steng_17 du_23 rdo_26 rje_30 
T02D1644:279a-24	lhor nyi ma'i steng du rin po che'i lcug ma'o //	lhor_0 nyi_5 ma_9 steng_14 du_20 rin_23 po_27 che_30 lcug_36 ma_41 
T02D1644:279a-25	nub tu nyi ma'i steng du padma'o //	nub_0 tu_4 nyi_7 ma_11 steng_16 du_22 padma_25 
T02D1644:279a-26	byang du nyi ma'i steng du ral gri'o //	byang_0 du_6 nyi_9 ma_13 steng_18 du_24 ral_27 gri_31 
T02D1644:279a-27	phyi rol dur khrod brgyad rnams ni shing lo la	phyi_0 rol_5 dur_9 khrod_13 brgyad_19 rnams_26 ni_32 shing_35 lo_41 la_44 
T02D1644:279a-28	gnas pa'i phyogs skyong gi gdan gyi mgo rdo rje'i	gnas_0 ba_5 phyogs_10 skyong_17 gi_24 gdan_27 gyi_32 mgo_36 rdo_40 rje_44 
T02D1644:279a-29	phreng ba dang me 'od ci rigs par bri'o //	phreng_0 ba_7 dang_10 me_15 'od_18 ci_22 rigs_25 ba_30 'bri_34 
T02D1644:279a-30	de nas bgegs bsal ba ni bdag nyid khro bo las thams cad pa'i skur bsgoms la //	de_0 nas_3 bgegs_7 bsal_13 ba_18 ni_21 bdag_24 nyid_29 khro_34 'bo_39 las_42 thams_46 cad_52 ba_56 skur_61 sgom_66 la_73 
T02D1644:279a-31	rdo rje dril bu gsor zhing lan gsum du bskor la /	rdo_0 rje_4 'dril_8 bu_13 gsor_16 zhing_21 lan_27 gsum_31 du_36 skor_39 la_45 
T02D1644:279a-32	h'um zhes brjod cing g-yas brkyang la sogs pa las kyi sbyor ba dang /	h_0 zhes_5 rjod_10 cing_16 g-yas_21 rkyong_27 la_35 sogs_38 ba_43 las_46 kyi_50 sbyor_54 ba_60 dang_63 
T02D1644:279a-33	khro bo'i phreng sngags bzlas pa'i ngag gi sbyor ba dang /	khro_0 'bo_5 phreng_10 sngags_17 bzlas_24 ba_30 ngag_35 gi_40 sbyor_43 ba_49 dang_52 
T02D1644:279a-34	stong pa nyid bsgoms pa'i sems kyi sbyor bas bgegs bsal lo //	stong_0 ba_6 nyid_9 sgom_14 ba_21 sems_26 kyi_31 sbyor_35 ba_41 bgegs_45 bsal_51 lo_56 
T02D1644:279a-35	de nas bum pa gzhung dang mthun par rtsa ba	de_0 nas_3 bum_7 ba_11 gzhung_14 dang_21 mthun_26 ba_32 rtsa_36 ba_41 
T02D1644:279a-36	nag po la sogs pa'i skyon med pa lnga la	nag_0 po_4 la_7 sogs_10 ba_15 skyon_20 med_26 ba_30 lnga_33 la_38 
T02D1644:279a-37	/ lha so so'i mtshan ma bris nas //	lha_2 so_6 so_9 mtshan_14 ma_21 'bri_24 nas_29 
T02D1644:279a-38	gong du smos pa'i cho gas byin gyis brlabs la ;	gong_0 du_5 smos_8 ba_13 cho_18 'gas_22 byin_26 gyis_31 brlabs_36 la_43 
T02D1644:279a-39	dbus kyi bum par dpal he ru ka yab yum	dbus_0 kyi_5 bum_9 ba_13 dpal_17 he_22 ru_25 ka_28 yab_31 yum_35 
T02D1644:279a-40	bskyed nas sa bon gyi 'od kyis ye shes kyi	skyed_0 nas_7 sa_11 bon_14 gyi_18 'od_22 kyis_26 ye_31 shes_34 kyi_39 
T02D1644:279a-41	lha bkug nas bstim ste /	lha_0 'gugs_4 nas_9 stim_13 ste_19 
T02D1644:279a-42	me tog la sogs pas mchod nas /	me_0 tog_3 la_7 sogs_10 ba_15 mchod_19 nas_25 
T02D1644:279a-43	rdo rje kha rgyan gyi steng du bzhag ste /	rdo_0 rje_4 kha_8 rgyan_12 gyi_18 steng_22 du_28 'jog_31 ste_37 
T02D1644:279a-44	rtsa ba'i sngags 'bru gsum dang bcas pa brgya rtsa brgyad bzlas nas /	rtsa_0 ba_5 sngags_10 'bru_17 gsum_22 dang_27 'cha'_32 ba_37 brgya_40 rtsa_46 brgyad_51 bzlas_58 nas_64 
T02D1644:279b-0	de nas @279b yab yub 'od du zhu ste /	de_0 nas_3 yab_13 yub_17 'od_21 du_25 'ju_28 ste_32 
T02D1644:279b-1	ye shes kyi bdud rtsi'i chur gyur par bsam mo //	ye_0 shes_3 kyi_8 bdud_12 rtsi_17 'chur(d)_24 gyur_29 ba_34 bsam_38 mo_43 
T02D1644:279b-2	de bzhin du bum pa bzhi la yang rdzogs par bya'o //	de_0 bzhin_3 du_9 bum_12 ba_16 bzhi_19 la_24 yang_27 rdzogs_32 ba_39 byed_43 
T02D1644:279b-3	gzhan yang yon chab la sogs pa'i mchod pa rnams	gzhan_0 yang_6 yon_11 chab_15 la_20 sogs_23 ba_28 mchod_33 ba_39 rnams_42 
T02D1644:279b-4	'bru gsum gyis byin gyis brlabs la gdan dang gos	'bru_0 gsum_5 gyis_10 byin_15 gyis_20 brlabs_25 la_32 gdan_35 dang_40 gos_45 
T02D1644:279b-5	kyis dag pa la sogs pa bya'o //	kyis_0 'dag_5 ba_9 la_12 sogs_15 ba_20 byed_23 
T02D1644:279b-6	de nas dkyil 'khor bsgrub pa ni /	de_0 nas_3 dkyil_7 'khor_13 sgrub_19 ba_26 ni_29 
T02D1644:279b-7	dkyil 'khor gyi phyi rol du ba'i lci bas byugs la /	dkyil_0 'khor_6 gyi_12 phyi_16 rol_21 du_25 ba_28 lci_33 ba_37 'byug_41 la_47 
T02D1644:279b-8	me tog sil ma bkram /	me_0 tog_3 sil_7 ma_11 'grem_14 
T02D1644:279b-9	bla bre dang /	bla_0 'bre_4 dang_8 
T02D1644:279b-10	rgyal mtshan la sogs pa bre /	rgyal_0 mtshan_6 la_13 sogs_16 ba_21 'bre_24 
T02D1644:279b-11	bum pa kun nas so sor bzhag ste /	bum_0 ba_4 kun_7 nas_11 so_15 sor_18 'jog_22 ste_28 
T02D1644:279b-12	rnam par rgyal ba'i bum pa gzhag pa'am yang na shar phyogs kyi sgo'i nang du gzhag go //	rnam_0 ba_5 rgyal_9 ba_15 bum_20 ba_24 'jog_27 ba_33 yang_39 na_44 'char_47 phyogs_52 kyi_59 sgo_63 nang_69 du_74 'jog_77 go_83 
T02D1644:279b-13	las thams cad pa'i bum pa ni /	las_0 thams_4 cad_10 ba_14 bum_19 ba_23 ni_26 
T02D1644:279b-14	bsang gtor bya ba'i phyir sgo'i g-yas phyogs su gzhag go //	bsang_0 'thor_6 byed_11 ba_15 phyir_20 sgo_26 g-yas_32 phyogs_38 su_45 'jog_48 go_54 
T02D1644:279b-15	bum pa kun las chu nyung zad bsdus la padma'i snod du blugs te /	bum_0 ba_4 kun_7 las_11 chu_15 nyung_19 zad_25 sdud_29 la_35 padma_38 snod_46 du_51 blugs_54 te_60 
T02D1644:279b-16	rnam par rgyal ba'i bum pa'i steng du gzhag go //	rnam_0 ba_5 rgyal_9 ba_15 bum_20 ba_24 steng_29 du_35 'jog_38 go_44 
T02D1644:279b-17	de nas slob dpon bdag nyid khrus byas te /	de_0 nas_3 slob_7 dpon_12 bdag_17 nyid_22 'khru_27 byed_33 te_38 
T02D1644:279b-18	rgyan chas ldan par byas la nang du zhugs te /	rgyan_0 cha_6 ldan_11 ba_16 byed_20 la_25 nang_28 du_33 'jug_36 te_42 
T02D1644:279b-19	stan bde ba la 'dug nas rim pa 'di gnyis kyis dkyil 'khor sprul par bya ste /	stan_0 bde_5 ba_9 la_12 'dug_15 nas_20 rim_24 ba_28 'di_31 gnyis_35 kyis_41 dkyil_46 'khor_52 sprul_58 ba_64 byed_68 ste_72 
T02D1644:279b-20	lo bcu gnyis la sogs pa'i mtshan nyid dang ldan	lo_0 'chu_3 gnyis_7 la_13 sogs_16 ba_21 mtshan_26 nyid_33 dang_38 ldan_43 
T02D1644:279b-21	pa'i bu mo'am yang na 'od kyi rig ma snying	ba_0 bu_5 mo_8 yang_14 na_19 'od_22 kyi_26 rig_30 ma_34 snying_37 
T02D1644:279b-22	ga nas phyung la /	ga_0 nas_3 'byin_7 la_14 
T02D1644:279b-23	yab yum gnyis lha'i skur bsgoms nas /	yab_0 yum_4 gnyis_8 lha_14 skur_20 sgom_25 nas_32 
T02D1644:279b-24	gsang gnas gnyis byin gyis brlabs te /	gsang_0 gnas_6 gnyis_11 byin_17 gyis_22 brlabs_27 te_34 
T02D1644:279b-25	snyoms par zhugs nas bde ba'i sgras /	snyom_0 ba_7 'jug_11 nas_17 bde_21 ba_25 sgras_30 
T02D1644:279b-26	de bzhin gshegs pa thams cad bkug ste bdag la bcug ste /	de_0 bzhin_3 gshegs_9 ba_16 thams_19 cad_25 'gugs_29 ste_34 bdag_38 la_43 'jug_46 ste_51 
T02D1644:279b-27	bdag la 'khor lo'i tshul du nam mkha'i khams la khyab par spros nas slar bsdus te /	bdag_0 la_5 'khor_8 lo_14 tshul_19 du_25 nam_28 mkha_32 khams_39 la_45 khyab_48 ba_54 spros_58 nas_64 slar_68 sdud_73 te_79 
T02D1644:279b-28	ye shes kyi lha dang 'dres nas so sor zhugs pa'am /	ye_0 shes_3 kyi_8 lha_12 dang_16 'dre_21 nas_27 so_31 sor_34 'jug_38 ba_44 
T02D1644:279b-29	yang na stong pa nyid du bsgom pa'i dang las	yang_0 na_5 stong_8 ba_14 nyid_17 du_22 bsgom_25 ba_31 dang_36 las_41 
T02D1644:279b-30	h'um gi snang ba las ra ba dang dra ba	h_0 gi_5 snang_8 ba_14 las_17 ra_21 ba_24 dang_27 'dra_32 ba_36 
T02D1644:279b-31	dang sa gzhi bsgoms la /	dang_0 sa_5 gzhi_8 sgom_13 la_20 
T02D1644:279b-32	de'i nang du sna tshogs padma bsams te /	de_0 nang_5 du_10 sna_13 tshogs_17 padma_24 bsams_30 te_36 
T02D1644:279b-33	de'i rjes la dbus dang phyogs bzhi char la /	de_0 rjes_5 la_10 dbus_13 dang_18 phyogs_23 bzhi_30 char_35 la_40 
T02D1644:279b-34	nyi ma la thig le phra mo re re bsgom /	nyi_0 ma_4 la_7 thig_10 le_15 phra_18 mo_23 re_26 re_29 bsgom_32 
T02D1644:279b-35	de nas shar phyogs kyi thig le las rdo rje'i rigs dpag tu med pa spros te /	de_0 nas_3 'char_7 phyogs_12 kyi_19 thig_23 le_28 las_31 rdo_35 rje_39 rigs_45 dpog_50 tu_55 med_58 ba_62 spros_65 te_71 
T02D1644:279b-36	ye shes kyi rdo rje'i rigs thams cad bsdus nas /	ye_0 shes_3 kyi_8 rdo_12 rje_16 rigs_22 thams_27 cad_33 sdud_37 nas_43 
T02D1644:279b-37	shar phyogs kyi thig le la thim pas rdo rje mkha' 'gro mar bskyed do //	'char_0 phyogs_5 kyi_12 thig_16 le_21 la_24 'thim_27 ba_32 rdo_36 rje_40 mkha'_44 'gro_50 mar_55 skyed_59 do_66 
T02D1644:279b-38	de bzhin du mkha' 'gro ma gsum yang bskyed do //	de_0 bzhin_3 du_9 mkha'_12 'gro_18 ma_23 gsum_26 yang_31 skyed_36 do_43 
T02D1644:280a-0	dbus kyi thig le las rigs lnga char gyi sangs rgyas dang byang chub sems @280a * //	dbus_0 kyi_5 thig_9 le_14 las_17 rigs_21 lnga_26 char_31 gyi_36 sangs_40 rgya_46 dang_52 byang_57 chub_63 sems_68 
T02D1644:280a-1	dpa' la sogs pa spros te /	dpa'_0 la_5 sogs_8 ba_13 spros_16 te_22 
T02D1644:280a-2	slar 'dus te dbus kyi thig le la thim pas	slar_0 'du_5 te_10 dbus_13 kyi_18 thig_22 le_27 la_30 'thim_33 ba_38 
T02D1644:280a-3	sangs rgyas mkha' 'gro ma dang bcas pa'i dpal rdo	sangs_0 rgya_6 mkha'_12 'gro_18 ma_23 dang_26 'cha'_31 ba_36 dpal_41 rdo_46 
T02D1644:280a-4	rje he ru ka bskyed la /	rje_0 he_4 ru_7 ka_10 skyed_13 la_20 
T02D1644:280a-5	de nas yang yab yum snyoms par zhugs pa'i bde	de_0 nas_3 yang_7 yab_12 yum_16 snyom_20 ba_27 'jug_31 ba_37 bde_42 
T02D1644:280a-6	pa'i ngo bo 'od du zhu ste 'od kyi gong	ba_0 ngo_5 'bo_9 'od_12 du_16 'ju_19 ste_23 'od_27 kyi_31 gong_35 
T02D1644:280a-7	bur gnas pa la /	bur_0 gnas_4 ba_9 la_12 
T02D1644:280a-8	phyogs bzhi'i lha mo bzhis glus bskul bas yab yum dus gcig tu skur bzhengs par bsgom mo //	phyogs_0 bzhi_7 lha_14 mo_18 bzhis_21 glus_27 skul_32 ba_38 yab_42 yum_46 dus_50 gcig_54 tu_59 skur_62 bzhengs_67 ba_75 bsgom_79 mo_85 
T02D1644:280a-9	de ltar ye shes kyi dkyil 'khor dang bcas pa'i lha'i 'khor lo sprul nas /	de_0 ltar_3 ye_8 shes_11 kyi_16 dkyil_20 'khor_26 dang_32 'cha'_37 ba_42 lha_47 'khor_53 lo_59 sprul_62 nas_68 
T02D1644:280a-10	de nas phyi'i mchod pa yon chab la sogs pa rol mo'i bar gyis mchod pa'o //	de_0 nas_3 phyi_7 mchod_14 ba_20 yon_23 chab_27 la_32 sogs_35 ba_40 rol_43 mo_47 ba_52 gyis_56 mchod_61 ba_67 
T02D1644:280a-11	nang gi mchod pa ni bdud rtsi myang ba nas nang gi tshogs kyi mchod pa'o //	nang_0 gi_5 mchod_8 ba_14 ni_17 bdud_20 rtsi_25 myang_30 ba_36 nas_39 nang_43 gi_48 tshogs_51 kyi_58 mchod_62 ba_68 
T02D1644:280a-12	gsang ba'i mchod pa ni dbang po gnyis kyi bde ba'o //	gsang_0 ba_6 mchod_11 ba_17 ni_20 dbang_23 po_29 gnyis_32 kyi_38 bde_42 ba_46 
T02D1644:280a-13	bla na mad pa'i mchod pa ni gnyis su med pa'i bsgom pa'o //	bla_0 na_4 mad_7 ba_11 mchod_16 ba_22 ni_25 gnyis_28 su_34 med_37 ba_41 bsgom_46 ba_52 
T02D1644:280a-14	de nas sngar smos pa'i bstod pas bstod nas lha	de_0 nas_3 sngar_7 smos_13 ba_18 bstod_23 ba_29 bstod_33 nas_39 lha_43 
T02D1644:280a-15	rnams kyi sngags 'bru gsum dang spel ba ci nus	rnams_0 kyi_6 sngags_10 'bru_17 gsum_22 dang_27 spel_32 ba_37 ci_40 nus_43 
T02D1644:280a-16	pas bzlas la yang phyi nang gi mchod pas mchod	ba_0 bzlas_4 la_10 yang_13 phyi_18 nang_23 gi_28 mchod_31 ba_37 mchod_41 
T02D1644:280a-17	nas / de nas gtor ma rgya chen po gtang ngo //	nas_0 de_6 nas_9 'thor_13 ma_18 rgya_21 chen_26 po_31 gtong_34 ngo_40 
T02D1644:280a-18	de nas nang du zhugs te bdag nyid dkyil 'khor du 'jug cing dbang nod pa'i phyir /	de_0 nas_3 nang_7 du_12 'jug_15 te_21 bdag_24 nyid_29 dkyil_34 'khor_40 du_46 'jug_49 cing_54 dbang_59 nod_65 ba_69 phyir_74 
T02D1644:280a-19	byang chub rdo rjes sangs rgyas la //	byang_0 chub_6 rdo_11 rjes_15 sangs_20 rgya_26 la_32 
T02D1644:280a-20	mchod chen ji ltar mdzod pa bzhin //	mchod_0 chen_6 ji_11 ltar_14 mdzod_19 ba_25 bzhin_28 
T02D1644:280a-21	bdag kyang rab tu bsgral slad du /	bdag_0 kyang_5 rab_11 tu_15 bsgral_18 slad_25 du_30 
T02D1644:280a-22	nam mkha'i rdo rje bdag la stsol //	nam_0 mkha_4 rdo_11 rje_15 bdag_19 la_24 stsol_27 
T02D1644:280a-23	zhes lha la gsol ba btab la /	zhes_0 lha_5 la_9 gsol_12 ba_17 'debs_20 la_25 
T02D1644:280a-24	de nas dkyil 'khor gyi bdag pos bdag la gnang	de_0 nas_3 dkyil_7 'khor_13 gyi_19 bdag_23 pos_28 bdag_32 la_37 gnang_40 
T02D1644:280a-25	ba byin nas dkyil 'khor du zhugs pa nas rjes	ba_0 byin_3 nas_8 dkyil_12 'khor_18 du_24 'jug_27 ba_33 nas_36 rjes_40 
T02D1644:280a-26	su gnang ba'i bar du rdzogs par bskur bar bsgom	su_0 gnang_3 ba_9 ba_14 du_18 rdzogs_21 ba_28 skur_32 ba_38 bsgom_42 
T02D1644:280a-27	mo // de nas dam tshig gi glus bstod de /	mo_0 de_6 nas_9 dam_13 tshig_17 gi_23 glus_26 bstod_31 de_37 
T02D1644:280a-28	aom nam mkha' las byung mtshan med phyir //	aom_0 nam_4 mkha'_8 las_14 'byung_18 mtshan_24 med_31 phyir_35 
T02D1644:280a-29	thog ma tha ma med pa'i mchog / sems dpa' rdo rje che rang bzhin //	thogs_0 ma_5 tha_8 ma_12 med_15 ba_19 mchog_24 sems_32 dpa'_37 rdo_42 rje_46 che_50 rang_54 bzhin_59 
T02D1644:280a-30	rdo rje 'dzin par bdag sgrubs shig / dngos grub	rdo_0 rje_4 'dzin_8 ba_14 bdag_18 sgrubs_23 shig_30 dngos_37 'grub_43 
T02D1644:280a-31	chen po kun gyi mchog / dbang phyug chen po	chen_0 po_5 kun_8 gyi_12 mchog_16 dbang_24 phyug_30 chen_36 po_41 
T02D1644:280a-32	lhag pa'i lha // rdo rje 'dzin pa kun gyi rgyal //	lhag_0 ba_5 lha_10 rdo_17 rje_21 'dzin_25 ba_31 kun_34 gyi_38 rgyal_42 
T02D1644:280a-33	mi 'gyur mchog tu bdag sgrubs shig / nyes pa med pa rtag pa ste /	mi_0 'gyur_3 mchog_9 tu_15 bdag_18 sgrubs_23 shig_30 nyes_37 ba_42 med_45 ba_49 rtag_52 ba_57 ste_60 
T02D1644:280a-34	'dod chags kun du rjes su chags //	'dod_0 chags_5 kun_11 du_15 rjes_18 su_23 chags_26 
T02D1644:280a-35	'dod chags chen po dga' ba che //	'dod_0 chags_5 chen_11 po_16 dga'_19 ba_24 che_27 
T02D1644:280a-36	bcom ldan de nyid bdag sgrubs shig / shin tu	'joms_0 ldan_5 de_10 nyid_13 bdag_18 sgrubs_23 shig_30 shin_37 tu_42 
T02D1644:280a-37	dag pa kun gyi mchog / gdod nas grol ba	'dag_0 ba_4 kun_7 gyi_11 mchog_15 gdod_23 nas_28 grol_32 ba_37 
T02D1644:280b-0	de bzhin gshegs // @280b kun du bzang po kun bdag nyid //	de_0 bzhin_3 gshegs_9 kun_25 du_29 bzang_32 po_38 kun_41 bdag_45 nyid_50 
T02D1644:280b-1	byang chub sems su bdag sgrubs shig / dngos grub	byang_0 chub_6 sems_11 su_16 bdag_19 sgrubs_24 shig_31 dngos_38 'grub_44 
T02D1644:280b-2	chen po mchog gi mchog / dbang phyug chen po	chen_0 po_5 mchog_8 gi_14 mchog_17 dbang_25 phyug_31 chen_37 po_42 
T02D1644:280b-3	rgyal bas rgyal // grub pa'i rdo rje cher bstod pas //	rgyal_0 ba_6 rgyal_10 'grub_19 ba_24 rdo_29 rje_33 cher_37 bstod_42 ba_48 
T02D1644:280b-4	rdo rje snyems ma bdag po'i bdag / sems can kun gyi yid khyab pa //	rdo_0 rje_4 snyems_8 ma_15 bdag_18 po_23 bdag_28 sems_35 can_40 kun_44 gyi_48 yid_52 khyab_56 ba_62 
T02D1644:280b-5	sems can kun gyi snying la gnas //	sems_0 can_5 kun_9 gyi_13 snying_17 la_24 gnas_27 
T02D1644:280b-6	sems can kun gyi yab nyid de //	sems_0 can_5 kun_9 gyi_13 yab_17 nyid_21 de_26 
T02D1644:280b-7	'dod chags mnyam pa'i dam tshig mchog / ces pa'i dam tshig gi glus ba stong pa bya'o //	'dod_0 chags_5 mnyam_11 ba_17 dam_22 tshig_26 mchog_32 ces_40 ba_44 dam_49 tshig_53 gi_59 glus_62 ba_67 stong_70 ba_76 byed_79 
T02D1644:280b-8	de nas bden pa'i byin gyi rlabs 'di brjod do //	de_0 nas_3 bden_7 ba_12 byin_17 gyi_22 rlabs_26 'di_32 rjod_36 do_42 
T02D1644:280b-9	shes rab thabs bdag dkyil 'khor gyi //	shes_0 rab_5 thabs_9 bdag_15 dkyil_20 'khor_26 gyi_32 
T02D1644:280b-10	bden pa'i byin rlabs gang yin pa //	bden_0 ba_5 byin_10 rlabs_15 gang_21 yin_26 ba_30 
T02D1644:280b-11	bden pa de yis mgon khyod kyis //	bden_0 ba_5 de_8 yis_11 mgon_15 khyod_20 kyis_26 
T02D1644:280b-12	bdag gi 'dod pa skong byed shog / chos rnams gzugs brnyan lta bu ste //	bdag_0 gi_5 'dod_8 ba_13 skong_16 byed_22 shog_27 chos_34 rnams_39 gzugs_45 rnyan_51 lta_58 bu_62 ste_65 
T02D1644:280b-13	gsal zhing dag la rnyog pa med //	gsal_0 zhing_5 'dag_11 la_15 rnyog_18 ba_24 med_27 
T02D1644:280b-14	gzung du med cing brjod du med //	gzung_0 du_6 med_9 cing_13 rjod_18 du_24 med_27 
T02D1644:280b-15	rgyu dang las las byung ba dang //	rgyu_0 dang_5 las_10 las_14 'byung_18 ba_24 dang_27 
T02D1644:280b-16	de bzhin kho na nyid las byung //	de_0 bzhin_3 kho_9 na_13 nyid_16 las_21 'byung_25 
T02D1644:280b-17	bden pa de yis dkyil 'khor ni //	bden_0 ba_5 de_8 yis_11 dkyil_15 'khor_21 ni_27 
T02D1644:280b-18	gzugs brnyan gsal bar sems can rnams //	gzugs_0 rnyan_6 gsal_13 ba_18 sems_22 can_27 rnams_31 
T02D1644:280b-19	dri med thams cad thob par shog / ces so //	'dri_0 med_4 thams_8 cad_14 'thob_18 ba_23 shog_27 ces_34 so_38 
T02D1644:280b-20	de nas slob ma gzhug par bya ste /	de_0 nas_3 slob_7 ma_12 'jug_15 ba_21 byed_25 ste_29 
T02D1644:280b-21	slob ma khrus byas te gos gsar pa bgos la dar dmar pos gdong g-yogs te /	slob_0 ma_5 'khru_8 byed_14 te_19 gos_22 gsar_26 ba_31 bgod_34 la_39 dar_42 dmar_46 pos_51 gdong_55 g-yogs_61 te_68 
T02D1644:280b-22	yol ba'i phyi rol du bzhag pa las kyi bum pa'i chus gtor te /	yol_0 ba_4 phyi_9 rol_14 du_18 'jog_21 ba_27 las_30 kyi_34 bum_38 ba_42 chus_47 'thor_52 te_57 
T02D1644:280b-23	me tog bzung ste gnas pa las slob dpon gyis /	me_0 tog_3 bzung_7 ste_13 gnas_17 ba_22 las_25 slob_29 dpon_34 gyis_39 
T02D1644:280b-24	'dod pa dga' ba khyod su yin //	'dod_0 ba_5 dga'_8 ba_13 khyod_16 su_22 yin_25 
T02D1644:280b-25	zhes dri'o //	zhes_0 'dri_5 
T02D1644:280b-26	des kyang /	des_0 kyang_4 
T02D1644:280b-27	bdag ni skal bzang bde chen mos //	bdag_0 ni_5 skal_8 bzang_13 bde_19 chen_23 mos_28 
T02D1644:280b-28	zhes smra'o //	zhes_0 smra_5 
T02D1644:280b-29	yang slob dpon gyis /	yang_0 slob_5 dpon_10 gyis_15 
T02D1644:280b-30	thar pa chen po'i grong mchog tu //	thar_0 ba_5 chen_8 po_13 grong_18 mchog_24 tu_30 
T02D1644:280b-31	rab tu 'jug par khyod spro'am //	rab_0 tu_4 'jug_7 ba_12 khyod_16 spro_22 
T02D1644:280b-32	slob mas /	slob_0 mas_5 
T02D1644:280b-33	thar pa chen po'i grong mchog tu //	thar_0 ba_5 chen_8 po_13 grong_18 mchog_24 tu_30 
T02D1644:280b-34	bdag ni 'jug par 'tshal lags so //	bdag_0 ni_5 'jug_8 ba_13 'tshal_17 lags_24 so_29 
T02D1644:280b-35	zhes lan gdab po //	zhes_0 lan_5 gdab_9 po_14 
T02D1644:280b-36	de nas aom sarba yog tsitta autp'a da y'a mi zhes pas byang chub tu sems bskyed pa /	de_0 nas_3 aom_7 sarba_11 yog_17 tsitta_21 autp_28 da_35 y_38 mi_42 zhes_45 ba_50 byang_54 chub_60 tu_65 sems_68 skyed_73 ba_80 
T02D1644:280b-37	de nas sdom pa gzung ste /	de_0 nas_3 sdom_7 ba_12 gzung_15 ste_21 
T02D1644:280b-38	thog med dus nas 'khor ba nas //	thogs_0 med_5 dus_9 nas_13 'khor_17 ba_23 nas_26 
T02D1644:280b-39	bdag gis sdig pa ci bgyis dang //	bdag_0 gis_5 sdig_9 ba_14 ci_17 bgyid_20 dang_26 
T02D1644:280b-40	bgyid stsal gnag lags di ring bshags //	bgyid_0 stsal_6 gnag_12 lags_17 di_22 ring_25 'chags_30 
T02D1644:280b-41	gtso la slar yang sdom par 'tshal //	gtso_0 la_5 slar_8 yang_13 sdom_18 ba_23 'tshal_27 
