T02D1887:184a-0	@184a # // rgya gar skad du /	rgya_11 gar_16 skad_20 du_25 
T02D1887:184a-1	sam kshipt'a bhi she ka gu hya s'a m'a dzik /	sam_0 kshipt_4 bhi_13 she_17 ka_21 gu_24 hya_27 s_31 m_35 dzik_39 
T02D1887:184a-2	bod skad du /	'bod_0 skad_4 du_9 
T02D1887:184a-3	'dus pa'i dbang bskur ba mdor bsdus pa /	'du_0 ba_5 dbang_10 skur_16 ba_22 mdor_25 sdud_30 ba_36 
T02D1887:184a-4	byang chub sems dpa' 'phags pa spyan ras gzigs dbang phyug la phyag 'tshal lo //	byang_0 chub_6 sems_11 dpa'_16 'phag_21 ba_28 spyan_31 ras_37 gzigs_41 dbang_47 phyug_53 la_59 phyag_62 'tshal_68 lo_75 
T02D1887:184a-5	dpal rdo rje sems dpa' la phyag 'tshal la //	dpal_0 rdo_5 rje_9 sems_13 dpa'_18 la_23 phyag_26 'tshal_32 la_39 
T02D1887:184a-6	chu dang cod pan rdo rje dang ni dril bu ming //	chu_0 dang_4 cod_9 pan_13 rdo_17 rje_21 dang_25 ni_30 'dril_33 bu_38 ming_41 
T02D1887:184a-7	rigs gsum dang ldan skal ldan slob dpon gsang ba	rigs_0 gsum_5 dang_10 ldan_15 skal_20 ldan_25 slob_30 dpon_35 gsang_40 ba_46 
T02D1887:184a-8	mchog / dbang bskur dam pa dgu po gang zhig	mchog_0 dbang_8 skur_14 dam_20 ba_24 dgu_27 po_31 gang_34 'jig_39 
T02D1887:184a-9	bsod nams dpag med kyis //	bsod_0 nams_5 dpog_10 med_15 kyis_19 
T02D1887:184a-10	srid pa dag par skyed mdzad sgrol ma de la phyag 'tshal lo //	srid_0 ba_5 'dag_8 ba_12 skyed_16 mdzad_22 sgrol_28 ma_34 de_37 la_40 phyag_43 'tshal_49 lo_56 
T02D1887:184a-11	rtsod pa'i dus dang phrad bas yid gzungs rnam zhan cing //	rtsod_0 ba_6 dus_11 dang_15 'phrad_20 ba_26 yid_30 gzungs_34 rnam_41 zhan_46 cing_51 
T02D1887:184a-12	'gro ba shin tu bsdus par 'dod cing nan tan med //	'gro_0 ba_5 shin_8 tu_13 sdud_16 ba_22 'dod_26 cing_31 nan_36 tan_40 med_44 
T02D1887:184a-13	des na dbang rim rgyas ba spangs pa'i dbang bskur mdor bsdus 'di //	des_0 na_4 dbang_7 rim_13 rgya_17 ba_23 spong_26 ba_33 dbang_38 skur_44 mdor_50 sdud_55 'di_61 
T02D1887:184a-14	ngag gi dbang phyug grags pa yis ni brjod par bya //	ngag_0 gi_5 dbang_8 phyug_14 grags_20 ba_26 yis_29 ni_33 rjod_36 ba_42 byed_46 
T02D1887:184a-15	mu stegs la min rmongs la min //	mu_0 stegs_3 la_9 min_12 rmongs_16 la_23 min_26 
T02D1887:184a-16	rtog ge skam po dag la min //	rtogs_0 ge_5 skam_8 po_13 'dag_16 la_20 min_23 
T02D1887:184a-17	nyan thos la min ma ning dang //	nyan_0 thos_5 la_10 min_13 ma_17 ning_20 dang_25 
T02D1887:184a-18	rgan po byis pa la yang min //	rgan_0 po_5 byis_8 ba_13 la_16 yang_19 min_24 
T02D1887:184a-19	rgyal po la min bu la min //	rgyal_0 po_6 la_9 min_12 bu_16 la_19 min_22 
T02D1887:184a-20	dad pa med pa la min pa'i //	dad_0 ba_4 med_7 ba_11 la_14 min_17 ba_21 
T02D1887:184a-21	bdun dang brgyad pa la sbyin pa //	bdun_0 dang_5 brgyad_10 ba_17 la_20 sbyin_23 ba_29 
T02D1887:184a-22	bstan la phan pa 'dogs pa nyid //	ston_0 la_6 phan_9 ba_14 'dogs_17 ba_23 nyid_26 
T02D1887:184a-23	de la re zhig ji lta ba bzhin du dbang	de_0 la_3 re_6 'jig_9 ji_14 lta_17 ba_21 bzhin_24 du_30 dbang_33 
T02D1887:184b-0	@184b bskur zhing rjes su gnang ba thob pa rig	skur_6 zhing_12 rjes_18 su_23 gnang_26 ba_32 'thob_35 ba_40 rig_43 
T02D1887:184b-1	sngags bzlas pa'i sngags pas /	sngags_0 bzlas_7 ba_13 sngags_18 ba_25 
T02D1887:184b-2	sngon la slob ma'i snod brtag ste /	sngon_0 la_6 slob_9 ma_14 snod_19 rtog_24 ste_30 
T02D1887:184b-3	dad pa dang thos pa la sogs pa yongs su	dad_0 ba_4 dang_7 thos_12 ba_17 la_20 sogs_23 ba_28 yongs_31 su_37 
T02D1887:184b-4	sbyangs pa don du gnyer zhing legs par brtags pa'i	sbyong_0 ba_8 don_11 du_15 gnyer_18 zhing_24 legs_30 ba_35 rtog_39 ba_46 
T02D1887:184b-5	skal ba dang ldan pa'i slob ma dag la dbang	skal_0 ba_5 dang_8 ldan_13 ba_18 slob_23 ma_28 'dag_31 la_35 dbang_38 
T02D1887:184b-6	bskur ba la sogs pas gzung bar 'dod pas ;	skur_0 ba_6 la_9 sogs_12 ba_17 gzung_21 ba_27 'dod_31 ba_36 
T02D1887:184b-7	dkyil 'khor la sogs pa'i gnas ni rgyal po dang	dkyil_0 'khor_6 la_12 sogs_15 ba_20 gnas_25 ni_30 rgyal_33 po_39 dang_42 
T02D1887:184b-8	chom rkun la sogs pa nye bar 'tshe ba thams	chom_0 rkun_5 la_10 sogs_13 ba_18 nye_21 ba_25 'tshe_29 ba_35 thams_38 
T02D1887:184b-9	cad dang bral ba'i dkyil 'khor gyi khang pa la	cad_0 dang_4 'bral_9 ba_14 dkyil_19 'khor_25 gyi_31 khang_35 ba_41 la_44 
T02D1887:184b-10	sogs par cho ga ji lta ba bzhin du bris	sogs_0 ba_5 cho_9 ga_13 ji_16 lta_19 ba_23 bzhin_26 du_32 'bri_35 
T02D1887:184b-11	pa'i rdul tshon gyi dkyil 'khor ram /	ba_0 rdul_5 tshon_10 gyi_16 dkyil_20 'khor_26 ram_32 
T02D1887:184b-12	mtshan nyid dang ldan pa'i ras ris la sogs pa'i dkyil 'khor ram /	mtshan_0 nyid_7 dang_12 ldan_17 ba_22 ras_27 ris_31 la_35 sogs_38 ba_43 dkyil_48 'khor_54 ram_60 
T02D1887:184b-13	mngon sum du byas pa'i dkyil 'khor du me tog dang /	mngon_0 sum_6 du_10 byed_13 ba_18 dkyil_23 'khor_29 du_35 me_38 tog_41 dang_45 
T02D1887:184b-14	bdug spos dang /	bdug_0 spros_5 dang_10 
T02D1887:184b-15	lha bshos la sogs pa rnams kyis mchod pa dang	lha_0 bshos_4 la_10 sogs_13 ba_18 rnams_21 kyis_27 mchod_32 ba_38 dang_41 
T02D1887:184b-16	rang gi lha'i rnal 'byor sngon du 'gro bas rang	rang_0 gi_5 lha_8 rnal_14 'byor_19 sngon_25 du_31 'gro_34 ba_39 rang_43 
T02D1887:184b-17	nyid slob ma 'jug pa'i rim pas zhugs la /	nyid_0 slob_5 ma_10 'jug_13 ba_18 rim_23 ba_27 'jug_31 la_37 
T02D1887:184b-18	yol ba'i phyi rol du yon dbul ba dbang bskur	yol_0 ba_4 phyi_9 rol_14 du_18 yon_21 'bul_25 ba_30 dbang_33 skur_39 
T02D1887:184b-19	ba'i skal ba can cig gis slob ma rnam par	ba_0 skal_5 ba_10 can_13 cig_17 gis_21 slob_25 ma_30 rnam_33 ba_38 
T02D1887:184b-20	snang mdzad kyi gzugs su dmigs la /	snang_0 mdzad_6 kyi_12 gzugs_16 su_22 dmigs_25 la_31 
T02D1887:184b-21	a'a kham ba'i ra h'um /	a_0 kham_4 ba_9 ra_14 h_17 
T02D1887:184b-22	zhes pa 'dis me tog gi phreng ba bzung la gdong g-yogs bcings te /	zhes_0 ba_5 'dis_8 me_13 tog_16 gi_20 phreng_23 ba_30 bzung_33 la_39 gdong_42 g-yogs_48 'ching_55 te_62 
T02D1887:184b-23	bgegs mthar byed kyi sngags bzlas pa'i bum pa'i chus bsang gtor byas la /	bgegs_0 mthar_6 byed_12 kyi_17 sngags_21 bzlas_28 ba_34 bum_39 ba_43 chus_48 bsang_53 'thor_59 byed_64 la_69 
T02D1887:184b-24	dkyil 'khor du gzhug pa'i don du kye bde ba dga' ba khyod su yin zhes dri bar bya'o //	dkyil_0 'khor_6 du_12 'jug_15 ba_21 don_26 du_30 kye_33 bde_37 ba_41 dga'_44 ba_49 khyod_52 su_58 yin_61 zhes_65 'dri_70 ba_74 byed_78 
T02D1887:184b-25	des kyang bde chen bdag ni skal ba bzang po zhes brjod par bya'o //	des_0 kyang_4 bde_10 chen_14 bdag_19 ni_24 skal_27 ba_32 bzang_35 po_41 zhes_44 rjod_49 ba_55 byed_59 
T02D1887:184b-26	de ma thag tu /	de_0 ma_3 thag_6 tu_11 
T02D1887:184b-27	aom sarbba yo ga tsittam autp'a da y'a mi /	aom_0 sarbba_4 yo_11 ga_14 tsittam_17 autp_25 da_32 y_35 mi_39 
T02D1887:184b-28	zhes pa 'dis byang chub tu sems bskyed par bya'o //	zhes_0 ba_5 'dis_8 byang_13 chub_19 tu_24 sems_27 skyed_32 ba_39 byed_43 
T02D1887:184b-29	de nas rdo rje dang bcas pa'i rdo rje aom	de_0 nas_3 rdo_7 rje_11 dang_15 'cha'_20 ba_25 rdo_30 rje_34 aom_38 
T02D1887:184b-30	su ra te sa ma ya stvam ho siddhi badzra	su_0 ra_3 te_6 sa_9 ma_12 ya_15 stvam_18 ho_24 siddhi_27 badzra_34 
T02D1887:184b-31	ya th'a su kham /	ya_0 th_3 su_8 kham_11 
T02D1887:184b-32	zhes pa 'dis snying gar rdo rje gzhag par bya'o //	zhes_0 ba_5 'dis_8 snying_13 gar_20 rdo_24 rje_28 'jog_32 ba_38 byed_42 
T02D1887:184b-33	de nas sngar smras pa'i yi ge lnga pos yol	de_0 nas_3 sngar_7 smras_13 ba_19 yi_24 ge_27 lnga_30 pos_35 yol_39 
T02D1887:184b-34	ba'i nang du bcug la 'di skad brjod par bya'o	ba_0 nang_5 du_10 'jug_13 la_18 'di_21 skad_25 rjod_30 ba_36 byed_40 
T02D1887:184b-35	// deng khyod de bzhin gshegs pa thams cad kyi	deng_3 khyod_8 de_14 bzhin_17 gshegs_23 ba_30 thams_33 cad_39 kyi_43 
T02D1887:184b-36	rigs su zhugs kyis ngas khyod la rdo rje'i ye	rigs_0 su_5 'jug_8 kyis_14 ngas_19 khyod_24 la_30 rdo_33 rje_37 ye_43 
T02D1887:184b-37	shes 'di bskyed par bya yis /	shes_0 'di_5 skyed_9 ba_16 byed_20 yis_24 
T02D1887:184b-38	ye shes gang gis khyod de bzhin gshegs pa'i ye shes kyang thob par 'gyur na /	ye_0 shes_3 gang_8 gis_13 khyod_17 de_23 bzhin_26 gshegs_32 ba_39 ye_44 shes_47 kyang_52 'thob_58 ba_63 'gyur_67 na_73 
T02D1887:184b-39	dngos grub gzhan lta ci smos /	dngos_0 'grub_6 gzhan_11 lta_17 ci_21 smos_24 
T02D1887:184b-40	khyod kyis 'di dkyil 'khor ma mthong ba'i mdun du	khyod_0 kyis_6 'di_11 dkyil_15 'khor_21 ma_27 mthong_30 ba_37 mdun_42 du_47 
T02D1887:184b-41	smra bar ma byed cig / smras na khyod dam	smra_0 ba_5 ma_9 byed_12 cig_17 smras_23 na_29 khyod_32 dam_38 
T02D1887:184b-42	tshig nyams par 'gyur ta re /	tshig_0 nyams_6 ba_12 'gyur_16 ta_22 re_25 
T02D1887:185a-0	de nas rdo rje mgo bor bzhag nas 'di skad ces brjod @185a * //	de_0 nas_3 rdo_7 rje_11 mgo_15 'bor_19 'jog_23 nas_29 'di_33 skad_37 ces_42 rjod_46 
T02D1887:185a-1	zhe sdang chen po'i nyams dang ldan pas na phat gnyis pa'o //	zhe_0 sdang_4 chen_10 po_15 nyams_20 dang_26 ldan_31 ba_36 na_40 phat_43 gnyis_48 ba_54 
T02D1887:185a-2	mthu rgyun mi 'chad pa'i don gyis na sv'a h'a /	mthu_0 rgyun_5 mi_11 'chad_14 ba_20 don_25 gyis_29 na_34 sv_37 h_42 
T02D1887:185a-3	de nas bcom ldan 'das de bzhin gshegs pa thams	de_0 nas_3 'joms_7 ldan_12 'da'_17 de_22 bzhin_25 gshegs_31 ba_38 thams_41 
T02D1887:185a-4	cad kyi bdag pos gti mug rdo rje chen po'i	cad_0 kyi_4 bdag_8 pos_13 gti_17 mug_21 rdo_25 rje_29 chen_33 po_38 
T02D1887:185a-5	sngags gsungs pa / aom dzin dzik ces bya ba smos te dzi ni byang chub kyi sems te ;	sngags_0 gsungs_7 ba_14 aom_19 dzin_23 dzik_28 ces_33 byed_37 ba_41 smos_44 te_49 dzi_52 ni_56 byang_59 chub_65 kyi_70 sems_74 te_79 
T02D1887:185a-6	na ni gti mug mi gnas par bya ba'i don to //	na_0 ni_3 gti_6 mug_10 mi_14 gnas_17 ba_22 byed_26 ba_30 don_35 to_39 
T02D1887:185a-7	dzik ni 'dzin pa ste gti mug chen pos 'gro ba thams cad sangs rgyas su 'dzin pa'o //	dzik_0 ni_5 'dzin_8 ba_14 ste_17 gti_21 mug_25 chen_29 pos_34 'gro_38 ba_43 thams_46 cad_52 sangs_56 rgya_62 su_68 'dzin_71 ba_77 
T02D1887:185a-8	de nas bcom ldan 'das de bzhin gshegs pa thams	de_0 nas_3 'joms_7 ldan_12 'da'_17 de_22 bzhin_25 gshegs_31 ba_38 thams_41 
T02D1887:185a-9	cad kyi bdag pos phra ma rdo rje'i sngags gsungs	cad_0 kyi_4 bdag_8 pos_13 phra_17 ma_22 rdo_25 rje_29 sngags_35 gsungs_42 
T02D1887:185a-10	pa / aom ratna dhrik ces bya ba smos te /	ba_0 aom_5 ratna_9 dhrik_15 ces_21 byed_25 ba_29 smos_32 te_37 
T02D1887:185a-11	ratna ni rin po che ste /	ratna_0 ni_6 rin_9 po_13 che_16 ste_20 
T02D1887:185a-12	sangs rgyas pa'i bar du che ba'i yon tan zad mi shes pa'i don to //	sangs_0 rgya_6 ba_12 ba_17 du_21 che_24 ba_28 yon_33 tan_37 zad_41 mi_45 shes_48 ba_53 don_58 to_62 
T02D1887:185a-13	dhrik ni brtul zhugs te phra ma chen po'i brtul	dhrik_0 ni_6 brtul_9 'jug_15 te_21 phra_24 ma_29 chen_32 po_37 brtul_42 
T02D1887:185a-14	zhugs kyis dri ma ma lus pa 'byed par byed	'jug_0 kyis_6 'dri_11 ma_15 ma_18 lus_21 ba_25 'byed_28 ba_34 byed_38 
T02D1887:185a-15	pa'i don to // de nas bcom ldan 'das de	ba_0 don_5 to_9 de_15 nas_18 'joms_22 ldan_27 'da'_32 de_37 
T02D1887:185a-16	bzhin gshegs pa thams cad kyi bdag pos 'dod chags	bzhin_0 gshegs_6 ba_13 thams_16 cad_22 kyi_26 bdag_30 pos_35 'dod_39 chags_44 
T02D1887:185a-17	rdo rje'i sngags gsungs pa ;	rdo_0 rje_4 sngags_10 gsungs_17 ba_24 
T02D1887:185a-18	aom aa ro lik ces bya ba smos te aa ni ma skyes pa'o //	aom_0 aa_4 ro_7 lik_10 ces_14 byed_18 ba_22 smos_25 te_30 aa_33 ni_36 ma_39 skye_42 ba_48 
T02D1887:185a-19	ro ni nyams su myong ba'o //	ro_0 ni_3 nyams_6 su_12 myong_15 ba_21 
T02D1887:185a-20	lik ni mngon par zhen pa ste 'dod chags chen pos sems can 'dul bar byed pa'i don to //	lik_0 ni_4 mngon_7 ba_13 zhen_17 ba_22 ste_25 'dod_29 chags_34 chen_40 pos_45 sems_49 can_54 'dul_58 ba_63 byed_67 ba_72 don_77 to_81 
T02D1887:185a-21	de nas bcom ldan 'das de bzhin gshegs pa thams	de_0 nas_3 'joms_7 ldan_12 'da'_17 de_22 bzhin_25 gshegs_31 ba_38 thams_41 
T02D1887:185a-22	cad kyi bdag pos phrag dog rdo rje'i sngags gsungs	cad_0 kyi_4 bdag_8 pos_13 phrag_17 dog_23 rdo_27 rje_31 sngags_37 gsungs_44 
T02D1887:185a-23	pa / aom pradzny'a dhrik ces bya ba smos te /	ba_0 aom_5 pradzny_9 dhrik_19 ces_25 byed_29 ba_33 smos_36 te_41 
T02D1887:185a-24	pradzny'a ni shes rab ste /	pradzny_0 ni_10 shes_13 rab_18 ste_22 
T02D1887:185a-25	chos thams cad gcig dang du ma dang bral bas rang bzhin med pa nyid du byas pa'o //	chos_0 thams_5 cad_11 gcig_15 dang_20 du_25 ma_28 dang_31 'bral_36 ba_41 rang_45 bzhin_50 med_56 ba_60 nyid_63 du_68 byed_71 ba_76 
T02D1887:185a-26	dhrik ni rang la gnas pa ste yon tan dang ldan pa'i 'bras bu gzhan la phrag dog pa'o //	dhrik_0 ni_6 rang_9 la_14 gnas_17 ba_22 ste_25 yon_29 tan_33 dang_37 ldan_42 ba_47 'bras_52 bu_58 gzhan_61 la_67 phrag_70 dog_76 ba_80 
T02D1887:185a-27	de nas bcom ldan 'das de bzhin gshags pa thams	de_0 nas_3 'joms_7 ldan_12 'da'_17 de_22 bzhin_25 gshags_31 ba_38 thams_41 
T02D1887:185a-28	cad kyi bdag pos rdo rje tho ba'i sngags gsungs	cad_0 kyi_4 bdag_8 pos_13 rdo_17 rje_21 tho_25 ba_29 sngags_34 gsungs_41 
T02D1887:185a-29	pa / aom mudga ra dhrik ces bya ba smos te /	ba_0 aom_5 mudga_9 ra_15 dhrik_18 ces_24 byed_28 ba_32 smos_35 te_40 
T02D1887:185a-30	mudga ra ni thob ste dad pa rnam par dag pa'i stobs dang ldan pa'o //	mudga_0 ra_6 ni_9 'thob_12 ste_17 dad_21 ba_25 rnam_28 ba_33 'dag_37 ba_41 stobs_46 dang_52 ldan_57 ba_62 
T02D1887:185a-31	dhrik ni brtul zhugs te phung po'i bdud zad par byed pa'o //	dhrik_0 ni_6 brtul_9 'jug_15 te_21 'phung_24 po_30 bdud_35 zad_40 ba_44 byed_48 ba_53 
T02D1887:185a-32	de nas bcom ldan 'das de bzhin gshegs pa thams	de_0 nas_3 'joms_7 ldan_12 'da'_17 de_22 bzhin_25 gshegs_31 ba_38 thams_41 
T02D1887:185a-33	cad kyi bdag pos rdo rje dbyug pa'i sngags gsungs	cad_0 kyi_4 bdag_8 pos_13 rdo_17 rje_21 dbyug_25 ba_31 sngags_36 gsungs_43 
T02D1887:185a-34	pa / aom danda dhrik ces bya ba smos te /	ba_0 aom_5 danda_9 dhrik_15 ces_21 byed_25 ba_29 smos_32 te_37 
T02D1887:185a-35	danda ni dbyug pa'o //	danda_0 ni_6 dbyug_9 ba_15 
T02D1887:185a-36	des 'joms par byed pa ste brtson 'grus rnam par dag pa'i stobs dang ldan pa'o //	des_0 'joms_4 ba_10 byed_14 ba_19 ste_22 brtson_26 'grus_33 rnam_39 ba_44 'dag_48 ba_52 stobs_57 dang_63 ldan_68 ba_73 
T02D1887:185a-37	dhrik ni brtul zhugs te nyon mongs pa'i bdud zad par byed pa'o //	dhrik_0 ni_6 brtul_9 'jug_15 te_21 nyon_24 mongs_29 ba_35 bdud_40 zad_45 ba_49 byed_53 ba_58 
T02D1887:185b-0	de nas bcom @185b ldan 'das de bzhin gshegs pa	de_0 nas_3 'joms_7 ldan_18 'da'_23 de_28 bzhin_31 gshegs_37 ba_44 
T02D1887:185b-1	thams cad kyi bdag pos rdo rje padma'i sngags gsungs	thams_0 cad_6 kyi_10 bdag_14 pos_19 rdo_23 rje_27 padma_31 sngags_39 gsungs_46 
T02D1887:185b-2	pa / aom padma dhrik ces bya ba smos te padma ni chags pa'i don to //	ba_0 aom_5 padma_9 dhrik_15 ces_21 byed_25 ba_29 smos_32 te_37 padma_40 ni_46 chags_49 ba_55 don_60 to_64 
T02D1887:185b-3	dran pa rnam par dag pa nyid yod pas so //	dran_0 ba_5 rnam_8 ba_13 'dag_17 ba_21 nyid_24 yod_29 ba_33 so_37 
T02D1887:185b-4	dhrik ni brtul zhugs te 'chi bdag gi bdud zad par byed pa'o //	dhrik_0 ni_6 brtul_9 'jug_15 te_21 'chi_24 bdag_29 gi_34 bdud_37 zad_42 ba_46 byed_50 ba_55 
T02D1887:185b-5	de nas bcom ldan 'das de bzhin gshegs pa thams	de_0 nas_3 'joms_7 ldan_12 'da'_17 de_22 bzhin_25 gshegs_31 ba_38 thams_41 
T02D1887:185b-6	cad kyi bdag pos rdo rje ral gri'i sngags gsungs	cad_0 kyi_4 bdag_8 pos_13 rdo_17 rje_21 ral_25 gri_29 sngags_35 gsungs_42 
T02D1887:185b-7	pa / aom khadga dhrik ces bya ba smos te /	ba_0 aom_5 khadga_9 dhrik_16 ces_22 byed_26 ba_30 smos_33 te_38 
T02D1887:185b-8	khadga ni ral gri'o //	khadga_0 ni_7 ral_10 gri_14 
T02D1887:185b-9	de ni zag pa med pa'i don shes rab kyi	de_0 ni_3 zag_6 ba_10 med_13 ba_17 don_22 shes_26 rab_31 kyi_35 
T02D1887:185b-10	rang bzhin te ting nge 'dzin gyi stobs rnam par	rang_0 bzhin_5 te_11 ting_14 nge_19 'dzin_23 gyi_29 stobs_33 rnam_39 ba_44 
T02D1887:185b-11	dag pa'o // dhrik ni brtul zhugs te lha'i bu	'dag_0 ba_4 dhrik_12 ni_18 brtul_21 'jug_27 te_33 lha_36 bu_42 
T02D1887:185b-12	rnam par g-yeng byed kyi bdud pham phar byed pa'o	rnam_0 ba_5 g-yeng_9 byed_16 kyi_21 bdud_25 'pham_30 phar_35 byed_40 ba_45 
T02D1887:185b-13	dag pa'o // // de nas bcom ldan 'das de	'dag_0 ba_4 de_15 nas_18 'joms_22 ldan_27 'da'_32 de_37 
T02D1887:185b-14	bzhin gshegs pa thams cad kyi bdag pos rdo rje	bzhin_0 gshegs_6 ba_13 thams_16 cad_22 kyi_26 bdag_30 pos_35 rdo_39 rje_43 
T02D1887:185b-15	tsa rtsi ka'i sngags gsungs pa /	tsa_0 rtsi_4 ka_9 sngags_14 gsungs_21 ba_28 
T02D1887:185b-16	aom mo ha ra ti zhes bya ba smos te /	aom_0 mo_4 ha_7 ra_10 ti_13 zhes_16 byed_21 ba_25 smos_28 te_33 
T02D1887:185b-17	mo ha ra ni rnam par dag pa ste bde ba chen pos yongs su gang ba'i yid de /	mo_0 ha_3 ra_6 ni_9 rnam_12 ba_17 'dag_21 ba_25 ste_28 bde_32 ba_36 chen_39 pos_44 yongs_48 su_54 gang_57 ba_62 yid_67 de_71 
T02D1887:185b-18	gti mug gshin rje gshed la gnyis su med pa rdzogs pas ti'o //	gti_0 mug_4 gshin_8 rje_14 gshed_18 la_24 gnyis_27 su_33 med_36 ba_40 rdzogs_43 ba_50 ti_54 
T02D1887:185b-19	de nas bcom ldan 'das de bzhin gshegs pa thams	de_0 nas_3 'joms_7 ldan_12 'da'_17 de_22 bzhin_25 gshegs_31 ba_38 thams_41 
T02D1887:185b-20	cad kyi bdag pos rdo rje phag mo'i sngags gsungs	cad_0 kyi_4 bdag_8 pos_13 rdo_17 rje_21 phag_25 mo_30 sngags_35 gsungs_42 
T02D1887:185b-21	pa / aom dhve shva ra ti zhes bya ba smos te /	ba_0 aom_5 dhve_9 shva_14 ra_19 ti_22 zhes_25 byed_30 ba_34 smos_37 te_42 
T02D1887:185b-22	dhve zhes bya ba ni lha ste bde ba'i rol pas mngon par rtse ba'o //	dhve_0 zhes_5 byed_10 ba_14 ni_17 lha_20 ste_24 bde_28 ba_32 rol_37 ba_41 mngon_45 ba_51 rtse_55 ba_60 
T02D1887:185b-23	zhe sdang chen po'i thugs la rab tu dbang ba'i phyir shva ra ste dbang phyug go //	zhe_0 sdang_4 chen_10 po_15 thugs_20 la_26 rab_29 tu_33 dbang_36 ba_42 phyir_47 shva_53 ra_58 ste_61 dbang_65 phyug_71 go_77 
T02D1887:185b-24	bcom ldan 'das kyi sku la mngon par rdzogs pas na ti'o //	'joms_0 ldan_5 'da'_10 kyi_15 sku_19 la_23 mngon_26 ba_32 rdzogs_36 ba_43 na_47 ti_50 
T02D1887:185b-25	de nas bcom ldan 'das de bzhin gshegs pa thams	de_0 nas_3 'joms_7 ldan_12 'da'_17 de_22 bzhin_25 gshegs_31 ba_38 thams_41 
T02D1887:185b-26	cad kyi bdag pos rdo rje dbyangs can ma'i sngags	cad_0 kyi_4 bdag_8 pos_13 rdo_17 rje_21 dbyangs_25 can_33 ma_37 sngags_42 
T02D1887:185b-27	gsungs pa / aom r'a ga ra ti zhes bya	gsungs_0 ba_7 aom_12 r_16 ga_20 ra_23 ti_26 zhes_29 byed_34 
T02D1887:185b-28	ba smos pas r'a ga ni tshon te sna tshogs	ba_0 smos_3 ba_8 r_12 ga_16 ni_19 tshon_22 te_28 sna_31 tshogs_35 
T02D1887:185b-29	pa'i mdangs dang ldan pa'o //	ba_0 mdangs_5 dang_12 ldan_17 ba_22 
T02D1887:185b-30	ra ni khrag ste mnyes par byed pa'o //	ra_0 ni_3 khrag_6 ste_12 mnyes_16 ba_22 byed_26 ba_31 
T02D1887:185b-31	'dod chags rdo rje'i sku la yongs su rdzogs pas ti'o //	'dod_0 chags_5 rdo_11 rje_15 sku_21 la_25 yongs_28 su_34 rdzogs_37 ba_44 ti_48 
T02D1887:185b-32	de nas bcom ldag 'das de bzhin gshegs pa thams	de_0 nas_3 'joms_7 ldag_12 'da'_17 de_22 bzhin_25 gshegs_31 ba_38 thams_41 
T02D1887:185b-33	cad kyi bdag pos rdo rje go r'i ma'i sngags	cad_0 kyi_4 bdag_8 pos_13 rdo_17 rje_21 go_25 r_28 ma_32 sngags_37 
T02D1887:185b-34	gsungs pa / aom badzra ra ti'i zhes bya ba smos te /	gsungs_0 ba_7 aom_12 badzra_16 ra_23 ti_26 zhes_31 byed_36 ba_40 smos_43 te_48 
T02D1887:185b-35	badzra ni rdo rje ste dbyer mi phyed pa'i don to //	badzra_0 ni_7 rdo_10 rje_14 ste_18 dbyer_22 mi_28 phyed_31 ba_37 don_42 to_46 
T02D1887:185b-36	ra ni khrag ste snying rjes nye bar 'dzin pa'o //	ra_0 ni_3 khrag_6 ste_12 snying_16 rjes_23 nye_28 ba_32 'dzin_36 ba_42 
T02D1887:185b-37	phrag dog rdo rje'i sku la rdzogs pa nyid kyis te'o //	phrag_0 dog_6 rdo_10 rje_14 sku_20 la_24 rdzogs_27 ba_34 nyid_37 kyis_42 te_47 
T02D1887:185b-38	de yang thams cad gsangs ba las /	de_0 yang_3 thams_8 cad_14 gsangs_18 ba_25 las_28 
T02D1887:185b-39	bcom ldan 'das kyis byin brlabs pa'i //	'joms_0 ldan_5 'da'_10 kyis_15 byin_20 brlabs_25 ba_32 
T02D1887:185b-40	nor bu lta bu'i sngags rnams ni //	nor_0 bu_4 lta_7 bu_11 sngags_16 rnams_23 ni_29 
T02D1887:185b-41	gsang chen rab tu sbyor ba yis //	gsang_0 chen_6 rab_11 tu_15 sbyor_18 ba_24 yis_27 
T02D1887:185b-42	'di ni bsam dpag dka' ba ste //	'di_0 ni_4 bsam_7 dpog_12 dka'_17 ba_22 ste_25 
T02D1887:186a-0	'di @186a * //	'di_0 
T02D1887:186a-1	dkyil na bzhugs pa'i de bzhin gshegs pa thams cad	dkyil_0 na_6 bzhugs_9 ba_16 de_21 bzhin_24 gshegs_30 ba_37 thams_40 cad_46 
T02D1887:186a-2	rdo rje'i gzugs kyis cod pan la bzhugs par bsam	rdo_0 rje_4 gzugs_10 kyis_16 cod_21 pan_25 la_29 bzhugs_32 ba_39 bsam_43 
T02D1887:186a-3	par bya'o // de dag ni cod pan gyi dbang bskur ba'i cho ga'o //	ba_0 byed_4 de_13 'dag_16 ni_20 cod_23 pan_27 gyi_31 dbang_35 skur_41 ba_47 cho_52 ga_56 
T02D1887:186a-4	de nas rdo rje blangs la /	de_0 nas_3 rdo_7 rje_11 blangs_15 la_22 
T02D1887:186a-5	sangs rgyas rnams kyis rdo rje'i dbang //	sangs_0 rgya_6 rnams_12 kyis_18 rdo_23 rje_27 dbang_33 
T02D1887:186a-6	de ring khyod la bskur bar bya //	de_0 ring_3 khyod_8 la_14 skur_17 ba_23 byed_27 
T02D1887:186a-7	'di de sangs rgyas thams cad nyid //	'di_0 de_4 sangs_7 rgya_13 thams_19 cad_25 nyid_29 
T02D1887:186a-8	rab tu grub phyir rdo rje zung //	rab_0 tu_4 'grub_7 phyir_12 rdo_18 rje_22 zung_26 
T02D1887:186a-9	zhes gdon zhing rdo rje snying ga la sogs par	zhes_0 'don_5 zhing_10 rdo_16 rje_20 snying_24 ga_31 la_34 sogs_37 ba_42 
T02D1887:186a-10	reg nas rdo rje lag pa g-yas su sbyin par	reg_0 nas_4 rdo_8 rje_12 lag_16 ba_20 g-yas_23 su_29 sbyin_32 ba_38 
T02D1887:186a-11	bya'o // de dag ni rdo rje'i dbang bskur ba'i cho ga'o //	byed_0 de_9 'dag_12 ni_16 rdo_19 rje_23 dbang_29 skur_35 ba_41 cho_46 ga_50 
T02D1887:186a-12	de nas lag pa g-yon par dril bu byin la	de_0 nas_3 lag_7 ba_11 g-yon_14 ba_20 'dril_24 bu_29 byin_32 la_37 
T02D1887:186a-13	rdo rje dang dril bur ldan pa'i slob ma'i lag	rdo_0 rje_4 dang_8 'dril_13 bur_18 ldan_22 ba_27 slob_32 ma_37 lag_42 
T02D1887:186a-14	pa gnyis kyis 'khyud pa'i tshul du bcug la /	ba_0 gnyis_3 kyis_9 'khyud_14 ba_21 tshul_26 du_32 'jug_35 la_40 
T02D1887:186a-15	aom badzra aa dhi pa ti stvam aa bhi shinyts'a mi tishtha badzra sa ma ya stvam /	aom_0 badzra_4 aa_11 dhi_14 ba_18 ti_21 stvam_24 aa_30 bhi_33 shinyts_37 mi_47 tishtha_50 badzra_58 sa_65 ma_68 ya_71 stvam_74 
T02D1887:186a-16	zhes gdon par bya'o //	zhes_0 'don_5 ba_10 byed_14 
T02D1887:186a-17	dril bu'i dbang bskur ba ni bdag po'i dbang bskur ba zhes brjod do //	'dril_0 bu_5 dbang_10 skur_16 ba_22 ni_25 bdag_28 po_33 dbang_38 skur_44 ba_50 zhes_53 rjod_58 do_64 
T02D1887:186a-18	de dag ni dril bu'i dbang bskur ba'i cho ga'o //	de_0 'dag_3 ni_7 'dril_10 bu_15 dbang_20 skur_26 ba_32 cho_37 ga_41 
T02D1887:186a-19	de'i rjes la rdo rje dang dril bu slob ma'i spyi bor bzung la /	de_0 rjes_5 la_10 rdo_13 rje_17 dang_21 'dril_26 bu_31 slob_34 ma_39 spyi_44 'bor_49 bzung_53 la_59 
T02D1887:186a-20	aom badzra satva tvam aa bhi shinyts'a mi badzra na ma aa bhi she ka ta /	aom_0 badzra_4 satva_11 tvam_17 aa_22 bhi_25 shinyts_29 mi_39 badzra_42 na_49 ma_52 aa_55 bhi_58 she_62 ka_66 ta_69 
T02D1887:186a-21	kye dpal che ge mo rdo rje zhes rigs dang mthun pa'i ming dag gdags so //	kye_0 dpal_4 che_9 ge_13 mo_16 rdo_19 rje_23 zhes_27 rigs_32 dang_37 mthun_42 ba_48 ming_53 'dag_58 'dogs_62 so_68 
T02D1887:186a-22	dbang bskur ba de dag gis ni sngags dang rgyud	dbang_0 skur_6 ba_12 de_15 'dag_18 gis_22 ni_26 sngags_29 dang_36 brgyud_41 
T02D1887:186a-23	nyan pa dang 'chad pa dang sngags sgrub pa la	nyan_0 ba_5 dang_8 'chad_13 ba_19 dang_22 sngags_27 sgrub_34 ba_40 la_43 
T02D1887:186a-24	dbang bskur bya bar 'gyur ro //	dbang_0 skur_6 byed_12 ba_16 'gyur_20 ro_26 
T02D1887:186a-25	dbang bskur ba lnga po de nyid ni rig pa'i dbang bskur ba zhes brjod de /	dbang_0 skur_6 ba_12 lnga_15 po_20 de_23 nyid_26 ni_31 rig_34 ba_38 dbang_43 skur_49 ba_55 zhes_58 rjod_63 de_69 
T02D1887:186a-26	thams cad du spyan ma la sogs pa'i rigs rnams kyi bya ba yod pa'i phyir ro //	thams_0 cad_6 du_10 spyan_13 ma_19 la_22 sogs_25 ba_30 rigs_35 rnams_40 kyi_46 byed_50 ba_54 yod_57 ba_61 phyir_66 ro_72 
T02D1887:186a-27	de dag ni ming gi dbang bskur ba'i cho ga'o //	de_0 'dag_3 ni_7 ming_10 gi_15 dbang_18 skur_24 ba_30 cho_35 ga_39 
T02D1887:186a-28	de'i rjes la rig pa'i dbang bskur ba blangs shing slob dpon gyi sdom pa blangs pa la /	de_0 rjes_5 la_10 rig_13 ba_17 dbang_22 skur_28 ba_34 blangs_37 shing_44 slob_50 dpon_55 gyi_60 sdom_64 ba_69 blangs_72 ba_79 la_82 
T02D1887:186a-29	rdo rje slob dpon dbang bskur ba //	rdo_0 rje_4 slob_8 dpon_13 dbang_18 skur_24 ba_30 
T02D1887:186a-30	gang gis khyod kyi drin gyis dag / bdag dang gzhan don nus 'gyur ba //	gang_0 gis_5 khyod_9 kyi_15 drin_19 gyis_24 'dag_29 bdag_35 dang_40 gzhan_45 don_51 nus_55 'gyur_59 ba_65 
T02D1887:186a-31	brtse ba'i gter gyis bdag la stsol //	brtse_0 ba_6 gter_11 gyis_16 bdag_21 la_26 stsol_29 
T02D1887:186a-32	zhes gsol ba btab par gyur pa'i slob ma la	zhes_0 gsol_5 ba_10 'debs_13 ba_18 gyur_22 ba_27 slob_32 ma_37 la_40 
T02D1887:186a-33	bsam gtan gyi spyan la sogs pa rnams kyis dbang	bsam_0 gtan_5 gyi_10 spyan_14 la_20 sogs_23 ba_28 rnams_31 kyis_37 dbang_42 
T02D1887:186a-34	bskur nas dam tshig gsum 'dzin du gzhug go //	skur_0 nas_6 dam_10 tshig_14 gsum_20 'dzin_25 du_31 'jug_34 go_40 
T02D1887:186a-35	de la dam tshig gsum ni 'di yin te /	de_0 la_3 dam_6 tshig_10 gsum_16 ni_21 'di_24 yin_28 te_32 
T02D1887:186a-36	h'um gi yi ge rdo rjer bsams nas /	h_0 gi_5 yi_8 ge_11 rdo_14 rjer_18 bsams_23 nas_29 
T02D1887:186a-37	thog mtha' med pa'i sems dpa' ni //	thogs_0 mtha'_5 med_11 ba_15 sems_20 dpa'_25 ni_30 
T02D1887:186a-38	rdo rje sems dpa' dga' ba che //	rdo_0 rje_4 sems_8 dpa'_13 dga'_18 ba_23 che_26 
T02D1887:186a-39	kun tu bzang po kun bdag nyid //	kun_0 tu_4 bzang_7 po_13 kun_16 bdag_20 nyid_25 
T02D1887:186a-40	rdo rje snyems tshul bdag po'i bdag / bcom ldan	rdo_0 rje_4 snyems_8 tshul_15 bdag_21 po_26 bdag_31 'joms_38 ldan_43 
T02D1887:186b-0	'das dam pa dang po'i skyes @186b bu'o zhes bya	'da'_0 dam_5 ba_9 dang_12 po_17 skye_22 bu_34 zhes_39 byed_44 
T02D1887:186b-1	ba de kho na nyid rdo rje gzung ngo //	ba_0 de_3 kho_6 na_10 nyid_13 rdo_18 rje_22 gzung_26 ngo_32 
