T02D2205:173a-28	de la sogs pa'i mchod pa'i tshogs //	de_0 la_3 sogs_6 ba_11 mchod_16 ba_22 tshogs_27 
T02D2205:173a-29	ci 'byor thams cad dbul bar bya //	ci_0 'byor_3 thams_9 cad_15 'bul_19 ba_24 byed_28 
T02D2205:173a-30	dang por sems bskyed phyag 'tshal nas //	dang_0 por_5 sems_9 skyed_14 phyag_21 'tshal_27 nas_34 
T02D2205:173a-31	skyabs gsol sngom pa gzung bar bya //	skyob_0 gsol_7 sngom_12 ba_18 gzung_21 ba_27 byed_31 
T02D2205:173a-32	dbang bzhi'i dkyil 'khor lha las blang //	dbang_0 bzhi_6 dkyil_13 'khor_19 lha_25 las_29 blang_33 
T02D2205:173a-33	yang na nam mkha'i dbyings su blang //	yang_0 na_5 nam_8 mkha_12 dbyings_19 su_27 blang_30 
T02D2205:173a-34	thos dang bsam pas bdag nyid 'jug pa'o //	thos_0 dang_5 bsam_10 ba_15 bdag_19 nyid_24 'jug_29 ba_34 
T02D2205:173a-35	de nas slob ma gzhug par bya //	de_0 nas_3 slob_7 ma_12 'jug_15 ba_21 byed_25 
T02D2205:173a-36	phyi rol khrus kyi cho ga bya //	phyi_0 rol_5 'khru_9 kyi_15 cho_19 ga_23 byed_26 
T02D2205:173a-37	bum par gyur dang rdzas rnams dgram //	bum_0 ba_4 gyur_8 dang_13 rdzas_18 rnams_24 'grem_30 
T02D2205:173a-38	ci 'byor yon rnams dbul bar bya //	ci_0 'byor_3 yon_9 rnams_13 'bul_19 ba_24 byed_28 
T02D2205:173a-39	sems bskyed sdom pa la sogs sngon bzhin bya //	sems_0 skyed_5 sdom_12 ba_17 la_20 sogs_23 sngon_28 bzhin_34 byed_40 
T02D2205:173a-40	sdom pa legs par 'dzin pa la //	sdom_0 ba_5 legs_8 ba_13 'dzin_17 ba_23 la_26 
T02D2205:173a-41	bka' bsgo dam tshig bdud rtsi blud //	bka'_0 sgo_5 dam_10 tshig_14 bdud_20 rtsi_25 blud_30 
T02D2205:173a-42	yid 'ong rnal 'byor chen po khyod //	yid_0 'ong_4 rnal_9 'byor_14 chen_20 po_25 khyod_28 
T02D2205:173a-43	gos sngon dkyil 'khor chen por chud //	gos_0 sngon_4 dkyil_10 'khor_16 chen_22 por_27 chud_31 
T02D2205:173a-44	nga yis khyod la dngos grub 'byung //	nga_0 yis_4 khyod_8 la_14 dngos_17 'grub_23 'byung_28 
T02D2205:173a-45	sangs rgyas kun gyis byin gyis rlob //	sangs_0 rgya_6 kun_12 gyis_16 byin_21 gyis_26 rlob_31 
T02D2205:173b-0	ces ba ni spro ba @173b bskyed pa'o //	ces_0 ba_4 ni_7 spro_10 ba_15 skyed_24 ba_31 
T02D2205:173b-1	gsang mchog gos sngon dkyil 'khor 'di //	gsang_0 mchog_6 gos_12 sngon_16 dkyil_22 'khor_28 'di_34 
T02D2205:173b-2	sems can dad pa med pa dang //	sems_0 can_5 dad_9 ba_13 med_16 ba_20 dang_23 
T02D2205:173b-3	gang yang log chos spyod pa dang //	gang_0 yang_5 log_10 chos_14 spyod_19 ba_25 dang_28 
T02D2205:173b-4	mnar med ngan song rgyud can dang //	mnar_0 med_5 ngan_9 'gro_14 brgyud_19 can_25 dang_29 
T02D2205:173b-5	rna bar ming yang bsgrag mi bya //	rna_0 ba_4 ming_8 yang_13 sgrog_18 mi_25 byed_28 
T02D2205:173b-6	zhes pa ni gdams ngag go //	zhes_0 ba_5 ni_8 'doms_11 ngag_17 go_22 
T02D2205:173b-7	gal te de la smras gyur na //	gal_0 te_4 de_7 la_10 smras_13 gyur_19 na_24 
T02D2205:173b-8	dam can chad pas bcad nas ni //	dam_0 can_4 'chad_8 ba_13 gcod_17 nas_22 ni_26 
T02D2205:173b-9	cho yi 'du byed 'di bskum nas //	cho_0 yi_4 'du_7 byed_11 'di_16 skum_20 nas_26 
T02D2205:173b-10	mnar med dmyal bar myur du dengs //	mnar_0 med_5 dmyal_9 ba_15 myur_19 du_24 dengs_27 
T02D2205:173b-11	gos sngon chen pos mdo la spong //	gos_0 sngon_4 chen_10 pos_15 mdo_19 la_23 spong_26 
T02D2205:173b-12	zhes pa 'di ni skyon bstan pa'o //	zhes_0 ba_5 'di_8 ni_12 skyon_15 ston_21 ba_27 
T02D2205:173b-13	de nas snying nang sems dpa' bskyed //	de_0 nas_3 snying_7 nang_14 sems_19 dpa'_24 skyed_29 
T02D2205:173b-14	bdud rtsi lnga dang sbyar ba'am //	bdud_0 rtsi_5 lnga_10 dang_15 sbyor_20 ba_26 
T02D2205:173b-15	yang na dri yi chu blud de //	yang_0 na_5 'dri_8 yi_12 chu_15 blud_19 de_24 
T02D2205:173b-16	'thung zhig rdo rje 'bar ba'i chu //	'thung_0 'jig_7 rdo_12 rje_16 'bar_20 ba_25 chu_30 
T02D2205:173b-17	dam las 'das na sreg par byed //	dam_0 las_4 'da'_8 na_13 sreg_16 ba_21 byed_25 
T02D2205:173b-18	dam tshig bsrungs na dngos grub ni //	dam_0 tshig_4 bsrungs_10 na_18 dngos_21 'grub_27 ni_32 
T02D2205:173b-19	rdo rje bdud rtsi'i chu yis 'grub //	rdo_0 rje_4 bdud_8 rtsi_13 chu_20 yis_24 'grub_28 
T02D2205:173b-20	aom badzra sa tva h'um ma h'a panytsa aa mra ta //	aom_0 badzra_4 sa_11 tva_14 h_18 ma_23 h_26 panytsa_30 aa_38 mra_41 ta_45 
T02D2205:173b-21	kha kha zhes pa ni mna' bsgags pa'o //	kha_0 kha_4 zhes_8 ba_13 ni_16 mna'_19 sgog_24 ba_31 
T02D2205:173b-22	de ring phan chad bu khyod kyis //	de_0 ring_3 phan_8 'chad_13 bu_18 khyod_21 kyis_27 
T02D2205:173b-23	gsang chen rdo rje nga yin gyis //	gsang_0 chen_6 rdo_11 rje_15 nga_19 yin_23 gyis_27 
T02D2205:173b-24	nga la ba rnyas par ma byed cig / gal te brnyas par gyur na ni //	nga_0 la_4 ba_7 rnyas_10 ba_16 ma_20 byed_23 cig_28 gal_34 te_38 brnyas_41 ba_48 gyur_52 na_57 ni_60 
T02D2205:173b-25	sangs rgyas thams cad mnyen pa min //	sangs_0 rgya_6 thams_12 cad_18 mnyen_22 ba_28 min_31 
T02D2205:173b-26	tshe yi 'du byed 'di bkum nas //	tshe_0 yi_5 'du_8 byed_12 'di_17 bkum_21 nas_26 
T02D2205:173b-27	dmyal bar skye bar gdon mi za //	dmyal_0 ba_6 skye_10 ba_15 'don_19 mi_24 za_27 
T02D2205:173b-28	zhes pa ni man ngag go ;	zhes_0 ba_5 ni_8 man_11 ngag_15 go_20 
T02D2205:173b-29	; de nas rdo rje slob ma yis //	de_2 nas_5 rdo_9 rje_13 slob_17 ma_22 yis_25 
T02D2205:173b-30	slob dpon la ni gsol ba gdab //	slob_0 dpon_5 la_10 ni_13 gsol_16 ba_21 gdab_24 
T02D2205:173b-31	chos dbyings byin rlabs las byung ba'i //	chos_0 dbyings_5 byin_13 rlabs_18 las_24 'byung_28 ba_34 
T02D2205:173b-32	bcom ldan rdo rje chad chen po //	'joms_0 ldan_5 rdo_10 rje_14 'chad_18 chen_23 po_28 
T02D2205:173b-33	de ring bdag la dbab tu gsol //	de_0 ring_3 bdag_8 la_13 'bebs_16 tu_21 gsol_24 
T02D2205:173b-34	zhes so //	zhes_0 so_5 
T02D2205:173b-35	de nas slob ma mtha' yas la //	de_0 nas_3 slob_7 ma_12 mtha'_15 yas_21 la_25 
T02D2205:173b-36	ram dang bcas pa'i yi ge bsam //	ram_0 dang_4 'cha'_9 ba_14 yi_19 ge_22 bsam_25 
T02D2205:173b-37	bskyod nas drod bskul chu la phog / bskol bas sa yi dkyil 'khor zhu //	skyod_0 nas_7 drod_11 skul_16 chu_22 la_26 'bogs_29 skol_36 ba_42 sa_46 yi_49 dkyil_52 'khor_58 'ju_64 
T02D2205:173b-38	lus nang me yis bsreg byas nas //	lus_0 nang_4 me_9 yis_12 bsreg_16 byed_22 nas_27 
T02D2205:173b-39	sdig pa tshig par gyur pa dang //	sdig_0 ba_5 tshig_8 ba_14 gyur_18 ba_23 dang_26 
T02D2205:173b-40	bde gshegs byang chub sems phab ste //	bde_0 gshegs_4 byang_11 chub_17 sems_22 'bebs_27 ste_32 
T02D2205:173b-41	snying gnam lus nang 'khyil par bsam //	snying_0 gnam_7 lus_12 nang_16 'khyil_21 ba_28 bsam_32 
T02D2205:173b-42	de nas rdo rje 'chang chen bsgom //	de_0 nas_3 rdo_7 rje_11 'chang_15 chen_22 bsgom_27 
T02D2205:173b-43	me tog dkyil 'khor lha la dbul //	me_0 tog_3 dkyil_7 'khor_13 lha_19 la_23 'bul_26 
T02D2205:173b-44	pra t'i tshtsa ho zhes brjod //	pra_0 t_4 tshtsa_8 ho_15 zhes_18 rjod_23 
T02D2205:173b-45	de nas phreng ba mgo la bcing //	de_0 nas_3 phreng_7 ba_14 mgo_17 la_21 'ching_24 
T02D2205:173b-46	aom ma h'a ba la badzra //	aom_0 ma_4 h_7 ba_11 la_14 badzra_17 
T02D2205:173b-47	aa bhi shi nyts'a mi zhe'o //	aa_0 bhi_3 'chi_7 nyts_11 mi_18 zhe_21 
T02D2205:173b-48	rmad byung gsang ba'i me tog 'di //	rmad_0 'byung_5 gsang_11 ba_17 me_22 tog_25 'di_29 
T02D2205:173b-49	gsang la babs pa rigs kyi lha //	gsang_0 la_6 'bab_9 ba_14 rigs_17 kyi_22 lha_26 
T02D2205:174a-0	las 'phro @174a * //	las_0 'phro_4 
T02D2205:174a-1	thugs rjes 'byung bar 'gyur //	thugs_0 rjes_6 'byung_11 ba_18 'gyur_22 
T02D2205:174a-2	gtso bo'i thugs sogs mchog dngos grub //	gtso_0 'bo_5 thugs_10 sogs_16 mchog_21 dngos_27 'grub_33 
T02D2205:174a-3	dbus dang nyen dngos grub nye //	dbus_0 dang_5 nyen_10 dngos_15 'grub_21 nye_26 
T02D2205:174a-4	ring na dngos grub ster bar 'gyur //	ring_0 na_5 dngos_8 'grub_14 ster_19 ba_24 'gyur_28 
T02D2205:174a-5	zhes pa la sogs pa ni dbab pa'i cho ga dang me tog go //	zhes_0 ba_5 la_8 sogs_11 ba_16 ni_19 'bebs_22 ba_27 cho_32 ga_36 dang_39 me_44 tog_47 go_51 
T02D2205:174a-6	dpal ldan chen po gos sngon can //	dpal_0 ldan_5 chen_10 po_15 gos_18 sngon_22 can_28 
T02D2205:174a-7	khyod kyi mig dbye ba brtson par mdzod //	khyod_0 kyi_6 mig_10 'byed_14 ba_19 brtson_22 ba_29 mdzod_33 
T02D2205:174a-8	tsakshu pra be sha ya phat /	tsakshu_0 pra_8 be_12 sha_15 ya_19 phat_22 
T02D2205:174a-9	brtab pa'i lta bas blta byas te //	rtab_0 ba_6 lta_11 ba_15 lta_19 byed_24 te_29 
T02D2205:174a-10	dkar po mthong na zhib 'grub //	dkar_0 po_5 mthong_8 na_15 zhib_18 'grub_23 
T02D2205:174a-11	ser po mthong na rgyas pa 'grub //	ser_0 po_4 mthong_7 na_14 rgya_17 ba_23 'grub_26 
T02D2205:174a-12	dmar po mthong na dbang gi las //	dmar_0 po_5 mthong_8 na_15 dbang_18 gi_24 las_27 
T02D2205:174a-13	nag pos grag po'i las 'grub 'gyur //	nag_0 pos_4 grag_8 po_13 las_18 'grub_22 'gyur_28 
T02D2205:174a-14	khyod kyi mig gis ji ltar mthong //	khyod_0 kyi_6 mig_10 gis_14 ji_18 ltar_21 mthong_26 
T02D2205:174a-15	zhes dri bar bya'o ;	zhes_0 'dri_5 ba_9 byed_13 
T02D2205:174a-16	/ deng nas brtsams te dpal ldan che //	deng_2 nas_7 brtsams_11 te_19 dpal_22 ldan_27 che_32 
T02D2205:174a-17	khyab nas brtsams te dkyil 'khor bstan //	khyab_0 nas_6 brtsams_10 te_18 dkyil_21 'khor_27 ston_33 
T02D2205:174a-18	dkyil 'khor mthong ba'i 'og tu ni //	dkyil_0 'khor_6 mthong_12 ba_19 'og_24 tu_28 ni_31 
T02D2205:174a-19	yon phul gsol ba gdab par bya //	yon_0 'bul_4 gsol_9 ba_14 gdab_17 ba_22 byed_26 
T02D2205:174a-20	ji ltar dus gsum sangs rgyas la //	ji_0 ltar_3 dus_8 gsum_12 sangs_17 rgya_23 la_29 
T02D2205:174a-21	rdo rje sems dpas dbang bskur ltar //	rdo_0 rje_4 sems_8 dpas_13 dbang_18 skur_24 ltar_30 
T02D2205:174a-22	bdag kyang rab tu bsgral slad du ;	bdag_0 kyang_5 rab_11 tu_15 bsgral_18 slad_25 du_30 
T02D2205:174a-23	/ bde gshegs bum pa'i dbang mchog stsol //	bde_2 gshegs_6 bum_13 ba_17 dbang_22 mchog_28 stsol_34 
T02D2205:174a-24	zhes pa ni gsol ba gdab pa'o //	zhes_0 ba_5 ni_8 gsol_11 ba_16 gdab_19 ba_24 
T02D2205:174a-25	de nas rdo rje rgyal po yis //	de_0 nas_3 rdo_7 rje_11 rgyal_15 po_21 yis_24 
T02D2205:174a-26	bum pa'i chu ni bsdus byas te //	bum_0 ba_4 chu_9 ni_13 sdud_16 byed_22 te_27 
T02D2205:174a-27	byang chub sems kyi ngo bo dag //	byang_0 chub_6 sems_11 kyi_16 ngo_20 'bo_24 'dag_27 
T02D2205:174a-28	rol mo'i sgra dang bcas pa yis //	rol_0 mo_4 sgra_9 dang_14 'cha'_19 ba_24 yis_27 
T02D2205:174a-29	spyi gtsug dag tu dbang bskur ro //	spyi_0 gtsug_5 'dag_11 tu_15 dbang_18 skur_24 ro_30 
T02D2205:174a-30	aom gsang ba gsum las legs byung ba'i //	aom_0 gsang_4 ba_10 gsum_13 las_18 legs_22 'byung_27 ba_33 
T02D2205:174a-31	lha yi chu ni dag pa yis //	lha_0 yi_4 chu_7 ni_11 'dag_14 ba_18 yis_21 
T02D2205:174a-32	dri med rdo rje chu dbang gis //	'dri_0 med_4 rdo_8 rje_12 chu_16 dbang_20 gis_26 
T02D2205:174a-33	mi bskyod dngos grub thob par shog / aom sarba	mi_0 skyod_3 dngos_10 'grub_16 'thob_21 ba_26 shog_30 aom_37 sarba_41 
T02D2205:174a-34	ta th'a ta a'a da rsha aa bhi shi nyts'a	ta_0 th_3 ta_8 a_11 da_15 rsha_18 aa_23 bhi_26 'chi_30 nyts_34 
T02D2205:174a-35	mi / chu'i dbang ngo //	mi_0 chu_5 dbang_11 ngo_17 
T02D2205:174a-36	aom sangs rgyas byin rlabs las byung ba'i //	aom_0 sangs_4 rgya_10 byin_16 rlabs_21 las_27 'byung_31 ba_37 
T02D2205:174a-37	yid bzhin nor bu 'bar ba che //	yid_0 bzhin_4 nor_10 bu_14 'bar_17 ba_22 che_25 
T02D2205:174a-38	dam pa thams cad 'byung ba'i gnas //	dam_0 ba_4 thams_7 cad_13 'byung_17 ba_24 gnas_29 
T02D2205:174a-39	rin chen grub pa'i dbang bskur ro //	rin_0 chen_4 'grub_9 ba_14 dbang_19 skur_25 ro_31 
T02D2205:174a-40	aom sarba ta th'a ga ta ratna badzra aa bhi shi nyts'a mi //	aom_0 sarba_4 ta_10 th_13 ga_18 ta_21 ratna_24 badzra_30 aa_37 bhi_40 'chi_44 nyts_48 mi_55 
T02D2205:174a-41	zhes pa ni dbu rgyan gyi dbang ngo //	zhes_0 ba_5 ni_8 dbu_11 rgyan_15 gyi_21 dbang_25 ngo_31 
T02D2205:174a-42	aom ye shes lnga yis rtags 'chang ba //	aom_0 ye_4 shes_7 lnga_12 yis_17 rtags_21 'chang_27 ba_34 
T02D2205:174a-43	thugs mchog rdo rje bla med pa'i //	thugs_0 mchog_6 rdo_12 rje_16 bla_20 med_24 ba_28 
T02D2205:174a-44	dus gsum 'gyur ba med pa yi //	dus_0 gsum_4 'gyur_9 ba_15 med_18 ba_22 yi_25 
T02D2205:174a-45	snang ba mtha' yas dbang bskur ro //	snang_0 ba_6 mtha'_9 yas_15 dbang_19 skur_25 ro_31 
T02D2205:174a-46	aom sarba ta th'a ga tas samana aa bhi shi nyts'a mi /	aom_0 sarba_4 ta_10 th_13 ga_18 tas_21 samana_25 aa_32 bhi_35 'chi_39 nyts_43 mi_50 
T02D2205:174a-47	zhes pa ni rdo rje'i dbang ngo //	zhes_0 ba_5 ni_8 rdo_11 rje_15 dbang_21 ngo_27 
T02D2205:174a-48	aom chos sku sgyu ma'i sgra sgrogs shing //	aom_0 chos_4 sku_9 sgyu_13 ma_18 sgra_23 sgrogs_28 shing_35 
T02D2205:174a-49	stong pa'i don las sad par byed //	stong_0 ba_6 don_11 las_15 sad_19 ba_23 byed_27 
T02D2205:174a-50	bla med dril bu'i dbang bskur bas //	bla_0 med_4 'dril_8 bu_13 dbang_18 skur_24 ba_30 
T02D2205:174a-51	don yod grub pa'i dngos grub shog / aom sarba	don_0 yod_4 'grub_8 ba_13 dngos_18 'grub_24 shog_29 aom_36 sarba_40 
T02D2205:174b-0	ta th'a ga ta kri t'a nu shth'a aa @174b	ta_0 th_3 ga_8 ta_11 kri_14 t_18 nu_22 shth_25 aa_32 
T02D2205:174b-1	bhi shinyts'a mi / zhes pa ni dril bu'i dbang po //	bhi_0 shinyts_4 mi_14 zhes_19 ba_24 ni_27 'dril_30 bu_35 dbang_40 po_46 
T02D2205:174b-2	kye rdo rje'i ming gis dbang bskur bas //	kye_0 rdo_4 rje_8 ming_14 gis_19 dbang_23 skur_29 ba_35 
T02D2205:174b-3	cis kyang mi tshugs mi shigs pa'i //	cis_0 kyang_4 mi_10 tshugs_13 mi_20 shigs_23 ba_29 
T02D2205:174b-4	byang chub chen po thob pa dang //	byang_0 chub_6 chen_11 po_16 'thob_19 ba_24 dang_27 
T02D2205:174b-5	rnam par snang mdzad dngos grub shog / aom sarba	rnam_0 ba_5 snang_9 mdzad_15 dngos_21 'grub_27 shog_32 aom_39 sarba_43 
T02D2205:174b-6	ta th'a ga ta shi sa ma ya dzny'a ta	ta_0 th_3 ga_8 ta_11 'chi_14 sa_18 ma_21 ya_24 dzny_27 ta_34 
T02D2205:174b-7	n'a ma aa bhi shinyts'a mi /	n_0 ma_4 aa_7 bhi_10 shinyts_14 mi_24 
T02D2205:174b-8	zhes pa ni ming gi dbang ngo //	zhes_0 ba_5 ni_8 ming_11 gi_16 dbang_19 ngo_25 
T02D2205:174b-9	chos rnams sgyu ma lta bu ste //	chos_0 rnams_5 sgyu_11 ma_16 lta_19 bu_23 ste_26 
T02D2205:174b-10	dag cing gsal la rtog pa med //	'dag_0 cing_4 gsal_9 la_14 rtogs_17 ba_22 med_25 
T02D2205:174b-11	mi long gi ni gzugs brnyan bzhin //	mi_0 long_3 gi_8 ni_11 gzugs_14 rnyan_20 bzhin_27 
T02D2205:174b-12	rang byung lha ni shes par gyis //	rang_0 'byung_5 lha_11 ni_15 shes_18 ba_23 gyis_27 
T02D2205:174b-13	zhes pa ni me long ngo //	zhes_0 ba_5 ni_8 me_11 long_14 ngo_19 
T02D2205:174b-14	lung las //	lung_0 las_5 
T02D2205:174b-15	dang po gsol ba gdab ba ste //	dang_0 po_5 gsol_8 ba_13 gdab_16 ba_21 ste_24 
T02D2205:174b-16	gsan nas ye shes 'khor lo gzhug / sdig pa dag par chus bkrus te ;	gsan_0 nas_5 ye_9 shes_12 'khor_17 lo_23 'jug_26 sdig_34 ba_39 'dag_42 ba_46 chus_50 'khrud_55 te_61 
T02D2205:174b-17	/ so so'i dbang rdzas lag tu sbyin //	so_2 so_5 dbang_10 rdzas_16 lag_22 tu_26 sbyin_29 
T02D2205:174b-18	nyon mongs lnga yi dri ma bskur //	nyon_0 mongs_5 lnga_11 yi_16 'dri_19 ma_23 skur_26 
T02D2205:174b-19	dbu la rigs lnga'i sangs rgyas dgod //	dbu_0 la_4 rigs_7 lnga_12 sangs_19 rgya_25 'god_31 
T02D2205:174b-20	ce'o //	ce_0 
T02D2205:174b-21	bcom ldan rdo rje 'dzin pa'am //	'joms_0 ldan_5 rdo_10 rje_14 'dzin_18 ba_24 
T02D2205:174b-22	rdo rje'i dbang gis mngon sangs rgyas //	rdo_0 rje_4 dbang_10 gis_16 mngon_20 sangs_26 rgya_32 
T02D2205:174b-23	ye shes lnga dang rdo rje 'di //	ye_0 shes_3 lnga_8 dang_13 rdo_18 rje_22 'di_26 
T02D2205:174b-24	khyod kyis rtag tu bcang par gyis //	khyod_0 kyis_6 rtag_11 tu_16 'chang_19 ba_25 gyis_29 
T02D2205:174b-25	zhes pa thugs kyi dam tshig go //	zhes_0 ba_5 thugs_8 kyi_14 dam_18 tshig_22 go_28 
T02D2205:174b-26	gsung rnams sgra brnyan lta bu ste //	gsung_0 rnams_6 sgra_12 rnyan_17 lta_24 bu_28 ste_31 
T02D2205:174b-27	rtog pa med pas sna tshogs sgra //	rtogs_0 ba_5 med_8 ba_12 sna_16 tshogs_20 sgra_27 
T02D2205:174b-28	brjod bral dpag gis mi lang pa'i //	rjod_0 'bral_6 dpog_11 gis_16 mi_20 lang_23 ba_28 
T02D2205:174b-29	dril bu 'di ni khyod kyis zung //	'dril_0 bu_5 'di_8 ni_12 khyod_15 kyis_21 zung_26 
T02D2205:174b-30	zhes pa ni gsung gi dam tshig go //	zhes_0 ba_5 ni_8 gsung_11 gi_17 dam_20 tshig_24 go_30 
T02D2205:174b-31	thabs dang shes rab gnyis med sgra //	thabs_0 dang_6 shes_11 rab_16 gnyis_20 med_26 sgra_30 
T02D2205:174b-32	mi phyed rdo rje'i ngo bo 'di //	mi_0 phyed_3 rdo_9 rje_13 ngo_19 'bo_23 'di_26 
T02D2205:174b-33	'khyud pa'i phyag rgya'i dam tshig ste //	'khyud_0 ba_7 phyag_12 rgya_18 dam_25 tshig_29 ste_35 
T02D2205:174b-34	khyod kyis kyang ni rtag tu bcang //	khyod_0 kyis_6 kyang_11 ni_17 rtag_20 tu_25 'chang_28 
T02D2205:174b-35	zhes pa ni sku'i dam tshig go //	zhes_0 ba_5 ni_8 sku_11 dam_17 tshig_21 go_27 
T02D2205:174b-36	'di ni sangs rgyas thams cad dang //	'di_0 ni_4 sangs_7 rgya_13 thams_19 cad_25 dang_29 
T02D2205:174b-37	dpal ldan rdo rje 'dzin la gnas //	dpal_0 ldan_5 rdo_10 rje_14 'dzin_18 la_24 gnas_27 
T02D2205:174b-38	khyid kyis kyang ni rtag tu bzang //	khyid_0 kyis_6 kyang_11 ni_17 rtag_20 tu_25 bzang_28 
T02D2205:174b-39	phyag na rdo rje'i brtul zhugs brtan //	phyag_0 na_6 rdo_9 rje_13 brtul_19 'jug_25 brtan_31 
T02D2205:174b-40	aom sarba ta th'a ga ta badzra pa'i ni h'um	aom_0 sarba_4 ta_10 th_13 ga_18 ta_21 badzra_24 ba_31 ni_36 h_39 
T02D2205:174b-41	ma h'a ya ksha se n'a pa ta ye h'um	ma_0 h_3 ya_7 ksha_10 se_15 n_18 ba_22 ta_25 ye_28 h_31 
T02D2205:174b-42	ta ye h'um ha ha ha ha hi //	ta_0 ye_3 h_6 ha_11 ha_14 ha_17 ha_20 hi_23 
T02D2205:174b-43	zhes pa 'di ni rdo rje'i brtul zhugs so //	zhes_0 ba_5 'di_8 ni_12 rdo_15 rje_19 brtul_25 'jug_31 so_37 
T02D2205:174b-44	chags dang grol ba'i gang zag gis //	chags_0 dang_6 grol_11 ba_16 gang_21 zag_26 gis_30 
T02D2205:174b-45	thun mong dkyil 'khor cho ga yin //	thun_0 mong_5 dkyil_10 'khor_16 cho_22 ga_26 yin_29 
T02D2205:174b-46	gang zag rnam pa gnyis po de //	gang_0 zag_5 rnam_9 ba_14 gnyis_17 po_23 de_26 
T02D2205:174b-47	dkyil 'khor 'di ru zhugs tsam gyis //	dkyil_0 'khor_6 'di_12 ru_16 'jug_19 tsam_25 gyis_30 
T02D2205:174b-48	dngos grub gnyis dang 'brel bar byed //	dngos_0 'grub_6 gnyis_11 dang_17 'brel_22 ba_28 byed_32 
T02D2205:174b-49	klu dang 'byung pos zin pa la ;	klu_0 dang_4 'byung_9 pos_16 zin_20 ba_24 la_27 
T02D2205:174b-50	/ dang po cho ga sngon song nas //	dang_2 po_7 cho_10 ga_14 sngon_17 'gro_23 nas_28 
T02D2205:174b-51	smre ba'i rdzas kyis dbral bar bya //	smre_0 ba_5 rdzas_10 kyis_16 dbrol_21 ba_27 byed_31 
T02D2205:174b-52	de nas bral ba gso ba dang //	de_0 nas_3 'bral_7 ba_12 gso_15 ba_19 dang_22 
T02D2205:174b-53	nad pa chu yis bskur bar bya //	nad_0 ba_4 chu_7 yis_11 skur_15 ba_21 byed_25 
T02D2205:174b-54	de ltar byas nas dkyil 'khor 'dir //	de_0 ltar_3 byed_8 nas_13 dkyil_17 'khor_23 'dir_29 
T02D2205:174b-55	zhugs pa tsam gyis myur du thar //	'jug_0 ba_6 tsam_9 gyis_14 myur_19 du_24 thar_27 
T02D2205:174b-56	rims dang 'brum bu la sogs pa //	rims_0 dang_5 'brum_10 bu_16 la_19 sogs_22 ba_27 
T02D2205:174b-57	gtor ma'i 'khor lo sngon song bas //	'thor_0 ma_5 'khor_10 lo_16 sngon_19 'gro_25 ba_30 
T02D2205:175a-0	@175a * // dkyil 'khor 'di ru zhugs gyur na //	dkyil_11 'khor_17 'di_23 ru_27 'jug_30 gyur_36 na_41 
T02D2205:175a-1	myur du nyen las thar bar 'gyur //	myur_0 du_5 nyen_8 las_13 thar_17 ba_22 'gyur_26 
T02D2205:175a-2	bud med dag kyang bu 'dod na //	'bud_0 med_4 'dag_8 kyang_12 bu_18 'dod_21 na_26 
T02D2205:175a-3	dang po cho ga sngon sogs nas //	dang_0 po_5 cho_8 ga_12 sngon_15 sogs_21 nas_26 
T02D2205:175a-4	khur skyis dag nas gos bzang bgo //	'khur_0 skyis_5 'dag_11 nas_15 gos_19 bzang_23 bgod_29 
T02D2205:175a-5	dkyil 'khor 'dir lugs pa yis //	dkyil_0 'khor_6 'dir_12 lugs_17 ba_22 yis_25 
T02D2205:175a-6	bus pa'i gdon rnams bzlog pa dang //	'bud_0 ba_4 'don_9 rnams_14 bzlog_20 ba_26 dang_29 
T02D2205:175a-7	bus pa dbyung bar gdon mi za //	'bud_0 ba_4 'byin_7 ba_14 'don_18 mi_23 za_26 
T02D2205:175a-8	yid gas bkol ba'i cho ga yang //	yid_0 'gas_4 'khol_8 ba_13 cho_18 ga_22 yang_25 
T02D2205:175a-9	lha la sogs pa bkug gyur nas //	lha_0 la_4 sogs_7 ba_12 'gugs_15 gyur_20 nas_25 
T02D2205:175a-10	sdom pa legs par bzung nas ni //	sdom_0 ba_5 legs_8 ba_13 bzung_17 nas_23 ni_27 
T02D2205:175a-11	dkyil 'khor 'di ru zhugs gyur nas //	dkyil_0 'khor_6 'di_12 ru_16 'jug_19 gyur_25 nas_30 
T02D2205:175a-12	bdag gis bcol ba thams cad de //	bdag_0 gis_5 'chol_9 ba_14 thams_17 cad_23 de_27 
T02D2205:175a-13	thogs ba med pa'i rdo rje bzhin //	thogs_0 ba_6 med_9 ba_13 rdo_18 rje_22 bzhin_26 
T02D2205:175a-14	ro yi las rnams byed 'dod pas //	ro_0 yi_3 las_6 rnams_10 byed_16 'dod_21 ba_26 
T02D2205:175a-15	blang dang bsrung ba sngon song nas //	blang_0 dang_6 bsrung_11 ba_18 sngon_21 'gro_27 nas_32 
T02D2205:175a-16	dkyil 'khor 'di ru bcu ga gyur na //	dkyil_0 'khor_6 'di_12 ru_16 'chu_19 ga_23 gyur_26 na_31 
T02D2205:175a-17	log chos drug dang ldan pa yang //	log_0 chos_4 drug_9 dang_14 ldan_19 ba_24 yang_27 
T02D2205:175a-18	gtsang ba'i gnas su nye bar 'gro //	gtsang_0 ba_7 gnas_12 su_17 nye_20 ba_24 'gro_28 
T02D2205:175a-19	de bzhin gshegs pa'i sku gzugs la //	de_0 bzhin_3 gshegs_9 ba_16 sku_21 gzugs_25 la_31 
T02D2205:175a-20	dang pa'i cho ga sngon song nas //	dang_0 ba_5 cho_10 ga_14 sngon_17 'gro_23 nas_28 
T02D2205:175a-21	byin brlabs dkyil 'khor chen po 'dir //	byin_0 brlabs_5 dkyil_12 'khor_18 chen_24 po_29 'dir_32 
T02D2205:175a-22	dbang bskur mchod ba phul gyur na //	dbang_0 skur_6 mchod_12 ba_18 'bul_21 gyur_26 na_31 
T02D2205:175a-23	shin tu bkra shis don ldan te //	shin_0 tu_5 bkra_8 shis_13 don_18 ldan_22 te_27 
T02D2205:175a-24	bskur zhig bstim pa'i gnas su 'gyur //	skur_0 'jig_6 stim_11 ba_17 gnas_22 su_27 'gyur_30 
T02D2205:175a-25	yon tan 'byung ba 'gyur ba'i gnas //	yon_0 tan_4 'byung_8 ba_15 'gyur_18 ba_24 gnas_29 
T02D2205:175a-26	chags lam pa dang grol lam pa //	chags_0 lam_6 ba_10 dang_13 grol_18 lam_23 ba_27 
T02D2205:175a-27	mdzes rims kyis zin pa dang //	mdzes_0 rims_6 kyis_11 zin_16 ba_20 dang_23 
T02D2205:175a-28	bud med dang ni yi dags bskol //	'bud_0 med_4 dang_8 ni_13 yi_16 dags_19 skol_24 
T02D2205:175a-29	ro dang sku gzugs lhag par gnas //	ro_0 dang_3 sku_8 gzugs_12 lhag_18 ba_23 gnas_27 
T02D2205:175a-30	brgyad po dkyil 'khor 'di yis byed //	brgyad_0 po_7 dkyil_10 'khor_16 'di_22 yis_26 byed_30 
T02D2205:175a-31	de phyir dkyil 'khor cho ga brgyad //	de_0 phyir_3 dkyil_9 'khor_15 cho_21 ga_25 brgyad_28 
T02D2205:175a-32	gcig par bsdu ba'i cho ga'o /	gcig_0 ba_5 sdud_9 ba_14 cho_19 ga_23 
T02D2205:175a-34	// / de nas gsang ba'i dbang bskur te //	de_5 nas_8 gsang_12 ba_18 dbang_23 skur_29 te_35 
T02D2205:175a-35	de yang bdud rtsi lnga yas byung //	de_0 yang_3 bdud_8 rtsi_13 lnga_18 yas_23 'byung_27 
T02D2205:175a-36	stegs bu'i steng du slob dpon dang //	stegs_0 bu_6 steng_11 du_17 slob_20 dpon_25 dang_30 
T02D2205:175a-37	phyag rgya ma ni snyoms par zhugs //	phyag_0 rgya_6 ma_11 ni_14 snyom_17 ba_24 'jug_28 
T02D2205:175a-38	slob mas de la gsol ba ga dab //	slob_0 mas_5 de_9 la_12 gsol_15 ba_20 ga_23 dab_26 
T02D2205:175a-39	aom rgyal ba thams cad rol pa yis //	aom_0 rgyal_4 ba_10 thams_13 cad_19 rol_23 ba_27 yis_30 
T02D2205:175a-40	sangs rgyas chu yis rgyun phab ste //	sangs_0 rgya_6 chu_12 yis_16 rgyun_20 'bebs_26 ste_31 
T02D2205:175a-41	nyon mongs rtog pa sbyar ba bzhin //	nyon_0 mongs_5 rtogs_11 ba_16 sbyor_19 ba_25 bzhin_28 
T02D2205:175a-42	bdag la byang chub sems dbang gsol //	bdag_0 la_5 byang_8 chub_14 sems_19 dbang_24 gsol_30 
T02D2205:175a-43	ji ltar rgyal ba'i dbu skabs pa //	ji_0 ltar_3 rgyal_8 ba_14 dbu_19 skabs_23 ba_29 
T02D2205:175a-44	byang chub sems kyis bskus pa bzhin //	byang_0 chub_6 sems_11 kyis_16 skud_21 ba_27 bzhin_30 
T02D2205:175a-45	bdag la byang chub sems khrus gsol //	bdag_0 la_5 byang_8 chub_14 sems_19 'khru_24 gsol_30 
T02D2205:175a-46	zhes pa ni gsol ba gdab pa'o //	zhes_0 ba_5 ni_8 gsol_11 ba_16 gdab_19 ba_24 
T02D2205:175a-47	de nas blo ldan slob dpon dang //	de_0 nas_3 blo_7 ldan_11 slob_16 dpon_21 dang_26 
T02D2205:175a-48	slob ma gnyis med sbyor byas pa'i //	slob_0 ma_5 gnyis_8 med_14 sbyor_18 byed_24 ba_29 
T02D2205:175a-49	byang chub sems su dgang gsungs pa //	byang_0 chub_6 sems_11 su_16 'geng_19 gsungs_25 ba_32 
T02D2205:175a-50	yum gyi bha gar blang bar bya //	yum_0 gyi_4 bha_8 gar_12 blang_16 ba_22 byed_26 
T02D2205:175b-0	dper na bud ba me tog @175b bzhin ;	dper_0 na_5 'bud_8 ba_12 me_15 tog_18 bzhin_28 
T02D2205:175b-1	/ yang na gsang ba'i rdo rje sker //	yang_2 na_7 gsang_10 ba_16 rdo_21 rje_25 sker_29 
T02D2205:175b-2	sbom pos dbang po gnyis mnan te //	sbom_0 pos_5 dbang_9 po_15 gnyis_18 gnon_24 te_29 
T02D2205:175b-3	slob ma'i kha ru dab ba bar bya //	slob_0 ma_5 kha_10 ru_14 dab_17 ba_21 ba_24 byed_28 
T02D2205:175b-4	dper rna ma la bu bzhin no //	dper_0 rna_5 ma_9 la_12 bu_15 bzhin_18 no_24 
T02D2205:175b-5	yang na slob ma gang yin pa //	yang_0 na_5 slob_8 ma_13 gang_16 yin_21 ba_25 
T02D2205:175b-6	gdugs la sogs dang ldan byas nas //	gdugs_0 la_6 sogs_9 dang_14 ldan_19 byed_24 nas_29 
T02D2205:175b-7	gsang chen bde ba'i rgyu mchog ste //	gsang_0 chen_6 bde_11 ba_15 rgyu_20 mchog_25 ste_31 
T02D2205:175b-8	bdud rtsi lnga dang ldan byas nas ;	bdud_0 rtsi_5 lnga_10 dang_15 ldan_20 byed_25 nas_30 
T02D2205:175b-9	/ bkra shis bstod pas bstod pa dang //	bkra_2 shis_7 bstod_12 ba_18 bstod_22 ba_28 dang_31 
T02D2205:175b-10	slob ma'i lce la sbyin par bya //	slob_0 ma_5 lce_10 la_14 sbyin_17 ba_23 byed_27 
T02D2205:175b-11	de nas slob mched po de //	de_0 nas_3 slob_7 mched_12 po_18 de_21 
T02D2205:175b-12	byang chub ba dud rtsi lces blangs nas //	byang_0 chub_6 ba_11 dud_14 rtsi_18 lces_23 blangs_28 nas_35 
T02D2205:175b-13	snying gar 'dod pa bsten par bya //	snying_0 gar_7 'dod_11 ba_16 sten_19 ba_25 byed_29 
T02D2205:175b-14	bde ba de la brten gyur nas //	bde_0 ba_4 de_7 la_10 rten_13 gyur_19 nas_24 
T02D2205:175b-15	lte ba'i dbus su bsam par bya //	lte_0 ba_4 dbus_9 su_14 bsam_17 ba_22 byed_26 
T02D2205:175b-16	slob mas kyang ni 'di skad brjod ;	slob_0 mas_5 kyang_9 ni_15 'di_18 skad_22 rjod_27 
T02D2205:175b-17	/ chi bar gyur par rab slong zhing //	ba_6 gyur_10 ba_15 rab_19 slong_23 zhing_29 
T02D2205:175b-18	rtog pa'i dra ba sel mdzad pa //	rtogs_0 ba_5 'dra_10 ba_14 sel_17 mdzad_21 ba_27 
T02D2205:175b-19	ae ma mchog gi bdud rtse che //	ae_0 ma_3 mchog_6 gi_12 bdud_15 rtse_20 che_25 
