T02D2684:226a-0	@226a # // rgya gar skad du /	rgya_11 gar_16 skad_20 du_25 
T02D2684:226a-1	badzra bid'a ra na n'a mdh'a ra ni britti /	badzra_0 bid_7 ra_13 na_16 n_19 mdh_23 ra_29 ni_32 britti_35 
T02D2684:226a-2	bod skad du /	'bod_0 skad_4 du_9 
T02D2684:226a-3	rdo rje rnam par 'joms pa zhes bya ba'i gzungs kyi 'grel pa /	rdo_0 rje_4 rnam_8 ba_13 'joms_17 ba_23 zhes_26 byed_31 ba_35 gzungs_40 kyi_47 'grel_51 ba_57 
T02D2684:226a-4	bcom ldan 'das rdo rje rnam par 'joms pa la phyag 'tshal lo //	'joms_0 ldan_5 'da'_10 rdo_15 rje_19 rnam_23 ba_28 'joms_32 ba_38 la_41 phyag_44 'tshal_50 lo_57 
T02D2684:226a-5	rdo rje lta bu'i ye shes kyis //	rdo_0 rje_4 lta_8 bu_12 ye_17 shes_20 kyis_25 
T02D2684:226a-6	gdul dka' rnams kyi gnyen po gang //	gdul_0 dka'_5 rnams_10 kyi_16 gnyen_20 po_26 gang_29 
T02D2684:226a-7	mchog tu zab pa'i chos nyid can //	mchog_0 tu_6 zab_9 ba_13 chos_18 nyid_23 can_28 
T02D2684:226a-8	rdo rje rnam 'joms sku la 'dud //	rdo_0 rje_4 rnam_8 'joms_13 sku_19 la_23 'dud_26 
T02D2684:226a-9	re zhig yongs su shes par bya ba pha rol tu phyin pa'i theg pa dang /	re_0 'jig_3 yongs_8 su_14 shes_17 ba_22 byed_26 ba_30 pha_33 rol_37 tu_41 phyin_44 ba_50 theg_55 ba_60 dang_63 
T02D2684:226a-10	rjes su bsgrub par bya ba sngags kyi theg pa gnyis so //	rjes_0 su_5 sgrub_8 ba_15 byed_19 ba_23 sngags_26 kyi_33 theg_37 ba_42 gnyis_45 so_51 
T02D2684:226a-11	sngags la yang rdo rje 'chang gis bka' stsal ba'i rgyud dang /	sngags_0 la_7 yang_10 rdo_15 rje_19 'chang_23 gis_30 bka'_34 stsal_39 ba_45 brgyud_50 dang_56 
T02D2684:226a-12	de dang mi 'gal ba'i bla ma dam pa'i gdams ngag go //	de_0 dang_3 mi_8 'gal_11 ba_16 bla_21 ma_25 dam_28 ba_32 'doms_37 ngag_43 go_48 
T02D2684:226a-13	rgyud la rnam par gzhag pa dang //	brgyud_0 la_6 rnam_9 ba_14 'jog_18 ba_24 dang_27 
T02D2684:226a-14	bshad pa'i tshul gyis rtogs par bya ste /	'chad_0 ba_6 tshul_11 gyis_17 rtogs_22 ba_28 byed_32 ste_36 
T02D2684:226a-15	re zhig spyi rgyud kyi rnam par gzhag pa ni /	re_0 'jig_3 spyi_8 brgyud_13 kyi_19 rnam_23 ba_28 'jog_32 ba_38 ni_41 
T02D2684:226a-16	gang zhig rgyun chags pa de'i rgyud de'o //	gang_0 'jig_5 rgyun_10 chags_16 ba_22 de_25 brgyud_30 de_36 
T02D2684:226a-17	rgyud las ji skad du /	brgyud_0 las_6 ji_10 skad_13 du_18 
T02D2684:226a-18	rgyud ni rgyun chags zhes bya ste /	brgyud_0 ni_6 rgyun_9 chags_15 zhes_21 byed_26 ste_30 
T02D2684:226a-19	'khor ba rgyud du 'dod pa yin //	'khor_0 ba_6 brgyud_9 du_15 'dod_18 ba_23 yin_26 
T02D2684:226a-20	mya ngan las 'das rgyud phyi ma //	mya_0 ngan_4 las_9 'da'_13 brgyud_18 phyi_24 ma_29 
T02D2684:226a-21	zhes gsungs so //	zhes_0 gsungs_5 so_12 
T02D2684:226a-22	gzhan yang /	gzhan_0 yang_6 
T02D2684:226a-23	ma tshang med dang 'brel ba dang //	ma_0 tshang_3 med_10 dang_14 'brel_19 ba_25 dang_28 
T02D2684:226a-24	zhes bya ba la sogs pa'i don yang de bzhin du rig par bya'o //	zhes_0 byed_5 ba_9 la_12 sogs_15 ba_20 don_25 yang_29 de_34 bzhin_37 du_43 rig_46 ba_50 byed_54 
T02D2684:226a-25	de lta bu'i rgyud de la yang gdul bya'i khyad	de_0 lta_3 bu_7 brgyud_12 de_18 la_21 yang_24 gdul_29 byed_34 khyad_40 
T02D2684:226a-26	par dang brjod bya don gyi khyad par gyis rnam	ba_0 dang_4 rjod_9 byed_15 don_19 gyi_23 khyad_27 ba_33 gyis_37 rnam_42 
T02D2684:226a-27	pa bzhi'o // de yang gang zhe na /	ba_0 bzhi_3 de_13 yang_16 gang_21 zhe_26 na_30 
T02D2684:226a-28	bya ba dang spyod pa dang /	byed_0 ba_4 dang_7 spyod_12 ba_18 dang_21 
T02D2684:226a-29	rnal 'byor bla na med pa'i rgyud do //	rnal_0 'byor_5 bla_11 na_15 med_18 ba_22 brgyud_27 do_33 
T02D2684:226a-30	gzhan dag rgyud gong ma'i lta ba ston cing 'og	gzhan_0 'dag_6 brgyud_10 gong_16 ma_21 lta_26 ba_30 ston_33 cing_38 'og_43 
T02D2684:226a-31	ma'i spyod pa ston pa gnyis ka'i rgyud dang lnga'o	ma_0 spyod_5 ba_11 ston_14 ba_19 gnyis_22 ka_28 brgyud_33 dang_39 lnga_44 
T02D2684:226a-32	zhes 'dod pa ni mi 'thad de /	zhes_0 'dod_5 ba_10 ni_13 mi_16 'thad_19 de_25 
T02D2684:226a-33	de lta na rgyud la la nas rgyud phal cher	de_0 lta_3 na_7 brgyud_10 la_16 la_19 nas_22 brgyud_26 phal_32 cher_37 
T02D2684:226b-0	gyi don @226b tshang bar gsungs pa yang yod pas	gyi_0 don_4 tshang_14 ba_21 gsungs_25 ba_32 yang_35 yod_40 ba_44 
T02D2684:226b-1	rgyud sde lnga las kyang lhag par 'gyur te /	brgyud_0 sde_6 lnga_10 las_15 kyang_19 lhag_25 ba_30 'gyur_34 te_40 
T02D2684:226b-2	nyes pa 'di yang spang bar dka'o //	nyes_0 ba_5 'di_8 yang_12 spong_17 ba_23 dka_27 
T02D2684:226b-3	de'i phyir rgyud de ni bzhi kho na'o //	de_0 phyir_5 brgyud_11 de_17 ni_20 bzhi_23 kho_28 na_32 
T02D2684:226b-4	'dir ni bya ba'i rgyud ston pa'i skabs yin pas de brjod par bya ste /	'dir_0 ni_5 byed_8 ba_12 brgyud_17 ston_23 ba_28 skabs_33 yin_39 ba_43 de_47 rjod_50 ba_56 byed_60 ste_64 
T02D2684:226b-5	longs spyod rdzogs pa'i sku'i gtsug tor las 'od zer	longs_0 spyod_6 rdzogs_12 ba_19 sku_24 gtsug_30 tor_36 las_40 'od_44 zer_48 
T02D2684:226b-6	dang bcas pa'i khro bo zhig byung ste zhus pa	dang_0 'cha'_5 ba_10 khro_15 'bo_20 'jig_23 'byung_28 ste_34 zhus_38 ba_43 
T02D2684:226b-7	la bshad pa ni gtsug tor 'khor los sgyur ba'i	la_0 'chad_3 ba_9 ni_12 gtsug_15 tor_21 'khor_25 los_31 sgyur_35 ba_41 
T02D2684:226b-8	rgyud ces bya'o // de bzhin du zhal khro bo me lce 'bar ba dang /	brgyud_0 ces_6 byed_10 de_19 bzhin_22 du_28 zhal_31 khro_36 'bo_41 me_44 lce_47 'bar_51 ba_56 dang_59 
T02D2684:226b-9	shangs dang /	shangs_0 dang_7 
T02D2684:226b-10	dpung pa dang /	dpung_0 ba_6 dang_9 
T02D2684:226b-11	thugs ka dang /	thugs_0 ka_6 dang_9 
T02D2684:226b-12	gsang ba dang /	gsang_0 ba_6 dang_9 
T02D2684:226b-13	zhabs kyi bol gong la sogs pa nas sprul pa'i zhu ba po la gsang ba'i spyi rgyud dang /	zhabs_0 kyi_6 bol_10 gong_14 la_19 sogs_22 ba_27 nas_30 sprul_34 ba_40 'ju_45 ba_49 po_52 la_55 gsang_58 ba_64 spyi_69 brgyud_74 dang_80 
T02D2684:226b-14	dpung pa bzang po la sogs pa'i rgyud rnams bshad do //	dpung_0 ba_6 bzang_9 po_15 la_18 sogs_21 ba_26 brgyud_31 rnams_37 'chad_43 do_49 
T02D2684:226b-15	de dag thams cad kyi don zab mo mdor bsdus	de_0 'dag_3 thams_7 cad_13 kyi_17 don_21 zab_25 mo_29 mdor_32 sdud_37 
T02D2684:226b-16	te lag na rdo rje la gsungs pa ni rdo	te_0 lag_3 na_7 rdo_10 rje_14 la_18 gsungs_21 ba_28 ni_31 rdo_34 
T02D2684:226b-17	rje rnam par 'joms pa ste /	rje_0 rnam_4 ba_9 'joms_13 ba_19 ste_22 
T02D2684:226b-18	le lag gi rgyud dam man ngag gi rgyud ces kyang bya'o //	le_0 lag_3 gi_7 brgyud_10 dam_16 man_20 ngag_24 gi_29 brgyud_32 ces_38 kyang_42 byed_48 
T02D2684:226b-19	de ltar na mdor bsdus te rgyud kyi rnam par gzhag pa'i bshad pa'o //	de_0 ltar_3 na_8 mdor_11 sdud_16 te_22 brgyud_25 kyi_31 rnam_35 ba_40 'jog_44 ba_50 'chad_55 ba_61 
T02D2684:226b-20	de nas rgyud kyi bshad pa'i tshul brjod par bya'o //	de_0 nas_3 brgyud_7 kyi_13 'chad_17 ba_23 tshul_28 rjod_34 ba_40 byed_44 
T02D2684:226b-21	de la phun sum tshogs pa rnam pa lnga ste /	de_0 la_3 phun_6 sum_11 tshogs_15 ba_22 rnam_25 ba_30 lnga_33 ste_38 
T02D2684:226b-22	ston pa dang /	ston_0 ba_5 dang_8 
T02D2684:226b-23	gnas dang /	gnas_0 dang_5 
T02D2684:226b-24	dus dang //	dus_0 dang_4 
T02D2684:226b-25	chos dang /	chos_0 dang_5 
T02D2684:226b-26	'khor ro //	'khor_0 ro_6 
T02D2684:226b-27	de la ston pa ni longs spyod rdzogs pa'i sku'o //	de_0 la_3 ston_6 ba_11 ni_14 longs_17 spyod_23 rdzogs_29 ba_36 sku_41 
T02D2684:226b-28	gnas ni chos kyi dbyings kyi pho brang ngo //	gnas_0 ni_5 chos_8 kyi_13 dbyings_17 kyi_25 pho_29 brang_33 ngo_39 
T02D2684:226b-29	dus ni 'dzam bu'i gling du chos kyis 'khor lo	dus_0 ni_4 'dzam_7 bu_13 gling_18 du_24 chos_27 kyis_32 'khor_37 lo_43 
T02D2684:226b-30	gsum gsungs ba'i rjes la'am bsam gyis mi khyab pa'i	gsum_0 gsungs_5 ba_12 rjes_17 la_22 bsam_28 gyis_33 mi_38 khyab_41 ba_47 
T02D2684:226b-31	dus su'o // chos ni rdo rje rnam par 'joms pa la sogs pa'i rgyud rnams so //	dus_0 su_4 chos_12 ni_17 rdo_20 rje_24 rnam_28 ba_33 'joms_37 ba_43 la_46 sogs_49 ba_54 brgyud_59 rnams_65 so_71 
T02D2684:226b-32	'khor ni sa bcu'i byang chub sems dpa' lag na rdo rje la sogs pa'o //	'khor_0 ni_6 sa_9 'chu_12 byang_18 chub_24 sems_29 dpa'_34 lag_39 na_43 rdo_46 rje_50 la_54 sogs_57 ba_62 
T02D2684:226b-33	de ltan rgyun bshad pa'i tshul lo //	de_0 ltan_3 rgyun_8 'chad_14 ba_20 tshul_25 lo_31 
T02D2684:226b-34	da ni gzhung gi don la 'jug par bya ste /	da_0 ni_3 gzhung_6 gi_13 don_16 la_20 'jug_23 ba_28 byed_32 ste_36 
T02D2684:226b-35	de yang gnyis te drang ba'i don dang nges pa'i don yi ge ltar bshad pa dang /	de_0 yang_3 gnyis_8 te_14 'dren_17 ba_23 don_28 dang_32 nges_37 ba_42 don_47 yi_51 ge_54 ltar_57 'chad_62 ba_68 dang_71 
T02D2684:226b-36	gdams ngag gi don phyi dang /	'doms_0 ngag_6 gi_11 don_14 phyi_18 dang_23 
T02D2684:226b-37	nang dang gsang ba dang de kho na nyid kyi dbye bas khrus bzhi bstan pa'o //	nang_0 dang_5 gsang_10 ba_16 dang_19 de_24 kho_27 na_31 nyid_34 kyi_39 'byed_43 ba_48 'khru_52 bzhi_58 ston_63 ba_69 
T02D2684:226b-38	de la re zhig yi ge'i don brjod par bya ste /	de_0 la_3 re_6 'jig_9 yi_14 ge_17 don_22 rjod_26 ba_32 byed_36 ste_40 
T02D2684:226b-39	de la yang dang por nges pa'i don brjod par bya'i /	de_0 la_3 yang_6 dang_11 por_16 nges_20 ba_25 don_30 rjod_34 ba_40 byed_44 
T02D2684:226b-40	yi ge'i don brjod pa ni sgra ji bzhin du 'og nas brjod par bya'o //	yi_0 ge_3 don_8 rjod_12 ba_18 ni_21 sgra_24 ji_29 bzhin_32 du_38 'og_41 nas_45 rjod_49 ba_55 byed_59 
T02D2684:226b-41	nges pa'i don du sbyar na chos thams cad kyi	nges_0 ba_5 don_10 du_14 sbyor_17 na_23 chos_26 thams_31 cad_37 kyi_41 
T02D2684:226b-42	de bzhin nyid la bsgyur zhing bcos su mi yi	de_0 bzhin_3 nyid_9 la_14 sgyur_17 zhing_24 'chos_30 su_35 mi_38 yi_41 
T02D2684:226b-43	ge'i don brjod par bya ste /	ge_0 don_5 rjod_9 ba_15 byed_19 ste_23 
T02D2684:226b-44	de la yang dang por nges pa'i pa'i don du 'di skad ces bya ba gsungs so //	de_0 la_3 yang_6 dang_11 por_16 nges_20 ba_25 ba_30 don_35 du_39 'di_42 skad_46 ces_51 byed_55 ba_59 gsungs_62 so_69 
T02D2684:227a-0	yang dag par ni chos thams cad de bzhin nyid las ma g-yos shing @227a * //	yang_0 'dag_5 ba_9 ni_13 chos_16 thams_21 cad_27 de_31 bzhin_34 nyid_40 las_45 ma_49 g-yos_52 shing_58 
T02D2684:227a-1	de kho na nyid yin pas na bdag gis zhes bya'o //	de_0 kho_3 na_7 nyid_10 yin_15 ba_19 na_23 bdag_26 gis_31 zhes_35 byed_40 
T02D2684:227a-2	'o na de bzhin nyid la kha dog dang dbyibs	'o_0 na_3 de_6 bzhin_9 nyid_15 la_20 kha_23 dog_27 dang_31 dbyibs_36 
T02D2684:227a-3	la sogs pa'i rang bzhin med pas ji ltar rtogs	la_0 sogs_3 ba_8 rang_13 bzhin_18 med_24 ba_28 ji_32 ltar_35 rtogs_40 
T02D2684:227a-4	par rung snyam pa la de'i phyir /	ba_0 rung_4 snyam_9 ba_15 la_18 de_21 phyir_26 
T02D2684:227a-5	bla ma'i drin gyis rtogs par 'gyur //	bla_0 ma_4 drin_9 gyis_14 rtogs_19 ba_25 'gyur_29 
T02D2684:227a-6	zhes gsungs pa ni thos pa zhes bya'o /	zhes_0 gsungs_5 ba_12 ni_15 thos_18 ba_23 zhes_26 byed_31 
T02D2684:227a-7	de yang dpe la sogs pa'i sgo nas bla mas	de_0 yang_3 dpe_8 la_12 sogs_15 ba_20 sgo_25 nas_29 bla_33 mas_37 
T02D2684:227a-8	mtshon pa las rim gyis nges par skye bar 'gyur	mtshon_0 ba_7 las_10 rim_14 gyis_18 nges_23 ba_28 skye_32 ba_37 'gyur_41 
T02D2684:227a-9	gyi cig car du rang gi ngo bor thos pa'am	gyi_0 cig_4 car_8 du_12 rang_15 gi_20 ngo_23 'bor_27 thos_31 ba_36 
T02D2684:227a-10	/ rtogs pa ma yin no //	rtogs_2 ba_8 ma_11 yin_14 no_18 
T02D2684:227a-11	de lta bu'i bla ma dam pa rnyed dka' zhing	de_0 lta_3 bu_7 bla_12 ma_16 dam_19 ba_23 rnyed_26 dka'_32 zhing_37 
T02D2684:227a-12	des rjes su bzung yang de kho na nyid myur	des_0 rjes_4 su_9 bzung_12 yang_18 de_23 kho_26 na_30 nyid_33 myur_38 
T02D2684:227a-13	du rtogs par dka' ste rim gyis sbyangs pa la	du_0 rtogs_3 ba_9 dka'_13 ste_18 rim_22 gyis_26 sbyong_31 ba_39 la_42 
T02D2684:227a-14	sna ma zhig rtogs par 'gyur bas na dus gcig	sna_0 ma_4 'jig_7 rtogs_12 ba_18 'gyur_22 ba_28 na_32 dus_35 gcig_39 
T02D2684:227a-15	na zhes gsungs so //	na_0 zhes_3 gsungs_8 so_15 
T02D2684:227a-16	gang gis de ltar rtogs pa'i don de la ni	gang_0 gis_5 de_9 ltar_12 rtogs_17 ba_23 don_28 de_32 la_35 ni_38 
T02D2684:227a-17	grub pa'i mtha' zhe'am lta ba zhes kyang zer ro	'grub_0 ba_5 mtha'_10 zhe_16 lta_23 ba_27 zhes_30 kyang_35 zer_41 ro_45 
T02D2684:227a-18	// de ltar rtogs pa'i don la gnas te 'dris	de_3 ltar_6 rtogs_11 ba_17 don_22 la_26 gnas_29 te_34 'dris_37 
T02D2684:227a-19	shing goms par byed pa ni bsgom pa zhes bya	shing_0 goms_6 ba_11 byed_15 ba_20 ni_23 bsgom_26 ba_32 zhes_35 byed_40 
T02D2684:227a-20	ba'am rnal 'byor zhes kyang zer ro //	ba_0 rnal_6 'byor_11 zhes_17 kyang_22 zer_28 ro_32 
T02D2684:227a-21	de lta bu'i bstan pa dang gong nas gong du	de_0 lta_3 bu_7 ston_12 ba_18 dang_21 gong_26 nas_31 gong_35 du_40 
T02D2684:227a-22	phogs dbyung ba'i gnas skabs la ni sa dang lam	phogs_0 'byin_6 ba_13 gnas_18 skabs_23 la_29 ni_32 sa_35 dang_38 lam_43 
T02D2684:227a-23	gyi rim pa zhes zer ro //	gyi_0 rim_4 ba_8 zhes_11 zer_16 ro_20 
T02D2684:227a-24	de rab tu gsal zhing khyad par du gyur pa'i	de_0 rab_3 tu_7 gsal_10 zhing_15 khyad_21 ba_27 du_31 gyur_34 ba_39 
T02D2684:227a-25	gnas skabs na sgrub pa po de la byang chub	gnas_0 skabs_5 na_11 sgrub_14 ba_20 po_23 de_26 la_29 byang_32 chub_38 
T02D2684:227a-26	sems dpa' zhes zer ro //	sems_0 dpa'_5 zhes_10 zer_15 ro_19 
T02D2684:227a-27	de yang nyon mongs pa'i sems kyis mi 'jug cing	de_0 yang_3 nyon_8 mongs_13 ba_19 sems_24 kyis_29 mi_34 'jug_37 cing_42 
T02D2684:227a-28	rang gis nyams su myong ba la gnod pa'i las	rang_0 gis_5 nyams_9 su_15 myong_18 ba_24 la_27 gnod_30 ba_35 las_40 
T02D2684:227a-29	mi byed pa ni spyod pa zhes bya'o //	mi_0 byed_3 ba_8 ni_11 spyod_14 ba_20 zhes_23 byed_28 
T02D2684:227a-30	de ltar na lta ba dang //	de_0 ltar_3 na_8 lta_11 ba_15 dang_18 
T02D2684:227a-31	de la gnas pa dang /	de_0 la_3 gnas_6 ba_11 dang_14 
T02D2684:227a-32	sgom pa dang /	sgom_0 ba_5 dang_8 
T02D2684:227a-33	de dang mi 'gal ba'i las spyod pa ste de	de_0 dang_3 mi_8 'gal_11 ba_16 las_21 spyod_25 ba_31 ste_34 de_38 
T02D2684:227a-34	dag dang ldan pa ni brtson 'grus kyi khyad par	'dag_0 dang_4 ldan_9 ba_14 ni_17 brtson_20 'grus_27 kyi_33 khyad_37 ba_43 
T02D2684:227a-35	gyi skye ba gcig gam gnyis la sogs pa ci	gyi_0 skye_4 ba_9 gcig_12 gam_17 gnyis_21 la_27 sogs_30 ba_35 ci_38 
T02D2684:227a-36	rigs par rang 'dod pa'i 'bras bu 'thob par gyur	rigs_0 ba_5 rang_9 'dod_14 ba_19 'bras_24 bu_30 'thob_33 ba_39 gyur_43 
T02D2684:227a-37	pas 'bras bu bstan pa ni bcom ldan 'das gsungs	ba_0 'bras_4 bu_10 ston_13 ba_19 ni_22 'joms_25 ldan_30 'da'_35 gsungs_40 
T02D2684:227a-38	te / de ni thob par 'dod pa'i phyir 'bras bu'o //	te_0 de_5 ni_8 'thob_11 ba_16 'dod_20 ba_25 phyir_30 'bras_36 bu_42 
T02D2684:227a-39	gnas skabs kyi 'bras bu'i drang ba'i don brjod pa'i skabs su brjod par bya'o //	gnas_0 skabs_5 kyi_11 'bras_15 bu_21 'dren_26 ba_32 don_37 rjod_41 ba_47 skabs_52 su_58 rjod_61 ba_67 byed_71 
T02D2684:227a-40	de la bcom ldan 'das zhes bya ba ni phyin	de_0 la_3 'joms_6 ldan_11 'da'_16 zhes_21 byed_26 ba_30 ni_33 phyin_36 
T02D2684:227a-41	ci log 'joms pa'i skal ba can te bha ga	ci_0 log_3 'joms_7 ba_13 skal_18 ba_23 can_26 te_30 bha_33 ga_37 
T02D2684:227a-42	zhes bya ba'i don ni skal ba'am 'joms pa yin	zhes_0 byed_5 ba_9 don_14 ni_18 skal_21 ba_26 'joms_32 ba_38 yin_41 
T02D2684:227a-43	pa'i phyir ro // gang 'joms she na bdud bzhi	ba_0 phyir_5 ro_11 gang_17 'joms_22 she_28 na_32 bdud_35 bzhi_40 
T02D2684:227a-44	'joms pa ste skye ba ni phung po lnga mngon	'joms_0 ba_6 ste_9 skye_13 ba_18 ni_21 'phung_24 po_30 lnga_33 mngon_38 
T02D2684:227a-45	par len pas na phung po'i bdud do //	ba_0 len_4 ba_8 na_12 'phung_15 po_21 bdud_26 do_31 
T02D2684:227a-46	rgas pa ni legs pa las nyams pas na lha'i bu'i bdud do //	rga_0 ba_5 ni_8 legs_11 ba_16 las_19 nyams_23 ba_29 na_33 lha_36 bu_42 bdud_47 do_52 
T02D2684:227a-47	na pa ni bde bas phongs shing nyon mongs pas na nyon mongs pa'i bdud do //	na_0 ba_3 ni_6 bde_9 ba_13 'phong_17 shing_24 nyon_30 mongs_35 ba_41 na_45 nyon_48 mongs_53 ba_59 bdud_64 do_69 
T02D2684:227b-0	'chi @227b ba ni nyid mtshams sbyor bar 'gyur ba ste 'chi bdag gi bdud do //	'chi_0 ba_11 ni_14 nyid_17 mtshams_22 sbyor_30 ba_36 'gyur_40 ba_46 ste_49 'chi_53 bdag_58 gi_63 bdud_66 do_71 
T02D2684:227b-1	bdud de rnams gang las byung zhe na /	bdud_0 de_5 rnams_8 gang_14 las_19 'byung_23 zhe_29 na_33 
T02D2684:227b-2	nyon mongs pas bskul ba las byung ba'o //	nyon_0 mongs_5 ba_11 skul_15 ba_21 las_24 'byung_28 ba_34 
T02D2684:227b-3	de yang gang las byung zhe na bag chags dang	de_0 yang_3 gang_8 las_13 'byung_17 zhe_23 na_27 bag_30 chags_34 dang_40 
T02D2684:227b-4	bcas pa'i sems las byung bas na sems de ni	'cha'_0 ba_5 sems_10 las_15 'byung_19 ba_25 na_29 sems_32 de_37 ni_40 
T02D2684:227b-5	nyes pa thams cad 'byung ba'i rtsa bar gyur bas	nyes_0 ba_5 thams_8 cad_14 'byung_18 ba_25 rtsa_30 ba_35 gyur_39 ba_44 
T02D2684:227b-6	/ rgyud do cog gi rtsa ba ste //	brgyud_2 do_8 cog_11 gi_15 rtsa_18 ba_23 ste_26 
T02D2684:227b-7	zhes gsungs so //	zhes_0 gsungs_5 so_12 
T02D2684:227b-8	gzhan yang de legs bar rtogs shing sems de'i rang	gzhan_0 yang_6 de_11 legs_14 ba_19 rtogs_23 shing_29 sems_35 de_40 rang_45 
T02D2684:227b-9	bzhin khong du goms pas bdag dang gzhan la phan	bzhin_0 khong_6 du_12 goms_15 ba_20 bdag_24 dang_29 gzhan_34 la_40 phan_43 
T02D2684:227b-10	pa dang bde ba thams cad kyang de la 'byung	ba_0 dang_3 bde_8 ba_12 thams_15 cad_21 kyang_25 de_31 la_34 'byung_37 
T02D2684:227b-11	bas de'i phyir / rgyud do cog gi rtsa ba ste //	ba_0 de_4 phyir_9 brgyud_17 do_23 cog_26 gi_30 rtsa_33 ba_38 ste_41 
T02D2684:227b-12	zhes bya'o //	zhes_0 byed_5 
T02D2684:227b-13	rgyud thams cad du yang don 'di rtogs pa'i thabs	brgyud_0 thams_6 cad_12 du_16 yang_19 don_24 'di_28 rtogs_32 ba_38 thabs_43 
T02D2684:227b-14	gzhan dang gzhan gsungs bar zad kyi don gyi gtso	gzhan_0 dang_6 gzhan_11 gsungs_17 ba_24 zad_28 kyi_32 don_36 gyi_40 gtso_44 
T02D2684:227b-15	bo ni 'di nyid yin pa'i phyir yang /	'bo_0 ni_3 'di_6 nyid_10 yin_15 ba_19 phyir_24 yang_30 
T02D2684:227b-16	rgyud do cog gis rtsa ba ste //	brgyud_0 do_6 cog_9 gis_13 rtsa_17 ba_22 ste_25 
T02D2684:227b-17	zhes gsungs so //	zhes_0 gsungs_5 so_12 
T02D2684:227b-18	de lta bas na gzhom zhing gdul bar bya ba ni rang gi sems yin te /	de_0 lta_3 ba_7 na_11 'joms_14 zhing_20 gdul_26 ba_31 byed_35 ba_39 ni_42 rang_45 gi_50 sems_53 yin_58 te_62 
T02D2684:227b-19	ma bcos na nyes pa'i rgyud do cog yin la /	ma_0 'chos_3 na_8 nyes_11 ba_16 brgyud_21 do_27 cog_30 yin_34 la_38 
T02D2684:227b-20	bcos pa ni legs pa'i dpal kun thob par byed pa'i phyir ro //	'chos_0 ba_5 ni_8 legs_11 ba_16 dpal_21 kun_26 'thob_30 ba_35 byed_39 ba_44 phyir_49 ro_55 
T02D2684:227b-21	'o na gang gis gzhom zhe na /	'o_0 na_3 gang_6 gis_11 'joms_15 zhe_21 na_25 
T02D2684:227b-22	de la gsum ste /	de_0 la_3 gsum_6 ste_11 
T02D2684:227b-23	ji ltar gzhom pa dang /	ji_0 ltar_3 'joms_8 ba_14 dang_17 
T02D2684:227b-24	gang gzhom pa dang /	gang_0 'joms_5 ba_11 dang_14 
T02D2684:227b-25	gang gis bcom pa'o //	gang_0 gis_5 'joms_9 ba_14 
T02D2684:227b-26	ji ltar gzhom pa ni rtogs pa'i don rjes su bsgrub pa mthar phyir pas so //	ji_0 ltar_3 'joms_8 ba_14 ni_17 rtogs_20 ba_26 don_31 rjes_35 su_40 sgrub_43 ba_50 mthar_53 phyir_59 ba_65 so_69 
T02D2684:227b-27	gang gzhom pa ni bdud bzhi la sogs pa'i rgyud do cog gi rtsa ba'o //	gang_0 'joms_5 ba_11 ni_14 bdud_17 bzhi_22 la_27 sogs_30 ba_35 brgyud_40 do_46 cog_49 gi_53 rtsa_56 ba_61 
T02D2684:227b-28	gang gis bcom pa ni dbang gi rim pa dang mthun pa'i khrus kyis so //	gang_0 gis_5 'joms_9 ba_14 ni_17 dbang_20 gi_26 rim_29 ba_33 dang_36 mthun_41 ba_47 'khru_52 kyis_58 so_63 
T02D2684:227b-29	de ltar bcom pas dpal kun gyis ni legs par brgyan pa dang ldan par 'gyur ro //	de_0 ltar_3 'joms_8 ba_13 dpal_17 kun_22 gyis_26 ni_31 legs_34 ba_39 rgyan_43 ba_50 dang_53 ldan_58 ba_63 'gyur_67 ro_73 
T02D2684:227b-30	de gang gis bcom pa la rnam par rtog pa	de_0 gang_3 gis_8 'joms_12 ba_17 la_20 rnam_23 ba_28 rtogs_32 ba_37 
T02D2684:227b-31	med cing gang la yang mi gnas pa zhes bya'o	med_0 cing_4 gang_9 la_14 yang_17 mi_22 gnas_25 ba_30 zhes_33 byed_38 
T02D2684:227b-32	// rdo rje la bzhugs zhes bya ba ni spangs	rdo_3 rje_7 la_11 bzhugs_14 zhes_21 byed_26 ba_30 ni_33 spong_36 
T02D2684:227b-33	pa dang ye shes phun sum tshogs pa'i ngo bo	ba_0 dang_3 ye_8 shes_11 phun_16 sum_21 tshogs_25 ba_32 ngo_37 'bo_41 
T02D2684:227b-34	nyid las mi 'gyur zhes bya ba'i tha tshig go	nyid_0 las_5 mi_9 'gyur_12 zhes_18 byed_23 ba_27 tha_32 tshig_36 go_42 
T02D2684:227b-35	// // de'i che ba'i rang bzhin dang yon tan	de_6 che_11 ba_15 rang_20 bzhin_25 dang_31 yon_36 tan_40 
T02D2684:227b-36	ni 'og nas mi chod pa zhes bya ba la	ni_0 'og_3 nas_7 mi_11 chod_14 ba_19 zhes_22 byed_27 ba_31 la_34 
T02D2684:227b-37	sogs pas bstan to //	sogs_0 ba_5 ston_9 to_15 
T02D2684:227b-38	de'i don ni 'di skad du bstan par 'gyur te /	de_0 don_5 ni_9 'di_12 skad_16 du_21 ston_24 ba_30 'gyur_34 te_40 
T02D2684:227b-39	gang gi bla ma la brten te de kho na	gang_0 gi_5 bla_8 ma_12 la_15 rten_18 te_24 de_27 kho_30 na_34 
T02D2684:227b-40	nyid rtogs pa mngon du byas pa'i 'bras bu ni	nyid_0 rtogs_5 ba_11 mngon_14 du_20 byed_23 ba_28 'bras_33 bu_39 ni_42 
T02D2684:227b-41	dbyings dang ye shes dbyer med pa las smin pa'i	dbyings_0 dang_8 ye_13 shes_16 dbyer_21 med_27 ba_31 las_34 smin_38 ba_43 
T02D2684:227b-42	tshul du don mdzad cing bzhugs so zhes rig par	tshul_0 du_6 don_9 mdzad_13 cing_19 bzhugs_24 so_31 zhes_34 rig_39 ba_43 
T02D2684:227b-43	bya'o // de'i yang bcom ldan 'das zhes bya bas	byed_0 de_9 yang_14 'joms_19 ldan_24 'da'_29 zhes_34 byed_39 ba_43 
T02D2684:227b-44	ni chad pa'i mtha' bsal te rdzogs pa'i sangs rgyas	ni_0 'chad_3 ba_8 mtha'_13 bsal_19 te_24 rdzogs_27 ba_34 sangs_39 rgya_45 
T02D2684:227b-45	la zag pa med pa'i rang bzhin can bde ba	la_0 zag_3 ba_7 med_10 ba_14 rang_19 bzhin_24 can_30 bde_34 ba_38 
T02D2684:228a-0	chen po'i @228a * //	chen_0 po_5 
T02D2684:228a-1	ye shes mnga' bar bstan to //	ye_0 shes_3 mnga'_8 ba_14 ston_18 to_24 
T02D2684:228a-2	rdo rje la bzhugs zhes bya bas ni rtag pa'i mtha' bsal te /	rdo_0 rje_4 la_8 bzhugs_11 zhes_18 byed_23 ba_27 ni_31 rtag_34 ba_39 mtha'_44 bsal_50 te_55 
T02D2684:228a-3	chos kyi dbyings ston ba nyid bstan pa'o //	chos_0 kyi_5 dbyings_9 ston_17 ba_22 nyid_25 ston_30 ba_36 
T02D2684:228a-4	de ltar chos kyi dbyings stong pa nyid dang ye	de_0 ltar_3 chos_8 kyi_13 dbyings_17 stong_25 ba_31 nyid_34 dang_39 ye_44 
T02D2684:228a-5	shes rtog ba med par mar la mar zhugs pa'am	shes_0 rtogs_5 ba_10 med_13 ba_17 mar_21 la_25 mar_28 'jug_32 ba_38 
T02D2684:228a-6	/ chu la chu thim pa lta bur gyur pa ste de la chos kyi sku zhes kyang bya /	chu_2 la_6 chu_9 'thim_13 ba_18 lta_21 bur_25 gyur_29 ba_34 ste_37 de_41 la_44 chos_47 kyi_52 sku_56 zhes_60 kyang_65 byed_71 
T02D2684:228a-7	sangs rgyas bcom ldan 'das zhes kyang bya /	sangs_0 rgya_6 'joms_12 ldan_17 'da'_22 zhes_27 kyang_32 byed_38 
T02D2684:228a-8	rdo rje 'chang zhes kyang bya /	rdo_0 rje_4 'chang_8 zhes_15 kyang_20 byed_26 
T02D2684:228a-9	byang chub chen po zhes kyang bya'o //	byang_0 chub_6 chen_11 po_16 zhes_19 kyang_24 byed_30 
T02D2684:228a-10	sangs rgyas kyi mthu zhes bya ba la sangs rgyas ni 'das ma thag par bshad pa nyid do //	sangs_0 rgya_6 kyi_12 mthu_16 zhes_21 byed_26 ba_30 la_33 sangs_36 rgya_42 ni_48 'da'_51 ma_56 thag_59 ba_64 'chad_68 ba_74 nyid_77 do_82 
T02D2684:228a-11	mthu ni cho 'phrul te nam mkha'i cho 'phrul sprin la sogs pa sna tshogs 'byung ba lta bu'o ;	mthu_0 ni_5 cho_8 'phrul_12 te_19 nam_22 mkha_26 cho_33 'phrul_37 sprin_44 la_50 sogs_53 ba_58 sna_61 tshogs_65 'byung_72 ba_79 lta_82 bu_86 
T02D2684:228a-12	/ gang la nang du don mi g-yeng ba'i yang	gang_2 la_7 nang_10 du_15 don_18 mi_22 g-yeng_25 ba_32 yang_37 
T02D2684:228a-13	lag tu phyag tu de mtshon byed kyi phyag mtshan	lag_0 tu_4 phyag_7 tu_13 de_16 mtshon_19 byed_26 kyi_31 phyag_35 mtshan_41 
T02D2684:228a-14	bsnams pa la de skad dku ba rjod de lag	snom_0 ba_7 la_10 de_13 skad_16 dku_21 ba_25 rjod_28 de_33 lag_36 
T02D2684:228a-15	na rdo rje'ang nang gi stong pa'i ngang la mi	na_0 rdo_3 rje_7 nang_15 gi_20 stong_23 ba_29 ngang_34 la_40 mi_43 
T02D2684:228a-16	yengs pa'i brjed byang du rdo rje lag tu thogs	yengs_0 ba_6 brjed_11 byang_17 du_23 rdo_26 rje_30 lag_34 tu_38 thogs_41 
T02D2684:228a-17	pas lag na rdo rje'o //	ba_0 lag_4 na_8 rdo_11 rje_15 
T02D2684:228a-18	rnam par smin pa las grub pa las grub ba	rnam_0 ba_5 smin_9 ba_14 las_17 'grub_21 ba_26 las_29 'grub_33 ba_38 
T02D2684:228a-19	dang ting nge 'dzin gyi lus la ni lus thams	dang_0 ting_5 nge_10 'dzin_14 gyi_20 lus_24 la_28 ni_31 lus_34 thams_38 
T02D2684:228a-20	cad ces gsungs so //	cad_0 ces_4 gsungs_8 so_15 
T02D2684:228a-21	rdo rje byin gyis brlabs zhes bya ba ni stong	rdo_0 rje_4 byin_8 gyis_13 brlabs_18 zhes_25 byed_30 ba_34 ni_37 stong_40 
T02D2684:228a-22	pa nyid sgom pa'i snod du rung bar byas shing	ba_0 nyid_3 sgom_8 ba_13 snod_18 du_23 rung_26 ba_31 byed_35 shing_40 
T02D2684:228a-23	stong pa nyid kyis gdams ngag gnang ba'o //	stong_0 ba_6 nyid_9 kyis_14 'doms_19 ngag_25 gnang_30 ba_36 
T02D2684:228a-24	rdo rje ting nge 'dzin la snyoms par zhugs so	rdo_0 rje_4 ting_8 nge_13 'dzin_17 la_23 snyom_26 ba_33 'jug_37 so_43 
T02D2684:228a-25	zhes bya ba ni lag na rdo rjes gdams ba	zhes_0 byed_5 ba_9 ni_12 lag_15 na_19 rdo_22 rjes_26 'doms_31 ba_37 
T02D2684:228a-26	de lhur blangs te sgrub cing gnas ba'o /	de_0 lhur_3 blangs_8 te_15 sgrub_18 cing_24 gnas_29 ba_34 
T02D2684:228a-27	zhes rig par bya'o //	zhes_0 rig_5 ba_9 byed_13 
T02D2684:228a-28	gdams pa gang zhe na stong pa nyid dang ldan ba'i khrus bzhi'o //	'doms_0 ba_6 gang_9 zhe_14 na_18 stong_21 ba_27 nyid_30 dang_35 ldan_40 ba_45 'khru_50 bzhi_56 
T02D2684:228a-29	de dag ni yi ge'i don nges pa'i don du mdor bsdus te bkod pa'o //	de_0 'dag_3 ni_7 yi_10 ge_13 don_18 nges_22 ba_27 don_32 du_36 mdor_39 sdud_44 te_50 bkod_53 ba_58 
T02D2684:228a-30	da ni gdams ngag gi don brjod par bya'o //	da_0 ni_3 'doms_6 ngag_12 gi_17 don_20 rjod_24 ba_30 byed_34 
T02D2684:228a-31	de la bzhi ste /	de_0 la_3 bzhi_6 ste_11 
T02D2684:228a-32	gzungs sngags kyi tshul zlos pa'i phyi'i khrus dang /	gzungs_0 sngags_7 kyi_14 tshul_18 zlos_24 ba_29 phyi_34 'khru_41 dang_47 
