T02D1270:73a-8	aa nu rkto me bha ba /	aa_0 nu_3 rkto_6 me_11 bha_14 ba_18 
T02D1270:73a-9	sarba siddhim me pra ya tstsha /	sarba_0 siddhim_6 me_14 pra_17 ya_21 tstsha_24 
T02D1270:73a-10	sarba ka rma su tsa me /	sarba_0 ka_6 rma_9 su_13 tsa_16 me_20 
T02D1270:73a-11	tsittam shre ya: ku ru h'um /	tsittam_0 shre_8 ya:_13 ku_17 ru_20 h_23 
T02D1270:73a-12	ha ha ha ha ho: bha ga b'a na /	ha_0 ha_3 ha_6 ha_9 ho:_12 bha_16 ga_20 b_23 na_27 
T02D1270:73a-13	sarba ta th'a ga ta badzra m'a me munydza badzr'i	sarba_0 ta_6 th_9 ga_14 ta_17 badzra_20 m_27 me_31 munydza_34 badzr_42 
T02D1270:73a-14	bha ba ma h'a sa ma ya satva a'a: rang	bha_0 ba_4 ma_7 h_10 sa_14 ma_17 ya_20 satva_23 a:_29 rang_34 
T02D1270:73a-15	zhi ba'i sbyin sreg byed na /	zhi_0 ba_4 sbyin_9 sreg_15 byed_20 na_25 
T02D1270:73a-16	de las nad dang rnam par 'tshe ba dang bar	de_0 las_3 nad_7 dang_11 rnam_16 ba_21 'tshe_25 ba_31 dang_34 ba_39 
T02D1270:73a-17	du gcog pa dang bgegs dang nyon mongs pa la	du_0 gcog_3 ba_8 dang_11 bgegs_16 dang_22 nyon_27 mongs_32 ba_38 la_41 
T02D1270:73a-18	sogs pa bdud kyi sde bdag dang gzhan gyi don	sogs_0 ba_5 bdud_8 kyi_13 sde_17 bdag_21 dang_26 gzhan_31 gyi_37 don_41 
T02D1270:73a-19	du zhi bar bya ba dang /	du_0 zhi_3 ba_7 byed_11 ba_15 dang_18 
T02D1270:73a-20	mngon par shes pa dang /	mngon_0 ba_6 shes_10 ba_15 dang_18 
T02D1270:73a-21	mchog gi dngos grub thob par bya ba'i phyir zhi ba'i sbyin sreg brtsam par bya'o //	mchog_0 gi_6 dngos_9 'grub_15 'thob_20 ba_25 byed_29 ba_33 phyir_38 zhi_44 ba_48 sbyin_53 sreg_59 brtsam_64 ba_71 byed_75 
T02D1270:73a-22	de nas dkyil 'khor chen po'i shar phyogs su kha	de_0 nas_3 dkyil_7 'khor_13 chen_19 po_24 'char_29 phyogs_34 su_41 kha_44 
T02D1270:73a-23	dog dkar po'i ras la khru gang gi tshad du	dog_0 dkar_4 po_9 ras_14 la_18 khru_21 gang_26 gi_31 tshad_34 du_40 
T02D1270:73a-24	zlum por bskor ba'o //	zlum_0 por_5 skor_9 ba_15 
T02D1270:73a-25	zabs su sor bcu gnyis pa'i tshad du brko'o //	zabs_0 su_5 sor_8 'chu_12 gnyis_16 ba_22 tshad_27 du_33 rko_36 
T02D1270:73a-26	de'i dbus su sor bcu drug pa'i padma 'dab ma brgyad pa dbus su brkos la /	de_0 dbus_5 su_10 sor_13 'chu_17 drug_21 ba_26 padma_31 'dab_37 ma_42 brgyad_45 ba_52 dbus_55 su_60 rko_63 la_69 
T02D1270:73a-27	de'i steng du lha'i mtshan ma bkod la /	de_0 steng_5 du_11 lha_14 mtshan_20 ma_27 bkod_30 la_35 
T02D1270:73a-28	de'i dbus kyi kha khyer nas sor bzhi phyir bskyed pa dang /	de_0 dbus_5 kyi_10 kha_14 'khyer_18 nas_24 sor_28 bzhi_32 phyir_37 skyed_43 ba_50 dang_53 
T02D1270:73a-29	sor bzhi'i kha khyer 'phang du brtsig par bya'o //	sor_0 bzhi_4 kha_11 'khyer_15 'phen_21 du_28 brtsig_31 ba_38 byed_42 
T02D1270:73a-30	de la rdo rje rtse lnga pa sor brgyad pa sor brgyad pa'i rabs yongs su bskor bar bya'o //	de_0 la_3 rdo_6 rje_10 rtse_14 lnga_19 ba_24 sor_27 brgyad_31 ba_38 sor_41 brgyad_45 ba_52 rabs_57 yongs_62 su_68 skor_71 ba_77 byed_81 
T02D1270:73a-31	de'i phyi rol du kha dog dkar po'i sa gzhi	de_0 phyi_5 rol_10 du_14 kha_17 dog_21 dkar_25 po_30 sa_35 gzhi_38 
T02D1270:73a-32	la sogs pa'i zhi ba'i mchod pas yongs su bskor	la_0 sogs_3 ba_8 zhi_13 ba_17 mchod_22 ba_28 yongs_32 su_38 skor_41 
T02D1270:73a-33	bar bya'o // de la kha dog dkar pos legs par byugs la /	ba_0 byed_4 de_13 la_16 kha_19 dog_23 dkar_27 pos_32 legs_36 ba_41 'byug_45 la_51 
T02D1270:73a-34	de'i steng du ba'i rnam lngas byug par bya'o //	de_0 steng_5 du_11 ba_14 rnam_19 lngas_24 'byug_30 ba_35 byed_39 
T02D1270:73a-35	de'i steng du tsandan dkar po la sogs pa'i dkar	de_0 steng_5 du_11 tsandan_14 dkar_22 po_27 la_30 sogs_33 ba_38 dkar_43 
T02D1270:73a-36	po'i dri zhim po dang bdud rtsi lngas zhal khab	po_0 'dri_5 zhim_9 po_14 dang_17 bdud_22 rtsi_27 lngas_32 zhal_38 khab_43 
T02D1270:73a-37	bya'o // me tog dkar po dri zhim po dang	byed_0 me_9 tog_12 dkar_16 po_21 'dri_24 zhim_28 po_33 dang_36 
T02D1270:73a-38	ldan pa'i sil mas thab khung yongs su dgram par	ldan_0 ba_5 sil_10 mas_14 thab_18 khung_23 yongs_29 su_35 'grem_38 ba_44 
T02D1270:73a-39	bya'o // bya'o // yang na 'thas par bcags pa'i dkyil 'khor la rdul tshon gyis bri bar bya'o //	byed_0 byed_9 yang_18 na_23 'thas_26 ba_32 'jags_36 ba_42 dkyil_47 'khor_53 la_59 rdul_62 tshon_67 gyis_73 'bri_78 ba_82 byed_86 
T02D1270:73a-40	de nas ser po la sogs pa'i snod du kha dog dkar po'i dri dang /	de_0 nas_3 ser_7 po_11 la_14 sogs_17 ba_22 snod_27 du_32 kha_35 dog_39 dkar_43 po_48 'dri_53 dang_57 
T02D1270:73a-41	'o ma dang nas blugs pa'i chus legs par bkang la /	'o_0 ma_3 dang_6 nas_11 blugs_15 ba_21 chus_26 legs_31 ba_36 'geng_40 la_46 
T02D1270:73a-42	sv'a h'a'i mtha' dang ldan pa'i sngags kyis sngon bzhin du bsngags te gzhag par bya'o //	sv_0 h'i_5 mtha'_11 dang_17 ldan_22 ba_27 sngags_32 kyis_39 sngon_44 bzhin_50 du_56 bsngags_59 te_67 'jog_70 ba_76 byed_80 
T02D1270:73a-43	'o ma can gyi shing dang kha dog dkar po'i rigs kyi lci ba'i me shing dang /	'o_0 ma_3 can_6 gyi_10 shing_14 dang_20 kha_25 dog_29 dkar_33 po_38 rigs_43 kyi_48 lci_52 ba_56 me_61 shing_64 dang_70 
T02D1270:73a-44	zho dang mar dang sbrang dang /	zho_0 dang_4 mar_9 dang_13 sbrang_18 dang_25 
T02D1270:73a-45	'o ma dang /	'o_0 ma_3 dang_6 
T02D1270:73a-46	nas dang /	nas_0 dang_4 
T02D1270:73a-47	'bras rngos pa dang /	'bras_0 rngos_6 ba_12 dang_15 
T02D1270:73a-48	pri yang ku dang /	pri_0 yang_4 ku_9 dang_12 
T02D1270:73b-0	@73b tsandan dang /	tsandan_5 dang_13 
T02D1270:73b-1	s'a la'i zas mchog dang /	s_0 la_4 zas_9 mchog_13 dang_19 
T02D1270:73b-2	ku sha sar pa dang /	ku_0 sha_3 sar_7 ba_11 dang_14 
T02D1270:73b-3	d'ur ba dang /	d_0 ba_5 dang_8 
T02D1270:73b-4	me tog dkar po dang /	me_0 tog_3 dkar_7 po_12 dang_15 
T02D1270:73b-5	gser dang /	gser_0 dang_5 
T02D1270:73b-6	tsu ta'i lo ma dang /	tsu_0 ta_4 lo_9 ma_12 dang_15 
T02D1270:73b-7	shing gi bcud dkar po dri zhim po la sogs pas sbyin sreg bya'o //	shing_0 gi_6 bcud_9 dkar_14 po_19 'dri_22 zhim_26 po_31 la_34 sogs_37 ba_42 sbyin_46 sreg_52 byed_57 
T02D1270:73b-8	pa la sha la sogs pa'i shing la yam shing	ba_0 la_3 sha_6 la_10 sogs_13 ba_18 shing_23 la_29 yam_32 shing_36 
T02D1270:73b-9	sor bcu gnyis pa mthe'u chung gi tshad tsam du	sor_0 'chu_4 gnyis_8 ba_14 mthe_17 chung_24 gi_30 tshad_33 tsam_39 du_44 
T02D1270:73b-10	sbom la / rtse mo'i cha las byung ba srog chags med cing sar pa /	sbom_0 la_5 rtse_10 mo_15 cha_20 las_24 'byung_28 ba_34 srog_37 chags_42 med_48 cing_52 sar_57 ba_61 
T02D1270:73b-11	bdud rtsi lnga dang dri zhim po'i chu la sbags	bdud_0 rtsi_5 lnga_10 dang_15 'dri_20 zhim_24 po_29 chu_34 la_38 sbag_41 
T02D1270:73b-12	nas sbrang dang 'o ma la rtse mo gnyis bsnyugs	nas_0 sbrang_4 dang_11 'o_16 ma_19 la_22 rtse_25 mo_30 gnyis_33 bsnyug_39 
T02D1270:73b-13	la / sngon bzhin gyi tshogs dbul bar bya'o //	la_0 sngon_5 bzhin_11 gyi_17 tshogs_21 'bul_28 ba_33 byed_37 
T02D1270:73b-14	byang chub kyi shing gis gtsubs pa dang gtsub shing las byung ba'i me dang /	byang_0 chub_6 kyi_11 shing_15 gis_21 gtsubs_25 ba_32 dang_35 gtsub_40 shing_46 las_52 'byung_56 ba_62 me_67 dang_70 
T02D1270:73b-15	yang na bram ze'i khyim nas byung ba'i me la /	yang_0 na_5 bram_8 ze_13 khyim_18 nas_24 'byung_28 ba_34 me_39 la_42 
T02D1270:73b-16	sngon bzhin du smos pa'i cho gas sbar bar bya'o //	sngon_0 bzhin_6 du_12 smos_15 ba_20 cho_25 'gas_29 sbor_33 ba_38 byed_42 
T02D1270:73b-17	me lha ni kha dog dkar por bya'o //	me_0 lha_3 ni_7 kha_10 dog_14 dkar_18 por_23 byed_27 
T02D1270:73b-18	rgyan dang na bza' dkar ba mtshan nyid thams cad god dang mtshungs pas /	rgyan_0 dang_6 na_11 bza'_14 dkar_19 ba_24 mtshan_27 nyid_34 thams_39 cad_45 god_49 dang_53 mtshungs_58 ba_67 
T02D1270:73b-19	sngags pa ni gos dang rgyan dkar bas brgyan pa /	sngags_0 ba_7 ni_10 gos_13 dang_17 rgyan_22 dkar_28 ba_33 rgyan_37 ba_44 
T02D1270:73b-20	dbu skra gyen du brdzes pa la me tog dang ras dkar pos cod pan byas pa /	dbu_0 skra_4 gyen_9 du_14 brdzes_17 ba_24 la_27 me_30 tog_33 dang_37 ras_42 dkar_46 pos_51 cod_55 pan_59 byed_63 ba_68 
T02D1270:73b-21	byams pa dang snying rje dang ldan pa /	byams_0 ba_6 dang_9 snying_14 rje_21 dang_25 ldan_30 ba_35 
T02D1270:73b-22	padma'i gdan la bzang po'i 'dug stangs kyis kha shar phyogs su mngon par phyogs la 'dug nas /	padma_0 gdan_8 la_13 bzang_16 po_22 'dug_27 stangs_32 kyis_39 kha_44 'char_48 phyogs_53 su_60 mngon_63 ba_69 phyogs_73 la_80 'dug_83 nas_88 
T02D1270:73b-23	zhi ba'i sems kyis dkar po'i chos gcig la brtsam par bya'o //	zhi_0 ba_4 sems_9 kyis_14 dkar_19 po_24 chos_29 gcig_34 la_39 brtsam_42 ba_49 byed_53 
T02D1270:73b-24	sngags thams cad kyi mthar sv'a h'a dang che ge	sngags_0 thams_7 cad_13 kyi_17 mthar_21 sv_27 h_32 dang_36 che_41 ge_45 
T02D1270:73b-25	mo zhes bya ba sh'atnim ku ru sv'a h'a zhes	mo_0 zhes_3 byed_8 ba_12 sh_15 ku_24 ru_27 sv_30 h_35 zhes_39 
T02D1270:73b-26	pa bskul ba'i tshig dang ldan pa'i sngags kyis zhi	ba_0 skul_3 ba_9 tshig_14 dang_20 ldan_25 ba_30 sngags_35 kyis_42 zhi_47 
T02D1270:73b-27	ba'i sbyin sreg bya'o //	ba_0 sbyin_5 sreg_11 byed_16 
T02D1270:73b-28	de nas mar dang bdud rtsi la sogs pas tshim par gyur ba'i lha rnams dgyes par gyur te /	de_0 nas_3 mar_7 dang_11 bdud_16 rtsi_21 la_26 sogs_29 ba_34 tshim_38 ba_44 gyur_48 ba_53 lha_58 rnams_62 dgyes_68 ba_74 gyur_78 te_83 
T02D1270:73b-29	so so'i thugs ka nas ye shes sems dpa'i dkyil	so_0 so_3 thugs_8 ka_14 nas_17 ye_21 shes_24 sems_29 dpa_34 dkyil_40 
T02D1270:73b-30	'khor nam mkha'i khams su sku mdog dkar po rang	'khor_0 nam_6 mkha_10 khams_17 su_23 sku_26 mdog_30 dkar_35 po_40 rang_43 
T02D1270:73b-31	bzhin du spros nas lha rnams kyis rin po che'i	bzhin_0 du_6 spros_9 nas_15 lha_19 rnams_23 kyis_29 rin_34 po_38 che_41 
T02D1270:73b-32	bum pa ye shes kyi bdud rtsis gang ba thogs	bum_0 ba_4 ye_7 shes_10 kyi_15 bdud_19 rtsis_24 gang_30 ba_35 thogs_38 
T02D1270:73b-33	nas / sgrub pa po la sogs pa dad yon	nas_0 sgrub_6 ba_12 po_15 la_18 sogs_21 ba_26 dad_29 yon_33 
T02D1270:73b-34	bdag 'khor dang bcas pa la dbang bskur bar dmigs	bdag_0 'khor_5 dang_11 'cha'_16 ba_21 la_24 dbang_27 skur_33 ba_39 dmigs_43 
T02D1270:73b-35	nas / te / nang la sogs pa'i gnod pa thams cad bsal nas /	nas_0 te_6 nang_11 la_16 sogs_19 ba_24 gnod_29 ba_34 thams_37 cad_43 bsal_47 nas_52 
T02D1270:73b-36	rang gi 'dod pa'i dngos grub sngon bzhin du rdzogs par bya'o //	rang_0 gi_5 'dod_8 ba_13 dngos_18 'grub_24 sngon_29 bzhin_35 du_41 rdzogs_44 ba_51 byed_55 
T02D1270:73b-37	de nas ye shes sems dpa'i dkyil 'khor bsdus te thugs kar bstim par bya'o //	de_0 nas_3 ye_7 shes_10 sems_15 dpa_20 dkyil_26 'khor_32 sdud_38 te_44 thugs_47 kar_53 stim_57 ba_63 byed_67 
T02D1270:73b-38	de lta bu la zhugs pa thams cad bde ba dang ldan par bsam mo //	de_0 lta_3 bu_7 la_10 'jug_13 ba_19 thams_22 cad_28 bde_32 ba_36 dang_39 ldan_44 ba_49 bsam_53 mo_58 
T02D1270:74a-0	zhi ba'i @74a * //	zhi_0 ba_4 
T02D1270:74a-1	sbyin sreg gi rim pa'o /	sbyin_0 sreg_6 gi_11 rim_14 ba_18 
T02D1270:74a-3	// / de nas gzhan yang ral gri dang 'khor lo mda' dang /	de_5 nas_8 gzhan_12 yang_18 ral_23 gri_27 dang_31 'khor_36 lo_42 mda'_45 dang_50 
T02D1270:74a-4	rdo rje dang rin po che dang padma dang gter chen po sgrub pa dang /	rdo_0 rje_4 dang_8 rin_13 po_17 che_20 dang_24 padma_29 dang_35 gter_40 chen_45 po_50 sgrub_53 ba_59 dang_62 
T02D1270:74a-5	bcud kyis len pa dang /	bcud_0 kyis_5 len_10 ba_14 dang_17 
T02D1270:74a-6	khyad par gyi bcud kyis len pa dang 'khor los	khyad_0 ba_6 gyi_10 bcud_14 kyis_19 len_24 ba_28 dang_31 'khor_36 los_42 
T02D1270:74a-7	sgyur ba'i rgyal po'i yon tan thob par bya ba'i	sgyur_0 ba_6 rgyal_11 po_17 yon_22 tan_26 'thob_30 ba_35 byed_39 ba_43 
T02D1270:74a-8	phyir / bdag gam gzhan gyi don du tshes bco	phyir_0 bdag_8 gam_13 gzhan_17 gyi_23 don_27 du_31 tshes_34 'chos_40 
T02D1270:74a-9	lnga'i dus su rgyas pa'i sbyin sreg brtsam par bya'o	lnga_0 dus_7 su_11 rgya_14 ba_20 sbyin_25 sreg_31 brtsam_36 ba_43 byed_47 
T02D1270:74a-10	phyir / // de la dkyil 'khor chen po'i lho	phyir_0 de_11 la_14 dkyil_17 'khor_23 chen_29 po_34 lho_39 
T02D1270:74a-11	phyogs su kha dog ser po'i sa la rgyar khru	phyogs_0 su_7 kha_10 dog_14 ser_18 po_22 sa_27 la_30 rgyar_33 khru_39 
T02D1270:74a-12	do'i ched zabs su khru gang gi ched brko bar	do_0 ched_5 zabs_10 su_15 khru_18 gang_23 gi_28 ched_31 rko_36 ba_41 
T02D1270:74a-13	phyir / // bya'o // sor brgyad phyir gyes pa las sor brgyad yar brtsig par byas nas /	phyir_0 byed_11 sor_20 brgyad_24 phyir_31 'gyes_37 ba_42 las_45 sor_49 brgyad_53 yar_60 brtsig_64 ba_71 byed_75 nas_80 
T02D1270:74a-14	de'i dbugs kyi lte ba 'khor lo rtsibs brgyad pa'i steng du lha'i mtshan ma bkod la /	de_0 dbugs_5 kyi_11 lte_15 ba_19 'khor_22 lo_28 rtsibs_31 brgyad_38 ba_45 steng_50 du_56 lha_59 mtshan_65 ma_72 bkod_75 la_80 
T02D1270:74a-15	der rdo rje dang rin po che dang padma dang ral gri yang dgod par bya'o //	der_0 rdo_4 rje_8 dang_12 rin_17 po_21 che_24 dang_28 padma_33 dang_39 ral_44 gri_48 yang_52 'god_57 ba_62 byed_66 
T02D1270:74a-16	kha khyer la rin po che sor drug pa 'bar	kha_0 'khyer_4 la_10 rin_13 po_17 che_20 sor_24 drug_28 ba_33 'bar_36 
T02D1270:74a-17	bas kun nas bskor nas thab khung gi kha dog	ba_0 kun_4 nas_8 skor_12 nas_18 thab_22 khung_27 gi_33 kha_36 dog_40 
T02D1270:74a-18	ser po gru bzhi pa ste /	ser_0 po_4 gru_7 bzhi_11 ba_16 ste_19 
T02D1270:74a-19	yang na zur brgyad rin po che 'bar ba'i dbyibs su bya'o //	yang_0 na_5 zur_8 brgyad_12 rin_19 po_23 che_26 'bar_30 ba_35 dbyibs_40 su_47 byed_50 
T02D1270:74a-20	kha dog zer po'i sas byugs la /	kha_0 dog_4 zer_8 po_12 sas_17 'byug_21 la_27 
T02D1270:74a-21	de'i steng du bdud rtsi lnga dang dri ser pos legs par byug go //	de_0 steng_5 du_11 bdud_14 rtsi_19 lnga_24 dang_29 'dri_34 ser_38 pos_42 legs_46 ba_51 'byug_55 go_60 
T02D1270:74a-22	de'i steng du me tog ser po dri zhim po'am /	de_0 steng_5 du_11 me_14 tog_17 ser_21 po_25 'dri_28 zhim_32 po_37 
T02D1270:74a-23	sna tshogs pa'i me tog gi sil mas yongs su dgram par bya'o //	sna_0 tshogs_4 ba_11 me_16 tog_19 gi_23 sil_26 mas_30 yongs_34 su_40 'grem_43 ba_49 byed_53 
T02D1270:74a-24	ri dgas kyi lci ba spangs pa'i sngon du smos	ri_0 'gas_3 kyi_8 lci_12 ba_16 spong_19 ba_26 sngon_31 du_37 smos_40 
T02D1270:74a-25	pa'i shing 'bras bu dang bcas pa rnams las bya'o	ba_0 shing_5 'bras_11 bu_17 dang_20 'cha'_25 ba_30 rnams_33 las_39 byed_43 
T02D1270:74a-26	// yam shing ni pa la sha la sogs pa	yam_3 shing_7 ni_13 ba_16 la_19 sha_22 la_26 sogs_29 ba_34 
T02D1270:74a-27	dbus kyi cha las byung bsgoms su chag gang ba	dbus_0 kyi_5 cha_9 las_13 'byung_17 sgom_23 su_30 'chag_33 gang_38 ba_43 
T02D1270:74a-28	// / chu ru khru gang gi tshad dang ldan pa /	chu_5 ru_9 khru_12 gang_17 gi_22 tshad_25 dang_31 ldan_36 ba_41 
T02D1270:74a-29	rtse mo gru bzhi par byas pa'o //	rtse_0 mo_5 gru_8 bzhi_12 ba_17 byed_21 ba_26 
T02D1270:74a-30	lhag ma rnams ni las thams cad pa'i sbyin sreg tu shes par bya'o //	lhag_0 ma_5 rnams_8 ni_14 las_17 thams_21 cad_27 ba_31 sbyin_36 sreg_42 tu_47 shes_50 ba_55 byed_59 
T02D1270:74a-31	rgyas pa'i sbyin sreg gi rim pa'o /	rgya_0 ba_6 sbyin_11 sreg_17 gi_22 rim_25 ba_29 
T02D1270:74a-33	// / de nas gsad pa dang /	de_5 nas_8 gsad_12 ba_17 dang_20 
T02D1270:74a-34	skem pa dang /	skem_0 ba_5 dang_8 
T02D1270:74a-35	bskrad pa dang /	skrod_0 ba_7 dang_10 
T02D1270:74a-36	dbye ba dang /	'byed_0 ba_5 dang_8 
T02D1270:74a-37	rengs pa dang rmongs par bya ba dang /	rengs_0 ba_6 dang_9 rmongs_14 ba_21 byed_25 ba_29 dang_32 
T02D1270:74a-38	lus dum bur gcod pa la sogs pa'i las bsgrub par bya ba'i phyir /	lus_0 dum_4 bur_8 gcod_12 ba_17 la_20 sogs_23 ba_28 las_33 sgrub_37 ba_44 byed_48 ba_52 phyir_57 
T02D1270:74a-39	mngon spyod kyi sbyin sreg brtsam par bya'o //	mngon_0 spyod_6 kyi_12 sbyin_16 sreg_22 brtsam_27 ba_34 byed_38 
T02D1270:74a-40	de la dkyil 'khor chen po'i byang phyogs su shin	de_0 la_3 dkyil_6 'khor_12 chen_18 po_23 byang_28 phyogs_34 su_41 shin_44 
T02D1270:74a-41	tu rtsub pa myu gu mi skyed pa chu shel	tu_0 rtsub_3 ba_9 myu_12 gu_16 mi_19 skyed_22 ba_28 chu_31 shel_35 
T02D1270:74a-42	lam char sprin ltar gnag pa'i sa la sor nyi	lam_0 char_4 sprin_9 ltar_15 gnag_20 ba_25 sa_30 la_33 sor_36 nyi_40 
T02D1270:74a-43	shu'i tshad dang ldan pa /	shu_0 tshad_6 dang_12 ldan_17 ba_22 
T02D1270:74a-44	zabs su sor bcu brkos pa dbus su khro bo'i rdo rje sor brgyad pa byas la /	zabs_0 su_5 sor_8 'chu_12 rko_16 ba_22 dbus_25 su_30 khro_33 'bo_38 rdo_43 rje_47 sor_51 brgyad_55 ba_62 byed_65 la_70 
T02D1270:74b-0	de nas sor @74b gsum phyir dor ba dang /	de_0 nas_3 sor_7 gsum_16 phyir_21 'dor_27 ba_31 dang_34 
T02D1270:74b-1	sor gsum 'phang du brtsig par byas nas sor gsum pas kun nas bskor bar bya'o //	sor_0 gsum_4 'phen_9 du_16 brtsig_19 ba_26 byed_30 nas_35 sor_39 gsum_43 ba_48 kun_52 nas_56 skor_60 ba_66 byed_70 
T02D1270:74b-2	rtse mo lhor bstan no //	rtse_0 mo_5 lhor_8 ston_13 no_19 
T02D1270:74b-3	thab khung kha dog nag por byas la /	thab_0 khung_5 kha_11 dog_15 nag_19 por_23 byed_27 la_32 
T02D1270:74b-4	sa nag po dang dur khrod kyi rus phye dang /	sa_0 nag_3 po_7 dang_10 dur_15 khrod_19 kyi_25 rus_29 'byed_33 dang_38 
T02D1270:74b-5	bong bu dang rnga mo'i ril ma la sogs pa dang /	bong_0 bu_5 dang_8 rnga_13 mo_18 ril_23 ma_27 la_30 sogs_33 ba_38 dang_41 
T02D1270:74b-6	dug ji snyed pas thab khung byug par bya'o //	dug_0 ji_4 snyed_7 ba_13 thab_17 khung_22 'byug_28 ba_33 byed_37 
T02D1270:74b-7	dbus su lha'i mtshan dang ldan par bkod de kha	dbus_0 su_5 lha_8 mtshan_14 dang_21 ldan_26 ba_31 bkod_35 de_40 kha_43 
T02D1270:74b-8	khyer ral gri'am rdo rje rtse gsum pas yongs su	'khyer_0 ral_6 gri_10 rdo_17 rje_21 rtse_25 gsum_30 ba_35 yongs_39 su_45 
T02D1270:74b-9	bskor la / 'bras phub dang kha dog nag po'i	skor_0 la_6 'bras_11 'bubs_17 dang_22 kha_27 dog_31 nag_35 po_39 
T02D1270:74b-10	me tog gis thab khung la gcal du dgram par	me_0 tog_3 gis_7 thab_11 khung_16 la_22 gcal_25 du_30 'grem_33 ba_39 
T02D1270:74b-11	bskor la / bya'o // de las sngon du bstan pa'i snod du /	skor_0 la_6 byed_11 de_20 las_23 sngon_27 du_33 ston_36 ba_42 snod_47 du_52 
T02D1270:74b-12	khra dang mi dang /	khra_0 dang_5 mi_10 dang_13 
T02D1270:74b-13	ba glang dang /	ba_0 glang_3 dang_9 
T02D1270:74b-14	bong bu dang /	bong_0 bu_5 dang_8 
T02D1270:74b-15	rnga mo'i chu dang /	rnga_0 mo_5 chu_10 dang_14 
T02D1270:74b-16	khrag gis yongs su bkang ste /	khrag_0 gis_6 yongs_10 su_16 'geng_19 ste_25 
T02D1270:74b-17	phat ces sngon bzhin yongs su bzlas la /	phat_0 ces_5 sngon_9 bzhin_15 yongs_21 su_27 bzlas_30 la_36 
T02D1270:74b-18	g-yas su me'i dkyil 'khor gyi steng du gzhag par bya'o //	g-yas_0 su_6 me_9 dkyil_14 'khor_20 gyi_26 steng_30 du_36 'jog_39 ba_45 byed_49 
T02D1270:74b-19	yungs kar dang /	yungs_0 kar_6 dang_10 
T02D1270:74b-20	tsha ba'i mar dang /	tsha_0 ba_5 mar_10 dang_14 
T02D1270:74b-21	khrag dang /	khrag_0 dang_6 
T02D1270:74b-22	tshva dang /	tshva_0 dang_6 
T02D1270:74b-23	ske tshe dang /	ske_0 tshe_4 dang_9 
T02D1270:74b-24	mi'i rus phye dang /	mi_0 rus_5 'byed_9 dang_14 
T02D1270:74b-25	rkang rjes kyis dang /	rkang_0 rjes_6 kyis_11 dang_16 
T02D1270:74b-26	nim pa'i shun pa dang /	nim_0 ba_4 shun_9 ba_14 dang_17 
T02D1270:74b-27	bong bu dang /	bong_0 bu_5 dang_8 
T02D1270:74b-28	rnga mo la sogs pa'i ril ma dad skra dang de rnams gcig tu brdungs la gzugs bya'o //	rnga_0 mo_5 la_8 sogs_11 ba_16 ril_21 ma_25 dad_28 skra_32 dang_37 de_42 rnams_45 gcig_51 tu_56 rdung_59 la_67 gzugs_70 byed_76 
T02D1270:74b-29	bya rog la sogs pa'i sgro dang /	byed_0 rog_4 la_8 sogs_11 ba_16 sgro_21 dang_26 
T02D1270:74b-30	dri chen dang dri chu dang /	'dri_0 chen_4 dang_9 'dri_14 chu_18 dang_22 
T02D1270:74b-31	tsher ma dang /	tsher_0 ma_6 dang_9 
T02D1270:74b-32	gyo mo dang /	gyo_0 mo_4 dang_7 
T02D1270:74b-33	rus phye dang /	rus_0 'byed_4 dang_9 
T02D1270:74b-34	tshil chen dang /	tshil_0 chen_6 dang_11 
T02D1270:74b-35	sha chen la sogs pa dang /	sha_0 chen_4 la_9 sogs_12 ba_17 dang_20 
T02D1270:74b-36	khrag dang /	khrag_0 dang_6 
T02D1270:74b-37	dug dang /	dug_0 dang_4 
T02D1270:74b-38	ske tshe dang /	ske_0 tshe_4 dang_9 
T02D1270:74b-39	smyo byed kyi khu bas legs par byug par bya'o //	smyo_0 byed_5 kyi_10 khu_14 ba_18 legs_22 ba_27 'byug_31 ba_36 byed_40 
T02D1270:74b-40	de nas las thams cad pa'i chu la bsngags te /	de_0 nas_3 las_7 thams_11 cad_17 ba_21 chu_26 la_30 bsngags_33 te_41 
T02D1270:74b-41	bsang gtor byas nas de dag thams cad kyang bsgrub byar dmigs la /	bsang_0 'thor_6 byed_11 nas_16 de_20 'dag_23 thams_27 cad_33 kyang_37 sgrub_43 byar_50 dmigs_55 la_61 
T02D1270:74b-42	de lus kyi gnas su dug dang ske tshe la sogs pas khyab par byugs te /	de_0 lus_3 kyi_7 gnas_11 su_16 dug_19 dang_23 ske_28 tshe_32 la_37 sogs_40 ba_45 khyab_49 ba_55 'byug_59 te_65 
T02D1270:74b-43	sbyin sreg tu bya'o //	sbyin_0 sreg_6 tu_11 byed_14 
T02D1270:74b-44	mar nag chen po'i mar me g-yon phyogs su gzhag par bya'o //	mar_0 nag_4 chen_8 po_13 mar_18 me_22 g-yon_25 phyogs_31 su_38 'jog_41 ba_47 byed_51 
T02D1270:74b-45	tsha ba'i shing tsher ma can dang /	tsha_0 ba_5 shing_10 tsher_16 ma_22 can_25 dang_29 
T02D1270:74b-46	kha ba dang dri mi zhim pa dang /	kha_0 ba_4 dang_7 'dri_12 mi_16 zhim_19 ba_24 dang_27 
T02D1270:74b-47	dur khrod las byung ba'i shing dang bong bu dang	dur_0 khrod_4 las_10 'byung_14 ba_20 shing_25 dang_31 bong_36 bu_41 dang_44 
T02D1270:74b-48	rnga mo la sogs pa'i ril ma skam po bud	rnga_0 mo_5 la_8 sogs_11 ba_16 ril_21 ma_25 skam_28 po_33 'bud_36 
T02D1270:74b-49	shing du bya'o // de nas nim pa dang /	shing_0 du_6 byed_9 de_18 nas_21 nim_25 ba_29 dang_32 
T02D1270:74b-50	seng ldeng dang /	seng_0 ldeng_5 dang_11 
T02D1270:74b-51	ko bi dar dang /	ko_0 bi_3 dar_6 dang_10 
T02D1270:74b-52	bse shing dang /	bse_0 shing_4 dang_10 
T02D1270:74b-53	ma da ni shing dang /	ma_0 da_3 ni_6 shing_9 dang_15 
T02D1270:74b-54	tsha ba'i shing dang /	tsha_0 ba_5 shing_10 dang_16 
T02D1270:74b-55	tsher ma can gyi shing dang /	tsher_0 ma_6 can_9 gyi_13 shing_17 dang_23 
T02D1270:74b-56	kha ba'i shing dang /	kha_0 ba_4 shing_9 dang_15 
T02D1270:74b-57	yang na ro bsregs pa'i shing dang /	yang_0 na_5 ro_8 bsregs_11 ba_18 shing_23 dang_29 
T02D1270:74b-58	de dag tshad ma'i cha las byung ba sor bcu'i	de_0 'dag_3 tshad_7 ma_13 cha_18 las_22 'byung_26 ba_32 sor_35 'chu_39 
T02D1270:75a-0	tshad dang ldan pa rtse mo zur gsum @75a *	tshad_0 dang_6 ldan_11 ba_16 rtse_19 mo_24 zur_27 gsum_31 
T02D1270:75a-1	// par byas la /	ba_3 byed_7 la_12 
T02D1270:75a-2	dug dang ske tshe dang khrag gis legs par byugs la yam shing bya'o //	dug_0 dang_4 ske_9 tshe_13 dang_18 khrag_23 gis_29 legs_33 ba_38 'byug_42 la_48 yam_51 shing_55 byed_61 
T02D1270:75a-3	de nas dur khrod las byung ba'i me dang /	de_0 nas_3 dur_7 khrod_11 las_17 'byung_21 ba_27 me_32 dang_35 
T02D1270:75a-4	dur khrod kyi rus pa las byung ba'i me dang /	dur_0 khrod_4 kyi_10 rus_14 ba_18 las_21 'byung_25 ba_31 me_36 dang_39 
T02D1270:75a-5	ro bsregs pa'i shing las gtsub stan dang gtsub shing las byung ba'i me dang /	ro_0 bsregs_3 ba_10 shing_15 las_21 gtsub_25 stan_31 dang_36 gtsub_41 shing_47 las_53 'byung_57 ba_63 me_68 dang_71 
T02D1270:75a-6	rdo las byung ba'i me dang /	rdo_0 las_4 'byung_8 ba_14 me_19 dang_22 
T02D1270:75a-7	gtum pa'i khyim nas blangs pa'i me dang me de dag sbar bar bya'o //	'thum_0 ba_5 khyim_10 nas_16 blangs_20 ba_27 me_32 dang_35 me_40 de_43 'dag_46 sbor_50 ba_55 byed_59 
T02D1270:75a-8	de la me lha'i sku mdog nag po dbu skra	de_0 la_3 me_6 lha_9 sku_15 mdog_19 nag_24 po_28 dbu_31 skra_35 
T02D1270:75a-9	gyen du 'bar ba spyan me bdag gi phung po	gyen_0 du_5 'bar_8 ba_13 spyan_16 me_22 bdag_25 gi_30 'phung_33 po_39 
T02D1270:75a-10	'dra ba / zhal gang gdangs nas mche ba gtsigs pa rngam pa'i zhal khro gnyer dang bcas pa /	'dra_0 ba_5 zhal_10 gang_15 gdang_20 nas_27 mche_31 ba_36 gtsigs_39 ba_46 rngam_49 ba_55 zhal_60 khro_65 gnyer_70 dang_76 'cha'_81 ba_86 
T02D1270:75a-11	shin tu gtum pa /	shin_0 tu_5 'thum_8 ba_13 
T02D1270:75a-12	'jigs pa chen po'i gzugs can gsus pa che pa /	'jigs_0 ba_6 chen_9 po_14 gzugs_19 can_25 gsus_29 ba_34 che_37 ba_41 
T02D1270:75a-13	yan lag thung zhing sbom pa /	yan_0 lag_4 thung_8 zhing_14 sbom_20 ba_25 
T02D1270:75a-14	ras nag po se ral khar thogs pa /	ras_0 nag_4 po_8 se_11 ral_14 khar_18 thogs_23 ba_29 
T02D1270:75a-15	rgyan nag pos kun nas brgyan pa /	rgyan_0 nag_6 pos_10 kun_14 nas_18 rgyan_22 ba_29 
T02D1270:75a-16	'jig pa'i dus kyi me ltar 'bar ba /	'jig_0 ba_5 dus_10 kyi_14 me_18 ltar_21 'bar_26 ba_31 
T02D1270:75a-17	zhal thab khung dang mtshungs pa'o //	zhal_0 thab_5 khung_10 dang_16 mtshungs_21 ba_30 
T02D1270:75a-18	de nas sngags pa ni thugs shin tu gtum pa	de_0 nas_3 sngags_7 ba_14 ni_17 thugs_20 shin_26 tu_31 'thum_34 ba_39 
T02D1270:75a-19	dur khrod kyi ras nag pos stod g-yogs byas pa	dur_0 khrod_4 kyi_10 ras_14 nag_18 pos_22 stod_26 g-yogs_31 byed_38 ba_43 
T02D1270:75a-20	/ kha dog sngon po'i rgyan gyis brgyan pa /	kha_2 dog_6 sngon_10 po_16 rgyan_21 gyis_27 rgyan_32 ba_39 
T02D1270:75a-21	me tog sngon po'i phreng ba se ral khar thogs pa /	me_0 tog_3 sngon_7 po_13 phreng_18 ba_25 se_28 ral_31 khar_35 thogs_40 ba_46 
T02D1270:75a-22	dur khrod kyi khrag gis byugs pa'i ras kyis smad	dur_0 khrod_4 kyi_10 khrag_14 gis_20 'byug_24 ba_30 ras_35 kyis_39 smad_44 
T02D1270:75a-23	dkris byas pa spyan shin tu 'bar zhing zhal shin	dkri_0 byed_6 ba_11 spyan_14 shin_20 tu_25 'bar_28 zhing_33 zhal_39 shin_44 
T02D1270:75a-24	tu khro ba / rkang pa g-yon pas g-yas pa	tu_0 khro_3 ba_8 rkang_13 ba_19 g-yon_22 ba_28 g-yas_32 ba_38 
T02D1270:75a-25	mnan pa'i tshul gyis 'dug nas so 'cha' zhing bsgrub	gnon_0 ba_5 tshul_10 gyis_16 'dug_21 nas_26 so_30 'cha'_33 zhing_39 sgrub_45 
T02D1270:75a-26	bya'i gzugs kyi steng du gtum pa'i sems kyis 'dug	byed_0 gzugs_6 kyi_12 steng_16 du_22 'thum_25 ba_30 sems_35 kyis_40 'dug_45 
T02D1270:75a-27	tu khro ba / par bya'o // yang na dur	tu_0 khro_3 ba_8 ba_13 byed_17 yang_26 na_31 dur_34 
T02D1270:75a-28	khrod kyi pha gu nag po'i steng du bsgrub bya	khrod_0 kyi_6 pha_10 gu_14 nag_17 po_21 steng_26 du_32 sgrub_35 byed_42 
T02D1270:75a-29	mnan pa'i snying gar sngon gyi tshul gyis 'dug par	gnon_0 ba_5 snying_10 gar_17 sngon_21 gyi_27 tshul_31 gyis_37 'dug_42 ba_47 
T02D1270:75a-30	tu khro ba / par bya'o // bya'o // bsgrub bya ni mdog nyams pa /	tu_0 khro_3 ba_8 ba_13 byed_17 byed_26 sgrub_35 byed_42 ni_46 mdog_49 nyams_54 ba_60 
