T02D2684:232b-13	nor bu yungs kar d'ur ba dang //	nor_0 bu_4 yungs_7 kar_13 d_17 ba_22 dang_25 
T02D2684:232b-14	zhes bya ba la sogs pa ste nor bu zhes	zhes_0 byed_5 ba_9 la_12 sogs_15 ba_20 ste_23 nor_27 bu_31 zhes_34 
T02D2684:232b-15	bya ba ni mu tig la sogs pa rin po	byed_0 ba_4 ni_7 mu_10 tig_13 la_17 sogs_20 ba_25 rin_28 po_32 
T02D2684:232b-16	che lnga mtshon pa'o //	che_0 lnga_4 mtshon_9 ba_16 
T02D2684:232b-17	yungs kar zhes bya ba ni 'bru lnga'i brda'o //	yungs_0 kar_6 zhes_10 byed_15 ba_19 ni_22 'bru_25 lnga_30 brda_37 
T02D2684:232b-18	d'ur ba zhes bya ba ni snying po lnga'o /	d_0 ba_5 zhes_8 byed_13 ba_17 ni_20 snying_23 po_30 lnga_33 
T02D2684:232b-19	rma med pa ni nyams pa ste tsandan gang la	rma_0 med_4 ba_8 ni_11 nyams_14 ba_20 ste_23 tsandan_27 gang_35 la_40 
T02D2684:232b-20	ma nyams ba'i dri yod pa de ni dkon zhing	ma_0 nyams_3 ba_9 'dri_14 yod_18 ba_22 de_25 ni_28 dkon(d)_31 zhing_36 
T02D2684:232b-21	dri'i mchog ste spos lnga'i mtshon pa'o //	'dri_0 mchog_6 ste_12 spros_16 lnga_21 mtshon_28 ba_35 
T02D2684:232b-22	bcas zhes bya ba ni dri de ma rnyed na	'cha'_0 zhes_5 byed_10 ba_14 ni_17 'dri_20 de_24 ma_27 rnyed_30 na_36 
T02D2684:232b-23	dri gzhan yang rung zhes bya ba'i tha tshig go	'dri_0 gzhan_4 yang_10 rung_15 zhes_20 byed_25 ba_29 tha_34 tshig_38 go_44 
T02D2684:232b-24	// rin chen zhes bya ba ni sman lnga'i brda'o //	rin_3 chen_7 zhes_12 byed_17 ba_21 ni_24 sman_27 lnga_32 brda_39 
T02D2684:232b-25	sman la sogs pa lnga po de dag ci'i don du bum par gzhug ce na /	sman_0 la_5 sogs_8 ba_13 lnga_16 po_21 de_24 'dag_27 ci_31 don_36 du_40 bum_43 ba_47 'jug_51 ce_57 na_60 
T02D2684:232b-26	zag bcas kyi phung po lnga dang /	zag_0 'cha'_4 kyi_9 'phung_13 po_19 lnga_22 dang_27 
T02D2684:232b-27	sa la sogs pa'i khams lnga dang rol sogs pa'i yul lnga dang /	sa_0 la_3 sogs_6 ba_11 khams_16 lnga_22 dang_27 rol_32 sogs_36 ba_41 yul_46 lnga_50 dang_55 
T02D2684:232b-28	'dod chags la sogs pa'i nyon mongs pa lnga rnams	'dod_0 chags_5 la_11 sogs_14 ba_19 nyon_24 mongs_29 ba_35 lnga_38 rnams_43 
T02D2684:232b-29	yongs su dag nas zag pa med pa'i phung po	yongs_0 su_6 'dag_9 nas_13 zag_17 ba_21 med_24 ba_28 'phung_33 po_39 
T02D2684:232b-30	lnga dang ye shes lnga dang de bzhin gshegs pa'i	lnga_0 dang_5 ye_10 shes_13 lnga_18 dang_23 de_28 bzhin_31 gshegs_37 ba_44 
T02D2684:232b-31	sku dang / gsung dang /	sku_0 dang_4 gsung_11 dang_17 
T02D2684:232b-32	thugs dang /	thugs_0 dang_6 
T02D2684:232b-33	phrin las dang /	phrin_0 las_6 dang_10 
T02D2684:232b-34	yon tan de dag gi don rtogs shing thob par bya ba'i phyir ro //	yon_0 tan_4 de_8 'dag_11 gi_15 don_18 rtogs_22 shing_28 'thob_34 ba_39 byed_43 ba_47 phyir_52 ro_58 
T02D2684:232b-35	rin po che lnga la sogs pa dbul pos mi	rin_0 po_4 che_7 lnga_11 la_16 sogs_19 ba_24 'bul_27 pos_32 mi_36 
T02D2684:232b-36	'byor ro snyam pa la sku gsung thugs kyi mtshon	'byor_0 ro_6 snyam_9 ba_15 la_18 sku_21 gsung_25 thugs_31 kyi_37 mtshon_41 
T02D2684:232b-37	byed du rdzas gsum gsungs te /	byed_0 du_5 rdzas_8 gsum_14 gsungs_19 te_26 
T02D2684:232b-38	shel dang rdo rje me tog gam //	shel_0 dang_5 rdo_10 rje_14 me_18 tog_21 gam_25 
T02D2684:232b-39	zhes bya ba ni gzhan mi rnyed na zhes bya ba'i don to //	zhes_0 byed_5 ba_9 ni_12 gzhan_15 mi_21 rnyed_24 na_30 zhes_33 byed_38 ba_42 don_47 to_51 
T02D2684:232b-40	de ni lus dang ngag dang yid yongs su dag	de_0 ni_3 lus_6 dang_10 ngag_15 dang_20 yid_25 yongs_29 su_35 'dag_38 
T02D2684:232b-41	pa'i rang bzhin sku gsum thob pa'o zhes mtshon pa	ba_0 rang_5 bzhin_10 sku_16 gsum_20 'thob_25 ba_30 zhes_35 mtshon_40 ba_47 
T02D2684:232b-42	ste sgo gsum dag pa las sku gsum 'byung ba	ste_0 sgo_4 gsum_8 'dag_13 ba_17 las_20 sku_24 gsum_28 'byung_33 ba_40 
T02D2684:232b-43	yang sems dag cing dri ma med pa shel lta	yang_0 sems_5 'dag_10 cing_14 'dri_19 ma_23 med_26 ba_30 shel_33 lta_38 
T02D2684:232b-44	bu'i chos kyi sku dang /	bu_0 chos_5 kyi_10 sku_14 dang_18 
T02D2684:232b-45	rdo rje lta bu rgyan thams cad kyis brgyan pa longs spyod rdzogs pa'i sku dang /	rdo_0 rje_4 lta_8 bu_12 rgyan_15 thams_21 cad_27 kyis_31 rgyan_36 ba_43 longs_46 spyod_52 rdzogs_58 ba_65 sku_70 dang_74 
T02D2684:232b-46	'gro ba thams cad la yid du 'ong zhing mdzes	'gro_0 ba_5 thams_8 cad_14 la_18 yid_21 du_25 'ong_28 zhing_33 mdzes_39 
T02D2684:232b-47	pa'i me tog lta bu sprul pa'i sku ste de	ba_0 me_5 tog_8 lta_12 bu_16 sprul_19 ba_25 sku_30 ste_34 de_38 
T02D2684:232b-48	dag mtshon pa'i phyir ro //	'dag_0 mtshon_4 ba_11 phyir_16 ro_22 
T02D2684:233a-0	gal te @233a * //	gal_0 te_4 
T02D2684:233a-1	mchog tu dbul bas gsum mi 'byor ro zhe na de'i phyir /	mchog_0 tu_6 'bul_9 ba_14 gsum_18 mi_23 'byor_26 ro_32 zhe_35 na_39 de_42 phyir_47 
T02D2684:233a-2	chu yi gser ram yang na ni //	chu_0 yi_4 gser_7 ram_12 yang_16 na_21 ni_24 
T02D2684:233a-3	zhe bya ba gsungs te /	zhe_0 byed_4 ba_8 gsungs_11 te_18 
T02D2684:233a-4	de tsam la brten zhes pa'o //	de_0 tsam_3 la_8 rten_11 zhes_17 ba_22 
T02D2684:233a-5	de la gser ni bsregs pa la sogs pas rang	de_0 la_3 gser_6 ni_11 bsregs_14 ba_21 la_24 sogs_27 ba_32 rang_36 
T02D2684:233a-6	bzhin ser po bsgyur bar mi nus pa bzhin du	bzhin_0 ser_6 po_10 sgyur_13 ba_20 mi_24 nus_27 ba_31 bzhin_34 du_40 
T02D2684:233a-7	byang chub kyi snying po yang de de ltar mtshon	byang_0 chub_6 kyi_11 snying_15 po_22 yang_25 de_30 de_33 ltar_36 mtshon_41 
T02D2684:233a-8	ba'i brda'o // ram yang na ni zhes bya ba	ba_0 brda_5 ram_15 yang_19 na_24 ni_27 zhes_30 byed_35 ba_39 
T02D2684:233a-9	de dag gang yang mi rnyed pas bum pa rin	de_0 'dag_3 gang_7 yang_12 mi_17 rnyed_20 ba_26 bum_30 ba_34 rin_37 
T02D2684:233a-10	po che las grub tsam la brten zhes bya ba'i	po_0 che_3 las_7 'grub_11 tsam_16 la_21 rten_24 zhes_30 byed_35 ba_39 
T02D2684:233a-11	ba'i brda'o // don to // gang zhe na /	ba_0 brda_5 don_15 to_19 gang_25 zhe_30 na_34 
T02D2684:233a-12	dngul gyi bum pa dag kyang rung //	dngul_0 gyi_6 bum_10 ba_14 'dag_17 kyang_21 rung_27 
T02D2684:233a-13	zhes gsungs so //	zhes_0 gsungs_5 so_12 
T02D2684:233a-14	kyang zhes bya ba ni sa la sogs pa'i snod mtshon pa'o //	kyang_0 zhes_6 byed_11 ba_15 ni_18 sa_21 la_24 sogs_27 ba_32 snod_37 mtshon_42 ba_49 
T02D2684:233a-15	'dir rtogs par bya ba ni 'di yin te dngul	'dir_0 rtogs_5 ba_11 byed_15 ba_19 ni_22 'di_25 yin_29 te_33 dngul_36 
T02D2684:233a-16	gyi bum pa ni dkar zhing dri ma med pa	gyi_0 bum_4 ba_8 ni_11 dkar_14 zhing_19 'dri_25 ma_29 med_32 ba_36 
T02D2684:233a-17	dang rin po che yin zhing mnyen pa ltar byang	dang_0 rin_5 po_9 che_12 yin_16 zhing_20 mnyen_26 ba_32 ltar_35 byang_40 
T02D2684:233a-18	chub kyi sems 'gro ba kun la khyab pa'i don	chub_0 kyi_5 sems_9 'gro_14 ba_19 kun_22 la_26 khyab_29 ba_35 don_40 
T02D2684:233a-19	gyi snying po de kho na nyid kyang rnal 'byor	gyi_0 snying_4 po_11 de_14 kho_17 na_21 nyid_24 kyang_29 rnal_35 'byor_40 
T02D2684:233a-20	ba gang gis mngon du byas nas ma rig pa'i	ba_0 gang_3 gis_8 mngon_12 du_18 byed_21 nas_26 ma_30 rig_33 ba_37 
T02D2684:233a-21	mun pa zhi ba dang nyon mongs pa'i dri ma	mun_0 ba_4 zhi_7 ba_11 dang_14 nyon_19 mongs_24 ba_30 'dri_35 ma_39 
T02D2684:233a-22	dag ba dang rin po che bzhin du 'dod pa	'dag_0 ba_4 dang_7 rin_12 po_16 che_19 bzhin_23 du_29 'dod_32 ba_37 
T02D2684:233a-23	thams cad 'byung ba dang lam gyi dus na lus	thams_0 cad_6 'byung_10 ba_17 dang_20 lam_25 gyi_29 dus_33 na_37 lus_40 
T02D2684:233a-24	dang sems mnyen zhing las su rung ba ste /	dang_0 sems_5 mnyen_10 zhing_16 las_22 su_26 rung_29 ba_34 ste_37 
T02D2684:233a-25	de ltar dngul dang byang chub kyi sems chos mtshungs pa'o //	de_0 ltar_3 dngul_8 dang_14 byang_19 chub_25 kyi_30 sems_34 chos_39 mtshungs_44 ba_53 
T02D2684:233a-26	zhes gsungs par rig par bya'o //	zhes_0 gsungs_5 ba_12 rig_16 ba_20 byed_24 
T02D2684:233a-27	gtsang ma'i gos kyis zhes bya ba ji ltar gos	gtsang_0 ma_7 gos_12 kyis_16 zhes_21 byed_26 ba_30 ji_33 ltar_36 gos_41 
T02D2684:233a-28	kyis lhags pa dang ngo tshal sogs pa las skyob	kyis_0 lhags_5 ba_11 dang_14 ngo_19 tshal_23 sogs_29 ba_34 las_37 skyob_41 
T02D2684:233a-29	pa bzhin du / rnal 'byor pa'i dam tshig dang	ba_0 bzhin_3 du_9 rnal_14 'byor_19 ba_25 dam_30 tshig_34 dang_40 
T02D2684:233a-30	sdom pa yang 'khor ba dang ngan song las skyob	sdom_0 ba_5 yang_8 'khor_13 ba_19 dang_22 ngan_27 'gro_32 las_37 skyob_41 
T02D2684:233a-31	pa'o zhes bya ba'i tha tshig go //	ba_0 zhes_5 byed_10 ba_14 tha_19 tshig_23 go_29 
T02D2684:233a-32	gtsang ma'i zhes bya ba ni dam tshig la sogs	gtsang_0 ma_7 zhes_12 byed_17 ba_21 ni_24 dam_27 tshig_31 la_37 sogs_40 
T02D2684:233a-33	ba'i skyon med de ma nyams pa'o zhes rig par	ba_0 skyon_5 med_11 de_15 ma_18 nyams_21 ba_27 zhes_32 rig_37 ba_41 
T02D2684:233a-34	bya'o // bzlas pa'i dbang du mdzad de thun re	byed_0 bzlas_9 ba_15 dbang_20 du_26 mdzad_29 de_35 thun_38 re_43 
T02D2684:233a-35	re la gzungs ring po nyi shu rtsa gcig gam	re_0 la_3 gzungs_6 ring_13 po_18 nyi_21 shu_25 rtsa_29 gcig_34 gam_39 
T02D2684:233a-36	brgya rtsa brgyad do //	brgya_0 rtsa_6 brgyad_11 do_18 
T02D2684:233a-37	yang snying bzlas par 'dod na brgya rtsa brgyad yan chad do zhes bya ba'i don to //	yang_0 snying_5 bzlas_12 ba_18 'dod_22 na_27 brgya_30 rtsa_36 brgyad_41 yan_48 'chad_52 do_57 zhes_60 byed_65 ba_69 don_74 to_78 
T02D2684:233a-38	rgyal po ni sems te bag chags kun gyi gzhi	rgyal_0 po_6 ni_9 sems_12 te_17 bag_20 chags_24 kun_30 gyi_34 gzhi_38 
T02D2684:233a-39	yin la brtan pas rgyal po dang chos mtshungs so	yin_0 la_4 brtan_7 ba_13 rgyal_17 po_23 dang_26 chos_31 mtshungs_36 so_45 
T02D2684:233a-40	// de khrus byas pas sgrib pa thams cad dang	de_3 'khru_6 byed_12 ba_17 sgrib_21 ba_27 thams_30 cad_36 dang_40 
T02D2684:233a-41	bral nas ma bcos pa gnyug ma'i ngang la gnas	'bral_0 nas_5 ma_9 'chos_12 ba_17 gnyug_20 ma_26 ngang_31 la_37 gnas_40 
T02D2684:233a-42	par 'gyur ro zhes dgongs pa'o //	ba_0 'gyur_4 ro_10 zhes_13 dgongs_18 ba_25 
T02D2684:233a-43	blon po lta bu nyon mongs pa yid dang 'bangs	blon_0 po_5 lta_8 bu_12 nyon_15 mongs_20 ba_26 yid_29 dang_33 'bang_38 
T02D2684:233a-44	lta bu'i tshogs drug kyang rgyal po ni zhi bas	lta_0 bu_4 tshogs_9 drug_16 kyang_21 rgyal_27 po_33 ni_36 zhi_39 ba_43 
T02D2684:233a-45	zhi bar 'gyur ro //	zhi_0 ba_4 'gyur_8 ro_14 
T02D2684:233a-46	de lta bas na gang zhig 'khor ba'i sdug bsngal	de_0 lta_3 ba_7 na_11 gang_14 'jig_19 'khor_24 ba_30 sdug_35 sngal_40 
T02D2684:233a-47	las thar par 'dod pas sems kyi rgyal po rtag	las_0 thar_4 ba_9 'dod_13 ba_18 sems_22 kyi_27 rgyal_31 po_37 rtag_40 
T02D2684:233a-48	tu khrus kyis shig ces gsungs so //	tu_0 'khru_3 kyis_9 shig_14 ces_19 gsungs_23 so_30 
T02D2684:233a-49	rdo rje spun dang dam tshig 'di la mos //	rdo_0 rje_4 spun_8 dang_13 dam_18 tshig_22 'di_28 la_32 mos_35 
T02D2684:233b-0	de yi ngor byas @233b bla ma dam pa'i gsung //	de_0 yi_3 ngor_6 byed_11 bla_22 ma_26 dam_29 ba_33 gsung_38 
T02D2684:233b-1	shes rab mthu yis bdag gis rnam par bkod //	shes_0 rab_5 mthu_9 yis_14 bdag_18 gis_23 rnam_27 ba_32 bkod_36 
T02D2684:233b-2	dge ba thob de byang chub mchog tu bsngo //	dge_0 ba_4 'thob_7 de_12 byang_15 chub_21 mchog_26 tu_32 sngo_35 
T02D2684:233b-3	nyes par gyur na rnam 'joms nying la bshags //	nyes_0 ba_5 gyur_9 na_14 rnam_17 'joms_22 nying_28 la_34 'chags_37 
T02D2684:233b-4	rdo rje rnam 'joms kyi 'grel ba jo bo smri tis mdzad pa rdzogs so /	rdo_0 rje_4 rnam_8 'joms_13 kyi_19 'grel_23 ba_29 jo_32 'bo_35 smri_38 tis_43 mdzad_47 ba_53 rdzogs_56 so_63 
T02D2684:233b-6	// / pandi ta chen bo de nyid kyis bsgyur /	pandi_5 ta_11 chen_14 'bo_19 de_22 nyid_25 kyis_30 sgyur_35 
T02D2684:233b-7	phyi dang nang dang de kho na nyid kyi khrus	phyi_0 dang_5 nang_10 dang_15 de_20 kho_23 na_27 nyid_30 kyi_35 'khru_39 
T02D2684:233b-8	gsum ni theg pa gsum dang ji bzhin du sbyar	gsum_0 ni_5 theg_8 ba_13 gsum_16 dang_21 ji_26 bzhin_29 du_35 sbyor_38 
