T02D1897:259b-0	@259b # // rgya gar skad da /	rgya_11 gar_16 skad_20 da_25 
T02D1897:259b-1	snga sa na sarba ka s'a dha na n'a ma /	snga_0 sa_5 na_8 sarba_11 ka_17 s_20 dha_24 na_28 n_31 ma_35 
T02D1897:259b-2	bod skad du /	'bod_0 skad_4 du_9 
T02D1897:259b-3	bstan pa'i nor thams cad pa zhes bya ba'i sgrub pa'i thabs /	ston_0 ba_6 nor_11 thams_15 cad_21 ba_25 zhes_28 byed_33 ba_37 sgrub_42 ba_48 thabs_53 
T02D1897:259b-4	dpal 'jam pa'i rdo rje la phyag 'tshal lo //	dpal_0 'jam_5 ba_10 rdo_15 rje_19 la_23 phyag_26 'tshal_32 lo_39 
T02D1897:259b-5	sangs rgyas ba stan pa bdud rtsi yi //	sangs_0 rgya_6 ba_12 stan_15 ba_20 bdud_23 rtsi_28 yi_33 
T02D1897:260a-0	rgya mtshog ting mtha' @260a * //	rgya_0 mtshog_5 ting_12 mtha'_17 
T02D1897:260a-1	med pa la //	med_0 ba_4 la_7 
T02D1897:260a-2	nor ldan rnams ni gzhug pa'i phyir //	nor_0 ldan_4 rnams_9 ni_15 'jug_18 ba_24 phyir_29 
T02D1897:260a-3	go rims bzhin du brjod par bya //	go_0 rims_3 bzhin_8 du_14 rjod_17 ba_23 byed_27 
T02D1897:260a-4	goo ta ma'i bstan la dad //	goo_0 ta_4 ma_7 ston_12 la_18 dad_21 
T02D1897:260a-5	gal te rigs kyi bu 'ongs na //	gal_0 te_4 rigs_7 kyi_12 bu_16 'ongs_19 na_25 
T02D1897:260a-6	dang por gsum la skyabs 'gro sbyin //	dang_0 por_5 gsum_9 la_14 skyob_17 'gro_24 sbyin_29 
T02D1897:260a-7	de yi rjes la byang chub sems /	de_0 yi_3 rjes_6 la_11 byang_14 chub_20 sems_25 
T02D1897:260a-8	de la 'di ni skyabs su 'gro ba sngon du	de_0 la_3 'di_6 ni_10 skyob_13 su_20 'gro_23 ba_28 sngon_31 du_37 
T02D1897:260a-9	song ba'i byang chub tu sems bskyed pa'i cho ga'o	'gro_0 ba_5 byang_10 chub_16 tu_21 sems_24 skyed_29 ba_36 cho_41 ga_45 
T02D1897:260a-10	// dus bzang po la dad pa dang ldan pa'i	dus_3 bzang_7 po_13 la_16 dad_19 ba_23 dang_26 ldan_31 ba_36 
T02D1897:260a-11	rigs kyi bus gtsang ba dang gtsang ba'i gos kyis	rigs_0 kyi_5 'bud_9 gtsang_13 ba_20 dang_23 gtsang_28 ba_35 gos_40 kyis_44 
T02D1897:260a-12	yid du 'ong ba'i sa phyogs su de bzhin gshegs	yid_0 du_4 'ong_7 ba_12 sa_17 phyogs_20 su_27 de_30 bzhin_33 gshegs_39 
T02D1897:260a-13	pa'i sku gzugs rab tu mchod nas de'i mdun du	ba_0 sku_5 gzugs_9 rab_15 tu_19 mchod_22 nas_28 de_32 mdun_37 du_42 
T02D1897:260a-14	dkon mchog gsum dang bla ma la dkyil 'khor rnams	dkon(d)_0 mchog_5 gsum_11 dang_16 bla_21 ma_25 la_28 dkyil_31 'khor_37 rnams_43 
T02D1897:260a-15	// byas te / ji ltar srid pa'i me tog	byed_3 te_8 ji_13 ltar_16 srid_21 ba_26 me_31 tog_34 
T02D1897:260a-16	la sogs pa'i rab tu sbyin pa sngon du song	la_0 sogs_3 ba_8 rab_13 tu_17 sbyin_20 ba_26 sngon_29 du_35 'gro_38 
T02D1897:260a-17	bas dkon mchog gsum rnams la phyag byas te /	ba_0 dkon(d)_4 mchog_9 gsum_15 rnams_20 la_26 phyag_29 byed_35 te_40 
T02D1897:260a-18	ji ltar de ltar nus pas rab tu mchod nas	ji_0 ltar_3 de_8 ltar_11 nus_16 ba_20 rab_24 tu_28 mchod_31 nas_37 
T02D1897:260a-19	bla ma mkhas pa snying rje can la yon phul	bla_0 ma_4 mkhas_7 ba_13 snying_16 rje_23 can_27 la_31 yon_34 'bul_38 
T02D1897:260a-20	nas me tog snyim pa sngon du 'gro bas zhabs	nas_0 me_4 tog_7 snyim_11 ba_17 sngon_20 du_26 'gro_29 ba_34 zhabs_38 
T02D1897:260a-21	gnyis la gtugs te /	gnyis_0 la_6 gtugs_9 te_15 
T02D1897:260a-22	pus mo lha nga sa la btsugs pa'am tsog tsog	pus_0 mo_4 lha_7 nga_11 sa_15 la_18 btsugs_21 ba_28 tsog_34 tsog_39 
T02D1897:260a-23	pos thal mo sbyar nas gnas te lan gsum du	pos_0 thal_4 mo_9 sbyor_12 nas_18 gnas_22 te_27 lan_30 gsum_34 du_39 
T02D1897:260a-24	gsol ba gdab par bya'o //	gsol_0 ba_5 gdab_8 ba_13 byed_17 
T02D1897:260a-25	dge ba'i bshes gnyen gyis gsum la skyabs su 'gro ba dang /	dge_0 ba_4 bshes_9 gnyen_15 gyis_21 gsum_26 la_31 skyob_34 su_41 'gro_44 ba_49 dang_52 
T02D1897:260a-26	byang chub kyi sems kyang bdag la gsol zhes so //	byang_0 chub_6 kyi_11 sems_15 kyang_20 bdag_26 la_31 gsol_34 zhes_39 so_44 
T02D1897:260a-27	de nas bla mas lhag pa'i bsam pas rab tu	de_0 nas_3 bla_7 mas_11 lhag_15 ba_20 bsam_25 ba_30 rab_34 tu_38 
T02D1897:260a-28	zhugs pa'i slob ma la bltas te ci nus pas	'jug_0 ba_6 slob_11 ma_16 la_19 lta_22 te_28 ci_31 nus_34 ba_38 
T02D1897:260a-29	sbyin par bya'o zhes so //	sbyin_0 ba_6 byed_10 zhes_16 so_21 
T02D1897:260a-30	khas blangs pa sngon du song bas 'di ltar sbyin par bya'o //	khas_0 blangs_5 ba_12 sngon_15 du_21 'gro_24 ba_29 'di_33 ltar_37 sbyin_42 ba_48 byed_52 
T02D1897:260a-31	tshe dang ldan pa khyod kyis 'di skad smros shig	tshe_0 dang_5 ldan_10 ba_15 khyod_18 kyis_24 'di_29 skad_33 smros_38 shig_44 
T02D1897:260a-32	/ phyogs bcu'i 'jig rten gyi khams na bzhugs pa'i	phyogs_2 'chu_9 'jig_15 rten_20 gyi_25 khams_29 na_35 bzhugs_38 ba_45 
T02D1897:260a-33	sangs rgyas bcom ldan 'das rnams dang //	sangs_0 rgya_6 'joms_12 ldan_17 'da'_22 rnams_27 dang_33 
T02D1897:260a-34	byang chub sems dpa' sems dpa' chen po rnams dang /	byang_0 chub_6 sems_11 dpa'_16 sems_21 dpa'_26 chen_31 po_36 rnams_39 dang_45 
T02D1897:260a-35	slob dpon bdag la dgongs su gsol /	slob_0 dpon_5 bdag_10 la_15 dgongs_18 su_25 gsol_28 
T02D1897:260a-36	bdag ming 'di zhes bgyi bas gang cung zad lus	bdag_0 ming_5 'di_10 zhes_14 bgyid_19 ba_24 gang_28 cung_33 zad_38 lus_42 
T02D1897:260a-37	dang ngag dang yid rnams kyis sangs rgyas dang byang	dang_0 ngag_5 dang_10 yid_15 rnams_19 kyis_25 sangs_30 rgya_36 dang_42 byang_47 
T02D1897:260a-38	chub sems dpa' pha ma gnyis dang /	chub_0 sems_5 dpa'_10 pha_15 ma_19 gnyis_22 dang_28 
T02D1897:260a-39	de las gzhan pa'i sems can gzhan dag la yang	de_0 las_3 gzhan_7 ba_13 sems_18 can_23 gzhan_27 'dag_33 la_37 yang_40 
T02D1897:260a-40	brten nas skye ba 'di dang skye ba gzhan dag	rten_0 nas_6 skye_10 ba_15 'di_18 dang_22 skye_27 ba_32 gzhan_35 'dag_41 
T02D1897:260a-41	gam srid pa bar ma rnams su bdag gis sdig	gam_0 srid_4 ba_9 ba_12 ma_16 rnams_19 su_25 bdag_28 gis_33 sdig_37 
T02D1897:260a-42	pa'i las bgyis pa dang /	ba_0 las_5 bgyid_9 ba_15 dang_18 
T02D1897:260a-43	bgyid du stsal ba dang /	bgyid_0 du_6 stsal_9 ba_15 dang_18 
T02D1897:260a-44	rjes su yi rang ba yang rung /	rjes_0 su_5 yi_8 rang_11 ba_16 yang_19 rung_24 
T02D1897:260b-0	de dag thams cad gcig tu @260b bsdus shing mnyam	de_0 'dag_3 thams_7 cad_13 gcig_17 tu_22 sdud_31 shing_37 mnyam_43 
T02D1897:260b-1	par bzlums te sngom nas sangs rgyas dang byang chub	ba_0 bzlums_4 te_11 sngom_14 nas_20 sangs_24 rgya_30 dang_36 byang_41 chub_47 
T02D1897:260b-2	sems dpa' dang slob dpon gyi mdun du mchog tu	sems_0 dpa'_5 dang_10 slob_15 dpon_20 gyi_25 mdun_29 du_34 mchog_37 tu_43 
T02D1897:260b-3	rab tu bshags par bgyi'o //	rab_0 tu_4 'chags_7 ba_14 bgyid_18 
T02D1897:260b-4	shes bzhin dran pa na rab tu mi 'chab bo //	shes_0 bzhin_5 dran_11 ba_16 na_19 rab_22 tu_26 mi_29 'chab_32 'bo_38 
T02D1897:260b-5	'di ltar lan gsum du'o //	'di_0 ltar_4 lan_9 gsum_13 du_18 
T02D1897:260b-6	bdag ming 'di zhes bgyi bas 'di ltar sdig pa	bdag_0 ming_5 'di_10 zhes_14 bgyid_19 ba_24 'di_28 ltar_32 sdig_37 ba_42 
T02D1897:260b-7	bshags nas nyi ma 'di nas bzung ste snying po	'chags_0 nas_7 nyi_11 ma_15 'di_18 nas_22 bzung_26 ste_32 snying_36 po_43 
T02D1897:260b-8	byang chub la mchis kyi bar du sangs rgyas bcom	byang_0 chub_6 la_11 mchis_14 kyi_20 ba_24 du_28 sangs_31 rgya_37 'joms_43 
T02D1897:260b-9	ldan 'das thugs rje chen po can thams cad mkhyen	ldan_0 'da'_5 thugs_10 rje_16 chen_20 po_25 can_28 thams_32 cad_38 mkhyen_42 
T02D1897:260b-10	pa thams cad gzigs pa 'jigs pa mi bzad pa	ba_0 thams_3 cad_9 gzigs_13 ba_19 'jigs_22 ba_28 mi_31 bzad_34 ba_39 
T02D1897:260b-11	thams cad las 'das pa /	thams_0 cad_6 las_10 'da'_14 ba_19 
T02D1897:260b-12	skyes bu chen po mi phyed pa'i sku /	skye_0 bu_6 chen_9 po_14 mi_17 phyed_20 ba_26 sku_31 
T02D1897:260b-13	bla na med pa'i sku chos kyi sku rkang gnyis rnams kyi mchog sangs rgyas la skyabs su mchi'o //	bla_0 na_4 med_7 ba_11 sku_16 chos_20 kyi_25 sku_29 rkang_33 gnyis_39 rnams_45 kyi_51 mchog_55 sangs_61 rgya_67 la_73 skyob_76 su_83 mchi_86 
T02D1897:260b-14	bdag ming 'di zhes bgyi bas 'di ltar sdig pa bshags nas nyi ma 'di nas bzung ste /	bdag_0 ming_5 'di_10 zhes_14 bgyid_19 ba_24 'di_28 ltar_32 sdig_37 ba_42 'chags_45 nas_52 nyi_56 ma_60 'di_63 nas_67 bzung_71 ste_77 
T02D1897:260b-15	byang chub snying po la mchis kyi bar du zhi	byang_0 chub_6 snying_11 po_18 la_21 mchis_24 kyi_30 ba_34 du_38 zhi_41 
T02D1897:260b-16	ba 'dod chags dang bral ba'i mchog chos la skyabs	ba_0 'dod_3 chags_8 dang_14 'bral_19 ba_24 mchog_29 chos_35 la_40 skyob_43 
T02D1897:260b-17	su mchi'o // bdag ming 'di zhes bgyi bas 'di	su_0 mchi_3 bdag_13 ming_18 'di_23 zhes_27 bgyid_32 ba_37 'di_41 
T02D1897:260b-18	ltar sdig pa bshags nas nyi ma 'di nas bzung	ltar_0 sdig_5 ba_10 'chags_13 nas_20 nyi_24 ma_28 'di_31 nas_35 bzung_39 
T02D1897:260b-19	ste snying po byang chub la mchis kyi bar du	ste_0 snying_4 po_11 byang_14 chub_20 la_25 mchis_28 kyi_34 ba_38 du_42 
T02D1897:260b-20	tshogs rnams kyi mchog phyir mi ldog pa'i byang chub	tshogs_0 rnams_7 kyi_13 mchog_17 phyir_23 mi_29 ldog_32 ba_37 byang_42 chub_48 
T02D1897:260b-21	sems dpa'i dge 'dun la skyabs su mchi'o //	sems_0 dpa_5 dge_11 'dun_15 la_20 skyob_23 su_30 mchi_33 
T02D1897:260b-22	bdag ming 'di zhes bgyi ba 'di ltar sdig pa	bdag_0 ming_5 'di_10 zhes_14 bgyid_19 ba_24 'di_27 ltar_31 sdig_36 ba_41 
T02D1897:260b-23	bshags pa dang gsum la skyabs su mchis nas sems	'chags_0 ba_7 dang_10 gsum_15 la_20 skyob_23 su_30 mchis_33 nas_39 sems_43 
T02D1897:260b-24	can gyi khams mtha' med pa rnams bsgral pa'i ched	can_0 gyi_4 khams_8 mtha'_14 med_20 ba_24 rnams_27 bsgral_33 ba_40 ched_45 
T02D1897:260b-25	dang / dbyung ba'i phyir dang 'khor ba'i sdug bsngal las yongs su bskyab pa'i don dang /	dang_0 'byin_7 ba_14 phyir_19 dang_25 'khor_30 ba_36 sdug_41 sngal_46 las_53 yongs_57 su_63 bskyab_66 ba_73 don_78 dang_82 
T02D1897:260b-26	thams cad mkhyen pa'i ye shes bla na med pa la rab tu gzhag pa'i phyir /	thams_0 cad_6 mkhyen_10 ba_17 ye_22 shes_25 bla_30 na_34 med_37 ba_41 la_44 rab_47 tu_51 'jog_54 ba_60 phyir_65 
T02D1897:260b-27	ji ltar 'das pa dang /	ji_0 ltar_3 'da'_8 ba_13 dang_16 
T02D1897:260b-28	ma byon pa dang /	ma_0 'byon_3 ba_8 dang_11 
T02D1897:260b-29	da ltar byung ba'i byang chub sems dpa' rnams kyis	da_0 ltar_3 'byung_8 ba_14 byang_19 chub_25 sems_30 dpa'_35 rnams_40 kyis_46 
T02D1897:260b-30	byang chub tu sems bskyed nas sangs rgyas nyid rtogs	byang_0 chub_6 tu_11 sems_14 skyed_19 nas_26 sangs_30 rgya_36 nyid_42 rtogs_47 
T02D1897:260b-31	par gyur pa dang /	ba_0 gyur_4 ba_9 dang_12 
T02D1897:260b-32	rtogs par 'gyur ba dang /	rtogs_0 ba_6 'gyur_10 ba_16 dang_19 
T02D1897:260b-33	ji ltar sangs rgyas thams cad sgrib pa dang bral	ji_0 ltar_3 sangs_8 rgya_14 thams_20 cad_26 sgrib_30 ba_36 dang_39 'bral_44 
T02D1897:260b-34	ba'i sangs rgyas kyi ye shes dang sangs rgyas kyi	ba_0 sangs_5 rgya_11 kyi_17 ye_21 shes_24 dang_29 sangs_34 rgya_40 kyi_46 
T02D1897:260b-35	spyan gyis gzigs shing mkhyen pa dang /	spyan_0 gyis_6 gzigs_11 shing_17 mkhyen_23 ba_30 dang_33 
T02D1897:260b-36	ji ltar chos rnams kyi chos nyid mkhyen pa'i cho ga des bdag ming 'di zhes bgyi ba /	ji_0 ltar_3 chos_8 rnams_13 kyi_19 chos_23 nyid_28 mkhyen_33 ba_40 cho_45 ga_49 des_52 bdag_56 ming_61 'di_66 zhes_70 bgyid_75 ba_80 
T02D1897:260b-37	slob dpon mtshan 'di zhes bya ba'i mdun dang sangs	slob_0 dpon_5 mtshan_10 'di_17 zhes_21 byed_26 ba_30 mdun_35 dang_40 sangs_45 
T02D1897:260b-38	rgyas dang byang chub sems dpa' thams cad kyi mdun	rgya_0 dang_6 byang_11 chub_17 sems_22 dpa'_27 thams_32 cad_38 kyi_42 mdun_46 
T02D1897:261a-0	du bla na med pa yang @261a * //	du_0 bla_3 na_7 med_10 ba_14 yang_17 
T02D1897:261a-1	dag par rdzogs pa'i byang chub tu sems bskyed par bgyi'o //	'dag_0 ba_4 rdzogs_8 ba_15 byang_20 chub_26 tu_31 sems_34 skyed_39 ba_46 bgyid_50 
T02D1897:261a-2	'di ltar lan gsum du'o //	'di_0 ltar_4 lan_9 gsum_13 du_18 
T02D1897:261a-3	de nas gal te 'dod na dge bsnyen gyi sdom pa sbyin no //	de_0 nas_3 gal_7 te_11 'dod_14 na_19 dge_22 snyen_26 gyi_33 sdom_37 ba_42 sbyin_45 no_51 
T02D1897:261a-4	gsum la skyabs su 'gro ba sngon du song ba'i	gsum_0 la_5 skyob_8 su_15 'gro_18 ba_23 sngon_26 du_32 'gro_35 ba_40 
T02D1897:261a-5	bslab pa lnga 'dzin pa ni dge bsnyen gyi sdom	bslab_0 ba_6 lnga_9 'dzin_14 ba_20 ni_23 dge_26 snyen_30 gyi_37 sdom_41 
T02D1897:261a-6	pa'o // de yang sngar gsol ba btab pa dang	ba_0 de_8 yang_11 sngar_16 gsol_22 ba_27 'debs_30 ba_35 dang_38 
T02D1897:261a-7	ldan pa skyabs su song ba la 'di ltar sbyin	ldan_0 ba_5 skyob_8 su_15 'gro_18 ba_23 la_26 'di_29 ltar_33 sbyin_38 
T02D1897:261a-8	pa'o // par bya'o // tshe dang ldan pa khyod	ba_0 ba_8 byed_12 tshe_21 dang_26 ldan_31 ba_36 khyod_39 
T02D1897:261a-9	'di skad smros shig / slob dpon dgongs su gsol	'di_0 skad_4 smros_9 shig_15 slob_22 dpon_27 dgongs_32 su_39 gsol_42 
T02D1897:261a-10	pa'o // par bya'o // / ji ltar 'phags pa	ba_0 ba_8 byed_12 ji_23 ltar_26 'phag_31 ba_38 
T02D1897:261a-11	dgra bcom pa de rnams kyis ji srid 'tsho'i bar	dgra_0 'joms_5 ba_10 de_13 rnams_16 kyis_22 ji_27 srid_30 'tsho_35 ba_43 
T02D1897:261a-12	du tha na srin bu grog ma yang nye bar	du_0 tha_3 na_7 srin_10 bu_15 grog_18 ma_23 yang_26 nye_31 ba_35 
T02D1897:261a-13	pa'o // par bya'o // / bzung ste / sems	ba_0 ba_8 byed_12 bzung_23 ste_29 sems_35 
T02D1897:261a-14	can thams cad la ngo tsha dang snying rje dang	can_0 thams_4 cad_10 la_14 ngo_17 tsha_21 dang_26 snying_31 rje_38 dang_42 
T02D1897:261a-15	ldan pas srog gcod pa spangs pa dang /	ldan_0 ba_5 srog_9 gcod_14 ba_19 spong_22 ba_29 dang_32 
T02D1897:261a-16	srog gcod pa las slar log pa dang /	srog_0 gcod_5 ba_10 las_13 slar_17 log_22 ba_26 dang_29 
T02D1897:261a-17	dbyug pa spangs pa dang /	dbyug_0 ba_6 spong_9 ba_16 dang_19 
T02D1897:261a-18	mtshon cha spangs pa de bzhin du bdag ming 'di	mtshon_0 cha_7 spong_11 ba_18 de_21 bzhin_24 du_30 bdag_33 ming_38 'di_43 
T02D1897:261a-19	zhes bgyi bas kyang tha ma srin bu grog ma	zhes_0 bgyid_5 ba_10 kyang_14 tha_20 ma_24 srin_27 bu_32 grog_35 ma_40 
T02D1897:261a-20	yang nye bar bzung ste sems can ngo tsha dang	yang_0 nye_5 ba_9 bzung_13 ste_19 sems_23 can_28 ngo_32 tsha_36 dang_41 
T02D1897:261a-21	snying rje dang ldan pas srog gcod pa spangs te	snying_0 rje_7 dang_11 ldan_16 ba_21 srog_25 gcod_30 ba_35 spong_38 te_45 
T02D1897:261a-22	srog gcod pa las slar log pa dang dbyug pa	srog_0 gcod_5 ba_10 las_13 slar_17 log_22 ba_26 dang_29 dbyug_34 ba_40 
T02D1897:261a-23	spang ba dang / mtshon cha spang bar bgyi'o //	spong_0 ba_6 dang_9 mtshon_16 cha_23 spong_27 ba_33 bgyid_37 
T02D1897:261a-24	yan lag dang po 'dis 'phags pa dgra bcom pa	yan_0 lag_4 dang_8 po_13 'dis_16 'phag_21 ba_28 dgra_31 'joms_36 ba_41 
T02D1897:261a-25	de rnams kyi bslab pa la rjes su sgrub po	de_0 rnams_3 kyi_9 bslab_13 ba_19 la_22 rjes_25 su_30 sgrub_33 po_39 
T02D1897:261a-26	rjes su bgyid do //	rjes_0 su_5 bgyid_8 do_14 
T02D1897:261a-27	gzhan yang slar ji ltar 'phags pa dgra bcom pa	gzhan_0 yang_6 slar_11 ji_16 ltar_19 'phag_24 ba_31 dgra_34 'joms_39 ba_44 
T02D1897:261a-28	de rnams kyis ji srid 'tsho'i bar du ma byin	de_0 rnams_3 kyis_9 ji_14 srid_17 'tsho_22 ba_30 du_34 ma_37 byin_40 
T02D1897:261a-29	par len pa dang /	ba_0 len_4 ba_8 dang_11 
T02D1897:261a-30	'dod pas log par g-yem pa dang /	'dod_0 ba_5 log_9 ba_13 g-yem_17 ba_23 dang_26 
T02D1897:261a-31	brdzun du smra ba dang /	brdzun_0 du_7 smra_10 ba_15 dang_18 
T02D1897:261a-32	'bru'i chang myos par 'gyur ba'i gnas spangs shing myos	'bru_0 chang_7 myos_13 ba_18 'gyur_22 ba_28 gnas_33 spong_38 shing_45 myos_51 
T02D1897:261a-33	par 'gyur ba'i gnas las slar log pa de bzhin	ba_0 'gyur_4 ba_10 gnas_15 las_20 slar_24 log_29 ba_33 de_36 bzhin_39 
T02D1897:261a-34	du ming 'di zhes bgyi ba nyi ma 'di nas	du_0 ming_3 'di_8 zhes_12 bgyid_17 ba_22 nyi_25 ma_29 'di_32 nas_36 
T02D1897:261a-35	bzung ste / ji srid 'tsho'i bar du ma byin	bzung_0 ste_6 ji_12 srid_15 'tsho_20 ba_28 du_32 ma_35 byin_38 
T02D1897:261a-36	par len pa dang 'dod pas log par g-yem pa	ba_0 len_4 ba_8 dang_11 'dod_16 ba_21 log_25 ba_29 g-yem_33 ba_39 
T02D1897:261a-37	dang brdzun du smra ba dang /	dang_0 brdzun_5 du_12 smra_15 ba_20 dang_23 
T02D1897:261a-38	'bru'i chang myos par 'gyur ba bag med pa'i gnas spangs shing /	'bru_0 chang_7 myos_13 ba_18 'gyur_22 ba_28 bag_31 med_35 ba_39 gnas_44 spong_49 shing_56 
T02D1897:261a-39	'bru'i gnas las slar log par bgyi'o //	'bru_0 gnas_7 las_12 slar_16 log_21 ba_25 bgyid_29 
T02D1897:261a-40	yan lag lnga pa 'dis 'phags pa dgra bcom pa	yan_0 lag_4 lnga_8 ba_13 'dis_16 'phag_21 ba_28 dgra_31 'joms_36 ba_41 
T02D1897:261a-41	de dag gi bslab pa la rjes su slob po	de_0 'dag_3 gi_7 bslab_10 ba_16 la_19 rjes_22 su_27 slob_30 po_35 
T02D1897:261a-42	// rjes su sgrub po //	rjes_3 su_8 sgrub_11 po_17 
T02D1897:261a-43	rjes su bgyid do //	rjes_0 su_5 bgyid_8 do_14 
T02D1897:261a-44	bdag slob dpon gyis dge bsnyen du bzung du gsol //	bdag_0 slob_5 dpon_10 gyis_15 dge_20 snyen_24 du_31 bzung_34 du_40 gsol_43 
T02D1897:261a-45	de bzhin du lan gnyis lan gsum mo //	de_0 bzhin_3 du_9 lan_12 gnyis_16 lan_22 gsum_26 mo_31 
T02D1897:261b-0	de bzhin du gal te gso sbyong len @261b par	de_0 bzhin_3 du_9 gal_12 te_16 gso_19 sbyong_23 len_30 ba_40 
T02D1897:261b-1	'dod na de'i tshe go ma'i sdom pa sbyin par	'dod_0 na_5 de_8 tshe_13 go_18 ma_21 sdom_26 ba_31 sbyin_34 ba_40 
T02D1897:261b-2	bya'o // skyabs su 'gro ba sngon du song ba'i	byed_0 skyob_9 su_16 'gro_19 ba_24 sngon_27 du_33 'gro_36 ba_41 
T02D1897:261b-3	bslab pa brgyad 'dzin pa ni go ma'i sdom pa'o	bslab_0 ba_6 brgyad_9 'dzin_16 ba_22 ni_25 go_28 ma_31 sdom_36 ba_41 
T02D1897:261b-4	bya'o // // de yang gsol ba btab pa dang	byed_0 de_12 yang_15 gsol_20 ba_25 'debs_28 ba_33 dang_36 
T02D1897:261b-5	ldan pa gsum la skyabs su 'gro ba sngon du	ldan_0 ba_5 gsum_8 la_13 skyob_16 su_23 'gro_26 ba_31 sngon_34 du_40 
T02D1897:261b-6	song ba la 'di ltar sbyin par bya'o //	'gro_0 ba_5 la_8 'di_11 ltar_15 sbyin_20 ba_26 byed_30 
T02D1897:261b-7	tshe dang ldan pa khyod kyis 'di skad smros shig	tshe_0 dang_5 ldan_10 ba_15 khyod_18 kyis_24 'di_29 skad_33 smros_38 shig_44 
T02D1897:261b-8	bdag ming 'di zhes bgyi ba dus 'di nas bzung	bdag_0 ming_5 'di_10 zhes_14 bgyid_19 ba_24 dus_27 'di_31 nas_35 bzung_39 
T02D1897:261b-9	ste / ji srid phyis kyi mtshan mo'i nyi ma shar ba la thug pa de srid du /	ste_0 ji_6 srid_9 'byid_14 kyi_20 mtshan_24 mo_31 nyi_36 ma_40 'char_43 ba_48 la_51 thug_54 ba_59 de_62 srid_65 du_70 
T02D1897:261b-10	srog gcod kun dang gzhan gyi nor 'phrog de bzhin mi tshangs spyod //	srog_0 gcod_5 kun_10 dang_14 gzhan_19 gyi_25 nor_29 'phrog_33 de_40 bzhin_43 mi_49 tshangs_52 spyod_60 
T02D1897:261b-11	phra brdzun dga' ba skyed byed chang dang dus ma yin pa'i zas //	phra_0 brdzun_5 dga'_12 ba_17 skyed_20 byed_26 chang_31 dang_37 dus_42 ma_46 yin_49 ba_53 zas_58 
T02D1897:261b-12	phreng ba tshon rtsi glu gar rol pa khri stan	phreng_0 ba_7 tshon_10 rtsi_16 glu_21 gar_25 rol_29 ba_33 khri_36 stan_41 
T02D1897:261b-13	chen po dag / bdag ni de ring spong byed	chen_0 po_5 'dag_8 bdag_14 ni_19 de_22 ring_25 spong_30 byed_36 
T02D1897:261b-14	dgra bcom zhugs pa'i yon tan brgyad //	dgra_0 'joms_5 'jug_10 ba_16 yon_21 tan_25 brgyad_29 
T02D1897:261b-15	de bzhin du lan gsum mo //	de_0 bzhin_3 du_9 lan_12 gsum_16 mo_21 
T02D1897:261b-16	de nas gzhan yang dge tshul gyi sdom pa dang /	de_0 nas_3 gzhan_7 yang_13 dge_18 tshul_22 gyi_28 sdom_32 ba_37 dang_40 
T02D1897:261b-17	dge slong gi sdom pa dang /	dge_0 slong_4 gi_10 sdom_13 ba_18 dang_21 
T02D1897:261b-18	byang chub sems dpa'i sdom pa dang /	byang_0 chub_6 sems_11 dpa_16 sdom_22 ba_27 dang_30 
T02D1897:261b-19	sngags kyi tshul rdo rje sems dpa'i sdom pa yang yod de /	sngags_0 kyi_7 tshul_11 rdo_17 rje_21 sems_25 dpa_30 sdom_36 ba_41 yang_44 yod_49 de_53 
T02D1897:261b-20	de yang sbyor ba ji lta ba bzhin dang /	de_0 yang_3 sbyor_8 ba_14 ji_17 lta_20 ba_24 bzhin_27 dang_33 
T02D1897:261b-21	mos pa ji lta ba bzhin dang /	mos_0 ba_4 ji_7 lta_10 ba_14 bzhin_17 dang_23 
T02D1897:261b-22	skabs ji lta ba bzhin dang /	skabs_0 ji_6 lta_9 ba_13 bzhin_16 dang_22 
T02D1897:261b-23	cho ga ji lta ba bzhin du blang bar bya ste /	cho_0 ga_4 ji_7 lta_10 ba_14 bzhin_17 du_23 blang_26 ba_32 byed_36 ste_40 
T02D1897:261b-24	de 'dir ma bstan te thun mong ma yin pa nyid kyi phyir ro //	de_0 'dir_3 ma_8 ston_11 te_17 thun_20 mong_25 ma_30 yin_33 ba_37 nyid_40 kyi_45 phyir_49 ro_55 
T02D1897:261b-25	de la srog gcod pa dang /	de_0 la_3 srog_6 gcod_11 ba_16 dang_19 
T02D1897:261b-26	ma byin pa len pa dang /	ma_0 byin_3 ba_8 len_11 ba_15 dang_18 
T02D1897:261b-27	'dod pa log par g-yem pa dang /	'dod_0 ba_5 log_8 ba_12 g-yem_16 ba_22 dang_25 
T02D1897:261b-28	brdzun du smra ba dang /	brdzun_0 du_7 smra_10 ba_15 dang_18 
T02D1897:261b-29	'bru'i chang dang /	'bru_0 chang_7 dang_13 
T02D1897:261b-30	bcos pa'i chang dang /	'chos_0 ba_5 chang_10 dang_16 
T02D1897:261b-31	bag med pa'i gnas te /	bag_0 med_4 ba_8 gnas_13 te_18 
T02D1897:261b-32	'di las ldog pa ni dge bsnyen gyi bslab pa'i gnas lnga'o ;	'di_0 las_4 ldog_8 ba_13 ni_16 dge_19 snyen_23 gyi_30 bslab_34 ba_40 gnas_45 lnga_50 
T02D1897:261b-33	/ de bzhin du srog gcod pa dang /	de_2 bzhin_5 du_11 srog_14 gcod_19 ba_24 dang_27 
T02D1897:261b-34	ma byin par len pa dang /	ma_0 byin_3 ba_8 len_12 ba_16 dang_19 
T02D1897:261b-35	mi tshangs par spyod pa dang /	mi_0 tshangs_3 ba_11 spyod_15 ba_21 dang_24 
T02D1897:261b-36	brdzun du smra ba dang /	brdzun_0 du_7 smra_10 ba_15 dang_18 
T02D1897:261b-37	'bru'i chang bag med pa'i gnas dang /	'bru_0 chang_7 bag_13 med_17 ba_21 gnas_26 dang_31 
T02D1897:261b-38	dus ma yin pa'i zas dang /	dus_0 ma_4 yin_7 ba_11 zas_16 dang_20 
T02D1897:261b-39	gar la sogs pa dang /	gar_0 la_4 sogs_7 ba_12 dang_15 
T02D1897:261b-40	phreng ba la sogs pa dang /	phreng_0 ba_7 la_10 sogs_13 ba_18 dang_21 
T02D1897:261b-41	khri stan chen po dang /	khri_0 stan_5 chen_10 po_15 dang_18 
T02D1897:261b-42	khri stan mthon po dang /	khri_0 stan_5 mthon_10 po_16 dang_19 
T02D1897:261b-43	gser la sogs pa ste 'di dag spong ba ni dge tshul gyi bslab pa'i gnas bcu'o //	gser_0 la_5 sogs_8 ba_13 ste_16 'di_20 'dag_24 spong_28 ba_34 ni_37 dge_40 tshul_44 gyi_50 bslab_54 ba_60 gnas_65 'chu_70 
T02D1897:261b-44	de bzhin pham pa rnams dang /	de_0 bzhin_3 'pham_9 ba_14 rnams_17 dang_23 
T02D1897:261b-45	dge 'dun gyi lhag ma rnams dang /	dge_0 'dun_4 gyi_9 lhag_13 ma_18 rnams_21 dang_27 
T02D1897:261b-46	so sor bshags par bya ba dang /	so_0 sor_3 'chags_7 ba_14 byed_18 ba_22 dang_25 
T02D1897:261b-47	nyes byas rnams de ltung ba sde lnga ni dge slong rnams kyi'o //	nyes_0 byed_5 rnams_10 de_16 ltung_19 ba_25 sde_28 lnga_32 ni_37 dge_40 slong_44 rnams_50 kyi_56 
T02D1897:262a-0	@262a * // pham pa dang /	'pham_11 ba_16 dang_19 
T02D1897:262a-1	nyes byas te ltung ba de gnyis ni byang chub sems dpa'i sdom can gyi'o //	nyes_0 byed_5 te_10 ltung_13 ba_19 de_22 gnyis_25 ni_31 byang_34 chub_40 sems_45 dpa_50 sdom_56 can_61 gyi_65 
T02D1897:262a-2	pham pa rnams dang dge 'dun gyi lhag ma rnams zhes pa ni rtsa ba'i ltung ba dang /	'pham_0 ba_5 rnams_8 dang_14 dge_19 'dun_23 gyi_28 lhag_32 ma_37 rnams_40 zhes_46 ba_51 ni_54 rtsa_57 ba_62 ltung_67 ba_73 dang_76 
T02D1897:262a-3	ltung ba sbom po'i sgras brjod de /	ltung_0 ba_6 sbom_9 po_14 sgras_19 rjod_25 de_31 
T02D1897:262a-4	ltung ba de gnyis ni rdo rje sems dpa'i sdom pa can gyi'o //	ltung_0 ba_6 de_9 gnyis_12 ni_18 rdo_21 rje_25 sems_29 dpa_34 sdom_40 ba_45 can_48 gyi_52 
T02D1897:262a-5	de la bla ma la brnyas pa dang /	de_0 la_3 bla_6 ma_10 la_13 brnyas_16 ba_23 dang_26 
T02D1897:262a-6	de bzhin gshegs pa'i bka' las 'das pa dang /	de_0 bzhin_3 gshegs_9 ba_16 bka'_21 las_26 'da'_30 ba_35 dang_38 
T02D1897:262a-7	zhe sdang gis rdo rje spun gyi nyes pa brjod pa dang /	zhe_0 sdang_4 gis_10 rdo_14 rje_18 spun_22 gyi_27 nyes_31 ba_36 rjod_39 ba_45 dang_48 
T02D1897:262a-8	byams pa spong ba dang /	byams_0 ba_6 spong_9 ba_15 dang_18 
T02D1897:262a-9	byang chub kyi sems spong ba dang /	byang_0 chub_6 kyi_11 sems_15 spong_20 ba_26 dang_29 
T02D1897:262a-10	theg pa gsum la smod pa dang /	theg_0 ba_5 gsum_8 la_13 smod_16 ba_21 dang_24 
T02D1897:262a-11	yongs su ma smin pa la gsang ba sgrogs pa dang /	yongs_0 su_6 ma_9 smin_12 ba_17 la_20 gsang_23 ba_29 sgrogs_32 ba_39 dang_42 
T02D1897:262a-12	de bzhin gshegs pa'i bdag nyid phung po lnga la smod pa dang /	de_0 bzhin_3 gshegs_9 ba_16 bdag_21 nyid_26 'phung_31 po_37 lnga_40 la_45 smod_48 ba_53 dang_56 
T02D1897:262a-13	chos thams cad rang bzhin gyis yongs su dag pa la the tshom za ba dang /	chos_0 thams_5 cad_11 rang_15 bzhin_20 gyis_26 yongs_31 su_37 'dag_40 ba_44 la_47 the_50 tshom_54 za_60 ba_63 dang_66 
T02D1897:262a-14	sdang ba la byams pa dang /	sdang_0 ba_6 la_9 byams_12 ba_18 dang_21 
T02D1897:262a-15	chos thams cad thog ma dang tha mas stong pa la thog ma dang tha mar rtog pa dang /	chos_0 thams_5 cad_11 thogs_15 ma_20 dang_23 tha_28 mas_32 stong_36 ba_42 la_45 thogs_48 ma_53 dang_56 tha_61 mar_65 rtogs_69 ba_74 dang_77 
T02D1897:262a-16	dad pa dang ldan pa'i sems rab tu sun 'byin pa dang /	dad_0 ba_4 dang_7 ldan_12 ba_17 sems_22 rab_27 tu_31 sun_34 'byin_38 ba_44 dang_47 
T02D1897:262a-17	ji ltar rnyed pa'i dam tshig mi bsten pa dang /	ji_0 ltar_3 rnyed_8 ba_14 dam_19 tshig_23 mi_29 sten_32 ba_38 dang_41 
T02D1897:262a-18	bud med la smod pa zhes bya ste rtsa ba'i ltung ba bcu bzhi'o //	'bud_0 med_4 la_8 smod_11 ba_16 zhes_19 byed_24 ste_28 rtsa_32 ba_37 ltung_42 ba_48 'chu_51 bzhi_55 
T02D1897:262a-19	de bzhin du stobs kyis rnal 'byor ma len pa dang /	de_0 bzhin_3 du_9 stobs_12 kyis_18 rnal_23 'byor_28 ma_34 len_37 ba_41 dang_44 
T02D1897:262a-20	stobs kyis de'i byang chub kyi sems len pa dang /	stobs_0 kyis_6 de_11 byang_16 chub_22 kyi_27 sems_31 len_36 ba_40 dang_43 
T02D1897:262a-21	gsang ba mi sbed pa dang /	gsang_0 ba_6 mi_9 sbed_12 ba_17 dang_20 
T02D1897:262a-22	dam tshig la rtsod pa dang /	dam_0 tshig_4 la_10 rtsod_13 ba_19 dang_22 
T02D1897:262a-23	dad pa dang ldan pa la chos log par ston pa dang /	dad_0 ba_4 dang_7 ldan_12 ba_17 la_20 chos_23 log_28 ba_32 ston_36 ba_41 dang_44 
T02D1897:262a-24	nyan thos kyi theg pa la zhugs pa dang zhag	nyan_0 thos_5 kyi_10 theg_14 ba_19 la_22 'jug_25 ba_31 dang_34 zhag_39 
T02D1897:262a-25	bdun du lhan cig gnas pa dang rnal 'byor mi	bdun_0 du_5 lhan_8 cig_13 gnas_17 ba_22 dang_25 rnal_30 'byor_35 mi_41 
