T02D1263:1b-0	@1b # // rgya gar skad du /	rgya_9 gar_14 skad_18 du_23 
T02D1263:1b-1	he badzra mandala karma kra ma bi dhi:/	he_0 badzra_3 mandala_10 karma_18 kra_24 ma_28 bi_31 
T02D1263:1b-2	bod skad du /	'bod_0 skad_4 du_9 
T02D1263:1b-3	kye'i rdo rje'i dkyil 'khor gyi las kyi rim pa'i	kye_0 rdo_6 rje_10 dkyil_16 'khor_22 gyi_28 las_32 kyi_36 rim_40 ba_44 
T02D1263:1b-4	cho ga / dpal kye'i rdo rje la phyag 'tshal	cho_0 ga_4 dpal_9 kye_14 rdo_20 rje_24 la_28 phyag_31 'tshal_37 
T02D1263:1b-5	lo // dang [dd] por slob dpon gyis bla ma la dbang thob cing /	lo_0 dang_6 [dd]_11 por_16 slob_20 dpon_25 gyis_30 bla_35 ma_39 la_42 dbang_45 'thob_51 cing_56 
T02D1263:1b-6	dam tshig la gnas la mtshan nyid thams cad dang ldan pa des /	dam_0 tshig_4 la_10 gnas_13 la_18 mtshan_21 nyid_28 thams_33 cad_39 dang_43 ldan_48 ba_53 des_56 
T02D1263:1b-7	slob ma la dbang bskur ba'i don du /	slob_0 ma_5 la_8 dbang_11 skur_17 ba_23 don_28 du_32 
T02D1263:1b-8	dkyil 'khor bri ba ni /	dkyil_0 'khor_6 'bri_12 ba_16 ni_19 
T02D1263:1b-9	dang por slob ma'i mtshan nyid brtag par bya ste /	dang_0 por_5 slob_9 ma_14 mtshan_19 nyid_26 rtog_31 ba_37 byed_41 ste_45 
T02D1263:1b-10	des shing 'jam la snyan par smra ba /	des_0 shing_4 'jam_10 la_15 snyan_18 ba_24 smra_28 ba_33 
T02D1263:1b-11	sems can thams cad la byams pa dang /	sems_0 can_5 thams_9 cad_15 la_19 byams_22 ba_28 dang_31 
T02D1263:1b-12	snying rje'i sems dang ldan pa /	snying_0 rje_7 sems_13 dang_18 ldan_23 ba_28 
T02D1263:1b-13	thos bsam dang klog pa la mngon par brtson pa /	thos_0 bsam_5 dang_10 klog_15 ba_20 la_23 mngon_26 ba_32 brtson_36 ba_43 
T02D1263:1b-14	thabs dang shes rab zab mo'i tshul gyis /	thabs_0 dang_6 shes_11 rab_16 zab_20 mo_24 tshul_29 gyis_35 
T02D1263:1b-15	gsang ba'i chos la shin tu dad pa /	gsang_0 ba_6 chos_11 la_16 shin_19 tu_24 dad_27 ba_31 
T02D1263:1b-16	bla ma la gus pa /	bla_0 ma_4 la_7 gus_10 ba_14 
T02D1263:1b-17	bstan bcos la 'jigs pa med pa /	ston_0 'chos_6 la_11 'jigs_14 ba_20 med_23 ba_27 
T02D1263:1b-18	gtong sems che ba dang ldan pa'i slob ma de yongs su gzung bar bya'o //	gtong_0 sems_6 che_11 ba_15 dang_18 ldan_23 ba_28 slob_33 ma_38 de_41 yongs_44 su_50 gzung_53 ba_59 byed_63 
T02D1263:1b-19	de ltar slob ma brtags pa'i rjes la /	de_0 ltar_3 slob_8 ma_13 rtog_16 ba_23 rjes_28 la_33 
T02D1263:1b-20	dang po lha'i bsnyen pa bya ste /	dang_0 po_5 lha_8 snyen_14 ba_21 byed_24 ste_28 
T02D1263:1b-21	de la gtso bo'i 'dzab ni 'bum du bzlas par bya'o //	de_0 la_3 gtso_6 'bo_11 'dzab_16 ni_22 'bum_25 du_30 bzlas_33 ba_39 byed_43 
T02D1263:1b-22	lha mo rnams kyi 'dzab ni stong du bzlas par bya'o //	lha_0 mo_4 rnams_7 kyi_13 'dzab_17 ni_23 stong_26 du_32 bzlas_35 ba_41 byed_45 
T02D1263:2a-0	de @2a * //	de_0 
T02D1263:2a-1	la slob dpon la la dag gi thugs bzhed kyis /	la_0 slob_3 dpon_8 la_13 la_16 'dag_19 gi_23 thugs_26 bzhed_32 kyis_38 
T02D1263:2a-2	lha mo brgyad kyi 'dzab ni mi dgos te /	lha_0 mo_4 brgyad_7 kyi_14 'dzab_18 ni_24 mi_27 dgos_30 te_35 
T02D1263:2a-3	ci'i phyir zhe na /	ci_0 phyir_5 zhe_11 na_15 
T02D1263:2a-4	dpa' bo'i yan lag tu gyur pas na /	dpa'_0 'bo_5 yan_10 lag_14 tu_18 gyur_21 ba_26 na_30 
T02D1263:2a-5	dpa' bo gcig po byas pas chog gsung /	dpa'_0 'bo_5 gcig_8 po_13 byed_16 ba_21 chog_25 gsung_30 
T02D1263:2a-6	de ltar bzlas pa byas pas mtshan ma byung na /	de_0 ltar_3 bzlas_8 ba_14 byed_17 ba_22 mtshan_26 ma_33 'byung_36 na_42 
T02D1263:2a-7	dkyil 'khor bri ba brtsam par bya ste /	dkyil_0 'khor_6 'bri_12 ba_16 brtsam_19 ba_26 byed_30 ste_34 
T02D1263:2a-8	dang por sems dag pa mngon du byas la /	dang_0 por_5 sems_9 'dag_14 ba_18 mngon_21 du_27 byed_30 la_35 
T02D1263:2a-9	kye'i rdo rje dang ldan pas lha rnams mnyes par byas shing /	kye_0 rdo_6 rje_10 dang_14 ldan_19 ba_24 lha_28 rnams_32 mnyes_38 ba_44 byed_48 shing_53 
T02D1263:2a-10	dkyil 'khor bri ba'i phyir /	dkyil_0 'khor_6 'bri_12 ba_16 phyir_21 
T02D1263:2a-11	sa gzhi yongs su brtag par bya ste /	sa_0 gzhi_3 yongs_8 su_14 rtog_17 ba_23 byed_27 ste_31 
T02D1263:2a-12	nags tshal shin tu dben pa'am /	nags_0 tshal_5 shin_11 tu_16 dben_19 ba_24 
T02D1263:2a-13	byang chub sems dpa'i khyim mam /	byang_0 chub_6 sems_11 dpa_16 khyim_22 mam_28 
T02D1263:2a-14	rgya mtsho chen po'i 'gram mam /	rgya_0 mtsho_5 chen_11 po_16 'grams_21 mam_27 
T02D1263:2a-15	dur khrod grub pa'i gnas sam /	dur_0 khrod_4 'grub_10 ba_15 gnas_20 sam_25 
T02D1263:2a-16	sngon dkyil 'khor byas pa'i gnas sam /	sngon_0 dkyil_6 'khor_12 byed_18 ba_23 gnas_28 sam_33 
T02D1263:2a-17	yang na gnas yid du 'ong ba'i sa phyogs rang gi sems 'jug pa /	yang_0 na_5 gnas_8 yid_13 du_17 'ong_20 ba_25 sa_30 phyogs_33 rang_40 gi_45 sems_48 'jug_53 ba_58 
T02D1263:2a-18	mdzes shing yid du 'ong ba ru /	mdzes_0 shing_6 yid_12 du_16 'ong_19 ba_24 ru_27 
T02D1263:2a-19	dri zhim pa'i chus gtor te /	'dri_0 zhim_4 ba_9 chus_14 'thor_19 te_24 
T02D1263:2a-20	me tog sna tshogs pa yang dgram /	me_0 tog_3 sna_7 tshogs_11 ba_18 yang_21 'grem_26 
T02D1263:2a-21	gnas gang yang rung ba der /	gnas_0 gang_5 yang_10 rung_15 ba_20 der_23 
T02D1263:2a-22	shar dang byang du gzhol na /	'char_0 dang_5 byang_10 du_16 gzhol_19 na_25 
T02D1263:2a-23	rnal 'byor pa rnams dngos grub tu 'gyur ro //	rnal_0 'byor_5 ba_11 rnams_14 dngos_20 'grub_26 tu_31 'gyur_34 ro_40 
T02D1263:2a-24	dbus mthon phyag rgya chen po'i rigs 'dzin thob par 'gyur /	dbus_0 mthon_5 phyag_11 rgya_17 chen_22 po_27 rigs_32 'dzin_37 'thob_43 ba_48 'gyur_52 
T02D1263:2a-25	byang mthon na mkha' 'gro ma rnams kyi rjes su 'brang bar 'gyur ro //	byang_0 mthon_6 na_12 mkha'_15 'gro_21 ma_26 rnams_29 kyi_35 rjes_39 su_44 'brang_47 ba_54 'gyur_58 ro_64 
T02D1263:2a-26	shar mtho na rigs bzhi dang /	'char_0 mtho_5 na_10 rigs_13 bzhi_18 dang_23 
T02D1263:2a-27	lnga la sogs pa rtogs pa zad par 'gyur ro //	lnga_0 la_5 sogs_8 ba_13 rtogs_16 ba_22 zad_25 ba_29 'gyur_33 ro_39 
T02D1263:2b-0	@2b sa gzhi dbus dma' na sngags pa 'jigs pa dang bcas par 'gyur ro //	sa_4 gzhi_7 dbus_12 dma'_17 na_22 sngags_25 ba_32 'jigs_35 ba_41 dang_44 'cha'_49 ba_54 'gyur_58 ro_64 
T02D1263:2b-1	de ltar mtshan nyid dang ldan pa'i gnas der bsgrubs nas /	de_0 ltar_3 mtshan_8 nyid_15 dang_20 ldan_25 ba_30 gnas_35 der_40 sgrub_44 nas_52 
T02D1263:2b-2	ji ltar 'dod pa'i dngos grub tu 'gyur ro //	ji_0 ltar_3 'dod_8 ba_13 dngos_18 'grub_24 tu_29 'gyur_32 ro_38 
T02D1263:2b-3	sa brtag pa'i rim pa'o /	sa_0 rtog_3 ba_9 rim_14 ba_18 
T02D1263:2b-5	// / de ltar brtags pa'i dbus su /	de_5 ltar_8 rtog_13 ba_20 dbus_25 su_30 
T02D1263:2b-6	kye'i rdo rje dang ldan par 'dug la /	kye_0 rdo_6 rje_10 dang_14 ldan_19 ba_24 'dug_28 la_33 
T02D1263:2b-7	sa'i lha mo bskul la gsol ba gdab par bya ste /	sa_0 lha_5 mo_9 skul_12 la_18 gsol_21 ba_26 gdab_29 ba_34 byed_38 ste_42 
T02D1263:2b-8	lag pa gnyis kyi sor mo lan gsum du sa la brdab par bya'o //	lag_0 ba_4 gnyis_7 kyi_13 sor_17 mo_21 lan_24 gsum_28 du_33 sa_36 la_39 brdab_42 ba_48 byed_52 
T02D1263:2b-9	brdabs pas sa'i nang nas phyir 'thon nas /	brdab_0 ba_7 sa_11 nang_16 nas_21 phyir_25 'thon_31 nas_37 
T02D1263:2b-10	rnal 'byor pa'i mdun du 'dug nas gnas par bsam mo //	rnal_0 'byor_5 ba_11 mdun_16 du_21 'dug_24 nas_29 gnas_33 ba_38 bsam_42 mo_47 
T02D1263:2b-11	lha mo de yang rgyan thams cad kyis brgyan pa dang ldan pa /	lha_0 mo_4 de_7 yang_10 rgyan_15 thams_21 cad_27 kyis_31 rgyan_36 ba_43 dang_46 ldan_51 ba_56 
T02D1263:2b-12	mdog ser por gnas pa /	mdog_0 ser_5 por_9 gnas_13 ba_18 
T02D1263:2b-13	bzhin sdug pa mdzes pa phyag na bum pa bsnams te /	bzhin_0 sdug_6 ba_11 mdzes_14 ba_20 phyag_23 na_29 bum_32 ba_36 snom_39 te_46 
T02D1263:2b-14	bdag ni ci bgyi bka' stsol 'tshal /	bdag_0 ni_5 ci_8 bgyid_11 bka'_16 stsol_21 'tshal_27 
T02D1263:2b-15	zhes smra bar bsam mo //	zhes_0 smra_5 ba_10 bsam_14 mo_19 
T02D1263:2b-16	de ltar bsams pa'i lha mo de la mchod yon dang /	de_0 ltar_3 bsams_8 ba_14 lha_19 mo_23 de_26 la_29 mchod_32 yon_38 dang_42 
T02D1263:2b-17	zhabs bsil dang /	zhabs_0 bsil_6 dang_11 
T02D1263:2b-18	mchod pa dang /	mchod_0 ba_6 dang_9 
T02D1263:2b-19	gtor ma phul la 'di skad brjod par bya'o //	'thor_0 ma_5 'bul_8 la_13 'di_16 skad_20 rjod_25 ba_31 byed_35 
T02D1263:2b-20	skyob pa sangs rgyas thams cad kyi //	skyob_0 ba_6 sangs_9 rgya_15 thams_21 cad_27 kyi_31 
T02D1263:2b-21	spyod pa'i tshul dang khyad par dang //	spyod_0 ba_6 tshul_11 dang_17 khyad_22 ba_28 dang_32 
T02D1263:2b-22	sa dang pha rol phyin pa la //	sa_0 dang_3 pha_8 rol_12 phyin_16 ba_22 la_25 
T02D1263:2b-23	lha mo khyod ni dpang du gyur //	lha_0 mo_4 khyod_7 ni_13 dpang_16 du_22 gyur_25 
T02D1263:2b-24	sh'akya seng ge skyob pa yis //	sh_0 seng_8 ge_13 skyob_16 ba_22 yis_25 
T02D1263:2b-25	ji ltar bdud kyi sde bcom pa //	ji_0 ltar_3 bdud_8 kyi_13 sde_17 'joms_21 ba_26 
T02D1263:2b-26	de bzhin bdag gis bdud sde las //	de_0 bzhin_3 bdag_9 gis_14 bdud_18 sde_23 las_27 
T02D1263:2b-27	rgyal bar byas te dkyil 'khor bri //	rgyal_0 ba_6 byed_10 te_15 dkyil_18 'khor_24 'bri_30 
T02D1263:2b-28	zhes lan gsum brjod la /	zhes_0 lan_5 gsum_9 rjod_14 la_20 
T02D1263:2b-29	sa'i lha mo dga' ba'i mdangs kyis /	sa_0 lha_5 mo_9 dga'_12 ba_17 mdangs_22 kyis_29 
T02D1263:2b-30	khyod slob dpon yin gyis /	khyod_0 slob_6 dpon_11 yin_16 gyis_20 
T02D1263:2b-31	dkyil 'khor gyis shig zer nas /	dkyil_0 'khor_6 gyis_12 shig_17 zer_22 nas_26 
T02D1263:2b-32	sa la thim par bsam mo //	sa_0 la_3 'thim_6 ba_11 bsam_15 mo_20 
T02D1263:2b-33	de ni sa blang ba'i rim pa'o //	de_0 ni_3 sa_6 blang_9 ba_15 rim_20 ba_24 
T02D1263:2b-34	de nas sa phyogs dri zhim po'i chus gtor te /	de_0 nas_3 sa_7 phyogs_10 'dri_17 zhim_21 po_26 chus_31 'thor_36 te_41 
T02D1263:2b-35	bdud rtsi lnga'i chag chag gdab /	bdud_0 rtsi_5 lnga_10 'chag_17 'chag_22 gdab_27 
T02D1263:2b-36	de nas lto 'phye'i rim pa shes par byas la /	de_0 nas_3 lto_7 'phye_11 rim_19 ba_23 shes_26 ba_31 byed_35 la_40 
T02D1263:2b-37	dngos grub rab 'bring gsum gyi don du mgrin pa dang /	dngos_0 'grub_6 rab_11 'bring_15 gsum_22 gyi_27 don_31 du_35 mgrin_38 ba_44 dang_47 
T02D1263:2b-38	lte ba dang pus mo yan chod du brko bar bya'o //	lte_0 ba_4 dang_7 pus_12 mo_16 yan_19 chod_23 du_28 rko_31 ba_36 byed_40 
T02D1263:2b-39	de nas sa'i ro rdo ba dang /	de_0 nas_3 sa_7 ro_12 rdo_15 ba_19 dang_22 
T02D1263:2b-40	mgal dum dang /	mgal_0 dum_5 dang_9 
T02D1263:2b-41	sol ba dang /	sol_0 ba_4 dang_7 
T02D1263:2b-42	rus pa dang /	rus_0 ba_4 dang_7 
T02D1263:2b-43	gyo mo dang /	gyo_0 mo_4 dang_7 
T02D1263:2b-44	gseg ma dang /	gseg_0 ma_5 dang_8 
T02D1263:2b-45	bong ba la sogs pa med par byas pa'i sa gzhi bzang po snum pa la /	bong_0 ba_5 la_8 sogs_11 ba_16 med_19 ba_23 byed_27 ba_32 sa_37 gzhi_40 bzang_45 po_51 snum_54 ba_59 la_62 
T02D1263:2b-46	dri bzang po tsandan dang /	'dri_0 bzang_4 po_10 tsandan_13 dang_21 
T02D1263:2b-47	gur gum dang /	gur_0 'gum_4 dang_8 
T02D1263:2b-48	ga bur dang /	ga_0 bur_3 dang_7 
T02D1263:2b-49	gla rtsi la sogs pa dang yang bsres pas dgang /	gla_0 rtsi_4 la_9 sogs_12 ba_17 dang_20 yang_25 bsres_30 ba_36 'geng_40 
T02D1263:2b-50	yang na dri zhim po dang /	yang_0 na_5 'dri_8 zhim_12 po_17 dang_20 
T02D1263:2b-51	chu bsres la yi ge h'um bzlas pa'i chu dang bsres shing 'thas par bcag cing bkang la /	chu_0 bsres_4 la_10 yi_13 ge_16 h_19 bzlas_24 ba_30 chu_35 dang_39 bsres_44 shing_50 'thas_56 ba_62 'chag_66 cing_71 'geng_76 la_82 
T02D1263:3a-0	rin po che @3a * //	rin_0 po_4 che_7 
T02D1263:3a-1	la sogs pa'i sa'i gter bcug pa dang /	la_0 sogs_3 ba_8 sa_13 gter_18 'jug_23 ba_28 dang_31 
T02D1263:3a-2	lag mthil ltar mnyam pa'i steng du /	lag_0 mthil_4 ltar_10 mnyam_15 ba_21 steng_26 du_32 
T02D1263:3a-3	yan lag drug dang ldan pa'i rnal 'byor pa 'dug la /	yan_0 lag_4 drug_8 dang_13 ldan_18 ba_23 rnal_28 'byor_33 ba_39 'dug_42 la_47 
T02D1263:3a-4	aom raksha raksha zhes brjod pas /	aom_0 raksha_4 raksha_11 zhes_18 rjod_23 ba_29 
T02D1263:3a-5	sa gzhi thams cad rdo rje'i rang bzhin du bya'o //	sa_0 gzhi_3 thams_8 cad_14 rdo_18 rje_22 rang_28 bzhin_33 du_39 byed_42 
T02D1263:3a-6	'og dang steng rdo rje'i gur dang /	'og_0 dang_4 steng_9 rdo_15 rje_19 gur_25 dang_29 
T02D1263:3a-7	rdo rje'i bla rer bya //	rdo_0 rje_4 bla_10 rer_14 byed_18 
T02D1263:3a-8	de nas aom badzr'i bha ba badzra bandha h'um /	de_0 nas_3 aom_7 badzr_11 bha_19 ba_23 badzra_26 bandha_33 h_40 
T02D1263:3a-9	zhes pas thams cad 'od dang ldan par bya'o //	zhes_0 ba_5 thams_9 cad_15 'od_19 dang_23 ldan_28 ba_33 byed_37 
T02D1263:3a-10	kye yi rdo rje khros mchod pa //	kye_0 yi_4 rdo_7 rje_11 khro_15 mchod_21 ba_27 
T02D1263:3a-11	lha mo khyod ni dpang du 'gyur //	lha_0 mo_4 khyod_7 ni_13 dpang_16 du_22 'gyur_25 
T02D1263:3a-12	rin chen sna tshogs phye btags pas //	rin_0 chen_4 sna_9 tshogs_13 'byed_20 'dogs_25 ba_31 
T02D1263:3a-13	bdag gis don yod dkyil 'khor bri //	bdag_0 gis_5 don_9 yod_13 dkyil_17 'khor_23 'bri_29 
T02D1263:3a-14	don de bi sh'akya buddha si /	don_0 de_4 bi_7 sh_10 buddha_18 si_25 
T02D1263:3a-15	he badzra kro dha na na ratna na da ri ta to a'atma ko&amp; ham /	he_0 badzra_3 kro_10 dha_14 na_18 na_21 ratna_24 na_30 da_33 ri_36 ta_39 to_42 a_45 ko&amp;_52 ham_60 
T02D1263:3a-16	mandala na khe dam /	mandala_0 na_8 khe_11 dam_15 
T02D1263:3a-17	sa gzhi byin gyis brlab cing sta gon la gnas pa'i rim pa'o /	sa_0 gzhi_3 byin_8 gyis_13 brlab_18 cing_24 sta_29 gon_33 la_37 gnas_40 ba_45 rim_50 ba_54 
T02D1263:3a-19	// / de nas bla ma ni yan lag drug dang ldan pa /	de_5 nas_8 bla_12 ma_16 ni_19 yan_22 lag_26 drug_30 dang_35 ldan_40 ba_45 
T02D1263:3a-20	rgyan spyi gtsug gi rgya gram dang /	rgyan_0 spyi_6 gtsug_11 gi_17 rgya_20 'grams_25 dang_30 
T02D1263:3a-21	mgul rgyan dang /	mgul_0 rgyan_5 dang_11 
T02D1263:3a-22	rna rgyan dang /	rna_0 rgyan_4 dang_10 
T02D1263:3a-23	ska rags dang /	ska_0 rags_4 dang_9 
T02D1263:3a-24	phyag gdub dang /	phyag_0 gdub_6 dang_11 
T02D1263:3a-25	rgyan lngar ldan pas /	rgyan_0 lngar_6 ldan_12 ba_17 
T02D1263:3a-26	rdo rje dang dril bu thogs la /	rdo_0 rje_4 dang_8 'dril_13 bu_18 thogs_21 la_27 
T02D1263:3a-27	gong du smos pa'i mdun du 'dug la /	gong_0 du_5 smos_8 ba_13 mdun_18 du_23 'dug_26 la_31 
T02D1263:3a-28	lha mo goo r'im la sogs pa /	lha_0 mo_4 goo_7 r_11 la_16 sogs_19 ba_24 
T02D1263:3a-29	rigs bzhi'i ting nge 'dzin bzhi phyogs bzhir 'dug la /	rigs_0 bzhi_5 ting_12 nge_17 'dzin_21 bzhi_27 phyogs_32 bzhir_39 'dug_45 la_50 
T02D1263:3a-30	rdo rje dril bu thogs la mdo bskul bar bya'o //	rdo_0 rje_4 'dril_8 bu_13 thogs_16 la_22 mdo_25 skul_29 ba_35 byed_39 
T02D1263:3a-31	de yang bskul ba'i sngon du mchod pa bya ste /	de_0 yang_3 skul_8 ba_14 sngon_19 du_25 mchod_28 ba_34 byed_37 ste_41 
T02D1263:3a-32	goo r'i ting nge 'dzin can gyis /	goo_0 r_4 ting_8 nge_13 'dzin_17 can_23 gyis_27 
T02D1263:3a-33	aom badzra pushpe a'a: h'um /	aom_0 badzra_4 pushpe_11 a:_18 h_23 
T02D1263:3a-34	aom badzra dh'u pe a'a: h'um /	aom_0 badzra_4 dh_11 pe_16 a:_19 h_24 
T02D1263:3a-35	aom badzra d'i pe a'a: h'um /	aom_0 badzra_4 d_11 pe_15 a:_18 h_23 
T02D1263:3a-36	aom badzra gandhe a'a: h'um /	aom_0 badzra_4 gandhe_11 a:_18 h_23 
T02D1263:3a-37	aom badzra nee be tye a'a: h'um /	aom_0 badzra_4 nee_11 be_15 tye_18 a:_22 h_27 
T02D1263:3a-38	zhes bya ba'i mchod pa rnam pa lngas mchod de /	zhes_0 byed_5 ba_9 mchod_14 ba_20 rnam_23 ba_28 lngas_31 mchod_37 de_43 
T02D1263:3a-39	khyod ni rnal 'byor ma rnams bskor //	khyod_0 ni_6 rnal_9 'byor_14 ma_20 rnams_23 skor_29 
T02D1263:3a-40	zhes bya ba la sogs pas bstod do //	zhes_0 byed_5 ba_9 la_12 sogs_15 ba_20 bstod_24 do_30 
T02D1263:3a-41	de nas 'di skad ces bskul lo //	de_0 nas_3 'di_7 skad_11 ces_16 skul_20 lo_26 
T02D1263:3a-42	de bzhin gshegs pa kun zhi ba /	de_0 bzhin_3 gshegs_9 ba_16 kun_19 zhi_23 ba_27 
T02D1263:3a-43	de bzhin gshegs pa kun gyi gnas //	de_0 bzhin_3 gshegs_9 ba_16 kun_19 gyi_23 gnas_27 
T02D1263:3a-44	kun 'byung rdo rje sems dpa' yi //	kun_0 'byung_4 rdo_11 rje_15 sems_19 dpa'_24 yi_29 
T02D1263:3a-45	dkyil 'khor 'dren pa bshad du gsol //	dkyil_0 'khor_6 bgrang_12 ba_18 'chad_21 du_27 gsol_30 
T02D1263:3a-46	mtshan nyid thams cad yang dag rdzogs //	mtshan_0 nyid_7 thams_12 cad_18 yang_22 'dag_27 rdzogs_31 
T02D1263:3a-47	mtshan min thams cad yang dag spangs //	mtshan_0 min_7 thams_11 cad_17 yang_21 'dag_26 spong_30 
T02D1263:3a-48	kun du bzang po kun chen gyi //	kun_0 du_4 bzang_7 po_13 kun_16 chen_20 gyi_25 
T02D1263:3a-49	dkyil 'khor 'dren pa bshad du gsol //	dkyil_0 'khor_6 bgrang_12 ba_18 'chad_21 du_27 gsol_30 
T02D1263:3a-50	yang dag sangs rgyas mchog zhi ba //	yang_0 'dag_5 sangs_9 rgya_15 mchog_21 zhi_27 ba_31 
T02D1263:3a-51	ye shes spyod pa rnam par spyod //	ye_0 shes_3 spyod_8 ba_14 rnam_17 ba_22 spyod_26 
T02D1263:3a-52	rdo rje'i gsung ni kun 'byung ba //	rdo_0 rje_4 gsung_10 ni_16 kun_19 'byung_23 ba_30 
T02D1263:3a-53	dkyil 'khor 'dren pa bshad du gsol //	dkyil_0 'khor_6 bgrang_12 ba_18 'chad_21 du_27 gsol_30 
T02D1263:3a-54	sems can kun gyi sems chen po //	sems_0 can_5 kun_9 gyi_13 sems_17 chen_22 po_27 
T02D1263:3a-55	rang bzhin dag pa dri ma med //	rang_0 bzhin_5 'dag_11 ba_15 'dri_18 ma_22 med_25 
T02D1263:3b-0	rnam snang mdzad chen @3b 'byung ba yi //	rnam_0 snang_5 mdzad_11 chen_17 'byung_26 ba_33 yi_36 
T02D1263:3b-1	dkyil 'khor 'dren pa bshad du gsol //	dkyil_0 'khor_6 bgrang_12 ba_18 'chad_21 du_27 gsol_30 
T02D1263:3b-2	de nas gong du smos pa yi //	de_0 nas_3 gong_7 du_12 smos_15 ba_20 yi_23 
T02D1263:3b-3	phyag rgya lnga dang ldan pa yi //	phyag_0 rgya_6 lnga_11 dang_16 ldan_21 ba_26 yi_29 
T02D1263:3b-4	kye'i rdo rje bsgom pa des bgegs bsal bar bya ste /	kye_0 rdo_6 rje_10 bsgom_14 ba_20 des_23 bgegs_27 bsal_33 ba_38 byed_42 ste_46 
T02D1263:3b-5	rkang pa gnyis su h'um las sna tshogs rdo rje bsams la /	rkang_0 ba_6 gnyis_9 su_15 h_18 las_23 sna_27 tshogs_31 rdo_38 rje_42 bsams_46 la_52 
T02D1263:3b-6	mig g-yas ma las nyi ma'i dkyil 'khor g-yon du ta las zla ba'i dkyil 'khor bsams te /	mig_0 g-yas_4 ma_10 las_13 nyi_17 ma_21 dkyil_26 'khor_32 g-yon_38 du_44 ta_47 las_50 zla_54 ba_58 dkyil_63 'khor_69 bsams_75 te_81 
T02D1263:3b-7	rdo rje'i lta bas thams cad du bltas te /	rdo_0 rje_4 lta_10 ba_14 thams_18 cad_24 du_28 lta_31 te_37 
T02D1263:3b-8	de yang rab tu myur ba yis //	de_0 yang_3 rab_8 tu_12 myur_15 ba_20 yis_23 
T02D1263:3b-9	mig gi rdzi ma 'dren pa ni //	mig_0 gi_4 rdzi_7 ma_12 bgrang_15 ba_21 ni_24 
T02D1263:3b-10	'bar ba'i lta ba zhes su gsungs //	'bar_0 ba_5 lta_10 ba_14 zhes_17 su_22 gsungs_25 
T02D1263:3b-11	'gro ba thams cad dgug pa'o //	'gro_0 ba_5 thams_8 cad_14 'gugs_18 ba_23 
T02D1263:3b-12	zhes pa ltar bltas la /	zhes_0 ba_5 ltar_8 lta_13 la_19 
T02D1263:3b-13	lag pa g-yon gyis dril bu bzung zhing /	lag_0 ba_4 g-yon_7 gyis_13 'dril_18 bu_23 bzung_26 zhing_32 
T02D1263:3b-14	g-yas kyis rdo rje gsor la /	g-yas_0 kyis_6 rdo_11 rje_15 gsor_19 la_24 
T02D1263:3b-15	steng 'og tu legs par 'khyud nas /	steng_0 'og_6 tu_10 legs_13 ba_18 'khyud_22 nas_29 
T02D1263:3b-16	sa phyogs de ni gnas pa 'dis bskrad par bya'o //	sa_0 phyogs_3 de_10 ni_13 gnas_16 ba_21 'dis_24 skrod_29 ba_36 byed_40 
T02D1263:3b-17	sa phyogs 'dir ngas sems can gyi don brtsam gyis /	sa_0 phyogs_3 'dir_10 ngas_15 sems_20 can_25 gyi_29 don_33 brtsam_37 gyis_44 
T02D1263:3b-18	lha dang /	lha_0 dang_4 
T02D1263:3b-19	klu dang /	klu_0 dang_4 
T02D1263:3b-20	gnod sbyin dang /	gnod_0 sbyin_5 dang_11 
T02D1263:3b-21	dri za dang /	'dri_0 za_4 dang_7 
T02D1263:3b-22	'byung po dang /	'byung_0 po_7 dang_10 
T02D1263:3b-23	sha za mo dang /	sha_0 za_4 mo_7 dang_10 
T02D1263:3b-24	srin mo la sogs pa gang dag gnas pa'i bdag	srin_0 mo_5 la_8 sogs_11 ba_16 gang_19 'dag_24 gnas_28 ba_33 bdag_38 
T02D1263:3b-25	po myur du song shig / di ltar dpal he ru	po_0 myur_3 du_8 'gro_11 shig_16 ltar_26 dpal_31 he_36 ru_39 
T02D1263:3b-26	ka'i bka' thos nas /	ka_0 bka'_5 thos_10 nas_15 
T02D1263:3b-27	myur du dengs shig / gang dag mi 'gro ba de la /	myur_0 du_5 dengs_8 shig_14 gang_21 'dag_26 mi_30 'gro_33 ba_38 de_41 la_44 
T02D1263:3b-28	nga'i ye shes kyi rdo rje dang /	nga_0 ye_6 shes_9 kyi_14 rdo_18 rje_22 dang_26 
T02D1263:3b-29	kha tr'am ga 'dis spyi bo rnam pa brgyar 'gas	kha_0 tr_4 ga_10 'dis_13 spyi_18 'bo_23 rnam_26 ba_31 brgyar_34 'gas_41 
T02D1263:3b-30	par 'gyur ro zhes lan gsum du brjod la dbang	ba_0 'gyur_4 ro_10 zhes_13 lan_18 gsum_22 du_27 rjod_30 la_36 dbang_39 
T02D1263:3b-31	ldan gyi mtshams nas brtsams nas /	ldan_0 gyi_5 mtshams_9 nas_17 brtsams_21 nas_29 
T02D1263:3b-32	h'um mang po brjod cing lan gsum g-yas skor du bskor bar bya'o //	h_0 mang_5 po_10 rjod_13 cing_19 lan_24 gsum_28 g-yas_33 skor_39 du_44 skor_47 ba_53 byed_57 
T02D1263:3b-33	bskal pa'i me lta bu'i 'od zer rkang pa'i 'og	bskal_0 ba_6 me_11 lta_14 bu_18 'od_23 zer_27 rkang_31 ba_37 'og_42 
T02D1263:3b-34	nas byung bas gdug pa can rnams bsregs par gyur	nas_0 'byung_4 ba_10 gdug_14 ba_19 can_22 rnams_26 bsregs_32 ba_39 gyur_43 
T02D1263:3b-35	par / phan tshun 'byer bar 'gyur bar bsam mo //	ba_0 phan_6 tshun_11 'byer_17 ba_23 'gyur_27 ba_33 bsam_37 mo_42 
T02D1263:3b-36	de yang rol pa'i goms stabs brgyad pas gar bya'o //	de_0 yang_3 rol_8 ba_12 goms_17 stabs_22 brgyad_28 ba_35 gar_39 byed_43 
T02D1263:3b-37	rkang pa bskyod dang lag pa bskyod //	rkang_0 ba_6 skyod_9 dang_16 lag_21 ba_25 skyod_28 
T02D1263:3b-38	smin ma 'degs dang rab dgas phye //	smin_0 ma_5 'degs_8 dang_14 rab_19 'gas_23 'byed_28 
T02D1263:3b-39	cung zad ngo tsha zur mig dang //	cung_0 zad_5 ngo_9 tsha_13 zur_18 mig_22 dang_26 
T02D1263:3b-40	zla rgyas lta na dur ba dang //	zla_0 rgya_4 lta_10 na_14 dur_17 ba_21 dang_24 
T02D1263:3b-41	mig yangs gar ni byed 'gyur zhing //	mig_0 yangs_4 gar_10 ni_14 byed_17 'gyur_22 zhing_28 
T02D1263:3b-42	kha yi padma 'dzum dang bcas //	kha_0 yi_4 padma_7 'dzum_13 dang_19 'cha'_24 
T02D1263:3b-43	cung zad dmar ba'i mche ba 'chang //	cung_0 zad_5 dmar_9 ba_14 mche_19 ba_24 'chang_27 
T02D1263:3b-44	kunda na ltar dkar po'i phreng //	kunda_0 na_6 ltar_9 dkar_14 po_19 phreng_24 
T02D1263:3b-45	dpal ldan khrag 'thung rnal 'byor ches //	dpal_0 ldan_5 khrag_10 'thung_16 rnal_23 'byor_28 ches_34 
T02D1263:3b-46	sems can sgrol ba rmad du byung //	sems_0 can_5 sgrol_9 ba_15 rmad_18 du_23 'byung_26 
T02D1263:3b-47	de la sogs pa'i gar gyis ni //	de_0 la_3 sogs_6 ba_11 gar_16 gyis_20 ni_25 
T02D1263:3b-48	bgegs la sogs pa bskrad par bya //	bgegs_0 la_6 sogs_9 ba_14 skrod_17 ba_24 byed_28 
T02D1263:3b-49	de nas sngon du gsungs pa'i raksha'i sngags kyis /	de_0 nas_3 sngon_7 du_13 gsungs_16 ba_23 raksha_28 sngags_37 kyis_44 
T02D1263:3b-50	rdo rjes gzhi dang gur dang bla re la sogs pa bya'o //	rdo_0 rjes_4 gzhi_9 dang_14 gur_19 dang_23 bla_28 re_32 la_35 sogs_38 ba_43 byed_46 
T02D1263:4a-0	de ltar @4a * //	de_0 ltar_3 
T02D1263:4a-1	byas na dkyil 'khor gyi sa'i cha nyes pa dang	byed_0 na_5 dkyil_8 'khor_14 gyi_20 sa_24 cha_29 nyes_33 ba_38 dang_41 
T02D1263:4a-2	ldan pa yang nyes pa dag med par 'gyur ro	ldan_0 ba_5 yang_8 nyes_13 ba_18 'dag_21 med_25 ba_29 'gyur_33 ro_39 
T02D1263:4a-3	// bgegs bsal ba'i rim pa'o /	bgegs_3 bsal_9 ba_14 rim_19 ba_23 
T02D1263:4a-5	// / de nas ba'i rnam lnga dang ldan pa'i dri zhim po'i chu dang /	de_5 nas_8 ba_12 rnam_17 lnga_22 dang_27 ldan_32 ba_37 'dri_42 zhim_46 po_51 chu_56 dang_60 
T02D1263:4a-6	bdud rtsi lnga'i chus byugs la /	bdud_0 rtsi_5 lnga_10 chus_17 'byug_22 la_28 
T02D1263:4a-7	de'i steng dri'i thig le bya /	de_0 steng_5 'dri_11 thig_17 le_22 byed_25 
T02D1263:4a-8	thig le'i steng me tog bzhag la /	thig_0 le_5 steng_10 me_16 tog_19 'jog_23 la_29 
T02D1263:4a-9	sna tshogs padmar bsam /	sna_0 tshogs_4 padmar_11 bsam_18 
T02D1263:4a-10	padma'i steng du aom las nyi ma'i dkyil 'khor bsam /	padma_0 steng_8 du_14 aom_17 las_21 nyi_25 ma_29 dkyil_34 'khor_40 bsam_46 
T02D1263:4a-11	de'i steng du rang gi sngags h'um gam tsam bam gham pam sam lam dam /	de_0 steng_5 du_11 rang_14 gi_19 sngags_22 h_29 gam_34 tsam_38 bam_43 gham_47 pam_52 sam_56 lam_60 dam_64 
T02D1263:4a-12	rnal 'byor gyi lha'i 'khor lo bskyed la /	rnal_0 'byor_5 gyi_11 lha_15 'khor_21 lo_27 skyed_30 la_37 
T02D1263:4a-13	rang rang gi gdan de nyid la bzhugs par bsam /	rang_0 rang_5 gi_10 gdan_13 de_18 nyid_21 la_26 bzhugs_29 ba_36 bsam_40 
T02D1263:4a-14	de nas ye shes sems dpa' 'khor dang bcas pa spyan drang bar bya ste /	de_0 nas_3 ye_7 shes_10 sems_15 dpa'_20 'khor_25 dang_31 'cha'_36 ba_41 spyan_44 'dren_50 ba_56 byed_60 ste_64 
T02D1263:4a-15	goo r'i dza: zhes bskul bas /	goo_0 r_4 dza:_8 zhes_13 skul_18 ba_24 
T02D1263:4a-16	goo r'i las sprul pa'i goo r'i lcags kyu can mang po 'phros pas /	goo_0 r_4 las_8 sprul_12 ba_18 goo_23 r_27 lcags_31 kyu_37 can_41 mang_45 po_50 'phro_53 ba_60 
T02D1263:4a-17	rang bzhin gyi dkyil 'khor nas kye'i rdo rje 'khor dang bcas pa spyan drangs la /	rang_0 bzhin_5 gyi_11 dkyil_15 'khor_21 nas_27 kye_31 rdo_37 rje_41 'khor_45 dang_51 'cha'_56 ba_61 spyan_64 drangs_70 la_77 
T02D1263:4a-18	rdo rje bla re'i steng na bzhugs pa la /	rdo_0 rje_4 bla_8 re_12 steng_17 na_23 bzhugs_26 ba_33 la_36 
T02D1263:4a-19	dro kasha na dang /	dro_0 kasha_4 na_10 dang_13 
T02D1263:4a-20	aargha dang /	aargha_0 dang_7 
T02D1263:4a-21	aanytsa dang /	aanytsa_0 dang_8 
T02D1263:4a-22	bi dhi dang /	bi_0 dhi_3 dang_7 
T02D1263:4a-23	spos dang /	spros_0 dang_5 
T02D1263:4a-24	me tog la sogs pa rnal 'byor pa rnams kyis mchod /	me_0 tog_3 la_7 sogs_10 ba_15 rnal_18 'byor_23 ba_29 rnams_32 kyis_38 mchod_43 
T02D1263:4a-25	lha mo brgyad kyi mchod pas kyang mchod /	lha_0 mo_4 brgyad_7 kyi_14 mchod_18 ba_24 kyang_28 mchod_34 
T02D1263:4a-26	de nas tsoo r'i h'um zhes pas /	de_0 nas_3 tsoo_7 r_12 h_16 zhes_21 ba_26 
T02D1263:4a-27	tsoo r'i zhags pa can gyis gzhal yas khang gi	tsoo_0 r_5 zhags_9 ba_15 can_18 gyis_22 'jal_27 yas_33 khang_37 gi_43 
T02D1263:4a-28	nang du gzhug / be t'a l'i bam gyis de	nang_0 du_5 'jug_8 be_16 t_19 l_23 bam_27 gyis_31 de_36 
T02D1263:4a-29	bzhin du bcing / ghasma r'i ho: sa dgyes par byas te /	bzhin_0 du_6 'ching_9 ghasma_17 r_24 ho:_28 sa_32 dgyes_35 ba_41 byed_45 te_50 
T02D1263:4a-30	ye shes kyi 'khor lo gcig tu bya'o //	ye_0 shes_3 kyi_8 'khor_12 lo_18 gcig_21 tu_26 byed_29 
T02D1263:4a-31	de nas phyi'i mchod pas mchod /	de_0 nas_3 phyi_7 mchod_14 ba_20 mchod_24 
T02D1263:4a-32	nang gi mchod pas kyang mchod /	nang_0 gi_5 mchod_8 ba_14 kyang_18 mchod_24 
