T02D1228:34a-0	@34a # // rgya gar skad du /	rgya_10 gar_15 skad_19 du_24 
T02D1228:34a-1	shr'i he badzra ho ma bi dhi /	shr_0 he_6 badzra_9 ho_16 ma_19 bi_22 dhi_25 
T02D1228:34a-2	bod skad du /	'bod_0 skad_4 du_9 
T02D1228:34a-3	dpal kye rdo rje las sbyin sreg gi cho ga /	dpal_0 kye_5 rdo_9 rje_13 las_17 sbyin_21 sreg_27 gi_32 cho_35 ga_39 
T02D1228:34a-4	kye rdo rje la phyag 'tshal lo //	kye_0 rdo_4 rje_8 la_12 phyag_15 'tshal_21 lo_28 
T02D1228:34a-5	dpal ldan mkha' 'gro 'gro ba'i mgon //	dpal_0 ldan_5 mkha'_10 'gro_16 'gro_21 ba_26 mgon_31 
T02D1228:34a-6	lha mo dang bcas 'khor lo la //	lha_0 mo_4 dang_7 'cha'_12 'khor_17 lo_23 la_26 
T02D1228:34a-7	phyag 'tshal nas ni sbyin sreg gi //	phyag_0 'tshal_6 nas_13 ni_17 sbyin_20 sreg_26 gi_31 
T02D1228:34a-8	rim pa yang dag bshad par bya //	rim_0 ba_4 yang_7 'dag_12 'chad_16 ba_22 byed_26 
T02D1228:34a-9	rgyal bas bya ba'i rgyud las ni //	rgyal_0 ba_6 byed_10 ba_14 brgyud_19 las_25 ni_29 
T02D1228:34a-10	las ni rnam pa bzhir gsungs pa /	las_0 ni_4 rnam_7 ba_12 bzhir_15 gsungs_21 ba_28 
T02D1228:34a-11	zhi dang rgyas dang dbang mngon spyod //	zhi_0 dang_4 rgya_9 dang_15 dbang_20 mngon_26 spyod_32 
T02D1228:34a-12	de yi rim pa ma nor bar //	de_0 yi_3 rim_6 ba_10 ma_13 nor_16 ba_20 
T02D1228:34a-13	mdor bsdus rim pa bshad par bya //	mdor_0 sdud_5 rim_11 ba_15 'chad_18 ba_24 byed_28 
T02D1228:34a-14	zhal bsro cho ga bya ba la //	zhal_0 bsro_5 cho_10 ga_14 byed_17 ba_21 la_24 
T02D1228:34a-15	rgyas pa'i las ni mchog yin te /	rgya_0 ba_6 las_11 ni_15 mchog_18 yin_24 te_28 
T02D1228:34a-16	rgyas nas brtsams te las rnams kyi //	rgya_0 nas_6 brtsams_10 te_18 las_21 rnams_25 kyi_31 
T02D1228:34a-17	rim pa rab tu bshad par bya //	rim_0 ba_4 rab_7 tu_11 'chad_14 ba_20 byed_24 
T02D1228:34a-18	me thab rim pa bshad bya ste /	me_0 thab_3 rim_8 ba_12 'chad_15 byed_21 ste_25 
T02D1228:34a-19	rgyas pa pa la ni gru bzhi pa //	rgya_0 ba_6 ba_9 la_12 ni_15 gru_18 bzhi_22 ba_27 
T02D1228:34a-20	zhi ba la ni zlum por 'dod //	zhi_0 ba_4 la_7 ni_10 zlum_13 por_18 'dod_22 
T02D1228:34a-21	dbang la gzhu yi dbyibs can te //	dbang_0 la_6 gzhu_9 yi_14 dbyibs_17 can_24 te_28 
T02D1228:34a-22	gsod pa la ni gru gsum shis //	gsod_0 ba_5 la_8 ni_11 gru_14 gsum_18 shis_23 
T02D1228:34a-23	yang na las kun byed pa'i mchog / khru gang dang ni khru do nyid //	yang_0 na_5 las_8 kun_12 byed_16 ba_21 mchog_26 khru_34 gang_39 dang_44 ni_49 khru_52 do_57 nyid_60 
T02D1228:34a-24	rgyas pa'i steng dang 'og tu 'dod //	rgya_0 ba_6 steng_11 dang_17 'og_22 tu_26 'dod_29 
T02D1228:34a-25	khru gang dang ni de yi phyed //	khru_0 gang_5 dang_10 ni_15 de_18 yi_21 phyed_24 
T02D1228:34a-26	zhi ba'i steng dang 'og tu 'dod //	zhi_0 ba_4 steng_9 dang_15 'og_20 tu_24 'dod_27 
T02D1228:34a-27	gzhu la bzhi bcu nyi shu kha //	gzhu_0 la_5 bzhi_8 'chu_13 nyi_17 shu_21 kha_25 
T02D1228:34a-28	zabs su sor bcu dbang gi yin //	zabs_0 su_5 sor_8 'chu_12 dbang_16 gi_22 yin_25 
T02D1228:34a-29	ngos gsum sor ni nyi shu la //	ngos_0 gsum_5 sor_10 ni_14 nyi_17 shu_21 la_25 
T02D1228:34a-30	zabs su de phyed gsod la 'dod //	zabs_0 su_5 de_8 phyed_11 gsod_17 la_22 'dod_25 
T02D1228:34a-31	rgyas pa kha dog ser po ste //	rgya_0 ba_6 kha_9 dog_13 ser_17 po_21 ste_24 
T02D1228:34a-32	zhi ba dkar por shes par bya //	zhi_0 ba_4 dkar_7 por_12 shes_16 ba_21 byed_25 
T02D1228:34a-33	dbang la dmar por rab tu grags //	dbang_0 la_6 dmar_9 por_14 rab_18 tu_22 grags_25 
T02D1228:34a-34	de bzhin gsod la nag por 'dod//	de_0 bzhin_3 gsod_9 la_14 nag_17 por_21 
T02D1228:34b-0	@34b dgug pa'i las ni dbang du bya //	'gugs_5 ba_10 las_15 ni_19 dbang_22 du_28 byed_31 
T02D1228:34b-1	mngon spyod du ni zhe sdang sogs //	mngon_0 spyod_6 du_12 ni_15 zhe_18 sdang_22 sogs_28 
T02D1228:34b-2	rgyas pa dbus su rin chen te //	rgya_0 ba_6 dbus_9 su_14 rin_17 chen_21 te_26 
T02D1228:34b-3	shar du rdo rje lhor 'khor lo //	'char_0 du_5 rdo_8 rje_12 lhor_16 'khor_21 lo_27 
T02D1228:34b-4	nub tu padma ral gri byang //	nub_0 tu_4 padma_7 ral_13 gri_17 byang_21 
T02D1228:34b-5	sor bzhi 'gyed par byas pa'i phyir //	sor_0 bzhi_4 'gyed_9 ba_15 byed_19 ba_24 phyir_29 
T02D1228:34b-6	kha khyer sor bzhi rdo rjes bskor //	kha_0 'khyer_4 sor_10 bzhi_14 rdo_19 rjes_23 skor_28 
T02D1228:34b-7	phyi rol sor bzhi por la yang //	phyi_0 rol_5 sor_9 bzhi_13 por_18 la_22 yang_25 
T02D1228:34b-8	padma'i phreng ba gtang bar bya //	padma_0 phreng_8 ba_15 gtong_18 ba_24 byed_28 
T02D1228:34b-9	zhi ba'i phyag mtshan rim pa yang //	zhi_0 ba_4 phyag_9 mtshan_15 rim_22 ba_26 yang_29 
T02D1228:34b-10	dbus su 'khor lo shar rdo rje //	dbus_0 su_5 'khor_8 lo_14 'char_17 rdo_22 rje_26 
T02D1228:34b-11	lho ru rin chen nub padma //	lho_0 ru_4 rin_7 chen_11 nub_16 padma_20 
T02D1228:34b-12	byang du ral gri shes par bya //	byang_0 du_6 ral_9 gri_13 shes_17 ba_22 byed_26 
T02D1228:34b-13	tsandan dkar pos byugs pa'o //	tsandan_0 dkar_8 pos_13 'byug_17 ba_23 
T02D1228:34b-14	dbang gi phyag mtshan rim bshad bya //	dbang_0 gi_6 phyag_9 mtshan_15 rim_22 'chad_26 byed_32 
T02D1228:34b-15	kha khyer spyi dang mthun pa ste //	kha_0 'khyer_4 spyi_10 dang_15 mthun_20 ba_26 ste_29 
T02D1228:34b-16	dbus la rdo rje rab dang /	dbus_0 la_5 rdo_8 rje_12 rab_16 dang_20 
T02D1228:34b-17	dbus su padma 'dab brgyad bya //	dbus_0 su_5 padma_8 'dab_14 brgyad_19 byed_26 
T02D1228:34b-18	phyi ma spyir mthun dmar pos byug / mngon spyod mtshan nyid bshad bya ste //	phyi_0 ma_5 spyir_8 mthun_14 dmar_20 pos_25 'byug_29 mngon_36 spyod_42 mtshan_48 nyid_55 'chad_60 byed_66 ste_70 
T02D1228:34b-19	kha khyer sor gsum rdo rjes bskor //	kha_0 'khyer_4 sor_10 gsum_14 rdo_19 rjes_23 skor_28 
T02D1228:34b-20	dbus su ral gri phyi ma ni //	dbus_0 su_5 ral_8 gri_12 phyi_16 ma_21 ni_24 
T02D1228:34b-21	bla ma'i zhal shes nag pos byug / rgyas pa shar du bltas la bya /	bla_0 ma_4 zhal_9 shes_14 nag_19 pos_23 'byug_27 rgya_34 ba_40 'char_43 du_48 lta_51 la_57 byed_60 
T02D1228:34b-22	zhi ba la ni byang du 'dod /	zhi_0 ba_4 la_7 ni_10 byang_13 du_19 'dod_22 
T02D1228:34b-23	dbang dang bskrad pa nub tu 'dod //	dbang_0 dang_6 skrod_11 ba_18 nub_21 tu_25 'dod_28 
T02D1228:34b-24	drag po'i las la lho ru'o //	drag_0 po_5 las_10 la_14 lho_17 ru_21 
T02D1228:34b-25	rgyas pa la ni nang par bya //	rgya_0 ba_6 la_9 ni_12 nang_15 ba_20 byed_24 
T02D1228:34b-26	zhi ba nyi ma phyed na'o //	zhi_0 ba_4 nyi_7 ma_11 phyed_14 na_20 
T02D1228:34b-27	dbang ni nyi nub nam phyed drag / ces gang gsungs pa ni me thab kyi rim pa'o //	dbang_0 ni_6 nyi_9 nub_13 nam_17 phyed_21 drag_27 ces_34 gang_38 gsungs_43 ba_50 ni_53 me_56 thab_59 kyi_64 rim_68 ba_72 
T02D1228:34b-28	mchod rdzas sreg rdzas rim zhes bya //	mchod_0 rdzas_6 sreg_12 rdzas_17 rim_23 zhes_27 byed_32 
T02D1228:34b-29	sngags mkhan g-yon du dri me tog / dung phor bkang ba gzhag par bya //	sngags_0 mkhan_7 g-yon_13 du_19 'dri_22 me_26 tog_29 dung_35 phor_40 'geng_45 ba_51 'jog_54 ba_60 byed_64 
T02D1228:34b-30	yon chab snod ni gser la sogs //	yon_0 chab_4 snod_9 ni_14 gser_17 la_22 sogs_25 
T02D1228:34b-31	chu dang me tog gis bkad gzhag / med na sa las byas pa'ang rung //	chu_0 dang_4 me_9 tog_12 gis_16 'gad_20 'jog_25 med_33 na_37 sa_40 las_43 byed_47 ba_52 rung_59 
T02D1228:34b-32	shing ni mi shes spang bar bya //	shing_0 ni_6 mi_9 shes_12 spong_17 ba_23 byed_27 
T02D1228:34b-33	dgang gzar blugs gzar mar mdun du //	'geng_0 gzar_6 blugs_11 gzar_17 mar_22 mdun_26 du_31 
T02D1228:34b-34	g-yas su dris bkang snod du ni //	g-yas_0 su_6 'dri_9 'geng_14 snod_20 du_25 ni_28 
T02D1228:34b-35	ku sha bcug la gzhag par bya //	ku_0 sha_3 'jug_7 la_12 'jog_15 ba_21 byed_25 
T02D1228:34b-36	las kun byed pa'i bum pa yang //	las_0 kun_4 byed_8 ba_13 bum_18 ba_22 yang_25 
T02D1228:34b-37	tshul bzhin du ni gzhag par bya //	tshul_0 bzhin_6 du_12 ni_15 'jog_18 ba_24 byed_28 
T02D1228:34b-38	'byung po'i gtor ma mchog kyang gzhag / til sogs	'byung_0 po_7 'thor_12 ma_17 mchog_20 kyang_26 'jog_32 til_40 sogs_44 
T02D1228:34b-39	sreg rdzas rim bzhin gzhag / rgyas la zho dang	sreg_0 rdzas_5 rim_11 bzhin_15 'jog_21 rgya_29 la_35 zho_38 dang_42 
T02D1228:34b-40	zhi la til // dbang dang dgug la autpala dmar //	zhi_0 la_4 til_7 dbang_14 dang_20 'gugs_25 la_30 autpala_33 dmar_41 
T02D1228:34b-41	drag po la sogs tsher can shing //	drag_0 po_5 la_8 sogs_11 tsher_16 can_22 shing_26 
T02D1228:34b-42	phyi ma 'og nas bshad pa bzhin //	phyi_0 ma_5 'og_8 nas_12 'chad_16 ba_22 bzhin_25 
T02D1228:34b-43	thog mar mar dang tha mar mar //	thogs_0 mar_5 mar_9 dang_13 tha_18 mar_22 mar_26 
T02D1228:34b-44	mchod rdzas dang sreg rdzas kyi rim pa'o //	mchod_0 rdzas_6 dang_12 sreg_17 rdzas_22 kyi_28 rim_32 ba_36 
T02D1228:34b-45	de rnams byin gyis brlab pa ni //	de_0 rnams_3 byin_9 gyis_14 brlab_19 ba_25 ni_28 
T02D1228:34b-46	rdo rjes rag pa de nyid ni //	rdo_0 rjes_4 rag_9 ba_13 de_16 nyid_19 ni_24 
T02D1228:34b-47	brjod pas dri ma dag nas ni //	rjod_0 ba_6 'dri_10 ma_14 'dag_17 nas_21 ni_25 
T02D1228:34b-48	nyi ma'i shel ltar dag par bsam //	nyi_0 ma_4 shel_9 ltar_14 'dag_19 ba_23 bsam_27 
T02D1228:35a-0	rdzas byin gyis brlab @35a * //	rdzas_0 byin_6 gyis_11 brlab_16 
T02D1228:35a-1	pa'i rim pa'o //	ba_0 rim_5 ba_9 
T02D1228:35a-2	rlon shing 'dab bcas rtse las byung //	rlon_0 shing_5 'dab_11 'cha'_16 rtse_21 las_26 'byung_30 
T02D1228:35a-3	srid du mdzub gang sbom chag gang //	srid_0 du_5 mdzub_8 gang_14 sbom_19 'chag_24 gang_29 
T02D1228:35a-4	sbrang rtsi dang ni mar gyis byug / tsandan dkar po'i chu la spangs //	sbrang_0 rtsi_7 dang_12 ni_17 mar_20 gyis_24 'byug_29 tsandan_36 dkar_44 po_49 chu_54 la_58 spong_61 
T02D1228:35a-5	rtse gcig zhi ba'i las la dbul //	rtse_0 gcig_5 zhi_10 ba_14 las_19 la_23 'bul_26 
T02D1228:35a-6	srid du khru gang sboms su ni //	srid_0 du_5 khru_8 gang_13 sboms_18 su_24 ni_27 
T02D1228:35a-7	chag gang pa ni rab tu bzang /	'chag_0 gang_5 ba_10 ni_13 rab_16 tu_20 bzang_23 
T02D1228:35a-8	yal ga dbus kyi cha las byung //	yal_0 ga_4 dbus_7 kyi_12 cha_16 las_20 'byung_24 
T02D1228:35a-9	zho dang mar dang ser po'i dris //	zho_0 dang_4 mar_9 dang_13 ser_18 po_22 'dri_27 
T02D1228:35a-10	spangs pa rtse gcig rgyas pa la'o //	spong_0 ba_7 rtse_10 gcig_15 rgya_20 ba_26 la_29 
T02D1228:35a-11	sor lnga 'dab bcas sbom chag gang //	sor_0 lnga_4 'dab_9 'cha'_14 sbom_19 'chag_24 gang_29 
T02D1228:35a-12	yungs mar bdud rtsi lnga la sogs //	yungs_0 mar_6 bdud_10 rtsi_15 lnga_20 la_25 sogs_28 
T02D1228:35a-13	spangs pa dbang gi las la shis //	spong_0 ba_7 dbang_10 gi_16 las_19 la_23 shis_26 
T02D1228:35a-14	srid du sor bzhi tsher ma can //	srid_0 du_5 sor_8 bzhi_12 tsher_17 ma_23 can_26 
T02D1228:35a-15	mi rus dur khrod thal chen dang //	mi_0 rus_3 dur_7 khrod_11 thal_17 chen_22 dang_27 
T02D1228:35a-16	dug la sogs pa'i chus spangs pa'o //	dug_0 la_4 sogs_7 ba_12 chus_17 spong_22 ba_29 
T02D1228:35a-17	mngon spyod dag la dbul bar rigs //	mngon_0 spyod_6 'dag_12 la_16 'bul_19 ba_24 rigs_28 
T02D1228:35a-18	yam shing gi rim pa'o //	yam_0 shing_4 gi_10 rim_13 ba_17 
T02D1228:35a-19	de nas bud shing rim pa bshad //	de_0 nas_3 'bud_7 shing_11 rim_17 ba_21 'chad_24 
T02D1228:35a-20	p'a la sha dang n+ya gro sogs //	p_0 la_4 sha_7 dang_11 n_16 ya_18 gro_21 sogs_25 
T02D1228:35a-21	las kyi rjes su mthun par bya //	las_0 kyi_4 rjes_8 su_13 mthun_16 ba_22 byed_26 
T02D1228:35a-22	yang na 'o ma can shing mchog / de yang las dang rjes mthun bya //	yang_0 na_5 'o_8 ma_11 can_14 shing_18 mchog_24 de_32 yang_35 las_40 dang_44 rjes_49 mthun_54 byed_60 
T02D1228:35a-23	bud shing rim pa mdor bstan pa'o //	'bud_0 shing_4 rim_10 ba_14 mdor_17 ston_22 ba_28 
T02D1228:35a-24	de nas slob dpon phyag rgya lnga dang ldan pas /	de_0 nas_3 slob_7 dpon_12 phyag_17 rgya_23 lnga_28 dang_33 ldan_38 ba_43 
T02D1228:35a-25	bla ma mchod pa nas brtsams te /	bla_0 ma_4 mchod_7 ba_13 nas_16 brtsams_20 te_28 
T02D1228:35a-26	ting nge 'dzin rdzogs pa dang /	ting_0 nge_5 'dzin_9 rdzogs_15 ba_22 dang_25 
T02D1228:35a-27	bdag nyid kyi dkyil 'khor la /	bdag_0 nyid_5 kyi_10 dkyil_14 'khor_20 la_26 
T02D1228:35a-28	ku shas bsang gtor bya /	ku_0 shas_3 bsang_8 'thor_14 byed_19 
T02D1228:35a-29	zhal bshal dang /	zhal_0 bshal_5 dang_11 
T02D1228:35a-30	aargham dang /	aargham_0 dang_8 
T02D1228:35a-31	zhabs bsil dang /	zhabs_0 bsil_6 dang_11 
T02D1228:35a-32	mchod pa rnam pa lngas mchod /	mchod_0 ba_6 rnam_9 ba_14 lngas_17 mchod_23 
T02D1228:35a-33	phyag rgya'i mchod pa dang /	phyag_0 rgya_6 mchod_13 ba_19 dang_22 
T02D1228:35a-34	phyag btsal bar bya'o //	phyag_0 btsal_6 ba_12 byed_16 
T02D1228:35a-35	bdag gzi byin bskyed pa'i rim pa'o //	bdag_0 gzi_5 byin_9 skyed_14 ba_21 rim_26 ba_30 
T02D1228:35a-36	de nas rdzas rnams thams cad la /	de_0 nas_3 rdzas_7 rnams_13 thams_19 cad_25 la_29 
T02D1228:35a-37	bsang gtor lan gsum byas nas su //	bsang_0 'thor_6 lan_11 gsum_15 byed_20 nas_25 su_29 
T02D1228:35a-38	las dang rjes mthun me blangs nas //	las_0 dang_4 rjes_9 mthun_14 me_20 blangs_23 nas_30 
T02D1228:35a-39	rlung yab kyis ni sbar bar bya //	rlung_0 yab_6 kyis_10 ni_15 sbor_18 ba_23 byed_27 
T02D1228:35a-40	spar ba'i sngags ni 'di yin te //	spor_0 ba_5 sngags_10 ni_17 'di_20 yin_24 te_28 
T02D1228:35a-41	aom dzv'a la dzv'a la h'um phat /	aom_0 dzv_4 la_10 dzv_13 la_19 h_22 phat_27 
T02D1228:35a-42	mang brjod legs par sbar nas ni //	mang_0 rjod_5 legs_11 ba_16 sbor_20 nas_25 ni_29 
T02D1228:35a-43	thab khung bud shing brdzangs pa la //	thab_0 khung_5 'bud_11 shing_15 brdzangs_21 ba_30 la_33 
T02D1228:35a-44	gzhung bzhin du ni me gzhug go //	gzhung_0 bzhin_7 du_13 ni_16 me_19 'jug_22 go_28 
T02D1228:35a-45	mar gyis gzi byin bskyed byas la //	mar_0 gyis_4 gzi_9 byin_13 skyed_18 byed_25 la_30 
T02D1228:35a-46	dge dang mi dge'i mtshan brtag go //	dge_0 dang_4 mi_9 dge_12 mtshan_18 rtog_25 go_31 
T02D1228:35a-47	me spar ba'i rim pa'o //	me_0 spor_3 ba_8 rim_13 ba_17 
T02D1228:35a-48	aom badzra a'a yu she sv'a h'a //	aom_0 badzra_4 a_11 yu_15 she_18 sv_22 h_27 
T02D1228:35a-49	'dis ni ku sha byin brlabs nas //	'dis_0 ni_5 ku_8 sha_11 byin_15 brlabs_20 nas_27 
T02D1228:35a-50	shar du rtse bstan dang po yin //	'char_0 du_5 rtse_8 ston_13 dang_19 po_24 yin_27 
T02D1228:35a-51	lho dang nub byang de bzhin rtse //	lho_0 dang_4 nub_9 byang_13 de_19 bzhin_22 rtse_28 
T02D1228:35a-52	bstan te bkram pa'i rim pa'o //	ston_0 te_6 'grem_9 ba_15 rim_20 ba_24 
T02D1228:35a-53	ku sha dgram pa'i rim pa mdor bstan pa'o //	ku_0 sha_3 'grem_7 ba_13 rim_18 ba_22 mdor_25 ston_30 ba_36 
T02D1228:35a-54	sngon du bsgom pa'i rim pa'o //	sngon_0 du_6 bsgom_9 ba_15 rim_20 ba_24 
T02D1228:35b-0	nam mkha'i @35b khams su bha ga bsam //	nam_0 mkha_4 khams_16 su_22 bha_25 ga_29 bsam_32 
T02D1228:35b-1	dbus su h'um bskyed mchod rten bsam //	dbus_0 su_5 h_8 skyed_13 mchod_20 rten_26 bsam_31 
T02D1228:35b-2	las dang rjes su mthun pa yi //	las_0 dang_4 rjes_9 su_14 mthun_17 ba_23 yi_26 
T02D1228:35b-3	de yi dbus su thab khung bsam //	de_0 yi_3 dbus_6 su_11 thab_14 khung_19 bsam_25 
T02D1228:35b-4	dbus su bam bskyed padma la //	dbus_0 su_5 bam_8 skyed_12 padma_19 la_25 
T02D1228:35b-5	de dbus nyi ma'i dkyil 'khor bsam //	de_0 dbus_3 nyi_8 ma_12 dkyil_17 'khor_23 bsam_29 
T02D1228:35b-6	de steng mngon par byang chub pas //	de_0 steng_3 mngon_9 ba_15 byang_19 chub_25 ba_30 
T02D1228:35b-7	rdo rje sems dpa' yab yum bsgom //	rdo_0 rje_4 sems_8 dpa'_13 yab_18 yum_22 bsgom_26 
T02D1228:35b-8	'dod chags stobs kyis 'od du zhu //	'dod_0 chags_5 stobs_11 kyis_17 'od_22 du_26 'ju_29 
T02D1228:35b-9	'od las h'um dang ram du gyur //	'od_0 las_4 h_8 dang_13 ram_18 du_22 gyur_25 
T02D1228:35b-10	de gyur ma lha yab yum bsam //	de_0 gyur_3 ma_8 lha_11 yab_15 yum_19 bsam_23 
T02D1228:35b-11	las dang rjes su mthun pa'i mdog / zhal gsum pa la phyag drug pa //	las_0 dang_4 rjes_9 su_14 mthun_17 ba_23 mdog_28 zhal_35 gsum_40 ba_45 la_48 phyag_51 drug_57 ba_62 
T02D1228:35b-12	rang dang 'dra ba'i shes rab 'khyud //	rang_0 dang_5 'dra_10 ba_15 shes_20 rab_25 'khyud_29 
T02D1228:35b-13	g-yas na gundhe mchog sbyin bsnams //	g-yas_0 na_6 gundhe_9 mchog_16 sbyin_22 snom_28 
T02D1228:35b-14	g-yon na se'u 'bru bgrang phreng mtha' //	g-yon_0 na_6 se_9 'bru_14 bgrong_19 phreng_26 mtha'_33 
T02D1228:35b-15	gsus 'dir ral pa'i dbu rgyan can //	gsus_0 'dir_5 ral_10 ba_14 dbu_19 rgyan_23 can_29 
T02D1228:35b-16	rigs bdag cod pan mchod phyir thogs //	rigs_0 bdag_5 cod_10 pan_14 mchod_18 phyir_24 thogs_30 
T02D1228:35b-17	de yi thugs kar bsam pa ni //	de_0 yi_3 thugs_6 kar_12 bsam_16 ba_21 ni_24 
T02D1228:35b-18	sna tshogs pad steng gru gsum me //	sna_0 tshogs_4 pad_11 steng_15 gru_21 gsum_25 me_30 
T02D1228:35b-19	de yi steng du h'um dang dza: //	de_0 yi_3 steng_6 du_12 h_15 dang_20 dza:_25 
T02D1228:35b-20	lce la yi ge ram bsam mo //	lce_0 la_4 yi_7 ge_10 ram_13 bsam_17 mo_22 
T02D1228:35b-21	bsang gtor nas brtsams phyag 'tshal sogs //	bsang_0 'thor_6 nas_11 brtsams_15 phyag_23 'tshal_29 sogs_36 
T02D1228:35b-22	de la mchod pa dbul bar bya'o //	de_0 la_3 mchod_6 ba_12 'bul_15 ba_20 byed_24 
T02D1228:35b-23	dam tshig sems dpa'i me lha'i rim pa'o //	dam_0 tshig_4 sems_10 dpa_15 me_21 lha_24 rim_30 ba_34 
T02D1228:35b-24	aom aagna ye ma h'a te dza /	aom_0 aagna_4 ye_10 ma_13 h_16 te_20 dza_23 
T02D1228:35b-25	sarba karm'a bra s'a dha ka /	sarba_0 karm_6 bra_13 s_17 dha_21 ka_25 
T02D1228:35b-26	ka ru ni kri ta sarba /	ka_0 ru_3 ni_6 kri_9 ta_13 sarba_16 
T02D1228:35b-27	a'asmin sanni hi tv'a bha ba ye shes sems dpa' dgug pa'o //	a_0 sanni_8 hi_14 tv_17 bha_22 ba_26 ye_29 shes_32 sems_37 dpa'_42 'gugs_47 ba_52 
T02D1228:35b-28	rang gi mdun du bltas nas ni /	rang_0 gi_5 mdun_8 du_13 lta_16 nas_22 ni_26 
T02D1228:35b-29	bsang gtor nas brtsams phyag 'tshal mtha' //	bsang_0 'thor_6 nas_11 brtsams_15 phyag_23 'tshal_29 mtha'_36 
T02D1228:35b-30	phyag nas rab tu bstim par bya //	phyag_0 nas_6 rab_10 tu_14 stim_17 ba_23 byed_27 
T02D1228:35b-31	sngags 'dis dgyes par bzhugs su gsol //	sngags_0 'dis_7 dgyes_12 ba_18 bzhugs_22 su_29 gsol_32 
T02D1228:35b-32	sarb'a n+yee par than tsa si ti ham ga tsa ha bya ba ka /	sarb_0 n_7 yee_9 ba_13 than_17 tsa_22 si_26 ti_29 ham_32 ga_36 tsa_39 ha_43 byed_46 ba_50 ka_53 
T02D1228:35b-33	aa ka mu ye tha ka le /	aa_0 ka_3 mu_6 ye_9 tha_12 ka_16 le_19 
T02D1228:35b-34	sarba siddhi ku ru sha me me dza:h'um bam ho: //	sarba_0 siddhi_6 ku_13 ru_16 sha_19 me_23 me_26 dza:h_29 bam_38 ho:_42 
T02D1228:35b-35	bka' lung gis gar dang ldan par bskul bar bya /	bka'_0 lung_5 gis_10 gar_14 dang_18 ldan_23 ba_28 skul_32 ba_38 byed_42 
T02D1228:35b-36	goo r'i lcags kyus bkug nas ni /	goo_0 r_4 lcags_8 kyus_14 'gugs_19 nas_24 ni_28 
T02D1228:35b-37	tsoo r'i ma yis zhags pas gzhug / lcags sgrog gis bsdams be t'a l'i //	tsoo_0 r_5 ma_9 yis_12 zhags_16 ba_22 'jug_26 lcags_34 sgrog_40 gis_46 sdom_50 be_57 t_60 l_64 
T02D1228:35b-38	dril bus mnyes byed ghasma r'i //	'dril_0 'bud_5 mnyes_9 byed_15 ghasma_20 r_27 
T02D1228:35b-39	gnyis su med par bstims nas ni //	gnyis_0 su_6 med_9 ba_13 stim_17 nas_24 ni_28 
T02D1228:35b-40	bsang gtor nas brtsams mchod pa dbul //	bsang_0 'thor_6 nas_11 brtsams_15 mchod_23 ba_29 'bul_32 
T02D1228:35b-41	dam tshig gi me lha la ye shes kyi me lha gzhug pa'i rim pa'o //	dam_0 tshig_4 gi_10 me_13 lha_16 la_20 ye_23 shes_26 kyi_31 me_35 lha_38 'jug_42 ba_48 rim_53 ba_57 
T02D1228:35b-42	de nas las dang rjes su mthun pa'i sgrub pa pos rgyud rnams bsgoms nas ni /	de_0 nas_3 las_7 dang_11 rjes_16 su_21 mthun_24 ba_30 sgrub_35 ba_41 pos_44 brgyud_48 rnams_54 sgom_60 nas_67 ni_71 
T02D1228:35b-43	gzar bu gnyis kyi nang du ni /	gzar_0 bu_5 gnyis_8 kyi_14 nang_18 du_23 ni_26 
T02D1228:35b-44	yi dam lha yi sa bon bsam //	yi_0 dam_3 lha_7 yi_11 sa_14 bon_17 bsam_21 
T02D1228:35b-45	gru mo gnyis sprad gzar bu bdun //	gru_0 mo_4 gnyis_7 sprod_13 gzar_19 bu_24 bdun_27 
T02D1228:35b-46	so so'i las dang mthun par dbul //	so_0 so_3 las_8 dang_12 mthun_17 ba_23 'bul_27 
T02D1228:35b-47	rgyas dang zhi ba pushtim dang //	rgya_0 dang_6 zhi_11 ba_15 pushtim_18 dang_26 
T02D1228:35b-48	sh'antim ku ru zhes pas dbul //	sh_0 ku_9 ru_12 zhes_15 ba_20 'bul_24 
T02D1228:36a-0	dbang drag gnyis pa @36a * //	dbang_0 drag_6 gnyis_11 ba_17 
T02D1228:36a-1	ba sham dang //	ba_0 sham_3 dang_8 
T02D1228:36a-2	sha tr'um ma ras dbul bar bya //	sha_0 tr_4 ma_10 ras_13 'bul_17 ba_22 byed_26 
T02D1228:36a-3	de ni dbul ba'i rim pa bshad par bya ste //	de_0 ni_3 'bul_6 ba_11 rim_16 ba_20 'chad_23 ba_29 byed_33 ste_37 
T02D1228:36a-4	aom na ma: sa manta buddh'a n'am /	aom_0 na_4 ma:_7 sa_11 manta_14 buddh_20 n_28 
T02D1228:36a-5	aagna ye sv'a h'a /	aagna_0 ye_6 sv_9 h_14 
T02D1228:36a-6	pu na hi ma nta /	pu_0 na_3 hi_6 ma_9 nta_12 
T02D1228:36a-7	aagna ye pushtim ku ru sv'a h'a /	aagna_0 ye_6 pushtim_9 ku_17 ru_20 sv_23 h_28 
T02D1228:36a-8	zhes pas so //	zhes_0 ba_5 so_9 
T02D1228:36a-9	gzhan ni blugs gzar gyis dbul bar bya'o //	gzhan_0 ni_6 blugs_9 gzar_15 gyis_20 'bul_25 ba_30 byed_34 
T02D1228:36a-10	aom sarba sam ba de sv'a h'a /	aom_0 sarba_4 sam_10 ba_14 de_17 sv_20 h_25 
T02D1228:36a-11	zho zan gyi'o //	zho_0 zan_4 gyi_8 
T02D1228:36a-12	aom sarba p'a pim da ha na badzra ya aa	aom_0 sarba_4 p_10 pim_14 da_18 ha_21 na_24 badzra_27 ya_34 aa_37 
T02D1228:36a-13	mu kam bya sarba p'a bam da ha na sv'a	mu_0 kam_3 byed_7 sarba_11 p_17 bam_21 da_25 ha_28 na_31 sv_34 
T02D1228:36a-14	h'a / til gyi'o //	h_0 til_6 gyi_10 
T02D1228:36a-15	aom badzra a'a yu she sv'a h'a /	aom_0 badzra_4 a_11 yu_15 she_18 sv_22 h_27 
T02D1228:36a-16	me grugs pa'i d'ur ba'i 'o //	me_0 grugs_3 ba_9 d_14 ba_19 'o_24 
T02D1228:36a-17	aom badzr'a yu she sv'a h'a /	aom_0 badzr_4 yu_12 she_15 sv_19 h_24 
T02D1228:36a-18	'bras ma chag pa'i 'o //	'bras_0 ma_6 'chag_9 ba_14 'o_19 
T02D1228:36a-19	aom badzr'a pra ti ha ta badzra ye sv'a h'a /	aom_0 badzr_4 pra_12 ti_16 ha_19 ta_22 badzra_25 ye_32 sv_35 h_40 
T02D1228:36a-20	ku sha'i'o /	ku_0 sha'o_3 
T02D1228:36a-21	aom badzra ba dzi ye sv'a h'a /	aom_0 badzra_4 ba_11 dzi_14 ye_18 sv_21 h_26 
T02D1228:36a-22	lag pan gyi'o //	lag_0 pan_4 gyi_8 
T02D1228:36a-23	aom badzra ma h'a be ga ye sv'a h'a /	aom_0 badzra_4 ma_11 h_14 be_18 ga_21 ye_24 sv_27 h_32 
T02D1228:36a-24	nas kyi'o //	nas_0 kyi_4 
T02D1228:36a-25	aom ma h'a ba l'a ya sv'a h'a /	aom_0 ma_4 h_7 ba_11 l_14 ya_18 sv_21 h_26 
T02D1228:36a-26	sran chen gyi'o //	sran_0 chen_5 gyi_10 
T02D1228:36a-27	aom badzra ghasma ri sv'a h'a /	aom_0 badzra_4 ghasma_11 ri_18 sv_21 h_26 
T02D1228:36a-28	gro'i'o //	gro'o_0 
T02D1228:36a-29	yam shing dbul ba'i rim pa ni /	yam_0 shing_4 'bul_10 ba_15 rim_20 ba_24 ni_27 
T02D1228:36a-30	aom ya dzny'a ya sv'a h'a /	aom_0 ya_4 dzny_7 ya_14 sv_17 h_22 
T02D1228:36a-31	au dumw'a ra'i 'o //	au_0 dumw_3 ra_10 'o_15 
T02D1228:36a-32	aom bo dhi bri ksh'a ya sv'a h'a /	aom_0 'bo_4 dhi_7 'bri_11 ksh_15 ya_21 sv_24 h_29 
T02D1228:36a-33	byang chub kyi shing gi'o //	byang_0 chub_6 kyi_11 shing_15 gi_21 
T02D1228:36a-34	aom badzra na da th'a ya sv'a h'a /	aom_0 badzra_4 na_11 da_14 th_17 ya_22 sv_25 h_30 
T02D1228:36a-35	n+ya gro dha'i 'o //	n_0 ya_2 gro_5 dha_9 'o_15 
T02D1228:36a-36	aom badzra ha sa ka r'a ya sv'a h'a /	aom_0 badzra_4 ha_11 sa_14 ka_17 r_20 ya_24 sv_27 h_32 
T02D1228:36a-37	aa mra'i 'o //	aa_0 mra_3 'o_9 
T02D1228:36a-38	de nas aagna ye pushtim ku ru zhes pas mar	de_0 nas_3 aagna_7 ye_13 pushtim_16 ku_24 ru_27 zhes_30 ba_35 mar_39 
T02D1228:36a-39	dgang gzar khengs pa stong yan chad dbul bar bya'o	'geng_0 gzar_6 kheng_11 ba_18 stong_21 yan_27 'chad_31 'bul_36 ba_41 byed_45 
T02D1228:36a-40	// de nas bsang gtor nas brtsams te /	de_3 nas_6 bsang_10 'thor_16 nas_21 brtsams_25 te_33 
T02D1228:36a-41	mchod nas me lha la bstod pa bya /	mchod_0 nas_6 me_10 lha_13 la_17 bstod_20 ba_26 byed_29 
T02D1228:36a-42	rdo rje dril 'dzin dpa' bo yis //	rdo_0 rje_4 'dril_8 'dzin_13 dpa'_19 'bo_24 yis_27 
T02D1228:36a-43	srid pa'i rang bzhin tshigs bcad brjod /	srid_0 ba_5 rang_10 bzhin_15 tshigs_21 gcod_28 rjod_33 
T02D1228:36a-44	de yan chad ni me lha mchod pa'i rim pa'o //	de_0 yan_3 'chad_7 ni_12 me_15 lha_18 mchod_22 ba_28 rim_33 ba_37 
T02D1228:36a-45	de nas las kun byed pa'i chus //	de_0 nas_3 las_7 kun_11 byed_15 ba_20 chus_25 
T02D1228:36a-46	me lha bsang gtor thugs ka ru //	me_0 lha_3 bsang_7 'thor_13 thugs_18 ka_24 ru_27 
T02D1228:36a-47	dkyil 'khor 'khor lo bsang bar bya //	dkyil_0 'khor_6 'khor_12 lo_18 bsang_21 ba_27 byed_31 
T02D1228:36a-48	las dang rjes mthun me zhal thab //	las_0 dang_4 rjes_9 mthun_14 me_20 zhal_23 thab_28 
T02D1228:36a-49	bsangs nas de ru dbul bar bya //	bsangs_0 nas_7 de_11 ru_14 'bul_17 ba_22 byed_26 
T02D1228:36a-50	dza:h'um bam ho:'i bka' lung 'dis //	dza:h_0 bam_9 ho:'i_13 bka'_19 lung_24 'dis_29 
T02D1228:36a-51	dkyil 'khor lha ni dkyil 'khor bstim //	dkyil_0 'khor_6 lha_12 ni_16 dkyil_19 'khor_25 stim_31 
T02D1228:36a-52	bsang gtor nas brtsams mchod pa dbul //	bsang_0 'thor_6 nas_11 brtsams_15 mchod_23 ba_29 'bul_32 
T02D1228:36a-53	mchod bstod bdud rtsi mthar thug bya //	mchod_0 bstod_6 bdud_12 rtsi_17 mthar_22 thug_28 byed_33 
T02D1228:36a-54	de nas mar gzar nyi shu rtsa gcig yan chad dbul bar bya'o //	de_0 nas_3 mar_7 gzar_11 nyi_16 shu_20 rtsa_24 gcig_29 yan_34 'chad_38 'bul_43 ba_48 byed_52 
T02D1228:36a-55	de nas zho la sogs pa'i rdzas rnams phul la /	de_0 nas_3 zho_7 la_11 sogs_14 ba_19 rdzas_24 rnams_30 'bul_36 la_41 
T02D1228:36a-56	mar gyi sbyin sreg brgya'am stong la brgyad kyis btags pa dbul bar bya'o //	mar_0 gyi_4 sbyin_8 sreg_14 brgya_19 stong_28 la_34 brgyad_37 kyis_44 'dogs_49 ba_55 'bul_58 ba_63 byed_67 
T02D1228:36a-57	bsang gtor nas brtsams mar gyis mchod //	bsang_0 'thor_6 nas_11 brtsams_15 mar_23 gyis_27 mchod_32 
T02D1228:36a-58	bstod de phyag 'tshal gshegs su gsol //	bstod_0 de_6 phyag_9 'tshal_15 gshegs_22 su_29 gsol_32 
T02D1228:36a-59	rdo rje dril 'dzin dpa' bo yis //	rdo_0 rje_4 'dril_8 'dzin_13 dpa'_19 'bo_24 yis_27 
T02D1228:36a-60	rang bzhin dag gi tshig bcad brjod //	rang_0 bzhin_5 'dag_11 gi_15 tshig_18 gcod_24 rjod_29 
T02D1228:36b-0	@36b yi ge brgya bas bzod par gsol //	yi_5 ge_8 brgya_11 ba_17 bzod_21 ba_26 gsol_30 
T02D1228:36b-1	mtha' ru mu: btags snying gar bsdu //	mtha'_0 ru_6 mu:_9 'dogs_13 snying_19 gar_26 sdud_30 
T02D1228:36b-2	lha yi sbyin sreg gi rim pa'o //	lha_0 yi_4 sbyin_7 sreg_13 gi_18 rim_21 ba_25 
T02D1228:36b-3	de nas blugs gzar 'ba' zhig gis //	de_0 nas_3 blugs_7 gzar_13 'ba'_18 'jig_23 gis_28 
