T02D1250:213a-38	g-yung mo la sogs brgyad pa'o //	g-yung_0 mo_7 la_10 sogs_13 brgyad_18 ba_25 
T02D1250:213a-39	aom aa bhi shi nytsa tu m'am sarba ta th'a ga ta ho //	aom_0 aa_4 bhi_7 'chi_11 nytsa_15 tu_21 m_24 sarba_29 ta_35 th_38 ga_43 ta_46 ho_49 
T02D1250:213a-40	'bud dang 'bar dang thod pa dang //	'bud_0 dang_5 'bar_10 dang_15 thod_20 ba_25 dang_28 
T02D1250:213a-41	'dzin pa lnga dang 'bras bu lnga //	'dzin_0 ba_6 lnga_9 dang_14 'bras_19 bu_25 lnga_28 
T02D1250:213a-42	de 'gyur bdud rtsi ro myang ba //	de_0 'gyur_3 bdud_9 rtsi_14 ro_19 myang_22 ba_28 
T02D1250:213a-43	rdo rje nas kyi 'bru bsam ste //	rdo_0 rje_4 nas_8 kyi_12 'bru_16 bsam_21 ste_26 
T02D1250:213a-44	dgyes pa'i rdo rje de bklag go //	dgyes_0 ba_6 rdo_11 rje_15 de_19 klog_22 go_28 
T02D1250:213a-45	aom sarba ta th'a ga ta aa mri ta sva	aom_0 sarba_4 ta_10 th_13 ga_18 ta_21 aa_24 mri_27 ta_31 sva_34 
T02D1250:213a-46	da na badzra sva bh'a ba a'a tma ko&amp; ham	da_0 na_3 badzra_6 sva_13 bh_17 ba_22 a_25 tma_29 ko&amp;_33 ham_41 
T02D1250:213a-47	/ lha mo brgyad rnams spros nas ni //	lha_2 mo_6 brgyad_9 rnams_16 spros_22 nas_28 ni_32 
T02D1250:213a-48	mchod pa brgyad kyis sngon bzhin du //	mchod_0 ba_6 brgyad_9 kyis_16 sngon_21 bzhin_27 du_33 
T02D1250:213a-49	skyil 'khor gtso bo nyid la mchod //	skyil_0 'khor_6 gtso_12 'bo_17 nyid_20 la_25 mchod_28 
T02D1250:213a-50	aom sarba ta th'a ga ta p'u dza badzra sva bh'a ba a'a tma ko&amp; ham //	aom_0 sarba_4 ta_10 th_13 ga_18 ta_21 p_24 dza_28 badzra_32 sva_39 bh_43 ba_48 a_51 tma_55 ko&amp;_59 ham_67 
T02D1250:213a-51	rnal 'byor ma rnams de dag gis //	rnal_0 'byor_5 ma_11 rnams_14 de_20 'dag_23 gis_27 
T02D1250:213a-52	'khor lo'i gtso bo la bstod la //	'khor_0 lo_6 gtso_11 'bo_16 la_19 bstod_22 la_28 
T02D1250:213a-53	khyod ni rnal 'byor brgyad kyis bskor //	khyod_0 ni_6 rnal_9 'byor_14 brgyad_20 kyis_27 skor_32 
T02D1250:213a-54	nyid kyi thugs kyi khyod dgongs 'grub //	nyid_0 kyi_5 thugs_9 kyi_15 khyod_19 dgongs_25 'grub_32 
T02D1250:213a-55	rgyu dang mi rgyu 'khor ba kun 'grub pa //	rgyu_0 dang_5 mi_10 rgyu_13 'khor_18 ba_24 kun_27 'grub_31 ba_37 
T02D1250:213a-56	snying rje'i thugs kyis sems can byang chub tu //	snying_0 rje_7 thugs_13 kyis_19 sems_24 can_29 byang_33 chub_39 tu_44 
T02D1250:213a-57	kun rdzob sgyu mas sgrub pa'i yid dgyes mdzod //	kun_0 rdzob_4 sgyu_10 mas_15 sgrub_19 ba_25 yid_30 dgyes_34 mdzod_40 
T02D1250:213a-58	aom sarba ta th'a ga ta stu tir badzra sva bh'a ba a'a tma ko&amp; ham //	aom_0 sarba_4 ta_10 th_13 ga_18 ta_21 stu_24 tir_28 badzra_32 sva_39 bh_43 ba_48 a_51 tma_55 ko&amp;_59 ham_67 
T02D1250:213a-59	de yan chad bsnyen pa dang nye ba'i bsnyen pa bshad nas //	de_0 yan_3 'chad_7 snyen_12 ba_19 dang_22 nye_27 ba_31 snyen_36 ba_43 'chad_46 nas_52 
T02D1250:213b-0	@213b sgrub pa dang sgrub pa chen po bshad par bya ste //	sgrub_6 ba_12 dang_15 sgrub_20 ba_26 chen_29 po_34 'chad_37 ba_43 byed_47 ste_51 
T02D1250:213b-1	dkyil 'khor lha rnams lus la bsdu //	dkyil_0 'khor_6 lha_12 rnams_16 lus_22 la_26 sdud_29 
T02D1250:213b-2	lte bar tsa nda l'i sbar la //	lte_0 ba_4 tsa_8 nda_12 l_16 sbor_20 la_25 
T02D1250:213b-3	de bzhin gshegs pa lnga bsregs te //	de_0 bzhin_3 gshegs_9 ba_16 lnga_19 bsregs_24 te_31 
T02D1250:213b-4	spyan la sogs pa yang bsregs te //	spyan_0 la_6 sogs_9 ba_14 yang_17 bsregs_22 te_29 
T02D1250:213b-5	bsregs pas ham las ri bong 'byung //	bsregs_0 ba_7 ham_11 las_15 ri_19 bong_22 'byung_27 
T02D1250:213b-6	dang po sprin dang 'dra ba mthong //	dang_0 po_5 sprin_8 dang_14 'dra_19 ba_24 mthong_27 
T02D1250:213b-7	gnyis su du ba 'dra ba mthong //	gnyis_0 su_6 du_9 ba_12 'dra_15 ba_20 mthong_23 
T02D1250:213b-8	gsum pa glog gi rnam pa ste //	gsum_0 ba_5 glog_8 gi_13 rnam_16 ba_21 ste_24 
T02D1250:213b-9	bzhi pa mar me 'dra ba dang //	bzhi_0 ba_5 mar_8 me_12 'dra_15 ba_20 dang_23 
T02D1250:213b-10	lnga pa thams cad snang ba ste //	lnga_0 ba_5 thams_8 cad_14 snang_18 ba_24 ste_27 
T02D1250:213b-11	sprin med nam mkha' 'dra ba ste //	sprin_0 med_6 nam_10 mkha'_14 'dra_20 ba_25 ste_28 
T02D1250:213b-12	phyis ni sgyu ma'i rnam pa mtshungs //	'byid_0 ni_6 sgyu_9 ma_14 rnam_19 ba_24 mtshungs_27 
T02D1250:213b-13	rmi lam rnam pa skad cig go //	rmi_0 lam_4 rnam_8 ba_13 skad_16 cig_21 go_25 
T02D1250:213b-14	rang gi snying ga 'di nyid du //	rang_0 gi_5 snying_8 ga_15 'di_18 nyid_22 du_27 
T02D1250:213b-15	spros dang bsdu ba'i sbyor ba yis //	spros_0 dang_6 sdud_11 ba_16 sbyor_21 ba_27 yis_30 
T02D1250:213b-16	spros med bsgom pa'i sbyor ba ste //	spros_0 med_6 bsgom_10 ba_16 sbyor_21 ba_27 ste_30 
T02D1250:213b-17	thog ma mtha' dbus med pa yi //	thogs_0 ma_5 mtha'_8 dbus_14 med_19 ba_23 yi_26 
T02D1250:213b-18	'khor med mya ngan 'das pa med //	'khor_0 med_6 mya_10 ngan_14 'da'_19 ba_24 med_27 
T02D1250:213b-19	de ltar ma yin dmigs ma yin //	de_0 ltar_3 ma_8 yin_11 dmigs_15 ma_21 yin_24 
T02D1250:213b-20	zhes mar me'i rtse mo'i bar du'o //	zhes_0 mar_5 me_9 rtse_14 mo_19 ba_24 du_28 
T02D1250:213b-21	bar chod bgegs kyis mi tshugs phyir //	ba_0 chod_4 bgegs_9 kyis_15 mi_20 tshugs_23 phyir_30 
T02D1250:213b-22	gtor ma rgyun tu sbyin par bya /	'thor_0 ma_5 rgyun_8 tu_14 sbyin_17 ba_23 byed_27 
T02D1250:213b-23	aom ainda dza ma dza la /	aom_0 ainda_4 dza_10 ma_14 dza_17 la_21 
T02D1250:213b-24	ya ksha bh'u ta /	ya_0 ksha_3 bh_8 ta_13 
T02D1250:213b-25	ba hni ba au /	ba_0 hni_3 ba_7 au_10 
T02D1250:213b-26	r'a ksha tsanda //	r_0 ksha_4 tsanda_9 
T02D1250:213b-27	s'u dzdza //	s_0 dzdza_4 
T02D1250:213b-28	m'a da ba ppa //	m_0 da_4 ba_7 ppa_10 
T02D1250:213b-29	ta le p'a t'a la //	ta_0 le_3 p_6 t_10 la_14 
T02D1250:213b-30	aa shta sa ppa /	aa_0 shta_3 sa_8 ppa_11 
T02D1250:213b-31	ai dam /	ai_0 dam_3 
T02D1250:213b-32	ba lim //	ba_0 lim_3 
T02D1250:213b-33	bh'um dza /	bh_0 dza_6 
T02D1250:213b-34	dzim gha //	dzim_0 gha_5 
T02D1250:213b-35	pushpa /	pushpa_0 
T02D1250:213b-36	dh'u pa //	dh_0 ba_5 
T02D1250:213b-37	m'am sa //	m_0 sa_5 
T02D1250:213b-38	pim gha //	pim_0 gha_4 
T02D1250:213b-39	aam bha sappa //	aam_0 bha_4 sappa_8 
T02D1250:213b-40	ka dzdza s'a dha /	ka_0 dzdza_3 s_9 dha_13 
T02D1250:213b-41	kha nti khu ni phe da g'a da /	kha_0 nti_4 khu_8 ni_12 phe_15 da_19 g_22 da_26 
T02D1250:213b-42	aom aa k'a ro mu kham sarba dha rm'a n'um /	aom_0 aa_4 k_7 ro_11 mu_14 kham_17 sarba_22 dha_28 rm_32 n_37 
T02D1250:213b-43	a'a dya nu tpa nna tv'a ta /	a_0 dya_4 nu_8 tpa_11 nna_15 tv_19 ta_24 
T02D1250:213b-44	aom a'a: h'u% phat sv'a h'a /	aom_0 a:_4 h%_9 phat_14 sv_19 h_24 
T02D1250:213b-45	aom tree lo ky'a kshe pa h'u% h'u% h'u% phat phat sv'a h'a /	aom_0 tree_4 lo_9 ky_12 kshe_17 ba_22 h%_25 h%_30 h%_35 phat_40 phat_45 sv_50 h_55 
T02D1250:213b-46	snying po'o //	snying_0 po_7 
T02D1250:213b-47	bsam gtan mi nus rnal 'byor gang //	bsam_0 gtan_5 mi_10 nus_13 rnal_17 'byor_22 gang_28 
T02D1250:213b-48	de ni dag pa rjes su dran //	de_0 ni_3 'dag_6 ba_10 rjes_13 su_18 dran_21 
T02D1250:213b-49	snying rje'i spyan ni dmar po ste //	snying_0 rje_7 spyan_13 ni_19 dmar_22 po_27 ste_30 
T02D1250:213b-50	yan lag nag po byams pa yin //	yan_0 lag_4 nag_8 po_12 byams_15 ba_21 yin_24 
T02D1250:213b-51	phyag rgya lnga ni sangs rgyas yin //	phyag_0 rgya_6 lnga_11 ni_16 sangs_19 rgya_25 yin_31 
T02D1250:213b-52	khros pas gdug pa 'dul ba yin //	khro_0 ba_6 gdug_10 ba_15 'dul_18 ba_23 yin_26 
T02D1250:213b-53	spyan gsum pa ni sku gsum mo //	spyan_0 gsum_6 ba_11 ni_14 sku_17 gsum_21 mo_26 
T02D1250:213b-54	rus pa bden pa bzhi po'o //	rus_0 ba_4 bden_7 ba_12 bzhi_15 po_20 
T02D1250:213b-55	gzugs kyi phung po rdo rje me //	gzugs_0 kyi_6 'phung_10 po_16 rdo_19 rje_23 me_27 
T02D1250:213b-56	tshor ba gsang ba'i goo r'i ma //	tshor_0 ba_6 gsang_9 ba_15 goo_20 r_24 ma_28 
T02D1250:213b-57	'du shes phung po chu ma'o //	'du_0 shes_4 'phung_9 po_15 chu_18 ma_22 
T02D1250:213b-58	'du byed rdo rje mkha' 'gro ma //	'du_0 byed_4 rdo_9 rje_13 mkha'_17 'gro_23 ma_28 
T02D1250:213b-59	rnam par shes pa bdag med ma //	rnam_0 ba_5 shes_9 ba_14 bdag_17 med_22 ma_26 
T02D1250:213b-60	don dam la ni phung po med //	don_0 dam_4 la_8 ni_11 'phung_14 po_20 med_23 
T02D1250:213b-61	skye mched drug ni dag pa ni /	skye_0 mched_5 drug_11 ni_16 'dag_19 ba_23 ni_26 
T02D1250:213b-62	mig ni gti mug rdo rje ma //	mig_0 ni_4 gti_7 mug_11 rdo_15 rje_19 ma_23 
T02D1250:213b-63	rna ba zhe sdang rdo rje ma //	rna_0 ba_4 zhe_7 sdang_11 rdo_17 rje_21 ma_25 
T02D1250:213b-64	sna la ser sna rdo rje ma //	sna_0 la_4 ser_7 sna_11 rdo_15 rje_19 ma_23 
T02D1250:213b-65	kha la 'dod chags rdo rje ma //	kha_0 la_4 'dod_7 chags_12 rdo_18 rje_22 ma_26 
T02D1250:213b-66	lus la phrag dog rdo rje ma //	lus_0 la_4 phrag_7 dog_13 rdo_17 rje_21 ma_25 
T02D1250:213b-67	sa ni pukka s'i ru bshad //	sa_0 ni_3 pukka_6 s_12 ru_16 'chad_19 
T02D1250:213b-68	chu yi khams ni rngon pa ma //	chu_0 yi_4 khams_7 ni_13 rngon_16 ba_22 ma_25 
T02D1250:213b-69	drod ni gtum mor shes par bya //	drod_0 ni_5 'thum_8 mor_13 shes_17 ba_22 byed_26 
T02D1250:213b-70	rlung ni g-yung mor rab tu grags //	rlung_0 ni_6 g-yung_9 mor_16 rab_20 tu_24 grags_27 
T02D1250:214a-0	gzugs ni goo r'ir ra yang @214a * //	gzugs_0 ni_6 goo_9 r_13 ra_18 yang_21 
T02D1250:214a-1	dag brjod //	'dag_0 rjod_4 
T02D1250:214a-2	sgra ni chom rkun ma rab brjod //	sgra_0 ni_5 chom_8 rkun_13 ma_18 rab_21 rjod_25 
T02D1250:214a-3	dri ni ro langs ma ru bshad //	'dri_0 ni_4 ro_7 ldang_10 ma_16 ru_19 'chad_22 
T02D1250:214a-4	ro yi tshul ni za phod ma //	ro_0 yi_3 tshul_6 ni_12 za_15 phod_18 ma_23 
T02D1250:214a-5	reg bya sa spyod ma zhes bya //	reg_0 byed_4 sa_8 spyod_11 ma_17 zhes_20 byed_25 
T02D1250:214a-6	chos kyi dbyings ni mkha' spyod ma //	chos_0 kyi_5 dbyings_9 ni_17 mkha'_20 spyod_26 ma_32 
T02D1250:214a-7	de ltar dag pas rjes dran bya //	de_0 ltar_3 'dag_8 ba_12 rjes_16 dran_21 byed_26 
T02D1250:214a-8	bdag gi sgrub thabs rim pa 'di //	bdag_0 gi_5 sgrub_8 thabs_14 rim_20 ba_24 'di_27 
T02D1250:214a-9	blo zhan don du bdag gis brtsams //	blo_0 zhan_4 don_9 du_13 bdag_16 gis_21 brtsams_25 
T02D1250:214a-10	de yi dge ba gang yin pas //	de_0 yi_3 dge_6 ba_10 gang_13 yin_18 ba_22 
T02D1250:214a-11	sems can 'khor ba las grol shog / dpal dgyes pa rdo rje'i sgrub thabs //	sems_0 can_5 'khor_9 ba_15 las_18 grol_22 shog_27 dpal_34 dgyes_39 ba_45 rdo_48 rje_52 sgrub_58 thabs_64 
T02D1250:214a-12	slob dpon chen po bde ba'i rdo rjes mdzad pa rdzogs so /	slob_0 dpon_5 chen_10 po_15 bde_18 ba_22 rdo_27 rjes_31 mdzad_36 ba_42 rdzogs_45 so_52 
T02D1250:214a-14	// / rgya gar gyi mkhan po dharma tsandra dang /	rgya_5 gar_10 gyi_14 mkhan_18 po_24 dharma_27 tsandra_34 dang_42 
T02D1250:214a-15	lo ts'a ba dharma tsandras rang 'gyur du bsgyur zhing zhus te gtan la phab pa'o /	lo_0 ts_3 ba_8 dharma_11 tsandras_18 rang_27 'gyur_32 du_38 sgyur_41 zhing_48 zhus_54 te_59 gtan_62 la_67 'bebs_70 ba_75 
T02D1250:214a-17	// / zhal gcig phyag gnyis pa'i sgrub thabs rdzogs so//	zhal_5 gcig_10 phyag_15 gnyis_21 ba_27 sgrub_32 thabs_38 rdzogs_44 
