T02D1276:103a-0	@103a # // rgya gar skad du /	rgya_11 gar_16 skad_20 du_25 
T02D1276:103a-1	dvi bhu dza he badzra s'a dha nam /	dvi_0 bhu_4 dza_8 he_12 badzra_15 s_22 dha_26 nam_30 
T02D1276:103a-2	bod skad du /	'bod_0 skad_4 du_9 
T02D1276:103a-3	dgyes pa rdo rje phyag gnyis pa'i sgrub pa'i thabs /	dgyes_0 ba_6 rdo_9 rje_13 phyag_17 gnyis_23 ba_29 sgrub_34 ba_40 thabs_45 
T02D1276:103a-4	dpal rdo rje he ru ka la phyag 'tshal lo //	dpal_0 rdo_5 rje_9 he_13 ru_16 ka_19 la_22 phyag_25 'tshal_31 lo_38 
T02D1276:103a-5	ae wam yi ge la bzhugs pas //	ae_0 wam_3 yi_7 ge_10 la_13 bzhugs_16 ba_23 
T02D1276:103a-6	dga' bzhi la sogs mnga' bdag ni //	dga'_0 bzhi_5 la_10 sogs_13 mnga'_18 bdag_24 ni_29 
T02D1276:103a-7	dang po dbus mtha' las grol ba //	dang_0 po_5 dbus_8 mtha'_13 las_19 grol_23 ba_28 
T02D1276:103a-8	rdo rje 'chang de la phyag 'tshal //	rdo_0 rje_4 'chang_8 de_15 la_18 phyag_21 'tshal_27 
T02D1276:103a-9	bla ma rnams dang sangs rgyas dang //	bla_0 ma_4 rnams_7 dang_13 sangs_18 rgya_24 dang_30 
T02D1276:103a-10	chos dang dge 'dun gus bcas shing //	chos_0 dang_5 dge_10 'dun_14 gus_19 'cha'_23 shing_28 
T02D1276:103a-11	rgan gzhon rdor spyod phyag byas nas //	rgan_0 gzhon_5 rdar_11 spyod_16 phyag_22 byed_28 nas_33 
T02D1276:103a-12	dgyes pa rdo rje'i sgrubs thabs bshad //	dgyes_0 ba_6 rdo_9 rje_13 sgrubs_19 thabs_26 'chad_32 
T02D1276:103a-13	dang po goms par byed pa ni //	dang_0 po_5 goms_8 ba_13 byed_17 ba_22 ni_25 
T02D1276:103a-14	gang du sngags pas dngos grub 'grub cing /	gang_0 du_5 sngags_8 ba_15 dngos_19 'grub_25 'grub_30 cing_36 
T02D1276:103a-15	sems rtse gcig par 'gyur ba /	sems_0 rtse_5 gcig_10 ba_15 'gyur_19 ba_25 
T02D1276:103a-16	shing gcig gam /	shing_0 gcig_6 gam_11 
T02D1276:103a-17	dur khrod dam /	dur_0 khrod_4 dam_10 
T02D1276:103a-18	ma mo'i khyim mam /	ma_0 mo_3 khyim_8 mam_14 
T02D1276:103a-19	de bzhin mtshan mo'am /	de_0 bzhin_3 mtshan_9 mo_16 
T02D1276:103a-20	skye bos dben pa'i grong mtha' 'am /	skye_0 'bod_5 dben_9 ba_14 grong_19 mtha'_25 'am_31 
T02D1276:103a-21	dgon par bsngags pa gsungs pa'i gnas bzang po brtag go //	dgon_0 ba_5 bsngags_9 ba_17 gsungs_20 ba_27 gnas_32 bzang_37 po_43 rtog_46 go_52 
T02D1276:103a-22	rang gi snying gar ram bsams la /	rang_0 gi_5 snying_8 gar_15 ram_19 bsams_23 la_29 
T02D1276:103a-23	de las byung ba'i nyi ma'i dkyil 'khor de la h'um yang bskyed la /	de_0 las_3 'byung_7 ba_13 nyi_18 ma_22 dkyil_27 'khor_33 de_39 la_42 h_45 yang_50 skyed_55 la_62 
T02D1276:103a-24	dom bi n'is rjes su chags pas phrag na 'khyud	dom_0 bi_4 n_7 rjes_12 su_17 chags_20 ba_26 phrag_30 na_36 'khyud_39 
T02D1276:103a-25	pa'i thabs dang shes rab kyi bdag nyid can rdo	ba_0 thabs_5 dang_11 shes_16 rab_21 kyi_25 bdag_29 nyid_34 can_39 rdo_43 
T02D1276:103a-26	rje las 'khrungs pas /	rje_0 las_4 'khrung_8 ba_17 
T02D1276:103a-27	thugs rje dang ldan pa'i rje btsun la /	thugs_0 rje_6 dang_10 ldan_15 ba_20 rje_25 btsun_29 la_35 
T02D1276:103a-28	rgyan thams cad kyis brgyan pa'i lha mo brgyad goo r'i ri dgas kyi mtshan ma bsnams pa /	rgyan_0 thams_6 cad_12 kyis_16 rgyan_21 ba_28 lha_33 mo_37 brgyad_40 goo_47 r_51 ri_55 'gas_58 kyi_63 mtshan_67 ma_74 snom_77 ba_84 
T02D1276:103a-29	tsoo r'i nyi ma'i snod bsnams pa /	tsoo_0 r_5 nyi_9 ma_13 snod_18 snom_23 ba_30 
T02D1276:103a-30	be t'a l'i chu bsnams pa /	be_0 t_3 l_7 chu_11 snom_15 ba_22 
T02D1276:103a-31	ghasma r'i sman bsnams pa /	ghasma_0 r_7 sman_11 snom_16 ba_23 
T02D1276:103a-32	pukka s'i phyag na rdo rje bsnams pa /	pukka_0 s_6 phyag_10 na_16 rdo_19 rje_23 snom_27 ba_34 
T02D1276:103a-33	sha ba r'i ro bsnams pa /	sha_0 ba_4 r_7 ro_11 snom_14 ba_21 
T02D1276:103a-34	tsandal'i da ma ru bsnams nas /	tsandal_0 da_10 ma_13 ru_16 snom_19 nas_26 
T02D1276:103a-35	g-yung mo de kho nas mchod pas de rnams kyis	g-yung_0 mo_7 de_10 kho_13 nas_17 mchod_21 ba_27 de_31 rnams_34 kyis_40 
T02D1276:103a-36	gco bo la mchod pa byed pa nam mkha' la	gco_0 'bo_4 la_7 mchod_10 ba_16 byed_19 ba_24 nam_27 mkha'_31 la_37 
T02D1276:103a-37	blta'o // de nas /	lta_0 de_10 nas_13 
T02D1276:103a-38	dkon mchog gsum la skyabs su mchi //	dkon(d)_0 mchog_5 gsum_11 la_16 skyob_19 su_26 mchi_29 
T02D1276:103a-39	sdig pa thams cad bshags par ba gyi [?] //	sdig_0 ba_5 thams_8 cad_14 'chags_18 ba_25 ba_29 gyi_32 
T02D1276:103a-40	'gro ba'i dge la rjes yi rang //	'gro_0 ba_5 dge_10 la_14 rjes_17 yi_22 rang_25 
T02D1276:103a-41	sangs rgyas byang chub yid kyis gzung //	sangs_0 rgya_6 byang_12 chub_18 yid_23 kyis_27 gzung_32 
T02D1276:103a-42	dang po byams pa bsgom par bya //	dang_0 po_5 byams_8 ba_14 bsgom_17 ba_23 byed_27 
T02D1276:103a-43	gnyis pa snying rje bsgom par bya //	gnyis_0 ba_6 snying_9 rje_16 bsgom_20 ba_26 byed_30 
T02D1276:103a-44	gsum pa dga' ba bsgoms nas ni //	gsum_0 ba_5 dga'_8 ba_13 sgom_16 nas_23 ni_27 
T02D1276:103a-45	kun gyi mtha' ru btang snyoms so //	kun_0 gyi_4 mtha'_8 ru_14 gtong_17 snyom_23 so_30 
T02D1276:103b-0	yang sems stong pa nyid du dmigs @103b pas tha mal pa'i nga rgyal spang bar bya ste /	yang_0 sems_5 stong_10 ba_16 nyid_19 du_24 dmigs_27 ba_39 tha_43 mal_47 ba_51 nga_56 rgyal_60 spong_66 ba_72 byed_76 ste_80 
T02D1276:103b-1	aom sh'u n+ya t'a dzny'a na badzra sv'a bh'a ba a'atma ko&amp; ham /	aom_0 sh_4 n_9 ya_11 t_14 dzny_18 na_25 badzra_28 sv_35 bh_40 ba_45 a_48 ko&amp;_55 ham_63 
T02D1276:103b-2	dang por ram las nyi ma bsam //	dang_0 por_5 ram_9 las_13 nyi_17 ma_21 bsam_24 
T02D1276:103b-3	nyi ma'i dbus su rab gnas pa'i //	nyi_0 ma_4 dbus_9 su_14 rab_17 gnas_21 ba_26 
T02D1276:103b-4	h'um las sna tshogs rdo rjer bsam //	h_0 las_5 sna_9 tshogs_13 rdo_20 rjer_24 bsam_29 
T02D1276:103b-5	rdo rje de las ra ba dang //	rdo_0 rje_4 de_8 las_11 ra_15 ba_18 dang_21 
T02D1276:103b-6	rdo rje'i gur gyis phub par bsgom //	rdo_0 rje_4 gur_10 gyis_14 'bubs_19 ba_24 bsgom_28 
T02D1276:103b-7	mkha' dbyings bha ga bsgoms nas ni //	mkha'_0 dbyings_6 bha_14 ga_18 sgom_21 nas_28 ni_32 
T02D1276:103b-8	de nang bsgom par bya ba ni //	de_0 nang_3 bsgom_8 ba_14 byed_18 ba_22 ni_25 
T02D1276:103b-9	dang por ro ni bsam bya ste //	dang_0 por_5 ro_9 ni_12 bsam_15 byed_20 ste_24 
T02D1276:103b-10	chos dbyings bdag med yin zhes bya //	chos_0 dbyings_5 bdag_13 med_18 yin_22 zhes_26 byed_31 
T02D1276:103b-11	de stengs gnas pa'i rnal 'byor pas //	de_0 stengs_3 gnas_10 ba_15 rnal_20 'byor_25 ba_31 
T02D1276:103b-12	he ru ka ru bsgom par bya //	he_0 ru_3 ka_6 ru_9 bsgom_12 ba_18 byed_22 
T02D1276:103b-13	a'a li las zla k'a li nyi //	a_0 li_4 las_7 zla_11 k_15 li_19 nyi_22 
T02D1276:103b-14	de stengs sa bon h'um brtag bya //	de_0 stengs_3 sa_10 bon_13 h_17 rtog_22 byed_28 
T02D1276:103b-15	h'um las rdo rje bsam par bya //	h_0 las_5 rdo_9 rje_13 bsam_17 ba_22 byed_26 
T02D1276:103b-16	rdo rje'i lte ba h'um la yang //	rdo_0 rje_4 lte_10 ba_14 h_17 la_22 yang_25 
T02D1276:103b-17	de nyid h'um ni gnas par bsam //	de_0 nyid_3 h_8 ni_13 gnas_16 ba_21 bsam_25 
T02D1276:103b-18	me long ye shes zla ba ste //	me_0 long_3 ye_8 shes_11 zla_16 ba_20 ste_23 
T02D1276:103b-19	mnyam nyid ye shes bdun par ldan //	mnyam_0 nyid_6 ye_11 shes_14 bdun_19 ba_24 ldan_28 
T02D1276:103b-20	phyag mtshan sa bon so sor rtog / thams cad gcig bsdus bya nan tan //	phyag_0 mtshan_6 sa_13 bon_16 so_20 sor_23 rtogs_27 thams_34 cad_40 gcig_44 sdud_49 byed_55 nan_59 tan_63 
T02D1276:103b-21	chos nyid dag pa'i rdzogs pa'i sku //	chos_0 nyid_5 'dag_10 ba_14 rdzogs_19 ba_26 sku_31 
T02D1276:103b-22	mngon par byang chub rnam pa lnga //	mngon_0 ba_6 byang_10 chub_16 rnam_21 ba_26 lnga_29 
T02D1276:103b-23	rim bzhin mkhas pas bsgom par gsungs //	rim_0 bzhin_4 mkhas_10 ba_16 bsgom_20 ba_26 gsungs_30 
T02D1276:103b-24	sems can lus las yang dag 'byung //	sems_0 can_5 lus_9 las_13 yang_17 'dag_22 'byung_26 
T02D1276:103b-25	dkyil 'khor gtso bo bsgom par bya //	dkyil_0 'khor_6 gtso_12 'bo_17 bsgom_20 ba_26 byed_30 
T02D1276:103b-26	zhal dang phyag mtshan gsungs bzhin te //	zhal_0 dang_5 phyag_10 mtshan_16 gsungs_23 bzhin_30 te_36 
T02D1276:103b-27	chu shel lta bu'i 'od mnga' ba //	chu_0 shel_4 lta_9 bu_13 'od_18 mnga'_22 ba_28 
T02D1276:103b-28	dga' bas gnyis ni snyoms par zhugs //	dga'_0 ba_5 gnyis_9 ni_15 snyom_18 ba_25 'jug_29 
T02D1276:103b-29	bdag med ma dang lhan cig sbyor //	bdag_0 med_5 ma_9 dang_12 lhan_17 cig_22 sbyor_26 
T02D1276:103b-30	bsrub bya bsrubs pa'i sbyor ba yis //	bsrub_0 byed_6 bsrubs_10 ba_17 sbyor_22 ba_28 yis_31 
T02D1276:103b-31	goo r'i la sogs nges 'byung bya //	goo_0 r_4 la_8 sogs_11 nges_16 'byung_21 byed_28 
T02D1276:103b-32	gam tsam bam gham pam sam lam dam sa bon las nges 'byung //	gam_0 tsam_4 bam_9 gham_13 pam_18 sam_22 lam_26 dam_30 sa_34 bon_37 las_41 nges_45 'byung_50 
T02D1276:103b-33	dbang po goo r'i gshin rje sku //	dbang_0 po_6 goo_9 r_13 gshin_17 rje_23 sku_27 
T02D1276:103b-34	chu yi phyogs su be t'a l'i //	chu_0 yi_4 phyogs_7 su_14 be_17 t_20 l_24 
T02D1276:103b-35	lus ngan phyogs su ghasma r'i //	lus_0 ngan_4 phyogs_9 su_16 ghasma_19 r_26 
T02D1276:103b-36	pukka s'i ni dbang ldan 'dod //	pukka_0 s_6 ni_10 dbang_13 ldan_19 'dod_24 
T02D1276:103b-37	me yi phyogs su sha pa r'i //	me_0 yi_3 phyogs_6 su_13 sha_16 ba_20 r_23 
T02D1276:103b-38	tsandal'i ni bden bral gnas //	tsandal_0 ni_10 bden_13 'bral_18 gnas_23 
T02D1276:103b-39	rlung gi phyogs su do mbir 'dod //	rlung_0 gi_6 phyogs_9 su_16 do_19 mbir_22 'dod_27 
T02D1276:103b-40	goo r'i kha dog nag por 'gyur //	goo_0 r_4 kha_8 dog_12 nag_16 por_20 'gyur_24 
T02D1276:103b-41	tsoo r'i btsod kyi kha dog ldan //	tsoo_0 r_5 btsod_9 kyi_15 kha_19 dog_23 ldan_27 
T02D1276:103b-42	be t'a l'i ni gtso mo'i mdog / margata ma dog 'dra ghasma r'i //	be_0 t_3 l_7 ni_11 gtso_14 mo_19 mdog_24 margata_31 ma_39 dog_42 'dra_46 ghasma_51 r_58 
T02D1276:103b-43	aindra n'i mdog pukka s'i //	aindra_0 n_7 mdog_11 pukka_16 s_22 
T02D1276:103b-44	sha ba r'i ni chu shel bzhin //	sha_0 ba_4 r_7 ni_11 chu_14 shel_18 bzhin_23 
T02D1276:103b-45	tsandal'i ni mkha' bzhin sngo //	tsandal_0 ni_10 mkha'_13 bzhin_19 sngo_25 
T02D1276:103b-46	do mbi n'i ni sna tshogs mdog / ro yi steng na 'od 'bar zhing //	do_0 mbi_3 n_7 ni_11 sna_14 tshogs_18 mdog_25 ro_32 yi_35 steng_38 na_44 'od_47 'bar_51 zhing_56 
T02D1276:103b-47	phyag gnyis dbu skra gyen du brdzes //	phyag_0 gnyis_6 dbu_12 skra_16 gyen_21 du_26 brdzes_29 
T02D1276:103b-48	sbyin dmar zhal ni gcig dang bcas //	sbyin_0 dmar_6 zhal_11 ni_16 gcig_19 dang_24 'cha'_29 
T02D1276:103b-49	phyag rgya lnga yis rnam par brgyan //	phyag_0 rgya_6 lnga_11 yis_16 rnam_20 ba_25 rgyan_29 
T02D1276:103b-50	phyag ni gcig na ka p'a la bsnams //	phyag_0 ni_6 gcig_9 na_14 ka_17 p_20 la_24 snom_27 
T02D1276:104a-0	@104a * // g-yas kyi phyag na gri gug go //	g-yas_11 kyi_17 phyag_21 na_27 gri_30 gug_34 go_38 
T02D1276:104a-1	kha tv'am ga ni phyag g-yon na //	kha_0 tv_4 ga_10 ni_13 phyag_16 g-yon_22 na_28 
T02D1276:104a-2	rked pa stag gi pags pas g-yogs //	rked_0 ba_5 stag_8 gi_13 pags_16 ba_21 g-yogs_25 
T02D1276:104a-3	de nas rdo rje chags chen gyis //	de_0 nas_3 rdo_7 rje_11 chags_15 chen_21 gyis_26 
T02D1276:104a-4	rig ma dang bcas zhu bar gyur //	rig_0 ma_4 dang_7 'cha'_12 'ju_17 ba_21 gyur_25 
T02D1276:104a-5	sna tshogs glu dang nyer spyod pas //	sna_0 tshogs_4 glu_11 dang_15 nyer_20 spyod_25 ba_31 
T02D1276:104a-6	de nas lha mo skul bar byed //	de_0 nas_3 lha_7 mo_11 skul_14 ba_19 byed_23 
T02D1276:104a-7	snying rje'i yid kyis lha mo bzhengs //	snying_0 rje_7 yid_13 kyis_17 lha_22 mo_26 bzhengs_29 
T02D1276:104a-8	sbos mos bdag la yongs su skyobs //	sbo_0 mos_5 bdag_9 la_14 yongs_17 su_23 skyobs_26 
T02D1276:104a-9	stong pa'i ting 'dzin spangs nas ni //	stong_0 ba_6 ting_11 'dzin_16 spong_22 nas_29 ni_33 
T02D1276:104a-10	bde chen 'dod pas bdag la sbyor //	bde_0 chen_4 'dod_9 ba_14 bdag_18 la_23 sbyor_26 
T02D1276:104a-11	khyod mi bzhugs na bdag 'gum pas //	khyod_0 mi_6 bzhugs_9 na_16 bdag_19 'gum_24 ba_29 
T02D1276:104a-12	stong pa'i rang bzhin spangs nas su //	stong_0 ba_6 rang_11 bzhin_16 spong_22 nas_29 su_33 
T02D1276:104a-13	ri khrod ma 'bras bsgrub pa'i phyir //	ri_0 khrod_3 ma_9 'bras_12 sgrub_18 ba_25 phyir_30 
T02D1276:104a-14	dgyes pa rdo rje khyod bzhengs shig / dod pas 'jig rten snying mnan na //	dgyes_0 ba_6 rdo_9 rje_13 khyod_17 bzhengs_23 shig_31 ba_42 'jig_46 rten_51 snying_56 gnon_63 na_68 
T02D1276:104a-15	gtso bo ci phyir stong nyid bzhugs //	gtso_0 'bo_5 ci_8 phyir_11 stong_17 nyid_23 bzhugs_28 
T02D1276:104a-16	khyod mi bzhugs na phyogs rmongs pas //	khyod_0 mi_6 bzhugs_9 na_16 phyogs_19 rmongs_26 ba_33 
T02D1276:104a-17	gtum mo bdag ni gsol ba 'debs //	'thum_0 mo_5 bdag_8 ni_13 gsol_16 ba_21 'debs_24 
T02D1276:104a-18	bdag gis khyod kyi thugs 'tshal gyis //	bdag_0 gis_5 khyod_9 kyi_15 thugs_19 'tshal_25 gyis_32 
T02D1276:104a-19	sgyu 'phrul lta bur khyod bzhengs shig /	sgyu_0 'phrul_5 lta_12 bur_16 khyod_20 bzhengs_26 shig_34 
T02D1276:104a-20	'gro gtso smra bas bdag legs shes //	'gro_0 gtso_5 smra_10 ba_15 bdag_19 legs_24 shes_29 
T02D1276:104a-21	thugs rje rgyun chad ma mdzad cig / dang po stong nyid byang chub ste //	thugs_0 rje_6 rgyun_10 'chad_16 ma_21 mdzad_24 cig_30 dang_36 po_41 stong_44 nyid_50 byang_55 chub_61 ste_66 
T02D1276:104a-22	gnyis pa sa bon bsdus pa yin //	gnyis_0 ba_6 sa_9 bon_12 sdud_16 ba_22 yin_25 
T02D1276:104a-23	gsum pa gzugs ni rdzogs pa ste //	gsum_0 ba_5 gzugs_8 ni_14 rdzogs_17 ba_24 ste_27 
T02D1276:104a-24	bzhi pas sa bon dgod pa po //	bzhi_0 ba_5 sa_9 bon_12 'god_16 ba_21 po_24 
T02D1276:104a-25	h'um rdo rje las rdo rje cher //	h_0 rdo_5 rje_9 las_13 rdo_17 rje_21 cher_25 
T02D1276:104a-26	zhu ba'i gzugs ni bzhengs par gyur //	'ju_0 ba_4 gzugs_9 ni_15 bzhengs_18 ba_26 gyur_30 
T02D1276:104a-27	'gro ba'i don la 'od zer gyis //	'gro_0 ba_5 don_10 la_14 'od_17 zer_21 gyis_25 
T02D1276:104a-28	rang gi lus ni rnam spros pas //	rang_0 gi_5 lus_8 ni_12 rnam_15 spros_20 ba_26 
T02D1276:104a-29	nam mkha'i dkyil 'khor khyab byas nas //	nam_0 mkha_4 dkyil_11 'khor_17 khyab_23 byed_29 nas_34 
T02D1276:104a-30	tshogs re slar yang 'dus pa yin //	tshogs_0 re_7 slar_10 yang_15 'du_20 ba_25 yin_28 
T02D1276:104a-31	rnal 'byor zhe sdang bdag nyid gyur //	rnal_0 'byor_5 zhe_11 sdang_15 bdag_21 nyid_26 gyur_31 
T02D1276:104a-32	kha dog sngo zhing cung zad dmar //	kha_0 dog_4 sngo_8 zhing_13 cung_19 zad_24 dmar_28 
T02D1276:104a-33	dbu skra ser po gyen du brjes //	dbu_0 skra_4 ser_9 po_13 gyen_16 du_21 rje_24 
T02D1276:104a-34	phyag rgya lnga yi rgyan gyis brgyan //	phyag_0 rgya_6 lnga_11 yi_16 rgyan_19 gyis_25 rgyan_30 
T02D1276:104a-35	'khor lo rna cha mgul rgyan dang //	'khor_0 lo_6 rna_9 cha_13 mgul_17 rgyan_22 dang_28 
T02D1276:104a-36	lag pa'i gdu bu ska rags rnams //	lag_0 ba_4 gdu_9 bu_13 ska_16 rags_20 rnams_25 
T02D1276:104a-37	sangs rgyas lnga yi rnam dag ste //	sangs_0 rgya_6 lnga_12 yi_17 rnam_20 'dag_25 ste_29 
T02D1276:104a-38	phyag rgya lnga ru rab tu grags //	phyag_0 rgya_6 lnga_11 ru_16 rab_19 tu_23 grags_26 
T02D1276:104a-39	bcu drug cha byad khros pas gzigs //	'chu_0 drug_4 cha_9 byad_13 khro_18 ba_24 gzigs_28 
T02D1276:104a-40	phyag g-yon rdo rje thod pas mtshan //	phyag_0 g-yon_6 rdo_12 rje_16 thod_20 ba_25 mtshan_29 
T02D1276:104a-41	kha tv'am ga yang g-yon pa ni //	kha_0 tv_4 ga_10 yang_13 g-yon_18 ba_24 ni_27 
T02D1276:104a-42	rdo rje 'bar ba g-yas pa na //	rdo_0 rje_4 'bar_8 ba_13 g-yas_16 ba_22 na_25 
T02D1276:104a-43	h'um sgrogs pa yi bdag nyid can //	h_0 sgrogs_5 ba_12 yi_15 bdag_18 nyid_23 can_28 
T02D1276:104a-44	lha mo brgyad kyis yongs bskor nas //	lha_0 mo_4 brgyad_7 kyis_14 yongs_19 skor_25 nas_31 
T02D1276:104a-45	mgon po dur khrod nang na rol //	mgon_0 po_5 dur_8 khrod_12 nang_18 na_23 rol_26 
T02D1276:104a-46	dpal ni gnyis med ye shes te //	dpal_0 ni_5 gnyis_8 med_14 ye_18 shes_21 te_26 
T02D1276:104a-47	he ni rgyu sogs stong pa nyid //	he_0 ni_3 rgyu_6 sogs_11 stong_16 ba_22 nyid_25 
T02D1276:104a-48	ru ni bkod pa spangs pa yin //	ru_0 ni_3 bkod_6 ba_11 spong_14 ba_21 yin_24 
T02D1276:104b-0	ka ni gang du mi gnas @104b pa //	ka_0 ni_3 gang_6 du_11 mi_14 gnas_17 ba_28 
T02D1276:104b-1	chos kyi dbyings las nges 'khrungs pas //	chos_0 kyi_5 dbyings_9 las_17 nges_21 'khrung_26 ba_35 
T02D1276:104b-2	chos nyid bdag nyid bsgom pa yin //	chos_0 nyid_5 bdag_10 nyid_15 bsgom_20 ba_26 yin_29 
T02D1276:104b-3	aom dha rma dh'a tu sva bh'a ba a'atma ko&amp; ham //	aom_0 dha_4 rma_8 dh_12 tu_17 sva_20 bh_24 ba_29 a_32 ko&amp;_39 ham_47 
T02D1276:104b-4	mig ni rdo rje gti mug ma //	mig_0 ni_4 rdo_7 rje_11 gti_15 mug_19 ma_23 
T02D1276:104b-5	rna ba rdo rje zhe sdang ma //	rna_0 ba_4 rdo_7 rje_11 zhe_15 sdang_19 ma_25 
T02D1276:104b-6	sna ni ser sna rdo rje ma //	sna_0 ni_4 ser_7 sna_11 rdo_15 rje_19 ma_23 
T02D1276:104b-7	lce ni 'dod chags rdo rje ma //	lce_0 ni_4 'dod_7 chags_12 rdo_18 rje_22 ma_26 
T02D1276:104b-8	reg bya rdo rje phrag dog ma'o //	reg_0 byed_4 rdo_8 rje_12 phrag_16 dog_22 ma_26 
T02D1276:104b-9	bdag med rnal 'byor ma ni yid //	bdag_0 med_5 rnal_9 'byor_14 ma_20 ni_23 yid_26 
T02D1276:104b-10	sa spyod ma ni lus rdo rje //	sa_0 spyod_3 ma_9 ni_12 lus_15 rdo_19 rje_23 
T02D1276:104b-11	mkha' spyod ma ni gsung rdo rje //	mkha'_0 spyod_6 ma_12 ni_15 gsung_18 rdo_24 rje_28 
T02D1276:104b-12	thugs ni dbus na bzhugs pa'i phyir //	thugs_0 ni_6 dbus_9 na_14 bzhugs_17 ba_24 phyir_29 
T02D1276:104b-13	de phyir bdag med ma dbus 'khrungs //	de_0 phyir_3 bdag_9 med_14 ma_18 dbus_21 'khrung_26 
T02D1276:104b-14	rang snying nas ni sa bon byung //	rang_0 snying_5 nas_12 ni_16 sa_19 bon_22 'byung_26 
T02D1276:104b-15	'od zer nag po dang ldan la //	'od_0 zer_4 nag_8 po_12 dang_15 ldan_20 la_25 
T02D1276:104b-16	lcags kyu'i rnam pa can gyis ni //	lcags_0 kyu_6 rnam_12 ba_17 can_20 gyis_24 ni_29 
T02D1276:104b-17	khams gsum na bzhugs sangs rgyas rnams //	khams_0 gsum_6 na_11 bzhugs_14 sangs_21 rgya_27 rnams_33 
T02D1276:104b-18	yum brgyad dang bcas bkug nas ni //	yum_0 brgyad_4 dang_11 'cha'_16 'gugs_21 nas_26 ni_30 
T02D1276:104b-19	yang dag mchod nas gsol ba gdab //	yang_0 'dag_5 mchod_9 nas_15 gsol_19 ba_24 gdab_27 
T02D1276:104b-20	aom aa bhi shinytsa tu mam sarba ta th'a ga ta zhes bya bas so //	aom_0 aa_4 bhi_7 shinytsa_11 tu_20 mam_23 sarba_27 ta_33 th_36 ga_41 ta_44 zhes_47 byed_52 ba_56 so_60 
T02D1276:104b-21	he ru ka sku'i cha byad can //	he_0 ru_3 ka_6 sku_9 cha_15 byad_19 can_24 
T02D1276:104b-22	de bzhin gshegs pa lnga rnams kyis //	de_0 bzhin_3 gshegs_9 ba_16 lnga_19 rnams_24 kyis_30 
T02D1276:104b-23	de bzhin gshegs lnga bdag nyid can //	de_0 bzhin_3 gshegs_9 lnga_16 bdag_21 nyid_26 can_31 
T02D1276:104b-24	bdud rtsi lnga yis gang ba yi //	bdud_0 rtsi_5 lnga_10 yis_15 gang_19 ba_24 yi_27 
T02D1276:104b-25	bum pa'i dbang bskur te /	bum_0 ba_4 dbang_9 skur_15 te_21 
T02D1276:104b-26	rnga brdungs pa'i sgra dang ldan pas me tog gi char dang gur gum gyi char 'bebs shing //	rnga_0 rdung_5 ba_13 sgra_18 dang_23 ldan_28 ba_33 me_37 tog_40 gi_44 char_47 dang_52 gur_57 'gum_61 gyi_65 char_69 'bebs_74 shing_80 
T02D1276:104b-27	thugs rje la sogs pa mngon par bstod cing /	thugs_0 rje_6 la_10 sogs_13 ba_18 mngon_21 ba_27 bstod_31 cing_37 
T02D1276:104b-28	spyan la sogs pas glu len pas dbang bskur bas	spyan_0 la_6 sogs_9 ba_14 glu_18 len_22 ba_26 dbang_30 skur_36 ba_42 
T02D1276:104b-29	mgo la rang gi rigs kyi bdag po bzhugs par	mgo_0 la_4 rang_7 gi_12 rigs_15 kyi_20 bdag_24 po_29 bzhugs_32 ba_39 
T02D1276:104b-30	'gyur ro // 'khor lo'i gzugs ni mi bskyod pa //	'gyur_0 ro_6 'khor_12 lo_18 gzugs_23 ni_29 mi_32 skyod_35 ba_42 
T02D1276:104b-31	rna ba 'od dpag med kyi bdag / mgul rgyan	rna_0 ba_4 'od_7 dpog_11 med_16 kyi_20 bdag_24 mgul_31 rgyan_36 
T02D1276:104b-32	rin chen 'byung ba'i bdag / gdu bu rnam par	rin_0 chen_4 'byung_9 ba_16 bdag_21 gdu_28 bu_32 rnam_35 ba_40 
T02D1276:104b-33	snang mdzad 'dod // ska rags la ni don grub bzhugs //	snang_0 mdzad_6 'dod_12 ska_20 rags_24 la_29 ni_32 don_35 'grub_39 bzhugs_44 
T02D1276:104b-34	shes rab rang bzhin kha tv'am ga / khor ba mya ngan 'das pa yi //	shes_0 rab_5 rang_9 bzhin_14 kha_20 tv_24 ga_30 ba_40 mya_43 ngan_47 'da'_52 ba_57 yi_60 
T02D1276:104b-35	rnam rtog bcad pa padma'i snod //	rnam_0 rtogs_5 gcod_10 ba_15 padma_18 snod_26 
T02D1276:104b-36	rnam par grol ba'i rgyu ru ni //	rnam_0 ba_5 grol_9 ba_14 rgyu_19 ru_24 ni_27 
T02D1276:104b-37	bdud bzhi'i khrag ni gsol ba yin //	bdud_0 bzhi_5 khrag_12 ni_18 gsol_21 ba_26 yin_29 
T02D1276:104b-38	snying rje'i spyan ni dmar ba yin //	snying_0 rje_7 spyan_13 ni_19 dmar_22 ba_27 yin_30 
T02D1276:104b-39	yan lag nag po byams pa'i sems //	yan_0 lag_4 nag_8 po_12 byams_15 ba_21 sems_26 
T02D1276:104b-40	pags pa byang chub yan lag bdun //	pags_0 ba_5 byang_8 chub_14 yan_19 lag_23 bdun_27 
T02D1276:104b-41	rus pa'i rgyan ni bden pa bzhi //	rus_0 ba_4 rgyan_9 ni_15 bden_18 ba_23 bzhi_26 
T02D1276:104b-42	khro ba ma rungs gdul bya la //	khro_0 ba_5 ma_8 rungs_11 gdul_17 byed_22 la_26 
T02D1276:104b-43	khrag ni sha ba r'i ru bstan //	khrag_0 ni_6 sha_9 ba_13 r_16 ru_20 ston_23 
T02D1276:104b-44	khu ba tsandal'i ru grags //	khu_0 ba_4 tsandal_7 ru_17 grags_20 
T02D1276:104b-45	tshil dang rkang ni do mbi n'i //	tshil_0 dang_6 rkang_11 ni_17 do_20 mbi_23 n_27 
T02D1276:104b-46	bdud la sogs pa nyes pa drug / gcod phyir gri gug thogs pas bzhugs //	bdud_0 la_5 sogs_8 ba_13 nyes_16 ba_21 drug_24 gcod_31 phyir_36 gri_42 gug_46 thogs_50 ba_56 bzhugs_60 
T02D1276:104b-47	thod pa stong nyid ngo bo ste /	thod_0 ba_5 stong_8 nyid_14 ngo_19 'bo_23 ste_26 
T02D1276:105a-0	@105a * // thams cad thabs su shes par bya //	thams_11 cad_17 thabs_21 su_27 shes_30 ba_35 byed_39 
T02D1276:105a-1	dus tshigs gsum ldan byin gyis brlabs //	dus_0 tshigs_4 gsum_11 ldan_16 byin_21 gyis_26 brlabs_31 
T02D1276:105a-2	lha yi sku ru gnas par bya //	lha_0 yi_4 sku_7 ru_11 gnas_14 ba_19 byed_23 
T02D1276:105a-3	bya rnams byed tshe rnal 'byor pas //	byed_0 rnams_4 byed_10 tshe_15 rnal_20 'byor_25 ba_31 
T02D1276:105a-4	rnal 'byor 'di ni dran par bya //	rnal_0 'byor_5 'di_11 ni_15 dran_18 ba_23 byed_27 
T02D1276:105a-5	skad cig tsam yang sems gzhan ni //	skad_0 cig_5 tsam_9 yang_14 sems_19 gzhan_24 ni_30 
T02D1276:105a-6	ma rig ma rungs ldan sems kyis //	ma_0 rig_3 ma_7 rungs_10 ldan_16 sems_21 kyis_26 
T02D1276:105a-7	dngos grub 'dod pa'i sgrub pa pos //	dngos_0 'grub_6 'dod_11 ba_16 sgrub_21 ba_27 pos_30 
T02D1276:105a-8	'bad pas mkhas pas gnas mi bya //	'bad_0 ba_5 mkhas_9 ba_15 gnas_19 mi_24 byed_27 
T02D1276:105a-9	zla drug rnal 'byor pas bsgoms na //	zla_0 drug_4 rnal_9 'byor_14 ba_20 sgom_24 na_31 
T02D1276:105a-10	the tshom 'dir med dngos grub thob //	the_0 tshom_4 'dir_10 med_15 dngos_19 'grub_25 'thob_30 
T02D1276:105a-11	de la so ma nyi mi bya ste //	de_0 la_3 so_6 ma_9 nyi_12 mi_16 byed_19 ste_23 
T02D1276:105a-12	sangs rgyas rdzu 'phrul bsam mi khyab //	sangs_0 rgya_6 rdzu_12 'phrul_17 bsam_24 mi_29 khyab_32 
T02D1276:105a-13	yan lag ji snyed yod pa dang //	yan_0 lag_4 ji_8 snyed_11 yod_17 ba_21 dang_24 
T02D1276:105a-14	gong du brjod pa thams cad ni //	gong_0 du_5 rjod_8 ba_14 thams_17 cad_23 ni_27 
T02D1276:105a-15	de snyed sngags dang phyag rgya yin //	de_0 snyed_3 sngags_9 dang_16 phyag_21 rgya_27 yin_32 
T02D1276:105a-16	dpal ldan he ru'i go 'phang gnas //	dpal_0 ldan_5 he_10 ru_13 go_18 'phen_21 gnas_28 
T02D1276:105a-17	de la sngags ni 'di yin te //	de_0 la_3 sngags_6 ni_13 'di_16 yin_20 te_24 
T02D1276:105a-18	aom tree lo ky'a kshe pa h'um h'um h'um phat sv'a h'a /	aom_0 tree_4 lo_9 ky_12 kshe_17 ba_22 h_25 h_30 h_35 phat_40 sv_45 h_50 
T02D1276:105a-19	gshegs su gsol ba'i don du spyan drangs nas //	gshegs_0 su_7 gsol_10 ba_15 don_20 du_24 spyan_27 drangs_33 nas_40 
T02D1276:105a-20	yang dag par mchod la //	yang_0 'dag_5 ba_9 mchod_13 la_19 
T02D1276:105a-21	bsod nams yongs su bsngos la bzod par gsol lo //	bsod_0 nams_5 yongs_10 su_16 sngo_19 la_26 bzod_29 ba_34 gsol_38 lo_43 
T02D1276:105a-22	he ru ka rnam par bsams nas ldang ba'i bla ma'i man ngag yin no //	he_0 ru_3 ka_6 rnam_9 ba_14 bsams_18 nas_24 ldang_28 ba_34 bla_39 ma_43 man_48 ngag_52 yin_57 no_61 
T02D1276:105a-23	shes rab bla ma'i zho rtag tu //	shes_0 rab_5 bla_9 ma_13 zho_18 rtag_22 tu_27 
T02D1276:105a-24	bla ma dam pa'i gdams ngag gi / bdud rtsi myang ba gang yin pa //	bla_0 ma_4 dam_7 ba_11 'doms_16 ngag_22 gi_27 bdud_32 rtsi_37 myang_42 ba_48 gang_51 yin_56 ba_60 
T02D1276:105a-25	de yis sangs rgyas thob par 'gyur //	de_0 yis_3 sangs_7 rgya_13 'thob_19 ba_24 'gyur_28 
T02D1276:105a-26	dgyes rdor rgyud las gsungs pa yi //	dgyes_0 rdar_6 brgyud_11 las_17 gsungs_21 ba_28 yi_31 
T02D1276:105a-27	der rnyed rim pas bsdus nas ni //	der_0 rnyed_4 rim_10 ba_14 sdud_18 nas_24 ni_28 
T02D1276:105a-28	dgyes pa'i sgrub thabs gsal byas pas //	dgyes_0 ba_6 sgrub_11 thabs_17 gsal_23 byed_28 ba_33 
T02D1276:105a-29	bsod nams dpag med gang bsags pa //	bsod_0 nams_5 dpog_10 med_15 gang_19 bsags_24 ba_30 
T02D1276:105a-30	des ni ltas ngan nyes mang zhing //	des_0 ni_4 ltas_7 ngan_12 nyes_17 mang_22 zhing_27 
T02D1276:105a-31	sdug bsngal gyis rmongs bsam ldan 'gro //	sdug_0 sngal_5 gyis_12 rmongs_17 bsam_24 ldan_29 'gro_34 
T02D1276:105a-32	ma lus thub dbang dkyil 'khor che //	ma_0 lus_3 thub_7 dbang_12 dkyil_18 'khor_24 che_30 
T02D1276:105a-33	dpal ldan rgyal po'i snod thob shog / gsung bsdus pa'i dgyes pa rdo rje'i sgrub thabs rdzogs so /	dpal_0 ldan_5 rgyal_10 po_16 snod_21 'thob_26 shog_31 gsung_38 sdud_44 ba_50 dgyes_55 ba_61 rdo_64 rje_68 sgrub_74 thabs_80 rdzogs_86 so_93 
T02D1276:105a-35	// / rgya gar gyi mkhan po su ma ti shr'i bha dra dang /	rgya_5 gar_10 gyi_14 mkhan_18 po_24 su_27 ma_30 ti_33 shr_36 bha_42 'dra_46 dang_50 
T02D1276:105a-36	dge slong sh'akya 'od kyis bsgyur//	dge_0 slong_4 sh_10 'od_18 kyis_22 
