T02D1228:36b-4	lhag nas me lha'i mchod par bya //	lhag_0 nas_5 me_9 lha_12 mchod_18 ba_24 byed_28 
T02D1228:36b-5	aom aagna ye sv'a h'a //	aom_0 aagna_4 ye_10 sv_13 h_18 
T02D1228:36b-6	zhes pas so //	zhes_0 ba_5 so_9 
T02D1228:36b-7	de nas rdzas kun phul ba dang /	de_0 nas_3 rdzas_7 kun_13 'bul_17 ba_22 dang_25 
T02D1228:36b-8	dgang gzar mar gyis bkang nas ni //	'geng_0 gzar_6 mar_11 gyis_15 'geng_20 nas_26 ni_30 
T02D1228:36b-9	de nas slob mas me tog bor //	de_0 nas_3 slob_7 mas_12 me_16 tog_19 'bor_23 
T02D1228:36b-10	las dang mthun pa'i legs par brjod //	las_0 dang_4 mthun_9 ba_15 legs_20 ba_25 rjod_29 
T02D1228:36b-11	aom aagna ye sv'a h'a /	aom_0 aagna_4 ye_10 sv_13 h_18 
T02D1228:36b-12	zhes pas dbul //	zhes_0 ba_5 'bul_9 
T02D1228:36b-13	shantim ku ru zhi ba la /	shantim_0 ku_8 ru_11 zhi_14 ba_18 la_21 
T02D1228:36b-14	rgyas pa pushtim pa sham dbang //	rgya_0 ba_6 pushtim_9 ba_17 sham_20 dbang_25 
T02D1228:36b-15	zhi ba'i sbyin sreg byed pa'i dus su rnal 'byor	zhi_0 ba_4 sbyin_9 sreg_15 byed_20 ba_25 dus_30 su_34 rnal_37 'byor_42 
T02D1228:36b-16	pas bya ba'i rim pa ni 'di dag yin te	ba_0 byed_4 ba_8 rim_13 ba_17 ni_20 'di_23 'dag_27 yin_31 te_35 
T02D1228:36b-17	/ dang por thab khung gi bye brag bya ba dang /	dang_2 por_7 thab_11 khung_16 gi_22 'bye_25 brag_29 byed_34 ba_38 dang_41 
T02D1228:36b-18	tshad dang kha dog dang /	tshad_0 dang_6 kha_11 dog_15 dang_19 
T02D1228:36b-19	mtshan ma bri ba dang dus dang phyogs dang /	mtshan_0 ma_7 'bri_10 ba_14 dang_17 dus_22 dang_26 phyogs_31 dang_38 
T02D1228:36b-20	rdzas kyi mtshan nyid dang /	rdzas_0 kyi_6 mtshan_10 nyid_17 dang_22 
T02D1228:36b-21	rdzas byin gyis brlab pa dang /	rdzas_0 byin_6 gyis_11 brlab_16 ba_22 dang_25 
T02D1228:36b-22	rnal 'byor bskyed pa dang /	rnal_0 'byor_5 skyed_11 ba_18 dang_21 
T02D1228:36b-23	yam shing gi mtshan nyid dang /	yam_0 shing_4 gi_10 mtshan_13 nyid_20 dang_25 
T02D1228:36b-24	bud shing gi mtshan nyid dang /	'bud_0 shing_4 gi_10 mtshan_13 nyid_20 dang_25 
T02D1228:36b-25	me spar ba'i mtshan nyid dang /	me_0 spor_3 ba_8 mtshan_13 nyid_20 dang_25 
T02D1228:36b-26	ku sha dgram pa dang /	ku_0 sha_3 'grem_7 ba_13 dang_16 
T02D1228:36b-27	thab khung byin gyis brlab pa dang /	thab_0 khung_5 byin_11 gyis_16 brlab_21 ba_27 dang_30 
T02D1228:36b-28	der dam tshig gi me lha bskyed pa dang /	der_0 dam_4 tshig_8 gi_14 me_17 lha_20 skyed_24 ba_31 dang_34 
T02D1228:36b-29	de la ye shes kyi me lha spyan drang ba dang /	de_0 la_3 ye_6 shes_9 kyi_14 me_18 lha_21 spyan_25 'dren_31 ba_37 dang_40 
T02D1228:36b-30	bsang gtor dang /	bsang_0 'thor_6 dang_11 
T02D1228:36b-31	yang der bdag nyid kyi lha'i 'khor lo bskyed pa dang /	yang_0 der_5 bdag_9 nyid_14 kyi_19 lha_23 'khor_29 lo_35 skyed_38 ba_45 dang_48 
T02D1228:36b-32	de la ye shes kyi 'khor lo dgug gzhug bya ba dang /	de_0 la_3 ye_6 shes_9 kyi_14 'khor_18 lo_24 'gugs_27 'jug_32 byed_38 ba_42 dang_45 
T02D1228:36b-33	der dgang blugs la sogs pa dbul ba dang /	der_0 'geng_4 blugs_10 la_16 sogs_19 ba_24 'bul_27 ba_32 dang_35 
T02D1228:36b-34	mchod pa la sogs pa phul la /	mchod_0 ba_6 la_9 sogs_12 ba_17 'bul_20 la_25 
T02D1228:36b-35	ye shes kyi lha gshegs su gsol te /	ye_0 shes_3 kyi_8 lha_12 gshegs_16 su_23 gsol_26 te_31 
T02D1228:36b-36	dam tshig gi 'khor lo bsdu ba dang /	dam_0 tshig_4 gi_10 'khor_13 lo_19 sdud_22 ba_27 dang_30 
T02D1228:36b-37	yang me lha la mchod pa la sogs pa bya ste /	yang_0 me_5 lha_8 la_12 mchod_15 ba_21 la_24 sogs_27 ba_32 byed_35 ste_39 
T02D1228:36b-38	ye shes kyi lha bskul ba dang /	ye_0 shes_3 kyi_8 lha_12 skul_16 ba_22 dang_25 
T02D1228:36b-39	dam tshig gi me lha bsdus la /	dam_0 tshig_4 gi_10 me_13 lha_16 sdud_20 la_26 
T02D1228:36b-40	rdzas lhag mas sbyin sreg bya ste /	rdzas_0 lhag_6 mas_11 sbyin_15 sreg_21 byed_26 ste_30 
T02D1228:36b-41	bdag nyid ci bder gnas par bya'o //	bdag_0 nyid_5 ci_10 bder_13 gnas_18 ba_23 byed_27 
T02D1228:36b-42	mngon spyod la ni m'a ra ya //	mngon_0 spyod_6 la_12 ni_15 m_18 ra_22 ya_25 
T02D1228:36b-43	mar gyi sbyin sreg brgya rtsa brgyad //	mar_0 gyi_4 sbyin_8 sreg_14 brgya_19 rtsa_25 brgyad_30 
T02D1228:36b-44	me lha'i mchod pa byas nas ni //	me_0 lha_3 mchod_9 ba_15 byed_18 nas_23 ni_27 
T02D1228:36b-45	mchod pa'i zhal bsil gong ma bzhin //	mchod_0 ba_6 zhal_11 bsil_16 gong_21 ma_26 bzhin_29 
T02D1228:36b-46	so rtsi na bza' la sogs pas //	so_0 rtsi_3 na_8 bza'_11 la_16 sogs_19 ba_24 
T02D1228:36b-47	me lha mnyes par byas nas ni //	me_0 lha_3 mnyes_7 ba_13 byed_17 nas_22 ni_26 
T02D1228:36b-48	rang bzhin dag pa'i tshigs bcad brjod //	rang_0 bzhin_5 'dag_11 ba_15 tshigs_20 gcod_27 rjod_32 
T02D1228:36b-49	me lha nam mkhar gshegs su gsol //	me_0 lha_3 nam_7 mkhar_11 gshegs_17 su_24 gsol_27 
T02D1228:36b-50	me lha'i mchod pa'i rim pa'o //	me_0 lha_3 mchod_9 ba_15 rim_20 ba_24 
T02D1228:36b-51	zab mo'i don ni man ngag yin pas 'dir ma bstan //	zab_0 mo_4 don_9 ni_13 man_16 ngag_20 yin_25 ba_29 'dir_33 ma_38 ston_41 
T02D1228:36b-52	kye yi rdo rje zhes bya ba'i //	kye_0 yi_4 rdo_7 rje_11 zhes_15 byed_20 ba_24 
T02D1228:36b-53	sbyin sreg rim pa gsal byed pas //	sbyin_0 sreg_6 rim_11 ba_15 gsal_18 byed_23 ba_28 
T02D1228:36b-54	dge ba thob pa gang yin des //	dge_0 ba_4 'thob_7 ba_12 gang_15 yin_20 des_24 
T02D1228:37a-0	myur bar sems can grol gyur @37a * //	myur_0 ba_5 sems_9 can_14 grol_18 gyur_23 
T02D1228:37a-1	cig / sbyin sreg gi cho ga mdor bsdus pa //	cig_0 sbyin_6 sreg_12 gi_17 cho_20 ga_24 mdor_27 sdud_32 ba_38 
T02D1228:37a-2	slob dpon po dhi garbhas mdzad pa rdzogs so /	slob_0 dpon_5 po_10 dhi_13 garbhas_17 mdzad_25 ba_31 rdzogs_34 so_41 
T02D1228:37a-4	// / rgya gar gyi mkhan po ka m'a la shr'i dang /	rgya_5 gar_10 gyi_14 mkhan_18 po_24 ka_27 m_30 la_34 shr_37 dang_43 
T02D1228:37a-5	dge slong shes rab skyabs kyis bsgyur//	dge_0 slong_4 shes_10 rab_15 skyob_19 kyis_26 
