T02D1380:265b-0	@265b * // dpal dus kyi 'khor lo'i sdom tshig bzhugs /	dpal_11 dus_16 kyi_20 'khor_24 lo_30 sdom_35 tshig_40 bzhugs_46 
T02D1380:265b-2	# // dam pa rnams la phyag 'tshal lo //	dam_5 ba_9 rnams_12 la_18 phyag_21 'tshal_27 lo_34 
T02D1380:265b-3	bden pa dbyer med dus 'khor lo //	bden_0 ba_5 dbyer_8 med_14 dus_18 'khor_22 lo_28 
T02D1380:265b-4	shes bya'i cha nas gnyis zhes bya //	shes_0 byed_5 cha_11 nas_15 gnyis_19 zhes_25 byed_30 
T02D1380:265b-5	brjod bya dang ni rjod byed do //	rjod_0 byed_6 dang_10 ni_15 rjod_18 byed_23 do_28 
T02D1380:265b-6	brjod bya bden pa gnyis yin te //	rjod_0 byed_6 bden_10 ba_15 gnyis_18 yin_24 te_28 
T02D1380:265b-7	kun rdzob phyi nang gzhan dang gsum //	kun_0 rdzob_4 phyi_10 nang_15 gzhan_20 dang_26 gsum_31 
T02D1380:265b-8	phyi ni 'chags gnas 'jig pa ste //	phyi_0 ni_5 'chag_8 gnas_15 'jig_20 ba_25 ste_28 
T02D1380:265b-9	chags pa rten dang brten pa'o //	chags_0 ba_6 rten_9 dang_14 rten_19 ba_25 
T02D1380:265b-10	rten ni rgyu dang go rims dbyings //	rten_0 ni_5 rgyu_8 dang_13 go_18 rims_21 dbyings_26 
T02D1380:265b-11	rang bzhin kha dog ming dang ni //	rang_0 bzhin_5 kha_11 dog_15 ming_19 dang_24 ni_29 
T02D1380:265b-12	yi ge grangs dang tshad dag go //	yi_0 ge_3 grangs_6 dang_13 tshad_18 'dag_24 go_28 
T02D1380:265b-13	rgyu ni las kyi 'dus byas nas //	rgyu_0 ni_5 las_8 kyi_12 'du_16 byed_21 nas_26 
T02D1380:265b-14	rdul phran dag las skyes par 'dod //	rdul_0 phran_5 'dag_11 las_15 skye_19 ba_25 'dod_29 
T02D1380:265b-15	stong dang rlung sogs rim pa'o //	stong_0 dang_6 rlung_11 sogs_17 rim_22 ba_26 
T02D1380:265b-16	dbyings ni gzhu sogs rang bzhin ni //	dbyings_0 ni_8 gzhu_11 sogs_16 rang_21 bzhin_26 ni_32 
T02D1380:265b-17	g-yo sogs kha dog sngo la sogs //	g-yo_0 sogs_5 kha_10 dog_14 sngo_18 la_23 sogs_26 
T02D1380:265b-18	ming ni rlung sogs ri la sogs //	ming_0 ni_5 rlung_8 sogs_14 ri_19 la_22 sogs_25 
T02D1380:265b-19	yi ge ya ra la sogs pa'o //	yi_0 ge_3 ya_6 ra_9 la_12 sogs_15 ba_20 
T02D1380:265b-20	grangs ni rlung dang mtsho yi bar //	grangs_0 ni_7 rlung_10 dang_16 mtsho_21 yi_27 ba_30 
T02D1380:265b-21	tshad ni rngams dang mtha' skor ro //	tshad_0 ni_6 rngams_9 dang_16 mtha'_21 skor_27 ro_32 
T02D1380:265b-22	brten pa sems can zhes bya ste //	rten_0 ba_6 sems_9 can_14 zhes_18 byed_23 ste_27 
T02D1380:265b-23	rgyu dang ming gi rab dbye dang //	rgyu_0 dang_5 ming_10 gi_15 rab_18 'byed_22 dang_27 
T02D1380:265b-24	so so'i gnas dang tshe tshad dang //	so_0 so_3 gnas_8 dang_13 tshe_18 tshad_23 dang_29 
T02D1380:265b-25	sa bon yi ger rab shes bya //	sa_0 bon_3 yi_7 ger_10 rab_14 shes_18 byed_23 
T02D1380:265b-26	rgyu ni las dang nyon mongs dang //	rgyu_0 ni_5 las_8 dang_12 nyon_17 mongs_22 dang_28 
T02D1380:265b-27	ming ni mnar med nas bzung nas //	ming_0 ni_5 mnar_8 med_13 nas_17 bzung_21 nas_27 
T02D1380:265b-28	srid pa sum cu rtsa gcig bar //	srid_0 ba_5 sum_8 cu_12 rtsa_15 gcig_20 ba_25 
T02D1380:265b-29	gnas ni rlung dang srid rtse'i bar //	gnas_0 ni_5 rlung_8 dang_14 srid_19 rtse_24 ba_31 
T02D1380:265b-30	tshe tshad lo dang bskal pa'i grangs //	tshe_0 tshad_5 lo_11 dang_14 bskal_19 ba_25 grangs_30 
T02D1380:265b-31	sa bon yi ge ka la sogs //	sa_0 bon_3 yi_7 ge_10 ka_13 la_16 sogs_19 
T02D1380:265b-32	'chags pa sdud par shes par bya //	'chag_0 ba_7 sdud_10 ba_15 shes_19 ba_24 byed_28 
T02D1380:265b-33	gnas pa rnam pa gnyis yin te //	gnas_0 ba_5 rnam_8 ba_13 gnyis_16 yin_22 te_26 
T02D1380:265b-34	bstan pa dus dang byed pa rtsis //	ston_0 ba_6 dus_9 dang_13 byed_18 ba_23 rtsis_26 
T02D1380:265b-35	dang po dus bzhi la sogs pas //	dang_0 po_5 dus_8 bzhi_12 la_17 sogs_20 ba_25 
T02D1380:265b-36	sa yi dum bu rnams la ni //	sa_0 yi_3 dum_6 bu_10 rnams_13 la_19 ni_22 
T02D1380:265b-37	'khor los sgyur rgyal lus kyis su //	'khor_0 los_6 sgyur_10 rgyal_16 lus_22 kyis_26 su_31 
T02D1380:265b-38	log 'dren mthar byed legs rnams 'dzin //	log_0 bgrang_4 mthar_10 byed_16 legs_21 rnams_26 'dzin_32 
T02D1380:265b-39	byed pa yan lag lngas bsdus te //	byed_0 ba_5 yan_8 lag_12 lngas_16 sdud_22 te_28 
T02D1380:265b-40	gza' ni tshes dang rgyu skar dang //	gza'_0 ni_5 tshes_8 dang_14 rgyu_19 skar_24 dang_29 
T02D1380:265b-41	khyim la gnas pa dag yin no //	khyim_0 la_6 gnas_9 ba_14 'dag_17 yin_21 no_25 
T02D1380:265b-42	tshes ni dbyangs dang rten 'brel dang //	tshes_0 ni_6 dbyangs_9 dang_17 rten_22 'brel_27 dang_33 
T02D1380:265b-43	drag mo la sogs shes par bya //	drag_0 mo_5 la_8 sogs_11 shes_16 ba_21 byed_25 
T02D1380:265b-44	'jig pa sa sogs rim zhugs pas //	'jig_0 ba_5 sa_8 sogs_11 rim_16 'jug_20 ba_26 
T02D1380:265b-45	tha ma stong par gyur pa'o //	tha_0 ma_4 stong_7 ba_13 gyur_17 ba_22 
T02D1380:265b-46	nang ni skye gnas 'chi ba ste //	nang_0 ni_5 skye_8 gnas_13 'chi_18 ba_23 ste_26 
T02D1380:265b-47	skye ba nang dang phyi dag go //	skye_0 ba_5 nang_8 dang_13 phyi_18 'dag_23 go_27 
T02D1380:266a-0	nang @266a * //	nang_0 
T02D1380:266a-1	gi dus dang rgyu dag dang //	gi_0 dus_3 dang_7 rgyu_12 'dag_17 dang_21 
T02D1380:266a-2	ngo bo rkyen rnams rdzogs dus so //	ngo_0 'bo_4 rkyen_7 rnams_13 rdzogs_19 dus_26 so_30 
T02D1380:266a-3	dus ni ye shes g-yo ba dang //	dus_0 ni_4 ye_7 shes_10 g-yo_15 ba_20 dang_23 
T02D1380:266a-4	rgyu ni khu srog skye gnas khrag / ngo bo phung po khams rang bzhin //	rgyu_0 ni_5 khu_8 srog_12 skye_17 gnas_22 khrag_27 ngo_35 'bo_39 'phung_42 po_48 khams_51 rang_57 bzhin_62 
T02D1380:266a-5	rkyen ni ma yis rdo zos mthus //	rkyen_0 ni_6 ma_9 yis_12 rdo_16 zos_20 mthus_24 
T02D1380:266a-6	rnam pa khu khrag rtsa rlung gis //	rnam_0 ba_5 khu_8 khrag_12 rtsa_18 rlung_23 gis_29 
T02D1380:266a-7	gtso bo brgyad ni bskyed pa'o //	gtso_0 'bo_5 brgyad_8 ni_15 skyed_18 ba_25 
T02D1380:266a-8	rdzogs dus bcu gnyis bcu gsum mo //	rdzogs_0 dus_7 'chu_11 gnyis_15 'chu_21 gsum_25 mo_30 
T02D1380:266a-9	phyi nas dbyibs dang tshad dag dang //	phyi_0 nas_5 dbyibs_9 dang_16 tshad_21 'dag_27 dang_31 
T02D1380:266a-10	rnam grangs dag tu bstan pa yin //	rnam_0 grangs_5 'dag_12 tu_16 ston_19 ba_25 yin_28 
T02D1380:266a-11	dbyibs ni lus dang yan lag sogs //	dbyibs_0 ni_7 lus_10 dang_14 yan_19 lag_23 sogs_27 
T02D1380:266a-12	tshad ni sor dang khru yi bar //	tshad_0 ni_6 sor_9 dang_13 khru_18 yi_23 ba_26 
T02D1380:266a-13	dbye ba phung po khams dag dang //	'byed_0 ba_5 'phung_8 po_14 khams_17 'dag_23 dang_27 
T02D1380:266a-14	dbang po las kyi dbang po dang //	dbang_0 po_6 las_9 kyi_13 dbang_17 po_23 dang_26 
T02D1380:266a-15	'khor lo bya ba'i 'khor lo dang //	'khor_0 lo_6 byed_9 ba_13 'khor_18 lo_24 dang_27 
T02D1380:266a-16	las kyi 'khor lo dag tu'o //	las_0 kyi_4 'khor_8 lo_14 'dag_17 tu_21 
T02D1380:266a-17	de yang rtsa rlung sems dag gis //	de_0 yang_3 rtsa_8 rlung_13 sems_19 'dag_24 gis_28 
T02D1380:266a-18	lus kyi ngo bo bsdus pa'o //	lus_0 kyi_4 ngo_8 'bo_12 sdud_15 ba_21 
T02D1380:266a-19	gnas pa las dang bsrung ba'o //	gnas_0 ba_5 las_8 dang_12 bsrung_17 ba_24 
T02D1380:266a-20	las ni phyi nyid nang sbyar bas //	las_0 ni_4 phyi_7 nyid_12 nang_17 sbyor_22 ba_28 
T02D1380:266a-21	dus kyi 'khor lor gyur pa'o //	dus_0 kyi_4 'khor_8 lor_14 gyur_18 ba_23 
T02D1380:266a-22	bsrung ba sems kyi sdig gzhom dang //	bsrung_0 ba_7 sems_10 kyi_15 sdig_19 'joms_24 dang_30 
T02D1380:266a-23	nad zhi lus kyi bcud len no //	nad_0 zhi_4 lus_8 kyi_12 bcud_16 len_21 no_25 
T02D1380:266a-24	'chi ba dus dang dus min pa'o //	'chi_0 ba_5 dus_8 dang_12 dus_17 min_21 ba_25 
T02D1380:266a-25	gzhan ni sgrub pa'i thabs dang ni //	gzhan_0 ni_6 sgrub_9 ba_15 thabs_20 dang_26 ni_31 
T02D1380:266a-26	'jig rten dbang ni ngo bo dang //	'jig_0 rten_5 dbang_10 ni_16 ngo_19 'bo_23 dang_26 
T02D1380:266a-27	nges tshig dbye ba cho ga'o //	nges_0 tshig_5 'byed_11 ba_16 cho_19 ga_23 
T02D1380:266a-28	ngo bo gzhan las thob bya ste //	ngo_0 'bo_4 gzhan_7 las_13 'thob_17 byed_22 ste_26 
T02D1380:266a-29	nges tshig dri 'khrud nges par 'joms //	nges_0 tshig_5 'dri_11 'khrud_15 nges_22 ba_27 'joms_31 
T02D1380:266a-30	dbye ba thun mong khyad par gyis //	'byed_0 ba_5 thun_8 mong_13 khyad_18 ba_24 gyis_28 
T02D1380:266a-31	bdun dang gsum du shes par bya'o //	bdun_0 dang_5 gsum_10 du_15 shes_18 ba_23 byed_27 
T02D1380:266a-32	cho ga sbyor ba dngos gzhi'o /	cho_0 ga_4 sbyor_7 ba_13 dngos_16 gzhi_22 
T02D1380:266a-33	sgrub pa lam dang 'bras bu ste //	sgrub_0 ba_6 lam_9 dang_13 'bras_18 bu_24 ste_27 
T02D1380:266a-34	lam ni las dang ye shes so //	lam_0 ni_4 las_7 dang_11 ye_16 shes_19 so_24 
T02D1380:266a-35	las brgya'i ngo bo dbye ba dang //	las_0 brgya_4 ngo_12 'bo_16 'byed_19 ba_24 dang_27 
T02D1380:266a-36	nyams su blang ba'i cho ga'o //	nyams_0 su_6 blang_9 ba_15 cho_20 ga_24 
T02D1380:266a-37	ngo bo nus pa sgra ldan pa //	ngo_0 'bo_4 nus_7 ba_11 sgra_14 ldan_19 ba_24 
T02D1380:266a-38	dbye ba gzhan gyi rigs la sogs //	'byed_0 ba_5 gzhan_8 gyi_14 rigs_18 la_23 sogs_26 
T02D1380:266a-39	nyams blangs bsnyen sgrub sgrub pa'o //	nyams_0 blangs_6 snyen_13 sgrub_20 sgrub_26 ba_32 
T02D1380:266a-40	ye shes phyag rgya'i ngo bo ni //	ye_0 shes_3 phyag_8 rgya_14 ngo_21 'bo_25 ni_28 
T02D1380:266a-41	rang gi sems kyis brtags pa ste //	rang_0 gi_5 sems_8 kyis_13 rtog_18 ba_25 ste_28 
T02D1380:266a-42	dbye ba dkyil 'khor rnam gsum mo //	'byed_0 ba_5 dkyil_8 'khor_14 rnam_20 gsum_25 mo_30 
T02D1380:266a-43	cho ga sngon 'gro dngos dang mjug / dngos ni bskyed dang bsgom pa'o //	cho_0 ga_4 sngon_7 'gro_13 dngos_18 dang_24 mjug_29 dngos_36 ni_42 skyed_45 dang_52 bsgom_57 ba_63 
T02D1380:266a-44	bsgom pa dngos zhen rnam gnyis dang //	bsgom_0 ba_6 dngos_9 zhen_15 rnam_20 gnyis_25 dang_31 
T02D1380:266a-45	zhen bral dag pa bsgom pa'o //	zhen_0 'bral_5 'dag_10 ba_14 bsgom_17 ba_23 
T02D1380:266a-46	rjes ni mnyam gzhag las langs la //	rjes_0 ni_5 mnyam_8 'jog_14 las_20 ldang_24 la_30 
T02D1380:266a-47	snang grags chos la sogs pa yang //	snang_0 grags_6 chos_12 la_17 sogs_20 ba_25 yang_28 
T02D1380:266a-48	nang gi rnam pa phyis sbyar nas //	nang_0 gi_5 rnam_8 ba_13 'byid_16 sbyor_22 nas_28 
T02D1380:266a-49	lus ngag yid kyis byas pa'o //	lus_0 ngag_4 yid_9 kyis_13 byed_18 ba_23 
T02D1380:266a-50	'bras bu 'dod dang gzugs khams kyi //	'bras_0 bu_6 'dod_9 dang_14 gzugs_19 khams_25 kyi_31 
T02D1380:266a-51	mthar thug thob par 'gyur ba'o //	mthar_0 thug_6 'thob_11 ba_16 'gyur_20 ba_26 
T02D1380:266a-52	don dam bden pa la brten pa //	don_0 dam_4 bden_8 ba_13 la_16 rten_19 ba_25 
T02D1380:266a-53	lta ba lam dang 'bras bu'o //	lta_0 ba_4 lam_7 dang_11 'bras_16 bu_22 
T02D1380:266a-54	chos nyid mi mthun phyi nang gi //	chos_0 nyid_5 mi_10 mthun_13 phyi_19 nang_24 gi_29 
T02D1380:266a-55	log par rtog pa bstan pa'o //	log_0 ba_4 rtogs_8 ba_13 ston_16 ba_22 
T02D1380:266b-0	mthun pa @266b gnyis su med sgrub pa //	mthun_0 ba_6 gnyis_15 su_21 med_24 sgrub_28 ba_34 
T02D1380:266b-1	ngo bo dbye ba mtshon byed dang //	ngo_0 'bo_4 'byed_7 ba_12 mtshon_15 byed_22 dang_27 
T02D1380:266b-2	dpe yi rnam par shes par bya //	dpe_0 yi_4 rnam_7 ba_12 shes_16 ba_21 byed_25 
T02D1380:266b-3	ngo bo mi rtog ye shes te //	ngo_0 'bo_4 mi_7 rtogs_10 ye_15 shes_18 te_23 
T02D1380:266b-4	de yang bems po log pa'o //	de_0 yang_3 bems_8 po_13 log_16 ba_20 
T02D1380:266b-5	dbye ba chos can dag gi ni //	'byed_0 ba_5 chos_8 can_13 'dag_17 gi_21 ni_24 
T02D1380:266b-6	stong pa lnga dang thig le drug / spang bya sogs pas shes par bya //	stong_0 ba_6 lnga_9 dang_14 thig_19 le_24 drug_27 spong_34 byed_40 sogs_44 ba_49 shes_53 ba_58 byed_62 
T02D1380:266b-7	mtshon byed sgra dang mtshan ma ste //	mtshon_0 byed_7 sgra_12 dang_17 mtshan_22 ma_29 ste_32 
T02D1380:266b-8	ae bam aa la sogs pa dang //	ae_0 bam_3 aa_7 la_10 sogs_13 ba_18 dang_21 
T02D1380:266b-9	de ru mtshon pa'i dbyibs ngag go //	de_0 ru_3 mtshon_6 ba_13 dbyibs_18 ngag_25 go_30 
T02D1380:266b-10	dpe ni pra ti se na sogs //	dpe_0 ni_4 pra_7 ti_11 se_14 na_17 sogs_20 
T02D1380:266b-11	'jig rten dpe las 'das pa'o //	'jig_0 rten_5 dpe_10 las_14 'da'_18 ba_23 
T02D1380:266b-12	chos can ci rlung sems dag gi //	chos_0 can_5 ci_9 rlung_12 sems_18 'dag_23 gi_27 
T02D1380:266b-13	gnas lugs shes par byed pa'o //	gnas_0 lugs_5 shes_10 ba_15 byed_19 ba_24 
T02D1380:266b-14	lam ni dbang dang sgrub pa'i thabs //	lam_0 ni_4 dbang_7 dang_13 sgrub_18 ba_24 thabs_29 
T02D1380:266b-15	dbang ni 'jig rten las 'das te //	dbang_0 ni_6 'jig_9 rten_14 las_19 'da'_23 te_28 
T02D1380:266b-16	ngo bo rang gi byang chub sems //	ngo_0 'bo_4 rang_7 gi_12 byang_15 chub_21 sems_26 
T02D1380:266b-17	bla ma'i rkyen gyis ngo shes pa //	bla_0 ma_4 rkyen_9 gyis_15 ngo_20 shes_24 ba_29 
T02D1380:266b-18	nges pa'i tshig gong dang mtshungs //	nges_0 ba_5 tshig_10 gong_16 dang_21 mtshungs_26 
T02D1380:266b-19	dbye ba dngos dang brtag pa ste //	'byed_0 ba_5 dngos_8 dang_14 rtog_19 ba_25 ste_28 
T02D1380:266b-20	dang po sangs rgyas dus su ste //	dang_0 po_5 sangs_8 rgya_14 dus_20 su_24 ste_27 
T02D1380:266b-21	brtag pa da lta rgyu dus so //	rtog_0 ba_6 da_9 lta_12 rgyu_16 dus_21 so_25 
T02D1380:266b-22	cho ga byed dang bral na yang //	cho_0 ga_4 byed_7 dang_12 'bral_17 na_22 yang_25 
T02D1380:266b-23	re zhig dpe dang brda tshig gis //	re_0 'jig_3 dpe_8 dang_12 brda_17 tshig_22 gis_28 
T02D1380:266b-24	phyi yi rnam par rtog pa'o //	phyi_0 yi_5 rnam_8 ba_13 rtogs_17 ba_22 
T02D1380:266b-25	sgrub pa phyag rgya chen po ste //	sgrub_0 ba_6 phyag_9 rgya_15 chen_20 po_25 ste_28 
T02D1380:266b-26	ngo bo mi rtog ye shes so //	ngo_0 'bo_4 mi_7 rtogs_10 ye_15 shes_18 so_23 
T02D1380:266b-27	dbye ba rnam pa gsum bdag nyid //	'byed_0 ba_5 rnam_8 ba_13 gsum_16 bdag_21 nyid_26 
T02D1380:266b-28	nyams blang rgyu dang ngo bo dang //	nyams_0 blang_6 rgyu_12 dang_17 ngo_22 'bo_26 dang_29 
T02D1380:266b-29	dbye ba'i tshul du bstan pa'o //	'byed_0 ba_5 tshul_10 du_16 ston_19 ba_25 
T02D1380:266b-30	rgyu ni rkyen gsum ngo bo dang //	rgyu_0 ni_5 rkyen_8 gsum_14 ngo_19 'bo_23 dang_26 
T02D1380:266b-31	mi rtog pa la dmigs pa'o //	mi_0 rtogs_3 ba_8 la_11 dmigs_14 ba_20 
T02D1380:266b-32	dbye ba yan lag drug yin te //	'byed_0 ba_5 yan_8 lag_12 drug_16 yin_21 te_25 
T02D1380:266b-33	spang bya spong byed thob bya yis //	spong_0 byed_6 spong_10 byed_16 'thob_21 byed_26 yis_30 
T02D1380:266b-34	lam ni yan lag der bsdus na //	lam_0 ni_4 yan_7 lag_11 der_15 sdud_19 na_25 
T02D1380:266b-35	gdams ngag mtshan nyid rtags 'bras bu //	'doms_0 ngag_6 mtshan_11 nyid_18 rtags_23 'bras_29 bu_35 
T02D1380:266b-36	so sor dbye ba la sogs kun //	so_0 sor_3 'byed_7 ba_12 la_15 sogs_18 kun_23 
T02D1380:266b-37	sgrub bzhi'i tshul du sgom pa'o //	sgrub_0 bzhi_6 tshul_13 du_19 sgom_22 ba_27 
T02D1380:266b-38	'bras bu spangs thob phun tshogs pa'o //	'bras_0 bu_6 spong_9 'thob_16 phun_21 tshogs_26 ba_33 
T02D1380:266b-39	sangs rgyas sku bzhi la sogs pa'i //	sangs_0 rgya_6 sku_12 bzhi_16 la_21 sogs_24 ba_29 
T02D1380:266b-40	gdul bya'i sgo nas dag bya yis //	gdul_0 byed_5 sgo_11 nas_15 'dag_19 byed_23 yis_27 
T02D1380:266b-41	rnam thar la sogs lam gyis so //	rnam_0 thar_5 la_10 sogs_13 lam_18 gyis_22 so_27 
T02D1380:266b-42	de ni brjod bya mdor bsdus pa'o //	de_0 ni_3 rjod_6 byed_12 mdor_16 sdud_21 ba_27 
T02D1380:266b-43	rjod par byed pa'i tshig dag ni //	rjod_0 ba_5 byed_9 ba_14 tshig_19 'dag_25 ni_29 
T02D1380:266b-44	gzhung chad grangs dang bshad tshul bsdu //	gzhung_0 'chad_7 grangs_12 dang_19 'chad_24 tshul_30 sdud_36 
T02D1380:266b-45	gzhung tshad rgyu dang 'grel pa'o //	gzhung_0 tshad_7 rgyu_13 dang_18 'grel_23 ba_29 
T02D1380:266b-46	grangs ni rgyud kyi le'u grangs te //	grangs_0 ni_7 brgyud_10 kyi_16 le_20 grangs_25 te_32 
T02D1380:266b-47	mdor bsdus dang ni bsdus don no //	mdor_0 sdud_5 dang_11 ni_16 sdud_19 don_25 no_29 
T02D1380:266b-48	rgyas par bshad pa 'grel pas so //	rgya_0 ba_6 'chad_10 ba_16 'grel_19 ba_25 so_29 
T02D1380:266b-49	rgyud kyi le'u rnam lnga ni //	brgyud_0 kyi_6 le_10 rnam_15 lnga_20 ni_25 
T02D1380:266b-50	grangs nges go rims nges pa yang //	grangs_0 nges_7 go_12 rims_15 nges_20 ba_25 yang_28 
T02D1380:266b-51	rgyud gsum dag gi grangs dag dang //	brgyud_0 gsum_6 'dag_11 gi_15 grangs_18 'dag_25 dang_29 
T02D1380:266b-52	gzhan gzhug dngos po'i rim pa dang //	gzhan_0 'jug_6 dngos_12 po_18 rim_23 ba_27 dang_30 
T02D1380:266b-53	rnal 'byor snyoms zhugs rags pra dang //	rnal_0 'byor_5 snyom_11 'jug_18 rags_24 pra_29 dang_33 
T02D1380:266b-54	dman pa mchog gi go rims so //	dman_0 ba_5 mchog_8 gi_14 go_17 rims_20 so_25 
T02D1380:266b-55	'grel pa rnam gsum bshad pa yang //	'grel_0 ba_6 rnam_9 gsum_14 'chad_19 ba_25 yang_28 
T02D1380:267a-0	grangs @267a * //	grangs_0 
T02D1380:267a-1	nges lus la rtsa dag dang //	nges_0 lus_5 la_9 rtsa_12 'dag_17 dang_21 
T02D1380:267a-2	de yi chas phyed dbus ma'i dbus //	de_0 yi_3 cha_6 phyed_11 dbus_17 ma_22 dbus_27 
T02D1380:267a-3	mtshan dang dpe byad ting 'dzin dang //	mtshan_0 dang_7 dpe_12 byad_16 ting_21 'dzin_26 dang_32 
T02D1380:267a-4	go rims so so'i rnam 'grel lo //	go_0 rims_3 so_8 so_11 rnam_16 'grel_21 lo_27 
T02D1380:267a-5	bshad thams mtha' drug mtshan nyid de //	'chad_0 thams_6 mtha'_12 drug_18 mtshan_23 nyid_30 de_35 
T02D1380:267a-6	de yang drang don nges don no //	de_0 yang_3 'dren_8 don_14 nges_18 don_23 no_27 
T02D1380:267a-7	don bsdus rgyud gsum dag tu ni //	don_0 sdud_4 brgyud_10 gsum_16 'dag_21 tu_25 ni_28 
T02D1380:267a-8	spyi ru bsdus dang so so'i dang //	spyi_0 ru_5 sdud_8 dang_14 so_19 so_22 dang_27 
T02D1380:267a-9	dngos dang phal ba'i yul du ste //	dngos_0 dang_6 phal_11 ba_16 yul_21 du_25 ste_28 
T02D1380:267a-10	yan lag de dang der shes bya //	yan_0 lag_4 de_8 dang_11 der_16 shes_20 byed_25 
T02D1380:267a-11	dam pa'i drin gyis nges gsal ba'i //	dam_0 ba_4 drin_9 gyis_14 nges_19 gsal_24 ba_29 
T02D1380:267a-12	dam pa'i lam 'dis sems can la //	dam_0 ba_4 lam_9 'dis_13 sems_18 can_23 la_27 
T02D1380:267a-13	mi yi skye ba 'di nyid kyis //	mi_0 yi_3 skye_6 ba_11 'di_14 nyid_18 kyis_23 
T02D1380:267a-14	byang chub myur thob nges par shog / dpal dus	byang_0 chub_6 myur_11 'thob_16 nges_21 ba_26 shog_30 dpal_37 dus_42 
T02D1380:267a-15	kyi 'khor lo'i sdom tshig pandi ta chen po aa	kyi_0 'khor_4 lo_10 sdom_15 tshig_20 pandi_26 ta_32 chen_35 po_40 aa_43 
T02D1380:267a-16	bhy'a ka ras mdzad pa rdzogs so /	bhy_0 ka_6 ras_9 mdzad_13 ba_19 rdzogs_22 so_29 
T02D1380:267a-18	// / pandi ta jo bo ri pa dang /	pandi_5 ta_11 jo_14 'bo_17 ri_20 ba_23 dang_26 
T02D1380:267a-19	sgra sgyur gyi lo ts'a ba khe'u bgad 'khor lo grags kyis bsgyur ba'o//	sgra_0 sgyur_5 gyi_11 lo_15 ts_18 ba_23 khe_26 dgod_32 'khor_37 lo_43 grags_46 kyis_52 sgyur_57 
