T02D2782:150b-0	@150b * // dpal ting 'dzin gyi rgyal po byin gyis brlabs pa'i gter la phyag 'tshal lo //	dpal_11 ting_16 'dzin_21 gyi_27 rgyal_31 po_37 byin_40 gyis_45 brlabs_50 ba_57 gter_62 la_67 phyag_70 'tshal_76 lo_83 
T02D2782:150b-1	dpal ldan padmo 'dzin dbang gis //	dpal_0 ldan_5 padmo_10 'dzin_16 dbang_22 gis_28 
T02D2782:150b-2	sngags mthu ma grub grub pa dang //	sngags_0 mthu_7 ma_12 'grub_15 'grub_20 ba_25 dang_28 
T02D2782:150b-3	nyams chags gso ba'i cho ga ni //	nyams_0 chags_6 gso_12 ba_16 cho_21 ga_25 ni_28 
T02D2782:150b-4	mkhas pas 'bad de bsgom par bya //	mkhas_0 ba_6 'bad_10 de_15 bsgom_18 ba_24 byed_28 
T02D2782:150b-5	tha mal lus kyi snying 'dab dbus //	tha_0 mal_4 lus_8 kyi_12 snying_16 'dab_23 dbus_28 
T02D2782:150b-6	phyogs kyi kha dog can h'um yig //	phyogs_0 kyi_7 kha_11 dog_15 can_19 h_23 yig_28 
T02D2782:150b-7	rnal 'byor rgyal po rang sems gzhi//	rnal_0 'byor_5 rgyal_11 po_17 rang_20 sems_25 
T02D2782:150b-8	dkar 'khyil gzi brjid 'od mdzad bsgom //	dkar_0 'khyil_5 gzi_12 brjid_16 'od_22 mdzad_26 bsgom_32 
T02D2782:150b-9	kha dang rna ba sna gnyis dang //	kha_0 dang_4 rna_9 ba_13 sna_16 gnyis_20 dang_26 
T02D2782:150b-10	mig gnyis bshang dang gci ba'i sgo //	mig_0 gnyis_4 bshang_10 dang_17 gci_22 ba_26 sgo_31 
T02D2782:150b-11	de bzhin rkang pa lag gnyis ni //	de_0 bzhin_3 rkang_9 ba_15 lag_18 gnyis_22 ni_28 
T02D2782:150b-12	gtso bo las spros rdo rje bdag / gsang ba'i dkyil 'khor cho ga bzhin //	gtso_0 'bo_5 las_8 spros_12 rdo_18 rje_22 bdag_26 gsang_33 ba_39 dkyil_44 'khor_50 cho_56 ga_60 bzhin_63 
T02D2782:150b-13	padma autpal rdo rje phra //	padma_0 autpal_6 rdo_13 rje_17 phra_21 
T02D2782:150b-14	nyi zla rdo rje hom khung zlum //	nyi_0 zla_4 rdo_8 rje_12 hom_16 khung_20 zlum_26 
T02D2782:150b-15	rgya gram rdo rje rtse mang nyid //	rgya_0 'grams_5 rdo_10 rje_14 rtse_18 mang_23 nyid_28 
T02D2782:150b-16	aa phreng ka phreng dkar dmar gyis //	aa_0 phreng_3 ka_10 phreng_13 dkar_20 dmar_25 gyis_30 
T02D2782:150b-17	bskor bas khrag 'thung 'jigs pa'i sngags //	skor_0 ba_6 khrag_10 'thung_16 'jigs_23 ba_29 sngags_34 
T02D2782:150b-18	thugs rje 'phros pa'i 'od zer / las //	thugs_0 rje_6 'phro_10 ba_17 'od_22 zer_26 las_32 
T02D2782:150b-19	skyes pa'i sbyor ba yi dags bya //	skye_0 ba_6 sbyor_11 ba_17 yi_20 dags_23 byed_28 
T02D2782:150b-20	dam tshig rdo rje h'um yig las //	dam_0 tshig_4 rdo_10 rje_14 h_18 yig_23 las_27 
T02D2782:150b-21	ye shes dpal 'dzin bcu gnas ni //	ye_0 shes_3 dpal_8 'dzin_13 'chu_19 gnas_23 ni_28 
T02D2782:150b-22	mchod sogs cho ga bzhin btud nas //	mchod_0 sogs_6 cho_11 ga_15 bzhin_18 'dud_24 nas_29 
T02D2782:151a-0	@151a * // ting 'dzin sems dpa' rtse gcig bya //	ting_11 'dzin_16 sems_22 dpa'_27 rtse_32 gcig_37 byed_42 
T02D2782:151a-1	rnam par rtog pa kun shigs dang //	rnam_0 ba_5 rtogs_9 ba_14 kun_17 shigs_21 dang_27 
T02D2782:151a-2	ye shes phyag rgya mchog sbyor la //	ye_0 shes_3 phyag_8 rgya_14 mchog_19 sbyor_25 la_31 
T02D2782:151a-3	mnyam gzhag phrin las bcu lhag spyod //	mnyam_0 'jog_6 phrin_12 las_18 'chu_22 lhag_26 spyod_31 
T02D2782:151a-4	mkhas pas som nyi med par spyad //	mkhas_0 ba_6 som_10 nyi_14 med_18 ba_22 spyod_26 
T02D2782:151a-5	rtag tu sems can la phan dang //	rtag_0 tu_5 sems_8 can_13 la_17 phan_20 dang_25 
T02D2782:151a-6	lhag pa'i lhas de de nyid shes //	lhag_0 ba_5 lhas_10 de_15 de_18 nyid_21 shes_26 
T02D2782:151a-7	rnal 'byor cho ga la brtson pas //	rnal_0 'byor_5 cho_11 ga_15 la_18 brtson_21 ba_28 
T02D2782:151a-8	zla ba drug na rtags mthong 'gyur //	zla_0 ba_4 drug_7 na_12 rtags_15 mthong_21 'gyur_28 
T02D2782:151a-9	lus nang me lce 'bar ba ltar tsha me 'od rnam par 'khrugs pa dang //	lus_0 nang_4 me_9 lce_12 'bar_16 ba_21 ltar_24 tsha_29 me_34 'od_37 rnam_41 ba_46 'khrugs_50 ba_58 dang_61 
T02D2782:151a-10	rdo rje'i spu skyes kha nas me 'bar skye bo mang po'i mgo btud bstod //	rdo_0 rje_4 spu_10 skye_14 kha_20 nas_24 me_28 'bar_31 skye_36 'bo_41 mang_44 po_49 mgo_54 'dud_58 bstod_63 
T02D2782:151a-11	lag na rdo rje ral gri 'bar thogs ha la'i	lag_0 na_4 rdo_7 rje_11 ral_15 gri_19 'bar_23 thogs_28 ha_34 la_37 
T02D2782:151a-12	sgra sgrogs phyogs bcur rgyug / mig 'bras rab gsal	sgra_0 sgrogs_5 phyogs_12 'jur_19 rgyug_24 mig_32 'bras_36 rab_42 gsal_46 
T02D2782:151a-13	sgron ma'i 'od 'char blo gros nye bar zhi ba'o	sgron_0 ma_6 'od_11 'char_15 blo_21 gros_25 nye_30 ba_34 zhi_38 ba_42 
T02D2782:151a-14	// byin rlabs mi zad pa'i cho ga rdzogs so//	byin_3 rlabs_8 mi_14 zad_17 ba_21 cho_26 ga_30 rdzogs_33 
