T02D2684:228a-33	rig sngags kyi tshul du zlos pa nang gi khrus dang /	rig_0 sngags_4 kyi_11 tshul_15 du_21 zlos_24 ba_29 nang_32 gi_37 'khru_40 dang_46 
T02D2684:228a-34	gsang sngags su zlos pa gsang ba'i khrus dang /	gsang_0 sngags_6 su_13 zlos_16 ba_21 gsang_24 ba_30 'khru_35 dang_41 
T02D2684:228a-35	snying bor zlos ba de kho na nyid kyi khrus so //	snying_0 'bor_7 zlos_11 ba_16 de_19 kho_22 na_26 nyid_29 kyi_34 'khru_38 so_44 
T02D2684:228a-36	khrus de dag kyang rim pa bzhin du nyan thos dang /	'khru_0 de_6 'dag_9 kyang_13 rim_19 ba_23 bzhin_26 du_32 nyan_35 thos_40 dang_45 
T02D2684:228a-37	rang rgyal dang /	rang_0 rgyal_5 dang_11 
T02D2684:228a-38	sems tsam pa dang /	sems_0 tsam_5 ba_10 dang_13 
T02D2684:228a-39	dbu ma pa rnams la sbyar bar bya'o //	dbu_0 ma_4 ba_7 rnams_10 la_16 sbyor_19 ba_25 byed_29 
T02D2684:228a-40	de la dang por phyi'i khrus kyis ni lus dag par byed la ;	de_0 la_3 dang_6 por_11 phyi_15 'khru_22 kyis_28 ni_33 lus_36 'dag_40 ba_44 byed_48 la_53 
T02D2684:228a-41	nang gi khrus kyis ni ngag dag par byed cing gsang ba'i khrus kyis ni sems dag par byed /	nang_0 gi_5 'khru_8 kyis_14 ni_19 ngag_22 'dag_27 ba_31 byed_35 cing_40 gsang_45 ba_51 'khru_56 kyis_62 ni_67 sems_70 'dag_75 ba_79 byed_83 
T02D2684:228a-42	de kho na nyid kyi khrus rdo rje lta bu'i	de_0 kho_3 na_7 nyid_10 kyi_15 'khru_19 rdo_25 rje_29 lta_33 bu_37 
T02D2684:228a-43	ting nge 'dzin gyis ni lus ngag yid gsum dbyer	ting_0 nge_5 'dzin_9 gyis_15 ni_20 lus_23 ngag_27 yid_32 gsum_36 dbyer_41 
T02D2684:228a-44	med pa nyid du 'gyur ro //	med_0 ba_4 nyid_7 du_12 'gyur_15 ro_21 
T02D2684:228a-45	da ni phyi'i khrus bya bar 'dod pa rnams la de bshad par bya ste /	da_0 ni_3 phyi_6 'khru_13 byed_19 ba_23 'dod_27 ba_32 rnams_35 la_41 de_44 'chad_47 ba_53 byed_57 ste_61 
T02D2684:228b-0	dang por sngags pa snying @228b rje che zhing bya	dang_0 por_5 sngags_9 ba_16 snying_19 rje_32 che_36 zhing_40 byed_46 
T02D2684:228b-1	ba la mkhas pas phyi dang nang gi dri ma	ba_0 la_3 mkhas_6 ba_12 phyi_16 dang_21 nang_26 gi_31 'dri_34 ma_38 
T02D2684:228b-2	dag par byas te gos sar pa bgos la mdun	'dag_0 ba_4 byed_8 te_13 gos_16 sar_20 ba_24 bgod_27 la_32 mdun_35 
T02D2684:228b-3	du bum pa rin po che las grub pa'i nang	du_0 bum_3 ba_7 rin_10 po_14 che_17 las_21 'grub_25 ba_30 nang_35 
T02D2684:228b-4	du srog chags med cing gtsang ba'i chu blugs nas	du_0 srog_3 chags_8 med_14 cing_18 gtsang_23 ba_30 chu_35 blugs_39 nas_45 
T02D2684:228b-5	sku'i rtags su sman lnga dang /	sku_0 rtags_6 su_12 sman_15 lnga_20 dang_25 
T02D2684:228b-6	gsung gi rtags su spos lnga dang /	gsung_0 gi_6 rtags_9 su_15 spros_18 lnga_23 dang_28 
T02D2684:228b-7	thugs kyi rtags su snying po lnga dang /	thugs_0 kyi_6 rtags_10 su_16 snying_19 po_26 lnga_29 dang_34 
T02D2684:228b-8	phrin las kyi rtags su 'bras bu lnga dang /	phrin_0 las_6 kyi_10 rtags_14 su_20 'bras_23 bu_29 lnga_32 dang_37 
T02D2684:228b-9	yon tan gyi rtags su rin po che lnga dang /	yon_0 tan_4 gyi_8 rtags_12 su_18 rin_21 po_25 che_28 lnga_32 dang_37 
T02D2684:228b-10	da bzhin nyid la nyes pa'i dri mas ma gos	da_0 bzhin_3 nyid_9 la_14 nyes_17 ba_22 'dri_27 mas_31 ma_35 gos_38 
T02D2684:228b-11	pa'i rtags su mgul gos gtsang mas dgab cing bzhag	ba_0 rtags_5 su_11 mgul_14 gos_19 gtsang_23 mas_30 'gebs_34 cing_39 'jog_44 
T02D2684:228b-12	ste / de'i nang du skad cig ma la bskyed pa'i lha'i sku dang /	ste_0 de_6 nang_11 du_16 skad_19 cig_24 ma_28 la_31 skyed_34 ba_41 lha_46 sku_52 dang_56 
T02D2684:228b-13	gsung dang /	gsung_0 dang_6 
T02D2684:228b-14	thugs dang /	thugs_0 dang_6 
T02D2684:228b-15	phrin las dang /	phrin_0 las_6 dang_10 
T02D2684:228b-16	yon tan rnams mtshon pa'i phyir rdzas de rnams bum par stsol lo //	yon_0 tan_4 rnams_8 mtshon_14 ba_21 phyir_26 rdzas_32 de_38 rnams_41 bum_47 ba_51 stsol_55 lo_61 
T02D2684:228b-17	sngags pa bdag nyid kyang yon tan de dag thob par bya ba'o phyir /	sngags_0 ba_7 bdag_10 nyid_15 kyang_20 yon_26 tan_30 de_34 'dag_37 'thob_41 ba_46 byed_50 ba_54 phyir_59 
T02D2684:228b-18	rtag tu yid la dran ba'i gzungs thag gdags par bya ste /	rtag_0 tu_5 yid_8 la_12 dran_15 ba_20 gzungs_25 thag_32 'dogs_37 ba_43 byed_47 ste_51 
T02D2684:228b-19	srad bu dkar po gtsang ma la sku gsungs thugs	srad_0 bu_5 dkar_8 po_13 gtsang_16 ma_23 la_26 sku_29 gsungs_33 thugs_40 
T02D2684:228b-20	kyi rang bzhin sum sgril du bya ba bzung ste	kyi_0 rang_4 bzhin_9 sum_15 sgril_19 du_25 byed_28 ba_32 bzung_35 ste_41 
T02D2684:228b-21	ma yengs par 'di ltar bzlas pa dang bsgom pa	ma_0 yengs_3 ba_9 'di_13 ltar_17 bzlas_22 ba_28 dang_31 bsgom_36 ba_42 
T02D2684:228b-22	la sogs pa bya'o //	la_0 sogs_3 ba_8 byed_11 
T02D2684:228b-23	gong du brjod pa'i mtshan nyid dang ldan pa'i sngags	gong_0 du_5 rjod_8 ba_14 mtshan_19 nyid_26 dang_31 ldan_36 ba_41 sngags_46 
T02D2684:228b-24	pas yud tsam gyis mdun gyi nam mkha' la sangs	ba_0 yud_4 tsam_8 gyis_13 mdun_18 gyi_23 nam_27 mkha'_31 la_37 sangs_40 
T02D2684:228b-25	rgyas sh'akya thub pa stong pa nyid la mnyam par	rgya_0 sh_6 thub_14 ba_19 stong_22 ba_28 nyid_31 la_36 mnyam_39 ba_45 
T02D2684:228b-26	gzhag ba 'ja' tshon lta bur snang la rang bzhin	'jog_0 ba_6 'ja'_9 tshon_14 lta_20 bur_24 snang_28 la_34 rang_37 bzhin_42 
T02D2684:228b-27	med pa'i sprul sku bzhugs par bsams la /	med_0 ba_4 sprul_9 sku_15 bzhugs_19 ba_26 bsams_30 la_36 
T02D2684:228b-28	rang nyid yud tsam gyis lag na rdo rjer mos par bya'o //	rang_0 nyid_5 yud_10 tsam_14 gyis_19 lag_24 na_28 rdo_31 rjer_35 mos_40 ba_44 byed_48 
T02D2684:228b-29	de nas bcom ldan 'das kyis bdag lus thams cad	de_0 nas_3 'joms_7 ldan_12 'da'_17 kyis_22 bdag_27 lus_32 thams_36 cad_42 
T02D2684:228b-30	rdo rje byin gyis brlab tu gsol zhes lan gsum	rdo_0 rje_4 byin_8 gyis_13 brlab_18 tu_24 gsol_27 zhes_32 lan_37 gsum_41 
T02D2684:228b-31	gsol ba gdab par bya'o //	gsol_0 ba_5 gdab_8 ba_13 byed_17 
T02D2684:228b-32	gsol ba btab pas lus rdo rjer byin gyis brlabs	gsol_0 ba_5 'debs_8 ba_13 lus_17 rdo_21 rjer_25 byin_30 gyis_35 brlabs_40 
T02D2684:228b-33	pas stong pa nyid du gyur pa la cung zad	ba_0 stong_4 ba_10 nyid_13 du_18 gyur_21 ba_26 la_29 cung_32 zad_37 
T02D2684:228b-34	gnas par bya'o ; / de nas stong pa'i ngang	gnas_0 ba_5 byed_9 de_19 nas_22 stong_26 ba_32 ngang_37 
T02D2684:228b-35	las rang nyid yud tsam gyis rdo rje rnam 'joms	las_0 rang_4 nyid_9 yud_14 tsam_18 gyis_23 rdo_28 rje_32 rnam_36 'joms_41 
T02D2684:228b-36	sngon po zhal gcig pa phyag gnyis pa g-yas na	sngon_0 po_6 zhal_9 gcig_14 ba_19 phyag_22 gnyis_28 ba_34 g-yas_37 na_43 
T02D2684:228b-37	rdo rje gdengs pa g-yon na dril bu dku la	rdo_0 rje_4 gdeng_8 ba_15 g-yon_18 na_24 'dril_27 bu_32 dku_35 la_39 
T02D2684:228b-38	bu brten nas bzhengs shing 'gying bag bcas pa'i zhal	bu_0 rten_3 nas_9 bzhengs_13 shing_21 'gying_27 bag_34 'cha'_38 ba_43 zhal_48 
T02D2684:228b-39	khro zhing mche ba gtsigs pa'i sku 'ja' tshon lta	khro_0 zhing_5 mche_11 ba_16 gtsigs_19 ba_26 sku_31 'ja'_35 tshon_40 lta_46 
T02D2684:228b-40	gnas par bya'o ; bur bsams la ; mdun gyi	gnas_0 ba_5 byed_9 bur_17 bsams_21 la_27 mdun_32 gyi_37 
T02D2684:228b-41	khams gsum rnam par dag pa'i rang bzhin bum pa'i	khams_0 gsum_6 rnam_11 ba_16 'dag_20 ba_24 rang_29 bzhin_34 bum_40 ba_44 
T02D2684:228b-42	nang du yang yud tsam gyis rang dang mthun pa'i	nang_0 du_5 yang_8 yud_13 tsam_17 gyis_22 rang_27 dang_32 mthun_37 ba_43 
T02D2684:228b-43	sku bskyed la de'i thugs kar gzungs thag gi sna	sku_0 skyed_4 la_11 de_14 thugs_19 kar_25 gzungs_29 thag_36 gi_41 sna_44 
T02D2684:228b-44	zug par bsams la sngags kyi sgra 'brug lta bur	zug_0 ba_4 bsams_8 la_14 sngags_17 kyi_24 sgra_28 'brug_33 lta_39 bur_43 
T02D2684:228b-45	stong gsum gang bar bsam zhing ngag tu gdon par	stong_0 gsum_6 gang_11 ba_16 bsam_20 zhing_25 ngag_31 tu_36 'don_39 ba_44 
T02D2684:229a-0	gnas par bya'o ; bur bsams la ; bya'o // sngags kyi phreng ba gzungs @229a * //	gnas_0 ba_5 byed_9 bur_17 bsams_21 la_27 byed_32 sngags_41 kyi_48 phreng_52 ba_59 gzungs_62 
T02D2684:229a-1	thag la 'khril zhing bum bar lha'i thugs kar phog par bsam par bya'o //	thag_0 la_5 'khril_8 zhing_15 bum_21 ba_25 lha_29 thugs_35 kar_41 'bogs_45 ba_50 bsam_54 ba_59 byed_63 
T02D2684:229a-2	grangs ni thun re la brgya rtsa brgyang la sogs	grangs_0 ni_7 thun_10 re_15 la_18 brgya_21 rtsa_27 rgyong_32 la_40 sogs_43 
T02D2684:229a-3	pa ci nus su bzlas nas de'i rjes la bstod	ba_0 ci_3 nus_6 su_10 bzlas_13 nas_19 de_23 rjes_28 la_33 bstod_36 
T02D2684:229a-4	pa yang bya ste /	ba_0 yang_3 byed_8 ste_12 
T02D2684:229a-5	rdo rje ye shes nyon mongs 'joms pa'i sku //	rdo_0 rje_4 ye_8 shes_11 nyon_16 mongs_21 'joms_27 ba_33 sku_38 
T02D2684:229a-6	thugs rje byams pas ma rig sel ba'i gsung /	thugs_0 rje_6 byams_10 ba_16 ma_20 rig_23 sel_27 ba_31 gsung_36 
T02D2684:229a-7	bde chen mi g-yo mchog tu gsal ba'i thugs //	bde_0 chen_4 mi_9 g-yo_12 mchog_17 tu_23 gsal_26 ba_31 thugs_36 
T02D2684:229a-8	rdo rje rnam par 'joms la phyag 'tshal bstod //	rdo_0 rje_4 rnam_8 ba_13 'joms_17 la_23 phyag_26 'tshal_32 bstod_39 
T02D2684:229a-9	ces bstod pa zin pa dang lha 'od du zhu	ces_0 bstod_4 ba_10 zin_13 ba_17 dang_20 lha_25 'od_29 du_33 'ju_36 
T02D2684:229a-10	ste ye shes kyi bdud rtsir bsams la bdag dang	ste_0 ye_4 shes_7 kyi_12 bdud_16 rtsir_21 bsams_27 la_33 bdag_36 dang_41 
T02D2684:229a-11	gzhan la khrus bya zhing sngags kyi mthar phrin las	gzhan_0 la_6 'khru_9 byed_15 zhing_19 sngags_25 kyi_32 mthar_36 phrin_42 las_48 
T02D2684:229a-12	kyi spel ba dang bcas par bzla'o /	kyi_0 spel_4 ba_9 dang_12 'cha'_17 ba_22 bzla_26 
T02D2684:229a-13	de ni phyi'i khrus te lus dag pa phung po	de_0 ni_3 phyi_6 'khru_13 te_19 lus_22 'dag_26 ba_30 'phung_33 po_39 
T02D2684:229a-14	lhag ma med pa'i nyan thos kyi 'bras bu thob	lhag_0 ma_5 med_8 ba_12 nyan_17 thos_22 kyi_27 'bras_31 bu_37 'thob_40 
T02D2684:229a-15	par gyur ro // de nas nang gi khrus bshad par bya'o //	ba_0 gyur_4 ro_9 de_15 nas_18 nang_22 gi_27 'khru_30 'chad_36 ba_42 byed_46 
T02D2684:229a-16	bum pa ni rang gi lus te khams gsum rnam par dag pa'i gzhal yas khang ngo //	bum_0 ba_4 ni_7 rang_10 gi_15 lus_18 te_22 khams_25 gsum_31 rnam_36 ba_41 'dag_45 ba_49 'jal_54 yas_60 khang_64 ngo_70 
T02D2684:229a-17	rdzas ni don snying rnam lnga dang /	rdzas_0 ni_6 don_9 snying_13 rnam_20 lnga_25 dang_30 
T02D2684:229a-18	snod rnam drug dang /	snod_0 rnam_5 drug_10 dang_15 
T02D2684:229a-19	phung po lnga dang dbang po lnga dang /	'phung_0 po_6 lnga_9 dang_14 dbang_19 po_25 lnga_28 dang_33 
T02D2684:229a-20	'byung ba bzhi la rim pa bzhin du /	'byung_0 ba_7 bzhi_10 la_15 rim_18 ba_22 bzhin_25 du_31 
T02D2684:229a-21	sman dang /	sman_0 dang_5 
T02D2684:229a-22	spos dang /	spros_0 dang_5 
T02D2684:229a-23	'bru dang /	'bru_0 dang_5 
T02D2684:229a-24	snying po dang /	snying_0 po_7 dang_10 
T02D2684:229a-25	rin po zhe rnams su mongs bar byas la snying	rin_0 po_4 zhe_7 rnams_11 su_17 mongs_20 ba_26 byed_30 la_35 snying_38 
T02D2684:229a-26	gar yud tsam gyis lha bskyed pa'i bar du gsol	gar_0 yud_4 tsam_8 gyis_13 lha_18 skyed_22 ba_29 ba_34 du_38 gsol_41 
T02D2684:229a-27	ba gdab pa la sogs bsdam bzhin no //	ba_0 gdab_3 ba_8 la_11 sogs_14 sdom_19 bzhin_25 no_31 
T02D2684:229a-28	rang nyid zas dkar gsum la sogs pa gtsang ma zos pa ni chu'o ;	rang_0 nyid_5 zas_10 dkar_14 gsum_19 la_24 sogs_27 ba_32 gtsang_35 ma_42 zos_45 ba_49 ni_52 chu_55 
T02D2684:229a-29	/ gos gtsang ma gyon pa ni mgul chings so //	gos_2 gtsang_6 ma_13 gyon_16 ba_21 ni_24 mgul_27 'ching_32 so_39 
T02D2684:229a-30	dran ba ma yengs pa ni gzungs thag go //	dran_0 ba_5 ma_8 yengs_11 ba_17 ni_20 gzungs_23 thag_30 go_35 
T02D2684:229a-31	sngags ni sgra mi che bar bzlas par bya ste rig sngags zhes bya'o //	sngags_0 ni_7 sgra_10 mi_15 che_18 ba_22 bzlas_26 ba_32 byed_36 ste_40 rig_44 sngags_48 zhes_55 byed_60 
T02D2684:229a-32	zin pa dang snying ga'i lha la sogs pa zhu	zin_0 ba_4 dang_7 snying_12 ga_19 lha_24 la_28 sogs_31 ba_36 'ju_39 
T02D2684:229a-33	nas rdo rje nor bu nas byung ba'i rang 'byung	nas_0 rdo_4 rje_8 nor_12 bu_16 nas_19 'byung_23 ba_29 rang_34 'byung_39 
T02D2684:229a-34	gi bdud rtsis bkru bar bya'o //	gi_0 bdud_3 rtsis_8 'khrud_14 ba_19 byed_23 
T02D2684:229a-35	de nas khrus bshad de /	de_0 nas_3 'khru_7 'chad_13 de_19 
T02D2684:229a-36	des ni phyi yul la rgyu ba bkag pas chos	des_0 ni_4 phyi_7 yul_12 la_16 rgyu_19 ba_24 'gog_27 ba_32 chos_36 
T02D2684:229a-37	kyi bdag gzung ba'i phyogs gcig la bdag med pa	kyi_0 bdag_4 gzung_9 ba_15 phyogs_20 gcig_27 la_32 bdag_35 med_40 ba_44 
T02D2684:229a-38	rtogs pas ngag dag pa sngags kyi nus pa thob	rtogs_0 ba_6 ngag_10 'dag_15 ba_19 sngags_22 kyi_29 nus_33 ba_37 'thob_40 
T02D2684:229a-39	nas rang sangs rgyas kyi 'bras bu mi dma' ba	nas_0 rang_4 sangs_9 rgya_15 kyi_21 'bras_25 bu_31 mi_34 dma'_37 ba_42 
T02D2684:229a-40	nyid thob par 'gyur ro //	nyid_0 'thob_5 ba_10 'gyur_14 ro_20 
T02D2684:229a-41	de nas gsang ba'i khrus brjod par bya'o //	de_0 nas_3 gsang_7 ba_13 'khru_18 rjod_24 ba_30 byed_34 
T02D2684:229a-42	gsol ba gdab pa la sogs pa snga ma ltar	gsol_0 ba_5 gdab_8 ba_13 la_16 sogs_19 ba_24 snga_27 ma_32 ltar_35 
T02D2684:229a-43	byas nas thams cad sems kyi rang bzhin yin no	byed_0 nas_5 thams_9 cad_15 sems_19 kyi_24 rang_28 bzhin_33 yin_39 no_43 
T02D2684:229a-44	zhes lhag par mos par byas la /	zhes_0 lhag_5 ba_10 mos_14 ba_18 byed_22 la_27 
T02D2684:229a-45	sems de'i rang bzhin ni 'od gsal ba yin mod	sems_0 de_5 rang_10 bzhin_15 ni_21 'od_24 gsal_28 ba_33 yin_36 mod_40 
T02D2684:229a-46	kyi gnas skabs nyon mongs pas bsgribs pa de gsal	kyi_0 gnas_4 skabs_9 nyon_15 mongs_20 ba_26 sgrib_30 ba_38 de_41 gsal_44 
T02D2684:229a-47	ba'i don du sems de lus ngag yid gsum gyi	ba_0 don_5 du_9 sems_12 de_17 lus_20 ngag_24 yid_29 gsum_33 gyi_38 
T02D2684:229b-0	rnam pa yi ge aom a'a: h'um @229b * //	rnam_0 ba_5 yi_8 ge_11 aom_14 a:_18 h_23 
T02D2684:229b-1	gsum du bsams la yi ge gsum las sngags kyang	gsum_0 du_5 bsams_8 la_14 yi_17 ge_20 gsum_23 las_28 sngags_32 kyang_39 
T02D2684:229b-2	gsang sngags kyi tshul du lan bdun yid kyis brjod	gsang_0 sngags_6 kyi_13 tshul_17 du_23 lan_26 bdun_30 yid_35 kyis_39 rjod_44 
T02D2684:229b-3	de yi ge gsum po rim gyis aom dang a'a:dang	de_0 yi_3 ge_6 gsum_9 po_14 rim_17 gyis_21 aom_26 dang_30 a:dang_35 
T02D2684:229b-4	h'um la 'dus te h'um de yang n'a da'i bar	h_0 la_5 'du_8 te_13 h_16 de_21 yang_24 n_29 da_33 ba_38 
T02D2684:229b-5	du thim ste / n'a da de mar me ltar	du_0 'thim_3 ste_8 n_14 da_18 de_21 mar_24 me_28 ltar_31 
T02D2684:229b-6	rab tu gsal bar 'gyur bas ni sems kyi sgrib	rab_0 tu_4 gsal_7 ba_12 'gyur_16 ba_22 ni_26 sems_29 kyi_34 sgrib_38 
T02D2684:229b-7	pa dag par byas nas sems yongs su dag pa	ba_0 'dag_3 ba_7 byed_11 nas_16 sems_20 yongs_25 su_31 'dag_34 ba_38 
T02D2684:229b-8	sems tsam gyi 'bras bu thob ste gsang ba'i khrus	sems_0 tsam_5 gyi_10 'bras_14 bu_20 'thob_23 ste_28 gsang_32 ba_38 'khru_43 
T02D2684:229b-9	du thim ste / zhes bya'o // ldang bar 'dod	du_0 'thim_3 ste_8 zhes_14 byed_19 ldang_28 ba_34 'dod_38 
T02D2684:229b-10	na lus sems ngag yid gsum sku gsung thugs kyi	na_0 lus_3 sems_7 ngag_12 yid_17 gsum_21 sku_26 gsung_30 thugs_36 kyi_42 
T02D2684:229b-11	rang bzhin du dbyer med pa la mos pas spyod	rang_0 bzhin_5 du_11 dbyer_14 med_20 ba_24 la_27 mos_30 ba_34 spyod_38 
T02D2684:229b-12	du thim ste / zhes bya'o // lam bya'o //	du_0 'thim_3 ste_8 zhes_14 byed_19 lam_28 byed_32 
T02D2684:229b-13	da ni de kho na nyid kyi khrus brjod par	da_0 ni_3 de_6 kho_9 na_13 nyid_16 kyi_21 'khru_25 rjod_31 ba_37 
T02D2684:229b-14	du thim ste / zhes bya'o // lam bya'o //	du_0 'thim_3 ste_8 zhes_14 byed_19 lam_28 byed_32 
T02D2684:229b-15	bya'o // chos thams cad sems su lhag par mos	byed_0 chos_9 thams_14 cad_20 sems_24 su_29 lhag_32 ba_37 mos_41 
T02D2684:229b-16	par sems nyid yi ge gsum du bsams la sku	ba_0 sems_4 nyid_9 yi_14 ge_17 gsum_20 du_25 bsams_28 la_34 sku_37 
T02D2684:229b-17	gsum du mos pa bya bzhin khams gsum pa rnams	gsum_0 du_5 mos_8 ba_12 byed_15 bzhin_19 khams_25 gsum_31 ba_36 rnams_39 
T02D2684:229b-18	kyang yi ge gsum las byung zhing de la slar	kyang_0 yi_6 ge_9 gsum_12 las_17 'byung_21 zhing_27 de_33 la_36 slar_39 
T02D2684:229b-19	thim par gyur pa'o zhes mos par bya'o //	'thim_0 ba_5 gyur_9 ba_14 zhes_19 mos_24 ba_28 byed_32 
T02D2684:229b-20	de nas yi ge aom ni a'a: la thim pas	de_0 nas_3 yi_7 ge_10 aom_13 ni_17 a:_20 la_25 'thim_28 ba_33 
T02D2684:229b-21	longs spyod rdzogs pa'i sku'i rang bzhi na ngag gi	longs_0 spyod_6 rdzogs_12 ba_19 sku_24 rang_30 bzhi_35 na_40 ngag_43 gi_48 
T02D2684:229b-22	sgyu ma lta bur mi bden zhes mos pa bya'o	sgyu_0 ma_5 lta_8 bur_12 mi_16 bden_19 zhes_24 mos_29 ba_33 byed_36 
T02D2684:229b-23	// de ma thag tu h'um yang a'a:la thim pas	de_3 ma_6 thag_9 tu_14 h_17 yang_22 a:la_27 'thim_34 ba_39 
T02D2684:229b-24	sprul ba'i sku'i rang bzhin lus kyang sgyu ma lta	sprul_0 ba_6 sku_11 rang_17 bzhin_22 lus_28 kyang_32 sgyu_38 ma_43 lta_46 
T02D2684:229b-25	// bu ste / yang dag par ma grub ces	bu_3 ste_6 yang_12 'dag_17 ba_21 ma_25 'grub_28 ces_33 
T02D2684:229b-26	bsams zhing de ma thag tu yi ge a'a:de yang	bsams_0 zhing_6 de_12 ma_15 thag_18 tu_23 yi_26 ge_29 a:de_32 yang_39 
T02D2684:229b-27	gsal bar bltar te /	gsal_0 ba_5 bltar_9 te_15 
T02D2684:229b-28	dag tu yang a'a:zhes bya ba nyi shu rtsa gcig	'dag_0 tu_4 yang_7 a:zhes_12 byed_21 ba_25 nyi_28 shu_32 rtsa_36 gcig_41 
T02D2684:229b-29	brjod pa ni snying po'i tshul du sngags bzlas pa'o	rjod_0 ba_6 ni_9 snying_12 po_19 tshul_24 du_30 sngags_33 bzlas_40 ba_46 
T02D2684:229b-30	// de ltar brjod pas brjod yal du gyur te	de_3 ltar_6 rjod_11 ba_17 rjod_21 yal_27 du_31 gyur_34 te_39 
T02D2684:229b-31	de nas a'a:la sems gsal bar gtad pas sems nyid	de_0 nas_3 a:la_7 sems_14 gsal_19 ba_24 gtod_28 ba_33 sems_37 nyid_42 
T02D2684:229b-32	rang bzhin gyis ma skyes pa rkyen gyis mi 'gag	rang_0 bzhin_5 gyis_11 ma_16 skye_19 ba_25 rkyen_28 gyis_34 mi_39 'gag_42 
T02D2684:229b-33	pa'i chos nyid brjod du med pa rang du gnas	ba_0 chos_5 nyid_10 rjod_15 du_21 med_24 ba_28 rang_31 du_36 gnas_39 
T02D2684:229b-34	// te / a'a'i ming tsam yang mi dmigs pa	te_3 a'i_8 ming_14 tsam_19 yang_24 mi_29 dmigs_32 ba_38 
T02D2684:229b-35	ni rdo rje lta bu'i ting nge 'dzin te nam	ni_0 rdo_3 rje_7 lta_11 bu_15 ting_20 nge_25 'dzin_29 te_35 nam_38 
T02D2684:229b-36	mkha' lta bu zag pa med pa'i bde ba dang	mkha'_0 lta_6 bu_10 zag_13 ba_17 med_20 ba_24 bde_29 ba_33 dang_36 
T02D2684:229b-37	spros pa med pa'i chos nyid ro gcig tu gyur	spros_0 ba_6 med_9 ba_13 chos_18 nyid_23 ro_28 gcig_31 tu_36 gyur_39 
T02D2684:229b-38	pa brjod du med pa'i ye shes kyi ngal ji	ba_0 rjod_3 du_9 med_12 ba_16 ye_21 shes_24 kyi_29 ngal_33 ji_38 
T02D2684:229b-39	srid 'dod pas gnas par bya'o //	srid_0 'dod_5 ba_10 gnas_14 ba_19 byed_23 
T02D2684:229b-40	de ni rdo rje lta bu'i ting nge 'dzin yin	de_0 ni_3 rdo_6 rje_10 lta_14 bu_18 ting_23 nge_28 'dzin_32 yin_38 
T02D2684:229b-41	pas na rdo rje'i ting nge 'dzin la snyoms par	ba_0 na_4 rdo_7 rje_11 ting_17 nge_22 'dzin_26 la_32 snyom_35 ba_42 
T02D2684:229b-42	zhugs so zhes kyang gsungs so //	'jug_0 so_6 zhes_9 kyang_14 gsungs_20 so_27 
T02D2684:229b-43	de ni de kho na nyid kyi khrus te sko	de_0 ni_3 de_6 kho_9 na_13 nyid_16 kyi_21 'khru_25 te_31 sko_34 
T02D2684:229b-44	gsum dag pa dbyer med pa dbu ma'i lam mthar	gsum_0 'dag_5 ba_9 dbyer_12 med_18 ba_22 dbu_25 ma_29 lam_34 mthar_38 
T02D2684:229b-45	phyin pa'i chos kyi sku thob pa zhes bya'o //	phyin_0 ba_6 chos_11 kyi_16 sku_20 'thob_24 ba_29 zhes_32 byed_37 
T02D2684:229b-46	ting nge 'dzin las ldang bar 'dod na yang skad	ting_0 nge_5 'dzin_9 las_15 ldang_19 ba_25 'dod_29 na_34 yang_37 skad_42 
T02D2684:229b-47	cig las khas gsum pa'i ngo bo aa las skur	cig_0 las_4 khas_8 gsum_13 ba_18 ngo_23 'bo_27 aa_30 las_33 skur_37 
T02D2684:229b-48	mos ba bya ste spyod lam bya'o //	mos_0 ba_4 byed_7 ste_11 spyod_15 lam_21 byed_25 
T02D2684:230a-0	ting nge 'dzin de'i che ba ni de nas zhes bya ba nas rab tu smras so @230a * //	ting_0 nge_5 'dzin_9 de_15 che_20 ba_24 ni_27 de_30 nas_33 zhes_37 byed_42 ba_46 nas_49 rab_53 tu_57 smras_60 so_66 
T02D2684:230a-1	zhes bya ba'i bar du gsungs so //	zhes_0 byed_5 ba_9 ba_14 du_18 gsungs_21 so_28 
T02D2684:230a-2	de ltar na gdams ngag gi don brjod pa'o //	de_0 ltar_3 na_8 'doms_11 ngag_17 gi_22 don_25 rjod_29 ba_35 
T02D2684:230a-3	da ni yi ge'i don brjod par bya ste /	da_0 ni_3 yi_6 ge_9 don_14 rjod_18 ba_24 byed_28 ste_32 
T02D2684:230a-4	de la dang por re zhig nges pa'i don bshad par bya'o //	de_0 la_3 dang_6 por_11 re_15 'jig_18 nges_23 ba_28 don_33 'chad_37 ba_43 byed_47 
T02D2684:230a-5	de nas sangs rgyas dang byang chub sems dpa'i mthus	de_0 nas_3 sangs_7 rgya_13 dang_19 byang_24 chub_30 sems_35 dpa_40 mthus_46 
T02D2684:230a-6	zhes bya ba la sogs pa ni rtogs bar sla'o	zhes_0 byed_5 ba_9 la_12 sogs_15 ba_20 ni_23 rtogs_26 ba_32 sla_36 
T02D2684:230a-7	// rdo rje zhes bya ba ni stong pa nyid kyi ting nge 'dzin to //	rdo_3 rje_7 zhes_11 byed_16 ba_20 ni_23 stong_26 ba_32 nyid_35 kyi_40 ting_44 nge_49 'dzin_53 to_59 
T02D2684:230a-8	gal te de ni khro bar mi 'thad do zhe	gal_0 te_4 de_7 ni_10 khro_13 ba_18 mi_22 'thad_25 do_31 zhe_34 
T02D2684:230a-9	na spros pa dang mtshan ma la sogs pa 'khor	na_0 spros_3 ba_9 dang_12 mtshan_17 ma_24 la_27 sogs_30 ba_35 'khor_38 
T02D2684:230a-10	ba'i chos thams cad la stong pa nyid de khro	ba_0 chos_5 thams_10 cad_16 la_20 stong_23 ba_29 nyid_32 de_37 khro_40 
T02D2684:230a-11	zhing gtum la de dag 'joms pa na de'i phyir	zhing_0 'thum_6 la_11 de_14 'dag_17 'joms_21 ba_27 na_30 de_33 phyir_38 
T02D2684:230a-12	de la khro bo zhes gsungs so //	de_0 la_3 khro_6 'bo_11 zhes_14 gsungs_19 so_26 
T02D2684:230a-13	chos thams cad stong pa nyid chos nyid skye ba	chos_0 thams_5 cad_11 stong_15 ba_21 nyid_24 chos_29 nyid_34 skye_39 ba_44 
T02D2684:230a-14	med pa'i ngang las byung bas na rdo rje khro	med_0 ba_4 ngang_9 las_15 'byung_19 ba_25 na_29 rdo_32 rje_36 khro_40 
T02D2684:230a-15	po las byung ba zhes gsungs so //	po_0 las_3 'byung_7 ba_13 zhes_16 gsungs_21 so_28 
T02D2684:230a-16	gang 'byung zhe na rdo rje snying po ste /	gang_0 'byung_5 zhe_12 na_16 rdo_19 rje_23 snying_27 po_34 ste_37 
T02D2684:230a-17	thams cad la de bzhin gshegs pa'i snying po'i khyad par gsungs pa yin no //	thams_0 cad_6 la_10 de_13 bzhin_16 gshegs_22 ba_29 snying_34 po_41 khyad_46 ba_52 gsungs_56 ba_63 yin_66 no_70 
T02D2684:230a-18	'dir bsdus pa'i don ni 'di yin te 'khor ba	'dir_0 sdud_5 ba_11 don_16 ni_20 'di_23 yin_27 te_31 'khor_34 ba_40 
T02D2684:230a-19	dang mya ngan las 'das pa'i dongs bo thams cad	dang_0 mya_5 ngan_9 las_14 'da'_18 ba_23 dongs_28 'bo_34 thams_37 cad_43 
T02D2684:230a-20	ni rgyud do cog gi rtsa bar rang gi sems	ni_0 brgyud_3 do_9 cog_12 gi_16 rtsa_19 ba_24 rang_28 gi_33 sems_36 
T02D2684:230a-21	las byung la / sems de yang shin tu rtogs	las_0 'byung_4 la_10 sems_15 de_20 yang_23 shin_28 tu_33 rtogs_36 
T02D2684:230a-22	par dka' bas so so skye bo nas byung chub	ba_0 dka'_4 ba_9 so_13 so_16 skye_19 'bo_24 nas_27 'byung_31 chub_37 
T02D2684:230a-23	sems dpa' la sogs pa'i bar du rtogs pa'i bye	sems_0 dpa'_5 la_10 sogs_13 ba_18 ba_23 du_27 rtogs_30 ba_36 'bye_41 
T02D2684:230a-24	brag tha dad pa sna tshogs 'byung ngo //	brag_0 tha_5 dad_9 ba_13 sna_16 tshogs_20 'byung_27 ngo_34 
T02D2684:230a-25	de yang dmus long gis rta dang glang po la	de_0 yang_3 dmus_8 long_13 gis_18 rta_22 dang_26 glang_31 po_37 la_40 
T02D2684:230a-26	dpyad pa bzhin du de dag gis kyang cha shas	dpyod_0 ba_6 bzhin_9 du_15 de_18 'dag_21 gis_25 kyang_29 cha_35 shas_39 
T02D2684:230a-27	kyang rtsam la / rang rang gi grub mtha' dang	kyang_0 rtsam_6 la_12 rang_17 rang_22 gi_27 'grub_30 mtha'_35 dang_41 
T02D2684:230a-28	lta bar 'dogs pas zad de grub mtha' tha dad	lta_0 ba_4 'dogs_8 ba_14 zad_18 de_22 'grub_25 mtha'_30 tha_36 dad_40 
T02D2684:230a-29	kyang sems nyid de bzhin nyid la ni tha dad	kyang_0 sems_6 nyid_11 de_16 bzhin_19 nyid_25 la_30 ni_33 tha_36 dad_40 
T02D2684:230a-30	pa'am rnam par dbye ba yod pa ma yin te	ba_0 rnam_6 ba_11 'byed_15 ba_20 yod_23 ba_27 ma_30 yin_33 te_37 
T02D2684:230a-31	kyang rtsam la / ji skad du / chos kyi dbyings la dbyer med phyir //	kyang_0 rtsam_6 la_12 ji_17 skad_20 du_25 chos_30 kyi_35 dbyings_39 la_47 dbyer_50 med_56 phyir_60 
T02D2684:230a-32	zhes bya ba la sogs pa gsungs pa'i phyir ro //	zhes_0 byed_5 ba_9 la_12 sogs_15 ba_20 gsungs_23 ba_30 phyir_35 ro_41 
T02D2684:230a-33	sems de yang rgyud do cog gi rtsa ba ji	sems_0 de_5 yang_8 brgyud_13 do_19 cog_22 gi_26 rtsa_29 ba_34 ji_37 
T02D2684:230a-34	ltar yin zhe na lung las chos thams cad sems	ltar_0 yin_5 zhe_9 na_13 lung_16 las_21 chos_25 thams_30 cad_36 sems_40 
T02D2684:230a-35	kyi sprul pa'o // zhes bya ba la sogs pa'i lung dang rigs pa mang mod kyi /	kyi_0 sprul_4 ba_10 zhes_18 byed_23 ba_27 la_30 sogs_33 ba_38 lung_43 dang_48 rigs_53 ba_58 mang_61 mod_66 kyi_70 
T02D2684:230a-36	'dir ni bla ma'i gdams ngag la gtso bo yin no //	'dir_0 ni_5 bla_8 ma_12 'doms_17 ngag_23 la_28 gtso_31 'bo_36 yin_39 no_43 
T02D2684:230a-37	gal te gdams pa ltar na yang sems ci'i phyir	gal_0 te_4 'doms_7 ba_13 ltar_16 na_21 yang_24 sems_29 ci_34 phyir_39 
T02D2684:230a-38	na rgyud do cog gi rtsa ba yin snyam pa	na_0 brgyud_3 do_9 cog_12 gi_16 rtsa_19 ba_24 yin_27 snyam_31 ba_37 
T02D2684:230a-39	la / chos thams cad ni sems su 'dus la	la_0 chos_5 thams_10 cad_16 ni_20 sems_23 su_28 'du_31 la_36 
T02D2684:230a-40	sems kyi rang bzhin legs par ma rtogs bas 'khor	sems_0 kyi_5 rang_9 bzhin_14 legs_20 ba_25 ma_29 rtogs_32 ba_38 'khor_42 
T02D2684:230a-41	ba'i rgya mtsho yang byung la /	ba_0 rgya_5 mtsho_10 yang_16 'byung_21 la_27 
T02D2684:230a-42	rtogs shing goms pas mya ngan las 'das pa'i bde	rtogs_0 shing_6 goms_12 ba_17 mya_21 ngan_25 las_30 'da'_34 ba_39 bde_44 
T02D2684:230a-43	ba yang byung ba'i phyir sems ni rgyud do cog	ba_0 yang_3 'byung_8 ba_14 phyir_19 sems_25 ni_30 brgyud_33 do_39 cog_42 
T02D2684:230a-44	gi rtsa ba yin no //	gi_0 rtsa_3 ba_8 yin_11 no_15 
T02D2684:230a-45	ma rtogs pa las 'khor ba ji ltar 'byung zhe na /	ma_0 rtogs_3 ba_9 las_12 'khor_16 ba_22 ji_25 ltar_28 'byung_33 zhe_40 na_44 
T02D2684:230a-46	ma rig pa'i rkyen gyis 'khor ba zhes bya ba ste /	ma_0 rig_3 ba_7 rkyen_12 gyis_18 'khor_23 ba_29 zhes_32 byed_37 ba_41 ste_44 
