T02D1270:61a-19	sogs pa'i mtshams su zla ba'i steng du gri gug	sogs_0 ba_5 mtshams_10 su_18 zla_21 ba_25 steng_30 du_36 gri_39 gug_43 
T02D1270:61a-20	bzhi bri'o // shar la sogs pa'i sgor zla ba dang padma la gri gug bzhi bri'o //	bzhi_0 'bri_5 'char_14 la_19 sogs_22 ba_27 sgor_32 zla_37 ba_41 dang_44 padma_49 la_55 gri_58 gug_62 bzhi_66 'bri_71 
T02D1270:61a-21	shar dang nub kyi sgo 'gram du padma dang zla ba'i steng du gri gug gnyis bri'o //	'char_0 dang_5 nub_10 kyi_14 sgo_18 'grams_22 du_28 padma_31 dang_37 zla_42 ba_46 steng_51 du_57 gri_60 gug_64 gnyis_68 'bri_74 
T02D1270:61a-22	dkyil 'khor gyi tshon bkye ba'i dus su zhugs pa dang /	dkyil_0 'khor_6 gyi_12 tshon_16 'gyed_22 ba_27 dus_32 su_36 'jug_39 ba_45 dang_48 
T02D1270:61a-23	'byung ba dang /	'byung_0 ba_7 dang_10 
T02D1270:61a-24	rdo rje'i thig yid kyis nam mkha' la bteg ste /	rdo_0 rje_4 thig_10 yid_15 kyis_19 nam_24 mkha'_28 la_34 bteg_37 ste_42 
T02D1270:61a-25	badzra be ga'i sngags brjod pa dang /	badzra_0 be_7 ga_10 sngags_15 rjod_22 ba_28 dang_31 
T02D1270:61a-26	lha'i rnam pa dang mi bral bar dgod par bya'o //	lha_0 rnam_6 ba_11 dang_14 mi_19 'bral_22 ba_27 'god_31 ba_36 byed_40 
T02D1270:61a-27	de ltar ma yin na dam tshig nyams par bshad do //	de_0 ltar_3 ma_8 yin_11 na_15 dam_18 tshig_22 nyams_28 ba_34 'chad_38 do_44 
T02D1270:61a-28	de nyid 'dus pa las 'di ltar gsungs te /	de_0 nyid_3 'du_8 ba_13 las_16 'di_20 ltar_24 gsungs_29 te_36 
T02D1270:61a-29	dkyil 'khor 'byung dang 'jug pa la //	dkyil_0 'khor_6 'byung_12 dang_19 'jug_24 ba_29 la_32 
T02D1270:61a-30	rdo rje'i thig dang tshon rnams ni //	rdo_0 rje_4 thig_10 dang_15 tshon_20 rnams_26 ni_32 
T02D1270:61a-31	sems kyis bteg nas spyod byas na //	sems_0 kyis_5 bteg_10 nas_15 spyod_19 byed_25 na_30 
T02D1270:61a-32	dam tshig nyams pas gos mi 'gyur //	dam_0 tshig_4 nyams_10 ba_16 gos_20 mi_24 'gyur_27 
T02D1270:61a-33	de nas dkyil 'khor phyi rim du g-yas dang g-yon	de_0 nas_3 dkyil_7 'khor_13 phyi_19 rim_24 du_28 g-yas_31 dang_37 g-yon_42 
T02D1270:61a-34	skor gyi rim pas phyogs dang mtshams su ro skyes	skor_0 gyi_5 rim_9 ba_13 phyogs_17 dang_24 mtshams_29 su_37 ro_40 skye_43 
T02D1270:61a-35	dang ro langs 'jigs gzugs dang /	dang_0 ro_5 ldang_8 'jigs_14 gzugs_20 dang_26 
T02D1270:61a-36	'byung po la sogs dur khrod brgyad kyi bdag nyid bri'o //	'byung_0 po_7 la_10 sogs_13 dur_18 khrod_22 brgyad_28 kyi_35 bdag_39 nyid_44 'bri_49 
T02D1270:61b-0	de la shar phyogs su tsha ba'i rigs @61b drag la gtum pa zhes bya ba'i dur khrod bri'o //	de_0 la_3 'char_6 phyogs_11 su_18 tsha_21 ba_26 rigs_31 drag_41 la_46 'thum_49 ba_54 zhes_57 byed_62 ba_66 dur_71 khrod_75 'bri_81 
T02D1270:61b-1	lho phyogs su dum bu'i rigs 'jigs su rung ba zhes bya ba'i dur khrod bri'o //	lho_0 phyogs_4 su_11 dum_14 bu_18 rigs_23 'jigs_28 su_34 rung_37 ba_42 zhes_45 byed_50 ba_54 dur_59 khrod_63 'bri_69 
T02D1270:61b-2	nub phyogs su 'dod pa'i rigs keng rus 'bar ba zhes bya ba'i dur khrod bri'o //	nub_0 phyogs_4 su_11 'dod_14 ba_19 rigs_24 keng_29 rus_34 'bar_38 ba_43 zhes_46 byed_51 ba_55 dur_60 khrod_64 'bri_70 
T02D1270:61b-3	byang phyogs su gsal shing la btsugs par bya ba'i	byang_0 phyogs_6 su_13 gsal_16 shing_21 la_27 btsugs_30 ba_37 byed_41 ba_45 
T02D1270:61b-4	rigs 'ur 'ur 'bar bas khyab pa zhes bya ba'i	rigs_0 'ur_5 'ur_9 'bar_13 ba_18 khyab_22 ba_28 zhes_31 byed_36 ba_40 
T02D1270:61b-5	dur khrod du bri'o //	dur_0 khrod_4 du_10 'bri_13 
T02D1270:61b-6	byang shar mtshams su shing la dpyangs pa'i rigs ha har dgod pa zhes bya ba'i dur khrod bri'o //	byang_0 'char_6 mtshams_11 su_19 shing_22 la_28 dpyong_31 ba_39 rigs_44 ha_49 har_52 'god_56 ba_61 zhes_64 byed_69 ba_73 dur_78 khrod_82 'bri_88 
T02D1270:61b-7	me'i mtshams su phyed tsha ba'i rigs nags tshal phun sum tshogs pa bri'o //	me_0 mtshams_5 su_13 phyed_16 tsha_22 ba_27 rigs_32 nags_37 tshal_42 phun_48 sum_53 tshogs_57 ba_64 'bri_67 
T02D1270:61b-8	bden bral gyi mtshams su phyed dum bu'i rigs mun	bden_0 'bral_5 gyi_10 mtshams_14 su_22 phyed_25 dum_31 bu_35 rigs_40 mun_45 
T02D1270:61b-9	pa mi bzad pa zhes bya ba'i dur khrod du	ba_0 mi_3 bzad_6 ba_11 zhes_14 byed_19 ba_23 dur_28 khrod_32 du_38 
T02D1270:61b-10	bri'o // rlung gi mtshams su sa 'og tu sbas	'bri_0 rlung_9 gi_15 mtshams_18 su_26 sa_29 'og_32 tu_36 sbed_39 
T02D1270:61b-11	pa'i rigs k'i li k'i li'i sgra sgrog pa bri'o	ba_0 rigs_5 k_10 li_14 k_17 li_21 sgra_26 sgrog_31 ba_37 'bri_40 
T02D1270:61b-12	bri'o // // de dag kyang rim pa ji lta ba bzhin du shing rnams bri'o //	'bri_0 de_12 'dag_15 kyang_19 rim_25 ba_29 ji_32 lta_35 ba_39 bzhin_42 du_48 shing_51 rnams_57 'bri_63 
T02D1270:61b-13	shi ri sha dang /	'chi_0 ri_4 sha_7 dang_11 
T02D1270:61b-14	tsu ta dang /	tsu_0 ta_4 dang_7 
T02D1270:61b-15	kang ke li /	kang_0 ke_5 li_8 
T02D1270:61b-16	aa shvadtha /	aa_0 shvadtha_3 
T02D1270:61b-17	bha tha /	bha_0 tha_4 
T02D1270:61b-18	ka ra nydza /	ka_0 ra_3 nydza_6 
T02D1270:61b-19	la ta ta /	la_0 ta_3 ta_6 
T02D1270:61b-20	pra ka ri /	pra_0 ka_4 ri_7 
T02D1270:61b-21	sa las skyes pa shar la sogs pa'i rim pas bri'o //	sa_0 las_3 skye_7 ba_13 'char_16 la_21 sogs_24 ba_29 rim_34 ba_38 'bri_42 
T02D1270:61b-22	shing rnams kyi nang du shing gi bdag po gri gug dang /	shing_0 rnams_6 kyi_12 nang_16 du_21 shing_24 gi_30 bdag_33 po_38 gri_41 gug_45 dang_49 
T02D1270:61b-23	thod pa 'dzin pa 'khor dang bcas pa bri'o //	thod_0 ba_5 'dzin_8 ba_14 'khor_17 dang_23 'cha'_28 ba_33 'bri_36 
T02D1270:61b-24	de la glang po che'i gdong pa can ni glang po che'i tshogs kyis bskor ba'o //	de_0 la_3 glang_6 po_12 che_15 gdong_21 ba_27 can_30 ni_34 glang_37 po_43 che_46 tshogs_52 kyis_59 skor_64 ba_70 
T02D1270:61b-25	ma he'i gdong pa can ni ma he'i tshogs kyis bskor ba'o //	ma_0 he_3 gdong_8 ba_14 can_17 ni_21 ma_24 he_27 tshogs_32 kyis_39 skor_44 ba_50 
T02D1270:61b-26	chu srin gyi gdong pa can ni nya'i tshogs kyis bskor ba'o //	chu_0 srin_4 gyi_9 gdong_13 ba_19 can_22 ni_26 nya_29 tshogs_35 kyis_42 skor_47 ba_53 
T02D1270:61b-27	gnod sbyin gyi gdong pa can ni mi'i tshogs kyis bskor ba'o //	gnod_0 sbyin_5 gyi_11 gdong_15 ba_21 can_24 ni_28 mi_31 tshogs_36 kyis_43 skor_48 ba_54 
T02D1270:61b-28	ba glang gi gdod pa can ni khyu mchog gi tshogs kyis bskor ba'o //	ba_0 glang_3 gi_9 gdod_12 ba_17 can_20 ni_24 khyu_27 mchog_32 gi_38 tshogs_41 kyis_48 skor_53 ba_59 
T02D1270:61b-29	ra'i gdong pa can ni ra'i tshogs kyis bskor ba'o //	ra_0 gdong_5 ba_11 can_14 ni_18 ra_21 tshogs_26 kyis_33 skor_38 ba_44 
T02D1270:61b-30	srin po'i gdong pa can ni yi dags kyi tshogs kyis bskor ba'o //	srin_0 po_5 gdong_10 ba_16 can_19 ni_23 yi_26 dags_29 kyi_34 tshogs_38 kyis_45 skor_50 ba_56 
T02D1270:61b-31	sha ra bha'i gdong pa can ni sha ra bha'i tshogs kyis bskor ba'o //	sha_0 ra_4 bha_7 gdong_13 ba_19 can_22 ni_26 sha_29 ra_33 bha_36 tshogs_42 kyis_49 skor_54 ba_60 
T02D1270:61b-32	shing de dag gi rtsar ni phyogs skyong pa rnams	shing_0 de_6 'dag_9 gi_13 rtsar_16 ni_22 phyogs_25 skyong_32 ba_39 rnams_42 
T02D1270:61b-33	ji ltar gsungs pa bzhin 'khor dang bcas pa rang	ji_0 ltar_3 gsungs_8 ba_15 bzhin_18 'khor_24 dang_30 'cha'_35 ba_40 rang_43 
T02D1270:61b-34	gi rig ma la 'khyud par bzhugs so //	gi_0 rig_3 ma_7 la_10 'khyud_13 ba_20 bzhugs_24 so_31 
T02D1270:61b-35	de la dbang po ni sku mdog ser po rin	de_0 la_3 dbang_6 po_12 ni_15 sku_18 mdog_22 ser_27 po_31 rin_34 
T02D1270:61b-36	po che'i dbu rgyan can sna tshogs pa'i rgyan gyis	po_0 che_3 dbu_9 rgyan_13 can_19 sna_23 tshogs_27 ba_34 rgyan_39 gyis_45 
T02D1270:61b-37	brgyan pa / phyag na rdo rje 'dzin zhing glang	rgyan_0 ba_7 phyag_12 na_18 rdo_21 rje_25 'dzin_29 zhing_35 glang_41 
T02D1270:61b-38	po dkar po la 'gying bag gi tshul gyis bzhugs	po_0 dkar_3 po_8 la_11 'gying_14 bag_21 gi_25 tshul_28 gyis_34 bzhugs_39 
T02D1270:61b-39	brgyan pa / pa bri'o // gshin rje ni sku	rgyan_0 ba_7 ba_12 'bri_15 gshin_24 rje_30 ni_34 sku_37 
T02D1270:61b-40	mdog nag po spyan me mdag gi phung po 'dra	mdog_0 nag_5 po_9 spyan_12 me_18 mdag_21 gi_26 'phung_29 po_35 'dra_38 
T02D1270:61b-41	brgyan pa / pa bri'o // ba / smin ma	rgyan_0 ba_7 ba_12 'bri_15 ba_24 smin_29 ma_34 
T02D1270:61b-42	dang dpral bar khro gnyer bsdus pa skra ser po	dang_0 dpral_5 ba_11 khro_15 gnyer_20 sdud_26 ba_32 skra_35 ser_40 po_44 
T02D1270:61b-43	gyen du 'bar ba /	gyen_0 du_5 'bar_8 ba_13 
T02D1270:62a-0	phyag na dbyug pa dang rtse gsum @62a * //	phyag_0 na_6 dbyug_9 ba_15 dang_18 rtse_23 gsum_28 
T02D1270:62a-1	'dzin cing ma he la khros pa'i tshul gyis bzhugs pa bri'o //	'dzin_0 cing_6 ma_11 he_14 la_17 khro_20 ba_26 tshul_31 gyis_37 bzhugs_42 ba_49 'bri_52 
T02D1270:62a-2	chu bdag ni sku mdog dkar po gdengs ka bdun dang ldan pa /	chu_0 bdag_4 ni_9 sku_12 mdog_16 dkar_21 po_26 gdeng_29 ka_36 bdun_39 dang_44 ldan_49 ba_54 
T02D1270:62a-3	sbrul gyi zhags pa dang dung 'dzin pa chu srin la bzhugs pa'o //	sbrul_0 gyi_6 zhags_10 ba_16 dang_19 dung_24 'dzin_29 ba_35 chu_38 srin_42 la_47 bzhugs_50 ba_57 
T02D1270:62a-4	nor bdag ni sku mdog ser po gser gyi mdog	nor_0 bdag_4 ni_9 sku_12 mdog_16 ser_21 po_25 gser_28 gyi_33 mdog_37 
T02D1270:62a-5	can rin po che'i dbu rgyan can lcags kyu dang	can_0 rin_4 po_8 che_11 dbu_17 rgyan_21 can_27 lcags_31 kyu_37 dang_41 
T02D1270:62a-6	dbyug pa 'dzin pa gnod sbyin la bzhugs pa'o //	dbyug_0 ba_6 'dzin_9 ba_15 gnod_18 sbyin_23 la_29 bzhugs_32 ba_39 
T02D1270:62a-7	dbang ldan ni sku mdog dkar po ral pa'i thor tshugs can zla ba'i dbu rgyan /	dbang_0 ldan_6 ni_11 sku_14 mdog_18 dkar_23 po_28 ral_31 ba_35 'thor_40 tshugs_45 can_52 zla_56 ba_60 dbu_65 rgyan_69 
T02D1270:62a-8	spyan gsum pa thod pa'i phreng ba can /	spyan_0 gsum_6 ba_11 thod_14 ba_19 phreng_24 ba_31 can_34 
T02D1270:62a-9	phyag bzhi pa /	phyag_0 bzhi_6 ba_11 
T02D1270:62a-10	cang te'u dang /	cang_0 te_5 dang_10 
T02D1270:62a-11	thod pa dang /	thod_0 ba_5 dang_8 
T02D1270:62a-12	tri sh'u la /	tri_0 sh_4 la_9 
T02D1270:62a-13	kha tv'am ga 'dzin pa khyu mchog gi steng du bzhugs pa'o //	kha_0 tv_4 ga_10 'dzin_13 ba_19 khyu_22 mchog_27 gi_33 steng_36 du_42 bzhugs_45 ba_52 
T02D1270:62a-14	me lha ni sku mdog dmar po ral pa thor tshugs su byas pa /	me_0 lha_3 ni_7 sku_10 mdog_14 dmar_19 po_24 ral_27 ba_31 'thor_34 tshugs_39 su_46 byed_49 ba_54 
T02D1270:62a-15	tshangs pa'i the gu can /	tshangs_0 ba_8 the_13 gu_17 can_20 
T02D1270:62a-16	phyag bzhi pa /	phyag_0 bzhi_6 ba_11 
T02D1270:62a-17	bgrang phreng dang skyabs sbyin dang gundhe dang /	bgrong_0 phreng_7 dang_14 skyob_19 sbyin_26 dang_32 gundhe_37 dang_44 
T02D1270:62a-18	dbyug pa 'dzin pa ra'i steng na bzhugs pa'o //	dbyug_0 ba_6 'dzin_9 ba_15 ra_18 steng_23 na_29 bzhugs_32 ba_39 
T02D1270:62a-19	bden bral ni sku mdog sngon po dbu skra dmar po gyen du 'bar ba /	bden_0 'bral_5 ni_10 sku_13 mdog_17 sngon_22 po_28 dbu_31 skra_35 dmar_40 po_45 gyen_48 du_53 'bar_56 ba_61 
T02D1270:62a-20	thod pa'i phreng ba can gri gug dang thod pa 'dzin pa ro'i steng na bzhugs pa'o //	thod_0 ba_5 phreng_10 ba_17 can_20 gri_24 gug_28 dang_32 thod_37 ba_42 'dzin_45 ba_51 ro_54 steng_59 na_65 bzhugs_68 ba_75 
T02D1270:62a-21	rlung ni du ba'i mdog can rlung gi ras 'dzin pa /	rlung_0 ni_6 du_9 ba_12 mdog_17 can_22 rlung_26 gi_32 ras_35 'dzin_39 ba_45 
T02D1270:62a-22	rin po che'i dbu rgyan can sha ba'i steng na bzhugs pa bri'o //	rin_0 po_4 che_7 dbu_13 rgyan_17 can_23 sha_27 ba_31 steng_36 na_42 bzhugs_45 ba_52 'bri_55 
T02D1270:62a-23	de dag gi gnas su yang lha dang yi dags	de_0 'dag_3 gi_7 gnas_10 su_15 yang_18 lha_23 dang_27 yi_32 dags_35 
T02D1270:62a-24	dang klu dang gnod sbyin dang 'byung po dang thub	dang_0 klu_5 dang_9 gnod_14 sbyin_19 dang_25 'byung_30 po_37 dang_40 thub_45 
T02D1270:62a-25	pa dang / srin po dang rlung bdag dang de dag gi tshogs kyis bskor ba bri'o //	ba_0 dang_3 srin_10 po_15 dang_18 rlung_23 bdag_29 dang_34 de_39 'dag_42 gi_46 tshogs_49 kyis_56 skor_61 ba_67 'bri_70 
T02D1270:62a-26	de'i g-yon du klu chen po brgyad gdengs ka dang bcas par bri'o //	de_0 g-yon_5 du_11 klu_14 chen_18 po_23 brgyad_26 gdeng_33 ka_40 dang_43 'cha'_48 ba_53 'bri_57 
T02D1270:62a-27	nor rgyas ni zla ba'i mdog can spyi bor autpala sngon pos mtshan pa gdengs ka dang bcas pa /	nor_0 rgya_4 ni_10 zla_13 ba_17 mdog_22 can_27 spyi_31 'bor_36 autpala_40 sngon_48 pos_54 mtshan_58 ba_65 gdeng_68 ka_75 dang_78 'cha'_83 ba_88 
T02D1270:62a-28	padma ni dung gi mdog can dpal be'us mtshan pa'i gdengs ka can /	padma_0 ni_6 dung_9 gi_14 mdog_17 can_22 dpal_26 be_31 mtshan_37 ba_44 gdeng_49 ka_56 can_59 
T02D1270:62a-29	stobs kyi rgyu ni d'ur ba lta bur mdog sngo	stobs_0 kyi_6 rgyu_10 ni_15 d_18 ba_23 lta_26 bur_30 mdog_34 sngo_39 
T02D1270:62a-30	ba rin po che gsum gyis mgrin par mtshan pa'o	ba_0 rin_3 po_7 che_10 gsum_14 gyis_19 mgrin_24 ba_30 mtshan_34 ba_41 
T02D1270:62a-31	// 'jog po ni nyer ldan gyi me tog lta bu'i mdog can nor bu 'bar bas mtshan pa /	'jog_3 po_8 ni_11 nyer_14 ldan_19 gyi_24 me_28 tog_31 lta_35 bu_39 mdog_44 can_49 nor_53 bu_57 'bar_60 ba_65 mtshan_69 ba_76 
T02D1270:62a-32	padma chen po'i mdog kunda lta bur mtshungs pa rtse gsum gyis mtshan pa /	padma_0 chen_6 po_11 mdog_16 kunda_21 lta_27 bur_31 mtshungs_35 ba_44 rtse_47 gsum_52 gyis_57 mtshan_62 ba_69 
T02D1270:62a-33	hu lu hu lu ni shin tu gnag pa spyi bo mtshan mas mtshan pa /	hu_0 lu_3 hu_6 lu_9 ni_12 shin_15 tu_20 gnag_23 ba_28 spyi_31 'bo_36 mtshan_39 mas_46 mtshan_50 ba_57 
T02D1270:62a-34	rigs ldan ni du ba'i mdog can zla ba'i nor bus mgrin pa mtshan pa /	rigs_0 ldan_5 ni_10 du_13 ba_16 mdog_21 can_26 zla_30 ba_34 nor_39 'bud_43 mgrin_47 ba_53 mtshan_56 ba_63 
T02D1270:62a-35	dung skyong ni gser gyi mdog can mgrin pa zla ba'i dkyil 'khor gyis mtshan pa bri'o //	dung_0 skyong_5 ni_12 gser_15 gyi_20 mdog_24 can_29 mgrin_33 ba_39 zla_42 ba_46 dkyil_51 'khor_57 gyis_63 mtshan_68 ba_75 'bri_78 
T02D1270:62b-0	de dag gi rgyab tshogs su sprin rnams bri ste sgra grag pa ni mdog @62b nag po /	de_0 'dag_3 gi_7 rgyab_10 tshogs_16 su_23 sprin_26 rnams_32 'bri_38 ste_42 sgra_46 grag_51 ba_56 ni_59 mdog_62 nag_72 po_76 
T02D1270:62b-1	'khyil pa ni mdog sngon po /	'khyil_0 ba_7 ni_10 mdog_13 sngon_18 po_24 
T02D1270:62b-2	rmugs pa ni gur gum gyi mdog can /	rmugs_0 ba_6 ni_9 gur_12 'gum_16 gyi_20 mdog_24 can_29 
T02D1270:62b-3	mun pa ni sna tshogs pa'i mdog can /	mun_0 ba_4 ni_7 sna_10 tshogs_14 ba_21 mdog_26 can_31 
T02D1270:62b-4	gang ba ni dmar ser /	gang_0 ba_5 ni_8 dmar_11 ser_16 
T02D1270:62b-5	'bab pa ni sngon dmar /	'bab_0 ba_5 ni_8 sngon_11 dmar_17 
T02D1270:62b-6	drag po ni snag tsha'i mdog can /	drag_0 po_5 ni_8 snag_11 tsha_16 mdog_23 can_28 
T02D1270:62b-7	'khrigs pa ni dkar po /	'khrig_0 ba_8 ni_11 dkar_14 po_19 
T02D1270:62b-8	gzhan yang dkyil 'khor gyi rgyan du gyur pa thams cad kyis legs par spras te brgyan par bya'o //	gzhan_0 yang_6 dkyil_11 'khor_17 gyi_23 rgyan_27 du_33 gyur_36 ba_41 thams_44 cad_50 kyis_54 legs_59 ba_64 spras_68 te_74 rgyan_77 ba_84 byed_88 
T02D1270:62b-9	tshon dgye ba'i rim pa'o /	tshon_0 dgye_6 ba_11 rim_16 ba_20 
T02D1270:62b-11	// / de la dkyil 'khor bri ba'i dus su gang zhig gis bgegs brtsam pa dang /	de_5 la_8 dkyil_11 'khor_17 'bri_23 ba_27 dus_32 su_36 gang_39 'jig_44 gis_49 bgegs_53 brtsam_59 ba_66 dang_69 
T02D1270:62b-12	rang bzhin gyis bar chad du 'gyur ba spang ba'i phyir /	rang_0 bzhin_5 gyis_11 ba_16 'chad_20 du_25 'gyur_28 ba_34 spong_37 ba_43 phyir_48 
T02D1270:62b-13	sngon gyi rim pa bzhin dbang po la sogs pa'i	sngon_0 gyi_6 rim_10 ba_14 bzhin_17 dbang_23 po_29 la_32 sogs_35 ba_40 
T02D1270:62b-14	phyogs skyong ba rnams la rim pa bzhin du phur	phyogs_0 skyong_7 ba_14 rnams_17 la_23 rim_26 ba_30 bzhin_33 du_39 'phur_42 
T02D1270:62b-15	bus gdab pa la sogs pa bya'o //	'bud_0 gdab_4 ba_9 la_12 sogs_15 ba_20 byed_23 
T02D1270:62b-16	gal te dkyil 'khor gyi gnas su char dbab par gyur na /	gal_0 te_4 dkyil_7 'khor_13 gyi_19 gnas_23 su_28 char_31 'bebs_36 ba_41 gyur_45 na_50 
T02D1270:62b-17	dgyes pa'i rdo rje'i rnal 'byor dang ldan pas dur khrod kyi ras kyi steng du 'dug ste /	dgyes_0 ba_6 rdo_11 rje_15 rnal_21 'byor_26 dang_32 ldan_37 ba_42 dur_46 khrod_50 kyi_56 ras_60 kyi_64 steng_68 du_74 'dug_77 ste_82 
T02D1270:62b-18	gdug pa'i sems kyis sngags 'di bzlas so //	gdug_0 ba_5 sems_10 kyis_15 sngags_20 'di_27 bzlas_31 so_37 
T02D1270:62b-19	aom a'arya a'arya sma shan /	aom_0 a_4 a_11 sma_18 shan_22 
T02D1270:62b-20	pri y'a ya h'um h'um phat sv'a h'a /	pri_0 y_4 ya_8 h_11 h_16 phat_21 sv_26 h_31 
T02D1270:62b-21	'bar ba'i lta bas gyen du bltas nas thugs ka	'bar_0 ba_5 lta_10 ba_14 gyen_18 du_23 lta_26 nas_32 thugs_36 ka_42 
T02D1270:62b-22	nas khro bo 'bar ba'i tshogs kyis nam mkha'i khams	nas_0 khro_4 'bo_9 'bar_12 ba_17 tshogs_22 kyis_29 nam_34 mkha_38 khams_45 
T02D1270:62b-23	yongs su khyab ste /	yongs_0 su_6 khyab_9 ste_15 
T02D1270:62b-24	de'i 'od zer ye shes kyi mi lta bus sprin	de_0 'od_5 zer_9 ye_13 shes_16 kyi_21 mi_25 lta_28 'bud_32 sprin_36 
T02D1270:62b-25	gyi tshogs yongs su gtor ba'i bsam pa dang ldan	gyi_0 tshogs_4 yongs_11 su_17 'thor_20 ba_25 bsam_30 ba_35 dang_38 ldan_43 
T02D1270:62b-26	par bya'o // gal te me'i dgra byung bar gyur na /	ba_0 byed_4 gal_13 te_17 me_20 dgra_25 'byung_30 ba_36 gyur_40 na_45 
T02D1270:62b-27	me'i steng du bam yongs su gyur pa las chu'i dkyil 'khor kha dog dkar po /	me_0 steng_5 du_11 bam_14 yongs_18 su_24 gyur_27 ba_32 las_35 chu_39 dkyil_45 'khor_51 kha_57 dog_61 dkar_65 po_70 
T02D1270:62b-28	de'i steng du padma 'dab ma brgyad pa'i lte ba la /	de_0 steng_5 du_11 padma_14 'dab_20 ma_25 brgyad_28 ba_35 lte_40 ba_44 la_47 
T02D1270:62b-29	bhr'um yongs su gyur pa'i 'khor lo rtsibs brgyad pa bsam /	bhr_0 yongs_7 su_13 gyur_16 ba_21 'khor_26 lo_32 rtsibs_35 brgyad_42 ba_49 bsam_52 
T02D1270:62b-30	de'i lte ba la bhr'um las gyur pa'i ston ka'i	de_0 lte_5 ba_9 la_12 bhr_15 las_22 gyur_26 ba_31 ston_36 ka_41 
T02D1270:62b-31	ri bong can gyi dbus su bhr'um gyis byin gyis	ri_0 bong_3 can_8 gyi_12 dbus_16 su_21 bhr_24 gyis_31 byin_36 gyis_41 
T02D1270:62b-32	brlabs pa'i dbus su rgya mtsho bzhi chu bo chen	brlabs_0 ba_7 dbus_12 su_17 rgya_20 mtsho_25 bzhi_31 chu_36 'bo_40 chen_43 
T02D1270:62b-33	po bzhi ma dros pa'i chu lta bu'i thugs ka'i	po_0 bzhi_3 ma_8 dro_11 ba_16 chu_21 lta_25 bu_29 thugs_34 ka_40 
T02D1270:62b-34	sa bon gyi 'od zer sprin gyi tshogs lta bu	sa_0 bon_3 gyi_7 'od_11 zer_15 sprin_19 gyi_25 tshogs_29 lta_36 bu_40 
T02D1270:62b-35	byung ste nam mkha'i khams ma lus pa khyab par	'byung_0 ste_6 nam_10 mkha_14 khams_21 ma_27 lus_30 ba_34 khyab_37 ba_43 
T02D1270:62b-36	byas nas chu'i rgyun 'bab pas phyogs bcur yongs su	byed_0 nas_5 chu_9 rgyun_15 'bab_21 ba_26 phyogs_30 'jur_37 yongs_42 su_48 
T02D1270:62b-37	'gengs par 'gyur ro //	'gengs_0 ba_7 'gyur_11 ro_17 
T02D1270:62b-38	bdag nyid rnam par snang mdzad du bsam mo //	bdag_0 nyid_5 rnam_10 ba_15 snang_19 mdzad_25 du_31 bsam_34 mo_39 
T02D1270:62b-39	gal te rlung gis bar chad du gyur na de	gal_0 te_4 rlung_7 gis_13 ba_17 'chad_21 du_26 gyur_29 na_34 de_37 
T02D1270:62b-40	zhi bar bya ba'i phyir bdag nyid lhag pa'i lha'am	zhi_0 ba_4 byed_8 ba_12 phyir_17 bdag_23 nyid_28 lhag_33 ba_38 lha_43 
T02D1270:62b-41	rdo rje h'um mdzad kyi rnal 'byor du zhugs te	rdo_0 rje_4 h_8 mdzad_13 kyi_19 rnal_23 'byor_28 du_34 'jug_37 te_43 
T02D1270:62b-42	/ h'um gi sngags 'bum phrag tu bzlas pa byas la sa la ma lhung ba'i rnam lnga'am /	h_2 gi_7 sngags_10 'bum_17 phrag_22 tu_28 bzlas_31 ba_37 byed_40 la_45 sa_48 la_51 ma_54 lhung_57 ba_63 rnam_68 lnga_73 
T02D1270:63a-0	grog mkhar gyi sa las @63a * //	grog_0 mkhar_5 gyi_11 sa_15 las_18 
T02D1270:63a-1	rlung lha'i gzugs byas nas nam mkhar yam las byung ba'i rlung lha'i gzugs bsams te /	rlung_0 lha_6 gzugs_12 byed_18 nas_23 nam_27 mkhar_31 yam_37 las_41 'byung_45 ba_51 rlung_56 lha_62 gzugs_68 bsams_74 te_80 
T02D1270:63a-2	de nyid bkug la rdzas kyi gzugs la bstim par bya'o //	de_0 nyid_3 'gugs_8 la_13 rdzas_16 kyi_22 gzugs_26 la_32 stim_35 ba_41 byed_45 
T02D1270:63a-3	bcings la ni ram shu'i phur bu sor bzhi sa	'ching_0 la_7 ni_10 ram_13 shu_17 'phur_23 bu_28 sor_31 bzhi_35 sa_40 
T02D1270:63a-4	la lan brgya rtsa brgyad du bzlas te gdab par	la_0 lan_3 brgya_7 rtsa_13 brgyad_18 du_25 bzlas_28 te_34 gdab_37 ba_42 
T02D1270:63a-5	bya'o // de bzhin du chu'i gnod pa bsal bar	byed_0 de_9 bzhin_12 du_18 chu_21 gnod_27 ba_32 bsal_35 ba_40 
T02D1270:63a-6	bya ba'i phyir chu lha la phur bus gdab par	byed_0 ba_4 phyir_9 chu_15 lha_19 la_23 'phur_26 'bud_31 gdab_35 ba_40 
T02D1270:63a-7	bya'o // bya'o // yang sngon bzhin du rdo rje	byed_0 byed_9 yang_18 sngon_23 bzhin_29 du_35 rdo_38 rje_42 
T02D1270:63a-8	ra ba la sogs pa rdo rjes gzhi'i bar du	ra_0 ba_3 la_6 sogs_9 ba_14 rdo_17 rjes_21 gzhi_26 ba_33 du_37 
T02D1270:63a-9	rim pas bsgom pa la khro bo'i lta bas phyogs	rim_0 ba_4 bsgom_8 ba_14 la_17 khro_20 'bo_25 lta_30 ba_34 phyogs_38 
T02D1270:63a-10	thams cad du bltas la /	thams_0 cad_6 du_10 lta_13 la_19 
T02D1270:63a-11	rtsa ba'i sngags brjod par bya'o //	rtsa_0 ba_5 sngags_10 rjod_17 ba_23 byed_27 
T02D1270:63a-12	aom aa shta na n'a ya /	aom_0 aa_4 shta_7 na_12 n_15 ya_19 
T02D1270:63a-13	pinggo rdhva ke sha bartma ne tsa tu rbim sha ti ne tr'a ya /	pinggo_0 rdhva_7 ke_13 sha_16 bartma_20 ne_27 tsa_30 tu_34 rbim_37 sha_42 ti_46 ne_49 tr_52 ya_57 
T02D1270:63a-14	sho da sha bhu dz'a ya kri shna dzi m'u ta wa pu she /	sho_0 da_4 sha_7 bhu_11 dz_15 ya_20 kri_23 shna_27 dzi_32 m_36 ta_40 wa_43 pu_46 she_49 
T02D1270:63a-15	ka p'a la m'a l'a ne kam dh'a ri ne a'a ddma kr'u ra tsi tt'a ya /	ka_0 p_3 la_7 m_10 l_14 ne_18 kam_21 dh_25 ri_30 ne_33 a_36 ddma_40 kr_45 ra_50 tsi_53 tt_57 ya_62 
T02D1270:63a-16	aardhan du dam shti ne aom m'a ra ya m'a ra ya /	aardhan_0 du_8 dam_11 shti_15 ne_20 aom_23 m_27 ra_31 ya_34 m_37 ra_41 ya_44 
T02D1270:63a-17	k'a ra ya k'a ra ya /	k_0 ra_4 ya_7 k_10 ra_14 ya_17 
T02D1270:63a-18	ga rdza ya ga rdza ya /	ga_0 rdza_3 ya_8 ga_11 rdza_14 ya_19 
T02D1270:63a-19	ta rdza ya ta rdza ya /	ta_0 rdza_3 ya_8 ta_11 rdza_14 ya_19 
T02D1270:63a-20	sho sha ya sho sha ya /	sho_0 sha_4 ya_8 sho_11 sha_15 ya_19 
T02D1270:63a-21	sapta s'a ga r'an /	sapta_0 s_6 ga_10 r_13 
T02D1270:63a-22	bandha bandha n'a g'a shti k'an /	bandha_0 bandha_7 n_14 g_18 shti_22 k_27 
T02D1270:63a-23	gri hna gri hna /	gri_0 hna_4 gri_8 hna_12 
T02D1270:63a-24	sarba sha tr'um /	sarba_0 sha_6 tr_10 
T02D1270:63a-25	ha h'a /	ha_0 h_3 
T02D1270:63a-26	hi h'i /	hi_0 h_3 
T02D1270:63a-27	hu h'u /	hu_0 h_3 
T02D1270:63a-28	he hee /	he_0 hee_3 
T02D1270:63a-29	ho hoo /	ho_0 hoo_3 
T02D1270:63a-30	ham ha: phat sv'a h'a /	ham_0 ha:_4 phat_8 sv_13 h_18 
T02D1270:63a-31	yang na bar chad zhi bar bya ba'i phyir /	yang_0 na_5 ba_8 'chad_12 zhi_17 ba_21 byed_25 ba_29 phyir_34 
T02D1270:63a-32	aarga'i lo ma dang /	aarga_0 lo_8 ma_11 dang_14 
T02D1270:63a-33	ske tshe dang /	ske_0 tshe_4 dang_9 
T02D1270:63a-34	btsan dug dang /	btsan_0 dug_6 dang_10 
T02D1270:63a-35	tsi tra ka'i khu ba rnams kyis bgegs kyi ming bris te /	tsi_0 tra_4 ka_8 khu_13 ba_17 rnams_20 kyis_26 bgegs_31 kyi_37 ming_41 'bri_46 te_51 
T02D1270:63a-36	aom he badzra dzra ra dzvar sha tr'am na na bhr'um h'um h'um h'um phat sv'a h'a /	aom_0 he_4 badzra_7 dzra_14 ra_19 dzvar_22 sha_28 tr_32 na_38 na_41 bhr_44 h_51 h_56 h_61 phat_66 sv_71 h_76 
T02D1270:63a-37	sngags 'di khri phrag tu bzlas te /	sngags_0 'di_7 khri_11 phrag_16 tu_22 bzlas_25 te_31 
T02D1270:63a-38	shin tu khros nas 'bras phub kyi phye la sbyin sreg bya'o //	shin_0 tu_5 khro_8 nas_14 'bras_18 'bubs_24 kyi_29 'byed_33 la_38 sbyin_41 sreg_47 byed_52 
T02D1270:63a-39	des kyang bar chad zhi bar ma gyur na de la dug dang /	des_0 kyang_4 ba_10 'chad_14 zhi_19 ba_23 ma_27 gyur_30 na_35 de_38 la_41 dug_44 dang_48 
T02D1270:63a-40	tsha ba dang /	tsha_0 ba_5 dang_8 
T02D1270:63a-41	skye tshe dang /	skye_0 tshe_5 dang_10 
T02D1270:63a-42	tshva dang /	tshva_0 dang_6 
T02D1270:63a-43	ro bsregs pa'i thal ba dang /	ro_0 bsregs_3 ba_10 thal_15 ba_20 dang_23 
T02D1270:63a-44	sol ba dang /	sol_0 ba_4 dang_7 
T02D1270:63a-45	mi rus phye ma dang 'di dag ni smyi byed kyi khu bas sbrus te /	mi_0 rus_3 'byed_7 ma_12 dang_15 'di_20 'dag_24 ni_28 smyi_31 byed_36 kyi_41 khu_45 ba_49 sbru_53 te_59 
T02D1270:63a-46	bgegs kyi gzugs byas la rnga mo dang bong bu	bgegs_0 kyi_6 gzugs_10 byed_16 la_21 rnga_24 mo_29 dang_32 bong_37 bu_42 
T02D1270:63a-47	la sogs pa'i ril ma la dur khrod las byung	la_0 sogs_3 ba_8 ril_13 ma_17 la_20 dur_23 khrod_27 las_33 'byung_37 
T02D1270:63a-48	ba'i me sbar te /	ba_0 me_5 sbor_8 te_13 
T02D1270:63a-49	mtshon rnon pos gzugs gtubs shing /	mtshon_0 rnon_7 pos_12 gzugs_16 gtub_22 shing_28 
T02D1270:63a-50	aom sarba bi ghan'an m'a ra ya ghu: sv'a h'a /	aom_0 sarba_4 bi_10 ghan_13 m_21 ra_25 ya_28 ghu:_31 sv_36 h_41 
T02D1270:63a-51	zhes pa'i sngags kyis 'bar ba'i mig dang /	zhes_0 ba_5 sngags_10 kyis_17 'bar_22 ba_27 mig_32 dang_36 
T02D1270:63a-52	phyed krung gi gar gyis sngar bzhin sbyin sreg bya'o //	phyed_0 krung_6 gi_12 gar_15 gyis_19 sngar_24 bzhin_30 sbyin_36 sreg_42 byed_47 
T02D1270:63a-53	de yang chos thams cad rnam par rtog pa tsam yin la /	de_0 yang_3 chos_8 thams_13 cad_19 rnam_23 ba_28 rtogs_32 ba_37 tsam_40 yin_45 la_49 
T02D1270:63a-54	bgegs kyang rnam par rtog pa las byung ba'i phyir /	bgegs_0 kyang_6 rnam_12 ba_17 rtogs_21 ba_26 las_29 'byung_33 ba_39 phyir_44 
T02D1270:63a-55	bdag med pa'i mes 'joms par 'gyur ro //	bdag_0 med_5 ba_9 mes_14 'joms_18 ba_24 'gyur_28 ro_34 
T02D1270:63a-56	bar chod bsal ba'i rim pa'o /	ba_0 chod_4 bsal_9 ba_14 rim_19 ba_23 
T02D1270:63a-58	// / de nas bar chad med par dkyil 'khor bri ba rdzogs pa dang /	de_5 nas_8 ba_12 'chad_16 med_21 ba_25 dkyil_29 'khor_35 'bri_41 ba_45 rdzogs_48 ba_55 dang_58 
T02D1270:63b-0	slob dpon khrus byas te dri zhim pos @63b byugs la /	slob_0 dpon_5 'khru_10 byed_16 te_21 'dri_24 zhim_28 pos_33 'byug_42 la_48 
T02D1270:63b-1	sna tshogs pa'i na bza' gyon zhing me tog gi phreng bas cod pan byas te /	sna_0 tshogs_4 ba_11 na_16 bza'_19 gyon_24 zhing_29 me_35 tog_38 gi_42 phreng_45 ba_52 cod_56 pan_60 byed_64 te_69 
T02D1270:63b-2	dkyil 'khor gyi pho brang du zhugs la stan mtho	dkyil_0 'khor_6 gyi_12 pho_16 brang_20 du_26 'jug_29 la_35 stan_38 mtho_43 
T02D1270:63b-3	zhing 'jam pa la 'dug la rang lha'i rnal 'byor	zhing_0 'jam_6 ba_11 la_14 'dug_17 la_22 rang_25 lha_30 rnal_36 'byor_41 
