T02D1887:186b-2	de dag ni rdo rje'i dam tshig go //	de_0 'dag_3 ni_7 rdo_10 rje_14 dam_20 tshig_24 go_30 
T02D1887:186b-3	de ma thag tu yi ge aa las skyes pa'i dril bu la /	de_0 ma_3 thag_6 tu_11 yi_14 ge_17 aa_20 las_23 skye_27 ba_33 'dril_38 bu_43 la_46 
T02D1887:186b-4	'di de sangs rgyas thams cad kyi //	'di_0 de_4 sangs_7 rgya_13 thams_19 cad_25 kyi_29 
T02D1887:186b-5	ye shes dbyangs kyi rjes 'gror bshad //	ye_0 shes_3 dbyangs_8 kyi_16 rjes_20 'gror_25 'chad_31 
T02D1887:186b-6	khyod kyis kyang ni rtag tu zung //	khyod_0 kyis_6 kyang_11 ni_17 rtag_20 tu_25 zung_28 
T02D1887:186b-7	byang chub mchog tu rgyal bas bzhing [?] //	byang_0 chub_6 mchog_11 tu_17 rgyal_20 ba_26 bzhing_30 
T02D1887:186b-8	ces pa 'dis slob ma'i lag tu sbyin no //	ces_0 ba_4 'dis_7 slob_12 ma_17 lag_22 tu_26 sbyin_29 no_35 
T02D1887:186b-9	srid pa rang bzhin gyis ni dag / ngo bo nyid kyis srid bral byas //	srid_0 ba_5 rang_8 bzhin_13 gyis_19 ni_24 'dag_27 ngo_33 'bo_37 nyid_40 kyis_45 srid_50 'bral_55 byed_60 
T02D1887:186b-10	rang bzhin dag pa'i sems dpa' mchog / srid pa mchog ni byed par 'gyur //	rang_0 bzhin_5 'dag_11 ba_15 sems_20 dpa'_25 mchog_30 srid_38 ba_43 mchog_46 ni_52 byed_55 ba_60 'gyur_64 
T02D1887:186b-11	zhes bya ba 'dis slob mas kyang dkrol bar bya'o //	zhes_0 byed_5 ba_9 'dis_12 slob_17 mas_22 kyang_26 'khrol_32 ba_38 byed_42 
T02D1887:186b-12	de dag ni dril bu'i dam tshig ge //	de_0 'dag_3 ni_7 'dril_10 bu_15 dam_20 tshig_24 ge_30 
T02D1887:186b-13	de'i rjes la /	de_0 rjes_5 la_10 
T02D1887:186b-14	yid kyis lus ni brtan bya'i phyir //	yid_0 kyis_4 lus_9 ni_13 brtan_16 byed_22 phyir_28 
T02D1887:186b-15	phyag rgya dam tshig ces byar gsungs //	phyag_0 rgya_6 dam_11 tshig_15 ces_21 byar_25 gsungs_30 
T02D1887:186b-16	gang gis lus kun brtags pas na //	gang_0 gis_5 lus_9 kun_13 rtog_17 ba_24 na_28 
T02D1887:186b-17	des na phyag rgya rab tu bsgrags //	des_0 na_4 phyag_7 rgya_13 rab_18 tu_22 sgrog_25 
T02D1887:186b-18	zhes bya ba 'dis rang gi 'dod pa'i lha'i lus	zhes_0 byed_5 ba_9 'dis_12 rang_17 gi_22 'dod_25 ba_30 lha_35 lus_41 
T02D1887:186b-19	kyis bdag nyid phyag rgya chen por byin gyis brlab	kyis_0 bdag_5 nyid_10 phyag_15 rgya_21 chen_26 por_31 byin_35 gyis_40 brlab_45 
T02D1887:186b-20	par bya'o // de dag ni phyag rgya'i dam tshig go //	ba_0 byed_4 de_13 'dag_16 ni_20 phyag_23 rgya_29 dam_36 tshig_40 go_46 
T02D1887:186b-21	de nas dkyil 'khor gyi de kho na nyid ni	de_0 nas_3 dkyil_7 'khor_13 gyi_19 de_23 kho_26 na_30 nyid_33 ni_38 
T02D1887:186b-22	dkyil 'khor gyi rnam par dag pa'i mtshan nyid dang	dkyil_0 'khor_6 gyi_12 rnam_16 ba_21 'dag_25 ba_29 mtshan_34 nyid_41 dang_46 
T02D1887:186b-23	/ lha'i de kho nas ni lha'i rnam par dag pa'i mtshan nyid dang /	lha_2 de_8 kho_11 nas_15 ni_19 lha_22 rnam_28 ba_33 'dag_37 ba_41 mtshan_46 nyid_53 dang_58 
T02D1887:186b-24	slob dpon gyi las ni dkyil 'khor gyi sgrub pa sngon du 'gro ba ste /	slob_0 dpon_5 gyi_10 las_14 ni_18 dkyil_21 'khor_27 gyi_33 sgrub_37 ba_43 sngon_46 du_52 'gro_55 ba_60 ste_63 
T02D1887:186b-25	der slob dpon gyi 'jug pa'i bya ba'i mtshan nyid do zhes sems shing 'di gsum bstan par bya'o //	der_0 slob_4 dpon_9 gyi_14 'jug_18 ba_23 byed_28 ba_32 mtshan_37 nyid_44 do_49 zhes_52 sems_57 shing_62 'di_68 gsum_72 ston_77 ba_83 byed_87 
T02D1887:186b-26	de nas rnam par snang mdzad la sogs pa'i gzugs	de_0 nas_3 rnam_7 ba_12 snang_16 mdzad_22 la_28 sogs_31 ba_36 gzugs_41 
T02D1887:186b-27	su dmigs pa'i slob ma la rjes su gnang ba	su_0 dmigs_3 ba_9 slob_14 ma_19 la_22 rjes_25 su_30 gnang_33 ba_39 
T02D1887:186b-28	sbyin par bya ste /	sbyin_0 ba_6 byed_10 ste_14 
T02D1887:186b-29	sems can kun la phan don du //	sems_0 can_5 kun_9 la_13 phan_16 don_21 du_25 
T02D1887:186b-30	'jig rten kun la thams cad du //	'jig_0 rten_5 kun_10 la_14 thams_17 cad_23 du_27 
T02D1887:186b-31	ji ltar 'dul ba sna tshogs pa //	ji_0 ltar_3 'dul_8 ba_13 sna_16 tshogs_20 ba_27 
T02D1887:186b-32	chos kyi 'khor lo rab tu bskor //	chos_0 kyi_5 'khor_9 lo_15 rab_18 tu_22 skor_25 
T02D1887:186b-33	zhes chos kyi gnas su rdo rje dang rin po	zhes_0 chos_5 kyi_10 gnas_14 su_19 rdo_22 rje_26 dang_30 rin_35 po_39 
T02D1887:186b-34	che dang padma dang las kyi sgra bcug la rim	che_0 dang_4 padma_9 dang_15 las_20 kyi_24 sgra_28 'jug_33 la_38 rim_41 
T02D1887:186b-35	pa bzhin du tshigs su bcad pa lngas bya ste	ba_0 bzhin_3 du_9 tshigs_12 su_19 gcod_22 ba_27 lngas_30 byed_36 ste_40 
T02D1887:186b-36	/ de dag ni rjes su gnang ba'i sbyin pa'o //	de_2 'dag_5 ni_9 rjes_12 su_17 gnang_20 ba_26 sbyin_31 ba_37 
T02D1887:186b-37	de nas /	de_0 nas_3 
T02D1887:186b-38	'di de sangs rgyas thams cad nyid //	'di_0 de_4 sangs_7 rgya_13 thams_19 cad_25 nyid_29 
T02D1887:186b-39	rdo rje sems dpa'i phyag na gnas //	rdo_0 rje_4 sems_8 dpa_13 phyag_19 na_25 gnas_28 
T02D1887:186b-40	khyod kyis kyang ni rtag tu gzung //	khyod_0 kyis_6 kyang_11 ni_17 rtag_20 tu_25 gzung_28 
T02D1887:186b-41	phyag na rdo rjes brtul zhugs brtan //	phyag_0 na_6 rdo_9 rjes_13 brtul_18 'jug_24 brtan_30 
T02D1887:186b-42	zhes pas rdo rje sbyin te /	zhes_0 ba_5 rdo_9 rje_13 sbyin_17 te_23 
T02D1887:186b-43	sarbba ta th'a ga ta siddhi badzra sa ma ya	sarbba_0 ta_7 th_10 ga_15 ta_18 siddhi_21 badzra_28 sa_35 ma_38 ya_41 
T02D1887:186b-44	tishtha ae sha stvam dh'a ra ya mi badzra satva	tishtha_0 ae_8 sha_11 stvam_15 dh_21 ra_26 ya_29 mi_32 badzra_35 satva_42 
T02D1887:186b-45	hi hi hi hi h'um /	hi_0 hi_3 hi_6 hi_9 h_12 
T02D1887:186b-46	zhes brjod du gzhug cing slob ma rdo rje brtul zhugs 'dzin du gzhug go //	zhes_0 rjod_5 du_11 'jug_14 cing_20 slob_25 ma_30 rdo_33 rje_37 brtul_41 'jug_47 'dzin_53 du_59 'jug_62 go_68 
T02D1887:186b-47	de dag ni rdo rje sbyin pa'o //	de_0 'dag_3 ni_7 rdo_10 rje_14 sbyin_18 ba_24 
T02D1887:187a-0	de'i rjes la sangs @187a * //	de_0 rjes_5 la_10 sangs_13 
T02D1887:187a-1	rgyas kyi gzugs su bdag nyid bsams nas /	rgya_0 kyi_6 gzugs_10 su_16 bdag_19 nyid_24 bsams_29 nas_35 
T02D1887:187a-2	snying gar khu tshur g-yon pas chos gos kyi grva nas 'dzin pa'i tshul du byas la //	snying_0 gar_7 khu_11 tshur_15 g-yon_21 ba_27 chos_31 gos_36 kyi_40 grva_44 nas_49 'dzin_53 ba_59 tshul_64 du_70 byed_73 la_78 
T02D1887:187a-3	g-yas pa mchog sbyin pas /	g-yas_0 ba_6 mchog_9 sbyin_15 ba_21 
T02D1887:187a-4	aom 'dir ni ngas khyod lung bstan yin //	aom_0 'dir_4 ni_9 ngas_12 khyod_17 lung_23 ston_28 yin_34 
T02D1887:187a-5	rdo rje sems dpa' de bzhin gshegs //	rdo_0 rje_4 sems_8 dpa'_13 de_18 bzhin_21 gshegs_27 
T02D1887:187a-6	srid pa shin tu grub pa'i phyir //	srid_0 ba_5 shin_8 tu_13 'grub_16 ba_21 phyir_26 
T02D1887:187a-7	srid pa'i ngan 'gro rnams las bton //	srid_0 ba_5 ngan_10 'gro_15 rnams_20 las_26 'don_30 
T02D1887:187a-8	kye che ge mo zhes bya ba de bzhin gshegs pa'i /	kye_0 che_4 ge_8 mo_11 zhes_14 byed_19 ba_23 de_26 bzhin_29 gshegs_35 ba_42 
T02D1887:187a-9	siddhi sa ma ya stvam bhurbhu ba sva:/	siddhi_0 sa_7 ma_10 ya_13 stvam_16 bhurbhu_22 ba_30 
T02D1887:187a-10	zhes bya bas lung bstan te /	zhes_0 byed_5 ba_9 lung_13 ston_18 te_24 
T02D1887:187a-11	gang la 'phags pa'i phyag rgya 'dis lung ston par byed na /	gang_0 la_5 'phag_8 ba_15 phyag_20 rgya_26 'dis_31 lung_36 ston_41 ba_46 byed_50 na_55 
T02D1887:187a-12	de bzhin gshegs pa thams cad byang chub sems dpa'i	de_0 bzhin_3 gshegs_9 ba_16 thams_19 cad_25 byang_29 chub_35 sems_40 dpa_45 
T02D1887:187a-13	'khor gyi dkyil 'khor rnams kyis mgrin gcig tu bla	'khor_0 gyi_6 dkyil_10 'khor_16 rnams_22 kyis_28 mgrin_33 gcig_39 tu_44 bla_47 
T02D1887:187a-14	na med pa yang dag par rdzogs pa'i byang chub	na_0 med_3 ba_7 yang_10 'dag_15 ba_19 rdzogs_23 ba_30 byang_35 chub_41 
T02D1887:187a-15	tu lung ston par mdzad de /	tu_0 lung_3 ston_8 ba_13 mdzad_17 de_23 
T02D1887:187a-16	'phags pa phyag rgya chen po 'di'i mthu dang gsang sngags kyi stobs kyis so zhes dad par bya'o //	'phag_0 ba_7 phyag_10 rgya_16 chen_21 po_26 'di_29 mthu_35 dang_40 gsang_45 sngags_51 kyi_58 stobs_62 kyis_68 so_73 zhes_76 dad_81 ba_85 byed_89 
T02D1887:187a-17	de dag ni lung bstan pa'o //	de_0 'dag_3 ni_7 lung_10 ston_15 ba_21 
T02D1887:187a-18	de nas gsang ba brjod par bya ste /	de_0 nas_3 gsang_7 ba_13 rjod_16 ba_22 byed_26 ste_30 
T02D1887:187a-19	'dod chags bral ba lta bu'i sdig / khams gsum na ni gzhan med de //	'dod_0 chags_5 'bral_11 ba_16 lta_19 bu_23 sdig_28 khams_35 gsum_41 na_46 ni_49 gzhan_52 med_58 de_62 
T02D1887:187a-20	de bas 'dod chags bral bya bar //	de_0 ba_3 'dod_7 chags_12 'bral_18 byed_23 ba_27 
T02D1887:187a-21	khyod kyis nam yang ma byed cig / ma h'a sa ma ya h'a na h'um phat /	khyod_0 kyis_6 nam_11 yang_15 ma_20 byed_23 cig_28 ma_34 h_37 sa_41 ma_44 ya_47 h_50 na_54 h_57 phat_62 
T02D1887:187a-22	de nas /	de_0 nas_3 
T02D1887:187a-23	mchog gsang dkyil 'khor dam pa ni //	mchog_0 gsang_6 dkyil_12 'khor_18 dam_24 ba_28 ni_31 
T02D1887:187a-24	mthong ba dang ni zhugs pa yis //	mthong_0 ba_7 dang_10 ni_15 'jug_18 ba_24 yis_27 
T02D1887:187a-25	sdig pa kun las nges grol bar //	sdig_0 ba_5 kun_8 las_12 nges_16 grol_21 ba_26 
T02D1887:187a-26	khyod ni de nyid legs par gnas //	khyod_0 ni_6 de_9 nyid_12 legs_17 ba_22 gnas_26 
T02D1887:187a-27	bde chen theg pa 'di la ni //	bde_0 chen_4 theg_9 ba_14 'di_17 la_21 ni_24 
T02D1887:187a-28	phyin chad 'chi ba yod min te //	phyin_0 'chad_6 'chi_11 ba_16 yod_19 min_23 te_27 
T02D1887:187a-29	srid pa shin tu dag bya'i phyir //	srid_0 ba_5 shin_8 tu_13 'dag_16 byed_20 phyir_26 
T02D1887:187a-30	sding [*sdings?] pa'i sdug bsngal rnams las 'das //	sding_0 [*sdings?]_6 ba_17 sdug_22 sngal_27 rnams_34 las_40 'da'_44 
T02D1887:187a-31	byang chub sems ni btang mi bya //	byang_0 chub_6 sems_11 ni_16 gtong_19 mi_25 byed_28 
T02D1887:187a-32	rdo rje zhes bya'i phyag rgya dang //	rdo_0 rje_4 zhes_8 byed_13 phyag_19 rgya_25 dang_30 
T02D1887:187a-33	gang zhig skyes pa tsam gyis ni //	gang_0 'jig_5 skye_10 ba_16 tsam_19 gyis_24 ni_29 
T02D1887:187a-34	sangs rgyas nyid du dogs med pa'o //	sangs_0 rgya_6 nyid_12 du_17 dogs_20 med_25 ba_29 
T02D1887:187a-35	dam pa'i chos ni mi smad cing //	dam_0 ba_4 chos_9 ni_14 mi_17 smad_20 cing_25 
T02D1887:187a-36	nam yang spang bar mi bya ste //	nam_0 yang_4 spong_9 ba_15 mi_19 byed_22 ste_26 
T02D1887:187a-37	mi shes pa'am rmongs pa yis //	mi_0 shes_3 ba_8 rmongs_14 ba_21 yis_24 
T02D1887:187a-38	de ni bstan par mi bya'o //	de_0 ni_3 ston_6 ba_12 mi_16 byed_19 
T02D1887:187a-39	rdo rje dril bu phyag rgya yang //	rdo_0 rje_4 'dril_8 bu_13 phyag_16 rgya_22 yang_27 
T02D1887:187a-40	nam yang spang bar mi bya'o //	nam_0 yang_4 spong_9 ba_15 mi_19 byed_22 
T02D1887:187a-41	slob dpon brnyas par mi bya ste //	slob_0 dpon_5 brnyas_10 ba_17 mi_21 byed_24 ste_28 
T02D1887:187a-42	de ni sangs rgyas kun dang mtshungs //	de_0 ni_3 sangs_6 rgya_12 kun_18 dang_22 mtshungs_27 
T02D1887:187a-43	rang gi bdag nyid yongs spangs nas //	rang_0 gi_5 bdag_8 nyid_13 yongs_18 spong_24 nas_31 
T02D1887:187a-44	dka' thub kyis ni gdung mi bya //	dka'_0 thub_5 kyis_10 ni_15 gdung_18 mi_24 byed_27 
T02D1887:187a-45	ji ltar bde bar bde ba bzung //	ji_0 ltar_3 bde_8 ba_12 bde_16 ba_20 bzung_23 
T02D1887:187a-46	'di ni ma byon rdzogs sangs rgyas //	'di_0 ni_4 ma_7 'byon_10 rdzogs_15 sangs_22 rgya_28 
T02D1887:187a-47	de ring rdo rje slob dpon te //	de_0 ring_3 rdo_8 rje_12 slob_16 dpon_21 te_26 
T02D1887:187a-48	sngags dang rgyud ni 'dzin pa khyod //	sngags_0 dang_7 brgyud_12 ni_18 'dzin_21 ba_27 khyod_30 
T02D1887:187a-49	sangs rgyas byang chub sems rnams dang //	sangs_0 rgya_6 byang_12 chub_18 sems_23 rnams_28 dang_34 
T02D1887:187b-0	@187b lha rnams kyis ni bzhed pa yin //	lha_6 rnams_10 kyis_16 ni_21 bzhed_24 ba_30 yin_33 
T02D1887:187b-1	sems can rnams la snying brtse'i phyir //	sems_0 can_5 rnams_9 la_15 snying_18 brtse_25 phyir_33 
T02D1887:187b-2	khyod kyis dkyil 'khor cho ga bzhin //	khyod_0 kyis_6 dkyil_11 'khor_17 cho_23 ga_27 bzhin_30 
T02D1887:187b-3	'bad pa yis ni bri bya zhing //	'bad_0 ba_5 yis_8 ni_12 'bri_15 byed_19 zhing_23 
T02D1887:187b-4	sgrub pa po rnams rgyud la sbyor //	sgrub_0 ba_6 po_9 rnams_12 brgyud_18 la_24 sbyor_27 
T02D1887:187b-5	de dag ni dbugs dbyung ba'o //	de_0 'dag_3 ni_7 dbugs_10 'byin_16 ba_23 
T02D1887:187b-6	rjes su gnang ba la sogs pa bzhi po 'di dag rnams ni //	rjes_0 su_5 gnang_8 ba_14 la_17 sogs_20 ba_25 bzhi_28 po_33 'di_36 'dag_40 rnams_44 ni_50 
T02D1887:187b-7	dbang bskur ba lnga'i de ma thag tu'am /	dbang_0 skur_6 ba_12 lnga_15 de_22 ma_25 thag_28 tu_33 
T02D1887:187b-8	bzhi pa'i dbang bskur ba'i de ma thag tu brjod par bya'o //	bzhi_0 ba_5 dbang_10 skur_16 ba_22 de_27 ma_30 thag_33 tu_38 rjod_41 ba_47 byed_51 
T02D1887:187b-9	slob dpon gyi dbang bskur ba nyid la ni phyir mi ldog pa'i dbang skur ba zhes brjod do //	slob_0 dpon_5 gyi_10 dbang_14 skur_20 ba_26 nyid_29 la_34 ni_37 phyir_40 mi_46 ldog_49 ba_54 dbang_59 skur_65 ba_70 zhes_73 rjod_78 do_84 
T02D1887:187b-10	dbang bskur ba lnga dang slob dpon gyi dbang bskur ba ni bum pa'i dbang yin te /	dbang_0 skur_6 ba_12 lnga_15 dang_20 slob_25 dpon_30 gyi_35 dbang_39 skur_45 ba_51 ni_54 bum_57 ba_61 dbang_66 yin_72 te_76 
T02D1887:187b-11	thams cad du bum pa'i byed pa yod pas so //	thams_0 cad_6 du_10 bum_13 ba_17 byed_22 ba_27 yod_30 ba_34 so_38 
T02D1887:187b-12	dbang bskur ba drug po bya ba ni rgyud thams	dbang_0 skur_6 ba_12 drug_15 po_20 byed_23 ba_27 ni_30 brgyud_33 thams_39 
T02D1887:187b-13	cad du yang 'gal ba med de 'jam dpal gyi	cad_0 du_4 yang_7 'gal_12 ba_17 med_20 de_24 'jam_27 dpal_32 gyi_37 
T02D1887:187b-14	rgyud la sogs pa rnams su bstan pa'i phyir ro	brgyud_0 la_6 sogs_9 ba_14 rnams_17 su_23 ston_26 ba_32 phyir_37 ro_43 
T02D1887:187b-15	// de dag ni slob dpon gyi dbang bskur ba'i cho ga'o //	de_3 'dag_6 ni_10 slob_13 dpon_18 gyi_23 dbang_27 skur_33 ba_39 cho_44 ga_48 
T02D1887:187b-16	de nas yol ba la sogs pa dben par byas	de_0 nas_3 yol_7 ba_11 la_14 sogs_17 ba_22 dben_25 ba_30 byed_34 
T02D1887:187b-17	pa'i phyogs su slob mas rang gi sems dang 'thad	ba_0 phyogs_5 su_12 slob_15 mas_20 rang_24 gi_29 sems_32 dang_37 'thad_42 
T02D1887:187b-18	pa'i gzugs la sogs pa'i yon tan dang ldan pa	ba_0 gzugs_5 la_11 sogs_14 ba_19 yon_24 tan_28 dang_32 ldan_37 ba_42 
T02D1887:187b-19	dam tshig dang sdom pa dang ting nge 'dzin gsum	dam_0 tshig_4 dang_10 sdom_15 ba_20 dang_23 ting_28 nge_33 'dzin_37 gsum_43 
T02D1887:187b-20	la mkhas pa rgyan thams cad kyis brgyan pa shin	la_0 mkhas_3 ba_9 rgyan_12 thams_18 cad_24 kyis_28 rgyan_33 ba_40 shin_43 
T02D1887:187b-21	tu dad pa snying rje'i bdag nyid can gyi shes	tu_0 dad_3 ba_7 snying_10 rje_17 bdag_23 nyid_28 can_33 gyi_37 shes_41 
T02D1887:187b-22	rab gsang ba'i dbang bskur ba'i don du bla ma	rab_0 gsang_4 ba_10 dbang_15 skur_21 ba_27 don_32 du_36 bla_39 ma_43 
T02D1887:187b-23	la phul la / byang chub rdo rje zhes pa la sogs pas gsol pa gdab par bya'o //	la_0 'bul_3 la_8 byang_13 chub_19 rdo_24 rje_28 zhes_32 ba_37 la_40 sogs_43 ba_48 gsol_52 ba_57 gdab_60 ba_65 byed_69 
T02D1887:187b-24	bla mas kyang ting nge 'dzin gsum mngon sum du	bla_0 mas_4 kyang_8 ting_14 nge_19 'dzin_23 gsum_29 mngon_34 sum_40 du_44 
T02D1887:187b-25	byas shing de bzhin nyid kyi padma'i nang du sbyor	byed_0 shing_5 de_11 bzhin_14 nyid_20 kyi_25 padma_29 nang_37 du_42 sbyor_45 
T02D1887:187b-26	bas bskyod pa'i rdo rje nor bu'i nang du chud	ba_0 skyod_4 ba_11 rdo_16 rje_20 nor_24 bu_28 nang_33 du_38 chud_41 
T02D1887:187b-27	pa rang gis rig par byas nas /	ba_0 rang_3 gis_8 rig_12 ba_16 byed_20 nas_25 
T02D1887:187b-28	sems kyang nam mkha'i khams su ma lhung ba nyid	sems_0 kyang_5 nam_11 mkha_15 khams_22 su_28 ma_31 lhung_34 ba_40 nyid_43 
T02D1887:187b-29	du mtsho skyes nas rdo rje bton nas srin lag	du_0 mtsho_3 skye_9 nas_15 rdo_19 rje_23 'don_27 nas_32 srin_36 lag_41 
T02D1887:187b-30	dang mthe bo dag gi sa slob ma'i mig dang	dang_0 mthe_5 'bo_10 'dag_13 gi_17 sa_20 slob_23 ma_28 mig_33 dang_37 
T02D1887:187b-31	lag pa'i spyod yul ma yin par de kha'i ni	lag_0 ba_4 spyod_9 yul_15 ma_19 yin_22 ba_26 de_30 kha_33 ni_39 
T02D1887:187b-32	chu skyes kyi nam mkhar sbyin par bya'o //	chu_0 skye_4 kyi_10 nam_14 mkhar_18 sbyin_24 ba_30 byed_34 
T02D1887:187b-33	des kyang aa ho ma h'a su kha /	des_0 kyang_4 aa_10 ho_13 ma_16 h_19 su_23 kha_26 
T02D1887:187b-34	zhes brjod de drangs nas longs spyod cing longs spyod kyi sbu gur gzhug par bya'o //	zhes_0 rjod_5 de_11 drangs_14 nas_21 longs_25 spyod_31 cing_37 longs_42 spyod_48 kyi_54 sbu_58 gur_62 'jug_66 ba_72 byed_76 
T02D1887:187b-35	de nyid kyis kyang langs la rang gi khyad par	de_0 nyid_3 kyis_8 kyang_13 ldang_19 la_25 rang_28 gi_33 khyad_36 ba_42 
T02D1887:187b-36	gyi nang nas khyad par du 'phags te me tog	gyi_0 nang_4 nas_9 khyad_13 ba_19 du_23 'phag_26 te_33 me_36 tog_39 
T02D1887:187b-37	gi bcud kyi thigs pa gos dang bral zhing sgeg	gi_0 bcud_3 kyi_8 thigs_12 ba_18 gos_21 dang_25 'bral_30 zhing_35 sgeg_41 
T02D1887:187b-38	pa dang bcas pas de'i nam mkhar gzhug par bya'o	ba_0 dang_3 'cha'_8 ba_13 de_17 nam_22 mkhar_26 'jug_32 ba_38 byed_42 
T02D1887:187b-39	// de ni shes rab dang thabs kyi gsang ba dag gi dbang bskur ba'i cho ga'o //	de_3 ni_6 shes_9 rab_14 dang_18 thabs_23 kyi_29 gsang_33 ba_39 'dag_42 gi_46 dbang_49 skur_55 ba_61 cho_66 ga_70 
T02D1887:187b-40	de nas de bzhin nyid gcig tu 'dong na de nyid kyis so //	de_0 nas_3 de_7 bzhin_10 nyid_16 gcig_21 tu_26 'dong_29 na_35 de_38 nyid_41 kyis_46 so_51 
T02D1887:187b-41	tha dad par 'dod na gzhan gyis te /	tha_0 dad_4 ba_8 'dod_12 na_17 gzhan_20 gyis_26 te_31 
T02D1887:188a-0	rang rig @188a * //	rang_0 rig_5 
T02D1887:188a-1	pa'i ye shes mngon sum du byed pa'i gnas skabs	ba_0 ye_5 shes_8 mngon_13 sum_19 du_23 byed_26 ba_31 gnas_36 skabs_41 
T02D1887:188a-2	su sngar smras pa'i tshigs su bcad pas gsol ba	su_0 sngar_3 smras_9 ba_15 tshigs_20 su_27 gcod_30 ba_35 gsol_39 ba_44 
T02D1887:188a-3	btab par gyur pa'i slob ma de'i lag pa bzhag	'debs_0 ba_5 gyur_9 ba_14 slob_19 ma_24 de_27 lag_32 ba_36 'jog_39 
T02D1887:188a-4	la / nyams dga' gzungs 'di khyod kyis ni //	la_0 nyams_5 dga'_11 gzungs_16 'di_23 khyod_27 kyis_33 ni_38 
T02D1887:188a-5	bsten byar sangs rgyas rnams kyis bsngags //	sten_0 byar_6 sangs_11 rgya_17 rnams_23 kyis_29 bsngags_34 
T02D1887:188a-6	'khor ba'i rim pa'i sbyor ba yis //	'khor_0 ba_6 rim_11 ba_15 sbyor_20 ba_26 yis_29 
T02D1887:188a-7	bde ba dam pa myang bar gyis //	bde_0 ba_4 dam_7 ba_11 myang_14 ba_20 gyis_24 
T02D1887:188a-8	thabs gzhan gyis ni sangs rgyas min //	thabs_0 gzhan_6 gyis_12 ni_17 sangs_20 rgya_26 min_32 
T02D1887:188a-9	'di ni 'gro ba gsum na dag / de bas 'di dang bral bar ni //	'di_0 ni_4 'gro_7 ba_12 gsum_15 na_20 'dag_23 de_29 ba_32 'di_36 dang_40 'bral_45 ba_50 ni_54 
T02D1887:188a-10	khyod kyis nam yang ma byed cig / di de sangs rgyas thams cad kyi //	khyod_0 kyis_6 nam_11 yang_15 ma_20 byed_23 cig_28 de_37 sangs_40 rgya_46 thams_52 cad_58 kyi_62 
T02D1887:188a-11	rig pa'i brtul zhugs bla na med //	rig_0 ba_4 brtul_9 'jug_15 bla_21 na_25 med_28 
T02D1887:188a-12	blun po 'ga' zhig 'da' byed na //	blun_0 po_5 'ga'_8 'jig_13 'da'_18 byed_23 na_28 
T02D1887:188a-13	de la dngos grub mchog ni med //	de_0 la_3 dngos_6 'grub_12 mchog_17 ni_23 med_26 
T02D1887:188a-14	ces brjod de gtang bar bya'o //	ces_0 rjod_4 de_10 gtong_13 ba_19 byed_23 
T02D1887:188a-15	de yang tsandan dang gur gum la sogs pa byugs	de_0 yang_3 tsandan_8 dang_16 gur_21 'gum_25 la_29 sogs_32 ba_37 'byug_40 
T02D1887:188a-16	pa shin tu dri zhim pa la sogs pa'i me	ba_0 shin_3 tu_8 'dri_11 zhim_15 ba_20 la_23 sogs_26 ba_31 me_36 
T02D1887:188a-17	tog gi phreng bas steng du brgyan pa gos med	tog_0 gi_4 phreng_7 ba_14 steng_18 du_24 rgyan_27 ba_34 gos_37 med_41 
T02D1887:188a-18	par chu skyes mdzes pa gsal bar ston par byed	ba_0 chu_4 skye_8 mdzes_14 ba_20 gsal_23 ba_28 ston_32 ba_37 byed_41 
T02D1887:188a-19	cing slob ma la 'di skad smra bar bya ste	cing_0 slob_5 ma_10 la_13 'di_16 skad_20 smra_25 ba_30 byed_34 ste_38 
T02D1887:188a-20	/ bu khyod bden par smra'am ci //	bu_2 khyod_5 bden_11 ba_16 smra_20 ci_28 
T02D1887:188a-21	bshad gci la sogs bza' ba dang //	'chad_0 gci_6 la_10 sogs_13 bza'_18 ba_23 dang_26 
T02D1887:188a-22	khrag dang khu ba de bzhin sha //	khrag_0 dang_6 khu_11 ba_15 de_18 bzhin_21 sha_27 
T02D1887:188a-23	de bzhin mchog tu bud med gus //	de_0 bzhin_3 mchog_9 tu_15 'bud_18 med_22 gus_26 
T02D1887:188a-24	bha ga'i padmar 'o byed pa //	bha_0 ga_4 padmar_9 'o_16 byed_19 ba_24 
T02D1887:188a-25	bu yis ji ltar bde bar smros //	bu_0 yis_3 ji_7 ltar_10 bde_15 ba_19 smros_23 
T02D1887:188a-26	zhes brjod do //	zhes_0 rjod_5 do_11 
T02D1887:188a-27	des kyang ;	des_0 kyang_4 
T02D1887:188a-28	khrag dang khu ba sogs za dang ;	khrag_0 dang_6 khu_11 ba_15 sogs_18 za_23 dang_26 
T02D1887:188a-29	/ rtag tu bud med gus byas dang ;	rtag_2 tu_7 'bud_10 med_14 gus_18 byed_22 dang_27 
T02D1887:188a-30	/ bha gnyid la'o bgyid par //	bha_2 rnyid_6 la_12 bgyid_17 ba_23 
T02D1887:188a-31	lha mo ci ste bdag mi spro //	lha_0 mo_4 ci_7 ste_10 bdag_14 mi_19 spro_22 
T02D1887:188a-32	zhes smra bar bgyi'o //	zhes_0 smra_5 ba_10 bgyid_14 
T02D1887:188a-33	de dga' zhing byams pa dang ldan pas sgrub pa	de_0 dga'_3 zhing_8 byams_14 ba_20 dang_23 ldan_28 ba_33 sgrub_37 ba_43 
T02D1887:188a-34	po la bdag po bzhin du rnam par lta zhing	po_0 la_3 bdag_6 po_11 bzhin_14 du_20 rnam_23 ba_28 lta_32 zhing_36 
T02D1887:188a-35	/ tsog tsog por chu skyes bstan nas 'di skad ces smra bar bya'o //	tsog_2 tsog_7 por_12 chu_16 skye_20 ston_26 nas_32 'di_36 skad_40 ces_45 smra_49 ba_54 byed_58 
T02D1887:188a-36	ae ma'o nga yi padma 'di //	ae_0 ma_3 nga_8 yi_12 padma_15 'di_21 
T02D1887:188a-37	bde ba kun dang yang dag ldan //	bde_0 ba_4 kun_7 dang_11 yang_16 'dag_21 ldan_25 
T02D1887:188a-38	gang zhig chogs bsten byed pa //	gang_0 'jig_5 chogs_10 sten_16 byed_22 ba_27 
T02D1887:188a-39	de yi mdun du nga gnas so //	de_0 yi_3 mdun_6 du_11 nga_14 gnas_18 so_23 
T02D1887:188a-40	rdzogs sangs mnyes par bya ba la sogs //	rdzogs_0 sangs_7 mnyes_13 ba_19 byed_23 ba_27 la_30 sogs_33 
T02D1887:188a-41	ji lta'i bya ba padmar gyis //	ji_0 lta_3 byed_9 ba_13 padmar_16 gyis_23 
T02D1887:188a-42	bde chen rgyal po rang nyid ni //	bde_0 chen_4 rgyal_9 po_15 rang_18 nyid_23 ni_28 
T02D1887:188a-43	'di nyid du ni rab tu gnas //	'di_0 nyid_4 du_9 ni_12 rab_15 tu_19 gnas_22 
T02D1887:188a-44	aud phu la la bha ma dzi dzva la /	aud_0 phu_4 la_8 la_11 bha_14 ma_18 dzi_21 dzva_25 la_30 
T02D1887:188a-45	la sogs pas byed pa legs par gdags pas /	la_0 sogs_3 ba_8 byed_12 ba_17 legs_20 ba_25 'dogs_29 ba_35 
T02D1887:188a-46	ji srid rnal 'byor byang chub sems //	ji_0 srid_3 rnal_8 'byor_13 byang_19 chub_25 sems_30 
T02D1887:188a-47	gdod pa ru ni mi byed pas //	gdod_0 ba_5 ru_8 ni_11 mi_14 byed_17 ba_22 
T02D1887:188a-48	de srid rgyun mi chad pa yi //	de_0 srid_3 rgyun_8 mi_14 'chad_17 ba_22 yi_25 
T02D1887:188a-49	dga' skyes bde ba ci yang thob //	dga'_0 skye_5 bde_11 ba_15 ci_18 yang_21 'thob_26 
T02D1887:188a-50	dngos grub kun gyi gter gyur pa'i //	dngos_0 'grub_6 kun_11 gyi_15 gter_19 gyur_24 ba_29 
T02D1887:188a-51	byang chub sems ni lhung gyur na //	byang_0 chub_6 sems_11 ni_16 lhung_19 gyur_25 na_30 
T02D1887:188a-52	phung po rnam shes brgyal ba la //	'phung_0 po_6 rnam_9 shes_14 brgyal_19 ba_26 la_29 
T02D1887:188a-53	ma smad dngos grub ga la yod //	ma_0 smad_3 dngos_8 'grub_14 ga_19 la_22 yod_25 
T02D1887:188b-0	mkha' @188b dbyings rdo rje mnyam sbyor dang //	mkha'_0 dbyings_12 rdo_20 rje_24 mnyam_28 sbyor_34 dang_40 
T02D1887:188b-1	reg las rmad byung chen po yi //	reg_0 las_4 rmad_8 'byung_13 chen_19 po_24 yi_27 
T02D1887:188b-2	bde ba skyes pa gang yin pa //	bde_0 ba_4 skye_7 ba_13 gang_16 yin_21 ba_25 
T02D1887:188b-3	mchog tu dga' ba byed pa'o //	mchog_0 tu_6 dga'_9 ba_14 byed_17 ba_22 
T02D1887:188b-4	dga' bral dga' ba bdag dbus su //	dga'_0 'bral_5 dga'_10 ba_15 bdag_18 dbus_23 su_28 
T02D1887:188b-5	mtshan bya brtags la brtan par gyis //	mtshan_0 byed_7 rtog_11 la_18 brtan_21 ba_27 gyis_31 
T02D1887:188b-6	padma'i nam mkhar rdo rje dang //	padma_0 nam_8 mkhar_12 rdo_18 rje_22 dang_26 
T02D1887:188b-7	lte ba dag ni gnon nas su //	lte_0 ba_4 'dag_7 ni_11 gnon_14 nas_19 su_23 
T02D1887:188b-8	rdo rje skyil mo krung la sems //	rdo_0 rje_4 skyil_8 mo_14 krung_17 la_23 sems_26 
T02D1887:188b-9	nor bu'i nang du son pa lta //	nor_0 bu_4 nang_9 du_14 son_17 ba_21 lta_24 
T02D1887:188b-10	ye shes skye ba gang yin te //	ye_0 shes_3 skye_8 ba_13 gang_16 yin_21 te_25 
T02D1887:188b-11	shin tu ye shes ngo bo yin //	shin_0 tu_5 ye_8 shes_11 ngo_16 'bo_20 yin_23 
T02D1887:188b-12	'dod chags ma yin chags bral min //	'dod_0 chags_5 ma_11 yin_14 chags_18 'bral_24 min_29 
T02D1887:188b-13	da bu mar dmigs su med pa ste //	da_0 bu_3 mar_6 dmigs_10 su_16 med_19 ba_23 ste_26 
T02D1887:188b-14	gang tshe rnal 'byor ye shes mthong ;	gang_0 tshe_5 rnal_10 'byor_15 ye_21 shes_24 mthong_29 
T02D1887:188b-15	/ bde bar 'gyur ba bde bar gnas //	bde_2 ba_6 'gyur_10 ba_16 bde_19 ba_23 gnas_27 
T02D1887:188b-16	thun nam yang na nyi ma gcig / zla phyed zla ba khyud skor dang //	thun_0 nam_5 yang_9 na_14 nyi_17 ma_21 gcig_24 zla_31 phyed_35 zla_41 ba_45 khyud_48 skor_54 dang_59 
T02D1887:188b-17	bskal pa'am bskal pa stong phrag tu //	bskal_0 ba_6 bskal_12 ba_18 stong_21 phrag_27 tu_33 
T02D1887:188b-18	ye shes mngon par sbyor bas gnas //	ye_0 shes_3 mngon_8 ba_14 sbyor_18 ba_24 gnas_28 
T02D1887:188b-19	de ltar brtags la ji ltar nus pas bzung ba	de_0 ltar_3 rtog_8 la_15 ji_18 ltar_21 nus_26 ba_30 bzung_34 ba_40 
T02D1887:188b-20	la btang ste chu skyes lce nyid kyis rjes su	la_0 gtong_3 ste_9 chu_13 skye_17 lce_23 nyid_27 kyis_32 rjes_37 su_42 
T02D1887:188b-21	blangs te / de kho na mthong bas byang chub	blangs_0 te_7 de_12 kho_15 na_19 mthong_22 ba_29 byang_33 chub_39 
T02D1887:188b-22	kyi sems dam tshig gi ngo po gzung bar bya'o	kyi_0 sems_4 dam_9 tshig_13 gi_19 ngo_22 po_26 gzung_29 ba_35 byed_39 
T02D1887:188b-23	blangs te / // shes rab ye shes kyi dbang bskur ba'i cho ga'o //	blangs_0 te_7 shes_15 rab_20 ye_24 shes_27 kyi_32 dbang_36 skur_42 ba_48 cho_53 ga_57 
T02D1887:188b-24	de'i rjes la dbang bskur ba bdun 'thob cing shes	de_0 rjes_5 la_10 dbang_13 skur_19 ba_25 bdun_28 'thob_33 cing_39 shes_44 
T02D1887:188b-25	rab ye shes mngon sum du blangs pa nyid ma	rab_0 ye_4 shes_7 mngon_12 sum_18 du_22 blangs_25 ba_32 nyid_35 ma_40 
