T02D1644:273b-0	@273b # // rgya gar skad du /	rgya_11 gar_16 skad_20 du_25 
T02D1644:273b-1	ma h'a m'a y'a s'a dha nam mandala bi dhi:/	ma_0 h_3 m_7 y_11 s_15 dha_19 nam_23 mandala_27 bi_35 
T02D1644:273b-2	bod skad du /	'bod_0 skad_4 du_9 
T02D1644:273b-3	sgyu 'phrul chen mo'i sgrub thabs kyi dkyil 'khor gyi	sgyu_0 'phrul_5 chen_12 mo_17 sgrub_22 thabs_28 kyi_34 dkyil_38 'khor_44 gyi_50 
T02D1644:273b-4	cho ga / dpal rdo rje mkha' 'gro la phyag	cho_0 ga_4 dpal_9 rdo_14 rje_18 mkha'_22 'gro_28 la_33 phyag_36 
T02D1644:273b-5	'tshal lo // 'phags pa spyan ras gzigs dbang phyug la phyag 'tshal lo //	'tshal_0 lo_7 'phag_13 ba_20 spyan_23 ras_29 gzigs_33 dbang_39 phyug_45 la_51 phyag_54 'tshal_60 lo_67 
T02D1644:273b-6	'jig dus chu yi mdog can brgyad phyed zhal //	'jig_0 dus_5 chu_9 yi_13 mdog_16 can_21 brgyad_25 phyed_32 zhal_38 
T02D1644:273b-7	phyag bzhi zhabs gnyis bdud kyi snying gar mnan //	phyag_0 bzhi_6 zhabs_11 gnyis_17 bdud_23 kyi_28 snying_32 gar_39 gnon_43 
T02D1644:273b-8	rang rig 'od kyis 'khril zhing bde gang yin //	rang_0 rig_5 'od_9 kyis_13 'khril_18 zhing_25 bde_31 gang_35 yin_40 
T02D1644:273b-9	bde gshegs kun 'bod rdo rje 'dzin la bdud //	bde_0 gshegs_4 kun_11 'bod_15 rdo_20 rje_24 'dzin_28 la_34 bdud_37 
T02D1644:273b-10	skye bo rtog pa'i dba' rlabs g-yengs pa yis //	skye_0 'bo_5 rtogs_8 ba_13 dba'_18 rlabs_23 g-yengs_29 ba_37 yis_40 
T02D1644:273b-11	so so'i gzhung mangs blta bar mi nus phyir //	so_0 so_3 gzhung_8 mang_15 lta_21 ba_26 mi_30 nus_33 phyir_37 
T02D1644:273b-12	lung dang man ngag rigs pas gzhung bkod de //	lung_0 dang_5 man_10 ngag_14 rigs_19 ba_24 gzhung_28 bkod_35 de_40 
T02D1644:273b-13	mdor bsdus dran pa tsam gyis bri bar bya //	mdor_0 sdud_5 dran_11 ba_16 tsam_19 gyis_24 'bri_29 ba_33 byed_37 
T02D1644:273b-14	de ltar re zhig dang por slob ma dbang bskur ba'i snod dang skal bar ldan pa ni /	de_0 ltar_3 re_8 'jig_11 dang_16 por_21 slob_25 ma_30 dbang_33 skur_39 ba_45 snod_50 dang_55 skal_60 ba_65 ldan_69 ba_74 ni_77 
T02D1644:273b-15	de yang /	de_0 yang_3 
T02D1644:273b-16	'jam zhing snyan smra snying rjer ldan //	'jam_0 zhing_5 snyan_11 smra_17 snying_22 rjer_29 ldan_34 
T02D1644:273b-17	dge ba'i las la mngon par brtson //	dge_0 ba_4 las_9 la_13 mngon_16 ba_22 brtson_26 
T02D1644:273b-18	theg pa che la lhag par dang //	theg_0 ba_5 che_8 la_12 lhag_15 ba_20 dang_24 
T02D1644:273b-19	rgyun du bla ma la gus shing //	rgyun_0 du_6 bla_9 ma_13 la_16 gus_19 shing_23 
T02D1644:273b-20	sbyin dang gtong la mngon dga' ba //	sbyin_0 dang_6 gtong_11 la_17 mngon_20 dga'_26 ba_31 
T02D1644:273b-21	slob ma de ni yongs su gzung //	slob_0 ma_5 de_8 ni_11 yongs_14 su_20 gzung_23 
T02D1644:274a-0	de bas na mtshan nyid de lta bu dang ldan @274a * //	de_0 ba_3 na_7 mtshan_10 nyid_17 de_22 lta_25 bu_29 dang_32 ldan_37 
T02D1644:274a-1	pa'i slob mas dbang nod pa'i 'os su gyur pa'i bla ma la gsol ba gdab par bya ste /	ba_0 slob_5 mas_10 dbang_14 nod_20 ba_24 'os_29 su_33 gyur_36 ba_41 bla_46 ma_50 la_53 gsol_56 ba_61 gdab_64 ba_69 byed_73 ste_77 
T02D1644:274a-2	de yang /	de_0 yang_3 
T02D1644:274a-3	brtan zhing dul la blo gros ldan //	brtan_0 zhing_6 dul_12 la_16 blo_19 gros_23 ldan_28 
T02D1644:274a-4	bzod ldan drang zhing g-yo sgyu med //	bzod_0 ldan_5 'dren_10 zhing_16 g-yo_22 sgyu_27 med_32 
T02D1644:274a-5	gsang sngags rgyud kyi sbyor la mkhas //	gsang_0 sngags_6 brgyud_13 kyi_19 sbyor_23 la_29 mkhas_32 
T02D1644:274a-6	des ni dkyil 'khor bri bar bya //	des_0 ni_4 dkyil_7 'khor_13 'bri_19 ba_23 byed_27 
T02D1644:274a-7	de bas na de lta bu dang ldan pa'i slob	de_0 ba_3 na_7 de_10 lta_13 bu_17 dang_20 ldan_25 ba_30 slob_35 
T02D1644:274a-8	dpon la lan gnyis nas gsum gyi bar du gsol	dpon_0 la_5 lan_8 gnyis_12 nas_18 gsum_22 gyi_27 ba_31 du_35 gsol_38 
T02D1644:274a-9	ba gdab par bya'o //	ba_0 gdab_3 ba_8 byed_12 
T02D1644:274a-10	de nas slob dpon gyis gal te khyod kyis dkyil 'khor gyi rdzas dang /	de_0 nas_3 slob_7 dpon_12 gyis_17 gal_22 te_26 khyod_29 kyis_35 dkyil_40 'khor_46 gyi_52 rdzas_56 dang_62 
T02D1644:274a-11	yo byad 'di dang 'di la sogs pa 'byor ram mi 'byor zhes dri bar bya'o //	yo_0 byad_3 'di_8 dang_12 'di_17 la_21 sogs_24 ba_29 'byor_32 ram_38 mi_42 'byor_45 zhes_51 'dri_56 ba_60 byed_64 
T02D1644:274a-12	de nas de dag 'byor bar khas len na /	de_0 nas_3 de_7 'dag_10 'byor_14 ba_20 khas_24 len_29 na_33 
T02D1644:274a-13	de'i tshe gnang ba byin la slob ma sbyong zhing bsrung ba bya ste /	de_0 tshe_5 gnang_10 ba_16 byin_19 la_24 slob_27 ma_32 sbyong_35 zhing_42 bsrung_48 ba_55 byed_58 ste_62 
T02D1644:274a-14	slob ma'i rkang mthil du yam las rlung gi dkyil 'khor /	slob_0 ma_5 rkang_10 mthil_16 du_22 yam_25 las_29 rlung_33 gi_39 dkyil_42 'khor_48 
T02D1644:274a-15	gsang bar ram las me'i dkyil 'khor /	gsang_0 ba_6 ram_10 las_14 me_18 dkyil_23 'khor_29 
T02D1644:274a-16	snying gar las dang nyon mongs pa'i sdig pa'i ngo bo pam mam /	snying_0 gar_7 las_11 dang_15 nyon_20 mongs_25 ba_31 sdig_36 ba_41 ngo_46 'bo_50 pam_53 mam_57 
T02D1644:274a-17	kam nag po cig bsams la ;	kam_0 nag_4 po_8 cig_11 bsams_15 la_21 
T02D1644:274a-18	de nas rlung gis me sbar bas snying ga'i kam bsregs te /	de_0 nas_3 rlung_7 gis_13 me_17 sbor_20 ba_25 snying_29 ga_36 kam_41 bsregs_45 te_52 
T02D1644:274a-19	las dang nyon mongs pa'i sdig pa mi dge ba thams cad sbyang bar bsams la /	las_0 dang_4 nyon_9 mongs_14 ba_20 sdig_25 ba_30 mi_33 dge_36 ba_40 thams_43 cad_49 sbyong_53 ba_60 bsams_64 la_70 
T02D1644:274a-20	slob ma'i gnas gsum du 'bru gsum bkod la /	slob_0 ma_5 gnas_10 gsum_15 du_20 'bru_23 gsum_28 bkod_33 la_38 
T02D1644:274a-21	'khor lo can gyi sngags nyi shu rtsa gcig la sogs pa bzlas te bsrung ba bya'o //	'khor_0 lo_6 can_9 gyi_13 sngags_17 nyi_24 shu_28 rtsa_32 gcig_37 la_42 sogs_45 ba_50 bzlas_53 te_59 bsrung_62 ba_69 byed_72 
T02D1644:274a-22	de nas slob dpon gyis bsnyen pa la 'jug ste /	de_0 nas_3 slob_7 dpon_12 gyis_17 snyen_22 ba_29 la_32 'jug_35 ste_40 
T02D1644:274a-23	mandala dang mchod pa dang gtor ma la sogs pa bshams /	mandala_0 dang_8 mchod_13 ba_19 dang_22 'thor_27 ma_32 la_35 sogs_38 ba_43 bshams_46 
T02D1644:274a-24	ye shes kyi dkyil 'khor nam mkha' la bltas la /	ye_0 shes_3 kyi_8 dkyil_12 'khor_18 nam_24 mkha'_28 la_34 lta_37 la_43 
T02D1644:274a-25	mchod pa la sogs pa bya /	mchod_0 ba_6 la_9 sogs_12 ba_17 byed_20 
T02D1644:274a-26	de nas lha'i ting nge 'dzin dang ldan pas bzlas pa bya ste /	de_0 nas_3 lha_7 ting_13 nge_18 'dzin_22 dang_28 ldan_33 ba_38 bzlas_42 ba_48 byed_51 ste_55 
T02D1644:274a-27	'khor lo can gyi 'bum phrag gcig tu bzlas la /	'khor_0 lo_6 can_9 gyi_13 'bum_17 phrag_22 gcig_28 tu_33 bzlas_36 la_42 
T02D1644:274a-28	lha mo rnams kyi khri phrag re re bzlas so //	lha_0 mo_4 rnams_7 kyi_13 khri_17 phrag_22 re_28 re_31 bzlas_34 so_40 
T02D1644:274a-29	de nas yang sa mchod la sogs byas la /	de_0 nas_3 yang_7 sa_12 mchod_15 la_21 sogs_24 byed_29 la_34 
T02D1644:274a-30	grogs bzang po dag dang bcas pas sa brtag cing spyad bar bya ste /	grogs_0 bzang_6 po_12 'dag_15 dang_19 'cha'_24 ba_29 sa_33 rtog_36 cing_42 spyod_47 ba_53 byed_57 ste_61 
T02D1644:274a-31	de yang /	de_0 yang_3 
T02D1644:274a-32	gtsug lag khang dang tshong dus dang //	gtsug_0 lag_6 khang_10 dang_16 tshong_21 dus_28 dang_32 
T02D1644:274a-33	ldum ra grong ngam grong khyer gyi //	ldum_0 ra_5 grong_8 ngam_14 grong_19 'khyer_25 gyi_31 
T02D1644:274a-34	shar dang byang gi sa yi char //	'char_0 dang_5 byang_10 gi_16 sa_19 yi_22 char_25 
T02D1644:274a-35	mnyam par gzhag cing gzung bar bya //	mnyam_0 ba_6 'jog_10 cing_16 gzung_21 ba_27 byed_31 
T02D1644:274a-36	de bas na de dag tu brtags pa'am /	de_0 ba_3 na_7 de_10 'dag_13 tu_17 rtog_20 ba_27 
T02D1644:274a-37	yang na dur khrod dang nags tshal la sogs pa	yang_0 na_5 dur_8 khrod_12 dang_18 nags_23 tshal_28 la_34 sogs_37 ba_42 
T02D1644:274a-38	gang dang gang yid du 'ong ba'i gnas der sa	gang_0 dang_5 gang_10 yid_15 du_19 'ong_22 ba_27 gnas_32 der_37 sa_41 
T02D1644:274a-39	sbyang bar bya ste /	sbyong_0 ba_7 byed_11 ste_15 
T02D1644:274b-0	de la 'ang @274b gnyis te /	de_0 la_3 'ang_6 gnyis_17 te_23 
T02D1644:274b-1	phyi sbyang ba dang /	phyi_0 sbyong_5 ba_12 dang_15 
T02D1644:274b-2	nang gi sbyang ba'o //	nang_0 gi_5 sbyong_8 ba_15 
T02D1644:274b-3	phyi la yang gnyis te /	phyi_0 la_5 yang_8 gnyis_13 te_19 
T02D1644:274b-4	las kyis sbyang ba ni zhi ba'i thab khung du	las_0 kyis_4 sbyong_9 ba_16 ni_19 zhi_22 ba_26 thab_31 khung_36 du_42 
T02D1644:274b-5	mi rus kyi phye ma la sogs pas sbyin sreg	mi_0 rus_3 kyi_7 'byed_11 ma_16 la_19 sogs_22 ba_27 sbyin_31 sreg_37 
T02D1644:274b-6	byas la / nye bar zhi bar byas la bya bas sbyang ba ni /	byed_0 la_5 nye_10 ba_14 zhi_18 ba_22 byed_26 la_31 byed_34 ba_38 sbyong_42 ba_49 ni_52 
T02D1644:274b-7	de yang /	de_0 yang_3 
T02D1644:274b-8	pus nub tsam du brkos nas ni //	pus_0 nub_4 tsam_8 du_13 rko_16 nas_22 ni_26 
T02D1644:274b-9	sa de nyid kyis dgang bar bya //	sa_0 de_3 nyid_6 kyis_11 'geng_16 ba_22 byed_26 
T02D1644:274b-10	gal te lhag par gyur na ni //	gal_0 te_4 lhag_7 ba_12 gyur_16 na_21 ni_24 
T02D1644:274b-11	dngos grub yod par 'dod pa yin //	dngos_0 'grub_6 yod_11 ba_15 'dod_19 ba_24 yin_27 
T02D1644:274b-12	de bas na pus nub tsam du bkros la sa'i skyon rnams bsal nas /	de_0 ba_3 na_7 pus_10 nub_14 tsam_18 du_23 bkros_26 la_32 sa_35 skyon_40 rnams_46 bsal_52 nas_57 
T02D1644:274b-13	de nyid kyis legs par bkang ste /	de_0 nyid_3 kyis_8 legs_13 ba_18 'geng_22 ste_28 
T02D1644:274b-14	gzhung dang mthun par byas la /	gzhung_0 dang_7 mthun_12 ba_18 byed_22 la_27 
T02D1644:274b-15	de nas chu'i ltas bstan par bya ste /	de_0 nas_3 chu_7 ltas_13 ston_18 ba_24 byed_28 ste_32 
T02D1644:274b-16	de yang /	de_0 yang_3 
T02D1644:274b-17	mtho gang zlum por brkos nas ni //	mtho_0 gang_5 zlum_10 por_15 rko_19 nas_25 ni_29 
T02D1644:274b-18	ba yis byugs la chu yis dgang //	ba_0 yis_3 'byug_7 la_13 chu_16 yis_20 'geng_24 
T02D1644:274b-19	ma yengs sems kyis shar phyin la //	ma_0 yengs_3 sems_9 kyis_14 'char_19 phyin_24 la_30 
T02D1644:274b-20	slar log ltas ni brtag par bya //	slar_0 log_5 ltas_9 ni_14 rtog_17 ba_23 byed_27 
T02D1644:274b-21	de bas na chu'i ltas rab 'bring gsum brtags la	de_0 ba_3 na_7 chu_10 ltas_16 rab_21 'bring_25 gsum_32 rtog_37 la_44 
T02D1644:274b-22	de nas dri zhim po dang bcas pa'i sas khung	de_0 nas_3 'dri_7 zhim_11 po_16 dang_19 'cha'_24 ba_29 sas_34 khung_38 
T02D1644:274b-23	bu legs par bkang nas /	bu_0 legs_3 ba_8 'geng_12 nas_18 
T02D1644:274b-24	rin po che lnga dang 'bru lngas sa'i dbus su bcug la legs par bcags te /	rin_0 po_4 che_7 lnga_11 dang_16 'bru_21 lngas_26 sa_32 dbus_37 su_42 'jug_45 la_50 legs_53 ba_58 'jags_62 te_68 
T02D1644:274b-25	ba'i rdzas lngas byug cing nye 'khor du me tog sil ma bkram pa dang /	ba_0 rdzas_5 lngas_11 'byug_17 cing_22 nye_27 'khor_31 du_37 me_40 tog_43 sil_47 ma_51 'grem_54 ba_60 dang_63 
T02D1644:274b-26	phyogs mtshams su ba dan dang /	phyogs_0 mtshams_7 su_15 ba_18 dan_21 dang_25 
T02D1644:274b-27	gdugs dang /	gdugs_0 dang_6 
T02D1644:274b-28	rgyal mtshan la sogs pa btsugs la las thams cad	rgyal_0 mtshan_6 la_13 sogs_16 ba_21 btsugs_24 la_31 las_34 thams_38 cad_44 
T02D1644:274b-29	pa'i sngags bzlas pa'i chus gtor ni bya bas sbyang	ba_0 sngags_5 bzlas_12 ba_18 chus_23 'thor_28 ni_33 byed_36 ba_40 sbyong_44 
T02D1644:274b-30	ba'o // nang gi sbyang ba ni nang la gzhol	ba_0 nang_8 gi_13 sbyong_16 ba_23 ni_26 nang_29 la_34 gzhol_37 
T02D1644:274b-31	ba'i sems kyis chos nyid kyi sngags bzlas te stong	ba_0 sems_5 kyis_10 chos_15 nyid_20 kyi_25 sngags_29 bzlas_36 te_42 stong_45 
T02D1644:274b-32	pa nyid du bsgoms la /	ba_0 nyid_3 du_8 sgom_11 la_18 
T02D1644:274b-33	de'i ngang las yi ge h'um las rdo rje'i sa	de_0 ngang_5 las_11 yi_15 ge_18 h_21 las_26 rdo_30 rje_34 sa_40 
T02D1644:274b-34	gzhir bsgom aom me di n'i badzr'i bha wa bandha	gzhir_0 bsgom_6 aom_12 me_16 di_19 n_22 badzr_26 bha_34 wa_38 bandha_41 
T02D1644:274b-35	h'um zhes pas byin gyis brlab pa'o //	h_0 zhes_5 ba_10 byin_14 gyis_19 brlab_24 ba_30 
T02D1644:274b-36	de nas sa bslang ste /	de_0 nas_3 sa_7 bslang_10 ste_17 
T02D1644:274b-37	mchod pa bshams la sa'i dbus su lha'i ting nge	mchod_0 ba_6 bshams_9 la_16 sa_19 dbus_24 su_29 lha_32 ting_38 nge_43 
T02D1644:274b-38	'dzin la gnas pas snying rje chen po dmigs te	'dzin_0 la_6 gnas_9 ba_14 snying_18 rje_25 chen_29 po_34 dmigs_37 te_43 
T02D1644:274b-39	/ lag pa g-yas pa sa la brdabs pas sags pa'i ser gnas /	lag_2 ba_6 g-yas_9 ba_15 sa_18 la_21 brdab_24 ba_31 sags_35 ba_40 ser_45 gnas_49 
T02D1644:274b-40	sa'i lha mo sku mdog ser mo /	sa_0 lha_5 mo_9 sku_12 mdog_16 ser_21 mo_25 
T02D1644:274b-41	zhi ba'i bzhin can phyag gnyis kyis bum pa 'dzin pa cig byung bar bsams la ;	zhi_0 ba_4 bzhin_9 can_15 phyag_19 gnyis_25 kyis_31 bum_36 ba_40 'dzin_43 ba_49 cig_52 'byung_56 ba_62 bsams_66 la_72 
T02D1644:274b-42	mchod pa dang gtor ma phul te /	mchod_0 ba_6 dang_9 'thor_14 ma_19 'bul_22 te_27 
T02D1644:274b-43	dpal he ru ka mchod cing /	dpal_0 he_5 ru_8 ka_11 mchod_14 cing_20 
T02D1644:274b-44	ma ma sna tshogs rin chen 'dzin //	ma_0 ma_3 sna_6 tshogs_10 rin_17 chen_21 'dzin_26 
T02D1644:274b-45	lha mo khyod ni dbang du gyur //	lha_0 mo_4 khyod_7 ni_13 dbang_16 du_22 gyur_25 
T02D1644:274b-46	sa 'dir dkyil 'khor bri bar bya //	sa_0 'dir_3 dkyil_8 'khor_14 'bri_20 ba_24 byed_28 
T02D1644:274b-47	zhes sa bslangs la /	zhes_0 sa_5 bslangs_8 la_16 
T02D1644:274b-48	de nas gsol ba gdab ste /	de_0 nas_3 gsol_7 ba_12 gdab_15 ste_20 
T02D1644:274b-49	skyob pa sangs rgyas thams cad kyi //	skyob_0 ba_6 sangs_9 rgya_15 thams_21 cad_27 kyi_31 
T02D1644:275a-0	spyod @275a * //	spyod_0 
T02D1644:275a-1	pa'i tshul dang khyad par gyi //	ba_0 tshul_5 dang_11 khyad_16 ba_22 gyi_26 
T02D1644:275a-2	sa dang pha rol phyin pa la //	sa_0 dang_3 pha_8 rol_12 phyin_16 ba_22 la_25 
T02D1644:275a-3	lha mo khyod ni dbang du gyur //	lha_0 mo_4 khyod_7 ni_13 dbang_16 du_22 gyur_25 
T02D1644:275a-4	sh'akya seng ge skyob pa yis //	sh_0 seng_8 ge_13 skyob_16 ba_22 yis_25 
T02D1644:275a-5	ji ltar bdud kyi stobs bcom pa //	ji_0 ltar_3 bdud_8 kyi_13 stobs_17 'joms_23 ba_28 
T02D1644:275a-6	de bzhin bdag gis bdud las ni //	de_0 bzhin_3 bdag_9 gis_14 bdud_18 las_23 ni_27 
T02D1644:275a-7	rgyal bar byas te dkyil 'khor bri //	rgyal_0 ba_6 byed_10 te_15 dkyil_18 'khor_24 'bri_30 
T02D1644:275a-8	zhes brjod la de nyid du thim par bsam mo //	zhes_0 rjod_5 la_11 de_14 nyid_17 du_22 'thim_25 ba_30 bsam_34 mo_39 
T02D1644:275a-9	sa bzung ba ni slob dpon sa'i dbus su 'dug ste /	sa_0 bzung_3 ba_9 ni_12 slob_15 dpon_20 sa_25 dbus_30 su_35 'dug_38 ste_43 
T02D1644:275a-10	me tog gi phreng ba dang /	me_0 tog_3 gi_7 phreng_10 ba_17 dang_20 
T02D1644:275a-11	cod pan la sogs pas brgyan te /	cod_0 pan_4 la_8 sogs_11 ba_16 rgyan_20 te_27 
T02D1644:275a-12	rdo rje dril bu gzung ste dpal he ru ka'i	rdo_0 rje_4 'dril_8 bu_13 gzung_16 ste_22 dpal_26 he_31 ru_34 ka_37 
T02D1644:275a-13	ting nge 'dzin la gnas pa la slob ma bzhis	ting_0 nge_5 'dzin_9 la_15 gnas_18 ba_23 la_26 slob_29 ma_34 bzhis_37 
T02D1644:275a-14	rgyan cha dang rdo rje dril bu 'dzin pas rdo	rgyan_0 cha_6 dang_10 rdo_15 rje_19 'dril_23 bu_28 'dzin_31 ba_37 rdo_41 
T02D1644:275a-15	rje mkha' 'gro la sogs pa'i lha mo bzhir bsgoms	rje_0 mkha'_4 'gro_10 la_15 sogs_18 ba_23 lha_28 mo_32 bzhir_35 sgom_41 
T02D1644:275a-16	la ; phyogs bzhi nas gsol ba gdab ste /	la_0 phyogs_5 bzhi_12 nas_17 gsol_21 ba_26 gdab_29 ste_34 
T02D1644:275a-17	de bzhin gshegs pa kun zhi ba //	de_0 bzhin_3 gshegs_9 ba_16 kun_19 zhi_23 ba_27 
T02D1644:275a-18	de bzhin gshegs pa kun gyi gnas //	de_0 bzhin_3 gshegs_9 ba_16 kun_19 gyi_23 gnas_27 
T02D1644:275a-19	rdo rje 'dzin pa las byung ba'i //	rdo_0 rje_4 'dzin_8 ba_14 las_17 'byung_21 ba_27 
T02D1644:275a-20	dkyil 'khor gtso bo bshad du gsol //	dkyil_0 'khor_6 gtso_12 'bo_17 'chad_20 du_26 gsol_29 
T02D1644:275a-21	mtshan nyid thams cad yang dag rdzogs //	mtshan_0 nyid_7 thams_12 cad_18 yang_22 'dag_27 rdzogs_31 
T02D1644:275a-22	mtshan ma thams cad yang dag spangs /	mtshan_0 ma_7 thams_10 cad_16 yang_20 'dag_25 spong_29 
T02D1644:275a-23	kun du bzang po sku yi mchog / dkyil 'khor dam pa bshad du gsol //	kun_0 du_4 bzang_7 po_13 sku_16 yi_20 mchog_23 dkyil_31 'khor_37 dam_43 ba_47 'chad_50 du_56 gsol_59 
T02D1644:275a-24	zhi ba'i chos ni mchog las byung //	zhi_0 ba_4 chos_9 ni_14 mchog_17 las_23 'byung_27 
T02D1644:275a-25	ye shes spyod pa rnams sbyang ba //	ye_0 shes_3 spyod_8 ba_14 rnams_17 sbyong_23 ba_30 
T02D1644:275a-26	kun du bzang po gsung gi mchog / dkyil 'khor snying po bshad du gsol //	kun_0 du_4 bzang_7 po_13 gsung_16 gi_22 mchog_25 dkyil_33 'khor_39 snying_45 po_52 'chad_55 du_61 gsol_64 
T02D1644:275a-27	sems can kun gyi sems chen po //	sems_0 can_5 kun_9 gyi_13 sems_17 chen_22 po_27 
T02D1644:275a-28	rang bzhin dag pa dri ma med //	rang_0 bzhin_5 'dag_11 ba_15 'dri_18 ma_22 med_25 
T02D1644:275a-29	kun du bzang po thugs kyi mchog / dkyil 'khor snying po bshad du gsol //	kun_0 du_4 bzang_7 po_13 thugs_16 kyi_22 mchog_26 dkyil_34 'khor_40 snying_46 po_53 'chad_56 du_62 gsol_65 
T02D1644:275a-30	de nas bdag lha'i nga rgyal gyis bsgyings pa dang	de_0 nas_3 bdag_7 lha_12 nga_18 rgyal_22 gyis_28 sgying_33 ba_42 dang_45 
T02D1644:275a-31	bcas pas mig g-yas par aa las zla ba g-yon	'cha'_0 ba_5 mig_9 g-yas_13 ba_19 aa_23 las_26 zla_30 ba_34 g-yon_37 
T02D1644:275a-32	par ta las nyi ma bsams te /	ba_0 ta_4 las_7 nyi_11 ma_15 bsams_18 te_24 
T02D1644:275a-33	rkang pa'i mthil du h'um las sna tshogs rdo rje gdengs pa bsgoms la /	rkang_0 ba_6 mthil_11 du_17 h_20 las_25 sna_29 tshogs_33 rdo_40 rje_44 gdeng_48 ba_55 sgom_58 la_65 
T02D1644:275a-34	dbang ldan du song la rdo rje gsor te /	dbang_0 ldan_6 du_11 'gro_14 la_19 rdo_22 rje_26 gsor_30 te_35 
T02D1644:275a-35	h'um ring po brjod la /	h_0 ring_5 po_10 rjod_13 la_19 
T02D1644:275a-36	deng slob dpon sa phyogs 'dir slob ma'i don du las 'di brtsams kyis /	deng_0 slob_5 dpon_10 sa_15 phyogs_18 'dir_25 slob_30 ma_35 don_40 du_44 las_47 'di_51 brtsams_55 kyis_63 
T02D1644:275a-37	'di na gnas pa'i lha dang klu dang /	'di_0 na_4 gnas_7 ba_12 lha_17 dang_21 klu_26 dang_30 
T02D1644:275a-38	gnod sbyin dang /	gnod_0 sbyin_5 dang_11 
T02D1644:275a-39	dri za dang /	'dri_0 za_4 dang_7 
T02D1644:275a-40	'byung po dang /	'byung_0 po_7 dang_10 
T02D1644:275a-41	sha za dang srin po la sogs pa gang dag	sha_0 za_4 dang_7 srin_12 po_17 la_20 sogs_23 ba_28 gang_31 'dag_36 
T02D1644:275a-42	gnas pa'i sa'i bdag po rnams myur du deng shig	gnas_0 ba_5 sa_10 bdag_15 po_20 rnams_23 myur_29 du_34 deng_37 shig_42 
T02D1644:275a-43	/ di ltar dpal he ru ka'i bka' thos nas myur	ltar_5 dpal_10 he_15 ru_18 ka_21 bka'_26 thos_31 nas_36 myur_40 
T02D1644:275a-44	ba nyid du song shig gang dag mi 'gro ba	ba_0 nyid_3 du_8 'gro_11 shig_16 gang_21 'dag_26 mi_30 'gro_33 ba_38 
T02D1644:275a-45	de dag la nga'i rdo rje dang bcas pa'i kha	de_0 'dag_3 la_7 nga_10 rdo_16 rje_20 dang_24 'cha'_29 ba_34 kha_39 
T02D1644:275a-46	tv'am ga 'dis mgo tshal pa brgyar bkas par bya'o	tv_0 ga_6 'dis_9 mgo_14 tshal_18 ba_24 brgyar_27 'gas_34 ba_39 byed_43 
T02D1644:275a-47	zhes bya ba lan gsum du brjod nas de nas	zhes_0 byed_5 ba_9 lan_12 gsum_16 du_21 rjod_24 nas_30 de_34 nas_37 
T02D1644:275b-0	yang rdo rje @275b gsor nas /	yang_0 rdo_5 rje_9 gsor_19 nas_24 
T02D1644:275b-1	h'um lus ngag sems dang ldan pa yi //	h_0 lus_5 ngag_9 sems_14 dang_19 ldan_24 ba_29 yi_32 
T02D1644:275b-2	bgegs kyi tshogs kun nga la nyon //	bgegs_0 kyi_6 tshogs_10 kun_17 nga_21 la_25 nyon_28 
T02D1644:275b-3	nga ni dpal ldan snying rje'i stobs //	nga_0 ni_4 dpal_7 ldan_12 snying_17 rje_24 stobs_30 
T02D1644:275b-4	srung ba'i 'khor lo rab sbyor bas //	srung_0 ba_6 'khor_11 lo_17 rab_20 sbyor_24 ba_30 
T02D1644:275b-5	rdo rje 'bar ba'i kha tv'am gas //	rdo_0 rje_4 'bar_8 ba_13 kha_18 tv_22 'gas_28 
T02D1644:275b-6	sku gsum las byung dags par bya //	sku_0 gsum_4 las_9 'byung_13 dags_19 ba_24 byed_28 
T02D1644:275b-7	gal te bdag tshig las 'das na //	gal_0 te_4 bdag_7 tshig_12 las_18 'da'_22 na_27 
T02D1644:275b-8	zhig 'gyur 'dir ni the tshom med //	'jig_0 'gyur_5 'dir_11 ni_16 the_19 tshom_23 med_29 
T02D1644:275b-9	g-yas brkyang dang g-yon bskum la sogs pa'i rdo rje'i 'gros kyis kun du bskor zhing bcags la /	g-yas_0 rkyong_6 dang_14 g-yon_19 skum_25 la_31 sogs_34 ba_39 rdo_44 rje_48 'gros_54 kyis_60 kun_65 du_69 skor_72 zhing_78 'jags_84 la_90 
T02D1644:275b-10	seng ldeng gi phur pa sor brgyad pa la tsandan dmar po bskus te /	seng_0 ldeng_5 gi_11 'phur_14 ba_19 sor_22 brgyad_26 ba_33 la_36 tsandan_39 dmar_47 po_52 skud_55 te_61 
T02D1644:275b-11	me tog dmar po btags pa dgu dbus dang phyogs mtshams su dgu btab la lha la phyag phya'o //	me_0 tog_3 dmar_7 po_12 'dogs_15 ba_21 dgu_24 dbus_28 dang_33 phyogs_38 mtshams_45 su_53 dgu_56 'debs_60 la_65 lha_68 la_72 phyag_75 phya_81 
T02D1644:275b-12	sa bsrung ba ni dkyil 'khor gyi sa'i dbus gnas la bgegs nye bar zhi bar bya ba'i phyir /	sa_0 bsrung_3 ba_10 ni_13 dkyil_16 'khor_22 gyi_28 sa_32 dbus_37 gnas_42 la_47 bgegs_50 nye_56 ba_60 zhi_64 ba_68 byed_72 ba_76 phyir_81 
T02D1644:275b-13	rab dang dra ba dang sa gzhi la sogs pa'i srung ba'i 'khor lo bsgoms la /	rab_0 dang_4 'dra_9 ba_13 dang_16 sa_21 gzhi_24 la_29 sogs_32 ba_37 srung_42 ba_48 'khor_53 lo_59 sgom_62 la_69 
T02D1644:275b-14	snying gnas bgegs mthar byed /	snying_0 gnas_7 bgegs_12 mthar_18 byed_24 
T02D1644:275b-15	stod khro bo smad phur bu'i dbyibs can du byung ste /	stod_0 khro_5 'bo_10 smad_13 'phur_18 bu_23 dbyibs_28 can_35 du_39 'byung_42 ste_48 
T02D1644:275b-16	aom gta gha / gh'a ta ya gh'a ta ya /	aom_0 gta_4 gha_8 gh_14 ta_19 ya_22 gh_25 ta_30 ya_33 
T02D1644:275b-17	sarba du sht'am phat /	sarba_0 du_6 sht_9 phat_16 
T02D1644:275b-18	k'i la ya k'i la ya /	k_0 la_4 ya_7 k_10 la_14 ya_17 
T02D1644:275b-19	sarba p'a pam phat /	sarba_0 p_6 pam_10 phat_14 
T02D1644:275b-20	h'um h'um badzra k'i la ya /	h_0 h_5 badzra_10 k_17 la_21 ya_24 
T02D1644:275b-21	badzra dha rod a'adzny'a pa y'a ti /	badzra_0 dha_7 rod_11 a'a_15 ba_25 y_28 ti_32 
T02D1644:275b-22	k'a ya b'ak tsitta badzra k'i la ya h'um h'um phat /	k_0 ya_4 b_7 tsitta_12 badzra_19 k_26 la_30 ya_33 h_36 h_41 phat_46 
T02D1644:275b-23	ces pas bgegs rnams phur bus btab ste /	ces_0 ba_4 bgegs_8 rnams_14 'phur_20 'bud_25 'debs_29 ste_34 
T02D1644:275b-24	aom raksha raksha zhes pa dang 'bru gsum bzlas par bya'o //	aom_0 raksha_4 raksha_11 zhes_18 ba_23 dang_26 'bru_31 gsum_36 bzlas_41 ba_47 byed_51 
T02D1644:275b-25	de nas lha sta gon la gnas pa'i bdud rtsi	de_0 nas_3 lha_7 sta_11 gon_15 la_19 gnas_22 ba_27 bdud_32 rtsi_37 
T02D1644:275b-26	lnga dang bcas pa'i dri zhim po'i chus dbus su	lnga_0 dang_5 'cha'_10 ba_15 'dri_20 zhim_24 po_29 chus_34 dbus_39 su_44 
T02D1644:275b-27	sor bcu pa gru bzhir byugs la /	sor_0 'chu_4 ba_8 gru_11 bzhir_15 'byug_21 la_27 
T02D1644:275b-28	phyogs bzhir lha mo rnams kyi gnas su ni sor drug pa'i zlum por byas la /	phyogs_0 bzhir_7 lha_13 mo_17 rnams_20 kyi_26 gnas_30 su_35 ni_38 sor_41 drug_45 ba_50 zlum_55 por_60 byed_64 la_69 
T02D1644:275b-29	so sor me tog re re gzhag ste /	so_0 sor_3 me_7 tog_10 re_14 re_17 'jog_20 ste_26 
T02D1644:275b-30	snying ga'i sa bon gyis ye shes kyi 'khor lo	snying_0 ga_7 sa_12 bon_15 gyis_19 ye_24 shes_27 kyi_32 'khor_36 lo_42 
T02D1644:275b-31	nam mkha' la bkug la mchod pa'i khyad par gyis	nam_0 mkha'_4 la_10 'gugs_13 la_18 mchod_21 ba_27 khyad_32 ba_38 gyis_42 
T02D1644:275b-32	mchod de / de'i rjes la bstod pa bya ste /	mchod_0 de_6 de_11 rjes_16 la_21 bstod_24 ba_30 byed_33 ste_37 
T02D1644:275b-33	mche ba gtsigs shing 'jigs pa che //	mche_0 ba_5 gtsigs_8 shing_15 'jigs_21 ba_27 che_30 
T02D1644:275b-34	sngags kyi me tog phreng bas brgyan //	sngags_0 kyi_7 me_11 tog_14 phreng_18 ba_25 rgyan_29 
T02D1644:275b-35	sha chen rtag tu gsol mdzad pa'i //	sha_0 chen_4 rtag_9 tu_14 gsol_17 mdzad_22 ba_28 
T02D1644:275b-36	he ru ka la bdag phyag 'tshal //	he_0 ru_3 ka_6 la_9 bdag_12 phyag_17 'tshal_23 
T02D1644:275b-37	rnam par snang mdzad ra btu dag / rdo rje zhi ba dga' ba che //	rnam_0 ba_5 snang_9 mdzad_15 ra_21 'thu_24 'dag_28 rdo_34 rje_38 zhi_42 ba_46 dga'_49 ba_54 che_57 
T02D1644:275b-38	rang bzhin gyis ni 'od gsal mchog / sangs rgyas mkha' 'gro phyag 'tshal bstod //	rang_0 bzhin_5 gyis_11 ni_16 'od_19 gsal_23 mchog_28 sangs_36 rgya_42 mkha'_48 'gro_54 phyag_59 'tshal_65 bstod_72 
T02D1644:275b-39	mi bskyod pa yi ye shes che //	mi_0 skyod_3 ba_10 yi_13 ye_16 shes_19 che_24 
T02D1644:275b-40	rdo rje dbyings ni mkhas chen po //	rdo_0 rje_4 dbyings_8 ni_16 mkhas_19 chen_25 po_30 
T02D1644:275b-41	rdo rje gsum mchog dkyil 'khor gsum //	rdo_0 rje_4 gsum_8 mchog_13 dkyil_19 'khor_25 gsum_31 
T02D1644:275b-42	rdo rje mkha' 'gro bstod phyag 'tshal //	rdo_0 rje_4 mkha'_8 'gro_14 bstod_19 phyag_25 'tshal_31 
T02D1644:275b-43	rin chen rgyal po rab tu zab //	rin_0 chen_4 rgyal_9 po_15 rab_18 tu_22 zab_25 
T02D1644:275b-44	rdo rje nam mkha' dri ma med //	rdo_0 rje_4 nam_8 mkha'_12 'dri_18 ma_22 med_25 
T02D1644:276a-0	dngos nyid dag pas @276a * //	dngos_0 nyid_6 'dag_11 ba_15 
T02D1644:276a-1	gos med pa'i //	gos_0 med_4 ba_8 
T02D1644:276a-2	rin chen mkha' 'gro phyag 'tshal bstod //	rin_0 chen_4 mkha'_9 'gro_15 phyag_20 'tshal_26 bstod_33 
T02D1644:276a-3	rdo rje dpag med rgyal po che //	rdo_0 rje_4 dpog_8 med_13 rgyal_17 po_23 che_26 
T02D1644:276a-4	mi rtog nam mkha' rdo rje 'dzin //	mi_0 rtogs_3 nam_8 mkha'_12 rdo_18 rje_22 'dzin_26 
T02D1644:276a-5	'dod chags pha rol phyin pa brnyes //	'dod_0 chags_5 pha_11 rol_15 phyin_19 ba_25 brnyes_28 
T02D1644:276a-6	padma'i mkha' 'gro phyag 'tshal bstod //	padma_0 mkha'_8 'gro_14 phyag_19 'tshal_25 bstod_32 
T02D1644:276a-7	rdo rje dag pa gdon mi za //	rdo_0 rje_4 'dag_8 ba_12 'don_15 mi_20 za_23 
T02D1644:276a-8	bsam pa thams cad rab rdzogs byed //	bsam_0 ba_5 thams_8 cad_14 rab_18 rdzogs_22 byed_29 
T02D1644:276a-9	sangs rgyas ngo bo nyid las byung //	sangs_0 rgya_6 ngo_12 'bo_16 nyid_19 las_24 'byung_28 
T02D1644:276a-10	sna tshogs mkha' 'gro phyag 'tshal bstod //	sna_0 tshogs_4 mkha'_11 'gro_17 phyag_22 'tshal_28 bstod_35 
T02D1644:276a-11	ces pas bstod la /	ces_0 ba_4 bstod_8 la_14 
