T02D2681:191a-10	da ha da ha badzra zhes pa ni rta mgrin gyi snying po'o //	da_0 ha_3 da_6 ha_9 badzra_12 zhes_19 ba_24 ni_27 rta_30 mgrin_34 gyi_40 snying_44 po_51 
T02D2681:191a-11	pa tsa pa tsa badzra zhes pa ni bdud rtsi 'khyil pa'i snying po'o //	ba_0 tsa_3 ba_7 tsa_10 badzra_14 zhes_21 ba_26 ni_29 bdud_32 rtsi_37 'khyil_42 ba_49 snying_54 po_61 
T02D2681:191a-12	dha ra dha ra badzra zhes pa ni stobs po che'i snying po'o //	dha_0 ra_4 dha_7 ra_11 badzra_14 zhes_21 ba_26 ni_29 stobs_32 po_38 che_41 snying_47 po_54 
T02D2681:191a-13	d'a ra ya d'a ra ya badzra zhes pa ni gzhan gyis mi thub pa'i snying po'o //	d_0 ra_4 ya_7 d_10 ra_14 ya_17 badzra_20 zhes_27 ba_32 ni_35 gzhan_38 gyis_44 mi_49 thub_52 ba_57 snying_62 po_69 
T02D2681:191a-14	d'a ru na d'a ru na badzra zhes pa ni mi g-yo mgon po'i snying po'o //	d_0 ru_4 na_7 d_10 ru_14 na_17 badzra_20 zhes_27 ba_32 ni_35 mi_38 g-yo_41 mgon_46 po_51 snying_56 po_63 
T02D2681:191a-15	tstshinda tstshinda badzra zhes pa ni dbyug pa sngon po'i snying po'o //	tstshinda_0 tstshinda_10 badzra_20 zhes_27 ba_32 ni_35 dbyug_38 ba_44 sngon_47 po_53 snying_58 po_65 
T02D2681:191a-16	bhinda bhinda badzra h'um phat sv'a h'a /	bhinda_0 bhinda_7 badzra_14 h_21 phat_26 sv_31 h_36 
T02D2681:191a-17	zhes pa ni padma 'khyil pa'i snying po'o //	zhes_0 ba_5 ni_8 padma_11 'khyil_17 ba_24 snying_29 po_36 
T02D2681:191a-18	de yan chad khro bo'i rang bzhin bshad do /	de_0 yan_3 'chad_7 khro_12 'bo_17 rang_22 bzhin_27 'chad_33 do_39 
T02D2681:191a-20	// / na ma shtsanta badzra kro dha ya h'um zhes pa ni phyag 'tshal ba'i don to //	na_5 ma_8 shtsanta_11 badzra_20 kro_27 dha_31 ya_35 h_38 zhes_43 ba_48 ni_51 phyag_54 'tshal_60 ba_67 don_72 to_76 
T02D2681:191a-21	da ni sgo ba bzhi'i don ston te /	da_0 ni_3 sgo_6 ba_10 bzhi_13 don_20 ston_24 te_29 
T02D2681:191a-22	hu lu hu lu zhes pa ni shar gyi sgo	hu_0 lu_3 hu_6 lu_9 zhes_12 ba_17 ni_20 'char_23 gyi_28 sgo_32 
T02D2681:191a-23	bas bgegs dang 'byung po thams cad tshur drongs shig	ba_0 bgegs_4 dang_10 'byung_15 po_22 thams_25 cad_31 tshur_35 drongs_41 shig_48 
T02D2681:191a-24	pa'o // tishtha tishtha zhes pa ni lho'i sgo bas chings shig chings shig pa'o //	ba_0 tishtha_8 tishtha_16 zhes_24 ba_29 ni_32 lho_35 sgo_41 ba_45 'ching_49 shig_56 'ching_61 shig_68 ba_73 
T02D2681:191a-25	bandha bandha zhes pa ni nub kyi sgo bas bgegs dang log 'dren rnams choms shig choms shig pa'o //	bandha_0 bandha_7 zhes_14 ba_19 ni_22 nub_25 kyi_29 sgo_33 ba_37 bgegs_41 dang_47 log_52 bgrang_56 rnams_62 choms_68 shig_74 choms_79 shig_85 ba_90 
T02D2681:191a-26	ha na ha na zhes pa ni byang gi sgo bas rtogs shig rtogs shig pa'o //	ha_0 na_3 ha_6 na_9 zhes_12 ba_17 ni_20 byang_23 gi_29 sgo_32 ba_36 rtogs_40 shig_46 rtogs_51 shig_57 ba_62 
T02D2681:191a-27	aa mri te h'um phat ces pa ni bdud rtsi 'khyil pa'i sngags te /	aa_0 mri_3 te_7 h_10 phat_15 ces_20 ba_24 ni_27 bdud_30 rtsi_35 'khyil_40 ba_47 sngags_52 te_59 
T02D2681:191a-28	gang gi sngags thams cad kyi lhag chad skong pa'o //	gang_0 gi_5 sngags_8 thams_15 cad_21 kyi_25 lhag_29 'chad_34 skong_39 ba_45 
T02D2681:191a-29	der khro bo rnams kyi don bshad nas //	der_0 khro_4 'bo_9 rnams_12 kyi_18 don_22 'chad_26 nas_32 
T02D2681:191a-30	da ni yon tan gyi rnam grangs kyi sgo nas bye brag 'chad de /	da_0 ni_3 yon_6 tan_10 gyi_14 rnam_18 grangs_23 kyi_30 sgo_34 nas_38 'bye_42 brag_46 'chad_51 de_57 
T02D2681:191a-31	sdig pa thams cad byang byas nas //	sdig_0 ba_5 thams_8 cad_14 byang_18 byed_24 nas_29 
T02D2681:191a-32	sdug bsngal thams cad med par byed //	sdug_0 sngal_5 thams_12 cad_18 med_22 ba_26 byed_30 
T02D2681:191a-33	ces pa ni rgyud 'di'i don la zhugs te dkyil 'khor gyi cho ga gzhung bzhin du bya ste /	ces_0 ba_4 ni_7 brgyud_10 'di_16 don_22 la_26 'jug_29 te_35 dkyil_38 'khor_44 gyi_50 cho_54 ga_58 gzhung_61 bzhin_68 du_74 byed_77 ste_81 
T02D2681:191a-34	dkyil 'khor du gzhug pa la sogs pa byas na nyon mongs pa'i sgrib pa dang /	dkyil_0 'khor_6 du_12 'jug_15 ba_21 la_24 sogs_27 ba_32 byed_35 na_40 nyon_43 mongs_48 ba_54 sgrib_59 ba_65 dang_68 
T02D2681:191a-35	las kyi sgrib pa dang /	las_0 kyi_4 sgrib_8 ba_14 dang_17 
T02D2681:191a-36	chos kyi sgrib pa'i sdig pa la sogs pa byang bar 'gyur ro //	chos_0 kyi_5 sgrib_9 ba_15 sdig_20 ba_25 la_28 sogs_31 ba_36 byang_39 ba_45 'gyur_49 ro_55 
T02D2681:191b-0	sdug bsngal thams cad med par @191b byed ;	sdug_0 sngal_5 thams_12 cad_18 med_22 ba_26 byed_36 
T02D2681:191b-1	/ ces pa ni rgyud 'di nyams su blangs shing bsgrubs na /	ces_2 ba_6 ni_9 brgyud_12 'di_18 nyams_22 su_28 blangs_31 shing_38 sgrub_44 na_52 
T02D2681:191b-2	nyon mongs pa'i sdug bsngal gsum dang brgyad la sogs pa'i sdug bsngal thams cad zhi bar byed pa'o //	nyon_0 mongs_5 ba_11 sdug_16 sngal_21 gsum_28 dang_33 brgyad_38 la_45 sogs_48 ba_53 sdug_58 sngal_63 thams_70 cad_76 zhi_80 ba_84 byed_88 ba_93 
T02D2681:191b-3	rgyud do cog gi rtsa ba ste //	brgyud_0 do_6 cog_9 gi_13 rtsa_16 ba_21 ste_24 
T02D2681:191b-4	zhes pa ni bde bar gshegs pa'i zhal nas gsungs	zhes_0 ba_5 ni_8 bde_11 ba_15 gshegs_19 ba_26 zhal_31 nas_36 gsungs_40 
T02D2681:191b-5	pa'i rgyud thams cad kyi rtsa ba yin pa'i phyir	ba_0 brgyud_5 thams_11 cad_17 kyi_21 rtsa_25 ba_30 yin_33 ba_37 phyir_42 
T02D2681:191b-6	ro// dpal kun gyis ni legs par brgyan //	dpal_5 kun_10 gyis_14 ni_19 legs_22 ba_27 rgyan_31 
T02D2681:191b-7	zhes pa ni dpal ni 'jig rten dang 'jig rten	zhes_0 ba_5 ni_8 dpal_11 ni_16 'jig_19 rten_24 dang_29 'jig_34 rten_39 
T02D2681:191b-8	las 'das pa'i yon tan thams cad dang ldan pas	las_0 'da'_4 ba_9 yon_14 tan_18 thams_22 cad_28 dang_32 ldan_37 ba_42 
T02D2681:191b-9	na'o // kun ni dus gsum gyi sangs rgyas thams cad kyang de'i don rtogs pa las 'byung ba'o //	na_0 kun_8 ni_12 dus_15 gsum_19 gyi_24 sangs_28 rgya_34 thams_40 cad_46 kyang_50 de_56 don_61 rtogs_65 ba_71 las_74 'byung_78 ba_85 
T02D2681:191b-10	de'i don nyams su blangs shing phul du phyin na legs par brgyan zhes pa'o //	de_0 don_5 nyams_9 su_15 blangs_18 shing_25 'bul_31 du_36 phyin_39 na_45 legs_48 ba_53 rgyan_57 zhes_64 ba_69 
T02D2681:191b-11	sems can dbang po nyams pa dang //	sems_0 can_5 dbang_9 po_15 nyams_18 ba_24 dang_27 
T02D2681:191b-12	zhes pa ni khams gsum gyi sems can thams cad la mi nad dang phyugs nad dang tshe dang /	zhes_0 ba_5 ni_8 khams_11 gsum_17 gyi_22 sems_26 can_31 thams_35 cad_41 la_45 mi_48 nad_51 dang_55 phyugs_60 nad_67 dang_71 tshe_76 dang_81 
T02D2681:191b-13	mdangs 'phrog pa la sogs pa'i gnod pa'i byed pa	mdangs_0 'phrog_7 ba_14 la_17 sogs_20 ba_25 gnod_30 ba_35 byed_40 ba_45 
T02D2681:191b-14	rnams 'di'i don nyams su blangs na bzlog par 'gyur	rnams_0 'di_6 don_12 nyams_16 su_22 blangs_25 na_32 bzlog_35 ba_41 'gyur_45 
T02D2681:191b-15	ro // tshe zad pa dang tshe nyams dang //	ro_0 tshe_6 zad_11 ba_15 dang_18 tshe_23 nyams_28 dang_34 
T02D2681:191b-16	zhes pa ni tshe zad pa gso ba'i thabs ston	zhes_0 ba_5 ni_8 tshe_11 zad_16 ba_20 gso_23 ba_27 thabs_32 ston_38 
T02D2681:191b-17	te dkyil 'khor gyi lha rnams la phrin las bzhi	te_0 dkyil_3 'khor_9 gyi_15 lha_19 rnams_23 la_29 phrin_32 las_38 bzhi_42 
T02D2681:191b-18	gzhung bzhin byas te mchod na tshe nyams pa sos	gzhung_0 bzhin_7 byed_13 te_18 mchod_21 na_27 tshe_30 nyams_35 ba_41 sos_44 
T02D2681:191b-19	par 'gyur ro // phun sum tshogs min gang chags dang //	ba_0 'gyur_4 ro_10 phun_16 sum_21 tshogs_25 min_32 gang_36 chags_41 dang_47 
T02D2681:191b-20	zhes pa ni mdog nyams pa gso pa'i thabs ston te /	zhes_0 ba_5 ni_8 mdog_11 nyams_16 ba_22 gso_25 ba_29 thabs_34 ston_40 te_45 
T02D2681:191b-21	khams gsum gyi sems can bkres pa dang grang ba	khams_0 gsum_6 gyi_11 sems_15 can_20 bkres_24 ba_30 dang_33 grang_38 ba_44 
T02D2681:191b-22	la sogs pa'i sdug bsngal gyis byang chub la mi	la_0 sogs_3 ba_8 sdug_13 sngal_18 gyis_25 byang_30 chub_36 la_41 mi_44 
T02D2681:191b-23	chags te / sdug bsngal la chags pas de sbyang	chags_0 te_6 sdug_11 sngal_16 la_23 chags_26 ba_32 de_36 sbyong_39 
T02D2681:191b-24	ba'i thabs ni dkyil 'khor gyi lha rnams spyan drangs	ba_0 thabs_5 ni_11 dkyil_14 'khor_20 gyi_26 lha_30 rnams_34 spyan_40 drangs_46 
T02D2681:191b-25	la rgyas pa'i las byas na bde ba phun sum	la_0 rgya_3 ba_9 las_14 byed_18 na_23 bde_26 ba_30 phun_33 sum_38 
T02D2681:191b-26	tshogs pa dang ldan no //	tshogs_0 ba_7 dang_10 ldan_15 no_20 
T02D2681:191b-27	lha rnams rgyab kyis phyogs pa dang //	lha_0 rnams_4 rgyab_10 kyis_16 phyogs_21 ba_28 dang_31 
T02D2681:191b-28	zhes pa ni /	zhes_0 ba_5 ni_8 
T02D2681:191b-29	'jig rten las 'das pa'i lha mi dga' ba ston te /	'jig_0 rten_5 las_10 'da'_14 ba_19 lha_24 mi_28 dga'_31 ba_36 ston_39 te_44 
T02D2681:191b-30	bde bar gshegs pa'i spyan sngar dbang dang dam tshig	bde_0 ba_4 gshegs_8 ba_15 spyan_20 sngar_26 dbang_32 dang_38 dam_43 tshig_47 
T02D2681:191b-31	nos nas 'jig rten pa'i las dang mthun pa'i spyod	nos_0 nas_4 'jig_8 rten_13 ba_18 las_23 dang_27 mthun_32 ba_38 spyod_43 
T02D2681:191b-32	pa byas pas lha rnams mi dgyes te /	ba_0 byed_3 ba_8 lha_12 rnams_16 mi_22 dgyes_25 te_31 
T02D2681:191b-33	de zhi bar bya ba'i thabs ni rang yi dam lhar zhugs nas dkyil 'khor dang /	de_0 zhi_3 ba_7 byed_11 ba_15 thabs_20 ni_26 rang_29 yi_34 dam_37 lhar_41 'jug_46 nas_52 dkyil_56 'khor_62 dang_68 
T02D2681:191b-34	mchod rdzas la sogs pa thams cad mang por bsgyur te /	mchod_0 rdzas_6 la_12 sogs_15 ba_20 thams_23 cad_29 mang_33 por_38 sgyur_42 te_49 
T02D2681:191b-35	dbang gi las byas na 'grub po //	dbang_0 gi_6 las_9 byed_13 na_18 'grub_21 po_27 
T02D2681:191b-36	mdza' sdug skye bo sdang ba dang //	mdza'_0 sdug_6 skye_11 'bo_16 sdang_19 ba_25 dang_28 
T02D2681:191b-37	zhes pa ni lha 'phangs pa'i snga ltas te rang	zhes_0 ba_5 ni_8 lha_11 'phen_15 ba_23 snga_28 ltas_33 te_38 rang_41 
T02D2681:191b-38	gi mdza' ba dang 'khor la sogs pa zhe sdang	gi_0 mdza'_3 ba_9 dang_12 'khor_17 la_23 sogs_26 ba_31 zhe_34 sdang_38 
T02D2681:192a-0	dang ngan @192a * //	dang_0 ngan_5 
T02D2681:192a-1	sems la sogs pa byed de de zhi bar bya ba'i phyir drag po'i las byas nas 'grub bo //	sems_0 la_5 sogs_8 ba_13 byed_16 de_21 de_24 zhi_27 ba_31 byed_35 ba_39 phyir_44 drag_50 po_55 las_60 byed_64 nas_69 'grub_73 'bo_79 
T02D2681:192a-2	bram ze la sogs gtses pa dang //	bram_0 ze_5 la_8 sogs_11 gtses_16 ba_22 dang_25 
T02D2681:192a-3	zhes pa ni rgyal po log pa'i stobs can gyis	zhes_0 ba_5 ni_8 rgyal_11 po_17 log_20 ba_24 stobs_29 can_35 gyis_39 
T02D2681:192a-4	bram ze la gseg shad brgyab pa'i rnam smin la	bram_0 ze_5 la_8 gseg_11 shad_16 rgyag_21 ba_28 rnam_33 smin_38 la_43 
T02D2681:192a-5	bya ste / rang gis bsgrubs na 'grub par 'gyur ro //	byed_0 ste_4 rang_10 gis_15 sgrub_19 na_27 'grub_30 ba_36 'gyur_40 ro_46 
T02D2681:192a-6	phan tshun mthun pa ma yin dang //	phan_0 tshun_5 mthun_11 ba_17 ma_20 yin_23 dang_27 
T02D2681:192a-7	zhes pa ni mi mthun pa ston te //	zhes_0 ba_5 ni_8 mi_11 mthun_14 ba_20 ston_23 te_28 
T02D2681:192a-8	gdon 'byung pos byin gyis brlabs pas sems can thams cad dgra byed de /	'don_0 'byung_5 pos_12 byin_16 gyis_21 brlabs_26 ba_33 sems_37 can_42 thams_46 cad_52 dgra_56 byed_61 de_66 
T02D2681:192a-9	khrus chog byas na gang yang 'grub po //	'khru_0 chog_6 byed_11 na_16 gang_19 yang_24 'grub_29 po_35 
T02D2681:192a-10	nor 'grib pas ni gnod pa dang //	nor_0 'grib_4 ba_10 ni_14 gnod_17 ba_22 dang_25 
T02D2681:192a-11	zhes pa ni nor yod pa de nyams te phongs	zhes_0 ba_5 ni_8 nor_11 yod_15 ba_19 de_22 nyams_25 te_31 'phong_34 
T02D2681:192a-12	par gyur na rgyas pa'i las byas na nor dang	ba_0 gyur_4 na_9 rgya_12 ba_18 las_23 byed_27 na_32 nor_35 dang_39 
T02D2681:192a-13	ldan par 'gyur ro //	ldan_0 ba_5 'gyur_9 ro_15 
T02D2681:192a-14	mya ngan ngal dang gnod pa dang //	mya_0 ngan_4 ngal_9 dang_14 gnod_19 ba_24 dang_27 
T02D2681:192a-15	zhes pa ni mya ngan gyi gnas ston te /	zhes_0 ba_5 ni_8 mya_11 ngan_15 gyi_20 gnas_24 ston_29 te_34 
T02D2681:192a-16	khams gsum gyi sems can thams cad nyon mongs pa'i	khams_0 gsum_6 gyi_11 sems_15 can_20 thams_24 cad_30 nyon_34 mongs_39 ba_45 
T02D2681:192a-17	mya ngan gyis gzir ba la zhi pa'i las byas	mya_0 ngan_4 gyis_9 gzir_14 ba_19 la_22 zhi_25 ba_29 las_34 byed_38 
T02D2681:192a-18	na 'grub par 'gyur ro //	na_0 'grub_3 ba_9 'gyur_13 ro_19 
T02D2681:192a-19	'jigs pa dang ni phongs pa dang /	'jigs_0 ba_6 dang_9 ni_14 'phong_17 ba_24 dang_27 
T02D2681:192a-20	zhes pa ni 'jigs shing phongs pa ston te /	zhes_0 ba_5 ni_8 'jigs_11 shing_17 'phong_23 ba_30 ston_33 te_38 
T02D2681:192a-21	sems can rgyal po'i chad pas 'jigs pa dang /	sems_0 can_5 rgyal_9 po_15 'chad_20 ba_25 'jigs_29 ba_35 dang_38 
T02D2681:192a-22	gnam lcags kyi 'jigs pa dang /	gnam_0 lcags_5 kyi_11 'jigs_15 ba_21 dang_24 
T02D2681:192a-23	gcan gzhan gyi 'jigs pa dang /	gcan_0 gzhan_5 gyi_11 'jigs_15 ba_21 dang_24 
T02D2681:192a-24	me dang chus 'jigs pa dang /	me_0 dang_3 chus_8 'jigs_13 ba_19 dang_22 
T02D2681:192a-25	skar mda' ltung bas 'jigs pa dang /	skar_0 mda'_5 ltung_10 ba_16 'jigs_20 ba_26 dang_29 
T02D2681:192a-26	mgon skyob med de phongs pa la sogs pa la phrin las bzhi'i las byas na 'grub pa'o //	mgon_0 skyob_5 med_11 de_15 'phong_18 ba_25 la_28 sogs_31 ba_36 la_39 phrin_42 las_48 bzhi_52 las_59 byed_63 na_68 'grub_71 ba_77 
T02D2681:192a-27	gza' dang rgyu skar byad stems dang //	gza'_0 dang_5 rgyu_10 skar_15 byad_20 stem_25 dang_31 
T02D2681:192a-28	zhes pa ni byad stems ston te /	zhes_0 ba_5 ni_8 byad_11 stem_16 ston_22 te_27 
T02D2681:192a-29	'jig rten gyi gza' chen po brgyad dang /	'jig_0 rten_5 gyi_10 gza'_14 chen_19 po_24 brgyad_27 dang_34 
T02D2681:192a-30	rgyu skar nyi shu rtsa brgyad kyi byad stems la gza' dang /	rgyu_0 skar_5 nyi_10 shu_14 rtsa_18 brgyad_23 kyi_30 byad_34 stem_39 la_45 gza'_48 dang_53 
T02D2681:192a-31	rgyu skar gyi cho ga byas na zhi bar 'gyur ro //	rgyu_0 skar_5 gyi_10 cho_14 ga_18 byed_21 na_26 zhi_29 ba_33 'gyur_37 ro_43 
T02D2681:192a-32	mi bzad gdon gyi nyen pa dang /	mi_0 bzad_3 'don_8 gyi_13 nyen_17 ba_22 dang_25 
T02D2681:192a-33	zhes pa ni gdon stong phrag brgyad cus nyen pa	zhes_0 ba_5 ni_8 'don_11 stong_16 phrag_22 brgyad_28 cus_35 nyen_39 ba_44 
T02D2681:192a-34	la phrin las bzhi'i las byas na 'grub par 'gyur	la_0 phrin_3 las_9 bzhi_13 las_20 byed_24 na_29 'grub_32 ba_38 'gyur_42 
T02D2681:192a-35	ro // mya ngan ngal las byung ba yi //	ro_0 mya_6 ngan_10 ngal_15 las_20 'byung_24 ba_30 yi_33 
T02D2681:192a-36	rmi lam sdig pa mthong na yang //	rmi_0 lam_4 sdig_8 ba_13 mthong_16 na_23 yang_26 
T02D2681:192a-37	zhes pa ni nyon mongs pa'i sems can phyin ci	zhes_0 ba_5 ni_8 nyon_11 mongs_16 ba_22 sems_27 can_32 phyin_36 ci_42 
T02D2681:192a-38	log gi lta ba ngan pa'i mya ngan gyis gdungs	log_0 gi_4 lta_7 ba_11 ngan_14 ba_19 mya_24 ngan_28 gyis_33 gdung_38 
T02D2681:192a-39	pa'am / lus sems na zhing thang chad pas 'thibs	ba_0 lus_8 sems_12 na_17 zhing_20 thang_26 'chad_32 ba_37 'thib_41 
T02D2681:192a-40	pa gnyid log pa'i rmi lam na sdig pa'i bag	ba_0 rnyid_3 log_9 ba_13 rmi_18 lam_22 na_26 sdig_29 ba_34 bag_39 
T02D2681:192a-41	chags rmis na phrin las bzhi'i las byas na 'grub	chags_0 rmis_6 na_11 phrin_14 las_20 bzhi_24 las_31 byed_35 na_40 'grub_43 
T02D2681:192a-42	pa'am / pa'o // des ni rab bkrus gtsang ma yin //	ba_0 ba_8 des_16 ni_20 rab_23 'khrud_27 gtsang_33 ma_40 yin_43 
T02D2681:192a-43	zhes pa ni cho ga'i thabs ston te /	zhes_0 ba_5 ni_8 cho_11 ga_15 thabs_20 ston_26 te_31 
T02D2681:192b-0	dkyil 'khor gyi cho ga rdzogs par byas @192b la ;	dkyil_0 'khor_6 gyi_12 cho_16 ga_20 rdzogs_23 ba_30 byed_34 la_45 
T02D2681:192b-1	slob dpon gyis bdud rtsi'i bum pas slob ma'i spyi	slob_0 dpon_5 gyis_10 bdud_15 rtsi_20 bum_27 ba_31 slob_35 ma_40 spyi_45 
T02D2681:192b-2	bor dbang bskur zhing khrus byas na mi gtsang ba	'bor_0 dbang_4 skur_10 zhing_16 'khru_22 byed_28 na_33 mi_36 gtsang_39 ba_46 
T02D2681:192b-3	la sogs pa thams cad 'dag go //	la_0 sogs_3 ba_8 thams_11 cad_17 'dag_21 go_26 
T02D2681:192b-4	gtsang ma ni nyon mongs pa med pa'o //	gtsang_0 ma_7 ni_10 nyon_13 mongs_18 ba_24 med_27 ba_31 
T02D2681:192b-5	mdo sde dam pa mnyam par bya //	mdo_0 sde_4 dam_8 ba_12 mnyam_15 ba_21 byed_25 
T02D2681:192b-6	zhes pa ni slob ma ni byang chub tu sems bskyed la /	zhes_0 ba_5 ni_8 slob_11 ma_16 ni_19 byang_22 chub_28 tu_33 sems_36 skyed_41 la_48 
T02D2681:192b-7	mdo sde'i don nyan du bcug la lha dbog bsgom du gzhug pa bya'o //	mdo_0 sde_4 don_10 nyan_14 du_19 'jug_22 la_27 lha_30 'bogs_34 bsgom_39 du_45 'jug_48 ba_54 byed_57 
T02D2681:192b-8	gang dag yid dge sems dang zhing //	gang_0 'dag_5 yid_9 dge_13 sems_17 dang_22 zhing_27 
T02D2681:192b-9	gtsang ma'i gos kyis rab brgyan te //	gtsang_0 ma_7 gos_12 kyis_16 rab_21 rgyan_25 te_32 
T02D2681:192b-10	zhes pa ni /	zhes_0 ba_5 ni_8 
T02D2681:192b-11	slob dpon gyis slob ma de la ras sam dar	slob_0 dpon_5 gyis_10 slob_15 ma_20 de_23 la_26 ras_29 sam_33 dar_37 
T02D2681:192b-12	dkar la sogs pa'i gos gcang ma bskon la dri	dkar_0 la_5 sogs_8 ba_13 gos_18 gcang_22 ma_28 skon_31 la_37 'dri_40 
T02D2681:192b-13	zhim po'i me tog la sogs pa'i rgyan mang pos	zhim_0 po_5 me_10 tog_13 la_17 sogs_20 ba_25 rgyan_30 mang_36 pos_41 
T02D2681:192b-14	brgyan la gzhag go //	rgyan_0 la_7 'jog_10 go_16 
T02D2681:192b-15	zab mo sangs rgyas spyod yul ba //	zab_0 mo_4 sangs_7 rgya_13 spyod_19 yul_25 ba_29 
T02D2681:192b-16	mdo sde 'di ni nyan byed na //	mdo_0 sde_4 'di_8 ni_12 nyan_15 byed_20 na_25 
T02D2681:192b-17	zhes pa ni thag pa chen po'i chos mnyan pa'i yon tan ston te /	zhes_0 ba_5 ni_8 thag_11 ba_16 chen_19 po_24 chos_29 nyan_34 ba_40 yon_45 tan_49 ston_53 te_58 
T02D2681:192b-18	skul ma gdab po //	skul_0 ma_5 gdab_8 po_13 
T02D2681:192b-19	mdo sde'i rgyal po 'di klog pa dang 'dzin pa	mdo_0 sde_4 rgyal_10 po_16 'di_19 klog_23 ba_28 dang_31 'dzin_36 ba_42 
T02D2681:192b-20	dang gzhan la ston cing nyams su longs shig pa	dang_0 gzhan_5 la_11 ston_14 cing_19 nyams_24 su_30 longs_33 shig_39 ba_44 
T02D2681:192b-21	bstan to // mdo sde 'di yi gzi brjid kyis //	ston_0 to_6 mdo_12 sde_16 'di_20 yi_24 gzi_27 brjid_31 kyis_37 
T02D2681:192b-22	srog chags dag ni thams cad kyi //	srog_0 chags_5 'dag_11 ni_15 thams_18 cad_24 kyi_28 
T02D2681:192b-23	zhes pa ni mdo sde 'di nyan cing nyams su	zhes_0 ba_5 ni_8 mdo_11 sde_15 'di_19 nyan_23 cing_28 nyams_33 su_39 
T02D2681:192b-24	len pa'i gzi byin gyis nyon mongs pa'i rnam pa	len_0 ba_4 gzi_9 byin_13 gyis_18 nyon_23 mongs_28 ba_34 rnam_39 ba_44 
T02D2681:192b-25	dang / sdug bsngal gyi bye brag thams cad zhi bar byed pa'o //	dang_0 sdug_7 sngal_12 gyi_19 'bye_23 brag_27 thams_32 cad_38 zhi_42 ba_46 byed_50 ba_55 
T02D2681:192b-26	mi bzad pa yi nang rnams kyang //	mi_0 bzad_3 ba_8 yi_11 nang_14 rnams_19 kyang_25 
T02D2681:192b-27	de dag thams cad zhi par blta //	de_0 'dag_3 thams_7 cad_13 zhi_17 ba_21 lta_25 
T02D2681:192b-28	zhes pa ni /	zhes_0 ba_5 ni_8 
T02D2681:192b-29	khams gsum gyi sems can thams cad kyi nyon mongs pa'i bag chags mi bzad pa rnams dang /	khams_0 gsum_6 gyi_11 sems_15 can_20 thams_24 cad_30 kyi_34 nyon_38 mongs_43 ba_49 bag_54 chags_58 mi_64 bzad_67 ba_72 rnams_75 dang_81 
T02D2681:192b-30	nad kyi rang bzhin rnams zhi bar bya ba'i phyir ro //	nad_0 kyi_4 rang_8 bzhin_13 rnams_19 zhi_25 ba_29 byed_33 ba_37 phyir_42 ro_48 
T02D2681:192b-31	de ltar nad zhi nas /	de_0 ltar_3 nad_8 zhi_12 nas_16 
T02D2681:192b-32	de'i 'og tu bde ba thob pa'i rtags ston te /	de_0 'og_5 tu_9 bde_12 ba_16 'thob_19 ba_24 rtags_29 ston_35 te_40 
T02D2681:192b-33	tshe dang bsod nams 'phel bar 'gyur //	tshe_0 dang_5 bsod_10 nams_15 'phel_20 ba_26 'gyur_30 
T02D2681:192b-34	sdig pa kun las rnam par grol //	sdig_0 ba_5 kun_8 las_12 rnam_16 ba_21 grol_25 
T02D2681:192b-35	zhes pa ni /	zhes_0 ba_5 ni_8 
T02D2681:192b-36	sems can thams cad kyi tshe zad pa'am 'chi ba la sogs pa bzlog pa ste /	sems_0 can_5 thams_9 cad_15 kyi_19 tshe_23 zad_28 ba_32 'chi_38 ba_43 la_46 sogs_49 ba_54 bzlog_57 ba_63 ste_66 
T02D2681:192b-37	mdo sde 'di mnyan pa'am bsam pa'am bsgoms pas tshe	mdo_0 sde_4 'di_8 nyan_12 ba_18 bsam_24 ba_29 sgom_35 ba_42 tshe_46 
T02D2681:192b-38	dang bsod nams tshad med pa 'phel par 'gyur ro	dang_0 bsod_5 nams_10 tshad_15 med_21 ba_25 'phel_28 ba_34 'gyur_38 ro_44 
T02D2681:192b-39	// de yan chad kyis cho ga'i thabs dang phan yon bshad do //	de_3 yan_6 'chad_10 kyis_15 cho_20 ga_24 thabs_29 dang_35 phan_40 yon_45 'chad_49 do_55 
T02D2681:192b-40	da ni bum pa'i cho ga dang cha rkyen ston te /	da_0 ni_3 bum_6 ba_10 cho_15 ga_19 dang_22 cha_27 rkyen_31 ston_37 te_42 
T02D2681:192b-41	nor bu yungs kar d'ur ba dang //	nor_0 bu_4 yungs_7 kar_13 d_17 ba_22 dang_25 
T02D2681:192b-42	zhes pa ni nor bu ni mu tig dang gzi mchod dang byi ru'o //	zhes_0 ba_5 ni_8 nor_11 bu_15 ni_18 mu_21 tig_24 dang_28 gzi_33 mchod_37 dang_43 'byi_48 ru_52 
T02D2681:192b-43	yungs kar ni 'bru sna lnga'i gtso bo ste /	yungs_0 kar_6 ni_10 'bru_13 sna_18 lnga_22 gtso_29 'bo_34 ste_37 
T02D2681:192b-44	nas dang /	nas_0 dang_4 
T02D2681:192b-45	so ba dang /	so_0 ba_3 dang_6 
T02D2681:192b-46	til dang /	til_0 dang_4 
T02D2681:192b-47	mon sran no //	mon_0 sran_4 no_9 
T02D2681:193a-0	d'ur ba @193a * //	d_0 ba_5 
T02D2681:193a-1	ni kha rgyan no //	ni_0 kha_3 rgyan_7 no_13 
T02D2681:193a-2	de'i khongs su bya kri seng kri tsandan la sogs pa ste shing yal gcan no //	de_0 khongs_5 su_12 byed_15 kri_19 seng_23 kri_28 tsandan_32 la_40 sogs_43 ba_48 ste_51 shing_55 yal_61 gcan_65 no_70 
T02D2681:193a-3	rin chen rma med tsandan bcas //	rin_0 chen_4 rma_9 med_13 tsandan_17 'cha'_25 
T02D2681:193a-4	zhes pa ni rin po che lnga dang /	zhes_0 ba_5 ni_8 rin_11 po_15 che_18 lnga_22 dang_27 
T02D2681:193a-5	snying po lnga ston te /	snying_0 po_7 lnga_10 ston_15 te_20 
T02D2681:193a-6	rin chen lnga ni gser dang /	rin_0 chen_4 lnga_9 ni_14 gser_17 dang_22 
T02D2681:193a-7	shel dang /	shel_0 dang_5 
T02D2681:193a-8	aindra n'i la dang byi ru'o //	aindra_0 n_7 la_11 dang_14 'byi_19 ru_23 
T02D2681:193a-9	rma med pa ni de rnams skyon med pa la bya'o //	rma_0 med_4 ba_8 ni_11 de_14 rnams_17 skyon_23 med_29 ba_33 la_36 byed_39 
T02D2681:193a-10	tsandan ni gla rtsi dang gur gum dang /	tsandan_0 ni_8 gla_11 rtsi_15 dang_20 gur_25 'gum_29 dang_33 
T02D2681:193a-11	spos dang /	spros_0 dang_5 
T02D2681:193a-12	aa ga ru dang /	aa_0 ga_3 ru_6 dang_9 
T02D2681:193a-13	lnga ni dri lnga'o //	lnga_0 ni_5 'dri_8 lnga_12 
T02D2681:193a-14	shel dang rdo rje me tog dang /	shel_0 dang_5 rdo_10 rje_14 me_18 tog_21 dang_25 
T02D2681:193a-15	zhes pa ni snying po ste /	zhes_0 ba_5 ni_8 snying_11 po_18 ste_21 
T02D2681:193a-16	me shes dang chu shel dang /	me_0 shes_3 dang_8 chu_13 shel_17 dang_22 
T02D2681:193a-17	rtsi thog gi snying po mar dang /	rtsi_0 thogs_5 gi_10 snying_13 po_20 mar_23 dang_27 
T02D2681:193a-18	shing thog gi snying po bu ram dang /	shing_0 thogs_6 gi_11 snying_14 po_21 bu_24 ram_27 dang_31 
T02D2681:193a-19	me tog gi snying po sbrang rtsi ste snying po lnga'o//	me_0 tog_3 gi_7 snying_10 po_17 sbrang_20 rtsi_27 ste_32 snying_36 po_43 
T02D2681:193a-20	rdo rje me tog ni bum pa'i gdan te /	rdo_0 rje_4 me_8 tog_11 ni_15 bum_18 ba_22 gdan_27 te_32 
T02D2681:193a-21	dbyar me tog gi dkyil 'khor bya /	dbyar_0 me_6 tog_9 gi_13 dkyil_16 'khor_22 byed_28 
T02D2681:193a-22	dgun tshon sna lnga'i dkyil 'khor bya /	dgun_0 tshon_5 sna_11 lnga_15 dkyil_22 'khor_28 byed_34 
T02D2681:193a-23	yang na 'bru la bya'o //	yang_0 na_5 'bru_8 la_13 byed_16 
T02D2681:193a-24	chu yis gser ram yang na ni //	chu_0 yis_4 gser_8 ram_13 yang_17 na_22 ni_25 
T02D2681:193a-25	dngul gyi bum pa dag kyang rung //	dngul_0 gyi_6 bum_10 ba_14 'dag_17 kyang_21 rung_27 
T02D2681:193a-26	gtsang ma'i gos kyis dkri zhing dgang //	gtsang_0 ma_7 gos_12 kyis_16 dkri_21 zhing_26 'geng_32 
T02D2681:193a-27	zhes pa ni bum pa'i rgyu ston te /	zhes_0 ba_5 ni_8 bum_11 ba_15 rgyu_20 ston_25 te_30 
T02D2681:193a-28	rgyal po la gser gyi bum pa /	rgyal_0 po_6 la_9 gser_12 gyi_17 bum_21 ba_25 
T02D2681:193a-29	blon po la dngul gyi bum pa dag kyang zhes pa mang po ste /	blon_0 po_5 la_8 dngul_11 gyi_17 bum_21 ba_25 'dag_28 kyang_32 zhes_38 ba_43 mang_46 po_51 ste_54 
T02D2681:193a-30	dmangs la zangs sam sa las bya //	dmangs_0 la_7 zangs_10 sam_16 sa_20 las_23 byed_27 
T02D2681:193a-31	gtsang ma'i gos ni ras kha tshar ma nyams pa la bya'o //	gtsang_0 ma_7 gos_12 ni_16 ras_19 kha_23 tshar_27 ma_33 nyams_36 ba_42 la_45 byed_48 
T02D2681:193a-32	lan grangs nyi shu rtsa gcig gam //	lan_0 grangs_4 nyi_11 shu_15 rtsa_19 gcig_24 gam_29 
T02D2681:193a-33	yang na lan grangs brgya rtsa brgyad //	yang_0 na_5 lan_8 grangs_12 brgya_19 rtsa_25 brgyad_30 
T02D2681:193a-34	rdo rje rnam 'joms bzlas nas ni //	rdo_0 rje_4 rnam_8 'joms_13 bzlas_19 nas_25 ni_29 
T02D2681:193a-35	zhes pa grangs ston te /	zhes_0 ba_5 grangs_8 ston_15 te_20 
T02D2681:193a-36	rgyal po dang blon po la brgya rtsa brgyad do //	rgyal_0 po_6 dang_9 blon_14 po_19 la_22 brgya_25 rtsa_31 brgyad_36 do_43 
T02D2681:193a-37	blon po tha ma'am dmangs la nyi shu rtsa gcig bzlas so //	blon_0 po_5 tha_8 ma_12 dmangs_18 la_25 nyi_28 shu_32 rtsa_36 gcig_41 bzlas_46 so_52 
T02D2681:193a-38	dmangs tha ma la bdun bzlas so //	dmangs_0 tha_7 ma_11 la_14 bdun_17 bzlas_22 so_28 
T02D2681:193a-39	rgyal po rtag tu khrus kyis shig / ces pa ni rgyal po stobs can snying po la bya'o //	rgyal_0 po_6 rtag_9 tu_14 'khru_17 kyis_23 shig_28 ces_35 ba_39 ni_42 rgyal_45 po_51 stobs_54 can_60 snying_64 po_71 la_74 byed_77 
T02D2681:193a-40	rgyal po sngon la smos pa ci'i phyir zhe na /	rgyal_0 po_6 sngon_9 la_15 smos_18 ba_23 ci_26 phyir_31 zhe_37 na_41 
T02D2681:193a-41	bsod nams can gyis sngon la byas na thams cad la bde ba'i phyir ro //	bsod_0 nams_5 can_10 gyis_14 sngon_19 la_25 byed_28 na_33 thams_36 cad_42 la_46 bde_49 ba_53 phyir_58 ro_64 
T02D2681:193a-42	'bangs ni rgyal po'i 'khor yin te don gyis shes par bya'o /	'bang_0 ni_7 rgyal_10 po_16 'khor_21 yin_27 te_31 don_34 gyis_38 shes_43 ba_48 byed_52 
T02D2681:193a-44	// / rdo rje rnam par 'joms pa'i don rnam par phye ste bshad pa /	rdo_5 rje_9 rnam_13 ba_18 'joms_22 ba_28 don_33 rnam_37 ba_42 'byed_46 ste_51 'chad_55 ba_61 
T02D2681:193a-45	rgya gar gyi slob dpon chen po ba'i ma la mi tras mdzad pa rdzogs so /	rgya_0 gar_5 gyi_9 slob_13 dpon_18 chen_23 po_28 ba_31 ma_36 la_39 mi_42 tras_45 mdzad_50 ba_56 rdzogs_59 so_66 
