T02D1263:6b-27	gro dang /	gro_0 dang_4 
T02D1263:6b-28	'di rnams ni dkyil 'khor gyi lha rnams kyi thugs kyi rang bzhin no //	'di_0 rnams_4 ni_10 dkyil_13 'khor_19 gyi_25 lha_29 rnams_33 kyi_39 thugs_43 kyi_49 rang_53 bzhin_58 no_64 
T02D1263:6b-29	shel dang /	shel_0 dang_5 
T02D1263:6b-30	dngul dang /	dngul_0 dang_6 
T02D1263:6b-31	mu tig dang /	mu_0 tig_3 dang_7 
T02D1263:6b-32	dung dang /	dung_0 dang_5 
T02D1263:6b-33	byi ru ni dkyil 'khor gyi sku mdog gi rtags su byas pa'o //	'byi_0 ru_4 ni_7 dkyil_10 'khor_16 gyi_22 sku_26 mdog_30 gi_35 rtags_38 su_44 byed_47 ba_52 
T02D1263:6b-34	gzhan yang zla ba dang /	gzhan_0 yang_6 zla_11 ba_15 dang_18 
T02D1263:6b-35	nyi ma dang /	nyi_0 ma_4 dang_7 
T02D1263:6b-36	chu dang /	chu_0 dang_4 
T02D1263:6b-37	sman dang /	sman_0 dang_5 
T02D1263:6b-38	dri dang /	'dri_0 dang_4 
T02D1263:6b-39	bu ram dang /	bu_0 ram_3 dang_7 
T02D1263:6b-40	ka ra dang /	ka_0 ra_3 dang_6 
T02D1263:6b-41	bza' ba rnams gzhug go //	bza'_0 ba_5 rnams_8 'jug_14 go_20 
T02D1263:6b-42	bum pa la bdag po'i mtshan ma la sogs pa lnga dang ldan par bya zhing /	bum_0 ba_4 la_7 bdag_10 po_15 mtshan_20 ma_27 la_30 sogs_33 ba_38 lnga_41 dang_46 ldan_51 ba_56 byed_60 zhing_64 
T02D1263:6b-43	sngon po dang /	sngon_0 po_6 dang_9 
T02D1263:6b-44	dkar po dang /	dkar_0 po_5 dang_8 
T02D1263:6b-45	ser po dang /	ser_0 po_4 dang_7 
T02D1263:6b-46	dmar po dang /	dmar_0 po_5 dang_8 
T02D1263:6b-47	ljang gu'i ras rnams kyis ni mgul ba bcing bar bya'o //	ljang_0 gu_6 ras_11 rnams_15 kyis_21 ni_26 mgul_29 ba_34 'ching_37 ba_43 byed_47 
T02D1263:6b-48	ma 'byor na ras yug gcig gis spyi bor bcing ngo //	ma_0 'byor_3 na_9 ras_12 yug_16 gcig_20 gis_25 spyi_29 'bor_34 'ching_38 ngo_44 
T02D1263:6b-49	shing lo ma can gyi rigs bzang po 'bras bu	shing_0 lo_6 ma_9 can_12 gyi_16 rigs_20 bzang_25 po_31 'bras_34 bu_40 
T02D1263:6b-50	dang lo ma dang yal gar bcas pas kha rgyan	dang_0 lo_5 ma_8 dang_11 yal_16 gar_20 'cha'_24 ba_29 kha_33 rgyan_37 
T02D1263:6b-51	bya'o // bum pa gzhan rnams ni sman la sogs	byed_0 bum_9 ba_13 gzhan_16 rnams_22 ni_28 sman_31 la_36 sogs_39 
T02D1263:6b-52	pa yang mi gzhug / lha re re 'od du	ba_0 yang_3 mi_8 'jug_11 lha_19 re_23 re_26 'od_29 du_33 
T02D1263:6b-53	zhu ba las bya'o //	'ju_0 ba_4 las_7 byed_11 
T02D1263:6b-54	mchod bstod 'dzab kun 'dra'o //	mchod_0 bstod_6 'dzab_12 kun_18 'dra_22 
T02D1263:6b-55	de nas bum pa rnams ras bting ba'i steng du me tog dkar po chal bar bkram la /	de_0 nas_3 bum_7 ba_11 rnams_14 ras_20 bting_24 ba_30 steng_35 du_41 me_44 tog_47 dkar_51 po_56 'chal_59 ba_64 'grem_68 la_74 
T02D1263:6b-56	de'i steng du bzhugs su gsol lo //	de_0 steng_5 du_11 bzhugs_14 su_21 gsol_24 lo_29 
T02D1263:6b-57	de'i dus su gar gyi mchod pa rnams kyang 'bul lo //	de_0 dus_5 su_9 gar_12 gyi_16 mchod_20 ba_26 rnams_29 kyang_35 'bul_41 lo_46 
T02D1263:6b-58	las thams cad pa'i bum pa sna tshogs rdo rjes mtshan pa /	las_0 thams_4 cad_10 ba_14 bum_19 ba_23 sna_26 tshogs_30 rdo_37 rjes_41 mtshan_46 ba_53 
T02D1263:6b-59	de la mchod pa byas la phyi rol gyi byang shar gyi mtshams la bzhugs su gsol lo //	de_0 la_3 mchod_6 ba_12 byed_15 la_20 phyi_23 rol_28 gyi_32 byang_36 'char_42 gyi_47 mtshams_51 la_59 bzhugs_62 su_69 gsol_72 lo_77 
T02D1263:7a-0	bgegs @7a * //	bgegs_0 
T02D1263:7a-1	ma lus rnams las ma grub kyi bar du bsrung du gsol zhes pas bcol //	ma_0 lus_3 rnams_7 las_13 ma_17 'grub_20 kyi_25 ba_29 du_33 bsrung_36 du_43 gsol_46 zhes_51 ba_56 'chol_60 
T02D1263:7a-2	gtor ma dgu /	'thor_0 ma_5 dgu_8 
T02D1263:7a-3	mar me dgu /	mar_0 me_4 dgu_7 
T02D1263:7a-4	lha bshos dgu /	lha_0 bshos_4 dgu_10 
T02D1263:7a-5	spos dgu /	spros_0 dgu_5 
T02D1263:7a-6	de rnams ni bum pa lhag par gnas pa'i sta gon gyi cho ga'o /	de_0 rnams_3 ni_9 bum_12 ba_16 lhag_19 ba_24 gnas_28 ba_33 sta_38 gon_42 gyi_46 cho_50 ga_54 
T02D1263:7a-8	// / sta gon gyi phyi de nyin par rgyas pa'i sbyin sreg bya'o //	sta_5 gon_9 gyi_13 phyi_17 de_22 nyin_25 ba_30 rgya_34 ba_40 sbyin_45 sreg_51 byed_56 
T02D1263:7a-9	slob dpon mtshan nyid bzang po dang ldan pa yang	slob_0 dpon_5 mtshan_10 nyid_17 bzang_22 po_28 dang_31 ldan_36 ba_41 yang_44 
T02D1263:7a-10	dag pa'i ye shes de kho na nyid shes pa	'dag_0 ba_4 ye_9 shes_12 de_17 kho_20 na_24 nyid_27 shes_32 ba_37 
T02D1263:7a-11	/ khro ba med pa /	khro_2 ba_7 med_10 ba_14 
T02D1263:7a-12	khon pa med pa /	khon_0 ba_5 med_8 ba_12 
T02D1263:7a-13	phyag rgya dang ldan pa'i shes rab can gyis /	phyag_0 rgya_6 dang_11 ldan_16 ba_21 shes_26 rab_31 can_35 gyis_39 
T02D1263:7a-14	dkyil 'khor gyi lha rnams mdun gyi nam mkha' la gshegs su gsol lo //	dkyil_0 'khor_6 gyi_12 lha_16 rnams_20 mdun_26 gyi_31 nam_35 mkha'_39 la_45 gshegs_48 su_55 gsol_58 lo_63 
T02D1263:7a-15	thig gdab pa'i las brtsam par bya'o //	thig_0 gdab_5 ba_10 las_15 brtsam_19 ba_26 byed_30 
T02D1263:7a-16	de yang ras bal la shes rab ma mtshan dang ldan pas bkal ba /	de_0 yang_3 ras_8 bal_12 la_16 shes_19 rab_24 ma_28 mtshan_31 dang_38 ldan_43 ba_48 'khel_52 ba_57 
T02D1263:7a-17	'jur mdud la sogs pa med pa /	'jur_0 mdud_5 la_10 sogs_13 ba_18 med_21 ba_25 
T02D1263:7a-18	ring thung dkyil 'khor nyis 'gyur la /	ring_0 thung_5 dkyil_11 'khor_17 nyis_23 'gyur_28 la_34 
T02D1263:7a-19	sbom phra sgo'i nyi shu'i char 'gyur ba bkal te /	sbom_0 phra_5 sgo_10 nyi_16 shu_20 char_26 'gyur_31 ba_37 'khel_40 te_45 
T02D1263:7a-20	srad bu so sor bsdoms la /	srad_0 bu_5 so_8 sor_11 sdom_15 la_22 
T02D1263:7a-21	padma bhanddha'i snod dri zhim pos byugs pa'i nang du bzhag la /	padma_0 bhanddha_6 snod_17 'dri_22 zhim_26 pos_31 'byug_35 ba_41 nang_46 du_51 'jog_54 la_60 
T02D1263:7a-22	dang la srad bu rang bzhin med par bsgom //	dang_0 la_5 srad_8 bu_13 rang_16 bzhin_21 med_27 ba_31 bsgom_35 
T02D1263:7a-23	de las so so'i yig 'brur 'gyur //	de_0 las_3 so_7 so_10 yig_15 'brur_19 'gyur_25 
T02D1263:7a-24	yig 'bru yongs su gyur pa las /	yig_0 'bru_4 yongs_9 su_15 gyur_18 ba_23 las_26 
T02D1263:7a-25	srad bu 'byung bar bsam /	srad_0 bu_5 'byung_8 ba_15 bsam_19 
T02D1263:7a-26	de nas ye shes kyi thugs ka nas /	de_0 nas_3 ye_7 shes_10 kyi_15 thugs_19 ka_25 nas_28 
T02D1263:7a-27	ye shes kyi srad bu yod pa rnal 'byor pa'i nyi ma zla ba'i bar mig gi lcags kyus /	ye_0 shes_3 kyi_8 srad_12 bu_17 yod_20 ba_24 rnal_27 'byor_32 ba_38 nyi_43 ma_47 zla_50 ba_54 ba_59 mig_63 gi_67 lcags_70 kyus_76 
T02D1263:7a-28	gtso bo kye yi rdo rje dang /	gtso_0 'bo_5 kye_8 yi_12 rdo_15 rje_19 dang_23 
T02D1263:7a-29	sangs rgyas kun gyi mkha' 'gro ma //	sangs_0 rgya_6 kun_12 gyi_16 mkha'_20 'gro_26 ma_31 
T02D1263:7a-30	gtso bo sngags dang gnyis med rnams //	gtso_0 'bo_5 sngags_8 dang_15 gnyis_20 med_26 rnams_30 
T02D1263:7a-31	spyan drangs nas ni de la bstim //	spyan_0 drangs_6 nas_13 ni_17 de_20 la_23 stim_26 
T02D1263:7a-32	de ltar ye shes kyi thig skud bskyed nas /	de_0 ltar_3 ye_8 shes_11 kyi_16 thig_20 skud_25 skyed_30 nas_37 
T02D1263:7a-33	srad bu lnga gtso bo'i sngags brjod pas /	srad_0 bu_5 lnga_8 gtso_13 'bo_18 sngags_23 rjod_30 ba_36 
T02D1263:7a-34	gcig tu sgril lo //	gcig_0 tu_5 sgril_8 lo_14 
T02D1263:7a-35	aom badzra sa ma ya s'u tram /	aom_0 badzra_4 sa_11 ma_14 ya_17 s_20 tram_24 
T02D1263:7a-36	m'a ti kra ma h'um zhes pas brgya rtsa brgyad bzlas par bya'o //	m_0 ti_4 kra_7 ma_11 h_14 zhes_19 ba_24 brgya_28 rtsa_34 brgyad_39 bzlas_46 ba_52 byed_56 
T02D1263:7a-37	aom a'a: h'um gsum mtha' gnyis dang dbus su bkod la /	aom_0 a:_4 h_9 gsum_14 mtha'_19 gnyis_25 dang_31 dbus_36 su_41 bkod_44 la_49 
T02D1263:7a-38	byin gyis brlabs te /	byin_0 gyis_5 brlabs_10 te_17 
T02D1263:7a-39	de la mchod pa 'bul /	de_0 la_3 mchod_6 ba_12 'bul_15 
T02D1263:7a-40	de nas gtso bo'i thugs ka nas /	de_0 nas_3 gtso_7 'bo_12 thugs_17 ka_23 nas_26 
T02D1263:7a-41	srad bu 'dzin pa'i grogs po sprul la /	srad_0 bu_5 'dzin_8 ba_14 grogs_19 po_25 sprul_28 la_34 
T02D1263:7a-42	dza dza zhes brjod du bcug la gtad par bya'o //	dza_0 dza_4 zhes_8 rjod_13 du_19 'jug_22 la_27 gtod_30 ba_35 byed_39 
T02D1263:7a-43	dang por ni nam mkha' la thig gdab par bya'o //	dang_0 por_5 ni_9 nam_12 mkha'_16 la_22 thig_25 gdab_30 ba_35 byed_39 
T02D1263:7a-44	thig skud dag ni 'debs pa'i tshe //	thig_0 skud_5 'dag_10 ni_14 'debs_17 ba_23 tshe_28 
T02D1263:7a-45	'jig rten khams ni ma lus pa //	'jig_0 rten_5 khams_10 ni_16 ma_19 lus_22 ba_26 
T02D1263:7a-46	sangs rgyas la sogs 'gro don du //	sangs_0 rgya_6 la_12 sogs_15 'gro_20 don_25 du_29 
T02D1263:7a-47	khyed kyi don ni bya nus yin //	'khyed_0 kyi_6 don_10 ni_14 byed_17 nus_21 yin_25 
T02D1263:7a-48	zhes bskul zhing brjod do //	zhes_0 skul_5 zhing_11 rjod_17 do_23 
T02D1263:7a-49	de bzhin dus thig kyang gdab par bya ste /	de_0 bzhin_3 dus_9 thig_13 kyang_18 gdab_24 ba_29 byed_33 ste_37 
T02D1263:7a-50	slob dpon chu bdag tu 'dug la /	slob_0 dpon_5 chu_10 bdag_14 tu_19 'dug_22 la_27 
T02D1263:7b-0	slob ma brgya @7b byin du 'dug la tshangs thig gdab /	slob_0 ma_5 brgya_8 byin_18 du_23 'dug_26 la_31 tshangs_34 thig_42 gdab_47 
T02D1263:7b-1	slob dpon gshin rje'i phyogs su 'dug la /	slob_0 dpon_5 gshin_10 rje_16 phyogs_22 su_29 'dug_32 la_37 
T02D1263:7b-2	slob ma gnod sbyin du 'dug la tshangs thig gnyis pa gdab /	slob_0 ma_5 gnod_8 sbyin_13 du_19 'dug_22 la_27 tshangs_30 thig_38 gnyis_43 ba_49 gdab_52 
T02D1263:7b-3	slob dpon byin zar 'dug la /	slob_0 dpon_5 byin_10 zar_15 'dug_19 la_24 
T02D1263:7b-4	slob ma dbang ldan du 'dug la shar la gdab /	slob_0 ma_5 dbang_8 ldan_14 du_19 'dug_22 la_27 'char_30 la_35 gdab_38 
T02D1263:7b-5	slob dpon rlung gi phyogs su 'dug la /	slob_0 dpon_5 rlung_10 gi_16 phyogs_19 su_26 'dug_29 la_34 
T02D1263:7b-6	slob ma bden bral du 'dug la nub tu gdab /	slob_0 ma_5 bden_8 'bral_13 du_18 'dug_21 la_26 nub_29 tu_33 gdab_36 
T02D1263:7b-7	slob dpon de nyid du 'dug / slob ma dbang ldan du 'dug la byang du gdab /	slob_0 dpon_5 de_10 nyid_13 du_18 'dug_21 slob_28 ma_33 dbang_36 ldan_42 du_47 'dug_50 la_55 byang_58 du_64 gdab_67 
T02D1263:7b-8	slob dpon byin zar 'dug / slob ma bden bral du 'dug la lho ru gdab par bya'o //	slob_0 dpon_5 byin_10 zar_15 'dug_19 slob_26 ma_31 bden_34 'bral_39 du_44 'dug_47 la_52 lho_55 ru_59 gdab_62 ba_67 byed_71 
T02D1263:7b-9	srad bus yongs su thig gdab bya //	srad_0 'bud_5 yongs_9 su_15 thig_18 gdab_23 byed_28 
T02D1263:7b-10	srad bus gzhal bar mi bya ste //	srad_0 'bud_5 'jal_9 ba_15 mi_19 byed_22 ste_26 
T02D1263:7b-11	'phel 'grib gnyis kyi nyes yod pas //	'phel_0 'grib_6 gnyis_12 kyi_18 nyes_22 yod_27 ba_31 
T02D1263:7b-12	sra bas rab tu gzhal bar bya //	sra_0 ba_4 rab_8 tu_12 'jal_15 ba_21 byed_25 
T02D1263:7b-13	zhes 'byung bas /	zhes_0 'byung_5 ba_12 
T02D1263:7b-14	spa la sogs pa'i drang zhing sra ba la ka ti ka byas la /	spa_0 la_4 sogs_7 ba_12 'dren_17 zhing_23 sra_29 ba_33 la_36 ka_39 ti_42 ka_45 byed_48 la_53 
T02D1263:7b-15	thig rkang bzhi bcu rtsa gnyis phyogs re rer gdab par bya'o //	thig_0 rkang_5 bzhi_11 'chu_16 rtsa_20 gnyis_25 phyogs_31 re_38 rer_41 gdab_45 ba_50 byed_54 
T02D1263:7b-16	de ltar thig bzhi bcu rtsa gnyis btab la /	de_0 ltar_3 thig_8 bzhi_13 'chu_18 rtsa_22 gnyis_27 'debs_33 la_38 
T02D1263:7b-17	sgo khyud kyi thig tshun chad kyis ni /	sgo_0 khyud_4 kyi_10 thig_14 tshun_19 'chad_25 kyis_30 ni_35 
T02D1263:7b-18	padma'i lte ba la bskor bar bya'o //	padma_0 lte_8 ba_12 la_15 skor_18 ba_24 byed_28 
T02D1263:7b-19	padma'i ze ba bskor ba ni /	padma_0 ze_8 ba_11 skor_14 ba_20 ni_23 
T02D1263:7b-20	lha'i snam bu las ji tsam ran par bskor bar bya'o //	lha_0 snam_6 bu_11 las_14 ji_18 tsam_21 ran_26 ba_30 skor_34 ba_40 byed_44 
T02D1263:7b-21	dkyil 'khor gyi mthar rdo rje ra ba dang /	dkyil_0 'khor_6 gyi_12 mthar_16 rdo_22 rje_26 ra_30 ba_33 dang_36 
T02D1263:7b-22	me 'od gnyis las cha re re bskor /	me_0 'od_3 gnyis_7 las_13 cha_17 re_21 re_24 skor_27 
T02D1263:7b-23	rta babs kyi snam bu bzhi'i phyogs nas cha phyed /	rta_0 'bab_4 kyi_9 snam_13 bu_18 bzhi_21 phyogs_28 nas_35 cha_39 phyed_43 
T02D1263:7b-24	logs kyi cha chen bzhi la /	logs_0 kyi_5 cha_9 chen_13 bzhi_18 la_23 
T02D1263:7b-25	gcig chos kyi 'khor lo /	gcig_0 chos_5 kyi_10 'khor_14 lo_20 
T02D1263:7b-26	gcig la rdo rje rgya gram gyi ra dbu ma de'i sna padma'i sdong po la gtad par bya'o //	gcig_0 la_5 rdo_8 rje_12 rgya_16 'grams_21 gyi_26 ra_30 dbu_33 ma_37 de_40 sna_45 padma_49 sdong_57 po_63 la_66 gtod_69 ba_74 byed_78 
T02D1263:7b-27	de nas bla mas dkyil 'khor gyi dbus su 'dug la /	de_0 nas_3 bla_7 mas_11 dkyil_15 'khor_21 gyi_27 dbus_31 su_36 'dug_39 la_44 
T02D1263:7b-28	mig gnyis la nyi ma dang zla ba'i dkyil 'khor bsams la /	mig_0 gnyis_4 la_10 nyi_13 ma_17 dang_20 zla_25 ba_29 dkyil_34 'khor_40 bsams_46 la_52 
T02D1263:7b-29	bzlog la blta zhing /	bzlog_0 la_6 lta_9 zhing_14 
T02D1263:7b-30	hi hi zhes pas sgo dbye bar bsam /	hi_0 hi_3 zhes_6 ba_11 sgo_15 'byed_19 ba_24 bsam_28 
T02D1263:7b-31	de nas badzra be la zhes brjod la /	de_0 nas_3 badzra_7 be_14 la_17 zhes_20 rjod_25 la_31 
T02D1263:7b-32	phyir byung de nas thig gdab pa'i las zin nas /	phyir_0 'byung_6 de_12 nas_15 thig_19 gdab_24 ba_29 las_34 zin_38 nas_42 
T02D1263:7b-33	ye shes skud pa la mchod pas mchod la /	ye_0 shes_3 skud_8 ba_13 la_16 mchod_19 ba_25 mchod_29 la_35 
T02D1263:7b-34	sarba ma ra ta rtsi pa ra aartha rtsa /	sarba_0 ma_6 ra_9 ta_12 rtsi_15 ba_20 ra_23 aartha_26 rtsa_33 
T02D1263:7b-35	sa ti ta ta gatstsha zhes brjod la lha gshegs su gsol lo //	sa_0 ti_3 ta_6 ta_9 gatstsha_12 zhes_21 rjod_26 la_32 lha_35 gshegs_39 su_46 gsol_49 lo_54 
T02D1263:7b-36	ye shes kyi thig gdab pa'i rim pa'o /	ye_0 shes_3 kyi_8 thig_12 gdab_17 ba_22 rim_27 ba_31 
T02D1263:7b-38	// / de nas 'bras la kha dog bsgyur ba legs pa tshon gyi rim par bzhag la /	de_5 nas_8 'bras_12 la_18 kha_21 dog_25 sgyur_29 ba_36 legs_39 ba_44 tshon_47 gyi_53 rim_57 ba_61 'jog_65 la_71 
T02D1263:7b-39	de la rang bzhin med par byas la /	de_0 la_3 rang_6 bzhin_11 med_17 ba_21 byed_25 la_30 
T02D1263:7b-40	bhr'um aam dzr'am kham h'um lngar bsgyur bar bsam /	bhr_0 aam_7 dzr_11 kham_18 h_23 lngar_28 sgyur_34 ba_41 bsam_45 
T02D1263:7b-41	de yongs su gyur pa las chon sna lngar 'byung bar bsam /	de_0 yongs_3 su_9 gyur_12 ba_17 las_20 chon_24 sna_29 lngar_33 'byung_39 ba_46 bsam_50 
T02D1263:7b-42	de nas rnal 'byor pa'i nyi zla'i 'bar mig lcags kyus /	de_0 nas_3 rnal_7 'byor_12 ba_18 nyi_23 zla_27 'bar_33 mig_38 lcags_42 kyus_48 
T02D1263:8a-0	kye'i rdo rje @8a * //	kye_0 rdo_6 rje_10 
T02D1263:8a-1	mkha' 'gro ma 'khor dang bcas pa rnams spyan drangs nas tshon la thim par bsam /	mkha'_0 'gro_6 ma_11 'khor_14 dang_20 'cha'_25 ba_30 rnams_33 spyan_39 drangs_45 nas_52 tshon_56 la_62 'thim_65 ba_70 bsam_74 
T02D1263:8a-2	aom badzra tsi tr'a sa ma ya h'um /	aom_0 badzra_4 tsi_11 tr_15 sa_20 ma_23 ya_26 h_29 
T02D1263:8a-3	zhes lan mang du bzlas la /	zhes_0 lan_5 mang_9 du_14 bzlas_17 la_23 
T02D1263:8a-4	sa tshon la mchod pa 'bul /	sa_0 tshon_3 la_9 mchod_12 ba_18 'bul_21 
T02D1263:8a-5	byang shar mtshams nas /	byang_0 'char_6 mtshams_11 nas_19 
T02D1263:8a-6	bla ma'i rim pa bzhin du nag po /	bla_0 ma_4 rim_9 ba_13 bzhin_16 du_22 nag_25 po_29 
T02D1263:8a-7	dkar po /	dkar_0 po_5 
T02D1263:8a-8	ser po /	ser_0 po_4 
T02D1263:8a-9	dmar po /	dmar_0 po_5 
T02D1263:8a-10	ljang gu'i re kh'a lnga po mnyam por mtho gang du drangs la mchod pa dbul /	ljang_0 gu_6 re_11 kh_14 lnga_19 po_24 mnyam_27 por_33 mtho_37 gang_42 du_47 drangs_50 la_57 mchod_60 ba_66 'bul_69 
T02D1263:8a-11	re kh'a la me tog sil ma gtor /	re_0 kh_3 la_8 me_11 tog_14 sil_18 ma_22 'thor_25 
T02D1263:8a-12	de nas re kh'a 'dren khar bla mas 'di skad brjod do //	de_0 nas_3 re_7 kh_10 bgrang_15 khar_21 bla_26 mas_30 'di_34 skad_38 rjod_43 do_49 
T02D1263:8a-13	'di ni chos dbyings dag pa ste /	'di_0 ni_4 chos_7 dbyings_12 'dag_20 ba_24 ste_27 
T02D1263:8a-14	sems can khams ni sgrol byed pa //	sems_0 can_5 khams_9 ni_15 sgrol_18 byed_24 ba_29 
T02D1263:8a-15	dpal ldan khrag 'thung rgyal po nyid //	dpal_0 ldan_5 khrag_10 'thung_16 rgyal_23 po_29 nyid_32 
T02D1263:8a-16	de bzhin gshegs pa kun gyi gnas /	de_0 bzhin_3 gshegs_9 ba_16 kun_19 gyi_23 gnas_27 
T02D1263:8a-17	zhes so //	zhes_0 so_5 
T02D1263:8a-18	nyes pa kun las rnam grol bas //	nyes_0 ba_5 kun_8 las_12 rnam_16 grol_21 ba_26 
T02D1263:8a-19	tshon gyi las ni yang dag brtsam //	tshon_0 gyi_6 las_10 ni_14 yang_17 'dag_22 brtsam_26 
T02D1263:8a-20	slob dpon gyis ni dang po dbye //	slob_0 dpon_5 gyis_10 ni_15 dang_18 po_23 'byed_26 
T02D1263:8a-21	phyi nas kun du slob mas so //	phyi_0 nas_5 kun_9 du_13 slob_16 mas_21 so_25 
T02D1263:8a-22	zhes 'byung ngo //	zhes_0 'byung_5 ngo_12 
T02D1263:8a-23	mthe chung dang ni mthe bo sangs //	mthe_0 chung_5 dang_11 ni_16 mthe_19 'bo_24 sangs_27 
T02D1263:8a-24	drang la 'tho [?] bar yang dag bri //	'dren_0 la_6 'tho_9 ba_18 yang_22 'dag_27 'bri_31 
T02D1263:8a-25	gal te ri mo mi mnyam na //	gal_0 te_4 ri_7 mo_10 mi_13 mnyam_16 na_22 
T02D1263:8a-26	yo zhing dma' dang bcas pa dang //	yo_0 zhing_3 dma'_9 dang_14 'cha'_19 ba_24 dang_27 
T02D1263:8a-27	ri mo dma' bas mi 'grub cing //	ri_0 mo_3 dma'_6 ba_11 mi_15 'grub_18 cing_24 
T02D1263:8a-28	yon pos gdung ba skyed par byed //	yon_0 pos_4 gdung_8 ba_14 skyed_17 ba_23 byed_27 
T02D1263:8a-29	chad pas slob dpon slob ma dang //	'chad_0 ba_5 slob_9 dpon_14 slob_19 ma_24 dang_27 
T02D1263:8a-30	gnyis ka 'chi bar shes par bya //	gnyis_0 ka_6 'chi_9 ba_14 shes_18 ba_23 byed_27 
T02D1263:8a-31	zhes 'byung bas //	zhes_0 'byung_5 ba_12 
T02D1263:8a-32	shin tu gzab par bya'o //	shin_0 tu_5 gzab_8 ba_13 byed_17 
T02D1263:8a-33	de nas gzhung dang mthun par tshul bzhin du dkyil 'khor bri bar bya'o //	de_0 nas_3 gzhung_7 dang_14 mthun_19 ba_25 tshul_29 bzhin_35 du_41 dkyil_44 'khor_50 'bri_56 ba_60 byed_64 
T02D1263:8a-34	de ni tshon dgye ba'i rim pa'o /	de_0 ni_3 tshon_6 dgye_12 ba_17 rim_22 ba_26 
T02D1263:8a-36	// / de ltar dkyil 'khor bris nas /	de_5 ltar_8 dkyil_13 'khor_19 'bri_25 nas_30 
T02D1263:8a-37	da ni phyag rgya dgod par bya'o //	da_0 ni_3 phyag_6 rgya_12 'god_17 ba_22 byed_26 
T02D1263:8a-38	dbus kyi lte bar bdud bzhi bsnol ba dang /	dbus_0 kyi_5 lte_9 ba_13 bdud_17 bzhi_22 snol_27 ba_33 dang_36 
T02D1263:8a-39	nyi ma'i dkyil 'khor gyi steng du na ra ka	nyi_0 ma_4 dkyil_9 'khor_15 gyi_21 steng_25 du_31 na_34 ra_37 ka_40 
T02D1263:8a-40	p'a la rdo rje rgya gram dang bcas pa dkar	p_0 la_4 rdo_7 rje_11 rgya_15 'grams_20 dang_25 'cha'_30 ba_35 dkar_38 
T02D1263:8a-41	po bri / shar du gri gug nag po bri /	po_0 'bri_3 'char_9 du_14 gri_17 gug_21 nag_25 po_29 'bri_32 
T02D1263:8a-42	lho ru da ma ru dmar skya /	lho_0 ru_4 da_7 ma_10 ru_13 dmar_16 skya_21 
T02D1263:8a-43	nub tu rus sbal dmar ser /	nub_0 tu_4 rus_7 sbal_11 dmar_16 ser_21 
T02D1263:8a-44	byang du sbrul ljang gu /	byang_0 du_6 sbrul_9 ljang_15 gu_21 
T02D1263:8a-45	byang shar du seng ge dmar sngon /	byang_0 'char_6 du_11 seng_14 ge_19 dmar_22 sngon_27 
T02D1263:8a-46	shar lhor dge slong dkar po /	'char_0 lhor_5 dge_10 slong_14 dkar_20 po_25 
T02D1263:8a-47	lho nub tu 'khor lo ljang sngon /	lho_0 nub_4 tu_8 'khor_11 lo_17 ljang_20 sngon_26 
T02D1263:8a-48	nub byang du rdo rje khra bo rnam par dgod do //	nub_0 byang_4 du_10 rdo_13 rje_17 khra_21 'bo_26 rnam_29 ba_34 'god_38 do_43 
T02D1263:8a-49	de ltar phyag rgya dgod tsam na /	de_0 ltar_3 phyag_8 rgya_14 'god_19 tsam_24 na_29 
T02D1263:8a-50	yang lha so so'i rang gi snying po brjod cing dgod /	yang_0 lha_5 so_9 so_12 rang_17 gi_22 snying_25 po_32 rjod_35 cing_41 'god_46 
T02D1263:8a-51	bum pa rnam pa brgyad kyang shar la sogs pa'i gnas su bris pa'am /	bum_0 ba_4 rnam_7 ba_12 brgyad_15 kyang_22 'char_28 la_33 sogs_36 ba_41 gnas_46 su_51 'bri_54 ba_59 
T02D1263:8a-52	dgod par bya'o //	'god_0 ba_5 byed_9 
T02D1263:8a-53	phyag rgya dgod pa'i rim pa'o //	phyag_0 rgya_6 'god_11 ba_16 rim_21 ba_25 
T02D1263:8a-54	de nas bla re dam pa bre ba dang /	de_0 nas_3 bla_7 re_11 dam_14 ba_18 'bre_21 ba_25 dang_28 
T02D1263:8a-55	gzhan yang rgyan thams cad bri zhing dgram par bya /	gzhan_0 yang_6 rgyan_11 thams_17 cad_23 'bri_27 zhing_31 'grem_37 ba_43 byed_47 
T02D1263:8b-0	phyi rol du phyogs skyong gi gtor ma rnams @8b btsugs la /	phyi_0 rol_5 du_9 phyogs_12 skyong_19 gi_26 'thor_29 ma_34 rnams_37 btsugs_47 la_54 
T02D1263:8b-1	phyogs skyong sa bon las bskyed la /	phyogs_0 skyong_7 sa_14 bon_17 las_21 skyed_25 la_32 
T02D1263:8b-2	de la spyan drangs la bstims la bzhag / de nas bum pa rnams thogs la /	de_0 la_3 spyan_6 drangs_12 la_19 stim_22 la_29 'jog_32 de_40 nas_43 bum_47 ba_51 rnams_54 thogs_60 la_66 
T02D1263:8b-3	spos kyis sna drangs la rol mo'i cha byang sna tshogs la /	spros_0 kyis_5 sna_10 drangs_14 la_21 rol_24 mo_28 cha_33 byang_37 sna_43 tshogs_47 la_54 
T02D1263:8b-4	dkyil 'khor lan gsum du bskor la tshul bzhin du dgod /	dkyil_0 'khor_6 lan_12 gsum_16 du_21 skor_24 la_30 tshul_33 bzhin_39 du_45 'god_48 
T02D1263:8b-5	las thams cad pa byang shar mtshams su dgod /	las_0 thams_4 cad_10 ba_14 byang_17 'char_23 mtshams_28 su_36 'god_39 
T02D1263:8b-6	de nas dgongs ka'i dus su /	de_0 nas_3 dgongs_7 ka_14 dus_19 su_23 
T02D1263:8b-7	bla ma rgyan chas dgod khrus bya /	bla_0 ma_4 rgyan_7 cha_13 'god_18 'khru_23 byed_29 
T02D1263:8b-8	lus dri zhim pos bsgo /	lus_0 'dri_4 zhim_8 pos_13 sgo_17 
T02D1263:8b-9	dkyil 'khor gyi 'gram du chag chag gdab /	dkyil_0 'khor_6 gyi_12 'grams_16 du_22 'chag_25 'chag_30 gdab_35 
T02D1263:8b-10	de nas stan bde ba la 'dug la /	de_0 nas_3 stan_7 bde_12 ba_16 la_19 'dug_22 la_27 
T02D1263:8b-11	tsandal'i dang lhan cig bsgrub par bya /	tsandal_0 dang_10 lhan_15 cig_20 sgrub_24 ba_31 byed_35 
T02D1263:8b-12	med na ting nge 'dzin gyis bya /	med_0 na_4 ting_7 nge_12 'dzin_16 gyis_22 byed_27 
T02D1263:8b-13	de nas bla ma la yan lag drug dang ldan pa lha'i 'khor lo tshul bzhin du bskyed la /	de_0 nas_3 bla_7 ma_11 la_14 yan_17 lag_21 drug_25 dang_30 ldan_35 ba_40 lha_43 'khor_49 lo_55 tshul_58 bzhin_64 du_70 skyed_73 la_80 
T02D1263:8b-14	de nas goo r'i la bka' bsgo ba la lha	de_0 nas_3 goo_7 r_11 la_15 bka'_18 sgo_23 ba_28 la_31 lha_34 
T02D1263:8b-15	rnams spyan drangs pa de la mchod pa rnams 'bul	rnams_0 spyan_6 drangs_12 ba_19 de_22 la_25 mchod_28 ba_34 rnams_37 'bul_43 
T02D1263:8b-16	/ de nas gzhug pa dang /	de_2 nas_5 'jug_9 ba_15 dang_18 
T02D1263:8b-17	bcing ba dang /	'ching_0 ba_6 dang_9 
T02D1263:8b-18	dgyes pa bskyed pa rnams byas la /	dgyes_0 ba_6 skyed_9 ba_16 rnams_19 byed_25 la_30 
T02D1263:8b-19	gnyis su med par bstim /	gnyis_0 su_6 med_9 ba_13 stim_17 
T02D1263:8b-20	de la mchod pa rnams dbul bar bya ste /	de_0 la_3 mchod_6 ba_12 rnams_15 'bul_21 ba_26 byed_30 ste_34 
T02D1263:8b-21	proksha na dang /	proksha_0 na_8 dang_11 
T02D1263:8b-22	aargha dang /	aargha_0 dang_7 
T02D1263:8b-23	aanytsa m'a nam dang /	aanytsa_0 m_8 nam_12 dang_16 
T02D1263:8b-24	bi dhi dang /	bi_0 dhi_3 dang_7 
T02D1263:8b-25	spos dang /	spros_0 dang_5 
T02D1263:8b-26	me tog la sogs pa dang /	me_0 tog_3 la_7 sogs_10 ba_15 dang_18 
T02D1263:8b-27	lha mo brgyad kyi mchod pas mchod /	lha_0 mo_4 brgyad_7 kyi_14 mchod_18 ba_24 mchod_28 
T02D1263:8b-28	ras dang /	ras_0 dang_4 
T02D1263:8b-29	tsandan dang /	tsandan_0 dang_8 
T02D1263:8b-30	gur gum char du 'bab pa dang /	gur_0 'gum_4 char_8 du_13 'bab_16 ba_21 dang_24 
T02D1263:8b-31	sna tshogs pa'i mchod pas mchod /	sna_0 tshogs_4 ba_11 mchod_16 ba_22 mchod_26 
T02D1263:8b-32	de nas bdud rtsi mchod pas kyang rim bzhin du mchod /	de_0 nas_3 bdud_7 rtsi_12 mchod_17 ba_23 kyang_27 rim_33 bzhin_37 du_43 mchod_46 
T02D1263:8b-33	de nas bstod pa nyi shu pas lha rnams la bstod par bya'o //	de_0 nas_3 bstod_7 ba_13 nyi_16 shu_20 ba_24 lha_28 rnams_32 la_38 bstod_41 ba_47 byed_51 
T02D1263:8b-34	sna tshogs pa'i glu dang bkra shis kyi glu'i rnam pas kyang mchod /	sna_0 tshogs_4 ba_11 glu_16 dang_20 bkra_25 shis_30 kyi_35 glu_39 rnam_45 ba_50 kyang_54 mchod_60 
T02D1263:8b-35	ga na tsakra tshogs kyi 'khor lo chen po bskor /	ga_0 na_3 tsakra_6 tshogs_13 kyi_20 'khor_24 lo_30 chen_33 po_38 skor_41 
T02D1263:8b-36	smon lam gyi tshogs brjod /	smon_0 lam_5 gyi_9 tshogs_13 rjod_20 
T02D1263:8b-37	bskor ba lan gsum byas /	skor_0 ba_6 lan_9 gsum_13 byed_18 
T02D1263:8b-38	gtor ma dgu yang 'bul lo /	'thor_0 ma_5 dgu_8 yang_12 'bul_17 lo_22 
T02D1263:8b-40	// / di na mar dbang bskur ba la 'jug par bya ste /	na_8 mar_11 dbang_15 skur_21 ba_27 la_30 'jug_33 ba_38 byed_42 ste_46 
T02D1263:8b-41	slob ma 'jug pa'i rim pa bzhin du /	slob_0 ma_5 'jug_8 ba_13 rim_18 ba_22 bzhin_25 du_31 
T02D1263:8b-42	slob dpon rang nyid dang la 'jug par bya'o //	slob_0 dpon_5 rang_10 nyid_15 dang_20 la_25 'jug_28 ba_33 byed_37 
T02D1263:8b-43	de nas sngon du brtags pa'i slob ma mtshan dang ldan pas 'di skad brjod par bya'o //	de_0 nas_3 sngon_7 du_13 rtog_16 ba_23 slob_28 ma_33 mtshan_36 dang_43 ldan_48 ba_53 'di_57 skad_61 rjod_66 ba_72 byed_76 
T02D1263:8b-44	sangs rgyas kun gyi rang bzhin sku //	sangs_0 rgya_6 kun_12 gyi_16 rang_20 bzhin_25 sku_31 
T02D1263:8b-45	slob dpon la ni skyabs su mchi //	slob_0 dpon_5 la_10 ni_13 skyob_16 su_23 mchi_26 
T02D1263:8b-46	gtso bo lha mor bcas pa yi //	gtso_0 'bo_5 lha_8 mor_12 'cha'_16 ba_21 yi_24 
T02D1263:8b-47	lha rnams la yang phyag 'tshal lo //	lha_0 rnams_4 la_10 yang_13 phyag_18 'tshal_24 lo_31 
T02D1263:8b-48	thar pa chen po'i grong mchog tu //	thar_0 ba_5 chen_8 po_13 grong_18 mchog_24 tu_30 
T02D1263:8b-49	mgon pos bdag ni gzhug par gsol //	mgon_0 pos_5 bdag_9 ni_14 'jug_17 ba_23 gsol_27 
T02D1263:8b-50	zhes slob dpon la gsol ba gdab par bya'o //	zhes_0 slob_5 dpon_10 la_15 gsol_18 ba_23 gdab_26 ba_31 byed_35 
T02D1263:9a-0	de nas slob dpon gyis 'di skad @9a * //	de_0 nas_3 slob_7 dpon_12 gyis_17 'di_22 skad_26 
T02D1263:9a-1	brjod do //	rjod_0 do_6 
T02D1263:9a-2	de bzhin gshegs pa kun gyi gnas //	de_0 bzhin_3 gshegs_9 ba_16 kun_19 gyi_23 gnas_27 
T02D1263:9a-3	he ru ka dpal grong khyer mchog / snying po'i dkyil 'khor 'di ru ni //	he_0 ru_3 ka_6 dpal_9 grong_14 'khyer_20 mchog_26 snying_34 po_41 dkyil_46 'khor_52 'di_58 ru_62 ni_65 
T02D1263:9a-4	bdag gis slob ma gzhug par bgyi //	bdag_0 gis_5 slob_9 ma_14 'jug_17 ba_23 bgyid_27 
T02D1263:9a-5	de nas dkyil 'khor gyi lha la lus ngag yid kyi sgo nas phyag 'tshal bar bya ste /	de_0 nas_3 dkyil_7 'khor_13 gyi_19 lha_23 la_27 lus_30 ngag_34 yid_39 kyi_43 sgo_47 nas_51 phyag_55 'tshal_61 ba_68 byed_72 ste_76 
T02D1263:9a-6	aom na ma: te h'um /	aom_0 na_4 ma:_7 te_11 h_14 
