T02D1270:84b-27	sna'i skye mched dang /	sna_0 skye_6 mched_11 dang_17 
T02D1270:84b-28	nga rgyal chen po dag pa'i sangs rgyas kyis mnyam	nga_0 rgyal_4 chen_10 po_15 'dag_18 ba_22 sangs_27 rgya_33 kyis_39 mnyam_44 
T02D1270:84b-29	pa nyid kyi ye shes ni gsang ba'i goo r'i	ba_0 nyid_3 kyi_8 ye_12 shes_15 ni_20 gsang_23 ba_29 goo_34 r_38 
T02D1270:84b-30	ma'o // 'du shes kyi phung po dang lce'i dbang po dang /	ma_0 'du_8 shes_12 kyi_17 'phung_21 po_27 dang_30 lce_35 dbang_41 po_47 dang_50 
T02D1270:84b-31	'dod chags chen po rnam par dag pa'i sangs rgyas	'dod_0 chags_5 chen_11 po_16 rnam_19 ba_24 'dag_28 ba_32 sangs_37 rgya_43 
T02D1270:84b-32	kyis so sor rtog pa'i ye shes kyi rang bzhin	kyis_0 so_5 sor_8 rtogs_12 ba_17 ye_22 shes_25 kyi_30 rang_34 bzhin_39 
T02D1270:84b-33	ni chu'i rnal 'byor ma'o //	ni_0 chu_3 rnal_9 'byor_14 ma_20 
T02D1270:84b-34	'du byed kyi phung po dang lus kyi skye mched	'du_0 byed_4 kyi_9 'phung_13 po_19 dang_22 lus_27 kyi_31 skye_35 mched_40 
T02D1270:84b-35	dang phrag dog chen po dag pa'i sangs rgyas kyis	dang_0 phrag_5 dog_11 chen_15 po_20 'dag_23 ba_27 sangs_32 rgya_38 kyis_44 
T02D1270:84b-36	bya ba grub pa'i ye shes kyi rang bzhin ni	byed_0 ba_4 'grub_7 ba_12 ye_17 shes_20 kyi_25 rang_29 bzhin_34 ni_40 
T02D1270:84b-37	rdo rje mkha' 'gro ma'o //	rdo_0 rje_4 mkha'_8 'gro_14 ma_19 
T02D1270:84b-38	rnam par shes pa'i phung po dang /	rnam_0 ba_5 shes_9 ba_14 'phung_19 po_25 dang_28 
T02D1270:84b-39	yid kyi skye mched dang zhe sdang chen po dag	yid_0 kyi_4 skye_8 mched_13 dang_19 zhe_24 sdang_28 chen_34 po_39 'dag_42 
T02D1270:84b-40	pa'i sangs rgyas kyi sa chos kyi dbyings kyi ye	ba_0 sangs_5 rgya_11 kyi_17 sa_21 chos_24 kyi_29 dbyings_33 kyi_41 ye_45 
T02D1270:84b-41	shes rang bzhin ni bdag med ma'o //	shes_0 rang_5 bzhin_10 ni_16 bdag_19 med_24 ma_28 
T02D1270:84b-42	de dag ni lha'i de kho na nyid do //	de_0 'dag_3 ni_7 lha_10 de_16 kho_19 na_23 nyid_26 do_31 
T02D1270:85a-0	phyi dang nang gi sa yongs su sbyang ba la sogs pa ni @85a * //	phyi_0 dang_5 nang_10 gi_15 sa_18 yongs_21 su_27 sbyong_30 ba_37 la_40 sogs_43 ba_48 ni_51 
T02D1270:85a-1	slob dpon gyi las dang bya ba'o //	slob_0 dpon_5 gyi_10 las_14 dang_18 byed_23 ba_27 
T02D1270:85a-2	de nas dam tshig gsum dang ldan pa ni rdo	de_0 nas_3 dam_7 tshig_11 gsum_17 dang_22 ldan_27 ba_32 ni_35 rdo_38 
T02D1270:85a-3	rje brtul zhugs kyi snod du rung ba yin te	rje_0 brtul_4 'jug_10 kyi_16 snod_20 du_25 rung_28 ba_33 yin_36 te_40 
T02D1270:85a-4	/ rdo rjer byin gyis brlabs nas /	rdo_2 rjer_6 byin_11 gyis_16 brlabs_21 nas_28 
T02D1270:85a-5	sangs rgyas kun gyis bsngags pa yi //	sangs_0 rgya_6 kun_12 gyis_16 bsngags_21 ba_29 yi_32 
T02D1270:85a-6	ye shes lnga ldan rdo rje ni //	ye_0 shes_3 lnga_8 ldan_13 rdo_18 rje_22 ni_26 
T02D1270:85a-7	khyod la yang dag sbyin par bya //	khyod_0 la_6 yang_9 'dag_14 sbyin_18 ba_24 byed_28 
T02D1270:85a-8	h'um gis thugs kar yang dag gzung //	h_0 gis_5 thugs_9 kar_15 yang_19 'dag_24 gzung_28 
T02D1270:85a-9	gsung rnams sgra brnyan lta bu ste //	gsung_0 rnams_6 sgra_12 rnyan_17 lta_24 bu_28 ste_31 
T02D1270:85a-10	rtog pa med pas sna tshogs sgra //	rtogs_0 ba_5 med_8 ba_12 sna_16 tshogs_20 sgra_27 
T02D1270:85a-11	brjod pa'i yul las rnam par 'das //	rjod_0 ba_6 yul_11 las_15 rnam_19 ba_24 'da'_28 
T02D1270:85a-12	dril bu gsung gi rang bzhin te //	'dril_0 bu_5 gsung_8 gi_14 rang_17 bzhin_22 te_28 
T02D1270:85a-13	de ni khyod kyis gzung bar gyis //	de_0 ni_3 khyod_6 kyis_12 gzung_17 ba_23 gyis_27 
T02D1270:85a-14	'di ni gsung gi dam tshig pas //	'di_0 ni_4 gsung_7 gi_13 dam_16 tshig_20 ba_26 
T02D1270:85a-15	yi ge shes a'a: yis yang dag gzung //	yi_0 ge_3 shes_6 a:_11 yis_16 yang_20 'dag_25 gzung_29 
T02D1270:85a-16	thabs dang shes rab bdag nyid rgyud //	thabs_0 dang_6 shes_11 rab_16 bdag_20 nyid_25 brgyud_30 
T02D1270:85a-17	mi phyed rdo rje'i ngo bo nyid //	mi_0 phyed_3 rdo_9 rje_13 ngo_19 'bo_23 nyid_26 
T02D1270:85a-18	'khyud pa phyag rgya chen po ste //	'khyud_0 ba_7 phyag_10 rgya_16 chen_21 po_26 ste_29 
T02D1270:85a-19	'di ni sku yi dam tshig yin //	'di_0 ni_4 sku_7 yi_11 dam_14 tshig_18 yin_24 
T02D1270:85a-20	yi ge aom gyis yang dag gzung //	yi_0 ge_3 aom_6 gyis_10 yang_15 'dag_20 gzung_24 
T02D1270:85a-21	de ltar dam tshig gsum ldan na //	de_0 ltar_3 dam_8 tshig_12 gsum_18 ldan_23 na_28 
T02D1270:85a-22	rdo rje'i brtul zhugs sbyin par bya //	rdo_0 rje_4 brtul_10 'jug_16 sbyin_22 ba_28 byed_32 
T02D1270:85a-23	yi ge h'um las skyes pa yi //	yi_0 ge_3 h_6 las_11 skye_15 ba_21 yi_24 
T02D1270:85a-24	rgyu 'bras rdo rje sems rang bzhin //	rgyu_0 'bras_5 rdo_11 rje_15 sems_19 rang_24 bzhin_29 
T02D1270:85a-25	cho ga tshang nas slob ma sbyin //	cho_0 ga_4 tshang_7 nas_14 slob_18 ma_23 sbyin_26 
T02D1270:85a-26	'di ni sangs rgyas thams cad kyi //	'di_0 ni_4 sangs_7 rgya_13 thams_19 cad_25 kyi_29 
T02D1270:85a-27	rdo rje sems dpa'i lag na gnas //	rdo_0 rje_4 sems_8 dpa_13 lag_19 na_23 gnas_26 
T02D1270:85a-28	khyod kyis kyang ni rtag tu 'chang //	khyod_0 kyis_6 kyang_11 ni_17 rtag_20 tu_25 'chang_28 
T02D1270:85a-29	rdo rje sems dpa'i brtul zhugs brtan //	rdo_0 rje_4 sems_8 dpa_13 brtul_19 'jug_25 brtan_31 
T02D1270:85a-30	thog mtha' med pa'i sems dpa' ni //	thogs_0 mtha'_5 med_11 ba_15 sems_20 dpa'_25 ni_30 
T02D1270:85a-31	rdo rje sems dpa'i dga' ba che //	rdo_0 rje_4 sems_8 dpa_13 dga'_19 ba_24 che_27 
T02D1270:85a-32	kun du bzang po kun bdag nyid //	kun_0 du_4 bzang_7 po_13 kun_16 bdag_20 nyid_25 
T02D1270:85a-33	rdo rje snyems tshul bdag po'i bdag / khyod kyis rtag tu 'chang bar gyis //	rdo_0 rje_4 snyems_8 tshul_15 bdag_21 po_26 bdag_31 khyod_38 kyis_44 rtag_49 tu_54 'chang_57 ba_64 gyis_68 
T02D1270:85a-34	'di dag brjod nas slob ma'i lag tu sbyin par bya'o //	'di_0 'dag_4 rjod_8 nas_14 slob_18 ma_23 lag_28 tu_32 sbyin_35 ba_41 byed_45 
T02D1270:85a-35	aom sarba ta th'a ga ta siddhi badzra sa ma ya ae sha tvam dh'a ra ya mi /	aom_0 sarba_4 ta_10 th_13 ga_18 ta_21 siddhi_24 badzra_31 sa_38 ma_41 ya_44 ae_47 sha_50 tvam_54 dh_59 ra_64 ya_67 mi_70 
T02D1270:85a-36	hi hi hi hi h'um /	hi_0 hi_3 hi_6 hi_9 h_12 
T02D1270:85a-37	'dis rdo rje 'dzin du gzhug ste rdo rje brtul zhugs brtan pha'o //	'dis_0 rdo_5 rje_9 'dzin_13 du_19 'jug_22 ste_28 rdo_32 rje_36 brtul_40 'jug_46 brtan_52 pha_58 
T02D1270:85a-38	'di de sangs rgyas thams cad kyi //	'di_0 de_4 sangs_7 rgya_13 thams_19 cad_25 kyi_29 
T02D1270:85a-39	shes rab sgra yi rjes 'gror bshad //	shes_0 rab_5 sgra_9 yi_14 rjes_17 'gror_22 'chad_28 
T02D1270:85a-40	khyod kyis kyang ni rtag tu 'chang //	khyod_0 kyis_6 kyang_11 ni_17 rtag_20 tu_25 'chang_28 
T02D1270:85a-41	byang chub mchog tu rgyal bas bzhed //	byang_0 chub_6 mchog_11 tu_17 rgyal_20 ba_26 bzhed_30 
T02D1270:85a-42	chos kyi sgra ni khyod kyis sgrogs //	chos_0 kyi_5 sgra_9 ni_14 khyod_17 kyis_23 sgrogs_28 
T02D1270:85a-43	srid pa rang bzhin gyis dag phyir //	srid_0 ba_5 rang_8 bzhin_13 gyis_19 'dag_24 phyir_28 
T02D1270:85a-44	ngo bo med pa dngos med byas //	ngo_0 'bo_4 med_7 ba_11 dngos_14 med_20 byed_24 
T02D1270:85a-45	rang bzhin dag la sems pa rnams //	rang_0 bzhin_5 'dag_11 la_15 sems_18 ba_23 rnams_26 
T02D1270:85a-46	dam pa srid pa byed par shog / de dag gis ni rdo rje'i brtul zhugs sbyin te /	dam_0 ba_4 srid_7 ba_12 byed_15 ba_20 shog_24 de_31 'dag_34 gis_38 ni_42 rdo_45 rje_49 brtul_55 'jug_61 sbyin_67 te_73 
T02D1270:85a-47	dril bu'i de kho na nyid 'dzin du bcug la dkrol bar bya'o //	'dril_0 bu_5 de_10 kho_13 na_17 nyid_20 'dzin_25 du_31 'jug_34 la_39 'khrol_42 ba_48 byed_52 
T02D1270:85a-48	de nas lhag pa'i lha'i phyag rgyas phyag rgya chen por byin gyis brlabs la /	de_0 nas_3 lhag_7 ba_12 lha_17 phyag_23 rgya_29 phyag_35 rgya_41 chen_46 por_51 byin_55 gyis_60 brlabs_65 la_72 
T02D1270:85b-0	gzugs @85b sogs sku yi dam tshig gis //	gzugs_0 sogs_11 sku_16 yi_20 dam_23 tshig_27 gis_33 
T02D1270:85b-1	gsang sngags ma tshang med par bzla //	gsang_0 sngags_6 ma_13 tshang_16 med_23 ba_27 bzla_31 
T02D1270:85b-2	rang gi rig pa'i ngo bo ste //	rang_0 gi_5 rig_8 ba_12 ngo_17 'bo_21 ste_24 
T02D1270:85b-3	phyogs bcu dus gsum bzhugs pa yi / khyod kyis aom gyis gzung bar gyis //	phyogs_0 'chu_7 dus_11 gsum_15 bzhugs_20 ba_27 yi_30 khyod_35 kyis_41 aom_46 gyis_50 gzung_55 ba_61 gyis_65 
T02D1270:85b-4	de ltar de kho na nyid gsum bstan to //	de_0 ltar_3 de_8 kho_11 na_15 nyid_18 gsum_23 ston_28 to_34 
T02D1270:85b-5	de nas phyag rgya drug gis dbang bskur la /	de_0 nas_3 phyag_7 rgya_13 drug_18 gis_23 dbang_27 skur_33 la_39 
T02D1270:85b-6	lung bstan pa'o //	lung_0 ston_5 ba_11 
T02D1270:85b-7	bdag nyid gtso bo'i nga rgyal du byas te /	bdag_0 nyid_5 gtso_10 'bo_15 nga_20 rgyal_24 du_30 byed_33 te_38 
T02D1270:85b-8	sangs rgyas thams cad kyi zhing mngon sum du byas la /	sangs_0 rgya_6 thams_12 cad_18 kyi_22 zhing_26 mngon_32 sum_38 du_42 byed_45 la_50 
T02D1270:85b-9	lag pa g-yon pa'i khu tshur gyis chos gos kyi tha ma snying gar gzung ste /	lag_0 ba_4 g-yon_7 ba_13 khu_18 tshur_22 gyis_28 chos_33 gos_38 kyi_42 tha_46 ma_50 snying_53 gar_60 gzung_64 ste_70 
T02D1270:85b-10	lag pa g-yas pa skyabs spyin du byas la /	lag_0 ba_4 g-yas_7 ba_13 skyob_16 spyin_23 du_29 byed_32 la_37 
T02D1270:85b-11	shar la sogs pa'i goo rims kyis lung bstan par bya'o //	'char_0 la_5 sogs_8 ba_13 goo_18 rims_22 kyis_27 lung_32 ston_37 ba_43 byed_47 
T02D1270:85b-12	aom rdo rje'i rigs mchog chen po yi //	aom_0 rdo_4 rje_8 rigs_14 mchog_19 chen_25 po_30 yi_33 
T02D1270:85b-13	de bzhin gshegs pa thams cad dang //	de_0 bzhin_3 gshegs_9 ba_16 thams_19 cad_25 dang_29 
T02D1270:85b-14	mgrin pa gcig tu lung bstan to //	mgrin_0 ba_6 gcig_9 tu_14 lung_17 ston_22 to_28 
T02D1270:85b-15	'di ltar nga yis lung bstan nas /	'di_0 ltar_4 nga_9 yis_13 lung_17 ston_22 nas_28 
T02D1270:85b-16	rdo rje sems dpa' de bzhin gshegs //	rdo_0 rje_4 sems_8 dpa'_13 de_18 bzhin_21 gshegs_27 
T02D1270:85b-17	srid pa'i mtha' nyid bsgrub pa'i phyir //	srid_0 ba_5 mtha'_10 nyid_16 sgrub_21 ba_28 phyir_33 
T02D1270:85b-18	srid pa ngan 'gro rnams las 'grol //	srid_0 ba_5 ngan_8 'gro_13 rnams_18 las_24 'grol_28 
T02D1270:85b-19	kye de bzhin gshegs pa che ge mo //	kye_0 de_4 bzhin_7 gshegs_13 ba_20 che_23 ge_27 mo_30 
T02D1270:85b-20	zhes bya ba 'di /	zhes_0 byed_5 ba_9 'di_12 
T02D1270:85b-21	ta th'a ga ta siddha bhur bhu ba sva: 'di ltar rigs bzhi'i rin po che dang /	ta_0 th_3 ga_8 ta_11 siddha_14 bhur_21 bhu_26 ba_30 sva:_33 'di_38 ltar_42 rigs_47 bzhi_52 rin_59 po_63 che_66 dang_70 
T02D1270:85b-22	padma dang las kyi bdag nyid du lung bstan to //	padma_0 dang_6 las_11 kyi_15 bdag_19 nyid_24 du_29 lung_32 ston_37 to_43 
T02D1270:85b-23	de yi dbang bskur gyur pa yi //	de_0 yi_3 dbang_6 skur_12 gyur_18 ba_23 yi_26 
T02D1270:85b-24	sngags pa 'gro ba kun gyi bdag / phyag rgya chen po'i bdag nyid la //	sngags_0 ba_7 'gro_10 ba_15 kun_18 gyi_22 bdag_26 phyag_33 rgya_39 chen_44 po_49 bdag_54 nyid_59 la_64 
T02D1270:85b-25	bla na med pa'i byang chub tu //	bla_0 na_4 med_7 ba_11 byang_16 chub_22 tu_27 
T02D1270:85b-26	bde gshegs kyis kyang lung bstan mdzod //	bde_0 gshegs_4 kyis_11 kyang_16 lung_22 ston_27 mdzod_33 
T02D1270:85b-27	de la 'di ltar bstan te /	de_0 la_3 'di_6 ltar_10 ston_15 te_21 
T02D1270:85b-28	sngags dang phyag rgyas rdo rje 'chang gi go 'phang du gyur pa'i phyir /	sngags_0 dang_7 phyag_12 rgya_18 rdo_24 rje_28 'chang_32 gi_39 go_42 'phen_45 du_52 gyur_55 ba_60 phyir_65 
T02D1270:85b-29	bstan par bya ba'i lung bstan pa'o //	ston_0 ba_6 byed_10 ba_14 lung_19 ston_24 ba_30 
T02D1270:85b-30	de nas dam tshig gsum dang ldan pa de dbugs dbyung bar bya ste /	de_0 nas_3 dam_7 tshig_11 gsum_17 dang_22 ldan_27 ba_32 de_35 dbugs_38 'byin_44 ba_51 byed_55 ste_59 
T02D1270:85b-31	gsang mchog dkyil 'khor dam pa ni //	gsang_0 mchog_6 dkyil_12 'khor_18 dam_24 ba_28 ni_31 
T02D1270:85b-32	mthong ba dad ni zhugs gyur pas //	mthong_0 ba_7 dad_10 ni_14 'jug_17 gyur_23 ba_28 
T02D1270:85b-33	sdig pa kun las nges par grol //	sdig_0 ba_5 kun_8 las_12 nges_16 ba_21 grol_25 
T02D1270:85b-34	khyed rnams de nyid legs par gnas //	'khyed_0 rnams_6 de_12 nyid_15 legs_20 ba_25 gnas_29 
T02D1270:85b-35	bde chen theg pa 'di las ni //	bde_0 chen_4 theg_9 ba_14 'di_17 las_21 ni_25 
T02D1270:85b-36	slar khyod 'chi ba la sogs med //	slar_0 khyod_5 'chi_11 ba_16 la_19 sogs_22 med_27 
T02D1270:85b-37	mi tshugs pa dang mchog 'bras bu //	mi_0 tshugs_3 ba_10 dang_13 mchog_18 'bras_24 bu_30 
T02D1270:85b-38	cis kyang mi tshugs dga' bar gyis //	cis_0 kyang_4 mi_10 tshugs_13 dga'_20 ba_25 gyis_29 
T02D1270:85b-39	srid pa'i sdug bsngal las khyod 'das //	srid_0 ba_5 sdug_10 sngal_15 las_22 khyod_26 'da'_32 
T02D1270:85b-40	dam pa'i srid pa bsgrub pa'i phyir //	dam_0 ba_4 srid_9 ba_14 sgrub_17 ba_24 phyir_29 
T02D1270:85b-41	ston pa'i mchog tu gyur pa yin //	ston_0 ba_5 mchog_10 tu_16 gyur_19 ba_24 yin_27 
T02D1270:85b-42	dam tshig sdom pa grub pa 'di //	dam_0 tshig_4 sdom_10 ba_15 'grub_18 ba_23 'di_26 
T02D1270:85b-43	rtag tu khyod kyis bsrung bar gyis //	rtag_0 tu_5 khyod_8 kyis_14 bsrung_19 ba_26 gyis_30 
T02D1270:85b-44	sangs rgyas kun gyis mthun par gsungs //	sangs_0 rgya_6 kun_12 gyis_16 mthun_21 ba_27 gsungs_31 
T02D1270:85b-45	dam pa rtag pa'i bka' yin no //	dam_0 ba_4 rtag_7 ba_12 bka'_17 yin_22 no_26 
T02D1270:86a-0	gang zhig skyed pa @86a * //	gang_0 'jig_5 skyed_10 ba_16 
T02D1270:86a-1	tsam gyis ni //	tsam_0 gyis_5 ni_10 
T02D1270:86a-2	sangs rgyas nyid du dogs med pa'i //	sangs_0 rgya_6 nyid_12 du_17 dogs_20 med_25 ba_29 
T02D1270:86a-3	byang chub sems ni gtang mi bya //	byang_0 chub_6 sems_11 ni_16 gtong_19 mi_25 byed_28 
T02D1270:86a-4	phyag rgya rdo rje gang yin pa //	phyag_0 rgya_6 rdo_11 rje_15 gang_19 yin_24 ba_28 
T02D1270:86a-5	dam pa'i chos ni mi spang zhing //	dam_0 ba_4 chos_9 ni_14 mi_17 spong_20 zhing_26 
T02D1270:86a-6	nam yang dor bar mi bya'o //	nam_0 yang_4 'dor_9 ba_13 mi_17 byed_20 
T02D1270:86a-7	mi shes pas ni rmongs pa la //	mi_0 shes_3 ba_8 ni_12 rmongs_15 ba_22 la_25 
T02D1270:86a-8	tshul chen bstan par mi bya'o //	tshul_0 chen_6 ston_11 ba_17 mi_21 byed_24 
T02D1270:86a-9	bdag nyid yongs su spangs nas su //	bdag_0 nyid_5 yongs_10 su_16 spong_19 nas_26 su_30 
T02D1270:86a-10	dka' thub kyis ni ma gdungs shid //	dka'_0 thub_5 kyis_10 ni_15 ma_18 gdung_21 shid_28 
T02D1270:86a-11	ci bde bar ni gzung bar bya //	ci_0 bde_3 ba_7 ni_11 gzung_14 ba_20 byed_24 
T02D1270:86a-12	'di ni ma byon rdzogs sangs rgyas //	'di_0 ni_4 ma_7 'byon_10 rdzogs_15 sangs_22 rgya_28 
T02D1270:86a-13	rdo rje dril bu'i phyag rgya rnams //	rdo_0 rje_4 'dril_8 bu_13 phyag_18 rgya_24 rnams_29 
T02D1270:86a-14	nam yang yongs su mi dor zhing //	nam_0 yang_4 yongs_9 su_15 mi_18 'dor_21 zhing_25 
T02D1270:86a-15	slob dpon smad par mi bya ste //	slob_0 dpon_5 smad_10 ba_15 mi_19 byed_22 ste_26 
T02D1270:86a-16	'di ni sangs rgyas kun dang 'dra //	'di_0 ni_4 sangs_7 rgya_13 kun_19 dang_23 'dra_28 
T02D1270:86a-17	sangs rgyas tshul mtshungs bla ma yi //	sangs_0 rgya_6 tshul_12 mtshungs_18 bla_27 ma_31 yi_34 
T02D1270:86a-18	slob dpon la ni gang smod pa //	slob_0 dpon_5 la_10 ni_13 gang_16 smod_21 ba_26 
T02D1270:86a-19	de ni sangs rgyas kun smad pas //	de_0 ni_3 sangs_6 rgya_12 kun_18 smad_22 ba_27 
T02D1270:86a-20	rtag tu sdug bsngal thob 'gyur te //	rtag_0 tu_5 sdug_8 sngal_13 'thob_20 'gyur_25 te_31 
T02D1270:86a-21	rims dang du ga dang dbyig dug nad //	rims_0 dang_5 du_10 ga_13 dang_16 dbyig_21 dug_27 nad_31 
T02D1270:86a-22	mkha' 'gro rnams kyi chad pa dang //	mkha'_0 'gro_6 rnams_11 kyi_17 'chad_21 ba_26 dang_29 
T02D1270:86a-23	gnod dang log 'dren gtum po yis //	gnod_0 dang_5 log_10 bgrang_14 'thum_20 po_25 yis_28 
T02D1270:86a-24	bsad nas sems can dmyal bar ltung //	bsad_0 nas_5 sems_9 can_14 dmyal_18 ba_24 ltung_28 
T02D1270:86a-25	de bas nan tan thams cad kyis //	de_0 ba_3 nan_7 tan_11 thams_15 cad_21 kyis_25 
T02D1270:86a-26	rdo rje slob dpon blo gros che //	rdo_0 rje_4 slob_8 dpon_13 blo_18 gros_22 che_27 
T02D1270:86a-27	dge ba rab tu mi bcom pa //	dge_0 ba_4 rab_7 tu_11 mi_14 'joms_17 ba_22 
T02D1270:86a-28	nam yang smod par mi bya'o //	nam_0 yang_4 smod_9 ba_14 mi_18 byed_21 
T02D1270:86a-29	bla ma la ni gus bcas yon //	bla_0 ma_4 la_7 ni_10 gus_13 'cha'_17 yon_22 
T02D1270:86a-30	rjes mthun khyod kyis dbul bar bya //	rjes_0 mthun_5 khyod_11 kyis_17 'bul_22 ba_27 byed_31 
T02D1270:86a-31	des ni rims sogs gnod pa rnams //	des_0 ni_4 rims_7 sogs_12 gnod_17 ba_22 rnams_25 
T02D1270:86a-32	phyir yang 'byung bar mi 'gyur ro //	phyir_0 yang_6 'byung_11 ba_18 mi_22 'gyur_25 ro_31 
T02D1270:86a-33	rtag tu rang gi dam tshig bsrung //	rtag_0 tu_5 rang_8 gi_13 dam_16 tshig_20 bsrung_26 
T02D1270:86a-34	rtag tu de bzhin gshegs pa mchod //	rtag_0 tu_5 de_8 bzhin_11 gshegs_17 ba_24 mchod_27 
T02D1270:86a-35	rtag tu bla ma la yang dbul //	rtag_0 tu_5 bla_8 ma_12 la_15 yang_18 'bul_23 
T02D1270:86a-36	'di ni sangs rgyas kun dang 'dra //	'di_0 ni_4 sangs_7 rgya_13 kun_19 dang_23 'dra_28 
T02D1270:86a-37	de phul sangs rgyas thams cad la //	de_0 'bul_3 sangs_8 rgya_14 thams_20 cad_26 la_30 
T02D1270:86a-38	rtag tu phul ba nyid du 'gyur //	rtag_0 tu_5 'bul_8 ba_13 nyid_16 du_21 'gyur_24 
T02D1270:86a-39	de phul bsod nams tshogs yin te //	de_0 'bul_3 bsod_8 nams_13 tshogs_18 yin_25 te_29 
T02D1270:86a-40	tshogs las dngos grub mchog thob 'gyur //	tshogs_0 las_7 dngos_11 'grub_17 mchog_22 'thob_28 'gyur_33 
T02D1270:86a-41	gang phyir 'di ni legs gnas pas //	gang_0 phyir_5 'di_11 ni_15 legs_18 gnas_23 ba_28 
T02D1270:86a-42	deng khyod nye bar 'bras bur gnas //	deng_0 khyod_5 nye_11 ba_15 'bras_19 bur_25 gnas_29 
T02D1270:86a-43	dam tshig lha rnams kun mnyam par //	dam_0 tshig_4 lha_10 rnams_14 kun_20 mnyam_24 ba_30 
T02D1270:86a-44	deng khyod 'gyur bar the tshom med //	deng_0 khyod_5 'gyur_11 ba_17 the_21 tshom_25 med_31 
T02D1270:86a-45	sangs rgyas rdo rje 'dzin bcas pa //	sangs_0 rgya_6 rdo_12 rje_16 'dzin_20 'cha'_26 ba_31 
T02D1270:86a-46	kun gyis deng khyod dbang bskur bas //	kun_0 gyis_4 deng_9 khyod_14 dbang_20 skur_26 ba_32 
T02D1270:86a-47	khams gsum gyi ni rgyal chen po //	khams_0 gsum_6 gyi_11 ni_15 rgyal_18 chen_24 po_29 
T02D1270:86a-48	rgyal po'i bdag por bstan pa yin //	rgyal_0 po_6 bdag_11 por_16 ston_20 ba_26 yin_29 
T02D1270:86a-49	deng ni bdud las rnam rgyal te //	deng_0 ni_5 bdud_8 las_13 rnam_17 rgyal_22 te_28 
T02D1270:86a-50	grong khyer mchog tu rab tu bzhugs //	grong_0 'khyer_6 mchog_12 tu_18 rab_21 tu_25 bzhugs_28 
T02D1270:86a-51	khyed rnams kyis ni sangs rgyas nyid //	'khyed_0 rnams_6 kyis_12 ni_17 sangs_20 rgya_26 nyid_32 
T02D1270:86a-52	de nyid thob par the tshom med //	de_0 nyid_3 'thob_8 ba_13 the_17 tshom_21 med_27 
T02D1270:86a-53	de ltar yid ni rab dang rdo rje nyid du gyis //	de_0 ltar_3 yid_8 ni_12 rab_15 dang_19 rdo_24 rje_28 nyid_32 du_37 gyis_40 
T02D1270:86b-0	rang gi dam tshig @86b mi zad bde chen bstan par gyis //	rang_0 gi_5 dam_8 tshig_12 mi_23 zad_26 bde_30 chen_34 ston_39 ba_45 gyis_49 
T02D1270:86b-1	deng 'dir 'gro ba myur te rdo rje sems dpa' dang //	deng_0 'dir_5 'gro_10 ba_15 myur_18 te_23 rdo_26 rje_30 sems_34 dpa'_39 dang_44 
T02D1270:86b-2	rab tu mnyam zhing rtag pa nyid du rtogs par 'gyur //	rab_0 tu_4 mnyam_7 zhing_13 rtag_19 ba_24 nyid_27 du_32 rtogs_35 ba_41 'gyur_45 
T02D1270:86b-3	gzhan yang dam tshig bcu bzhi bstan //	gzhan_0 yang_6 dam_11 tshig_15 'chu_21 bzhi_25 ston_30 
T02D1270:86b-4	de ltar slob ma mnyes gshin pas //	de_0 ltar_3 slob_8 ma_13 mnyes_16 gshin_22 ba_28 
T02D1270:86b-5	bla ma'i zhabs la phyag 'tshal te //	bla_0 ma_4 zhabs_9 la_15 phyag_18 'tshal_24 te_31 
T02D1270:86b-6	gtso bo 'di ltar bka' stsal pa'i //	gtso_0 'bo_5 'di_8 ltar_12 bka'_17 stsal_22 ba_28 
T02D1270:86b-7	gsung gi de bzhin bka' bgyid do //	gsung_0 gi_6 de_9 bzhin_12 bka'_18 bgyid_23 do_29 
T02D1270:86b-8	zhes pa ni dbugs dbyung ba sbyin pa'o //	zhes_0 ba_5 ni_8 dbugs_11 'byin_17 ba_24 sbyin_27 ba_33 
T02D1270:86b-9	de nas rjes su gnang ba spyin pa ni //	de_0 nas_3 rjes_7 su_12 gnang_15 ba_21 spyin_24 ba_30 ni_33 
T02D1270:86b-10	de nas rang gi lha'i rnal 'byor dang ldan pas gser gyi thur ma la bsngags te /	de_0 nas_3 rang_7 gi_12 lha_15 rnal_21 'byor_26 dang_32 ldan_37 ba_42 gser_46 gyi_51 thur_55 ma_60 la_63 bsngags_66 te_74 
T02D1270:86b-11	bdag gi thugs ka'i 'od zer dang mtshungs par ye	bdag_0 gi_5 thugs_8 ka_14 'od_19 zer_23 dang_27 mtshungs_32 ba_41 ye_45 
T02D1270:86b-12	shes kyi mig sman gyis mig dbye bar brtsam par	shes_0 kyi_5 mig_9 sman_13 gyis_18 mig_23 'byed_27 ba_32 brtsam_36 ba_43 
T02D1270:86b-13	bya'o // bu khyod kyi ni mi shes pa'i //	byed_0 bu_9 khyod_12 kyi_18 ni_22 mi_25 shes_28 ba_33 
T02D1270:86b-14	mig gi rab rib nyes pa rnams //	mig_0 gi_4 rab_7 rib_11 nyes_15 ba_20 rnams_23 
T02D1270:86b-15	ji ltar mig sman mkhan po ltar //	ji_0 ltar_3 mig_8 sman_12 mkhan_17 po_23 ltar_26 
T02D1270:86b-16	de bzhin rdo rje sems dpa' yis //	de_0 bzhin_3 rdo_9 rje_13 sems_17 dpa'_22 yis_27 
T02D1270:86b-17	sbyor bas rab rib bsal bar bya //	sbyor_0 ba_6 rab_10 rib_14 bsal_18 ba_23 byed_27 
T02D1270:86b-18	aom badzra ne tra ya aa pa ha ra pa	aom_0 badzra_4 ne_11 tra_14 ya_18 aa_21 ba_24 ha_27 ra_30 ba_33 
T02D1270:86b-19	ta lam hr'i: slob ma'i mig gnyis la mchog gi	ta_0 lam_3 hr:_7 slob_13 ma_18 mig_23 gnyis_27 la_33 mchog_36 gi_42 
T02D1270:86b-20	yi ge bsams la /	yi_0 ge_3 bsams_6 la_12 
T02D1270:86b-21	thur ma dang 'od zer gyis bsal bar bya'o //	thur_0 ma_5 dang_8 'od_13 zer_17 gyis_21 bsal_26 ba_31 byed_35 
T02D1270:86b-22	aom badzra satva zhes pas de nas me long bstan la /	aom_0 badzra_4 satva_11 zhes_17 ba_22 de_26 nas_29 me_33 long_36 ston_41 la_47 
T02D1270:86b-23	chos thams cad kyi rang bzhin bstan pa ni /	chos_0 thams_5 cad_11 kyi_15 rang_19 bzhin_24 ston_30 ba_36 ni_39 
T02D1270:86b-24	chos rnams gzugs brnyan lta bu ste //	chos_0 rnams_5 gzugs_11 rnyan_17 lta_24 bu_28 ste_31 
T02D1270:86b-25	dag cing gsal la rnyog pa med //	'dag_0 cing_4 gsal_9 la_14 rnyog_17 ba_23 med_26 
T02D1270:86b-26	gzung du med cing brjod du med //	gzung_0 du_6 med_9 cing_13 rjod_18 du_24 med_27 
T02D1270:86b-27	rgyu dang las las kun du byung //	rgyu_0 dang_5 las_10 las_14 kun_18 du_22 'byung_25 
T02D1270:86b-28	de bzhin nyid las nges par skyes //	de_0 bzhin_3 nyid_9 las_14 nges_18 ba_23 skye_27 
T02D1270:86b-29	ngo bo nyid med gnas med pa //	ngo_0 'bo_4 nyid_7 med_12 gnas_16 med_21 ba_25 
T02D1270:86b-30	'di ltar chos rnams thams cad shes //	'di_0 ltar_4 chos_9 rnams_14 thams_20 cad_26 shes_30 
T02D1270:86b-31	rang bzhin med cing gzhi med pas //	rang_0 bzhin_5 med_11 cing_15 gzhi_20 med_25 ba_29 
T02D1270:86b-32	sems can don ni mnyam med byos //	sems_0 can_5 don_9 ni_13 mnyam_16 med_22 byos_26 
T02D1270:86b-33	skyob pa rnams kyi mchog tu 'gyur //	skyob_0 ba_6 rnams_9 kyi_15 mchog_19 tu_25 'gyur_28 
T02D1270:86b-34	de nas dril bu dkrol zhing me long gi gzugs brnyan bstan la /	de_0 nas_3 'dril_7 bu_12 'khrol_15 zhing_21 me_27 long_30 gi_35 gzugs_38 rnyan_44 ston_51 la_57 
T02D1270:86b-35	chos thams cad kyi de kho na nyid 'di ltar	chos_0 thams_5 cad_11 kyi_15 de_19 kho_22 na_26 nyid_29 'di_34 ltar_38 
T02D1270:86b-36	shes par gyis shig ces bka' bsgo la tshig 'di	shes_0 ba_5 gyis_9 shig_14 ces_19 bka'_23 sgo_28 la_33 tshig_36 'di_42 
T02D1270:86b-37	brjod par bya'o // thams cad nam mkha'i mtshan nyid de //	rjod_0 ba_6 byed_10 thams_19 cad_25 nam_29 mkha_33 mtshan_40 nyid_47 de_52 
T02D1270:86b-38	nam mkha' la ni mtshan nyid med //	nam_0 mkha'_4 la_10 ni_13 mtshan_16 nyid_23 med_28 
T02D1270:86b-39	nam mkha' dang ni mnyam sbyor phyir //	nam_0 mkha'_4 dang_10 ni_15 mnyam_18 sbyor_24 phyir_30 
T02D1270:86b-40	kun gyi mchog ni mnyam nyid gsal //	kun_0 gyi_4 mchog_8 ni_14 mnyam_17 nyid_23 gsal_28 
T02D1270:86b-41	rdo rje sems dpa' me long ltar //	rdo_0 rje_4 sems_8 dpa'_13 me_18 long_21 ltar_26 
T02D1270:86b-42	dag cing gsal la dri ma med //	'dag_0 cing_4 gsal_9 la_14 'dri_17 ma_21 med_24 
T02D1270:86b-43	sangs rgyas kun gyi bdag nyid ni //	sangs_0 rgya_6 kun_12 gyi_16 bdag_20 nyid_25 ni_30 
T02D1270:86b-44	bu khyod kyi ni snying la gnas //	bu_0 khyod_3 kyi_9 ni_13 snying_16 la_23 gnas_26 
T02D1270:86b-45	gang 'di de bzhin gshegs pa thams cad kyi bdag	gang_0 'di_5 de_9 bzhin_12 gshegs_18 ba_25 thams_28 cad_34 kyi_38 bdag_42 
T02D1270:86b-46	po'i byang chub sems dpa' ni 'di yin par shes	po_0 byang_5 chub_11 sems_16 dpa'_21 ni_26 'di_29 yin_33 ba_37 shes_41 
T02D1270:87a-0	par gyis shig / ces brjod @87a * //	ba_0 gyis_4 shig_9 ces_16 rjod_20 
T02D1270:87a-1	la me long snying gar gtug go //	la_0 me_3 long_6 snying_11 gar_18 gtug_22 go_27 
T02D1270:87a-2	de nas ho las skyes pa'i gzhu lag tu byin la /	de_0 nas_3 ho_7 las_10 skye_14 ba_20 gzhu_25 lag_30 tu_34 byin_37 la_42 
T02D1270:87a-3	de bzhin gshegs pa thams cad rjes su sgrubs shib [*shi ba?] //	de_0 bzhin_3 gshegs_9 ba_16 thams_19 cad_25 rjes_29 su_34 sgrubs_37 shib_44 [*shi_49 ba?]_55 
T02D1270:87a-4	bdud bzhi rnam par 'dul bar gyis shig ces mgo la phyogs bzhir gzhu bzhi dgang bar bya'o //	bdud_0 bzhi_5 rnam_10 ba_15 'dul_19 ba_24 gyis_28 shig_33 ces_38 mgo_42 la_46 phyogs_49 bzhir_56 gzhu_62 bzhi_67 'geng_72 ba_78 byed_82 
T02D1270:87a-5	steng dang 'og tu yang ngo //	steng_0 dang_6 'og_11 tu_15 yang_18 ngo_23 
T02D1270:87a-6	de nas aom badzra he tu mam zhes pas 'khor	de_0 nas_3 aom_7 badzra_11 he_18 tu_21 mam_24 zhes_28 ba_33 'khor_37 
T02D1270:87a-7	lo rkang pa gnyis kyi bar du bzhag la aom	lo_0 rkang_3 ba_9 gnyis_12 kyi_18 ba_22 du_26 'jog_29 la_35 aom_38 
T02D1270:87a-8	badzra bha sha ram zhes pas dud lag pa g-yas	badzra_0 bha_7 sha_11 ram_15 zhes_19 ba_24 dud_28 lag_32 ba_36 g-yas_39 
T02D1270:87a-9	su sbyin // dbyangs kyi yi ge dang po las glegs bam dang /	su_0 sbyin_3 dbyangs_12 kyi_20 yi_24 ge_27 dang_30 po_35 las_38 glegs_42 bam_48 dang_52 
T02D1270:87a-10	dbyangs kyi yi ge tha ma las dril bur gyur	dbyangs_0 kyi_8 yi_12 ge_15 tha_18 ma_22 las_25 'dril_29 bur_34 gyur_38 
T02D1270:87a-11	pa las lag pa g-yon du byin la 'di skad	ba_0 las_3 lag_7 ba_11 g-yon_14 du_20 byin_23 la_28 'di_31 skad_35 
T02D1270:87a-12	brjod do // 'di nas brtsams te sems bskyed pa	rjod_0 do_6 'di_12 nas_16 brtsams_20 te_28 sems_31 skyed_36 ba_43 
T02D1270:87a-13	tsam gyis chos kyi 'khor lo bskor bar gyis shig	tsam_0 gyis_5 chos_10 kyi_15 'khor_19 lo_25 skor_28 ba_34 gyis_38 shig_43 
