T02D1897:278b-4	aom a'a:h'um badzra h'um zhes pa'o //	aom_0 a:h_4 badzra_13 h_20 zhes_25 ba_30 
T02D1897:278b-5	aom a'a:na ma:sa manta k'a ya b'aka tsitta badzra nam /	aom_0 a:na_4 ma:sa_11 manta_17 k_23 ya_27 b_30 tsitta_36 badzra_43 nam_50 
T02D1897:278b-6	na mo badzra kro dh'a ya /	na_0 mo_3 badzra_6 kro_13 dh_17 ya_22 
T02D1897:278b-7	ma h'a dam shtota ka bhee ra ba ya /	ma_0 h_3 dam_7 shtota_11 ka_18 bhee_21 ra_26 ba_29 ya_32 
T02D1897:278b-8	aa si mu sa la ba ra su p'a sha ha st'a ya /	aa_0 si_3 mu_6 sa_9 la_12 ba_15 ra_18 su_21 p_24 sha_28 ha_32 st_35 ya_40 
T02D1897:278b-9	aom aa mri ta kunda li kha kha kh'a hi kh'a hi /	aom_0 aa_4 mri_7 ta_11 kunda_14 li_20 kha_23 kha_27 kh_31 hi_36 kh_39 hi_44 
T02D1897:278b-10	tishtha tishtha /	tishtha_0 tishtha_8 
T02D1897:278b-11	bandha bandha /	bandha_0 bandha_7 
T02D1897:278b-12	ha na ha na /	ha_0 na_3 ha_6 na_9 
T02D1897:278b-13	da ha da ha /	da_0 ha_3 da_6 ha_9 
T02D1897:278b-14	gardzdza gardzdza /	gardzdza_0 gardzdza_9 
T02D1897:278b-15	bi spho ta ya bi spho ta ya /	bi_0 spho_3 ta_8 ya_11 bi_14 spho_17 ta_22 ya_25 
T02D1897:278b-16	sarba bighn'an bi na ya ka / ma h'a ga	sarba_0 bighn_6 bi_15 na_18 ya_21 ka_24 ma_29 h_32 ga_36 
T02D1897:278b-17	na pa ti dz'i ba tan ka r'a ya h'um	na_0 ba_3 ti_6 dz_9 ba_14 tan_17 ka_21 r_24 ya_28 h_31 
T02D1897:278b-18	phat sv'a h'a h'um /	phat_0 sv_5 h_10 h_14 
T02D1897:278b-19	'jigs pa thams cad las skyob pa bdud rtsi 'khyil	'jigs_0 ba_6 thams_9 cad_15 las_19 skyob_23 ba_29 bdud_32 rtsi_37 'khyil_42 
T02D1897:278b-20	ba'i sngags 'di rtag tu bzlas par bya zhes bya	ba_0 sngags_5 'di_12 rtag_16 tu_21 bzlas_24 ba_30 byed_34 zhes_38 byed_43 
T02D1897:278b-21	ba ni bsgom pa'i cho ga'o //	ba_0 ni_3 bsgom_6 ba_12 cho_17 ga_21 
T02D1897:278b-22	bsgoms pa las langs pa'i dus su rang gi lha'i	sgom_0 ba_7 las_10 ldang_14 ba_20 dus_25 su_29 rang_32 gi_37 lha_40 
T02D1897:278b-23	rnal 'byor gyi sa la gnas nas brtan pa dang	rnal_0 'byor_5 gyi_11 sa_15 la_18 gnas_21 nas_26 brtan_30 ba_36 dang_39 
T02D1897:278b-24	g-yo ba'i khams gsum pa thams cad rang gi lhag	g-yo_0 ba_5 khams_10 gsum_16 ba_21 thams_24 cad_30 rang_34 gi_39 lhag_42 
T02D1897:278b-25	pa'i lha'i gzugs kyis sam sbyar ba ji lta ba	ba_0 lha_5 gzugs_11 kyis_17 sam_22 sbyor_26 ba_32 ji_35 lta_38 ba_42 
T02D1897:278b-26	bzhin du gzugs rdo rje ma la sogs pa'i gzugs	bzhin_0 du_6 gzugs_9 rdo_15 rje_19 ma_23 la_26 sogs_29 ba_34 gzugs_39 
T02D1897:278b-27	kyis lhag par mos pas bya ba thams cad byed	kyis_0 lhag_5 ba_10 mos_14 ba_18 byed_22 ba_26 thams_29 cad_35 byed_39 
T02D1897:278b-28	pa dang zas la sogs pa bdud rtsi myang ba'i	ba_0 dang_3 zas_8 la_12 sogs_15 ba_20 bdud_23 rtsi_28 myang_33 ba_39 
T02D1897:278b-29	cho gas bya ba dang /	cho_0 'gas_4 byed_8 ba_12 dang_15 
T02D1897:278b-30	spros pa med pa'i rang rig pa'i dkyil 'khor gyi	spros_0 ba_6 med_9 ba_13 rang_18 rig_23 ba_27 dkyil_32 'khor_38 gyi_44 
T02D1897:278b-31	'khor lo'i bdag nyid gnyis su med par rab tu	'khor_0 lo_6 bdag_11 nyid_16 gnyis_21 su_27 med_30 ba_34 rab_38 tu_42 
T02D1897:278b-32	gsal ba'i mes skad cig cig gcig la skyes pa'i	gsal_0 ba_5 mes_10 skad_14 cig_19 cig_23 gcig_27 la_32 skye_35 ba_41 
T02D1897:278b-33	rtog pa thams cad kyi bud shing bsreg pa dang	rtogs_0 ba_5 thams_8 cad_14 kyi_18 'bud_22 shing_26 bsreg_32 ba_38 dang_41 
T02D1897:278b-34	/ dkon mchog gsum la mchod pa bya ba dang /	dkon(d)_2 mchog_7 gsum_13 la_18 mchod_21 ba_27 byed_30 ba_34 dang_37 
T02D1897:278b-35	sems can gyi don tsam gyi phyir lus la sogs pa'i bya ba byed pa dang /	sems_0 can_5 gyi_9 don_13 tsam_17 gyi_22 phyir_26 lus_32 la_36 sogs_39 ba_44 byed_49 ba_53 byed_56 ba_61 dang_64 
T02D1897:278b-36	dam tshig la gnas pa grogs dam tshig la gnas pa dang /	dam_0 tshig_4 la_10 gnas_13 ba_18 grogs_21 dam_27 tshig_31 la_37 gnas_40 ba_45 dang_48 
T02D1897:278b-37	shin tu gsang ste bde ba dang mi 'gal bar dam tshig bsten pa dang /	shin_0 tu_5 gsang_8 ste_14 bde_18 ba_22 dang_25 mi_30 'gal_33 ba_38 dam_42 tshig_46 sten_52 ba_58 dang_61 
T02D1897:278b-38	dam tshig nyams na don yod grub pa'i rnal 'byor gyis langs te /	dam_0 tshig_4 nyams_10 na_16 don_19 yod_23 'grub_27 ba_32 rnal_37 'byor_42 gyis_48 ldang_53 te_59 
T02D1897:278b-39	bla ma la chen por mi byed pa la sogs	bla_0 ma_4 la_7 chen_10 por_15 mi_19 byed_22 ba_27 la_30 sogs_33 
T02D1897:278b-40	pa'i rtsa ba'i ltung ba byung na sdom pa gzung	ba_0 rtsa_5 ba_10 ltung_15 ba_21 'byung_24 na_30 sdom_33 ba_38 gzung_41 
T02D1897:278b-41	ba sngon du 'gro bas yon phul nas bzod par	ba_0 sngon_3 du_9 'gro_12 ba_17 yon_21 'bul_25 nas_30 bzod_34 ba_39 
T02D1897:278b-42	gsol / so sor bshags pa dang /	gsol_0 so_7 sor_10 'chags_14 ba_21 dang_24 
T02D1897:278b-43	yang sdom pa gzung bar bya'o //	yang_0 sdom_5 ba_10 gzung_13 ba_19 byed_23 
T02D1897:278b-44	dbang bskur ba'i cho gas phyi'i khrus bya ba dang /	dbang_0 skur_6 ba_12 cho_17 'gas_21 phyi_25 'khru_32 byed_38 ba_42 dang_45 
T02D1897:278b-45	thun gyi mtshams su yang las dang po pas gong ma bzhin du bsam gtan bya'o //	thun_0 gyi_5 mtshams_9 su_17 yang_20 las_25 dang_29 po_34 ba_37 gong_41 ma_46 bzhin_49 du_55 bsam_58 gtan_63 byed_68 
T02D1897:278b-46	grub pa'i mtshan ma thob nas rgyud du bstan pa'i rim pas dngos grub pa dang /	'grub_0 ba_5 mtshan_10 ma_17 'thob_20 nas_25 brgyud_29 du_35 ston_38 ba_44 rim_49 ba_53 dngos_57 'grub_63 ba_68 dang_71 
T02D1897:279a-0	@279a * // bgegs so sor nye bar byung na bdud rtsi thab	bgegs_11 so_17 sor_20 nye_24 ba_28 'byung_32 na_38 bdud_41 rtsi_46 thab_51 
T02D1897:279a-1	sbyor gyi rnal 'byor gyi sa phye mar bya ba	sbyor_0 gyi_6 rnal_10 'byor_15 gyi_21 sa_25 'byed_28 mar_33 byed_37 ba_41 
T02D1897:279a-2	dang / rgyu mthun pa dang rnam par smin pa dang /	dang_0 rgyu_7 mthun_12 ba_18 dang_21 rnam_26 ba_31 smin_35 ba_40 dang_43 
T02D1897:279a-3	skyes bu byed pa dang /	skye_0 bu_6 byed_9 ba_14 dang_17 
T02D1897:279a-4	dri ma med pa zhes bya ba'i 'bras bu bzhir nges pa dang /	'dri_0 ma_4 med_7 ba_11 zhes_14 byed_19 ba_23 'bras_28 bu_34 bzhir_37 nges_43 ba_48 dang_51 
T02D1897:279a-5	bsnyen pa dang nye bar sgrub pa dang sgrub pa	snyen_0 ba_7 dang_10 nye_15 ba_19 sgrub_23 ba_29 dang_32 sgrub_37 ba_43 
T02D1897:279a-6	chen po zhes bya ba'i yan lag bzhir nges pa	chen_0 po_5 zhes_8 byed_13 ba_17 yan_22 lag_26 bzhir_30 nges_36 ba_41 
T02D1897:279a-7	dang / las dang po pa dang /	dang_0 las_7 dang_11 po_16 ba_19 dang_22 
T02D1897:279a-8	ye shes cung zad la dbang thob pa dang /	ye_0 shes_3 cung_8 zad_13 la_17 dbang_20 'thob_26 ba_31 dang_34 
T02D1897:279a-9	yang dag pa'i ye shes la dbang thob pa zhes bya ba'i rnal 'byor pa bzhir nges pa dang /	yang_0 'dag_5 ba_9 ye_14 shes_17 la_22 dbang_25 'thob_31 ba_36 zhes_39 byed_44 ba_48 rnal_53 'byor_58 ba_64 bzhir_67 nges_73 ba_78 dang_81 
T02D1897:279a-10	smig rgyu lta bu dang /	smig_0 rgyu_5 lta_10 bu_14 dang_17 
T02D1897:279a-11	du ba lta bu dang /	du_0 ba_3 lta_6 bu_10 dang_13 
T02D1897:279a-12	me khyer lta bu dang /	me_0 'khyer_3 lta_9 bu_13 dang_16 
T02D1897:279a-13	mar me lta bu dang /	mar_0 me_4 lta_7 bu_11 dang_14 
T02D1897:279a-14	rtag tu nam mkha' la gsal bar snang ba zhes bya ba'i mtshan ma lngar nges pa dang /	rtag_0 tu_5 nam_8 mkha'_12 la_18 gsal_21 ba_26 snang_30 ba_36 zhes_39 byed_44 ba_48 mtshan_53 ma_60 lngar_63 nges_69 ba_74 dang_77 
T02D1897:279a-15	sbyor ba dang po dang /	sbyor_0 ba_6 dang_9 po_14 dang_17 
T02D1897:279a-16	dkyil 'khor rgyal po mchog dang /	dkyil_0 'khor_6 rgyal_12 po_18 mchog_21 dang_27 
T02D1897:279a-17	las rgyal po mchog ces bya ba'i ting nge 'dzin gsum du nges pa dang /	las_0 rgyal_4 po_10 mchog_13 ces_19 byed_23 ba_27 ting_32 nge_37 'dzin_41 gsum_47 du_52 nges_55 ba_60 dang_63 
T02D1897:279a-18	dkyil 'khor gyi bdag po'i rnam par nges pa dang /	dkyil_0 'khor_6 gyi_12 bdag_16 po_21 rnam_26 ba_31 nges_35 ba_40 dang_43 
T02D1897:279a-19	thugs kar zhugs pa'i dkyil 'khor gyi 'khor los khams	thugs_0 kar_6 'jug_10 ba_16 dkyil_21 'khor_27 gyi_33 'khor_37 los_43 khams_47 
T02D1897:279a-20	gsal bar byas te nyal bar bya zhes bya ba	gsal_0 ba_5 byed_9 te_14 nyal_17 ba_22 byed_26 zhes_30 byed_35 ba_39 
T02D1897:279a-21	ni bsgom pa'i rnal 'byor spyod pa'i cho ga'o //	ni_0 bsgom_3 ba_9 rnal_14 'byor_19 spyod_25 ba_31 cho_36 ga_40 
T02D1897:279a-22	che ba'i cho ga brjod nas da ni mchog tu	che_0 ba_4 cho_9 ga_13 rjod_16 nas_22 da_26 ni_29 mchog_32 tu_38 
T02D1897:279a-23	zab pa'i gnas bstan pa thams cad kyi nor gyi	zab_0 ba_4 gnas_9 ston_14 ba_20 thams_23 cad_29 kyi_33 nor_37 gyi_41 
T02D1897:279a-24	tshig don lnga po brjod par bya ste /	tshig_0 don_6 lnga_10 po_15 rjod_18 ba_24 byed_28 ste_32 
T02D1897:279a-25	'dir nges par don dam par chos thams cad gcig	'dir_0 nges_5 ba_10 don_14 dam_18 ba_22 chos_26 thams_31 cad_37 gcig_41 
T02D1897:279a-26	dang du ma dang gzung ba dang 'dzin pa dang	dang_0 du_5 ma_8 dang_11 gzung_16 ba_22 dang_25 'dzin_30 ba_36 dang_39 
T02D1897:279a-27	/ rgyu dang 'bras bu rtag pa dang /	rgyu_2 dang_7 'bras_12 bu_18 rtag_21 ba_26 dang_29 
T02D1897:279a-28	rtag min rtag pa la sogs pa'i spros pa dang	rtag_0 min_5 rtag_9 ba_14 la_17 sogs_20 ba_25 spros_30 ba_36 dang_39 
T02D1897:279a-29	bral bas sgyu ma dang smig rgyu dang rmi lam	'bral_0 ba_5 sgyu_9 ma_14 dang_17 smig_22 rgyu_27 dang_32 rmi_37 lam_41 
T02D1897:279a-30	dang chu zla dang gzugs brnyan lta bur so so'i	dang_0 chu_5 zla_9 dang_13 gzugs_18 rnyan_24 lta_31 bur_35 so_39 so_42 
T02D1897:279a-31	rgyud mngon par 'dod pas gsal ba sna tshogs gnyis	brgyud_0 mngon_6 ba_12 'dod_16 ba_21 gsal_25 ba_30 sna_33 tshogs_37 gnyis_44 
T02D1897:279a-32	su med pa tsam yin yang kun rdzob la brten	su_0 med_3 ba_7 tsam_10 yin_15 yang_19 kun_24 rdzob_28 la_34 rten_37 
T02D1897:279a-33	te rgyal ba'i sras kyis ji ltar rig par ldog	te_0 rgyal_3 ba_9 sras_14 kyis_19 ji_24 ltar_27 rig_32 ba_36 ldog_40 
T02D1897:279a-34	par byas pa'i bye brag gi mtshan ma dang /	ba_0 byed_4 ba_9 'bye_14 brag_18 gi_23 mtshan_26 ma_33 dang_36 
T02D1897:279a-35	gzhal bya dang /	'jal_0 byed_6 dang_10 
T02D1897:279a-36	de kho na nyid dang /	de_0 kho_3 na_7 nyid_10 dang_15 
T02D1897:279a-37	bsgrub bya dang /	sgrub_0 byed_7 dang_11 
T02D1897:279a-38	sgrub thabs kyi rnam par gzhag par bya ste /	sgrub_0 thabs_6 kyi_12 rnam_16 ba_21 'jog_25 ba_31 byed_35 ste_39 
T02D1897:279a-39	byang chub rab tu rtogs par bya'o //	byang_0 chub_6 rab_11 tu_15 rtogs_18 ba_24 byed_28 
T02D1897:279a-40	de la 'dir tshad ma ni rang rig pa'i mngon sum ste /	de_0 la_3 'dir_6 tshad_11 ma_17 ni_20 rang_23 rig_28 ba_32 mngon_37 sum_43 ste_47 
T02D1897:279a-41	gsal ba sna tshogs pa'i rnam pa sna tshogs pa'i	gsal_0 ba_5 sna_8 tshogs_12 ba_19 rnam_24 ba_29 sna_32 tshogs_36 ba_43 
T02D1897:279a-42	chos can gzhan la ltos pa med pa rab tu	chos_0 can_5 gzhan_9 la_15 ltos_18 ba_23 med_26 ba_30 rab_33 tu_37 
T02D1897:279a-43	gsal ba bems po las log pa'i chos so //	gsal_0 ba_5 bems_8 po_13 las_16 log_20 ba_24 chos_29 so_34 
T02D1897:279a-44	gzhal bya ni rang rig pa'i tshad ma las log	'jal_0 byed_6 ni_10 rang_13 rig_18 ba_22 tshad_27 ma_33 las_36 log_40 
T02D1897:279b-0	na med pa tha @279b mi dad pa'i ngo bo'i	na_0 med_3 ba_7 tha_10 mi_20 dad_23 ba_27 ngo_32 'bo_36 
T02D1897:279b-1	rang bzhin gzugs dang sgra dang dri dang ro dang	rang_0 bzhin_5 gzugs_11 dang_17 sgra_22 dang_27 'dri_32 dang_36 ro_41 dang_44 
T02D1897:279b-2	reg bya dang / bde ba dang /	reg_0 byed_4 dang_8 bde_15 ba_19 dang_22 
T02D1897:279b-3	sdug bsngal dang /	sdug_0 sngal_5 dang_12 
T02D1897:279b-4	btang snyoms kyi bdag nyid sna tshogs kyi rnam pa'i tshogs so //	gtong_0 snyom_6 kyi_13 bdag_17 nyid_22 sna_27 tshogs_31 kyi_38 rnam_42 ba_47 tshogs_52 so_59 
T02D1897:279b-5	de kho na nyid ni so so'i rgyud du mngon	de_0 kho_3 na_7 nyid_10 ni_15 so_18 so_21 brgyud_26 du_32 mngon_35 
T02D1897:279b-6	par 'dod pa rnams kyi sna tshogs gnyis su med	ba_0 'dod_4 ba_9 rnams_12 kyi_18 sna_22 tshogs_26 gnyis_33 su_39 med_42 
T02D1897:279b-7	pa rab tu gsal ba'i bdag nyid sems can thams	ba_0 rab_3 tu_7 gsal_10 ba_15 bdag_20 nyid_25 sems_30 can_35 thams_39 
T02D1897:279b-8	cad kyi gzugs kyi gzung ba dang /	cad_0 kyi_4 gzugs_8 kyi_14 gzung_18 ba_24 dang_27 
T02D1897:279b-9	'dzin pa la sogs par btags pa'i spros pa rnam par grol ba'o //	'dzin_0 ba_6 la_9 sogs_12 ba_17 'dogs_21 ba_27 spros_32 ba_38 rnam_41 ba_46 grol_50 ba_55 
T02D1897:279b-10	yul dang dngos po thams cad la khyab pa dmigs	yul_0 dang_4 dngos_9 po_15 thams_18 cad_24 la_28 khyab_31 ba_37 dmigs_40 
T02D1897:279b-11	pa na sangs rgyas thams cad kyi yon tan skye	ba_0 na_3 sangs_6 rgya_12 thams_18 cad_24 kyi_28 yon_32 tan_36 skye_40 
T02D1897:279b-12	ba'i rgyu ste mi rtag pa la sogs pa bzhin	ba_0 rgyu_5 ste_10 mi_14 rtag_17 ba_22 la_25 sogs_28 ba_33 bzhin_36 
T02D1897:279b-13	du brtags pa thun mong gi chos so //	du_0 rtog_3 ba_10 thun_13 mong_18 gi_23 chos_26 so_31 
T02D1897:279b-14	de nyid kyang longs spyod rdzogs pa'i rten du nges te /	de_0 nyid_3 kyang_8 longs_14 spyod_20 rdzogs_26 ba_33 rten_38 du_43 nges_46 te_51 
T02D1897:279b-15	de bzhin gshegs pa thams cad kyi chos kyi sku ru shes so //	de_0 bzhin_3 gshegs_9 ba_16 thams_19 cad_25 kyi_29 chos_33 kyi_38 sku_42 ru_46 shes_49 so_54 
T02D1897:279b-16	bsgrub bya ni sangs rgyas nyid de /	sgrub_0 byed_7 ni_11 sangs_14 rgya_20 nyid_26 de_31 
T02D1897:279b-17	'di ltar yang gtsang ma'i gnas kyi steng na sdug	'di_0 ltar_4 yang_9 gtsang_14 ma_21 gnas_26 kyi_31 steng_35 na_41 sdug_44 
T02D1897:279b-18	po bkod pa'i ming can yang dag par rdzogs pa'i	po_0 bkod_3 ba_8 ming_13 can_18 yang_22 'dag_27 ba_31 rdzogs_35 ba_42 
T02D1897:279b-19	sangs rgyas rnams te /	sangs_0 rgya_6 rnams_12 te_18 
T02D1897:279b-20	ji ltar bcom ldan 'das dga' ba'i rang bzhin stobs	ji_0 ltar_3 'joms_8 ldan_13 'da'_18 dga'_23 ba_28 rang_33 bzhin_38 stobs_44 
T02D1897:279b-21	dang mi 'jigs pa la sogs pa thams cad mkhyen	dang_0 mi_5 'jigs_8 ba_14 la_17 sogs_20 ba_25 thams_28 cad_34 mkhyen_38 
T02D1897:279b-22	pa la sogs pa yid kyi yon tan gyis rgyas	ba_0 la_3 sogs_6 ba_11 yid_14 kyi_18 yon_22 tan_26 gyis_30 rgya_35 
T02D1897:279b-23	par gyur pa mtshan dang dpe byad kyis 'bar bar	ba_0 gyur_4 ba_9 mtshan_12 dang_19 dpe_24 byad_28 kyis_33 'bar_38 ba_43 
T02D1897:279b-24	gyur pa longs spyod rdzogs pa'i bdag nyid de brtags	gyur_0 ba_5 longs_8 spyod_14 rdzogs_20 ba_27 bdag_32 nyid_37 de_42 rtog_45 
T02D1897:279b-25	pas stong pa'i mtshan nyid chos kyi sku mngon du	ba_0 stong_4 ba_10 mtshan_15 nyid_22 chos_27 kyi_32 sku_36 mngon_40 du_46 
T02D1897:279b-26	byas te / sprul pa spros pas mtshams med par	byed_0 te_5 sprul_10 ba_16 spros_19 ba_25 mtshams_29 med_37 ba_41 
T02D1897:279b-27	'gro ba'i don yang dag par rdzogs par byed pa	'gro_0 ba_5 don_10 yang_14 'dag_19 ba_23 rdzogs_27 ba_34 byed_38 ba_43 
T02D1897:279b-28	nyan thos dang rang sangs rgyas dang /	nyan_0 thos_5 dang_10 rang_15 sangs_20 rgya_26 dang_32 
T02D1897:279b-29	sa dgu'i dbang phyug byang chub sems dpas kyang mi mthong ba'i sku /	sa_0 dgu_3 dbang_9 phyug_15 byang_21 chub_27 sems_32 dpas_37 kyang_42 mi_48 mthong_51 ba_58 sku_63 
T02D1897:279b-30	sa bcu'i byang chub sems dpa' dbang phyug mchog gis	sa_0 'chu_3 byang_9 chub_15 sems_20 dpa'_25 dbang_30 phyug_36 mchog_42 gis_48 
T02D1897:279b-31	chos nyan pa'i sgo nas 'khor ba ji srid kyi	chos_0 nyan_5 ba_10 sgo_15 nas_19 'khor_23 ba_29 ji_32 srid_35 kyi_40 
T02D1897:279b-32	bar du bzhugs pa ste de nyid bsgrub bya'o //	ba_0 du_4 bzhugs_7 ba_14 ste_17 de_21 nyid_24 sgrub_29 byed_36 
T02D1897:279b-33	sgrub thabs ni slar yang lcags kyi khang pa 'bar	sgrub_0 thabs_6 ni_12 slar_15 yang_20 lcags_25 kyi_31 khang_35 ba_41 'bar_44 
T02D1897:279b-34	bar rab tu zhugs par gyur pa'i sdug bsngal gsum	ba_0 rab_4 tu_8 'jug_11 ba_17 gyur_21 ba_26 sdug_31 sngal_36 gsum_43 
T02D1897:279b-35	gyis sdug bsngal ba'i khams gsum pa nges pa la	gyis_0 sdug_5 sngal_10 ba_17 khams_22 gsum_28 ba_33 nges_36 ba_41 la_44 
T02D1897:279b-36	sogs pas tshig don lnga po nges pa la thug	sogs_0 ba_5 tshig_9 don_15 lnga_19 po_24 nges_27 ba_32 la_35 thug_38 
T02D1897:279b-37	pas yon tan bco brgyad dang ldan pa'i byang chub	ba_0 yon_4 tan_8 'chos_12 brgyad_16 dang_23 ldan_28 ba_33 byang_38 chub_44 
T02D1897:279b-38	sems dpa' pha rol tu phyin pa bcu la goms	sems_0 dpa'_5 pha_10 rol_14 tu_18 phyin_21 ba_27 'chu_30 la_34 goms_37 
T02D1897:279b-39	pa ni pha rol tu phyin pa'i tshul gyis gnas	ba_0 ni_3 pha_6 rol_10 tu_14 phyin_17 ba_23 tshul_28 gyis_34 gnas_39 
T02D1897:280a-0	pa'o // dpal ldan sngags kyi theg pa'i tshul la @280a * //	ba_0 dpal_8 ldan_13 sngags_18 kyi_25 theg_29 ba_34 tshul_39 la_45 
T02D1897:280a-1	tshad ma dang /	tshad_0 ma_6 dang_9 
T02D1897:280a-2	gzhal bya dang /	'jal_0 byed_6 dang_10 
T02D1897:280a-3	de kho na nyid ni de rnams nyid do //	de_0 kho_3 na_7 nyid_10 ni_15 de_18 rnams_21 nyid_27 do_32 
T02D1897:280a-4	bsgrub bya dang sgrub thabs dag la khyad par yod de /	sgrub_0 byed_7 dang_11 sgrub_16 thabs_22 'dag_28 la_32 khyad_35 ba_41 yod_45 de_49 
T02D1897:280a-5	de la bsgrub bya ni bcom ldan 'das de nyid /	de_0 la_3 sgrub_6 byed_13 ni_17 'joms_20 ldan_25 'da'_30 de_35 nyid_38 
T02D1897:280a-6	'on kyang 'dir bye brag ni rlung dang me dang	'on_0 kyang_4 'dir_10 'bye_15 brag_19 ni_24 rlung_27 dang_33 me_38 dang_41 
T02D1897:280a-7	sa dang chu'i dkyil 'khor gyi dbus su yangs pa	sa_0 dang_3 chu_8 dkyil_14 'khor_20 gyi_26 dbus_30 su_35 yangs_38 ba_44 
T02D1897:280a-8	na rdo rje sa gzhi la sogs pa'i dbus na	na_0 rdo_3 rje_7 sa_11 gzhi_14 la_19 sogs_22 ba_27 dbus_32 na_37 
T02D1897:280a-9	gnas pa'i srung ba'i 'khor lo'i lte bar dpal ldan	gnas_0 ba_5 srung_10 ba_16 'khor_21 lo_27 lte_32 ba_36 dpal_40 ldan_45 
T02D1897:280a-10	chos kyi 'byung gnas kyi nang na gnas pa'i gzhal	chos_0 kyi_5 'byung_9 gnas_16 kyi_21 nang_25 na_30 gnas_33 ba_38 'jal_43 
T02D1897:280a-11	yas khang du ji ltar 'dod pa'i yon tan lnga'i	yas_0 khang_4 du_10 ji_13 ltar_16 'dod_21 ba_26 yon_31 tan_35 lnga_39 
T02D1897:280a-12	dbang phyug yid du 'ong ba'i gnas phun sum tshogs	dbang_0 phyug_6 yid_12 du_16 'ong_19 ba_24 gnas_29 phun_34 sum_39 tshogs_43 
T02D1897:280a-13	pa na sangs rgyas thams cad yon tan gyis dag	ba_0 na_3 sangs_6 rgya_12 thams_18 cad_24 yon_28 tan_32 gyis_36 'dag_41 
T02D1897:280a-14	pa'i rten dang brten pa'i rang bzhin dag yod pa	ba_0 rten_5 dang_10 rten_15 ba_21 rang_26 bzhin_31 'dag_37 yod_41 ba_45 
T02D1897:280a-15	na bsgrub byar 'dod pa'i rgyal ba lha mo'i 'dod	na_0 sgrub_3 byar_10 'dod_15 ba_20 rgyal_25 ba_31 lha_34 mo_38 'dod_43 
T02D1897:280a-16	pas dam par 'khyud pa'i bya bar gnas shing chags	ba_0 dam_4 ba_8 'khyud_12 ba_19 byed_24 ba_28 gnas_32 shing_37 chags_43 
T02D1897:280a-17	pa'o // de nas gzhan du yang 'gyur ba ste /	ba_0 de_8 nas_11 gzhan_15 du_21 yang_24 'gyur_29 ba_35 ste_38 
T02D1897:280a-18	mchog tu rnam par g-yeng ba'i dga' ba 'jigs pa	mchog_0 tu_6 rnam_9 ba_14 g-yeng_18 ba_25 dga'_30 ba_35 'jigs_38 ba_44 
T02D1897:280a-19	dang chags pa'i skal ba lta bu der dge la	dang_0 chags_5 ba_11 skal_16 ba_21 lta_24 bu_28 der_31 dge_35 la_39 
T02D1897:280a-20	rtog pa med cing thabs kyi blo dang ting nge	rtogs_0 ba_5 med_8 cing_12 thabs_17 kyi_23 blo_27 dang_31 ting_36 nge_41 
T02D1897:280a-21	'dzin las byung ba de bas rab tu gang ba	'dzin_0 las_6 'byung_10 ba_16 de_19 ba_22 rab_26 tu_30 gang_33 ba_38 
T02D1897:280a-22	/ bde ba chen po gang skyes pa //	bde_2 ba_6 chen_9 po_14 gang_17 skye_22 ba_28 
T02D1897:280a-23	'dod pa yon tan lnga rnam pa //	'dod_0 ba_5 yon_8 tan_12 lnga_16 rnam_21 ba_26 
T02D1897:280a-24	bsgoms pa'i stobs kyis gsal ba ni //	sgom_0 ba_7 stobs_12 kyis_18 gsal_23 ba_28 ni_31 
T02D1897:280a-25	nyin mtshan rgyun du mi 'chad pa'o //	nyin_0 mtshan_5 rgyun_12 du_18 mi_21 'chad_24 ba_30 
T02D1897:280a-26	de yi ye shes rtogs rang bzhin //	de_0 yi_3 ye_6 shes_9 rtogs_14 rang_20 bzhin_25 
T02D1897:280a-27	gsal ba yin pas rtogs pa med //	gsal_0 ba_5 yin_8 ba_12 rtogs_16 ba_22 med_25 
T02D1897:280a-28	sna tshogs gnyis su med rang bzhin //	sna_0 tshogs_4 gnyis_11 su_17 med_20 rang_24 bzhin_29 
T02D1897:280a-29	yod med rtogs pas rjod byed phyir //	yod_0 med_4 rtogs_8 ba_14 rjod_18 byed_23 phyir_28 
T02D1897:280a-30	thugs rjes spro ba dang bsdu ba //	thugs_0 rjes_6 spro_11 ba_16 dang_19 sdud_24 ba_29 
T02D1897:280a-31	sngar goms pa yi dbang gis yin //	sngar_0 goms_6 ba_11 yi_14 dbang_17 gis_23 yin_27 
T02D1897:280a-32	lhun grub sems can don yin te ;	lhun_0 'grub_5 sems_10 can_15 don_19 yin_23 te_27 
T02D1897:280a-33	/ de nas yid bzhin nor bu bzhin //	de_2 nas_5 yid_9 bzhin_13 nor_19 bu_23 bzhin_26 
T02D1897:280a-34	de ni lhun gyis grub pas na //	de_0 ni_3 lhun_6 gyis_11 'grub_16 ba_21 na_25 
T02D1897:280a-35	rtag tu ma nyams pa yi blo //	rtag_0 tu_5 ma_8 nyams_11 ba_17 yi_20 blo_23 
T02D1897:280a-36	nam mkha'i mthas gtugs 'gro ba yi //	nam_0 mkha_4 mthas_11 gtugs_17 'gro_23 ba_28 yi_31 
T02D1897:280a-37	don byed pa la rab tu 'jug / de bas	don_0 byed_4 ba_9 la_12 rab_15 tu_19 'jug_22 de_29 ba_32 
T02D1897:280a-38	'di ltar sku dang ldan pa shes rab la 'khyud	'di_0 ltar_4 sku_9 dang_13 ldan_18 ba_23 shes_26 rab_31 la_35 'khyud_38 
T02D1897:280a-39	pa rang gsal rang bzhin te /	ba_0 rang_3 gsal_8 rang_13 bzhin_18 te_24 
T02D1897:280a-40	mchog tu thugs rjes rab tu rgyun chud pa dang rnam par bral ba'i sku //	mchog_0 tu_6 thugs_9 rjes_15 rab_20 tu_24 rgyun_27 chud_33 ba_38 dang_41 rnam_46 ba_51 'bral_55 ba_60 sku_65 
T02D1897:280a-41	dpe med pa yi bde gang rten dang brten pa'i rang bzhin ni //	dpe_0 med_4 ba_8 yi_11 bde_14 gang_18 rten_23 dang_28 rten_33 ba_39 rang_44 bzhin_49 ni_55 
T02D1897:280a-42	thub pa'i dbang po'i yan lag bdun dang ldan pa la phyag 'tshal //	thub_0 ba_5 dbang_10 po_16 yan_21 lag_25 bdun_29 dang_34 ldan_39 ba_44 la_47 phyag_50 'tshal_56 
T02D1897:280a-43	'di ldan yan lag bdun dang ldan pa'i bzhi pa ni bsgrub bya'o //	'di_0 ldan_4 yan_9 lag_13 bdun_17 dang_22 ldan_27 ba_32 bzhi_37 ba_42 ni_45 sgrub_48 byed_55 
T02D1897:280b-0	'di nyid ni @280b phyag rgya chen po'i dngos grub tu brjod do //	'di_0 nyid_4 ni_9 phyag_18 rgya_24 chen_29 po_34 dngos_39 'grub_45 tu_50 rjod_53 do_59 
T02D1897:280b-1	kha cig slar yang 'di lta bu bsgrub bya yin par smra ste /	kha_0 cig_4 slar_8 yang_13 'di_18 lta_22 bu_26 sgrub_29 byed_36 yin_40 ba_44 smra_48 ste_53 
T02D1897:280b-2	shes rab dang ye shes kyi dbang gi dus na	shes_0 rab_5 dang_9 ye_14 shes_17 kyi_22 dbang_26 gi_32 dus_35 na_39 
T02D1897:280b-3	bla ma'i man ngag gis so sor bdag nyid rig	bla_0 ma_4 man_9 ngag_13 gis_18 so_22 sor_25 bdag_29 nyid_34 rig_39 
T02D1897:280b-4	cing / mchog dga' dang dga' bral gyi dus su	cing_0 mchog_7 dga'_13 dang_18 dga'_23 'bral_28 gyi_33 dus_37 su_41 
T02D1897:280b-5	gnas pa chos thams cad kyi gcig tu lhan cig	gnas_0 ba_5 chos_8 thams_13 cad_19 kyi_23 gcig_27 tu_32 lhan_35 cig_40 
T02D1897:280b-6	skyes pa phyag dang zhal dang kha dog dang /	skye_0 ba_6 phyag_9 dang_15 zhal_20 dang_25 kha_30 dog_34 dang_38 
T02D1897:280b-7	dbyibs la sogs pa'i rnam pa thams cad kyi dri ma las grol ba /	dbyibs_0 la_7 sogs_10 ba_15 rnam_20 ba_25 thams_28 cad_34 kyi_38 'dri_42 ma_46 las_49 grol_53 ba_58 
T02D1897:280b-8	nam mkha' dang mtshungs pa mtha' yas pa'i de bzhin	nam_0 mkha'_4 dang_10 mtshungs_15 ba_24 mtha'_27 yas_33 ba_37 de_42 bzhin_45 
T02D1897:280b-9	gshegs pa'i yon tan rin po che rdzogs pa'i bdag	gshegs_0 ba_7 yon_12 tan_16 rin_20 po_24 che_27 rdzogs_31 ba_38 bdag_43 
T02D1897:280b-10	nyid 'gro ba ma lus pa'i don byed pa kun	nyid_0 'gro_5 ba_10 ma_13 lus_16 ba_20 don_25 byed_29 ba_34 kun_37 
T02D1897:280b-11	rdzob tu longs spyod rdzogs pa dang /	rdzob_0 tu_6 longs_9 spyod_15 rdzogs_21 ba_28 dang_31 
T02D1897:280b-12	sprul pa'i sku gnyis kyi rten du gyur pa /	sprul_0 ba_6 sku_11 gnyis_15 kyi_21 rten_25 du_30 gyur_33 ba_38 
T02D1897:280b-13	yid bzhin gyi nor bu bzhin du rtog pa med	yid_0 bzhin_4 gyi_10 nor_14 bu_18 bzhin_21 du_27 rtogs_30 ba_35 med_38 
T02D1897:280b-14	kyang mngon par 'dod pa'i don thams cad sgrub par	kyang_0 mngon_6 ba_12 'dod_16 ba_21 don_26 thams_30 cad_36 sgrub_40 ba_46 
T02D1897:280b-15	byed pa / thog ma dang tha ma med pa	byed_0 ba_5 thogs_10 ma_15 dang_18 tha_23 ma_27 med_30 ba_34 
T02D1897:280b-16	sgyu ma lta bu spros pa thams cad dang bral	sgyu_0 ma_5 lta_8 bu_12 spros_15 ba_21 thams_24 cad_30 dang_34 'bral_39 
T02D1897:280b-17	byed pa / ba / gsal ba zag pa med pa bde ba chen po'i rang bzhin tsam /	byed_0 ba_5 ba_10 gsal_15 ba_20 zag_23 ba_27 med_30 ba_34 bde_37 ba_41 chen_44 po_49 rang_54 bzhin_59 tsam_65 
T02D1897:280b-18	de bzhin gshegs pa thams cad kyi chos kyi sku'i bdag nyid blang bar bya'o //	de_0 bzhin_3 gshegs_9 ba_16 thams_19 cad_25 kyi_29 chos_33 kyi_38 sku_42 bdag_48 nyid_53 blang_58 ba_64 byed_68 
T02D1897:280b-19	'di yang rtag tu shar ba'i phyir ma rig pa tsam rnam par log pas thob par bya'o //	'di_0 yang_4 rtag_9 tu_14 'char_17 ba_22 phyir_27 ma_33 rig_36 ba_40 tsam_43 rnam_48 ba_53 log_57 ba_61 'thob_65 ba_70 byed_74 
T02D1897:280b-20	med pa nyid yin na yang bsgoms pa'i stobs kyis rdzogs par bya ba'o //	med_0 ba_4 nyid_7 yin_12 na_16 yang_19 sgom_24 ba_31 stobs_36 kyis_42 rdzogs_47 ba_54 byed_58 ba_62 
T02D1897:280b-21	'di ni nges par gdams ngag ngan pa yin pa'i phyir thag ring du spang bar bya'o //	'di_0 ni_4 nges_7 ba_12 'doms_16 ngag_22 ngan_27 ba_32 yin_35 ba_39 phyir_44 thag_50 ring_55 du_60 spong_63 ba_69 byed_73 
T02D1897:280b-22	'di ltar yang bde ba chen po gcig pu mngon	'di_0 ltar_4 yang_9 bde_14 ba_18 chen_21 po_26 gcig_29 pu_34 mngon_37 
T02D1897:280b-23	par 'dod pa'i bsgrub bya yin pa nyid du ci	ba_0 'dod_4 ba_9 sgrub_14 byed_21 yin_25 ba_29 nyid_32 du_37 ci_40 
T02D1897:280b-24	lung gis bsgrubs pas sam /	lung_0 gis_5 sgrub_9 ba_17 sam_21 
T02D1897:280b-25	dgag par bya ba ma yin pas sam /	'gog_0 ba_5 byed_9 ba_13 ma_16 yin_19 ba_23 sam_27 
T02D1897:280b-26	de gcig tu rdzogs par byed pa'i tshogs pa yod pas sam /	de_0 gcig_3 tu_8 rdzogs_11 ba_18 byed_22 ba_27 tshogs_32 ba_39 yod_42 ba_46 sam_50 
T02D1897:280b-27	de gcig pu 'dod pa srid pas sam /	de_0 gcig_3 pu_8 'dod_11 ba_16 srid_19 ba_24 sam_28 
T02D1897:280b-28	shes rab ye shes kyi dus na de tsam rab tu snang bas sam /	shes_0 rab_5 ye_9 shes_12 kyi_17 dus_21 na_25 de_28 tsam_31 rab_36 tu_40 snang_43 ba_49 sam_53 
T02D1897:280b-29	man ngag brgyud pa las 'ongs pa yin zhes brtag pa bdun no //	man_0 ngag_4 brgyud_9 ba_16 las_19 'ongs_23 ba_29 yin_32 zhes_36 rtog_41 ba_47 bdun_50 no_55 
