T02D1407:110a-9	pro tam g'i zhes pa la sogs pa ni ji ltar gsungs pa bzhin pas go sla'o //	pro_0 tam_4 g_8 zhes_12 ba_17 la_20 sogs_23 ba_28 ni_31 ji_34 ltar_37 gsungs_42 ba_49 bzhin_52 ba_58 go_62 sla_65 
T02D1407:110a-10	skad de dag la sbyar ba de nyid rnal 'byor bas the tshom zi za'o //	skad_0 de_5 'dag_8 la_12 sbyor_15 ba_21 de_24 nyid_27 rnal_32 'byor_37 ba_43 the_47 tshom_51 zi_57 za_60 
T02D1407:110a-11	'di dag ni dpal he ru ka bde mchog gi	'di_0 'dag_4 ni_8 dpal_11 he_16 ru_19 ka_22 bde_25 mchog_29 gi_35 
T02D1407:110a-12	'grel pa sgrub thabs rnams kyi gnas zhes bya ba	'grel_0 ba_6 sgrub_9 thabs_15 rnams_21 kyi_27 gnas_31 zhes_36 byed_41 ba_45 
T02D1407:110a-13	las le'u nyi shu rtsa bzhi pa'i rnam par bshad	las_0 le_4 nyi_9 shu_13 rtsa_17 bzhi_22 ba_27 rnam_32 ba_37 'chad_41 
T02D1407:110a-14	pa'o / //	ba_0 
T02D1407:110a-15	/ de nas don kun la ni 'dod pa'i zhes	de_2 nas_5 don_9 kun_13 la_17 ni_20 'dod_23 ba_28 zhes_33 
T02D1407:110a-16	pa la sogs pa'i don ni 'di dag la brgyad	ba_0 la_3 sogs_6 ba_11 don_16 ni_20 'di_23 'dag_27 la_31 brgyad_34 
T02D1407:110a-17	po mthar sbyar gsungs pa zhes pa ni yang dag	po_0 mthar_3 sbyor_9 gsungs_15 ba_22 zhes_25 ba_30 ni_33 yang_36 'dag_41 
T02D1407:110a-18	par sbyar te / de la brgyad pa'i mtha' ni yi ge ha'o //	ba_0 sbyor_4 te_10 de_15 la_18 brgyad_21 ba_28 mtha'_33 ni_39 yi_42 ge_45 ha_48 
T02D1407:110a-19	de nyid la yi ge au dang thig ler ldan par bya'o //	de_0 nyid_3 la_8 yi_11 ge_14 au_17 dang_20 thig_25 ler_30 ldan_34 ba_39 byed_43 
T02D1407:110a-20	des na 'di ltar 'gyur te /	des_0 na_4 'di_7 ltar_11 'gyur_16 te_22 
T02D1407:110a-21	aom na mo bha ga wa te p'i re sh'a ya /	aom_0 na_4 mo_7 bha_10 ga_14 wa_17 te_20 p_23 re_27 sh_30 ya_35 
T02D1407:110a-22	ma h'a zhes pa la sogs pa gsal lo //	ma_0 h_3 zhes_7 ba_12 la_15 sogs_18 ba_23 gsal_26 lo_31 
T02D1407:110a-23	'di dag ni dpal he ru ka bde mchog gi	'di_0 'dag_4 ni_8 dpal_11 he_16 ru_19 ka_22 bde_25 mchog_29 gi_35 
T02D1407:110a-24	'grel pa sgrub thabs rnams kyi gnas zhes bya ba	'grel_0 ba_6 sgrub_9 thabs_15 rnams_21 kyi_27 gnas_31 zhes_36 byed_41 ba_45 
T02D1407:110a-25	las le'u nyi shu rtsa lnga pa'i rnam par bshad	las_0 le_4 nyi_9 shu_13 rtsa_17 lnga_22 ba_27 rnam_32 ba_37 'chad_41 
T02D1407:110a-26	pa'o / //	ba_0 
T02D1407:110a-27	/ de nas gzhan na med pa zhes bya ba	de_2 nas_5 gzhan_9 na_15 med_18 ba_22 zhes_25 byed_30 ba_34 
T02D1407:110a-28	la sogs pa ni dpal he ru ka bdag nyid	la_0 sogs_3 ba_8 ni_11 dpal_14 he_19 ru_22 ka_25 bdag_28 nyid_33 
T02D1407:110a-29	chen po'o // rim dang rim bzlog pa'i zhes pa ni rim pa bzhin du bslang bar bya'o //	chen_0 po_5 rim_13 dang_17 rim_22 bzlog_26 ba_32 zhes_37 ba_42 ni_45 rim_48 ba_52 bzhin_55 du_61 bslang_64 ba_71 byed_75 
T02D1407:110a-30	steng 'og dngos grub rtag tu ster //	steng_0 'og_6 dngos_10 'grub_16 rtag_21 tu_26 ster_29 
T02D1407:110a-31	zhes pa ni 'og ces pa ni sa 'og la sogs pa gang cung zad yod do cog go //	zhes_0 ba_5 ni_8 'og_11 ces_15 ba_19 ni_22 sa_25 'og_28 la_32 sogs_35 ba_40 gang_43 cung_48 zad_53 yod_57 do_61 cog_64 go_68 
T02D1407:110a-32	steng zhes pa ni steng gi dngos grub ste /	steng_0 zhes_6 ba_11 ni_14 steng_17 gi_23 dngos_26 'grub_32 ste_37 
T02D1407:110a-33	phyag rgya chen po'o //	phyag_0 rgya_6 chen_11 po_16 
T02D1407:110a-34	pho nya ma zhes pa la /	pho_0 nya_4 ma_8 zhes_11 ba_16 la_19 
T02D1407:110a-35	pho nya ma dang 'dra bas pho nya rnams su 'gyur te /	pho_0 nya_4 ma_8 dang_11 'dra_16 ba_21 pho_25 nya_29 rnams_33 su_39 'gyur_42 te_48 
T02D1407:110a-36	thams cad phun sum tshogs pa'i byang chub thams cad	thams_0 cad_6 phun_10 sum_15 tshogs_19 ba_26 byang_31 chub_37 thams_42 cad_48 
T02D1407:110a-37	nges par ster bar gnas pa gnyis su med pa	nges_0 ba_5 ster_9 ba_14 gnas_18 ba_23 gnyis_26 su_32 med_35 ba_39 
T02D1407:110a-38	dga' ba'i gzugs can no //	dga'_0 ba_5 gzugs_10 can_16 no_20 
T02D1407:110a-39	bdag gi pho nya ma zhes pa ni de dang	bdag_0 gi_5 pho_8 nya_12 ma_16 zhes_19 ba_24 ni_27 de_30 dang_33 
T02D1407:110a-40	lhan cig tu spyod cing mngon du spyad par bya	lhan_0 cig_5 tu_9 spyod_12 cing_18 mngon_23 du_29 spyod_32 ba_38 byed_42 
T02D1407:110a-41	ba ma'o // kun 'gro zhes pa ni skal ba	ba_0 ma_3 kun_11 'gro_15 zhes_20 ba_25 ni_28 skal_31 ba_36 
T02D1407:110a-42	dang ldan pa'i sems can la don so sor sgrub	dang_0 ldan_5 ba_10 sems_15 can_20 la_24 don_27 so_31 sor_34 sgrub_38 
T02D1407:110a-43	ba ma'o // par byed pa'o // rtag par 'khyud cing 'o bya'o //	ba_0 ma_3 ba_11 byed_15 ba_20 rtag_28 ba_33 'khyud_37 cing_44 'o_49 byed_52 
T02D1407:110b-0	zhes pa la sogs pa ni dus thams cad du sbyin @110b par bya ba'o //	zhes_0 ba_5 la_8 sogs_11 ba_16 ni_19 dus_22 thams_26 cad_32 du_36 sbyin_39 ba_51 byed_55 ba_59 
T02D1407:110b-1	rnal 'byor gyi gnas khyad par phyir //	rnal_0 'byor_5 gyi_11 gnas_15 khyad_20 ba_26 phyir_30 
T02D1407:110b-2	zhes pa 'di dag la gnas ni sa gzhir gsungs pa ste /	zhes_0 ba_5 'di_8 'dag_12 la_16 gnas_19 ni_24 sa_27 gzhir_30 gsungs_36 ba_43 ste_46 
T02D1407:110b-3	gnas zhes pa ni mchog gi padma'i dkyil 'khor la gsungs so //	gnas_0 zhes_5 ba_10 ni_13 mchog_16 gi_22 padma_25 dkyil_33 'khor_39 la_45 gsungs_48 so_55 
T02D1407:110b-4	gnas pa ni gnyis su med pa'i dga' ba las	gnas_0 ba_5 ni_8 gnyis_11 su_17 med_20 ba_24 dga'_29 ba_34 las_37 
T02D1407:110b-5	byung ba'i rgyal po gang gnas pa'i bde ba chen	'byung_0 ba_6 rgyal_11 po_17 gang_20 gnas_25 ba_30 bde_35 ba_39 chen_42 
T02D1407:110b-6	po'o // de'i phyir na mchog gi padma ni gnas te /	po_0 de_8 phyir_13 na_19 mchog_22 gi_28 padma_31 ni_37 gnas_40 te_45 
T02D1407:110b-7	khrag dang ga pur gyis yongs su gang ba'i khyad	khrag_0 dang_6 ga_11 pur_14 gyis_18 yongs_23 su_29 gang_32 ba_37 khyad_42 
T02D1407:110b-8	par can yin pas na der tsumba na bya zhing	ba_0 can_4 yin_8 ba_12 na_16 der_19 tsumba_23 na_30 byed_33 zhing_37 
T02D1407:110b-9	lce rtse ba sgril pas brud cing chang gis 'thung	lce_0 rtse_4 ba_9 sgril_12 ba_18 'brud_22 cing_27 chang_32 gis_38 'thung_42 
T02D1407:110b-10	ba dang ldan pas na sems rab tu dga' bar	ba_0 dang_3 ldan_8 ba_13 na_17 sems_20 rab_25 tu_29 dga'_32 ba_37 
T02D1407:110b-11	bya'o // de nas rdo rje dang padma yang dag par sbyor bas rol par bya'o //	byed_0 de_9 nas_12 rdo_16 rje_20 dang_24 padma_29 yang_35 'dag_40 ba_44 sbyor_48 ba_54 rol_58 ba_62 byed_66 
T02D1407:110b-12	ji srid rnal 'byor tshogs rnams ni //	ji_0 srid_3 rnal_8 'byor_13 tshogs_19 rnams_26 ni_32 
T02D1407:110b-13	zhes pas ni dga' ba'i bstan bcos las bshad pa lta bu ste /	zhes_0 ba_5 ni_9 dga'_12 ba_17 ston_22 'chos_28 las_33 'chad_37 ba_43 lta_46 bu_50 ste_53 
T02D1407:110b-14	bcing ba dang rtse ba dag go //	'ching_0 ba_6 dang_9 rtse_14 ba_19 'dag_22 go_26 
T02D1407:110b-15	de lta rdo rje sems dpa'i yang gsungs pas byang chub rab tu bsgrubs te /	de_0 lta_3 rdo_7 rje_11 sems_15 dpa_20 yang_26 gsungs_31 ba_38 byang_42 chub_48 rab_53 tu_57 sgrub_60 te_68 
T02D1407:110b-16	rang bzhin so so'i mtshan nyid shes par byas la /	rang_0 bzhin_5 so_11 so_14 mtshan_19 nyid_26 shes_31 ba_36 byed_40 la_45 
T02D1407:110b-17	de dang mthun pas sbyin par bya'o //	de_0 dang_3 mthun_8 ba_14 sbyin_18 ba_24 byed_28 
T02D1407:110b-18	thams cad bden pa'i ngo bo las /	thams_0 cad_6 bden_10 ba_15 ngo_20 'bo_24 las_27 
T02D1407:110b-19	gzhan du nam yang mi bya'o //	gzhan_0 du_6 nam_9 yang_13 mi_18 byed_21 
T02D1407:110b-20	de nas ma dang bu mo cha blang ma zhes	de_0 nas_3 ma_7 dang_10 bu_15 mo_18 cha_21 blang_25 ma_31 zhes_34 
T02D1407:110b-21	pa la sogs pa'i don ni ji lta ba bzhin	ba_0 la_3 sogs_6 ba_11 don_16 ni_20 ji_23 lta_26 ba_30 bzhin_33 
T02D1407:110b-22	no // gang gi rtag tu sngags sbyin pa //	no_0 gang_6 gi_11 rtag_14 tu_19 sngags_22 sbyin_29 ba_35 
T02D1407:110b-23	zhes pa ni de rnams kyi phyag rgya de lta	zhes_0 ba_5 ni_8 de_11 rnams_14 kyi_20 phyag_24 rgya_30 de_35 lta_38 
T02D1407:110b-24	bu nyid kyis shes rab kyi ye shes sbyin pa'o	bu_0 nyid_3 kyis_8 shes_13 rab_18 kyi_22 ye_26 shes_29 sbyin_34 ba_40 
T02D1407:110b-25	// rnal 'byor gyi ni rgyud rnams la //	rnal_3 'byor_8 gyi_14 ni_18 brgyud_21 rnams_27 la_33 
T02D1407:110b-26	rnyed dka'i dam tshig rnams bshad bya //	rnyed_0 dka_6 dam_12 tshig_16 rnams_22 'chad_28 byed_34 
T02D1407:110b-27	zhes pa ni gsal lo //	zhes_0 ba_5 ni_8 gsal_11 lo_16 
T02D1407:110b-28	dpal ldan he ru ka nyid las //	dpal_0 ldan_5 he_10 ru_13 ka_16 nyid_19 las_24 
T02D1407:110b-29	rnal 'byor ma chog ni gzhan med do //	rnal_0 'byor_5 ma_11 chog_14 ni_19 gzhan_22 med_28 do_32 
T02D1407:110b-30	zhes pa ni gang gsungs pa de thams cad dpal	zhes_0 ba_5 ni_8 gang_11 gsungs_16 ba_23 de_26 thams_29 cad_35 dpal_39 
T02D1407:110b-31	he ru ka rnal 'byor du bya ba las gzhan	he_0 ru_3 ka_6 rnal_9 'byor_14 du_20 byed_23 ba_27 las_30 gzhan_34 
T02D1407:110b-32	na med do zhes bya ba'i don to //	na_0 med_3 do_7 zhes_10 byed_15 ba_19 don_24 to_28 
T02D1407:110b-33	de bas na rnal 'byor gyi yum slob dpon te zhes gsungs te /	de_0 ba_3 na_7 rnal_10 'byor_15 gyi_21 yum_25 slob_29 dpon_34 te_39 zhes_42 gsungs_47 te_54 
T02D1407:110b-34	rnal 'byor rnams kyi slob dpon ni rnal 'byor rnams kyi ma'o //	rnal_0 'byor_5 rnams_11 kyi_17 slob_21 dpon_26 ni_31 rnal_34 'byor_39 rnams_45 kyi_51 ma_55 
T02D1407:110b-35	de'i phyir na brnyas mi bya zhing zhes pa la sogs pa gsungs so //	de_0 phyir_5 na_11 brnyas_14 mi_21 byed_24 zhing_28 zhes_34 ba_39 la_42 sogs_45 ba_50 gsungs_53 so_60 
T02D1407:110b-36	lha gzhan la ni kun sbyor ba //	lha_0 gzhan_4 la_10 ni_13 kun_16 sbyor_20 ba_26 
T02D1407:110b-37	zhes pa ni snying rje chen po dang rab tu	zhes_0 ba_5 ni_8 snying_11 rje_18 chen_22 po_27 dang_30 rab_35 tu_39 
T02D1407:110b-38	dga' ba'i thabs su sbyor ba'i mchog 'di bor nas	dga'_0 ba_5 thabs_10 su_16 sbyor_19 ba_25 mchog_30 'di_36 'bor_40 nas_44 
T02D1407:110b-39	gzhan la'o // kun sbyor bar zhes pa ni dngos	gzhan_0 la_6 kun_14 sbyor_18 ba_24 zhes_28 ba_33 ni_36 dngos_39 
T02D1407:110b-40	grub kyi don la sbyor ba lhag pa'i lha las	'grub_0 kyi_5 don_9 la_13 sbyor_16 ba_22 lhag_25 ba_30 lha_35 las_39 
T02D1407:110b-41	gzhan par kun du 'dod pa'o //	gzhan_0 ba_6 kun_10 du_14 'dod_17 ba_22 
T02D1407:111a-0	de ni gang dngos grub 'dod pa la rnam par rmongs pa ste dmus @111a * //	de_0 ni_3 gang_6 dngos_11 'grub_17 'dod_22 ba_27 la_30 rnam_33 ba_38 rmongs_42 ba_49 ste_52 dmus_56 
T02D1407:111a-1	long lta bu'o //	long_0 lta_5 bu_9 
T02D1407:111a-2	de ni sdug bsngal mang pos gdungs pa ha cang yang ches te /	de_0 ni_3 sdug_6 sngal_11 mang_18 pos_23 gdung_27 ba_34 ha_37 cang_40 yang_45 ches_50 te_55 
T02D1407:111a-3	rgyal po rgyal srid dang bral nas mi tha mal ngar gyur pa lta bu'o //	rgyal_0 po_6 rgyal_9 srid_15 dang_20 'bral_25 nas_30 mi_34 tha_37 mal_41 ngar_45 gyur_50 ba_55 lta_58 bu_62 
T02D1407:111a-4	lha mo gzhan dang kun sbyor ba //	lha_0 mo_4 gzhan_7 dang_13 kun_18 sbyor_22 ba_28 
T02D1407:111a-5	zhes pa la kun sbyor ba zhes pa ni rnam pa mang por rol pa la gsungs te /	zhes_0 ba_5 la_8 kun_11 sbyor_15 ba_21 zhes_24 ba_29 ni_32 rnam_35 ba_40 mang_43 por_48 rol_52 ba_56 la_59 gsungs_62 te_69 
T02D1407:111a-6	rnam par mi rtog pa'i sems kyis rigs thams cad la mnyam par sbyar ba'o //	rnam_0 ba_5 mi_9 rtogs_12 ba_17 sems_22 kyis_27 rigs_32 thams_37 cad_43 la_47 mnyam_50 ba_56 sbyor_60 ba_66 
T02D1407:111a-7	mi mo'i spyod dang gtsub shing du //	mi_0 mo_3 spyod_8 dang_14 gtsub_19 shing_25 du_31 
T02D1407:111a-8	zhes pa ni dbang po gnyis rab tu sbyor ba ste /	zhes_0 ba_5 ni_8 dbang_11 po_17 gnyis_20 rab_26 tu_30 sbyor_33 ba_39 ste_42 
T02D1407:111a-9	rna ba la sogs pa'i dbang po thams cad bde	rna_0 ba_4 la_7 sogs_10 ba_15 dbang_20 po_26 thams_29 cad_35 bde_39 
T02D1407:111a-10	bar bsdu zhing yang dag pa'i snying po gang la	ba_0 sdud_4 zhing_9 yang_15 'dag_20 ba_24 snying_29 po_36 gang_39 la_44 
T02D1407:111a-11	kun du spyod pa'i khyab bdag go //	kun_0 du_4 spyod_7 ba_13 khyab_18 bdag_24 go_29 
T02D1407:111a-12	tshangs spyod de bzhin bsam gtan dang //	tshangs_0 spyod_8 de_14 bzhin_17 bsam_23 gtan_28 dang_33 
T02D1407:111a-13	zhes pa la /	zhes_0 ba_5 la_8 
T02D1407:111a-14	tshangs spyod ces pa ni stong pa nyid du 'gyur pa la dran pa'i sbyor ba ma spangs pa'o //	tshangs_0 spyod_8 ces_14 ba_18 ni_21 stong_24 ba_30 nyid_33 du_38 'gyur_41 ba_47 la_50 dran_53 ba_58 sbyor_63 ba_69 ma_72 spong_75 ba_82 
T02D1407:111a-15	de yang bde ba byang chub kyi lam dag pa	de_0 yang_3 bde_8 ba_12 byang_15 chub_21 kyi_26 lam_30 'dag_34 ba_38 
T02D1407:111a-16	de kho na nyid bla na med pa'i dam tshig	de_0 kho_3 na_7 nyid_10 bla_15 na_19 med_22 ba_26 dam_31 tshig_35 
T02D1407:111a-17	la spyod pa 'dzin cing brtags pa ste /	la_0 spyod_3 ba_9 'dzin_12 cing_18 rtog_23 ba_30 ste_33 
T02D1407:111a-18	byang chub pa sgrub pa pos rtag tu shes par bya ste /	byang_0 chub_6 ba_11 sgrub_14 ba_20 pos_23 rtag_27 tu_32 shes_35 ba_40 byed_44 ste_48 
T02D1407:111a-19	yang dag par gnas la byang chub bsgrub par bya'o //	yang_0 'dag_5 ba_9 gnas_13 la_18 byang_21 chub_27 sgrub_32 ba_39 byed_43 
T02D1407:111a-20	lhag ma rnams ni go sla'o //	lhag_0 ma_5 rnams_8 ni_14 go_17 sla_20 
T02D1407:111a-21	rgyud rnams kun gyi thun mong ste //	brgyud_0 rnams_6 kun_12 gyi_16 thun_20 mong_25 ste_30 
T02D1407:111a-22	zhes pa ni bya ba dang spyod pa dang /	zhes_0 ba_5 ni_8 byed_11 ba_15 dang_18 spyod_23 ba_29 dang_32 
T02D1407:111a-23	rnal 'byor dang rnal 'byor bla na med pa la sogs pa ste /	rnal_0 'byor_5 dang_11 rnal_16 'byor_21 bla_27 na_31 med_34 ba_38 la_41 sogs_44 ba_49 ste_52 
T02D1407:111a-24	rnal 'byor ma chen po'i rgyud kyi rang bzhin la bya ba 'dra bar sbyar bas mi gzhom mo //	rnal_0 'byor_5 ma_11 chen_14 po_19 brgyud_24 kyi_30 rang_34 bzhin_39 la_45 byed_48 ba_52 'dra_55 ba_60 sbyor_64 ba_70 mi_74 'joms_77 mo_83 
T02D1407:111a-25	des na /	des_0 na_4 
T02D1407:111a-26	rgyu med par ni gzhom mi bya //	rgyu_0 med_5 ba_9 ni_13 'joms_16 mi_22 byed_25 
T02D1407:111a-27	zhes pa smos te /	zhes_0 ba_5 smos_8 te_13 
T02D1407:111a-28	go 'phang mtshungs par ma mthong ngo //	go_0 'phen_3 mtshungs_10 ba_19 ma_23 mthong_26 ngo_33 
T02D1407:111a-29	rgyud de dang de dag la rgyu'am gtan tshigs med	brgyud_0 de_6 dang_9 de_14 'dag_17 la_21 rgyu_24 gtan_32 tshigs_37 med_44 
T02D1407:111a-30	pas na dam tshig gi spyod pa sbas shing gang	ba_0 na_4 dam_7 tshig_11 gi_17 spyod_20 ba_26 sbed_29 shing_34 gang_40 
T02D1407:111a-31	la spyod pa ming tsam yang sbyin par mi bya	la_0 spyod_3 ba_9 ming_12 tsam_17 yang_22 sbyin_27 ba_33 mi_37 byed_40 
T02D1407:111a-32	zhing skal ba dang ldan pa'i sems can rnams la	zhing_0 skal_6 ba_11 dang_14 ldan_19 ba_24 sems_29 can_34 rnams_38 la_44 
T02D1407:111a-33	bshad par bya'o // khra sogs pho nya brgyad po la //	'chad_0 ba_6 byed_10 khra_19 sogs_24 pho_29 nya_33 brgyad_37 po_44 la_47 
T02D1407:111a-34	drod dang da pa 'phel byed cing //	drod_0 dang_5 da_10 ba_13 'phel_16 byed_22 cing_27 
T02D1407:111a-35	zhes pa ni 'dod pa'i de kho na nyid phun sum tshogs pa ster bar nges pa ste /	zhes_0 ba_5 ni_8 'dod_11 ba_16 de_21 kho_24 na_28 nyid_31 phun_36 sum_41 tshogs_45 ba_52 ster_55 ba_60 nges_64 ba_69 ste_72 
T02D1407:111a-36	kun du khyab pa'i byang chub kyi lam du gnas pa'o //	kun_0 du_4 khyab_7 ba_13 byang_18 chub_24 kyi_29 lam_33 du_37 gnas_40 ba_45 
T02D1407:111a-37	dad pa tsam gyis blang bya yi //	dad_0 ba_4 tsam_7 gyis_12 blang_17 byed_23 yi_27 
T02D1407:111a-38	zhes pa la /	zhes_0 ba_5 la_8 
T02D1407:111a-39	dad pa tsam gyis zhes pa ni dad pa'i rgyus chos ston la /	dad_0 ba_4 tsam_7 gyis_12 zhes_17 ba_22 ni_25 dad_28 ba_32 rgyus_37 chos_43 ston_48 la_53 
T02D1407:111a-40	de la shes rab kyi rgyus de kho na nyid rig par byed pa'o //	de_0 la_3 shes_6 rab_11 kyi_15 rgyus_19 de_25 kho_28 na_32 nyid_35 rig_40 ba_44 byed_48 ba_53 
T02D1407:111a-41	de skad du brtag pa'i rgyal po gnyis pa las /	de_0 skad_3 du_8 rtog_11 ba_17 rgyal_22 po_28 gnyis_31 ba_37 las_40 
T02D1407:111a-42	nya phyis kyis min lag pas ma ni //	nya_0 'byid_4 kyis_10 min_15 lag_19 ba_23 ma_27 ni_30 
T02D1407:111b-0	@111b rig pa lce yis myong byas na //	rig_6 ba_10 lce_13 yis_17 myong_21 byed_27 na_32 
T02D1407:111b-1	tshe ring nad kyang med pa'o //	tshe_0 ring_5 nad_10 kyang_14 med_20 ba_24 
T02D1407:111b-2	zhes so //	zhes_0 so_5 
T02D1407:111b-3	ye shes bskyed pa'i rgyu ni //	ye_0 shes_3 skyed_8 ba_15 rgyu_20 ni_25 
T02D1407:111b-4	blo ldan mthe'u chung bskyod par ni //	blo_0 ldan_4 mthe_9 chung_16 skyod_22 ba_29 ni_33 
T02D1407:111b-5	zhes pa ste /	zhes_0 ba_5 ste_8 
T02D1407:111b-6	mthe'u chung zhes pa ni mthe'u chung ste sor mo tha ma'o //	mthe_0 chung_7 zhes_13 ba_18 ni_21 mthe_24 chung_31 ste_37 sor_41 mo_45 tha_48 ma_52 
T02D1407:111b-7	des rab tu bskul ba ni bskyod pa'o //	des_0 rab_4 tu_8 skul_11 ba_17 ni_20 skyod_23 ba_30 
T02D1407:111b-8	de yang lo grangs bcu gnyis ma'i skye gnas su	de_0 yang_3 lo_8 grangs_11 'chu_18 gnyis_22 ma_28 skye_33 gnas_38 su_43 
T02D1407:111b-9	bcug pa las byung ba lces blangs na bcud kyis	'jug_0 ba_5 las_8 'byung_12 ba_18 lces_21 blangs_26 na_33 bcud_36 kyis_41 
T02D1407:111b-10	len 'grub par byed pas bde ba chen po bskyed	len_0 'grub_4 ba_10 byed_14 ba_19 bde_23 ba_27 chen_30 po_35 skyed_38 
T02D1407:111b-11	pa'i rgyu yin no //	ba_0 rgyu_5 yin_10 no_14 
T02D1407:111b-12	sgrub pa rnam pa gsum du gnas //	sgrub_0 ba_6 rnam_9 ba_14 gsum_17 du_22 gnas_25 
T02D1407:111b-13	zhes pa ni sgrub pa po dman pa dang /	zhes_0 ba_5 ni_8 sgrub_11 ba_17 po_20 dman_23 ba_28 dang_31 
T02D1407:111b-14	'bring dang mchog tu gyur pa 'di dag gi dbye ba'o //	'bring_0 dang_7 mchog_12 tu_18 gyur_21 ba_26 'di_29 'dag_33 gi_37 'byed_40 ba_45 
T02D1407:111b-15	'di dag ni dpal he ru ka bde mchog gi	'di_0 'dag_4 ni_8 dpal_11 he_16 ru_19 ka_22 bde_25 mchog_29 gi_35 
T02D1407:111b-16	'grel ba sgrub thabs rnams kyi gnas zhes bya ba	'grel_0 ba_6 sgrub_9 thabs_15 rnams_21 kyi_27 gnas_31 zhes_36 byed_41 ba_45 
T02D1407:111b-17	las le'u nyi shu rtsa drug pa'i rnam par bshad	las_0 le_4 nyi_9 shu_13 rtsa_17 drug_22 ba_27 rnam_32 ba_37 'chad_41 
T02D1407:111b-18	pa'o / //	ba_0 
T02D1407:111b-19	/ de nas brtul zhugs spyod pa zhes pa la	de_2 nas_5 brtul_9 'jug_15 spyod_21 ba_27 zhes_30 ba_35 la_38 
T02D1407:111b-20	sogs pas ni le'u nyi shu rtsa bdun pa ston	sogs_0 ba_5 ni_9 le_12 nyi_17 shu_21 rtsa_25 bdun_30 ba_35 ston_38 
T02D1407:111b-21	to // de la spyod pa rnams ni spyod pa'o //	to_0 de_6 la_9 spyod_12 ba_18 rnams_21 ni_27 spyod_30 ba_36 
T02D1407:111b-22	brtul zhugs ni mi'i rus pa'i phreng ba la sogs pas brgyan pa'o //	brtul_0 'jug_6 ni_12 mi_15 rus_20 ba_24 phreng_29 ba_36 la_39 sogs_42 ba_47 rgyan_51 ba_58 
T02D1407:111b-23	dpa' bo zhes pa ni rnal 'byor ba'o //	dpa'_0 'bo_5 zhes_8 ba_13 ni_16 rnal_19 'byor_24 ba_30 
T02D1407:111b-24	de yang gang zhe na /	de_0 yang_3 gang_8 zhe_13 na_17 
T02D1407:111b-25	rnal 'byor ma thams cad kyi sgrub pa'o //	rnal_0 'byor_5 ma_11 thams_14 cad_20 kyi_24 sgrub_28 ba_34 
T02D1407:111b-26	mtshan nyid dbye bar shes bya na //	mtshan_0 nyid_7 'byed_12 ba_17 shes_21 byed_26 na_30 
T02D1407:111b-27	zhes pa ni phung po dang khams la sogs pa	zhes_0 ba_5 ni_8 'phung_11 po_17 dang_20 khams_25 la_31 sogs_34 ba_39 
T02D1407:111b-28	sgyu ma lta bur shes par bya ba 'ba' zhig	sgyu_0 ma_5 lta_8 bur_12 shes_16 ba_21 byed_25 ba_29 'ba'_32 'jig_37 
T02D1407:111b-29	ste / 'jig rten gyi chos brgyad po yongs su bsal te /	ste_0 'jig_6 rten_11 gyi_16 chos_20 brgyad_25 po_32 yongs_35 su_41 bsal_44 te_49 
T02D1407:111b-30	thams cad kyi mgon po dpal dang ldan pa rdo	thams_0 cad_6 kyi_10 mgon_14 po_19 dpal_22 dang_27 ldan_32 ba_37 rdo_40 
T02D1407:111b-31	rje slob dpon la phyag 'tshal te blo gros chen	rje_0 slob_4 dpon_9 la_14 phyag_17 'tshal_23 te_30 blo_33 gros_37 chen_42 
T02D1407:111b-32	po dang ldan pas bzhi po gsang ba la rjes	po_0 dang_3 ldan_8 ba_13 bzhi_17 po_22 gsang_25 ba_31 la_34 rjes_37 
T02D1407:111b-33	su spyad par bya zhing lung dang mi 'bral bar	su_0 spyod_3 ba_9 byed_13 zhing_17 lung_23 dang_28 mi_33 'bral_36 ba_42 
T02D1407:111b-34	sbyangs pa'i yon tan gyi mtshan ma gsil byed dang	sbyong_0 ba_8 yon_13 tan_17 gyi_21 mtshan_25 ma_32 gsil_35 byed_40 dang_45 
T02D1407:111b-35	/ lhung bzed dang /	lhung_2 bzed_8 dang_13 
T02D1407:111b-36	chos gos dang /	chos_0 gos_5 dang_9 
T02D1407:111b-37	chu tshags rnams bcad par bya'i //	chu_0 tshags_4 rnams_11 gcod_17 ba_22 byed_26 
T02D1407:111b-38	bslab pa de rnams dang bral ba'i rnal 'byor pa	bslab_0 ba_6 de_9 rnams_12 dang_18 'bral_23 ba_28 rnal_33 'byor_38 ba_44 
T02D1407:111b-39	ni sangs rgyas pa'i mu stegs kyi spyod par 'gyur	ni_0 sangs_3 rgya_9 ba_15 mu_20 stegs_23 kyi_29 spyod_33 ba_39 'gyur_43 
T02D1407:111b-40	ro // shes rab kyi pha rol tu phyin pa	ro_0 shes_6 rab_11 kyi_15 pha_19 rol_23 tu_27 phyin_30 ba_36 
T02D1407:111b-41	la dmigs pa de lta bu ni lhag pa'i lha	la_0 dmigs_3 ba_9 de_12 lta_15 bu_19 ni_22 lhag_25 ba_30 lha_35 
T02D1407:111b-42	ro // gcig yin no // stong pa nyid kyi	ro_0 gcig_6 yin_11 no_15 stong_21 ba_27 nyid_30 kyi_35 
T02D1407:111b-43	ye shes las byung ba dang gdug pa thams cad	ye_0 shes_3 las_8 'byung_12 ba_18 dang_21 gdug_26 ba_31 thams_34 cad_40 
T02D1407:111b-44	gzhig pa las skyes pa'i sngon po chen po rnam	'jig_0 ba_6 las_9 skye_13 ba_19 sngon_24 po_30 chen_33 po_38 rnam_41 
T02D1407:111b-45	par 'gyur ba drag po 'jigs pa'ang 'jigs par mdzad	ba_0 'gyur_4 ba_10 drag_13 po_18 'jigs_21 ba_27 'jigs_34 ba_40 mdzad_44 
T02D1407:111b-46	ro // gcig yin no // pa / mche ba	ro_0 gcig_6 yin_11 no_15 ba_21 mche_26 ba_31 
T02D1407:111b-47	cung zad rnam par gtsigs pa ral pa la zla	cung_0 zad_5 rnam_9 ba_14 gtsigs_18 ba_25 ral_28 ba_32 la_35 zla_38 
T02D1407:111b-48	ba phyed kyis brgyan pa ral ba chen po 'phungs	ba_0 phyed_3 kyis_9 rgyan_14 ba_21 ral_24 ba_28 chen_31 po_36 'phungs_39 
T02D1407:112a-0	pa'i steng na sna tshogs rdo rje @112a * //	ba_0 steng_5 na_11 sna_14 tshogs_18 rdo_25 rje_29 
T02D1407:112a-1	can /	can_0 
T02D1407:112a-2	thod pa'i phreng bas rnam par brgyan cing /	thod_0 ba_5 phreng_10 ba_17 rnam_21 ba_26 rgyan_30 cing_37 
T02D1407:112a-3	rgyan thams cad yang dag par rdzogs pa dang /	rgyan_0 thams_6 cad_12 yang_16 'dag_21 ba_25 rdzogs_29 ba_36 dang_39 
T02D1407:112a-4	stag gi pags pa'i smad g-yogs can //	stag_0 gi_5 pags_8 ba_13 smad_18 g-yogs_23 can_30 
T02D1407:112a-5	skyil krung phyed pas shin tu gnas pa /	skyil_0 krung_6 phyed_12 ba_18 shin_22 tu_27 gnas_30 ba_35 
T02D1407:112a-6	gdug pa thams cad 'jigs par mdzad cing 'dod pa	gdug_0 ba_5 thams_8 cad_14 'jigs_18 ba_24 mdzad_28 cing_34 'dod_39 ba_44 
T02D1407:112a-7	dang gti mug las byung ba'i phrag dog dus mtshan	dang_0 gti_5 mug_9 las_13 'byung_17 ba_23 phrag_28 dog_34 dus_38 mtshan_42 
T02D1407:112a-8	mo 'og tu gzir ba spyan gsum dang mgrin pa	mo_0 'og_3 tu_7 gzir_10 ba_15 spyan_18 gsum_24 dang_29 mgrin_34 ba_40 
T02D1407:112a-9	bzhi la zhal bzhi pa'o //	bzhi_0 la_5 zhal_8 bzhi_13 ba_18 
T02D1407:112a-10	nam mkha' lta bu'i dpal skya dang dkar po dang	nam_0 mkha'_4 lta_10 bu_14 dpal_19 skya_24 dang_29 dkar_34 po_39 dang_42 
T02D1407:112a-11	dmar po dang ljang gu'i zhal rnams gyen phyogs su	dmar_0 po_5 dang_8 ljang_13 gu_19 zhal_24 rnams_29 gyen_35 phyogs_40 su_47 
T02D1407:112a-12	gzigs pa'o // rdo rje dang dril bu 'dzin pa'i	gzigs_0 ba_6 rdo_14 rje_18 dang_22 'dril_27 bu_32 'dzin_35 ba_41 
T02D1407:112a-13	phyag gnyis kyis phag gdong ma la snyoms par zhugs	phyag_0 gnyis_6 kyis_12 phag_17 gdong_22 ma_28 la_31 snyom_34 ba_41 'jug_45 
T02D1407:112a-14	te gnyis su med par dga' ba'o //	te_0 gnyis_3 su_9 med_12 ba_16 dga'_20 ba_25 
T02D1407:112a-15	phyag gzhan rnams na chos kyi 'khor lo dang /	phyag_0 gzhan_6 rnams_12 na_18 chos_21 kyi_26 'khor_30 lo_36 dang_39 
T02D1407:112a-16	gsil byed dang /	gsil_0 byed_5 dang_10 
T02D1407:112a-17	lhung bzed dang /	lhung_0 bzed_6 dang_11 
T02D1407:112a-18	gsal shing dang /	gsal_0 shing_5 dang_11 
T02D1407:112a-19	zhags pa dang /	zhags_0 ba_6 dang_9 
T02D1407:112a-20	lcags kyu rnams so //	lcags_0 kyu_6 rnams_10 so_16 
T02D1407:112a-21	de bzhin du mgo bo dang /	de_0 bzhin_3 du_9 mgo_12 'bo_16 dang_19 
T02D1407:112a-22	cang te'u dang /	cang_0 te_5 dang_10 
T02D1407:112a-23	phyag gzhan gnyas na chos gos dang mi'i pags pa bsnams pa'i tshul can no //	phyag_0 gzhan_6 gnyas_12 na_18 chos_21 gos_26 dang_30 mi_35 pags_40 ba_45 snom_48 ba_55 tshul_60 can_66 no_70 
T02D1407:112a-24	phag rgod mo ni kha dog dmar mo gcer bu	phag_0 rgod_5 mo_10 ni_13 kha_16 dog_20 dmar_24 mo_29 bcer_32 bu_37 
T02D1407:112a-25	spyan gsum pa skra grol pa rgyan thams cad kyis	spyan_0 gsum_6 ba_11 skra_14 grol_19 ba_24 rgyan_27 thams_33 cad_39 kyis_43 
T02D1407:112a-26	'bar ba'o // g-yon pa na sa'i lhung bzed dang ldan pa'o //	'bar_0 ba_5 g-yon_13 ba_19 na_22 sa_25 lhung_30 bzed_36 dang_41 ldan_46 ba_51 
T02D1407:112a-27	g-yas pa na chos kyi dbyangs kyi sgra 'khrol ba'i cang te'u'o //	g-yas_0 ba_6 na_9 chos_12 kyi_17 dbyangs_21 kyi_29 sgra_33 'khrol_38 ba_45 cang_50 te'o_55 
T02D1407:112a-28	byin pa gnyis kyis mnyam par 'khyud pa ni thugs rje chen pos dgyes pa'i bde ba chen po'o //	byin_0 ba_5 gnyis_8 kyis_14 mnyam_19 ba_25 'khyud_29 ba_36 ni_39 thugs_42 rje_48 chen_52 pos_57 dgyes_61 ba_67 bde_72 ba_76 chen_79 po_84 
T02D1407:112a-29	shar la sogs pa'i 'dab ma la gdol ba mo dang /	'char_0 la_5 sogs_8 ba_13 'dab_18 ma_23 la_26 gdol_29 ba_34 mo_37 dang_40 
T02D1407:112a-30	sme mo dang /	sme_0 mo_4 dang_7 
T02D1407:112a-31	chos mkhan ma dang /	chos_0 mkhan_5 ma_11 dang_14 
T02D1407:112a-32	sbos mo dang /	sbo_0 mo_5 dang_8 
T02D1407:112a-33	shan pa mo dang /	shan_0 ba_5 mo_8 dang_11 
T02D1407:112a-34	ri khrod ma dang /	ri_0 khrod_3 ma_9 dang_12 
T02D1407:112a-35	nya 'chor ma dang /	nya_0 'chor_4 ma_10 dang_13 
T02D1407:112a-36	de bzhin du rngon pa mo'o //	de_0 bzhin_3 du_9 rngon_12 ba_18 mo_21 
T02D1407:112a-37	ser po dang /	ser_0 po_4 dang_7 
T02D1407:112a-38	sngon po dang /	sngon_0 po_6 dang_9 
T02D1407:112a-39	dmar po dang /	dmar_0 po_5 dang_8 
T02D1407:112a-40	dud kha dang /	dud_0 kha_4 dang_8 
T02D1407:112a-41	khra bo dang /	khra_0 'bo_5 dang_8 
T02D1407:112a-42	dmar po dang /	dmar_0 po_5 dang_8 
T02D1407:112a-43	ljang gu dang /	ljang_0 gu_6 dang_9 
T02D1407:112a-44	brgyad pa ni dkar po ste /	brgyad_0 ba_7 ni_10 dkar_13 po_18 ste_21 
T02D1407:112a-45	rim dang rim las bzlog par ro //	rim_0 dang_4 rim_9 las_13 bzlog_17 ba_23 ro_27 
T02D1407:112a-46	tshul rnams ni bzhad pa dang /	tshul_0 rnams_6 ni_12 bzhad_15 ba_21 dang_24 
