T02D3721:10a-0	@10a # // rgya gar skad du /	rgya_10 gar_15 skad_19 du_24 
T02D3721:10a-1	gu ru panytsa bim shi ka / bod skad du /	gu_0 ru_3 panytsa_6 bim_14 'chi_18 ka_22 'bod_27 skad_31 du_36 
T02D3721:10a-2	bla ma lnga bcu pa /	bla_0 ma_4 lnga_7 'chu_12 ba_16 
T02D3721:10a-3	bcom ldan 'das rdo rje sems dpa' la phyag 'tshal lo //	'joms_0 ldan_5 'da'_10 rdo_15 rje_19 sems_23 dpa'_28 la_33 phyag_36 'tshal_42 lo_49 
T02D3721:10a-4	dpal ldan rdo rje sems dpa'i gnas thob rgyur gyur pa //	dpal_0 ldan_5 rdo_10 rje_14 sems_18 dpa_23 gnas_29 'thob_34 rgyur_39 gyur_45 ba_50 
T02D3721:10a-5	bla ma'i zhabs kyi padmar ji bzhin btud byas te //	bla_0 ma_4 zhabs_9 kyi_15 padmar_19 ji_26 bzhin_29 'dud_35 byed_40 te_45 
T02D3721:10a-6	de bstan pa ni dri med rgyud mang las gsungs pa //	de_0 ston_3 ba_9 ni_12 'dri_15 med_19 brgyud_23 mang_29 las_34 gsungs_38 ba_45 
T02D3721:10a-7	mdor bsdus bshad pa 'di ni gus pas mnyan par gyis //	mdor_0 sdud_5 'chad_11 ba_17 'di_20 ni_24 gus_27 ba_31 nyan_35 ba_41 gyis_45 
T02D3721:10a-8	dbang bskur mchog thob rdo rje yi //	dbang_0 skur_6 mchog_12 'thob_18 rdo_23 rje_27 yi_31 
T02D3721:10a-9	slob dpon la ni de bzhin gshegs //	slob_0 dpon_5 la_10 ni_13 de_16 bzhin_19 gshegs_25 
T02D3721:10a-10	phyogs bcu'i 'jig rten khams bzhugs pas //	phyogs_0 'chu_7 'jig_13 rten_18 khams_23 bzhugs_29 ba_36 
T02D3721:10a-11	dus gsum du ni mngon phyag 'tshal //	dus_0 gsum_4 du_9 ni_12 mngon_15 phyag_21 'tshal_27 
T02D3721:10a-12	mchog tu dad pas dus gsum du //	mchog_0 tu_6 dad_9 ba_13 dus_17 gsum_21 du_26 
T02D3721:10a-13	dkyil 'khor me tog bcas thal mos //	dkyil_0 'khor_6 me_12 tog_15 'cha'_19 thal_24 mos_29 
T02D3721:10a-14	ston pa bla ma bsnyen bkur zhing //	ston_0 ba_5 bla_8 ma_12 snyen_15 bkur_22 zhing_27 
T02D3721:10a-15	zhabs la spyi bos phyag bya'o //	zhabs_0 la_6 spyi_9 'bod_14 phyag_18 byed_24 
T02D3721:10a-16	khyim pa'am ni gsar bu la //	khyim_0 ba_6 ni_12 gsar_15 bu_20 la_23 
T02D3721:10a-17	'jig rten smod pa spang pa'i phyir //	'jig_0 rten_5 smod_10 ba_15 spong_18 ba_24 phyir_29 
T02D3721:10a-18	dam chos la sogs mdun bdar te //	dam_0 chos_4 la_9 sogs_12 mdun_17 bdar_22 te_27 
T02D3721:10a-19	brtul zhugs 'dzin pas blos phyag bya //	brtul_0 'jug_6 'dzin_12 ba_18 blos_22 phyag_27 byed_33 
T02D3721:10a-20	gdan bstabs pa dang ldang ba dang //	gdan_0 stob_5 ba_12 dang_15 ldang_20 ba_26 dang_29 
T02D3721:10a-21	don gyi bya ba sogs bsnyen bkur //	don_0 gyi_4 byed_8 ba_12 sogs_15 snyen_20 bkur_27 
T02D3721:10a-22	brtul zhugs can gyis kun bya ste //	brtul_0 'jug_6 can_12 gyis_16 kun_21 byed_25 ste_29 
T02D3721:10a-23	phyag bya dam pa min las spang //	phyag_0 byed_6 dam_10 ba_14 min_17 las_21 spong_25 
T02D3721:10a-24	bla ma dang ni slob ma dag / mtshungs par dam tshig nyams 'gyur bas //	bla_0 ma_4 dang_7 ni_12 slob_15 ma_20 'dag_23 mtshungs_29 ba_38 dam_42 tshig_46 nyams_52 'gyur_58 ba_64 
T02D3721:10a-25	dpa' bos dang por slob dpon dang //	dpa'_0 'bod_5 dang_9 por_14 slob_18 dpon_23 dang_28 
T02D3721:10a-26	slob ma'i 'brel pa brtag par bya //	slob_0 ma_5 'brel_10 ba_16 rtog_19 ba_25 byed_29 
T02D3721:10a-27	blo ldan slob mas bla mar ni //	blo_0 ldan_4 slob_9 mas_14 bla_18 mar_22 ni_26 
T02D3721:10a-28	snying rje med cing khro la gdug / khengs shing chags la ma bsdams dang //	snying_0 rje_7 med_11 cing_15 khro_20 la_25 gdug_28 kheng_35 shing_42 chags_48 la_54 ma_57 sdom_60 dang_67 
T02D3721:10a-29	spyo mas dang bcas par mi bya'o //	spyo_0 mas_5 dang_9 'cha'_14 ba_19 mi_23 byed_26 
T02D3721:10a-30	brtan zhing dul la blo gros ldan //	brtan_0 zhing_6 dul_12 la_16 blo_19 gros_23 ldan_28 
T02D3721:10a-31	bzod ldan drang la g-yo sgyu med //	bzod_0 ldan_5 'dren_10 la_16 g-yo_19 sgyu_24 med_29 
T02D3721:10a-32	sngags dang rgyud kyi sbyor ba shes //	sngags_0 dang_7 brgyud_12 kyi_18 sbyor_22 ba_28 shes_31 
T02D3721:10a-33	snying brtser ldan zhing bstan bcos mkhas //	snying_0 brtser_7 ldan_14 zhing_19 ston_25 'chos_31 mkhas_36 
T02D3721:10a-34	de nyid bcu ni yongs su shes //	de_0 nyid_3 'chu_8 ni_12 yongs_15 su_21 shes_24 
T02D3721:10a-35	dkyil 'khor 'dri ba'i las la mkhas //	dkyil_0 'khor_6 'bri_12 ba_17 las_22 la_26 mkhas_29 
T02D3721:10a-36	sngags bshad pa yi sbyor ba shes //	sngags_0 'chad_7 ba_13 yi_16 sbyor_19 ba_25 shes_28 
T02D3721:10a-37	rab tu zhi zhing dbang po dul //	rab_0 tu_4 zhi_7 zhing_11 dbang_17 po_23 dul_26 
T02D3721:10b-0	de 'dra'i mgon la bsams byas @10b nas ;	de_0 'dra_3 mgon_10 la_15 bsams_18 byed_24 nas_34 
T02D3721:10b-1	/ slob mar gyur nas brnyas na ni //	slob_2 mar_7 gyur_11 nas_16 brnyas_20 na_27 ni_30 
T02D3721:10b-2	sangs rgyas thams cad brnyas pas na //	sangs_0 rgya_6 thams_12 cad_18 brnyas_22 ba_29 na_33 
T02D3721:10b-3	des ni rtag tu sdug bsngal 'thob //	des_0 ni_4 rtag_7 tu_12 sdug_15 sngal_20 'thob_27 
T02D3721:10b-4	slob dpon la ni smod pa de //	slob_0 dpon_5 la_10 ni_13 smod_16 ba_21 de_24 
T02D3721:10b-5	yams dang 'tshe ba'i nad rnams dang //	yams_0 dang_5 'tshe_10 ba_16 nad_21 rnams_25 dang_31 
T02D3721:10b-6	gdon dang rims dang dug rnams kyis //	'don_0 dang_5 rims_10 dang_15 dug_20 rnams_24 kyis_30 
T02D3721:10b-7	rmongs chen de ni 'chi bar 'gyur //	rmongs_0 chen_7 de_12 ni_15 'chi_18 ba_23 'gyur_27 
T02D3721:10b-8	rgyal po me dang sbrul gdug dang //	rgyal_0 po_6 me_9 dang_12 sbrul_17 gdug_23 dang_28 
T02D3721:10b-9	chu dang mkha' 'gro rkun po dang //	chu_0 dang_4 mkha'_9 'gro_15 rkun_20 po_25 dang_28 
T02D3721:10b-10	gdon dang log 'dren rnams kyis kyang //	'don_0 dang_5 log_10 bgrang_14 rnams_20 kyis_26 kyang_31 
T02D3721:10b-11	bsad nas sems can dmyal bar 'gro //	bsad_0 nas_5 sems_9 can_14 dmyal_18 ba_24 'gro_28 
T02D3721:10b-12	nam yang slob dpon dag gi ni //	nam_0 yang_4 slob_9 dpon_14 'dag_19 gi_23 ni_26 
T02D3721:10b-13	kun du sems dkrugs mi bya ste //	kun_0 du_4 sems_7 dkrug_12 mi_19 byed_22 ste_26 
T02D3721:10b-14	gal te rmongs pas byas gyur na //	gal_0 te_4 rmongs_7 ba_14 byed_18 gyur_23 na_28 
T02D3721:10b-15	dmyal bar nges par 'tshed par 'gyur //	dmyal_0 ba_6 nges_10 ba_15 'tshed_19 ba_26 'gyur_30 
T02D3721:10b-16	mnar med la sogs 'jigs rung ba'i //	mnar_0 med_5 la_9 sogs_12 'jigs_17 rung_23 ba_28 
T02D3721:10b-17	dmyal ba bstan pa gang yin pa //	dmyal_0 ba_6 ston_9 ba_15 gang_18 yin_23 ba_27 
T02D3721:10b-18	slob dpon la ni smod pa rnams //	slob_0 dpon_5 la_10 ni_13 smod_16 ba_21 rnams_24 
T02D3721:10b-19	der ni gnas par yang dag bshad //	der_0 ni_4 gnas_7 ba_12 yang_16 'dag_21 'chad_25 
T02D3721:10b-20	de bas 'bad pa thams cad kyis //	de_0 ba_3 'bad_7 ba_12 thams_15 cad_21 kyis_25 
T02D3721:10b-21	rdo rje slob dpon blo gros che //	rdo_0 rje_4 slob_8 dpon_13 blo_18 gros_22 che_27 
T02D3721:10b-22	dge ba rab tu mi spyo mas pa //	dge_0 ba_4 rab_7 tu_11 mi_14 spyo_17 mas_22 ba_26 
T02D3721:10b-23	nam yang smad par mi bya'o //	nam_0 yang_4 smad_9 ba_14 mi_18 byed_21 
T02D3721:10b-24	bla ma la ni gus bcad yon //	bla_0 ma_4 la_7 ni_10 gus_13 gcod_17 yon_22 
T02D3721:10b-25	rjes su mthun par sbyin par bya //	rjes_0 su_5 mthun_8 ba_14 sbyin_18 ba_24 byed_28 
T02D3721:10b-26	des ni rims sogs gnod pa rnams //	des_0 ni_4 rims_7 sogs_12 gnod_17 ba_22 rnams_25 
T02D3721:10b-27	phyir zhing 'byung bar mi 'gyur ro //	phyir_0 zhing_6 'byung_12 ba_19 mi_23 'gyur_26 ro_32 
T02D3721:10b-28	rang gi dam tshig slob dpon ni //	rang_0 gi_5 dam_8 tshig_12 slob_18 dpon_23 ni_28 
T02D3721:10b-29	sbyin min bu dang chung ma dang //	sbyin_0 min_6 bu_10 dang_13 chung_18 ma_24 dang_27 
T02D3721:10b-30	rang srog gis kyang brten bya na //	rang_0 srog_5 gis_10 kyang_14 rten_20 byed_26 na_30 
T02D3721:10b-31	longs spyod g-yo ba smos ci dgos //	longs_0 spyod_6 g-yo_12 ba_17 smos_20 ci_25 dgos_28 
T02D3721:10b-32	gang phyir bskal pa bye ba ni //	gang_0 phyir_5 bskal_11 ba_17 'bye_20 ba_24 ni_27 
T02D3721:10b-33	grangs med par yang rnyed dka' ba'i //	grangs_0 med_7 ba_11 yang_15 rnyed_20 dka'_26 ba_31 
T02D3721:10b-34	sangs rgyas nyid kyang brtson ldan la //	sangs_0 rgya_6 nyid_12 kyang_17 brtson_23 ldan_30 la_35 
T02D3721:10b-35	tshe 'di nyid la ster bar byed //	tshe_0 'di_5 nyid_9 la_14 ster_17 ba_22 byed_26 
T02D3721:10b-36	rtag tu rang gi dam tshig bsrung //	rtag_0 tu_5 rang_8 gi_13 dam_16 tshig_20 bsrung_26 
T02D3721:10b-37	rtag tu de bzhin gshegs pa mchod //	rtag_0 tu_5 de_8 bzhin_11 gshegs_17 ba_24 mchod_27 
T02D3721:10b-38	rtag tu bla ma la yang 'bul //	rtag_0 tu_5 bla_8 ma_12 la_15 yang_18 'bul_23 
T02D3721:10b-39	'di ni sangs rgyas kun dang 'dra //	'di_0 ni_4 sangs_7 rgya_13 kun_19 dang_23 'dra_28 
T02D3721:10b-40	mi zad de ni 'dod pa yis //	mi_0 zad_3 de_7 ni_10 'dod_13 ba_18 yis_21 
T02D3721:10b-41	cung zad yid 'ong gang dang gang //	cung_0 zad_5 yid_9 'ong_13 gang_18 dang_23 gang_28 
T02D3721:10b-42	shin tu khyad par gyur pa nyid //	shin_0 tu_5 khyad_8 ba_14 gyur_18 ba_23 nyid_26 
T02D3721:10b-43	de dang de ni bla mar sbyin //	de_0 dang_3 de_8 ni_11 bla_14 mar_18 sbyin_22 
T02D3721:10b-44	de byin sangs rgyas thams cad la //	de_0 byin_3 sangs_8 rgya_14 thams_20 cad_26 la_30 
T02D3721:10b-45	rtag tu byin pa nyid du 'gyur //	rtag_0 tu_5 byin_8 ba_13 nyid_16 du_21 'gyur_24 
T02D3721:10b-46	de byin bsod nams tshogs yin te //	de_0 byin_3 bsod_8 nams_13 tshogs_18 yin_25 te_29 
T02D3721:10b-47	tshogs las dngos grub mchog tu 'gyur //	tshogs_0 las_7 dngos_11 'grub_17 mchog_22 tu_28 'gyur_31 
T02D3721:10b-48	de bas slob ma snying rje gtong //	de_0 ba_3 slob_7 ma_12 snying_15 rje_22 gtong_26 
T02D3721:10b-49	tshul khrims bzod pa'i yon tan ldan //	tshul_0 khrims_6 bzod_13 ba_18 yon_23 tan_27 ldan_31 
T02D3721:10b-50	slob dpon dang ni rdo rje 'dzin //	slob_0 dpon_5 dang_10 ni_15 rdo_18 rje_22 'dzin_26 
T02D3721:10b-51	tha dad par ni mi brtag go //	tha_0 dad_4 ba_8 ni_12 mi_15 rtog_18 go_24 
T02D3721:10b-52	mchod rten bshigs 'dra'i sdig 'jigs pas //	mchod_0 rten_6 bshigs_11 'dra_18 sdig_25 'jigs_30 ba_36 
T02D3721:11a-0	grib ma'ang bgom @11a * //	'grib_0 ma_5 bsgom_12 
T02D3721:11a-1	par mi bya na //	ba_0 mi_4 byed_7 na_11 
T02D3721:11a-2	lham dang stan dang bzhon pa sogs //	lham_0 dang_5 stan_10 dang_15 bzhon_20 ba_26 sogs_29 
T02D3721:11a-3	bgom mi bya ba smos ci dgos //	bsgom_0 mi_5 byed_8 ba_12 smos_15 ci_20 dgos_23 
T02D3721:11a-4	blo gros chen po dga' sems kyis //	blo_0 gros_4 chen_9 po_14 dga'_17 sems_22 kyis_27 
T02D3721:11a-5	bla ma'i bka' ni 'bad de mnyan //	bla_0 ma_4 bka'_9 ni_14 'bad_17 de_22 nyan_25 
T02D3721:11a-6	rigs pa yis ni mi nus pa //	rigs_0 ba_5 yis_8 ni_12 mi_15 nus_18 ba_22 
T02D3721:11a-7	mi nus de la tshig gis sbyang //	mi_0 nus_3 de_7 la_10 tshig_13 gis_19 sbyong_23 
T02D3721:11a-8	bla ma las ni dngos grub dang //	bla_0 ma_4 las_7 ni_11 dngos_14 'grub_20 dang_25 
T02D3721:11a-9	mtho ris dang ni bde ba 'thob //	mtho_0 ris_5 dang_9 ni_14 bde_17 ba_21 'thob_24 
T02D3721:11a-10	de bas 'bad pa thams cad kyis //	de_0 ba_3 'bad_7 ba_12 thams_15 cad_21 kyis_25 
T02D3721:11a-11	bla ma'i bka' las 'da' mi bya //	bla_0 ma_4 bka'_9 las_14 'da'_18 mi_23 byed_26 
T02D3721:11a-12	bla ma'i rdzas ni srog ji bzhin //	bla_0 ma_4 rdzas_9 ni_15 srog_18 ji_23 bzhin_26 
T02D3721:11a-13	bla ma'i sdug pa'ang bla ma bzhin //	bla_0 ma_4 sdug_9 ba_14 bla_21 ma_25 bzhin_28 
T02D3721:11a-14	de yi 'khor ni gnyen bzhin du //	de_0 yi_3 'khor_6 ni_12 gnyen_15 bzhin_21 du_27 
T02D3721:11a-15	mnyam bar gzhag pas rtag tu bsam //	mnyam_0 ba_6 'jog_10 ba_16 rtag_20 tu_25 bsam_28 
T02D3721:11a-16	mal stan 'dug dang sngon 'gro dang //	mal_0 stan_4 'dug_9 dang_14 sngon_19 'gro_25 dang_30 
T02D3721:11a-17	gtsug tor dag dang dpyangs pa dang //	gtsug_0 tor_6 'dag_10 dang_14 dpyong_19 ba_27 dang_30 
T02D3721:11a-18	stan la rkang 'jog rked par ni //	stan_0 la_5 rkang_8 'jog_14 rked_19 ba_24 ni_28 
T02D3721:11a-19	lag gzhag snye bar mi bya'o //	lag_0 'jog_4 snye_10 ba_15 mi_19 byed_22 
T02D3721:11a-20	bla ma dag ni langs pa na //	bla_0 ma_4 'dag_7 ni_11 ldang_14 ba_20 na_23 
T02D3721:11a-21	nyal dang 'dug par mi bya'o //	nyal_0 dang_5 'dug_10 ba_15 mi_19 byed_22 
T02D3721:11a-22	rtag tu de yi bya ba la //	rtag_0 tu_5 de_8 yi_11 byed_14 ba_18 la_21 
T02D3721:11a-23	ldang mkhas phun sum tshogs par bya //	ldang_0 mkhas_6 phun_12 sum_17 tshogs_21 ba_28 byed_32 
T02D3721:11a-24	mchil ma la sogs 'dor ba dang //	mchil_0 ma_6 la_9 sogs_12 'dor_17 ba_22 dang_25 
T02D3721:11a-25	stan la rkang 'jog rkyong ba ni //	stan_0 la_5 rkang_8 'jog_14 rkyong_19 ba_26 ni_29 
T02D3721:11a-26	'chag dang rtsod par smra ba dag / bla ma'i mdun du mi bya'o //	'chag_0 dang_6 rtsod_11 ba_17 smra_21 ba_26 'dag_29 bla_35 ma_39 mdun_44 du_49 mi_52 byed_55 
T02D3721:11a-27	yan lag mnye dang gar dag dang //	yan_0 lag_4 mnyed_8 dang_13 gar_18 'dag_22 dang_26 
T02D3721:11a-28	glu dang rol mo mi bya zhing //	glu_0 dang_4 rol_9 mo_13 mi_16 byed_19 zhing_23 
T02D3721:11a-29	gtam gyi sbyor ba mang po rnams //	'dam_0 gyi_5 sbyor_9 ba_15 mang_18 po_23 rnams_26 
T02D3721:11a-30	thos pa'i nye 'khor du mi bya //	thos_0 ba_5 nye_10 'khor_14 du_20 mi_23 byed_26 
T02D3721:11a-31	btud de stan las ldang ba dang //	'dud_0 de_5 stan_8 las_13 ldang_17 ba_23 dang_26 
T02D3721:11a-32	bus pa yis ni 'dug par bya //	'bud_0 ba_4 yis_7 ni_11 'dug_14 ba_19 byed_23 
T02D3721:11a-33	mtshan chu 'jigs bcas lam du ni //	mtshan_0 chu_7 'jigs_11 'cha'_17 lam_22 du_26 ni_29 
T02D3721:11a-34	bsgo ba thob na mdun 'gro bya //	sgo_0 ba_5 'thob_8 na_13 mdun_16 'gro_21 byed_26 
T02D3721:11a-35	slob dpon gyis ni mthong mdun du //	slob_0 dpon_5 gyis_10 ni_15 mthong_18 mdun_25 du_30 
T02D3721:11a-36	blo dang ldan pas lus gcu dang //	blo_0 dang_4 ldan_9 ba_14 lus_18 gcu_22 dang_26 
T02D3721:11a-37	ka ba la sogs brten mi bya //	ka_0 ba_3 la_6 sogs_9 rten_14 mi_20 byed_23 
T02D3721:11a-38	sor mo'i tshigs ni drang mi bya //	sor_0 mo_4 tshigs_9 ni_16 'dren_19 mi_25 byed_28 
T02D3721:11a-39	rkang pa bkru dang lus bkru dang //	rkang_0 ba_6 'khrud_9 dang_14 lus_19 'khrud_23 dang_28 
T02D3721:11a-40	dril dang mnye ba la sogs pa //	'dril_0 dang_5 mnyed_10 ba_15 la_18 sogs_21 ba_26 
T02D3721:11a-41	phyag ni sngon du 'gro bas bya //	phyag_0 ni_6 sngon_9 du_15 'gro_18 ba_23 byed_27 
T02D3721:11a-42	de bzhin mthar ni ci bder bya //	de_0 bzhin_3 mthar_9 ni_15 ci_18 bder_21 byed_26 
T02D3721:11a-43	de yi mtshan smos brjod na ni //	de_0 yi_3 mtshan_6 smos_13 rjod_18 na_24 ni_27 
T02D3721:11a-44	ming mthar zhal sngar ldan pas bya //	ming_0 mthar_5 zhal_11 sngar_16 ldan_22 ba_27 byed_31 
T02D3721:11a-45	gzhan dag gus bar bya ba'i phyir //	gzhan_0 'dag_6 gus_10 ba_14 byed_18 ba_22 phyir_27 
T02D3721:11a-46	khyad par gyi ni tshig kyang brjod //	khyad_0 ba_6 gyi_10 ni_14 tshig_17 kyang_23 rjod_29 
T02D3721:11a-47	bla ma la ni bka' stsal zhu //	bla_0 ma_4 la_7 ni_10 bka'_13 stsal_18 'ju_24 
T02D3721:11a-48	bka' bzhin bgyid ces brjod byas la //	bka'_0 bzhin_5 bgyid_11 ces_17 rjod_21 byed_27 la_32 
T02D3721:11a-49	thal mo sbyar zhing ma yengs par //	thal_0 mo_5 sbyor_8 zhing_14 ma_20 yengs_23 ba_29 
T02D3721:11a-50	bla mas bsgo ba mnyan par bya //	bla_0 mas_4 sgo_8 ba_13 nyan_16 ba_22 byed_26 
T02D3721:11a-51	dgod dang lud pa la sogs pa //	'god_0 dang_5 lud_10 ba_14 la_17 sogs_20 ba_25 
T02D3721:11a-52	lag pas kha ni dgab par bya //	lag_0 ba_4 kha_8 ni_12 'gebs_15 ba_20 byed_24 
T02D3721:11a-53	bya ba zin nas 'jam pa yi //	byed_0 ba_4 zin_7 nas_11 'jam_15 ba_20 yi_23 
T02D3721:11a-54	tshig dag gis ni bzlas par bya //	tshig_0 'dag_6 gis_10 ni_14 bzlas_17 ba_23 byed_27 
T02D3721:11a-55	mdun du dul bar 'dug pa dang //	mdun_0 du_5 dul_8 ba_12 'dug_16 ba_21 dang_24 
T02D3721:11b-0	@11b gos sogs tshul bzhin bsdams pa dang //	gos_5 sogs_9 tshul_14 bzhin_20 sdom_26 ba_33 dang_36 
T02D3721:11b-1	pus btsugs thal mo sbyar ba yis //	pus_0 btsugs_4 thal_11 mo_16 sbyor_19 ba_25 yis_28 
T02D3721:11b-2	mnyan sogs 'dod la gsol gsum gdab //	nyan_0 sogs_6 'dod_11 la_16 gsol_19 gsum_24 gdab_29 
T02D3721:11b-3	bsnyen bkur spyod ba thams cad la //	snyen_0 bkur_7 spyod_12 ba_18 thams_21 cad_27 la_31 
T02D3721:11b-4	yid ni nga rgyal med par bya //	yid_0 ni_4 nga_7 rgyal_11 med_17 ba_21 byed_25 
T02D3721:11b-5	ngo tsha 'jigs shing bsdams pa yis //	ngo_0 tsha_4 'jigs_9 shing_15 sdom_21 ba_28 yis_31 
T02D3721:11b-6	bag ma gsar pa'i tshul gnas bya //	bag_0 ma_4 gsar_7 ba_12 tshul_17 gnas_23 byed_28 
T02D3721:11b-7	sgeg pa la sogs bya ba kun //	sgeg_0 ba_5 la_8 sogs_11 byed_16 ba_20 kun_23 
T02D3721:11b-8	ston pa'i mdun du spang bar bya //	ston_0 ba_5 mdun_10 du_15 spong_18 ba_24 byed_28 
T02D3721:11b-9	gzhan yang de 'dra'i bya ba ni //	gzhan_0 yang_6 de_11 'dra_14 byed_21 ba_25 ni_28 
T02D3721:11b-10	rang gis brtags la dor bar bya //	rang_0 gis_5 rtog_9 la_16 'dor_19 ba_23 byed_27 
T02D3721:11b-11	rab gnas dkyil 'khor sbyin sreg dang //	rab_0 gnas_4 dkyil_9 'khor_15 sbyin_21 sreg_27 dang_32 
T02D3721:11b-12	slob ma sdud dang 'chad pa rnams //	slob_0 ma_5 sdud_8 dang_13 'chad_18 ba_24 rnams_27 
T02D3721:11b-13	yul der bla ma gnas pa na //	yul_0 der_4 bla_8 ma_12 gnas_15 ba_20 na_23 
T02D3721:11b-14	rjes ma gnang bar mi bya'o //	rjes_0 ma_5 gnang_8 ba_14 mi_18 byed_21 
T02D3721:11b-15	spyan 'bye sogs las ci thob pa //	spyan_0 'bye_6 sogs_11 las_16 ci_20 'thob_23 ba_28 
T02D3721:11b-16	de kun bla ma rnams la dbul //	de_0 kun_3 bla_7 ma_11 rnams_14 la_20 'bul_23 
T02D3721:11b-17	de yis bstabs pa blangs nas ni //	de_0 yis_3 stob_7 ba_14 blangs_17 nas_24 ni_28 
T02D3721:11b-18	gzhan dag la ni ci bder bya //	gzhan_0 'dag_6 la_10 ni_13 ci_16 bder_19 byed_24 
T02D3721:11b-19	bla ma'i slob ma slob mar min //	bla_0 ma_4 slob_9 ma_14 slob_17 mar_22 min_26 
T02D3721:11b-20	slob ma'ang bla ma'i mdun du min //	slob_0 ma_5 bla_12 ma_16 mdun_21 du_26 min_29 
T02D3721:11b-21	bsnyen bkur dag dang ldang ba dang //	snyen_0 bkur_7 'dag_12 dang_16 ldang_21 ba_27 dang_30 
T02D3721:11b-22	phyag sogs byed pa bzlog par bya //	phyag_0 sogs_6 byed_11 ba_16 bzlog_19 ba_25 byed_29 
T02D3721:11b-23	slob dpon la ni gang 'bul dang //	slob_0 dpon_5 la_10 ni_13 gang_16 'bul_21 dang_26 
T02D3721:11b-24	bla mas kyang ni gang stsal pa //	bla_0 mas_4 kyang_8 ni_14 gang_17 stsal_22 ba_28 
T02D3721:11b-25	de la btud de lag gnyis kyis //	de_0 la_3 'dud_6 de_11 lag_14 gnyis_18 kyis_24 
T02D3721:11b-26	blo dang ldan pas blang bar bya //	blo_0 dang_4 ldan_9 ba_14 blang_18 ba_24 byed_28 
T02D3721:11b-27	dran pa brjed med gyur pa dang //	dran_0 ba_5 brjed_8 med_14 gyur_18 ba_23 dang_26 
T02D3721:11b-28	rang gi kun spyod la brtson pas //	rang_0 gi_5 kun_8 spyod_12 la_18 brtson_21 ba_28 
T02D3721:11b-29	spun gyi rang spyod las 'das pa //	spun_0 gyi_5 rang_9 spyod_14 las_20 'da'_24 ba_29 
T02D3721:11b-30	dga' bas phan tshun bzlog par bya //	dga'_0 ba_5 phan_9 tshun_14 bzlog_20 ba_26 byed_30 
T02D3721:11b-31	na bas bla ma'i bya ba la //	na_0 ba_3 bla_7 ma_11 byed_16 ba_20 la_23 
T02D3721:11b-32	btud de rjes ma gnang bar yang //	'dud_0 de_5 rjes_8 ma_13 gnang_16 ba_22 yang_26 
T02D3721:11b-33	bkag pa rnams ni spyad byas kyang //	'gog_0 ba_5 rnams_8 ni_14 spyod_17 byed_23 kyang_28 
T02D3721:11b-34	dge sems ldan la sdig mi 'gyur //	dge_0 sems_4 ldan_9 la_14 sdig_17 mi_22 'gyur_25 
T02D3721:11b-35	'dir mang smra ba ci zhig dgos //	'dir_0 mang_5 smra_10 ba_15 ci_18 'jig_21 dgos_26 
T02D3721:11b-36	bla ma dgyes byed gang yin bya //	bla_0 ma_4 dgyes_7 byed_13 gang_18 yin_23 byed_27 
T02D3721:11b-37	mi mnyes byed kun spang bar ni //	mi_0 mnyes_3 byed_9 kun_14 spong_18 ba_24 ni_28 
T02D3721:11b-38	de dang de la 'bad de spyad //	de_0 dang_3 de_8 la_11 'bad_14 de_19 spyod_22 
T02D3721:11b-39	dngos grub slob dpon rjes 'brang zhes //	dngos_0 'grub_6 slob_11 dpon_16 rjes_21 'brang_26 zhes_33 
T02D3721:11b-40	rdo rje 'dzin pa nyid gsung bar //	rdo_0 rje_4 'dzin_8 ba_14 nyid_17 gsung_22 ba_28 
T02D3721:11b-41	shes nas dngos po thams cad kyis //	shes_0 nas_5 dngos_9 po_15 thams_18 cad_24 kyis_28 
T02D3721:11b-42	bla ma yongs su mnyes par bya //	bla_0 ma_4 yongs_7 su_13 mnyes_16 ba_22 byed_26 
T02D3721:11b-43	bsam pa dag pa'i slob ma ni //	bsam_0 ba_5 'dag_8 ba_12 slob_17 ma_22 ni_25 
T02D3721:11b-44	dkon mchog gsum la skyabs song la //	dkon(d)_0 mchog_5 gsum_11 la_16 skyob_19 'gro_26 la_31 
T02D3721:11b-45	bla ma'i rjes su 'jug pa ni ;	bla_0 ma_4 rjes_9 su_14 'jug_17 ba_22 ni_25 
T02D3721:11b-46	/ kha ton bya bar sbyin par bya //	kha_2 ton_6 byed_10 ba_14 sbyin_18 ba_24 byed_28 
T02D3721:11b-47	de nas sngags sogs sbyin pa yis //	de_0 nas_3 sngags_7 sogs_14 sbyin_19 ba_25 yis_28 
T02D3721:11b-48	dam chos snod du byas nas su //	dam_0 chos_4 snod_9 du_14 byed_17 nas_22 su_26 
T02D3721:11b-49	rtsa ba'i ltung ba bcu bzhi ni //	rtsa_0 ba_5 ltung_10 ba_16 'chu_19 bzhi_23 ni_28 
T02D3721:11b-50	klag dang 'dzin pa nyid du bya //	klag_0 dang_5 'dzin_10 ba_16 nyid_19 du_24 byed_27 
T02D3721:11b-51	de ltar bla ma'i rjes 'jug slob ma ni //	de_0 ltar_3 bla_8 ma_12 rjes_17 'jug_22 slob_27 ma_32 ni_35 
T02D3721:11b-52	ma lus phan bskyed skyon med 'di byas pa'i //	ma_0 lus_3 phan_7 skyed_12 skyon_19 med_25 'di_29 byed_33 ba_38 
T02D3721:12a-0	dge ba mtha' @12a * //	dge_0 ba_4 mtha'_7 
T02D3721:12a-1	yas bdag gis ci bsags pa //	yas_0 bdag_4 gis_9 ci_13 bsags_16 ba_22 
T02D3721:12a-2	des ni 'gro kun myur du rgyal gyur cig /	des_0 ni_4 'gro_7 kun_12 myur_16 du_21 rgyal_24 gyur_30 cig_35 
T02D3721:12a-3	bla ma lnga bcu pa slob dpon chen po rta	bla_0 ma_4 lnga_7 'chu_12 ba_16 slob_19 dpon_24 chen_29 po_34 rta_37 
T02D3721:12a-4	dbyangs kyis mdzad pa rdzogs so /	dbyangs_0 kyis_8 mdzad_13 ba_19 rdzogs_22 so_29 
T02D3721:12a-6	// / rgya gar gyi mkhan po padm'a ka ra wa rma dang /	rgya_5 gar_10 gyi_14 mkhan_18 po_24 padm_27 ka_34 ra_37 wa_40 rma_43 dang_47 
T02D3721:12a-7	zhu chen gyi lo ts'a ba dge slong rin chen bzang pos bsgyur cing zhus te gtan la phab pa'o//	'ju_0 chen_4 gyi_9 lo_13 ts_16 ba_21 dge_24 slong_28 rin_34 chen_38 bzang_43 pos_49 sgyur_53 cing_60 zhus_65 te_70 gtan_73 la_78 'bebs_81 
