T02D1461:10b-0	@10b # // rgya gar skad du /	rgya_10 gar_15 skad_19 du_24 
T02D1461:11a-0	@11a * // sapta aa ksha ra s'a dha nam /	sapta_10 aa_16 ksha_19 ra_24 s_27 dha_31 nam_35 
T02D1461:11a-1	bod skad du /	'bod_0 skad_4 du_9 
T02D1461:11a-2	yi ge bdun pa'i sgrub thabs /	yi_0 ge_3 bdun_6 ba_11 sgrub_16 thabs_22 
T02D1461:11a-3	dpal rdo rje mkha' 'gro la phyag 'tshal lo //	dpal_0 rdo_5 rje_9 mkha'_13 'gro_19 la_24 phyag_27 'tshal_33 lo_40 
T02D1461:11a-4	byis pa bung med phal cher ni //	byis_0 ba_5 bung_8 med_13 phal_17 cher_22 ni_27 
T02D1461:11a-5	rgyas par gzung dkar 'gyur bas na //	rgya_0 ba_6 gzung_10 dkar_16 'gyur_21 ba_27 na_31 
T02D1461:11a-6	mdor bsdus pa'i yang mdor bsdus nas //	mdor_0 sdud_5 ba_11 yang_16 mdor_21 sdud_26 nas_32 
T02D1461:11a-7	yi ge bdun pa bsdu bar bya ;	yi_0 ge_3 bdun_6 ba_11 sdud_14 ba_19 byed_23 
T02D1461:11a-8	/ mchod sogs stong nyid byang chub kyi //	mchod_2 sogs_8 stong_13 nyid_19 byang_24 chub_30 kyi_35 
T02D1461:11a-9	sngags kyi mthar thug 'og tu ni //	sngags_0 kyi_7 mthar_11 thug_17 'og_22 tu_26 ni_29 
T02D1461:11a-10	brtser lhan lus kyi dbus son pa'i //	brtser_0 lhan_7 lus_12 kyi_16 dbus_20 son_25 ba_29 
T02D1461:11a-11	rdo rje mkha' 'gro rab bsgrub bya //	rdo_0 rje_4 mkha'_8 'gro_14 rab_19 sgrub_23 byed_30 
T02D1461:11a-12	yam ram bam lam 'byung pa bzhi'i //	yam_0 ram_4 bam_8 lam_12 'byung_16 ba_23 bzhi_26 
T02D1461:11a-13	dkyil 'khor steng du sum las byung //	dkyil_0 'khor_6 steng_12 du_18 sum_21 las_25 'byung_29 
T02D1461:11a-14	lhun po rin chen sna bdun dang //	lhun_0 po_5 rin_8 chen_12 sna_17 bdun_21 dang_26 
T02D1461:11a-15	rtse mo brgyad pa bsam par bya ;	rtse_0 mo_5 brgyad_8 ba_15 bsam_18 ba_23 byed_27 
T02D1461:11a-16	/ aom me di n'i badzr'i bha pa badzra bandha h'um /	aom_2 me_6 di_9 n_12 badzr_16 bha_24 ba_28 badzra_31 bandha_38 h_45 
T02D1461:11a-17	aom badzra pr'a k'a ra h'um bam h'um /	aom_0 badzra_4 pr_11 k_16 ra_20 h_23 bam_28 h_32 
T02D1461:11a-18	aom badzra panydza ra h'um ram h'um /	aom_0 badzra_4 panydza_11 ra_19 h_22 ram_27 h_31 
T02D1461:11a-19	aom badzra bi t'a na h'um kham h'um /	aom_0 badzra_4 bi_11 t_14 na_18 h_21 kham_26 h_31 
T02D1461:11a-20	aom badzra sa ra dz'a la tr'am sam tr'am /	aom_0 badzra_4 sa_11 ra_14 dz_17 la_22 tr_25 sam_31 tr_35 
T02D1461:11a-21	aom badzra dzva la aa na l'a rka h'um h'um h'um /	aom_0 badzra_4 dzva_11 la_16 aa_19 na_22 l_25 rka_29 h_33 h_38 h_43 
T02D1461:11a-22	rdo rje sa sogs drug byas nas //	rdo_0 rje_4 sa_8 sogs_11 drug_16 byed_21 nas_26 
T02D1461:11a-23	'khor lo sna tshogs rdo rjer gnas //	'khor_0 lo_6 sna_9 tshogs_13 rdo_20 rjer_24 gnas_29 
T02D1461:11a-24	sna tshogs rdo rje'i phreng bas bskor ;	sna_0 tshogs_4 rdo_11 rje_15 phreng_21 ba_28 skor_32 
T02D1461:11a-25	/ rtsibs drug la ni bri bar bya //	rtsibs_2 drug_9 la_14 ni_17 'bri_20 ba_24 byed_28 
T02D1461:11a-26	'dir ni h'um las byung pha yi //	'dir_0 ni_5 h_8 las_13 'byung_17 pha_23 yi_27 
T02D1461:11a-27	rdo rje mkha' 'gro bde chen po //	rdo_0 rje_4 mkha'_8 'gro_14 bde_19 chen_23 po_28 
T02D1461:11a-28	phyag drug zhal gsum spyan gsum pa //	phyag_0 drug_6 zhal_11 gsum_16 spyan_21 gsum_27 ba_32 
T02D1461:11a-29	mtshan kun gyis mtshan bsgom par bya //	mtshan_0 kun_7 gyis_11 mtshan_16 bsgom_23 ba_29 byed_33 
T02D1461:11a-30	dpe byad brgyad cu yang dag ldan //	dpe_0 byad_4 brgyad_9 cu_16 yang_19 'dag_24 ldan_28 
T02D1461:11a-31	khyab bdag a'a li k'a lis byung //	khyab_0 bdag_6 a_11 li_15 k_18 lis_22 'byung_26 
T02D1461:11a-32	rdo rje dril bus snyoms bar zhugs //	rdo_0 rje_4 'dril_8 'bud_13 snyom_17 ba_24 'jug_28 
T02D1461:11a-33	mi yi pags pa rlon pa 'chang //	mi_0 yi_3 pags_6 ba_11 rlon_14 ba_19 'chang_22 
T02D1461:11a-34	g-yon pa thong pa kha t'am ga / phyag g-yas na ni mdung rtse gsum //	g-yon_0 ba_6 thong_9 ba_15 kha_18 t_22 ga_27 phyag_32 g-yas_38 na_44 ni_47 mdung_50 rtse_56 gsum_61 
T02D1461:11a-35	thod pa'i phreng ba'i cod pan dang //	thod_0 ba_5 phreng_10 ba_17 cod_22 pan_26 dang_30 
T02D1461:11a-36	ral pas sna tshogs rdo rje 'chang //	ral_0 ba_4 sna_8 tshogs_12 rdo_19 rje_23 'chang_27 
T02D1461:11a-37	zla ba phyed pa'i thod dang ni //	zla_0 ba_4 phyed_7 ba_13 thod_18 dang_23 ni_28 
T02D1461:11a-38	phyag rgya drug gis sku la bklubs //	phyag_0 rgya_6 drug_11 gis_16 sku_20 la_24 bklubs_27 
T02D1461:11a-39	mthing dang ser dang ljang gu'i zhal ;	mthing_0 dang_7 ser_12 dang_16 ljang_21 gu_27 zhal_32 
T02D1461:11a-40	/ stag gi pags pa'i na bza' gsol //	stag_2 gi_7 pags_10 ba_15 na_20 bza'_23 gsol_28 
T02D1461:11a-41	'jigs byed dang ni dus mtshan mo //	'jigs_0 byed_6 dang_11 ni_16 dus_19 mtshan_23 mo_30 
T02D1461:11a-42	g-yas brkyang ba yis nyi mar mnan //	g-yas_0 rkyong_6 ba_14 yis_17 nyi_21 mar_25 gnon_29 
T02D1461:11a-43	mgon po ji lta de bzhin du //	mgon_0 po_5 ji_8 lta_11 de_15 bzhin_18 du_24 
T02D1461:11a-44	rdo rje phag mo'ang phyag la sogs //	rdo_0 rje_4 phag_8 mo_13 phyag_20 la_26 sogs_29 
T02D1461:11a-45	lha mo byin pa yang dag 'khyud //	lha_0 mo_4 byin_7 ba_12 yang_15 'dag_20 'khyud_24 
T02D1461:11a-46	mchog tu dga' bas myos pa mo //	mchog_0 tu_6 dga'_9 ba_14 myos_18 ba_23 mo_26 
T02D1461:11a-47	dza: h'um bam ho: yi ge 'dis ;	dza:_0 h_5 bam_10 ho:_14 yi_18 ge_21 'dis_24 
T02D1461:11a-48	/ ye shes dgug pa la sogs pa //	ye_2 shes_5 'gugs_10 ba_15 la_18 sogs_21 ba_26 
T02D1461:11a-49	rnal 'byor ma drug rtsibs drug la //	rnal_0 'byor_5 ma_11 drug_14 rtsibs_19 drug_26 la_31 
T02D1461:11a-50	g-yon du bskor bas rnam bskor bas //	g-yon_0 du_6 skor_9 ba_15 rnam_19 skor_24 ba_30 
T02D1461:11a-51	dad po lha mo khrag 'thung ma //	dad_0 po_4 lha_7 mo_11 khrag_14 'thung_20 ma_27 
T02D1461:11a-52	gnyis pa rdo rje 'jigs byed ma //	gnyis_0 ba_6 rdo_9 rje_13 'jigs_17 byed_23 ma_28 
T02D1461:11a-53	gsum pa drug gtum ma dang ni //	gsum_0 ba_5 drug_8 'thum_13 ma_18 dang_21 ni_26 
T02D1461:11a-54	bzhi pa rdo rje snang byed ma //	bzhi_0 ba_5 rdo_8 rje_12 snang_16 byed_22 ma_27 
T02D1461:11a-55	lnga pa rdo rje drag mo ste //	lnga_0 ba_5 rdo_8 rje_12 drag_16 mo_21 ste_24 
T02D1461:11b-0	@11b drug pa rdo rje mkha' 'gro yin //	drug_5 ba_10 rdo_13 rje_17 mkha'_21 'gro_27 yin_32 
T02D1461:11b-1	sngon mo ser mo ljang gu dang //	sngon_0 mo_6 ser_9 mo_13 ljang_16 gu_22 dang_25 
T02D1461:11b-2	dmar mo dud ka de bzhin dkar //	dmar_0 mo_5 dud_8 ka_12 de_15 bzhin_18 dkar_24 
T02D1461:11b-3	skra bshig ma la drag chen ma //	skra_0 'jig_5 ma_11 la_14 drag_17 chen_22 ma_27 
T02D1461:11b-4	spyan gsum ma sta phyogs kyi gos //	spyan_0 gsum_6 ma_11 sta_14 phyogs_18 kyi_25 gos_29 
T02D1461:11b-5	phyag ni cig shos phyag gnyis ni //	phyag_0 ni_6 cig_9 shos_13 phyag_18 gnyis_24 ni_30 
T02D1461:11b-6	sgra sgrogs da ma ru dril bus mtshan //	sgra_0 sgrogs_5 da_12 ma_15 ru_18 'dril_21 'bud_26 mtshan_30 
T02D1461:11b-7	mi yi pags pa bsnams pa ste ;	mi_0 yi_3 pags_6 ba_11 snom_14 ba_21 ste_24 
T02D1461:11b-8	/ yi dags nyi ma'i steng na gnas //	yi_2 dags_5 nyi_10 ma_14 steng_19 na_25 gnas_28 
T02D1461:11b-9	thong pa'i phreng ba'i cod pan can //	thong_0 ba_6 phreng_11 ba_18 cod_23 pan_27 can_31 
T02D1461:11b-10	g-yas brkyang gdan la yang dag bzhugs //	g-yas_0 rkyong_6 gdan_14 la_19 yang_22 'dag_27 bzhugs_31 
T02D1461:11b-11	lha rnams thams cad go rims bzhin //	lha_0 rnams_4 thams_10 cad_16 go_20 rims_23 bzhin_28 
T02D1461:11b-12	yi ge drug las byung ba bsgom //	yi_0 ge_3 drug_6 las_11 'byung_15 ba_21 bsgom_24 
T02D1461:11b-13	l'am m'am p'am t'am kham zhes pas //	l_0 m_5 p_10 t_15 kham_20 zhes_25 ba_30 
T02D1461:11b-14	khams lnga po ni byin gyis brlab //	khams_0 lnga_6 po_11 ni_14 byin_17 gyis_22 brlab_27 
T02D1461:11b-15	aom a'am hri ho h'um hr'i zhes //	aom_0 a_4 hri_9 ho_13 h_16 hr_21 zhes_26 
T02D1461:11b-16	gzugs sogs phung po la yang ngo /	gzugs_0 sogs_6 'phung_11 po_17 la_20 yang_23 ngo_28 
T02D1461:11b-17	bhr'um h'um kha a'a ho ham gis //	bhr_0 h_7 kha_12 a_16 ho_20 ham_23 gis_27 
T02D1461:11b-18	skye mched rnams ni sbyang bar bya //	skye_0 mched_5 rnams_11 ni_17 sbyong_20 ba_27 byed_31 
T02D1461:11b-19	aom ha na ma hi /	aom_0 ha_4 na_7 ma_10 hi_13 
T02D1461:11b-20	sv'a h'a hu /	sv_0 h_5 hu_9 
T02D1461:11b-21	boo shata he /	boo_0 shata_4 he_10 
T02D1461:11b-22	h'um h'um ho /	h_0 h_5 ho_10 
T02D1461:11b-23	phat ham /	phat_0 ham_5 
T02D1461:11b-24	brang mgo spyi gtsug phrag pa dang //	brang_0 mgo_6 spyi_10 gtsug_15 phrag_21 ba_27 dang_30 
T02D1461:11b-25	mig la sogs par spyar bar bya //	mig_0 la_4 sogs_7 ba_12 spyar_16 ba_22 byed_26 
T02D1461:11b-26	aom bam ham yom hrim mom hre hrim h'um h'um phat phat /	aom_0 bam_4 ham_8 yom_12 hrim_16 mom_21 hre_25 hrim_29 h_34 h_39 phat_44 phat_49 
T02D1461:11b-27	lte ba snyid ga kha dang ni //	lte_0 ba_4 snyid_7 ga_13 kha_16 dang_20 ni_25 
T02D1461:11b-28	spyi bo spyi gtsug gzhan la dgod //	spyi_0 'bo_5 spyi_8 gtsug_13 gzhan_19 la_25 'god_28 
T02D1461:11b-29	lus dang ngag lam sems la ni //	lus_0 dang_4 ngag_9 lam_14 sems_18 la_23 ni_26 
T02D1461:11b-30	aom a'a: h'um ni dgod par bya //	aom_0 a:_4 h_9 ni_14 'god_17 ba_22 byed_26 
T02D1461:11b-31	'khor los sgyur drug 'khor lor gnas //	'khor_0 los_6 sgyur_10 drug_16 'khor_21 lor_27 gnas_31 
T02D1461:11b-32	lha mo'i tshogs kyi lag gnas pa'i //	lha_0 mo_4 tshogs_9 kyi_16 lag_20 gnas_24 ba_29 
T02D1461:11b-33	bdud rtsi lnga yi khu bas gang //	bdud_0 rtsi_5 lnga_10 yi_15 khu_18 ba_22 gang_26 
T02D1461:11b-34	thod pa rnams kyis dbang bskur bya //	thod_0 ba_5 rnams_8 kyis_14 dbang_19 skur_25 byed_31 
T02D1461:11b-35	mchod dang bstod dad bdud rtsi myang ;	mchod_0 dang_6 bstod_11 dad_17 bdud_21 rtsi_26 myang_31 
T02D1461:11b-36	/ byas par gyur pas spyad par bya //	byed_2 ba_7 gyur_11 ba_16 spyod_20 ba_26 byed_30 
T02D1461:11b-37	dogs pa med pa'i sems kyis ni //	dogs_0 ba_5 med_8 ba_12 sems_17 kyis_22 ni_27 
T02D1461:11b-38	gsang sngags yi ge bdun pa bzlas //	gsang_0 sngags_6 yi_13 ge_16 bdun_19 ba_24 bzlas_27 
T02D1461:11b-39	aom hr'i: ha ha h'um h'um phat //	aom_0 hr:_4 ha_10 ha_13 h_16 h_21 phat_26 
T02D1461:11b-40	bsam gtan bzlas pa gang tshe skyo //	bsam_0 gtan_5 bzlas_10 ba_16 gang_19 tshe_24 skyo_29 
T02D1461:11b-41	de tshe dag pa rjes dran bya //	de_0 tshe_3 'dag_8 ba_12 rjes_15 dran_20 byed_25 
T02D1461:11b-42	dran pa yang dag byang chub kyi yan lag ni dpal he ru ka'o //	dran_0 ba_5 yang_8 'dag_13 byang_17 chub_23 kyi_28 yan_32 lag_36 ni_40 dpal_43 he_48 ru_51 ka_54 
T02D1461:11b-43	chos rab tu rnam par 'byed pa yang dag byang chub kyi yan lag ni khrag 'thung ma'o //	chos_0 rab_5 tu_9 rnam_12 ba_17 'byed_21 ba_27 yang_30 'dag_35 byang_39 chub_45 kyi_50 yan_54 lag_58 ni_62 khrag_65 'thung_71 ma_78 
T02D1461:11b-44	brtson 'grus yang dag byang chub kyi yan lag ni rdo rje 'jigs byed ma'o //	brtson_0 'grus_7 yang_13 'dag_18 byang_22 chub_28 kyi_33 yan_37 lag_41 ni_45 rdo_48 rje_52 'jigs_56 byed_62 ma_67 
T02D1461:11b-45	dga' ba yang dag byang chub kyi yan lag ni rab gtum ma'o //	dga'_0 ba_5 yang_8 'dag_13 byang_17 chub_23 kyi_28 yan_32 lag_36 ni_40 rab_43 'thum_47 ma_52 
T02D1461:11b-46	shin tu sbyangs pa yang dag byang chub kyi yan lag ni rdo rje snang byed ma'o //	shin_0 tu_5 sbyong_8 ba_16 yang_19 'dag_24 byang_28 chub_34 kyi_39 yan_43 lag_47 ni_51 rdo_54 rje_58 snang_62 byed_68 ma_73 
T02D1461:11b-47	ting de 'dzin yang dag byang chub kyi yan lag ni rdo rje drag mo'o //	ting_0 de_5 'dzin_8 yang_14 'dag_19 byang_23 chub_29 kyi_34 yan_38 lag_42 ni_46 rdo_49 rje_53 drag_57 mo_62 
T02D1461:11b-48	mgur chu gdu bu rin chen dang //	mgur_0 chu_5 gdu_9 bu_13 rin_16 chen_20 dang_25 
T02D1461:11b-49	rna cha gdub kor tshangs skung de //	rna_0 cha_4 gdub_8 kor_13 tshangs_17 skung_25 de_31 
T02D1461:11b-50	de dag pha rol phyin pa drug / phyag rgya'i gzugs su sbyar ba yin //	de_0 'dag_3 pha_7 rol_11 phyin_15 ba_21 drug_24 phyag_31 rgya_37 gzugs_44 su_50 sbyor_53 ba_59 yin_62 
T02D1461:11b-51	yi ge bdun pa'i sgrub thabs slob dpon rgyal dka' zla bas btus pa rdzogs so//	yi_0 ge_3 bdun_6 ba_11 sgrub_16 thabs_22 slob_28 dpon_33 rgyal_38 dka'_44 zla_49 ba_53 'thu_57 ba_62 rdzogs_65 
