T02D1644:283a-32	'di de sangs rgyas thams cad kyi //	'di_0 de_4 sangs_7 rgya_13 thams_19 cad_25 kyi_29 
T02D1644:283a-33	shes rab chos kyi dbyings zhes gsungs /	shes_0 rab_5 chos_9 kyi_14 dbyings_18 zhes_26 gsungs_31 
T02D1644:283a-34	ma h'a badzra ghanda aa: zhes pas g-yon par dril bu byin la /	ma_0 h_3 badzra_7 ghanda_14 aa:_21 zhes_25 ba_30 g-yon_34 ba_40 'dril_44 bu_49 byin_52 la_57 
T02D1644:283a-35	g-yas g-yon bsnol te 'khyud pa'i tshul du bya ste /	g-yas_0 g-yon_6 snol_12 te_18 'khyud_21 ba_28 tshul_33 du_39 byed_42 ste_46 
T02D1644:283a-36	'di ni dam tshig rdo rje'i rang bzhin gyi bdag po'i dbang ngo //	'di_0 ni_4 dam_7 tshig_11 rdo_17 rje_21 rang_27 bzhin_32 gyi_38 bdag_42 po_47 dbang_52 ngo_58 
T02D1644:283a-37	de nas rdo rje dril bu slob ma'i dbang por bzung la /	de_0 nas_3 rdo_7 rje_11 'dril_15 bu_20 slob_23 ma_28 dbang_33 por_39 bzung_43 la_49 
T02D1644:283a-38	gang dang gar snang de dang de //	gang_0 dang_5 gar_10 snang_14 de_20 dang_23 de_28 
T02D1644:283a-39	he ru ka dpal rang nyid gtso //	he_0 ru_3 ka_6 dpal_9 rang_14 nyid_19 gtso_24 
T02D1644:283a-40	gang phyir chos rnams rnam dag pas //	gang_0 phyir_5 chos_11 rnams_16 rnam_22 'dag_27 ba_31 
T02D1644:283a-41	sangs rgyas ye shes rang bzhin nyid //	sangs_0 rgya_6 ye_12 shes_15 rang_20 bzhin_25 nyid_31 
T02D1644:283a-42	aom badzra satva stvam aa bhi shinytsa m'am /	aom_0 badzra_4 satva_11 stvam_17 aa_23 bhi_26 shinytsa_30 m_39 
T02D1644:283b-0	@283b badzra aa bhi she ka ta zhes pas ming gi dbang bskur te /	badzra_6 aa_13 bhi_16 she_20 ka_24 ta_27 zhes_30 ba_35 ming_39 gi_44 dbang_47 skur_53 te_59 
T02D1644:283b-1	kya dpal che ge mo zhes rigs dang mthun pa'i ming las gang 'dod pa sbyin no //	kya_0 dpal_4 che_9 ge_13 mo_16 zhes_19 rigs_24 dang_29 mthun_34 ba_40 ming_45 las_50 gang_54 'dod_59 ba_64 sbyin_67 no_73 
T02D1644:283b-2	'di ni rtag pa'i rang bzhin gyi ming gi dbang ngo //	'di_0 ni_4 rtag_7 ba_12 rang_17 bzhin_22 gyi_28 ming_32 gi_37 dbang_40 ngo_46 
T02D1644:283b-3	de dag go rims bzhin du /	de_0 'dag_3 go_7 rims_10 bzhin_15 du_21 
T02D1644:283b-4	me long lta bu dang /	me_0 long_3 lta_8 bu_12 dang_15 
T02D1644:283b-5	mnyam pa nyid dang /	mnyam_0 ba_6 nyid_9 dang_14 
T02D1644:283b-6	so sor rtog pa dang /	so_0 sor_3 rtogs_7 ba_12 dang_15 
T02D1644:283b-7	bya ba grub pa dang /	byed_0 ba_4 'grub_7 ba_12 dang_15 
T02D1644:283b-8	chos kyi dbyings rnam par dag pa'i ye shes te /	chos_0 kyi_5 dbyings_9 rnam_17 ba_22 'dag_26 ba_30 ye_35 shes_38 te_43 
T02D1644:283b-9	ye shes lnga'i rang bzhin no //	ye_0 shes_3 lnga_8 rang_15 bzhin_20 no_26 
T02D1644:283b-10	dbang bskur ba lnga po de dag gis rgyud la sogs pa nyan pa dang /	dbang_0 skur_6 ba_12 lnga_15 po_20 de_23 'dag_26 gis_30 brgyud_34 la_40 sogs_43 ba_48 nyan_51 ba_56 dang_59 
T02D1644:283b-11	bshad pa dang sgrub pa'i snod du 'gyur ro //	'chad_0 ba_6 dang_9 sgrub_14 ba_20 snod_25 du_30 'gyur_33 ro_39 
T02D1644:283b-12	de dag gis ni spyan la sogs pa'i rig pa lnga'i las yin pa dang /	de_0 'dag_3 gis_7 ni_11 spyan_14 la_20 sogs_23 ba_28 rig_33 ba_37 lnga_40 las_47 yin_51 ba_55 dang_58 
T02D1644:283b-13	ma rig pa bzlog pas rig pa'i dbang lnga'o //	ma_0 rig_3 ba_7 bzlog_10 ba_16 rig_20 ba_24 dbang_29 lnga_35 
T02D1644:283b-14	de nas slob dpon gyi dbang bskur te /	de_0 nas_3 slob_7 dpon_12 gyi_17 dbang_21 skur_27 te_33 
T02D1644:283b-15	bdag dang gzhan gyi don gyi phyir //	bdag_0 dang_5 gzhan_10 gyi_16 don_20 gyi_24 phyir_28 
T02D1644:283b-16	rdo rje slob dpon dbang bskur ba //	rdo_0 rje_4 slob_8 dpon_13 dbang_18 skur_24 ba_30 
T02D1644:283b-17	thugs rje can khyod bka' drin gyis //	thugs_0 rje_6 can_10 khyod_14 bka'_20 drin_25 gyis_30 
T02D1644:283b-18	de ring bdag la stsal du gsol //	de_0 ring_3 bdag_8 la_13 stsal_16 du_22 gsol_25 
T02D1644:283b-19	zhes pas gsol ba btab la /	zhes_0 ba_5 gsol_9 ba_14 'debs_17 la_22 
T02D1644:283b-20	rdo rje che dang dril bu che //	rdo_0 rje_4 che_8 dang_12 'dril_17 bu_22 che_25 
T02D1644:283b-21	zung shig rdo rjes byin gyis brlabs //	zung_0 shig_5 rdo_10 rjes_14 byin_19 gyis_24 brlabs_29 
T02D1644:283b-22	de ring rdo rje slob dpon gyur //	de_0 ring_3 rdo_8 rje_12 slob_16 dpon_21 gyur_26 
T02D1644:283b-23	slob ma'i tshogs rnams bsdu bar gyis //	slob_0 ma_5 tshogs_10 rnams_17 sdud_23 ba_28 gyis_32 
T02D1644:283b-24	zhes slob ma la bskul la /	zhes_0 slob_5 ma_10 la_13 skul_16 la_22 
T02D1644:283b-25	de'i rjes la dam tshig gsum po 'dzin du gzhug ste /	de_0 rjes_5 la_10 dam_13 tshig_17 gsum_23 po_28 'dzin_31 du_37 'jug_40 ste_46 
T02D1644:283b-26	h'um gis rdo rje bsgoms la /	h_0 gis_5 rdo_9 rje_13 sgom_17 la_24 
T02D1644:283b-27	'di de sangs rgyas thams cad nyid //	'di_0 de_4 sangs_7 rgya_13 thams_19 cad_25 nyid_29 
T02D1644:283b-28	rdo rje sems dpa'i phyag na gnas //	rdo_0 rje_4 sems_8 dpa_13 phyag_19 na_25 gnas_28 
T02D1644:283b-29	rtag tu khyod kyis gzung bar bya //	rtag_0 tu_5 khyod_8 kyis_14 gzung_19 ba_25 byed_29 
T02D1644:283b-30	phyag na rdo rje'i brtul zhugs brtan //	phyag_0 na_6 rdo_9 rje_13 brtul_19 'jug_25 brtan_31 
T02D1644:283b-31	aom sarba ta th'a ga ta siddhi badzra sa ma	aom_0 sarba_4 ta_10 th_13 ga_18 ta_21 siddhi_24 badzra_31 sa_38 ma_41 
T02D1644:283b-32	ya tishtha ae sha tvam dha ra ya m'i hi	ya_0 tishtha_3 ae_11 sha_14 tvam_18 dha_23 ra_27 ya_30 m_33 hi_37 
T02D1644:283b-33	hi hi hi h'um zhes rdo rje gtad de gzung	hi_0 hi_3 hi_6 h_9 zhes_14 rdo_19 rje_23 gtod_27 de_32 gzung_35 
T02D1644:283b-34	bas / de kho na nyid 'di brjod de /	ba_0 de_6 kho_9 na_13 nyid_16 'di_21 rjod_25 de_31 
T02D1644:283b-35	thog mtha' med pa'i sems dpa' ni //	thogs_0 mtha'_5 med_11 ba_15 sems_20 dpa'_25 ni_30 
T02D1644:283b-36	rdo rje sems dpa' de bzhin gshegs //	rdo_0 rje_4 sems_8 dpa'_13 de_18 bzhin_21 gshegs_27 
T02D1644:283b-37	kun du bzang po kun bdag nyid //	kun_0 du_4 bzang_7 po_13 kun_16 bdag_20 nyid_25 
T02D1644:283b-38	rdo rje snying po bdag nyid gtso //	rdo_0 rje_4 snying_8 po_15 bdag_18 nyid_23 gtso_28 
T02D1644:283b-39	bcom ldan 'das dpal mchog dang po'i skyes bu'o //	'joms_0 ldan_5 'da'_10 dpal_15 mchog_20 dang_26 po_31 skye_36 bu_42 
T02D1644:283b-40	de nas a'a: las skyes pa'i dril bu byin la /	de_0 nas_3 a:_7 las_12 skye_16 ba_22 'dril_27 bu_32 byin_35 la_40 
T02D1644:283b-41	'di ni sangs rgyas thams cad kyis //	'di_0 ni_4 sangs_7 rgya_13 thams_19 cad_25 kyis_29 
T02D1644:283b-42	shes rab thabs kyi rjes 'gror brjod //	shes_0 rab_5 thabs_9 kyi_15 rjes_19 'gror_24 rjod_30 
T02D1644:283b-43	khyod kyis kyang ni rtag tu bcang //	khyod_0 kyis_6 kyang_11 ni_17 rtag_20 tu_25 'chang_28 
T02D1644:283b-44	byang chub mchog tu rgyal ba bzhed //	byang_0 chub_6 mchog_11 tu_17 rgyal_20 ba_26 bzhed_29 
T02D1644:283b-45	ces pas dril bu byin la /	ces_0 ba_4 'dril_8 bu_13 byin_16 la_21 
T02D1644:283b-46	srid pa rang bzhin dag pa'i phyir //	srid_0 ba_5 rang_8 bzhin_13 'dag_19 ba_23 phyir_28 
T02D1644:283b-47	ngo bo nyid kyis gdod nas dag / rang bzhin dag pa'i sems dpa' yis //	ngo_0 'bo_4 nyid_7 kyis_12 gdod_17 nas_22 'dag_26 rang_32 bzhin_37 'dag_43 ba_47 sems_52 dpa'_57 yis_62 
T02D1644:283b-48	srid pa dag pa'i mchog tu byed /	srid_0 ba_5 'dag_8 ba_12 mchog_17 tu_23 byed_26 
T02D1644:284a-0	aom badzra @284a * //	aom_0 badzra_4 
T02D1644:284a-1	ghande ra ni ta pra ra ni ta sam pra	ghande_0 ra_7 ni_10 ta_13 pra_16 ra_20 ni_23 ta_26 sam_29 pra_33 
T02D1644:284a-2	ra ni ta sarba buddha kshe tra pra tsa li	ra_0 ni_3 ta_6 sarba_9 buddha_15 kshe_22 tra_27 pra_31 tsa_35 li_39 
T02D1644:284a-3	pra dzny'a p'a ra mi tra /	pra_0 dzny_4 p_11 ra_15 mi_18 tra_21 
T02D1644:284a-4	n'a da sva bh'a ba badzra dha ra hri da ya /	n_0 da_4 sva_7 bh_11 ba_16 badzra_19 dha_26 ra_30 hri_33 da_37 ya_40 
T02D1644:284a-5	aa ba to sha ni h'um h'um h'um phat phat phat sv'a h'a /	aa_0 ba_3 to_6 sha_9 ni_13 h_16 h_21 h_26 phat_31 phat_36 phat_41 sv_46 h_51 
T02D1644:284a-6	zhes pas dkrol bar bya ste /	zhes_0 ba_5 'khrol_9 ba_15 byed_19 ste_23 
T02D1644:284a-7	dril bu'i brtul zhugs so //	'dril_0 bu_5 brtul_10 'jug_16 so_22 
T02D1644:284a-8	de nas phyag rgya'i brtul zhugs sbyin te /	de_0 nas_3 phyag_7 rgya_13 brtul_20 'jug_26 sbyin_32 te_38 
T02D1644:284a-9	de yang /	de_0 yang_3 
T02D1644:284a-10	shes rab lo grangs bcu gnyis ma //	shes_0 rab_5 lo_9 grangs_12 'chu_19 gnyis_23 ma_29 
T02D1644:284a-11	lag gnyis mgul du 'khyud byas te //	lag_0 gnyis_4 mgul_10 du_15 'khyud_18 byed_25 te_30 
T02D1644:284a-12	rdo rje dril bu'i sbyor ba yis //	rdo_0 rje_4 'dril_8 bu_13 sbyor_18 ba_24 yis_27 
T02D1644:284a-13	slob dpon gyi ni dbang du 'dod //	slob_0 dpon_5 gyi_10 ni_14 dbang_17 du_23 'dod_26 
T02D1644:284a-14	ces so //	ces_0 so_4 
T02D1644:284a-15	de bas na rang gi phyag rgyar byin gyis brlabs pa'o //	de_0 ba_3 na_7 rang_10 gi_15 phyag_18 rgyar_24 byin_30 gyis_35 brlabs_40 ba_47 
T02D1644:284a-16	de yang /	de_0 yang_3 
T02D1644:284a-17	yid kyi lus ni brtan pa'i phyir //	yid_0 kyi_4 lus_8 ni_12 brtan_15 ba_21 phyir_26 
T02D1644:284a-18	dam tshig phyag rgyar rab tu grags //	dam_0 tshig_4 phyag_10 rgyar_16 rab_22 tu_26 grags_29 
T02D1644:284a-19	gang gis las kun brtan byed pa //	gang_0 gis_5 las_9 kun_13 brtan_17 byed_23 ba_28 
T02D1644:284a-20	de ni phyag rgyar rab tu grags //	de_0 ni_3 phyag_6 rgyar_12 rab_18 tu_22 grags_25 
T02D1644:284a-21	zhes pas rang gi lha'i rnam par mngon par rtogs pa bskyed la /	zhes_0 ba_5 rang_9 gi_14 lha_17 rnam_23 ba_28 mngon_32 ba_38 rtogs_42 ba_48 skyed_51 la_58 
T02D1644:284a-22	de nas me tog la sogs pas kun nas mchod cing bstod pa bya ste /	de_0 nas_3 me_7 tog_10 la_14 sogs_17 ba_22 kun_26 nas_30 mchod_34 cing_40 bstod_45 ba_51 byed_54 ste_58 
T02D1644:284a-23	de yang snyems pa dang bcas pas me tog gcig slob ma'i mgo la dor la /	de_0 yang_3 snyems_8 ba_15 dang_18 'cha'_23 ba_28 me_32 tog_35 gcig_39 slob_44 ma_49 mgo_54 la_58 'dor_61 la_65 
T02D1644:284a-24	deng nas brtsams te rdzogs sangs rgyas //	deng_0 nas_5 brtsams_9 te_17 rdzogs_20 sangs_27 rgya_33 
T02D1644:284a-25	sras dang bcas rnams rnam rol cing //	sras_0 dang_5 'cha'_10 rnams_15 rnam_21 rol_26 cing_30 
T02D1644:284a-26	rdo rje snyems pa'i rab sbyor gyis //	rdo_0 rje_4 snyems_8 ba_15 rab_20 sbyor_24 gyis_30 
T02D1644:284a-27	dga' ston bde ba'i mchod pa gyis //	dga'_0 ston_5 bde_10 ba_14 mchod_19 ba_25 gyis_28 
T02D1644:284a-28	aa /	aa_0 
T02D1644:284a-29	sgeg dang bcas pa'i phreng ba 'phang //	sgeg_0 dang_5 'cha'_10 ba_15 phreng_20 ba_27 'phen_30 
T02D1644:284a-30	sangs rgyas thams cad mchod par bya //	sangs_0 rgya_6 thams_12 cad_18 mchod_22 ba_28 byed_32 
T02D1644:284a-31	des ni bcom ldan 'bral mi 'gyur //	des_0 ni_4 'joms_7 ldan_12 'bral_17 mi_23 'gyur_26 
T02D1644:284a-32	phreng bde yi rgyan yin no //	phreng_0 bde_7 yi_11 rgyan_14 yin_20 no_24 
T02D1644:284a-33	aom /	aom_0 
T02D1644:284a-34	lus can rnams la dam chos kyi //	lus_0 can_4 rnams_8 la_14 dam_17 chos_21 kyi_26 
T02D1644:284a-35	khyod kyis glu ni blang bar bya //	khyod_0 kyis_6 glu_11 ni_15 blang_18 ba_24 byed_28 
T02D1644:284a-36	de yis bde gshegs dngos grub ni //	de_0 yis_3 bde_7 gshegs_11 dngos_18 'grub_24 ni_29 
T02D1644:284a-37	myur du bde ba myong bar 'gyur //	myur_0 du_5 bde_8 ba_12 myong_15 ba_21 'gyur_25 
T02D1644:284a-38	g'i /	g_0 
T02D1644:284a-39	de nyid thal mo gar gyis ni //	de_0 nyid_3 thal_8 mo_13 gar_16 gyis_20 ni_25 
T02D1644:284a-40	sangs rgyas thams cad chags par mos //	sangs_0 rgya_6 thams_12 cad_18 chags_22 ba_28 mos_32 
T02D1644:284a-41	sangs rgyas 'du ba'i phrin las kyis //	sangs_0 rgya_6 'du_12 ba_16 phrin_21 las_27 kyis_31 
T02D1644:284a-42	gar mkhan tshul du bsgyur bar gyis //	gar_0 mkhan_4 tshul_10 du_16 sgyur_19 ba_26 gyis_30 
T02D1644:284a-44	ho:/ rdzogs sangs rgyas la spos btul la //	rdzogs_5 sangs_12 rgya_18 la_24 spros_27 'dul_32 la_37 
T02D1644:284a-45	brtul zhugs bzang pos legs tshim gyis //	brtul_0 'jug_6 bzang_12 pos_18 legs_22 tshim_27 gyis_33 
T02D1644:284a-46	lus can bde gshegs cha lugs su //	lus_0 can_4 bde_8 gshegs_12 cha_19 lugs_23 su_28 
T02D1644:284a-47	yi shes kyis ni tshim par gyis //	yi_0 shes_3 kyis_8 ni_13 tshim_16 ba_22 gyis_26 
T02D1644:284a-48	aa /	aa_0 
T02D1644:284a-49	sangs rgyas rnams la me tog dor //	sangs_0 rgya_6 rnams_12 la_18 me_21 tog_24 'dor_28 
T02D1644:284a-50	byang chub yan lag tshogs gyur pas //	byang_0 chub_6 yan_11 lag_15 tshogs_19 gyur_26 ba_31 
T02D1644:284a-51	mtshan dang dpe byad ldan pa yi //	mtshan_0 dang_7 dpe_12 byad_16 ldan_21 ba_26 yi_29 
T02D1644:284a-52	bde gshegs sku ni thob par 'gyur //	bde_0 gshegs_4 sku_11 ni_15 'thob_18 ba_23 'gyur_27 
T02D1644:284a-53	bhr'um /	bhr_0 
T02D1644:284b-0	@284b chos kyi me ni legs sbar pas //	chos_6 kyi_11 me_15 ni_18 legs_21 sbor_26 ba_31 
T02D1644:284b-1	rdo rje chos dang 'dra ba ru //	rdo_0 rje_4 chos_8 dang_13 'dra_18 ba_23 ru_26 
T02D1644:284b-2	sems can ma rig ldongs pa la //	sems_0 can_5 ma_9 rig_12 ldong_16 ba_23 la_26 
T02D1644:284b-3	ye shes sgron mas sbar bar gyis //	ye_0 shes_3 sgron_8 mas_14 sbor_18 ba_23 gyis_27 
T02D1644:284b-4	pra /	pra_0 
T02D1644:284b-5	rgyal ba rnams la dri phul bas //	rgyal_0 ba_6 rnams_9 la_15 'dri_18 'bul_22 ba_27 
T02D1644:284b-6	tshul khrims de bzhin gshegs rab dang //	tshul_0 khrims_6 de_13 bzhin_16 gshegs_22 rab_29 dang_33 
T02D1644:284b-7	rnam grol ye shes mthong ba yis //	rnam_0 grol_5 ye_10 shes_13 mthong_18 ba_25 yis_28 
T02D1644:284b-8	byang chub lus can rnams la bsgos //	byang_0 chub_6 lus_11 can_15 rnams_19 la_25 sgo_28 
T02D1644:284b-9	g'a /	g_0 
T02D1644:284b-10	de'i rjes la gser gyi thur ma la bcom ldan 'das kyi rtsa ba'i sngags bzlas te /	de_0 rjes_5 la_10 gser_13 gyi_18 thur_22 ma_27 la_30 'joms_33 ldan_38 'da'_43 kyi_48 rtsa_52 ba_57 sngags_62 bzlas_69 te_75 
T02D1644:284b-11	ji ltar mig mkhan rgyal po yis //	ji_0 ltar_3 mig_8 mkhan_12 rgyal_18 po_24 yis_27 
T02D1644:284b-12	'jig rten ling tog bsal ba ltar //	'jig_0 rten_5 ling_10 tog_15 bsal_19 ba_24 ltar_27 
T02D1644:284b-13	bu khyod kyis ni mi shes pa'i //	bu_0 khyod_3 kyis_9 ni_14 mi_17 shes_20 ba_25 
T02D1644:284b-14	ling tog rgyal ba rnams kyis bsal //	ling_0 tog_5 rgyal_9 ba_15 rnams_18 kyis_24 bsal_29 
T02D1644:284b-15	aom badzra ni tr'a ya aa pa h'a ra pa tra lam hr'i:/	aom_0 badzra_4 ni_11 tr_14 ya_19 aa_22 ba_25 h_28 ra_32 ba_35 tra_38 lam_42 
T02D1644:284b-16	de nas me long bstan te /	de_0 nas_3 me_7 long_10 ston_15 te_21 
T02D1644:284b-17	chos rnams sgyu ma lta bu ste //	chos_0 rnams_5 sgyu_11 ma_16 lta_19 bu_23 ste_26 
T02D1644:284b-18	gsal zhing dag la rnyog pa med //	gsal_0 zhing_5 'dag_11 la_15 rnyog_18 ba_24 med_27 
T02D1644:284b-19	gzung du med cing brjod du med //	gzung_0 du_6 med_9 cing_13 rjod_18 du_24 med_27 
T02D1644:284b-20	rgyu dang las las kun du 'byung //	rgyu_0 dang_5 las_10 las_14 kun_18 du_22 'byung_25 
T02D1644:284b-21	rang bzhin dag cing bdag med pa //	rang_0 bzhin_5 'dag_11 cing_15 bdag_20 med_25 ba_29 
T02D1644:284b-22	de ltar chos rnams shes byas nas ;	de_0 ltar_3 chos_8 rnams_13 shes_19 byed_24 nas_29 
T02D1644:284b-23	/ sems can don ni mnyam med byos //	sems_2 can_7 don_11 ni_15 mnyam_18 med_24 byos_28 
T02D1644:284b-24	'on kyang rgyal ba'i sras su skye /	'on_0 kyang_4 rgyal_10 ba_16 sras_21 su_26 skye_29 
T02D1644:284b-25	de nas ho: zhes mda' gzhu byin nas /	de_0 nas_3 ho:_7 zhes_11 mda'_16 gzhu_21 byin_26 nas_31 
T02D1644:284b-26	de bzhin gshegs pa thams cad rjes su chags par	de_0 bzhin_3 gshegs_9 ba_16 thams_19 cad_25 rjes_29 su_34 chags_37 ba_43 
T02D1644:284b-27	byos shig ces bsgo la phyogs bzhir mda' re 'phang	byos_0 shig_5 ces_10 sgo_14 la_19 phyogs_22 bzhir_29 mda'_35 re_40 'phen_43 
T02D1644:284b-28	ba dang / steng 'og tu yang mda' re 'phen du gzhug go ;	ba_0 dang_3 steng_10 'og_16 tu_20 yang_23 mda'_28 re_33 'phen_36 du_42 'jug_45 go_51 
T02D1644:284b-29	/ de nas aom badzra he tu krum zhes bya bas 'khor lo rkang pa'i bar du bzhag la /	de_2 nas_5 aom_9 badzra_13 he_20 tu_23 krum_26 zhes_31 byed_36 ba_40 'khor_44 lo_50 rkang_53 ba_59 ba_64 du_68 'jog_71 la_77 
T02D1644:284b-30	yang aom badzra bha sha ram zhes byas pas /	yang_0 aom_5 badzra_9 bha_16 sha_20 ram_24 zhes_28 byed_33 ba_38 
T02D1644:284b-31	lag pa g-yas su dung gtad nas g-yon par ma h'a m'a y'a'i pu sti byin te /	lag_0 ba_4 g-yas_7 su_13 dung_16 gtod_21 nas_26 g-yon_30 ba_36 ma_40 h_43 m_47 y'i_51 pu_57 sti_60 byin_64 te_69 
T02D1644:284b-32	dril bu yang dkrol zhing /	'dril_0 bu_5 yang_8 'khrol_13 zhing_19 
T02D1644:284b-33	deng nas brtsams te sems bskyed pa //	deng_0 nas_5 brtsams_9 te_17 sems_20 skyed_25 ba_32 
T02D1644:284b-34	tsam gyis chos kyi 'khor lo bskor //	tsam_0 gyis_5 chos_10 kyi_15 'khor_19 lo_25 skor_28 
T02D1644:284b-35	khyod kyis the tshom dgos med pas //	khyod_0 kyis_6 the_11 tshom_15 dgos_21 med_26 ba_30 
T02D1644:284b-36	yid gnyis med pa'i sems kyis su //	yid_0 gnyis_4 med_10 ba_14 sems_19 kyis_24 su_29 
T02D1644:284b-37	chos kyi dung ni bla med pa //	chos_0 kyi_5 dung_9 ni_14 bla_17 med_21 ba_25 
T02D1644:284b-38	dri med kun du gang bar gyis //	'dri_0 med_4 kun_8 du_12 gang_15 ba_20 gyis_24 
T02D1644:284b-39	sngags kyi spyod tshul cho ga rnams //	sngags_0 kyi_7 spyod_11 tshul_17 cho_23 ga_27 rnams_30 
T02D1644:284b-40	skye bo rnams la rtag tu shod //	skye_0 'bo_5 rnams_8 la_14 rtag_17 tu_22 shod_25 
T02D1644:284b-41	de ltar byas na sangs rgyas la //	de_0 ltar_3 byed_8 na_13 sangs_16 rgya_22 la_28 
T02D1644:284b-42	phan 'dogs drin du gzo zhes bya //	phan_0 'dogs_5 drin_11 du_16 gzo_19 zhes_23 byed_28 
T02D1644:284b-43	rdo rje 'dzin pa de kun yang //	rdo_0 rje_4 'dzin_8 ba_14 de_17 kun_20 yang_24 
T02D1644:284b-44	khyod la rtag tu bsrung bar mdzad //	khyod_0 la_6 rtag_9 tu_14 bsrung_17 ba_24 mdzad_28 
T02D1644:284b-45	ces brjod la /	ces_0 rjod_4 la_10 
T02D1644:284b-46	de nas so so'i 'khor los sgyur ba'i cha lugs su bya ste /	de_0 nas_3 so_7 so_10 'khor_15 los_21 sgyur_25 ba_31 cha_36 lugs_40 su_45 byed_48 ste_52 
T02D1644:284b-47	sems can kun la phan pa'i phyir //	sems_0 can_5 kun_9 la_13 phan_16 ba_21 phyir_26 
T02D1644:285a-0	'jig rten khams ni thams cad @285a * //	'jig_0 rten_5 khams_10 ni_16 thams_19 cad_25 
T02D1644:285a-1	du ;	du_0 
T02D1644:285a-2	/ ji ltar sna tshogs 'dul gyur pa'i //	ji_2 ltar_5 sna_10 tshogs_14 'dul_21 gyur_26 ba_31 
T02D1644:285a-3	chos kyi 'khor lo rab tu bskor //	chos_0 kyi_5 'khor_9 lo_15 rab_18 tu_22 skor_25 
T02D1644:285a-4	de bzhin du chos kyi gnas su rdo rje dang /	de_0 bzhin_3 du_9 chos_12 kyi_17 gnas_21 su_26 rdo_29 rje_33 dang_37 
T02D1644:285a-5	rin po che dang /	rin_0 po_4 che_7 dang_11 
T02D1644:285a-6	padma dang /	padma_0 dang_6 
T02D1644:285a-7	las kyi tshig bcug la /	las_0 kyi_4 tshig_8 'jug_14 la_19 
T02D1644:285a-8	tshigs su bcad pa lngas rjes su gnang ba byin la /	tshigs_0 su_7 gcod_10 ba_15 lngas_18 rjes_24 su_29 gnang_32 ba_38 byin_41 la_46 
T02D1644:285a-9	de nas yang ;	de_0 nas_3 yang_7 
T02D1644:285a-10	zhi rgyas dbang dang gsang ba dang //	zhi_0 rgya_4 dbang_10 dang_16 gsang_21 ba_27 dang_30 
T02D1644:285a-11	dgug dang skrag dang bskrad pa dang //	'gugs_0 dang_5 skrag_10 dang_16 skrod_21 ba_28 dang_31 
T02D1644:285a-12	dbye dang gnan pa la sogs pa'i //	'byed_0 dang_5 gnon_10 ba_15 la_18 sogs_21 ba_26 
T02D1644:285a-13	las de thams cad bsgrub par gyis //	las_0 de_4 thams_7 cad_13 sgrub_17 ba_24 gyis_28 
T02D1644:285a-14	ral gri mig sman sa 'og dang //	ral_0 gri_4 mig_8 sman_12 sa_17 'og_20 dang_24 
T02D1644:285a-15	mchil lha ma de bzhin ri lu ste //	mchil_0 lha_6 ma_10 de_13 bzhin_16 ri_22 lu_25 ste_28 
T02D1644:285a-16	rnal 'byor ma yi dngos grub rnams //	rnal_0 'byor_5 ma_11 yi_14 dngos_17 'grub_23 rnams_28 
T02D1644:285a-17	de dag ci dgar bsgrub par gyis //	de_0 'dag_3 ci_7 dgar_10 sgrub_15 ba_22 gyis_26 
T02D1644:285a-18	zhes bya ba rjes su gnang ba'o //	zhes_0 byed_5 ba_9 rjes_12 su_17 gnang_20 ba_26 
T02D1644:285a-19	de nas bdag nyid langs te /	de_0 nas_3 bdag_7 nyid_12 ldang_17 te_23 
T02D1644:285a-20	sangs rgyas kyi gzugs dmigs la //	sangs_0 rgya_6 kyi_12 gzugs_16 dmigs_22 la_28 
T02D1644:285a-21	g-yon pa snying gar chos gos 'dzin pa'i tshul du byas la /	g-yon_0 ba_6 snying_9 gar_16 chos_20 gos_25 'dzin_29 ba_35 tshul_40 du_46 byed_49 la_54 
T02D1644:285a-22	g-yas mi 'jigs pa sbyin pa ltar byas te /	g-yas_0 mi_6 'jigs_9 ba_15 sbyin_18 ba_24 ltar_27 byed_32 te_37 
T02D1644:285a-23	rdo rje'i ming gis dbang bskur bas lung bstan pa'o //	rdo_0 rje_4 ming_10 gis_15 dbang_19 skur_25 ba_31 lung_35 ston_40 ba_46 
T02D1644:285a-24	'di ni khyod la ngas lung bstan //	'di_0 ni_4 khyod_7 la_13 ngas_16 lung_21 ston_26 
T02D1644:285a-25	rdo rje sems dpa' de bzhin gshegs //	rdo_0 rje_4 sems_8 dpa'_13 de_18 bzhin_21 gshegs_27 
T02D1644:285a-26	srid pa shin tu dag pas na //	srid_0 ba_5 shin_8 tu_13 'dag_16 ba_20 na_24 
T02D1644:285a-27	srid pa'i ngan 'gro dag las bton /	srid_0 ba_5 ngan_10 'gro_15 'dag_20 las_24 'don_28 
T02D1644:285a-28	he badzra n'a ma ta th'a ga ta bhur bhu	he_0 badzra_3 n_10 ma_14 ta_17 th_20 ga_25 ta_28 bhur_31 bhu_36 
T02D1644:285a-29	ba sva: gang la tshul 'di dang phyag rgya chen	ba_0 sva:_3 gang_8 la_13 tshul_16 'di_22 dang_26 phyag_31 rgya_37 chen_42 
T02D1644:285a-30	po mchog tu gsang ba'i cho ga 'dis lung bstan	po_0 mchog_3 tu_9 gsang_12 ba_18 cho_23 ga_27 'dis_30 lung_35 ston_40 
T02D1644:285a-31	pa de la sangs rgyas dang byang chub sems dpa'	ba_0 de_3 la_6 sangs_9 rgya_15 dang_21 byang_26 chub_32 sems_37 dpa'_42 
T02D1644:285a-32	dkyil 'khor 'khor lo dang bcas pa rnams kyis //	dkyil_0 'khor_6 'khor_12 lo_18 dang_21 'cha'_26 ba_31 rnams_34 kyis_40 
T02D1644:285a-33	mgrin gcig tu bla na med pa'i byang chub chen por lung ston par mdzad de /	mgrin_0 gcig_6 tu_11 bla_14 na_18 med_21 ba_25 byang_30 chub_36 chen_41 por_46 lung_50 ston_55 ba_60 mdzad_64 de_70 
T02D1644:285a-34	sngags 'di dang phyag rgya 'di'i mthu yin no zhes pas dad pa bskyed pa'o //	sngags_0 'di_7 dang_11 phyag_16 rgya_22 'di_27 mthu_33 yin_38 no_42 zhes_45 ba_50 dad_54 ba_58 skyed_61 ba_68 
T02D1644:285a-35	de nas gsang ba bsgrags te /	de_0 nas_3 gsang_7 ba_13 sgrog_16 te_24 
T02D1644:285a-36	'dod chags bral ba lta bu'i sdig / khams gsum na ni med pa ste //	'dod_0 chags_5 'bral_11 ba_16 lta_19 bu_23 sdig_28 khams_35 gsum_41 na_46 ni_49 med_52 ba_56 ste_59 
T02D1644:285a-37	de bas 'dod la chags bral bar //	de_0 ba_3 'dod_7 la_12 chags_15 'bral_21 ba_26 
T02D1644:285a-38	nam yang bya ba ma yin no //	nam_0 yang_4 byed_9 ba_13 ma_16 yin_19 no_23 
T02D1644:285a-39	ma h'a sa ma ya ha na h'um /	ma_0 h_3 sa_7 ma_10 ya_13 ha_16 na_19 h_22 
T02D1644:285a-40	de nas slob ma'i spyi bor gdugs bzung la ;	de_0 nas_3 slob_7 ma_12 spyi_17 'bor_22 gdugs_26 bzung_32 la_38 
T02D1644:285a-41	/ gdugs dang bcas pas bskor ba lan gsum byas la /	gdugs_2 dang_8 'cha'_13 ba_18 skor_22 ba_28 lan_31 gsum_35 byed_40 la_45 
T02D1644:285a-42	de nas dkyil 'khor gyi sgo ru gdugs dang bcas par spyi bos gtugs la /	de_0 nas_3 dkyil_7 'khor_13 gyi_19 sgo_23 ru_27 gdugs_30 dang_36 'cha'_41 ba_46 spyi_50 'bod_55 gtugs_59 la_65 
T02D1644:285a-43	sngags rnams 'dzin par gyur pa yis //	sngags_0 rnams_7 'dzin_13 ba_19 gyur_23 ba_28 yis_31 
T02D1644:285a-44	slob ma 'di ni phul ba lags //	slob_0 ma_5 'di_8 ni_12 'bul_15 ba_20 lags_23 
T02D1644:285a-45	zhes brjod de /	zhes_0 rjod_5 de_11 
T02D1644:285b-0	gdugs bzhag la 'di @285b skad ces brjod do //	gdugs_0 'jog_6 la_12 'di_15 skad_25 ces_30 rjod_34 do_40 
T02D1644:285b-1	di ring dkyil 'khor slob dpon gyur //	di_0 ring_3 dkyil_8 'khor_14 slob_20 dpon_25 gyur_30 
T02D1644:285b-2	sngags dang rgyud rnams 'dzin par gyur //	sngags_0 dang_7 brgyud_12 rnams_18 'dzin_24 ba_30 gyur_34 
T02D1644:285b-3	sangs rgyas byang chub sems dpa' dang //	sangs_0 rgya_6 byang_12 chub_18 sems_23 dpa'_28 dang_33 
T02D1644:285b-4	lha rnams kun gyis mthun par gsungs //	lha_0 rnams_4 kun_10 gyis_14 mthun_19 ba_25 gsungs_29 
T02D1644:285b-5	sems can kun la rjes brtse bas //	sems_0 can_5 kun_9 la_13 rjes_16 brtse_21 ba_27 
T02D1644:285b-6	dkyil 'khor cho ga bzhin du bris //	dkyil_0 'khor_6 cho_12 ga_16 bzhin_19 du_25 'bri_28 
T02D1644:285b-7	khyod kyis nan tan bskyed nas su //	khyod_0 kyis_6 nan_11 tan_15 skyed_19 nas_26 su_30 
T02D1644:285b-8	sgrub pa po rnams sngags la sbyor //	sgrub_0 ba_6 po_9 rnams_12 sngags_18 la_25 sbyor_28 
T02D1644:285b-9	de nas dbugs dbyung bar bya ste //	de_0 nas_3 dbugs_7 'byin_13 ba_20 byed_24 ste_28 
T02D1644:285b-10	gsang chen mchog gi dkyil 'khor du //	gsang_0 chen_6 mchog_11 gi_17 dkyil_20 'khor_26 du_32 
T02D1644:285b-11	bcug pa dang ni mthong ba yis //	'jug_0 ba_5 dang_8 ni_13 mthong_16 ba_23 yis_26 
T02D1644:285b-12	sdig pa kun las rnam grol te //	sdig_0 ba_5 kun_8 las_12 rnam_16 grol_21 te_26 
T02D1644:285b-13	di ring khyod ni dge bar gnas //	di_0 ring_3 khyod_8 ni_14 dge_17 ba_21 gnas_25 
T02D1644:285b-14	bde chen theg pa 'di la ni //	bde_0 chen_4 theg_9 ba_14 'di_17 la_21 ni_24 
T02D1644:285b-15	phyin chad 'chi ba yod min te //	phyin_0 'chad_6 'chi_11 ba_16 yod_19 min_23 te_27 
T02D1644:285b-16	mi thub gnod pa yod min la //	mi_0 thub_3 gnod_8 ba_13 yod_16 min_20 la_24 
T02D1644:285b-17	cis kyang mi 'jigs dga' bar gyis //	cis_0 kyang_4 mi_10 'jigs_13 dga'_19 ba_24 gyis_28 
T02D1644:285b-18	srid pa shin tu dag pas na //	srid_0 ba_5 shin_8 tu_13 'dag_16 ba_20 na_24 
T02D1644:285b-19	srid dang sdug bsngal las 'das so //	srid_0 dang_5 sdug_10 sngal_15 las_22 'da'_26 so_31 
T02D1644:285b-20	rdo rje zhes bya'i phyag rgya dang //	rdo_0 rje_4 zhes_8 byed_13 phyag_19 rgya_25 dang_30 
T02D1644:285b-21	byang chub sems ni spang mi bya //	byang_0 chub_6 sems_11 ni_16 spong_19 mi_25 byed_28 
T02D1644:285b-22	gang zhig skyes pa tsam gyis kyang //	gang_0 'jig_5 skye_10 ba_16 tsam_19 gyis_24 kyang_29 
T02D1644:285b-23	sangs rgyas nyid 'gyur the tshom med //	sangs_0 rgya_6 nyid_12 'gyur_17 the_23 tshom_27 med_33 
T02D1644:285b-24	dam pa'i chos kyang smang mi bya //	dam_0 ba_4 chos_9 kyang_14 smang_20 mi_26 byed_29 
T02D1644:285b-25	nam yang dor bar mi bya ste //	nam_0 yang_4 'dor_9 ba_13 mi_17 byed_20 ste_24 
T02D1644:285b-26	mi shes pa'am rmongs pa la //	mi_0 shes_3 ba_8 rmongs_14 ba_21 la_24 
T02D1644:285b-27	de ni bstan par mi bya'o //	de_0 ni_3 ston_6 ba_12 mi_16 byed_19 
T02D1644:285b-28	rdo rje dril bu mi sdang zhing ;	rdo_0 rje_4 'dril_8 bu_13 mi_16 sdang_19 zhing_25 
T02D1644:285b-29	/ slob dpon nam yang smad mi bya //	slob_2 dpon_7 nam_12 yang_16 smad_21 mi_26 byed_29 
T02D1644:285b-30	sangs rgyas kun dang mtshungs pas na //	sangs_0 rgya_6 kun_12 dang_16 mtshungs_21 ba_30 na_34 
