T02D2357:6b-0	@6b * // sangs rgyas la phyag 'tshal lo //	sangs_9 rgya_15 la_21 phyag_24 'tshal_30 lo_37 
T02D2357:6b-1	rdul chon dkyil 'khor bum pa rdo rje sogs //	rdul_0 chon_5 dkyil_10 'khor_16 bum_22 ba_26 rdo_29 rje_33 sogs_37 
T02D2357:6b-2	grol bar ma lta phung po 'grangs pa'i thabs //	grol_0 ba_5 ma_9 lta_12 'phung_16 po_22 'grang_25 ba_33 thabs_38 
T02D2357:6b-3	ka na pas brjod de 'dra su zhig byed //	ka_0 na_3 ba_6 rjod_10 de_16 'dra_19 su_24 'jig_27 byed_32 
T02D2357:7a-0	thams @7a * //	thams_0 
T02D2357:7a-1	cad brdzun pas slu ba yin par 'dod //	cad_0 brdzun_4 ba_11 slu_15 ba_19 yin_22 ba_26 'dod_30 
T02D2357:7a-2	ka na pa'i glu rdzogs so//	ka_0 na_3 ba_6 glu_11 rdzogs_15 
