T02D1407:89b-16	ces pa'o // de nas 'gugs pa la sogs pa	ces_0 ba_4 de_12 nas_15 'gugs_19 ba_25 la_28 sogs_31 ba_36 
T02D1407:89b-17	byas la yang dag par mchod de kha sbyar du	byed_0 la_5 yang_8 'dag_13 ba_17 mchod_21 de_27 kha_30 sbyor_34 du_40 
T02D1407:89b-18	byas la klu gnas pa'i sar bcug ste /	byed_0 la_5 klu_8 gnas_12 ba_17 sar_22 'jug_26 ste_31 
T02D1407:89b-19	gu gul dang /	gu_0 gul_3 dang_7 
T02D1407:89b-20	lce pog dkar po dang /	lce_0 pog_4 dkar_8 po_13 dang_16 
T02D1407:89b-21	sgog pa bsregs pa'i bdug pa byin te /	sgog_0 ba_5 bsregs_8 ba_15 bdug_20 ba_25 byin_28 te_33 
T02D1407:89b-22	sngags kyi bzlas pa byas na char 'bab po //	sngags_0 kyi_7 bzlas_11 ba_17 byed_20 na_25 char_28 'bab_33 po_38 
T02D1407:89b-23	char 'bebs par byed pa'i don ni de lta bu'o //	char_0 'bebs_5 ba_11 byed_15 ba_20 don_25 ni_29 de_32 lta_35 bu_39 
T02D1407:89b-24	zlog par byed pa dang zhes bya ba ni 'khor lo'i bka' rab tu sbyar ba las so //	zlog_0 ba_5 byed_9 ba_14 dang_17 zhes_22 byed_27 ba_31 ni_34 'khor_37 lo_43 bka'_48 rab_53 tu_57 sbyor_60 ba_66 las_69 so_73 
T02D1407:89b-25	yang na rdo rje 'dzin pa'i me tog dman ma	yang_0 na_5 rdo_8 rje_12 'dzin_16 ba_22 me_27 tog_30 dman_34 ma_39 
T02D1407:89b-26	blangs pa las rtsa ba'i sngags kyis lan bdun du	blangs_0 ba_7 las_10 rtsa_14 ba_19 sngags_24 kyis_31 lan_36 bdun_40 du_45 
T02D1407:89b-27	mngon par sngags kyis btab la //	mngon_0 ba_6 sngags_10 kyis_17 'debs_22 la_27 
T02D1407:89b-28	de'i bdug pas sprin la bdugs na 'dis nam mkha' la char zlog par byed do //	de_0 bdug_5 ba_10 sprin_14 la_20 bdug_23 na_29 'dis_32 nam_37 mkha'_41 la_47 char_50 zlog_55 ba_60 byed_64 do_69 
T02D1407:89b-29	rgya mtsho skems par byed do zhes pa ni /	rgya_0 mtsho_5 skem_11 ba_17 byed_21 do_26 zhes_29 ba_34 ni_37 
T02D1407:89b-30	ji ltar gsungs pa'i cho ga bsgom pas rgya mtsho'i	ji_0 ltar_3 gsungs_8 ba_15 cho_20 ga_24 bsgom_27 ba_33 rgya_37 mtsho_42 
T02D1407:89b-31	dbus su sngags pa shin tu khros pas gzi brjid	dbus_0 su_5 sngags_8 ba_15 shin_18 tu_23 khro_26 ba_32 gzi_36 brjid_40 
T02D1407:89b-32	chen por gnas na skam par 'di la the tshom	chen_0 por_5 gnas_9 na_14 skam_17 ba_22 'di_26 la_30 the_33 tshom_37 
T02D1407:89b-33	med do // kha tv'am ga la yongs su bzlas	med_0 do_4 kha_10 tv_14 ga_20 la_23 yongs_26 su_32 bzlas_35 
T02D1407:89b-34	te bsnun na chu bo gyen du zlog par byed	te_0 snun_3 na_9 chu_12 'bo_16 gyen_19 du_24 zlog_27 ba_32 byed_36 
T02D1407:89b-35	pa ni chu bo rgyun phyogs nas bzlog ste 'bebs	ba_0 ni_3 chu_6 'bo_10 rgyun_13 phyogs_19 nas_26 bzlog_30 ste_36 'bebs_40 
T02D1407:89b-36	med do // so zhes pa'o // dbang po zlog	med_0 do_4 so_10 zhes_13 ba_18 dbang_26 po_32 zlog_35 
T02D1407:89b-37	par byed do zhes pa ni sdigs mdzub byas pa	ba_0 byed_4 do_9 zhes_12 ba_17 ni_20 sdigs_23 mdzub_29 byed_35 ba_40 
T02D1407:89b-38	med do // so zhes pa'o // tsam gyis so	med_0 do_4 so_10 zhes_13 ba_18 tsam_26 gyis_31 so_36 
T02D1407:89b-39	// 'bum byas pas sa g-yo bar byed do zhes	'bum_3 byed_8 ba_13 sa_17 g-yo_20 ba_25 byed_29 do_34 zhes_37 
T02D1407:89b-40	pa ni rkang pa g-yas brkyang bar sbyor ba'i gar	ba_0 ni_3 rkang_6 ba_12 g-yas_15 rkyong_21 ba_29 sbyor_33 ba_39 gar_44 
T02D1407:90a-0	gyis bde zhing dga' bas mkha' 'gro ma'i 'khor @90a	gyis_0 bde_5 zhing_9 dga'_15 ba_20 mkha'_24 'gro_30 ma_35 'khor_40 
T02D1407:90a-1	med do // so zhes pa'o // tsam gyis so // * // lo bde bar byed pa'o //	med_0 do_4 so_10 zhes_13 ba_18 tsam_26 gyis_31 so_36 lo_47 bde_50 ba_54 byed_58 ba_63 
T02D1407:90a-2	shing la 'dzegs te zhes pa la sogs pa ni	shing_0 la_6 'dzegs_9 te_16 zhes_19 ba_24 la_27 sogs_30 ba_35 ni_38 
T02D1407:90a-3	sgrub pa po grub par gyur pa gang gi tshe	sgrub_0 ba_6 po_9 'grub_12 ba_17 gyur_21 ba_26 gang_29 gi_34 tshe_37 
T02D1407:90a-4	kye thams cad byed par 'gyur ro zhes pa'o //	kye_0 thams_4 cad_10 byed_14 ba_19 'gyur_23 ro_29 zhes_32 ba_37 
T02D1407:90a-5	gzugs stong phrag du ma byed do zhes pa la	gzugs_0 stong_6 phrag_12 du_18 ma_21 byed_24 do_29 zhes_32 ba_37 la_40 
T02D1407:90a-6	sogs pa ni phyag rgya chen po'i go 'phang la	sogs_0 ba_5 ni_8 phyag_11 rgya_17 chen_22 po_27 go_32 'phen_35 la_42 
T02D1407:90a-7	gnas pa 'jig rten 'dir gang grub pa'i sangs rgyas	gnas_0 ba_5 'jig_8 rten_13 'dir_18 gang_23 'grub_28 ba_33 sangs_38 rgya_44 
T02D1407:90a-8	de'i ji ltar brjod par nus ji ste zhes snying	de_0 ji_5 ltar_8 rjod_13 ba_19 nus_23 ji_27 ste_30 zhes_34 snying_39 
T02D1407:90a-9	rje chen pos mgu bar mdzad cing smon lam gyis	rje_0 chen_4 pos_9 mgu_13 ba_17 mdzad_21 cing_27 smon_32 lam_37 gyis_41 
T02D1407:90a-10	rtag par skyes pa de ji ltar 'dul ba'i sems	rtag_0 ba_5 skye_9 ba_15 de_18 ji_21 ltar_24 'dul_29 ba_34 sems_39 
T02D1407:90a-11	can rnams kyi bsam pa de dang de'i gzugs 'dzin	can_0 rnams_4 kyi_10 bsam_14 ba_19 de_22 dang_25 de_30 gzugs_35 'dzin_41 
T02D1407:90a-12	par 'gyur bas na'o //	ba_0 'gyur_4 ba_10 na_14 
T02D1407:90a-13	de nas brtson 'grus dman par 'gyur ba gang gi	de_0 nas_3 brtson_7 'grus_14 dman_20 ba_25 'gyur_29 ba_35 gang_38 gi_43 
T02D1407:90a-14	tshe dngos grub 'dod pa'i sgrub pa pos de'i tshe	tshe_0 dngos_5 'grub_11 'dod_16 ba_21 sgrub_26 ba_32 pos_35 de_39 tshe_44 
T02D1407:90a-15	sngags dang sman gyis 'grub par 'gyur ro //	sngags_0 dang_7 sman_12 gyis_17 'grub_22 ba_28 'gyur_32 ro_38 
T02D1407:90a-16	sngags ni sngags nyid la gsungs so //	sngags_0 ni_7 sngags_10 nyid_17 la_22 gsungs_25 so_32 
T02D1407:90a-17	sman ni sman te sman bzang po'i thabs chen pos grub pa thob par ci ste mi skye ste /	sman_0 ni_5 sman_8 te_13 sman_16 bzang_21 po_27 thabs_32 chen_38 pos_43 'grub_47 ba_52 'thob_55 ba_60 ci_64 ste_67 mi_71 skye_74 ste_79 
T02D1407:90a-18	gdon mi za bar gzugs ma lus pa so sor	'don_0 mi_5 za_8 ba_11 gzugs_15 ma_21 lus_24 ba_28 so_31 sor_34 
T02D1407:90a-19	yongs su bsgyur ba ni bsod nams med pa rnams	yongs_0 su_6 sgyur_9 ba_16 ni_19 bsod_22 nams_27 med_32 ba_36 rnams_39 
T02D1407:90a-20	kyis kyang rkyen rnams rnyed par gyur na ni rkyen	kyis_0 kyang_5 rkyen_11 rnams_17 rnyed_23 ba_29 gyur_33 na_38 ni_41 rkyen_44 
T02D1407:90a-21	rnam pa sna tshogs pa la sogs pa'i dgos pa	rnam_0 ba_5 sna_8 tshogs_12 ba_19 la_22 sogs_25 ba_30 dgos_35 ba_40 
T02D1407:90a-22	rnams dang sems can rnams kyi chags par so sor	rnams_0 dang_6 sems_11 can_16 rnams_20 kyi_26 chags_30 ba_36 so_40 sor_43 
T02D1407:90a-23	skyes par byed do //	skye_0 ba_6 byed_10 do_15 
T02D1407:90a-24	de yang dang po kho nar bdag nyid khar gyur par bya'o //	de_0 yang_3 dang_8 po_13 kho_16 nar_20 bdag_24 nyid_29 khar_34 gyur_39 ba_44 byed_48 
T02D1407:90a-25	de nas re zhig sa bon gyis bsgom pa'o //	de_0 nas_3 re_7 'jig_10 sa_15 bon_18 gyis_22 bsgom_27 ba_33 
T02D1407:90a-26	de gang zhe na sa bon la sogs pa ste /	de_0 gang_3 zhe_8 na_12 sa_15 bon_18 la_22 sogs_25 ba_30 ste_33 
T02D1407:90a-27	shing gi tshogs ae randa dang smyo byed la sogs	shing_0 gi_6 tshogs_9 ae_16 randa_19 dang_25 smyo_30 byed_35 la_40 sogs_43 
T02D1407:90a-28	pa'i ste sa bon zhes pa ni de lta bu'o	ba_0 ste_5 sa_9 bon_12 zhes_16 ba_21 ni_24 de_27 lta_30 bu_34 
T02D1407:90a-29	// de lta bu la sogs par shin tu smin pa rnams la chogs bsgrub bar bya ste /	de_3 lta_6 bu_10 la_13 sogs_16 ba_21 shin_25 tu_30 smin_33 ba_38 rnams_41 la_47 chogs_50 sgrub_56 ba_63 byed_67 ste_71 
T02D1407:90a-30	'byung bo'i nyin par gdol pa ma'i me tog la bsnos la bdud rtsi rnam pa lngas sbrus te /	'byung_0 'bo_7 nyin_12 ba_17 gdol_21 ba_26 ma_29 me_34 tog_37 la_41 sno_44 la_50 bdud_53 rtsi_58 rnam_63 ba_68 lngas_71 sbru_77 te_83 
T02D1407:90a-31	nyin mtshan de la bskams pa khyi dkar po min	nyin_0 mtshan_5 de_12 la_15 skem_18 ba_25 khyi_28 dkar_33 po_38 min_41 
T02D1407:90a-32	pa'i thod par ro bsregs pa'i sas bkang bar nag	ba_0 thod_5 ba_10 ro_14 bsregs_17 ba_24 sas_29 'geng_33 ba_39 nag_43 
T02D1407:90a-33	po'i tshes brgyad dam bcu bzhi la ma mo'i nags	po_0 tshes_5 brgyad_11 dam_18 'chu_22 bzhi_26 la_31 ma_34 mo_37 nags_42 
T02D1407:90a-34	tshal du btab ste /	tshal_0 du_6 'debs_9 ste_14 
T02D1407:90a-35	ji ltar grub pa'i sa bon blangs la sngags pas	ji_0 ltar_3 'grub_8 ba_13 sa_18 bon_21 blangs_25 la_32 sngags_35 ba_42 
T02D1407:90a-36	he ru ka dang bla ma mgon po khyad par	he_0 ru_3 ka_6 dang_9 bla_14 ma_18 mgon_21 po_26 khyad_29 ba_35 
T02D1407:90a-37	du mchod pa dbul zhing dur khrod de na gnas	du_0 mchod_3 ba_9 'bul_12 zhing_17 dur_23 khrod_27 de_33 na_36 gnas_39 
T02D1407:90a-38	pa rnams la mchod pa bya ste /	ba_0 rnams_3 la_9 mchod_12 ba_18 byed_21 ste_25 
T02D1407:90a-39	mngon par bsngags pa'i cho gas mgul par btags na nye bar sbas par 'gyur te /	mngon_0 ba_6 bsngags_10 ba_18 cho_23 'gas_27 mgul_31 ba_36 'dogs_40 na_46 nye_49 ba_53 sbed_57 ba_62 'gyur_66 te_72 
T02D1407:90a-40	dkrol bas ni yang rang gi ngo bor gnas par 'gyur ro //	'khrol_0 ba_6 ni_10 yang_13 rang_18 gi_23 ngo_26 'bor_30 gnas_34 ba_39 'gyur_43 ro_49 
T02D1407:90a-41	gzhan yang shing smyo byed kyi 'bras bu blangs la /	gzhan_0 yang_6 shing_11 smyo_17 byed_22 kyi_27 'bras_31 bu_37 blangs_40 la_47 
T02D1407:90b-0	nag po'i phyogs kyi dus su sbrul nag po'i @90b tshil bu blangs par bcug ste /	nag_0 po_4 phyogs_9 kyi_16 dus_20 su_24 sbrul_27 nag_33 po_37 tshil_47 bu_53 blangs_56 ba_63 'jug_67 ste_72 
T02D1407:90b-1	nag po'i tshes brgyad dang bcu bzhi la khva nag	nag_0 po_4 tshes_9 brgyad_15 dang_22 'chu_27 bzhi_31 la_36 khva_39 nag_44 
T02D1407:90b-2	po'i thod par sngon du gsungs pa'i gnas su btab	po_0 thod_5 ba_10 sngon_14 du_20 gsungs_23 ba_30 gnas_35 su_40 'debs_43 
T02D1407:90b-3	la mnyam par gzhag ste /	la_0 mnyam_3 ba_9 'jog_13 ste_19 
T02D1407:90b-4	grub pa'i sa bon de blangs te /	'grub_0 ba_5 sa_10 bon_13 de_17 blangs_20 te_27 
T02D1407:90b-5	cho gas mgrin par btags na de'i skad cig la nye bar sbas par 'gyur ro //	cho_0 'gas_4 mgrin_8 ba_14 'dogs_18 na_24 de_27 skad_32 cig_37 la_41 nye_44 ba_48 sbed_52 ba_57 'gyur_61 ro_67 
T02D1407:90b-6	yang thog mar cho ga shes pas skye ba gnyis	yang_0 thogs_5 mar_10 cho_14 ga_18 shes_21 ba_26 skye_30 ba_35 gnyis_38 
T02D1407:90b-7	pa rigs kyi mchog tu gyur pa mtshon mdung gis	ba_0 rigs_3 kyi_8 mchog_12 tu_18 gyur_21 ba_26 mtshon_29 mdung_36 gis_42 
T02D1407:90b-8	brgyab ste shi ba de'i thod pa blangs par ro	rgyag_0 ste_7 'chi_11 ba_15 de_18 thod_23 ba_28 blangs_31 ba_38 ro_42 
T02D1407:90b-9	bsregs pa dang grog mkhar gyi sas bkang bar thun	bsregs_0 ba_7 dang_10 grog_15 mkhar_20 gyi_26 sas_30 'geng_34 ba_40 thun_44 
T02D1407:90b-10	mtshams kyi dus su btab la ro bsregs pa'i sa	mtshams_0 kyi_8 dus_12 su_16 'debs_19 la_24 ro_27 bsregs_30 ba_37 sa_42 
T02D1407:90b-11	dang lam mdo dang chu 'gram gnyis kyi sas g-yogs	dang_0 lam_5 mdo_9 dang_13 chu_18 'grams_22 gnyis_28 kyi_34 sas_38 g-yogs_42 
T02D1407:90b-12	la chus gtor zhing gtor ma byin la bsrung brtag	la_0 chus_3 'thor_8 zhing_13 'thor_19 ma_24 byin_27 la_32 bsrung_35 rtog_42 
T02D1407:90b-13	tu bya ste / de yang dpal he ru ka'i	tu_0 byed_3 ste_7 de_13 yang_16 dpal_21 he_26 ru_29 ka_32 
T02D1407:90b-14	gzugs phyag rgya dang rgyan rnams kyis brgyan pa phyag	gzugs_0 phyag_6 rgya_12 dang_17 rgyan_22 rnams_28 kyis_34 rgyan_39 ba_46 phyag_49 
T02D1407:90b-15	g-yon pa na kha tv'am ga 'dzin cing thod pa	g-yon_0 ba_6 na_9 kha_12 tv_16 ga_22 'dzin_25 cing_31 thod_36 ba_41 
T02D1407:90b-16	tu bya ste / bsnams pa'o // g-yas kun na	tu_0 byed_3 ste_7 snom_13 ba_20 g-yas_28 kun_34 na_38 
T02D1407:90b-17	cang te'u 'dzin pa brtul zhugs spyod pa'i gzugs su	cang_0 te_5 'dzin_10 ba_16 brtul_19 'jug_25 spyod_31 ba_37 gzugs_42 su_48 
T02D1407:90b-18	tu bya ste / bsnams pa'o // 'gyur ba'o //	tu_0 byed_3 ste_7 snom_13 ba_20 'gyur_28 ba_34 
T02D1407:90b-19	des bsrung ba'i cho gas sha za la sogs pa'i	des_0 bsrung_4 ba_11 cho_16 'gas_20 sha_24 za_28 la_31 sogs_34 ba_39 
T02D1407:90b-20	bgegs mi 'jug pas bskyed pa de mi khyer mi	bgegs_0 mi_6 'jug_9 ba_14 skyed_18 ba_25 de_28 mi_31 'khyer_34 mi_40 
T02D1407:90b-21	tu bya ste / bsnams pa'o // 'gyur ba'o //	tu_0 byed_3 ste_7 snom_13 ba_20 'gyur_28 ba_34 
T02D1407:90b-22	'don to // de nas sman bzang po rab tu	'don_0 to_5 de_11 nas_14 sman_18 bzang_23 po_29 rab_32 tu_36 
T02D1407:90b-23	bskyed pa de ni tshes dang skar ma dang gza'	skyed_0 ba_7 de_10 ni_13 tshes_16 dang_22 skar_27 ma_32 dang_35 gza'_40 
T02D1407:90b-24	bzang po la blang zhing gdab pa yang ngo //	bzang_0 po_6 la_9 blang_12 zhing_18 gdab_24 ba_29 yang_32 ngo_37 
T02D1407:90b-25	gang gi gzugs su 'dzin par byed par 'dod na sngags pa mnyam par gzhag ste /	gang_0 gi_5 gzugs_8 su_14 'dzin_17 ba_23 byed_27 ba_32 'dod_36 na_41 sngags_44 ba_51 mnyam_54 ba_60 'jog_64 ste_70 
T02D1407:90b-26	gang dang gang yin pa'i khrag dang mar du bsnos	gang_0 dang_5 gang_10 yin_15 ba_19 khrag_24 dang_30 mar_35 du_39 sno_42 
T02D1407:90b-27	pa'i 'bras bu de sha la sogs pas kyang bsgre'o	ba_0 'bras_5 bu_11 de_14 sha_17 la_21 sogs_24 ba_29 kyang_33 sgre_39 
T02D1407:90b-28	// de'i tshil la sogs pas 'phel bar bya ba	de_3 tshil_8 la_14 sogs_17 ba_22 'phel_26 ba_32 byed_36 ba_40 
T02D1407:90b-29	ni ji skad gsungs pa'i thod par de'i tshil dang	ni_0 ji_3 skad_6 gsungs_11 ba_18 thod_23 ba_28 de_32 tshil_37 dang_43 
T02D1407:90b-30	khrag dang shal sogs pa ji skad bshad pa rnams	khrag_0 dang_6 shal_11 sogs_16 ba_21 ji_24 skad_27 'chad_32 ba_38 rnams_41 
T02D1407:90b-31	kyis bran zhing bdug pa dang bsku ba la sogs	kyis_0 bran_5 zhing_10 bdug_16 ba_21 dang_24 skud_29 ba_34 la_37 sogs_40 
T02D1407:90b-32	pas 'bad de yang nas yang du bya'o //	ba_0 'bad_4 de_9 yang_12 nas_17 yang_21 du_26 byed_29 
T02D1407:90b-33	smin pa'i dus su blang ba ni gcer bu skra	smin_0 ba_5 dus_10 su_14 blang_17 ba_23 ni_26 bcer_29 bu_34 skra_37 
T02D1407:90b-34	grol bar gyur pas bu mo gzhon nu ma'i lag	grol_0 ba_5 gyur_9 ba_14 bu_18 mo_21 gzhon_24 nu_30 ma_33 lag_38 
T02D1407:90b-35	pa g-yon pa'i thod par sbyin par bya'i //	ba_0 g-yon_3 ba_9 thod_14 ba_19 sbyin_23 ba_29 byed_33 
T02D1407:90b-36	'bras bu cung zad tsam yang sa la gzhag par mi bya'o //	'bras_0 bu_6 cung_9 zad_14 tsam_18 yang_23 sa_28 la_31 'jog_34 ba_40 mi_44 byed_47 
T02D1407:90b-37	grub pa'i sa bon de 'bad pas blangs la cha gsum du bya ste /	'grub_0 ba_5 sa_10 bon_13 de_17 'bad_20 ba_25 blangs_29 la_36 cha_39 gsum_43 du_48 byed_51 ste_55 
T02D1407:90b-38	gcig ni bla ma rdo rje 'dzin pa la 'bul lo //	gcig_0 ni_5 bla_8 ma_12 rdo_15 rje_19 'dzin_23 ba_29 la_32 'bul_35 lo_40 
T02D1407:90b-39	gnyis pa ni de bzhin gshegs pa thams cad dang	gnyis_0 ba_6 ni_9 de_12 bzhin_15 gshegs_21 ba_28 thams_31 cad_37 dang_41 
T02D1407:90b-40	dpa' bo dang rnal 'byor ma rnams la 'bul lo	dpa'_0 'bo_5 dang_8 rnal_13 'byor_18 ma_24 rnams_27 la_33 'bul_36 lo_41 
T02D1407:90b-41	// lhag ma ni bdag nyid kyis blangs la ma	lhag_3 ma_8 ni_11 bdag_14 nyid_19 kyis_24 blangs_29 la_36 ma_39 
T02D1407:91a-0	mo'i dkyil 'khor gyi dbus su bdag nyid @91a *	mo_0 dkyil_5 'khor_11 gyi_17 dbus_21 su_26 bdag_29 nyid_34 
T02D1407:91a-1	// // khva gdong ma la sogs pa'i cha byad	khva_6 gdong_11 ma_17 la_20 sogs_23 ba_28 cha_33 byad_37 
T02D1407:91a-2	du sbyar te gnas la khar bcug na rnal 'byor	du_0 sbyor_3 te_9 gnas_12 la_17 khar_20 'jug_25 na_30 rnal_33 'byor_38 
T02D1407:91a-3	pa rnam pa sna tshogs pa de lta bu'i gzugs	ba_0 rnam_3 ba_8 sna_11 tshogs_15 ba_22 de_25 lta_28 bu_32 gzugs_37 
T02D1407:91a-4	su ji lta ba'i cho gas nges par byed par	su_0 ji_3 lta_6 ba_10 cho_15 'gas_19 nges_23 ba_28 byed_32 ba_37 
T02D1407:91a-5	// // 'gyur ro // mi des tho rang sa	'gyur_6 ro_12 mi_18 des_21 tho_25 rang_29 sa_34 
T02D1407:91a-6	khar bsgrubs na ni thams cad du mi snang bar	khar_0 sgrub_5 na_13 ni_16 thams_19 cad_25 du_29 mi_32 snang_35 ba_41 
T02D1407:91a-7	'gyur te 'ug pa la sogs pas bu ga 'ang	'gyur_0 te_6 'ug_9 ba_13 la_16 sogs_19 ba_24 bu_28 ga_31 'ang_34 
T02D1407:91a-8	mi mthong na sa bon gyi dam tshig gis grub	mi_0 mthong_3 na_10 sa_13 bon_16 gyi_20 dam_24 tshig_28 gis_34 'grub_38 
T02D1407:91a-9	pa de sa las skyes pa rnams kyis lta ci	ba_0 de_3 sa_6 las_9 skye_13 ba_19 rnams_22 kyis_28 lta_33 ci_37 
T02D1407:91a-10	// // 'gyur ro // smos / blo dang ldan pas yid mnyam par gzhag ste /	'gyur_6 ro_12 smos_18 blo_25 dang_29 ldan_34 ba_39 yid_43 mnyam_47 ba_53 'jog_57 ste_63 
T02D1407:91a-11	bud med mchog rnams dang lhan cig tu ji srid 'dod par rol bar bya'o //	'bud_0 med_4 mchog_8 rnams_14 dang_20 lhan_25 cig_30 tu_34 ji_37 srid_40 'dod_45 ba_50 rol_54 ba_58 byed_62 
T02D1407:91a-12	de kha nas phyung na ni ji ltar 'dod pa bzhin du snang bar 'gyur te /	de_0 kha_3 nas_7 'byin_11 na_18 ni_21 ji_24 ltar_27 'dod_32 ba_37 bzhin_40 du_46 snang_49 ba_55 'gyur_59 te_65 
T02D1407:91a-13	'dod na snang bar yang byed cing 'dod na mi	'dod_0 na_5 snang_8 ba_14 yang_18 byed_23 cing_28 'dod_33 na_38 mi_41 
T02D1407:91a-14	snang bar yang byed de mi snang ba'i dbang phyug	snang_0 ba_6 yang_10 byed_15 de_20 mi_23 snang_26 ba_32 dbang_37 phyug_43 
T02D1407:91a-15	tu bshad do // khang bzangs dang shing gi rtse	tu_0 'chad_3 do_9 khang_15 bzangs_21 dang_28 shing_33 gi_39 rtse_42 
T02D1407:91a-16	mo la sogs pa phye mar byed do zhes pa	mo_0 la_3 sogs_6 ba_11 'byed_14 mar_19 byed_23 do_28 zhes_31 ba_36 
T02D1407:91a-17	ni gsang sngags kyi rgyal po me ltar 'bar ba	ni_0 gsang_3 sngags_9 kyi_16 rgyal_20 po_26 me_29 ltar_32 'bar_37 ba_42 
T02D1407:91a-18	sta re lta bus gcod par 'gyur ro //	sta_0 re_4 lta_7 'bud_11 gcod_15 ba_20 'gyur_24 ro_30 
T02D1407:91a-19	dug bdud rtsir byed pa dang zhes pa ni lag	dug_0 bdud_4 rtsir_9 byed_15 ba_20 dang_23 zhes_28 ba_33 ni_36 lag_39 
T02D1407:91a-20	pa g-yon par 'khor lo 'di rnams bkod la zla	ba_0 g-yon_3 ba_9 'khor_13 lo_19 'di_22 rnams_26 bkod_32 la_37 zla_40 
T02D1407:91a-21	ba'i 'od zer ltar dri ma med pas rtsa ba	ba_0 'od_5 zer_9 ltar_13 'dri_18 ma_22 med_25 ba_29 rtsa_33 ba_38 
T02D1407:91a-22	dang zos pa dang ze'u 'bru nag po dang /	dang_0 zos_5 ba_9 dang_12 ze_17 'bru_22 nag_27 po_31 dang_34 
T02D1407:91a-23	de bzhin du sbyar ba rnams la lag mthil du	de_0 bzhin_3 du_9 sbyor_12 ba_18 rnams_21 la_27 lag_30 mthil_34 du_40 
T02D1407:91a-24	bkod pa de tsam gyis dug rnams bdud rtsir byed	bkod_0 ba_5 de_8 tsam_11 gyis_16 dug_21 rnams_25 bdud_31 rtsir_36 byed_42 
T02D1407:91a-25	do // sna tshogs pa'i dug gis brgyal ba rnams	do_0 sna_6 tshogs_10 ba_17 dug_22 gis_26 brgyal_30 ba_37 rnams_40 
T02D1407:91a-26	bslang bar bya ba na 'od zer 'bar ba zla	bslang_0 ba_7 byed_11 ba_15 na_18 'od_21 zer_25 'bar_29 ba_34 zla_37 
T02D1407:91a-27	ba'i 'od zer ltar dri ma med pa lta bus	ba_0 'od_5 zer_9 ltar_13 'dri_18 ma_22 med_25 ba_29 lta_32 'bud_36 
T02D1407:91a-28	bdud rtsi bcud kyis len du bshad do //	bdud_0 rtsi_5 bcud_10 kyis_15 len_20 du_24 'chad_27 do_33 
T02D1407:91a-29	bdud rtsi dang kha zas la sogs pa rnams dug	bdud_0 rtsi_5 dang_10 kha_15 zas_19 la_23 sogs_26 ba_31 rnams_34 dug_40 
T02D1407:91a-30	tu bya na ni sngags rnams nag por bltas pas	tu_0 byed_3 na_7 ni_10 sngags_13 rnams_20 nag_26 por_30 lta_34 ba_40 
T02D1407:91a-31	'bad mi dgos so //	'bad_0 mi_5 dgos_8 so_13 
T02D1407:91a-32	yang na ku ba kha bo'i sa bon blangs la sbrul nag po'i tshil bu dang bsres te /	yang_0 na_5 ku_8 ba_11 kha_14 'bo_18 sa_23 bon_26 blangs_30 la_37 sbrul_40 nag_46 po_50 tshil_55 bu_61 dang_64 bsres_69 te_75 
T02D1407:91a-33	zla ba mar ngo'i gza' khro bo'i thun mtshams kyi	zla_0 ba_4 mar_7 ngo_11 gza'_17 khro_22 'bo_27 thun_32 mtshams_37 kyi_45 
T02D1407:91a-34	dus su sbrul gyi mgo bor bcug ste sa la	dus_0 su_4 sbrul_7 gyi_13 mgo_17 'bor_21 'jug_25 ste_30 sa_34 la_37 
T02D1407:91a-35	sbas la lam gyi bzhi mdo'i sas gang bar g-yogs	sbed_0 la_5 lam_8 gyi_12 bzhi_16 mdo_21 sas_27 gang_31 ba_36 g-yogs_40 
T02D1407:91a-36	te gdab par bya'o //	te_0 gdab_3 ba_8 byed_12 
T02D1407:91a-37	de'i khu bas thig le byas nas bza' ba dang	de_0 khu_5 ba_9 thig_13 le_18 byed_21 nas_26 bza'_30 ba_35 dang_38 
T02D1407:91a-38	bca' ba dang btung ba la sogs pa la sngags	'chos_0 ba_5 dang_8 'thung_13 ba_19 la_22 sogs_25 ba_30 la_33 sngags_36 
T02D1407:91a-39	zlos shing bltas na dug dang 'dra ba'i khandar 'gyur	zlos_0 shing_5 lta_11 na_17 dug_20 dang_24 'dra_29 ba_34 khandar_39 'gyur_47 
T02D1407:91a-40	ro // phyis na ni rang gi ngo bor 'gyur ro //	ro_0 'byid_6 na_12 ni_15 rang_18 gi_23 ngo_26 'bor_30 'gyur_34 ro_40 
T02D1407:91a-41	zla ba chur byed dang zhes pa la zla ba zhes pa ni chang ngo //	zla_0 ba_4 'chur(d)_7 byed_12 dang_17 zhes_22 ba_27 la_30 zla_33 ba_37 zhes_40 ba_45 ni_48 chang_51 ngo_57 
T02D1407:91a-42	chu zla bar zhes pa ni zla ba'i 'od zer ltar gsal bar bsams pa tsam gyis so //	chu_0 zla_4 ba_8 zhes_12 ba_17 ni_20 zla_23 ba_27 'od_32 zer_36 ltar_40 gsal_45 ba_50 bsams_54 ba_60 tsam_63 gyis_68 so_73 
T02D1407:91b-0	yang na mchod yon gyi shing dkar po las @91b	yang_0 na_5 mchod_8 yon_14 gyi_18 shing_22 dkar_28 po_33 las_36 
T02D1407:91b-1	me sbar ba la padma'i rtsa ba'i sna la ma	me_0 sbor_3 ba_8 la_11 padma_14 rtsa_22 ba_27 sna_32 la_36 ma_39 
T02D1407:91b-2	phra mo bskams te phye mar byas la 'o ma	phra_0 mo_5 skem_8 te_15 'byed_18 mar_23 byed_27 la_32 'o_35 ma_38 
T02D1407:91b-3	dang bsres te / ci mang du sngags dang ldan	dang_0 bsres_5 te_11 ci_16 mang_19 du_24 sngags_27 dang_34 ldan_39 
T02D1407:91b-4	pas sbyin sreg brgya rtsa brgyad kyi bar du sbyin	ba_0 sbyin_4 sreg_10 brgya_15 rtsa_21 brgyad_26 kyi_33 ba_37 du_41 sbyin_44 
T02D1407:91b-5	dang bsres te / no // de'i thal ba yang dag par blangs te /	dang_0 bsres_5 te_11 no_16 de_22 thal_27 ba_32 yang_35 'dag_40 ba_44 blangs_48 te_55 
T02D1407:91b-6	shing tsi tra ka'i rtsa ba'i khu ba dang bsnos la /	shing_0 tsi_6 tra_10 ka_14 rtsa_19 ba_24 khu_29 ba_33 dang_36 sno_41 la_47 
T02D1407:91b-7	grib ma la bskam par bya zhing lan bdun gyi bar du bskams /	'grib_0 ma_5 la_8 skem_11 ba_17 byed_21 zhing_25 lan_31 bdun_35 gyi_40 ba_44 du_48 skem_51 
T02D1407:91b-8	re re zhing tsi tra ka'i khu bas brlan par	re_0 re_3 zhing_6 tsi_12 tra_16 ka_20 khu_25 ba_29 brlan_33 ba_39 
T02D1407:91b-9	bya ste bskams pa rnal 'byor pa rnams mchod pa'i	byed_0 ste_4 skem_8 ba_15 rnal_18 'byor_23 ba_29 rnams_32 mchod_38 ba_44 
T02D1407:91b-10	dus su sen bar gang tsam gyi thal ba chang	dus_0 su_4 sen_7 ba_11 gang_15 tsam_20 gyi_25 thal_29 ba_34 chang_37 
T02D1407:91b-11	gi snod du btab na chu de zla ba dang	gi_0 snod_3 du_8 'debs_11 na_16 chu_19 de_23 zla_26 ba_30 dang_33 
T02D1407:91b-12	me tog kun da ltar gsal bar 'gyur ro //	me_0 tog_3 kun_7 da_11 ltar_14 gsal_19 ba_24 'gyur_28 ro_34 
T02D1407:91b-13	rmongs pa'i sems can rnams 'phyan pa la lam 'di yis sbyang bar bya ste /	rmongs_0 ba_7 sems_12 can_17 rnams_21 'phyan_27 ba_34 la_37 lam_40 'di_44 yis_48 sbyong_52 ba_59 byed_63 ste_67 
T02D1407:91b-14	me tog dzi ba bskams pa'i phye ma ci mang	me_0 tog_3 dzi_7 ba_11 skem_14 ba_21 'byed_26 ma_31 ci_34 mang_37 
T02D1407:91b-15	dang shing 'dzam bu'i 'bras bu'i khu ba bsres la	dang_0 shing_5 'dzam_11 bu_17 'bras_22 bu_28 khu_33 ba_37 bsres_40 la_46 
T02D1407:91b-16	ba'i chus brlan par byas pa padma'i snod du blugs	ba_0 chus_5 brlan_10 ba_16 byed_20 ba_25 padma_28 snod_36 du_41 blugs_44 
T02D1407:91b-17	na chu zla ba lta bur byed par 'gyur ro	na_0 chu_3 zla_7 ba_11 lta_14 bur_18 byed_22 ba_27 'gyur_31 ro_37 
T02D1407:91b-18	// dri thams cad 'phrog par byed do zhes bya	'dri_3 thams_7 cad_13 'phrog_17 ba_24 byed_28 do_33 zhes_36 byed_41 
T02D1407:91b-19	ba ni de nyid shing ka ta ka ranydza'i 'bras	ba_0 ni_3 de_6 nyid_9 shing_14 ka_20 ta_23 ka_26 ranydza_29 'bras_39 
T02D1407:91b-20	bu'i phye ma dang shing na ga ra'i shun phrags	bu_0 'byed_5 ma_10 dang_13 shing_18 na_24 ga_27 ra_30 shun_35 phrags_40 
T02D1407:91b-21	su ldan pas ltag pa la sogs pa la bdugs	su_0 ldan_3 ba_8 ltag_12 ba_17 la_20 sogs_23 ba_28 la_31 bdug_34 
T02D1407:91b-22	na dri 'phrog par byed do //	na_0 'dri_3 'phrog_7 ba_14 byed_18 do_23 
T02D1407:91b-23	de lta bus ni me tog dang shing gi 'bras	de_0 lta_3 'bud_7 ni_11 me_14 tog_17 dang_21 shing_26 gi_32 'bras_35 
T02D1407:91b-24	bu la sogs pa rnams la yang dri thams cad	bu_0 la_3 sogs_6 ba_11 rnams_14 la_20 yang_23 'dri_28 thams_32 cad_38 
T02D1407:91b-25	'phrog par byed do //	'phrog_0 ba_7 byed_11 do_16 
T02D1407:91b-26	'dis ni me tog dang spos la sogs pa la	'dis_0 ni_5 me_8 tog_11 dang_15 spros_20 la_25 sogs_28 ba_33 la_36 
T02D1407:91b-27	yang bdug pa des bdugs na ji ltar 'dod pa	yang_0 bdug_5 ba_10 des_13 bdug_17 na_23 ji_26 ltar_29 'dod_34 ba_39 
T02D1407:91b-28	de bzhin du phan tshun du dri rnams yang dag	de_0 bzhin_3 du_9 phan_12 tshun_17 du_23 'dri_26 rnams_30 yang_36 'dag_41 
T02D1407:91b-29	par 'pho'o // nam mkha' lding gi gdong du 'gro	ba_0 'pho_4 nam_14 mkha'_18 lding_24 gi_30 gdong_33 du_39 'gro_42 
T02D1407:91b-30	bas 'du bar byed pa dang zhes pa la sogs	ba_0 'du_4 ba_8 byed_12 ba_17 dang_20 zhes_25 ba_30 la_33 sogs_36 
T02D1407:91b-31	pa'i don ni 'di yin te /	ba_0 don_5 ni_9 'di_12 yin_16 te_20 
T02D1407:91b-32	de lta bu'i 'khor lo de nyid klu rnams spangs	de_0 lta_3 bu_7 'khor_12 lo_18 de_21 nyid_24 klu_29 rnams_33 spong_39 
T02D1407:91b-33	pa la zla bas nye bar brgyan pa der bud	ba_0 la_3 zla_6 ba_10 nye_14 ba_18 rgyan_22 ba_29 der_32 'bud_36 
T02D1407:91b-34	med dang skyes bu bzang po rnams kyi ming bar	med_0 dang_4 skye_9 bu_15 bzang_18 po_24 rnams_27 kyi_33 ming_37 ba_42 
T02D1407:91b-35	du bcug pa skar ma rgyal la gi wang gis	du_0 'jug_3 ba_8 skar_11 ma_16 rgyal_19 la_25 gi_28 wang_31 gis_36 
T02D1407:91b-36	yang dag par bris pa la mchod pa chen po	yang_0 'dag_5 ba_9 'bri_13 ba_18 la_21 mchod_24 ba_30 chen_33 po_38 
T02D1407:91b-37	byas la rang nyid dpal he ru ka'i bdag nyid	byed_0 la_5 rang_8 nyid_13 dpal_18 he_23 ru_26 ka_29 bdag_34 nyid_39 
T02D1407:91b-38	du sbyar te / de rang gi rig ma phag	du_0 sbyor_3 te_9 de_14 rang_17 gi_22 rig_25 ma_29 phag_32 
T02D1407:91b-39	mor yongs su brtags pa dang gnyis su med pa'i	mor_0 yongs_4 su_10 rtog_13 ba_20 dang_23 gnyis_28 su_34 med_37 ba_41 
T02D1407:91b-40	sbyor bas mnyam par gzhag la mtshan mo thams cad	sbyor_0 ba_6 mnyam_10 ba_16 'jog_20 la_26 mtshan_29 mo_36 thams_39 cad_45 
T02D1407:91b-41	du sngags kyi bzlas pa byas te bcangs na de	du_0 sngags_3 kyi_10 bzlas_14 ba_20 byed_23 te_28 'chang_31 na_38 de_41 
T02D1407:91b-42	la rig pa'i rgyal po rang nyid kyi bud med	la_0 rig_3 ba_7 rgyal_12 po_18 rang_21 nyid_26 kyi_31 'bud_35 med_39 
T02D1407:91b-43	rnams kyi tshogs lta bur skyes pa 'du bar byed	rnams_0 kyi_6 tshogs_10 lta_17 bur_21 skye_25 ba_31 'du_34 ba_38 byed_42 
