T02D1263:11a-46	srid pa dam pa byed par 'gyur //	srid_0 ba_5 dam_8 ba_12 byed_15 ba_20 'gyur_24 
T02D1263:11a-47	aom badzra stva tvam sa ma ya aa bhi shi	aom_0 badzra_4 stva_11 tvam_16 sa_21 ma_24 ya_27 aa_30 bhi_33 'chi_37 
T02D1263:11a-48	nyts'a mi zhes brjod la lag pa g-yon par sbyin	nyts_0 mi_7 zhes_10 rjod_15 la_21 lag_24 ba_28 g-yon_31 ba_37 sbyin_41 
T02D1263:11a-49	no // dril bu'i dbang bskur ba'o //	no_0 'dril_6 bu_11 dbang_16 skur_22 ba_28 
T02D1263:11a-50	de ltar dril bu byin la phyag rgya chen po dang ldan par bsams la /	de_0 ltar_3 'dril_8 bu_13 byin_16 la_21 phyag_24 rgya_30 chen_35 po_40 dang_43 ldan_48 ba_53 bsams_57 la_63 
T02D1263:11b-0	de la sngags kyis dbang @11b bskur ba'i ming gdags par bya ste /	de_0 la_3 sngags_6 kyis_13 dbang_18 skur_29 ba_35 ming_40 'dogs_45 ba_51 byed_55 ste_59 
T02D1263:11b-1	aom shr'i he ru ka aa dhi pa ti stvam /	aom_0 shr_4 he_10 ru_13 ka_16 aa_19 dhi_22 ba_26 ti_29 stvam_32 
T02D1263:11b-2	aa bhi shi nyts'a mi /	aa_0 bhi_3 'chi_7 nyts_11 mi_18 
T02D1263:11b-3	shr'i he ru ka n'a ma aa bhi she ka	shr_0 he_6 ru_9 ka_12 n_15 ma_19 aa_22 bhi_25 she_29 ka_33 
T02D1263:11b-4	ta zhes brjod la shr'i sgra dang bcas par padma'i	ta_0 zhes_3 rjod_8 la_14 shr_17 sgra_23 dang_28 'cha'_33 ba_38 padma_42 
T02D1263:11b-5	mthar thug pa'i ming gi dbang bskur ro //	mthar_0 thug_6 ba_11 ming_16 gi_21 dbang_24 skur_30 ro_36 
T02D1263:11b-6	'di ni sangs rgyas thams cad nyid //	'di_0 ni_4 sangs_7 rgya_13 thams_19 cad_25 nyid_29 
T02D1263:11b-7	he ru ka dpal phyag na bsnams //	he_0 ru_3 ka_6 dpal_9 phyag_14 na_20 snom_23 
T02D1263:11b-8	khyed kyis rtag tu bcang bar bgyi //	'khyed_0 kyis_6 rtag_11 tu_16 'chang_19 ba_25 bgyid_29 
T02D1263:11b-9	he ru ka dpal brtul zhugs brtan //	he_0 ru_3 ka_6 dpal_9 brtul_14 'jug_20 brtan_26 
T02D1263:11b-10	rdo rje rtse mo 'dzin du bcug la sngags 'di brjod do //	rdo_0 rje_4 rtse_8 mo_13 'dzin_16 du_22 'jug_25 la_30 sngags_33 'di_40 rjod_44 do_50 
T02D1263:11b-11	aom sarba ta th'a ga ta siddhi badzra sa ma	aom_0 sarba_4 ta_10 th_13 ga_18 ta_21 siddhi_24 badzra_31 sa_38 ma_41 
T02D1263:11b-12	ya ti shtha ae sha tvam dh'a ra ya mi	ya_0 ti_3 shtha_6 ae_12 sha_15 tvam_19 dh_24 ra_29 ya_32 mi_35 
T02D1263:11b-13	h'um / ha ha ha ha ho zhes brjod la	h_0 ha_7 ha_10 ha_13 ha_16 ho_19 zhes_22 rjod_27 la_33 
T02D1263:11b-14	lag pa g-yas pas rdo rje brtul zhugs kyi dbang	lag_0 ba_4 g-yas_7 ba_13 rdo_17 rje_21 brtul_25 'jug_31 kyi_37 dbang_41 
T02D1263:11b-15	h'um / sbyin par bya'o // aa las bhandhar gyur par bsgom /	h_0 sbyin_7 ba_13 byed_17 aa_26 las_29 bhandhar_33 gyur_42 ba_47 bsgom_51 
T02D1263:11b-16	aom las gri gug tu gyur par bsgoms la 'di skad brjod do //	aom_0 las_4 gri_8 gug_12 tu_16 gyur_19 ba_24 sgom_28 la_35 'di_38 skad_42 rjod_47 do_53 
T02D1263:11b-17	he ru ka dpal kha tv'am ga / rnal 'byor pa yi da ma ru //	he_0 ru_3 ka_6 dpal_9 kha_14 tv_18 ga_24 rnal_29 'byor_34 ba_40 yi_43 da_46 ma_49 ru_52 
T02D1263:11b-18	rdo rje kha tv'am rdo rje bcas //	rdo_0 rje_4 kha_8 tv_12 rdo_18 rje_22 'cha'_26 
T02D1263:11b-19	dril bu sil sil sgra sgrogs pa //	'dril_0 bu_5 sil_8 sil_12 sgra_16 sgrogs_21 ba_28 
T02D1263:11b-20	tshangs pa'i skud thogs rnal 'byor bdag / gri gug dang ni ka p'a la //	tshangs_0 ba_8 skud_13 thogs_18 rnal_24 'byor_29 bdag_35 gri_42 gug_46 dang_50 ni_55 ka_58 p_61 la_65 
T02D1263:11b-21	dpa' bo chen pos blang bar gyis //	dpa'_0 'bo_5 chen_8 pos_13 blang_17 ba_23 gyis_27 
T02D1263:11b-22	gri gug dang thod pas dbang bskur ro //	gri_0 gug_4 dang_8 thod_13 ba_18 dbang_22 skur_28 ro_34 
T02D1263:11b-23	de rnams dang ldan pa'i slob ma ni /	de_0 rnams_3 dang_9 ldan_14 ba_19 slob_24 ma_29 ni_32 
T02D1263:11b-24	zhi ba dang /	zhi_0 ba_4 dang_7 
T02D1263:11b-25	rgyas pa dang /	rgya_0 ba_6 dang_9 
T02D1263:11b-26	dbang dang /	dbang_0 dang_6 
T02D1263:11b-27	drag po dang /	drag_0 po_5 dang_8 
T02D1263:11b-28	rengs pa dang /	rengs_0 ba_6 dang_9 
T02D1263:11b-29	bskrad pa dang /	skrod_0 ba_7 dang_10 
T02D1263:11b-30	rmongs par byas pa dang /	rmongs_0 ba_7 byed_11 ba_16 dang_19 
T02D1263:11b-31	gsod pa la sogs pa dang /	gsod_0 ba_5 la_8 sogs_11 ba_16 dang_19 
T02D1263:11b-32	de rnams la thogs pa med par grub par byos shig / mchil lham bgo ba dang /	de_0 rnams_3 la_9 thogs_12 ba_18 med_21 ba_25 'grub_29 ba_34 byos_38 shig_43 mchil_50 lham_56 bgod_61 ba_65 dang_68 
T02D1263:11b-33	char dbab pa dang /	char_0 'bebs_5 ba_10 dang_13 
T02D1263:11b-34	nyi zla gzung ba la sogs pa mkha' 'gro ma'i	nyi_0 zla_4 gzung_8 ba_14 la_17 sogs_20 ba_25 mkha'_28 'gro_34 ma_39 
T02D1263:11b-35	dngos grub thams cad ci dga' bar 'grub par gyis	dngos_0 'grub_6 thams_11 cad_17 ci_21 dga'_24 ba_29 'grub_33 ba_39 gyis_43 
T02D1263:11b-36	shig / de ni rjes su gnang ba sbyin pa'o	shig_0 de_7 ni_10 rjes_13 su_18 gnang_21 ba_27 sbyin_30 ba_36 
T02D1263:11b-37	// me tog la sogs pa nas gri gug dang	me_3 tog_6 la_10 sogs_13 ba_18 nas_21 gri_25 gug_29 dang_33 
T02D1263:11b-38	thod pa'i dbang bskur ba yan chad kyis ni lus	thod_0 ba_5 dbang_10 skur_16 ba_22 yan_25 'chad_29 kyis_34 ni_39 lus_42 
T02D1263:11b-39	dag par byed pa yin pas na sku'i dbang zhes	'dag_0 ba_4 byed_8 ba_13 yin_16 ba_20 na_24 sku_27 dbang_33 zhes_39 
T02D1263:11b-40	// bya'o // 'bras bu ni gang dang gang skal ba mnyam pa yin zhe na /	byed_3 'bras_12 bu_18 ni_21 gang_24 dang_29 gang_34 skal_39 ba_44 mnyam_47 ba_53 yin_56 zhe_60 na_64 
T02D1263:11b-41	sa brgyad pa'i byang chub sems dpa' dang skal ba mnyam pa yin no /	sa_0 brgyad_3 ba_10 byang_15 chub_21 sems_26 dpa'_31 dang_36 skal_41 ba_46 mnyam_49 ba_55 yin_58 no_62 
T02D1263:11b-43	// / de nas me tog la sogs pa'i dbang thob pas /	de_5 nas_8 me_12 tog_15 la_19 sogs_22 ba_27 dbang_32 'thob_38 ba_43 
T02D1263:11b-44	bla mas gsang ba'i dbang bskur ba bsgrubs pa'i gnas	bla_0 mas_4 gsang_8 ba_14 dbang_19 skur_25 ba_31 sgrub_34 ba_42 gnas_47 
T02D1263:11b-45	de nyid du mi med cing dben par byas te	de_0 nyid_3 du_8 mi_11 med_14 cing_18 dben_23 ba_28 byed_32 te_37 
T02D1263:11b-46	/ yol bas bar du bcang la /	yol_2 ba_6 ba_10 du_14 'chang_17 la_23 
T02D1263:11b-47	mandala gru bzhi pa byas la /	mandala_0 gru_8 bzhi_12 ba_17 byed_20 la_25 
T02D1263:11b-48	dri zhim po dang bdud rtsis chag chag btab pa der /	'dri_0 zhim_4 po_9 dang_12 bdud_17 rtsis_22 'chag_28 'chag_33 'debs_38 ba_43 der_46 
T02D1263:11b-49	me tog sil ma bkram /	me_0 tog_3 sil_7 ma_11 'grem_14 
T02D1263:12a-0	stan sna tshogs pa @12a * //	stan_0 sna_5 tshogs_9 ba_16 
T02D1263:12a-1	bzang po bting la /	bzang_0 po_6 bting_9 la_15 
T02D1263:12a-2	slob mas shes rab ma mtshan dang ldan pa bla ma la phul la /	slob_0 mas_5 shes_9 rab_14 ma_18 mtshan_21 dang_28 ldan_33 ba_38 bla_41 ma_45 la_48 'bul_51 la_56 
T02D1263:12a-3	'di skad gsol ba gdab par bya ste /	'di_0 skad_4 gsol_9 ba_14 gdab_17 ba_22 byed_26 ste_30 
T02D1263:12a-4	khyod ni he ru ka dpal te //	khyod_0 ni_6 he_9 ru_12 ka_15 dpal_18 te_23 
T02D1263:12a-5	bde gshegs rnams kyis bde sogs mdzad //	bde_0 gshegs_4 rnams_11 kyis_17 bde_22 sogs_26 mdzad_31 
T02D1263:12a-6	byang chub sems dpa' che rnams kyi //	byang_0 chub_6 sems_11 dpa'_16 che_21 rnams_25 kyi_31 
T02D1263:12a-7	yang dag don mchog rnam par dag / ji ltar de nyid bdud rtsi yis //	yang_0 'dag_5 don_9 mchog_13 rnam_19 ba_24 'dag_28 ji_34 ltar_37 de_42 nyid_45 bdud_50 rtsi_55 yis_60 
T02D1263:12a-8	mchog gi dbang ni bskur ba bzhin //	mchog_0 gi_6 dbang_9 ni_15 skur_18 ba_24 bzhin_27 
T02D1263:12a-9	de bzhin bdag la 'khor ba yi //	de_0 bzhin_3 bdag_9 la_14 'khor_17 ba_23 yi_26 
T02D1263:12a-10	sdug bsngal rnams ni bsal bar mdzod //	sdug_0 sngal_5 rnams_12 ni_18 bsal_21 ba_26 mdzod_30 
T02D1263:12a-11	rnal 'byor bdud rtsi dri med mchog / rab rib nyes pa'i dri ma 'joms //	rnal_0 'byor_5 bdud_11 rtsi_16 'dri_21 med_25 mchog_29 rab_37 rib_41 nyes_45 ba_50 'dri_55 ma_59 'joms_62 
T02D1263:12a-12	gang ni byang chub bla med pa //	gang_0 ni_5 byang_8 chub_14 bla_19 med_23 ba_27 
T02D1263:12a-13	de ring bdag gis thob par mdzod //	de_0 ring_3 bdag_8 gis_13 'thob_17 ba_22 mdzod_26 
T02D1263:12a-14	ces brjod la gsol ba gdab par bya'o //	ces_0 rjod_4 la_10 gsol_13 ba_18 gdab_21 ba_26 byed_30 
T02D1263:12a-15	de nas bla mas shes rab ma bdag med mar bskyed la /	de_0 nas_3 bla_7 mas_11 shes_15 rab_20 ma_24 bdag_27 med_32 mar_36 skyed_40 la_47 
T02D1263:12a-16	de la go cha dang bya ba dang /	de_0 la_3 go_6 cha_9 dang_13 byed_18 ba_22 dang_25 
T02D1263:12a-17	gnas gsum du yang lha gsum bskyed la /	gnas_0 gsum_5 du_10 yang_13 lha_18 gsum_22 skyed_27 la_34 
T02D1263:12a-18	ye shes sems dpa' bkug pa dang /	ye_0 shes_3 sems_8 dpa'_13 'gugs_18 ba_23 dang_26 
T02D1263:12a-19	gzhug pa dang /	'jug_0 ba_6 dang_9 
T02D1263:12a-20	bcing ba dang /	'ching_0 ba_6 dang_9 
T02D1263:12a-21	rjes su dgyes pa byas te bstims la /	rjes_0 su_5 dgyes_8 ba_14 byed_17 te_22 stim_25 la_32 
T02D1263:12a-22	mi bskyod pas dbu brgyan te /	mi_0 skyod_3 ba_10 dbu_14 rgyan_18 te_25 
T02D1263:12a-23	'di skad brjod do //	'di_0 skad_4 rjod_9 do_15 
T02D1263:12a-24	mkha' gsang byin gyis brlabs te /	mkha'_0 gsang_6 byin_12 gyis_17 brlabs_22 te_29 
T02D1263:12a-25	aom padma su kha dh'a ra ma h'a r'a ga	aom_0 padma_4 su_10 kha_13 dh_17 ra_22 ma_25 h_28 r_32 ga_36 
T02D1263:12a-26	su kham da da tsa tur a'a na n+dya bha	su_0 kham_3 da_8 da_11 tsa_14 tur_18 a_22 na_26 n_29 dya_31 bha_35 
T02D1263:12a-27	ga bi shva h'um h'um h'um ka ryam ku ru	ga_0 bi_3 shva_6 h_11 h_16 h_21 ka_26 ryam_29 ku_34 ru_37 
T02D1263:12a-28	shva me / aom badzra ma h'a da sha tsa	shva_0 me_5 aom_10 badzra_14 ma_21 h_24 da_28 sha_31 tsa_35 
T02D1263:12a-29	tu ra a'a nanda da ma ka kha ga mu	tu_0 ra_3 a_6 nanda_10 da_16 ma_19 ka_22 kha_25 ga_29 mu_32 
T02D1263:12a-30	khe ka r'a sho n'a tha h'um h'um h'um karyam	khe_0 ka_4 r_7 sho_11 n_15 tha_19 h_23 h_28 h_33 karyam_38 
T02D1263:12a-31	ku ru shva me /	ku_0 ru_3 shva_6 me_11 
T02D1263:12a-32	zhes brjod pas /	zhes_0 rjod_5 ba_11 
T02D1263:12a-33	nyes pa med de rnam par dag par bsam mo //	nyes_0 ba_5 med_8 de_12 rnam_15 ba_20 'dag_24 ba_28 bsam_32 mo_37 
T02D1263:12a-34	de nas snyoms par 'jug par bya ste /	de_0 nas_3 snyom_7 ba_14 'jug_18 ba_23 byed_27 ste_31 
T02D1263:12a-35	mi bskyod pa mdzad cing rang gi ye shes sems	mi_0 skyod_3 ba_10 mdzad_13 cing_19 rang_24 gi_29 ye_32 shes_35 sems_40 
T02D1263:12a-36	dpa'i thugs ka'i mtshan ma'i lte ba'i h'um las 'od	dpa_0 thugs_6 ka_12 mtshan_17 ma_24 lte_29 ba_33 h_38 las_43 'od_47 
T02D1263:12a-37	'phros pas phyogs bcur bzhugs pa rnams spyan drangs nas	'phro_0 ba_7 phyogs_11 'jur_18 bzhugs_23 ba_30 rnams_33 spyan_39 drangs_45 nas_52 
T02D1263:12a-38	/ thugs kar thim pa la sogs pa rnams byas nas /	thugs_2 kar_8 'thim_12 ba_17 la_20 sogs_23 ba_28 rnams_31 byed_37 nas_42 
T02D1263:12a-39	byang chub kyi sems 'bar ba bo la'i sker phyin pa dang /	byang_0 chub_6 kyi_11 sems_15 'bar_20 ba_25 'bo_28 la_31 sker_36 phyin_41 ba_47 dang_50 
T02D1263:12a-40	aom sarba ta th'a ga t'a nu r'a ga na badzra sva bh'a ba a'atma ko&amp; ham /	aom_0 sarba_4 ta_10 th_13 ga_18 t_21 nu_25 r_28 ga_32 na_35 badzra_38 sva_45 bh_49 ba_54 a_57 ko&amp;_64 ham_72 
T02D1263:12a-41	zhes brjod la /	zhes_0 rjod_5 la_11 
T02D1263:12a-42	chags pa'i rdo rje'i rang bzhin yin no bar nga rgyal bya'o //	chags_0 ba_6 rdo_11 rje_15 rang_21 bzhin_26 yin_32 no_36 ba_39 nga_43 rgyal_47 byed_53 
T02D1263:12a-43	de nas byang chub kyi sems bo la'i skyer mtheb srin gyis mnan la /	de_0 nas_3 byang_7 chub_13 kyi_18 sems_22 'bo_27 la_30 skyer_35 mtheb_41 srin_47 gyis_52 gnon_57 la_62 
T02D1263:12a-44	slob ma'i bu gar 'dren par bya'o //	slob_0 ma_5 bu_10 gar_13 bgrang_17 ba_23 byed_27 
T02D1263:12a-45	de nas slob dpon gyis au pa su mandra blta bar byos /	de_0 nas_3 slob_7 dpon_12 gyis_17 au_22 ba_25 su_28 mandra_31 lta_38 ba_43 byos_47 
T02D1263:12a-46	aa ho su kha zhes brjod /	aa_0 ho_3 su_6 kha_9 zhes_13 rjod_18 
T02D1263:12a-47	slob mas bde ba can chen po'i dpal he ru ka bdag nyid do zhes brjod /	slob_0 mas_5 bde_9 ba_13 can_16 chen_20 po_25 dpal_30 he_35 ru_38 ka_41 bdag_44 nyid_49 do_54 zhes_57 rjod_62 
T02D1263:12a-48	bskur te 'thung ba'i rting la brjod /	skur_0 te_6 'thung_9 ba_16 rting_21 la_27 rjod_30 
T02D1263:12b-0	de'i rdo rje'i @12b dpal gyis reg pa des ni ngag gi nyes pa dang /	de_0 rdo_5 rje_9 dpal_20 gyis_25 reg_30 ba_34 des_37 ni_41 ngag_44 gi_49 nyes_52 ba_57 dang_60 
T02D1263:12b-1	rnam par rtog pa thams cad sel bar byed pas na /	rnam_0 ba_5 rtogs_9 ba_14 thams_17 cad_23 sel_27 ba_31 byed_35 ba_40 na_44 
T02D1263:12b-2	gsung gi dbang zhes bya'o //	gsung_0 gi_6 dbang_9 zhes_15 byed_20 
T02D1263:12b-3	de nas 'bras bu gang dang gang skal ba mnyam par 'gyur zhe na /	de_0 nas_3 'bras_7 bu_13 gang_16 dang_21 gang_26 skal_31 ba_36 mnyam_39 ba_45 'gyur_49 zhe_55 na_59 
T02D1263:12b-4	sa bcu pa'i byang chub sems dpa' dang skal ba mnyam par 'gyur ro //	sa_0 'chu_3 ba_7 byang_12 chub_18 sems_23 dpa'_28 dang_33 skal_38 ba_43 mnyam_46 ba_52 'gyur_56 ro_62 
T02D1263:12b-5	sa bcu pa'i byang chub sems dpa' dang skal ba mnyam par de la lung bstan par bya ste /	sa_0 'chu_3 ba_7 byang_12 chub_18 sems_23 dpa'_28 dang_33 skal_38 ba_43 mnyam_46 ba_52 de_56 la_59 lung_62 ston_67 ba_73 byed_77 ste_81 
T02D1263:12b-6	bla mas chos gos gyon la lag pa g-yon pas	bla_0 mas_4 chos_8 gos_13 gyon_17 la_22 lag_25 ba_29 g-yon_32 ba_38 
T02D1263:12b-7	chos gos kyi tha ma chang par bcug la 'di	chos_0 gos_5 kyi_9 tha_13 ma_17 chang_20 ba_26 'jug_30 la_35 'di_38 
T02D1263:12b-8	skad brjod do // 'di ltar ngas yongs su bstan te /	skad_0 rjod_5 do_11 'di_17 ltar_21 ngas_26 yongs_31 su_37 ston_40 te_46 
T02D1263:12b-9	he ru ka dpal de bzhin gshegs //	he_0 ru_3 ka_6 dpal_9 de_14 bzhin_17 gshegs_23 
T02D1263:12b-10	dngos po mchog tu grub pa'i phyir //	dngos_0 po_6 mchog_9 tu_15 'grub_18 ba_23 phyir_28 
T02D1263:12b-11	srid pa'i ngan 'gro rnams las bton //	srid_0 ba_5 ngan_10 'gro_15 rnams_20 las_26 'don_30 
T02D1263:12b-12	shr'i he ru ka na ma: sarba ta th'a ga ta hi /	shr_0 he_6 ru_9 ka_12 na_15 ma:_18 sarba_22 ta_28 th_31 ga_36 ta_39 hi_42 
T02D1263:12b-13	siddha sa ma ya stvam bhur bhu ba sva: zhes brjod do //	siddha_0 sa_7 ma_10 ya_13 stvam_16 bhur_22 bhu_27 ba_31 sva:_34 zhes_39 rjod_44 do_50 
T02D1263:12b-14	don yod grub pa'i phyag rgyar gnas pa dang //	don_0 yod_4 'grub_8 ba_13 phyag_18 rgyar_24 gnas_30 ba_35 dang_38 
T02D1263:12b-15	dus gsum gyi rgyal ba rnams kyis mgrin gcig tu lung ston par mdzad do //	dus_0 gsum_4 gyi_9 rgyal_13 ba_19 rnams_22 kyis_28 mgrin_33 gcig_39 tu_44 lung_47 ston_52 ba_57 mdzad_61 do_67 
T02D1263:12b-16	lung bstan pa'o //	lung_0 ston_5 ba_11 
T02D1263:12b-17	khams gsum gyi bdag por gyur pa dang /	khams_0 gsum_6 gyi_11 bdag_15 por_20 gyur_24 ba_29 dang_32 
T02D1263:12b-18	rgyal ba rnams kyi bdag por gyur pa dang /	rgyal_0 ba_6 rnams_9 kyi_15 bdag_19 por_24 gyur_28 ba_33 dang_36 
T02D1263:12b-19	phyin ci log gi bdud dang mu stegs la sogs pa las rgyal ba dang /	phyin_0 ci_6 log_9 gi_13 bdud_16 dang_21 mu_26 stegs_29 la_35 sogs_38 ba_43 las_46 rgyal_50 ba_56 dang_59 
T02D1263:12b-20	mya ngan las 'das pa'i grong khyer dam par 'jug pa ste /	mya_0 ngan_4 las_9 'da'_13 ba_18 grong_23 'khyer_29 dam_35 ba_39 'jug_43 ba_48 ste_51 
T02D1263:12b-21	'di nyid kyis sangs rgyas thob par 'gyur gyis /	'di_0 nyid_4 kyis_9 sangs_14 rgya_20 'thob_26 ba_31 'gyur_35 gyis_41 
T02D1263:12b-22	the tshom dang yid gnyis la sogs pa ma byed	the_0 tshom_4 dang_10 yid_15 gnyis_19 la_25 sogs_28 ba_33 ma_36 byed_39 
T02D1263:12b-23	cig / gzhan yang bla ma dam pas dbang bskur	cig_0 gzhan_6 yang_12 bla_17 ma_21 dam_24 ba_28 dbang_32 skur_38 
T02D1263:12b-24	ba tsam gyis ji ltar bsams pa ltar slob ma	ba_0 tsam_3 gyis_8 ji_13 ltar_16 bsams_21 ba_27 ltar_30 slob_35 ma_40 
T02D1263:12b-25	rnams kyis 'grub par 'gyur ro //	rnams_0 kyis_6 'grub_11 ba_17 'gyur_21 ro_27 
T02D1263:12b-26	de'i dbugs dbyung ba'o /	de_0 dbugs_5 'byin_11 ba_18 
T02D1263:12b-28	// / de nas shes rab dang ye shes kyi dbang bskur ba brtsam par bya ste /	de_5 nas_8 shes_12 rab_17 dang_21 ye_26 shes_29 kyi_34 dbang_38 skur_44 ba_50 brtsam_53 ba_60 byed_64 ste_68 
T02D1263:12b-29	de la yang gnyis te /	de_0 la_3 yang_6 gnyis_11 te_17 
T02D1263:12b-30	shes rab kyi dbang dang /	shes_0 rab_5 kyi_9 dbang_13 dang_19 
T02D1263:12b-31	shes rab ye shes kyi dbang ngo //	shes_0 rab_5 ye_9 shes_12 kyi_17 dbang_21 ngo_27 
T02D1263:12b-32	de la shes rab kyi dbang ni gzhon nu ma	de_0 la_3 shes_6 rab_11 kyi_15 dbang_19 ni_25 gzhon_28 nu_34 ma_37 
T02D1263:12b-33	lo grangs gong ma dang mthun pa bla ma la	lo_0 grangs_3 gong_10 ma_15 dang_18 mthun_23 ba_29 bla_32 ma_36 la_39 
T02D1263:12b-34	phul la / mandala chag chag la sogs pa gong ma dang mthun par bya'o //	'bul_0 la_5 mandala_10 'chag_18 'chag_23 la_28 sogs_31 ba_36 gong_39 ma_44 dang_47 mthun_52 ba_58 byed_62 
T02D1263:12b-35	de nas bla mas shes rab ma byin gyis brlab pa sngon dang mthun par byas la /	de_0 nas_3 bla_7 mas_11 shes_15 rab_20 ma_24 byin_27 gyis_32 brlab_37 ba_43 sngon_46 dang_52 mthun_57 ba_63 byed_67 la_72 
T02D1263:12b-36	bla mas shes rab ma dang slob ma la bsgo ba bya ste /	bla_0 mas_4 shes_8 rab_13 ma_17 dang_20 slob_25 ma_30 la_33 sgo_36 ba_41 byed_44 ste_48 
T02D1263:12b-37	khyod kyis 'dod chags kyang spang du mi rung ste /	khyod_0 kyis_6 'dod_11 chags_16 kyang_22 spong_28 du_34 mi_37 rung_40 ste_45 
T02D1263:12b-38	dus gsum gyi bde bar gshegs pa rnams kyis kyang /	dus_0 gsum_4 gyi_9 bde_13 ba_17 gshegs_21 ba_28 rnams_31 kyis_37 kyang_42 
T02D1263:13a-0	thabs dang shes rab gnyis su med pa'i rol pa mdzad pa las ye shes @13a * //	thabs_0 dang_6 shes_11 rab_16 gnyis_20 su_26 med_29 ba_33 rol_38 ba_42 mdzad_45 ba_51 las_54 ye_58 shes_61 
T02D1263:13a-1	cher skyes te /	cher_0 skye_5 te_11 
T02D1263:13a-2	mngon par rdzogs par sangs rgyas pa ste /	mngon_0 ba_6 rdzogs_10 ba_17 sangs_21 rgya_27 ba_33 ste_36 
T02D1263:13a-3	khyod kyis kyang 'dod chags spang du mi rung ste /	khyod_0 kyis_6 kyang_11 'dod_17 chags_22 spong_28 du_34 mi_37 rung_40 ste_45 
T02D1263:13a-4	gnyis su med pa'i rol pa gyis shig / ye shes skye bar 'gyur gyis zhes brjod de bsgo'o //	gnyis_0 su_6 med_9 ba_13 rol_18 ba_22 gyis_25 shig_30 ye_37 shes_40 skye_45 ba_50 'gyur_54 gyis_60 zhes_65 rjod_70 de_76 sgo_79 
T02D1263:13a-5	bla mas yang 'di skad brjod de /	bla_0 mas_4 yang_8 'di_13 skad_17 rjod_22 de_28 
T02D1263:13a-6	khyod kyis nus sam rdo rje can //	khyod_0 kyis_6 nus_11 sam_15 rdo_19 rje_23 can_27 
T02D1263:13a-7	dri chen dri chu bza' btung yin //	'dri_0 chen_4 'dri_9 chu_13 bza'_17 'thung_22 yin_28 
T02D1263:13a-8	rakta ga pur ma sha dang //	rakta_0 ga_6 pur_9 ma_13 sha_16 dang_20 
T02D1263:13a-9	bud med mos pas dang nus sam //	'bud_0 med_4 mos_8 ba_12 dang_16 nus_21 sam_25 
T02D1263:13a-10	bha gar 'o byed mi rtog gam //	bha_0 gar_4 'o_8 byed_11 mi_16 rtogs_19 gam_24 
T02D1263:13a-11	spros shing rdo rje bde ba can //	spros_0 shing_6 rdo_12 rje_16 bde_20 ba_24 can_27 
T02D1263:13a-12	de nas yang slob ma dang shes rab gnyis kyis /	de_0 nas_3 yang_7 slob_12 ma_17 dang_20 shes_25 rab_30 gnyis_34 kyis_40 
T02D1263:13a-13	nus pa'i tshig 'di brjod do //	nus_0 ba_4 tshig_9 'di_15 rjod_19 do_25 
T02D1263:13a-14	lha mo ci phyir bdag mi theg dri chen sa bon sogs za zhing //	lha_0 mo_4 ci_7 phyir_10 bdag_16 mi_21 theg_24 'dri_29 chen_33 sa_38 bon_41 sogs_45 za_50 zhing_53 
T02D1263:13a-15	shes rab yang dag dad par bgyis //	shes_0 rab_5 yang_9 'dag_14 dad_18 ba_22 bgyid_26 
T02D1263:13a-16	bha ga la yang 'o bgyid do //	bha_0 ga_4 la_7 yang_10 'o_15 bgyid_18 do_24 
T02D1263:13a-17	zhes brjod do //	zhes_0 rjod_5 do_11 
T02D1263:13a-18	de nas shes rab gcer bur phyung la /	de_0 nas_3 shes_7 rab_12 bcer_16 bur_21 'byin_25 la_32 
T02D1263:13a-19	khrus byas la dri zhim pos byugs la /	'khru_0 byed_6 la_11 'dri_14 zhim_18 pos_23 'byug_27 la_33 
T02D1263:13a-20	me tog gi phreng ba mgo la bcings nas /	me_0 tog_3 gi_7 phreng_10 ba_17 mgo_20 la_24 'ching_27 nas_34 
T02D1263:13a-21	lag pa gnyis kyis grva gnyis nas gzung ste /	lag_0 ba_4 gnyis_7 kyis_13 grva_18 gnyis_23 nas_29 gzung_33 ste_39 
T02D1263:13a-22	kha phye la shes rab mas 'di skad brjod do //	kha_0 'byed_4 la_9 shes_12 rab_17 mas_21 'di_25 skad_29 rjod_34 do_40 
T02D1263:13a-23	rmad chen nga yi padma yin //	rmad_0 chen_5 nga_10 yi_14 padma_17 yin_23 
T02D1263:13a-24	bde ba thams cad yang dag ldan //	bde_0 ba_4 thams_7 cad_13 yang_17 'dag_22 ldan_26 
T02D1263:13a-25	rtag tu rim bzhin 'di la spyod //	rtag_0 tu_5 rim_8 bzhin_12 'di_18 la_22 spyod_25 
T02D1263:13a-26	'di dang nam yang mi 'bral lo //	'di_0 dang_4 nam_9 yang_13 mi_18 'bral_21 lo_27 
T02D1263:13a-27	chos dbyings 'di ni rnam par dag / sems can khams ni rnam par grol //	chos_0 dbyings_5 'di_13 ni_17 rnam_20 ba_25 'dag_29 sems_35 can_40 khams_44 ni_50 rnam_53 ba_58 grol_62 
T02D1263:13a-28	khrag 'thung rgyal po 'di nyid ni //	khrag_0 'thung_6 rgyal_13 po_19 'di_22 nyid_26 ni_31 
T02D1263:13a-29	rang bzhin thams cad 'di la gnas //	rang_0 bzhin_5 thams_11 cad_17 'di_21 la_25 gnas_28 
T02D1263:13a-30	nang gi rtsa yi 'khor lo la //	nang_0 gi_5 rtsa_8 yi_13 'khor_16 lo_22 la_25 
T02D1263:13a-31	padma la zhugs rab tu gsungs //	padma_0 la_6 'jug_9 rab_15 tu_19 gsungs_22 
T02D1263:13a-32	bha ga'i nang du nam mkha' bzhin //	bha_0 ga_4 nang_9 du_14 nam_17 mkha'_21 bzhin_27 
T02D1263:13a-33	'byung ba lnga po rgyan bzhin chongs //	'byung_0 ba_7 lnga_10 po_15 rgyan_18 bzhin_24 chongs_30 
T02D1263:13a-34	lte ba la ni ge sar bcas //	lte_0 ba_4 la_7 ni_10 ge_13 sar_16 'cha'_20 
T02D1263:13a-35	'dab ma brgyad kyis rnam par brgyan //	'dab_0 ma_5 brgyad_8 kyis_15 rnam_20 ba_25 rgyan_29 
T02D1263:13a-36	de yi dbus nas 'byung ba yin //	de_0 yi_3 dbus_6 nas_11 'byung_15 ba_22 yin_25 
T02D1263:13a-37	de nyid bdud rtsi shu kra gzugs //	de_0 nyid_3 bdud_8 rtsi_13 shu_18 kra_22 gzugs_26 
T02D1263:13a-38	bha nydza mo ksha ho zhes shes rab mas brjod do //	bha_0 nydza_4 mo_10 ksha_13 ho_18 zhes_21 shes_26 rab_31 mas_35 rjod_39 do_45 
T02D1263:13a-39	de nas bla mas shi shya'i lag pa dang /	de_0 nas_3 bla_7 mas_11 'chi_15 shya_19 lag_26 ba_30 dang_33 
T02D1263:13a-40	shes rab ma'i lag pa gnyis steng 'og tu bzhag la /	shes_0 rab_5 ma_9 lag_14 ba_18 gnyis_21 steng_27 'og_33 tu_37 'jog_40 la_46 
T02D1263:13a-41	shes rab ma 'dis khyod kyi ye shes skyed par byed pa yin pas /	shes_0 rab_5 ma_9 'dis_12 khyod_17 kyi_23 ye_27 shes_30 skyed_35 ba_41 byed_45 ba_50 yin_53 ba_57 
T02D1263:13a-42	'di dang khyod rtag tu mi 'bral bar 'grogs shig ces brjod pa de kho na /	'di_0 dang_4 khyod_9 rtag_15 tu_20 mi_23 'bral_26 ba_32 'grogs_36 shig_43 ces_48 rjod_52 ba_58 de_61 kho_64 na_68 
T02D1263:13a-43	shes rab kyi dbang yin no /	shes_0 rab_5 kyi_9 dbang_13 yin_19 no_23 
T02D1263:13a-45	// / de nas shi shya shes rab ma dang gnyis yol ba'i nang du 'dug la /	de_5 nas_8 'chi_12 shya_16 shes_21 rab_26 ma_30 dang_33 gnyis_38 yol_44 ba_48 nang_53 du_58 'dug_61 la_66 
T02D1263:13a-46	shes rab ye shes kyi dbang slob mas nod par bya'o //	shes_0 rab_5 ye_9 shes_12 kyi_17 dbang_21 slob_27 mas_32 nod_36 ba_40 byed_44 
T02D1263:13b-0	de nas shes rab de la shi shyas glo @13b g-yon pas la phab nas nyal la /	de_0 nas_3 shes_7 rab_12 de_16 la_19 'chi_22 shyas_26 glo_32 g-yon_41 ba_47 la_51 'bebs_54 nas_59 nyal_63 la_68 
T02D1263:13b-1	dga' ba'i gtam bya /	dga'_0 ba_5 'dam_10 byed_15 
T02D1263:13b-2	gnas dgur sen mos gdab par bya ste /	gnas_0 dgur_5 sen_10 mos_14 gdab_18 ba_23 byed_27 ste_31 
T02D1263:13b-3	g-yon pa'i lag pa g-yon pa'i 'og tu 'dug pas	g-yon_0 ba_6 lag_11 ba_15 g-yon_18 ba_24 'og_29 tu_33 'dug_36 ba_41 
T02D1263:13b-4	padma'i nang gi bye'u mgo 'dra ba la glang po	padma_0 nang_8 gi_13 'bye_16 mgo_22 'dra_26 ba_31 la_34 glang_37 po_43 
T02D1263:13b-5	che'i lag pas brud pa la sogs pa bya'o //	che_0 lag_6 ba_10 'brud_14 ba_19 la_22 sogs_25 ba_30 byed_33 
T02D1263:13b-6	de nas lces kyang rol mo yang yang du byas la /	de_0 nas_3 lces_7 kyang_12 rol_18 mo_22 yang_25 yang_30 du_35 byed_38 la_43 
T02D1263:13b-7	padma rgyas su bcug la /	padma_0 rgya_6 su_12 'jug_15 la_20 
T02D1263:13b-8	de nas shes rab ma dang gnyis sbyor ba byas te /	de_0 nas_3 shes_7 rab_12 ma_16 dang_19 gnyis_24 sbyor_30 ba_36 byed_39 te_44 
T02D1263:13b-9	dal bu dal bus bskyod pa la /	'dal_0 bu_4 'dal_7 'bud_11 skyod_15 ba_22 la_25 
T02D1263:13b-10	byang chub kyi sems bo la'i sker phyin pa las /	byang_0 chub_6 kyi_11 sems_15 'bo_20 la_23 sker_28 phyin_33 ba_39 las_42 
T02D1263:13b-11	rnam par mi rtog pa'i ye shes skyes te /	rnam_0 ba_5 mi_9 rtogs_12 ba_17 ye_22 shes_25 skye_30 te_36 
T02D1263:13b-12	ji tsam gnas kyi bar du bsgom mo //	ji_0 tsam_3 gnas_8 kyi_13 ba_17 du_21 bsgom_24 mo_30 
T02D1263:13b-13	de nas ma thub na kakkolar phyung la /	de_0 nas_3 ma_7 thub_10 na_15 kakkolar_18 'byin_27 la_34 
T02D1263:13b-14	de nyid kye'i rdo rje'i rang bzhin yin pas lces blang ngo //	de_0 nyid_3 kye_8 rdo_14 rje_18 rang_24 bzhin_29 yin_35 ba_39 lces_43 blang_48 ngo_54 
T02D1263:13b-15	de yang rgyud las /	de_0 yang_3 brgyud_8 las_14 
T02D1263:13b-16	lag pas blang bar mi bya zhing //	lag_0 ba_4 blang_8 ba_14 mi_18 byed_21 zhing_25 
T02D1263:13b-17	nya phyis kyis kyang mi bya ste //	nya_0 'byid_4 kyis_10 kyang_15 mi_21 byed_24 ste_28 
T02D1263:13b-18	dung la'ang gzhag par mi bya'o //	dung_0 la_5 'jog_12 ba_18 mi_22 byed_25 
T02D1263:13b-19	bdud rtsi lce yis blang bar bya //	bdud_0 rtsi_5 lce_10 yis_14 blang_18 ba_24 byed_28 
T02D1263:13b-20	zhes 'byung bas /	zhes_0 'byung_5 ba_12 
T02D1263:13b-21	ka sko la nas lce kho nas blang bar bya'o //	ka_0 sko_3 la_7 nas_10 lce_14 kho_18 nas_22 blang_26 ba_32 byed_36 
T02D1263:13b-22	de ni shes rab ma'i kakkola nas ye shes kyi rang bzhin byang chub kyi sems blangs te /	de_0 ni_3 shes_6 rab_11 ma_15 kakkola_20 nas_28 ye_32 shes_35 kyi_40 rang_44 bzhin_49 byang_55 chub_61 kyi_66 sems_70 blangs_75 te_82 
T02D1263:13b-23	zos pas na shes rab dbang zhes bya'o //	zos_0 ba_4 na_8 shes_11 rab_16 dbang_20 zhes_26 byed_31 
T02D1263:13b-24	de la dga' ba rnam pa bzhi ni dga' ba dang /	de_0 la_3 dga'_6 ba_11 rnam_14 ba_19 bzhi_22 ni_27 dga'_30 ba_35 dang_38 
T02D1263:13b-25	yang dag pa'i dga' ba dang /	yang_0 'dag_5 ba_9 dga'_14 ba_19 dang_22 
T02D1263:13b-26	rang bzhin gyis dga' ba dang /	rang_0 bzhin_5 gyis_11 dga'_16 ba_21 dang_24 
T02D1263:13b-27	chad pa'i dga' ba dang bzhi'o //	'chad_0 ba_5 dga'_10 ba_15 dang_18 bzhi_23 
