T02D1897:271b-12	pa'i rdo rje rnams rnam par spros pas 'gro ba'i	ba_0 rdo_5 rje_9 rnams_13 rnam_19 ba_24 spros_28 ba_34 'gro_38 ba_43 
T02D1897:271b-13	don byed pa sngon du 'gro bas mam yig yongs	don_0 byed_4 ba_9 sngon_12 du_18 'gro_21 ba_26 mam_30 yig_34 yongs_38 
T02D1897:271b-14	su gyur pa las ral gri'i yu ba las zla	su_0 gyur_3 ba_8 las_11 ral_15 gri_19 yu_25 ba_28 las_31 zla_35 
T02D1897:271b-15	ba'i gnas su mam yig gis byin gyis brlabs la	ba_0 gnas_5 su_10 mam_13 yig_17 gis_21 byin_25 gyis_30 brlabs_35 la_42 
T02D1897:271b-16	yang 'jam pa'i rdo rje rnams rnam par spros pas	yang_0 'jam_5 ba_10 rdo_15 rje_19 rnams_23 rnam_29 ba_34 spros_38 ba_44 
T02D1897:271b-17	'gro ba'i don byas na mam yig dang ral gri	'gro_0 ba_5 don_10 byed_14 na_19 mam_22 yig_26 dang_30 ral_35 gri_39 
T02D1897:271b-18	yongs su gyur pa las bcom ldan 'das 'jam pa'i	yongs_0 su_6 gyur_9 ba_14 las_17 'joms_21 ldan_26 'da'_31 'jam_36 ba_41 
T02D1897:271b-19	rdo rje gur gum lta bu'i snying rje chen po	rdo_0 rje_4 gur_8 'gum_12 lta_16 bu_20 snying_25 rje_32 chen_36 po_41 
T02D1897:271b-20	dang shes rab kyi rgyu mthun pa dang /	dang_0 shes_5 rab_10 kyi_14 rgyu_18 mthun_23 ba_29 dang_32 
T02D1897:271b-21	ji srid nam mkha'i khams 'od kyis khyab pa /	ji_0 srid_3 nam_8 mkha_12 khams_19 'od_25 kyis_29 khyab_34 ba_40 
T02D1897:271b-22	rigs dpag tu med pa spros pas 'gro ba'i don byed par rtsom pa ral gri nag po dang /	rigs_0 dpog_5 tu_10 med_13 ba_17 spros_20 ba_26 'gro_30 ba_35 don_40 byed_44 ba_49 rtsom_53 ba_59 ral_62 gri_66 nag_70 po_74 dang_77 
T02D1897:271b-23	mda' dmar po dang /	mda'_0 dmar_5 po_10 dang_13 
T02D1897:271b-24	autpala sngon po dang /	autpala_0 sngon_8 po_14 dang_17 
T02D1897:271b-25	gzhu dmar po 'dzin pa bsgom par bya'o //	gzhu_0 dmar_5 po_10 'dzin_13 ba_19 bsgom_22 ba_28 byed_32 
T02D1897:271b-26	de nas longs spyod rdzogs pa'i sku'i rang bzhin gyi	de_0 nas_3 longs_7 spyod_13 rdzogs_19 ba_26 sku_31 rang_37 bzhin_42 gyi_48 
T02D1897:271b-27	dkyil 'khor 'khor lo'i bdag nyid bcom ldan 'das te	dkyil_0 'khor_6 'khor_12 lo_18 bdag_23 nyid_28 'joms_33 ldan_38 'da'_43 te_48 
T02D1897:271b-28	/ longs spyod rdzogs pa'i sku'i bdag nyid mi phyed pa gzung ba dang /	longs_2 spyod_8 rdzogs_14 ba_21 sku_26 bdag_32 nyid_37 mi_42 phyed_45 ba_51 gzung_54 ba_60 dang_63 
T02D1897:271b-29	'dzin pa stong pa nyid kyi chos kyi sku de	'dzin_0 ba_6 stong_9 ba_15 nyid_18 kyi_23 chos_27 kyi_32 sku_36 de_40 
T02D1897:271b-30	bzhin gshegs pa dang chos thams cad lhan cig dbyer	bzhin_0 gshegs_6 ba_13 dang_16 chos_21 thams_26 cad_32 lhan_36 cig_41 dbyer_45 
T02D1897:271b-31	mi phyed par rtogs par bya ba'i phyir 'dir lhag	mi_0 phyed_3 ba_9 rtogs_13 ba_19 byed_23 ba_27 phyir_32 'dir_38 lhag_43 
T02D1897:271b-32	par mos par bya'o //	ba_0 mos_4 ba_8 byed_12 
T02D1897:271b-33	aom dharmma dh'a tu sv'a bh'a ba a'atma ko&amp; ham	aom_0 dharmma_4 dh_12 tu_17 sv_20 bh_25 ba_30 a_33 ko&amp;_40 ham_48 
T02D1897:271b-34	zhes bya ba'i dkyil 'khor gyi bdag po yongs su	zhes_0 byed_5 ba_9 dkyil_14 'khor_20 gyi_26 bdag_30 po_35 yongs_38 su_44 
T02D1897:271b-35	rdzogs pa ni chung ngu'i rgyu mthun pa'i 'bras bu	rdzogs_0 ba_7 ni_10 chung_13 ngu_19 rgyu_25 mthun_30 ba_36 'bras_41 bu_47 
T02D1897:271b-36	dang / chung ngu'i bsnyen pa'o /	dang_0 chung_7 ngu_13 snyen_19 ba_26 
T02D1897:271b-38	// / de nas mig 'bras kyi steng gnyis su so	de_5 nas_8 mig_12 'bras_16 kyi_22 steng_26 gnyis_32 su_38 so_41 
T02D1897:271b-39	sor zla ba'i dkyil 'khor la ksham yig dkar po	sor_0 zla_4 ba_8 dkyil_13 'khor_19 la_25 ksham_28 yig_34 dkar_38 po_43 
T02D1897:271b-40	de yongs su gyur pa las 'khor lo dkar po	de_0 yongs_3 su_9 gyur_12 ba_17 las_20 'khor_24 lo_30 dkar_33 po_38 
T02D1897:271b-41	rtsibs brgyad pa'o // de'i lte ba'i nang du zla	rtsibs_0 brgyad_7 ba_14 de_22 lte_27 ba_31 nang_36 du_41 zla_44 
T02D1897:271b-42	ba la gnas pa'i ksham yig de las sa'i snying	ba_0 la_3 gnas_6 ba_11 ksham_16 yig_22 de_26 las_29 sa_33 snying_38 
T02D1897:272a-0	po rnam par spros pas @272a * //	po_0 rnam_3 ba_8 spros_12 ba_18 
T02D1897:272a-1	'gro ba'i don byed pa sngon du 'gro bas ksham	'gro_0 ba_5 don_10 byed_14 ba_19 sngon_22 du_28 'gro_31 ba_36 ksham_40 
T02D1897:272a-2	yig dang 'khor lo yongs su gyur ba las mig	yig_0 dang_4 'khor_9 lo_15 yongs_18 su_24 gyur_27 ba_32 las_35 mig_39 
T02D1897:272a-3	gi dbang po rnam par dag pa rnam par snang	gi_0 dbang_3 po_9 rnam_12 ba_17 'dag_21 ba_25 rnam_28 ba_33 snang_37 
T02D1897:272a-4	mdzad bzhin du sa'i snying po bsgom par bya'o //	mdzad_0 bzhin_6 du_12 sa_15 snying_20 po_27 bsgom_30 ba_36 byed_40 
T02D1897:272a-5	de ltar rna ba gnyis la so sor zla ba	de_0 ltar_3 rna_8 ba_12 gnyis_15 la_21 so_24 sor_27 zla_31 ba_35 
T02D1897:272a-6	las rdzim yig nag po dang rdo rje yongs su	las_0 rdzim_4 yig_10 nag_14 po_18 dang_21 rdo_26 rje_30 yongs_34 su_40 
T02D1897:272a-7	gyur ba las mi bskyod pa bzhin du phyag na	gyur_0 ba_5 las_8 mi_12 skyod_15 ba_22 bzhin_25 du_31 phyag_34 na_40 
T02D1897:272a-8	rdo rje'o // sna'i rtsa bar zla ba la kham	rdo_0 rje_4 sna_13 rtsa_19 ba_24 zla_28 ba_32 la_35 kham_38 
T02D1897:272a-9	yig ser po dang rin chen 'byung ldan bzhin du	yig_0 ser_4 po_8 dang_11 rin_16 chen_20 'byung_25 ldan_32 bzhin_37 du_43 
T02D1897:272a-10	nam mkha'i snying po'o //	nam_0 mkha_4 snying_11 po_18 
T02D1897:272a-11	lce'i dbus su zla ba la gam yig dmar po	lce_0 dbus_6 su_11 zla_14 ba_18 la_21 gam_24 yig_28 dmar_32 po_37 
T02D1897:272a-12	dang padma yongs su gyur ba las 'od dpag med	dang_0 padma_5 yongs_11 su_17 gyur_20 ba_25 las_28 'od_32 dpog_36 med_41 
T02D1897:272a-13	de de bzhin du 'jig rten dbang phyug go //	de_0 de_3 bzhin_6 du_12 'jig_15 rten_20 dbang_25 phyug_31 go_37 
T02D1897:272a-14	dpral ba'i dbus su zla ba la shkam yig ljang	dpral_0 ba_6 dbus_11 su_16 zla_19 ba_23 la_26 shkam_29 yig_35 ljang_39 
T02D1897:272a-15	gu dang ral gri nag po yongs su gyur ba	gu_0 dang_3 ral_8 gri_12 nag_16 po_20 yongs_23 su_29 gyur_32 ba_37 
T02D1897:272a-16	las don yod grub pa bzhin du sgrib pa rnam	las_0 don_4 yod_8 'grub_12 ba_17 bzhin_20 du_26 sgrib_29 ba_35 rnam_38 
T02D1897:272a-17	par sel ba'o // mgrin pa'i rtsa ba'i 'og tu	ba_0 sel_4 ba_8 mgrin_16 ba_22 rtsa_27 ba_32 'og_37 tu_41 
T02D1897:272a-18	zla ba la sam yig dkar po dang rdo rje	zla_0 ba_4 la_7 sam_10 yig_14 dkar_18 po_23 dang_26 rdo_31 rje_35 
T02D1897:272a-19	dmar po yongs su gyur ba las rdo rje sems	dmar_0 po_5 yongs_8 su_14 gyur_17 ba_22 las_25 rdo_29 rje_33 sems_37 
T02D1897:272a-20	dpa' bzhin du kun du bzang po bsgom par bya'o	dpa'_0 bzhin_5 du_11 kun_14 du_18 bzang_21 po_27 bsgom_30 ba_36 byed_40 
T02D1897:272a-21	par sel ba'o // // 'di ni dbang po rnam par sbyong ba'o /	ba_0 sel_4 ba_8 'di_19 ni_23 dbang_26 po_32 rnam_35 ba_40 sbyong_44 ba_51 
T02D1897:272a-23	// / de bzhin du nam mkha' la zla ba'i dkyil	de_5 bzhin_8 du_14 nam_17 mkha'_21 la_27 zla_30 ba_34 dkyil_39 
T02D1897:272a-24	'khor la gnas pa'i dzam dkar po dang me long	'khor_0 la_6 gnas_9 ba_14 dzam_19 dkar_24 po_29 dang_32 me_37 long_40 
T02D1897:272a-25	yongs su gyur ba las gzugs rnam par dag pa	yongs_0 su_6 gyur_9 ba_14 las_17 gzugs_21 rnam_27 ba_32 'dag_36 ba_40 
T02D1897:272a-26	rnam par snang mdzad kyi rang bzhin gzugs rdo rje	rnam_0 ba_5 snang_9 mdzad_15 kyi_21 rang_25 bzhin_30 gzugs_36 rdo_42 rje_46 
T02D1897:272a-27	ma me long 'dzin pa'o //	ma_0 me_3 long_6 'dzin_11 ba_17 
T02D1897:272a-28	h'um yig nag po dang pi wang yongs su gyur	h_0 yig_5 nag_9 po_13 dang_16 pi_21 wang_24 yongs_29 su_35 gyur_38 
T02D1897:272a-29	ba las sgra rnam par dag pa mi bskyod pa'i	ba_0 las_3 sgra_7 rnam_12 ba_17 'dag_21 ba_25 mi_28 skyod_31 ba_38 
T02D1897:272a-30	rang bzhin sgra rdo rje ma pi wang 'dzin pa'o	rang_0 bzhin_5 sgra_11 rdo_16 rje_20 ma_24 pi_27 wang_30 'dzin_35 ba_41 
T02D1897:272a-31	/ bam yig ser po dang dri chus bkang ba'i	bam_2 yig_6 ser_10 po_14 dang_17 'dri_22 chus_26 'geng_31 ba_37 
T02D1897:272a-32	dung phor yongs su gyur ba las dri rnam par	dung_0 phor_5 yongs_10 su_16 gyur_19 ba_24 las_27 'dri_31 rnam_35 ba_40 
T02D1897:272a-33	dag pa rin chen 'byung ldan gyi rang bzhin dri	'dag_0 ba_4 rin_7 chen_11 'byung_16 ldan_23 gyi_28 rang_32 bzhin_37 'dri_43 
T02D1897:272a-34	rdo rje ma dri chus bkang ba'i dung phor 'dzin	rdo_0 rje_4 ma_8 'dri_11 chus_15 'geng_20 ba_26 dung_31 phor_36 'dzin_41 
T02D1897:272a-35	/ pa'o // ho yig dmar po dang ro'i snod	ba_2 ho_10 yig_13 dmar_17 po_22 dang_25 ro_30 snod_35 
T02D1897:272a-36	yongs su gyur ba las ro rnam par dag pa	yongs_0 su_6 gyur_9 ba_14 las_17 ro_21 rnam_24 ba_29 'dag_33 ba_37 
T02D1897:272a-37	snang ba mtha' yas kyi rang bzhin rdo rje ma	snang_0 ba_6 mtha'_9 yas_15 kyi_19 rang_23 bzhin_28 rdo_34 rje_38 ma_42 
T02D1897:272a-38	ros bkang ba'i snod dkar po 'dzin pa'o //	ros_0 'geng_4 ba_10 snod_15 dkar_20 po_25 'dzin_28 ba_34 
T02D1897:272a-39	kham yig ljang gu dang gos sna tshogs yongs su	kham_0 yig_5 ljang_9 gu_15 dang_18 gos_23 sna_27 tshogs_31 yongs_38 su_44 
T02D1897:272a-40	gyur ba las reg bya rnam par dag pa don	gyur_0 ba_5 las_8 reg_12 byed_16 rnam_20 ba_25 'dag_29 ba_33 don_36 
T02D1897:272a-41	yod grub pa'i rang bzhin reg bya rdo rje ma	yod_0 'grub_4 ba_9 rang_14 bzhin_19 reg_25 byed_29 rdo_33 rje_37 ma_41 
T02D1897:272a-42	gos sna tshogs 'dzin pa'o //	gos_0 sna_4 tshogs_8 'dzin_15 ba_21 
T02D1897:272a-43	ram yig dkar po dang chos 'byung yongs su gyur	ram_0 yig_4 dkar_8 po_13 dang_16 chos_21 'byung_26 yongs_33 su_39 gyur_42 
T02D1897:272a-44	ba las chos khams rnam par dag pa rdo rje	ba_0 las_3 chos_7 khams_12 rnam_18 ba_23 'dag_27 ba_31 rdo_34 rje_38 
T02D1897:272a-45	sems dpa'i rang bzhin chos kyi dbyings kyi rdo rje	sems_0 dpa_5 rang_11 bzhin_16 chos_22 kyi_27 dbyings_31 kyi_39 rdo_43 rje_47 
T02D1897:272a-46	ma chos 'byung 'dzin pa ste 'di ni yul drug	ma_0 chos_3 'byung_8 'dzin_15 ba_21 ste_24 'di_28 ni_32 yul_35 drug_39 
T02D1897:272a-47	rnam par spyod pa'o /	rnam_0 ba_5 spyod_9 ba_15 
T02D1897:272b-0	// / @272b de bzhin du yam yig dkar po dang 'khor	de_11 bzhin_14 du_20 yam_23 yig_27 dkar_31 po_36 dang_39 'khor_44 
T02D1897:272b-1	lo rtsibs brgyad pa yongs su gyur ba las sa'i	lo_0 rtsibs_3 brgyad_10 ba_17 yongs_20 su_26 gyur_29 ba_34 las_37 sa_41 
T02D1897:272b-2	khams rnam par snang mdzad rang bzhin spyan ma 'khor	khams_0 rnam_6 ba_11 snang_15 mdzad_21 rang_27 bzhin_32 spyan_38 ma_44 'khor_47 
T02D1897:272b-3	lo rtsibs brgyad pa 'dzin pa'o //	lo_0 rtsibs_3 brgyad_10 ba_17 'dzin_20 ba_26 
T02D1897:272b-4	mam yig nag po dang autpala dmar po yongs su	mam_0 yig_4 nag_8 po_12 dang_15 autpala_20 dmar_28 po_33 yongs_36 su_42 
T02D1897:272b-5	gyur ba las chu'i khams rnam par dag pa mi	gyur_0 ba_5 las_8 chu_12 khams_18 rnam_24 ba_29 'dag_33 ba_37 mi_40 
T02D1897:272b-6	bskyod pa'i rang bzhin m'a ma k'i autpala dmar po	skyod_0 ba_7 rang_12 bzhin_17 m_23 ma_27 k_30 autpala_34 dmar_42 po_47 
T02D1897:272b-7	'dzin pa'o // a'am yig ser po dang /	'dzin_0 ba_6 a_14 yig_19 ser_23 po_27 dang_30 
T02D1897:272b-8	rin po che yongs su gyur ba las me'i khams	rin_0 po_4 che_7 yongs_11 su_17 gyur_20 ba_25 las_28 me_32 khams_37 
T02D1897:272b-9	rnam par dag pa snang ba mtha' yas kyi rang	rnam_0 ba_5 'dag_9 ba_13 snang_16 ba_22 mtha'_25 yas_31 kyi_35 rang_39 
T02D1897:272b-10	bzhin gos dkar mo padma dmar po 'dab ma brgyad	bzhin_0 gos_6 dkar_10 mo_15 padma_18 dmar_24 po_29 'dab_32 ma_37 brgyad_40 
T02D1897:272b-11	pa 'dzin pa'o // tam yig ser po dang gser	ba_0 'dzin_3 ba_9 tam_17 yig_21 ser_25 po_29 dang_32 gser_37 
T02D1897:272b-12	gyi autpala yongs su gyur ba las rlung gi khams	gyi_0 autpala_4 yongs_12 su_18 gyur_21 ba_26 las_29 rlung_33 gi_39 khams_42 
T02D1897:272b-13	rnam par dag pa rin chen chos 'byung ldan gyi	rnam_0 ba_5 'dag_9 ba_13 rin_16 chen_20 chos_25 'byung_30 ldan_37 gyi_42 
T02D1897:272b-14	rang bzhin sgrol ma gser gyi autpala 'dzin pa'o //	rang_0 bzhin_5 sgrol_11 ma_17 gser_20 gyi_25 autpala_29 'dzin_37 ba_43 
T02D1897:272b-15	'di ni khams bzhi rnam par sbyong ba'o /	'di_0 ni_4 khams_7 bzhi_13 rnam_18 ba_23 sbyong_27 ba_34 
T02D1897:272b-17	// / de bzhin du bhrum yig dkar po dang 'khor	de_5 bzhin_8 du_14 bhrum_17 yig_23 dkar_27 po_32 dang_35 'khor_40 
T02D1897:272b-18	lo yongs su gyur ba las gzugs kyi phung po	lo_0 yongs_3 su_9 gyur_12 ba_17 las_20 gzugs_24 kyi_30 'phung_34 po_40 
T02D1897:272b-19	rnam par dag pa rnam par snang mdzad 'khor lo	rnam_0 ba_5 'dag_9 ba_13 rnam_16 ba_21 snang_25 mdzad_31 'khor_37 lo_43 
T02D1897:272b-20	dkar po rtsibs brgyad pa 'dzin pa'o //	dkar_0 po_5 rtsibs_8 brgyad_15 ba_22 'dzin_25 ba_31 
T02D1897:272b-21	a'am yig ser po dang /	a_0 yig_5 ser_9 po_13 dang_16 
T02D1897:272b-22	rin po che yongs su gyur ba las tshor ba'i	rin_0 po_4 che_7 yongs_11 su_17 gyur_20 ba_25 las_28 tshor_32 ba_38 
T02D1897:272b-23	phung po rnam par dag pa rin chen 'byung ldan	'phung_0 po_6 rnam_9 ba_14 'dag_18 ba_22 rin_25 chen_29 'byung_34 ldan_41 
T02D1897:272b-24	rin po che ljang gu 'dzin pa'o //	rin_0 po_4 che_7 ljang_11 gu_17 'dzin_20 ba_26 
T02D1897:272b-25	dzrim yig dmar po dang padma yongs su gyur ba	dzrim_0 yig_6 dmar_10 po_15 dang_18 padma_23 yongs_29 su_35 gyur_38 ba_43 
T02D1897:272b-26	las 'du shes kyi phung po rnam par dag pa	las_0 'du_4 shes_8 kyi_13 'phung_17 po_23 rnam_26 ba_31 'dag_35 ba_39 
T02D1897:272b-27	'od dpag tu med pa padma dmar po 'dab ma	'od_0 dpog_4 tu_9 med_12 ba_16 padma_19 dmar_25 po_30 'dab_33 ma_38 
T02D1897:272b-28	brgyad pa 'dzin pa'o //	brgyad_0 ba_7 'dzin_10 ba_16 
T02D1897:272b-29	kham yig ljang gu dang ral gri yongs su gyur	kham_0 yig_5 ljang_9 gu_15 dang_18 ral_23 gri_27 yongs_31 su_37 gyur_40 
T02D1897:272b-30	ba las 'du byed kyi phung po rnam par dag	ba_0 las_3 'du_7 byed_11 kyi_16 'phung_20 po_26 rnam_29 ba_34 'dag_38 
T02D1897:272b-31	pa don yod grub pa ral gri nag po 'dzin	ba_0 don_3 yod_7 'grub_11 ba_16 ral_19 gri_23 nag_27 po_31 'dzin_34 
T02D1897:272b-32	pa'o // h'um yig nag po dang rdo rje yongs	ba_0 h_8 yig_13 nag_17 po_21 dang_24 rdo_29 rje_33 yongs_37 
T02D1897:272b-33	su gyur ba las rnam par shes pa'i phung po	su_0 gyur_3 ba_8 las_11 rnam_15 ba_20 shes_24 ba_29 'phung_34 po_40 
T02D1897:272b-34	rnam par dag pa mi bskyod pa rdo rje nag	rnam_0 ba_5 'dag_9 ba_13 mi_16 skyod_19 ba_26 rdo_29 rje_33 nag_37 
T02D1897:272b-35	pa'o // po 'dzin pa'o // 'di ni phung po lnga rnam par sbyor ba'o //	ba_0 po_8 'dzin_11 ba_17 'di_25 ni_29 'phung_32 po_38 lnga_41 rnam_46 ba_51 sbyor_55 ba_61 
T02D1897:272b-36	chung ngu'i rnam par smin pa'i 'bras bu dang /	chung_0 ngu_6 rnam_12 ba_17 smin_21 ba_26 'bras_31 bu_37 dang_40 
T02D1897:272b-37	chung ngu'i nye bar sgrub pa'o /	chung_0 ngu_6 nye_12 ba_16 sgrub_20 ba_26 
T02D1897:272b-39	// / nu ma gnyis kyi 'og tu zla ba la	nu_5 ma_8 gnyis_11 kyi_17 'og_21 tu_25 zla_28 ba_32 la_35 
T02D1897:272b-40	gnas pa'i h'um yig nag po de yongs su gyur	gnas_0 ba_5 h_10 yig_15 nag_19 po_23 de_26 yongs_29 su_35 gyur_38 
T02D1897:272b-41	ba las rdo rje nag po de'i dbus kyi lte	ba_0 las_3 rdo_7 rje_11 nag_15 po_19 de_22 dbus_27 kyi_32 lte_36 
T02D1897:272b-42	ba la gnas pa'i h'um yig nag po'o //	ba_0 la_3 gnas_6 ba_11 h_16 yig_21 nag_25 po_29 
T02D1897:272b-43	de yongs su gyur ba las slar yang rdo rje'i	de_0 yongs_3 su_9 gyur_12 ba_17 las_20 slar_24 yang_29 rdo_34 rje_38 
T02D1897:272b-44	lte ba'i dbus su zla ba la gnas pa'i h'um	lte_0 ba_4 dbus_9 su_14 zla_17 ba_21 la_24 gnas_27 ba_32 h_37 
T02D1897:272b-45	yig ste / de las thugs rdo rje spro ba	yig_0 ste_4 de_10 las_13 thugs_17 rdo_23 rje_27 spro_31 ba_36 
T02D1897:272b-46	dang bsdu ba sngon du 'gro ba'i nang du gnas	dang_0 sdud_5 ba_10 sngon_13 du_19 'gro_22 ba_27 nang_32 du_37 gnas_40 
T02D1897:272b-47	pa'i h'um yig dang rdo rje yongs su gyur ba	ba_0 h_5 yig_10 dang_14 rdo_19 rje_23 yongs_27 su_33 gyur_36 ba_41 
T02D1897:273a-0	las phyag na rdo rje yongs su gyur @273a *	las_0 phyag_4 na_10 rdo_13 rje_17 yongs_21 su_27 gyur_30 
T02D1897:273a-1	yig ste / // pa las phyag na rdo rje lta bu'i thugs rdo rje bsgom par bya'o //	yig_0 ste_4 ba_13 las_16 phyag_20 na_26 rdo_29 rje_33 lta_37 bu_41 thugs_46 rdo_52 rje_56 bsgom_60 ba_66 byed_70 
T02D1897:273a-2	de nas thugs rdo rje'i snying gar zla ba la	de_0 nas_3 thugs_7 rdo_13 rje_17 snying_23 gar_30 zla_34 ba_38 la_41 
T02D1897:273a-3	gnas pa'i rdo rje'i lte ba'i dbus su zla ba	gnas_0 ba_5 rdo_10 rje_14 lte_20 ba_24 dbus_29 su_34 zla_37 ba_41 
T02D1897:273a-4	la gnas pa'i h'um yig las byung ba'i thugs rdo	la_0 gnas_3 ba_8 h_13 yig_18 las_22 'byung_26 ba_32 thugs_37 rdo_43 
T02D1897:273a-5	rje spros pas 'gro ba'i don byas nas mdun du	rje_0 spros_4 ba_10 'gro_14 ba_19 don_24 byed_28 nas_33 mdun_37 du_42 
T02D1897:273a-6	byon te gnas pa rnams dang /	'byon_0 te_5 gnas_8 ba_13 rnams_16 dang_22 
T02D1897:273a-7	gdod ma nas grub pa'i thugs rdo rje rnams kyang mdun du spyan drangs la gnas par bltas te /	gdod_0 ma_5 nas_8 'grub_12 ba_17 thugs_22 rdo_28 rje_32 rnams_36 kyang_42 mdun_48 du_53 spyan_56 drangs_62 la_69 gnas_72 ba_77 lta_81 te_87 
T02D1897:273a-8	snying ga'i sa bon las byung ba'i phyi nang gsang	snying_0 ga_7 sa_12 bon_15 las_19 'byung_23 ba_29 phyi_34 nang_39 gsang_44 
T02D1897:273a-9	ba'i mchod pas yang dag par mchod pas dgyes par	ba_0 mchod_5 ba_11 yang_15 'dag_20 ba_24 mchod_28 ba_34 dgyes_38 ba_44 
T02D1897:273a-10	bltas la rang gis sbrul pa dang thog ma med	lta_0 la_6 rang_9 gis_14 sbrul_18 ba_24 dang_27 thogs_32 ma_37 med_40 
T02D1897:273a-11	pa nas grub pa rnams la tshigs su gcad pa	ba_0 nas_3 'grub_7 ba_12 rnams_15 la_21 tshigs_24 su_31 gcod_34 ba_39 
T02D1897:273a-12	gnyis kyis gsol ba gdab par bya'o //	gnyis_0 kyis_6 gsol_11 ba_16 gdab_19 ba_24 byed_28 
T02D1897:273a-13	rdo rje 'dzin thugs dpal dpal ldan //	rdo_0 rje_4 'dzin_8 thugs_14 dpal_20 dpal_25 ldan_30 
T02D1897:273a-14	rdo rje mi phyed gsum bsgom pas //	rdo_0 rje_4 mi_8 phyed_11 gsum_17 bsgom_22 ba_28 
T02D1897:273a-15	deng bdag byin gyis brlabs gnas su //	deng_0 bdag_5 byin_10 gyis_15 brlabs_20 gnas_27 su_32 
T02D1897:273a-16	rdo rje thugs kyis mdzad du gsol //	rdo_0 rje_4 thugs_8 kyis_14 mdzad_19 du_25 gsol_28 
T02D1897:273a-17	phyogs bcur bzhugs pa'i sangs rgyas rnams //	phyogs_0 'jur_7 bzhugs_12 ba_19 sangs_24 rgya_30 rnams_36 
T02D1897:273a-18	rdo rje mi phyed gsum bsgom pas //	rdo_0 rje_4 mi_8 phyed_11 gsum_17 bsgom_22 ba_28 
T02D1897:273a-19	deng bdag byin gyis brlabs gnas su //	deng_0 bdag_5 byin_10 gyis_15 brlabs_20 gnas_27 su_32 
T02D1897:273a-20	rdo rje thugs kyis mdzad du gsol //	rdo_0 rje_4 thugs_8 kyis_14 mdzad_19 du_25 gsol_28 
T02D1897:273a-21	de nas gsol ba btab pa'i de ma thag tu	de_0 nas_3 gsol_7 ba_12 'debs_15 ba_20 de_25 ma_28 thag_31 tu_36 
T02D1897:273a-22	rab tu dgyes pas rang gi thugs rdo rje'i bdag	rab_0 tu_4 dgyes_7 ba_13 rang_17 gi_22 thugs_25 rdo_31 rje_35 bdag_41 
T02D1897:273a-23	nyid du rab tu zhugs par bsams la 'dis lhag	nyid_0 du_5 rab_8 tu_12 'jug_15 ba_21 bsams_25 la_31 'dis_34 lhag_39 
T02D1897:273a-24	par mos par bya ste /	ba_0 mos_4 ba_8 byed_12 ste_16 
T02D1897:273a-25	aom sarba ta th'a ga ta tsitta badzra sv'a bh'a ba a'atma ko&amp; ham /	aom_0 sarba_4 ta_10 th_13 ga_18 ta_21 tsitta_24 badzra_31 sv_38 bh_43 ba_48 a_51 ko&amp;_58 ham_66 
T02D1897:273a-26	de bzhin du nu ma gnyis kyi bar du zla	de_0 bzhin_3 du_9 nu_12 ma_15 gnyis_18 kyi_24 ba_28 du_32 zla_35 
T02D1897:273a-27	ba la gnas pa'i ral gri'i yu ba'i dbus su	ba_0 la_3 gnas_6 ba_11 ral_16 gri_20 yu_26 ba_29 dbus_34 su_39 
T02D1897:273a-28	zla ba la gnas pa'i mam yig dang ral gri	zla_0 ba_4 la_7 gnas_10 ba_15 mam_20 yig_24 dang_28 ral_33 gri_37 
T02D1897:273a-29	yongs su gyur pa las gsol ba btab pa med	yongs_0 su_6 gyur_9 ba_14 las_17 gsol_21 ba_26 'debs_29 ba_34 med_37 
T02D1897:273a-30	par dam tshig sems dpa' bzhin du ye shes sems	ba_0 dam_4 tshig_8 sems_14 dpa'_19 bzhin_24 du_30 ye_33 shes_36 sems_41 
T02D1897:273a-31	dpa' bsgom par bya'o //	dpa'_0 bsgom_5 ba_11 byed_15 
T02D1897:273a-32	de bzhin du thugs rdo rje bskyed pa'i rim pa	de_0 bzhin_3 du_9 thugs_12 rdo_18 rje_22 skyed_26 ba_33 rim_38 ba_42 
T02D1897:273a-33	nyid kyis mgrin pa'i rtsa bar zla ba la gnas	nyid_0 kyis_5 mgrin_10 ba_16 rtsa_21 ba_26 zla_30 ba_34 la_37 gnas_40 
T02D1897:273a-34	pa'i ral gri'i yu ba'i dbus su zla ba la	ba_0 ral_5 gri_9 yu_15 ba_18 dbus_23 su_28 zla_31 ba_35 la_38 
T02D1897:273a-35	gnas pa'i aa yig dmar po dang padma yongs su	gnas_0 ba_5 aa_10 yig_13 dmar_17 po_22 dang_25 padma_30 yongs_36 su_42 
T02D1897:273a-36	gyur pa las gsol ba btab nas lhan cig 'jig	gyur_0 ba_5 las_8 gsol_12 ba_17 'debs_20 nas_25 lhan_29 cig_34 'jig_38 
T02D1897:273a-37	rten dbang phyug bzhin du gsung rdo rje bsgom par	rten_0 dbang_5 phyug_11 bzhin_17 du_23 gsung_26 rdo_32 rje_36 bsgom_40 ba_46 
T02D1897:273a-38	bya'o // der gsol ba btab pa'i tshigs su bcad pa gnyis ni /	byed_0 der_9 gsol_13 ba_18 'debs_21 ba_26 tshigs_31 su_38 gcod_41 ba_46 gnyis_49 ni_55 
T02D1897:273a-39	chos kyi gsung lam dpal dang ldan //	chos_0 kyi_5 gsung_9 lam_15 dpal_19 dang_24 ldan_29 
T02D1897:273a-40	rdo rje mi phyad gsum bsgoms pas //	rdo_0 rje_4 mi_8 phyad_11 gsum_17 sgom_22 ba_29 
T02D1897:273a-41	deng bdag byin gyis brlabs gnas su //	deng_0 bdag_5 byin_10 gyis_15 brlabs_20 gnas_27 su_32 
T02D1897:273a-42	rdo rje gsung gis mdzad du gsol //	rdo_0 rje_4 gsung_8 gis_14 mdzad_18 du_24 gsol_27 
T02D1897:273a-43	phyogs bcur bzhugs pa'i sangs rgyas rnams //	phyogs_0 'jur_7 bzhugs_12 ba_19 sangs_24 rgya_30 rnams_36 
T02D1897:273a-44	rdo rje mi phyed gsum bsgoms pas //	rdo_0 rje_4 mi_8 phyed_11 gsum_17 sgom_22 ba_29 
T02D1897:273b-0	deng bdag byin gyis @273b brlabs gnas su //	deng_0 bdag_5 byin_10 gyis_15 brlabs_26 gnas_33 su_38 
T02D1897:273b-1	rdo rje gsung gis mdzad du gsol //	rdo_0 rje_4 gsung_8 gis_14 mdzad_18 du_24 gsol_27 
T02D1897:273b-2	de nas bcom ldan 'das bzhugs pa'i de ma thag tu /	de_0 nas_3 'joms_7 ldan_12 'da'_17 bzhugs_22 ba_29 de_34 ma_37 thag_40 tu_45 
T02D1897:273b-3	aom sarba ta th'a ga ta b'aka badzra sv'a bh'a b'a a'atma ko&amp; ham /	aom_0 sarba_4 ta_10 th_13 ga_18 ta_21 b_24 badzra_30 sv_37 bh_42 b_47 a_51 ko&amp;_58 ham_66 
T02D1897:273b-4	zhes bya bas lhag par mos par bya'o //	zhes_0 byed_5 ba_9 lhag_13 ba_18 mos_22 ba_26 byed_30 
T02D1897:273b-5	de nas de nyid kyi bskyed pa'i rim pas dpral	de_0 nas_3 de_7 nyid_10 kyi_15 skyed_19 ba_26 rim_31 ba_35 dpral_39 
T02D1897:273b-6	bar aom yig dkar po dang 'khor lo yongs su	ba_0 aom_4 yig_8 dkar_12 po_17 dang_20 'khor_25 lo_31 yongs_34 su_40 
T02D1897:273b-7	gyur pa las gsol ba btab pa las lhan cig	gyur_0 ba_5 las_8 gsol_12 ba_17 'debs_20 ba_25 las_28 lhan_32 cig_37 
T02D1897:273b-8	sa'i snying po bzhin du sku rdo rje bsgom par	sa_0 snying_5 po_12 bzhin_15 du_21 sku_24 rdo_28 rje_32 bsgom_36 ba_42 
T02D1897:273b-9	bya'o // de la 'di ni gsol ba gdab pa'i tshigs su bcad pa gnyis te /	byed_0 de_9 la_12 'di_15 ni_19 gsol_22 ba_27 gdab_30 ba_35 tshigs_40 su_47 gcod_50 ba_55 gnyis_58 te_64 
T02D1897:273b-10	dpal ldan rdo rje sku 'chang ba //	dpal_0 ldan_5 rdo_10 rje_14 sku_18 'chang_22 ba_29 
T02D1897:273b-11	rdo rje mi phyed gsum bsgoms pas //	rdo_0 rje_4 mi_8 phyed_11 gsum_17 sgom_22 ba_29 
T02D1897:273b-12	deng bdag byin gyis brlabs gnas su //	deng_0 bdag_5 byin_10 gyis_15 brlabs_20 gnas_27 su_32 
T02D1897:273b-13	rdo rje sku yis mdzad du gsol //	rdo_0 rje_4 sku_8 yis_12 mdzad_16 du_22 gsol_25 
T02D1897:273b-14	phyogs bcur bzhugs pa'i sangs rgyas rnams //	phyogs_0 'jur_7 bzhugs_12 ba_19 sangs_24 rgya_30 rnams_36 
T02D1897:273b-15	rdo rje mi phyed gsum bsgoms pas //	rdo_0 rje_4 mi_8 phyed_11 gsum_17 sgom_22 ba_29 
T02D1897:273b-16	deng bdag byin gyis brlabs gnas su //	deng_0 bdag_5 byin_10 gyis_15 brlabs_20 gnas_27 su_32 
T02D1897:273b-17	rdo rje sku yis mdzad du gsol //	rdo_0 rje_4 sku_8 yis_12 mdzad_16 du_22 gsol_25 
T02D1897:273b-18	de nas rab tu zhugs pa'i de ma thag tu /	de_0 nas_3 rab_7 tu_11 'jug_14 ba_20 de_25 ma_28 thag_31 tu_36 
T02D1897:273b-19	aom sarba ta th'a ga ta k'a ya badzra sv'a bh'a ba a'atma ko&amp; ham /	aom_0 sarba_4 ta_10 th_13 ga_18 ta_21 k_24 ya_28 badzra_31 sv_38 bh_43 ba_48 a_51 ko&amp;_58 ham_66 
T02D1897:273b-20	zhes bya bas lhag par mos par bya'o //	zhes_0 byed_5 ba_9 lhag_13 ba_18 mos_22 ba_26 byed_30 
T02D1897:273b-21	de ltar thugs rdo rje la sogs pas byin gyis	de_0 ltar_3 thugs_8 rdo_14 rje_18 la_22 sogs_25 ba_30 byin_34 gyis_39 
T02D1897:273b-22	brlab pa ni chung ngu'i skyes bu byed pa'i 'bras	brlab_0 ba_6 ni_9 chung_12 ngu_18 skye_24 bu_30 byed_33 ba_38 'bras_43 
T02D1897:273b-23	bu dang chung ngu'i sgrub pa'o /	bu_0 dang_3 chung_8 ngu_14 sgrub_20 ba_26 
T02D1897:273b-25	// / de nas ye shes sems dpa'i thugs ka'i phyag	de_5 nas_8 ye_12 shes_15 sems_20 dpa_25 thugs_31 ka_37 phyag_42 
T02D1897:273b-26	mtshan gyi sa bon las 'od zer rnam par spros	mtshan_0 gyi_7 sa_11 bon_14 las_18 'od_22 zer_26 rnam_30 ba_35 spros_39 
T02D1897:273b-27	pas phyogs bcu'i de bzhin gshegs pa thams cad yang	ba_0 phyogs_4 'chu_11 de_17 bzhin_20 gshegs_26 ba_33 thams_36 cad_42 yang_46 
T02D1897:273b-28	dag par bskul te /	'dag_0 ba_4 skul_8 te_14 
T02D1897:273b-29	de bzhin gshegs pa'i so so'i sku las rnam par	de_0 bzhin_3 gshegs_9 ba_16 so_21 so_24 sku_29 las_33 rnam_37 ba_42 
T02D1897:273b-30	spros pa'i rang rang gi sku mdog gi rin po	spros_0 ba_6 rang_11 rang_16 gi_21 sku_24 mdog_28 gi_33 rin_36 po_40 
T02D1897:273b-31	che'i bum pa byang chub kyi sems kyis bkang bas	che_0 bum_6 ba_10 byang_13 chub_19 kyi_24 sems_28 kyis_33 'geng_38 ba_44 
T02D1897:273b-32	phyag 'brel ba rnams kyis nam mkha' khyab pas rgyal	phyag_0 'brel_6 ba_12 rnams_15 kyis_21 nam_26 mkha'_30 khyab_36 ba_42 rgyal_46 
T02D1897:273b-33	mtshan dang ba dan la sogs pas phyag 'brel ba'i	mtshan_0 dang_7 ba_12 dan_15 la_19 sogs_22 ba_27 phyag_31 'brel_37 ba_43 
T02D1897:273b-34	mchod pa'i lha mo'i tshogs kyis yongs su bskor ba	mchod_0 ba_6 lha_11 mo_15 tshogs_20 kyis_27 yongs_32 su_38 skor_41 ba_47 
T02D1897:273b-35	spyan ma la sogs pa chos kyi dbyings kyi rdo	spyan_0 ma_6 la_9 sogs_12 ba_17 chos_20 kyi_25 dbyings_29 kyi_37 rdo_41 
T02D1897:273b-36	rje ma'i mthar thug pa'i lha mo'i tshogs dpag tu	rje_0 ma_4 mthar_9 thug_15 ba_20 lha_25 mo_29 tshogs_34 dpog_41 tu_46 
T02D1897:273b-37	med pas bdag nyid dbang bskur bas bltas la spyi	med_0 ba_4 bdag_8 nyid_13 dbang_18 skur_24 ba_30 lta_34 la_40 spyi_43 
