T02D1550:197a-0	@197a # // rgya gar skad du /	rgya_11 gar_16 skad_20 du_25 
T02D1550:197a-1	shr'i badzra yo gi n'i s'a dha nam /	shr_0 badzra_6 yo_13 gi_16 n_19 s_23 dha_27 nam_31 
T02D1550:197a-2	bod skad du /	'bod_0 skad_4 du_9 
T02D1550:197a-3	dpal rdo rje rnal 'byor ma'i sgrub thabs //	dpal_0 rdo_5 rje_9 rnal_13 'byor_18 ma_24 sgrub_29 thabs_35 
T02D1550:197a-4	dpal rdo rje rnal 'byor ma la phyag 'tshal lo //	dpal_0 rdo_5 rje_9 rnal_13 'byor_18 ma_24 la_27 phyag_30 'tshal_36 lo_43 
T02D1550:197a-5	stong nyid snying rje'i bdag nyid can //	stong_0 nyid_6 snying_11 rje_18 bdag_24 nyid_29 can_34 
T02D1550:197a-6	khams gsum pa yi ngo bo nyid //	khams_0 gsum_6 ba_11 yi_14 ngo_17 'bo_21 nyid_24 
T02D1550:197a-7	bskal ba'i me ltar 'bar ba'i 'od //	bskal_0 ba_6 me_11 ltar_14 'bar_19 ba_24 'od_29 
T02D1550:197a-8	rdo rje rnal 'byor ma dpal 'dud //	rdo_0 rje_4 rnal_8 'byor_13 ma_19 dpal_22 'dud_27 
T02D1550:197a-9	bla ma brgyud pa'i rim pa ni //	bla_0 ma_4 brgyud_7 ba_14 rim_19 ba_23 ni_26 
T02D1550:197a-10	rtogs pa gcig gi spyod yul te //	rtogs_0 ba_6 gcig_9 gi_14 spyod_17 yul_23 te_27 
T02D1550:197a-11	rdo rje rnal 'byor ma'i sgrub thabs //	rdo_0 rje_4 rnal_8 'byor_13 ma_19 sgrub_24 thabs_30 
T02D1550:197a-12	mdor bsdus bdag gis bshad par bya //	mdor_0 sdud_5 bdag_11 gis_16 'chad_20 ba_26 byed_30 
T02D1550:197a-13	sngags pas thog mar re zhig bla ma dang sangs rgyas rnams la mngon par gus pa'i yid kyis //	sngags_0 ba_7 thogs_11 mar_16 re_20 'jig_23 bla_28 ma_32 dang_35 sangs_40 rgya_46 rnams_52 la_58 mngon_61 ba_67 gus_71 ba_75 yid_80 kyis_84 
T02D1550:197a-14	byang chub kyi sems brtan por bzung ste /	byang_0 chub_6 kyi_11 sems_15 brtan_20 por_26 bzung_30 ste_36 
T02D1550:197a-15	dbang bskur ba yang dag par thob nas /	dbang_0 skur_6 ba_12 yang_15 'dag_20 ba_24 'thob_28 nas_33 
T02D1550:197a-16	chos thams cad ngo bo nyid kyis 'od gsal ba'i rang bzhin yin yang /	chos_0 thams_5 cad_11 ngo_15 'bo_19 nyid_22 kyis_27 'od_32 gsal_36 ba_41 rang_46 bzhin_51 yin_57 yang_61 
T02D1550:197b-0	rang dang gzhan gyi don phun sum @197b tshogs pa la mngon du phyogs par bya ste /	rang_0 dang_5 gzhan_10 gyi_16 don_20 phun_24 sum_29 tshogs_39 ba_46 la_49 mngon_52 du_58 phyogs_61 ba_68 byed_72 ste_76 
T02D1550:197b-1	dur khrod la sogs pa yid dang rjes su mthun	dur_0 khrod_4 la_10 sogs_13 ba_18 yid_21 dang_25 rjes_30 su_35 mthun_38 
T02D1550:197b-2	pa'i dben pa'i gnas su stan 'jam po la rnal	ba_0 dben_5 ba_10 gnas_15 su_20 stan_23 'jam_28 po_33 la_36 rnal_39 
T02D1550:197b-3	'byor gyi rol pas rab tu bsngags pa'i gnas su	'byor_0 gyi_6 rol_10 ba_14 rab_18 tu_22 bsngags_25 ba_33 gnas_38 su_43 
T02D1550:197b-4	bltas te 'dug par bya'o //	lta_0 te_6 'dug_9 ba_14 byed_18 
T02D1550:197b-5	de'i rjes la lus dang ngag dang sems yongs su dag par bya ba ni /	de_0 rjes_5 la_10 lus_13 dang_17 ngag_22 dang_27 sems_32 yongs_37 su_43 'dag_46 ba_50 byed_54 ba_58 ni_61 
T02D1550:197b-6	rgun 'brum mam bu ram shing ngam /	rgun_0 'brum_5 mam_11 bu_15 ram_18 shing_22 ngam_28 
T02D1550:197b-7	'bras las byas pa'i btung ba bzang po ji ltar	'bras_0 las_6 byed_10 ba_15 'thung_20 ba_26 bzang_29 po_35 ji_38 ltar_41 
T02D1550:197b-8	rnyed pa'i dam tshig lnga dang ldan par byas la	rnyed_0 ba_6 dam_11 tshig_15 lnga_21 dang_26 ldan_31 ba_36 byed_40 la_45 
T02D1550:197b-9	mchod sbyin gyi snod du bzhag ste /	mchod_0 sbyin_6 gyi_12 snod_16 du_21 'jog_24 ste_30 
T02D1550:197b-10	yi ge gsum gyi sngags kyis mngon par bsngags nas /	yi_0 ge_3 gsum_6 gyi_11 sngags_15 kyis_22 mngon_27 ba_33 bsngags_37 nas_45 
T02D1550:197b-11	chu de nyid kyis lag pa g-yon pa nas brtsams	chu_0 de_4 nyid_7 kyis_12 lag_17 ba_21 g-yon_24 ba_30 nas_33 brtsams_37 
T02D1550:197b-12	nas yan lag dang nying lag thams cad sngags kyi	nas_0 yan_4 lag_8 dang_12 nying_17 lag_23 thams_27 cad_33 sngags_37 kyi_44 
T02D1550:197b-13	chus khrus bya zhing /	chus_0 'khru_5 byed_11 zhing_15 
T02D1550:197b-14	de nyid kyis mchod pa'i rdzas kyang bsang gtor bya ba'o //	de_0 nyid_3 kyis_8 mchod_13 ba_19 rdzas_24 kyang_30 bsang_36 'thor_42 byed_47 ba_51 
T02D1550:197b-15	de'i rjes la /	de_0 rjes_5 la_10 
T02D1550:197b-16	aom bam hom yom hrim mom hrem hri h'um h'um phat phat /	aom_0 bam_4 hom_8 yom_12 hrim_16 mom_21 hrem_25 hri_30 h_34 h_39 phat_44 phat_49 
T02D1550:197b-17	ces bya ba'i sngags kyi yi ges lag pa g-yon pa'i sor mo rnams la sbyar te /	ces_0 byed_4 ba_8 sngags_13 kyi_20 yi_24 ges_27 lag_31 ba_35 g-yon_38 ba_44 sor_49 mo_53 rnams_56 la_62 sbyor_65 te_71 
T02D1550:197b-18	dag pa gsum brjod par bya'o //	'dag_0 ba_4 gsum_7 rjod_12 ba_18 byed_22 
T02D1550:197b-19	aom sva bh'a ba shuddha: sarbba dharm'a: sva bh'a ba shuddho&amp; ham /	aom_0 sva_4 bh_8 ba_13 shuddha:_16 sarbba_25 dharm:_32 sva_41 bh_45 ba_50 shuddho&amp;_53 ham_66 
T02D1550:197b-20	aom badzra shuddha: sarba dharm'a badzra shuddho&amp; ham//	aom_0 badzra_4 shuddha:_11 sarba_20 dharm_26 badzra_34 shuddho&amp;_41 
T02D1550:197b-21	aom yo ga shuddha: sarba dharm'a yo ga shuddho&amp; ham /	aom_0 yo_4 ga_7 shuddha:_10 sarba_19 dharm_25 yo_33 ga_36 shuddho&amp;_39 ham_52 
T02D1550:197b-22	de nas rang gi lus khams gsum po rnam par dag pa'i gzhal yas khang du brtags te /	de_0 nas_3 rang_7 gi_12 lus_15 khams_19 gsum_25 po_30 rnam_33 ba_38 'dag_42 ba_46 'jal_51 yas_57 khang_61 du_67 rtog_70 te_77 
T02D1550:197b-23	skad cig tsam gyis lte ba'i skyil 'khor du rdo	skad_0 cig_5 tsam_9 gyis_14 lte_19 ba_23 skyil_28 'khor_34 du_40 rdo_43 
T02D1550:197b-24	rje rnal 'byor ma phyag gnyis na gri gug dang	rje_0 rnal_4 'byor_9 ma_15 phyag_18 gnyis_24 na_30 gri_33 gug_37 dang_41 
T02D1550:197b-25	thod pa bsnams pa /	thod_0 ba_5 snom_8 ba_15 
T02D1550:197b-26	skra grol ba thur du 'phyang ba /	skra_0 grol_5 ba_10 thur_13 du_18 'phyang_21 ba_29 
T02D1550:197b-27	gcer bu spyan gsum pa /	bcer_0 bu_5 spyan_8 gsum_14 ba_19 
T02D1550:197b-28	gzugs dang lang tsho phun sum tshogs pa /	gzugs_0 dang_6 lang_11 tsho_16 phun_21 sum_26 tshogs_30 ba_37 
T02D1550:197b-29	phyag rgya lnga yis rnam par brgyan //	phyag_0 rgya_6 lnga_11 yis_16 rnam_20 ba_25 rgyan_29 
T02D1550:197b-30	sangs rgyas lnga yi dbu rgyan can //	sangs_0 rgya_6 lnga_12 yi_17 dbu_20 rgyan_24 can_30 
T02D1550:197b-31	zla ba nyi ma me dkyil du //	zla_0 ba_4 nyi_7 ma_11 me_14 dkyil_17 du_23 
T02D1550:197b-32	skyil krung phyed pas gnon mdzad cing //	skyil_0 krung_6 phyed_12 ba_18 gnon_22 mdzad_27 cing_33 
T02D1550:197b-33	dza ba sindhu ra dang mtshungs //	dza_0 ba_4 sindhu_7 ra_14 dang_17 mtshungs_22 
T02D1550:197b-34	de lta'i gzugs can lha mo ni //	de_0 lta_3 gzugs_9 can_15 lha_19 mo_23 ni_26 
T02D1550:197b-35	rnal 'byor pa yis rtag tu bsgom //	rnal_0 'byor_5 ba_11 yis_14 rtag_18 tu_23 bsgom_26 
T02D1550:197b-36	de yi g-yas ni phag gdong ste //	de_0 yi_3 g-yas_6 ni_12 phag_15 gdong_20 ste_26 
T02D1550:197b-37	de bzhin g-yon pa khro mo nyid //	de_0 bzhin_3 g-yon_9 ba_15 khro_18 mo_23 nyid_26 
T02D1550:197b-38	kun rdzob don dam rang bzhin gyis //	kun_0 rdzob_4 don_10 dam_14 rang_18 bzhin_23 gyis_29 
T02D1550:197b-39	zhal gnyis su ni rab tu grags //	zhal_0 gnyis_5 su_11 ni_14 rab_17 tu_21 grags_24 
T02D1550:197b-40	bla ma'i man ngag lam gyis ni //	bla_0 ma_4 man_9 ngag_13 lam_18 gyis_22 ni_27 
T02D1550:197b-41	rim pa rgyas par rtogs par bya //	rim_0 ba_4 rgya_7 ba_13 rtogs_17 ba_23 byed_27 
T02D1550:197b-42	de yi padma'i nang du ni //	de_0 yi_3 padma_6 nang_14 du_19 ni_22 
T02D1550:197b-43	don kun sgrub byed 'khor lo bsgom //	don_0 kun_4 sgrub_8 byed_14 'khor_19 lo_25 bsgom_28 
T02D1550:197b-44	rim pa gsum gyis mtshan nas su //	rim_0 ba_4 gsum_7 gyis_12 mtshan_17 nas_24 su_28 
T02D1550:197b-45	kha dog dmar po'i 'od zer can //	kha_0 dog_4 dmar_8 po_13 'od_18 zer_22 can_26 
T02D1550:197b-46	sngags kyi yi ges yongs rdzogs nas //	sngags_0 kyi_7 yi_11 ges_14 yongs_18 rdzogs_24 nas_31 
T02D1550:197b-47	rdza mkhan 'khor lo bzhin du 'khor //	rdza_0 mkhan_5 'khor_11 lo_17 bzhin_20 du_26 'khor_29 
T02D1550:197b-48	srin po'i zhal ni cung zhig bsdam //	srin_0 po_5 zhal_10 ni_15 cung_18 'jig_23 sdom_28 
T02D1550:197b-49	rab tu 'bar ba'i rnam par bsgom //	rab_0 tu_4 'bar_7 ba_12 rnam_17 ba_22 bsgom_26 
T02D1550:198a-0	phag gdod gyen du @198a * //	phag_0 gdod_5 gyen_10 du_15 
T02D1550:198a-1	nye bar blta //	nye_0 ba_4 lta_8 
T02D1550:198a-2	g-yung drung 'khyil ba myur du 'khor //	g-yung_0 drung_7 'khyil_13 ba_20 myur_23 du_28 'khor_31 
T02D1550:198a-3	phyag rgya gnyis po'i rnal 'byor gyis //	phyag_0 rgya_6 gnyis_11 po_17 rnal_22 'byor_27 gyis_33 
T02D1550:198a-4	khams gsum po yang 'grub par 'gyur //	khams_0 gsum_6 po_11 yang_14 'grub_19 ba_25 'gyur_29 
T02D1550:198a-5	rnal 'byor bdag nyid skad cig gis //	rnal_0 'byor_5 bdag_11 nyid_16 skad_21 cig_26 gis_30 
T02D1550:198a-6	'grub 'gyur rnal 'byor pas gzhan min //	'grub_0 'gyur_6 rnal_12 'byor_17 ba_23 gzhan_27 min_33 
T02D1550:198a-7	de nas gzhan yang bshad bya ba //	de_0 nas_3 gzhan_7 yang_13 'chad_18 byed_24 ba_28 
T02D1550:198a-8	sngags btu ba yi cho ga mchog / gru gsum dkyil 'khor nyams dga' ba //	sngags_0 'thu_7 ba_11 yi_14 cho_17 ga_21 mchog_24 gru_32 gsum_36 dkyil_41 'khor_47 nyams_53 dga'_59 ba_64 
T02D1550:198a-9	rdo rje rol pa las byung ba'i //	rdo_0 rje_4 rol_8 ba_12 las_15 'byung_19 ba_25 
T02D1550:198a-10	chos kyi 'byung gnas zhes bshad pa //	chos_0 kyi_5 'byung_9 gnas_16 zhes_21 'chad_26 ba_32 
T02D1550:198a-11	btsun mo'i bha ga nyid kyang de //	btsun_0 mo_6 bha_11 ga_15 nyid_18 kyang_23 de_29 
T02D1550:198a-12	a'a lo k'a li'i dbye bas der //	a_0 lo_4 k_7 li_11 'byed_16 ba_21 der_25 
T02D1550:198a-13	sde tshan brgyad kyi rim pa ni //	sde_0 tshan_4 brgyad_10 kyi_17 rim_21 ba_25 ni_28 
T02D1550:198a-14	gzugs me mda' dang thub pa dang //	gzugs_0 me_6 mda'_9 dang_14 thub_19 ba_24 dang_27 
T02D1550:198a-15	bu ga drag po 'dod pa nyid //	bu_0 ga_3 drag_6 po_11 'dod_14 ba_19 nyid_22 
T02D1550:198a-16	'khor lo rnams ni rim bzhin du //	'khor_0 lo_6 rnams_9 ni_15 rim_18 bzhin_22 du_28 
T02D1550:198a-17	man ngag gis ni dgod par bya //	man_0 ngag_4 gis_9 ni_13 'god_16 ba_21 byed_25 
T02D1550:198a-18	dang por aa nas brtsams nas su //	dang_0 por_5 aa_9 nas_12 brtsams_16 nas_24 su_28 
T02D1550:198a-19	yi ge ha yi mthar thug par //	yi_0 ge_3 ha_6 yi_9 mthar_12 thug_18 ba_23 
T02D1550:198a-20	bskor ba'i tshul gyi sbyor ba yis //	skor_0 ba_6 tshul_11 gyi_17 sbyor_21 ba_27 yis_30 
T02D1550:198a-21	bde mchog rgya mtsho gsung bzhin bri //	bde_0 mchog_4 rgya_10 mtsho_15 gsung_21 bzhin_27 'bri_33 
T02D1550:198a-22	dva yi thog ma sum 'gyur bya //	dva_0 yi_4 thogs_7 ma_12 sum_15 'gyur_19 byed_25 
T02D1550:198a-23	thig le n'a ngas rnam par brgyan //	thig_0 le_5 n_8 ngas_12 rnam_17 ba_22 rgyan_26 
T02D1550:198a-24	bha thog tsha thog yi ge nyid //	bha_0 thogs_4 tsha_9 thogs_14 yi_19 ge_22 nyid_25 
T02D1550:198a-25	ta yig thog mas mgo bor brgyan //	ta_0 yig_3 thogs_7 mas_12 mgo_16 'bor_20 rgyan_24 
T02D1550:198a-26	tsa sa'i bar nas gzung byas te //	tsa_0 sa_4 ba_9 nas_13 gzung_17 byed_23 te_28 
T02D1550:198a-27	ta yig 'og ma 'og tu sbyor //	ta_0 yig_3 'og_7 ma_11 'og_14 tu_18 sbyor_21 
T02D1550:198a-28	sha thog sha thog 'brel ba ni //	sha_0 thogs_4 sha_9 thogs_13 'brel_18 ba_24 ni_27 
T02D1550:198a-29	de bzhin sbyor bar shes par bya //	de_0 bzhin_3 sbyor_9 ba_15 shes_19 ba_24 byed_28 
T02D1550:198a-30	li yi mgo gyur yi ge la //	li_0 yi_3 mgo_6 gyur_10 yi_15 ge_18 la_21 
T02D1550:198a-31	nya yi 'og nas gnas pas brgyan //	nya_0 yi_4 'og_7 nas_11 gnas_15 ba_20 rgyan_24 
T02D1550:198a-32	pa thog ta yig 'og mar ldan //	ba_0 thogs_3 ta_8 yig_11 'og_15 mar_19 ldan_23 
T02D1550:198a-33	pha thog tha yig 'og mas bcings //	pha_0 thogs_4 tha_9 yig_13 'og_17 mas_21 'ching_25 
T02D1550:198a-34	ha ta'i bar gnas yi ge la //	ha_0 ta_3 ba_8 gnas_12 yi_17 ge_20 la_23 
T02D1550:198a-35	na yig thog na gnas pas brgyan //	na_0 yig_3 thogs_7 na_12 gnas_15 ba_20 rgyan_24 
T02D1550:198a-36	sha yi 'og na gnas pas gzung //	sha_0 yi_4 'og_7 na_11 gnas_14 ba_19 gzung_23 
T02D1550:198a-37	bha 'og gi stan na 'og sbyar //	bha_0 'og_4 gi_8 stan_11 na_16 'og_19 sbyor_23 
T02D1550:198a-38	ha yi steng gnas yi ge nyid //	ha_0 yi_3 steng_6 gnas_12 yi_17 ge_20 nyid_23 
T02D1550:198a-39	ra yig gong ma nyis brtsegs ldan //	ra_0 yig_3 gong_7 ma_12 nyis_15 brtsegs_20 ldan_28 
T02D1550:198a-40	ta yig gong ma sbyar bya ste //	ta_0 yig_3 gong_7 ma_12 sbyor_15 byed_21 ste_25 
T02D1550:198a-41	mgo bo ru ni yongs su grags //	mgo_0 'bo_4 ru_7 ni_10 yongs_13 su_19 grags_22 
T02D1550:198a-42	pha yi thog na gnas pa la //	pha_0 yi_4 thogs_7 na_12 gnas_15 ba_20 la_23 
T02D1550:198a-43	tha yig thog na gnas pas brgyan //	tha_0 yig_4 thogs_8 na_13 gnas_16 ba_21 rgyan_25 
T02D1550:198a-44	nya thog na thog gis brgyan pa //	nya_0 thogs_4 na_9 thogs_12 gis_17 rgyan_21 ba_28 
T02D1550:198a-45	man ngag bzhin du shes par bya //	man_0 ngag_4 bzhin_9 du_15 shes_18 ba_23 byed_27 
T02D1550:198a-46	tsa sa'i bar na gnas pa blang //	tsa_0 sa_4 ba_9 na_13 gnas_16 ba_21 blang_24 
T02D1550:198a-47	bha 'og gi stan na 'og sbyar //	bha_0 'og_4 gi_8 stan_11 na_16 'og_19 sbyor_23 
T02D1550:198a-48	de bzhin tsha yi gong ma zung //	de_0 bzhin_3 tsha_9 yi_14 gong_17 ma_22 zung_25 
T02D1550:198a-49	de bzhin ta yi steng mas brgyan //	de_0 bzhin_3 ta_9 yi_12 steng_15 mas_21 rgyan_25 
T02D1550:198a-50	tha yi steng mas na 'og brgyan //	tha_0 yi_4 steng_7 mas_13 na_17 'og_20 rgyan_24 
T02D1550:198a-51	pha yi 'og gnas yi ge blang //	pha_0 yi_4 'og_7 gnas_11 yi_16 ge_19 blang_22 
T02D1550:198a-52	dha ba bar gnas yi ge blang //	dha_0 ba_4 ba_7 gnas_11 yi_16 ge_19 blang_22 
T02D1550:198a-53	tha yi 'og mas brgyan pha nyid //	tha_0 yi_4 'og_7 mas_11 rgyan_15 pha_22 nyid_26 
T02D1550:198a-54	yi ge nya la'i bar gnas pa //	yi_0 ge_3 nya_6 la_10 ba_15 gnas_19 ba_24 
T02D1550:198a-55	na yi gong mas brgyan par bya //	na_0 yi_3 gong_6 mas_11 rgyan_15 ba_22 byed_26 
T02D1550:198a-56	sa'i bar gnas yi ge la /	sa_0 ba_5 gnas_9 yi_14 ge_17 la_20 
T02D1550:198a-57	r'i yi 'og ma gdangs par bya //	r_0 yi_4 'og_7 ma_11 gdang_14 ba_21 byed_25 
T02D1550:198a-58	thig le n'a da mnyam ldan pa //	thig_0 le_5 n_8 da_12 mnyam_15 ldan_21 ba_26 
T02D1550:198b-0	gsum @198b 'gyur du ni dbye ba nyid //	gsum_0 'gyur_11 du_17 ni_20 'byed_23 ba_28 nyid_31 
T02D1550:198b-1	na 'og ra yi 'og ma ni //	na_0 'og_3 ra_7 yi_10 'og_13 ma_17 ni_20 
T02D1550:198b-2	snga ma bzhin du sum 'gyur bya //	snga_0 ma_5 bzhin_8 du_14 sum_17 'gyur_21 byed_27 
T02D1550:198b-3	sha 'og sha yi mgo mas brgyan //	sha_0 'og_4 sha_8 yi_12 mgo_15 mas_19 rgyan_23 
T02D1550:198b-4	nya yi 'og na gnas pa sbyar //	nya_0 yi_4 'og_7 na_11 gnas_14 ba_19 sbyor_22 
T02D1550:198b-5	ma wa bar na gnas pa gzung //	ma_0 wa_3 ba_6 na_10 gnas_13 ba_18 gzung_21 
T02D1550:198b-6	dzha yig gdong mas rnam par brgyan //	dzha_0 yig_5 gdong_9 mas_15 rnam_19 ba_24 rgyan_28 
T02D1550:198b-7	bla ma'i man ngag lam gyis ni //	bla_0 ma_4 man_9 ngag_13 lam_18 gyis_22 ni_27 
T02D1550:198b-8	sngags btu ba ni shes par bya //	sngags_0 'thu_7 ba_11 ni_14 shes_17 ba_22 byed_26 
T02D1550:198b-9	glegs bam klog pa'i sngags pa yis //	glegs_0 bam_6 klog_10 ba_15 sngags_20 ba_27 yis_30 
T02D1550:198b-10	ji lta'i rim pa spangs pa yis //	ji_0 lta_3 rim_9 ba_13 spong_16 ba_23 yis_26 
T02D1550:198b-11	gang des bskal ba bye bar byas //	gang_0 des_5 bskal_9 ba_15 'bye_18 ba_22 byed_26 
T02D1550:198b-12	dngos grub go 'phang mi thob pa //	dngos_0 'grub_6 go_11 'phen_14 mi_21 'thob_24 ba_29 
T02D1550:198b-13	gzhan yang rab tu bshad bya ba //	gzhan_0 yang_6 rab_11 tu_15 'chad_18 byed_24 ba_28 
T02D1550:198b-14	rdo rje can gyi mchod pa ni //	rdo_0 rje_4 can_8 gyi_12 mchod_16 ba_22 ni_25 
T02D1550:198b-15	tshes bcu'i dus su khyad par du //	tshes_0 'chu_6 dus_12 su_16 khyad_19 ba_25 du_29 
T02D1550:198b-16	mchod pa lnga dang ldan gyur cing //	mchod_0 ba_6 lnga_9 dang_14 ldan_19 gyur_24 cing_29 
T02D1550:198b-17	bza' ston de bzhin btung ba dang //	bza'_0 ston_5 de_10 bzhin_13 'thung_19 ba_25 dang_28 
T02D1550:198b-18	phyi dang gsang bar bcas par ldan //	phyi_0 dang_5 gsang_10 ba_16 'cha'_20 ba_25 ldan_29 
T02D1550:198b-19	snod ni dri med sbyangs pa ru //	snod_0 ni_5 'dri_8 med_12 sbyong_16 ba_24 ru_27 
T02D1550:198b-20	gur kum la sogs sbyar bar bya //	gur_0 kum_4 la_8 sogs_11 sbyor_16 ba_22 byed_26 
T02D1550:198b-21	chu bzang po dang ldan pa la //	chu_0 bzang_4 po_10 dang_13 ldan_18 ba_23 la_26 
T02D1550:198b-22	sindhu ra'i phye ma btsags //	sindhu_0 ra_7 'byed_12 ma_17 btsags_20 
T02D1550:198b-23	gser gyi smyu gu'i sbyor ba yis //	gser_0 gyi_5 smyu_9 gu_14 sbyor_19 ba_25 yis_28 
T02D1550:198b-24	blo dang ldan pas ae dbyibs bris //	blo_0 dang_4 ldan_9 ba_14 ae_18 dbyibs_21 'bri_28 
T02D1550:198b-25	dbus su sngags kyi rgyal po ni //	dbus_0 su_5 sngags_8 kyi_15 rgyal_19 po_25 ni_28 
T02D1550:198b-26	rim pa bzhin du bri bar bya //	rim_0 ba_4 bzhin_7 du_13 'bri_16 ba_20 byed_24 
T02D1550:198b-27	g-yung drung 'khyil ba'i phyag rgya ni //	g-yung_0 drung_7 'khyil_13 ba_20 phyag_25 rgya_31 ni_36 
T02D1550:198b-28	dge ba'i 'khor lo'i logs la dgod //	dge_0 ba_4 'khor_9 lo_15 logs_20 la_25 'god_28 
T02D1550:198b-29	me tog rnam pa sna tshogs nyid //	me_0 tog_3 rnam_7 ba_12 sna_15 tshogs_19 nyid_26 
T02D1550:198b-30	chu las skyes dang thang las skyes //	chu_0 las_4 skye_8 dang_14 thang_19 las_25 skye_29 
T02D1550:198b-31	mar me ts'a ru dam tshig che //	mar_0 me_4 ts_7 ru_12 dam_15 tshig_19 che_25 
T02D1550:198b-32	de bzhin gzhon nu ma yang mchod //	de_0 bzhin_3 gzhon_9 nu_15 ma_18 yang_21 mchod_26 
T02D1550:198b-33	mchod pa'i khyad par 'di dag ni //	mchod_0 ba_6 khyad_11 ba_17 'di_21 'dag_25 ni_29 
T02D1550:198b-34	nges pa nyid du bya ba yin //	nges_0 ba_5 nyid_8 du_13 byed_16 ba_20 yin_23 
T02D1550:198b-35	skra grol gcer bur byas nas ni //	skra_0 grol_5 bcer_10 bur_15 byed_19 nas_24 ni_28 
T02D1550:198b-36	sdar bshad phyogs bcu bltas nas kyang //	sdar_0 'chad_5 phyogs_11 'chu_18 lta_22 nas_28 kyang_32 
T02D1550:198b-37	shin tu gsang bar bya ba nyid //	shin_0 tu_5 gsang_8 ba_14 byed_18 ba_22 nyid_25 
T02D1550:198b-38	mchod pa'i dus su mnyam par gzhag //	mchod_0 ba_6 dus_11 su_15 mnyam_18 ba_24 'jog_28 
T02D1550:198b-39	ma gsang bgegs ni skye 'gyur te //	ma_0 gsang_3 bgegs_9 ni_15 skye_18 'gyur_23 te_29 
T02D1550:198b-40	dngos grub de bzhin nyams par 'gyur //	dngos_0 'grub_6 de_11 bzhin_14 nyams_20 ba_26 'gyur_30 
T02D1550:198b-41	dam tshig nyams par gyur pa na //	dam_0 tshig_4 nyams_10 ba_16 gyur_20 ba_25 na_28 
T02D1550:198b-42	nad rnams sna tshogs 'byung bar 'gyur //	nad_0 rnams_4 sna_10 tshogs_14 'byung_21 ba_28 'gyur_32 
T02D1550:198b-43	srog ni gtong bar gyur pa yis //	srog_0 ni_5 gtong_8 ba_14 gyur_18 ba_23 yis_26 
T02D1550:198b-44	'chi ba'i dus la bab kyang bla'i //	'chi_0 ba_5 dus_10 la_14 'bab_17 kyang_21 bla_27 
T02D1550:198b-45	gal te dngos grub mchog 'dod na //	gal_0 te_4 dngos_7 'grub_13 mchog_18 'dod_24 na_29 
T02D1550:198b-46	dam tshig rtag tu bsrung bar bya //	dam_0 tshig_4 rtag_10 tu_15 bsrung_18 ba_25 byed_29 
T02D1550:198b-47	khams gsum brtan dang g-yo ba yis //	khams_0 gsum_6 brtan_11 dang_17 g-yo_22 ba_27 yis_30 
T02D1550:198b-48	'gro ba thams cad g-yon nas 'byung //	'gro_0 ba_5 thams_8 cad_14 g-yon_18 nas_24 'byung_28 
T02D1550:198b-49	g-yon pa sngon du bskyod bya ste ;	g-yon_0 ba_6 sngon_9 du_15 skyod_18 byed_25 ste_29 
T02D1550:198b-50	/ rnal 'byor rtag tu g-yon pas spyad //	rnal_2 'byor_7 rtag_13 tu_18 g-yon_21 ba_27 spyod_31 
T02D1550:198b-51	mchod pa lag pa g-yon pas ta //	mchod_0 ba_6 lag_9 ba_13 g-yon_16 ba_22 ta_26 
T02D1550:198b-52	bza' btung g-yon pas bya ba nyid //	bza'_0 'thung_5 g-yon_11 ba_17 byed_21 ba_25 nyid_28 
T02D1550:198b-53	rigs lnga la ni kun spyod pa //	rigs_0 lnga_5 la_10 ni_13 kun_16 spyod_20 ba_26 
T02D1550:198b-54	rigs gcig tu ni brtag par bya //	rigs_0 gcig_5 tu_10 ni_13 rtog_16 ba_22 byed_26 
T02D1550:198b-55	bza' dang bza' min de bzhin btung //	bza'_0 dang_5 bza'_10 min_15 de_19 bzhin_22 'thung_28 
T02D1550:198b-56	sme gtsang ngo tsha rnam par spangs //	sme_0 gtsang_4 ngo_11 tsha_15 rnam_20 ba_25 spong_29 
T02D1550:199a-0	rtog pa kun las nges par @199a * //	rtogs_0 ba_5 kun_8 las_12 nges_16 ba_21 
T02D1550:199a-1	grol ;	grol_0 
T02D1550:199a-2	/ rtsod pa thams cad rnam par spangs //	rtsod_2 ba_8 thams_11 cad_17 rnam_21 ba_26 spong_30 
T02D1550:199a-3	mkha' 'gro ma yi dra ba sdom //	mkha'_0 'gro_6 ma_11 yi_14 'dra_17 ba_21 sdom_24 
T02D1550:199a-4	dpa' bo seng ge bzhin du spyod //	dpa'_0 'bo_5 seng_8 ge_13 bzhin_16 du_22 spyod_25 
T02D1550:199a-5	sngags ni rnal 'byor ma'i rang bzhin //	sngags_0 ni_7 rnal_10 'byor_15 ma_21 rang_26 bzhin_31 
T02D1550:199a-6	rnal 'byor ma ni sngags kyi gzugs //	rnal_0 'byor_5 ma_11 ni_14 sngags_17 kyi_24 gzugs_28 
T02D1550:199a-7	gal te go 'phang mchog 'dod na //	gal_0 te_4 go_7 'phen_10 mchog_17 'dod_23 na_28 
T02D1550:199a-8	de dag tha dad par mi bya //	de_0 'dag_3 tha_7 dad_11 ba_15 mi_19 byed_22 
T02D1550:199a-9	mi yis gang dang gang bsgom pa //	mi_0 yis_3 gang_7 dang_12 gang_17 bsgom_22 ba_28 
T02D1550:199a-10	yid dang yang dag ldan byas nas //	yid_0 dang_4 yang_9 'dag_14 ldan_18 byed_23 nas_28 
T02D1550:199a-11	des na de yi bdag nyid 'gyur //	des_0 na_4 de_7 yi_10 bdag_13 nyid_18 'gyur_23 
T02D1550:199a-12	sna tshogs nor bu ji bzhin no //	sna_0 tshogs_4 nor_11 bu_15 ji_18 bzhin_21 no_27 
T02D1550:199a-13	sems dang rjes mthun rnal 'byor gyis //	sems_0 dang_5 rjes_10 mthun_15 rnal_21 'byor_26 gyis_32 
T02D1550:199a-14	gang zhig shin tu goms byed na //	gang_0 'jig_5 shin_10 tu_15 goms_18 byed_23 na_28 
T02D1550:199a-15	mi gang bsod nams dman pa yang //	mi_0 gang_3 bsod_8 nams_13 dman_18 ba_23 yang_26 
T02D1550:199a-16	de ni grub 'gyur the tshom med //	de_0 ni_3 'grub_6 'gyur_11 the_17 tshom_21 med_27 
T02D1550:199a-17	bla ma sangs rgyas bla ma chos //	bla_0 ma_4 sangs_7 rgya_13 bla_19 ma_23 chos_26 
T02D1550:199a-18	de bzhin bal ma dge 'dun te //	de_0 bzhin_3 bal_9 ma_13 dge_16 'dun_20 te_25 
T02D1550:199a-19	bla ma dpal ldan rdo rje can //	bla_0 ma_4 dpal_7 ldan_12 rdo_17 rje_21 can_25 
T02D1550:199a-20	'dir ni bla ma bla med pa'o //	'dir_0 ni_5 bla_8 ma_12 bla_15 med_19 ba_23 
T02D1550:199a-21	sangs rgyas 'bras bu 'dod pa yin //	sangs_0 rgya_6 'bras_12 bu_18 'dod_21 ba_26 yin_29 
T02D1550:199a-22	de phyir bla ma bsnyen bkur bya //	de_0 phyir_3 bla_9 ma_13 snyen_16 bkur_23 byed_28 
T02D1550:199a-23	dpal dang ldan pa'i rub tu sngags pa'i gnas au	dpal_0 dang_5 ldan_10 ba_15 rub_20 tu_24 sngags_27 ba_34 gnas_39 au_44 
T02D1550:199a-24	rgyan nas byung ba'i dgongs pa bla na med pa	rgyan_0 nas_6 'byung_10 ba_16 dgongs_21 ba_28 bla_31 na_35 med_38 ba_42 
T02D1550:199a-25	dpa' rdo rje rnal 'byor ma'i gsang chen rna ba	dpa'_0 rdo_5 rje_9 rnal_13 'byor_18 ma_24 gsang_29 chen_35 rna_40 ba_44 
T02D1550:199a-26	nas rna ba ru zhal nas zhal du brgyud pa'i	nas_0 rna_4 ba_8 ru_11 zhal_14 nas_19 zhal_23 du_28 brgyud_31 ba_38 
T02D1550:199a-27	rim pa rdzogs so /	rim_0 ba_4 rdzogs_7 so_14 
T02D1550:199a-29	// / rgya gar gyi mkhan po bsod nams 'byung gnas bzang po'i zhal snga nas dang /	rgya_5 gar_10 gyi_14 mkhan_18 po_24 bsod_27 nams_32 'byung_37 gnas_44 bzang_49 po_55 zhal_60 snga_65 nas_70 dang_74 
T02D1550:199a-30	bod kyi lo ts'a ba rma ban chos 'bar gyis bsgyur ba'o//	'bod_0 kyi_4 lo_8 ts_11 ba_16 rma_19 ban_23 chos_27 'bar_32 gyis_37 sgyur_42 
