T02D2681:188b-32	bo dha bo dha zhes pa ni khams gsum gyi	'bo_0 dha_3 'bo_7 dha_10 zhes_14 ba_19 ni_22 khams_25 gsum_31 gyi_36 
T02D2681:188b-33	sems can thams cad byang chub tu sems bskyed cig	sems_0 can_5 thams_9 cad_15 byang_19 chub_25 tu_30 sems_33 skyed_38 cig_45 
T02D2681:188b-34	ces pa'o // sam bodha ya sam bodha ya zhes	ces_0 ba_4 sam_12 bodha_16 ya_22 sam_25 bodha_29 ya_35 zhes_38 
T02D2681:188b-35	pa ni 'gro ba thams cad khongs su chud par	ba_0 ni_3 'gro_6 ba_11 thams_14 cad_20 khongs_24 su_31 chud_34 ba_39 
T02D2681:188b-36	mdzod cig gces pa'o //	mdzod_0 cig_6 gces_10 ba_15 
T02D2681:188b-37	bhra ma bhra ma zhes pa ni byang chub sems	bhra_0 ma_5 bhra_8 ma_13 zhes_16 ba_21 ni_24 byang_27 chub_33 sems_38 
T02D2681:188b-38	dang mi ldan pa'i bgegs thams cad sod cig ces	dang_0 mi_5 ldan_8 ba_13 bgegs_18 thams_24 cad_30 sod_34 cig_38 ces_42 
T02D2681:188b-39	pa'o // sam bhra ma ya sam bhra ma ya	ba_0 sam_8 bhra_12 ma_17 ya_20 sam_23 bhra_27 ma_32 ya_35 
T02D2681:188b-40	zhes pa ni phyin ci log gi nyon mongs pa	zhes_0 ba_5 ni_8 phyin_11 ci_17 log_20 gi_24 nyon_27 mongs_32 ba_38 
T02D2681:188b-41	thams cad thugs rjes legs par sod cig ces pa'o	thams_0 cad_6 thugs_10 rjes_16 legs_21 ba_26 sod_30 cig_34 ces_38 ba_42 
T02D2681:188b-42	pa'o // // sarba bh'u ta ni zhes pa ni	ba_0 sarba_11 bh_17 ta_22 ni_25 zhes_28 ba_33 ni_36 
T02D2681:189a-0	gdon dang 'byung po thams cad gtubs la thugs @189a	'don_0 dang_5 'byung_10 po_17 thams_20 cad_26 gtub_30 la_36 thugs_39 
T02D2681:189a-1	pa'o // // * // ye shes kyi spyan gyis gzigs shig ces pa'o //	ba_0 ye_16 shes_19 kyi_24 spyan_28 gyis_34 gzigs_39 shig_45 ces_50 ba_54 
T02D2681:189a-2	ku ta ku ta zhes pa ni bdag la gnod pa'i gdon thams cad rdungs shig ces pa'o //	ku_0 ta_3 ku_6 ta_9 zhes_12 ba_17 ni_20 bdag_23 la_28 gnod_31 ba_36 'don_41 thams_46 cad_52 rdungs_56 shig_63 ces_68 ba_72 
T02D2681:189a-3	sam ku ta ya sam ku ta ya zhes pa	sam_0 ku_4 ta_7 ya_10 sam_13 ku_17 ta_20 ya_23 zhes_26 ba_31 
T02D2681:189a-4	ni 'jig rten na gnod pa byed pa thams cad	ni_0 'jig_3 rten_8 na_13 gnod_16 ba_21 byed_24 ba_29 thams_32 cad_38 
T02D2681:189a-5	byams pa'i thugs rjes rdungs shig ces pa'o ;	byams_0 ba_6 thugs_11 rjes_17 rdungs_22 shig_29 ces_34 ba_38 
T02D2681:189a-6	/ sarba sha tr'u n'am zhes pa ni bdag la	sarba_2 sha_8 tr_12 n_17 zhes_22 ba_27 ni_30 bdag_33 la_38 
T02D2681:189a-7	gnod pa'i dgra bgegs thams cad yang dag pa'i ye	gnod_0 ba_5 dgra_10 bgegs_15 thams_21 cad_27 yang_31 'dag_36 ba_40 ye_45 
T02D2681:189a-8	shes kyis sregs shig ces pa'o //	shes_0 kyis_5 sregs_10 shig_16 ces_21 ba_25 
T02D2681:189a-9	gha ta gha ta zhes pa ni bgegs thams cad thugs rjes sod cig ces pa'o //	gha_0 ta_4 gha_7 ta_11 zhes_14 ba_19 ni_22 bgegs_25 thams_31 cad_37 thugs_41 rjes_47 sod_52 cig_56 ces_60 ba_64 
T02D2681:189a-10	sam gha ta ya sam gha ta ya zhes pa ni legs par sod cig ces pa'o //	sam_0 gha_4 ta_8 ya_11 sam_14 gha_18 ta_22 ya_25 zhes_28 ba_33 ni_36 legs_39 ba_44 sod_48 cig_52 ces_56 ba_60 
T02D2681:189a-11	sarba bidy'i badzra badzra zhes pa ni /	sarba_0 bidy_6 badzra_13 badzra_20 zhes_27 ba_32 ni_35 
T02D2681:189a-12	rig sngags kyi mthu gang la bya ba thams cad rdo rje 'bar bas 'grub par gyis shig pa'o //	rig_0 sngags_4 kyi_11 mthu_15 gang_20 la_25 byed_28 ba_32 thams_35 cad_41 rdo_45 rje_49 'bar_53 ba_58 'grub_62 ba_68 gyis_72 shig_77 ba_82 
T02D2681:189a-13	sphot ya badzra badzra zhes pa ni ye shes kyi	sphot_0 ya_6 badzra_9 badzra_16 zhes_23 ba_28 ni_31 ye_34 shes_37 kyi_42 
T02D2681:189a-14	rdo rje 'bar bas nyon mongs pa thams cad sod	rdo_0 rje_4 'bar_8 ba_13 nyon_17 mongs_22 ba_28 thams_31 cad_37 sod_41 
T02D2681:189a-15	cig ces pa'o / ka ta badzra badzra zhes pa	cig_0 ces_4 ba_8 ka_15 ta_18 badzra_21 badzra_28 zhes_35 ba_40 
T02D2681:189a-16	ni ye shes grub pa'i rdo rje 'bar bas nyon	ni_0 ye_3 shes_6 'grub_11 ba_16 rdo_21 rje_25 'bar_29 ba_34 nyon_38 
T02D2681:189a-17	mongs pa thams cad chod cig ces pa'o //	mongs_0 ba_6 thams_9 cad_15 chod_19 cig_24 ces_28 ba_32 
T02D2681:189a-18	ma ta badzra badzra zhes pa ni byang chub kyi	ma_0 ta_3 badzra_6 badzra_13 zhes_20 ba_25 ni_28 byang_31 chub_37 kyi_42 
T02D2681:189a-19	sems kyi rdo rjes bdag gi gdug pa thams cad	sems_0 kyi_5 rdo_9 rjes_13 bdag_18 gi_23 gdug_26 ba_31 thams_34 cad_40 
T02D2681:189a-20	gtubs shing ces pa'o //	gtub_0 shing_6 ces_12 ba_16 
T02D2681:189a-21	ma tha badzra badzra zhes pa ni yang dag pa'i	ma_0 tha_3 badzra_7 badzra_14 zhes_21 ba_26 ni_29 yang_32 'dag_37 ba_41 
T02D2681:189a-22	ye shes kyi rdo rjes bgegs thams cad thul cig	ye_0 shes_3 kyi_8 rdo_12 rjes_16 bgegs_21 thams_27 cad_33 thul_37 cig_42 
T02D2681:189a-23	ces pa'o // aatta h'a sa n'i la ya badzra	ces_0 ba_4 aatta_12 h_18 sa_22 n_25 la_29 ya_32 badzra_35 
T02D2681:189a-24	zhes pa ni rdo rje rnon po rnon po me	zhes_0 ba_5 ni_8 rdo_11 rje_15 rnon_19 po_24 rnon_27 po_32 me_35 
T02D2681:189a-25	dang 'dra bas nyon mongs pa'i bag chags thams cad	dang_0 'dra_5 ba_10 nyon_14 mongs_19 ba_25 bag_30 chags_34 thams_40 cad_46 
T02D2681:189a-26	chod cig drol cig ces pa'o //	chod_0 cig_5 drol_9 cig_14 ces_18 ba_22 
T02D2681:189a-27	su badzra badzra sv'ah'a zhes pa ni thugs yang dag	su_0 badzra_3 badzra_10 sv'a_17 zhes_25 ba_30 ni_33 thugs_36 yang_42 'dag_47 
T02D2681:189a-28	par mkhyen pa'i rdo rjes chos kyi dbyings rnam par	ba_0 mkhyen_4 ba_11 rdo_16 rjes_20 chos_25 kyi_30 dbyings_34 rnam_42 ba_47 
T02D2681:189a-29	dag pa la legs par spyod cig ces pa'o /	'dag_0 ba_4 la_7 legs_10 ba_15 spyod_19 cig_25 ces_29 ba_33 
T02D2681:189a-30	de yan chad kyis phyag na rdo rje'i phrin las	de_0 yan_3 'chad_7 kyis_12 phyag_17 na_23 rdo_26 rje_30 phrin_36 las_42 
T02D2681:189a-31	kyi don bshad nas da ni khro bo rnams kyi	kyi_0 don_4 'chad_8 nas_14 da_18 ni_21 khro_24 'bo_29 rnams_32 kyi_38 
T02D2681:189a-32	phrin las kyi don ston te /	phrin_0 las_6 kyi_10 don_14 ston_18 te_23 
T02D2681:189a-33	he phul lu ni ru phullu zhes pa ni /	he_0 'bul_3 lu_8 ni_11 ru_14 phullu_17 zhes_24 ba_29 ni_32 
T02D2681:189a-34	rdo rje 'bar ba khams gsum pa'i nyon mongs pa rnams thugs rje 'bar bas chod cig ces pa'o //	rdo_0 rje_4 'bar_8 ba_13 khams_16 gsum_22 ba_27 nyon_32 mongs_37 ba_43 rnams_46 thugs_52 rje_58 'bar_62 ba_67 chod_71 cig_76 ces_80 ba_84 
T02D2681:189a-35	grihna kullu zhes pa ni khams gsum gyi sems can	grihna_0 kullu_7 zhes_13 ba_18 ni_21 khams_24 gsum_30 gyi_35 sems_39 can_44 
T02D2681:189a-36	thams cad kyi gshin rje'i sdug bsngal thams cad choms	thams_0 cad_6 kyi_10 gshin_14 rje_20 sdug_26 sngal_31 thams_38 cad_44 choms_48 
T02D2681:189a-37	shig ces pa'o // mi lu tsullu ku ru ku	shig_0 ces_5 ba_9 mi_17 lu_20 tsullu_23 ku_30 ru_33 ku_36 
T02D2681:189a-38	lu zhes pa ni dpal rta mgrin sngon po 'bar	lu_0 zhes_3 ba_8 ni_11 dpal_14 rta_19 mgrin_23 sngon_29 po_35 'bar_38 
T02D2681:189a-39	bas sdug bsngal thams cad spyod shig ces pa'o //	ba_0 sdug_4 sngal_9 thams_16 cad_22 spyod_26 shig_32 ces_37 ba_41 
T02D2681:189a-40	badzra bi dza ya sv'a h'a zhes pa ni khro	badzra_0 bi_7 dza_10 ya_14 sv_17 h_22 zhes_26 ba_31 ni_34 khro_37 
T02D2681:189b-0	bo bdud rtsi 'khyil bas nyon mongs pa thams @189b	'bo_0 bdud_3 rtsi_8 'khyil_13 ba_20 nyon_24 mongs_29 ba_35 thams_38 
T02D2681:189b-1	cad bdud rtsir byin gyis rlobs shig ces pa'o //	cad_0 bdud_4 rtsir_9 byin_15 gyis_20 rlobs_25 shig_31 ces_36 ba_40 
T02D2681:189b-2	k'i li k'i l'a la sv'ah'a zhes pa ni khro	k_0 li_4 k_7 l_11 la_15 sv'a_18 zhes_26 ba_31 ni_34 khro_37 
T02D2681:189b-3	bo stobs po che'i drag shul gyis mdzod cig ces	'bo_0 stobs_3 po_9 che_12 drag_18 shul_23 gyis_28 mdzod_33 cig_39 ces_43 
T02D2681:189b-4	pa'o // ka ta ka ta zhes pa ni khro	ba_0 ka_8 ta_11 ka_14 ta_17 zhes_20 ba_25 ni_28 khro_31 
T02D2681:189b-5	bo rgyal pos bdud thams cad pa bkongs shig ces	'bo_0 rgyal_3 pos_9 bdud_13 thams_18 cad_24 ba_28 bkong_31 shig_38 ces_43 
T02D2681:189b-6	pa'o // pa'o // ma ta ma ta zhes pa	ba_0 ba_8 ma_16 ta_19 ma_22 ta_25 zhes_28 ba_33 
T02D2681:189b-7	ni khro bo h'um ka ras nyon mongs pa thams	ni_0 khro_3 'bo_8 h_11 ka_16 ras_19 nyon_23 mongs_28 ba_34 thams_37 
T02D2681:189b-8	cad las skyobs shig ces pa'o //	cad_0 las_4 skyobs_8 shig_15 ces_20 ba_24 
T02D2681:189b-9	ra ta ra ta zhes pa ni khro bo padma	ra_0 ta_3 ra_6 ta_9 zhes_12 ba_17 ni_20 khro_23 'bo_28 padma_31 
T02D2681:189b-10	'khyil bas nyon mongs pa thams cad zhi bar mdzod	'khyil_0 ba_7 nyon_11 mongs_16 ba_22 thams_25 cad_31 zhi_35 ba_39 mdzod_43 
T02D2681:189b-11	cig ces pa'o // mo ta mo ta phra mo	cig_0 ces_4 ba_8 mo_16 ta_19 mo_22 ta_25 phra_28 mo_33 
T02D2681:189b-12	ta na ya sv'ah'a zhes pa ni ye shes kyi	ta_0 na_3 ya_6 sv'a_9 zhes_17 ba_22 ni_25 ye_28 shes_31 kyi_36 
T02D2681:189b-13	rdo rje 'bar bas gshin rje rtogs shig ces pa'o	rdo_0 rje_4 'bar_8 ba_13 gshin_17 rje_23 rtogs_27 shig_33 ces_38 ba_42 
T02D2681:189b-14	cig ces pa'o // // tsa ra ni tsa ra	cig_0 ces_4 ba_8 tsa_19 ra_23 ni_26 tsa_29 ra_33 
T02D2681:189b-15	zhes pa ni khro bo'i rgyal po n'i la dandas	zhes_0 ba_5 ni_8 khro_11 'bo_16 rgyal_21 po_27 n_30 la_34 dandas_37 
T02D2681:189b-16	bdag dang sems can thams cad la tshe dang dbang	bdag_0 dang_5 sems_10 can_15 thams_19 cad_25 la_29 tshe_32 dang_37 dbang_42 
T02D2681:189b-17	stsol cig ces pa'o //	stsol_0 cig_6 ces_10 ba_14 
T02D2681:189b-18	ha ra ha ra zhes pa ni ye shes kyi	ha_0 ra_3 ha_6 ra_9 zhes_12 ba_17 ni_20 ye_23 shes_26 kyi_31 
T02D2681:189b-19	gshog pas 'khor ba'i sdug bsngal las skyobs shig ces	gshog_0 ba_6 'khor_10 ba_16 sdug_21 sngal_26 las_33 skyobs_37 shig_44 ces_49 
T02D2681:189b-20	pa'o // sa ra sa ra m'a ra ya m'a	ba_0 sa_8 ra_11 sa_14 ra_17 m_20 ra_24 ya_27 m_30 
T02D2681:189b-21	ra ya zhes pa ni ye shes kyi rdo rjes	ra_0 ya_3 zhes_6 ba_11 ni_14 ye_17 shes_20 kyi_25 rdo_29 rjes_33 
T02D2681:189b-22	nyon mongs pa rnams sod la rdul du rlog cig	nyon_0 mongs_5 ba_11 rnams_14 sod_20 la_24 rdul_27 du_32 rlog_35 cig_40 
T02D2681:189b-23	pa'o // ces pa'o // badzra bi d'a ra na	ba_0 ces_8 ba_12 badzra_20 bi_27 d_30 ra_34 na_37 
T02D2681:189b-24	ya sv'ah'a zhes pas rdo rje rnam par 'joms pas	ya_0 sv'a_3 zhes_11 ba_16 rdo_20 rje_24 rnam_28 ba_33 'joms_37 ba_43 
T02D2681:189b-25	sems can thams cad kyi las mdzod cig ces pa'o	sems_0 can_5 thams_9 cad_15 kyi_19 las_23 mdzod_27 cig_33 ces_37 ba_41 
T02D2681:189b-26	pa'o // ces pa'o // // tstshinda tstshinda zhes pa ni /	ba_0 ces_8 ba_12 tstshinda_23 tstshinda_33 zhes_43 ba_48 ni_51 
T02D2681:189b-27	rta mgrin gyis nyon mongs pa thams cad tshar chod cig ces pa'o //	rta_0 mgrin_4 gyis_10 nyon_15 mongs_20 ba_26 thams_29 cad_35 tshar_39 chod_45 cig_50 ces_54 ba_58 
T02D2681:189b-28	bhinda bhinda zhes pa ni //	bhinda_0 bhinda_7 zhes_14 ba_19 ni_22 
T02D2681:189b-29	sems can thams cad sdug bsngal ba zhi bar gyis shi ces pa'o //	sems_0 can_5 thams_9 cad_15 sdug_19 sngal_24 ba_31 zhi_34 ba_38 gyis_42 'chi_47 ces_51 ba_55 
T02D2681:189b-30	ma h'a k'i li k'i l'a ya sv'ah'a /	ma_0 h_3 k_7 li_11 k_14 l_18 ya_22 sv'a_25 
T02D2681:189b-31	zhes pa ni khro bo stobs po ches nyon mongs pa thams cad zhi bar mdzod cig ces pa'o //	zhes_0 ba_5 ni_8 khro_11 'bo_16 stobs_19 po_25 ches_28 nyon_33 mongs_38 ba_44 thams_47 cad_53 zhi_57 ba_61 mdzod_65 cig_71 ces_75 ba_79 
T02D2681:189b-32	ban dha ban dha zhes pa ni khro bo takki	ban_0 dha_4 ban_8 dha_12 zhes_16 ba_21 ni_24 khro_27 'bo_32 takki_35 
T02D2681:189b-33	r'a dzas gdug pa can gyi bdud thams cad zung	r_0 dzas_4 gdug_9 ba_14 can_17 gyi_21 bdud_25 thams_30 cad_36 zung_40 
T02D2681:189b-34	la choms shig ces pa'o //	la_0 choms_3 shig_9 ces_14 ba_18 
T02D2681:189b-35	kro dha kro dha zhes pa ni khro bo rnams	kro_0 dha_4 kro_8 dha_12 zhes_16 ba_21 ni_24 khro_27 'bo_32 rnams_35 
T02D2681:189b-36	kyis nyon mongs pa rnams la rol cig ces pa'o	kyis_0 nyon_5 mongs_10 ba_16 rnams_19 la_25 rol_28 cig_32 ces_36 ba_40 
T02D2681:189b-37	/ k'i li k'i l'a ya sv'a h'a zhes pa	k_2 li_6 k_9 l_13 ya_17 sv_20 h_25 zhes_29 ba_34 
T02D2681:189b-38	ni khro bo bdud rtsi 'khyil bas gdug pa rnams	ni_0 khro_3 'bo_8 bdud_11 rtsi_16 'khyil_21 ba_28 gdug_32 ba_37 rnams_40 
T02D2681:189b-39	zhi bar mdzod cig ces ba'o //	zhi_0 ba_4 mdzod_8 cig_14 ces_18 ba_22 
T02D2681:189b-40	tsu ru tsu ru zhes pa ni khro bo aa	tsu_0 ru_4 tsu_7 ru_11 zhes_14 ba_19 ni_22 khro_25 'bo_30 aa_33 
T02D2681:189b-41	mo gha p'a shas phrin las mdzod cig ces pa'o	mo_0 gha_3 p_7 shas_11 phrin_16 las_22 mdzod_26 cig_32 ces_36 ba_40 
T02D2681:189b-42	/ tsanda li zhes pa ni khro bo rgyal po tshur spyon dam tshig la dgongs shig ces pa'o //	tsanda_2 li_9 zhes_12 ba_17 ni_20 khro_23 'bo_28 rgyal_31 po_37 tshur_40 spyon_46 dam_52 tshig_56 la_62 dgongs_65 shig_72 ces_77 ba_81 
T02D2681:189b-43	k'i li k'i l'a ya sv'ah'a /	k_0 li_4 k_7 l_11 ya_15 sv'a_18 
T02D2681:189b-44	zhes pa ni khro bo bdud rtsi 'khyil ba'i thugs	zhes_0 ba_5 ni_8 khro_11 'bo_16 bdud_19 rtsi_24 'khyil_29 ba_36 thugs_41 
T02D2681:189b-45	tshad med pa'i gsung sgras thams cad byang chub sems	tshad_0 med_6 ba_10 gsung_15 sgras_21 thams_27 cad_33 byang_37 chub_43 sems_48 
T02D2681:189b-46	su zhi bar mdzod cig ces pa'o //	su_0 zhi_3 ba_7 mdzod_11 cig_17 ces_21 ba_25 
T02D2681:189b-47	tr'a sa ya tr'a sa ya zhes pa ni khro	tr_0 sa_5 ya_8 tr_11 sa_16 ya_19 zhes_22 ba_27 ni_30 khro_33 
T02D2681:190a-0	bo ma h'a ba las bgegs thams cad @190a *	'bo_0 ma_3 h_6 ba_10 las_13 bgegs_17 thams_23 cad_29 
T02D2681:190a-1	// skrod cig ces pa'o //	skrod_3 cig_9 ces_13 ba_17 
T02D2681:190a-2	badzra k'i li k'i l'a ya sv'ah'a zhes pa ni	badzra_0 k_7 li_11 k_14 l_18 ya_22 sv'a_25 zhes_33 ba_38 ni_41 
T02D2681:190a-3	ye shes kyi rdo rje 'bar bas thams cad zhi	ye_0 shes_3 kyi_8 rdo_12 rje_16 'bar_20 ba_25 thams_29 cad_35 zhi_39 
T02D2681:190a-4	bar mdzod cig ces pa'o //	ba_0 mdzod_4 cig_10 ces_14 ba_18 
T02D2681:190a-5	ha ra ha ra badzra dha r'a ya sv'a h'a	ha_0 ra_3 ha_6 ra_9 badzra_12 dha_19 r_23 ya_27 sv_30 h_35 
T02D2681:190a-6	zhes pa ni rdo rje 'bar ba'i sgo bzhis bgegs	zhes_0 ba_5 ni_8 rdo_11 rje_15 'bar_19 ba_24 sgo_29 bzhis_33 bgegs_39 
T02D2681:190a-7	thams cad sregs shig ces pa'o //	thams_0 cad_6 sregs_10 shig_16 ces_21 ba_25 
T02D2681:190a-8	pra ha ra pra ha ra zhes pa ni khro	pra_0 ha_4 ra_7 pra_10 ha_14 ra_17 zhes_20 ba_25 ni_28 khro_31 
T02D2681:190a-9	bo bdud rtsi 'khyil bas mtshan ma'i rtog pa thams	'bo_0 bdud_3 rtsi_8 'khyil_13 ba_20 mtshan_24 ma_31 rtogs_36 ba_41 thams_44 
T02D2681:190a-10	cad zhi bar mdzod cig ces pa'o //	cad_0 zhi_4 ba_8 mdzod_12 cig_18 ces_22 ba_26 
T02D2681:190a-11	badzra pra bhanydza n'a ya sv'ah'a zhes pa ni byang	badzra_0 pra_7 bhanydza_11 n_20 ya_24 sv'a_27 zhes_35 ba_40 ni_43 byang_46 
T02D2681:190a-12	chub kyi sems rdo rje 'bar bas nyon mongs pa'i	chub_0 kyi_5 sems_9 rdo_14 rje_18 'bar_22 ba_27 nyon_31 mongs_36 ba_42 
T02D2681:190a-13	bag chags thams cad zhi bar mdzod cig ces pa'o	bag_0 chags_4 thams_10 cad_16 zhi_20 ba_24 mdzod_28 cig_34 ces_38 ba_42 
T02D2681:190a-14	// de yan chad kyis ni khro bo rnams kyi phrin las kyi don bshad do //	de_3 yan_6 'chad_10 kyis_15 ni_20 khro_23 'bo_28 rnams_31 kyi_37 phrin_41 las_47 kyi_51 don_55 'chad_59 do_65 
T02D2681:190a-15	da ni khro bo rnams kyi bsrung ba'i don ston te /	da_0 ni_3 khro_6 'bo_11 rnams_14 kyi_20 bsrung_24 ba_31 don_36 ston_40 te_45 
T02D2681:190a-16	ma tisthir badzra zhes pa ni blo brtan pa'i rdo	ma_0 tisthir_3 badzra_11 zhes_18 ba_23 ni_26 blo_29 brtan_33 ba_39 rdo_44 
T02D2681:190a-17	rjes byang chub sems kyi rang bzhin dang ldan par	rjes_0 byang_5 chub_11 sems_16 kyi_21 rang_25 bzhin_30 dang_36 ldan_41 ba_46 
T02D2681:190a-18	gyis shig ces pa'o //	gyis_0 shig_5 ces_10 ba_14 
T02D2681:190a-19	su ti shtir badzra zhes pa ni shin tu brtan	su_0 ti_3 shtir_6 badzra_12 zhes_19 ba_24 ni_27 shin_30 tu_35 brtan_38 
T02D2681:190a-20	pa'i rdo rjes la legs pa'i yon tan dang ldan	ba_0 rdo_5 rjes_9 la_14 legs_17 ba_22 yon_27 tan_31 dang_35 ldan_40 
T02D2681:190a-21	par 'gyur cig ces pa'o //	ba_0 'gyur_4 cig_10 ces_14 ba_18 
T02D2681:190a-22	pra tisthir badzra zhes pa ni so sor brtan pa'i	pra_0 tisthir_4 badzra_12 zhes_19 ba_24 ni_27 so_30 sor_33 brtan_37 ba_43 
T02D2681:190a-23	rdo rjes bdag gi lus brten par mdzod cig ces	rdo_0 rjes_4 bdag_9 gi_14 lus_17 rten_21 ba_27 mdzod_31 cig_37 ces_41 
T02D2681:190a-24	pa'o // ma h'a badzra zhes pa ni chen po rdo rjes bdud las rgyal bar mdzod ces pa'o //	ba_0 ma_8 h_11 badzra_15 zhes_22 ba_27 ni_30 chen_33 po_38 rdo_41 rjes_45 bdud_50 las_55 rgyal_59 ba_65 mdzod_69 ces_75 ba_79 
T02D2681:190a-25	aa pra ti ha ha badzra zhes pa ni rab	aa_0 pra_3 ti_7 ha_10 ha_13 badzra_16 zhes_23 ba_28 ni_31 rab_34 
T02D2681:190a-26	tu brtan pa'i rdo rjes bdag la ye shes kyi	tu_0 brtan_3 ba_9 rdo_14 rjes_18 bdag_23 la_28 ye_31 shes_34 kyi_39 
T02D2681:190a-27	mtshon cha gsol cig ces pa'o //	mtshon_0 cha_7 gsol_11 cig_16 ces_20 ba_24 
T02D2681:190a-28	aa mo gha badzra zhes pa ni don yod pa'i rdo rjes gzhan thams cad 'joms pa'o zhes pa'o //	aa_0 mo_3 gha_6 badzra_10 zhes_17 ba_22 ni_25 don_28 yod_32 ba_36 rdo_41 rjes_45 gzhan_50 thams_56 cad_62 'joms_66 ba_72 zhes_77 ba_82 
T02D2681:190a-29	ae hya hi badzra zhes pa ni bden pa'i rdo	ae_0 hya_3 hi_7 badzra_10 zhes_17 ba_22 ni_25 bden_28 ba_33 rdo_38 
T02D2681:190a-30	rje bdag 'khor ba las drongs pa shig ces pa'o	rje_0 bdag_4 'khor_9 ba_15 las_18 drongs_22 ba_29 shig_32 ces_37 ba_41 
T02D2681:190a-31	// sh'i ghram badzra ya sv'ah'a zhes pa ni dpa'	sh_3 ghram_8 badzra_14 ya_21 sv'a_24 zhes_32 ba_37 ni_40 dpa'_43 
T02D2681:190a-32	bar 'gro ba'i rdo rjes rings par bdag gi las	ba_0 'gro_4 ba_9 rdo_14 rjes_18 'dring_23 ba_29 bdag_33 gi_38 las_41 
T02D2681:190a-33	'grub par mdzod cig ces pa'o //	'grub_0 ba_6 mdzod_10 cig_16 ces_20 ba_24 
T02D2681:190a-34	dha ra dha ra zhes pa ni sgo bzhi'i srung ba bstan te /	dha_0 ra_4 dha_7 ra_11 zhes_14 ba_19 ni_22 sgo_25 bzhi_29 srung_36 ba_42 ston_45 te_51 
T02D2681:190a-35	byang chub sems kyi rang bzhin thams cad khyer la gzungs su gyis zhes pa'o //	byang_0 chub_6 sems_11 kyi_16 rang_20 bzhin_25 thams_31 cad_37 'khyer_41 la_47 gzungs_50 su_57 gyis_60 zhes_65 ba_70 
T02D2681:190a-36	dhi ri dhi ri zhes pa ni dbyings kyi rang	dhi_0 ri_4 dhi_7 ri_11 zhes_14 ba_19 ni_22 dbyings_25 kyi_33 rang_37 
T02D2681:190a-37	bzhin chos nyid dang ldan par gyis shig ces pa'o	bzhin_0 chos_6 nyid_11 dang_16 ldan_21 ba_26 gyis_30 shig_35 ces_40 ba_44 
T02D2681:190a-38	; / dhu ru dhu ru zhes pa ni lus	dhu_4 ru_8 dhu_11 ru_15 zhes_18 ba_23 ni_26 lus_29 
T02D2681:190a-39	thams cad thugs rjes zungs la thogs shig ces pa'o	thams_0 cad_6 thugs_10 rjes_16 zungs_21 la_27 thogs_30 shig_36 ces_41 ba_45 
T02D2681:190a-40	; // sarba badzra ku lam a'a brta ya sv'ah'a //	sarba_5 badzra_11 ku_18 lam_21 a_25 rtas_29 ya_34 sv'a_37 
T02D2681:190a-41	zhes pa ni rdo rje 'khor lo dang bcas pas bdag la byin gyis rlobs shig ces pa'o //	zhes_0 ba_5 ni_8 rdo_11 rje_15 'khor_19 lo_25 dang_28 'cha'_33 ba_38 bdag_42 la_47 byin_50 gyis_55 rlobs_60 shig_66 ces_71 ba_75 
T02D2681:190a-42	aa mu kam m'a ya phat ces pa ni bdag	aa_0 mu_3 kam_6 m_10 ya_14 phat_17 ces_22 ba_26 ni_29 bdag_32 
T02D2681:190b-0	dus ma yin pa'i 'jigs @190b ba las bzlog la	dus_0 ma_4 yin_7 ba_11 'jigs_16 ba_28 las_31 bzlog_35 la_41 
T02D2681:190b-1	bdud thams cad choms shig ces pa'o //	bdud_0 thams_5 cad_11 choms_15 shig_21 ces_26 ba_30 
T02D2681:190b-2	de yan chad khro bo bcu'i srung ba'i don bshad do /	de_0 yan_3 'chad_7 khro_12 'bo_17 'chu_20 srung_26 ba_32 don_37 'chad_41 do_47 
T02D2681:190b-3	da ni khro bo'i dbang gi don ston te /	da_0 ni_3 khro_6 'bo_11 dbang_16 gi_22 don_25 ston_29 te_34 
T02D2681:190b-4	na ma:sa manta badzra n'am zhes pa ni kun du	na_0 ma:sa_3 manta_9 badzra_15 n_22 zhes_27 ba_32 ni_35 kun_38 du_42 
T02D2681:190b-5	bzang po'i ye shes rdo rjes rang bzhin gyis dbang	bzang_0 po_6 ye_11 shes_14 rdo_19 rjes_23 rang_28 bzhin_33 gyis_39 dbang_44 
T02D2681:190b-6	bskur cig ces pa'o //	skur_0 cig_6 ces_10 ba_14 
T02D2681:190b-7	sarba ba lam a'a brta yang zhes pa ni stobs po ches dbang bskur cig ces pa'o //	sarba_0 ba_6 lam_9 a_13 rtas_17 yang_22 zhes_27 ba_32 ni_35 stobs_38 po_44 ches_47 dbang_52 skur_58 cig_64 ces_68 ba_72 
T02D2681:190b-8	ma h'a ba le zhes pa ni stobs po ches	ma_0 h_3 ba_7 le_10 zhes_13 ba_18 ni_21 stobs_24 po_30 ches_33 
T02D2681:190b-9	mgyogs pa rlung dang 'dra bar dbang bskur cig ces	mgyog_0 ba_7 rlung_10 dang_16 'dra_21 ba_26 dbang_30 skur_36 cig_42 ces_46 
T02D2681:190b-10	pa'o // ka ta be ta ta le zhes pa	ba_0 ka_8 ta_11 be_14 ta_17 ta_20 le_23 zhes_26 ba_31 
T02D2681:190b-11	ni ye shes kyi mche bas nyon mongs pa'i bdud	ni_0 ye_3 shes_6 kyi_11 mche_15 ba_20 nyon_24 mongs_29 ba_35 bdud_40 
T02D2681:190b-12	thul cig ces pa'o //	thul_0 cig_5 ces_9 ba_13 
T02D2681:190b-13	aa tsa le zhes pa ni khams gsum rnam rgyal	aa_0 tsa_3 le_7 zhes_10 ba_15 ni_18 khams_21 gsum_27 rnam_32 rgyal_37 
T02D2681:190b-14	gyi sprul pas dbang bskur la skyobs shig ces pa'o	gyi_0 sprul_4 ba_10 dbang_14 skur_20 la_26 skyobs_29 shig_36 ces_41 ba_45 
T02D2681:190b-15	// manda la ma ye shes pa ni dkyil 'khor	manda_3 la_9 ma_12 ye_15 shes_18 ba_23 ni_26 dkyil_29 'khor_35 
T02D2681:190b-16	gyi phyi'i srung ma rnams kyis sprul pa'i ngo bo	gyi_0 phyi_4 srung_11 ma_17 rnams_20 kyis_26 sprul_31 ba_37 ngo_42 'bo_46 
T02D2681:190b-17	nyid kyi che ba sna tshogs su snang ba'o //	nyid_0 kyi_5 che_9 ba_13 sna_16 tshogs_20 su_27 snang_30 ba_36 
T02D2681:190b-18	aa ti badzra zhes pa ni rdo rje bzang pos thams cad la skyobs shig pa'o //	aa_0 ti_3 badzra_6 zhes_13 ba_18 ni_21 rdo_24 rje_28 bzang_32 pos_38 thams_42 cad_48 la_52 skyobs_55 shig_62 ba_67 
T02D2681:190b-19	ma h'a ba le be ga ra na ra na	ma_0 h_3 ba_7 le_10 be_13 ga_16 ra_19 na_22 ra_25 na_28 
T02D2681:190b-20	zhes pa ni stobs po ches mgyogs pa rlung dang	zhes_0 ba_5 ni_8 stobs_11 po_17 ches_20 mgyog_25 ba_32 rlung_35 dang_41 
T02D2681:190b-21	'dra bas gnod pa thams cad zhi bar mdzod cig	'dra_0 ba_5 gnod_9 ba_14 thams_17 cad_23 zhi_27 ba_31 mdzod_35 cig_41 
T02D2681:190b-22	pa'o // aa dzi te dzva la dzva la zhes	ba_0 aa_8 dzi_11 te_15 dzva_18 la_23 dzva_26 la_31 zhes_34 
T02D2681:190b-23	pa ni yang dag pa'i shes rab kyis bdud dang	ba_0 ni_3 yang_6 'dag_11 ba_15 shes_20 rab_25 kyis_29 bdud_34 dang_39 
T02D2681:190b-24	log 'dren rnams sregs shig ces pa'o //	log_0 bgrang_4 rnams_10 sregs_16 shig_22 ces_27 ba_31 
T02D2681:190b-25	ti ti ti ti ping ga le zhes pa ni	ti_0 ti_3 ti_6 ti_9 ping_12 ga_17 le_20 zhes_23 ba_28 ni_31 
T02D2681:190b-26	so sor 'bar ba'i sdug bsngal thams cad las skyobs	so_0 sor_3 'bar_7 ba_12 sdug_17 sngal_22 thams_29 cad_35 las_39 skyobs_43 
T02D2681:190b-27	shig pa'o // de ha da ha zhes pa ni bdag gi nyon mongs pa rnams sregs shig pa'o //	shig_0 ba_5 de_13 ha_16 da_19 ha_22 zhes_25 ba_30 ni_33 bdag_36 gi_41 nyon_44 mongs_49 ba_55 rnams_58 sregs_64 shig_70 ba_75 
T02D2681:190b-28	te dzo ba ti zhes pa ni yang dag pa'i	te_0 dzo_3 ba_7 ti_10 zhes_13 ba_18 ni_21 yang_24 'dag_29 ba_33 
T02D2681:190b-29	ye shes kyis gti mug pa rnams sol cig pa'o	ye_0 shes_3 kyis_8 gti_13 mug_17 ba_21 rnams_24 sol_30 cig_34 ba_38 
T02D2681:190b-30	// ti li ti li zhes pa ni bdag gi sdug bsngal thams cad med par gyis shig pa'o ;	ti_3 li_6 ti_9 li_12 zhes_15 ba_20 ni_23 bdag_26 gi_31 sdug_34 sngal_39 thams_46 cad_52 med_56 ba_60 gyis_64 shig_69 ba_74 
T02D2681:190b-31	bhandha bhanda zhes pa ni bgegs dang 'byung po thams cad ching shig pa'o //	bhandha_0 bhanda_8 zhes_15 ba_20 ni_23 bgegs_26 dang_32 'byung_37 po_44 thams_47 cad_53 ching_57 shig_63 ba_68 
T02D2681:190b-32	ma h'a ba zhes pa ni stobs po ches las mdzod cig pa'o //	ma_0 h_3 ba_7 zhes_10 ba_15 ni_18 stobs_21 po_27 ches_30 las_35 mdzod_39 cig_45 ba_49 
T02D2681:190b-33	badzra aam ku sha dzva l'a ya sv'a h'a zhes	badzra_0 aam_7 ku_11 sha_14 dzva_18 l_23 ya_27 sv_30 h_35 zhes_39 
T02D2681:190b-34	pa ni rdo rje 'khor lo me dang 'dra bas	ba_0 ni_3 rdo_6 rje_10 'khor_14 lo_20 me_23 dang_26 'dra_31 ba_36 
T02D2681:190b-35	mtshan ma thams cad zhi bar mdzod cig pa'o //	mtshan_0 ma_7 thams_10 cad_16 zhi_20 ba_24 mdzod_28 cig_34 ba_38 
T02D2681:190b-36	de yan chad khro bo bcu'i rang gi las bshad pa'o //	de_0 yan_3 'chad_7 khro_12 'bo_17 'chu_20 rang_26 gi_31 las_34 'chad_38 ba_44 
T02D2681:190b-37	da ni ye shes kyi khro bo lag na rdo rje'i rang bzhin ston te /	da_0 ni_3 ye_6 shes_9 kyi_14 khro_18 'bo_23 lag_26 na_30 rdo_33 rje_37 rang_43 bzhin_48 ston_54 te_59 
T02D2681:190b-38	na mo ratna tra y'a la zhes pa ni dkon mchog gsum la phyag 'tshal lo zhes pa'o //	na_0 mo_3 ratna_6 tra_12 y_16 la_20 zhes_23 ba_28 ni_31 dkon(d)_34 mchog_39 gsum_45 la_50 phyag_53 'tshal_59 lo_66 zhes_69 ba_74 
T02D2681:190b-39	na ma: tsanda badzra p'a na ye zhes pa khams	na_0 ma:_3 tsanda_7 badzra_14 p_21 na_25 ye_28 zhes_31 ba_36 khams_39 
T02D2681:190b-40	gsum gyi gnod sbyin rnams gdul ba'i phyir lag na	gsum_0 gyi_5 gnod_9 sbyin_14 rnams_20 gdul_26 ba_31 phyir_36 lag_42 na_46 
T02D2681:191a-0	@191a * // rdo rje khro bo'i tshul du bzhugs pa'o //	rdo_11 rje_15 khro_19 'bo_24 tshul_29 du_35 bzhugs_38 ba_45 
T02D2681:191a-1	ma h'a yaksha se n'a pa ta ye zhes pa	ma_0 h_3 yaksha_7 se_14 n_17 ba_21 ta_24 ye_27 zhes_30 ba_35 
T02D2681:191a-2	ni gnod sbyin gyi sde dpon chen po lag na	ni_0 gnod_3 sbyin_8 gyi_14 sde_18 dpon_22 chen_27 po_32 lag_35 na_39 
T02D2681:191a-3	rdo rje ye shes kyi ngo bor bzhugs pa'o //	rdo_0 rje_4 ye_8 shes_11 kyi_16 ngo_20 'bor_24 bzhugs_28 ba_35 
T02D2681:191a-4	tadya th'a ni 'di lta ste zhes pa'o //	tadya_0 th_6 ni_11 'di_14 lta_18 ste_22 zhes_26 ba_31 
T02D2681:191a-5	aom ha ra ha ra badzra zhes pa ni ye	aom_0 ha_4 ra_7 ha_10 ra_13 badzra_16 zhes_23 ba_28 ni_31 ye_34 
T02D2681:191a-6	shes kyi lag na rdo rje dbus su bzhugs te	shes_0 kyi_5 lag_9 na_13 rdo_16 rje_20 dbus_24 su_29 bzhugs_32 te_39 
T02D2681:191a-7	/ ma tha ma tha badzra zhes pa ni h'um ka ra gshin rje gshed du bstan pa'o //	ma_2 tha_5 ma_9 tha_12 badzra_16 zhes_23 ba_28 ni_31 h_34 ka_39 ra_42 gshin_45 rje_51 gshed_55 du_61 ston_64 ba_70 
T02D2681:191a-8	dhu na dhu na badzra zhes pa ni mtshan ma thams cad 'joms pas na /	dhu_0 na_4 dhu_7 na_11 badzra_14 zhes_21 ba_26 ni_29 mtshan_32 ma_39 thams_42 cad_48 'joms_52 ba_58 na_62 
T02D2681:191a-9	khams gsum rnam par rgyal pa'i snying po'o //	khams_0 gsum_6 rnam_11 ba_16 rgyal_20 ba_26 snying_31 po_38 
