T02D1270:49b-0	@49b # // rgya gar skad du /	rgya_10 gar_15 skad_19 du_24 
T02D1270:49b-1	he ru ko pa au du da ya mandala bi dhi: bod skad du /	he_0 ru_3 ko_6 ba_9 au_12 du_15 da_18 ya_21 mandala_24 bi_32 dhi:_35 'bod_40 skad_44 du_49 
T02D1270:49b-2	he ru ka nye bar 'byung ba zhes bya ba'i	he_0 ru_3 ka_6 nye_9 ba_13 'byung_17 ba_24 zhes_27 byed_32 ba_36 
T02D1270:49b-3	dkyil 'khor gyi cho ga / dpal rdo rje mkha'	dkyil_0 'khor_6 gyi_12 cho_16 ga_20 dpal_25 rdo_30 rje_34 mkha'_38 
T02D1270:49b-4	'gro la phyag 'tshal lo //	'gro_0 la_5 phyag_8 'tshal_14 lo_21 
T02D1270:49b-5	dpal dgyes pa'i rdo rje la phyag 'tshal lo //	dpal_0 dgyes_5 ba_11 rdo_16 rje_20 la_24 phyag_27 'tshal_33 lo_40 
T02D1270:49b-6	he ru ka dpal thams cad mkhyen nyid rig par ldan /	he_0 ru_3 ka_6 dpal_9 thams_14 cad_20 mkhyen_24 nyid_31 rig_36 ba_40 ldan_44 
T02D1270:49b-7	lhan cig skyes pa de la spyi bos phyag 'tshal te //	lhan_0 cig_5 skye_9 ba_15 de_18 la_21 spyi_24 'bod_29 phyag_33 'tshal_39 te_46 
T02D1270:49b-8	skyon rnams thams cad bral zhing snying rnge'i rang bzhin ldan //	skyon_0 rnams_6 thams_12 cad_18 'bral_22 zhing_27 snying_33 rnge_40 rang_47 bzhin_52 ldan_58 
T02D1270:49b-9	de nyid rtogs phyir dkyil 'khor cho ga bsdus te bshad //	de_0 nyid_3 rtogs_8 phyir_14 dkyil_20 'khor_26 cho_32 ga_36 sdud_39 te_45 'chad_48 
T02D1270:49b-10	dbang bskur rab gnas bzlas dang sgrub pa la sogs pa //	dbang_0 skur_6 rab_12 gnas_16 bzlas_21 dang_27 sgrub_32 ba_38 la_41 sogs_44 ba_49 
T02D1270:49b-11	dkyil 'khor chen por mi ldan gang yang 'grub mi 'gyur //	dkyil_0 'khor_6 chen_12 por_17 mi_21 ldan_24 gang_29 yang_34 'grub_39 mi_45 'gyur_48 
T02D1270:49b-12	de phyir las kun rdzogs shing de nyid rtogs phyir dang //	de_0 phyir_3 las_9 kun_13 rdzogs_17 shing_24 de_30 nyid_33 rtogs_38 phyir_44 dang_50 
T02D1270:49b-13	khyad par lam la smin phyir dkyil 'khor cho ga brtsam //	khyad_0 ba_6 lam_10 la_14 smin_17 phyir_22 dkyil_28 'khor_34 cho_40 ga_44 brtsam_47 
T02D1270:49b-14	dkyil 'khor ting 'dzin sngags dang phyag rgya dang //	dkyil_0 'khor_6 ting_12 'dzin_17 sngags_23 dang_30 phyag_35 rgya_41 dang_46 
T02D1270:49b-15	gdan ldan bzlas dang sbyin sreg cho ga dang //	gdan_0 ldan_5 bzlas_10 dang_16 sbyin_21 sreg_27 cho_32 ga_36 dang_39 
T02D1270:49b-16	mchod dang las kyi sbyor ka yongs su sdud pa ste /	mchod_0 dang_6 las_11 kyi_15 sbyor_19 ka_25 yongs_28 su_34 sdud_37 ba_42 ste_45 
T02D1270:49b-17	'di ni de nyid bcu ste rig par bya //	'di_0 ni_4 de_7 nyid_10 'chu_15 ste_19 rig_23 ba_27 byed_31 
T02D1270:49b-18	slob dpon de nyid bcur ldan zhing //	slob_0 dpon_5 de_10 nyid_13 'jur_18 ldan_23 zhing_28 
T02D1270:49b-19	sngags dang rgyud kyi sbyor ba shes //	sngags_0 dang_7 brgyud_12 kyi_18 sbyor_22 ba_28 shes_31 
T02D1270:49b-20	mtshan nyid thams cad yongs su rdzogs //	mtshan_0 nyid_7 thams_12 cad_18 yongs_22 su_28 rdzogs_31 
T02D1270:49b-21	bstan bcos kun gyi don rtogs shing //	ston_0 'chos_6 kun_11 gyi_15 don_19 rtogs_23 shing_29 
T02D1270:49b-22	dbang rnams thams cad rdzogs pa dang //	dbang_0 rnams_6 thams_12 cad_18 rdzogs_22 ba_29 dang_32 
T02D1270:49b-23	de nyid lha yi snang ba thob //	de_0 nyid_3 lha_8 yi_12 snang_15 ba_21 'thob_24 
T02D1270:49b-24	bla ma yon tan ldan gyis gnang //	bla_0 ma_4 yon_7 tan_11 ldan_15 gyis_20 gnang_25 
T02D1270:49b-25	dam tshig sngom ldan rab tu brtan //	dam_0 tshig_4 sngom_10 ldan_16 rab_21 tu_25 brtan_28 
T02D1270:49b-26	theg pa gsum gyi de nyid rig / jig rten chos kyis ma gos shing //	theg_0 ba_5 gsum_8 gyi_13 de_17 nyid_20 rig_25 rten_35 chos_40 kyis_45 ma_50 gos_53 shing_57 
T02D1270:49b-27	snying rje'i rang bzhin snying brtser ldan //	snying_0 rje_7 rang_13 bzhin_18 snying_24 brtser_31 ldan_38 
T02D1270:49b-28	rgyun du bzlas brjod mthar phyin zhing //	rgyun_0 du_6 bzlas_9 rjod_15 mthar_21 phyin_27 zhing_33 
T02D1270:49b-29	dad dang byams la rgyun bzhugs pa //	dad_0 dang_4 byams_9 la_15 rgyun_18 bzhugs_24 ba_31 
T02D1270:49b-30	cho ga thams cad rdzogs pa dang //	cho_0 ga_4 thams_7 cad_13 rdzogs_17 ba_24 dang_27 
T02D1270:49b-31	dkyil 'khor bri la brtson ldan yin //	dkyil_0 'khor_6 'bri_12 la_16 brtson_19 ldan_26 yin_31 
T02D1270:49b-32	mchog gi bsod nams thob 'dod dang //	mchog_0 gi_6 bsod_9 nams_14 'thob_19 'dod_24 dang_29 
T02D1270:49b-33	de nyid rjes su yi rang ldan //	de_0 nyid_3 rjes_8 su_13 yi_16 rang_19 ldan_24 
T02D1270:49b-34	de dag mi ldan dkyil 'khor rtsom //	de_0 'dag_3 mi_7 ldan_10 dkyil_15 'khor_21 rtsom_27 
T02D1270:49b-35	cho ga'i rang bzhin dman pa dang //	cho_0 ga_4 rang_9 bzhin_14 dman_20 ba_25 dang_28 
T02D1270:49b-36	rlom pa'i sems kyis byas gyur na //	rlom_0 ba_5 sems_10 kyis_15 byed_20 gyur_25 na_30 
T02D1270:49b-37	tshe 'dir sdug bsngal chen po 'thob //	tshe_0 'dir_5 sdug_10 sngal_15 chen_22 po_27 'thob_30 
T02D1270:49b-38	pha rol 'jigs pa chen por 'gyur de phyir mtshan nyid rdzogs pa dang //	pha_0 rol_4 'jigs_8 ba_14 chen_17 por_22 'gyur_26 de_32 phyir_35 mtshan_41 nyid_48 rdzogs_53 ba_60 dang_63 
T02D1270:49b-39	rgyud kyi don rnams yongs rtogs shing //	brgyud_0 kyi_6 don_10 rnams_14 yongs_20 rtogs_26 shing_32 
T02D1270:49b-40	cho ga thams cad ma nyams par //	cho_0 ga_4 thams_7 cad_13 ma_17 nyams_20 ba_26 
T02D1270:49b-41	dkyil 'khor chen po rtsom pa na //	dkyil_0 'khor_6 chen_12 po_17 rtsom_20 ba_26 na_29 
T02D1270:49b-42	'di dang pha rol thams cad kyi //	'di_0 dang_4 pha_9 rol_13 thams_17 cad_23 kyi_27 
T02D1270:49b-43	bsod nams phun sum tshogs pa 'thob //	bsod_0 nams_5 phun_10 sum_15 tshogs_19 ba_26 'thob_29 
T02D1270:49b-44	mi mnyam bsod nams thob pa'i phyir //	mi_0 mnyam_3 bsod_9 nams_14 'thob_19 ba_24 phyir_29 
T02D1270:50a-0	dkyil @50a * //	dkyil_0 
T02D1270:50a-1	'khor mchod la brtson par bya //	'khor_0 mchod_6 la_12 brtson_15 ba_22 byed_26 
T02D1270:50a-2	de la dang po kho nar slob ma sbyin par bya ba'i phyir /	de_0 la_3 dang_6 po_11 kho_14 nar_18 slob_22 ma_27 sbyin_30 ba_36 byed_40 ba_44 phyir_49 
T02D1270:50a-3	mandala sogs pa sngon du 'gro bas lan gsum du gsol ba gdab par bya'o //	mandala_0 sogs_8 ba_13 sngon_16 du_22 'gro_25 ba_30 lan_34 gsum_38 du_43 gsol_46 ba_51 gdab_54 ba_59 byed_63 
T02D1270:50a-4	bdag nyid bsgrub par bya ba'i dkyil 'khor ram //	bdag_0 nyid_5 sgrub_10 ba_17 byed_21 ba_25 dkyil_30 'khor_36 ram_42 
T02D1270:50a-5	gzhan sbyin par bya ba'i don ched du gnyer bas bsnyen pa la 'jug par bya ste /	gzhan_0 sbyin_6 ba_12 byed_16 ba_20 don_25 ched_29 du_34 gnyer_37 ba_43 snyen_47 ba_54 la_57 'jug_60 ba_65 byed_69 ste_73 
T02D1270:50a-6	de nas khyad par gyi gnas so so'i skye bo mi 'du ba /	de_0 nas_3 khyad_7 ba_13 gyi_17 gnas_21 so_26 so_29 skye_34 'bo_39 mi_42 'du_45 ba_49 
T02D1270:50a-7	yid 'jug pa /	yid_0 'jug_4 ba_9 
T02D1270:50a-8	gnas kyi de kho na nyid rig pa'i stobs kyis gnas te /	gnas_0 kyi_5 de_9 kho_12 na_16 nyid_19 rig_24 ba_28 stobs_33 kyis_39 gnas_44 te_49 
T02D1270:50a-9	dgyes pa'i rdo rje'i rnal 'byor mtshan nyid thams cad dang ldan par bya ste /	dgyes_0 ba_6 rdo_11 rje_15 rnal_21 'byor_26 mtshan_32 nyid_39 thams_44 cad_50 dang_54 ldan_59 ba_64 byed_68 ste_72 
T02D1270:50a-10	lhag pa'i lha'am 'khor los sgyur ba'i sngags la 'bum phrag gi bzlas pa byas nas /	lhag_0 ba_5 lha_10 'khor_17 los_23 sgyur_27 ba_33 sngags_38 la_45 'bum_48 phrag_53 gi_59 bzlas_62 ba_68 byed_71 nas_76 
T02D1270:50a-11	'khor gyi sngags kyang khri phrag re re'i bzlas pa byas pa 'am /	'khor_0 gyi_6 sngags_10 kyang_17 khri_23 phrag_28 re_34 re_37 bzlas_42 ba_48 byed_51 ba_56 'am_59 
T02D1270:50a-12	yang na lha'i rjes su gnang ba thob cing /	yang_0 na_5 lha_8 rjes_14 su_19 gnang_22 ba_28 'thob_31 cing_36 
T02D1270:50a-13	mkha' 'gro mas lung bstan nas dkyil 'khor rtsom pa la 'jug par bya'o //	mkha'_0 'gro_6 mas_11 lung_15 ston_20 nas_26 dkyil_30 'khor_36 rtsom_42 ba_48 la_51 'jug_54 ba_59 byed_63 
T02D1270:50a-14	de dag ni bsnyen pa'i rim pa'o /	de_0 'dag_3 ni_7 snyen_10 ba_17 rim_22 ba_26 
T02D1270:50a-17	// / shing gcig 'jigs gnas chu 'gram dang //	shing_5 gcig_11 'jigs_16 gnas_22 chu_27 'grams_31 dang_37 
T02D1270:50a-18	dur khrod dben pa'i nags tshal dang //	dur_0 khrod_4 dben_10 ba_15 nags_20 tshal_25 dang_31 
T02D1270:50a-19	rgya mtsho'i 'gram dang g-yul 'gyed sar //	rgya_0 mtsho_5 'grams_13 dang_19 g-yul_24 'gyed_30 sar_36 
T02D1270:50a-20	bsgrubs na dngos grub nye bar bshad //	sgrub_0 na_8 dngos_11 'grub_17 nye_22 ba_26 'chad_30 
T02D1270:50a-21	mtsho dang grong khyer dbus dag dang //	mtsho_0 dang_6 grong_11 'khyer_17 dbus_23 'dag_28 dang_32 
T02D1270:50a-22	skye bo 'dus sa phyugs ra dang //	skye_0 'bo_5 'du_8 sa_13 phyugs_16 ra_23 dang_26 
T02D1270:50a-23	rab gnas ma byas lha khang dang //	rab_0 gnas_4 ma_9 byed_12 lha_17 khang_21 dang_27 
T02D1270:50a-24	mtshan nyid mi ldan sa phyogs su //	mtshan_0 nyid_7 mi_12 ldan_15 sa_20 phyogs_23 su_30 
T02D1270:50a-25	gang zhig dkyil 'khor rtsom byed na //	gang_0 'jig_5 dkyil_10 'khor_16 rtsom_22 byed_28 na_33 
T02D1270:50a-26	de yi dngos grub thams cad ni //	de_0 yi_3 dngos_6 'grub_12 thams_17 cad_23 ni_27 
T02D1270:50a-27	de nyid mkhyen pas ring bar gsungs //	de_0 nyid_3 mkhyen_8 ba_15 ring_19 ba_24 gsungs_28 
T02D1270:50a-28	gnas brtag pa'i rim pa'o /	gnas_0 rtog_5 ba_11 rim_16 ba_20 
T02D1270:50a-30	// / dus dang rgyu skar shis pa la //	dus_5 dang_9 rgyu_14 skar_19 shis_24 ba_29 la_32 
T02D1270:50a-31	snga dro'i dus su yang dag par //	snga_0 dro_5 dus_11 su_15 yang_18 'dag_23 ba_27 
T02D1270:50a-32	de nyid mkhyen pa'i gtso bo yis //	de_0 nyid_3 mkhyen_8 ba_15 gtso_20 'bo_25 yis_28 
T02D1270:50a-33	sa ni legs par brtag par bya //	sa_0 ni_3 legs_6 ba_11 rtog_15 ba_21 byed_25 
T02D1270:50a-34	bra shing yung ba rno shing rams shing rnams ni spangs //	bra_0 shing_4 yung_10 ba_15 rno_18 shing_22 rams_28 shing_33 rnams_39 ni_45 spong_48 
T02D1270:50a-35	nyung nag skur shing don grub go bi da ra dang //	nyung_0 nag_6 skur_10 shing_15 don_21 'grub_25 go_30 bi_33 da_36 ra_39 dang_42 
T02D1270:50a-36	sa rtsub dag dang ri sul tshva sgo tsher ma can //	sa_0 rtsub_3 'dag_9 dang_13 ri_18 sul_21 tshva_25 sgo_31 tsher_35 ma_41 can_44 
T02D1270:50a-37	rus sbal rgyab 'dra'i sa gzhi yongs su spang //	rus_0 sbal_4 rgyab_9 'dra_15 sa_22 gzhi_25 yongs_30 su_36 spong_39 
T02D1270:50a-38	shar phyogs ni ma pa la yi thar shing yod pa dang //	'char_0 phyogs_5 ni_12 ma_15 ba_18 la_21 yi_24 thar_27 shing_32 yod_38 ba_42 dang_45 
T02D1270:50a-39	lho phyogs pa la sha yi thang shing yod pa dang //	lho_0 phyogs_4 ba_11 la_14 sha_17 yi_21 thang_24 shing_30 yod_36 ba_40 dang_43 
T02D1270:50a-40	nub phyogs n+ya gro dha yi thang shing gnas pa dang //	nub_0 phyogs_4 n_11 ya_13 gro_16 dha_20 yi_24 thang_27 shing_33 gnas_39 ba_44 dang_47 
T02D1270:50a-41	byang phyogs ba ku la yi thang shing skyes pa ni //	byang_0 phyogs_6 ba_13 ku_16 la_19 yi_22 thang_25 shing_31 skye_37 ba_43 ni_46 
T02D1270:50a-42	sa phyogs de dag yongs su spang bar bya //	sa_0 phyogs_3 de_10 'dag_13 yongs_17 su_23 spong_26 ba_32 byed_36 
T02D1270:50a-43	me yi mtshams su ka ku pa yi shing ldan dang //	me_0 yi_3 mtshams_6 su_14 ka_17 ku_20 ba_23 yi_26 shing_29 ldan_35 dang_40 
T02D1270:50b-0	srin po'i mtshams su ba la sha yi shing @50b gnas spang bar bya //	srin_0 po_5 mtshams_10 su_18 ba_21 la_24 sha_27 yi_31 shing_34 gnas_45 spong_50 ba_56 byed_60 
T02D1270:50b-1	de bzhin rlung gi mtshams su pa la bha li'i shing //	de_0 bzhin_3 rlung_9 gi_15 mtshams_18 su_26 ba_29 la_32 bha_35 li_39 shing_44 
T02D1270:50b-2	dbang ldan mtshams su au dumw'a ra'i shing bcas spang //	dbang_0 ldan_6 mtshams_11 su_19 au_22 dumw_25 ra_32 shing_37 'cha'_43 spong_48 
T02D1270:50b-3	aa sho ka ni 'bras med skam po skam shing sa //	aa_0 sho_3 ka_7 ni_10 'bras_13 med_19 skam_23 po_28 skam_31 shing_36 sa_42 
T02D1270:50b-4	ta ma la'i shing tsher ma dug shing spang //	ta_0 ma_3 la_6 shing_11 tsher_17 ma_23 dug_26 shing_30 spong_36 
T02D1270:50b-5	gsal shing la sogs gdug pa'i shing rnams yongs su spang //	gsal_0 shing_5 la_11 sogs_14 gdug_19 ba_24 shing_29 rnams_35 yongs_41 su_47 spong_50 
T02D1270:50b-6	mi mnyam nag po gru bzhi chu shing skyes pa dang //	mi_0 mnyam_3 nag_9 po_13 gru_16 bzhi_20 chu_25 shing_29 skye_35 ba_41 dang_44 
T02D1270:50b-7	chu shol gang rol 'obs can gting khung gnyer ldan spang //	chu_0 shol_4 gang_9 rol_14 'obs_18 can_23 gting_27 khung_33 gnyer_39 ldan_45 spong_50 
T02D1270:50b-8	legs par gru bzhir brkos nas de nyid sa yis dgang //	legs_0 ba_5 gru_9 bzhir_13 rko_19 nas_25 de_29 nyid_32 sa_37 yis_40 'geng_44 
T02D1270:50b-9	sngon pas dma' na legs par brtags te spang bar bya //	sngon_0 ba_6 dma'_10 na_15 legs_18 ba_23 rtog_27 te_34 spong_37 ba_43 byed_47 
T02D1270:50b-10	mnyam par gang ste mtho na sa gzhi bzang por bshad //	mnyam_0 ba_6 gang_10 ste_15 mtho_19 na_24 sa_27 gzhi_30 bzang_35 por_41 'chad_45 
T02D1270:50b-11	de ni sa brtag pa'o /	de_0 ni_3 sa_6 rtog_9 ba_15 
T02D1270:50b-13	// / bra shing la sogs sa gzhi la //	bra_5 shing_9 la_15 sogs_18 sa_23 gzhi_26 la_31 
T02D1270:50b-14	gang zhig dkyil 'khor rtsom byed na //	gang_0 'jig_5 dkyil_10 'khor_16 rtsom_22 byed_28 na_33 
T02D1270:50b-15	rtsod dang mya ngan nor shor dang //	rtsod_0 dang_6 mya_11 ngan_15 nor_20 'chor_24 dang_29 
T02D1270:50b-16	yon bdag gdung skye the tshom med //	yon_0 bdag_4 gdung_9 skye_15 the_20 tshom_24 med_30 
T02D1270:50b-17	dma' 'am rus sbal rgyab 'dra na //	dma'_0 'am_5 rus_9 sbal_13 rgyab_18 'dra_24 na_29 
T02D1270:50b-18	'chi'am nad chen 'byung bar 'gyur //	'chi_0 nad_8 chen_12 'byung_17 ba_24 'gyur_28 
T02D1270:50b-19	de phyir de 'dra'i sa gzhi la //	de_0 phyir_3 de_9 'dra_12 sa_19 gzhi_22 la_27 
T02D1270:50b-20	dkyil 'khor mi brtsam blo ldan gyis //	dkyil_0 'khor_6 mi_12 brtsam_15 blo_22 ldan_26 gyis_31 
T02D1270:50b-21	aa sho ka sogs ldan pa yi //	aa_0 sho_3 ka_7 sogs_10 ldan_15 ba_20 yi_23 
T02D1270:50b-22	sa gzhi dkar po 'jam pa yi //	sa_0 gzhi_3 dkar_8 po_13 'jam_16 ba_21 yi_24 
T02D1270:50b-23	byang shar g-yas 'bab chu 'bab na //	byang_0 'char_6 g-yas_11 'bab_17 chu_22 'bab_26 na_31 
T02D1270:50b-24	der ni bla med dngos grub thob //	der_0 ni_4 bla_7 med_11 dngos_15 'grub_21 'thob_26 
T02D1270:50b-25	brkos pas sa chus ma khengs na //	rko_0 ba_6 sa_10 chus_13 ma_18 kheng_21 na_28 
T02D1270:50b-26	des ni dgongs pa nyams par 'gyur //	des_0 ni_4 dgongs_7 ba_14 nyams_17 ba_23 'gyur_27 
T02D1270:50b-27	brkos pas sa chus gang lhag na //	rko_0 ba_6 sa_10 chus_13 gang_18 lhag_23 na_28 
T02D1270:50b-28	bsams pa'i dgongs pa 'grub par 'gyur //	bsams_0 ba_6 dgongs_11 ba_18 'grub_21 ba_27 'gyur_31 
T02D1270:50b-29	sa gzhi'i mtshan nyid brtag pa'o /	sa_0 gzhi_3 mtshan_10 nyid_17 rtog_22 ba_28 
T02D1270:50b-31	// / de nas sngags pas sa gzhi legs par brtags	de_5 nas_8 sngags_12 ba_19 sa_23 gzhi_26 legs_31 ba_36 rtog_40 
T02D1270:50b-32	pa'i dbus su mtho zhing bde ba'i stan la 'dug	ba_0 dbus_5 su_10 mtho_13 zhing_18 bde_24 ba_28 stan_33 la_38 'dug_41 
T02D1270:50b-33	ste / khrus byas te dri zhim pos byugs la /	ste_0 'khru_6 byed_12 te_17 'dri_20 zhim_24 pos_29 'byug_33 la_39 
T02D1270:50b-34	na bza' dang phyag rgya drug gis legs par brgyan la /	na_0 bza'_3 dang_8 phyag_13 rgya_19 drug_24 gis_29 legs_33 ba_38 rgyan_42 la_49 
T02D1270:50b-35	dgos pa thams cad yongs su tshogs par byas nas rgyun du bsrung ba'i sngags bzlas te /	dgos_0 ba_5 thams_8 cad_14 yongs_18 su_24 tshogs_27 ba_34 byed_38 nas_43 rgyun_47 du_53 bsrung_56 ba_63 sngags_68 bzlas_75 te_81 
T02D1270:50b-36	sngags pa mnyam par gzhag pa dang ldan pas rdo rje dang dril bu gzung ste /	sngags_0 ba_7 mnyam_10 ba_16 'jog_20 ba_26 dang_29 ldan_34 ba_39 rdo_43 rje_47 dang_51 'dril_56 bu_61 gzung_64 ste_70 
T02D1270:50b-37	mchod pa dang gtor ma sngon du 'gro ba byas nas /	mchod_0 ba_6 dang_9 'thor_14 ma_19 sngon_22 du_28 'gro_31 ba_36 byed_39 nas_44 
T02D1270:50b-38	dgongs ka'i dus su ting nge 'dzin gsum rdzogs par byas la /	dgongs_0 ka_7 dus_12 su_16 ting_19 nge_24 'dzin_28 gsum_34 rdzogs_39 ba_46 byed_50 la_55 
T02D1270:50b-39	ji ltar bshad pa'i drag po'i sbyin sreg gis bgegs bskrad nas phur bu btab ste /	ji_0 ltar_3 'chad_8 ba_14 drag_19 po_24 sbyin_29 sreg_35 gis_40 bgegs_44 skrod_50 nas_57 'phur_61 bu_66 'debs_69 ste_74 
T02D1270:50b-40	rdo rje ra ba dang gur la sogs pa bsgom par bya'o //	rdo_0 rje_4 ra_8 ba_11 dang_14 gur_19 la_23 sogs_26 ba_31 bsgom_34 ba_40 byed_44 
T02D1270:50b-41	de nas slob ma bsrung ba'i don du zhi ba'i sbyin sreg bya'o //	de_0 nas_3 slob_7 ma_12 bsrung_15 ba_22 don_27 du_31 zhi_34 ba_38 sbyin_43 sreg_49 byed_54 
T02D1270:50b-42	de nas gtor ma rgya chen po ji lta ba'i gdams ngag gis byin gyis brlabs la /	de_0 nas_3 'thor_7 ma_12 rgya_15 chen_20 po_25 ji_28 lta_31 ba_35 'doms_40 ngag_46 gis_51 byin_55 gyis_60 brlabs_65 la_72 
T02D1270:51a-0	@51a * // phyogs thams cad kyi 'jig rten skyong ba rnams la	phyogs_10 thams_17 cad_23 kyi_27 'jig_31 rten_36 skyong_41 ba_48 rnams_51 la_57 
T02D1270:51a-1	sgra chen po dang ldan par byas te so so	sgra_0 chen_5 po_10 dang_13 ldan_18 ba_23 byed_27 te_32 so_35 so_38 
T02D1270:51a-2	la gtor ma sbyin no //	la_0 'thor_3 ma_8 sbyin_11 no_17 
T02D1270:51a-3	byin gyis rlob pa'i gsol ba gdab par bya'o //	byin_0 gyis_5 rlob_10 ba_15 gsol_20 ba_25 gdab_28 ba_33 byed_37 
T02D1270:51a-4	de'i nang par snga dro'i dus su sngags pa rnal	de_0 nang_5 ba_10 snga_14 dro_19 dus_25 su_29 sngags_32 ba_39 rnal_42 
T02D1270:51a-5	'byor dang ldan pa las thams cad pa'i sngags kyis	'byor_0 dang_6 ldan_11 ba_16 las_19 thams_23 cad_29 ba_33 sngags_38 kyis_45 
T02D1270:51a-6	las thams cad pa'i chu la bsngags te /	las_0 thams_4 cad_10 ba_14 chu_19 la_23 bsngags_26 te_34 
T02D1270:51a-7	sa gzhi la bsang gtor du byas nas rang gi	sa_0 gzhi_3 la_8 bsang_11 'thor_17 du_22 byed_25 nas_30 rang_34 gi_39 
T02D1270:51a-8	'od zer gyis ji ltar bshad pa'i sa'i lha mo	'od_0 zer_4 gyis_8 ji_13 ltar_16 'chad_21 ba_27 sa_32 lha_37 mo_41 
T02D1270:51a-9	bkug ste / mdun gyi nam mkha'i dbyings nas mchod pa la sogs pas yongs su mchod la /	'gugs_0 ste_5 mdun_11 gyi_16 nam_20 mkha_24 dbyings_31 nas_39 mchod_43 ba_49 la_52 sogs_55 ba_60 yongs_64 su_70 mchod_73 la_79 
T02D1270:51a-10	lha mo khyod ni dpang du gyur //	lha_0 mo_4 khyod_7 ni_13 dpang_16 du_22 gyur_25 
T02D1270:51a-11	zhes pa la sogs pas gsol ba btab nas aom	zhes_0 ba_5 la_8 sogs_11 ba_16 gsol_20 ba_25 'debs_28 nas_33 aom_37 
T02D1270:51a-12	badzro ttishtha zhes bya ba'i sngags kyis nam mkha'i phyogs	badzro_0 ttishtha_7 zhes_16 byed_21 ba_25 sngags_30 kyis_37 nam_42 mkha_46 phyogs_53 
T02D1270:51a-13	su gzhag par bya'o //	su_0 'jog_3 ba_9 byed_13 
T02D1270:51a-14	las kyi rdo rjes brko bar bya //	las_0 kyi_4 rdo_8 rjes_12 rko_17 ba_22 byed_26 
T02D1270:51a-15	zabs su pus mo'i tshad tsam brko //	zabs_0 su_5 pus_8 mo_12 tshad_17 tsam_23 rko_28 
T02D1270:51a-16	lto 'phye yongs su brtag byas la //	lto_0 'phye_4 yongs_10 su_16 rtog_19 byed_25 la_30 
T02D1270:51a-17	skyon ni rnam par brtag par bya //	skyon_0 ni_6 rnam_9 ba_14 rtog_18 ba_24 byed_28 
T02D1270:51a-18	dgun zla gsum gyi bdag nyid la //	dgun_0 zla_5 gsum_9 gyi_14 bdag_18 nyid_23 la_28 
T02D1270:51a-19	ji ltar nyi ma shar nas brtsams //	ji_0 ltar_3 nyi_8 ma_12 'char_15 nas_20 brtsams_24 
T02D1270:51a-20	lho yi phyogs su mgo bltas nas //	lho_0 yi_4 phyogs_7 su_14 mgo_17 lta_21 nas_27 
T02D1270:51a-21	g-yon gyi lus kyis nyal ba yin //	g-yon_0 gyi_6 lus_10 kyis_14 nyal_19 ba_24 yin_27 
T02D1270:51a-22	dpyid zla gsum gyi bdag nyid la //	dpyid_0 zla_6 gsum_10 gyi_15 bdag_19 nyid_24 la_29 
T02D1270:51a-23	lho nas nyi ma nub phyogs su //	lho_0 nas_4 nyi_8 ma_12 nub_15 phyogs_19 su_26 
T02D1270:51a-24	lus stod mi lus nub tu blta //	lus_0 stod_4 mi_9 lus_12 nub_16 tu_20 lta_23 
T02D1270:51a-25	lus smad sbrul 'dra shar du yin //	lus_0 smad_4 sbrul_9 'dra_15 'char_20 du_25 yin_28 
T02D1270:51a-26	dbyar zla gsum gyi bdag nyid la //	dbyar_0 zla_6 gsum_10 gyi_15 bdag_19 nyid_24 la_29 
T02D1270:51a-27	byang du kha bltas nub tu 'khor //	byang_0 du_6 kha_9 lta_13 nub_19 tu_23 'khor_26 
T02D1270:51a-28	ston zla gsum gyi bdag nyid la //	ston_0 zla_5 gsum_9 gyi_14 bdag_18 nyid_23 la_28 
T02D1270:51a-29	shar du mgo bltas shar blta yin //	'char_0 du_5 mgo_8 lta_12 'char_18 lta_23 yin_28 
T02D1270:51a-30	de yis lto shes byas nas brko //	de_0 yis_3 lto_7 shes_11 byed_16 nas_21 rko_25 
T02D1270:51a-31	des mi 'dod pa'i dngos grub ni //	des_0 mi_4 'dod_7 ba_12 dngos_17 'grub_23 ni_28 
T02D1270:51a-32	thob par 'gyur te the tshom med //	'thob_0 ba_5 'gyur_9 te_15 the_18 tshom_22 med_28 
T02D1270:51a-33	gal te mgo bor brko ba na //	gal_0 te_4 mgo_7 'bor_11 rko_15 ba_20 na_23 
T02D1270:51a-34	pha dang ma dang snying gnyen dang //	pha_0 dang_4 ma_9 dang_12 snying_17 gnyen_24 dang_30 
T02D1270:51a-35	bu dang tsha bo nye 'khor bcas //	bu_0 dang_3 tsha_8 'bo_13 nye_16 'khor_20 'cha'_26 
T02D1270:51a-36	rtag tu brlag 'gyur the tshom med //	rtag_0 tu_5 brlag_8 'gyur_14 the_20 tshom_24 med_30 
T02D1270:51a-37	gal te rgyab tu brkos pa na //	gal_0 te_4 rgyab_7 tu_13 rko_16 ba_22 na_25 
T02D1270:51a-38	yul 'chor yang na 'chi bar 'gyur //	yul_0 'chor_4 yang_10 na_15 'chi_18 ba_23 'gyur_27 
T02D1270:51a-39	gal te mjug mar brkos pa na //	gal_0 te_4 mjug_7 mar_12 rko_16 ba_22 na_25 
T02D1270:51a-40	ba lang ma he la sogs pa'i //	ba_0 lang_3 ma_8 he_11 la_14 sogs_17 ba_22 
T02D1270:51a-41	sgo phyugs myur du brlag par 'gyur //	sgo_0 phyugs_4 myur_11 du_16 brlag_19 ba_25 'gyur_29 
T02D1270:51a-42	de phyir lto 'phye yongs brtags la //	de_0 phyir_3 lto_9 'phye_13 yongs_19 rtog_25 la_32 
T02D1270:51a-43	skor ba lan gsum byas nas ni //	skor_0 ba_5 lan_8 gsum_12 byed_17 nas_22 ni_26 
T02D1270:51a-44	lto ba'i phyogs su brko bar bya //	lto_0 ba_4 phyogs_9 su_16 rko_19 ba_24 byed_28 
T02D1270:51a-45	lto 'phye shar phyogs nas brtsams nas //	lto_0 'phye_4 'char_10 phyogs_15 nas_22 brtsams_26 nas_34 
T02D1270:51a-46	ji ltar dus tshod gsungs pa bzhin //	ji_0 ltar_3 dus_8 tshod_12 gsungs_18 ba_25 bzhin_28 
T02D1270:51a-47	phyogs mtshams kun du 'khor zhing gnas //	phyogs_0 mtshams_7 kun_15 du_19 'khor_22 zhing_28 gnas_34 
T02D1270:51a-48	sa brkos pa yi nang nas ni //	sa_0 rko_3 ba_9 yi_12 nang_15 nas_20 ni_24 
T02D1270:51a-49	phub ma rdo ba gseg ma dang //	'bubs_0 ma_5 rdo_8 ba_12 gseg_15 ma_20 dang_23 
T02D1270:51b-0	sol ba ro dum la @51b sogs pa //	sol_0 ba_4 ro_7 dum_10 la_14 sogs_22 ba_27 
T02D1270:51b-1	de dag legs par bsal bar bya //	de_0 'dag_3 legs_7 ba_12 bsal_16 ba_21 byed_25 
T02D1270:51b-2	byung nas legs par ma bsal na //	'byung_0 nas_6 legs_10 ba_15 ma_19 bsal_22 na_27 
T02D1270:51b-3	de la nges par skyon du 'gyur //	de_0 la_3 nges_6 ba_11 skyon_15 du_21 'gyur_24 
T02D1270:51b-4	rus pa ma bsal skyon gyis lus ni 'jig par 'gyur //	rus_0 ba_4 ma_7 bsal_10 skyon_15 gyis_21 lus_26 ni_30 'jig_33 ba_38 'gyur_42 
T02D1270:51b-5	sol ba ma bsal skyon gyis 'jig pa chen pos	sol_0 ba_4 ma_7 bsal_10 skyon_15 gyis_21 'jig_26 ba_31 chen_34 pos_39 
T02D1270:51b-6	phog / thal bas nor shor mi rus kyis ni	'bogs_0 thal_7 ba_12 nor_16 'chor_20 mi_25 rus_28 kyis_32 ni_37 
T02D1270:51b-7	'chi bar 'gyur // sbrul la sogs pa'i skyon ni legs par sngags kyis spang //	'chi_0 ba_5 'gyur_9 sbrul_18 la_24 sogs_27 ba_32 skyon_37 ni_43 legs_46 ba_51 sngags_55 kyis_62 spong_67 
T02D1270:51b-8	ma spangs skyon gyis mkha' 'gro'i chad pa 'byung bar 'gyur //	ma_0 spong_3 skyon_10 gyis_16 mkha'_21 'gro_27 'chad_34 ba_39 'byung_42 ba_49 'gyur_53 
T02D1270:51b-9	rdo dang rdul phye bye ma sen mo skra dang gyo mo bong ba dang //	rdo_0 dang_4 rdul_9 'byed_14 'bye_19 ma_23 sen_26 mo_30 skra_33 dang_38 gyo_43 mo_47 bong_50 ba_55 dang_58 
T02D1270:51b-10	shing dang phag bu dri ma phug ma tsher ma rdo tshigs la sogs pa //	shing_0 dang_6 phag_11 bu_16 'dri_19 ma_23 'bugs_26 ma_31 tsher_34 ma_40 rdo_43 tshigs_47 la_54 sogs_57 ba_62 
T02D1270:51b-11	ma bsal skyon gyis brdung brdeg rtsod dang rnam par 'tshe ba kun du 'byung //	ma_0 bsal_3 skyon_8 gyis_14 rdung_19 brdeg_26 rtsod_32 dang_38 rnam_43 ba_48 'tshe_52 ba_58 kun_61 du_65 'byung_68 
T02D1270:51b-12	de phyir shin tu phra ba'i skyon yang legs par brtags te yongs su spang //	de_0 phyir_3 shin_9 tu_14 phra_17 ba_22 skyon_27 yang_33 legs_38 ba_43 rtog_47 te_54 yongs_57 su_63 spong_66 
T02D1270:51b-13	pus mo'i tshad du brkos pas ni //	pus_0 mo_4 tshad_9 du_15 rko_18 ba_24 ni_28 
T02D1270:51b-14	sa brtag legs par ma byung na //	sa_0 rtog_3 legs_9 ba_14 ma_18 'byung_21 na_27 
T02D1270:51b-15	rked pa'i tshad du brko bar bya //	rked_0 ba_5 tshad_10 du_16 rko_19 ba_24 byed_28 
T02D1270:51b-16	gseg ma la sogs mang gyur nas //	gseg_0 ma_5 la_8 sogs_11 mang_16 gyur_21 nas_26 
T02D1270:51b-17	de dag bsal bar ma nus na //	de_0 'dag_3 bsal_7 ba_12 ma_16 nus_19 na_23 
T02D1270:51b-18	chu dang yungs kar shis par bya //	chu_0 dang_4 yungs_9 kar_15 shis_19 ba_24 byed_28 
T02D1270:51b-19	chu dang yungs kar lag bzung nas //	chu_0 dang_4 yungs_9 kar_15 lag_19 bzung_23 nas_29 
T02D1270:51b-20	sa gzhi yongs su khyab gtor te //	sa_0 gzhi_3 yongs_8 su_14 khyab_17 'thor_23 te_28 
T02D1270:51b-21	sngags ni 'od bcas drag tu brjod //	sngags_0 ni_7 'od_10 'cha'_14 drag_19 tu_24 rjod_27 
T02D1270:51b-22	aom ha na ha na krodha h'um phat /	aom_0 ha_4 na_7 ha_10 na_13 krodha_16 h_23 phat_28 
T02D1270:51b-23	de nas h'um gis byin gyis brlabs pa'i chu dang	de_0 nas_3 h_7 gis_12 byin_16 gyis_21 brlabs_26 ba_33 chu_38 dang_42 
T02D1270:51b-24	sa la las thams cad pa'i sngags kyis lan du	sa_0 la_3 las_6 thams_10 cad_16 ba_20 sngags_25 kyis_32 lan_37 du_41 
T02D1270:51b-25	mar bsngags te sa la khyab par gtor nas /	mar_0 bsngags_4 te_12 sa_15 la_18 khyab_21 ba_27 'thor_31 nas_36 
T02D1270:51b-26	rin po che lnga dang sman lnga rgyal ba'i sa bon gyis byin gyis brlabs te /	rin_0 po_4 che_7 lnga_11 dang_16 sman_21 lnga_26 rgyal_31 ba_37 sa_42 bon_45 gyis_49 byin_54 gyis_59 brlabs_64 te_71 
T02D1270:51b-27	dkyil 'khor gyi snying por bcug nas /	dkyil_0 'khor_6 gyi_12 snying_16 por_23 'jug_27 nas_32 
T02D1270:51b-28	shin tu mnyam par legs par brdung bar bya'o //	shin_0 tu_5 mnyam_8 ba_14 legs_18 ba_23 rdung_27 ba_34 byed_38 
T02D1270:51b-29	bdag gam las kyi rdo rje ma yin pas mi bya'o //	bdag_0 gam_5 las_9 kyi_13 rdo_17 rje_21 ma_25 yin_28 ba_32 mi_36 byed_39 
T02D1270:51b-30	rgyal po'i pho brang nang dang ni //	rgyal_0 po_6 pho_11 brang_15 nang_21 dang_26 ni_31 
T02D1270:51b-31	mi mnyam pa yi sa phyogs dang //	mi_0 mnyam_3 ba_9 yi_12 sa_15 phyogs_18 dang_25 
T02D1270:51b-32	glang chen ba glang ra ba dang //	glang_0 chen_6 ba_11 glang_14 ra_20 ba_23 dang_26 
