T02D2684:230b-0	de'i @230b rgyu dang /	de_0 rgyu_11 dang_16 
T02D2684:230b-1	rkyen dang /	rkyen_0 dang_6 
T02D2684:230b-2	rang bzhin dang /	rang_0 bzhin_5 dang_11 
T02D2684:230b-3	dbye ba'o //	'byed_0 ba_5 
T02D2684:230b-4	sems de legs par rtogs shing bsgrub pa las mya	sems_0 de_5 legs_8 ba_13 rtogs_17 shing_23 sgrub_29 ba_36 las_39 mya_43 
T02D2684:230b-5	ngan las 'das pa'i bde ba ji ltar 'byung zhe	ngan_0 las_5 'da'_9 ba_14 bde_19 ba_23 ji_26 ltar_29 'byung_34 zhe_41 
T02D2684:230b-6	na / rang byung gi ye shes chen po'i rkyen gyis mya ngan 'das pa zhes bya ba ste /	na_0 rang_5 'byung_10 gi_16 ye_19 shes_22 chen_27 po_32 rkyen_37 gyis_43 mya_48 ngan_52 'da'_57 ba_62 zhes_65 byed_70 ba_74 ste_77 
T02D2684:230b-7	rgyu dang rkyen dang rang bzhin dang dbye ba'o //	rgyu_0 dang_5 rkyen_10 dang_16 rang_21 bzhin_26 dang_32 'byed_37 ba_42 
T02D2684:230b-8	de dag zhib tu bla ma'i lung las shes par bya'o //	de_0 'dag_3 zhib_7 tu_12 bla_15 ma_19 lung_24 las_29 shes_33 ba_38 byed_42 
T02D2684:230b-9	de ltar na rdo rje khro bo las byung ba'i	de_0 ltar_3 na_8 rdo_11 rje_15 khro_19 'bo_24 las_27 'byung_31 ba_37 
T02D2684:230b-10	rdo rje snying po sems kyi de bzhin nyid de	rdo_0 rje_4 snying_8 po_15 sems_18 kyi_23 de_27 bzhin_30 nyid_36 de_41 
T02D2684:230b-11	las rgyun du gnas shing brtan pa thob pas ni	las_0 rgyun_4 du_10 gnas_13 shing_18 brtan_24 ba_30 'thob_33 ba_38 ni_42 
T02D2684:230b-12	rnam par rtog pas bar du mi tshod pa zhes	rnam_0 ba_5 rtogs_9 ba_14 ba_18 du_22 mi_25 tshod_28 ba_34 zhes_37 
T02D2684:230b-13	bya ste chos kyi sku'o //	byed_0 ste_4 chos_8 kyi_13 sku_17 
T02D2684:230b-14	'dus ma byas par lhun gyis grub pa'i rdo rje	'du_0 ma_5 byed_8 ba_13 lhun_17 gyis_22 'grub_27 ba_32 rdo_37 rje_41 
T02D2684:230b-15	lta bu'i sku yin pa'i phyir rkyen gyis mi shigs	lta_0 bu_4 sku_9 yin_13 ba_17 phyir_22 rkyen_28 gyis_34 mi_39 shigs_42 
T02D2684:230b-16	pa'o // yang dag ba'i don la slu ba med pas na bden pa'o //	ba_0 yang_8 'dag_13 ba_17 don_22 la_26 slu_29 ba_33 med_36 ba_40 na_44 bden_47 ba_52 
T02D2684:230b-17	don na rtogs pa dang thog par dka' bas na sra ba'o //	don_0 na_4 rtogs_7 ba_13 dang_16 thogs_21 ba_26 dka'_30 ba_35 na_39 sra_42 ba_46 
T02D2684:230b-18	rdo rje snying po de ngan song du gnas pa'i	rdo_0 rje_4 snying_8 po_15 de_18 ngan_21 'gro_26 du_31 gnas_34 ba_39 
T02D2684:230b-19	tshe dman par mi 'gyur la nya ngan las 'das	tshe_0 dman_5 ba_10 mi_14 'gyur_17 la_23 nya_26 ngan_30 las_35 'da'_39 
T02D2684:230b-20	pa'i dus na bzang bar mi 'gyur bas na brtan	ba_0 dus_5 na_9 bzang_12 ba_18 mi_22 'gyur_25 ba_31 na_35 brtan_38 
T02D2684:230b-21	pa'o // gang gi rdo rje snying po de rtogs	ba_0 gang_8 gi_13 rdo_16 rje_20 snying_24 po_31 de_34 rtogs_37 
T02D2684:230b-22	pas nam mkha' ltar ci'i ngo bor yang ma grub	ba_0 nam_4 mkha'_8 ltar_14 ci_19 ngo_24 'bor_28 yang_32 ma_37 'grub_40 
T02D2684:230b-23	bas na thogs pa med pa'o //	ba_0 na_4 thogs_7 ba_13 med_16 ba_20 
T02D2684:230b-24	stong pa nyid nam mkha' lta bu de la gang	stong_0 ba_6 nyid_9 nam_14 mkha'_18 lta_24 bu_28 de_31 la_34 gang_37 
T02D2684:230b-25	gis kyang mi tshugs shing glags mi rnyed pas na	gis_0 kyang_4 mi_10 tshugs_13 shing_20 glags_26 mi_32 rnyed_35 ba_41 na_45 
T02D2684:230b-26	thams cad du ma pham pa'o //	thams_0 cad_6 du_10 ma_13 'pham_16 ba_21 
T02D2684:230b-27	rdo rje gnas bdun po des ci phal cher bdag gi don yul chos ki dbyings bstan to //	rdo_0 rje_4 gnas_8 bdun_13 po_18 des_21 ci_25 phal_28 cher_33 bdag_38 gi_43 don_46 yul_50 chos_54 ki_59 dbyings_62 ston_70 to_76 
T02D2684:230b-28	da ni phal cher gzhan gyi don gyi dbang du	da_0 ni_3 phal_6 cher_11 gzhan_16 gyi_22 don_26 gyi_30 dbang_34 du_40 
T02D2684:230b-29	mdzad nas ye shes kyi khyad par gsungs ba ni	mdzad_0 nas_6 ye_10 shes_13 kyi_18 khyad_22 ba_28 gsungs_32 ba_39 ni_42 
T02D2684:230b-30	sems can thams cad skrag par byed pa zhes bya	sems_0 can_5 thams_9 cad_15 skrag_19 ba_25 byed_29 ba_34 zhes_37 byed_42 
T02D2684:230b-31	ba la sogs pa phrin las bco brgyad ni drang	ba_0 la_3 sogs_6 ba_11 phrin_14 las_20 'chos_24 brgyad_28 ni_35 'dren_38 
T02D2684:230b-32	ba'i don ltar na 'khrul 'khor bris te sgra ji	ba_0 don_5 ltar_9 na_14 'khrul_17 'khor_24 'bri_30 te_35 sgra_38 ji_43 
T02D2684:230b-33	bzhin no zhes 'chad par 'gyur ro //	bzhin_0 no_6 zhes_9 'chad_14 ba_20 'gyur_24 ro_30 
T02D2684:230b-34	'dir nges pa'i don ltar na bco brgyad po de	'dir_0 nges_5 ba_10 don_15 ltar_19 na_24 'chos_27 brgyad_31 po_38 de_41 
T02D2684:230b-35	ni lam gyi rim pas ni stong pa nyid bco	ni_0 lam_3 gyi_7 rim_11 ba_15 ni_19 stong_22 ba_28 nyid_31 'chos_36 
T02D2684:230b-36	brgyad yin zhing 'bras bu'i dus na ni sangs rgyas	brgyad_0 yin_7 zhing_11 'bras_17 bu_23 dus_28 na_32 ni_35 sangs_38 rgya_44 
T02D2684:230b-37	kyi chos ma 'dres pa bco brgyad du rig par	kyi_0 chos_4 ma_9 'dre_12 ba_18 'chos_21 brgyad_25 du_32 rig_35 ba_39 
T02D2684:230b-38	bya'o // de la sems ni rang rig pa de lus la brten pas na sems can no //	byed_0 de_9 la_12 sems_15 ni_20 rang_23 rig_28 ba_32 de_35 lus_38 la_42 rten_45 ba_51 na_55 sems_58 can_63 no_67 
T02D2684:230b-39	thams cad ni ji snyed pa ma lus pa'o //	thams_0 cad_6 ni_10 ji_13 snyed_16 ba_22 ma_25 lus_28 ba_32 
T02D2684:230b-40	skrag par byed ces bya ba ni stong ba nyid	skrag_0 ba_6 byed_10 ces_15 byed_19 ba_23 ni_26 stong_29 ba_35 nyid_38 
T02D2684:230b-41	kyi ye shes kyi mes rang gi sems kyi nyon	kyi_0 ye_4 shes_7 kyi_12 mes_16 rang_20 gi_25 sems_28 kyi_33 nyon_37 
T02D2684:230b-42	mongs pa skrag pa'o //	mongs_0 ba_6 skrag_9 ba_15 
T02D2684:230b-43	sems can ni sngar bzhin no //	sems_0 can_5 ni_9 sngar_12 bzhin_18 no_24 
T02D2684:230b-44	'jil ba ni nyon mongs pa mngon du rgyu ba rnams so //	'jil_0 ba_5 ni_8 nyon_11 mongs_16 ba_22 mngon_25 du_31 rgyu_34 ba_39 rnams_42 so_48 
T02D2684:230b-45	rig sngags ni phyi'i yul rnams so //	rig_0 sngags_4 ni_11 phyi_14 yul_21 rnams_25 so_31 
T02D2684:230b-46	gcod pa ni sems las gzhan pa'i don ma grub par rtogs pa'o //	gcod_0 ba_5 ni_8 sems_11 las_16 gzhan_20 ba_26 don_31 ma_35 'grub_38 ba_43 rtogs_47 ba_53 
T02D2684:231a-0	rig sngags ni snga ma bzhin te gnon pa'i yul la @231a * //	rig_0 sngags_4 ni_11 snga_14 ma_19 bzhin_22 te_28 gnon_31 ba_36 yul_41 la_45 
T02D2684:231a-1	'phro ba bkag pa'o //	'phro_0 ba_6 'gog_9 ba_14 
T02D2684:231a-2	las ni 'bad ba dang rtsol ba'o //	las_0 ni_4 'bad_7 ba_12 dang_15 rtsol_20 ba_26 
T02D2684:231a-3	stong pa nyid la 'bad cing sgrub pa'i las byed pas na 'joms ba'o //	stong_0 ba_6 nyid_9 la_14 'bad_17 cing_22 sgrub_27 ba_33 las_38 byed_42 ba_47 na_51 'joms_54 ba_60 
T02D2684:231a-4	da ltar ba gzhan pa'i las sngon gyi las so //	da_0 ltar_3 ba_8 gzhan_11 ba_17 las_22 sngon_26 gyi_32 las_36 so_40 
T02D2684:231a-5	'jig pa ni zad cing zhi bar byed pa'o //	'jig_0 ba_5 ni_8 zad_11 cing_15 zhi_20 ba_24 byed_28 ba_33 
T02D2684:231a-6	gdon ni rnam par rtog ba'o //	'don_0 ni_5 rnam_8 ba_13 rtogs_17 ba_22 
T02D2684:231a-7	thams cad ni bzang ngan la sogs pa'o //	thams_0 cad_6 ni_10 bzang_13 ngan_19 la_24 sogs_27 ba_32 
T02D2684:231a-8	brlag pa ni don rtogs pas rang bzhin gyur ba'o //	brlag_0 ba_6 ni_9 don_12 rtogs_16 ba_22 rang_26 bzhin_31 gyur_37 ba_42 
T02D2684:231a-9	gdon ni snga ma bzhin no //	'don_0 ni_5 snga_8 ma_13 bzhin_16 no_22 
T02D2684:231a-10	thar pa ni slar mi skye ba skye ste gtan sbangs pa'o //	thar_0 ba_5 ni_8 slar_11 mi_16 skye_19 ba_24 skye_27 ste_32 gtan_36 sbong_41 ba_48 
T02D2684:231a-11	'byung po ni dbugs rgyu rlung la sogs pa 'byung ba bzhi'o //	'byung_0 po_7 ni_10 dbugs_13 rgyu_19 rlung_24 la_30 sogs_33 ba_38 'byung_41 ba_48 bzhi_51 
T02D2684:231a-12	'gugs pa ni rlung la sogs ba ste stong pa'i	'gugs_0 ba_6 ni_9 rlung_12 la_18 sogs_21 ba_26 ste_29 stong_33 ba_39 
T02D2684:231a-13	ting nge 'dzin la gnas pa'i stobs kyis rang bzhin	ting_0 nge_5 'dzin_9 la_15 gnas_18 ba_23 stobs_28 kyis_34 rang_39 bzhin_44 
T02D2684:231a-14	gyi rgyu ba chad de bstan pa'o //	gyi_0 rgyu_4 ba_9 'chad_12 de_17 ston_20 ba_26 
T02D2684:231a-15	rig sngags yul rnams so //	rig_0 sngags_4 yul_11 rnams_15 so_21 
T02D2684:231a-16	las thams cad ni snang bar bsgyur ba ste 'byung ba la dbang thob pas so //	las_0 thams_4 cad_10 ni_14 snang_17 ba_23 sgyur_27 ba_34 ste_37 'byung_41 ba_48 la_51 dbang_54 'thob_60 ba_65 so_69 
T02D2684:231a-17	ma grub pa ni ting nge 'dzin mi gsal ba'o //	ma_0 'grub_3 ba_8 ni_11 ting_14 nge_19 'dzin_23 mi_29 gsal_32 ba_37 
T02D2684:231a-18	grub bar byed pa ni de kho na nyid la	'grub_0 ba_5 byed_9 ba_14 ni_17 de_20 kho_23 na_27 nyid_30 la_35 
T02D2684:231a-19	sogs pa'i khrus kyis de bzhin nyid gsal zhing brtan	sogs_0 ba_5 'khru_10 kyis_16 de_21 bzhin_24 nyid_30 gsal_35 zhing_40 brtan_46 
T02D2684:231a-20	pa'o // grub pa ni ting nge 'dzin nyid do //	ba_0 'grub_8 ba_13 ni_16 ting_19 nge_24 'dzin_28 nyid_34 do_39 
T02D2684:231a-21	chud mi za ba ni slar mi nyams pa'o //	chud_0 mi_5 za_8 ba_11 ni_14 slar_17 mi_22 nyams_25 ba_31 
T02D2684:231a-22	chos sku las gzugs skur 'char zhing des yid la	chos_0 sku_5 las_9 gzugs_13 skur_19 'char_24 zhing_30 des_36 yid_40 la_44 
T02D2684:231a-23	bsams pa ltar phan 'dogs pas na 'dod pa thams	bsams_0 ba_6 ltar_9 phan_14 'dogs_19 ba_25 na_29 'dod_32 ba_37 thams_40 
T02D2684:231a-24	cad rab tu sbyin pa'o //	cad_0 rab_4 tu_8 sbyin_11 ba_17 
T02D2684:231a-25	ting nge 'dzin de las sangs rgyas kyi chos thams	ting_0 nge_5 'dzin_9 de_15 las_18 sangs_22 rgya_28 kyi_34 chos_38 thams_43 
T02D2684:231a-26	cad 'byung bas na 'dod pa thams cad sbyin pa'o	cad_0 'byung_4 ba_11 na_15 'dod_18 ba_23 thams_26 cad_32 sbyin_36 ba_42 
T02D2684:231a-27	// sems can ni gdul bya'o //	sems_3 can_8 ni_12 gdul_15 byed_20 
T02D2684:231a-28	srung ba ni 'khor ba las so //	srung_0 ba_6 ni_9 'khor_12 ba_18 las_21 so_25 
T02D2684:231a-29	ji ltar srung zhe na nyon mongs pa bzhi dang //	ji_0 ltar_3 srung_8 zhe_14 na_18 nyon_21 mongs_26 ba_32 bzhi_35 dang_40 
T02D2684:231a-30	rjes su mthun pa'i phrin las bzhes so //	rjes_0 su_5 mthun_8 ba_14 phrin_19 las_25 bzhes_29 so_35 
T02D2684:231a-31	gang zhe na 'dod chags can dang zhe sdang can dang /	gang_0 zhe_5 na_9 'dod_12 chags_17 can_23 dang_27 zhe_32 sdang_36 can_42 dang_46 
T02D2684:231a-32	gti mug can dang cha mnyam pa la zhi ba dang /	gti_0 mug_4 can_8 dang_12 cha_17 mnyam_21 ba_27 la_30 zhi_33 ba_37 dang_40 
T02D2684:231a-33	mngon spyod dang dbang dang rgyas pa rnams go rims ltar sbyar ro ;	mngon_0 spyod_6 dang_12 dbang_17 dang_23 rgya_28 ba_34 rnams_37 go_43 rims_46 ltar_51 sbyor_56 ro_62 
T02D2684:231a-34	/ rengs par byed pa ni zhe sdang can la'o //	rengs_2 ba_8 byed_12 ba_17 ni_20 zhe_23 sdang_27 can_33 la_37 
T02D2684:231a-35	rmugs par byed pa ni gti mug can la'o //	rmugs_0 ba_6 byed_10 ba_15 ni_18 gti_21 mug_25 can_29 la_33 
T02D2684:231a-36	gzhan yang zhi ba ni de bzhin nyid dang chos kyi dbyings so //	gzhan_0 yang_6 zhi_11 ba_15 ni_18 de_21 bzhin_24 nyid_30 dang_35 chos_40 kyi_45 dbyings_49 so_57 
T02D2684:231a-37	rgyas pa la ni mngon du gyur pa'i chos kyi sku'o //	rgya_0 ba_6 la_9 ni_12 mngon_15 du_21 gyur_24 ba_29 chos_34 kyi_39 sku_43 
T02D2684:231a-38	rengs pa ni mngon spyod de bde ba chen po	rengs_0 ba_6 ni_9 mngon_12 spyod_18 de_24 bde_27 ba_31 chen_34 po_39 
T02D2684:231a-39	la mngon par longs spyod pas na longs spyod rdzogs	la_0 mngon_3 ba_9 longs_13 spyod_19 ba_25 na_29 longs_32 spyod_38 rdzogs_44 
T02D2684:231a-40	pa'i sku'o// rmugs pa ni ye shes la sogs ba mi mnga' ba'i phyir sprul skur rig par bya'o //	ba_0 rmugs_13 ba_19 ni_22 ye_25 shes_28 la_33 sogs_36 ba_41 mi_44 mnga'_47 ba_53 phyir_58 sprul_64 skur_70 rig_75 ba_79 byed_83 
T02D2684:231a-41	zhi ba ni thabs gang gis sems can gyi rgyu ba rags pa rnams zhi nas gnas ba'o //	zhi_0 ba_4 ni_7 thabs_10 gang_16 gis_21 sems_25 can_30 gyi_34 rgyu_38 ba_43 rags_46 ba_51 rnams_54 zhi_60 nas_64 gnas_68 ba_73 
T02D2684:231a-42	rgyas ba ni de las lhag pa'i myong ba mthong ba'am rtogs pa'o //	rgya_0 ba_6 ni_9 de_12 las_15 lhag_19 ba_24 myong_29 ba_35 mthong_38 ba_45 rtogs_51 ba_57 
T02D2684:231a-43	rengs pa ni zhi bar gnas shing lhag pas mthong	rengs_0 ba_6 ni_9 zhi_12 ba_16 gnas_20 shing_25 lhag_31 ba_36 mthong_40 
T02D2684:231b-0	bas sems @231b nyid myong bar mi 'gyur bas de'i	ba_0 sems_4 nyid_15 myong_20 ba_26 mi_30 'gyur_33 ba_39 de_43 
T02D2684:231b-1	phyir rengs pa zhes bya'o //	phyir_0 rengs_6 ba_12 zhes_15 byed_20 
T02D2684:231b-2	de'i ngang la gnas na dmigs pa'i yul ci yang	de_0 ngang_5 la_11 gnas_14 na_19 dmigs_22 ba_28 yul_33 ci_37 yang_40 
T02D2684:231b-3	ma grub cing mthong ba'am rtogs pa'am bye brag phyed	ma_0 'grub_3 cing_8 mthong_13 ba_20 rtogs_26 ba_32 'bye_38 brag_42 phyed_47 
T02D2684:231b-4	pa'i dngos bor 'gyur ba ci 'ang med ba'i phyir	ba_0 dngos_5 'bor_11 'gyur_15 ba_21 ci_24 'ang_27 med_32 ba_36 phyir_41 
T02D2684:231b-5	rmugs pa zhes bya ste /	rmugs_0 ba_6 zhes_9 byed_14 ste_18 
T02D2684:231b-6	stong pa nyid kyi ngang la gnas pa zhes bya ba'i don to //	stong_0 ba_6 nyid_9 kyi_14 ngang_18 la_24 gnas_27 ba_32 zhes_35 byed_40 ba_44 don_49 to_53 
T02D2684:231b-7	gsang sngags kyi mthu chen po zhes bya ba ni	gsang_0 sngags_6 kyi_13 mthu_17 chen_22 po_27 zhes_30 byed_35 ba_39 ni_42 
T02D2684:231b-8	sngar brjod pa'i stong pa nyid chos thams cad kyi	sngar_0 rjod_6 ba_12 stong_17 ba_23 nyid_26 chos_31 thams_36 cad_42 kyi_46 
T02D2684:231b-9	rang bzhin te de ni ngo bo nyid kyis gsang	rang_0 bzhin_5 te_11 de_14 ni_17 ngo_20 'bo_24 nyid_27 kyis_32 gsang_37 
T02D2684:231b-10	ba'am sbas pa lta bur gnas shing rtogs par dka'	ba_0 sbed_6 ba_11 lta_14 bur_18 gnas_22 shing_27 rtogs_33 ba_39 dka'_43 
T02D2684:231b-11	bas gsang sngags zhes bya'o //	ba_0 gsang_4 sngags_10 zhes_17 byed_22 
T02D2684:231b-12	de'i mthu ni chos nyid bden pa'i nus ba'o //	de_0 mthu_5 ni_10 chos_13 nyid_18 bden_23 ba_28 nus_33 ba_37 
T02D2684:231b-13	chen po ni dngos po dang mtshan ma'i tshogs chen	chen_0 po_5 ni_8 dngos_11 po_17 dang_20 mtshan_25 ma_32 tshogs_37 chen_44 
T02D2684:231b-14	po yang 'joms la mtshan mas slar gzhom pa'am glags	po_0 yang_3 'joms_8 la_14 mtshan_17 mas_24 slar_28 'joms_33 ba_39 glags_45 
T02D2684:231b-15	mi rnyed pa ste /	mi_0 rnyed_3 ba_9 ste_12 
T02D2684:231b-16	ji ltar nyi mas mun pa 'joms kyi mun pa de ltar ma yin pa bzhin no //	ji_0 ltar_3 nyi_8 mas_12 mun_16 ba_20 'joms_23 kyi_29 mun_33 ba_37 de_40 ltar_43 ma_48 yin_51 ba_55 bzhin_58 no_64 
T02D2684:231b-17	rab tu smras zhes bya ba ni don zab mo	rab_0 tu_4 smras_7 zhes_13 byed_18 ba_22 ni_25 don_28 zab_32 mo_36 
T02D2684:231b-18	rtogs pa'i yan lag tu re shig tshig dang yi	rtogs_0 ba_6 yan_11 lag_15 tu_19 re_22 shig_25 tshig_30 dang_36 yi_41 
T02D2684:231b-19	ge gsungs par zad de /	ge_0 gsungs_3 ba_10 zad_14 de_18 
T02D2684:231b-20	rdo rje snying po'am yang dag pa'i don la ni	rdo_0 rje_4 snying_8 po_15 yang_21 'dag_26 ba_30 don_35 la_39 ni_42 
T02D2684:231b-21	smra ba'am bstan par mi nus te rang rig pa'i	smra_0 ba_5 ston_11 ba_17 mi_21 nus_24 te_28 rang_31 rig_36 ba_40 
T02D2684:231b-22	ye shes kyi ngo bo yin pa'i phyir ro //	ye_0 shes_3 kyi_8 ngo_12 'bo_16 yin_19 ba_23 phyir_28 ro_34 
T02D2684:231b-23	na mo ratna tra y'a ya zhes bya ba la	na_0 mo_3 ratna_6 tra_12 y_16 ya_20 zhes_23 byed_28 ba_32 la_35 
T02D2684:231b-24	sogs pa'i gsang sngags kyi don ni byin gyi rlabs	sogs_0 ba_5 gsang_10 sngags_16 kyi_23 don_27 ni_31 byin_34 gyi_39 rlabs_43 
T02D2684:231b-25	chung bar 'gyur bas na ma phye'o //	chung_0 ba_6 'gyur_10 ba_16 na_20 ma_23 'byed_26 
T02D2684:231b-26	de ltar bstan pa'i don des cir 'gyur zhe na /	de_0 ltar_3 ston_8 ba_14 don_19 des_23 cir_27 'gyur_31 zhe_37 na_41 
T02D2684:231b-27	rgyud do cog gi rtsa ba ma rig pa la	brgyud_0 do_6 cog_9 gi_13 rtsa_16 ba_21 ma_24 rig_27 ba_31 la_34 
T02D2684:231b-28	sogs pa'i nyes pa rnams zhi nas nyes pa'i 'bras	sogs_0 ba_5 nyes_10 ba_15 rnams_18 zhi_24 nas_28 nyes_32 ba_37 'bras_42 
T02D2684:231b-29	bu sdug bsngal thams cad mi 'byung ste de la	bu_0 sdug_3 sngal_8 thams_15 cad_21 mi_25 'byung_28 ste_35 de_39 la_42 
T02D2684:231b-30	dgongs nas / sdug pa thams cad byang byas nas //	dgongs_0 nas_7 sdug_13 ba_18 thams_21 cad_27 byang_31 byed_37 nas_42 
T02D2684:231b-31	sdug bsngal thams cad med par byed /	sdug_0 sngal_5 thams_12 cad_18 med_22 ba_26 byed_30 
T02D2684:231b-32	ces gsungs so //	ces_0 gsungs_4 so_11 
T02D2684:231b-33	'di skad du gsungs pa yin te gang zhig skye	'di_0 skad_4 du_9 gsungs_12 ba_19 yin_22 te_26 gang_29 'jig_34 skye_39 
T02D2684:231b-34	ba la sogs pa'i sdug bsngal 'di dag ni sngon	ba_0 la_3 sogs_6 ba_11 sdug_16 sngal_21 'di_28 'dag_32 ni_36 sngon_39 
T02D2684:231b-35	rang rang gi sdig pa mi dge ba spyad pa	rang_0 rang_5 gi_10 sdig_13 ba_18 mi_21 dge_24 ba_28 spyod_31 ba_37 
T02D2684:231b-36	las byung bas te sdig pa mi dge ba'i las	las_0 'byung_4 ba_10 te_14 sdig_17 ba_22 mi_25 dge_28 ba_32 las_37 
T02D2684:231b-37	de yang sems la gnas bas na gang gis sems	de_0 yang_3 sems_8 la_13 gnas_16 ba_21 na_25 gang_28 gis_33 sems_37 
T02D2684:231b-38	kyi rang bzhin 'od gsal ba rtogs pa de'i tshe	kyi_0 rang_4 bzhin_9 'od_15 gsal_19 ba_24 rtogs_27 ba_33 de_36 tshe_41 
T02D2684:231b-39	bag chags kyi dri ma dag pas sdig pa thams	bag_0 chags_4 kyi_10 'dri_14 ma_18 'dag_21 ba_25 sdig_29 ba_34 thams_37 
T02D2684:231b-40	cad dag par gyur nas de'i 'bras bu las kyi	cad_0 'dag_4 ba_8 gyur_12 nas_17 de_21 'bras_26 bu_32 las_35 kyi_39 
T02D2684:231b-41	rnam smin sdug bsngal la sogs pa myong bar 'gyur	rnam_0 smin_5 sdug_10 sngal_15 la_22 sogs_25 ba_30 myong_33 ba_39 'gyur_43 
T02D2684:231b-42	ba thams cad kyang med par byed do zhes bstan	ba_0 thams_3 cad_9 kyang_13 med_19 ba_23 byed_27 do_32 zhes_35 ston_40 
T02D2684:231b-43	par 'gyur ro // da ni 'jig rten dang 'jig	ba_0 'gyur_4 ro_10 da_16 ni_19 'jig_22 rten_27 dang_32 'jig_37 
T02D2684:231b-44	rten las 'das pa'i 'bras bu phun sum tshogs pa	rten_0 las_5 'da'_9 ba_14 'bras_19 bu_25 phun_28 sum_33 tshogs_37 ba_44 
T02D2684:231b-45	par 'gyur ro // ston te / 'dir gsang sngags	ba_0 'gyur_4 ro_10 ston_16 te_21 'dir_26 gsang_31 sngags_37 
T02D2684:231b-46	kyi 'bras bu nyan thos la sogs pa phung po	kyi_0 'bras_4 bu_10 nyan_13 thos_18 la_23 sogs_26 ba_31 'phung_34 po_40 
T02D2684:231b-47	lhag ma med pa'i mya ngan las 'das pa tho	lhag_0 ma_5 med_8 ba_12 mya_17 ngan_21 las_26 'da'_30 ba_35 tho_38 
T02D2684:231b-48	rangs kyi mar me shi ba ltar mi 'dod bas	rangs_0 kyi_6 mar_10 me_14 'chi_17 ba_21 ltar_24 mi_29 'dod_32 ba_37 
T02D2684:231b-49	yon tan gyi dbang du mdzad de /	yon_0 tan_4 gyi_8 dbang_12 du_18 mdzad_21 de_27 
T02D2684:232a-0	dpal kun gyis ni legs @232a * //	dpal_0 kun_5 gyis_9 ni_14 legs_17 
T02D2684:232a-1	par brgyan //	ba_0 rgyan_4 
T02D2684:232a-2	zhes gsungs so //	zhes_0 gsungs_5 so_12 
T02D2684:232a-3	des ni nges pa'i don rnams bshad zin to //	des_0 ni_4 nges_7 ba_12 don_17 rnams_21 'chad_27 zin_33 to_37 
T02D2684:232a-4	da ni drang ba'i don brjod par bya ste /	da_0 ni_3 'dren_6 ba_12 don_17 rjod_21 ba_27 byed_31 ste_35 
T02D2684:232a-5	de la phrin las kyi bye brag bco brgyad do //	de_0 la_3 phrin_6 las_12 kyi_16 'bye_20 brag_24 'chos_29 brgyad_33 do_40 
T02D2684:232a-6	mdor bsdus na phrin las bzhi'o //	mdor_0 sdud_5 na_11 phrin_14 las_20 bzhi_24 
T02D2684:232a-7	de la lha'i rnal 'byor dang ldan pas las 'di	de_0 la_3 lha_6 rnal_12 'byor_17 dang_23 ldan_28 ba_33 las_37 'di_41 
T02D2684:232a-8	dag bsgrub par bya'i stong pa nyid kyis ma yin	'dag_0 sgrub_4 ba_11 byed_15 stong_21 ba_27 nyid_30 kyis_35 ma_40 yin_43 
T02D2684:232a-9	no // de yang tshes gsum dang ldan pa'i sngags	no_0 de_6 yang_9 tshes_14 gsum_20 dang_25 ldan_30 ba_35 sngags_40 
T02D2684:232a-10	pas 'grub par rje btsun gsungs te de gang zhe	ba_0 'grub_4 ba_10 rje_14 btsun_18 gsungs_24 te_31 de_34 gang_37 zhe_42 
T02D2684:232a-11	na rtogs pa'i gdengs dang ldan pa dang lha las	na_0 rtogs_3 ba_9 gdeng_14 dang_21 ldan_26 ba_31 dang_34 lha_39 las_43 
T02D2684:232a-12	su rung pa dang /	su_0 rung_3 ba_8 dang_11 
T02D2684:232a-13	bzlas pa mthar phyin pa'o //	bzlas_0 ba_6 mthar_9 phyin_15 ba_21 
T02D2684:232a-14	de lta bu'i sngags pas sgrub pa ni snying brtse	de_0 lta_3 bu_7 sngags_12 ba_19 sgrub_23 ba_29 ni_32 snying_35 brtse_42 
T02D2684:232a-15	ba sngon du 'grongs bya'i gzhan du na dam tshig	ba_0 sngon_3 du_9 'grongs_12 byed_20 gzhan_26 du_32 na_35 dam_38 tshig_42 
T02D2684:232a-16	dang 'gal bar 'gyur ba'i phyir //	dang_0 'gal_5 ba_10 'gyur_14 ba_20 phyir_25 
T02D2684:232a-17	de la dang por las bco brgyad la phrin las	de_0 la_3 dang_6 por_11 las_15 'chos_19 brgyad_23 la_30 phrin_33 las_39 
T02D2684:232a-18	bzhi'i 'khrul 'khor bri bar bya ste 'khrul 'khor gyi	bzhi_0 'khrul_7 'khor_14 'bri_20 ba_24 byed_28 ste_32 'khrul_36 'khor_43 gyi_49 
T02D2684:232a-19	rgyu dang dus dang kha dog dang dbyibs so //	rgyu_0 dang_5 dus_10 dang_14 kha_19 dog_23 dang_27 dbyibs_32 so_39 
T02D2684:232a-20	de la zhi ba'i 'khrul 'khor ni rgyu ras la	de_0 la_3 zhi_6 ba_10 'khrul_15 'khor_22 ni_28 rgyu_31 ras_36 la_40 
T02D2684:232a-21	sogs pa la'o ma dang tsandan la sogs pas so	sogs_0 ba_5 la_8 ma_13 dang_16 tsandan_21 la_29 sogs_32 ba_37 so_41 
T02D2684:232a-22	// dus snga dro'o //	dus_3 snga_7 dro_12 
T02D2684:232a-23	mdog dkar po'o //	mdog_0 dkar_5 po_10 
T02D2684:232a-24	dbyibs zlum po ste padma rgyas pa lta bu'o //	dbyibs_0 zlum_7 po_12 ste_15 padma_19 rgya_25 ba_31 lta_34 bu_38 
T02D2684:232a-25	rgyas pa'i 'khrul 'khor ni rgyu shing shun la sogs pa la gi wang la sogs pas so //	rgya_0 ba_6 'khrul_11 'khor_18 ni_24 rgyu_27 shing_32 shun_38 la_43 sogs_46 ba_51 la_54 gi_57 wang_60 la_65 sogs_68 ba_73 so_77 
T02D2684:232a-26	dus nya'am phyed gang du'o //	dus_0 nya_4 phyed_11 gang_17 du_22 
T02D2684:232a-27	mdog ser po'o //	mdog_0 ser_5 po_9 
T02D2684:232a-28	dbyibs gru bzhi pa'o //	dbyibs_0 gru_7 bzhi_11 ba_16 
T02D2684:232a-29	dbang gi rgyu ni ras sam shing shun la mtshal dang li khri la sogs pas so //	dbang_0 gi_6 rgyu_9 ni_14 ras_17 sam_21 shing_25 shun_31 la_36 mtshal_39 dang_46 li_51 khri_54 la_59 sogs_62 ba_67 so_71 
T02D2684:232a-30	dus phyi dro'o //	dus_0 phyi_4 dro_9 
T02D2684:232a-31	mdog dmar pos so //	mdog_0 dmar_5 pos_10 so_14 
T02D2684:232a-32	dbyibs ni zla gam mo //	dbyibs_0 ni_7 zla_10 gam_14 mo_18 
T02D2684:232a-33	mngon spyod kyi rgyu ni ro ras sam zhing chen la dug dang khrag gis bris pa'o //	mngon_0 spyod_6 kyi_12 rgyu_16 ni_21 ro_24 ras_27 sam_31 zhing_35 chen_41 la_46 dug_49 dang_53 khrag_58 gis_64 'bri_68 ba_73 
T02D2684:232a-34	dus ni dgra la mtshan phyed na'o //	dus_0 ni_4 dgra_7 la_12 mtshan_15 phyed_22 na_28 
T02D2684:232a-35	bgegs la nyin phyed na'o //	bgegs_0 la_6 nyin_9 phyed_14 na_20 
T02D2684:232a-36	dbyibs dang kha dog ni nag po gru gsum mo //	dbyibs_0 dang_7 kha_12 dog_16 ni_20 nag_23 po_27 gru_30 gsum_34 mo_39 
T02D2684:232a-37	sngags dang ting nge 'dzin ni lung las shes par bya'o //	sngags_0 dang_7 ting_12 nge_17 'dzin_21 ni_27 lung_30 las_35 shes_39 ba_44 byed_48 
T02D2684:232a-38	sems can ni gang yang rung ba'o ;	sems_0 can_5 ni_9 gang_12 yang_17 rung_22 ba_27 
T02D2684:232a-39	/ dbang po ni rnam par shes pa skye ba'i rten mig la sogs pa'o //	dbang_2 po_8 ni_11 rnam_14 ba_19 shes_23 ba_28 skye_31 ba_36 rten_41 mig_46 la_50 sogs_53 ba_58 
T02D2684:232a-40	nyams pa ni mi gsal ba'am dman bar gyur pa'o //	nyams_0 ba_6 ni_9 mi_12 gsal_15 ba_20 dman_26 ba_31 gyur_35 ba_40 
T02D2684:232a-41	'og nas gnod pa dang zhes bya ba thams cad	'og_0 nas_4 gnod_8 ba_13 dang_16 zhes_21 byed_26 ba_30 thams_33 cad_39 
T02D2684:232a-42	la sbyar te dbang po nyams pa'i gnod pa dang	la_0 sbyor_3 te_9 dbang_12 po_18 nyams_21 ba_27 gnod_32 ba_37 dang_40 
T02D2684:232a-43	zhes bya bar rig ba'o //	zhes_0 byed_5 ba_9 rig_13 ba_17 
T02D2684:232a-44	gnod pa de dag khrus bzhi po sngar bstan pa la gnas pas zhi bar zhes rig par bya'o //	gnod_0 ba_5 de_8 'dag_11 'khru_15 bzhi_21 po_26 sngar_29 ston_35 ba_41 la_44 gnas_47 ba_52 zhi_56 ba_60 zhes_64 rig_69 ba_73 byed_77 
T02D2684:232a-45	tshul ji ltar gnas pas zhe na sgrub pa po	tshul_0 ji_6 ltar_9 gnas_14 ba_19 zhe_23 na_27 sgrub_30 ba_36 po_39 
T02D2684:232a-46	gang dag yid dge ba ni kun la phan par	gang_0 'dag_5 yid_9 dge_13 ba_17 ni_20 kun_23 la_27 phan_30 ba_35 
T02D2684:232a-47	'dod pas so // sems dang ba ni chos la gus pa dang spros pas so //	'dod_0 ba_5 so_9 sems_15 dang_20 ba_25 ni_28 chos_31 la_36 gus_39 ba_43 dang_46 spros_51 ba_57 so_61 
T02D2684:232a-48	dam tshig dang sdom pa ma nyams pa ni gtsang ma'i gos kyis rab brgyan te //	dam_0 tshig_4 dang_10 sdom_15 ba_20 ma_23 nyams_26 ba_32 ni_35 gtsang_38 ma_45 gos_50 kyis_54 rab_59 rgyan_63 te_70 
T02D2684:232a-49	zhes bya'o //	zhes_0 byed_5 
T02D2684:232b-0	mnyan par bya @232b zhes 'brel te gang zhe na mdo sde dam pa'o //	nyan_0 ba_6 byed_10 zhes_20 'brel_25 te_31 gang_34 zhe_39 na_43 mdo_46 sde_50 dam_54 ba_58 
T02D2684:232b-1	ji lta bu zhe na /	ji_0 lta_3 bu_7 zhe_10 na_14 
T02D2684:232b-2	zab mo sangs rgyas spyod yul ba'o //	zab_0 mo_4 sangs_7 rgya_13 spyod_19 yul_25 ba_29 
T02D2684:232b-3	'di ni slob dpon la lung blangs pa las 'bras	'di_0 ni_4 slob_7 dpon_12 la_17 lung_20 blangs_25 ba_32 las_35 'bras_39 
T02D2684:232b-4	bu 'thob kyi rang dgas ni ma yin zhes dgongs	bu_0 'thob_3 kyi_9 rang_13 'gas_18 ni_23 ma_26 yin_29 zhes_33 dgongs_38 
T02D2684:232b-5	pa'o // chos rnams kyi de kho na nyid mdor bsdus te gsungs pas na mdo sde'o //	ba_0 chos_8 rnams_13 kyi_19 de_23 kho_26 na_30 nyid_33 mdor_38 sdud_43 te_49 gsungs_52 ba_59 na_63 mdo_66 sde_70 
T02D2684:232b-6	de la nyan cing rjes su bsgrubs pas gnas skabs kyi 'bras bu yang /	de_0 la_3 nyan_6 cing_11 rjes_16 su_21 sgrub_24 ba_32 gnas_36 skabs_41 kyi_47 'bras_51 bu_57 yang_60 
T02D2684:232b-7	mdo sde 'di yi gzi brjid kyis //	mdo_0 sde_4 'di_8 yi_12 gzi_15 brjid_19 kyis_25 
T02D2684:232b-8	srog chags dag ni thams cad kyi //	srog_0 chags_5 'dag_11 ni_15 thams_18 cad_24 kyi_28 
T02D2684:232b-9	zhes bya ba la sogs pa gsungs te /	zhes_0 byed_5 ba_9 la_12 sogs_15 ba_20 gsungs_23 te_30 
T02D2684:232b-10	thams cad kyi nad zhi zhes bya ba ni gang dag nyams su len pa rnams kyi'o //	thams_0 cad_6 kyi_10 nad_14 zhi_18 zhes_22 byed_27 ba_31 ni_34 gang_37 'dag_42 nyams_46 su_52 len_55 ba_59 rnams_62 kyi_68 
T02D2684:232b-11	drang ba'i don bshad zin to //	'dren_0 ba_6 don_11 'chad_15 zin_21 to_25 
T02D2684:232b-12	da ni rdzas dang sngags kyi grangs gsungs pa ni /	da_0 ni_3 rdzas_6 dang_12 sngags_17 kyi_24 grangs_28 gsungs_35 ba_42 ni_45 
