T02D1887:188b-26	rnyed na yang tshig gis smras la dbang rin po	rnyed_0 na_6 yang_9 tshig_14 gis_20 smras_24 la_30 dbang_33 rin_39 po_43 
T02D1887:188b-27	che slob dpon gyi man ngag las ye shes kyi	che_0 slob_4 dpon_9 gyi_14 man_18 ngag_22 las_27 ye_31 shes_34 kyi_39 
T02D1887:188b-28	dbang sbyin pa de la bzhi pa mngon par brjod	dbang_0 sbyin_6 ba_12 de_15 la_18 bzhi_21 ba_26 mngon_29 ba_35 rjod_39 
T02D1887:188b-29	pa dbang bskur ba'i rin po che bla ma'i man	ba_0 dbang_3 skur_9 ba_15 rin_20 po_24 che_27 bla_31 ma_35 man_40 
T02D1887:188b-30	ngag gis rtogs par bya ba'i ngo bo sbyin par	ngag_0 gis_5 rtogs_9 ba_15 byed_19 ba_23 ngo_28 'bo_32 sbyin_35 ba_41 
T02D1887:188b-31	bya'o // de ni /	byed_0 de_9 ni_12 
T02D1887:188b-32	slob pa ma'i mos pa yid kyis yongs brtags la //	slob_0 ba_5 ma_8 mos_13 ba_17 yid_20 kyis_24 yongs_29 rtog_35 la_42 
T02D1887:188b-33	ji skad gsungs pa'i cho gas gsang byin nas //	ji_0 skad_3 gsungs_8 ba_15 cho_20 'gas_24 gsang_28 byin_34 nas_39 
T02D1887:188b-34	rgya che zab pa'i tshul la mos pa na //	rgya_0 che_5 zab_9 ba_13 tshul_18 la_24 mos_27 ba_31 na_34 
T02D1887:188b-35	dbang bskur rin chen tshig nyid sbyin par bya //	dbang_0 skur_6 rin_12 chen_16 tshig_21 nyid_27 sbyin_32 ba_38 byed_42 
T02D1887:188b-36	zhes gsungs so //	zhes_0 gsungs_5 so_12 
T02D1887:188b-37	shes rab ye shes kyi dbang bskur dngos su ma	shes_0 rab_5 ye_9 shes_12 kyi_17 dbang_21 skur_27 dngos_33 su_39 ma_42 
T02D1887:188b-38	thob pa la slar yang tshig tsam gyis dbang bskur	'thob_0 ba_5 la_8 slar_11 yang_16 tshig_21 tsam_27 gyis_32 dbang_37 skur_43 
T02D1887:188b-39	ba sbyin par mi bya ste /	ba_0 sbyin_3 ba_9 mi_13 byed_16 ste_20 
T02D1887:188b-40	dam tshig nyams pas 'jigs pa'i phyir ro //	dam_0 tshig_4 nyams_10 ba_16 'jigs_20 ba_26 phyir_31 ro_37 
T02D1887:188b-41	'o na gal te shes rab ye shes kyi dbang	'o_0 na_3 gal_6 te_10 shes_13 rab_18 ye_22 shes_25 kyi_30 dbang_34 
T02D1887:188b-42	bskur dngos su ma thob pa la tshig tsam gyi	skur_0 dngos_6 su_12 ma_15 'thob_18 ba_23 la_26 tshig_29 tsam_35 gyi_40 
T02D1887:188b-43	dbang bskur ba bkag na /	dbang_0 skur_6 ba_12 'gog_15 na_20 
T02D1887:188b-44	ji ltar na dge slong rnams rjes su gzung bar bya zhe na /	ji_0 ltar_3 na_8 dge_11 slong_15 rnams_21 rjes_27 su_32 gzung_35 ba_41 byed_45 zhe_49 na_53 
T02D1887:188b-45	dge slong rnams rjes su gzung bar mi bya ste /	dge_0 slong_4 rnams_10 rjes_16 su_21 gzung_24 ba_30 mi_34 byed_37 ste_41 
T02D1887:188b-46	de dag la ni 'dir dbang med pa'i phyir /	de_0 'dag_3 la_7 ni_10 'dir_13 dbang_18 med_24 ba_28 phyir_33 
T02D1887:188b-47	de ltar yang /	de_0 ltar_3 yang_8 
T02D1887:188b-48	gang yang dge slong dngos dga' dang //	gang_0 yang_5 dge_10 slong_14 dngos_20 dga'_26 dang_31 
T02D1887:188b-49	gang yang rtog ge la dga'i mi //	gang_0 yang_5 rtogs_10 ge_15 la_18 dga_21 mi_27 
T02D1887:188b-50	gang yang rgan po'i dngos gnas pa //	gang_0 yang_5 rgan_10 po_15 dngos_20 gnas_26 ba_31 
T02D1887:189a-0	de @189a * //	de_0 
T02D1887:189a-1	la de nyid bstan mi bya //	la_0 de_3 nyid_6 ston_11 mi_17 byed_20 
T02D1887:189a-2	zhes gsungs so //	zhes_0 gsungs_5 so_12 
T02D1887:189a-3	'o na ji ltar na /	'o_0 na_3 ji_6 ltar_9 na_14 
T02D1887:189a-4	so sor 'brang ma chen mo la sogs par gsungs pa /	so_0 sor_3 'brang_7 ma_14 chen_17 mo_22 la_25 sogs_28 ba_33 gsungs_37 ba_44 
T02D1887:189a-5	dge slong rdo rje 'dzin pas bya //	dge_0 slong_4 rdo_10 rje_14 'dzin_18 ba_24 byed_28 
T02D1887:189a-6	bdud la bsdigs pa la brtson pa //	bdud_0 la_5 sdig_8 ba_15 la_18 brtson_21 ba_28 
T02D1887:189a-7	zhes bya ba la sogs pa ni gsungs pa nyid do zhe na /	zhes_0 byed_5 ba_9 la_12 sogs_15 ba_20 ni_23 gsungs_26 ba_33 nyid_36 do_41 zhe_44 na_48 
T02D1887:189a-8	'on kyang dge slong 'ga' zhig gcig tu nges par	'on_0 kyang_4 dge_10 slong_14 'ga'_20 'jig_25 gcig_30 tu_35 nges_38 ba_43 
T02D1887:189a-9	grags pa'i dka' thub can nyan thos kyi theg pa	grags_0 ba_6 dka'_11 thub_16 can_21 nyan_25 thos_30 kyi_35 theg_39 ba_44 
T02D1887:189a-10	lta ba gcig pa ste /	lta_0 ba_4 gcig_7 ba_12 ste_15 
T02D1887:189a-11	de la ni sngags dang phyag rgya la sogs pa'i dbang bskur ba dbang med pa nyid do //	de_0 la_3 ni_6 sngags_9 dang_16 phyag_21 rgya_27 la_32 sogs_35 ba_40 dbang_45 skur_51 ba_57 dbang_60 med_66 ba_70 nyid_73 do_78 
T02D1887:189a-12	yang gang zhig nyan thos kyi sdom pa dang theg	yang_0 gang_5 'jig_10 nyan_15 thos_20 kyi_25 sdom_29 ba_34 dang_37 theg_42 
T02D1887:189a-13	pa chen por sems bskyed pa dang ldan pa ste	ba_0 chen_3 por_8 sems_12 skyed_17 ba_24 dang_27 ldan_32 ba_37 ste_40 
T02D1887:189a-14	/ de la sngags dang phyag rgya la sogs pa la dbang yod de /	de_2 la_5 sngags_8 dang_15 phyag_20 rgya_26 la_31 sogs_34 ba_39 la_42 dbang_45 yod_51 de_55 
T02D1887:189a-15	de yang gsang ba'i dbang bskur ba la sogs pa med do //	de_0 yang_3 gsang_8 ba_14 dbang_19 skur_25 ba_31 la_34 sogs_37 ba_42 med_45 do_49 
T02D1887:189a-16	yang gang zhig nyan thos kyi sdom pa dang sngags	yang_0 gang_5 'jig_10 nyan_15 thos_20 kyi_25 sdom_29 ba_34 dang_37 sngags_42 
T02D1887:189a-17	kyi tshul la yang sems bskyed pa dang ldan pa	kyi_0 tshul_4 la_10 yang_13 sems_18 skyed_23 ba_30 dang_33 ldan_38 ba_43 
T02D1887:189a-18	ste / de la ni thams cad du dbang bskur	ste_0 de_6 la_9 ni_12 thams_15 cad_21 du_25 dbang_28 skur_34 
T02D1887:189a-19	ba la sogs pa'i dbang yod pa ste de nyid	ba_0 la_3 sogs_6 ba_11 dbang_16 yod_22 ba_26 ste_29 de_33 nyid_36 
T02D1887:189a-20	ni rdo rje 'dzin pas bdud la bsdigs pa la	ni_0 rdo_3 rje_7 'dzin_11 ba_17 bdud_21 la_26 sdig_29 ba_36 la_39 
T02D1887:189a-21	ste / sogs pa bya'o ; / o na de ltar	ste_0 sogs_6 ba_11 byed_14 na_26 de_29 ltar_32 
T02D1887:189a-22	na yang ji ltar na dge slong gi sdom pa	na_0 yang_3 ji_8 ltar_11 na_16 dge_19 slong_23 gi_29 sdom_32 ba_37 
T02D1887:189a-23	mi nyams par 'gyur ram zhe na /	mi_0 nyams_3 ba_9 'gyur_13 ram_19 zhe_23 na_27 
T02D1887:189a-24	mi 'gyur te /	mi_0 'gyur_3 te_9 
T02D1887:189a-25	'di ltar dge slong gi sdom pa ma btang bar /	'di_0 ltar_4 dge_9 slong_13 gi_19 sdom_22 ba_27 ma_30 gtong_33 ba_39 
T02D1887:189a-26	phyi nang gsang ba'i theg pa gsum //	phyi_0 nang_5 gsang_10 ba_16 theg_21 ba_26 gsum_29 
T02D1887:189a-27	sdom pa so sor gzung bar bgyi //	sdom_0 ba_5 so_8 sor_11 gzung_15 ba_21 bgyid_25 
T02D1887:189a-28	zhes bya ba la sogs pa gang gi tshe /	zhes_0 byed_5 ba_9 la_12 sogs_15 ba_20 gang_23 gi_28 tshe_31 
T02D1887:189a-29	sdom pa gzhan dang mi 'gal zhing ;	sdom_0 ba_5 gzhan_8 dang_14 mi_19 'gal_22 zhing_27 
T02D1887:189a-30	/ lhag pa yang so sor 'dzin pa yin na de'i tshe ji ltar sdom pa nyams /	lhag_2 ba_7 yang_10 so_15 sor_18 'dzin_22 ba_28 yin_31 na_35 de_38 tshe_43 ji_48 ltar_51 sdom_56 ba_61 nyams_64 
T02D1887:189a-31	ci ste mi 'gal zhing lhag pa'i sdom pa ma	ci_0 ste_3 mi_7 'gal_10 zhing_15 lhag_21 ba_26 sdom_31 ba_36 ma_39 
T02D1887:189a-32	nyams par yin du bcug na dge slong gi sdom	nyams_0 ba_6 yin_10 du_14 'jug_17 na_22 dge_25 slong_29 gi_35 sdom_38 
T02D1887:189a-33	pa la dbang po gnyis snyoms par 'jug par byed	ba_0 la_3 dbang_6 po_12 gnyis_15 snyom_21 ba_28 'jug_32 ba_37 byed_41 
T02D1887:189a-34	pa ji ltar mi nyams she na /	ba_0 ji_3 ltar_6 mi_11 nyams_14 she_20 na_24 
T02D1887:189a-35	de ltar na yang mi nyams te /	de_0 ltar_3 na_8 yang_11 mi_16 nyams_19 te_25 
T02D1887:189a-36	'dul ba la sogs par bkag pa spyod pa ni	'dul_0 ba_5 la_8 sogs_11 ba_16 'gog_20 ba_25 spyod_28 ba_34 ni_37 
T02D1887:189a-37	nyams par bstan gyi yang ma bkag par spyod pa	nyams_0 ba_6 ston_10 gyi_16 yang_20 ma_25 'gog_28 ba_33 spyod_37 ba_43 
T02D1887:189a-38	la ni ma yin no //	la_0 ni_3 ma_6 yin_9 no_13 
T02D1887:189a-39	khams gsum par gyur pa'i mi dang lha la sogs	khams_0 gsum_6 ba_11 gyur_15 ba_20 mi_25 dang_28 lha_33 la_37 sogs_40 
T02D1887:189a-40	pa'i mdzes ma rnams la zag pa dang bcas pa'i	ba_0 mdzes_5 ma_11 rnams_14 la_20 zag_23 ba_27 dang_30 'cha'_35 ba_40 
T02D1887:189a-41	mngon par zhen pa myong pa'i mtshan nyid 'dod chags	mngon_0 ba_6 zhen_10 ba_15 myong_18 ba_24 mtshan_29 nyid_36 'dod_41 chags_46 
T02D1887:189a-42	byang bar byed pa de dag 'dul ba la sogs	byang_0 ba_6 byed_10 ba_15 de_18 'dag_21 'dul_25 ba_30 la_33 sogs_36 
T02D1887:189a-43	par bkag gi / yang khams gsum pa las 'das	ba_0 'gog_4 gi_9 yang_14 khams_19 gsum_25 ba_30 las_33 'da'_37 
T02D1887:189a-44	pa'i lus can rnam par rig pa tsam du ngo	ba_0 lus_5 can_9 rnam_13 ba_18 rig_22 ba_26 tsam_29 du_34 ngo_37 
T02D1887:189a-45	bo gcig pa'i 'jam pa'i rdo rje la sogs pa	'bo_0 gcig_3 ba_8 'jam_13 ba_18 rdo_23 rje_27 la_31 sogs_34 ba_39 
T02D1887:189a-46	rang snang ba'i ngo bo rnams ni ma yin no	rang_0 snang_5 ba_11 ngo_16 'bo_20 rnams_23 ni_29 ma_32 yin_35 no_39 
T02D1887:189a-47	// gzhan du na rmi lam du nye bar dmigs pa dang /	gzhan_3 du_9 na_12 rmi_15 lam_19 du_23 nye_26 ba_30 dmigs_34 ba_40 dang_43 
T02D1887:189a-48	rtog pa'i yul gyi rang bzhin gyi ngo bo rnams la yang sdom pa nyams par 'gyur ro //	rtogs_0 ba_5 yul_10 gyi_14 rang_18 bzhin_23 gyi_29 ngo_33 'bo_37 rnams_40 la_46 yang_49 sdom_54 ba_59 nyams_62 ba_68 'gyur_72 ro_78 
T02D1887:189b-0	ci ste de dag la @189b yang bdag gis legs par byas so //	ci_0 ste_3 de_7 'dag_10 la_14 yang_23 bdag_28 gis_33 legs_37 ba_42 byed_46 so_51 
T02D1887:189b-1	bdag gis rab tu gyur to zhes rab tu rjes	bdag_0 gis_5 rab_9 tu_13 gyur_16 to_21 zhes_24 rab_29 tu_33 rjes_36 
T02D1887:189b-2	su yi rang bar byed pa nyon mongs pa can	su_0 yi_3 rang_6 ba_11 byed_15 ba_20 nyon_23 mongs_28 ba_34 can_37 
T02D1887:189b-3	gyi sems la ni ltung bar gyur pa nyid do	gyi_0 sems_4 la_9 ni_12 ltung_15 ba_21 gyur_25 ba_30 nyid_33 do_38 
T02D1887:189b-4	zhe na / ltung ba tsam du gyur pa ni	zhe_0 na_4 ltung_9 ba_15 tsam_18 du_23 gyur_26 ba_31 ni_34 
T02D1887:189b-5	bden na yang sdom pa nyams pa ni ma yin	bden_0 na_5 yang_8 sdom_13 ba_18 nyams_21 ba_27 ni_30 ma_33 yin_36 
T02D1887:189b-6	zhe na / no // gal te de la smod	zhe_0 na_4 no_9 gal_15 te_19 de_22 la_25 smod_28 
T02D1887:189b-7	pa'i sems su byed na de'i tshe ni ltung ba	ba_0 sems_5 su_10 byed_13 na_18 de_21 tshe_26 ni_31 ltung_34 ba_40 
T02D1887:189b-8	tsam du yang mi 'gyur ro //	tsam_0 du_5 yang_8 mi_13 'gyur_16 ro_22 
T02D1887:189b-9	de yang /	de_0 yang_3 
T02D1887:189b-10	sdig pa shin tu mi bzad byas na yang //	sdig_0 ba_5 shin_8 tu_13 mi_16 bzad_19 byed_24 na_29 yang_32 
T02D1887:189b-11	bdag nyid smod par byed pa yang bar 'gyur //	bdag_0 nyid_5 smod_10 ba_15 byed_19 ba_24 yang_27 ba_32 'gyur_36 
T02D1887:189b-12	zhes gsungs so //	zhes_0 gsungs_5 so_12 
T02D1887:189b-13	de ltar na ji ltar rmi lam na nye bar	de_0 ltar_3 na_8 ji_11 ltar_14 rmi_19 lam_23 na_27 nye_30 ba_34 
T02D1887:189b-14	ma dmigs pa kun brags pa'i bud med rnams mos	ma_0 dmigs_3 ba_9 kun_12 brags_16 ba_22 'bud_27 med_31 rnams_35 mos_41 
T02D1887:189b-15	ba nyid 'jug pa'i tshor ba sred pa la yang	ba_0 nyid_3 'jug_8 ba_13 tshor_18 ba_24 sred_27 ba_32 la_35 yang_38 
T02D1887:189b-16	sdom pa nyams pa med la smod pa ni ltung	sdom_0 ba_5 nyams_8 ba_14 med_17 la_21 smod_24 ba_29 ni_32 ltung_35 
T02D1887:189b-17	ba tsam du yang mi 'gyur ba de bzhin du	ba_0 tsam_3 du_8 yang_11 mi_16 'gyur_19 ba_25 de_28 bzhin_31 du_37 
T02D1887:189b-18	khams gsum pa las 'das pa'i 'jam pa'i rdo rje	khams_0 gsum_6 ba_11 las_14 'da'_18 ba_23 'jam_28 ba_33 rdo_38 rje_42 
T02D1887:189b-19	la sogs pa'i rang gi ngo bo shes rab sems	la_0 sogs_3 ba_8 rang_13 gi_18 ngo_21 'bo_25 shes_28 rab_33 sems_37 
T02D1887:189b-20	tsam gyi rang gi ngo bo rnams la yongs su	tsam_0 gyi_5 rang_9 gi_14 ngo_17 'bo_21 rnams_24 la_30 yongs_33 su_39 
T02D1887:189b-21	dag pa mngon par ma zhen pa'i mtshan nyid 'dod	'dag_0 ba_4 mngon_7 ba_13 ma_17 zhen_20 ba_25 mtshan_30 nyid_37 'dod_42 
T02D1887:189b-22	chags chen po mngon du byed pa de mi dmigs	chags_0 chen_6 po_11 mngon_14 du_20 byed_23 ba_28 de_31 mi_34 dmigs_37 
T02D1887:189b-23	pa stong ba nyid bsgoms pas smod pa nyid la	ba_0 stong_3 ba_9 nyid_12 sgom_17 ba_24 smod_28 ba_33 nyid_36 la_41 
T02D1887:189b-24	dge slong gi dngos po nyams pa med cing ltung	dge_0 slong_4 gi_10 dngos_13 po_19 nyams_22 ba_28 med_31 cing_35 ltung_40 
T02D1887:189b-25	ba tsam du yang mi 'gyur ro zhes 'dod par	ba_0 tsam_3 du_8 yang_11 mi_16 'gyur_19 ro_25 zhes_28 'dod_33 ba_38 
T02D1887:189b-26	bya'o // 'o na sems tsam du ngo bo gcig	byed_0 'o_9 na_12 sems_15 tsam_20 du_25 ngo_28 'bo_32 gcig_35 
T02D1887:189b-27	pa'i 'jam pa'i rdo rje la sogs pa'i rang gi	ba_0 'jam_5 ba_10 rdo_15 rje_19 la_23 sogs_26 ba_31 rang_36 gi_41 
T02D1887:189b-28	ngo bo shes rab la rigs pa 'di yod na	ngo_0 'bo_4 shes_7 rab_12 la_16 rigs_19 ba_24 'di_27 yod_31 na_35 
T02D1887:189b-29	phyi rol gyi las kyi phyag rgya 'dul bar bkag	phyi_0 rol_5 gyi_9 las_13 kyi_17 phyag_21 rgya_27 'dul_32 ba_37 'gog_41 
T02D1887:189b-30	pa la rigs pa 'di ji ltar yin zhe na	ba_0 la_3 rigs_6 ba_11 'di_14 ji_18 ltar_21 yin_26 zhe_30 na_34 
T02D1887:189b-31	brjod par bya ste /	rjod_0 ba_6 byed_10 ste_14 
T02D1887:189b-32	ci 'dir khyed kyis gzugs la sogs pa rang gi	ci_0 'dir_3 'khyed_8 kyis_14 gzugs_19 la_25 sogs_28 ba_33 rang_36 gi_41 
T02D1887:189b-33	sems snang ba tsam du lus gcig pa nyid kyi	sems_0 snang_5 ba_11 tsam_14 du_19 lus_22 gcig_26 ba_31 nyid_34 kyi_39 
T02D1887:189b-34	grags pa tsam yang ma thos sam gang gis ni	grags_0 ba_6 tsam_9 yang_14 ma_19 thos_22 sam_27 gang_31 gis_36 ni_40 
T02D1887:189b-35	rjod byed de de bzhin no //	rjod_0 byed_5 de_10 de_13 bzhin_16 no_22 
T02D1887:189b-36	de ltar ni khyed 'dra ba la ni rnam par	de_0 ltar_3 ni_8 'khyed_11 'dra_17 ba_22 la_25 ni_28 rnam_31 ba_36 
T02D1887:189b-37	rig pa tsam gyi ngo bo de kho na go	rig_0 ba_4 tsam_7 gyi_12 ngo_16 'bo_20 de_23 kho_26 na_30 go_33 
T02D1887:189b-38	bar byed pa'am brdzun pa'i ngo bor snang ba tsam	ba_0 byed_4 ba_9 brdzun_15 ba_22 ngo_27 'bor_31 snang_35 ba_41 tsam_44 
T02D1887:189b-39	nyid kyi go bar byed pa dag gis gsang sngags	nyid_0 kyi_5 go_9 ba_12 byed_16 ba_21 'dag_24 gis_28 gsang_32 sngags_38 
T02D1887:189b-40	kyi tshul la dbang yod pa ma yin no //	kyi_0 tshul_4 la_10 dbang_13 yod_19 ba_23 ma_26 yin_29 no_33 
T02D1887:189b-41	gzugs la sogs pa'i dngos po thams cad kyi sems	gzugs_0 la_6 sogs_9 ba_14 dngos_19 po_25 thams_28 cad_34 kyi_38 sems_42 
T02D1887:189b-42	snang ba tsam du go ba la rang gi bud	snang_0 ba_6 tsam_9 du_14 go_17 ba_20 la_23 rang_26 gi_31 'bud_34 
T02D1887:189b-43	med du snang ba dang tha mi dad par 'jam	med_0 du_4 snang_7 ba_13 dang_16 tha_21 mi_25 dad_28 ba_32 'jam_36 
T02D1887:189b-44	pa'i rdo rje la sogs pa rang snang ba'i ngo	ba_0 rdo_5 rje_9 la_13 sogs_16 ba_21 rang_24 snang_29 ba_35 ngo_40 
T02D1887:189b-45	bor yongs su gyur pa'i las kyi phyag rgya sgyu	'bor_0 yongs_4 su_10 gyur_13 ba_18 las_23 kyi_27 phyag_31 rgya_37 sgyu_42 
T02D1887:189b-46	ma lta bu des rnam par sbyangs pa la dbang	ma_0 lta_3 bu_7 des_10 rnam_14 ba_19 sbyong_23 ba_31 la_34 dbang_37 
T02D1887:189b-47	bskur pa kha na ma tho ba med ba thob	skur_0 ba_6 kha_9 na_13 ma_16 tho_19 ba_23 med_26 ba_30 'thob_33 
T02D1887:189b-48	pa la yang dge slong rnams kyi sdom ba zhig	ba_0 la_3 yang_6 dge_11 slong_15 rnams_21 kyi_27 sdom_31 ba_36 'jig_39 
T02D1887:189b-49	pa'i nyes par mi 'gyur ro //	ba_0 nyes_5 ba_10 mi_14 'gyur_17 ro_23 
T02D1887:189b-50	de dag ni bzhi pa'i dbang gi cho ga'o //	de_0 'dag_3 ni_7 bzhi_10 ba_15 dbang_20 gi_26 cho_29 ga_33 
T02D1887:190a-0	dbang bskur mdo ra bsdus brjod pa las ni @190a * //	dbang_0 skur_6 mdo_12 ra_16 sdud_19 rjod_25 ba_31 las_34 ni_38 
T02D1887:190a-1	bdag las skyes pa yi //	bdag_0 las_5 skye_9 ba_15 yi_18 
T02D1887:190a-2	dung zla kunda ku mu dang chu skyes 'od mtshungs pa'i //	dung_0 zla_5 kunda_9 ku_15 mu_18 dang_21 chu_26 skye_30 'od_36 mtshungs_40 ba_49 
T02D1887:190a-3	bsod nams gang yin mkha' dang mtshungs pa des ni 'gro ba'i tshogs //	bsod_0 nams_5 gang_10 yin_15 mkha'_19 dang_25 mtshungs_30 ba_39 des_42 ni_46 'gro_49 ba_54 tshogs_59 
T02D1887:190a-4	shes rab padma las byung rdo rje 'chang gi rang	shes_0 rab_5 padma_9 las_15 'byung_19 rdo_25 rje_29 'chang_33 gi_40 rang_43 
T02D1887:190a-5	bzhin shog / gsang ba 'dus pa'i dbang bskur ba'i	bzhin_0 shog_6 gsang_13 ba_19 'du_22 ba_27 dbang_32 skur_38 ba_44 
T02D1887:190a-6	cho ga mdor bsdus pa rdzogs so /	cho_0 ga_4 mdor_7 sdud_12 ba_18 rdzogs_21 so_28 
T02D1887:190a-8	// / di ni pandi ta ngag gi dbang phyug grags pas mdzad pa /	ni_8 pandi_11 ta_17 ngag_20 gi_25 dbang_28 phyug_34 grags_40 ba_46 mdzad_50 ba_56 
T02D1887:190a-9	bal po'i pandi ta su ma ti k'i ti'i zhal snga nas dang /	bal_0 po_4 pandi_9 ta_15 su_18 ma_21 ti_24 k_27 ti_31 zhal_36 snga_41 nas_46 dang_50 
T02D1887:190a-10	bod kyi lo ts'a ba klog skya gzhon nu 'bar gyi zhal snga nas dang /	'bod_0 kyi_4 lo_8 ts_11 ba_16 klog_19 skya_24 gzhon_29 nu_35 'bar_38 gyi_43 zhal_47 snga_52 nas_57 dang_61 
T02D1887:190a-11	mar pa chos kyi dbang phyug gis bsgyur cing zhus pa'o /	mar_0 ba_4 chos_7 kyi_12 dbang_16 phyug_22 gis_28 sgyur_32 cing_39 zhus_44 ba_49 
