T02D1407:133b-14	lus pa med par grub ces pa ni bcom ldan	lus_0 ba_4 med_7 ba_11 'grub_15 ces_20 ba_24 ni_27 'joms_30 ldan_35 
T02D1407:133b-15	'das kyis de dang de las gsungs pa'i dngos grub	'da'_0 kyis_5 de_10 dang_13 de_18 las_21 gsungs_25 ba_32 dngos_37 'grub_43 
T02D1407:133b-16	lus pa med par 'grub ces pa'i don to //	lus_0 ba_4 med_7 ba_11 'grub_15 ces_21 ba_25 don_30 to_34 
T02D1407:133b-17	rgyal srid thams cad ces pa ni rdo rje 'dzin pa nyid do //	rgyal_0 srid_6 thams_11 cad_17 ces_21 ba_25 ni_28 rdo_31 rje_35 'dzin_39 ba_45 nyid_48 do_53 
T02D1407:133b-18	dung dang nya phyis mu tig rnams //	dung_0 dang_5 nya_10 'byid_14 mu_20 tig_23 rnams_27 
T02D1407:133b-19	zhes pa la sogs pa dang //	zhes_0 ba_5 la_8 sogs_11 ba_16 dang_19 
T02D1407:133b-20	gsum char rgyu las byung ba yin //	gsum_0 char_5 rgyu_10 las_15 'byung_19 ba_25 yin_28 
T02D1407:133b-21	zhes pa la /	zhes_0 ba_5 la_8 
T02D1407:133b-22	rgyu zhes pa ni mi dge ba'i las rnams so //	rgyu_0 zhes_5 ba_10 ni_13 mi_16 dge_19 ba_23 las_28 rnams_32 so_38 
T02D1407:133b-23	'byung ba zhes pa ni de las byung ba ste 'gro ba rigs drug rnams so //	'byung_0 ba_7 zhes_10 ba_15 ni_18 de_21 las_24 'byung_28 ba_34 ste_37 'gro_41 ba_46 rigs_49 drug_54 rnams_59 so_65 
T02D1407:133b-24	de rnams kyi nang nas bsod nams chen pos skyes pa'i mi'i 'gro ba'o //	de_0 rnams_3 kyi_9 nang_13 nas_18 bsod_22 nams_27 chen_32 pos_37 skye_41 ba_47 mi_52 'gro_57 ba_62 
T02D1407:133b-25	de lta bu 'dis na chos kyi sku'i lus can gyi thod pa la ni su zhig smod de /	de_0 lta_3 bu_7 'dis_10 na_15 chos_18 kyi_23 sku_27 lus_33 can_37 gyi_41 thod_45 ba_50 la_53 ni_56 su_59 'jig_62 smod_67 de_72 
T02D1407:133b-26	smad par mi bya'o zhes pa'i don te /	smad_0 ba_5 mi_9 byed_12 zhes_18 ba_23 don_28 te_32 
T02D1407:133b-27	dge ba'i las kyis bskyed pa'i 'bras bu ni ma yin pa'i phyir na shin tu dka' ste /	dge_0 ba_4 las_9 kyis_13 skyed_18 ba_25 'bras_30 bu_36 ni_39 ma_42 yin_45 ba_49 phyir_54 na_60 shin_63 tu_68 dka'_71 ste_76 
T02D1407:133b-28	bsod nams kyi tshogs chen po las 'byung bas na'o //	bsod_0 nams_5 kyi_10 tshogs_14 chen_21 po_26 las_29 'byung_33 ba_40 na_44 
T02D1407:133b-29	ci'i phyir na mi'i skye ba mchog ce na //	ci_0 phyir_5 na_11 mi_14 skye_19 ba_24 mchog_27 ce_33 na_36 
T02D1407:133b-30	ye shes dang thar pa'i don rab tu bsgrub pa'i	ye_0 shes_3 dang_8 thar_13 ba_18 don_23 rab_27 tu_31 sgrub_34 ba_41 
T02D1407:133b-31	gnas yin pas na chos kyi sku'i lus can gyi	gnas_0 yin_5 ba_9 na_13 chos_16 kyi_21 sku_25 lus_31 can_35 gyi_39 
T02D1407:133b-32	thod pa la lha dang mi rnams la gzugs mdzes	thod_0 ba_5 la_8 lha_11 dang_15 mi_20 rnams_23 la_29 gzugs_32 mdzes_38 
T02D1407:133b-33	pa'i yon tan gyi gzhi po de la bsngags so	ba_0 yon_5 tan_9 gyi_13 gzhi_17 po_22 de_25 la_28 bsngags_31 so_39 
T02D1407:133b-34	// de nas shin tu sna tshogs pa'i phyag rgya	de_3 nas_6 shin_10 tu_15 sna_18 tshogs_22 ba_29 phyag_34 rgya_40 
T02D1407:133b-35	lnga po ni mi rus kyi phreng bar shin tu	lnga_0 po_5 ni_8 mi_11 rus_14 kyi_18 phreng_22 ba_29 shin_33 tu_38 
T02D1407:133b-36	// nges te / shin tu dag pa'i rgyan rnams	nges_3 te_8 shin_13 tu_18 'dag_21 ba_25 rgyan_30 rnams_36 
T02D1407:133b-37	bzang pos dpa' bo rnam par mdzes par bshad do	bzang_0 pos_6 dpa'_10 'bo_15 rnam_18 ba_23 mdzes_27 ba_33 'chad_37 do_43 
T02D1407:133b-38	// nges te / // brda zhes pa ni brda ste /	nges_3 te_8 brda_16 zhes_21 ba_26 ni_29 brda_32 ste_37 
T02D1407:133b-39	sangs rgyas kyi phyag rgyas dpa' bo rnams kyi lag pa g-yon pa 'di sangs rgyas lnga'i gzugs dang /	sangs_0 rgya_6 kyi_12 phyag_16 rgya_22 dpa'_28 'bo_33 rnams_36 kyi_42 lag_46 ba_50 g-yon_53 ba_59 'di_62 sangs_66 rgya_72 lnga_78 gzugs_85 dang_91 
T02D1407:134a-0	@134a * // 'byung ba lnga'i bdag nyid dang /	'byung_11 ba_18 lnga_21 bdag_28 nyid_33 dang_38 
T02D1407:134a-1	sna tshogs pa'i brtan pa dang g-yo ba'i 'gro ba	sna_0 tshogs_4 ba_11 brtan_16 ba_22 dang_25 g-yo_30 ba_35 'gro_40 ba_45 
T02D1407:134a-2	ma lus pa ni rtsa lnga'i rang bzhin gyis ji	ma_0 lus_3 ba_7 ni_10 rtsa_13 lnga_18 rang_25 bzhin_30 gyis_36 ji_41 
T02D1407:134a-3	ltar bde ba'i bdag nyid du bskyed do //	ltar_0 bde_5 ba_9 bdag_14 nyid_19 du_24 skyed_27 do_34 
T02D1407:134a-4	de lta bus mngon par byang chub par 'byung ba'i theg pa'i don mthong bar 'gyur ro //	de_0 lta_3 'bud_7 mngon_11 ba_17 byang_21 chub_27 ba_32 'byung_36 ba_43 theg_48 ba_53 don_58 mthong_62 ba_69 'gyur_73 ro_79 
T02D1407:134a-5	g-yon pa zhes pa ni shes rab ste rang bzhin	g-yon_0 ba_6 zhes_9 ba_14 ni_17 shes_20 rab_25 ste_29 rang_33 bzhin_38 
T02D1407:134a-6	med par kun rdzob ma 'di ni yongs su rig	med_0 ba_4 kun_8 rdzob_12 ma_18 'di_21 ni_25 yongs_28 su_34 rig_37 
T02D1407:134a-7	par byed pa'i thabs kyi mtshan nyid dang gnyis su	ba_0 byed_4 ba_9 thabs_14 kyi_20 mtshan_24 nyid_31 dang_36 gnyis_41 su_47 
T02D1407:134a-8	med pa chos rnams kyi de bzhin nyid de /	med_0 ba_4 chos_7 rnams_12 kyi_18 de_22 bzhin_25 nyid_31 de_36 
T02D1407:134a-9	dpal he ru ka rdo rje phag mo dang gnyis	dpal_0 he_5 ru_8 ka_11 rdo_14 rje_18 phag_22 mo_27 dang_30 gnyis_35 
T02D1407:134a-10	su med pa'i bde ba rdzogs par byang chub pa'i	su_0 med_3 ba_7 bde_12 ba_16 rdzogs_19 ba_26 byang_30 chub_36 ba_41 
T02D1407:134a-11	dkyil 'khor la mngon du phyogs te mnyam par bltas	dkyil_0 'khor_6 la_12 mngon_15 du_21 phyogs_24 te_31 mnyam_34 ba_40 lta_44 
T02D1407:134a-12	na thams cad mgu bar yang dag par 'gyur ro	na_0 thams_3 cad_9 mgu_13 ba_17 yang_21 'dag_26 ba_30 'gyur_34 ro_40 
T02D1407:134a-13	// de'i tshe slob dpon rang nyid dpal dang ldan	de_3 tshe_8 slob_13 dpon_18 rang_23 nyid_28 dpal_33 dang_38 ldan_43 
T02D1407:134a-14	pa'i rdo rje 'chang sangs rgyas kyi yab chen po	ba_0 rdo_5 rje_9 'chang_13 sangs_20 rgya_26 kyi_32 yab_36 chen_40 po_45 
T02D1407:134a-15	// ste / lag pa g-yon la rigs drug po rim pa ji lta ba bzhin du bkod do //	ste_3 lag_9 ba_13 g-yon_16 la_22 rigs_25 drug_30 po_35 rim_38 ba_42 ji_45 lta_48 ba_52 bzhin_55 du_61 bkod_64 do_69 
T02D1407:134a-16	a'a li k'a li mnyam par byas pa las sde	a_0 li_4 k_7 li_11 mnyam_14 ba_20 byed_24 ba_29 las_32 sde_36 
T02D1407:134a-17	tshan rnams kyi grangs las rim pa ji lta ba	tshan_0 rnams_6 kyi_12 grangs_16 las_23 rim_27 ba_31 ji_34 lta_37 ba_41 
T02D1407:134a-18	bzhin du bzlas brjod bya'o //	bzhin_0 du_6 bzlas_9 rjod_15 byed_21 
T02D1407:134a-19	'di lta ste /	'di_0 lta_4 ste_8 
T02D1407:134a-20	sdong por rdo rje sems dpa' bzhugs //	sdong_0 por_6 rdo_10 rje_14 sems_18 dpa'_23 bzhugs_28 
T02D1407:134a-21	zhes pa la /	zhes_0 ba_5 la_8 
T02D1407:134a-22	sdong po zhes pa ni mthe bong ngo //	sdong_0 po_6 zhes_9 ba_14 ni_17 mthe_20 bong_25 ngo_30 
T02D1407:134a-23	lcug mar rnam par snang mdzad bzhugs //	lcug_0 mar_5 rnam_9 ba_14 snang_18 mdzad_24 bzhugs_30 
T02D1407:134a-24	zhes pa la /	zhes_0 ba_5 la_8 
T02D1407:134a-25	lcug ma zhes pa ni mdzub mo'o //	lcug_0 ma_5 zhes_8 ba_13 ni_16 mdzub_19 mo_25 
T02D1407:134a-26	bla mar padma gar dbang bzhugs //	bla_0 mar_4 padma_8 gar_14 dbang_18 bzhugs_24 
T02D1407:134a-27	zhes pa la /	zhes_0 ba_5 la_8 
T02D1407:134a-28	bla ma zhes pa ni gung mo ring po'o //	bla_0 ma_4 zhes_7 ba_12 ni_15 gung_18 mo_23 ring_26 po_31 
T02D1407:134a-29	rgyun la dngos grub thams cad ni //	rgyun_0 la_6 dngos_9 'grub_15 thams_20 cad_26 ni_30 
T02D1407:134a-30	zhes pa la /	zhes_0 ba_5 la_8 
T02D1407:134a-31	rgyun ni srin lag go //	rgyun_0 ni_6 srin_9 lag_14 go_18 
T02D1407:134a-32	mtha' ma la ni mkha' snying po //	mtha'_0 ma_6 la_9 ni_12 mkha'_15 snying_21 po_28 
T02D1407:134a-33	zhes pa la /	zhes_0 ba_5 la_8 
T02D1407:134a-34	mtha' zhes pa ni mthe'u chung ngo //	mtha'_0 zhes_6 ba_11 ni_14 mthe_17 chung_24 ngo_30 
T02D1407:134a-35	rdo rje sems dpa' zhes pa ni go sla'o //	rdo_0 rje_4 sems_8 dpa'_13 zhes_18 ba_23 ni_26 go_29 sla_32 
T02D1407:134a-36	dpa' bo zhes pa ni mi bskyod pa'o //	dpa'_0 'bo_5 zhes_8 ba_13 ni_16 mi_19 skyod_22 ba_29 
T02D1407:134a-37	gang dang gang la gnas pa'i sngags kyi yi ge de dang des rigs kyi ming gis bos la /	gang_0 dang_5 gang_10 la_15 gnas_18 ba_23 sngags_28 kyi_35 yi_39 ge_42 de_45 dang_48 des_53 rigs_57 kyi_62 ming_66 gis_71 'bod_75 la_79 
T02D1407:134a-38	de'i rnal 'byor byin la rab tu gnas par bya'o //	de_0 rnal_5 'byor_10 byin_16 la_21 rab_24 tu_28 gnas_31 ba_36 byed_40 
T02D1407:134a-39	de yang 'di lta ste /	de_0 yang_3 'di_8 lta_12 ste_16 
T02D1407:134a-40	kye dpal che ge mo rdo rje de bzhin gshegs pa zhes so //	kye_0 dpal_4 che_9 ge_13 mo_16 rdo_19 rje_23 de_27 bzhin_30 gshegs_36 ba_43 zhes_46 so_51 
T02D1407:134a-41	de la yang rigs kyi rim pa bzhin du'o //	de_0 la_3 yang_6 rigs_11 kyi_16 rim_20 ba_24 bzhin_27 du_33 
T02D1407:134a-42	aa a'a ka tsa ta ta pa ya sha zhes	aa_0 a_3 ka_7 tsa_10 ta_14 ta_17 ba_20 ya_23 sha_26 zhes_30 
T02D1407:134a-43	pa'i sde tshan gyi yi ge de rnams ni rnam	ba_0 sde_5 tshan_9 gyi_15 yi_19 ge_22 de_25 rnams_28 ni_34 rnam_37 
T02D1407:134a-44	par snang mdzad rgyal po'i bdag nyid do //	ba_0 snang_4 mdzad_10 rgyal_16 po_22 bdag_27 nyid_32 do_37 
T02D1407:134a-45	ai a'i kha tsha tha tha pha ra sha sde	ai_0 a_3 kha_7 tsha_11 tha_16 tha_20 pha_24 ra_28 sha_31 sde_35 
T02D1407:134a-46	tshan gnyis pa 'di dag ni rin chen rgyal po'o	tshan_0 gnyis_6 ba_12 'di_15 'dag_19 ni_23 rin_26 chen_30 rgyal_35 po_41 
T02D1407:134b-0	// au a'u @134b ga dza da da pa la	au_3 a_6 ga_16 dza_19 da_23 da_26 ba_29 la_32 
T02D1407:134b-1	sa zhes pa sde tshan gyi gsum pa de rnams	sa_0 zhes_3 ba_8 sde_11 tshan_15 gyi_21 gsum_25 ba_30 de_33 rnams_36 
T02D1407:134b-2	ni 'od dpag tu med pa'i'o //	ni_0 'od_3 dpog_7 tu_12 med_15 pa'o_19 
T02D1407:134b-3	ae aee gha dzha dha dha bha wa ha zhes	ae_0 aee_3 gha_7 dzha_11 dha_16 dha_20 bha_24 wa_28 ha_31 zhes_34 
T02D1407:134b-4	sde tshan rnams kyi bzhi pa 'di rnams ni don	sde_0 tshan_4 rnams_10 kyi_16 bzhi_20 ba_25 'di_28 rnams_32 ni_38 don_41 
T02D1407:134b-5	yod grub pa'i'o // ao aoo aam aa: nga nya	yod_0 'grub_4 pa'o_9 ao_19 aoo_22 aam_26 aa:_30 nga_34 nya_38 
T02D1407:134b-6	na ma zhes pa sde tshan rnams kyi lnga pa	na_0 ma_3 zhes_6 ba_11 sde_14 tshan_18 rnams_24 kyi_30 lnga_34 ba_39 
T02D1407:134b-7	'di rnams ni mi bskyod pa'i'o //	'di_0 rnams_4 ni_10 mi_13 skyod_16 pa'o_23 
T02D1407:134b-8	de lta bu ni 'jig rten thams cad kyi zad pa dang skye bar gnas so //	de_0 lta_3 bu_7 ni_10 'jig_13 rten_18 thams_23 cad_29 kyi_33 zad_37 ba_41 dang_44 skye_49 ba_54 gnas_58 so_63 
T02D1407:134b-9	de'i phyir na sangs rgyas thams cad kyi bdag por sbyor bas rdo rje zhes pa ste /	de_0 phyir_5 na_11 sangs_14 rgya_20 thams_26 cad_32 kyi_36 bdag_40 por_45 sbyor_49 ba_55 rdo_59 rje_63 zhes_67 ba_72 ste_75 
T02D1407:134b-10	rim pa ji lta bar rigs drug pa rdo rje sems dpa' bdag po cod pan te /	rim_0 ba_4 ji_7 lta_10 ba_14 rigs_18 drug_23 ba_28 rdo_31 rje_35 sems_39 dpa'_44 bdag_49 po_54 cod_57 pan_61 te_65 
T02D1407:134b-11	rgyu yis 'bras bu la rgyas btab pa dang /	rgyu_0 yis_5 'bras_9 bu_15 la_18 rgya_21 'debs_27 ba_32 dang_35 
T02D1407:134b-12	'bras bus rgyu la rgyas gdab pa'o //	'bras_0 'bud_6 rgyu_10 la_15 rgya_18 gdab_24 ba_29 
T02D1407:134b-13	de la bzhad pa'i rdo rje zhes pa dang /	de_0 la_3 bzhad_6 ba_12 rdo_17 rje_21 zhes_25 ba_30 dang_33 
T02D1407:134b-14	rnam par sgeg pa'i rdo rje zhes pa dang /	rnam_0 ba_5 sgeg_9 ba_14 rdo_19 rje_23 zhes_27 ba_32 dang_35 
T02D1407:134b-15	rdo rje bsgyings pa zhes pa dang /	rdo_0 rje_4 sgying_8 ba_17 zhes_20 ba_25 dang_28 
T02D1407:134b-16	rdo rje rol pa zhes pa ni rnam par snang mdzad kyi rigs kyi ming rnams so //	rdo_0 rje_4 rol_8 ba_12 zhes_15 ba_20 ni_23 rnam_26 ba_31 snang_35 mdzad_41 kyi_47 rigs_51 kyi_56 ming_60 rnams_65 so_71 
T02D1407:134b-17	bde ba'i myu gu rdo rje zhes pa dang /	bde_0 ba_4 myu_9 gu_13 rdo_16 rje_20 zhes_24 ba_29 dang_32 
T02D1407:134b-18	rdo rje padmo zhes pa dang /	rdo_0 rje_4 padmo_8 zhes_14 ba_19 dang_22 
T02D1407:134b-19	padmo'i myu gu rdo rje zhes pa dang /	padmo_0 myu_8 gu_12 rdo_15 rje_19 zhes_23 ba_28 dang_31 
T02D1407:134b-20	rdo rje rol pa zhes pa ni rin po che'i rigs kyi ming rnams so //	rdo_0 rje_4 rol_8 ba_12 zhes_15 ba_20 ni_23 rin_26 po_30 che_33 rigs_39 kyi_44 ming_48 rnams_53 so_59 
T02D1407:134b-21	rdo rje ye shes zhes pa dang /	rdo_0 rje_4 ye_8 shes_11 zhes_16 ba_21 dang_24 
T02D1407:134b-22	rdo rje yid bzhin nor bu zhes pa dang /	rdo_0 rje_4 yid_8 bzhin_12 nor_18 bu_22 zhes_25 ba_30 dang_33 
T02D1407:134b-23	yan lag med pa'i rdo rje zhes pa dang /	yan_0 lag_4 med_8 ba_12 rdo_17 rje_21 zhes_25 ba_30 dang_33 
T02D1407:134b-24	snang byed rdo rje zhes pa ni padma'i rigs can gyi ming rnams so //	snang_0 byed_6 rdo_11 rje_15 zhes_19 ba_24 ni_27 padma_30 rigs_38 can_43 gyi_47 ming_51 rnams_56 so_62 
T02D1407:134b-25	rdo rje shes rab myu gu zhes pa dang /	rdo_0 rje_4 shes_8 rab_13 myu_17 gu_21 zhes_24 ba_29 dang_32 
T02D1407:134b-26	rdo rje snying rje myu gu zhes pa dang /	rdo_0 rje_4 snying_8 rje_15 myu_19 gu_23 zhes_26 ba_31 dang_34 
T02D1407:134b-27	rdo rje mchog tu dga' ba zhes pa dang /	rdo_0 rje_4 mchog_8 tu_14 dga'_17 ba_22 zhes_25 ba_30 dang_33 
T02D1407:134b-28	rdo rje dga' ba de zhes pa dang /	rdo_0 rje_4 dga'_8 ba_13 de_16 zhes_19 ba_24 dang_27 
T02D1407:134b-29	rdo rje 'bebs pa zhes pa ni las kyi rigs can gyi ming rnams so //	rdo_0 rje_4 'bebs_8 ba_14 zhes_17 ba_22 ni_25 las_28 kyi_32 rigs_36 can_41 gyi_45 ming_49 rnams_54 so_60 
T02D1407:134b-30	rdo rje bde ba chen po zhes pa dang /	rdo_0 rje_4 bde_8 ba_12 chen_15 po_20 zhes_23 ba_28 dang_31 
T02D1407:134b-31	rdo rje chags pa zhes pa dang /	rdo_0 rje_4 chags_8 ba_14 zhes_17 ba_22 dang_25 
T02D1407:134b-32	nam mkha' rdo rje zhes pa dang /	nam_0 mkha'_4 rdo_10 rje_14 zhes_18 ba_23 dang_26 
T02D1407:134b-33	shes rab rdo rje zhes pa dang /	shes_0 rab_5 rdo_9 rje_13 zhes_17 ba_22 dang_25 
T02D1407:134b-34	pha rol tu phyin pa'i rdo rje zhes pa ni /	pha_0 rol_4 tu_8 phyin_11 ba_17 rdo_22 rje_26 zhes_30 ba_35 ni_38 
T02D1407:134b-35	zhe sdang gi rigs can rnams kyi ming ste /	zhe_0 sdang_4 gi_10 rigs_13 can_18 rnams_22 kyi_28 ming_32 ste_37 
T02D1407:134b-36	gya nom snang ba la sogs par rab tu gnas	'gyas_0 mnam_4 snang_8 ba_14 la_17 sogs_20 ba_25 rab_29 tu_33 gnas_36 
T02D1407:134b-37	pa na phyag rgya chen por grub pa rnams kyi	ba_0 na_3 phyag_6 rgya_12 chen_17 por_22 'grub_26 ba_31 rnams_34 kyi_40 
T02D1407:134b-38	ming du 'gyur ro //	ming_0 du_5 'gyur_8 ro_14 
T02D1407:134b-39	de bzhin du phyag rgya chen po grub pa po rnams kyi ming yang 'gyur te /	de_0 bzhin_3 du_9 phyag_12 rgya_18 chen_23 po_28 'grub_31 ba_36 po_39 rnams_42 kyi_48 ming_52 yang_57 'gyur_62 te_68 
T02D1407:134b-40	rdo rje snying po ma zhes pa dang /	rdo_0 rje_4 snying_8 po_15 ma_18 zhes_21 ba_26 dang_29 
T02D1407:134b-41	rdo rje mtshon cha ma zhes pa dang /	rdo_0 rje_4 mtshon_8 cha_15 ma_19 zhes_22 ba_27 dang_30 
T02D1407:134b-42	rdo rje ae ma'o bde ba ma zhes pa dang /	rdo_0 rje_4 ae_8 ma_11 bde_16 ba_20 ma_23 zhes_26 ba_31 dang_34 
T02D1407:134b-43	rdo rje bdag med ma zhes pa dang /	rdo_0 rje_4 bdag_8 med_13 ma_17 zhes_20 ba_25 dang_28 
T02D1407:134b-44	rdo rje spyan ma zhes pa dang /	rdo_0 rje_4 spyan_8 ma_14 zhes_17 ba_22 dang_25 
T02D1407:134b-45	ming de rnams ni rnam par snang mdzad kyi rigs can ma rnams kyi'o //	ming_0 de_5 rnams_8 ni_14 rnam_17 ba_22 snang_26 mdzad_32 kyi_38 rigs_42 can_47 ma_51 rnams_54 kyi_60 
T02D1407:135a-0	rdo rje @135a * //	rdo_0 rje_4 
T02D1407:135a-1	mkha' 'gro ma zhes bya ba dang /	mkha'_0 'gro_6 ma_11 zhes_14 byed_19 ba_23 dang_26 
T02D1407:135a-2	rdo rje sor mo zhes bya ba dang /	rdo_0 rje_4 sor_8 mo_12 zhes_15 byed_20 ba_24 dang_27 
T02D1407:135a-3	rdo rje phreng ba ma zhes bya ba dang /	rdo_0 rje_4 phreng_8 ba_15 ma_18 zhes_21 byed_26 ba_30 dang_33 
T02D1407:135a-4	rdo rje mgu ma zhes pa ni rin po che'i rigs can ma'i ming rnams so //	rdo_0 rje_4 mgu_8 ma_12 zhes_15 ba_20 ni_23 rin_26 po_30 che_33 rigs_39 can_44 ma_48 ming_53 rnams_58 so_64 
T02D1407:135a-5	rdo rje shugs ldan ma zhes pa dang /	rdo_0 rje_4 shugs_8 ldan_14 ma_19 zhes_22 ba_27 dang_30 
T02D1407:135a-6	rdo rje lcags kyu ma zhes pa dang /	rdo_0 rje_4 lcags_8 kyu_14 ma_18 zhes_21 ba_26 dang_29 
T02D1407:135a-7	rdo rje phreng skor ma zhes pa dang /	rdo_0 rje_4 phreng_8 skor_15 ma_20 zhes_23 ba_28 dang_31 
T02D1407:135a-8	rdo rje phreng ba ma zhes pa dang /	rdo_0 rje_4 phreng_8 ba_15 ma_18 zhes_21 ba_26 dang_29 
T02D1407:135a-9	rdo rje bzhad mo zhes pa ni padmo'i rigs can ma'i ming rnams so //	rdo_0 rje_4 bzhad_8 mo_14 zhes_17 ba_22 ni_25 padmo_28 rigs_36 can_41 ma_45 ming_50 rnams_55 so_61 
T02D1407:135a-10	rdo rje bsdams ma zhes pa dang /	rdo_0 rje_4 sdom_8 ma_15 zhes_18 ba_23 dang_26 
T02D1407:135a-11	rdo rje kha rgyas ma zhes pa dang /	rdo_0 rje_4 kha_8 rgya_12 ma_18 zhes_21 ba_26 dang_29 
T02D1407:135a-12	rdo rje padma ma zhes pa dang /	rdo_0 rje_4 padma_8 ma_14 zhes_17 ba_22 dang_25 
T02D1407:135a-13	rdo rje gsal byed ma zhes pa dang /	rdo_0 rje_4 gsal_8 byed_13 ma_18 zhes_21 ba_26 dang_29 
T02D1407:135a-14	rdo rje lus ldan ma zhes pa ni las kyi rigs can ma'i ming rnams so //	rdo_0 rje_4 lus_8 ldan_12 ma_17 zhes_20 ba_25 ni_28 las_31 kyi_35 rigs_39 can_44 ma_48 ming_53 rnams_58 so_64 
T02D1407:135a-15	rdo rje chags pa ma zhes pa dang /	rdo_0 rje_4 chags_8 ba_14 ma_17 zhes_20 ba_25 dang_28 
T02D1407:135a-16	rdo rje sgrol ma zhes pa dang /	rdo_0 rje_4 sgrol_8 ma_14 zhes_17 ba_22 dang_25 
T02D1407:135a-17	rdo rje mgul rgyan ma zhes pa dang /	rdo_0 rje_4 mgul_8 rgyan_13 ma_19 zhes_22 ba_27 dang_30 
T02D1407:135a-18	rdo rje bzhugs ma mo zhes pa dang /	rdo_0 rje_4 bzhugs_8 ma_15 mo_18 zhes_21 ba_26 dang_29 
T02D1407:135a-19	rdo rje blo ldan ma zhes pa dang /	rdo_0 rje_4 blo_8 ldan_12 ma_17 zhes_20 ba_25 dang_28 
T02D1407:135a-20	rdo rje mi thung ma zhes pa dang /	rdo_0 rje_4 mi_8 thung_11 ma_17 zhes_20 ba_25 dang_28 
T02D1407:135a-21	rdo rje mdzes 'phyang ma zhes pa dang /	rdo_0 rje_4 mdzes_8 'phyang_14 ma_22 zhes_25 ba_30 dang_33 
T02D1407:135a-22	rdo rje dbugs 'byin ma zhes pa dang /	rdo_0 rje_4 dbugs_8 'byin_14 ma_20 zhes_23 ba_28 dang_31 
T02D1407:135a-23	rdo rje lag pa mo zhes pa ni zhes sdang	rdo_0 rje_4 lag_8 ba_12 mo_15 zhes_18 ba_23 ni_26 zhes_29 sdang_34 
T02D1407:135a-24	gi rigs can ma phyag rgya chen po'i grub pa'i	gi_0 rigs_3 can_8 ma_12 phyag_15 rgya_21 chen_26 po_31 'grub_36 ba_41 
T02D1407:135a-25	ming rnams so // lag par 'byung ba 'di nyid	ming_0 rnams_5 so_11 lag_17 ba_21 'byung_25 ba_32 'di_35 nyid_39 
T02D1407:135a-26	ni zhes pa ni g-yon pa shes rab mar 'byung	ni_0 zhes_3 ba_8 ni_11 g-yon_14 ba_20 shes_23 rab_28 mar_32 'byung_36 
T02D1407:135a-27	ba 'gro ba rnams skyed par byed pa'i rgyu ste	ba_0 'gro_3 ba_8 rnams_11 skyed_17 ba_23 byed_27 ba_32 rgyu_37 ste_42 
T02D1407:135a-28	ming rnams so // / rtsa lnga dang 'byung ba lnga'i bdag nyid du gsungs so //	ming_0 rnams_5 so_11 rtsa_19 lnga_24 dang_29 'byung_34 ba_41 lnga_44 bdag_51 nyid_56 du_61 gsungs_64 so_71 
T02D1407:135a-29	spyan ma zhes pa la sogs pa'i lcug ma dang bla ma dang /	spyan_0 ma_6 zhes_9 ba_14 la_17 sogs_20 ba_25 lcug_30 ma_35 dang_38 bla_43 ma_47 dang_50 
T02D1407:135a-30	gtso bo dang byis pa dang sdong po ste /	gtso_0 'bo_5 dang_8 byis_13 ba_18 dang_21 sdong_26 po_32 ste_35 
T02D1407:135a-31	de rnams su shin tu bzhugs pa rnams so //	de_0 rnams_3 su_9 shin_12 tu_17 bzhugs_20 ba_27 rnams_30 so_36 
T02D1407:135a-32	pha rol tu phyin pa ni sdong po la ste /	pha_0 rol_4 tu_8 phyin_11 ba_17 ni_20 sdong_23 po_29 la_32 ste_35 
T02D1407:135a-33	stong pa nyid la'o byed ma'o //	stong_0 ba_6 nyid_9 la_14 byed_19 ma_24 
T02D1407:135a-34	de rnams ni 'byung ba chen po lnga rnams te /	de_0 rnams_3 ni_9 'byung_12 ba_19 chen_22 po_27 lnga_30 rnams_35 te_41 
T02D1407:135a-35	mtha' dang dbus med pa skye gnas chos kyi bde	mtha'_0 dang_6 dbus_11 med_16 ba_20 skye_23 gnas_28 chos_33 kyi_38 bde_42 
T02D1407:135a-36	ba dang ldan pa gang zhig rang bzhin med pa	ba_0 dang_3 ldan_8 ba_13 gang_16 'jig_21 rang_26 bzhin_31 med_37 ba_41 
T02D1407:135a-37	ni shes rab yin la 'dir dngos po ni thabs	ni_0 shes_3 rab_8 yin_12 la_16 'dir_19 dngos_24 po_30 ni_33 thabs_36 
T02D1407:135a-38	te / yang dag pa'i mtha' las kyang yang dag	te_0 yang_5 'dag_10 ba_14 mtha'_19 las_25 kyang_29 yang_35 'dag_40 
T02D1407:135a-39	pa'i mtha'i gzugs kyis gsal zhing gsal ba'i thugs rje	ba_0 mtha_5 gzugs_12 kyis_18 gsal_23 zhing_28 gsal_34 ba_39 thugs_44 rje_50 
T02D1407:135a-40	chen po he ru ka'o //	chen_0 po_5 he_8 ru_11 ka_14 
T02D1407:135a-41	de yang /	de_0 yang_3 
T02D1407:135a-42	thabs ni skyes bur shes par bya //	thabs_0 ni_6 skye_9 bur_15 shes_19 ba_24 byed_28 
T02D1407:135a-43	stong pa bud med rang bzhin no //	stong_0 ba_6 'bud_9 med_13 rang_17 bzhin_22 no_28 
T02D1407:135a-44	kun du bsam med spyod med dang //	kun_0 du_4 bsam_7 med_12 spyod_16 med_22 dang_26 
T02D1407:135a-45	chags pa'i chos rnams bsten pa'i'o //	chags_0 ba_6 chos_11 rnams_16 sten_22 pa'o_28 
T02D1407:135a-46	des de dang yang dag par drug pa las lto	des_0 de_4 dang_7 yang_12 'dag_17 ba_21 drug_25 ba_30 las_33 lto_37 
T02D1407:135a-47	bar blangs nas 'dzin pa ltar rdo rje can gnyis	ba_0 blangs_4 nas_11 'dzin_15 ba_21 ltar_24 rdo_29 rje_33 can_37 gnyis_41 
T02D1407:135b-0	@135b pas kyang mdun na mo blangs te gzung bar	ba_6 kyang_10 mdun_16 na_21 mo_24 blangs_27 te_34 gzung_37 ba_43 
T02D1407:135b-1	bya'o // de lta bu'i tshogs pa'i mchod pa nye	byed_0 de_9 lta_12 bu_16 tshogs_21 ba_28 mchod_33 ba_39 nye_42 
T02D1407:135b-2	bar kun du bsdus par dpa' bo dam pa mchod	ba_0 kun_4 du_8 sdud_11 ba_17 dpa'_21 'bo_26 dam_29 ba_33 mchod_36 
T02D1407:135b-3	bya'o // par bya'o // de nas ni rjes su gnang ba sbyin pa ste /	byed_0 ba_9 byed_13 de_22 nas_25 ni_29 rjes_32 su_37 gnang_40 ba_46 sbyin_49 ba_55 ste_58 
T02D1407:135b-4	'di nas bzung ste byang chub kyi dkyil 'khor gyi	'di_0 nas_4 bzung_8 ste_14 byang_18 chub_24 kyi_29 dkyil_33 'khor_39 gyi_45 
T02D1407:135b-5	mthar thug par phyogs rnams kun du sems can mchog	mthar_0 thug_6 ba_11 phyogs_15 rnams_22 kun_28 du_32 sems_35 can_40 mchog_44 
T02D1407:135b-6	rnams la chos kyi 'khor lo bla na med pa	rnams_0 la_6 chos_9 kyi_14 'khor_18 lo_24 bla_27 na_31 med_34 ba_38 
T02D1407:135b-7	bskor du gzhug ste /	skor_0 du_6 'jug_9 ste_15 
T02D1407:135b-8	thabs dang shes rab tu ldan pa'i bdag nyid kyi	thabs_0 dang_6 shes_11 rab_16 tu_20 ldan_23 ba_28 bdag_33 nyid_38 kyi_43 
T02D1407:135b-9	yid bzhin gyi nor bu rin po che lta bur	yid_0 bzhin_4 gyi_10 nor_14 bu_18 rin_21 po_25 che_28 lta_32 bur_36 
T02D1407:135b-10	skye ba med par gzung 'dzin dang bral bar sems	skye_0 ba_5 med_8 ba_12 gzung_16 'dzin_22 dang_28 'bral_33 ba_38 sems_42 
T02D1407:135b-11	can gyi don deng nas gyis shig pa'o //	can_0 gyi_4 don_8 deng_12 nas_17 gyis_21 shig_26 ba_31 
T02D1407:135b-12	dbang bskur ba nye bar thob nas rjes su gnang	dbang_0 skur_6 ba_12 nye_15 ba_19 'thob_23 nas_28 rjes_32 su_37 gnang_40 
T02D1407:135b-13	ba byas shin byas pa rab tu spro ba dang	ba_0 byed_3 shin_8 byed_13 ba_18 rab_21 tu_25 spro_28 ba_33 dang_36 
T02D1407:135b-14	ldan pa des shin tu snyan pa ma lus pa	ldan_0 ba_5 des_8 shin_12 tu_17 snyan_20 ba_26 ma_29 lus_32 ba_36 
T02D1407:135b-15	dga' bar byed pa'i tshig smra bar bya ste /	dga'_0 ba_5 byed_9 ba_14 tshig_19 smra_25 ba_30 byed_34 ste_38 
T02D1407:135b-16	deng bdag skye ba 'bras dang bcas //	deng_0 bdag_5 skye_10 ba_15 'bras_18 dang_24 'cha'_29 
T02D1407:135b-17	mi yi dngos 'di gson par 'gyur //	mi_0 yi_3 dngos_6 'di_12 gson_16 ba_21 'gyur_25 
T02D1407:135b-18	bdag gis deng 'dir de nyid rig //	bdag_0 gis_5 deng_9 'dir_14 de_19 nyid_22 rig_27 
T02D1407:135b-19	deng nas bdag nyid longs spyod bde //	deng_0 nas_5 bdag_9 nyid_14 longs_19 spyod_25 bde_31 
T02D1407:135b-20	deng 'dir bdag gi rgyu don thob //	deng_0 'dir_5 bdag_10 gi_15 rgyu_18 don_23 'thob_27 
T02D1407:135b-21	mkha' 'gro ma blo bsam mi khyab //	mkha'_0 'gro_6 ma_11 blo_14 bsam_18 mi_23 khyab_26 
T02D1407:135b-22	lha lags deng 'dir bdag mgu'o //	lha_0 lags_4 deng_9 'dir_14 bdag_19 mgu_24 
T02D1407:135b-23	bdag deng 'di ltar 'grub po kye //	bdag_0 deng_5 'di_10 ltar_14 'grub_19 po_25 kye_28 
T02D1407:135b-24	deng 'dir sangs rgyas rigs su skyes //	deng_0 'dir_5 sangs_10 rgya_16 rigs_22 su_27 skye_30 
T02D1407:135b-25	deng 'dir bdag ni sangs rgyas sras //	deng_0 'dir_5 bdag_10 ni_15 sangs_18 rgya_24 sras_30 
T02D1407:135b-26	zhes so //	zhes_0 so_5 
T02D1407:135b-27	slob ma rnams kyi bya ba yang dag par rdzogs	slob_0 ma_5 rnams_8 kyi_14 byed_18 ba_22 yang_25 'dag_30 ba_34 rdzogs_38 
T02D1407:135b-28	nas de'i rgyab la slob dpon gyi lag pas byugs	nas_0 de_4 rgyab_9 la_15 slob_18 dpon_23 gyi_28 lag_32 ba_36 'byug_40 
T02D1407:135b-29	te de nas gtang bar bya'o //	te_0 de_3 nas_6 gtong_10 ba_16 byed_20 
T02D1407:135b-30	de la me tog dang /	de_0 la_3 me_6 tog_9 dang_13 
T02D1407:135b-31	spos dang /	spros_0 dang_5 
T02D1407:135b-32	byug pa dag byin la //	'byug_0 ba_5 'dag_8 byin_12 la_17 
T02D1407:135b-33	glu dang gar dag gis kyang nye bar dga' bar bya ste /	glu_0 dang_4 gar_9 'dag_13 gis_17 kyang_21 nye_27 ba_31 dga'_35 ba_40 byed_44 ste_48 
T02D1407:135b-34	de lta bus nye bar bsdu bar bya'o //	de_0 lta_3 'bud_7 nye_11 ba_15 sdud_19 ba_24 byed_28 
T02D1407:135b-35	lhan cig zas la spyad par bya'o zhes pa ni	lhan_0 cig_5 zas_9 la_13 spyod_16 ba_22 byed_26 zhes_32 ba_37 ni_40 
T02D1407:135b-36	rgyud 'di la dbang bskur zhing 'di dag gzhan du	brgyud_0 'di_6 la_10 dbang_13 skur_19 zhing_25 'di_31 'dag_35 gzhan_39 du_45 
T02D1407:135b-37	mi smra zhing nges pa'i don dag shin tu sbed	mi_0 smra_3 zhing_8 nges_14 ba_19 don_24 'dag_28 shin_32 tu_37 sbed_40 
T02D1407:135b-38	pa rnams dang ngo //	ba_0 rnams_3 dang_9 ngo_14 
T02D1407:135b-39	'di lta bus cir 'gyur zhe nas /	'di_0 lta_4 'bud_8 cir_12 'gyur_16 zhe_22 nas_26 
T02D1407:135b-40	dpa' bo kun dang mnyam sbyor ba //	dpa'_0 'bo_5 kun_8 dang_12 mnyam_17 sbyor_23 ba_29 
T02D1407:135b-41	mkha' 'gro dra ba'i sdom pa yin //	mkha'_0 'gro_6 'dra_11 ba_15 sdom_20 ba_25 yin_28 
T02D1407:135b-42	zhes pa 'dir 'gyur ro //	zhes_0 ba_5 'dir_8 'gyur_13 ro_19 
T02D1407:135b-43	'di dag ni dpal he ru ka bde mchog gi	'di_0 'dag_4 ni_8 dpal_11 he_16 ru_19 ka_22 bde_25 mchog_29 gi_35 
T02D1407:135b-44	'grel pa sgrub thabs rnams kyi gnas zhes bya ba	'grel_0 ba_6 sgrub_9 thabs_15 rnams_21 kyi_27 gnas_31 zhes_36 byed_41 ba_45 
T02D1407:135b-45	las le'u sum cu gcig pa'i rnam par bshad pa'o	las_0 le_4 sum_9 cu_13 gcig_16 ba_21 rnam_26 ba_31 'chad_35 ba_41 
