T02D1644:280b-42	rgyal ba sras bcas rnams dang ni //	rgyal_0 ba_6 sras_9 'cha'_14 rnams_19 dang_25 ni_30 
T02D1644:280b-43	'gro gzhan dge ba gang bgyid pa //	'gro_0 gzhan_5 dge_11 ba_15 gang_18 bgyid_23 ba_29 
T02D1644:280b-44	de dag kun la yi rang ste //	de_0 'dag_3 kun_7 la_11 yi_14 rang_17 ste_22 
T02D1644:281a-0	byang @281a * //	byang_0 
T02D1644:281a-1	chub tu ni bdag gis bsngo //	chub_0 tu_5 ni_8 bdag_11 gis_16 sngo_20 
T02D1644:281a-2	sangs rgyas chos dang dge 'dun la //	sangs_0 rgya_6 chos_12 dang_17 dge_22 'dun_26 la_31 
T02D1644:281a-3	di ring bdag nyid skyabs su mchi //	di_0 ring_3 bdag_8 nyid_13 skyob_18 su_25 mchi_28 
T02D1644:281a-4	'khor ba'i sdug bsngal gcod pa dang //	'khor_0 ba_6 sdug_11 sngal_16 gcod_23 ba_28 dang_31 
T02D1644:281a-5	dge ba rnams ni spel ba'i phyir //	dge_0 ba_4 rnams_7 ni_13 spel_16 ba_21 phyir_26 
T02D1644:281a-6	byang chub sems gnyis bskyed nas su //	byang_0 chub_6 sems_11 gnyis_16 skyed_22 nas_29 su_33 
T02D1644:281a-7	'gro rnams bdag gis mgron du gnyer //	'gro_0 rnams_5 bdag_11 gis_16 mgron_20 du_26 gnyer_29 
T02D1644:281a-8	sangs rgyas gyur nas 'gro ba rnams //	sangs_0 rgya_6 gyur_12 nas_17 'gro_21 ba_26 rnams_29 
T02D1644:281a-9	ma lus srid ma tsho las bsgral bgyid //	ma_0 lus_3 srid_7 ma_12 tsho_15 las_20 bsgral_24 bgyid_31 
T02D1644:281a-10	de nas me tog dang bcas pa'i rdo rje snying gar bzhag la //	de_0 nas_3 me_7 tog_10 dang_14 'cha'_19 ba_24 rdo_29 rje_33 snying_37 gar_44 'jog_48 la_54 
T02D1644:281a-11	aom su ra te sa ma ya stvam ho /	aom_0 su_4 ra_7 te_10 sa_13 ma_16 ya_19 stvam_22 ho_28 
T02D1644:281a-12	siddhi badzra ya th'a su kham zhes lan gsum du brjod do //	siddhi_0 badzra_7 ya_14 th_17 su_22 kham_25 zhes_30 lan_35 gsum_39 du_44 rjod_47 do_53 
T02D1644:281a-13	de'i rjes la deng khyod de bzhin gshegs pa thams	de_0 rjes_5 la_10 deng_13 khyod_18 de_24 bzhin_27 gshegs_33 ba_40 thams_43 
T02D1644:281a-14	cad kyi rdo rje ye shes kyis byin gyis brlab	cad_0 kyi_4 rdo_8 rje_12 ye_16 shes_19 kyis_24 byin_29 gyis_34 brlab_39 
T02D1644:281a-15	par 'gyur gyis / gsang chen dam pa 'di de	ba_0 'gyur_4 gyis_10 gsang_17 chen_23 dam_28 ba_32 'di_35 de_39 
T02D1644:281a-16	bzhin gshegs pa thams cad kyi dkyil 'khor du ma	bzhin_0 gshegs_6 ba_13 thams_16 cad_22 kyi_26 dkyil_30 'khor_36 du_42 ma_45 
T02D1644:281a-17	zhugs pa rnams la smra bar mi bya zhing /	'jug_0 ba_6 rnams_9 la_15 smra_18 ba_23 mi_27 byed_30 zhing_34 
T02D1644:281a-18	ma dad pa rnams la yang ma yin no zhes bsgo la /	ma_0 dad_3 ba_7 rnams_10 la_16 yang_19 ma_24 yin_27 no_31 zhes_34 sgo_39 la_44 
T02D1644:281a-19	a'a kham ba'i ra h'um zhes pas yol ba'i nang du bcug la /	a_0 kham_4 ba_9 ra_14 h_17 zhes_22 ba_27 yol_31 ba_35 nang_40 du_45 'jug_48 la_53 
T02D1644:281a-20	de ring khyod de bzhin gshegs pa thams cad kyi rigs su zhugs te /	de_0 ring_3 khyod_8 de_14 bzhin_17 gshegs_23 ba_30 thams_33 cad_39 kyi_43 rigs_47 su_52 'jug_55 te_61 
T02D1644:281a-21	ye shes gang gis de bzhin gshegs pa thams cad	ye_0 shes_3 gang_8 gis_13 de_17 bzhin_20 gshegs_26 ba_33 thams_36 cad_42 
T02D1644:281a-22	kyi dngos grub kyang thob par 'gyur na dngos grub	kyi_0 dngos_4 'grub_10 kyang_15 'thob_21 ba_26 'gyur_30 na_36 dngos_39 'grub_45 
T02D1644:281a-23	gzhan lta ci smos te /	gzhan_0 lta_6 ci_10 smos_13 te_18 
T02D1644:281a-24	de lta bu'i ye shes ngas bskyed par bya yis /	de_0 lta_3 bu_7 ye_12 shes_15 ngas_20 skyed_25 ba_32 byed_36 yis_40 
T02D1644:281a-25	khyod kyis dkyil 'khor ma mthong ba rnams kyi mdun du smra bar mi bya ste /	khyod_0 kyis_6 dkyil_11 'khor_17 ma_23 mthong_26 ba_33 rnams_36 kyi_42 mdun_46 du_51 smra_54 ba_59 mi_63 byed_66 ste_70 
T02D1644:281a-26	khyod dam tshig nyams par gyur ta re /	khyod_0 dam_6 tshig_10 nyams_16 ba_22 gyur_26 ta_31 re_34 
T02D1644:281a-27	de nas de'i spyi bor rdo rje bzhag la /	de_0 nas_3 de_7 spyi_12 'bor_17 rdo_21 rje_25 'jog_29 la_35 
T02D1644:281a-28	'di ni khyod kyi dam tshig ste /	'di_0 ni_4 khyod_7 kyi_13 dam_17 tshig_21 ste_27 
T02D1644:281a-29	gal te tshul 'di gang su yang rung ba la	gal_0 te_4 tshul_7 'di_13 gang_17 su_22 yang_25 rung_30 ba_35 la_38 
T02D1644:281a-30	smras na khyod dam tshig gi rdo rje 'dis mgo	smras_0 na_6 khyod_9 dam_15 tshig_19 gi_25 rdo_28 rje_32 'dis_36 mgo_41 
T02D1644:281a-31	'gas par byed do zhes brjod la /	'gas_0 ba_5 byed_9 do_14 zhes_17 rjod_22 la_28 
T02D1644:281a-32	slar yang rdo rje snying gar bzhag la /	slar_0 yang_5 rdo_10 rje_14 snying_18 gar_25 'jog_29 la_35 
T02D1644:281a-33	aom rdo rje sems dpa' nyid khyod kyi //	aom_0 rdo_4 rje_8 sems_12 dpa'_17 nyid_22 khyod_27 kyi_33 
T02D1644:281a-34	snying la di ring yang dag zhugs //	snying_0 la_7 di_10 ring_13 yang_18 'dag_23 'jug_27 
T02D1644:281a-35	gal te tshul 'di smras na ni //	gal_0 te_4 tshul_7 'di_13 smras_17 na_23 ni_26 
T02D1644:281a-36	de ma thag tu dral te gshegs //	de_0 ma_3 thag_6 tu_11 'dral_14 te_19 gshegs_22 
T02D1644:281a-37	zhes so //	zhes_0 so_5 
T02D1644:281a-38	de nas mna' bsgags te /	de_0 nas_3 mna'_7 sgog_12 te_19 
T02D1644:281a-39	rnam rgyal bum pa'i steng gi padma'i snod kyi chu la /	rnam_0 rgyal_5 bum_11 ba_15 steng_20 gi_26 padma_29 snod_37 kyi_42 chu_46 la_50 
T02D1644:281a-40	aom badzra aa mri ta au da ka sha h'um zhes mngon par bzlas la /	aom_0 badzra_4 aa_11 mri_14 ta_18 au_21 da_24 ka_27 sha_30 h_34 zhes_39 mngon_44 ba_50 bzlas_54 la_60 
T02D1644:281a-41	'di ni khyod kyi dmyal ba'i chu //	'di_0 ni_4 khyod_7 kyi_13 dmyal_17 ba_23 chu_28 
T02D1644:281a-42	dam tshig 'das na sreg par byed //	dam_0 tshig_4 'da'_10 na_15 sreg_18 ba_23 byed_27 
T02D1644:281a-43	dam tshig bsrungs na dngos grub ni //	dam_0 tshig_4 bsrungs_10 na_18 dngos_21 'grub_27 ni_32 
T02D1644:281a-44	rdo rje bdud rtsi'i chu 'dis 'grub //	rdo_0 rje_4 bdud_8 rtsi_13 chu_20 'dis_24 'grub_29 
T02D1644:281a-45	ces brjod de blud la /	ces_0 rjod_4 de_10 blud_13 la_18 
T02D1644:281b-0	de ring tshun chad khyod kyi @281b rdo rje sems dpa' nga yin gyis /	de_0 ring_3 tshun_8 'chad_14 khyod_19 kyi_25 rdo_35 rje_39 sems_43 dpa'_48 nga_53 yin_57 gyis_61 
T02D1644:281b-1	ngas gang bsgo ba rnams bu khyod kyis bya dgos la /	ngas_0 gang_5 sgo_10 ba_15 rnams_18 bu_24 khyod_27 kyis_33 byed_38 dgos_42 la_47 
T02D1644:281b-2	nga la brnyas pa yang ma byed cig / byas	nga_0 la_4 brnyas_7 ba_14 yang_17 ma_22 byed_25 cig_30 byed_36 
T02D1644:281b-3	na yang ba ma spangs par shi ba'i dus byas	na_0 yang_3 ba_8 ma_11 spong_14 ba_21 'chi_25 ba_29 dus_34 byed_38 
T02D1644:281b-4	nas sems can dmyal ba chen por ltung bar gyur	nas_0 sems_4 can_9 dmyal_13 ba_19 chen_22 por_27 ltung_31 ba_37 gyur_41 
T02D1644:281b-5	ta re zhes smos te /	ta_0 re_3 zhes_6 smos_11 te_16 
T02D1644:281b-6	de nas slob mas de bzhin gshegs pa thams cad	de_0 nas_3 slob_7 mas_12 de_16 bzhin_19 gshegs_25 ba_32 thams_35 cad_41 
T02D1644:281b-7	kyis bdag la byin gyis rlobs la dpal he ru	kyis_0 bdag_5 la_10 byin_13 gyis_18 rlobs_23 la_29 dpal_32 he_37 ru_40 
T02D1644:281b-8	ka bdag la dbab tu gsol /	ka_0 bdag_3 la_8 'bebs_11 tu_16 gsol_19 
T02D1644:281b-9	zhes pas gsol ba btab la /	zhes_0 ba_5 gsol_9 ba_14 'debs_17 la_22 
T02D1644:281b-10	de nas slob ma'i snying gar dbang chen gyi dkyil 'khor rdo rjes mtshan pa la h'um /	de_0 nas_3 slob_7 ma_12 snying_17 gar_24 dbang_28 chen_34 gyi_39 dkyil_43 'khor_49 rdo_55 rjes_59 mtshan_64 ba_71 la_74 h_77 
T02D1644:281b-11	mgrin par chu'i dkyil 'khor bum pas mtshan pa la bam /	mgrin_0 ba_6 chu_10 dkyil_16 'khor_22 bum_28 ba_32 mtshan_36 ba_43 la_46 bam_49 
T02D1644:281b-12	spyi bor rlung gi dkyil 'khor ba dan gyis mtshan pa la ham /	spyi_0 'bor_5 rlung_9 gi_15 dkyil_18 'khor_24 ba_30 dan_33 gyis_37 mtshan_42 ba_49 la_52 ham_55 
T02D1644:281b-13	rkang mthil du rlung mas mtshan pa'i dkyil 'khor la dzheem dmar po bsgoms la /	rkang_0 mthil_6 du_12 rlung_15 mas_21 mtshan_25 ba_32 dkyil_37 'khor_43 la_49 dzheem_52 dmar_59 po_64 sgom_67 la_74 
T02D1644:281b-14	rdo rje dril bu gsil zhing 'gying bag dang bcas pas /	rdo_0 rje_4 'dril_8 bu_13 gsil_16 zhing_21 'gying_27 bag_34 dang_38 'cha'_43 ba_48 
T02D1644:281b-15	aom a'a be sha ya stambha ya /	aom_0 a_4 be_8 sha_11 ya_15 stambha_18 ya_26 
T02D1644:281b-16	ra ra ra ra tsa la ya tsa la ya /	ra_0 ra_3 ra_6 ra_9 tsa_12 la_16 ya_19 tsa_22 la_26 ya_29 
T02D1644:281b-17	h'um aa h'a dzheem au zhes lan brgya bzlas la dbab po //	h_0 aa_5 h_8 dzheem_12 au_19 zhes_22 lan_27 brgya_31 bzlas_37 la_43 'bebs_46 po_51 
T02D1644:281b-18	babs nas lce la aa dmar pho bsams la /	'bab_0 nas_5 lce_9 la_13 aa_16 dmar_19 pho_24 bsams_28 la_34 
T02D1644:281b-19	gsungs shig rdo rje dge mi dge / zhes dris pas /	gsungs_0 shig_7 rdo_12 rje_16 dge_20 mi_24 dge_27 zhes_33 'dri_38 ba_43 
T02D1644:281b-20	legs nyes gang yin pa'i ltas ston par 'gyur te /	legs_0 nyes_5 gang_10 yin_15 ba_19 ltas_24 ston_29 ba_34 'gyur_38 te_44 
T02D1644:281b-21	de yang thugs babs na yongs su shes pa skye'o //	de_0 yang_3 thugs_8 'bab_14 na_19 yongs_22 su_28 shes_31 ba_36 skye_39 
T02D1644:281b-22	gsung babs na sngags smra'o //	gsung_0 'bab_6 na_11 sngags_14 smra_21 
T02D1644:281b-23	sku babs na nam mkha' la gnas so //	sku_0 'bab_4 na_9 nam_12 mkha'_16 la_22 gnas_25 so_30 
T02D1644:281b-24	de nas aom tishtha badzra zhes pas babs pa brtan par bya'o //	de_0 nas_3 aom_7 tishtha_11 badzra_19 zhes_26 ba_31 'bab_35 ba_40 brtan_43 ba_49 byed_53 
T02D1644:281b-25	'di ni dbab pa'i cho ga'o //	'di_0 ni_4 'bebs_7 ba_12 cho_17 ga_21 
T02D1644:281b-26	de nas slob mas mandala bya ste /	de_0 nas_3 slob_7 mas_12 mandala_16 byed_24 ste_28 
T02D1644:281b-27	me tog bkram la lha dang bla ma la yon phul nas /	me_0 tog_3 'grem_7 la_13 lha_16 dang_20 bla_25 ma_29 la_32 yon_35 'bul_39 nas_44 
T02D1644:281b-28	byang chub rdo rje sangs rgyas la //	byang_0 chub_6 rdo_11 rje_15 sangs_19 rgya_25 la_31 
T02D1644:281b-29	zhes pa la sogs pas gsol ba gdab po //	zhes_0 ba_5 la_8 sogs_11 ba_16 gsol_20 ba_25 gdab_28 po_33 
T02D1644:281b-30	de nas slob dpon gyis /	de_0 nas_3 slob_7 dpon_12 gyis_17 
T02D1644:281b-31	snying po'i dkyil 'khor 'di ru ni /	snying_0 po_7 dkyil_12 'khor_18 'di_24 ru_28 ni_31 
T02D1644:281b-32	bdag gi slob ma gzhug par bgyi //	bdag_0 gi_5 slob_8 ma_13 'jug_16 ba_22 bgyid_26 
T02D1644:281b-33	lha yi rigs kyi rim pa bzhin //	lha_0 yi_4 rigs_7 kyi_12 rim_16 ba_20 bzhin_23 
T02D1644:281b-34	bsod nams gang yin de bzhin shog / dis ni dngos grub gang 'grub dang //	bsod_0 nams_5 gang_10 yin_15 de_19 bzhin_22 shog_28 ni_39 dngos_42 'grub_48 gang_53 'grub_58 dang_64 
T02D1644:281b-35	rigs ni gang gi snod du 'gyur //	rigs_0 ni_5 gang_8 gi_13 snod_16 du_21 'gyur_24 
T02D1644:281b-36	'di yi bsod nams ci yod pa //	'di_0 yi_4 bsod_7 nams_12 ci_17 yod_20 ba_24 
T02D1644:281b-37	dkyil 'khor du ni de bzhin shog / ces bden pa'i byin gyi rlabs brjod la /	dkyil_0 'khor_6 du_12 ni_15 de_18 bzhin_21 shog_27 ces_34 bden_38 ba_43 byin_48 gyi_53 rlabs_57 rjod_63 la_69 
T02D1644:281b-38	de nas mig sngar snang ba'i 'od kyi bye brag dri'o //	de_0 nas_3 mig_7 sngar_11 snang_17 ba_23 'od_28 kyi_32 'bye_36 brag_40 'dri_45 
T02D1644:281b-39	des kyang smras te /	des_0 kyang_4 smras_10 te_16 
T02D1644:281b-40	dkar po la sogs pa gang mthong ba las gang 'grub pa'i lha'i ltas brtag go //	dkar_0 po_5 la_8 sogs_11 ba_16 gang_19 mthong_24 ba_31 las_34 gang_38 'grub_43 ba_49 lha_54 ltas_60 rtog_65 go_71 
T02D1644:282a-0	de nas dkyil 'khor gyi lha rnams la sngar smos pa'i @282a * //	de_0 nas_3 dkyil_7 'khor_13 gyi_19 lha_23 rnams_27 la_33 sngar_36 smos_42 ba_47 
T02D1644:282a-1	bstod pas bstod la me tog dor bar bya ste /	bstod_0 ba_6 bstod_10 la_16 me_19 tog_22 'dor_26 ba_30 byed_34 ste_38 
T02D1644:282a-2	bde gshegs snying po'i dkyil 'khor du //	bde_0 gshegs_4 snying_11 po_18 dkyil_23 'khor_29 du_35 
T02D1644:282a-3	rigs pa'i me tog 'di dor bas //	rigs_0 ba_5 me_10 tog_13 'di_17 'dor_21 ba_25 
T02D1644:282a-4	sngon tshe ye shes bsnyen pa'i lha //	sngon_0 tshe_6 ye_11 shes_14 snyen_19 ba_26 lha_31 
T02D1644:282a-5	gang yin de la 'bab gyur cig / pra t'i	gang_0 yin_5 de_9 la_12 'bab_15 gyur_20 cig_25 pra_31 t_35 
T02D1644:282a-6	tstsha ho: zhes brjod pas me tog dor bar bya'o	tstsha_0 ho:_7 zhes_11 rjod_16 ba_22 me_26 tog_29 'dor_33 ba_37 byed_41 
T02D1644:282a-7	// de nas me tog gang du lhung ba de las /	de_3 nas_6 me_10 tog_13 gang_17 du_22 lhung_25 ba_31 de_34 las_37 
T02D1644:282a-8	de dang mthun pa'i lha dbab par bya ste /	de_0 dang_3 mthun_8 ba_14 lha_19 'bebs_23 ba_28 byed_32 ste_36 
T02D1644:282a-9	de yang /	de_0 yang_3 
T02D1644:282a-10	me tog rin chen la sogs pa //	me_0 tog_3 rin_7 chen_11 la_16 sogs_19 ba_24 
T02D1644:282a-11	gang la babs par rigs kyi lha //	gang_0 la_5 'bab_8 ba_13 rigs_17 kyi_22 lha_26 
T02D1644:282a-12	gtso bor rigs de bsgom pa ni //	gtso_0 'bor_5 rigs_9 de_14 bsgom_17 ba_23 ni_26 
T02D1644:282a-13	dngos grub 'gyur te the tshom med //	dngos_0 'grub_6 'gyur_11 te_17 the_20 tshom_24 med_30 
T02D1644:282a-14	ces brjod nas me tog de slob ma'i mgo la bcing ngo //	ces_0 rjod_4 nas_10 me_14 tog_17 de_21 slob_24 ma_29 mgo_34 la_38 'ching_41 ngo_47 
T02D1644:282a-15	de nas slob ma'i mig gnyis su aom bsgoms la /	de_0 nas_3 slob_7 ma_12 mig_17 gnyis_21 su_27 aom_30 sgom_34 la_41 
T02D1644:282a-16	aom rdo rje sems dpa' nyid khyod kyis //	aom_0 rdo_4 rje_8 sems_12 dpa'_17 nyid_22 khyod_27 kyis_33 
T02D1644:282a-17	mig 'byed par ni nan tan byed //	mig_0 'byed_4 ba_10 ni_14 nan_17 tan_21 byed_25 
T02D1644:282a-18	bye bas thams cad mthong gyur bas //	'bye_0 ba_4 thams_8 cad_14 mthong_18 gyur_25 ba_30 
T02D1644:282a-19	rdo rje'i mig ni bla na med //	rdo_0 rje_4 mig_10 ni_14 bla_17 na_21 med_24 
T02D1644:282a-20	ces brjod de gdong g-yogs bkrol la ;	ces_0 rjod_4 de_10 gdong_13 g-yogs_19 'grol_26 la_32 
T02D1644:282a-21	/ thar pa chen po'i grong khyer mchog / ltos shig ltos shig sems dpa' che //	thar_2 ba_7 chen_10 po_15 grong_20 'khyer_26 mchog_32 ltos_40 shig_45 ltos_50 shig_55 sems_60 dpa'_65 che_70 
T02D1644:282a-22	me tog gang du ltung gyur pa //	me_0 tog_3 gang_7 du_12 ltung_15 gyur_21 ba_26 
T02D1644:282a-23	de ni khyod kyi lha yin no //	de_0 ni_3 khyod_6 kyi_12 lha_16 yin_20 no_24 
T02D1644:282a-24	zhes brjod la /	zhes_0 rjod_5 la_11 
T02D1644:282a-25	dkyil 'khor ba ltar bcug la sgo srung nas yar	dkyil_0 'khor_6 ba_12 ltar_15 'jug_20 la_25 sgo_28 srung_32 nas_38 yar_42 
T02D1644:282a-26	gtso bo'i bar du ming brjod pa sngon du 'gro	gtso_0 'bo_5 ba_10 du_14 ming_17 rjod_22 ba_28 sngon_31 du_37 'gro_40 
T02D1644:282a-27	bas bstan par bya ste dkyil 'khor du gzhug go	ba_0 ston_4 ba_10 byed_14 ste_18 dkyil_22 'khor_28 du_34 'jug_37 go_43 
T02D1644:282a-28	// de nas dbang bskur te /	de_3 nas_6 dbang_10 skur_16 te_22 
T02D1644:282a-29	de yang /	de_0 yang_3 
T02D1644:282a-30	dbang bskur nas ni de nyid bstan //	dbang_0 skur_6 nas_12 ni_16 de_19 nyid_22 ston_27 
T02D1644:282a-31	gzhan du na ni dngos grub dag / shin tu ring ba nyid 'gyur ro //	gzhan_0 du_6 na_9 ni_12 dngos_15 'grub_21 'dag_26 shin_32 tu_37 ring_40 ba_45 nyid_48 'gyur_53 ro_59 
T02D1644:282a-32	rdo rje 'dzin pas de skad gsungs //	rdo_0 rje_4 'dzin_8 ba_14 de_18 skad_21 gsungs_26 
T02D1644:282a-33	de bas na dngos grub kyi phyir rjes su mthun pa'i yon bla ma la phul nas /	de_0 ba_3 na_7 dngos_10 'grub_16 kyi_21 phyir_25 rjes_31 su_36 mthun_39 ba_45 yon_50 bla_54 ma_58 la_61 'bul_64 nas_69 
T02D1644:282a-34	gsol ba btab la phyag bya'o //	gsol_0 ba_5 'debs_8 la_13 phyag_16 byed_22 
T02D1644:282a-35	slob dpon gyis de las dbang bskur ba'i phyir //	slob_0 dpon_5 gyis_10 de_15 las_18 dbang_22 skur_28 ba_34 phyir_39 
T02D1644:282a-36	rtsa ba'i dkyil 'khor gyi phyi rol du snying po'i	rtsa_0 ba_5 dkyil_10 'khor_16 gyi_22 phyi_26 rol_31 du_35 snying_38 po_45 
T02D1644:282a-37	dkyil 'khor gyi phyed tsam gyi dkyil 'khor gru bzhi	dkyil_0 'khor_6 gyi_12 phyed_16 tsam_22 gyi_27 dkyil_31 'khor_37 gru_43 bzhi_47 
T02D1644:282a-38	sgo bzhi pa la dbus su padma 'dab brgyad ge	sgo_0 bzhi_4 ba_9 la_12 dbus_15 su_20 padma_23 'dab_29 brgyad_34 ge_41 
T02D1644:282a-39	sar dang bcas pa sgo ru lha mo bzhi'i mtshan	sar_0 dang_4 'cha'_9 ba_14 sgo_17 ru_21 lha_24 mo_28 bzhi_31 mtshan_38 
T02D1644:282a-40	ma bris la / der slob ma bzhag ste shis pa'i cho ga'o //	ma_0 'bri_3 la_8 der_13 slob_17 ma_22 'jog_25 ste_31 shis_35 ba_40 cho_45 ga_49 
T02D1644:282a-41	de yang yungs kar la bcom ldan 'das kyi rtsa ba'i sngags bzlas te /	de_0 yang_3 yungs_8 kar_14 la_18 'joms_21 ldan_26 'da'_31 kyi_36 rtsa_40 ba_45 sngags_50 bzlas_57 te_63 
T02D1644:282a-42	lag pa g-yas g-yon gyi khu tshur gyis bzung nas	lag_0 ba_4 g-yas_7 g-yon_13 gyi_19 khu_23 tshur_27 gyis_33 bzung_38 nas_44 
T02D1644:282a-43	lan gnyis su bskor nas kham phor gyi me'i nang	lan_0 gnyis_4 su_10 skor_13 nas_19 kham_23 phor_28 gyi_33 me_37 nang_42 
T02D1644:282b-0	du blugs so // de bzhin du lan @282b gsum du bya'o //	du_0 blugs_3 so_9 de_15 bzhin_18 du_24 lan_27 gsum_37 du_42 byed_45 
T02D1644:282b-1	de ltar chu'i shis pa yang bya'o //	de_0 ltar_3 chu_8 shis_14 ba_19 yang_22 byed_27 
T02D1644:282b-2	de nas yang rtsa ba'i sngags kyis bsrungs la nye reg bya ste /	de_0 nas_3 yang_7 rtsa_12 ba_17 sngags_22 kyis_29 bsrungs_34 la_42 nye_45 reg_49 byed_53 ste_57 
T02D1644:282b-3	rtsa ba'i sngags kyis btab pa'i dri snying gar /	rtsa_0 ba_5 sngags_10 kyis_17 'debs_22 ba_27 'dri_32 snying_36 gar_43 
T02D1644:282b-4	me tog mgo la /	me_0 tog_3 mgo_7 la_11 
T02D1644:282b-5	mar me mig sngar /	mar_0 me_4 mig_7 sngar_11 
T02D1644:282b-6	mar dang sa rdza bsregs de'i bdug pas bdugs te shis pa'i tsho ga'o //	mar_0 dang_4 sa_9 rdza_12 bsregs_17 de_24 bdug_29 ba_34 bdug_38 te_44 shis_47 ba_52 tsho_57 ga_62 
T02D1644:282b-7	de nas he ru kar dmigs la dmigs la sogs pa byin gyis brlabs la /	de_0 nas_3 he_7 ru_10 kar_13 dmigs_17 la_23 dmigs_26 la_32 sogs_35 ba_40 byin_43 gyis_48 brlabs_53 la_60 
T02D1644:282b-8	steng du bla bre /	steng_0 du_6 bla_9 'bre_13 
T02D1644:282b-9	g-yas phyogs su h'um bzlas pa'i gdugs dkar po gser gyi yu ba can gzung ngo //	g-yas_0 phyogs_6 su_13 h_16 bzlas_21 ba_27 gdugs_32 dkar_38 po_43 gser_46 gyi_51 yu_55 ba_58 can_61 gzung_65 ngo_71 
T02D1644:282b-10	g-yon du rgyal mtshan dang /	g-yon_0 du_6 rgyal_9 mtshan_15 dang_22 
T02D1644:282b-11	ba dan bsgreng la zangs dang dung gi bud pa	ba_0 dan_3 sgreng_7 la_15 zangs_18 dang_24 dung_29 gi_34 'bud_37 ba_41 
T02D1644:282b-12	la sogs pa'i rol mo'i sgras nam mkha' gang bar	la_0 sogs_3 ba_8 rol_13 mo_17 sgras_22 nam_28 mkha'_32 gang_38 ba_43 
T02D1644:282b-13	bsams la / rdo rje dang dril bu dkrol te /	bsams_0 la_6 rdo_11 rje_15 dang_19 'dril_24 bu_29 'khrol_32 te_38 
T02D1644:282b-14	phun sum tshogs pa mnga' ba gser gyi ri bo 'dra //	phun_0 sum_5 tshogs_9 ba_16 mnga'_19 ba_25 gser_28 gyi_33 ri_37 'bo_40 'dra_43 
T02D1644:282b-15	'jig rten gsum gyi mgon po dri ma gsum spangs pa //	'jig_0 rten_5 gsum_10 gyi_15 mgon_19 po_24 'dri_27 ma_31 gsum_34 spong_39 ba_46 
T02D1644:282b-16	sangs rgyas padma rgyas pa 'dab dra'i spyan mnga' ba //	sangs_0 rgya_6 padma_12 rgya_18 ba_24 'dab_27 'dra_32 spyan_38 mnga'_44 ba_50 
T02D1644:282b-17	'di ni 'jig rten dge ba'i bkra shis dang po yin //	'di_0 ni_4 'jig_7 rten_12 dge_17 ba_21 bkra_26 shis_31 dang_36 po_41 yin_44 
T02D1644:282b-18	de yis nye bar bstan pa'i dam chos mi g-yo ba //	de_0 yis_3 nye_7 ba_11 ston_15 ba_21 dam_26 chos_30 mi_35 g-yo_38 ba_43 
T02D1644:282b-19	'jig rten gsum du grags shing lha dang mi yis mchod //	'jig_0 rten_5 gsum_10 du_15 grags_18 shing_24 lha_30 dang_34 mi_39 yis_42 mchod_46 
T02D1644:282b-20	chos kyi dam pa skye dgu rnams la zhi byed pa //	chos_0 kyi_5 dam_9 ba_13 skye_16 dgu_21 rnams_25 la_31 zhi_34 byed_38 ba_43 
T02D1644:282b-21	de ni 'jig rten dge ba'i bkra shis gnyis pa yin //	de_0 ni_3 'jig_6 rten_11 dge_16 ba_20 bkra_25 shis_30 gnyis_35 ba_41 yin_44 
T02D1644:282b-22	dge 'dun dam pa'i chos ldan thos pa'i bkra shis	dge_0 'dun_4 dam_9 ba_13 chos_18 ldan_23 thos_28 ba_33 bkra_38 shis_43 
T02D1644:282b-23	phyug / lha dang mi dang lha ma yin gyi	phyug_0 lha_8 dang_12 mi_17 dang_20 lha_25 ma_29 yin_32 gyi_36 
T02D1644:282b-24	sbyin pa'i gnas // tshogs kyi rab mchog ngo tsha shes dang dpal gyi gzhi //	sbyin_0 ba_6 gnas_11 tshogs_19 kyi_26 rab_30 mchog_34 ngo_40 tsha_44 shes_49 dang_54 dpal_59 gyi_64 gzhi_68 
T02D1644:282b-25	de ni 'jig rten dge ba'i bkra shis gsum pa yin //	de_0 ni_3 'jig_6 rten_11 dge_16 ba_20 bkra_25 shis_30 gsum_35 ba_40 yin_43 
T02D1644:282b-26	zhes bya ba la sogs pa bkra shis kyi glu blangs la dbang bskur te //	zhes_0 byed_5 ba_9 la_12 sogs_15 ba_20 bkra_23 shis_28 kyi_33 glu_37 blangs_41 la_48 dbang_51 skur_57 te_63 
T02D1644:282b-27	ji ltar bltams pa tsam gyis kyang //	ji_0 ltar_3 ltems_8 ba_15 tsam_18 gyis_23 kyang_28 
T02D1644:282b-28	de bzhin gshegs pa khrus gsol ba //	de_0 bzhin_3 gshegs_9 ba_16 'khru_19 gsol_25 ba_30 
T02D1644:282b-29	lha yi chu ni dag pa yis //	lha_0 yi_4 chu_7 ni_11 'dag_14 ba_18 yis_21 
T02D1644:282b-30	de bzhin bdag gis khrus bya'o //	de_0 bzhin_3 bdag_9 gis_14 'khru_18 byed_24 
T02D1644:282b-31	aom sarba ta th'a ga ta sa ma ya shri	aom_0 sarba_4 ta_10 th_13 ga_18 ta_21 sa_24 ma_27 ya_30 shri_33 
T02D1644:282b-32	ye h'um zhes brjod pa'i dang por rnam rgyal gyi	ye_0 h_3 zhes_8 rjod_13 ba_19 dang_24 por_29 rnam_33 rgyal_38 gyi_44 
T02D1644:282b-33	bum pa'i chus gtor //	bum_0 ba_4 chus_9 'thor_14 
T02D1644:282b-34	de nas lha mo rnams kyi bum pas so //	de_0 nas_3 lha_7 mo_11 rnams_14 kyi_20 bum_24 ba_28 so_32 
T02D1644:282b-35	de nas nang gi dbang bskur te /	de_0 nas_3 nang_7 gi_12 dbang_15 skur_21 te_27 
T02D1644:282b-36	snying ga'i sa bon gyi 'od zer gyis phyogs bcu'i	snying_0 ga_7 sa_12 bon_15 gyi_19 'od_23 zer_27 gyis_31 phyogs_36 'chu_43 
T02D1644:282b-37	ye shes kyi 'khor lo nam mkha' la bkug la	ye_0 shes_3 kyi_8 'khor_12 lo_18 nam_21 mkha'_25 la_31 'gugs_34 la_39 
T02D1644:282b-38	/ thugs rje'i rang bzhin can rnams kyis //	thugs_2 rje_8 rang_14 bzhin_19 can_25 rnams_29 kyis_35 
T02D1644:282b-39	'di la dbang bskur rab tu stsol //	'di_0 la_4 dbang_7 skur_13 rab_19 tu_23 stsol_26 
T02D1644:282b-40	zhes yid kyis dbang bskur nas /	zhes_0 yid_5 kyis_9 dbang_14 skur_20 nas_26 
T02D1644:283a-0	de dag rang gi 'od las byung ba'i dbang @283a * //	de_0 'dag_3 rang_7 gi_12 'od_15 las_19 'byung_23 ba_29 dbang_34 
T02D1644:283a-1	bskur bar bsams la /	skur_0 ba_6 bsams_10 la_16 
T02D1644:283a-2	sangs rgyas dag ni thams cad kyi //	sangs_0 rgya_6 'dag_12 ni_16 thams_19 cad_25 kyi_29 
T02D1644:283a-3	gsang gsum gnas las byung ba yi //	gsang_0 gsum_6 gnas_11 las_16 'byung_20 ba_26 yi_29 
T02D1644:283a-4	khams gsum kun gyis phyag byas pa //	khams_0 gsum_6 kun_11 gyis_15 phyag_20 byed_26 ba_31 
T02D1644:283a-5	dbang bskur gnang ba chen po sbyin /	dbang_0 skur_6 gnang_12 ba_18 chen_21 po_26 sbyin_29 
T02D1644:283a-6	badzra aa bhi shinytsa h'um zhes brjod cing bkru'o //	badzra_0 aa_7 bhi_10 shinytsa_14 h_23 zhes_28 rjod_33 cing_39 'khrud_44 
T02D1644:283a-7	de nas bcom ldan 'das rig ma dang bcas pa de dag slob ma'i bu gar btsud de /	de_0 nas_3 'joms_7 ldan_12 'da'_17 rig_22 ma_26 dang_29 'cha'_34 ba_39 de_42 'dag_45 slob_49 ma_54 bu_59 gar_62 btsud_66 de_72 
T02D1644:283a-8	lus thams cad bde ba'i rang bzhin du byas nas /	lus_0 thams_4 cad_10 bde_14 ba_18 rang_23 bzhin_28 du_34 byed_37 nas_42 
T02D1644:283a-9	mi bskyod pa'i cod pan gyi sbyor bas bsams te /	mi_0 skyod_3 ba_10 cod_15 pan_19 gyi_23 sbyor_27 ba_33 bsams_37 te_43 
T02D1644:283a-10	mi bskyod pa'i rang bzhin gyi chu'i dbang ngo //	mi_0 skyod_3 ba_10 rang_15 bzhin_20 gyi_26 chu_30 dbang_36 ngo_42 
T02D1644:283a-11	de nas gser la sogs pa'i khams kyi rang bzhin las byas pa'am /	de_0 nas_3 gser_7 la_12 sogs_15 ba_20 khams_25 kyi_31 rang_35 bzhin_40 las_46 byed_50 ba_55 
T02D1644:283a-12	ma 'byor na dar dang ras la sogs pa las byas pa'i cod pan bcings la /	ma_0 'byor_3 na_9 dar_12 dang_16 ras_21 la_25 sogs_28 ba_33 las_36 byed_40 ba_45 cod_50 pan_54 'ching_58 la_65 
T02D1644:283a-13	nam mkha' gang ba'i de bzhin gshegs pa thams cad	nam_0 mkha'_4 gang_10 ba_15 de_20 bzhin_23 gshegs_29 ba_36 thams_39 cad_45 
T02D1644:283a-14	rin chen 'byung ldan gyi gzugs kyis der zhugs par	rin_0 chen_4 'byung_9 ldan_16 gyi_21 gzugs_25 kyis_31 der_36 'jug_40 ba_46 
T02D1644:283a-15	bsams te / bdag po rtags kyis mtshan pa yi //	bsams_0 te_6 bdag_11 po_16 rtags_19 kyis_25 mtshan_30 ba_37 yi_40 
T02D1644:283a-16	rtags kyi dam pa cod pan gyis //	rtags_0 kyi_6 dam_10 ba_14 cod_17 pan_21 gyis_25 
T02D1644:283a-17	de ring khyod la dbang bskur bas //	de_0 ring_3 khyod_8 la_14 dbang_17 skur_23 ba_29 
T02D1644:283a-18	'gro ba'i mgon skyabs byed par shog / aom ratna	'gro_0 ba_5 mgon_10 skyob_15 byed_22 ba_27 shog_31 aom_38 ratna_42 
T02D1644:283a-19	mu ku ta aa bhi shi nytsa zhes pas dbang	mu_0 ku_3 ta_6 aa_9 bhi_12 'chi_16 nytsa_20 zhes_26 ba_31 dbang_35 
T02D1644:283a-20	bskur te / rin chen 'byung ldan gyi rang bzhin gyi cod pan gyi dbang ngo //	skur_0 te_6 rin_11 chen_15 'byung_20 ldan_27 gyi_32 rang_36 bzhin_41 gyi_47 cod_51 pan_55 gyi_59 dbang_63 ngo_69 
T02D1644:283a-21	de nas rdo rje rtse lnga pa blangs te /	de_0 nas_3 rdo_7 rje_11 rtse_15 lnga_20 ba_25 blangs_28 te_35 
T02D1644:283a-22	slob ma'i gnas gsum du gtugs la /	slob_0 ma_5 gnas_10 gsum_15 du_20 gtugs_23 la_29 
T02D1644:283a-23	sangs rgyas kyi ni rdo rje'i dbang //	sangs_0 rgya_6 kyi_12 ni_16 rdo_19 rje_23 dbang_29 
T02D1644:283a-24	di ring khyod la bskur bar bya //	di_0 ring_3 khyod_8 la_14 skur_17 ba_23 byed_27 
T02D1644:283a-25	'di de sangs rgyas thams cad nyid //	'di_0 de_4 sangs_7 rgya_13 thams_19 cad_25 nyid_29 
T02D1644:283a-26	rab tu bsgrub phyir rdo rje gzung //	rab_0 tu_4 sgrub_7 phyir_14 rdo_20 rje_24 gzung_28 
T02D1644:283a-27	ma h'a badzra h'um zhes pas lag pa g-yas su rdo rje sbyin /	ma_0 h_3 badzra_7 h_14 zhes_19 ba_24 lag_28 ba_32 g-yas_35 su_41 rdo_44 rje_48 sbyin_52 
T02D1644:283a-28	snang ba mtha' yas kyi rang bzhin gyi rdo rje'i dbang ngo //	snang_0 ba_6 mtha'_9 yas_15 kyi_19 rang_23 bzhin_28 gyi_34 rdo_38 rje_42 dbang_48 ngo_54 
T02D1644:283a-29	de nas lag pa g-yas pa dang g-yon par rdo rje dril bu byin la /	de_0 nas_3 lag_7 ba_11 g-yas_14 ba_20 dang_23 g-yon_28 ba_34 rdo_38 rje_42 'dril_46 bu_51 byin_54 la_59 
T02D1644:283a-30	shes rab dril bu'i dbang bskur ba //	shes_0 rab_5 'dril_9 bu_14 dbang_19 skur_25 ba_31 
T02D1644:283a-31	di ring khyod la sbyin par bya //	di_0 ring_3 khyod_8 la_14 sbyin_17 ba_23 byed_27 
