T02D3319:14b-0	@14b # // rgya gar skad du /	rgya_10 gar_15 skad_19 du_24 
T02D3319:14b-1	badzra aam ga manydzu gho sha s'a dha nam /	badzra_0 aam_7 ga_11 manydzu_14 gho_22 sha_26 s_30 dha_34 nam_38 
T02D3319:14b-2	bod skad du /	'bod_0 skad_4 du_9 
T02D3319:14b-3	yan lag med pa'i rdo rje 'jam pa'i dbyangs kyi sgrub thabs /	yan_0 lag_4 med_8 ba_12 rdo_17 rje_21 'jam_25 ba_30 dbyangs_35 kyi_43 sgrub_47 thabs_53 
T02D3319:14b-4	'phags pa 'jam dpal dbyangs la phyag 'tshal lo //	'phag_0 ba_7 'jam_10 dpal_15 dbyangs_20 la_28 phyag_31 'tshal_37 lo_44 
T02D3319:14b-5	sngon du bstan pa bzhin du sdig pa bshags pa	sngon_0 du_6 ston_9 ba_15 bzhin_18 du_24 sdig_27 ba_32 'chags_35 ba_42 
T02D3319:14b-6	la sogs pa byas nas stong par bsgoms pa'i rjes	la_0 sogs_3 ba_8 byed_11 nas_16 stong_20 ba_26 sgom_30 ba_37 rjes_42 
T02D3319:14b-7	su yi ge ham las skyes pa'i yi ge ham	su_0 yi_3 ge_6 ham_9 las_13 skye_17 ba_23 yi_28 ge_31 ham_34 
T02D3319:14b-8	gi chang gzungs kyi dbus su mnan pa'i mda' dang	gi_0 chang_3 gzungs_9 kyi_16 dbus_20 su_25 gnon_28 ba_33 mda'_38 dang_43 
T02D3319:14b-9	ldan pa'i gzhu bsgoms nas /	ldan_0 ba_5 gzhu_10 sgom_15 nas_22 
T02D3319:14b-10	de yongs su gyur ba las yan lag med pa'i	de_0 yongs_3 su_9 gyur_12 ba_17 las_20 yan_24 lag_28 med_32 ba_36 
T02D3319:14b-11	rdo rje zhes bya ba 'phags pa 'jam dpal mdog	rdo_0 rje_4 zhes_8 byed_13 ba_17 'phag_20 ba_27 'jam_30 dpal_35 mdog_40 
T02D3319:14b-12	ser po phyag drug pa'o //	ser_0 po_4 phyag_7 drug_13 ba_18 
T02D3319:14b-13	rtsa ba'i phyag gnyis ni rna ltag gi bar du	rtsa_0 ba_5 phyag_10 gnyis_16 ni_22 rna_25 ltag_29 gi_34 ba_37 du_41 
T02D3319:14b-14	bkang ba'i autpa la dmar po'i mde'u can gyi mnga'	'geng_0 ba_6 autpa_11 la_17 dmar_20 po_25 mde_30 can_36 gyi_40 mnga'_44 
T02D3319:14b-15	dang ldan pa'i me tog gi gzhu 'dzin pa'o //	dang_0 ldan_5 ba_10 me_15 tog_18 gi_22 gzhu_25 'dzin_30 ba_36 
T02D3319:14b-16	g-yas pa'i phyag gnyis na ral gri dang me long bsnams pa /	g-yas_0 ba_6 phyag_11 gnyis_17 na_23 ral_26 gri_30 dang_34 me_39 long_42 snom_47 ba_54 
T02D3319:14b-17	g-yon pa gnyis na autpal la sngon po dang shing	g-yon_0 ba_6 gnyis_9 na_15 autpal_18 la_25 sngon_28 po_34 dang_37 shing_42 
T02D3319:14b-18	mya ngan med pa dmar po yal ga me tog	mya_0 ngan_4 med_9 ba_13 dmar_16 po_21 yal_24 ga_28 me_31 tog_34 
T02D3319:14b-19	dang bcas pa bsnams pa'o //	dang_0 'cha'_5 ba_10 snom_13 ba_20 
T02D3319:14b-20	mi bskyod pas byin gyis brlabs pa'i ral pa'i cod pan can g-yon brkyang pa'i zhabs can /	mi_0 skyod_3 ba_10 byin_14 gyis_19 brlabs_24 ba_31 ral_36 ba_40 cod_45 pan_49 can_53 g-yon_57 rkyong_63 ba_71 zhabs_76 can_82 
T02D3319:14b-21	lo bcu drug gi rnam par byed cing cher sgeg pa'i skur blta bar bya'o //	lo_0 'chu_3 drug_7 gi_12 rnam_15 ba_20 byed_24 cing_29 cher_34 sgeg_39 ba_44 skur_49 lta_54 ba_59 byed_63 
T02D3319:14b-22	yang na phyag bzhi pa ste me long dang /	yang_0 na_5 phyag_8 bzhi_14 ba_19 ste_22 me_26 long_29 dang_34 
T02D3319:14b-23	mya ngan med pa'i yal ga me tog dang bcas	mya_0 ngan_4 med_9 ba_13 yal_18 ga_22 me_25 tog_28 dang_32 'cha'_37 
T02D3319:14b-24	pa bsnams pa'i phyag gnyis dang bral ba bsgom par	ba_0 snom_3 ba_10 phyag_15 gnyis_21 dang_27 'bral_32 ba_37 bsgom_40 ba_46 
T02D3319:14b-25	bya'o// de nas ye shes sems dpa' dang gcig tu byas nas /	de_8 nas_11 ye_15 shes_18 sems_23 dpa'_28 dang_33 gcig_38 tu_43 byed_46 nas_51 
T02D3319:14b-26	aom manydzu gho sha hr'i:dza:zhes bya ba'i sngags bzlas pa bya'o //	aom_0 manydzu_4 gho_12 sha_16 hr:dza:zhes_20 byed_34 ba_38 sngags_43 bzlas_50 ba_56 byed_59 
T02D3319:14b-27	'bum phrag gcig bzlas la 'jig rten gsum po yang ci bgyi bar byed par 'gyur ro //	'bum_0 phrag_5 gcig_11 bzlas_16 la_22 'jig_25 rten_30 gsum_35 po_40 yang_43 ci_48 bgyid_51 ba_56 byed_60 ba_65 'gyur_69 ro_75 
T02D3319:14b-28	yang na kha cig dgug par 'dod pas gong du gsungs pa bzhin du bsgom par byas nas //	yang_0 na_5 kha_8 cig_12 'gugs_16 ba_21 'dod_25 ba_30 gong_34 du_39 gsungs_42 ba_49 bzhin_52 du_58 bsgom_61 ba_67 byed_71 nas_76 
T02D3319:14b-29	de nga rgyal brtan po byas pa'i yid kyis rang	de_0 nga_3 rgyal_7 brtan_13 po_19 byed_22 ba_27 yid_32 kyis_36 rang_41 
T02D3319:14b-30	gi snying gar padma dmar po 'dab ma bcu drug	gi_0 snying_3 gar_10 padma_14 dmar_20 po_25 'dab_28 ma_33 'chu_36 drug_40 
T02D3319:14b-31	pa mngon par 'phyang ba'i sdong bu dang /	ba_0 mngon_3 ba_9 'phyang_13 ba_21 sdong_26 bu_32 dang_35 
T02D3319:14b-32	rtsa ba dang bcas pa dmigs nas de'i sdong bu'i dbus su yi ge h'um dmar po dgu blta'o //	rtsa_0 ba_5 dang_8 'cha'_13 ba_18 dmigs_21 nas_27 de_31 sdong_36 bu_42 dbus_47 su_52 yi_55 ge_58 h_61 dmar_66 po_71 dgu_74 lta_78 
T02D3319:15a-0	de'i 'dab ma la g-yas skor du dbyangs yig dmar po bcu drug bsgom @15a * //	de_0 'dab_5 ma_10 la_13 g-yas_16 skor_22 du_27 dbyangs_30 yig_38 dmar_42 po_47 'chu_50 drug_54 bsgom_59 
T02D3319:15a-1	par byas nas /	ba_0 byed_4 nas_9 
T02D3319:15a-2	de'i ze'u 'bru'i steng du nub mo dang nyin mo ji ltar srid par nyi ma dang /	de_0 ze_5 'bru_10 steng_17 du_23 nub_26 mo_30 dang_33 nyin_38 mo_43 ji_46 ltar_49 srid_54 ba_59 nyi_63 ma_67 dang_70 
T02D3319:15a-3	zla ba'i dkyil 'khor dmar po'o //	zla_0 ba_4 dkyil_9 'khor_15 dmar_21 po_26 
T02D3319:15a-4	de'i dbus yang yi ge hr'i:dmar po gnyis kyi bar	de_0 dbus_5 yang_10 yi_15 ge_18 hr:dmar_21 po_31 gnyis_34 kyi_40 ba_44 
T02D3319:15a-5	du bcug pa'i 'og nas bshad pa'i rang gi sngags	du_0 'jug_3 ba_8 'og_13 nas_17 'chad_21 ba_27 rang_32 gi_37 sngags_40 
T02D3319:15a-6	blta bar bya'o // de nas dbyangs yig dmar po	lta_0 ba_5 byed_9 de_18 nas_21 dbyangs_25 yig_33 dmar_37 po_42 
T02D3319:15a-7	de rnams sbrang ma dga' ba rgyas par rnam par	de_0 rnams_3 sbrang_9 ma_16 dga'_19 ba_24 rgya_27 ba_33 rnam_37 ba_42 
T02D3319:15a-8	blta bar bya'o // bsgoms nas / rang gi sngags	lta_0 ba_5 byed_9 sgom_18 nas_25 rang_31 gi_36 sngags_39 
T02D3319:15a-9	kyi 'od zer gyi tshogs kyis phyogs bcu bkang ste	kyi_0 'od_4 zer_8 gyi_12 tshogs_16 kyis_23 phyogs_28 'chu_35 'geng_39 ste_45 
T02D3319:15a-10	ji snyed mngon par 'dod pa'i bud med kyi gnas	ji_0 snyed_3 mngon_9 ba_15 'dod_19 ba_24 'bud_29 med_33 kyi_37 gnas_41 
T02D3319:15a-11	su song nas me rlung gi dkyil 'khor steng du	su_0 'gro_3 nas_8 me_12 rlung_15 gi_21 dkyil_24 'khor_30 steng_36 du_42 
T02D3319:15a-12	stobs kyis bzhag nas 'od zer gyi rang bzhin nyid	stobs_0 kyis_6 'jog_11 nas_17 'od_21 zer_25 gyi_29 rang_33 bzhin_38 nyid_44 
T02D3319:15a-13	kyi zhags pas legs par ske nas bcings nas /	kyi_0 zhags_4 ba_10 legs_14 ba_19 ske_23 nas_27 'ching_31 nas_38 
T02D3319:15a-14	lcags kyu rnon pos chos 'byung nas phug ste mdun	lcags_0 kyu_6 rnon_10 pos_15 chos_19 'byung_24 nas_31 'bugs_35 ste_40 mdun_44 
T02D3319:15a-15	du yang dag par bkug nas thal mo sbyar te	du_0 yang_3 'dag_8 ba_12 'gugs_16 nas_21 thal_25 mo_30 sbyor_33 te_39 
T02D3319:15a-16	/ mgal me 'khor ba'i 'khor lo'i nang du bcug nas yi ge h'um dmar pos mig dang /	mgal_2 me_7 'khor_10 ba_16 'khor_21 lo_27 nang_32 du_37 'jug_40 nas_45 yi_49 ge_52 h_55 dmar_60 pos_65 mig_69 dang_73 
T02D3319:15a-17	snying ga dang /	snying_0 ga_7 dang_10 
T02D3319:15a-18	yan lag dang nying lag thams cad bkang bar bsgom par bya'o //	yan_0 lag_4 dang_8 nying_13 lag_19 thams_23 cad_29 'geng_33 ba_39 bsgom_43 ba_49 byed_53 
T02D3319:15a-19	de nas de'i snying gar dbyangs yig dmar po bcu	de_0 nas_3 de_7 snying_12 gar_19 dbyangs_23 yig_31 dmar_35 po_40 'chu_43 
T02D3319:15a-20	drug dang ldan pa'i sdong bu'i sbubs nas yi ge	drug_0 dang_5 ldan_10 ba_15 sdong_20 bu_26 sbub_31 nas_37 yi_41 ge_44 
T02D3319:15a-21	h'um dang bcas pa'i padma 'dab ma bcu drug pa	h_0 dang_5 'cha'_10 ba_15 padma_20 'dab_26 ma_31 'chu_34 drug_38 ba_43 
T02D3319:15a-22	dmigs par bya ste /	dmigs_0 ba_6 byed_10 ste_14 
T02D3319:15a-23	'on kyang dri ma dang bcas pa'i mdog can no //	'on_0 kyang_4 'dri_10 ma_14 dang_17 'cha'_22 ba_27 mdog_32 can_37 no_41 
T02D3319:15a-24	de'i dbus su yi ge hr'i:de'i bar du bcug pa'i ming gi yi ge bsam par bya'o ;	de_0 dbus_5 su_10 yi_13 ge_16 hr:de_19 ba_29 du_33 'jug_36 ba_41 ming_46 gi_51 yi_54 ge_57 bsam_60 ba_65 byed_69 
T02D3319:15a-25	/ de nas rang gi sngags kyi 'od zer las	de_2 nas_5 rang_9 gi_14 sngags_17 kyi_24 'od_28 zer_32 las_36 
T02D3319:15a-26	byung ba'i rab tu dmar zhing phra ba'i lcags kyu	'byung_0 ba_6 rab_11 tu_15 dmar_18 zhing_23 phra_29 ba_34 lcags_39 kyu_45 
T02D3319:15a-27	rab tu rnon po dang /	rab_0 tu_4 rnon_7 po_12 dang_15 
T02D3319:15a-28	padma'i sdong bu la gnas pa'i yi ge h'um gi	padma_0 sdong_8 bu_14 la_17 gnas_20 ba_25 yi_30 ge_33 h_36 gi_41 
T02D3319:15a-29	'od kyis steng du 'gro zhing bskul bas sbrang bu'i	'od_0 kyis_4 steng_9 du_15 'gro_18 zhing_23 skul_29 ba_35 sbrang_39 bu_46 
T02D3319:15a-30	tshogs kyi rjes su 'gro bzhin pas /	tshogs_0 kyi_7 rjes_11 su_16 'gro_19 bzhin_24 ba_30 
T02D3319:15a-31	rang gi sna bug g-yas las gzhan pa'i cig shos kyi sgor byung ste /	rang_0 gi_5 sna_8 'bug_12 g-yas_16 las_22 gzhan_26 ba_32 cig_37 shos_41 kyi_46 sgor_50 'byung_55 ste_61 
T02D3319:15a-32	bsgrub bya'i sna bug g-yas pa'i sgo nas de'i snying gar zhugs te /	sgrub_0 byed_7 sna_13 'bug_17 g-yas_21 ba_27 sgo_32 nas_36 de_40 snying_45 gar_52 'jug_56 te_62 
T02D3319:15a-33	lcag skyu de yis de'i ming gi yi ge 'gugs par gnas par byed cing /	lcag_0 skyu_5 de_10 yis_13 de_17 ming_22 gi_27 yi_30 ge_33 'gugs_36 ba_42 gnas_46 ba_51 byed_55 cing_60 
T02D3319:15a-34	sbrang de rnams kyis kyang dga' bas padma de phyung zhing /	sbrang_0 de_7 rnams_10 kyis_16 kyang_21 dga'_27 ba_32 padma_36 de_42 'byin_45 zhing_52 
T02D3319:15a-35	rang dags dum bur byed cing dbyangs yid rnams gzhib bar bya'o //	rang_0 dags_5 dum_10 bur_14 byed_18 cing_23 dbyangs_28 yid_36 rnams_40 'jib_46 ba_52 byed_56 
T02D3319:15a-36	zhes yun ring du mi g-yo bar blta bar bya'o //	zhes_0 yun_5 ring_9 du_14 mi_17 g-yo_20 ba_25 lta_29 ba_34 byed_38 
T02D3319:15a-37	de nas de kho na bzhin dbugs kyis bskul ba'i lcags kyus de'i ming stobs kyis blangs te /	de_0 nas_3 de_7 kho_10 na_14 bzhin_17 dbugs_23 kyis_29 skul_34 ba_40 lcags_45 kyus_51 de_56 ming_61 stobs_66 kyis_72 blangs_77 te_84 
T02D3319:15a-38	sbrang bu de rnams kyis kyang /	sbrang_0 bu_7 de_10 rnams_13 kyis_19 kyang_24 
T02D3319:15a-39	rang gi dbyangs yig bkug ste /	rang_0 gi_5 dbyangs_8 yig_16 'gugs_20 ste_25 
T02D3319:15a-40	de'i sna bug g-yon pa'i lam du byung bar blta bar bya'o //	de_0 sna_5 'bug_9 g-yon_13 ba_19 lam_24 du_28 'byung_31 ba_37 lta_41 ba_46 byed_50 
T02D3319:15b-0	yang de blangs nas 'jug pa'i @15b rlung gis lcags kyu dang /	yang_0 de_5 blangs_8 nas_15 'jug_19 ba_24 rlung_34 gis_40 lcags_44 kyu_50 dang_54 
T02D3319:15b-1	sbrang bu rnams bkug ste /	sbrang_0 bu_7 rnams_10 'gugs_16 ste_21 
T02D3319:15b-2	rang gi sna bug g-yas pa'i sgo nas 'jug ste /	rang_0 gi_5 sna_8 'bug_12 g-yas_16 ba_22 sgo_27 nas_31 'jug_35 ste_40 
T02D3319:15b-3	de'i ming gi yi ge rang gi snying ga'i sngags la bcug nas /	de_0 ming_5 gi_10 yi_13 ge_16 rang_19 gi_24 snying_27 ga_34 sngags_39 la_46 'jug_49 nas_54 
T02D3319:15b-4	de'i ming gi yi ge rang gi snying ga'i sngags kyis drag por mnan nas /	de_0 ming_5 gi_10 yi_13 ge_16 rang_19 gi_24 snying_27 ga_34 sngags_39 kyis_46 drag_51 por_56 gnon_60 nas_65 
T02D3319:15b-5	dbyangs yig de rnams 'dab ma so so la sbrang	dbyangs_0 yig_8 de_12 rnams_15 'dab_21 ma_26 so_29 so_32 la_35 sbrang_38 
T02D3319:15b-6	bu mchog gis dbang du byas pa'i rnam par bsam	bu_0 mchog_3 gis_9 dbang_13 du_19 byed_22 ba_27 rnam_32 ba_37 bsam_41 
T02D3319:15b-7	par bya'o zhes bya'o //	ba_0 byed_4 zhes_10 byed_15 
T02D3319:15b-8	rim pa 'dis rang gi rnam par shes pa dang /	rim_0 ba_4 'dis_7 rang_12 gi_17 rnam_20 ba_25 shes_29 ba_34 dang_37 
T02D3319:15b-9	de'i rnam par shes pa de gcig tu byas pa blta bar bya'o //	de_0 rnam_5 ba_10 shes_14 ba_19 de_22 gcig_25 tu_30 byed_33 ba_38 lta_41 ba_46 byed_50 
T02D3319:15b-10	de nas de'i nu ma la autpal la dmar po'i	de_0 nas_3 de_7 nu_12 ma_15 la_18 autpal_21 la_28 dmar_31 po_36 
T02D3319:15b-11	mde'u rnon po dang ldan pa'i mdas phug nas 'dod	mde_0 rnon_6 po_11 dang_14 ldan_19 ba_24 mdas_29 'bugs_34 nas_39 'dod_43 
T02D3319:15b-12	chags chen pos brgyal par gyur bar bltas nas lcags	chags_0 chen_6 pos_11 brgyal_15 ba_22 gyur_26 ba_31 lta_35 nas_41 lcags_45 
T02D3319:15b-13	sgrog lta bu'i gzhus de'i rkang pa gnyis dam par	sgrog_0 lta_6 bu_10 gzhus_15 de_21 rkang_26 ba_32 gnyis_35 dam_41 ba_45 
T02D3319:15b-14	bcings nas / rang gis bsnams pa'i autpa la'i sdong	'ching_0 nas_7 rang_13 gis_18 snom_22 ba_29 autpa_34 la_40 sdong_45 
T02D3319:15b-15	bu'i rang bzhin gyi zhags pas ske nas bcings te	bu_0 rang_5 bzhin_10 gyi_16 zhags_20 ba_26 ske_30 nas_34 'ching_38 te_45 
T02D3319:15b-16	bcings nas / / yang dag par bkug nas rkang pa gnyis kyi drung du lhung bar byas nas /	'ching_0 nas_7 yang_15 'dag_20 ba_24 'gugs_28 nas_33 rkang_37 ba_43 gnyis_46 kyi_52 drung_56 du_62 lhung_65 ba_71 byed_75 nas_80 
T02D3319:15b-17	mya ngan med pas snying gar brabs pa'o //	mya_0 ngan_4 med_9 ba_13 snying_17 gar_24 'brab_28 ba_34 
T02D3319:15b-18	mngon pa'i nga rgyal med par byas la /	mngon_0 ba_6 nga_11 rgyal_15 med_21 ba_25 byed_29 la_34 
T02D3319:15b-19	ral gris 'jigs par bya ste /	ral_0 gris_4 'jigs_9 ba_15 byed_19 ste_23 
T02D3319:15b-20	skyabs gzhan med par byas nas yang rang nyid ji	skyob_0 gzhan_7 med_13 ba_17 byed_21 nas_26 yang_30 rang_35 nyid_40 ji_45 
T02D3319:15b-21	ltar gnas pas skra grol ba shin tu 'dod chags	ltar_0 gnas_5 ba_10 skra_14 grol_19 ba_24 shin_27 tu_32 'dod_35 chags_40 
T02D3319:15b-22	kyis myos pa gcer bu gos med pa /	kyis_0 myos_5 ba_10 bcer_13 bu_18 gos_21 med_25 ba_29 
T02D3319:15b-23	mi sbyor bas 'jigs shing shin tu chags par gyur	mi_0 sbyor_3 ba_9 'jigs_13 shing_19 shin_25 tu_30 chags_33 ba_39 gyur_43 
T02D3319:15b-24	pa me long la brtan par byas nas rang rig	ba_0 me_3 long_6 la_11 brtan_14 ba_20 byed_24 nas_29 rang_33 rig_38 
T02D3319:15b-25	pas rjes su chags par bya'o //	ba_0 rjes_4 su_9 chags_12 ba_18 byed_22 
T02D3319:15b-26	aom hr'i:aa mu kim a'a karsha ya manydzu sha hr'i:dza:zhes	aom_0 hr:aa_4 mu_12 kim_15 a_19 karsha_23 ya_30 manydzu_33 sha_41 hr:dza:zhes_45 
T02D3319:15b-27	bya ba'i rang gi sngags kyi ming dang bcas pa	byed_0 ba_4 rang_9 gi_14 sngags_17 kyi_24 ming_28 dang_33 'cha'_38 ba_43 
T02D3319:15b-28	rtse gcig pa'i yid kyis bzlas par bya'o //	rtse_0 gcig_5 ba_10 yid_15 kyis_19 bzlas_24 ba_30 byed_34 
T02D3319:15b-29	de ltar gong du gsungs pa'i rim pas dkar po'i phyogs kyi chos gcig nas brtsams te /	de_0 ltar_3 gong_8 du_13 gsungs_16 ba_23 rim_28 ba_32 dkar_36 po_41 phyogs_46 kyi_53 chos_57 gcig_62 nas_67 brtsams_71 te_79 
T02D3319:15b-30	ji srid tshes bcu bzhi'i bar du khri phrag gcig tsam bzlas par bya'o //	ji_0 srid_3 tshes_8 'chu_14 bzhi_18 ba_25 du_29 khri_32 phrag_37 gcig_43 tsam_48 bzlas_53 ba_59 byed_63 
T02D3319:15b-31	yang bco lnga la mchod pa rgya chen po byas nas mtshan thog thag bzlas pa bya'o //	yang_0 'chos_5 lnga_9 la_14 mchod_17 ba_23 rgya_26 chen_31 po_36 byed_39 nas_44 mtshan_48 thogs_55 thag_60 bzlas_65 ba_71 byed_74 
T02D3319:15b-32	de nas tho rangs de nges par 'ong bar 'gyur ro //	de_0 nas_3 tho_7 rangs_11 de_17 nges_20 ba_25 'ong_29 ba_34 'gyur_38 ro_44 
T02D3319:15b-33	'ongs nas de la yang phyag rgya chen po'i dngos	'ongs_0 nas_6 de_10 la_13 yang_16 phyag_21 rgya_27 chen_32 po_37 dngos_42 
T02D3319:15b-34	grub kyi don du rang gi lha mchod pa'i bsam	'grub_0 kyi_5 don_9 du_13 rang_16 gi_21 lha_24 mchod_28 ba_34 bsam_39 
T02D3319:15b-35	pas ji ltar bde bar longs spyod par bya'o //	ba_0 ji_4 ltar_7 bde_12 ba_16 longs_20 spyod_26 ba_32 byed_36 
T02D3319:15b-36	yan lag med pa'i rdo rje'i 'jam pa'i dbyangs kyi sgrub pa'i thabs rdzogs so //	yan_0 lag_4 med_8 ba_12 rdo_17 rje_21 'jam_27 ba_32 dbyangs_37 kyi_45 sgrub_49 ba_55 thabs_60 rdzogs_66 so_73 
T02D3319:15b-37	khams pa lo ts'a ba ba ri dge slong dharma k'irtis bsgyur ba'o//	khams_0 ba_6 lo_9 ts_12 ba_17 ba_20 ri_23 dge_26 slong_30 dharma_36 k_43 sgyur_51 
