T02D1897:264b-13	'phyang ba smin ma dang sma ra dang skra gyen	'phyang_0 ba_8 smin_11 ma_16 dang_19 sma_24 ra_28 dang_31 skra_36 gyen_41 
T02D1897:264b-14	du 'greng ba rnams so //	du_0 'greng_3 ba_10 rnams_13 so_19 
T02D1897:264b-15	klu mtha' yas shin tu sngo bas mgo la bcing	klu_0 mtha'_4 yas_10 shin_14 tu_19 sngo_22 ba_27 mgo_31 la_35 'ching_38 
T02D1897:264b-16	ba dang 'jog po dmar pos rna ba'i 'dab ma	ba_0 dang_3 'jog_8 po_13 dmar_16 pos_21 rna_25 ba_29 'dab_34 ma_39 
T02D1897:264b-17	brgyan pa dang / dkar po padma chen pos rgyan do shal byas pa dang /	rgyan_0 ba_7 dang_10 dkar_17 po_22 padma_25 chen_31 pos_36 rgyan_40 do_46 shal_49 byed_54 ba_59 dang_62 
T02D1897:264b-18	ljang gu ka rko ta sa tshangs pa'i skud pa dang /	ljang_0 gu_6 ka_9 rko_12 ta_16 sa_19 tshangs_22 ba_30 skud_35 ba_40 dang_43 
T02D1897:264b-19	ser bo dung skyong gis gdu bu byas pa dang /	ser_0 'bo_4 dung_7 skyong_12 gis_19 gdu_23 bu_27 byed_30 ba_35 dang_38 
T02D1897:264b-20	kha dog sna tshogs rigs ldan gyis legs par mdzes pa'i dpung rgyan dang /	kha_0 dog_4 sna_8 tshogs_12 rigs_19 ldan_24 gyis_29 legs_34 ba_39 mdzes_43 ba_49 dpung_54 rgyan_60 dang_66 
T02D1897:264b-21	padma skya bo lta bu nor ldan gyis ska rags spras pa dang /	padma_0 skya_6 'bo_11 lta_14 bu_18 nor_21 ldan_25 gyis_30 ska_35 rags_39 spras_44 ba_50 dang_53 
T02D1897:264b-22	padma'i yu ba skya bo lta bu'i padma rkang rgyan byas pa dang /	padma_0 yu_8 ba_11 skya_14 'bo_19 lta_22 bu_26 padma_31 rkang_37 rgyan_43 byed_49 ba_54 dang_57 
T02D1897:264b-23	stag gi pags pa'i gos 'dzin pa dang /	stag_0 gi_5 pags_8 ba_13 gos_18 'dzin_22 ba_28 dang_31 
T02D1897:264b-24	lce 'dril ba dang /	lce_0 'dril_4 ba_10 dang_13 
T02D1897:264b-25	gdong 'jigs pa dang /	gdong_0 'jigs_6 ba_12 dang_15 
T02D1897:264b-26	bzhad pa'i gad rgyangs dang /	bzhad_0 ba_6 gad_11 rgyangs_15 dang_23 
T02D1897:264b-27	dpral ba'i dbyes la khro gnyer dang /	dpral_0 ba_6 dbyes_11 la_17 khro_20 gnyer_25 dang_31 
T02D1897:264b-28	spyan zlum po cung zad dmar ba rnams so //	spyan_0 zlum_6 po_11 cung_14 zad_19 dmar_23 ba_28 rnams_31 so_37 
T02D1897:264b-29	khro bo mdzes pa rnams ni khro ba'i gzugs dang /	khro_0 'bo_5 mdzes_8 ba_14 rnams_17 ni_23 khro_26 ba_31 gzugs_36 dang_42 
T02D1897:264b-30	khro gnyer cung zad dang rgyan thams cad 'dzin pa	khro_0 gnyer_5 cung_11 zad_16 dang_20 rgyan_25 thams_31 cad_37 'dzin_41 ba_47 
T02D1897:264b-31	dang rin po che'i dbu rgyan can te sma ra	dang_0 rin_5 po_9 che_12 dbu_18 rgyan_22 can_28 te_32 sma_35 ra_39 
T02D1897:264b-32	med pa'o // dpal 'jam pa'i rdo rje dang /	med_0 ba_4 dpal_12 'jam_17 ba_22 rdo_27 rje_31 dang_35 
T02D1897:264b-33	rnam par snang mdzad dang /	rnam_0 ba_5 snang_9 mdzad_15 dang_21 
T02D1897:264b-34	rin chen 'byung ldan dang /	rin_0 chen_4 'byung_9 ldan_16 dang_21 
T02D1897:264b-35	snang ba mtha' yas dang ;	snang_0 ba_6 mtha'_9 yas_15 dang_19 
T02D1897:264b-36	don yod grub pa dang /	don_0 yod_4 'grub_8 ba_13 dang_16 
T02D1897:264b-37	m'a ma k'i dang /	m_0 ma_4 k_7 dang_11 
T02D1897:264b-38	sgra rdo rje dang /	sgra_0 rdo_5 rje_9 dang_13 
T02D1897:264b-39	shes rab mthar byed dang /	shes_0 rab_5 mthar_9 byed_15 dang_20 
T02D1897:264b-40	bgegs mthar byed dang /	bgegs_0 mthar_6 byed_12 dang_17 
T02D1897:264b-41	srung ba'i 'khor lo la gnas pa'i bgegs mthar byed dang /	srung_0 ba_6 'khor_11 lo_17 la_20 gnas_23 ba_28 bgegs_33 mthar_39 byed_45 dang_50 
T02D1897:264b-42	shes rab mthar byed dang /	shes_0 rab_5 mthar_9 byed_15 dang_20 
T02D1897:264b-43	'dod pa'i rgyal po dang /	'dod_0 ba_5 rgyal_10 po_16 dang_19 
T02D1897:264b-44	dbyug pa sngon po dang /	dbyug_0 ba_6 sngon_9 po_15 dang_18 
T02D1897:265a-0	stobs @265a * //	stobs_0 
T02D1897:265a-1	po che dang /	po_0 che_3 dang_7 
T02D1897:265a-2	mi g-yo ba dang /	mi_0 g-yo_3 ba_8 dang_11 
T02D1897:265a-3	gtsug tor 'khor los sgyur ba dang /	gtsug_0 tor_6 'khor_10 los_16 sgyur_20 ba_26 dang_29 
T02D1897:265a-4	gnod mdzes rgyal po dang /	gnod_0 mdzes_5 rgyal_11 po_17 dang_20 
T02D1897:265a-5	rdo rje h'um mdzad rnams kyi rigs kyi bdag po ni mi bskyod pa'o //	rdo_0 rje_4 h_8 mdzad_13 rnams_19 kyi_25 rigs_29 kyi_34 bdag_38 po_43 ni_46 mi_49 skyod_52 ba_59 
T02D1897:265a-6	mi bskyod pa dang chos kyi dbyings kyi rdo rje	mi_0 skyod_3 ba_10 dang_13 chos_18 kyi_23 dbyings_27 kyi_35 rdo_39 rje_43 
T02D1897:265a-7	ma gnyis kyi rigs kyi bdag po rdo rje sems	ma_0 gnyis_3 kyi_9 rigs_13 kyi_18 bdag_22 po_27 rdo_30 rje_34 sems_38 
T02D1897:265a-8	dpa'o // spyan ma dang gzugs rdo rje ma dang /	dpa_0 spyan_9 ma_15 dang_18 gzugs_23 rdo_29 rje_33 ma_37 dang_40 
T02D1897:265a-9	gshin rje mthar byed dang /	gshin_0 rje_6 mthar_10 byed_16 dang_21 
T02D1897:265a-10	srung ba'i 'khor lo la gnas pa'i gshin rje mthar	srung_0 ba_6 'khor_11 lo_17 la_20 gnas_23 ba_28 gshin_33 rje_39 mthar_43 
T02D1897:265a-11	byed rnams kyi bdag po ni rnam par snang mdzad	byed_0 rnams_5 kyi_11 bdag_15 po_20 ni_23 rnam_26 ba_31 snang_35 mdzad_41 
T02D1897:265a-12	do // gos dkar mo dang /	do_0 gos_6 dkar_10 mo_15 dang_18 
T02D1897:265a-13	ro rdo rje ma dang /	ro_0 rdo_3 rje_7 ma_11 dang_14 
T02D1897:265a-14	padma mthar byed dang /	padma_0 mthar_6 byed_12 dang_17 
T02D1897:265a-15	srung ba'i 'khor lo la gnas pa'i padma mthar byed	srung_0 ba_6 'khor_11 lo_17 la_20 gnas_23 ba_28 padma_33 mthar_39 byed_45 
T02D1897:265a-16	rnams kyi bdag po ni snang ba mtha' yas so	rnams_0 kyi_6 bdag_10 po_15 ni_18 snang_21 ba_27 mtha'_30 yas_36 so_40 
T02D1897:265a-17	// sgrol ma dang reg rdo rje ma gnyis kyi bdag po ni don yod grub pa'o //	sgrol_3 ma_9 dang_12 reg_17 rdo_21 rje_25 ma_29 gnyis_32 kyi_38 bdag_42 po_47 ni_50 don_53 yod_57 'grub_61 ba_66 
T02D1897:265a-18	dri rdo rje ma'i bdag po ni rin chen 'byung ldan no //	'dri_0 rdo_4 rje_8 ma_12 bdag_17 po_22 ni_25 rin_28 chen_32 'byung_37 ldan_44 no_49 
T02D1897:265a-19	dkyil 'khor thams cad kyi bdag po la zhal bltas pa'o //	dkyil_0 'khor_6 thams_12 cad_18 kyi_22 bdag_26 po_31 la_34 zhal_37 lta_42 ba_48 
T02D1897:265a-20	rnam par spros pa 'di dran par byas la man	rnam_0 ba_5 spros_9 ba_15 'di_18 dran_22 ba_27 byed_31 la_36 man_39 
T02D1897:265a-21	ngag ji lta ba bzhin du zhabs bsil dang zhal	ngag_0 ji_5 lta_8 ba_12 bzhin_15 du_21 zhabs_24 bsil_30 dang_35 zhal_40 
T02D1897:265a-22	bsil ba dang / aargham phul la dril bu dkrol te /	bsil_0 ba_5 dang_8 aargham_15 'bul_23 la_28 'dril_31 bu_36 'khrol_39 te_45 
T02D1897:265a-23	rang rang gi sa bon de kho na nyid gsum gyi nang du bcug la mngon par bsngags te /	rang_0 rang_5 gi_10 sa_13 bon_16 de_20 kho_23 na_27 nyid_30 gsum_35 gyi_40 nang_44 du_49 'jug_52 la_57 mngon_60 ba_66 bsngags_70 te_78 
T02D1897:265a-24	gnas ji lta ba bzhin du me tog la sogs pa dbul bar bya'o //	gnas_0 ji_5 lta_8 ba_12 bzhin_15 du_21 me_24 tog_27 la_31 sogs_34 ba_39 'bul_42 ba_47 byed_51 
T02D1897:265a-25	de nas phyi'i sku la sogs pa dang /	de_0 nas_3 phyi_7 sku_14 la_18 sogs_21 ba_26 dang_29 
T02D1897:265a-26	gsang ba'i mchod pa ye shes kyi dkyil 'khor la yang dril bu dkrol ba dang bcas pas /	gsang_0 ba_6 mchod_11 ba_17 ye_20 shes_23 kyi_28 dkyil_32 'khor_38 la_44 yang_47 'dril_52 bu_57 'khrol_60 ba_66 dang_69 'cha'_74 ba_79 
T02D1897:265a-27	aom a'a:aom badzra dh'u pe sv'a h'a h'um /	aom_0 a:aom_4 badzra_12 dh_19 pe_24 sv_27 h_32 h_36 
T02D1897:265a-28	'di la sogs pa sngar bstan pa'i sngags kyis ji ltar rnyed pa'i spos dang /	'di_0 la_4 sogs_7 ba_12 sngar_15 ston_21 ba_27 sngags_32 kyis_39 ji_44 ltar_47 rnyed_52 ba_58 spros_63 dang_68 
T02D1897:265a-29	mar me dang dri dang lha bshos la sogs pa	mar_0 me_4 dang_7 'dri_12 dang_16 lha_21 bshos_25 la_31 sogs_34 ba_39 
T02D1897:265a-30	nye bar bstabs la rang gi snying gnas byung ba'i	nye_0 ba_4 stob_8 la_15 rang_18 gi_23 snying_26 gnas_33 'byung_38 ba_44 
T02D1897:265a-31	bla na med pa'i mthar thug pa zag pa dang	bla_0 na_4 med_7 ba_11 mthar_16 thug_22 ba_27 zag_30 ba_34 dang_37 
T02D1897:265a-32	bral ba'i gzugs dang sgra dang dri dang ro dang	'bral_0 ba_5 gzugs_10 dang_16 sgra_21 dang_26 'dri_31 dang_35 ro_40 dang_43 
T02D1897:265a-33	reg bya la thug pa'i rab tu dbye bas 'dod	reg_0 byed_4 la_8 thug_11 ba_16 rab_21 tu_25 'byed_28 ba_33 'dod_37 
T02D1897:265a-34	pa'i yon tan lngas mchod par bya ste /	ba_0 yon_5 tan_9 lngas_13 mchod_19 ba_25 byed_29 ste_33 
T02D1897:265a-35	'di ni phyi'i mchod pa'o //	'di_0 ni_4 phyi_7 mchod_14 ba_20 
T02D1897:265a-36	gsang ba'i mchod pa ni man ngag ji lta ba bzhin du khong du chud par bya'o //	gsang_0 ba_6 mchod_11 ba_17 ni_20 man_23 ngag_27 ji_32 lta_35 ba_39 bzhin_42 du_48 khong_51 du_57 chud_60 ba_65 byed_69 
T02D1897:265a-37	de nas mchod par bya ba dang mchod par byed pa dang /	de_0 nas_3 mchod_7 ba_13 byed_17 ba_21 dang_24 mchod_29 ba_35 byed_39 ba_44 dang_47 
T02D1897:265a-38	mchod pa dang /	mchod_0 ba_6 dang_9 
T02D1897:265a-39	phyag bya ba dang /	phyag_0 byed_6 ba_10 dang_13 
T02D1897:265a-40	phyag byed pa dang /	phyag_0 byed_6 ba_11 dang_14 
T02D1897:265a-41	phyag dang /	phyag_0 dang_6 
T02D1897:265a-42	bshags par bya ba dang /	'chags_0 ba_7 byed_11 ba_15 dang_18 
T02D1897:265a-43	bshags par byed pa dang /	'chags_0 ba_7 byed_11 ba_16 dang_19 
T02D1897:265a-44	bshags pa la sogs pa stong pa nyid dang /	'chags_0 ba_7 la_10 sogs_13 ba_18 stong_21 ba_27 nyid_30 dang_35 
T02D1897:265a-45	mtshan ma med pa dang /	mtshan_0 ma_7 med_10 ba_14 dang_17 
T02D1897:265b-0	rang bzhin gyis 'od gsal bar bsgom par @265b bya'o ;	rang_0 bzhin_5 gyis_11 'od_16 gsal_20 ba_25 bsgom_29 ba_35 byed_45 
T02D1897:265b-1	/ bla na med pa'i mchod pa bdun po gsal	bla_2 na_6 med_9 ba_13 mchod_18 ba_24 bdun_27 po_32 gsal_35 
T02D1897:265b-2	bar byed pa'i tshigs su bcad pa gcig pu 'di	ba_0 byed_4 ba_9 tshigs_14 su_21 gcod_24 ba_29 gcig_32 pu_37 'di_40 
T02D1897:265b-3	ni sngon du byas la lhag pa'i bsam pas gdon	ni_0 sngon_3 du_9 byed_12 la_17 lhag_20 ba_25 bsam_30 ba_35 'don_39 
T02D1897:265b-4	par bya'o // sdig pa thams cad bdag gis bshags	ba_0 byed_4 sdig_13 ba_18 thams_21 cad_27 bdag_31 gis_36 'chags_40 
T02D1897:265b-5	bgyi mchog tu dga' bas dge ba rnams la rjes	bgyid_0 mchog_5 tu_11 dga'_14 ba_19 dge_23 ba_27 rnams_30 la_36 rjes_39 
T02D1897:265b-6	par bya'o // yi rang // bcom ldan 'das kyis	ba_0 byed_4 yi_13 rang_16 'joms_24 ldan_29 'da'_34 kyis_39 
T02D1897:265b-7	dam pa'i chos la yang ni skye ba ji srid	dam_0 ba_4 chos_9 la_14 yang_17 ni_22 skye_25 ba_30 ji_33 srid_36 
T02D1897:265b-8	gnas par gsol ba 'debs //	gnas_0 ba_5 gsol_9 ba_14 'debs_17 
T02D1897:265b-9	dkon mchog gsum la skyabs su mchi bar khas 'ches yid ni byang chub mchog tu sems bskyed bgyi //	dkon(d)_0 mchog_5 gsum_11 la_16 skyob_19 su_26 mchi_29 ba_34 khas_38 'che_43 yid_49 ni_53 byang_56 chub_62 mchog_67 tu_73 sems_76 skyed_81 bgyid_88 
T02D1897:265b-10	de yi lam la yang dag gnas bgyi dge ba'i cho ga byang chub mchog tu bsngo bar bgyi //	de_0 yi_3 lam_6 la_10 yang_13 'dag_18 gnas_22 bgyid_27 dge_32 ba_36 cho_41 ga_45 byang_48 chub_54 mchog_59 tu_65 sngo_68 ba_74 bgyid_78 
T02D1897:265b-11	'di ni rab tu rtogs pa'i mchod pa'o //	'di_0 ni_4 rab_7 tu_11 rtogs_14 ba_20 mchod_25 ba_31 
T02D1897:265b-12	de nas mi bskyod rdo rje zhes bya ba la	de_0 nas_3 mi_7 skyod_10 rdo_17 rje_21 zhes_25 byed_30 ba_34 la_37 
T02D1897:265b-13	sogs pa tshigs su bcad pa lnga dang mngon par	sogs_0 ba_5 tshigs_8 su_15 gcod_18 ba_23 lnga_26 dang_31 mngon_36 ba_42 
T02D1897:265b-14	'dod pa'i bstod pa gzhan yang rung bas bstod la	'dod_0 ba_5 bstod_10 ba_16 gzhan_19 yang_25 rung_30 ba_35 bstod_39 la_45 
T02D1897:265b-15	phyag byas te / bskor ba byas la slar yang phyag byas te /	phyag_0 byed_6 te_11 skor_16 ba_22 byed_25 la_30 slar_33 yang_38 phyag_43 byed_49 te_54 
T02D1897:265b-16	nye bar 'dug nas ji lta ba bzhin du gsang ba 'dus pa'i sngags sam /	nye_0 ba_4 'dug_8 nas_13 ji_17 lta_20 ba_24 bzhin_27 du_33 gsang_36 ba_42 'du_45 ba_50 sngags_55 sam_62 
T02D1897:265b-17	gzhan gang yang rung bas bcom ldan 'das dzam bha la chu dang /	gzhan_0 gang_6 yang_11 rung_16 ba_21 'joms_25 ldan_30 'da'_35 dzam_40 bha_45 la_49 chu_52 dang_56 
T02D1897:265b-18	'byung po thams cad la gtor ma dang /	'byung_0 po_7 thams_10 cad_16 la_20 'thor_23 ma_28 dang_31 
T02D1897:265b-19	yi dags rnams la yang chu spyin par bya'o //	yi_0 dags_3 rnams_8 la_14 yang_17 chu_22 spyin_26 ba_32 byed_36 
T02D1897:265b-20	de la aom a'a:dzam dha nam me de hi h'um dzam bha la la chu sbyin pa'i sngags so //	de_0 la_3 aom_6 a:dzam_10 dha_19 nam_23 me_27 de_30 hi_33 h_36 dzam_41 bha_46 la_50 la_53 chu_56 sbyin_60 ba_66 sngags_71 so_78 
T02D1897:265b-21	aom a'a:aom aa k'a ro mu kham sarba dharmma n'am a'adya nutpanna tv'at aom a'a:h'um phat sv'a h'a h'um /	aom_0 a:aom_4 aa_12 k_15 ro_19 mu_22 kham_25 sarba_30 dharmma_36 n_44 a_49 nutpanna_56 tv_65 aom_71 a:h_75 phat_84 sv_89 h_94 h_98 
T02D1897:265b-22	mdor bsdus pa'i gtor ma'i sngags so //	mdor_0 sdud_5 ba_11 'thor_16 ma_21 sngags_26 so_33 
T02D1897:265b-23	aom a'a:aom dza la mi tam sarba pre te bhya sv'a h'a h'um /	aom_0 a:aom_4 dza_12 la_16 mi_19 tam_22 sarba_26 pre_32 te_36 bhya_39 sv_44 h_49 h_53 
T02D1897:265b-24	yi dags rnams la chu sbyin pa'i sngags so //	yi_0 dags_3 rnams_8 la_14 chu_17 sbyin_21 ba_27 sngags_32 so_39 
T02D1897:265b-25	de nas stan bde ba la 'dug ste /	de_0 nas_3 stan_7 bde_12 ba_16 la_19 'dug_22 ste_27 
T02D1897:265b-26	shes rab kyi pha rol tu phyin pa la sogs	shes_0 rab_5 kyi_9 pha_13 rol_17 tu_21 phyin_24 ba_30 la_33 sogs_36 
T02D1897:265b-27	pa mngon par 'dod pa'i dam pa'i chos bklag par	ba_0 mngon_3 ba_9 'dod_13 ba_18 dam_23 ba_27 chos_32 klog_37 ba_43 
T02D1897:265b-28	bya'o // yang na 'khor lo'i bzlas pa bya'o //	byed_0 yang_9 na_14 'khor_17 lo_23 bzlas_28 ba_34 byed_37 
T02D1897:265b-29	mtha' ru mngon par 'dod pa'i smon lam btab nas //	mtha'_0 ru_6 mngon_9 ba_15 'dod_19 ba_24 smon_29 lam_34 'debs_38 nas_43 
T02D1897:265b-30	aom khyed kyis sems can don kun mdzad //	aom_0 'khyed_4 kyis_10 sems_15 can_20 don_24 kun_28 mdzad_32 
T02D1897:265b-31	ji ltar 'dod pa'i dngos grub stsol //	ji_0 ltar_3 'dod_8 ba_13 dngos_18 'grub_24 stsol_29 
T02D1897:265b-32	sangs rgyas yul du gshegs mdzod la //	sangs_0 rgya_6 yul_12 du_16 gshegs_19 mdzod_26 la_32 
T02D1897:265b-33	slar yang 'di ru gshegs su gsol //	slar_0 yang_5 'di_10 ru_14 gshegs_17 su_24 gsol_27 
T02D1897:265b-34	mu:sngags 'dis dril bu'i sgra sngon du song bas ye	mu:sngags_0 'dis_10 'dril_15 bu_20 sgra_25 sngon_30 du_36 'gro_39 ba_44 ye_48 
T02D1897:265b-35	shes kyi dkyil 'khor gshegs su gsol nas bde bar	shes_0 kyi_5 dkyil_9 'khor_15 gshegs_21 su_28 gsol_31 nas_36 bde_40 ba_44 
T02D1897:265b-36	gnas par bya'o // de bzhin du rdo rje 'jigs byed dang /	gnas_0 ba_5 byed_9 de_18 bzhin_21 du_27 rdo_30 rje_34 'jigs_38 byed_44 dang_49 
T02D1897:265b-37	gshin rje gshed nag po la sogs pa dang /	gshin_0 rje_6 gshed_10 nag_16 po_20 la_23 sogs_26 ba_31 dang_34 
T02D1897:266a-0	de @266a * //	de_0 
T02D1897:266a-1	bzhin du dgyes pa'i rdo rje dang /	bzhin_0 du_6 dgyes_9 ba_15 rdo_20 rje_24 dang_28 
T02D1897:266a-2	'khor lo sdom pa dang /	'khor_0 lo_6 sdom_9 ba_14 dang_17 
T02D1897:266a-3	sgyu 'phrul chen mo la sogs pa dang /	sgyu_0 'phrul_5 chen_12 mo_17 la_20 sogs_23 ba_28 dang_31 
T02D1897:266a-4	de bzhin du dpa' bo gcig sgrub pa dang /	de_0 bzhin_3 du_9 dpa'_12 'bo_17 gcig_20 sgrub_25 ba_31 dang_34 
T02D1897:266a-5	brtan pa'i 'khor lo dang /	brtan_0 ba_6 'khor_11 lo_17 dang_20 
T02D1897:266a-6	aa ra pa tsa na dang /	aa_0 ra_3 ba_6 tsa_9 na_13 dang_16 
T02D1897:266a-7	ku ru kulle la sogs pa dang /	ku_0 ru_3 kulle_6 la_12 sogs_15 ba_20 dang_23 
T02D1897:266a-8	de bzhin du kharsa p'a ni dang /	de_0 bzhin_3 du_9 kharsa_12 p_19 ni_23 dang_26 
T02D1897:266a-9	seng ldeng nags tshal la sogs pa yang ji ltar	seng_0 ldeng_5 nags_11 tshal_16 la_22 sogs_25 ba_30 yang_33 ji_38 ltar_41 
T02D1897:266a-10	mos pa ji ltar thob pa spyan drangs la rab	mos_0 ba_4 ji_7 ltar_10 'thob_15 ba_20 spyan_23 drangs_29 la_36 rab_39 
T02D1897:266a-11	tu mchod de gshegs su gsol lo //	tu_0 mchod_3 de_9 gshegs_12 su_19 gsol_22 lo_27 
T02D1897:266a-12	dro'i gnas su gtor ma dang bshos gtsang dang /	dro_0 gnas_6 su_11 'thor_14 ma_19 dang_22 bshos_27 gtsang_33 dang_40 
T02D1897:266a-13	sdom chang gsum dang /	sdom_0 chang_5 gsum_11 dang_16 
T02D1897:266a-14	phud dang lhag ma'i khams rnams te rab tu sbyin pa lnga cis kyang sbyin par bya'o //	'bud_0 dang_5 lhag_10 ma_15 khams_20 rnams_26 te_32 rab_35 tu_39 sbyin_42 ba_48 lnga_51 cis_56 kyang_60 sbyin_66 ba_72 byed_76 
T02D1897:266a-15	de la sngar bstan pa'i sngags kyis 'byung po thams cad la gtor ma sbyin no //	de_0 la_3 sngar_6 ston_12 ba_18 sngags_23 kyis_30 'byung_35 po_42 thams_45 cad_51 la_55 'thor_58 ma_63 sbyin_66 no_72 
T02D1897:266a-16	aom a'a:aom badzra nee bi dya buddha dharmm'a sam ghe bhya:sv'a h'a h'um /	aom_0 a:aom_4 badzra_12 nee_19 bi_23 dya_26 buddha_30 dharmm_37 sam_46 ghe_50 bhya:sv_54 h_64 h_68 
T02D1897:266a-17	sngags 'dis /	sngags_0 'dis_7 
T02D1897:266a-18	sangs rgyas dang chos dang dge 'dun la bshos gtsang dbul lo //	sangs_0 rgya_6 dang_12 chos_17 dang_22 dge_27 'dun_31 la_36 bshos_39 gtsang_45 'bul_52 lo_57 
T02D1897:266a-19	aom a'a:aom ha r'i tye sv'ah'a h'um /	aom_0 a:aom_4 ha_12 r_15 tye_19 sv'a_23 h_31 
T02D1897:266a-20	'dis 'phrog ma la sdom chang gsum sbyin par bya'o ;	'dis_0 'phrog_5 ma_12 la_15 sdom_18 chang_23 gsum_29 sbyin_34 ba_40 byed_44 
T02D1897:266a-21	/ de kho na nyid gsum gyi nang du bcug	de_2 kho_5 na_9 nyid_12 gsum_17 gyi_22 nang_26 du_31 'jug_34 
T02D1897:266a-22	pa'i rang gi sa bon gyi rang bdag po'i lha	ba_0 rang_5 gi_10 sa_13 bon_16 gyi_20 rang_24 bdag_29 po_34 lha_39 
T02D1897:266a-23	la zas phud dbul bar bya'o //	la_0 zas_3 'bud_7 'bul_12 ba_17 byed_21 
T02D1897:266a-24	aom a'a:aom autstshishtha pandi aa sa ne bhya:sv'ah'a h'um /	aom_0 a:aom_4 autstshishtha_12 pandi_26 aa_32 sa_35 ne_38 bhya:sv'a_41 h_54 
T02D1897:266a-25	'dis lhag ma'i kham sbyin par bya'o //	'dis_0 lhag_5 ma_10 kham_15 sbyin_20 ba_26 byed_30 
T02D1897:266a-26	'di ni mchod pa'i cho ga ste gnyis pa'o /	'di_0 ni_4 mchod_7 ba_13 cho_18 ga_22 ste_25 gnyis_29 ba_35 
T02D1897:266a-28	// / de nas bla ma bsten pa dang /	de_5 nas_8 bla_12 ma_16 sten_19 ba_25 dang_28 
T02D1897:266a-29	sems can bsten pa dang /	sems_0 can_5 sten_9 ba_15 dang_18 
T02D1897:266a-30	'gro ba drug gi tshig le'ur byas pa dang /	'gro_0 ba_5 drug_8 gi_13 tshig_16 le_22 byed_28 ba_33 dang_36 
T02D1897:266a-31	byang chub sems dpa'i spyod pa la 'jug pa la sogs pa dang /	byang_0 chub_6 sems_11 dpa_16 spyod_22 ba_28 la_31 'jug_34 ba_39 la_42 sogs_45 ba_50 dang_53 
T02D1897:266a-32	de bzhin du byang chub sems dpa' rnam pa lnga dang /	de_0 bzhin_3 du_9 byang_12 chub_18 sems_23 dpa'_28 rnam_33 ba_38 lnga_41 dang_46 
T02D1897:266a-33	sgrub thabs kun las btus pa dang /	sgrub_0 thabs_6 kun_12 las_16 'thu_20 ba_25 dang_28 
T02D1897:266a-34	dpa' bo gcig sgrub pa dang /	dpa'_0 'bo_5 gcig_8 sgrub_13 ba_19 dang_22 
T02D1897:266a-35	dbang sngon du 'gro ba'i dbang gi rab tu byed pa dang dkyil 'khor gyi cho ga dang /	dbang_0 sngon_6 du_12 'gro_15 ba_20 dbang_25 gi_31 rab_34 tu_38 byed_41 ba_46 dang_49 dkyil_54 'khor_60 gyi_66 cho_70 ga_74 dang_77 
T02D1897:266a-36	dpal gsang ba 'dus pa la sogs pa rgyud kyi	dpal_0 gsang_5 ba_11 'du_14 ba_19 la_22 sogs_25 ba_30 brgyud_33 kyi_39 
T02D1897:266a-37	rgyal po rnams mnyan la shes rab dang snying rje	rgyal_0 po_6 rnams_9 nyan_15 la_21 shes_24 rab_29 dang_33 snying_38 rje_45 
T02D1897:266a-38	dang shin tu yang dag par ldan pas rang bzhin	dang_0 shin_5 tu_10 yang_13 'dag_18 ba_22 ldan_26 ba_31 rang_35 bzhin_40 
T02D1897:266a-39	gyi don phun sum tshogs pa'i dpal ldan dkyil 'khor	gyi_0 don_4 phun_8 sum_13 tshogs_17 ba_24 dpal_29 ldan_34 dkyil_39 'khor_45 
T02D1897:266a-40	gyi 'khor lo bsgom par bya'o ;	gyi_0 'khor_4 lo_10 bsgom_13 ba_19 byed_23 
T02D1897:266a-41	/ yon tan gang dang ldan pas byang chub sems	yon_2 tan_6 gang_10 dang_15 ldan_20 ba_25 byang_29 chub_35 sems_40 
T02D1897:266a-42	dpa' bsgom pa la dbang bar 'gyur ba'i yon tan	dpa'_0 bsgom_5 ba_11 la_14 dbang_17 ba_23 'gyur_27 ba_33 yon_38 tan_42 
T02D1897:266a-43	de rnams bshad par bya ste /	de_0 rnams_3 'chad_9 ba_15 byed_19 ste_23 
T02D1897:266a-44	de la lcags kyi khang pa 'bar bar rab tu	de_0 la_3 lcags_6 kyi_12 khang_16 ba_22 'bar_25 ba_30 rab_34 tu_38 
T02D1897:266a-45	zhugs pa dang 'dra bar khams gsum pa sdug bsngal	'jug_0 ba_6 dang_9 'dra_14 ba_19 khams_23 gsum_29 ba_34 sdug_37 sngal_42 
T02D1897:266a-46	gsum gyis gdungs par nges pa dang /	gsum_0 gyis_5 gdung_10 ba_17 nges_21 ba_26 dang_29 
T02D1897:266b-0	snying rje dang @266b byams pa dang dga' ba dang /	snying_0 rje_7 dang_11 byams_22 ba_28 dang_31 dga'_36 ba_41 dang_44 
T02D1897:266b-1	btang snyoms dang /	gtong_0 snyom_6 dang_13 
T02D1897:266b-2	dkon mchog gsum la skyabs su 'gro ba dang /	dkon(d)_0 mchog_5 gsum_11 la_16 skyob_19 su_26 'gro_29 ba_34 dang_37 
T02D1897:266b-3	byang chub tu sems bskyed pa dang /	byang_0 chub_6 tu_11 sems_14 skyed_19 ba_26 dang_29 
T02D1897:266b-4	mi dge ba bcu las ldog pa dang /	mi_0 dge_3 ba_7 'chu_10 las_14 ldog_18 ba_23 dang_26 
T02D1897:266b-5	bslab pa'i gnas lnga la sogs pa la zhugs pa dang /	bslab_0 ba_6 gnas_11 lnga_16 la_21 sogs_24 ba_29 la_32 'jug_35 ba_41 dang_44 
T02D1897:266b-6	chos thams cad la rmi lam la sogs pa lta bur mos pa dang /	chos_0 thams_5 cad_11 la_15 rmi_18 lam_22 la_26 sogs_29 ba_34 lta_37 bur_41 mos_45 ba_49 dang_52 
T02D1897:266b-7	bden pa dang dkon mchog dang las kyi 'bras bu	bden_0 ba_5 dang_8 dkon(d)_13 mchog_18 dang_24 las_29 kyi_33 'bras_37 bu_43 
T02D1897:266b-8	la mngon par yid ches pa'i mtshan nyid kyi dad	la_0 mngon_3 ba_9 yid_13 ches_17 ba_22 mtshan_27 nyid_34 kyi_39 dad_43 
T02D1897:266b-9	pa dang gson po'i de nyid sems can gyi don	ba_0 dang_3 gson_8 po_13 de_18 nyid_21 sems_26 can_31 gyi_35 don_39 
T02D1897:266b-10	byed pa gcig pu dang /	byed_0 ba_5 gcig_8 pu_13 dang_16 
T02D1897:266b-11	gcig tu dkon mchog gsum la dga' ba dang /	gcig_0 tu_5 dkon(d)_8 mchog_13 gsum_19 la_24 dga'_27 ba_32 dang_35 
T02D1897:266b-12	byang chub par rings pa dang /	byang_0 chub_6 ba_11 'dring_15 ba_21 dang_24 
T02D1897:266b-13	the tshom med pa dang /	the_0 tshom_4 med_10 ba_14 dang_17 
T02D1897:266b-14	zhen pa med pa dang /	zhen_0 ba_5 med_8 ba_12 dang_15 
T02D1897:266b-15	'chad par 'gyur ba'i gnas rnam pa lnga yongs su shes pa dang /	'chad_0 ba_6 'gyur_10 ba_16 gnas_21 rnam_26 ba_31 lnga_34 yongs_39 su_45 shes_48 ba_53 dang_56 
T02D1897:266b-16	pha rol tu phyin pa bcu sbyang ba la gcig tu dga' ba rnams ni yon tan no //	pha_0 rol_4 tu_8 phyin_11 ba_17 'chu_20 sbyong_24 ba_31 la_34 gcig_37 tu_42 dga'_45 ba_50 rnams_53 ni_59 yon_62 tan_66 no_70 
T02D1897:266b-17	tha na yon tan gyi bye brag khyad par can	tha_0 na_4 yon_7 tan_11 gyi_15 'bye_19 brag_23 khyad_28 ba_34 can_38 
T02D1897:266b-18	bco brgyad dang ldan pa'i byang chub sems dpa' pha	'chos_0 brgyad_4 dang_11 ldan_16 ba_21 byang_26 chub_32 sems_37 dpa'_42 pha_47 
T02D1897:266b-19	rol tu phyin pa'i tshul gyis mngon par byang chub	rol_0 tu_4 phyin_7 ba_13 tshul_18 gyis_24 mngon_29 ba_35 byang_39 chub_45 
T02D1897:266b-20	pa la dbang yod pa de bzhin du thabs dang	ba_0 la_3 dbang_6 yod_12 ba_16 de_19 bzhin_22 du_28 thabs_31 dang_37 
T02D1897:266b-21	shes rab gnyis su med pa zab mo'i tshul la	shes_0 rab_5 gnyis_9 su_15 med_18 ba_22 zab_25 mo_29 tshul_34 la_40 
T02D1897:266b-22	lhag par mos pa dang /	lhag_0 ba_5 mos_9 ba_13 dang_16 
T02D1897:266b-23	gsang ba 'dus pa'i cho gas chu'i dbang dang /	gsang_0 ba_6 'du_9 ba_14 cho_19 'gas_23 chu_27 dbang_33 dang_39 
T02D1897:266b-24	dbu rgyan dang /	dbu_0 rgyan_4 dang_10 
T02D1897:266b-25	rdo rje dang /	rdo_0 rje_4 dang_8 
T02D1897:266b-26	dril bu dang /	'dril_0 bu_5 dang_8 
T02D1897:266b-27	ming dang /	ming_0 dang_5 
T02D1897:266b-28	bum pa dang /	bum_0 ba_4 dang_7 
T02D1897:266b-29	gsang ba dang /	gsang_0 ba_6 dang_9 
T02D1897:266b-30	shes rab ye shes dang /	shes_0 rab_5 ye_9 shes_12 dang_17 
T02D1897:266b-31	dbang bzhi pa dang /	dbang_0 bzhi_6 ba_11 dang_14 
T02D1897:266b-32	brtul zhugs dang /	brtul_0 'jug_6 dang_12 
T02D1897:266b-33	lung bstan dang /	lung_0 ston_5 dang_11 
T02D1897:266b-34	dbugs dbyung ba dang /	dbugs_0 'byin_6 ba_13 dang_16 
T02D1897:266b-35	rjes su snang ba dang /	rjes_0 su_5 snang_8 ba_14 dang_17 
T02D1897:266b-36	bla ma bsten pa dang /	bla_0 ma_4 sten_7 ba_13 dang_16 
T02D1897:266b-37	sems can bsten pa dang /	sems_0 can_5 sten_9 ba_15 dang_18 
T02D1897:266b-38	ltung ba spom po dang /	ltung_0 ba_6 spom_9 po_14 dang_17 
T02D1897:266b-39	rtsa ba'i ltung ba yongs su spong ba rnams so //	rtsa_0 ba_5 ltung_10 ba_16 yongs_19 su_25 spong_28 ba_34 rnams_37 so_43 
T02D1897:266b-40	tha na yon tan bye brag can sum cu drug	tha_0 na_4 yon_7 tan_11 'bye_15 brag_19 can_24 sum_28 cu_32 drug_35 
T02D1897:266b-41	dang ldan pa mchog tu zab cing rgya che ba'i	dang_0 ldan_5 ba_10 mchog_13 tu_19 zab_22 cing_26 rgya_31 che_36 ba_40 
T02D1897:266b-42	chos la rab tu zhugs pa rdo rje sems dpa'i	chos_0 la_5 rab_8 tu_12 'jug_15 ba_21 rdo_24 rje_28 sems_32 dpa_37 
T02D1897:266b-43	sdom pa 'dzin pa'i byang chub sems dpa' chen po	sdom_0 ba_5 'dzin_8 ba_14 byang_19 chub_25 sems_30 dpa'_35 chen_40 po_45 
T02D1897:266b-44	dpal gsang ba 'dus pa la sogs pa'i bcom ldan	dpal_0 gsang_5 ba_11 'du_14 ba_19 la_22 sogs_25 ba_30 'joms_35 ldan_40 
T02D1897:266b-45	'das kyi bsgom pa'i snod yin no zhes pa'o //	'da'_0 kyi_5 bsgom_9 ba_15 snod_20 yin_25 no_29 zhes_32 ba_37 
T02D1897:266b-46	snod kyi cho ga ste gsum pa'o /	snod_0 kyi_5 cho_9 ga_13 ste_16 gsum_20 ba_25 
T02D1897:266b-48	// / da ni bsgom pa'i cho ga brjod de sngon	da_5 ni_8 bsgom_11 ba_17 cho_22 ga_26 rjod_29 de_35 sngon_38 
T02D1897:266b-49	du bstan pa'i cho gas bsgom pa'i bdag por gyur	du_0 ston_3 ba_9 cho_14 'gas_18 bsgom_22 ba_28 bdag_33 por_38 gyur_42 
T02D1897:266b-50	pa'i rnal 'byor pa tho rangs kyi thun mtshams su	ba_0 rnal_5 'byor_10 ba_16 tho_19 rangs_23 kyi_29 thun_33 mtshams_38 su_46 
T02D1897:266b-51	gnyid rab tu sad pa ni lha mo'i glu'i sgras	rnyid_0 rab_6 tu_10 sad_13 ba_17 ni_20 lha_23 mo_27 glu_32 sgras_38 
T02D1897:266b-52	rab tu sangs par lhag par mos par bya ste	rab_0 tu_4 sangs_7 ba_13 lhag_17 ba_22 mos_26 ba_30 byed_34 ste_38 
T02D1897:267a-0	/ @267a * // rang gi snying gar dbyangs yig dang po dkar po	rang_13 gi_18 snying_21 gar_28 dbyangs_32 yig_40 dang_44 po_49 dkar_52 po_57 
