T02D1263:4a-33	dril bu'i sgras srid pa rang bzhin gyis dag phyir /	'dril_0 bu_5 sgras_10 srid_16 ba_21 rang_24 bzhin_29 gyis_35 'dag_40 phyir_44 
T02D1263:4a-34	ngo bo nyid kyis dngos med byas //	ngo_0 'bo_4 nyid_7 kyis_12 dngos_17 med_23 byed_27 
T02D1263:4a-35	rang bzhin dag pa'i sems dpa' rnams /	rang_0 bzhin_5 'dag_11 ba_15 sems_20 dpa'_25 rnams_30 
T02D1263:4a-36	dam pa'i srid pa byed par shog / ces pa dang /	dam_0 ba_4 srid_9 ba_14 byed_17 ba_22 shog_26 ces_33 ba_37 dang_40 
T02D1263:4a-37	thams cad dngos po'i rang bzhin mchog / gdod nas thams cad rang bzhin gnas //	thams_0 cad_6 dngos_10 po_16 rang_21 bzhin_26 mchog_32 gdod_40 nas_45 thams_49 cad_55 rang_59 bzhin_64 gnas_70 
T02D1263:4a-38	thabs dang shes rab gnyis med pa //	thabs_0 dang_6 shes_11 rab_16 gnyis_20 med_26 ba_30 
T02D1263:4a-39	kye yi rdo rje bdag phyag 'tshal //	kye_0 yi_4 rdo_7 rje_11 bdag_15 phyag_20 'tshal_26 
T02D1263:4a-40	zhes pa la sogs pa rdo rje glu'i tshig gis bstod ngo //	zhes_0 ba_5 la_8 sogs_11 ba_16 rdo_19 rje_23 glu_27 tshig_33 gis_39 bstod_43 ngo_49 
T02D1263:4a-41	de nas bdud rtsi mchod pa dpal kye'i rdo rje 'khor dang bcas pas yang bya'o //	de_0 nas_3 bdud_7 rtsi_12 mchod_17 ba_23 dpal_26 kye_31 rdo_37 rje_41 'khor_45 dang_51 'cha'_56 ba_61 yang_65 byed_70 
T02D1263:4a-42	de nas 'di skad brjod par bya'o //	de_0 nas_3 'di_7 skad_11 rjod_16 ba_22 byed_26 
T02D1263:4a-43	gnyis med ye shes las byung ba //	gnyis_0 med_6 ye_10 shes_13 las_18 'byung_22 ba_28 
T02D1263:4a-44	khyab bdag dngos grub bdag nyid can //	khyab_0 bdag_6 dngos_11 'grub_17 bdag_22 nyid_27 can_32 
T02D1263:4a-45	ston pa'i gtso bo khrag 'thung dpal //	ston_0 ba_5 gtso_10 'bo_15 khrag_18 'thung_24 dpal_31 
T02D1263:4a-46	bdag med ma dang yang dag ldan //	bdag_0 med_5 ma_9 dang_12 yang_17 'dag_22 ldan_26 
T02D1263:4a-47	phyogs mtshams rnams kyi mkha' 'gro dang //	phyogs_0 mtshams_7 rnams_15 kyi_21 mkha'_25 'gro_31 dang_36 
T02D1263:4b-0	rig pa'i lha @4b mo rdzu 'phrul dang //	rig_0 ba_4 lha_9 mo_17 rdzu_20 'phrul_25 dang_32 
T02D1263:4b-1	byang chub sems dpa' la sogs kun //	byang_0 chub_6 sems_11 dpa'_16 la_21 sogs_24 kun_29 
T02D1263:4b-2	ma lus bdag la dgongs su gsol //	ma_0 lus_3 bdag_7 la_12 dgongs_15 su_22 gsol_25 
T02D1263:4b-3	slob ma la ni phan pa dang //	slob_0 ma_5 la_8 ni_11 phan_14 ba_19 dang_22 
T02D1263:4b-4	khyed rnams la yang mchod pa'i phyir //	'khyed_0 rnams_6 la_12 yang_15 mchod_20 ba_26 phyir_31 
T02D1263:4b-5	rdo rje can bdag gis shes pa //	rdo_0 rje_4 can_8 bdag_12 gis_17 shes_21 ba_26 
T02D1263:4b-6	nang par dkyil 'khor 'dri bar bgyid //	nang_0 ba_5 dkyil_9 'khor_15 'bri_21 ba_26 bgyid_30 
T02D1263:4b-7	rjes su brtse bar nyer dgongs te //	rjes_0 su_5 brtse_8 ba_14 nyer_18 dgongs_23 te_30 
T02D1263:4b-8	byin gyis brlab pa mdzad du gsol //	byin_0 gyis_5 brlab_10 ba_16 mdzad_19 du_25 gsol_28 
T02D1263:4b-9	de nas dri zhim pa'i me tog gi phreng ba dang /	de_0 nas_3 'dri_7 zhim_11 ba_16 me_21 tog_24 gi_28 phreng_31 ba_38 dang_41 
T02D1263:4b-10	bdud rtsi lnga dang spos la sogs pa dbul bar bya'o //	bdud_0 rtsi_5 lnga_10 dang_15 spros_20 la_25 sogs_28 ba_33 'bul_36 ba_41 byed_45 
T02D1263:4b-11	lha la gsol ba gdab pa'i rim pa'o /	lha_0 la_4 gsol_7 ba_12 gdab_15 ba_20 rim_25 ba_29 
T02D1263:4b-13	// / de nas slob ma'i gtso bo 'khor dang bcas pa lhag par gnas par bya zhing /	de_5 nas_8 slob_12 ma_17 gtso_22 'bo_27 'khor_30 dang_36 'cha'_41 ba_46 lhag_49 ba_54 gnas_58 ba_63 byed_67 zhing_71 
T02D1263:4b-14	mchod par bya ba 'di brjod do //	mchod_0 ba_6 byed_10 ba_14 'di_17 rjod_21 do_27 
T02D1263:4b-15	bu tshur theg pa chen po la //	bu_0 tshur_3 theg_9 ba_14 chen_17 po_22 la_25 
T02D1263:4b-16	khyod ni tshul chen snod yin te //	khyod_0 ni_6 tshul_9 chen_15 snod_20 yin_25 te_29 
T02D1263:4b-17	gsang sngags spyod tshul cho ga 'di //	gsang_0 sngags_6 spyod_13 tshul_19 cho_25 ga_29 'di_32 
T02D1263:4b-18	khyod la yang dag bshad par bya //	khyod_0 la_6 yang_9 'dag_14 'chad_18 ba_24 byed_28 
T02D1263:4b-19	rdzogs pa'i sangs rgyas gang 'das dang //	rdzogs_0 ba_7 sangs_12 rgya_18 gang_24 'da'_29 dang_34 
T02D1263:4b-20	de bzhin gang dag ma byon dang //	de_0 bzhin_3 gang_9 'dag_14 ma_18 'byon_21 dang_26 
T02D1263:4b-21	da ltar byung ba'i rdzogs sangs rgyas //	da_0 ltar_3 'byung_8 ba_14 rdzogs_19 sangs_26 rgya_32 
T02D1263:4b-22	'gro la phan phyir bzhugs pa rnams //	'gro_0 la_5 phan_8 phyir_13 bzhugs_19 ba_26 rnams_29 
T02D1263:4b-23	de dag kun gyi gsang sngags kyi //	de_0 'dag_3 kun_7 gyi_11 gsang_15 sngags_21 kyi_28 
T02D1263:4b-24	cho ga bzang po 'di mkhyen nas //	cho_0 ga_4 bzang_7 po_13 'di_16 mkhyen_20 nas_27 
T02D1263:4b-25	dpa' bos byang chub shing drung du //	dpa'_0 'bod_5 byang_9 chub_15 shing_20 drung_26 du_32 
T02D1263:4b-26	thams cad mkhyen pa chad med brnyes //	thams_0 cad_6 mkhyen_10 ba_17 'chad_20 med_25 brnyes_29 
T02D1263:4b-27	gsang sngags sbyor ba mnyam med de //	gsang_0 sngags_6 sbyor_13 ba_19 mnyam_22 med_28 de_32 
T02D1263:4b-28	skyob pa dpal ldan he ru kas //	skyob_0 ba_6 dpal_9 ldan_14 he_19 ru_22 kas_25 
T02D1263:4b-29	bdud sde shin tu mi bzad pa //	bdud_0 sde_5 shin_9 tu_14 mi_17 bzad_20 ba_25 
T02D1263:4b-30	dpung chen dag kyang de yis bcom //	dpung_0 chen_6 'dag_11 kyang_15 de_21 yis_24 'joms_28 
T02D1263:4b-31	de bas kun mkhyen thob bya'i phyir //	de_0 ba_3 kun_7 mkhyen_11 'thob_18 byed_23 phyir_29 
T02D1263:4b-32	bu yis blo gros 'di gyis shig / sangs rgyas chos dang dge 'dun la //	bu_0 yis_3 blo_7 gros_11 'di_16 gyis_20 shig_25 sangs_32 rgya_38 chos_44 dang_49 dge_54 'dun_58 la_63 
T02D1263:4b-33	rtag tu bdag ni skyabs su mchi //	rtag_0 tu_5 bdag_8 ni_13 skyob_16 su_23 mchi_26 
T02D1263:4b-34	rnal 'byor gsang sngags mkha' 'gro ma //	rnal_0 'byor_5 gsang_11 sngags_17 mkha'_24 'gro_30 ma_35 
T02D1263:4b-35	'khor lor bzhugs pa'i bdag nyid can //	'khor_0 lor_6 bzhugs_10 ba_17 bdag_22 nyid_27 can_32 
T02D1263:4b-36	kun la rtag tu skyabs su mchi //	kun_0 la_4 rtag_7 tu_12 skyob_15 su_22 mchi_25 
T02D1263:4b-37	dpa' bo dpa' mo dbang lha mo //	dpa'_0 'bo_5 dpa'_8 mo_13 dbang_16 lha_22 mo_26 
T02D1263:4b-38	byang chub sems dpa' bdag nyid che //	byang_0 chub_6 sems_11 dpa'_16 bdag_21 nyid_26 che_31 
T02D1263:4b-39	khyad par du ni slob dpon la //	khyad_0 ba_6 du_10 ni_13 slob_16 dpon_21 la_26 
T02D1263:4b-40	rtag par bdag ni skyabs su mchi //	rtag_0 ba_5 bdag_9 ni_14 skyob_17 su_24 mchi_27 
T02D1263:4b-41	dpal ldan khrag 'thung la sogs pa //	dpal_0 ldan_5 khrag_10 'thung_16 la_23 sogs_26 ba_31 
T02D1263:4b-42	rnal 'byor ma dang snang mdzad sogs //	rnal_0 'byor_5 ma_11 dang_14 snang_19 mdzad_25 sogs_31 
T02D1263:4b-43	byang chub sems dpa' bdag med pa //	byang_0 chub_6 sems_11 dpa'_16 bdag_21 med_26 ba_30 
T02D1263:4b-44	thams cad bdag la dgongs su gsol //	thams_0 cad_6 bdag_10 la_15 dgongs_18 su_25 gsol_28 
T02D1263:4b-45	che ge dus 'di nas bzung ste //	che_0 ge_4 dus_7 'di_11 nas_15 bzung_19 ste_25 
T02D1263:4b-46	ji srid bdag med par gnas par //	ji_0 srid_3 bdag_8 med_13 ba_17 gnas_21 ba_26 
T02D1263:4b-47	de yi tshangs spyod gnyis med par //	de_0 yi_3 tshangs_6 spyod_14 gnyis_20 med_26 ba_30 
T02D1263:4b-48	bdag gi sdom pa legs par gzung //	bdag_0 gi_5 sdom_8 ba_13 legs_16 ba_21 gzung_25 
T02D1263:5a-0	de nas 'og nas 'byung ba 'di rnams kyis @5a * //	de_0 nas_3 'og_7 nas_11 'byung_15 ba_22 'di_25 rnams_29 kyis_35 
T02D1263:5a-1	kyang //	kyang_0 
T02D1263:5a-2	sdig pa bshags pa la sogs pa byed du gzhug ste /	sdig_0 ba_5 'chags_8 ba_15 la_18 sogs_21 ba_26 byed_29 du_34 'jug_37 ste_43 
T02D1263:5a-3	bdag gis sdig pa bgyis pa dang //	bdag_0 gis_5 sdig_9 ba_14 bgyid_17 ba_23 dang_26 
T02D1263:5a-4	bgyid du stsal dang yi rang rnams //	bgyid_0 du_6 stsal_9 dang_15 yi_20 rang_23 rnams_28 
T02D1263:5a-5	sangs rgyas spyan sngar mchis nas su //	sangs_0 rgya_6 spyan_12 sngar_18 mchis_24 nas_30 su_34 
T02D1263:5a-6	de dag thams cad bshags par bgyi //	de_0 'dag_3 thams_7 cad_13 'chags_17 ba_24 bgyid_28 
T02D1263:5a-7	sangs rgyas byang chub sems dpa' dang //	sangs_0 rgya_6 byang_12 chub_18 sems_23 dpa'_28 dang_33 
T02D1263:5a-8	rang rgyal dgra bcom 'gro rnams kyis //	rang_0 rgyal_5 dgra_11 'joms_16 'gro_21 rnams_26 kyis_32 
T02D1263:5a-9	bsgom dang bzlas brjod bsod nams tshogs //	bsgom_0 dang_6 bzlas_11 rjod_17 bsod_23 nams_28 tshogs_33 
T02D1263:5a-10	de la bdag ni yi rang ngo //	de_0 la_3 bdag_6 ni_11 yi_14 rang_17 ngo_22 
T02D1263:5a-11	sems bskyed mngon par sangs rgyas dang //	sems_0 skyed_5 mngon_12 ba_18 sangs_22 rgya_28 dang_34 
T02D1263:5a-12	chos kyi 'khor lo bskor ba dang //	chos_0 kyi_5 'khor_9 lo_15 skor_18 ba_24 dang_27 
T02D1263:5a-13	byang chub sems dpa' tshogs spyod la //	byang_0 chub_6 sems_11 dpa'_16 tshogs_21 spyod_28 la_34 
T02D1263:5a-14	de la bdag gis skyabs su mchi //	de_0 la_3 bdag_6 gis_11 skyob_15 su_22 mchi_25 
T02D1263:5a-15	sangs rgyas 'byung ba ji lta bar //	sangs_0 rgya_6 'byung_12 ba_19 ji_22 lta_25 ba_29 
T02D1263:5a-16	skal ldan byang chub sems dpa' yis //	skal_0 ldan_5 byang_10 chub_16 sems_21 dpa'_26 yis_31 
T02D1263:5a-17	byang chub sems mchog bskyed pa ltar //	byang_0 chub_6 sems_11 mchog_16 skyed_22 ba_29 ltar_32 
T02D1263:5a-18	'di nyid du ni sems bskyed de //	'di_0 nyid_4 du_9 ni_12 sems_15 skyed_20 de_27 
T02D1263:5a-19	mgon po bdag la dgongs su gsol //	mgon_0 po_5 bdag_8 la_13 dgongs_16 su_23 gsol_26 
T02D1263:5a-20	ma lus bzhugs pa'i sangs rgyas rnams //	ma_0 lus_3 bzhugs_7 ba_14 sangs_19 rgya_25 rnams_31 
T02D1263:5a-21	dus 'di nyid nas sangs rgyas par //	dus_0 'di_4 nyid_8 nas_13 sangs_17 rgya_23 ba_29 
T02D1263:5a-22	bla med bdag la gzigs su gsol //	bla_0 med_4 bdag_8 la_13 gzigs_16 su_22 gsol_25 
T02D1263:5a-23	sangs rgyas chos dang dge 'dun te //	sangs_0 rgya_6 chos_12 dang_17 dge_22 'dun_26 te_31 
T02D1263:5a-24	bla na med pa'i dkon mchog gsum //	bla_0 na_4 med_7 ba_11 dkon(d)_16 mchog_21 gsum_27 
T02D1263:5a-25	sangs rgyas rnal 'byor sdom pa ni //	sangs_0 rgya_6 rnal_12 'byor_17 sdom_23 ba_28 ni_31 
T02D1263:5a-26	yang dag nyid du gzung bar bgyi //	yang_0 'dag_5 nyid_9 du_14 gzung_17 ba_23 bgyid_27 
T02D1263:5a-27	rdo rje rigs mchog chen po la //	rdo_0 rje_4 rigs_8 mchog_13 chen_19 po_24 la_27 
T02D1263:5a-28	rdo rje dril bu'i phyag rgya yang //	rdo_0 rje_4 'dril_8 bu_13 phyag_18 rgya_24 yang_29 
T02D1263:5a-29	yang dag nyid du gzung bar bgyi //	yang_0 'dag_5 nyid_9 du_14 gzung_17 ba_23 bgyid_27 
T02D1263:5a-30	slob dpon dag kyang gzung bar bgyi //	slob_0 dpon_5 'dag_10 kyang_14 gzung_20 ba_26 bgyid_30 
T02D1263:5a-31	rin chen rigs mchog chen po yi //	rin_0 chen_4 rigs_9 mchog_14 chen_20 po_25 yi_28 
T02D1263:5a-32	dam tshig yid du 'ong ba la //	dam_0 tshig_4 yid_10 du_14 'ong_17 ba_22 la_25 
T02D1263:5a-33	nyin re bzhin nam dus drug tu //	nyin_0 re_5 bzhin_8 nam_14 dus_18 drug_22 tu_27 
T02D1263:5a-34	sbyin pa rnam bzhi rtag tu sbyin //	sbyin_0 ba_6 rnam_9 bzhi_14 rtag_19 tu_24 sbyin_27 
T02D1263:5a-35	byang chub chen po las byung ba'i //	byang_0 chub_6 chen_11 po_16 las_19 'byung_23 ba_29 
T02D1263:5a-36	padma'i rigs mchog dag pa la //	padma_0 rigs_8 mchog_13 'dag_19 ba_23 la_26 
T02D1263:5a-37	phyi nang gsang ba'i theg pa gsum //	phyi_0 nang_5 gsang_10 ba_16 theg_21 ba_26 gsum_29 
T02D1263:5a-38	dam pa'i chos kyang ma lus gzung //	dam_0 ba_4 chos_9 kyang_14 ma_20 lus_23 gzung_27 
T02D1263:5a-39	las kyi rigs mchog chen po yi //	las_0 kyi_4 rigs_8 mchog_13 chen_19 po_24 yi_27 
T02D1263:5a-40	sdom pa thams cad ldan par ni //	sdom_0 ba_5 thams_8 cad_14 ldan_18 ba_23 ni_27 
T02D1263:5a-41	yang dag nyid du gzung bar bgyi //	yang_0 'dag_5 nyid_9 du_14 gzung_17 ba_23 bgyid_27 
T02D1263:5a-42	mchod pa'i las kyang ci nus bgyi //	mchod_0 ba_6 las_11 kyang_15 ci_21 nus_24 bgyid_28 
T02D1263:5a-43	tshul khrims kyi ni slob pa dang //	tshul_0 khrims_6 kyi_13 ni_17 slob_20 ba_25 dang_28 
T02D1263:5a-44	dge ba'i chos ni sdud pa dang //	dge_0 ba_4 chos_9 ni_14 sdud_17 ba_22 dang_25 
T02D1263:5a-45	sems can don byed tshul khrims gsum //	sems_0 can_5 don_9 byed_13 tshul_18 khrims_24 gsum_31 
T02D1263:5a-46	de bzhin rtag par gzung bar bgyi //	de_0 bzhin_3 rtag_9 ba_14 gzung_18 ba_24 bgyid_28 
T02D1263:5a-47	bdag gi dge ba'i las rnams 'di dag gis //	bdag_0 gi_5 dge_8 ba_12 las_17 rnams_21 'di_27 'dag_31 gis_35 
T02D1263:5a-48	'jig rten mi ring sangs rgyas myur 'grub pas //	'jig_0 rten_5 mi_10 ring_13 sangs_18 rgya_24 myur_30 'grub_35 ba_41 
T02D1263:5a-49	sems can 'khor ba'i rgya mtshor bying ba rnams //	sems_0 can_5 'khor_9 ba_15 rgya_20 mtshor_25 'bying_32 ba_38 rnams_41 
T02D1263:5a-50	bla med byang chub nyid du 'grub par bgyi //	bla_0 med_4 byang_8 chub_14 nyid_19 du_24 'grub_27 ba_33 bgyid_37 
T02D1263:5a-51	zhes zhus pa dang /	zhes_0 zhus_5 ba_10 dang_13 
T02D1263:5b-0	bla mas @5b slob ma bsrung bar bya ste /	bla_0 mas_4 slob_12 ma_17 bsrung_20 ba_27 byed_31 ste_35 
T02D1263:5b-1	slob ma kun gyi lus ngag yid gsum du /	slob_0 ma_5 kun_8 gyi_12 lus_16 ngag_20 yid_25 gsum_29 du_34 
T02D1263:5b-2	spyi bor 'khor lo /	spyi_0 'bor_5 'khor_9 lo_15 
T02D1263:5b-3	mgrin par padma /	mgrin_0 ba_6 padma_10 
T02D1263:5b-4	snying gar rdo rje /	snying_0 gar_7 rdo_11 rje_15 
T02D1263:5b-5	de gsum gyi lte ba la /	de_0 gsum_3 gyi_8 lte_12 ba_16 la_19 
T02D1263:5b-6	aom a'a: h'um /	aom_0 a:_4 h_9 
T02D1263:5b-7	aom a'a: h'um /	aom_0 a:_4 h_9 
T02D1263:5b-8	de nas slob dpon gyi lag tu rdo rje bzung la /	de_0 nas_3 slob_7 dpon_12 gyi_17 lag_21 tu_25 rdo_28 rje_32 bzung_36 la_42 
T02D1263:5b-9	slob ma'i gnas gsum du rdo rje gtug cing /	slob_0 ma_5 gnas_10 gsum_15 du_20 rdo_23 rje_27 gtug_31 cing_36 
T02D1263:5b-10	aom a'a: h'um brjod cing /	aom_0 a:_4 h_9 rjod_14 cing_20 
T02D1263:5b-11	dri'i chus byugs /	'dri_0 chus_6 'byug_11 
T02D1263:5b-12	de nas rim pas slob ma kun gyi mgo bo la me tog sbyin /	de_0 nas_3 rim_7 ba_11 slob_15 ma_20 kun_23 gyi_27 mgo_31 'bo_35 la_38 me_41 tog_44 sbyin_48 
T02D1263:5b-13	mdun du spos sbyin /	mdun_0 du_5 spros_8 sbyin_13 
T02D1263:5b-14	mar me dang dri snying gar sbyin no //	mar_0 me_4 dang_7 'dri_12 snying_16 gar_23 sbyin_27 no_33 
T02D1263:5b-15	de nas so shing gi cho ga bya ste /	de_0 nas_3 so_7 shing_10 gi_16 cho_19 ga_23 byed_26 ste_30 
T02D1263:5b-16	yid 'ong au dum aa shvattha //	yid_0 'ong_4 au_9 dum_12 aa_16 shvattha_19 
T02D1263:5b-17	me tog bcings shing dri yis byug / sor ni bcu gnyis tshad du bya //	me_0 tog_3 'ching_7 shing_14 'dri_20 yis_24 'byug_28 sor_35 ni_39 'chu_42 gnyis_46 tshad_52 du_58 byed_61 
T02D1263:5b-18	mi g-yo ma gas 'bus ma zos //	mi_0 g-yo_3 ma_8 'gas_11 'bu_15 ma_20 zos_23 
T02D1263:5b-19	lci ba ba yi ko ba tsam //	lci_0 ba_4 ba_7 yi_10 ko_13 ba_16 tsam_19 
T02D1263:5b-20	sa gzhi mandala byas nas ni //	sa_0 gzhi_3 mandala_8 byed_16 nas_21 ni_25 
T02D1263:5b-21	slob ma de yi steng bzhag nas //	slob_0 ma_5 de_8 yi_11 steng_14 'jog_20 nas_26 
T02D1263:5b-22	me tog la sogs mchod pa bya //	me_0 tog_3 la_7 sogs_10 mchod_15 ba_21 byed_24 
T02D1263:5b-23	slob ma'i tshogs la sbyin par bya //	slob_0 ma_5 tshogs_10 la_17 sbyin_20 ba_26 byed_30 
T02D1263:5b-24	de nas shar phyogs kha bltas te //	de_0 nas_3 'char_7 phyogs_12 kha_19 lta_23 te_29 
T02D1263:5b-25	mi smra bar ni so shing bca' //	mi_0 smra_3 ba_8 ni_12 so_15 shing_18 'chos_24 
T02D1263:5b-26	za ba byin na mi gdags shing //	za_0 ba_3 byin_6 na_11 mi_14 'dogs_17 shing_23 
T02D1263:5b-27	phan tshun du yang mi 'dor ro //	phan_0 tshun_5 du_11 yang_14 mi_19 'dor_22 ro_27 
T02D1263:5b-28	so shing mdun du drang por bor //	so_0 shing_3 mdun_9 du_14 'dren_17 por_23 'bor_27 
T02D1263:5b-29	de yi tshe na mtshan ma ni //	de_0 yi_3 tshe_6 na_11 mtshan_14 ma_21 ni_24 
T02D1263:5b-30	de tshe bdag la blta ba dang //	de_0 tshe_3 bdag_8 la_13 lta_16 ba_21 dang_24 
T02D1263:5b-31	rtse mo gyen du 'greng gyur na //	rtse_0 mo_5 gyen_8 du_13 'greng_16 gyur_23 na_28 
T02D1263:5b-32	de yis dngos grub mchog tu bshad //	de_0 yis_3 dngos_7 'grub_13 mchog_18 tu_24 'chad_27 
T02D1263:5b-33	de bzhin gzhan du kha bltas na //	de_0 bzhin_3 gzhan_9 du_15 kha_18 lta_22 na_28 
T02D1263:5b-34	de bzhin dngos grub 'bring du bshad //	de_0 bzhin_3 dngos_9 'grub_15 'bring_20 du_27 'chad_30 
T02D1263:5b-35	mtshams dang byang du kha bltas na //	mtshams_0 dang_8 byang_13 du_19 kha_22 lta_26 na_32 
T02D1263:5b-36	'jig rten pa yi dngos grub thob //	'jig_0 rten_5 ba_10 yi_13 dngos_16 'grub_22 'thob_27 
T02D1263:5b-37	so shing ngor ba brgya zhig la //	so_0 shing_3 ngor_9 ba_14 brgya_17 'jig_23 la_28 
T02D1263:5b-38	gal te thur du kha bltas nas //	gal_0 te_4 thur_7 du_12 kha_15 lta_19 nas_25 
T02D1263:5b-39	de nas nges par sa 'og gi / dngos grub de la the tshom med //	de_0 nas_3 nges_7 ba_12 sa_16 'og_19 gi_23 dngos_28 'grub_34 de_39 la_42 the_45 tshom_49 med_55 
T02D1263:5b-40	de nas dri chus legs par bkrus te /	de_0 nas_3 'dri_7 chus_11 legs_16 ba_21 'khrud_25 te_31 
T02D1263:5b-41	'thor 'thung bya'o //	'thor_0 'thung_6 byed_13 
T02D1263:5b-42	aom bi shuddha dha rma p'a pam ni ts'a s+ya sho dha ya /	aom_0 bi_4 shuddha_7 dha_15 rma_19 p_23 pam_27 ni_31 ts_34 s_39 ya_41 sho_44 dha_48 ya_52 
T02D1263:5b-43	sarba bi kalpan aa pa n'a ya h'um /	sarba_0 bi_6 kalpan_9 aa_16 ba_19 n_22 ya_26 h_29 
T02D1263:5b-44	zhes pas bzlas pa'i chu hub gsum 'thung du gzhug pa'i sngags so //	zhes_0 ba_5 bzlas_9 ba_15 chu_20 hub_24 gsum_28 'thung_33 du_40 'jug_43 ba_49 sngags_54 so_61 
T02D1263:5b-45	de'i 'og tu slob ma rnams la sems dga' bar bya ba'i phyir chos bshad par bya ba ni /	de_0 'og_5 tu_9 slob_12 ma_17 rnams_20 la_26 sems_29 dga'_34 ba_39 byed_43 ba_47 phyir_52 chos_58 'chad_63 ba_69 byed_73 ba_77 ni_80 
T02D1263:5b-46	'jig rten khams ni thams cad du //	'jig_0 rten_5 khams_10 ni_16 thams_19 cad_25 du_29 
T02D1263:5b-47	thams cad mkhyen pa 'byung mi 'gyur //	thams_0 cad_6 mkhyen_10 ba_17 'byung_20 mi_27 'gyur_30 
T02D1263:5b-48	me tog au du mw'a ra bzhin //	me_0 tog_3 au_7 du_10 mw_13 ra_18 bzhin_21 
T02D1263:5b-49	brgya lam na ni re 'ga' 'byung //	brgya_0 lam_6 na_10 ni_13 re_16 'ga'_19 'byung_24 
T02D1263:5b-50	de phyir phrad dkar byung ba yi //	de_0 phyir_3 'phrad_9 dkar_15 'byung_20 ba_26 yi_29 
T02D1263:5b-51	gnyis med zab mo spyod tshul 'dis //	gnyis_0 med_6 zab_10 mo_14 spyod_17 tshul_23 'dis_29 
T02D1263:5b-52	sems can sangs rgyas par byed pa'i //	sems_0 can_5 sangs_9 rgya_15 ba_21 byed_25 ba_30 
T02D1263:5b-53	bskal pa grangs med mang por ni //	bskal_0 ba_6 grangs_9 med_16 mang_20 por_25 ni_29 
T02D1263:5b-54	sngon du byas pa'i rnam smin gang //	sngon_0 du_6 byed_9 ba_14 rnam_19 smin_24 gang_29 
T02D1263:6a-0	@6a * // de kun zad par gyur pa ni //	de_9 kun_12 zad_16 ba_20 gyur_24 ba_29 ni_32 
T02D1263:6a-1	zab mo'i dkyil 'khor mthong bas so //	zab_0 mo_4 dkyil_9 'khor_15 mthong_21 ba_28 so_32 
T02D1263:6a-2	de nas aom a'a: h'um zhes pas ku sha byin gyis brlabs la /	de_0 nas_3 aom_7 a:_11 h_16 zhes_21 ba_26 ku_30 sha_33 byin_37 gyis_42 brlabs_47 la_54 
T02D1263:6a-3	sngas su gzhag par bya /	bsngas_0 su_6 'jog_9 ba_15 byed_19 
T02D1263:6a-4	stan du yang gding bar bya /	stan_0 du_5 yang_8 'ding_13 ba_19 byed_23 
T02D1263:6a-5	de nas srung skud gdags pa ni /	de_0 nas_3 srung_7 skud_13 'dogs_18 ba_24 ni_27 
T02D1263:6a-6	srung skud dmar po la mdud pa drug tu bor la /	srung_0 skud_6 dmar_11 po_16 la_19 mdud_22 ba_27 drug_30 tu_35 'bor_38 la_42 
T02D1263:6a-7	dpung pa g-yon par btags te /	dpung_0 ba_6 g-yon_9 ba_15 'dogs_19 te_25 
T02D1263:6a-8	bsrung ba'i phyir bcing ba'o //	bsrung_0 ba_7 phyir_12 'ching_18 ba_24 
T02D1263:6a-9	de nas mchod pa byas gtor ma btang la /	de_0 nas_3 mchod_7 ba_13 byed_16 'thor_21 ma_26 gtong_29 la_35 
T02D1263:6a-10	slob dpon nang du zhugs la dkyil 'khor gyi lha	slob_0 dpon_5 nang_10 du_15 'jug_18 la_24 dkyil_27 'khor_33 gyi_39 lha_43 
T02D1263:6a-11	la phyi nang gi mchod pas yang dag par mchod	la_0 phyi_3 nang_8 gi_13 mchod_16 ba_22 yang_26 'dag_31 ba_35 mchod_39 
T02D1263:6a-12	de / slob ma rnams ni sta gon gyi gnas de nyid du /	de_0 slob_5 ma_10 rnams_13 ni_19 sta_22 gon_26 gyi_30 gnas_34 de_39 nyid_42 du_47 
T02D1263:6a-13	ku sha'i stan la seng ge'i nyal stabs su 'dug la /	ku_0 sha_3 stan_9 la_14 seng_17 ge_22 nyal_27 stabs_32 su_38 'dug_41 la_46 
T02D1263:6a-14	rmi lam gyi mtshan ma blta bar bya ba'i phyir /	rmi_0 lam_4 gyi_8 mtshan_12 ma_19 lta_22 ba_27 byed_31 ba_35 phyir_40 
T02D1263:6a-15	mi smra bar kye'i rdo rje yid la byas la /	mi_0 smra_3 ba_8 kye_12 rdo_18 rje_22 yid_26 la_30 byed_33 la_38 
T02D1263:6a-16	bsam gtan gyi sems kyis nyal bar bya'o //	bsam_0 gtan_5 gyi_10 sems_14 kyis_19 nyal_24 ba_29 byed_33 
T02D1263:6a-17	de'i mtshan mo'i mthar rmi lam gang dang gang rmi ba 'dri bar bya'o //	de_0 mtshan_5 mo_12 mthar_17 rmi_23 lam_27 gang_31 dang_36 gang_41 rmi_46 ba_50 'bri_53 ba_58 byed_62 
T02D1263:6a-18	dris pa thos nas rmi lam bzang ngan thogs pa med par brjod par bya'o //	'dri_0 ba_5 thos_8 nas_13 rmi_17 lam_21 bzang_25 ngan_31 thogs_36 ba_42 med_45 ba_49 rjod_53 ba_59 byed_63 
T02D1263:6a-19	de nas rmi lam bzang po mthong na slob ma la rjes su yi rang bar bya'o //	de_0 nas_3 rmi_7 lam_11 bzang_15 po_21 mthong_24 na_31 slob_34 ma_39 la_42 rjes_45 su_50 yi_53 rang_56 ba_61 byed_65 
T02D1263:6a-20	dngos grub rab 'bring tha ma brjod par bya'o //	dngos_0 'grub_6 rab_11 'bring_15 tha_22 ma_26 rjod_29 ba_35 byed_39 
T02D1263:6a-21	ngan ba mthong na ba'i rnam lnga 'thung du gzhug / drag po'i sbyin sreg bya'o //	ngan_0 ba_5 mthong_8 na_15 ba_18 rnam_23 lnga_28 'thung_33 du_40 'jug_43 drag_51 po_56 sbyin_61 sreg_67 byed_72 
T02D1263:6a-22	des rtog pa zhi bar 'gyur ro //	des_0 rtogs_4 ba_9 zhi_12 ba_16 'gyur_20 ro_26 
T02D1263:6a-23	slob ma lhag par sta gon la gnas pa'i rim pa'o /	slob_0 ma_5 lhag_8 ba_13 sta_17 gon_21 la_25 gnas_28 ba_33 rim_38 ba_42 
T02D1263:6a-25	// / de nas gser ram dngul lam /	de_5 nas_8 gser_12 ram_17 dngul_21 lam_27 
T02D1263:6a-26	zangs las rnam par rgyal ba'i bum pa byas la /	zangs_0 las_6 rnam_10 ba_15 rgyal_19 ba_25 bum_30 ba_34 byed_37 la_42 
T02D1263:6a-27	de rnams ma 'byor na kham sa las bya'o //	de_0 rnams_3 ma_9 'byor_12 na_18 kham_21 sa_26 las_29 byed_33 
T02D1263:6a-28	bum pa gzhan rnams kyang rin po che'i grangs ma rnyed na khams las bya'o //	bum_0 ba_4 gzhan_7 rnams_13 kyang_19 rin_25 po_29 che_32 grangs_38 ma_45 rnyed_48 na_54 khams_57 las_63 byed_67 
T02D1263:6a-29	kun sa dkar gyis byugs la /	kun_0 sa_4 dkar_7 gyis_12 'byug_17 la_23 
T02D1263:6a-30	padma'i lte ba la phyag mtshan bkod la gzhag /	padma_0 lte_8 ba_12 la_15 phyag_18 mtshan_24 bkod_31 la_36 'jog_39 
T02D1263:6a-31	de nas bum pa rnams rang bzhin med par bsams	de_0 nas_3 bum_7 ba_11 rnams_14 rang_20 bzhin_25 med_31 ba_35 bsams_39 
T02D1263:6a-32	la / de las yi ge kham dkar por gyur /	la_0 de_5 las_8 yi_12 ge_15 kham_18 dkar_23 por_28 gyur_32 
T02D1263:6a-33	kham dkar po 'od du zhu ba las byung ba'i	kham_0 dkar_5 po_10 'od_13 du_17 'ju_20 ba_24 las_27 'byung_31 ba_37 
T02D1263:6a-34	bum pa nag po ra ri med pa dkar por	bum_0 ba_4 nag_7 po_11 ra_14 ri_17 med_20 ba_24 dkar_27 por_32 
T02D1263:6a-35	'dug pa / mgrin pa ring ba lto che ba mchu 'phyang ba bsgoms la /	'dug_0 ba_5 mgrin_10 ba_16 ring_19 ba_24 lto_27 che_31 ba_35 mchu_38 'phyang_43 ba_51 sgom_54 la_61 
T02D1263:6a-36	de'i nang du pam dmar po las padmar gyur pa'i steng du /	de_0 nang_5 du_10 pam_13 dmar_17 po_22 las_25 padmar_29 gyur_36 ba_41 steng_46 du_52 
T02D1263:6a-37	aa las nyi ma'i dkyil 'khor de'i steng du h'um gam tsam bam gham pam sham lam dam /	aa_0 las_3 nyi_7 ma_11 dkyil_16 'khor_22 de_28 steng_33 du_39 h_42 gam_47 tsam_51 bam_56 gham_60 pam_65 sham_69 lam_74 dam_78 
T02D1263:6a-38	de rnams yongs su gyur pa las lha'i 'khor lo yongs su rdzogs par bskyed do //	de_0 rnams_3 yongs_9 su_15 gyur_18 ba_23 las_26 lha_30 'khor_36 lo_42 yongs_45 su_51 rdzogs_54 ba_61 skyed_65 do_72 
T02D1263:6a-39	de nas ye shes kyi 'khor lo spyan drangs te /	de_0 nas_3 ye_7 shes_10 kyi_15 'khor_19 lo_25 spyan_28 drangs_34 te_41 
T02D1263:6b-0	goo r'i dza: la @6b sogs pa'i phyag rgya bzhis dgug pa dang /	goo_0 r_4 dza:_8 la_13 sogs_20 ba_25 phyag_30 rgya_36 bzhis_41 'gugs_47 ba_52 dang_55 
T02D1263:6b-1	gzhug pa dang bcing ba dang dgyes par byas la /	'jug_0 ba_6 dang_9 'ching_14 ba_20 dang_23 dgyes_28 ba_34 byed_38 la_43 
T02D1263:6b-2	dbyer med par bsam mo //	dbyer_0 med_6 ba_10 bsam_14 mo_19 
T02D1263:6b-3	de la proksha na dang /	de_0 la_3 proksha_6 na_14 dang_17 
T02D1263:6b-4	aargha dang /	aargha_0 dang_7 
T02D1263:6b-5	aanytsa m'a nam dang /	aanytsa_0 m_8 nam_12 dang_16 
T02D1263:6b-6	bi dhi dang /	bi_0 dhi_3 dang_7 
T02D1263:6b-7	mchod pa rnam pa lnga dang /	mchod_0 ba_6 rnam_9 ba_14 lnga_17 dang_22 
T02D1263:6b-8	lha mo brgyad la bstod pa rnams byas la /	lha_0 mo_4 brgyad_7 la_14 bstod_17 ba_23 rnams_26 byed_32 la_37 
T02D1263:6b-9	de nas 'dzab brgya rtsa brgyad bzlas la gzhag go //	de_0 nas_3 'dzab_7 brgya_13 rtsa_19 brgyad_24 bzlas_31 la_37 'jog_40 go_46 
T02D1263:6b-10	de nas spos kyis kyang mchod pa bya ste /	de_0 nas_3 spros_7 kyis_12 kyang_17 mchod_23 ba_29 byed_32 ste_36 
T02D1263:6b-11	me tog dkar po chal bar gtor ba la sogs pa bya'o //	me_0 tog_3 dkar_7 po_12 'chal_15 ba_20 'thor_24 ba_29 la_32 sogs_35 ba_40 byed_43 
T02D1263:6b-12	de nas lha rnams 'od du zhu ba las /	de_0 nas_3 lha_7 rnams_11 'od_17 du_21 'ju_24 ba_28 las_31 
T02D1263:6b-13	byang chub kyi sems kyis dkar mer gyis khengs par bsam /	byang_0 chub_6 kyi_11 sems_15 kyis_20 dkar_25 mer_30 gyis_34 kheng_39 ba_46 bsam_50 
T02D1263:6b-14	de nas dri chab bzang po dgang ba blugs la /	de_0 nas_3 'dri_7 chab_11 bzang_16 po_22 'geng_25 ba_31 blugs_34 la_40 
T02D1263:6b-15	sman la sogs pa dang yang ldan par byas te /	sman_0 la_5 sogs_8 ba_13 dang_16 yang_21 ldan_26 ba_31 byed_35 te_40 
T02D1263:6b-16	shve ta bri ha ti /	shve_0 ta_5 'bri_8 ha_12 ti_15 
T02D1263:6b-17	aa pa ra dzi ta /	aa_0 ba_3 ra_6 dzi_9 ta_13 
T02D1263:6b-18	danda /	danda_0 
T02D1263:6b-19	autpala /	autpala_0 
T02D1263:6b-20	kanda ka ri /	kanda_0 ka_6 ri_9 
T02D1263:6b-21	ha sa de ba la sogs pa'i rtsa ba las byas te /	ha_0 sa_3 de_6 ba_9 la_12 sogs_15 ba_20 rtsa_25 ba_30 las_33 byed_37 te_42 
T02D1263:6b-22	'dir dkyil 'khor gyi byang chub sems rtags su byas pa'o //	'dir_0 dkyil_5 'khor_11 gyi_17 byang_21 chub_27 sems_32 rtags_37 su_43 byed_46 ba_51 
T02D1263:6b-23	'bras so ba dang /	'bras_0 so_6 ba_9 dang_12 
T02D1263:6b-24	sran ma sha dang /	sran_0 ma_5 sha_8 dang_12 
T02D1263:6b-25	nas dang /	nas_0 dang_4 
T02D1263:6b-26	til dang /	til_0 dang_4 
