T06D4044:141a-0	@141a * // rgya gar skad du /	rgya_11 gar_16 skad_20 du_25 
T06D4044:141a-1	bo dhi satva bh'u mi bri tti /	'bo_0 dhi_3 satva_7 bh_13 mi_18 'bri_21 tti_25 
T06D4044:141a-2	bod skad du /	'bod_0 skad_4 du_9 
T06D4044:141a-3	byang chub sems dpa'i sa'i 'grel ba /	byang_0 chub_6 sems_11 dpa_16 sa_22 'grel_27 ba_33 
T06D4044:141a-4	sangs rgyas dang byang chub sems dpa' thams cad la phyag 'tshal lo //	sangs_0 rgya_6 dang_12 byang_17 chub_23 sems_28 dpa'_33 thams_38 cad_44 la_48 phyag_51 'tshal_57 lo_64 
T06D4044:141a-5	'phags pa 'jam dpal gzhon nur gyur ba la phyag 'tshal lo //	'phag_0 ba_7 'jam_10 dpal_15 gzhon_20 nur_26 gyur_30 ba_35 la_38 phyag_41 'tshal_47 lo_54 
T06D4044:141a-6	sems can kun la phan 'dod pas //	sems_0 can_5 kun_9 la_13 phan_16 'dod_21 ba_26 
T06D4044:141a-7	ma mo gang zhig shes pa de //	ma_0 mo_3 gang_6 'jig_11 shes_16 ba_21 de_24 
T06D4044:141a-8	shes bya'i pha rol mthar 'gro ba //	shes_0 byed_5 pha_11 rol_15 mthar_19 'gro_25 ba_30 
T06D4044:141a-9	de yi bshad pa brtsams par bya //	de_0 yi_3 'chad_6 ba_12 brtsams_15 ba_23 byed_27 
T06D4044:141a-10	tshigs su bcad pa 'di brtsams pa'i dgos pa gang zhe na /	tshigs_0 su_7 gcod_10 ba_15 'di_18 brtsams_22 ba_30 dgos_35 ba_40 gang_43 zhe_48 na_52 
T06D4044:141a-11	dgos pa mthong ba'o //	dgos_0 ba_5 mthong_8 ba_15 
T06D4044:141a-12	dgos pa'i don gang don chen po'i don mthong ba ste /	dgos_0 ba_5 don_10 gang_14 don_19 chen_23 po_28 don_33 mthong_37 ba_44 ste_47 
T06D4044:141a-13	bstan bcos don chen mthong nas ni //	ston_0 'chos_6 don_11 chen_15 mthong_20 nas_27 ni_31 
T06D4044:141a-14	mnyan pa dang ni gzung ba'i phyir //	nyan_0 ba_6 dang_9 ni_14 gzung_17 ba_23 phyir_28 
T06D4044:141a-15	thos 'dod gus par gyur ba ni //	thos_0 'dod_5 gus_10 ba_14 gyur_18 ba_23 ni_26 
T06D4044:141a-16	dang po tshig gis dgos pa yin //	dang_0 po_5 tshig_8 gis_14 dgos_18 ba_23 yin_26 
T06D4044:141a-17	zhes gsungs pas so //	zhes_0 gsungs_5 ba_12 so_16 
T06D4044:141a-18	ma mo'i don chen po mthong bas /	ma_0 mo_3 don_8 chen_12 po_17 mthong_20 ba_27 
T06D4044:141a-19	tshigs su bcad pa 'di yang don che ba nyid kyis /	tshigs_0 su_7 gcod_10 ba_15 'di_18 yang_22 don_27 che_31 ba_35 nyid_38 kyis_43 
T06D4044:141a-20	yang 'di nyid kyi don che ba'i ngo bo ni brjod par bya ba ma yin no //	yang_0 'di_5 nyid_9 kyi_14 don_18 che_22 ba_26 ngo_31 'bo_35 ni_38 rjod_41 ba_47 byed_51 ba_55 ma_58 yin_61 no_65 
T06D4044:141a-21	'gro ba zhes bya ba ni 'thob pa'o //	'gro_0 ba_5 zhes_8 byed_13 ba_17 ni_20 'thob_23 ba_29 
T06D4044:141a-22	yang na rtogs pa ste /	yang_0 na_5 rtogs_8 ba_14 ste_17 
T06D4044:141a-23	ye shes mthong ba'i don du 'gro bas so //	ye_0 shes_3 mthong_8 ba_15 don_20 du_24 'gro_27 ba_32 so_36 
T06D4044:141a-24	tshig gcig la yang nges par bzung ba mthong ba'i phyir te /	tshig_0 gcig_6 la_11 yang_14 nges_19 ba_24 bzung_28 ba_34 mthong_37 ba_44 phyir_49 te_55 
T06D4044:141a-25	'di lta ste chu 'thung dang rlung za zhes bya ba lta bus na /	'di_0 lta_4 ste_8 chu_12 'thung_16 dang_23 rlung_28 za_34 zhes_37 byed_42 ba_46 lta_49 'bud_53 na_57 
T06D4044:141a-26	'gro ba zhes bya ba nges par gzung ba'i don du rtogs par bya'o //	'gro_0 ba_5 zhes_8 byed_13 ba_17 nges_20 ba_25 gzung_29 ba_35 don_40 du_44 rtogs_47 ba_53 byed_57 
T06D4044:141a-27	gzhan du na tshig la nus pa med par 'gyur ro //	gzhan_0 du_6 na_9 tshig_12 la_18 nus_21 ba_25 med_28 ba_32 'gyur_36 ro_42 
T06D4044:141a-28	'gro ba ni song bar gyur pa dang /	'gro_0 ba_5 ni_8 'gro_11 ba_16 gyur_20 ba_25 dang_28 
T06D4044:141a-29	'ong bar 'gyur ba dang /	'ong_0 ba_5 'gyur_9 ba_15 dang_18 
T06D4044:141a-30	'gro ba ste /	'gro_0 ba_5 ste_8 
T06D4044:141a-31	'di lta ste /	'di_0 lta_4 ste_8 
T06D4044:141a-32	ri ni gnas so zhes bya ba lta bu'o //	ri_0 ni_3 gnas_6 so_11 zhes_14 byed_19 ba_23 lta_26 bu_30 
T06D4044:141a-33	shes bya zhes bya ba ni shes par bya ba'o //	shes_0 byed_5 zhes_9 byed_14 ba_18 ni_21 shes_24 ba_29 byed_33 ba_37 
T06D4044:141a-34	de'i mtha' ni shes bya'i mtha'o //	de_0 mtha'_5 ni_11 shes_14 byed_19 mtha_25 
T06D4044:141a-35	'dir pa ri'i ri nye bar bsgyur ba ni khyab pa dang kun ngu'i don te /	'dir_0 ba_5 ri_8 ri_13 nye_16 ba_20 sgyur_24 ba_31 ni_34 khyab_37 ba_43 dang_46 kun_51 ngu_55 don_61 te_65 
T06D4044:141a-36	kun dang khyab pa'i mtha' ni pa ri aan ta ste /	kun_0 dang_4 khyab_9 ba_15 mtha'_20 ni_26 ba_29 ri_32 aan_35 ta_39 ste_42 
T06D4044:141a-37	mthar 'gro ba'o //	mthar_0 'gro_6 ba_11 
T06D4044:141a-38	gang zhig shes pa zhes bya ba ni gang de shes pas yin gyi /	gang_0 'jig_5 shes_10 ba_15 zhes_18 byed_23 ba_27 ni_30 gang_33 de_38 shes_41 ba_46 yin_50 gyi_54 
T06D4044:141a-39	gzhan gyis ni ma yin la shes pa yin gyi mi shes pa ni ma yin no //	gzhan_0 gyis_6 ni_11 ma_14 yin_17 la_21 shes_24 ba_29 yin_32 gyi_36 mi_40 shes_43 ba_48 ni_51 ma_54 yin_57 no_61 
T06D4044:141a-40	gang zhig shes pas shes bya'i pha rol mthar 'gro ba de gang yin zhe na /	gang_0 'jig_5 shes_10 ba_15 shes_19 byed_24 pha_30 rol_34 mthar_38 'gro_44 ba_49 de_52 gang_55 yin_60 zhe_64 na_68 
T06D4044:141a-41	byang chub sems dpa'i sde snod rgyas pa ste /	byang_0 chub_6 sems_11 dpa_16 sde_22 snod_26 rgya_31 ba_37 ste_40 
T06D4044:141a-42	shes bya'i pha rol mthar 'gro ba gzhan dag la ma mthong ba'i phyir ro //	shes_0 byed_5 pha_11 rol_15 mthar_19 'gro_25 ba_30 gzhan_33 'dag_39 la_43 ma_46 mthong_49 ba_56 phyir_61 ro_67 
T06D4044:141a-43	de'i ma mos ni shin tu rgyas pa'i mtshan nyid	de_0 ma_5 mos_8 ni_12 shin_15 tu_20 rgya_23 ba_29 mtshan_34 nyid_41 
T06D4044:141a-44	can gyi shin tu rgyas pa'i sde snod kyi ma	can_0 gyi_4 shin_8 tu_13 rgya_16 ba_22 sde_27 snod_31 kyi_36 ma_40 
T06D4044:141a-45	mo zhes bya ba ste /	mo_0 zhes_3 byed_8 ba_12 ste_15 
T06D4044:141a-46	ma mo dang 'dra bas na ma mo'o //	ma_0 mo_3 dang_6 'dra_11 ba_16 na_20 ma_23 mo_26 
T06D4044:141a-47	ji ltar yi ge'i ma mo ma gtogs pa'i bstan bcos mi dmigs pa de bzhin du /	ji_0 ltar_3 yi_8 ge_11 ma_16 mo_19 ma_22 gtogs_25 ba_31 ston_36 'chos_42 mi_47 dmigs_50 ba_56 de_59 bzhin_62 du_68 
T06D4044:141a-48	byang chub sems dpa'i sar bstan pa'i mtshan nyid dang	byang_0 chub_6 sems_11 dpa_16 sar_22 ston_26 ba_32 mtshan_37 nyid_44 dang_49 
T06D4044:141b-0	bral ba'i shin tu rgyas pa'i sde snod ma @141b	'bral_0 ba_5 shin_10 tu_15 rgya_18 ba_24 sde_29 snod_33 ma_38 
T06D4044:141b-1	mthong ba'i phyir ro //	mthong_0 ba_7 phyir_12 ro_18 
T06D4044:141b-2	de'i zhes bya ba ni ma mo'i'o //	de_0 zhes_5 byed_10 ba_14 ni_17 ma_20 mo'o_23 
T06D4044:141b-3	gang gis ci tsam zhe na /	gang_0 gis_5 ci_9 tsam_12 zhe_17 na_21 
T06D4044:141b-4	smras pa /	smras_0 ba_6 
T06D4044:141b-5	sems can kun la phan 'dod pas so //	sems_0 can_5 kun_9 la_13 phan_16 'dod_21 ba_26 so_30 
T06D4044:141b-6	sems can thams cad la phan par 'dod pa ni legs par byed pa ste /	sems_0 can_5 thams_9 cad_15 la_19 phan_22 ba_27 'dod_31 ba_36 ni_39 legs_42 ba_47 byed_51 ba_56 ste_59 
T06D4044:141b-7	sems can kun la phan par 'dod pa'o //	sems_0 can_5 kun_9 la_13 phan_16 ba_21 'dod_25 ba_30 
T06D4044:141b-8	ji lta bu'i phan pa zhig ce na /	ji_0 lta_3 bu_7 phan_12 ba_17 'jig_20 ce_25 na_28 
T06D4044:141b-9	bshad pa ma mo'i don bstan pa'o //	'chad_0 ba_6 ma_9 mo_12 don_17 ston_21 ba_27 
T06D4044:141b-10	de bstan pas kyang rgya chen po'i sde snod kyang	de_0 ston_3 ba_9 kyang_13 rgya_19 chen_24 po_29 sde_34 snod_38 kyang_43 
T06D4044:141b-11	bstan par 'gyur bas tshigs su bcad pa 'di'i bsdus	ston_0 ba_6 'gyur_10 ba_16 tshigs_20 su_27 gcod_30 ba_35 'di_38 sdud_44 
T06D4044:141b-12	pa'i don ni de yin no //	ba_0 don_5 ni_9 de_12 yin_15 no_19 
T06D4044:141b-13	byang chub sems dpa'i sa'i sde 'di'i bsdus pa'i don ni /	byang_0 chub_6 sems_11 dpa_16 sa_22 sde_27 'di_31 sdud_37 ba_43 don_48 ni_52 
T06D4044:141b-14	rnal 'byor gyi gzhi'i gnas dang /	rnal_0 'byor_5 gyi_11 gzhi_15 gnas_22 dang_27 
T06D4044:141b-15	rnal 'byor gyi gzhi'i bdag nyid kyi gnas dang /	rnal_0 'byor_5 gyi_11 gzhi_15 bdag_22 nyid_27 kyi_32 gnas_36 dang_41 
T06D4044:141b-16	rnal 'byor gyi gzhi'i mtha'i gnas so //	rnal_0 'byor_5 gyi_11 gzhi_15 mtha_22 gnas_29 so_34 
T06D4044:141b-17	rnal 'byor gyi gzhi'i gnas ni le'u bco brgyad do //	rnal_0 'byor_5 gyi_11 gzhi_15 gnas_22 ni_27 le_30 'chos_35 brgyad_39 do_46 
T06D4044:141b-18	rnal 'byor gyi gzhi'i sgrub pa'i chos ni le'u bzhi'o //	rnal_0 'byor_5 gyi_11 gzhi_15 sgrub_22 ba_28 chos_33 ni_38 le_41 bzhi_46 
T06D4044:141b-19	rnal 'byor gyi gzhi'i mtha' ni le'u lnga ste /	rnal_0 'byor_5 gyi_11 gzhi_15 mtha'_22 ni_28 le_31 lnga_36 ste_41 
T06D4044:141b-20	gang de ni chos bcu po 'di dag ni theg	gang_0 de_5 ni_8 chos_11 'chu_16 po_20 'di_23 'dag_27 ni_31 theg_34 
T06D4044:141b-21	pa chen po byang chub sems dpa'i lam 'bras bu	ba_0 chen_3 po_8 byang_11 chub_17 sems_22 dpa_27 lam_33 'bras_37 bu_43 
T06D4044:141b-22	dang bcas pa sdud par byed pa yin no //	dang_0 'cha'_5 ba_10 sdud_13 ba_18 byed_22 ba_27 yin_30 no_34 
T06D4044:141b-23	bcu gang zhe na /	'chu_0 gang_4 zhe_9 na_13 
T06D4044:141b-24	gzhi dang /	gzhi_0 dang_5 
T06D4044:141b-25	rtags dang /	rtags_0 dang_6 
T06D4044:141b-26	phyogs dang /	phyogs_0 dang_7 
T06D4044:141b-27	lhag pa'i bsam pa dang /	lhag_0 ba_5 bsam_10 ba_15 dang_18 
T06D4044:141b-28	gnas pa dang /	gnas_0 ba_5 dang_8 
T06D4044:141b-29	skye ba dang /	skye_0 ba_5 dang_8 
T06D4044:141b-30	yongs su 'dzin pa dang /	yongs_0 su_6 'dzin_9 ba_15 dang_18 
T06D4044:141b-31	sa dang /	sa_0 dang_3 
T06D4044:141b-32	spyod pa dang /	spyod_0 ba_6 dang_9 
T06D4044:141b-33	rab tu gnas pa'o zhes bya ba'o //	rab_0 tu_4 gnas_7 ba_12 zhes_17 byed_22 ba_26 
T06D4044:141b-34	grangs bcur bsdus pa ni grangs nges par gzung ba'i don te /	grangs_0 'jur_7 sdud_12 ba_18 ni_21 grangs_24 nges_31 ba_36 gzung_40 ba_46 don_51 te_55 
T06D4044:141b-35	bcu las mi mang zhing mi nyung ngo //	'chu_0 las_4 mi_8 mang_11 zhing_16 mi_22 nyung_25 ngo_31 
T06D4044:141b-36	theg pa chen po sdud par byed pa yin no zhes bya ba la /	theg_0 ba_5 chen_8 po_13 sdud_16 ba_21 byed_25 ba_30 yin_33 no_37 zhes_40 byed_45 ba_49 la_52 
T06D4044:141b-37	phyin par byed pas na theg pa'o //	phyin_0 ba_6 byed_10 ba_15 na_19 theg_22 ba_27 
T06D4044:141b-38	de ni theg pa yang yin la chen po yang yin pas theg pa chen po ste /	de_0 ni_3 theg_6 ba_11 yang_14 yin_19 la_23 chen_26 po_31 yang_34 yin_39 ba_43 theg_47 ba_52 chen_55 po_60 ste_63 
T06D4044:141b-39	'chad bar 'gyur ba'i chen po nyid rnam pa bdun gyi tshul gyis so //	'chad_0 ba_6 'gyur_10 ba_16 chen_21 po_26 nyid_29 rnam_34 ba_39 bdun_42 gyi_47 tshul_51 gyis_57 so_62 
T06D4044:141b-40	rab tu gnas pa'i le'u ni 'bras bu nyid yin pas na /	rab_0 tu_4 gnas_7 ba_12 le_17 ni_22 'bras_25 bu_31 nyid_34 yin_39 ba_43 na_47 
T06D4044:141b-41	theg pa chen por ma bsdus pas des na byang	theg_0 ba_5 chen_8 por_13 ma_17 sdud_20 ba_26 des_30 na_34 byang_37 
T06D4044:141b-42	chub sems dpa'i lam 'bras bu dang bcas pa zhes	chub_0 sems_5 dpa_10 lam_16 'bras_20 bu_26 dang_29 'cha'_34 ba_39 zhes_42 
T06D4044:141b-43	bstan to // 'dis thob par byed pas na lam mam thob par bya bas na lam ste /	ston_0 to_6 'dis_12 'thob_17 ba_22 byed_26 ba_31 na_35 lam_38 mam_42 'thob_46 ba_51 byed_55 ba_59 na_63 lam_66 ste_70 
T06D4044:141b-44	'di ltar ye shes dang thob par bya ba'i 'bras bu ni lam zhes bstan par 'gyur ro //	'di_0 ltar_4 ye_9 shes_12 dang_17 'thob_22 ba_27 byed_31 ba_35 'bras_40 bu_46 ni_49 lam_52 zhes_56 ston_61 ba_67 'gyur_71 ro_77 
T06D4044:141b-45	de lta bu'i mtshan nyid can gyis theg pa chen	de_0 lta_3 bu_7 mtshan_12 nyid_19 can_24 gyis_28 theg_33 ba_38 chen_41 
T06D4044:141b-46	pos ni rab tu gnas pa'i le'u yang 'di ltar	pos_0 ni_4 rab_7 tu_11 gnas_14 ba_19 le_24 yang_29 'di_34 ltar_38 
T06D4044:141b-47	bsdus par 'gyur ro //	sdud_0 ba_6 'gyur_10 ro_16 
T06D4044:141b-48	'dis 'dzin par byed pas na rten te /	'dis_0 'dzin_5 ba_11 byed_15 ba_20 na_24 rten_27 te_32 
T06D4044:141b-49	gang gi phyir brten pa la ltos nas rten nyid yin na /	gang_0 gi_5 phyir_8 rten_14 ba_20 la_23 ltos_26 nas_31 rten_35 nyid_40 yin_45 na_49 
T06D4044:141b-50	gang gi rten yin zhes brten pa 'dri bas /	gang_0 gi_5 rten_8 yin_13 zhes_17 rten_22 ba_28 'bri_31 ba_36 
T06D4044:141b-51	de lta bas na skal ba dang ldan pa zhes smras so //	de_0 lta_3 ba_7 na_11 skal_14 ba_19 dang_22 ldan_27 ba_32 zhes_35 smras_40 so_46 
T06D4044:142a-0	de bzhin du gzhan la @142a * //	de_0 bzhin_3 du_9 gzhan_12 la_18 
T06D4044:142a-1	yang sbyar bar bya'o //	yang_0 sbyor_5 ba_11 byed_15 
T06D4044:142a-2	yang dag par rdzogs pa'i byang chub yongs su rdzogs zhes ci'i phyir brjod /	yang_0 'dag_5 ba_9 rdzogs_13 ba_20 byang_25 chub_31 yongs_36 su_42 rdzogs_45 zhes_52 ci_57 phyir_62 rjod_68 
T06D4044:142a-3	'di ltar yang dag par rdzogs pa'i byang chub 'thob ces mi brjod ce na /	'di_0 ltar_4 yang_9 'dag_14 ba_18 rdzogs_22 ba_29 byang_34 chub_40 'thob_45 ces_51 mi_55 rjod_58 ce_64 na_67 
T06D4044:142a-4	rnam pa thams cad shin tu gnas gyur ba'i mtshan nyid can ni byang chub yin la /	rnam_0 ba_5 thams_8 cad_14 shin_18 tu_23 gnas_26 gyur_31 ba_36 mtshan_41 nyid_48 can_53 ni_57 byang_60 chub_66 yin_71 la_75 
T06D4044:142a-5	sbyin pa la sogs pa'i sbyor ba tsam gyis ni mi thob bo //	sbyin_0 ba_6 la_9 sogs_12 ba_17 sbyor_22 ba_28 tsam_31 gyis_36 ni_41 mi_44 'thob_47 'bo_52 
T06D4044:142a-6	'on kyang sbyin pa la sogs pa'i rim gyis gang glo bur ba'i dri ma bsal nas /	'on_0 kyang_4 sbyin_10 ba_16 la_19 sogs_22 ba_27 rim_32 gyis_36 gang_41 glo_46 bur_50 ba_54 'dri_59 ma_63 bsal_66 nas_71 
T06D4044:142a-7	mthar rdo rje lta bu'i ting nge 'dzin la yang dag par brten pa'i lam ni byang chub bo //	mthar_0 rdo_6 rje_10 lta_14 bu_18 ting_23 nge_28 'dzin_32 la_38 yang_41 'dag_46 ba_50 rten_54 ba_60 lam_65 ni_69 byang_72 chub_78 'bo_83 
T06D4044:142a-8	gang zag rigs la gnas pa zhes bya ba la sogs pa gsungs pa'i gzhung gis ci zhig bstan /	gang_0 zag_5 rigs_9 la_14 gnas_17 ba_22 zhes_25 byed_30 ba_34 la_37 sogs_40 ba_45 gsungs_48 ba_55 gzhung_60 gis_67 ci_71 'jig_74 ston_79 
T06D4044:142a-9	rigs la gnas pa'i rten rnams yod na yang rigs nyid gtsor brten zhes rab tu bstan te /	rigs_0 la_5 gnas_8 ba_13 rten_18 rnams_23 yod_29 na_33 yang_36 rigs_41 nyid_46 gtsor_51 rten_57 zhes_63 rab_68 tu_72 ston_75 te_81 
T06D4044:142a-10	rigs med na gzhan yod na yang rnam pa thams	rigs_0 med_5 na_9 gzhan_12 yod_18 na_22 yang_25 rnam_30 ba_35 thams_38 
T06D4044:142a-11	cad du bla na med pa yang dag par rdzogs	cad_0 du_4 bla_7 na_11 med_14 ba_18 yang_21 'dag_26 ba_30 rdzogs_34 
T06D4044:142a-12	pa'i byang chub mngon par rdzogs par 'tshang rgya ba	ba_0 byang_5 chub_11 mngon_16 ba_22 rdzogs_26 ba_33 'tshang_37 rgya_45 ba_50 
T06D4044:142a-13	med pa nyid yin la /	med_0 ba_4 nyid_7 yin_12 la_16 
T06D4044:142a-14	rigs yod na ni dus gzhan na sems bskyed pa	rigs_0 yod_5 na_9 ni_12 dus_15 gzhan_19 na_25 sems_28 skyed_33 ba_40 
T06D4044:142a-15	la sogs pa byas nas bla na med pa yang	la_0 sogs_3 ba_8 byed_11 nas_16 bla_20 na_24 med_27 ba_31 yang_34 
T06D4044:142a-16	dag par rdzogs pa'i byang chub mngon par rdzogs par	'dag_0 ba_4 rdzogs_8 ba_15 byang_20 chub_26 mngon_31 ba_37 rdzogs_41 ba_48 
T06D4044:142a-17	'tshang rgya ba'i phyir ro //	'tshang_0 rgya_8 ba_13 phyir_18 ro_24 
T06D4044:142a-18	rigs ji lta ba bzhin du dang po sems bskyed pa dang /	rigs_0 ji_5 lta_8 ba_12 bzhin_15 du_21 dang_24 po_29 sems_32 skyed_37 ba_44 dang_47 
T06D4044:142a-19	byang chub sems dpa'i spyod pa thams cad kyang de bzhin no //	byang_0 chub_6 sems_11 dpa_16 spyod_22 ba_28 thams_31 cad_37 kyang_41 de_47 bzhin_50 no_56 
T06D4044:142a-20	ci ltar rigs la gzhi zhes brjod cing nye bar rtog pa la sogs pa brjod pa ltar /	ci_0 ltar_3 rigs_8 la_13 gzhi_16 zhes_21 rjod_26 cing_32 nye_37 ba_41 rtogs_45 ba_50 la_53 sogs_56 ba_61 rjod_64 ba_70 ltar_73 
T06D4044:142a-21	dang po sems bskyed pa la yang gzhi dang rtog pa la sogs par brjod do //	dang_0 po_5 sems_8 skyed_13 ba_20 la_23 yang_26 gzhi_31 dang_36 rtogs_41 ba_46 la_49 sogs_52 ba_57 rjod_61 do_67 
T06D4044:142a-22	de la yang rigs zhes bya ba ni /	de_0 la_3 yang_6 rigs_11 zhes_16 byed_21 ba_25 ni_28 
T06D4044:142a-23	rang bzhin gyis gnas pa'i rigs so //	rang_0 bzhin_5 gyis_11 gnas_16 ba_21 rigs_26 so_31 
T06D4044:142a-24	'bras bu med pas cha phra ba zhes bya ba ni //	'bras_0 bu_6 med_9 ba_13 cha_17 phra_21 ba_26 zhes_29 byed_34 ba_38 ni_41 
T06D4044:142a-25	'bras bu mi dmigs pa'i don to //	'bras_0 bu_6 mi_9 dmigs_12 ba_18 don_23 to_27 
T06D4044:142a-26	'bras bu la ltos nas rigs yod par shes kyi gzhan dag tu ni ma yin no //	'bras_0 bu_6 la_9 ltos_12 nas_17 rigs_21 yod_26 ba_30 shes_34 kyi_39 gzhan_43 'dag_49 tu_53 ni_56 ma_59 yin_62 no_66 
T06D4044:142a-27	bdag la phan pa'i phyir zhugs pa zhes bya ba la sogs pa la /	bdag_0 la_5 phan_8 ba_13 phyir_18 'jug_24 ba_30 zhes_33 byed_38 ba_42 la_45 sogs_48 ba_53 la_56 
T06D4044:142a-28	dge ba la spyod pa ni phan pa zhes brjod do //	dge_0 ba_4 la_7 spyod_10 ba_16 ni_19 phan_22 ba_27 zhes_30 rjod_35 do_41 
T06D4044:142a-29	bde ba ni gnod pa ma yin ba'o //	bde_0 ba_4 ni_7 gnod_10 ba_15 ma_18 yin_21 ba_25 
T06D4044:142a-30	snying brtse ba ni 'di na la la mi gnod	snying_0 brtse_7 ba_13 ni_16 'di_19 na_23 la_26 la_29 mi_32 gnod_35 
T06D4044:142a-31	pa'i dge ba la spyod pas gzhan dag la brtse	ba_0 dge_5 ba_9 la_12 spyod_15 ba_21 gzhan_25 'dag_31 la_35 brtse_38 
T06D4044:142a-32	ba'o // 'dod par bya ba nyid dang don dang	ba_0 'dod_8 ba_13 byed_17 ba_21 nyid_24 dang_29 don_34 dang_38 
T06D4044:142a-33	ldan pa nyid kyis don yin la gang 'dod par	ldan_0 ba_5 nyid_8 kyis_13 don_18 yin_22 la_26 gang_29 'dod_34 ba_39 
T06D4044:142a-34	bya ba nyid dang kha na ma tho ba med	byed_0 ba_4 nyid_7 dang_12 kha_17 na_21 ma_24 tho_27 ba_31 med_34 
T06D4044:142a-35	pa nyid kyis phan pa dang bde ba'o //	ba_0 nyid_3 kyis_8 phan_13 ba_18 dang_21 bde_26 ba_30 
T06D4044:142a-36	gang dag dge ba spyod pa la 'jug pa rnams ni mi ste /	gang_0 'dag_5 dge_9 ba_13 spyod_16 ba_22 la_25 'jug_28 ba_33 rnams_36 ni_42 mi_45 ste_48 
T06D4044:142a-37	rgyal rigs la sogs pa'o //	rgyal_0 rigs_6 la_11 sogs_14 ba_19 
T06D4044:142a-38	gang dag sangs rgyas 'byung ba dang /	gang_0 'dag_5 sangs_9 rgya_15 'byung_21 ba_28 dang_31 
T06D4044:142a-39	legs par gsungs pa'i chos dang /	legs_0 ba_5 gsungs_9 ba_16 chos_21 dang_26 
T06D4044:142b-0	@142b legs par spyod pa'i dge 'dun la mang du zhugs pas phan pa 'byung bar 'gyur /	legs_6 ba_11 spyod_15 ba_21 dge_26 'dun_30 la_35 mang_38 du_43 'jug_46 ba_52 phan_56 ba_61 'byung_64 ba_71 'gyur_75 
T06D4044:142b-1	bde ba 'byung bar 'gyur zhes gsungs so //	bde_0 ba_4 'byung_7 ba_14 'gyur_18 zhes_24 gsungs_29 so_36 
T06D4044:142b-2	yang de ni bdag la phan pa dang bde ba byas nas 'jig rten la snying brtse pas /	yang_0 de_5 ni_8 bdag_11 la_16 phan_19 ba_24 dang_27 bde_32 ba_36 byed_39 nas_44 'jig_48 rten_53 la_58 snying_61 brtse_68 ba_74 
T06D4044:142b-3	'di snyam du sems par 'gyur te /	'di_0 snyam_4 du_10 sems_13 ba_18 'gyur_22 te_28 
T06D4044:142b-4	ji ltar gzhan dag la phan pa dang /	ji_0 ltar_3 gzhan_8 'dag_14 la_18 phan_21 ba_26 dang_29 
T06D4044:142b-5	bde ba dang /	bde_0 ba_4 dang_7 
T06D4044:142b-6	ldan par bya snyam mo //	ldan_0 ba_5 byed_9 snyam_13 mo_19 
T06D4044:142b-7	gzhan dag kyang 'di snyam du sems te /	gzhan_0 'dag_6 kyang_10 'di_16 snyam_20 du_26 sems_29 te_34 
T06D4044:142b-8	ji ltar bdag kyang 'di ltar 'gyur snyam mo //	ji_0 ltar_3 bdag_8 kyang_13 'di_19 ltar_23 'gyur_28 snyam_34 mo_40 
T06D4044:142b-9	des na don dang phan pa dang bde ba zhes bya'o //	des_0 na_4 don_7 dang_11 phan_16 ba_21 dang_24 bde_29 ba_33 zhes_36 byed_41 
T06D4044:142b-10	lha dang mi rnams zhes bya ba ni /	lha_0 dang_4 mi_9 rnams_12 zhes_18 byed_23 ba_27 ni_30 
T06D4044:142b-11	don shes pa dang /	don_0 shes_4 ba_9 dang_12 
T06D4044:142b-12	bsgrub pa la nus pa dang ldan pas lha dang mi'o //	sgrub_0 ba_7 la_10 nus_13 ba_17 dang_20 ldan_25 ba_30 lha_34 dang_38 mi_43 
T06D4044:142b-13	sbyin pa'i pha rol tu phyin pa'i rigs kyi rtags ni mdor bsdu na rnam pa gsum ste /	sbyin_0 ba_6 pha_11 rol_15 tu_19 phyin_22 ba_28 rigs_33 kyi_38 rtags_42 ni_48 mdor_51 sdud_56 na_61 rnam_64 ba_69 gsum_72 ste_77 
T06D4044:142b-14	zang zing gi sbyin pa dang /	zang_0 zing_5 gi_10 sbyin_13 ba_19 dang_22 
T06D4044:142b-15	chos kyi sbyin pa dang /	chos_0 kyi_5 sbyin_9 ba_15 dang_18 
T06D4044:142b-16	mi 'jigs pa'i sbyin pa'o //	mi_0 'jigs_3 ba_9 sbyin_14 ba_20 
T06D4044:142b-17	sbyin pa'i rtags gsum po de rnams las /	sbyin_0 ba_6 rtags_11 gsum_17 po_22 de_25 rnams_28 las_34 
T06D4044:142b-18	de la re zhig dang por zang zing gi sbyin	de_0 la_3 re_6 'jig_9 dang_14 por_19 zang_23 zing_28 gi_33 sbyin_36 
T06D4044:142b-19	pa'i rtags ni yod cing bdog pa ni rtags gsum	ba_0 rtags_5 ni_11 yod_14 cing_18 bdog_23 ba_28 ni_31 rtags_34 gsum_40 
T06D4044:142b-20	ste / sbyin pa'i bdag nyid can dang /	ste_0 sbyin_6 ba_12 bdag_17 nyid_22 can_27 dang_31 
T06D4044:142b-21	sbyin 'dod pa'i bsam pa nyid dang /	sbyin_0 'dod_6 ba_11 bsam_16 ba_21 nyid_24 dang_29 
T06D4044:142b-22	rtag tu rgyun mi 'chad par bgo bsha' byed pa'i ngang tshul can dang /	rtag_0 tu_5 rgyun_8 mi_14 'chad_17 ba_23 bgod_27 bsha'_31 byed_37 ba_42 ngang_47 tshul_53 can_59 dang_63 
T06D4044:142b-23	sbyin pa'i dus su rab tu dga' ba'i sems kyis ster ba'o //	sbyin_0 ba_6 dus_11 su_15 rab_18 tu_22 dga'_25 ba_30 sems_35 kyis_40 ster_45 ba_50 
T06D4044:142b-24	med cing mi bdog na yang chung na yang bgo bsha' byed pa dang /	med_0 cing_4 mi_9 bdog_12 na_17 yang_20 chung_25 na_31 yang_34 bgod_39 bsha'_43 byed_49 ba_54 dang_57 
T06D4044:142b-25	bsam pa ni sbyin par bya ba'am mi sbyin zhes	bsam_0 ba_5 ni_8 sbyin_11 ba_17 byed_21 ba_25 mi_31 sbyin_34 zhes_40 
T06D4044:142b-26	sems dang 'thab mo byas na sbyin pa ma yin	sems_0 dang_5 'thab_10 mo_16 byed_19 na_24 sbyin_27 ba_33 ma_36 yin_39 
T06D4044:142b-27	/ de bzhin ser sna'i phyogs kyi gnyen po dang /	de_2 bzhin_5 ser_11 sna_15 phyogs_21 kyi_28 gnyen_32 po_38 dang_41 
T06D4044:142b-28	rgud pa'i gnyen pos sbyin pa ni ngo tsha'o zhes	rgud_0 ba_5 gnyen_10 pos_16 sbyin_20 ba_26 ni_29 ngo_32 tsha_36 zhes_43 
T06D4044:142b-29	de ltar re zhig sbyin pa la bdag nyid sgrub	de_0 ltar_3 re_8 'jig_11 sbyin_16 ba_22 la_25 bdag_28 nyid_33 sgrub_38 
T06D4044:142b-30	pa'o // gzhan la sgrub pa la yang rnam pa gnyis te /	ba_0 gzhan_8 la_14 sgrub_17 ba_23 la_26 yang_29 rnam_34 ba_39 gnyis_42 te_48 
T06D4044:142b-31	gzhan sbyin pa la ma zhugs pa la sgrub pa dang /	gzhan_0 sbyin_6 ba_12 la_15 ma_18 'jug_21 ba_27 la_30 sgrub_33 ba_39 dang_42 
T06D4044:142b-32	sbyin pa la zhugs pa la sgrub pa'o //	sbyin_0 ba_6 la_9 'jug_12 ba_18 la_21 sgrub_24 ba_30 
T06D4044:142b-33	sbyin pa la ma zhugs pa la yang rnam pa gnyis te /	sbyin_0 ba_6 la_9 ma_12 'jug_15 ba_21 la_24 yang_27 rnam_32 ba_37 gnyis_40 te_46 
T06D4044:142b-34	sbyin pa'i phan yon mi shes pa'i skye bo rmongs pa dang /	sbyin_0 ba_6 phan_11 yon_16 mi_20 shes_23 ba_28 skye_33 'bo_38 rmongs_41 ba_48 dang_51 
T06D4044:142b-35	bag med cing zhum pa ste /	bag_0 med_4 cing_8 zhum_13 ba_18 ste_21 
T06D4044:142b-36	rmongs pa rnams la bstan pa dang /	rmongs_0 ba_7 rnams_10 la_16 ston_19 ba_25 dang_28 
T06D4044:142b-37	bag med pa'i ngang tshul can rnams nye bar 'dun par bya'o //	bag_0 med_4 ba_8 ngang_13 tshul_19 can_25 rnams_29 nye_35 ba_39 'dun_43 ba_48 byed_52 
T06D4044:142b-38	yang dag par zhugs pa rnams la yid dga' ba dang yid bde ba ste /	yang_0 'dag_5 ba_9 'jug_13 ba_19 rnams_22 la_28 yid_31 dga'_35 ba_40 dang_43 yid_48 bde_52 ba_56 ste_59 
T06D4044:142b-39	sbyin pa pa la ni yid dga' la /	sbyin_0 ba_6 ba_9 la_12 ni_15 yid_18 dga'_22 la_27 
T06D4044:142b-40	sbyin pa la rjes su yi rang ba ni yid bde ba'o //	sbyin_0 ba_6 la_9 rjes_12 su_17 yi_20 rang_23 ba_28 ni_31 yid_34 bde_38 ba_42 
T06D4044:142b-41	chos kyi sbyin pa las brtsams nas bstan pa bla ma rnams zhes bya ba de la /	chos_0 kyi_5 sbyin_9 ba_15 las_18 brtsams_22 nas_30 ston_34 ba_40 bla_43 ma_47 rnams_50 zhes_56 byed_61 ba_65 de_68 la_71 
T06D4044:142b-42	chos kyi phyir sbyin pa'am /	chos_0 kyi_5 phyir_9 sbyin_15 ba_21 
T06D4044:142b-43	chos sbyin pa'o //	chos_0 sbyin_5 ba_11 
T06D4044:142b-44	de la chos kyi phyir sbyin pa'i dbang du byas	de_0 la_3 chos_6 kyi_11 phyir_15 sbyin_21 ba_27 dbang_32 du_38 byed_41 
T06D4044:142b-45	nas bla ma rnams zhes bya ba la sogs pa	nas_0 bla_4 ma_8 rnams_11 zhes_17 byed_22 ba_26 la_29 sogs_32 ba_37 
T06D4044:142b-46	gsungs pa de la /	gsungs_0 ba_7 de_10 la_13 
T06D4044:143a-0	@143a * // mkhan po dang slob dpon ni pha ma'o //	mkhan_11 po_17 dang_20 slob_25 dpon_30 ni_35 pha_38 ma_42 
T06D4044:143a-1	rgan rabs ni gang rab tu byung ba tshangs pa mtshungs par spyod pa'am los rgan pa'o //	rgan_0 rabs_5 ni_10 gang_13 rab_18 tu_22 'byung_25 ba_31 tshangs_34 ba_42 mtshungs_45 ba_54 spyod_58 ba_64 los_70 rgan_74 ba_79 
T06D4044:143a-2	yon gnas ni yon tan dang ldan pa'o //	yon_0 gnas_4 ni_9 yon_12 tan_16 dang_20 ldan_25 ba_30 
T06D4044:143a-3	bkur sti bya bar 'os pa ni yon tan dang ldan pa'i bye brag gam /	bkur_0 sti_5 byed_9 ba_13 'os_17 ba_21 ni_24 yon_27 tan_31 dang_35 ldan_40 ba_45 'bye_50 brag_54 gam_59 
T06D4044:143a-4	yang na gzhan yang bkur sti bya bar 'os pa'o //	yang_0 na_5 gzhan_8 yang_14 bkur_19 sti_24 byed_28 ba_32 'os_36 ba_40 
T06D4044:143a-5	chos kyi sbyin pa'i dbang du byas nas /	chos_0 kyi_5 sbyin_9 ba_15 dbang_20 du_26 byed_29 nas_34 
T06D4044:143a-6	dris kyang rung ma dris kyang rung zhes bya ba la sogs pas bstan to //	'dri_0 kyang_5 rung_11 ma_16 'dri_19 kyang_24 rung_30 zhes_35 byed_40 ba_44 la_47 sogs_50 ba_55 ston_59 to_65 
T06D4044:143a-7	mi 'jigs pa sbyin pa'i dbang du byas nas bstan pa ni /	mi_0 'jigs_3 ba_9 sbyin_12 ba_18 dbang_23 du_29 byed_32 nas_37 ston_41 ba_47 ni_50 
T06D4044:143a-8	rgyal po dang dgra zhes bya ba la sogs pas bstan te /	rgyal_0 po_6 dang_9 dgra_14 zhes_19 byed_24 ba_28 la_31 sogs_34 ba_39 ston_43 te_49 
T06D4044:143a-9	mi 'jigs pa la rjes su sbyin pa lus sam	mi_0 'jigs_3 ba_9 la_12 rjes_15 su_20 sbyin_23 ba_29 lus_32 sam_36 
T06D4044:143a-10	ngag gis bdag gi dngos po nyams pa las yongs	ngag_0 gis_5 bdag_9 gi_14 dngos_17 po_23 nyams_26 ba_32 las_35 yongs_39 
T06D4044:143a-11	su bsrung pa'o // longs spyod nyams pa la mi 'jigs pa sbyin pa ni /	su_0 bsrung_3 ba_10 longs_18 spyod_24 nyams_30 ba_36 la_39 mi_42 'jigs_45 ba_51 sbyin_54 ba_60 ni_63 
T06D4044:143a-12	gtams zhes bya ba la sogs pa la /	gtams_0 zhes_6 byed_11 ba_15 la_18 sogs_21 ba_26 la_29 
