T06D4044:171b-14	mngon par rdzogs par sangs rgyas zhes bya ba'o //	mngon_0 ba_6 rdzogs_10 ba_17 sangs_21 rgya_27 zhes_33 byed_38 ba_42 
T06D4044:171b-15	bdud dpung dang bcas pa thams cad kyi g-yul chen po bcom pas na bcom ldan 'das te /	bdud_0 dpung_5 dang_11 'cha'_16 ba_21 thams_24 cad_30 kyi_34 g-yul_38 chen_44 po_49 'joms_52 ba_57 na_61 'joms_64 ldan_69 'da'_74 te_79 
T06D4044:171b-16	bcom ldan 'das nyag gcig 'jig rten gyi khams thams cad du 'byung zhes bya ba ni /	'joms_0 ldan_5 'da'_10 nyag_15 gcig_20 'jig_25 rten_30 gyi_35 khams_39 thams_45 cad_51 du_55 'byung_58 zhes_65 byed_70 ba_74 ni_77 
T06D4044:171b-17	sde pa gzhan kha cig gi 'dod pa'o //	sde_0 ba_4 gzhan_7 kha_13 cig_17 gi_21 'dod_24 ba_29 
T06D4044:171b-18	de'i lan du brtsams pa ni /	de_0 lan_5 du_9 brtsams_12 ba_20 ni_23 
T06D4044:171b-19	de la bskal pa du mar yang sangs rgyas gcig kyang mi 'byung zhes bya ba la sogs pa'o //	de_0 la_3 bskal_6 ba_12 du_15 mar_18 yang_22 sangs_27 rgya_33 gcig_39 kyang_44 mi_50 'byung_53 zhes_60 byed_65 ba_69 la_72 sogs_75 ba_80 
T06D4044:171b-20	rang bzhin gyis nyon mongs pa mang ba'i rgyud dang /	rang_0 bzhin_5 gyis_11 nyon_16 mongs_21 ba_27 mang_30 ba_35 brgyud_40 dang_46 
T06D4044:171b-21	shes rab 'chal pa'i rgyud kyis kyang bla na med	shes_0 rab_5 'chal_9 ba_15 brgyud_20 kyis_26 kyang_31 bla_37 na_41 med_44 
T06D4044:171b-22	pa yang dag par rdzogs pa'i byang chub mngon par	ba_0 yang_3 'dag_8 ba_12 rdzogs_16 ba_23 byang_28 chub_34 mngon_39 ba_45 
T06D4044:171b-23	rdzogs par 'tshang rgya bar mi nus zhes bya ba	rdzogs_0 ba_7 'tshang_11 rgya_19 ba_24 mi_28 nus_31 zhes_35 byed_40 ba_44 
T06D4044:171b-24	ni / nyon mongs pa dang shes bya'i sgrib pas	ni_0 nyon_5 mongs_10 ba_16 dang_19 shes_24 byed_29 sgrib_35 ba_41 
T06D4044:171b-25	zil gyis mnan pa'i phyir sangs rgyas dang byang chub	zil_0 gyis_4 gnon_9 ba_14 phyir_19 sangs_25 rgya_31 dang_37 byang_42 chub_48 
T06D4044:171b-26	sems dpa' rnams kyis zhes bya ba'i don to //	sems_0 dpa'_5 rnams_10 kyis_16 zhes_21 byed_26 ba_30 don_35 to_39 
T06D4044:171b-27	ngo bo nyid kyis zhes bya ba la sogs pa la /	ngo_0 'bo_4 nyid_7 kyis_12 zhes_17 byed_22 ba_26 la_29 sogs_32 ba_37 la_40 
T06D4044:171b-28	byang chub kyi le'u'i bsdus pa'i don dang go rims	byang_0 chub_6 kyi_11 le'i_15 sdud_22 ba_28 don_33 dang_37 go_42 rims_45 
T06D4044:171b-29	dag ni 'di nyid du nye bar bstan zin pa'i	'dag_0 ni_4 'di_7 nyid_11 du_16 nye_19 ba_23 ston_27 zin_33 ba_37 
T06D4044:171b-30	phyir / yang nye bar bstan par bya ba ma yin pas des na ma bris so //	phyir_0 yang_8 nye_13 ba_17 ston_21 ba_27 byed_31 ba_35 ma_38 yin_41 ba_45 des_49 na_53 ma_56 'bri_59 so_64 
T06D4044:171b-31	byang chub sems dpa' sa'i gzhi'i rnal 'byor gyi gnas	byang_0 chub_6 sems_11 dpa'_16 sa_21 gzhi_26 rnal_33 'byor_38 gyi_44 gnas_48 
T06D4044:171b-32	las byang chub sems dpa'i rim par phye ba ste	las_0 byang_4 chub_10 sems_15 dpa_20 rim_26 ba_30 'byed_34 ba_39 ste_42 
T06D4044:171b-33	bdun pa rdzogs so /	bdun_0 ba_5 rdzogs_8 so_15 
T06D4044:171b-35	// / sdom ni /	sdom_5 ni_10 
T06D4044:171b-36	mos pa mang po nyid dang ni //	mos_0 ba_4 mang_7 po_12 nyid_15 dang_20 ni_25 
T06D4044:171b-37	chos tshol ba dang ston pa dang //	chos_0 tshol_5 ba_11 dang_14 ston_19 ba_24 dang_27 
T06D4044:171b-38	sgrub pa dang ni de bzhin du //	sgrub_0 ba_6 dang_9 ni_14 de_17 bzhin_20 du_26 
T06D4044:171b-39	legs par gdams ngag rjes bstan dang //	legs_0 ba_5 'doms_9 ngag_15 rjes_20 ston_25 dang_31 
T06D4044:171b-40	lus dang ngag dang yid kyi las //	lus_0 dang_4 ngag_9 dang_14 yid_19 kyi_23 las_27 
T06D4044:172a-0	thabs dang bcas pa phyi ma @172a * //	thabs_0 dang_6 'cha'_11 ba_16 phyi_19 ma_24 
T06D4044:172a-1	yin ;	yin_0 
T06D4044:172a-2	/ zhes bya ba ni /	zhes_2 byed_7 ba_11 ni_14 
T06D4044:172a-3	ji ltar bslab pa'i dbang du byas pa yin la /	ji_0 ltar_3 bslab_8 ba_14 dbang_19 du_25 byed_28 ba_33 yin_36 la_40 
T06D4044:172a-4	byang chub sems dpa' gang la bslab par bya ba ni sngar bstan zin to //	byang_0 chub_6 sems_11 dpa'_16 gang_21 la_26 bslab_29 ba_35 byed_39 ba_43 ni_46 sngar_49 ston_55 zin_61 to_65 
T06D4044:172a-5	bsdus pa'i don ston pa bdun po 'di dag gi bsdus pa'i don ni /	sdud_0 ba_6 don_11 ston_15 ba_20 bdun_23 po_28 'di_31 'dag_35 gi_39 sdud_42 ba_48 don_53 ni_57 
T06D4044:172a-6	bdag nyid ji ltar slob pa dang /	bdag_0 nyid_5 ji_10 ltar_13 slob_18 ba_23 dang_26 
T06D4044:172a-7	gzhan dag la yang zhes bya ba ni bsdus pa'i don to //	gzhan_0 'dag_6 la_10 yang_13 zhes_18 byed_23 ba_27 ni_30 sdud_33 ba_39 don_44 to_48 
T06D4044:172a-8	de la bdag nyid slob par byed pa ni /	de_0 la_3 bdag_6 nyid_11 slob_16 ba_21 byed_25 ba_30 ni_33 
T06D4044:172a-9	byang chub sems dpa' chos kyis rjes su 'brang ba dang /	byang_0 chub_6 sems_11 dpa'_16 chos_21 kyis_26 rjes_31 su_36 'brang_39 ba_46 dang_49 
T06D4044:172a-10	dad pas rjes su 'brang ba'o //	dad_0 ba_4 rjes_8 su_13 'brang_16 ba_23 
T06D4044:172a-11	de la chos kyis rjes su 'brang ba ni rnam pa gsum du slob ste /	de_0 la_3 chos_6 kyis_11 rjes_16 su_21 'brang_24 ba_31 ni_34 rnam_37 ba_42 gsum_45 du_50 slob_53 ste_58 
T06D4044:172a-12	mos pa mang po nyid kyi bsam pa'i rgyun nyid dang /	mos_0 ba_4 mang_7 po_12 nyid_15 kyi_20 bsam_24 ba_29 rgyun_34 nyid_40 dang_45 
T06D4044:172a-13	sbyor ba nyid dang /	sbyor_0 ba_6 nyid_9 dang_14 
T06D4044:172a-14	chos tshol ba la sbyor ba nyid la'o //	chos_0 tshol_5 ba_11 la_14 sbyor_17 ba_23 nyid_26 la_31 
T06D4044:172a-15	dad pas rjes su 'brang ba ni rnam pa bzhi ste /	dad_0 ba_4 rjes_8 su_13 'brang_16 ba_23 ni_26 rnam_29 ba_34 bzhi_37 ste_42 
T06D4044:172a-16	bdag nyid kyis bslab pa'i sngar chos kyis rjes su	bdag_0 nyid_5 kyis_10 bslab_15 ba_21 sngar_26 chos_32 kyis_37 rjes_42 su_47 
T06D4044:172a-17	'brang ba la bstan pa'i bslab pa rnam pa gsum	'brang_0 ba_7 la_10 ston_13 ba_19 bslab_24 ba_30 rnam_33 ba_38 gsum_41 
T06D4044:172a-18	dang / bzhi pa gdams ngag rjes su bstan pa 'dzin pa'o //	dang_0 bzhi_7 ba_12 'doms_15 ngag_21 rjes_26 su_31 ston_34 ba_40 'dzin_43 ba_49 
T06D4044:172a-19	gzhan bslab pa yang rnam pa gnyis te /	gzhan_0 bslab_6 ba_12 yang_15 rnam_20 ba_25 gnyis_28 te_34 
T06D4044:172a-20	gzhan rnam pa gnyis ni zhugs pa dang ma zhugs pa zhes bya ba'o //	gzhan_0 rnam_6 ba_11 gnyis_14 ni_20 'jug_23 ba_29 dang_32 ma_37 'jug_40 ba_46 zhes_49 byed_54 ba_58 
T06D4044:172a-21	de la gzhan zhugs pa dbang po rnon po la bstan pa dang /	de_0 la_3 gzhan_6 'jug_12 ba_18 dbang_21 po_27 rnon_30 po_35 la_38 ston_41 ba_47 dang_50 
T06D4044:172a-22	dad pas rjes su 'brang ba la bstan cing gdams ngag rjes su bstan pa'o //	dad_0 ba_4 rjes_8 su_13 'brang_16 ba_23 la_26 ston_29 cing_35 'doms_40 ngag_46 rjes_51 su_56 ston_59 ba_65 
T06D4044:172a-23	ma zhugs pa rnams la ni /	ma_0 'jug_3 ba_9 rnams_12 la_18 ni_21 
T06D4044:172a-24	lus dang ngag dang yid kyi las dang /	lus_0 dang_4 ngag_9 dang_14 yid_19 kyi_23 las_27 dang_31 
T06D4044:172a-25	thabs dang bcas pa zhes bya ba ste /	thabs_0 dang_6 'cha'_11 ba_16 zhes_19 byed_24 ba_28 ste_31 
T06D4044:172a-26	de la dang por bdag nyid mos pa la slob par byed do //	de_0 la_3 dang_6 por_11 bdag_15 nyid_20 mos_25 ba_29 la_32 slob_35 ba_40 byed_44 do_49 
T06D4044:172a-27	de nas ni chos tshol lo //	de_0 nas_3 ni_7 chos_10 tshol_15 lo_21 
T06D4044:172a-28	de nas ni bsgrub ste /	de_0 nas_3 ni_7 sgrub_10 ste_17 
T06D4044:172a-29	chos kyis rjes su 'brang ba ni de ltar bdag	chos_0 kyis_5 rjes_10 su_15 'brang_18 ba_25 ni_28 de_31 ltar_34 bdag_39 
T06D4044:172a-30	nyid gang dang gang la slob pa de la gzhan	nyid_0 gang_5 dang_10 gang_15 la_20 slob_23 ba_28 de_31 la_34 gzhan_37 
T06D4044:172a-31	dag kyang 'dzud par byed de /	'dag_0 kyang_4 'dzud_10 ba_16 byed_20 de_25 
T06D4044:172a-32	bdag nyid kyang mos pa la slob par byed /	bdag_0 nyid_5 kyang_10 mos_16 ba_20 la_23 slob_26 ba_31 byed_35 
T06D4044:172a-33	chos tshol bar byed la /	chos_0 tshol_5 ba_11 byed_15 la_20 
T06D4044:172a-34	gzhan pha rol dag la yang mos pa bskyed par bya ba'i don du chos ston par byed do //	gzhan_0 pha_6 rol_10 'dag_14 la_18 yang_21 mos_26 ba_30 skyed_33 ba_40 byed_44 ba_48 don_53 du_57 chos_60 ston_65 ba_70 byed_74 do_79 
T06D4044:172a-35	bdag nyid kyi sgrub par byed cing gzhan dag gis	bdag_0 nyid_5 kyi_10 sgrub_14 ba_20 byed_24 cing_29 gzhan_34 'dag_40 gis_44 
T06D4044:172a-36	kyang rtogs par bya ba'i phyir gdams ngag dang rjes	kyang_0 rtogs_6 ba_12 byed_16 ba_20 phyir_25 'doms_31 ngag_37 dang_42 rjes_47 
T06D4044:172a-37	su bstan pa sbyin pa ste /	su_0 ston_3 ba_9 sbyin_12 ba_18 ste_21 
T06D4044:172a-38	de ltar re zhig zhugs pa rnams kyi'o //	de_0 ltar_3 re_8 'jig_11 'jug_16 ba_22 rnams_25 kyi_31 
T06D4044:172a-39	yang ma zhugs pa rnams la ni bdag nyid bsgrub	yang_0 ma_5 'jug_8 ba_14 rnams_17 la_23 ni_26 bdag_29 nyid_34 sgrub_39 
T06D4044:172a-40	pa la slob pa ni lus dang ngag dang yid	ba_0 la_3 slob_6 ba_11 ni_14 lus_17 dang_21 ngag_26 dang_31 yid_36 
T06D4044:172a-41	kyi las thabs dang bcas pa la slob par byed	kyi_0 las_4 thabs_8 dang_14 'cha'_19 ba_24 la_27 slob_30 ba_35 byed_39 
T06D4044:172a-42	pa nyid do // go rims de dag gi bsdus pa'i don de la /	ba_0 nyid_3 do_8 go_14 rims_17 de_22 'dag_25 gi_29 sdud_32 ba_38 don_43 de_47 la_50 
T06D4044:172a-43	ji ltar na byang chub sems dpa'i mos pa mang ba yin zhe na zhes bya ba la /	ji_0 ltar_3 na_8 byang_11 chub_17 sems_22 dpa_27 mos_33 ba_37 mang_40 ba_45 yin_48 zhe_52 na_56 zhes_59 byed_64 ba_68 la_71 
T06D4044:172a-44	'di'i bsdus pa'i don ni gang la mos pa spyad pa dang gang gis mos pa zhes bya ba'o //	'di_0 sdud_6 ba_12 don_17 ni_21 gang_24 la_29 mos_32 ba_36 spyod_39 ba_45 dang_48 gang_53 gis_58 mos_62 ba_66 zhes_69 byed_74 ba_78 
T06D4044:172a-45	dad pa dang dang ba sngon du 'gro bas te /	dad_0 ba_4 dang_7 dang_12 ba_17 sngon_20 du_26 'gro_29 ba_34 te_38 
T06D4044:172b-0	dad pa'i mtshan nyid @172b ni dad ba'o //	dad_0 ba_4 mtshan_9 nyid_16 ni_27 dad_30 ba_34 
T06D4044:172b-1	nges pa gang la de sngon du 'gro ba yod	nges_0 ba_5 gang_8 la_13 de_16 sngon_19 du_25 'gro_28 ba_33 yod_36 
T06D4044:172b-2	pa ni rgyu des na 'dod pa skye bar 'gyur	ba_0 ni_3 rgyu_6 des_11 na_15 'dod_18 ba_23 skye_26 ba_31 'gyur_35 
T06D4044:172b-3	la / de dang ldan pa'i mos pa gang yin zhe na /	la_0 de_5 dang_8 ldan_13 ba_18 mos_23 ba_27 gang_30 yin_35 zhe_39 na_43 
T06D4044:172b-4	nges pa'i dngos po la de nyid du nges par 'dzin pa'i mtshan nyid do //	nges_0 ba_5 dngos_10 po_16 la_19 de_22 nyid_25 du_30 nges_33 ba_38 'dzin_42 ba_48 mtshan_53 nyid_60 do_65 
T06D4044:172b-5	mos pa'i gnas rnam pa brgyad ni /	mos_0 ba_4 gnas_9 rnam_14 ba_19 brgyad_22 ni_29 
T06D4044:172b-6	dkon mchog dang /	dkon(d)_0 mchog_5 dang_11 
T06D4044:172b-7	yon tan la sogs pa'i //	yon_0 tan_4 la_8 sogs_11 ba_16 
T06D4044:172b-8	mos pa'i gnas brgyad po mdor bsdus pa ni /	mos_0 ba_4 gnas_9 brgyad_14 po_21 mdor_24 sdud_29 ba_35 ni_38 
T06D4044:172b-9	mchog la mos pa dang /	mchog_0 la_6 mos_9 ba_13 dang_16 
T06D4044:172b-10	zab cing rgya che ba la mos pa dang /	zab_0 cing_4 rgya_9 che_14 ba_18 la_21 mos_24 ba_28 dang_31 
T06D4044:172b-11	rgyu dang 'bras bu'i mtshan nyid can gyi tshogs la mos pa dang /	rgyu_0 dang_5 'bras_10 bu_16 mtshan_21 nyid_28 can_33 gyi_37 tshogs_41 la_48 mos_51 ba_55 dang_58 
T06D4044:172b-12	thob par bya ba la mos pa'o //	'thob_0 ba_5 byed_9 ba_13 la_16 mos_19 ba_23 
T06D4044:172b-13	sangs rgyas dkon mchog gi yon tan la mos pa ni /	sangs_0 rgya_6 dkon(d)_12 mchog_17 gi_23 yon_26 tan_30 la_34 mos_37 ba_41 ni_44 
T06D4044:172b-14	thob par bya ba la mos pa'o //	'thob_0 ba_5 byed_9 ba_13 la_16 mos_19 ba_23 
T06D4044:172b-15	sgrub pa'i thabs ni sgrub pa'i chos thob ba'i thabs	sgrub_0 ba_6 thabs_11 ni_17 sgrub_20 ba_26 chos_31 'thob_36 ba_41 thabs_46 
T06D4044:172b-16	su gyur pa legs par gsungs pa'i bstan pa'i chos	su_0 gyur_3 ba_8 legs_11 ba_16 gsungs_20 ba_27 ston_32 ba_38 chos_43 
T06D4044:172b-17	so // rnam grangs de las gzhan yang gnas la mos pa bstan pa dang /	so_0 rnam_6 grangs_11 de_18 las_21 gzhan_25 yang_31 gnas_36 la_41 mos_44 ba_48 ston_51 ba_57 dang_60 
T06D4044:172b-18	de'i rab tu dbye ba la mos pa ste /	de_0 rab_5 tu_9 'byed_12 ba_17 la_20 mos_23 ba_27 ste_30 
T06D4044:172b-19	'di ltar mdor bsdus pa gzhan gnas la mos pas bsten pa dang /	'di_0 ltar_4 mdor_9 sdud_14 ba_20 gzhan_23 gnas_29 la_34 mos_37 ba_41 sten_45 ba_51 dang_54 
T06D4044:172b-20	rab tu dbye ba la brten pa'o //	rab_0 tu_4 'byed_7 ba_12 la_15 rten_18 ba_24 
T06D4044:172b-21	'di ltar mdor bsdus pa gzhan yang dkon mchog gsum gyi yon tan dang /	'di_0 ltar_4 mdor_9 sdud_14 ba_20 gzhan_23 yang_29 dkon(d)_34 mchog_39 gsum_45 gyi_50 yon_54 tan_58 dang_62 
T06D4044:172b-22	de'i rab tu dbye ba la brten pa'o //	de_0 rab_5 tu_9 'byed_12 ba_17 la_20 rten_23 ba_29 
T06D4044:172b-23	de las gzhan yang bstan pa rnam pa bdun te /	de_0 las_3 gzhan_7 yang_13 ston_18 ba_24 rnam_27 ba_32 bdun_35 te_40 
T06D4044:172b-24	ji ltar byas nas she na sangs rgyas dang chos	ji_0 ltar_3 byed_8 nas_13 she_17 na_21 sangs_24 rgya_30 dang_36 chos_41 
T06D4044:172b-25	dang dge 'dun gyi yon tan la mos pa byas	dang_0 dge_5 'dun_9 gyi_14 yon_18 tan_22 la_26 mos_29 ba_33 byed_36 
T06D4044:172b-26	pa / sangs rgyas dang byang chub sems dpa'i mthu la mos pa dang ;	ba_0 sangs_5 rgya_11 dang_17 byang_22 chub_28 sems_33 dpa_38 mthu_44 la_49 mos_52 ba_56 dang_59 
T06D4044:172b-27	chos kyi yon tan la mos pa byas pa /	chos_0 kyi_5 yon_9 tan_13 la_17 mos_20 ba_24 byed_27 ba_32 
T06D4044:172b-28	de kho na'i don la mos pa ste /	de_0 kho_3 na_7 don_12 la_16 mos_19 ba_23 ste_26 
T06D4044:172b-29	don dam pa'i chos yin pa nyid kyis de kho na'i don to //	don_0 dam_4 ba_8 chos_13 yin_18 ba_22 nyid_25 kyis_30 de_35 kho_38 na_42 don_47 to_51 
T06D4044:172b-30	dge 'dun gyi yon tan la mos pa'i stobs nyid kyis rgyu dang 'bras bu la mos pa ste /	dge_0 'dun_4 gyi_9 yon_13 tan_17 la_21 mos_24 ba_28 stobs_33 nyid_39 kyis_44 rgyu_49 dang_54 'bras_59 bu_65 la_68 mos_71 ba_75 ste_78 
T06D4044:172b-31	rgyu 'di las 'bras bu 'di 'thob po zhes bya ba'o //	rgyu_0 'di_5 las_9 'bras_13 bu_19 'di_22 'thob_26 po_32 zhes_35 byed_40 ba_44 
T06D4044:172b-32	lam rab tu bsgom pa nyid kyis byang chub sems	lam_0 rab_4 tu_8 bsgom_11 ba_17 nyid_20 kyis_25 byang_30 chub_36 sems_41 
T06D4044:172b-33	dpa' gnas skabs kyi thob par bya ba la mos	dpa'_0 gnas_5 skabs_10 kyi_16 'thob_20 ba_25 byed_29 ba_33 la_36 mos_39 
T06D4044:172b-34	pa ste / sangs rgyas dkon mchog gi yon tan la mos pa las rab tu byung ba'o /	ba_0 ste_3 sangs_9 rgya_15 dkon(d)_21 mchog_26 gi_32 yon_35 tan_39 la_43 mos_46 ba_50 las_53 rab_57 tu_61 'byung_64 ba_70 
T06D4044:172b-35	chos dkon mchog gi yon tan la mos pa las	chos_0 dkon(d)_5 mchog_10 gi_16 yon_19 tan_23 la_27 mos_30 ba_34 las_37 
T06D4044:172b-36	byung ba ni thob par bya ba'i thabs la mos	'byung_0 ba_6 ni_9 'thob_12 ba_17 byed_21 ba_25 thabs_30 la_36 mos_39 
T06D4044:172b-37	pa'o // 'dir thob pa'i thabs ni sgrub pa'i chos te /	ba_0 'dir_8 'thob_13 ba_18 thabs_23 ni_29 sgrub_32 ba_38 chos_43 te_48 
T06D4044:172b-38	byang chub kyi phyogs kyi chos thams cad do //	byang_0 chub_6 kyi_11 phyogs_15 kyi_22 chos_26 thams_31 cad_37 do_41 
T06D4044:172b-39	legs par gsungs pa la mos pa ni /	legs_0 ba_5 gsungs_9 ba_16 la_19 mos_22 ba_26 ni_29 
T06D4044:172b-40	chos dkon mchog gi yon tan la mos pa byas pa nyid de /	chos_0 dkon(d)_5 mchog_10 gi_16 yon_19 tan_23 la_27 mos_30 ba_34 byed_37 ba_42 nyid_45 de_50 
T06D4044:172b-41	bstan pa'i chos la chos zhes byas nas so //	ston_0 ba_6 chos_11 la_16 chos_19 zhes_24 byed_29 nas_34 so_38 
T06D4044:172b-42	mos pa la goms pa lan mang du byed pa dang zhes bya ba ni /	mos_0 ba_4 la_7 goms_10 ba_15 lan_18 mang_22 du_27 byed_30 ba_35 dang_38 zhes_43 byed_48 ba_52 ni_55 
T06D4044:172b-43	ji srid bzod pa chen po ma bskyed kyi bar du'o //	ji_0 srid_3 bzod_8 ba_13 chen_16 po_21 ma_24 skyed_27 kyi_34 ba_38 du_42 
T06D4044:173a-0	bzod @173a * //	bzod_0 
T06D4044:173a-1	pa drag po yod pa ni lhag pa'i bsam pa dag pa nye bar gnas pa'i gnas skabs su /	ba_0 drag_3 po_8 yod_11 ba_15 ni_18 lhag_21 ba_26 bsam_31 ba_36 'dag_39 ba_43 nye_46 ba_50 gnas_54 ba_59 gnas_64 skabs_69 su_75 
T06D4044:173a-2	rgyu dang 'bras bu yang dag par ston pa'i rnam pa zhes bya ba la /	rgyu_0 dang_5 'bras_10 bu_16 yang_19 'dag_24 ba_28 ston_32 ba_37 rnam_42 ba_47 zhes_50 byed_55 ba_59 la_62 
T06D4044:173a-3	yang dag par zhes bya ba ni /	yang_0 'dag_5 ba_9 zhes_13 byed_18 ba_22 ni_25 
T06D4044:173a-4	phyin ci ma log pa'o //	phyin_0 ci_6 ma_9 log_12 ba_16 
T06D4044:173a-5	rgyu dang 'bras bu ni rjes su mthun pa zhes bya ba'i don to //	rgyu_0 dang_5 'bras_10 bu_16 ni_19 rjes_22 su_27 mthun_30 ba_36 zhes_39 byed_44 ba_48 don_53 to_57 
T06D4044:173a-6	byas pa chud mi za zhing bsal bar byed ces bya ba la /	byed_0 ba_5 chud_8 mi_13 za_16 zhing_19 bsal_25 ba_30 byed_34 ces_39 byed_43 ba_47 la_50 
T06D4044:173a-7	byas pa'i las rnams kyis nges par 'bras bu sbyin pa'o //	byed_0 ba_5 las_10 rnams_14 kyis_20 nges_25 ba_30 'bras_34 bu_40 sbyin_43 ba_49 
T06D4044:173a-8	ma byas pa dang phrad par mi 'gyur ba zhes bya ba ni /	ma_0 byed_3 ba_8 dang_11 'phrad_16 ba_22 mi_26 'gyur_29 ba_35 zhes_38 byed_43 ba_47 ni_50 
T06D4044:173a-9	ma byas pa'i las rnams las 'bras bu 'byung bar mi 'gyur ba'o //	ma_0 byed_3 ba_8 las_13 rnams_17 las_23 'bras_27 bu_33 'byung_36 ba_43 mi_47 'gyur_50 ba_56 
T06D4044:173a-10	pha rol klan ka tshol ba brjod pa'i yon tan ston pa'i rnam pa dang zhes bya ba ni /	pha_0 rol_4 klan_8 ka_13 tshol_16 ba_22 rjod_25 ba_31 yon_36 tan_40 ston_44 ba_49 rnam_54 ba_59 dang_62 zhes_67 byed_72 ba_76 ni_79 
T06D4044:173a-11	klan ka tshol ba zhes bya ba la /	klan_0 ka_5 tshol_8 ba_14 zhes_17 byed_22 ba_26 la_29 
T06D4044:173a-12	'dir nye bar zhes bya ba'i sgra ni nye bar bsgyur ba'am brnyas pa ste /	'dir_0 nye_5 ba_9 zhes_13 byed_18 ba_22 sgra_27 ni_32 nye_35 ba_39 sgyur_43 ba_50 brnyas_56 ba_63 ste_66 
T06D4044:173a-13	'di ltar nyes pa brjod cing rgol ba dang /	'di_0 ltar_4 nyes_9 ba_14 rjod_17 cing_23 rgol_28 ba_33 dang_36 
T06D4044:173a-14	skyon nas brjod cing nye bar brjod pa'am /	skyon_0 nas_6 rjod_10 cing_16 nye_21 ba_25 rjod_29 ba_35 
T06D4044:173a-15	gzhan dag la brnyas pa'i tshig gis skyon brjod cing smras pa'o //	gzhan_0 'dag_6 la_10 brnyas_13 ba_20 tshig_25 gis_31 skyon_35 rjod_41 cing_47 smras_52 ba_58 
T06D4044:173a-16	de nyid ni phan yon te /	de_0 nyid_3 ni_8 phan_11 yon_16 te_20 
T06D4044:173a-17	des ston pa'i rnam pa'o //	des_0 ston_4 ba_9 rnam_14 ba_19 
T06D4044:173a-18	'di lta bu smra ba las zhes bya ba la /	'di_0 lta_4 bu_8 smra_11 ba_16 las_19 zhes_23 byed_28 ba_32 la_35 
T06D4044:173a-19	gzhan las 'os pa ni 'di lta bu smras pa'o //	gzhan_0 las_6 'os_10 ba_14 ni_17 'di_20 lta_24 bu_28 smras_31 ba_37 
T06D4044:173a-20	de lta bu las thar pa ni de lta bu smra ba las thar pa'o //	de_0 lta_3 bu_7 las_10 thar_14 ba_19 ni_22 de_25 lta_28 bu_32 smra_35 ba_40 las_43 thar_47 ba_52 
T06D4044:173a-21	de nyid ni phan yon te /	de_0 nyid_3 ni_8 phan_11 yon_16 te_20 
T06D4044:173a-22	gzhan dag gi smras pa ni skyon 'di dang 'di lta bu zhes bya ba'i don to //	gzhan_0 'dag_6 gi_10 smras_13 ba_19 ni_22 skyon_25 'di_31 dang_35 'di_40 lta_44 bu_48 zhes_51 byed_56 ba_60 don_65 to_69 
T06D4044:173a-23	skad kyi dbyings kyi ngo bo sgrub pa rnam par	skad_0 kyi_5 dbyings_9 kyi_17 ngo_21 'bo_25 sgrub_28 ba_34 rnam_37 ba_42 
T06D4044:173a-24	gzhag pa ston pa'i rnam pa zhes bya ba la	'jog_0 ba_6 ston_9 ba_14 rnam_19 ba_24 zhes_27 byed_32 ba_36 la_39 
T06D4044:173a-25	/ dbyings kyi ngo bo rnam par gzhag pa ni dbyings kyi ngo bo rnam par gzhag pa ste /	dbyings_2 kyi_10 ngo_14 'bo_18 rnam_21 ba_26 'jog_30 ba_36 ni_39 dbyings_42 kyi_50 ngo_54 'bo_58 rnam_61 ba_66 'jog_70 ba_76 ste_79 
T06D4044:173a-26	dbyings kyi ngo bo 'di zhes rnam par gzhag pa de ston pa'i rnam pa'o //	dbyings_0 kyi_8 ngo_12 'bo_16 'di_19 zhes_23 rnam_28 ba_33 'jog_37 ba_43 de_46 ston_49 ba_54 rnam_59 ba_64 
T06D4044:173a-27	tshig legs par sbyar ba ni legs par sbyar ba'i brjod pa ste /	tshig_0 legs_6 ba_11 sbyor_15 ba_21 ni_24 legs_27 ba_32 sbyor_36 ba_42 rjod_47 ba_53 ste_56 
T06D4044:173a-28	phan yon no //	phan_0 yon_5 no_9 
T06D4044:173a-29	dbyangs sam yi ge nyams pa dang ldan pa'i sngags kyis ni /	dbyangs_0 sam_8 yi_12 ge_15 nyams_18 ba_24 dang_27 ldan_32 ba_37 sngags_42 kyis_49 ni_54 
T06D4044:173a-30	nyams pas don mi 'grub ste /	nyams_0 ba_6 don_10 mi_14 'grub_17 ste_23 
T06D4044:173a-31	ngag gi rdo rje des sgrub pa po nyid nyams par byed do //	ngag_0 gi_5 rdo_8 rje_12 des_16 sgrub_20 ba_26 po_29 nyid_32 nyams_37 ba_43 byed_47 do_52 
T06D4044:173a-32	de ston pa'i rnam pa ni legs par sbyar ba'i thabs kyis te /	de_0 ston_3 ba_8 rnam_13 ba_18 ni_21 legs_24 ba_29 sbyor_33 ba_39 thabs_44 kyis_50 te_55 
T06D4044:173a-33	'di lta bu'i phan yon ston pa'i rnam pa'o //	'di_0 lta_4 bu_8 phan_13 yon_18 ston_22 ba_27 rnam_32 ba_37 
T06D4044:173a-34	nad la mkhas pa ston pa'i rnam pa dang zhes bya ba la /	nad_0 la_4 mkhas_7 ba_13 ston_16 ba_21 rnam_26 ba_31 dang_34 zhes_39 byed_44 ba_48 la_51 
T06D4044:173a-35	nad 'di'i ming ni 'di'o zhes bya bar nad de la mkhas pa'o //	nad_0 'di_4 ming_10 ni_15 'di_18 zhes_24 byed_29 ba_33 nad_37 de_41 la_44 mkhas_47 ba_53 
T06D4044:173a-36	nad ci las byung ba la mkhas pa ston pa'i rnam pa dang zhes bya ba la /	nad_0 ci_4 las_7 'byung_11 ba_17 la_20 mkhas_23 ba_29 ston_32 ba_37 rnam_42 ba_47 dang_50 zhes_55 byed_60 ba_64 la_67 
T06D4044:173a-37	'di las kun du byung bas na nad kun du slong ba ni nad ci las byung ba'o //	'di_0 las_4 kun_8 du_12 'byung_15 ba_21 na_25 nad_28 kun_32 du_36 slong_39 ba_45 ni_48 nad_51 ci_55 las_58 'byung_62 ba_68 
T06D4044:173a-38	de la mkhas pa ste /	de_0 la_3 mkhas_6 ba_12 ste_15 
T06D4044:173b-0	mi 'phrod pa 'di las @173b nad 'di byung ngo zhes bya bar shes pa'o //	mi_0 'phrod_3 ba_10 'di_13 las_17 nad_27 'di_31 'byung_35 ngo_41 zhes_45 byed_50 ba_54 shes_58 ba_63 
T06D4044:173b-1	nad byung ba bsal ba la mkhas pa ston pa'i rnam pa dang zhes bya ba la /	nad_0 'byung_4 ba_10 bsal_13 ba_18 la_21 mkhas_24 ba_30 ston_33 ba_38 rnam_43 ba_48 dang_51 zhes_56 byed_61 ba_65 la_68 
T06D4044:173b-2	'dir sel bar byed pas na bsal ba ste /	'dir_0 sel_5 ba_9 byed_13 ba_18 na_22 bsal_25 ba_30 ste_33 
T06D4044:173b-3	nad bsal ba'o //	nad_0 bsal_4 ba_9 
T06D4044:173b-4	de la mkhas pa ni sman 'dis sos par byed do zhes bya bar shes pa'o //	de_0 la_3 mkhas_6 ba_12 ni_15 sman_18 'dis_23 sos_28 ba_32 byed_36 do_41 zhes_44 byed_49 ba_53 shes_57 ba_62 
T06D4044:173b-5	yang na bsal bar bya ba ni bsal ba ste /	yang_0 na_5 bsal_8 ba_13 byed_17 ba_21 ni_24 bsal_27 ba_32 ste_35 
T06D4044:173b-6	nye bar zhi bar bya ba zhes bya ba'i don to //	nye_0 ba_4 zhi_8 ba_12 byed_16 ba_20 zhes_23 byed_28 ba_32 don_37 to_41 
T06D4044:173b-7	nad nye bar zhi bar bya ba yin pas /	nad_0 nye_4 ba_8 zhi_12 ba_16 byed_20 ba_24 yin_27 ba_31 
T06D4044:173b-8	nad rab tu zhi ba nyid do //	nad_0 rab_4 tu_8 zhi_11 ba_15 nyid_18 do_23 
T06D4044:173b-9	rang rang gi bzo dang las kyi gnas grub pa'i	rang_0 rang_5 gi_10 bzo_13 dang_17 las_22 kyi_26 gnas_30 'grub_35 ba_40 
T06D4044:173b-10	'bras bu yongs su grub pa ston pa'i rnam pa	'bras_0 bu_6 yongs_9 su_15 'grub_18 ba_23 ston_26 ba_31 rnam_36 ba_41 
T06D4044:173b-11	zhes bya ba la /	zhes_0 byed_5 ba_9 la_12 
T06D4044:173b-12	rang rang gi bzo dang las kyi gnas sgrub pa ste /	rang_0 rang_5 gi_10 bzo_13 dang_17 las_22 kyi_26 gnas_30 sgrub_35 ba_41 ste_44 
T06D4044:173b-13	'bras bu 'di yongs su grub pa ni 'di las yongs su sgrub pa'o //	'bras_0 bu_6 'di_9 yongs_13 su_19 'grub_22 ba_27 ni_30 'di_33 las_37 yongs_41 su_47 sgrub_50 ba_56 
T06D4044:173b-14	zhes ston pa'i rnam pa'o //	zhes_0 ston_5 ba_10 rnam_15 ba_20 
T06D4044:173b-15	phyin ci ma log pa'i rgyu rnam par gzhag pa dang /	phyin_0 ci_6 ma_9 log_12 ba_16 rgyu_21 rnam_26 ba_31 'jog_35 ba_41 dang_44 
T06D4044:173b-16	rgyu thams cad bsdus pa zhes bya ba la /	rgyu_0 thams_5 cad_11 sdud_15 ba_21 zhes_24 byed_29 ba_33 la_36 
T06D4044:173b-17	rgyu rnams ji ltar yod pa nyid dang /	rgyu_0 rnams_5 ji_11 ltar_14 yod_19 ba_23 nyid_26 dang_31 
T06D4044:173b-18	ji snyed yod pa nyid de sems can gyi 'jig	ji_0 snyed_3 yod_9 ba_13 nyid_16 de_21 sems_24 can_29 gyi_33 'jig_37 
T06D4044:173b-19	rten las brtsams nas kun nas nyon mongs pa'am rnam	rten_0 las_5 brtsams_9 nas_17 kun_21 nas_25 nyon_29 mongs_34 ba_40 rnam_46 
T06D4044:173b-20	par byang ba dag go //	ba_0 byang_4 ba_10 'dag_13 go_17 
T06D4044:173b-21	'jig rten pa'i yang de dag tu lo thog la	'jig_0 rten_5 ba_10 yang_15 de_20 'dag_23 tu_27 lo_30 thogs_33 la_38 
T06D4044:173b-22	sogs pa snod kyi 'jig rten gyi dbang du byas	sogs_0 ba_5 snod_8 kyi_13 'jig_17 rten_22 gyi_27 dbang_31 du_37 byed_40 
T06D4044:173b-23	nas / lhan cig byed pas de kun nas bslang ba'i rtsi la sogs pa dag go //	nas_0 lhan_6 cig_11 byed_15 ba_20 de_24 kun_27 nas_31 bslang_35 ba_42 rtsi_47 la_52 sogs_55 ba_60 'dag_63 go_67 
T06D4044:173b-24	ming dang zhes bya ba la skyes pa dang rta zhes bya ba la sogs pa'o //	ming_0 dang_5 zhes_10 byed_15 ba_19 la_22 skye_25 ba_31 dang_34 rta_39 zhes_43 byed_48 ba_52 la_55 sogs_58 ba_63 
T06D4044:173b-25	ming sngon du 'gro ba'i 'du shes zhes bya ba dang /	ming_0 sngon_5 du_11 'gro_14 ba_19 'du_24 shes_28 zhes_33 byed_38 ba_42 dang_45 
T06D4044:173b-26	'du shes sngon du 'gro ba'i brjod pa zhes bya ba la /	'du_0 shes_4 sngon_9 du_15 'gro_18 ba_23 rjod_28 ba_34 zhes_37 byed_42 ba_46 la_49 
T06D4044:173b-27	'di ni skyes pa /	'di_0 ni_4 skye_7 ba_13 
T06D4044:173b-28	'di ni rta zhes bya ba'i gzhan go bar byed pa'i tha snyad do //	'di_0 ni_4 rta_7 zhes_11 byed_16 ba_20 gzhan_25 go_31 ba_34 byed_38 ba_43 tha_48 snyad_52 do_58 
T06D4044:173b-29	chos de dang de dag gi rjes su tha snyad 'dogs pa'i rgyu ste /	chos_0 de_5 dang_8 de_13 'dag_16 gi_20 rjes_23 su_28 tha_31 snyad_35 'dogs_41 ba_47 rgyu_52 ste_57 
T06D4044:173b-30	rjes su ni nye bar sgyur ba'am /	rjes_0 su_5 ni_8 nye_11 ba_15 sgyur_19 ba_25 
T06D4044:173b-31	goms pa las rjes su tha snyad byed pa ste ;	goms_0 ba_5 las_8 rjes_12 su_17 tha_20 snyad_24 byed_30 ba_35 ste_38 
T06D4044:173b-32	goms pa nyid las tha snyad du byed pa'o //	goms_0 ba_5 nyid_8 las_13 tha_17 snyad_21 du_27 byed_30 ba_35 
T06D4044:173b-33	lag pa la ltos nas ni len pa yod pa nyid do //	lag_0 ba_4 la_7 ltos_10 nas_15 ni_19 len_22 ba_26 yod_29 ba_33 nyid_36 do_41 
