T06D4044:149b-29	smras pa /	smras_0 ba_6 
T06D4044:149b-30	rang gi don 'ba' zhig ni spang bar bya ba ste /	rang_0 gi_5 don_8 'ba'_12 'jig_17 ni_22 spong_25 ba_31 byed_35 ba_39 ste_42 
T06D4044:149b-31	ji ltar zhe na /	ji_0 ltar_3 zhe_8 na_12 
T06D4044:149b-32	byang chub sems dpa'i bya ba las shin tu 'das pa'i phyir te /	byang_0 chub_6 sems_11 dpa_16 byed_22 ba_26 las_29 shin_33 tu_38 'da'_41 ba_46 phyir_51 te_57 
T06D4044:149b-33	byang chub sems dpa'i bya ba ni gzhan gyi don la zhugs pa'i mtshan nyid can yin la /	byang_0 chub_6 sems_11 dpa_16 byed_22 ba_26 ni_29 gzhan_32 gyi_38 don_42 la_46 'jug_49 ba_55 mtshan_60 nyid_67 can_72 yin_76 la_80 
T06D4044:149b-34	de las rab tu 'das pa'i phyir ro //	de_0 las_3 rab_7 tu_11 'da'_14 ba_19 phyir_24 ro_30 
T06D4044:149b-35	gang gi phyir gzhan gyi don 'ba' zhig yongs su shes nas spang bar bya ba yin zhe na /	gang_0 gi_5 phyir_8 gzhan_14 gyi_20 don_24 'ba'_28 'jig_33 yongs_38 su_44 shes_47 nas_52 spong_56 ba_62 byed_66 ba_70 yin_73 zhe_77 na_81 
T06D4044:149b-36	smras pa /	smras_0 ba_6 
T06D4044:149b-37	rjes su mthun pa ma yin pa'i phyir te /	rjes_0 su_5 mthun_8 ba_14 ma_17 yin_20 ba_24 phyir_29 te_35 
T06D4044:149b-38	rjes su mthun pa ma yin pa ni bdag nyid	rjes_0 su_5 mthun_8 ba_14 ma_17 yin_20 ba_24 ni_27 bdag_30 nyid_35 
T06D4044:149b-39	byang chub 'thob pa dang 'gal ba nyid ces bya	byang_0 chub_6 'thob_11 ba_17 dang_20 'gal_25 ba_30 nyid_33 ces_38 byed_42 
T06D4044:149b-40	ba'i don to // bdag nyid byang chub thob na sems can gyi don byed pas so //	ba_0 don_5 to_9 bdag_15 nyid_20 byang_25 chub_31 'thob_36 na_41 sems_44 can_49 gyi_53 don_57 byed_61 ba_66 so_70 
T06D4044:149b-41	lhag ma rnams ni zhes bya ba ni /	lhag_0 ma_5 rnams_8 ni_14 zhes_17 byed_22 ba_26 ni_29 
T06D4044:150a-0	@150a * // 'ba' zhig las gang gzhan pa'o //	'ba'_11 'jig_16 las_21 gang_25 gzhan_30 ba_36 
T06D4044:150a-1	ji lta bu zhe na /	ji_0 lta_3 bu_7 zhe_10 na_14 
T06D4044:150a-2	gnyi ga'i don te de la ni bslab par bya ba'o //	gnyi_0 ga_5 don_10 te_14 de_17 la_20 ni_23 bslab_26 ba_32 byed_36 ba_40 
T06D4044:150a-3	nyes par spyad pa zhes bya ba ni /	nyes_0 ba_5 spyod_9 ba_15 zhes_18 byed_23 ba_27 ni_30 
T06D4044:150a-4	bdag gi bde ba 'dod pas so //	bdag_0 gi_5 bde_8 ba_12 'dod_15 ba_20 so_24 
T06D4044:150a-5	sangs rgyas dang byang chub sems dpa' bshad pa zhes bya ba ni /	sangs_0 rgya_6 dang_12 byang_17 chub_23 sems_28 dpa'_33 'chad_38 ba_44 zhes_47 byed_52 ba_56 ni_59 
T06D4044:150a-6	legs par bshad pa'i phyir gzung ba ste /	legs_0 ba_5 'chad_9 ba_15 phyir_20 gzung_26 ba_32 ste_35 
T06D4044:150a-7	rab tu bstan pa'i don to //	rab_0 tu_4 ston_7 ba_13 don_18 to_22 
T06D4044:150a-8	gzhan gyis bshad pa rnams ni tshol ba la sogs	gzhan_0 gyis_6 'chad_11 ba_17 rnams_20 ni_26 tshol_29 ba_35 la_38 sogs_41 
T06D4044:150a-9	pas bdag dang gzhan gyi don du yang mi 'gyur	ba_0 bdag_4 dang_9 gzhan_14 gyi_20 don_24 du_28 yang_31 mi_36 'gyur_39 
T06D4044:150a-10	bar bstan pa'i don to /	ba_0 ston_4 ba_10 don_15 to_19 
T06D4044:150a-11	de ni nyes par bshad pa nyid kyis ser sna	de_0 ni_3 nyes_6 ba_11 'chad_15 ba_21 nyid_24 kyis_29 ser_34 sna_38 
T06D4044:150a-12	med na yang gzhan gyi don du mi 'gyur bas	med_0 na_4 yang_7 gzhan_12 gyi_18 don_22 du_26 mi_29 'gyur_32 ba_38 
T06D4044:150a-13	so // gang gi phyir rang gi don las yang	so_0 gang_6 gi_11 phyir_14 rang_20 gi_25 don_28 las_32 yang_36 
T06D4044:150a-14	bzod pa yang dag par blangs nas gnas pa zhes	bzod_0 ba_5 yang_8 'dag_13 ba_17 blangs_21 nas_28 gnas_32 ba_37 zhes_40 
T06D4044:150a-15	mi gzung zhe na /	mi_0 gzung_3 zhe_9 na_13 
T06D4044:150a-16	bdag nyid mtho ris 'dod pa yin na yang mthong ba'i chos la yang gnyi ga'i don byed la /	bdag_0 nyid_5 mtho_10 ris_15 'dod_19 ba_24 yin_27 na_31 yang_34 mthong_39 ba_46 chos_51 la_56 yang_59 gnyi_64 ga_69 don_74 byed_78 la_83 
T06D4044:150a-17	pha rol du yang byed pas so //	pha_0 rol_4 du_8 yang_11 byed_16 ba_21 so_25 
T06D4044:150a-18	des na re zhig pha rol tu phyin pa lnga	des_0 na_4 re_7 'jig_10 pha_15 rol_19 tu_23 phyin_26 ba_32 lnga_35 
T06D4044:150a-19	'ba' zhig gi dbang du byas nas rang gi don	'ba'_0 'jig_5 gi_10 dbang_13 du_19 byed_22 nas_27 rang_31 gi_36 don_39 
T06D4044:150a-20	zhes bstan to // dge ba'i chos sdud pa'i tshul khrims kyi dbang du byas nas ;	zhes_0 ston_5 to_11 dge_17 ba_21 chos_26 sdud_31 ba_36 tshul_41 khrims_47 kyi_54 dbang_58 du_64 byed_67 nas_72 
T06D4044:150a-21	'jig rten gyi zang zing gi zhes bya ba la sogs pa ste /	'jig_0 rten_5 gyi_10 zang_14 zing_19 gi_24 zhes_27 byed_32 ba_36 la_39 sogs_42 ba_47 ste_50 
T06D4044:150a-22	'jig rten gyi zang zing gi 'bras bu 'dod pa zhes bya ba ni /	'jig_0 rten_5 gyi_10 zang_14 zing_19 gi_24 'bras_27 bu_33 'dod_36 ba_41 zhes_44 byed_49 ba_53 ni_56 
T06D4044:150a-23	gzhan pa pha rol du yang zhes bya ba'i don to //	gzhan_0 ba_6 pha_9 rol_13 du_17 yang_20 zhes_25 byed_30 ba_34 don_39 to_43 
T06D4044:150a-24	'jig rten gyi zang zing 'thob pa'i rgyur zhes bya ba ni /	'jig_0 rten_5 gyi_10 zang_14 zing_19 'thob_24 ba_30 rgyur_35 zhes_41 byed_46 ba_50 ni_53 
T06D4044:150a-25	mthong ba'i chos la'o //	mthong_0 ba_7 chos_12 la_17 
T06D4044:150a-26	de bzhin du mchod rten mchod pa yang bdag nyid	de_0 bzhin_3 du_9 mchod_12 rten_18 mchod_23 ba_29 yang_32 bdag_37 nyid_42 
T06D4044:150a-27	kyi don 'ba' zhig yin la gzhan gyi don med	kyi_0 don_4 'ba'_8 'jig_13 yin_18 la_22 gzhan_25 gyi_31 don_35 med_39 
T06D4044:150a-28	ce na / mchod rten mchod pas kyang res 'ga' gnyi ga'i don du yang 'gyur te /	ce_0 na_3 mchod_8 rten_14 mchod_19 ba_25 kyang_29 res_35 'ga'_39 gnyi_44 ga_49 don_54 du_58 yang_61 'gyur_66 te_72 
T06D4044:150a-29	'jig rten gyi zang zing gi 'bras bu 'dod pa dang /	'jig_0 rten_5 gyi_10 zang_14 zing_19 gi_24 'bras_27 bu_33 'dod_36 ba_41 dang_44 
T06D4044:150a-30	'jig rten gyi zang zing la ltos pa med par dge ba'i chos sdud pa dang /	'jig_0 rten_5 gyi_10 zang_14 zing_19 la_24 ltos_27 ba_32 med_35 ba_39 dge_43 ba_47 chos_52 sdud_57 ba_62 dang_65 
T06D4044:150a-31	bdag nyid kyi sangs rgyas kyi chos yongs su smin	bdag_0 nyid_5 kyi_10 sangs_14 rgya_20 kyi_26 chos_30 yongs_35 su_41 smin_44 
T06D4044:150a-32	par yang dag par gnas pa ni gnyi ga'i don	ba_0 yang_4 'dag_9 ba_13 gnas_17 ba_22 ni_25 gnyi_28 ga_33 don_38 
T06D4044:150a-33	nyid du yang 'gyur ro //	nyid_0 du_5 yang_8 'gyur_13 ro_19 
T06D4044:150a-34	rnyed pa 'dod pa zhes bya ba ni gzhan dag las mchog tu rnyed pa 'dod pa'o //	rnyed_0 ba_6 'dod_9 ba_14 zhes_17 byed_22 ba_26 ni_29 gzhan_32 'dag_38 las_42 mchog_46 tu_52 rnyed_55 ba_61 'dod_64 ba_69 
T06D4044:150a-35	rnyed pa'i rgyu zhes bya ba ni /	rnyed_0 ba_6 rgyu_11 zhes_16 byed_21 ba_25 ni_28 
T06D4044:150a-36	mthong ba la don med pa'i rnyed pa sgrub pa'o //	mthong_0 ba_7 la_10 don_13 med_17 ba_21 rnyed_26 ba_32 sgrub_35 ba_41 
T06D4044:150a-37	gzhan dag gi spro ba skyed pa zhes bya ba dang /	gzhan_0 'dag_6 gi_10 spro_13 ba_18 skyed_21 ba_27 zhes_30 byed_35 ba_39 dang_42 
T06D4044:150a-38	yang dag pa ma yin pa'i yon tan sna tshogs	yang_0 'dag_5 ba_9 ma_12 yin_15 ba_19 yon_24 tan_28 sna_32 tshogs_36 
T06D4044:150a-39	ston pa zhes bya ba la sogs pa rnams kyis	ston_0 ba_5 zhes_8 byed_13 ba_17 la_20 sogs_23 ba_28 rnams_31 kyis_37 
T06D4044:150a-40	ni gzhan gyi don med par zhes bstan par 'gyur	ni_0 gzhan_3 gyi_9 don_13 med_17 ba_21 zhes_25 ston_30 ba_36 'gyur_40 
T06D4044:150a-41	ro // gal te gzhan rnams yang dag par mgu	ro_0 gal_6 te_10 gzhan_13 rnams_19 yang_25 'dag_30 ba_34 mgu_38 
T06D4044:150a-42	bar 'gyur na gzhan gyi don yang yod par 'gyur	ba_0 'gyur_4 na_10 gzhan_13 gyi_19 don_23 yang_27 yod_32 ba_36 'gyur_40 
T06D4044:150a-43	ro // ro zhe na / de ni med par bstan pa yin te /	ro_0 ro_6 zhe_9 na_13 de_18 ni_21 med_24 ba_28 ston_32 ba_38 yin_41 te_45 
T06D4044:150b-0	de ltar na dge ba'i chos sdud pa nyid kyi tshul khrims @150b kyi dbang du byas pa'o //	de_0 ltar_3 na_8 dge_11 ba_15 chos_20 sdud_25 ba_30 nyid_33 kyi_38 tshul_42 khrims_48 kyi_61 dbang_65 du_71 byed_74 ba_79 
T06D4044:150b-1	bdag la bsnyen bkur bya ba zhes bya ba la	bdag_0 la_5 snyen_8 bkur_15 byed_20 ba_24 zhes_27 byed_32 ba_36 la_39 
T06D4044:150b-2	sogs pa ni sems can gyi don byed pa'i tshul	sogs_0 ba_5 ni_8 sems_11 can_16 gyi_20 don_24 byed_28 ba_33 tshul_38 
T06D4044:150b-3	khrims kyi dbang du byas pa'o //	khrims_0 kyi_7 dbang_11 du_17 byed_20 ba_25 
T06D4044:150b-4	bsnyen bkur bya ba bdag gir bya ba 'dod pas zhes bya ba ni bsam pa nyid kyis so //	snyen_0 bkur_7 byed_12 ba_16 bdag_19 gir_24 byed_28 ba_32 'dod_35 ba_40 zhes_44 byed_49 ba_53 ni_56 bsam_59 ba_64 nyid_67 kyis_72 so_77 
T06D4044:150b-5	bsnyen bkur bya ba bdag gir bya ba'i don du zhes bya ba ni /	snyen_0 bkur_7 byed_12 ba_16 bdag_19 gir_24 byed_28 ba_32 don_37 du_41 zhes_44 byed_49 ba_53 ni_56 
T06D4044:150b-6	sbyor ba dang gnyi ga dag la rang gi don to //	sbyor_0 ba_6 dang_9 gnyi_14 ga_19 'dag_22 la_26 rang_29 gi_34 don_37 to_41 
T06D4044:150b-7	chos ma yin pa nyid kyis yin gyi chos kyis ma yin zhes bya ba ni /	chos_0 ma_5 yin_8 ba_12 nyid_15 kyis_20 yin_25 gyi_29 chos_33 kyis_38 ma_43 yin_46 zhes_50 byed_55 ba_59 ni_62 
T06D4044:150b-8	'ba' zhig gis so //	'ba'_0 'jig_5 gis_10 so_14 
T06D4044:150b-9	tshogs sdud pa zhes bya ba ni phan pa bya ba med pa'o //	tshogs_0 sdud_7 ba_12 zhes_15 byed_20 ba_24 ni_27 phan_30 ba_35 byed_38 ba_42 med_45 ba_49 
T06D4044:150b-10	tshe 'di'i bde ba la gnas shing zhes bya ba la sogs pa la /	tshe_0 'di_5 bde_11 ba_15 la_18 gnas_21 shing_26 zhes_32 byed_37 ba_41 la_44 sogs_47 ba_52 la_55 
T06D4044:150b-11	mtho ris kyi don gyi bsam gtan ni 'ba' zhig pa ste ;	mtho_0 ris_5 kyi_9 don_13 gyi_17 bsam_21 gtan_26 ni_31 'ba'_34 'jig_39 ba_44 ste_47 
T06D4044:150b-12	sngar bstan pa'o //	sngar_0 ston_6 ba_12 
T06D4044:150b-13	'di ltar yang bzod pa zhes bya ba la /	'di_0 ltar_4 yang_9 bzod_14 ba_19 zhes_22 byed_27 ba_31 la_34 
T06D4044:150b-14	mtho ris kyi don du tshul khrims dang /	mtho_0 ris_5 kyi_9 don_13 du_17 tshul_20 khrims_26 dang_33 
T06D4044:150b-15	brtson 'grus rtsom pa dang /	brtson_0 'grus_7 rtsom_13 ba_19 dang_22 
T06D4044:150b-16	bsam gtan dang /	bsam_0 gtan_5 dang_10 
T06D4044:150b-17	shes rab rnams yang dag par blangs nas gnas pa ni 'ba' zhig par sngar bstan to //	shes_0 rab_5 rnams_9 yang_15 'dag_20 ba_24 blangs_28 nas_35 gnas_39 ba_44 ni_47 'ba'_50 'jig_55 ba_60 sngar_64 ston_70 to_76 
T06D4044:150b-18	sbyin pa dang /	sbyin_0 ba_6 dang_9 
T06D4044:150b-19	bzod pa yang dag par blangs te gnas pa'i ma	bzod_0 ba_5 yang_8 'dag_13 ba_17 blangs_21 te_28 gnas_31 ba_36 ma_41 
T06D4044:150b-20	bstan pa'i rgyu rab tu bstan pa las brtsams te	ston_0 ba_6 rgyu_11 rab_16 tu_20 ston_23 ba_29 las_32 brtsams_36 te_44 
T06D4044:150b-21	/ snying rje sngon du 'gro ba'am zhes bya ba la /	snying_2 rje_9 sngon_13 du_19 'gro_22 ba_27 zhes_33 byed_38 ba_42 la_45 
T06D4044:150b-22	snying rje med par sngon du 'gro ba na yang zhes bya ba'i don to //	snying_0 rje_7 med_11 ba_15 sngon_19 du_25 'gro_28 ba_33 na_36 yang_39 zhes_44 byed_49 ba_53 don_58 to_62 
T06D4044:150b-23	byang chub tu yongs su bsngos pa'am zhes bya ba ni /	byang_0 chub_6 tu_11 yongs_14 su_20 sngo_23 ba_30 zhes_36 byed_41 ba_45 ni_48 
T06D4044:150b-24	byang chub tu yongs su ma bsngos pa yang zhes bya ba'i don to //	byang_0 chub_6 tu_11 yongs_14 su_20 ma_23 sngo_26 ba_33 yang_36 zhes_41 byed_46 ba_50 don_55 to_59 
T06D4044:150b-25	sbyin pa dang bzod pa 'di dag ni 'ba' zhig	sbyin_0 ba_6 dang_9 bzod_14 ba_19 'di_22 'dag_26 ni_30 'ba'_33 'jig_38 
T06D4044:150b-26	pa yin na yang rang gi don gyi ngo bor	ba_0 yin_3 na_7 yang_10 rang_15 gi_20 don_23 gyi_27 ngo_31 'bor_35 
T06D4044:150b-27	ni mi 'gyur te /	ni_0 mi_3 'gyur_6 te_12 
T06D4044:150b-28	nges par 'tshang rgya ba nyid dang gzhan pa'i rang gi don du yang 'gyur bas /	nges_0 ba_5 'tshang_9 rgya_17 ba_22 nyid_25 dang_30 gzhan_35 ba_41 rang_46 gi_51 don_54 du_58 yang_61 'gyur_66 ba_72 
T06D4044:150b-29	byang chub kyang 'thob la /	byang_0 chub_6 kyang_11 'thob_17 la_23 
T06D4044:150b-30	mtho ris kyi rgyu yang yin te /	mtho_0 ris_5 kyi_9 rgyu_13 yang_18 yin_23 te_27 
T06D4044:150b-31	mtho ris kyi phyir dang rang gi mtho ris kyi	mtho_0 ris_5 kyi_9 phyir_13 dang_19 rang_24 gi_29 mtho_32 ris_37 kyi_41 
T06D4044:150b-32	phyir yin pas sbyin pa dang bzod pa 'ba' zhig	phyir_0 yin_6 ba_10 sbyin_14 ba_20 dang_23 bzod_28 ba_33 'ba'_36 'jig_41 
T06D4044:150b-33	nyid yin na yang gzhan gyi don med pa ni	nyid_0 yin_5 na_9 yang_12 gzhan_17 gyi_23 don_27 med_31 ba_35 ni_38 
T06D4044:150b-34	ma yin no // mtho ris kyi phyir ma yin	ma_0 yin_3 no_7 mtho_13 ris_18 kyi_22 phyir_26 ma_32 yin_35 
T06D4044:150b-35	pa ni snga ma ltar 'ba' zhig pa nyid du	ba_0 ni_3 snga_6 ma_11 ltar_14 'ba'_19 'jig_24 ba_29 nyid_32 du_37 
T06D4044:150b-36	ma yin no // / lta ba log par zhugs pa zhes bya ba la /	ma_0 yin_3 no_7 lta_15 ba_19 log_22 ba_26 'jug_30 ba_36 zhes_39 byed_44 ba_48 la_51 
T06D4044:150b-37	ji ltar byas nas she na /	ji_0 ltar_3 byed_8 nas_13 she_17 na_21 
T06D4044:150b-38	smras pa /	smras_0 ba_6 
T06D4044:150b-39	'ong ba ma mthong ba dang /	'ong_0 ba_5 ma_8 mthong_11 ba_18 dang_21 
T06D4044:150b-40	'bras bu ma mthong ba zhes bya ba ste /	'bras_0 bu_6 ma_9 mthong_12 ba_19 zhes_22 byed_27 ba_31 ste_34 
T06D4044:150b-41	'jig rten pha rol med do zhe'am /	'jig_0 rten_5 pha_10 rol_14 med_18 do_22 zhe_25 
T06D4044:150b-42	legs par spyad pa dang /	legs_0 ba_5 spyod_9 ba_15 dang_18 
T06D4044:150b-43	nyes par spyad pa'i 'bras bu rnam par smin pa med do zhes zer ba'o //	nyes_0 ba_5 spyod_9 ba_15 'bras_20 bu_26 rnam_29 ba_34 smin_38 ba_43 med_46 do_50 zhes_53 zer_58 ba_62 
T06D4044:150b-44	tshul khrims nyams pa zhes bya ba ni tshul khrims 'chal ba'o //	tshul_0 khrims_6 nyams_13 ba_19 zhes_22 byed_27 ba_31 ni_34 tshul_37 khrims_43 'chal_50 ba_56 
T06D4044:150b-45	sgrub pa med pa zhes bya ba ni /	sgrub_0 ba_6 med_9 ba_13 zhes_16 byed_21 ba_25 ni_28 
T06D4044:150b-46	nan tan mi byed pa'o //	nan_0 tan_4 mi_8 byed_11 ba_16 
T06D4044:150b-47	sa 'og ma las yang dag par 'das pa zhes bya ba ni /	sa_0 'og_3 ma_7 las_10 yang_14 'dag_19 ba_23 'da'_27 ba_32 zhes_35 byed_40 ba_44 ni_47 
T06D4044:151a-0	'dod pa'i khams kyi 'dod @151a * //	'dod_0 ba_5 khams_10 kyi_16 'dod_20 
T06D4044:151a-1	chags dang bral ba'i phyir mi 'ong ba'am /	chags_0 dang_6 'bral_11 ba_16 phyir_21 mi_27 'ong_30 ba_35 
T06D4044:151a-2	khams nyid la 'dod chags dang bral ba'o //	khams_0 nyid_6 la_11 'dod_14 chags_19 dang_25 'bral_30 ba_35 
T06D4044:151a-3	bsam gtan las gyur pa la mkhas pa'i byang chub sems dpa' zhes bya ba ni /	bsam_0 gtan_5 las_10 gyur_14 ba_19 la_22 mkhas_25 ba_31 byang_36 chub_42 sems_47 dpa'_52 zhes_57 byed_62 ba_66 ni_69 
T06D4044:151a-4	bsam gtan la gnas pa zhes bya ba'i don to //	bsam_0 gtan_5 la_10 gnas_13 ba_18 zhes_21 byed_26 ba_30 don_35 to_39 
T06D4044:151a-5	'di ltar zhes bya ba la sogs pas ni 'dir rgyu bstan to //	'di_0 ltar_4 zhes_9 byed_14 ba_18 la_21 sogs_24 ba_29 ni_33 'dir_36 rgyu_41 ston_46 to_52 
T06D4044:151a-6	de la gzhan gyi don 'ba' zhig yin na ji	de_0 la_3 gzhan_6 gyi_12 don_16 'ba'_20 'jig_25 yin_30 na_34 ji_37 
T06D4044:151a-7	skad bstan pa snga ma gnyis ni zhes bya ba	skad_0 ston_5 ba_11 snga_14 ma_19 gnyis_22 ni_28 zhes_31 byed_36 ba_40 
T06D4044:151a-8	ni lta ba log par zhugs pa'i sbyin pa dang	ni_0 lta_3 ba_7 log_10 ba_14 'jug_18 ba_24 sbyin_29 ba_35 dang_38 
T06D4044:151a-9	/ tshul khrims nyams pas chos ston pa'o //	tshul_2 khrims_8 nyams_15 ba_21 chos_25 ston_30 ba_35 
T06D4044:151a-10	de ma yin pa zhes bya ba ni sa 'og	de_0 ma_3 yin_6 ba_10 zhes_13 byed_18 ba_22 ni_25 sa_28 'og_31 
T06D4044:151a-11	ma las yang dag par 'das pa zhes bya ba	ma_0 las_3 yang_7 'dag_12 ba_16 'da'_20 ba_25 zhes_28 byed_33 ba_37 
T06D4044:151a-12	la sogs pa ji skad bstan pa'o //	la_0 sogs_3 ba_8 ji_11 skad_14 ston_19 ba_25 
T06D4044:151a-13	de la dge ba yongs su 'dzin par byed ces bya ba ni /	de_0 la_3 dge_6 ba_10 yongs_13 su_19 'dzin_22 ba_28 byed_32 ces_37 byed_41 ba_45 ni_48 
T06D4044:151a-14	dge ba skyed par byed ces bya ba'i don to //	dge_0 ba_4 skyed_7 ba_13 byed_17 ces_22 byed_26 ba_30 don_35 to_39 
T06D4044:151a-15	dge ba la sogs pa zhes bya ba ni /	dge_0 ba_4 la_7 sogs_10 ba_15 zhes_18 byed_23 ba_27 ni_30 
T06D4044:151a-16	dge ba spel ba'o //	dge_0 ba_4 spel_7 ba_12 
T06D4044:151a-17	dge ba yongs su gzung ba yang dag par 'dzin du 'jug ces bya ba ni /	dge_0 ba_4 yongs_7 su_13 gzung_16 ba_22 yang_25 'dag_30 ba_34 'dzin_38 du_44 'jug_47 ces_52 byed_56 ba_60 ni_63 
T06D4044:151a-18	dge ba nye bar sog tu 'jug pa'o //	dge_0 ba_4 nye_7 ba_11 sog_15 tu_19 'jug_22 ba_27 
T06D4044:151a-19	'dul bar byed ces bya ba dang 'jug par byed ces bya ba dang /	'dul_0 ba_5 byed_9 ces_14 byed_18 ba_22 dang_25 'jug_30 ba_35 byed_39 ces_44 byed_48 ba_52 dang_55 
T06D4044:151a-20	'god par byed ces bya ba ni /	'god_0 ba_5 byed_9 ces_14 byed_18 ba_22 ni_25 
T06D4044:151a-21	chung ngu dang /	chung_0 ngu_6 dang_10 
T06D4044:151a-22	'bring dang /	'bring_0 dang_7 
T06D4044:151a-23	chen po nyid do //	chen_0 po_5 nyid_8 do_13 
T06D4044:151a-24	rang dang gzhan gyi don gyis bsdus pa'i don ni	rang_0 dang_5 gzhan_10 gyi_16 don_20 gyis_24 sdud_29 ba_35 don_40 ni_44 
T06D4044:151a-25	nyon mongs pa can ma yin pa'i ngo bo nyid	nyon_0 mongs_5 ba_11 can_14 ma_18 yin_21 ba_25 ngo_30 'bo_34 nyid_37 
T06D4044:151a-26	dang rgyu nyid dang /	dang_0 rgyu_5 nyid_10 dang_15 
T06D4044:151a-27	dus nyid dang /	dus_0 nyid_4 dang_9 
T06D4044:151a-28	nye bar zhi ba nyid do zhes bstan te /	nye_0 ba_4 zhi_8 ba_12 nyid_15 do_20 zhes_23 ston_28 te_34 
T06D4044:151a-29	phan pa byed pa nyid kyis de ni phan pa nyid do //	phan_0 ba_5 byed_8 ba_13 nyid_16 kyis_21 de_26 ni_29 phan_32 ba_37 nyid_40 do_45 
T06D4044:151a-30	rgyu bzhi'i bsdus pa'i don ni /	rgyu_0 bzhi_5 sdud_12 ba_18 don_23 ni_27 
T06D4044:151a-31	rgyu rnam pa gnyis te /	rgyu_0 rnam_5 ba_10 gnyis_13 te_19 
T06D4044:151a-32	bde ba 'phel ba dang skyed pa'o /	bde_0 ba_4 'phel_7 ba_13 dang_16 skyed_21 ba_27 
T06D4044:151a-33	skyed pa yang rnam pa gsum ste /	skyed_0 ba_6 yang_9 rnam_14 ba_19 gsum_22 ste_27 
T06D4044:151a-34	rten dang /	rten_0 dang_5 
T06D4044:151a-35	dmigs pa dang /	dmigs_0 ba_6 dang_9 
T06D4044:151a-36	lhan cig byed pa'i rkyen gyi mtshan nyid do //	lhan_0 cig_5 byed_9 ba_14 rkyen_19 gyi_25 mtshan_29 nyid_36 do_41 
T06D4044:151a-37	'phen pa yang rnam pa gnyis te mthong ba'i chos can dang /	'phen_0 ba_6 yang_9 rnam_14 ba_19 gnyis_22 te_28 mthong_31 ba_38 chos_43 can_48 dang_52 
T06D4044:151a-38	pha rol ba'i dbye bas so ;	pha_0 rol_4 ba_8 'byed_13 ba_18 so_22 
T06D4044:151a-39	/ bde ba'i rgyu la bde bar nye bar brtags par byas nas /	bde_2 ba_6 rgyu_11 la_16 bde_19 ba_23 nye_27 ba_31 rtog_35 ba_42 byed_46 nas_51 
T06D4044:151a-40	rgyu bde ba zhes brjod do //	rgyu_0 bde_5 ba_9 zhes_12 rjod_17 do_23 
T06D4044:151a-41	dper na me bde ba zhes bya ba lta bu'o //	dper_0 na_5 me_8 bde_11 ba_15 zhes_18 byed_23 ba_27 lta_30 bu_34 
T06D4044:151a-42	rgyu bde bar bsdus pa'i rgyu gsum po de dag ces bya ba ni /	rgyu_0 bde_5 ba_9 sdud_13 ba_19 rgyu_24 gsum_29 po_34 de_37 'dag_40 ces_44 byed_48 ba_52 ni_55 
T06D4044:151a-43	dbang po dang /	dbang_0 po_6 dang_9 
T06D4044:151a-44	yul dang /	yul_0 dang_4 
T06D4044:151a-45	bde ba tshor bar 'gyur ba'i reg pa ni lus	bde_0 ba_4 tshor_7 ba_13 'gyur_17 ba_23 reg_28 ba_32 ni_35 lus_38 
T06D4044:151a-46	kyi las kyis bsdus pa'i dbang po lnga sdud par	kyi_0 las_4 kyis_8 sdud_13 ba_19 dbang_24 po_30 lnga_33 sdud_38 ba_43 
T06D4044:151a-47	byed pas nyams su myong ba'i tshor ba'o //	byed_0 ba_5 nyams_9 su_15 myong_18 ba_24 tshor_29 ba_35 
T06D4044:151a-48	slob pa dang mi slob pa'i lam dang yang dag par ldan pa'o //	slob_0 ba_5 dang_8 mi_13 slob_16 ba_21 lam_26 dang_30 yang_35 'dag_40 ba_44 ldan_48 ba_53 
T06D4044:151a-49	grang ba dang tsha bas bsdus pa ni dus las 'byung ba'i sdug bsngal gyis bsdus pa'o //	grang_0 ba_6 dang_9 tsha_14 ba_19 sdud_23 ba_29 ni_32 dus_35 las_39 'byung_43 ba_50 sdug_55 sngal_60 gyis_67 sdud_72 ba_78 
T06D4044:151a-50	bkres pa dang /	bkres_0 ba_6 dang_9 
T06D4044:151a-51	skom pas bsdus pa ni /	skom_0 ba_5 sdud_9 ba_15 ni_18 
T06D4044:151b-0	nang gi bdag nyid can gyis @151b bsdus pa la sogs pa'i sdug bsngal dang /	nang_0 gi_5 bdag_8 nyid_13 can_18 gyis_22 sdud_33 ba_39 la_42 sogs_45 ba_50 sdug_55 sngal_60 dang_67 
T06D4044:151b-1	ngal ba'i sdug bsngal dang /	ngal_0 ba_5 sdug_10 sngal_15 dang_22 
T06D4044:151b-2	glo bur ba'i sdug bsngal dag go //	glo_0 bur_4 ba_8 sdug_13 sngal_18 'dag_25 go_29 
T06D4044:151b-3	sdig pa mi dge ba'i chos spangs te dben pas zhes bya ba ni /	sdig_0 ba_5 mi_8 dge_11 ba_15 chos_20 spong_25 te_32 dben_35 ba_40 zhes_44 byed_49 ba_53 ni_56 
T06D4044:151b-4	spangs pa nyid dben pa'o //	spong_0 ba_7 nyid_10 dben_15 ba_20 
T06D4044:151b-5	yang na spangs pa'i mtshan nyid kyis dben pa nyid de nye bar zhi ba'i bde ba'o //	yang_0 na_5 spong_8 ba_15 mtshan_20 nyid_27 kyis_32 dben_37 ba_42 nyid_45 de_50 nye_53 ba_57 zhi_61 ba_65 bde_70 ba_74 
T06D4044:151b-6	yang dag par sdug bsngal ba zhes bya ba ni /	yang_0 'dag_5 ba_9 sdug_13 sngal_18 ba_25 zhes_28 byed_33 ba_37 ni_40 
T06D4044:151b-7	tshor ba rnam pa gsum po dag gis sdug bsngal lo //	tshor_0 ba_6 rnam_9 ba_14 gsum_17 po_22 'dag_25 gis_29 sdug_33 sngal_38 lo_45 
T06D4044:151b-8	de las gzhan pa lhag ma rnams ni gnod pa med pa'i bde ba zhes bya ba la /	de_0 las_3 gzhan_7 ba_13 lhag_16 ma_21 rnams_24 ni_30 gnod_33 ba_38 med_41 ba_45 bde_50 ba_54 zhes_57 byed_62 ba_66 la_69 
T06D4044:151b-9	mngon par 'byung ba'i bde ba dang /	mngon_0 ba_6 'byung_10 ba_17 bde_22 ba_26 dang_29 
T06D4044:151b-10	rab tu dben pa'i bde ba dang /	rab_0 tu_4 dben_7 ba_12 bde_17 ba_21 dang_24 
T06D4044:151b-11	nye bar zhi ba'i bde ba'o //	nye_0 ba_4 zhi_8 ba_12 bde_17 ba_21 
T06D4044:151b-12	tha ma zhes bya ba ni /	tha_0 ma_4 zhes_7 byed_12 ba_16 ni_19 
T06D4044:151b-13	rdzogs par byang chub pa'i bde ba'o //	rdzogs_0 ba_7 byang_11 chub_17 ba_22 bde_27 ba_31 
T06D4044:151b-14	mngon par 'byung ba'i bde ba ni de dang rjes su mthun pa nyid yin /	mngon_0 ba_6 'byung_10 ba_17 bde_22 ba_26 ni_29 de_32 dang_35 rjes_40 su_45 mthun_48 ba_54 nyid_57 yin_62 
T06D4044:151b-15	rab tu dben pa'i bde ba ni de'i phyogs pa nyid yin /	rab_0 tu_4 dben_7 ba_12 bde_17 ba_21 ni_24 de_27 phyogs_32 ba_39 nyid_42 yin_47 
T06D4044:151b-16	nye bar zhi ba'i bde ba ni de 'dren par byed pa nyid yin gyi /	nye_0 ba_4 zhi_8 ba_12 bde_17 ba_21 ni_24 de_27 bgrang_30 ba_36 byed_40 ba_45 nyid_48 yin_53 gyi_57 
T06D4044:151b-17	don dam par ni ma yin te /	don_0 dam_4 ba_8 ni_12 ma_15 yin_18 te_22 
T06D4044:151b-18	don dam pa'i ni tha ma nyid de /	don_0 dam_4 ba_8 ni_13 tha_16 ma_20 nyid_23 de_28 
T06D4044:151b-19	gnod pa med pa nyid kyi phyir ro //	gnod_0 ba_5 med_8 ba_12 nyid_15 kyi_20 phyir_24 ro_30 
T06D4044:151b-20	bde ba 'dod pa yin par shes par bya'o zhes bya ba ni /	bde_0 ba_4 'dod_7 ba_12 yin_15 ba_19 shes_23 ba_28 byed_32 zhes_38 byed_43 ba_47 ni_50 
T06D4044:151b-21	bsam pas so //	bsam_0 ba_5 so_9 
T06D4044:151b-22	phan pa'i sbyin pa gang yin pa de bde ba	phan_0 ba_5 sbyin_10 ba_16 gang_19 yin_24 ba_28 de_31 bde_34 ba_38 
T06D4044:151b-23	sbyin pa yang yin par shes par bya ste zhes	sbyin_0 ba_6 yang_9 yin_14 ba_18 shes_22 ba_27 byed_31 ste_35 zhes_39 
T06D4044:151b-24	bya ba ni / phan pa'i rgyu'i gnas kyi sbyor	byed_0 ba_4 ni_7 phan_12 ba_17 rgyu_22 gnas_29 kyi_34 sbyor_38 
T06D4044:151b-25	ba 'di dag las 'di ltar de'i rjes su byung	ba_0 'di_3 'dag_7 las_11 'di_15 ltar_19 de_24 rjes_29 su_34 'byung_37 
T06D4044:151b-26	ba'i 'bras bu bde ba'i gnas byung bar rig par	ba_0 'bras_5 bu_11 bde_14 ba_18 gnas_23 'byung_28 ba_34 rig_38 ba_42 
T06D4044:151b-27	bya'o zhes bya ba'i don to //	byed_0 zhes_6 byed_11 ba_15 don_20 to_24 
T06D4044:151b-28	gang kun nas nyon mongs pa zhes bya ba ni /	gang_0 kun_5 nas_9 nyon_13 mongs_18 ba_24 zhes_27 byed_32 ba_36 ni_39 
T06D4044:151b-29	bdag nyid nyon mongs pa dang mtshungs par ldan pas nyon mongs pa gzhan gyis nyon mongs pa'am /	bdag_0 nyid_5 nyon_10 mongs_15 ba_21 dang_24 mtshungs_29 ba_38 ldan_42 ba_47 nyon_51 mongs_56 ba_62 gzhan_65 gyis_71 nyon_76 mongs_81 ba_87 
T06D4044:151b-30	bdag nyid nyon mongs pa dang ldan pa dang /	bdag_0 nyid_5 nyon_10 mongs_15 ba_21 dang_24 ldan_29 ba_34 dang_37 
T06D4044:151b-31	kha na ma tho ba dang bcas pa nyid ni /	kha_0 na_4 ma_7 tho_10 ba_14 dang_17 'cha'_22 ba_27 nyid_30 ni_35 
T06D4044:151b-32	bde ba yang mi phan pa zhes bya ba ste /	bde_0 ba_4 yang_7 mi_12 phan_15 ba_20 zhes_23 byed_28 ba_32 ste_35 
T06D4044:151b-33	don ma yin pa skyed par byed pa'i don to //	don_0 ma_4 yin_7 ba_11 skyed_14 ba_20 byed_24 ba_29 don_34 to_38 
T06D4044:151b-34	gang gi phyir zhe na /	gang_0 gi_5 phyir_8 zhe_14 na_18 
T06D4044:151b-35	smras pa /	smras_0 ba_6 
T06D4044:151b-36	mi phan pa'i phyir te /	mi_0 phan_3 ba_8 phyir_13 te_19 
T06D4044:151b-37	mi phan pa'i phyir ma 'ongs pa'i sdug bsngal gyi rgyu'o //	mi_0 phan_3 ba_8 phyir_13 ma_19 'ongs_22 ba_28 sdug_33 sngal_38 gyi_45 rgyu_49 
T06D4044:151b-38	de'i phyir de ni mi phan pa nyid pas thams cad nyon mongs pa can nam /	de_0 phyir_5 de_11 ni_14 mi_17 phan_20 ba_25 nyid_28 ba_33 thams_37 cad_43 nyon_47 mongs_52 ba_58 can_61 nam_65 
T06D4044:151b-39	kun nas nyon mongs par 'gyur ro //	kun_0 nas_4 nyon_8 mongs_13 ba_19 'gyur_23 ro_29 
T06D4044:151b-40	dbang po dang /	dbang_0 po_6 dang_9 
T06D4044:151b-41	yul dang /	yul_0 dang_4 
T06D4044:151b-42	reg pas bsdus pa ni bde ba'i rgyu'o //	reg_0 ba_4 sdud_8 ba_14 ni_17 bde_20 ba_24 rgyu_29 
T06D4044:151b-43	yang na gang dbang po dang yul dang reg pas	yang_0 na_5 gang_8 dbang_13 po_19 dang_22 yul_27 dang_31 reg_36 ba_40 
T06D4044:151b-44	bsdus pa'i rgyu bde ba dang tshor ba bde ba	sdud_0 ba_6 rgyu_11 bde_16 ba_20 dang_23 tshor_28 ba_34 bde_37 ba_41 
T06D4044:151b-45	ni kun nas nyon mongs par yang 'gyur te /	ni_0 kun_3 nas_7 nyon_11 mongs_16 ba_22 yang_26 'gyur_31 te_37 
T06D4044:151b-46	kun nas nyon mongs pa de ni kha na ma	kun_0 nas_4 nyon_8 mongs_13 ba_19 de_22 ni_25 kha_28 na_32 ma_35 
T06D4044:151b-47	tho ba dang bcas pa dang mi 'phrod pa ste	tho_0 ba_4 dang_7 'cha'_12 ba_17 dang_20 mi_25 'phrod_28 ba_35 ste_38 
T06D4044:151b-48	/ mi phan pa'i phyir ro //	mi_2 phan_5 ba_10 phyir_15 ro_21 
T06D4044:152a-0	@152a * // dkar po'i phyogs ni bstan pa las bzlog par rig par bya'o //	dkar_11 po_16 phyogs_21 ni_28 ston_31 ba_37 las_40 bzlog_44 ba_50 rig_54 ba_58 byed_62 
