T06D4044:160b-19	nyon mongs pa'i sgrib pa rnam par dag pa'i shes	nyon_0 mongs_5 ba_11 sgrib_16 ba_22 rnam_25 ba_30 'dag_34 ba_38 shes_43 
T06D4044:160b-20	pa'i spyod yul gyi de kho na dang shes bya'i	ba_0 spyod_5 yul_11 gyi_15 de_19 kho_22 na_26 dang_29 shes_34 byed_39 
T06D4044:160b-21	sgrib pa rnam par dag pa'i shes bya'i spyod yul	sgrib_0 ba_6 rnam_9 ba_14 'dag_18 ba_22 shes_27 byed_32 spyod_38 yul_44 
T06D4044:160b-22	gyi de kho na ni bsgoms pas rtogs par bya	gyi_0 de_4 kho_7 na_11 ni_14 sgom_17 ba_24 rtogs_28 ba_34 byed_38 
T06D4044:160b-23	ba ste / gnyi ga yang nyan thos dang rang	ba_0 ste_3 gnyi_9 ga_14 yang_17 nyan_22 thos_27 dang_32 rang_37 
T06D4044:160b-24	sangs rgyas kyi zhes bya ba la sogs pa ste	sangs_0 rgya_6 kyi_12 zhes_16 byed_21 ba_25 la_28 sogs_31 ba_36 ste_39 
T06D4044:160b-25	ba ste / / de thob par byed pa'i thabs nye bar bstan pas shes par bya ba ste /	ba_0 ste_3 de_11 'thob_14 ba_19 byed_23 ba_28 thabs_33 nye_39 ba_43 ston_47 ba_53 shes_57 ba_62 byed_66 ba_70 ste_73 
T06D4044:160b-26	phung po las ma gtogs pa'i gang zag med par	'phung_0 po_6 las_9 ma_13 gtogs_16 ba_22 gang_27 zag_32 med_36 ba_40 
T06D4044:160b-27	lta ba goms pa las byung ngo zhes bya ba'i	lta_0 ba_4 goms_7 ba_12 las_15 'byung_19 ngo_25 zhes_29 byed_34 ba_38 
T06D4044:160b-28	tshig gis so // shes bya'i sgrib pa rnam par	tshig_0 gis_6 so_10 shes_16 byed_21 sgrib_27 ba_33 rnam_36 ba_41 
T06D4044:160b-29	dag pa'i shes pa'i spyod yul gyi de kho na	'dag_0 ba_4 shes_9 ba_14 spyod_19 yul_25 gyi_29 de_33 kho_36 na_40 
T06D4044:160b-30	rnam par gzhag pa ni gnyis su med pa'i rang	rnam_0 ba_5 'jog_9 ba_15 ni_18 gnyis_21 su_27 med_30 ba_34 rang_39 
T06D4044:160b-31	tshig gis so // bzhin te / de kho na	tshig_0 gis_6 so_10 bzhin_16 te_22 de_27 kho_30 na_34 
T06D4044:160b-32	de bsgrub pa ni gnyis su bcom ldan 'das rnams	de_0 sgrub_3 ba_10 ni_13 gnyis_16 su_22 'joms_25 ldan_30 'da'_35 rnams_40 
T06D4044:160b-33	kyi ye shes zhes bya ba la sogs pas bstan	kyi_0 ye_4 shes_7 zhes_12 byed_17 ba_21 la_24 sogs_27 ba_32 ston_36 
T06D4044:160b-34	tshig gis so // bzhin te / te / bsgoms	tshig_0 gis_6 so_10 bzhin_16 te_22 te_27 sgom_32 
T06D4044:160b-35	pas rtogs par bya ba'i shes bya'i sgrib pa rnam	ba_0 rtogs_4 ba_10 byed_14 ba_18 shes_23 byed_28 sgrib_34 ba_40 rnam_43 
T06D4044:160b-36	par dag pa'i shes pa'i spyod yul gyi de kho	ba_0 'dag_4 ba_8 shes_13 ba_18 spyod_23 yul_29 gyi_33 de_37 kho_40 
T06D4044:160b-37	na rnam par gzhag pa ni gnyis su med pa'i	na_0 rnam_3 ba_8 'jog_12 ba_18 ni_21 gnyis_24 su_30 med_33 ba_37 
T06D4044:160b-38	tshig gis so // bzhin te / te / rang	tshig_0 gis_6 so_10 bzhin_16 te_22 te_27 rang_32 
T06D4044:160b-39	bzhin te / de kho na de bsgrub pa ni	bzhin_0 te_6 de_11 kho_14 na_18 de_21 sgrub_24 ba_31 ni_34 
T06D4044:160b-40	gnyis su med pa rnam par gzhag pas so //	gnyis_0 su_6 med_9 ba_13 rnam_16 ba_21 'jog_25 ba_31 so_35 
T06D4044:160b-41	dbu ma'i lam mtha' gnyis spangs pa bla na med	dbu_0 ma_4 lam_9 mtha'_13 gnyis_19 spong_25 ba_32 bla_35 na_39 med_42 
T06D4044:160b-42	pa zhes bya ste zhes bya bas ni gsung rab	ba_0 zhes_3 byed_8 ste_12 zhes_16 byed_21 ba_25 ni_29 gsung_32 rab_38 
T06D4044:160b-43	kyi don gyi dbu ma'i lam bstan pas don chen	kyi_0 don_4 gyi_8 dbu_12 ma_16 lam_21 ston_25 ba_31 don_35 chen_39 
T06D4044:160b-44	po nyid gsal bar byas pa'i gong na med pa'i	po_0 nyid_3 gsal_8 ba_13 byed_17 ba_22 gong_27 na_32 med_35 ba_39 
T06D4044:160b-45	rgyu yang dag par bstan par rig par bya'o //	rgyu_0 yang_5 'dag_10 ba_14 ston_18 ba_24 rig_28 ba_32 byed_36 
T06D4044:160b-46	gnyi ga dag gi rgyu ste /	gnyi_0 ga_5 'dag_8 gi_12 rgyu_15 ste_20 
T06D4044:161a-0	gang @161a * //	gang_0 
T06D4044:161a-1	gi phyir de kho na de la sangs rgyas bcom	gi_0 phyir_3 de_9 kho_12 na_16 de_19 la_22 sangs_25 rgya_31 'joms_37 
T06D4044:161a-2	ldan 'das rnams kyi ye shes shin tu rnam par	ldan_0 'da'_5 rnams_10 kyi_16 ye_20 shes_23 shin_28 tu_33 rnam_36 ba_41 
T06D4044:161a-3	dag par rig par bya'o zhes brjod pas de lta	'dag_0 ba_4 rig_8 ba_12 byed_16 zhes_22 rjod_27 ba_33 de_37 lta_40 
T06D4044:161a-4	bu'i rgyu rnams kyi gong na med pa nyid do	bu_0 rgyu_5 rnams_10 kyi_16 gong_20 na_25 med_28 ba_32 nyid_35 do_40 
T06D4044:161a-5	// byang chub sems dpa' rnams kyi ni yang slob	byang_3 chub_9 sems_14 dpa'_19 rnams_24 kyi_30 ni_34 yang_37 slob_42 
T06D4044:161a-6	pa'i lam gyis rab tu phye ba yin par rig	ba_0 lam_5 gyis_9 rab_14 tu_18 'byed_21 ba_26 yin_29 ba_33 rig_37 
T06D4044:161a-7	par bya ste zhes bya ba'i tshig gis ni gong	ba_0 byed_4 ste_8 zhes_12 byed_17 ba_21 tshig_26 gis_32 ni_36 gong_39 
T06D4044:161a-8	na med pa gnyis pa nyid kyi rgyu ste /	na_0 med_3 ba_7 gnyis_10 ba_16 nyid_19 kyi_24 rgyu_28 ste_33 
T06D4044:161a-9	gang gi phyir yang de'i rgyu yin pas shes rab	gang_0 gi_5 phyir_8 yang_14 de_19 rgyu_24 yin_29 ba_33 shes_37 rab_42 
T06D4044:161a-10	de ni byang chub sems dpa'i bla na med pa	de_0 ni_3 byang_6 chub_12 sems_17 dpa_22 bla_28 na_32 med_35 ba_39 
T06D4044:161a-11	yang dag par rdzogs pa'i byang chub thob par bya	yang_0 'dag_5 ba_9 rdzogs_13 ba_20 byang_25 chub_31 'thob_36 ba_41 byed_45 
T06D4044:161a-12	ba'i thabs chen po yin te /	ba_0 thabs_5 chen_11 po_16 yin_19 te_23 
T06D4044:161a-13	yang dag par rdzogs pa'i byang chub thob pa'i thabs yin pa'i phyir ro //	yang_0 'dag_5 ba_9 rdzogs_13 ba_20 byang_25 chub_31 'thob_36 ba_41 thabs_46 yin_52 ba_56 phyir_61 ro_67 
T06D4044:161a-14	'di'i slob pa'i lam gyis rab tu phye ba'i bla	'di_0 slob_6 ba_11 lam_16 gyis_20 rab_25 tu_29 'byed_32 ba_37 bla_42 
T06D4044:161a-15	na med pa nyid ni de'i thabs chen po nyid	na_0 med_3 ba_7 nyid_10 ni_15 de_18 thabs_23 chen_29 po_34 nyid_37 
T06D4044:161a-16	do // rab tu bsgrub pa ni de ci'i phyir	do_0 rab_6 tu_10 sgrub_13 ba_20 ni_23 de_26 ci_29 phyir_34 
T06D4044:161a-17	zhe na zhes bya ba la sogs pa'i gzhung gis	zhe_0 na_4 zhes_7 byed_12 ba_16 la_19 sogs_22 ba_27 gzhung_32 gis_39 
T06D4044:161a-18	do // bstan to // 'di ltar sangs rgyas kyi chos rnams yongs su smin par 'gyur la /	do_0 ston_6 to_12 'di_18 ltar_22 sangs_27 rgya_33 kyi_39 chos_43 rnams_48 yongs_54 su_60 smin_63 ba_68 'gyur_72 la_78 
T06D4044:161a-19	'di ltar thabs 'dis sangs rgyas kyi chos rnams yongs	'di_0 ltar_4 thabs_9 'dis_15 sangs_20 rgya_26 kyi_32 chos_36 rnams_41 yongs_47 
T06D4044:161a-20	su smin par 'gyur ba des na gang gi phyir	su_0 smin_3 ba_8 'gyur_12 ba_18 des_21 na_25 gang_28 gi_33 phyir_36 
T06D4044:161a-21	gzhan du ma yin pas mi mthun pa dang gnyen	gzhan_0 du_6 ma_9 yin_12 ba_16 mi_20 mthun_23 ba_29 dang_32 gnyen_37 
T06D4044:161a-22	po'i dngos po rab tu bsgrub pas mtha' gcig tu	po_0 dngos_5 po_11 rab_14 tu_18 sgrub_21 ba_28 mtha'_32 gcig_38 tu_43 
T06D4044:161a-23	byas pa'i don te /	byed_0 ba_5 don_10 te_14 
T06D4044:161a-24	stong pa nyid mchog la mos pa bsgom pa ji	stong_0 ba_6 nyid_9 mchog_14 la_20 mos_23 ba_27 bsgom_30 ba_36 ji_39 
T06D4044:161a-25	snyed pa de ni byang chub sems dpa'i slob pa'i	snyed_0 ba_6 de_9 ni_12 byang_15 chub_21 sems_26 dpa_31 slob_37 ba_42 
T06D4044:161a-26	lam gyis bsdus pa'i thabs chen po zhes brjod de	lam_0 gyis_4 sdud_9 ba_15 thabs_20 chen_26 po_31 zhes_34 rjod_39 de_45 
T06D4044:161a-27	zhes bya ba'o // thabs de'i phan yon rab tu bstan pa dang /	zhes_0 byed_5 ba_9 thabs_17 de_23 phan_28 yon_33 rab_37 tu_41 ston_44 ba_50 dang_53 
T06D4044:161a-28	go rims ni gzhung ci lta ba bzhin rig par bya ste /	go_0 rims_3 ni_8 gzhung_11 ci_18 lta_21 ba_25 bzhin_28 rig_34 ba_38 byed_42 ste_46 
T06D4044:161a-29	de yang byang chub sems dpa' de ni ring nas	de_0 yang_3 byang_8 chub_14 sems_19 dpa'_24 de_29 ni_32 ring_35 nas_40 
T06D4044:161a-30	chos bdag med pa la rjes su zhugs zhes bya	chos_0 bdag_5 med_10 ba_14 la_17 rjes_20 su_25 'jug_28 zhes_34 byed_39 
T06D4044:161a-31	ba nas brtsams te /	ba_0 nas_3 brtsams_7 te_15 
T06D4044:161a-32	de bzhin du phan yon mang du yod de /	de_0 bzhin_3 du_9 phan_12 yon_17 mang_21 du_26 yod_29 de_33 
T06D4044:161a-33	bdag nyid kyang sangs rgyas kyi chos yongs su smin par bya ba'i phyir dang /	bdag_0 nyid_5 kyang_10 sangs_16 rgya_22 kyi_28 chos_32 yongs_37 su_43 smin_46 ba_51 byed_55 ba_59 phyir_64 dang_70 
T06D4044:161a-34	gzhan dag kyang theg pa gsum gyi chos la yongs	gzhan_0 'dag_6 kyang_10 theg_16 ba_21 gsum_24 gyi_29 chos_33 la_38 yongs_41 
T06D4044:161a-35	su smin par bya ba'i phyir yang dag par rab	su_0 smin_3 ba_8 byed_12 ba_16 phyir_21 yang_27 'dag_32 ba_36 rab_40 
T06D4044:161a-36	tu zhugs pa yin zhes bya ba'o //	tu_0 'jug_3 ba_9 yin_12 zhes_16 byed_21 ba_25 
T06D4044:161a-37	de ni de dag gnyi ga'i chos yongs su smin	de_0 ni_3 de_6 'dag_9 gnyi_13 ga_18 chos_23 yongs_28 su_34 smin_37 
T06D4044:161a-38	par bya ba la ji ltar yang dag par rab	ba_0 byed_4 ba_8 la_11 ji_14 ltar_17 yang_22 'dag_27 ba_31 rab_35 
T06D4044:161a-39	tu zhugs par 'gyur zhes de'i phyir bsgrub pa'i thabs	tu_0 'jug_3 ba_9 'gyur_13 zhes_19 de_24 phyir_29 sgrub_35 ba_42 thabs_47 
T06D4044:161a-40	nye bar bstan pa ni /	nye_0 ba_4 ston_8 ba_14 ni_17 
T06D4044:161a-41	'di ltar yang dag par zhugs pa yin te zhes bya ba nas brtsams nas /	'di_0 ltar_4 yang_9 'dag_14 ba_18 'jug_22 ba_28 yin_31 te_35 zhes_38 byed_43 ba_47 nas_50 brtsams_54 nas_62 
T06D4044:161a-42	spros pa med pa'i tshul la zhugs shing don dam	spros_0 ba_6 med_9 ba_13 tshul_18 la_24 'jug_27 shing_33 don_39 dam_43 
T06D4044:161a-43	pa'i de kho na shes pa la yang dag par	ba_0 de_5 kho_8 na_12 shes_15 ba_20 la_23 yang_26 'dag_31 ba_35 
T06D4044:161a-44	brten pa'i yang dag pa'i sbyor ba yin par rig	rten_0 ba_6 yang_11 'dag_16 ba_20 sbyor_25 ba_31 yin_34 ba_38 rig_42 
T06D4044:161a-45	par bya'o zhes bya ba'i bar du'o //	ba_0 byed_4 zhes_10 byed_15 ba_19 ba_24 du_28 
T06D4044:161b-0	@161b de ltar rnam par gzhag pa'i de kho na	de_6 ltar_9 rnam_14 ba_19 'jog_23 ba_29 de_34 kho_37 na_41 
T06D4044:161b-1	de thob par bya ba'i thabs la 'jug pa'i byang	de_0 'thob_3 ba_8 byed_12 ba_16 thabs_21 la_27 'jug_30 ba_35 byang_40 
T06D4044:161b-2	chub sems dpa'i slob pa'i lam gyis bsdus pa'i bla	chub_0 sems_5 dpa_10 slob_16 ba_21 lam_26 gyis_30 sdud_35 ba_41 bla_46 
T06D4044:161b-3	na med pa yang dag par rdzogs pa'i byang chub	na_0 med_3 ba_7 yang_10 'dag_15 ba_19 rdzogs_23 ba_30 byang_35 chub_41 
T06D4044:161b-4	thob pa'i thabs rab tu bstan to //	'thob_0 ba_5 thabs_10 rab_16 tu_20 ston_23 to_29 
T06D4044:161b-5	'di'i phan yon gyis sangs rgyas kyi chos rnams yongs	'di_0 phan_6 yon_11 gyis_15 sangs_20 rgya_26 kyi_32 chos_36 rnams_41 yongs_47 
T06D4044:161b-6	su smin par bya ba'i yang dag pa'i sbyor ba	su_0 smin_3 ba_8 byed_12 ba_16 yang_21 'dag_26 ba_30 sbyor_35 ba_41 
T06D4044:161b-7	yang dag par bstan nas /	yang_0 'dag_5 ba_9 ston_13 nas_19 
T06D4044:161b-8	de ni rigs pa dang lung gi chos thams cad brjod du med par bsgrub pa ni /	de_0 ni_3 rigs_6 ba_11 dang_14 lung_19 gi_24 chos_27 thams_32 cad_38 rjod_42 du_48 med_51 ba_55 sgrub_59 ba_66 ni_69 
T06D4044:161b-9	ma zhugs pa rnams gzhug pa'i don dang /	ma_0 'jug_3 ba_9 rnams_12 'jug_18 ba_24 don_29 dang_33 
T06D4044:161b-10	thob par bya ba'i don dang /	'thob_0 ba_5 byed_9 ba_13 don_18 dang_22 
T06D4044:161b-11	phyin ci log dang the tshom gyi blo dang ldan pa rnams kyi de spang ba'i don du'o //	phyin_0 ci_6 log_9 dang_13 the_18 tshom_22 gyi_28 blo_32 dang_36 ldan_41 ba_46 rnams_49 kyi_55 de_59 spong_62 ba_68 don_73 du_77 
T06D4044:161b-12	de la rigs pa ni chos thams cad brjod du	de_0 la_3 rigs_6 ba_11 ni_14 chos_17 thams_22 cad_28 rjod_32 du_38 
T06D4044:161b-13	med pa'i ngo bo nyid yin par khong du chud	med_0 ba_4 ngo_9 'bo_13 nyid_16 yin_21 ba_25 khong_29 du_35 chud_38 
T06D4044:161b-14	par bya zhes bya ba nas brtsams nas /	ba_0 byed_4 zhes_8 byed_13 ba_17 nas_20 brtsams_24 nas_32 
T06D4044:161b-15	ji ltar bstan pa'i chos tha na mya ngan las	ji_0 ltar_3 ston_8 ba_14 chos_19 tha_24 na_28 mya_31 ngan_35 las_40 
T06D4044:161b-16	'das pa'i bar du brtags pa tsam du rig par	'da'_0 ba_5 ba_10 du_14 rtog_17 ba_24 tsam_27 du_32 rig_35 ba_39 
T06D4044:161b-17	bya'o zhes bya ba'i bar du'o //	byed_0 zhes_6 byed_11 ba_15 ba_20 du_24 
T06D4044:161b-18	sgro 'dogs pa'i mtha' rab tu dgag par nyes pa	sgro_0 'dogs_5 ba_11 mtha'_16 rab_22 tu_26 'gog_29 ba_34 nyes_38 ba_43 
T06D4044:161b-19	gsum gyis nyams pa'i phyir gcig la yang mang po'i	gsum_0 gyis_5 nyams_10 ba_16 phyir_21 gcig_27 la_32 yang_35 mang_40 po_45 
T06D4044:161b-20	bdag nyid can gyi skyon btags pa'i dngos pos ming	bdag_0 nyid_5 can_10 gyi_14 skyon_18 'dogs_24 ba_30 dngos_35 pos_41 ming_45 
T06D4044:161b-21	gi snga logs na blo'i skyon du thal bar 'gyur	gi_0 snga_3 logs_8 na_13 blo_16 skyon_22 du_28 thal_31 ba_36 'gyur_40 
T06D4044:161b-22	ba'i nyes pa yin no //	ba_0 nyes_5 ba_10 yin_13 no_17 
T06D4044:161b-23	skur pa 'debs pa ni dngos po med pas btags	skur_0 ba_5 'debs_8 ba_14 ni_17 dngos_20 po_26 med_29 ba_33 'dogs_37 
T06D4044:161b-24	pa'i dngos po yang med pa'i skyon rab tu dgag	ba_0 dngos_5 po_11 yang_14 med_19 ba_23 skyon_28 rab_34 tu_38 'gog_41 
T06D4044:161b-25	pas dbu ma pa'i rab tu bsgrub pa rigs par	ba_0 dbu_4 ma_8 ba_11 rab_16 tu_20 sgrub_23 ba_30 rigs_33 ba_38 
T06D4044:161b-26	rab tu bstan pa'i rigs pa'o //	rab_0 tu_4 ston_7 ba_13 rigs_18 ba_23 
T06D4044:161b-27	'di gnyis ni chos 'dul ba 'di las rab tu	'di_0 gnyis_4 ni_10 chos_13 'dul_18 ba_23 'di_26 las_30 rab_34 tu_38 
T06D4044:161b-28	nyams pa yin zhes bya ba nas brtsams pa 'di	nyams_0 ba_6 yin_9 zhes_13 byed_18 ba_22 nas_25 brtsams_29 ba_37 'di_40 
T06D4044:161b-29	ni 'thad pa sgrub pa'i rigs pa phyin ci ma	ni_0 'thad_3 ba_9 sgrub_12 ba_18 rigs_23 ba_28 phyin_31 ci_37 ma_40 
T06D4044:161b-30	log pa gang gis brjod du med pa'i ngo bo	log_0 ba_4 gang_7 gis_12 rjod_16 du_22 med_25 ba_29 ngo_34 'bo_38 
T06D4044:161b-31	nyid rab tu rtogs par byed pa ste /	nyid_0 rab_5 tu_9 rtogs_12 ba_18 byed_22 ba_27 ste_30 
T06D4044:161b-32	'di ltar re zhig 'di ni 'di las phyi rol	'di_0 ltar_4 re_9 'jig_12 'di_17 ni_21 'di_24 las_28 phyi_32 rol_37 
T06D4044:161b-33	ba rnams la brjod du med pa'i chos kyi ngo	ba_0 rnams_3 la_9 rjod_12 du_18 med_21 ba_25 chos_30 kyi_35 ngo_39 
T06D4044:161b-34	bo nyid rigs pas sgrub pa'o //	'bo_0 nyid_3 rigs_8 ba_13 sgrub_17 ba_23 
T06D4044:161b-35	chos 'di ba rnams la mi slu ba'i lung gis	chos_0 'di_5 ba_9 rnams_12 la_18 mi_21 slu_24 ba_28 lung_33 gis_38 
T06D4044:161b-36	chos thams cad brjod du med pa'i ngo bo nyid	chos_0 thams_5 cad_11 rjod_15 du_21 med_24 ba_28 ngo_33 'bo_37 nyid_40 
T06D4044:161b-37	du srid pa 'pho ba'i mdo'i tshigs su bcad pa	du_0 srid_3 ba_8 'pho_11 ba_16 mdo_21 tshigs_27 su_34 gcod_37 ba_42 
T06D4044:161b-38	dang / mdo sde'i lhug pa las kyang kha cig tshad ma gang gis snyam pa la /	dang_0 mdo_7 sde_11 lhug_17 ba_22 las_25 kyang_29 kha_35 cig_39 tshad_43 ma_49 gang_52 gis_57 snyam_61 ba_67 la_70 
T06D4044:161b-39	rab tu bstan pa dang /	rab_0 tu_4 ston_7 ba_13 dang_16 
T06D4044:161b-40	tshigs su bcad pa gzhan dang /	tshigs_0 su_7 gcod_10 ba_15 gzhan_18 dang_24 
T06D4044:161b-41	mdo sde gzhan dag las kyang yang dag par sdud pas yang dag par bsdus nas /	mdo_0 sde_4 gzhan_8 'dag_14 las_18 kyang_22 yang_28 'dag_33 ba_37 sdud_41 ba_46 yang_50 'dag_55 ba_59 sdud_63 nas_69 
T06D4044:161b-42	chos thams cad ngo bo nyid kyis brjod du med pa yang rab tu bstan la /	chos_0 thams_5 cad_11 ngo_15 'bo_19 nyid_22 kyis_27 rjod_32 du_38 med_41 ba_45 yang_48 rab_53 tu_57 ston_60 la_66 
T06D4044:161b-43	brjod par sbyor ba'i rgyu yang bstan nas /	rjod_0 ba_6 sbyor_10 ba_16 rgyu_21 yang_26 ston_31 nas_37 
T06D4044:161b-44	rang gi phyogs kyi skyon bsal ba'i don dang /	rang_0 gi_5 phyogs_8 kyi_15 skyon_19 bsal_25 ba_30 don_35 dang_39 
T06D4044:162a-0	rgol ba'i skabs med par @162a * //	rgol_0 ba_5 skabs_10 med_16 ba_20 
T06D4044:162a-1	rab tu bstan pas /	rab_0 tu_4 ston_7 ba_13 
T06D4044:162a-2	'di lta bu'i de kho na'i mtshan nyid do //	'di_0 lta_4 bu_8 de_13 kho_16 na_20 mtshan_25 nyid_32 do_37 
T06D4044:162a-3	gang mi shes pas 'jug pa dang /	gang_0 mi_5 shes_8 ba_13 'jug_17 ba_22 dang_25 
T06D4044:162a-4	gang shes pas ldog pa zhes bya ba dang /	gang_0 shes_5 ba_10 ldog_14 ba_19 zhes_22 byed_27 ba_31 dang_34 
T06D4044:162a-5	ji ltar de mi shes pas 'jug pa dang /	ji_0 ltar_3 de_8 mi_11 shes_14 ba_19 'jug_23 ba_28 dang_31 
T06D4044:162a-6	ji ltar de shes pas ldog pa yin zhe na	ji_0 ltar_3 de_8 shes_11 ba_16 ldog_20 ba_25 yin_28 zhe_32 na_36 
T06D4044:162a-7	zhes pa de lta bu yang rab tu bstan nas	zhes_0 ba_5 de_8 lta_11 bu_15 yang_18 rab_23 tu_27 ston_30 nas_36 
T06D4044:162a-8	/ de'i mtshan nyid kyang rab tu bstan te /	de_2 mtshan_7 nyid_14 kyang_19 rab_25 tu_29 ston_32 te_38 
T06D4044:162a-9	de lta bu yongs su ma shes pa'i phyir gzhi	de_0 lta_3 bu_7 yongs_10 su_16 ma_19 shes_22 ba_27 phyir_32 gzhi_38 
T06D4044:162a-10	de las byis pa rnams zhes bya ba nas brtsams	de_0 las_3 byis_7 ba_12 rnams_15 zhes_21 byed_26 ba_30 nas_33 brtsams_37 
T06D4044:162a-11	nas / byang chub sems dpa'i theg pa chen po	nas_0 byang_6 chub_12 sems_17 dpa_22 theg_28 ba_33 chen_36 po_41 
T06D4044:162a-12	la spros pa'i 'gog pa de de lta bu byang	la_0 spros_3 ba_9 'gog_14 ba_19 de_22 de_25 lta_28 bu_32 byang_35 
T06D4044:162a-13	chub sems dpa'i theg pa chen po'i yongs su mya	chub_0 sems_5 dpa_10 theg_16 ba_21 chen_24 po_29 yongs_34 su_40 mya_43 
T06D4044:162a-14	ngan las 'das pa zhes bya ba'i bar du ste	ngan_0 las_5 'da'_9 ba_14 zhes_17 byed_22 ba_26 ba_31 du_35 ste_38 
T06D4044:162a-15	nas / / 'di lta bus ni sngar rab tu	nas_0 'di_8 lta_12 'bud_16 ni_20 sngar_23 rab_29 tu_33 
T06D4044:162a-16	bsgoms pa'i slob pa'i lam de'i shes pa'i phan yon	sgom_0 ba_7 slob_12 ba_17 lam_22 de_26 shes_31 ba_36 phan_41 yon_46 
T06D4044:162a-17	nas / / bstan to // da ni mthong ba'i	nas_0 ston_8 to_14 da_20 ni_23 mthong_26 ba_33 
T06D4044:162a-18	chos de'i de kho na mchog gi don ye shes	chos_0 de_5 de_10 kho_13 na_17 mchog_20 gi_26 don_29 ye_33 shes_36 
T06D4044:162a-19	rnam par dag pa'i spyod yul la dbang du gyur	rnam_0 ba_5 'dag_9 ba_13 spyod_18 yul_24 la_28 dbang_31 du_37 gyur_40 
T06D4044:162a-20	pa thob pa dang /	ba_0 'thob_3 ba_8 dang_11 
T06D4044:162a-21	'bras bu thob pa de'i phan yon ni lnga ste /	'bras_0 bu_6 'thob_9 ba_14 de_17 phan_22 yon_27 ni_31 lnga_34 ste_39 
T06D4044:162a-22	des ni de dang gzhan gyi thun mong ba dang /	des_0 ni_4 de_7 dang_10 gzhan_15 gyi_21 thun_25 mong_30 ba_35 dang_38 
T06D4044:162a-23	de dang gzhan thun mong ma yin pa'i rgyu rab tu bstan pa'i don te /	de_0 dang_3 gzhan_8 thun_14 mong_19 ma_24 yin_27 ba_31 rgyu_36 rab_41 tu_45 ston_48 ba_54 don_59 te_63 
T06D4044:162a-24	phan yon de rnams kyis ji snyed yod pa'i phan	phan_0 yon_5 de_9 rnams_12 kyis_18 ji_23 snyed_26 yod_32 ba_36 phan_41 
T06D4044:162a-25	yon rnam pa lnga po don chen po nyid kyi	yon_0 rnam_4 ba_9 lnga_12 po_17 don_20 chen_24 po_29 nyid_32 kyi_37 
T06D4044:162a-26	las dag byang chub sems dpa' thams cad kyis bya	las_0 'dag_4 byang_8 chub_14 sems_19 dpa'_24 thams_29 cad_35 kyis_39 byed_44 
T06D4044:162a-27	ba yongs su rdzogs par bstan to //	ba_0 yongs_3 su_9 rdzogs_12 ba_19 ston_23 to_29 
T06D4044:162a-28	dang po dang gnyis pa dag ni dman pa ste /	dang_0 po_5 dang_8 gnyis_13 ba_19 'dag_22 ni_26 dman_29 ba_34 ste_37 
T06D4044:162a-29	thos pa dang bsams pa tsam pa'i phyir ro //	thos_0 ba_5 dang_8 bsams_13 ba_19 tsam_22 ba_27 phyir_32 ro_38 
T06D4044:162a-30	gsum pa ni 'bring po nyid de /	gsum_0 ba_5 ni_8 'bring_11 po_18 nyid_21 de_26 
T06D4044:162a-31	bdag gi don 'ba' zhig tsam pa'i phyir ro //	bdag_0 gi_5 don_8 'ba'_12 'jig_17 tsam_22 ba_27 phyir_32 ro_38 
T06D4044:162a-32	bzhi pa ni mchog nyid de /	bzhi_0 ba_5 ni_8 mchog_11 nyid_17 de_22 
T06D4044:162a-33	bdag dang gzhan gyi don nyid yin pa'i phyir ro zhes bya ba ste /	bdag_0 dang_5 gzhan_10 gyi_16 don_20 nyid_24 yin_29 ba_33 phyir_38 ro_44 zhes_47 byed_52 ba_56 ste_59 
T06D4044:162a-34	rim par phye ba mtha' dag gis bsdus pa'i don yin no //	rim_0 ba_4 'byed_8 ba_13 mtha'_16 'dag_22 gis_26 sdud_30 ba_36 don_41 yin_45 no_49 
T06D4044:162a-35	byang chub sems dpa'i sa'i gzhi'i rnal 'byor gyi gnas	byang_0 chub_6 sems_11 dpa_16 sa_22 gzhi_27 rnal_34 'byor_39 gyi_45 gnas_49 
T06D4044:162a-36	las bzhi pa de kho na rim par phye ba'o	las_0 bzhi_4 ba_9 de_12 kho_15 na_19 rim_22 ba_26 'byed_30 ba_35 
T06D4044:162a-38	/ // / kun nas nyon mongs pa med pa'i thabs kyi	kun_7 nas_11 nyon_15 mongs_20 ba_26 med_29 ba_33 thabs_38 kyi_44 
T06D4044:162a-39	rjes thogs la skyo ba med pa'i thabs kyi rgyu	rjes_0 thogs_5 la_11 skyo_14 ba_19 med_22 ba_26 thabs_31 kyi_37 rgyu_41 
T06D4044:162a-40	'di ltar mthu brtsam par bya ba ni /	'di_0 ltar_4 mthu_9 brtsam_14 ba_21 byed_25 ba_29 ni_32 
T06D4044:162a-41	ting nge 'dzin la dbang thob pa zhes bya ba'o //	ting_0 nge_5 'dzin_9 la_15 dbang_18 'thob_24 ba_29 zhes_32 byed_37 ba_41 
T06D4044:162a-42	ting nge 'dzin la dbang ba 'di la yod pas	ting_0 nge_5 'dzin_9 la_15 dbang_18 ba_24 'di_27 la_31 yod_34 ba_38 
T06D4044:162a-43	ting nge 'dzin la dbang ba ste de'i ngo bo	ting_0 nge_5 'dzin_9 la_15 dbang_18 ba_24 ste_27 de_31 ngo_36 'bo_40 
T06D4044:162a-44	ni ting nge 'dzin la dbang ba nyid yin la	ni_0 ting_3 nge_8 'dzin_12 la_18 dbang_21 ba_27 nyid_30 yin_35 la_39 
T06D4044:162a-45	/ de thob pa ni ting nge 'dzin la dbang thob pa ste /	de_2 'thob_5 ba_10 ni_13 ting_16 nge_21 'dzin_25 la_31 dbang_34 'thob_40 ba_45 ste_48 
T06D4044:162a-46	de la 'phags pa'i mthu zhes brjod do //	de_0 la_3 'phag_6 ba_13 mthu_18 zhes_23 rjod_28 do_34 
T06D4044:162a-47	ji ltar dbang thob pa yin zhe na /	ji_0 ltar_3 dbang_8 'thob_14 ba_19 yin_22 zhe_26 na_30 
T06D4044:162a-48	de la bstan par bya ba'i phyir smras pa /	de_0 la_3 ston_6 ba_12 byed_16 ba_20 phyir_25 smras_31 ba_37 
T06D4044:162a-49	sems las su rung ba /	sems_0 las_5 su_9 rung_12 ba_17 
T06D4044:162b-0	sems shin tu yongs su bsgoms pa'i byang chub sems @162b dpa'i lam 'phags pa'i mthu zhes bya ba'o //	sems_0 shin_5 tu_10 yongs_13 su_19 sgom_22 ba_29 byang_34 chub_40 sems_45 dpa_56 lam_62 'phag_66 ba_73 mthu_78 zhes_83 byed_88 ba_92 
T06D4044:162b-1	yang na gang gi mthu yin na /	yang_0 na_5 gang_8 gi_13 mthu_16 yin_21 na_25 
T06D4044:162b-2	sems las su rung ba'i ste /	sems_0 las_5 su_9 rung_12 ba_17 ste_22 
T06D4044:162b-3	sems las su rung ba nyid de /	sems_0 las_5 su_9 rung_12 ba_17 nyid_20 de_25 
T06D4044:162b-4	sems las su rung ba nyid ni //	sems_0 las_5 su_9 rung_12 ba_17 nyid_20 ni_25 
T06D4044:162b-5	de'i las su rung ba nyid ni sems shin tu bsgoms pa nyid do //	de_0 las_5 su_9 rung_12 ba_17 nyid_20 ni_25 sems_28 shin_33 tu_38 sgom_41 ba_48 nyid_51 do_56 
T06D4044:162b-6	de nas de lta bu'i mtshan nyid can gyi sems kyi mthu ni 'phags pa'i mthu zhes brjod do //	de_0 nas_3 de_7 lta_10 bu_14 mtshan_19 nyid_26 can_31 gyi_35 sems_39 kyi_44 mthu_48 ni_53 'phag_56 ba_63 mthu_68 zhes_73 rjod_78 do_84 
T06D4044:162b-7	'bras bu chen po ni rnam par smin pa'i 'bras bu chen po nyid de phan yon no //	'bras_0 bu_6 chen_9 po_14 ni_17 rnam_20 ba_25 smin_29 ba_34 'bras_39 bu_45 chen_48 po_53 nyid_56 de_61 phan_64 yon_69 no_73 
T06D4044:162b-8	de las gzhan zhes bya ba ni /	de_0 las_3 gzhan_7 zhes_13 byed_18 ba_22 ni_25 
T06D4044:162b-9	sangs rgyas dang byang chub sems dpa' rnams kyi bsod	sangs_0 rgya_6 dang_12 byang_17 chub_23 sems_28 dpa'_33 rnams_38 kyi_44 bsod_48 
T06D4044:162b-10	nams kyi tshogs chen po bsags pa las byung ba	nams_0 kyi_5 tshogs_9 chen_16 po_21 bsags_24 ba_30 las_33 'byung_37 ba_43 
T06D4044:162b-11	de yang ngo // mdor bsdu na rdzu 'phrul ni rnam pa gnyis te /	de_0 yang_3 ngo_8 mdor_15 sdud_20 na_25 rdzu_28 'phrul_33 ni_40 rnam_43 ba_48 gnyis_51 te_57 
T06D4044:162b-12	yongs su bsgyur ba dang sprul ba'o //	yongs_0 su_6 sgyur_9 ba_16 dang_19 sprul_24 ba_30 
T06D4044:162b-13	de la yongs su bsgyur ba'i rdzu 'phrul ni yod pa las gzhan du bsgyur ba ste /	de_0 la_3 yongs_6 su_12 sgyur_15 ba_22 rdzu_27 'phrul_32 ni_39 yod_42 ba_46 las_49 gzhan_53 du_59 sgyur_62 ba_69 ste_72 
T06D4044:162b-14	yongs su bsgyur bas yongs su bsgyur nas /	yongs_0 su_6 sgyur_9 ba_16 yongs_20 su_26 sgyur_29 nas_36 
T06D4044:162b-15	spyod par byed pas yongs su bsgyur ba zhes brjod do //	spyod_0 ba_6 byed_10 ba_15 yongs_19 su_25 sgyur_28 ba_35 zhes_38 rjod_43 do_49 
T06D4044:162b-16	yongs su bsgyur ba yang rnam pa bzhi ste /	yongs_0 su_6 sgyur_9 ba_16 yang_19 rnam_24 ba_29 bzhi_32 ste_37 
T06D4044:162b-17	yongs su bsgyur ba ni 'jig rten ni 'di dag yongs su bsgyur te /	yongs_0 su_6 sgyur_9 ba_16 ni_19 'jig_22 rten_27 ni_32 'di_35 'dag_39 yongs_43 su_49 sgyur_52 te_59 
T06D4044:162b-18	'byung ba dang 'byung ba las gyur pa'i mtshan nyid can gyi dngos po ni /	'byung_0 ba_7 dang_10 'byung_15 ba_22 las_25 gyur_29 ba_34 mtshan_39 nyid_46 can_51 gyi_55 dngos_59 po_65 ni_68 
T06D4044:162b-19	sems can dang sems can ma yin pa rnam pa gnyis dang /	sems_0 can_5 dang_9 sems_14 can_19 ma_23 yin_26 ba_30 rnam_33 ba_38 gnyis_41 dang_47 
T06D4044:162b-20	bdag dang gzhan zhes bya ba'i 'byung ba dang 'byung ba las gyur pa'o //	bdag_0 dang_5 gzhan_10 zhes_16 byed_21 ba_25 'byung_30 ba_37 dang_40 'byung_45 ba_52 las_55 gyur_59 ba_64 
T06D4044:162b-21	yang rnam pa gsum du gnas te sems can ma	yang_0 rnam_5 ba_10 gsum_13 du_18 gnas_21 te_26 sems_29 can_34 ma_38 
T06D4044:162b-22	yin par brjod pa 'byung ba dang 'byung ba las	yin_0 ba_4 rjod_8 ba_14 'byung_17 ba_24 dang_27 'byung_32 ba_39 las_42 
T06D4044:162b-23	gyur pa 'dus nas gnas pa dang /	gyur_0 ba_5 'du_8 nas_13 gnas_17 ba_22 dang_25 
T06D4044:162b-24	sems can du brjod pa 'dus nas gnas pa dang /	sems_0 can_5 du_9 rjod_12 ba_18 'du_21 nas_26 gnas_30 ba_35 dang_38 
T06D4044:162b-25	'byung ba dang 'byung ba dang 'byung ba las gyur	'byung_0 ba_7 dang_10 'byung_15 ba_22 dang_25 'byung_30 ba_37 las_40 gyur_44 
T06D4044:162b-26	pa'i ngo bo tha dad du gnas pa zhes bya	ba_0 ngo_5 'bo_9 tha_12 dad_16 du_20 gnas_23 ba_28 zhes_31 byed_36 
T06D4044:162b-27	ba 'di dag go //	ba_0 'di_3 'dag_7 go_11 
T06D4044:162b-28	de la sems can du brjod pa'i 'byung ba dang	de_0 la_3 sems_6 can_11 du_15 rjod_18 ba_24 'byung_29 ba_36 dang_39 
T06D4044:162b-29	'byung ba las gyur pa 'dus nas gnas pa'i rlung	'byung_0 ba_7 las_10 gyur_14 ba_19 'du_22 nas_27 gnas_31 ba_36 rlung_41 
T06D4044:162b-30	gi khams yongs su bsgyur ba ni g-yo bar byed	gi_0 khams_3 yongs_9 su_15 sgyur_18 ba_25 ni_28 g-yo_31 ba_36 byed_40 
