T10D4202:177b-10	rkyen du klu'i rgyal po hu lor zhes bgyi bas	rkyen_0 du_6 klu_9 rgyal_15 po_21 hu_24 lor_27 zhes_31 bgyid_36 ba_41 
T10D4202:177b-11	kha che'i yul nas de bzhin gshegs pa bdun gyi	kha_0 che_4 yul_10 nas_14 de_18 bzhin_21 gshegs_27 ba_34 bdun_37 gyi_42 
T10D4202:177b-12	sku gdung bzhugs pa'i mchod rten cig spyan rangs nas	sku_0 gdung_4 bzhugs_10 ba_17 mchod_22 rten_28 cig_33 spyan_37 rangs_43 nas_49 
T10D4202:177b-13	nam mkha' las gshegs pa dang ltar tsar ma na	nam_0 mkha'_4 las_10 gshegs_14 ba_21 dang_24 ltar_29 tsar_34 ma_39 na_42 
T10D4202:177b-14	bzhugs te / mchod rten 'di dri gtsang khang gi nang na bzhugs te /	bzhugs_0 te_7 mchod_12 rten_18 'di_23 'dri_27 gtsang_31 khang_38 gi_44 nang_47 na_52 bzhugs_55 te_62 
T10D4202:177b-15	grib ma slad rol du gsal bar 'byung /	'grib_0 ma_5 slad_8 rol_13 du_17 gsal_20 ba_25 'byung_29 
T10D4202:177b-16	rgyal po bi dza ya sing ha zhes bgyi ba	rgyal_0 po_6 bi_9 dza_12 ya_16 sing_19 ha_24 zhes_27 bgyid_32 ba_37 
T10D4202:177b-17	tsar ma'i gtsug lag khang du mchod pa bgyid du	tsar_0 ma_5 gtsug_10 lag_16 khang_20 du_26 mchod_29 ba_35 bgyid_38 du_44 
T10D4202:177b-18	mchis pa las sku gzugs lder so bgyis pa cig	mchis_0 ba_6 las_9 sku_13 gzugs_17 lder_23 so_28 bgyid_31 ba_37 cig_40 
T10D4202:177b-19	'chag cig gshegs par mthong nas mtshams med pa lnga	'chag_0 cig_6 gshegs_10 ba_17 mthong_21 nas_28 mtshams_32 med_40 ba_44 lnga_47 
T10D4202:177b-20	byang ngo zhes mchi ba yang da ltar bzhugs /	byang_0 ngo_6 zhes_10 mchi_15 ba_20 yang_23 da_28 ltar_31 bzhugs_36 
T10D4202:177b-21	gtsug lag khang de'i srung mar zhal gyis bzhes pa yang /	gtsug_0 lag_6 khang_10 de_16 srung_21 mar_27 zhal_31 gyis_36 bzhes_41 ba_47 yang_50 
T10D4202:177b-22	lhan nam mkha'i spyan dang nor bu bzang po zhes bgyi ba lags te /	lhan_0 nam_5 mkha_9 spyan_16 dang_22 nor_27 bu_31 bzang_34 po_40 zhes_43 bgyid_48 ba_53 lags_56 te_61 
T10D4202:177b-23	deng song gi bar du mngon rtags dang /	deng_0 'gro_5 gi_10 ba_13 du_17 mngon_20 rtags_26 dang_32 
T10D4202:177b-24	mtshan ma dag kyang 'byung /	mtshan_0 ma_7 'dag_10 kyang_14 'byung_20 
T10D4202:177b-25	'phags pa'i lung bstan dag kyang sbyar na yang thog	'phag_0 ba_7 lung_12 ston_17 'dag_23 kyang_27 sbyor_33 na_39 yang_42 thogs_47 
T10D4202:177b-26	ma gtsug lag khang 'di rnams brtsigs pa yang dge	ma_0 gtsug_3 lag_9 khang_13 'di_19 rnams_23 brtsigs_29 ba_37 yang_40 dge_45 
T10D4202:177b-27	ba'i bshes gnyen dang /	ba_0 bshes_5 gnyen_11 dang_17 
T10D4202:177b-28	yon bdag 'phags pa sha stag gis mdzad la gtsug	yon_0 bdag_4 'phag_9 ba_16 sha_19 stag_23 gis_28 mdzad_32 la_38 gtsug_41 
T10D4202:177b-29	lag khang dang mchod rten bzhugs so 'tshal gyi nang	lag_0 khang_4 dang_10 mchod_15 rten_21 bzhugs_26 so_33 'tshal_36 gyi_43 nang_47 
T10D4202:177b-30	na yang de bzhin gshegs pa rnams kyi sku gdung	na_0 yang_3 de_8 bzhin_11 gshegs_17 ba_24 rnams_27 kyi_33 sku_37 gdung_41 
T10D4202:177b-31	dang byang chub sems dpa' dang /	dang_0 byang_5 chub_11 sems_16 dpa'_21 dang_26 
T10D4202:177b-32	nyan thos dang /	nyan_0 thos_5 dang_10 
T10D4202:177b-33	rang sangs rgyas kyi sku gdung bzhugs pas gnyan cing byin che rab ste /	rang_0 sangs_5 rgya_11 kyi_17 sku_21 gdung_25 bzhugs_31 ba_38 gnyan_42 cing_48 byin_53 che_58 rab_62 ste_66 
T10D4202:177b-34	thog ma li yul du gtsug lag khang byung ba yang 'di las snga ba ma mchis so //	thogs_0 ma_5 li_8 yul_11 du_15 gtsug_18 lag_24 khang_28 'byung_34 ba_40 yang_43 'di_48 las_52 snga_56 ba_61 ma_64 mchis_67 so_73 
T10D4202:177b-35	de nas tsar mar 'jam dpal gyi sprul pa dge	de_0 nas_3 tsar_7 mar_12 'jam_16 dpal_21 gyi_26 sprul_30 ba_36 dge_39 
T10D4202:177b-36	slong 'phags pa bee ro tsa nas chos phyung rgyal	slong_0 'phag_6 ba_13 bee_16 ro_20 tsa_23 nas_27 chos_31 'byin_36 rgyal_43 
T10D4202:177b-37	po bi dza ya sam bha bas gtsug lag khang	po_0 bi_3 dza_6 ya_10 sam_13 bha_17 ba_21 gtsug_25 lag_31 khang_35 
T10D4202:177b-38	brtsigs tshun chad rgyal po li rje rabs bdun gyi	brtsigs_0 tshun_8 'chad_14 rgyal_19 po_25 li_28 rje_31 rabs_35 bdun_40 gyi_45 
T10D4202:177b-39	bar du gtsug lag khang gzhan ma brtsigs /	ba_0 du_4 gtsug_7 lag_13 khang_17 gzhan_23 ma_29 brtsigs_32 
T10D4202:177b-40	de nas de'i 'og tu rgya gar yul nas 'phags pa dgra bcom pa buddha du ta dang /	de_0 nas_3 de_7 'og_12 tu_16 rgya_19 gar_24 yul_28 nas_32 'phag_36 ba_43 dgra_46 'joms_51 ba_56 buddha_59 du_66 ta_69 dang_72 
T10D4202:177b-41	kha gang ta dang /	kha_0 gang_4 ta_9 dang_12 
T10D4202:177b-42	kha ga ro yang dang /	kha_0 ga_4 ro_7 yang_10 dang_15 
T10D4202:177b-43	kha ga drod dang bzhi byung ste /	kha_0 ga_4 drod_7 dang_12 bzhi_17 'byung_22 ste_28 
T10D4202:177b-44	goo to shan gyi a'arya sta nar bzhugs so //	goo_0 to_4 shan_7 gyi_12 a_16 sta_23 nar_27 bzhugs_31 so_38 
T10D4202:178a-0	de'i tshe byang chub sems dpa' byas pa yang li rje ba dzi @178a * //	de_0 tshe_5 byang_10 chub_16 sems_21 dpa'_26 byed_31 ba_36 yang_39 li_44 rje_47 ba_51 dzi_54 
T10D4202:178a-1	ya b'irya bya bar gyur te /	ya_0 b_3 byed_10 ba_14 gyur_18 te_23 
T10D4202:178a-2	rgyal po de srog mkhar gyi steng nas bltas nam khar gyi phyi rol na gser dang /	rgyal_0 po_6 de_9 srog_12 mkhar_17 gyi_23 steng_27 nas_33 lta_37 nam_43 khar_47 gyi_52 phyi_56 rol_61 na_65 gser_68 dang_73 
T10D4202:178a-3	dngul lta bur snang ba zhig mthong nas bsnyags pa dang /	dngul_0 lta_6 bur_10 snang_14 ba_20 'jig_23 mthong_28 nas_35 snyog_39 ba_47 dang_50 
T10D4202:178a-4	da ltar 'gum tir gyi mchod rten chen bo bzhugs pa slebs nas bltas na /	da_0 ltar_3 'gum_8 tir_13 gyi_17 mchod_21 rten_27 chen_32 'bo_37 bzhugs_40 ba_47 slebs_50 nas_56 lta_60 na_66 
T10D4202:178a-5	sha ba ni gnod sbyin gyi sde dpon chen po	sha_0 ba_4 ni_7 gnod_10 sbyin_15 gyi_21 sde_25 dpon_29 chen_34 po_39 
T10D4202:178a-6	yang dag shes su gyur te rgyal po la smras	yang_0 'dag_5 shes_9 su_14 gyur_17 te_22 rgyal_25 po_31 la_34 smras_37 
T10D4202:178a-7	pa / kye rgyal po khyod sangs rgyas kyis lung	ba_0 kye_5 rgyal_9 po_15 khyod_18 sangs_24 rgya_30 kyis_36 lung_41 
T10D4202:178a-8	bstan pa bzhin 'dir gtsug lag khang gcig brtsigs pa	ston_0 ba_6 bzhin_9 'dir_15 gtsug_20 lag_26 khang_30 gcig_36 brtsigs_41 ba_49 
T10D4202:178a-9	rigs so zhes bgyis pa dang /	rigs_0 so_5 zhes_8 bgyid_13 ba_19 dang_22 
T10D4202:178a-10	su'i phyir brtsigs zhes rgyal pos zhus pa dang /	su_0 phyir_5 brtsigs_11 zhes_19 rgyal_24 pos_30 zhus_34 ba_39 dang_42 
T10D4202:178a-11	sangs rgyas kyi pho nya zhes bgyi pa 'phags pa	sangs_0 rgya_6 kyi_12 pho_16 nya_20 zhes_24 bgyid_29 ba_34 'phag_37 ba_44 
T10D4202:178a-12	dgra bcom pa buddha ta la sogs pa bzhi khyed	dgra_0 'joms_5 ba_10 buddha_13 ta_20 la_23 sogs_26 ba_31 bzhi_34 'khyed_39 
T10D4202:178a-13	kyi dge ba'i bshes gnyen du 'ongs pa 'di dag	kyi_0 dge_4 ba_8 bshes_13 gnyen_19 du_25 'ongs_28 ba_34 'di_37 'dag_41 
T10D4202:178a-14	gi phyir brtsig ces bsgo ba dang /	gi_0 phyir_3 brtsig_9 ces_16 sgo_20 ba_25 dang_28 
T10D4202:178a-15	'phags pa dgra bcom pa de dag kyang rgyal po	'phag_0 ba_7 dgra_10 'joms_15 ba_20 de_23 'dag_26 kyang_30 rgyal_36 po_42 
T10D4202:178a-16	bi dza ya b'irya'i drung du byon nas chos bshad	bi_0 dza_3 ya_7 b'i_10 drung_19 du_25 'byon_28 nas_33 chos_37 'chad_42 
T10D4202:178a-17	pas rgyal po yang tshe snga ma'i smon lam dran	ba_0 rgyal_4 po_10 yang_13 tshe_18 snga_23 ma_28 smon_33 lam_38 dran_42 
T10D4202:178a-18	nas de ma thag tu dogs brtag pa'i phur bu	nas_0 de_4 ma_7 thag_10 tu_15 dogs_18 rtog_23 ba_29 'phur_34 bu_39 
T10D4202:178a-19	der btab ste / gtsug lag khang 'gum tir brtsigs so ;	der_0 'debs_4 ste_9 gtsug_15 lag_21 khang_25 'gum_31 tir_36 brtsigs_40 so_48 
T10D4202:178a-20	/ de nas rgyal po bi dza ya b'irya 'gum	de_2 nas_5 rgyal_9 po_15 bi_18 dza_21 ya_25 b_28 'gum_35 
T10D4202:178a-21	tir gyi gtsug lag khang du mchod pa bgyid du	tir_0 gyi_4 gtsug_8 lag_14 khang_18 du_24 mchod_27 ba_33 bgyid_36 du_42 
T10D4202:178a-22	mchis pa'i tshe bu chung ngu zhig stor nas rjes	mchis_0 ba_6 tshe_11 bu_16 chung_19 ngu_25 'jig_29 stor_34 nas_39 rjes_43 
T10D4202:178a-23	bcang pa de btsal na /	'chang_0 ba_6 de_9 btsal_12 na_18 
T10D4202:178a-24	goo to shan gyi lung bu'i nang nas sangs rgyas	goo_0 to_4 shan_7 gyi_12 lung_16 bu_21 nang_26 nas_31 sangs_35 rgya_41 
T10D4202:178a-25	'od srungs kyi sku gdung bzhugs pa'i mchod rten gyi	'od_0 srungs_4 kyi_11 sku_15 gdung_19 bzhugs_25 ba_32 mchod_37 rten_43 gyi_48 
T10D4202:178a-26	drung nas bu rnyed de /	drung_0 nas_6 bu_10 rnyed_13 de_19 
T10D4202:178a-27	de nas rgyal pos mchod rten 'di gang gi dus na sus brtsigs zhes smras pa dang /	de_0 nas_3 rgyal_7 pos_13 mchod_17 rten_23 'di_28 gang_32 gi_37 dus_40 na_44 sus_47 brtsigs_51 zhes_59 smras_64 ba_70 dang_73 
T10D4202:178a-28	dge ba'i bshes gnyen 'phags pa de dag gi zhal	dge_0 ba_4 bshes_9 gnyen_15 'phag_21 ba_28 de_31 'dag_34 gi_38 zhal_41 
T10D4202:178a-29	nas mchod rten 'di sangs rgyas 'od srungs mya ngan	nas_0 mchod_4 rten_10 'di_15 sangs_19 rgya_25 'od_31 srungs_35 mya_42 ngan_46 
T10D4202:178a-30	las 'das pa'i tshe brtsigs te sangs rgyas 'od srungs	las_0 'da'_4 ba_9 tshe_14 brtsigs_19 te_27 sangs_30 rgya_36 'od_42 srungs_46 
T10D4202:178a-31	kyi sku gdung bzhugs so //	kyi_0 sku_4 gdung_8 bzhugs_14 so_21 
T10D4202:178a-32	li yul sngon mtshor gyur ba'i dus na mchod rten 'di ris g-yogs te chus ma zhig la /	li_0 yul_3 sngon_7 mtshor_13 gyur_20 ba_25 dus_30 na_34 mchod_37 rten_43 'di_48 ris_52 g-yogs_56 te_63 chus_66 ma_71 'jig_74 la_79 
T10D4202:178a-33	phyis kyang yul 'di mchod 'gyur te /	'byid_0 kyang_6 yul_12 'di_16 mchod_20 'gyur_26 te_32 
T10D4202:178a-34	yang mchod rten 'di ris g-yogs nas chus mi 'jig ste /	yang_0 mchod_5 rten_11 'di_16 ris_20 g-yogs_24 nas_31 chus_35 mi_40 'jig_43 ste_48 
T10D4202:178a-35	sangs rgyas byams pa byung ba'i tshe yang mtsho bskams	sangs_0 rgya_6 byams_12 ba_18 'byung_21 ba_27 tshe_32 yang_37 mtsho_42 skem_48 
T10D4202:178a-36	nas yul du gyur pa'i dus na mchod rten 'di	nas_0 yul_4 du_8 gyur_11 ba_16 dus_21 na_25 mchod_28 rten_34 'di_39 
T10D4202:178a-37	'byung ste / gnas 'di ni rus gsum du gshegs	'byung_0 ste_7 gnas_13 'di_18 ni_22 rus_25 gsum_29 du_34 gshegs_37 
T10D4202:178a-38	pa'i de bzhin gshegs pa rnams kyis sangs rgyas kyi	ba_0 de_5 bzhin_8 gshegs_14 ba_21 rnams_24 kyis_30 sangs_35 rgya_41 kyi_47 
T10D4202:178a-39	zhing khud pa'i nang na yang goo to shan 'di	zhing_0 khud_6 ba_11 nang_16 na_21 yang_24 goo_29 to_33 shan_36 'di_41 
T10D4202:178a-40	pho brang sa gcig yin te dus gsum gyi sangs	pho_0 brang_4 sa_10 gcig_13 yin_18 te_22 dus_25 gsum_29 gyi_34 sangs_38 
T10D4202:178a-41	rgyas rnams kyang kun 'dir gshegs shing lung ston /	rgya_0 rnams_6 kyang_12 kun_18 'dir_22 gshegs_27 shing_34 lung_40 ston_45 
T10D4202:178a-42	sems can gyi don mdzod do //	sems_0 can_5 gyi_9 don_13 mdzod_17 do_23 
T10D4202:178a-43	phyogs bcu 'i sangs rgyas kyi zhing so so nas	phyogs_0 'chu_7 'i_11 sangs_14 rgya_20 kyi_26 zhing_30 so_36 so_39 nas_42 
T10D4202:178a-44	byang chub sems dpa' stong phrag nyi shu yang dus	byang_0 chub_6 sems_11 dpa'_16 stong_21 phrag_27 nyi_33 shu_37 yang_41 dus_46 
T10D4202:178a-45	gsum du glang mgo ri 'di la mchod pa mdzad	gsum_0 du_5 glang_8 mgo_14 ri_18 'di_21 la_25 mchod_28 ba_34 mdzad_37 
T10D4202:178b-0	du byon @178b nas slar gshegs so zhes bstan /	du_0 'byon_3 nas_14 slar_18 gshegs_23 so_30 zhes_33 ston_38 
T10D4202:178b-1	de nas rgyal po bi dza ya b'i rya dad	de_0 nas_3 rgyal_7 po_13 bi_16 dza_19 ya_23 b_26 rya_30 dad_34 
T10D4202:178b-2	pa'i shugs chen pos glang mgo ri'i steng du goo	ba_0 shugs_5 chen_11 pos_16 glang_20 mgo_26 ri_30 steng_35 du_41 goo_44 
T10D4202:178b-3	to shan gyi gtsug lag khang brtsigs nas bu chung	to_0 shan_3 gyi_8 gtsug_12 lag_18 khang_22 brtsigs_28 nas_36 bu_40 chung_43 
T10D4202:178b-4	du de yang thar bar btang ste phyis dgra bcom	du_0 de_3 yang_6 thar_11 ba_16 gtong_20 ste_26 'byid_30 dgra_36 'joms_41 
T10D4202:178b-5	pa'i 'bras bu thob nas /	ba_0 'bras_5 bu_11 'thob_14 nas_19 
T10D4202:178b-6	li yul du dgra bcom par gyur pa 'di las	li_0 yul_3 du_7 dgra_10 'joms_15 ba_20 gyur_24 ba_29 'di_32 las_36 
T10D4202:178b-7	snga ba ma byung bas 'di ni lam ston pa'o	snga_0 ba_5 ma_8 'byung_11 ba_17 'di_21 ni_25 lam_28 ston_32 ba_37 
T10D4202:178b-8	zhes mo rgu bde shi bya bar btags te /	zhes_0 mo_5 rgu_8 bde_12 'chi_16 byed_20 ba_24 'dogs_28 te_34 
T10D4202:178b-9	thog ma mo rgu bde shi'i ming ni de nas	thogs_0 ma_5 mo_8 rgu_11 bde_15 'chi_19 ming_25 ni_30 de_33 nas_36 
T10D4202:178b-10	byung ste deng sang gi bar du yang thub ldan	'byung_0 ste_6 deng_10 sang_15 gi_20 ba_23 du_27 yang_30 thub_35 ldan_40 
T10D4202:178b-11	dang / dka' thub kyi mchog las btus te /	dang_0 dka'_7 thub_12 kyi_17 mchog_21 las_27 'thu_31 te_36 
T10D4202:178b-12	mo rgu bde shir bsgo ba lags /	mo_0 rgu_3 bde_7 shir_11 sgo_16 ba_21 lags_24 
T10D4202:178b-13	goo to sha na dang /	goo_0 to_4 sha_7 na_11 dang_14 
T10D4202:178b-14	'gum tir gyi gtsug lag khang 'di gnyis bzhugs pa'i	'gum_0 tir_5 gyi_9 gtsug_13 lag_19 khang_23 'di_29 gnyis_33 bzhugs_39 ba_46 
T10D4202:178b-15	dog sa yang dus gsum gyi de bzhin gshegs pa	dog_0 sa_4 yang_7 dus_12 gsum_16 gyi_21 de_25 bzhin_28 gshegs_34 ba_41 
T10D4202:178b-16	rim gyis 'byung ngo 'tshal gyi zhabs kyis bcags /	rim_0 gyis_4 'byung_9 ngo_16 'tshal_20 gyi_27 zhabs_31 kyis_37 'jags_42 
T10D4202:178b-17	byin gyis brlabs pa'i steng du 'phags pa'i lung bstan dag dang sbyar nas yang /	byin_0 gyis_5 brlabs_10 ba_17 steng_22 du_28 'phag_31 ba_38 lung_43 ston_48 'dag_54 dang_58 sbyor_63 nas_69 yang_73 
T10D4202:178b-18	thog mar gtsug lag khang 'di rnams brtsigs pa yang dge ba'i bshes gnyen dang /	thogs_0 mar_5 gtsug_9 lag_15 khang_19 'di_25 rnams_29 brtsigs_35 ba_43 yang_46 dge_51 ba_55 bshes_60 gnyen_66 dang_72 
T10D4202:178b-19	yon bdag 'phags pa sha stag gis mdzad la /	yon_0 bdag_4 'phag_9 ba_16 sha_19 stag_23 gis_28 mdzad_32 la_38 
T10D4202:178b-20	gtsug lag khang dang /	gtsug_0 lag_6 khang_10 dang_16 
T10D4202:178b-21	mchod rten bzhugs so 'tshal gyi nang na de bzhin gshegs pa'i sku gdung dang /	mchod_0 rten_6 bzhugs_11 so_18 'tshal_21 gyi_28 nang_32 na_37 de_40 bzhin_43 gshegs_49 ba_56 sku_61 gdung_65 dang_71 
T10D4202:178b-22	byang chub sems dpa' dang /	byang_0 chub_6 sems_11 dpa'_16 dang_21 
T10D4202:178b-23	nyan thos dang /	nyan_0 thos_5 dang_10 
T10D4202:178b-24	rang sangs rgyas kyi sku gdung bzhugs pas gnyan zhing byin che rab ste /	rang_0 sangs_5 rgya_11 kyi_17 sku_21 gdung_25 bzhugs_31 ba_38 gnyan_42 zhing_48 byin_54 che_59 rab_63 ste_67 
T10D4202:178b-25	gtsug lag khang gi srung mar zhal gyis bzhes pa yang rnam thos kyi sras dang /	gtsug_0 lag_6 khang_10 gi_16 srung_19 mar_25 zhal_29 gyis_34 bzhes_39 ba_45 yang_48 rnam_53 thos_58 kyi_63 sras_67 dang_72 
T10D4202:178b-26	gnod sbyin gyi sde dpon yang dag shes dang /	gnod_0 sbyin_5 gyi_11 sde_15 dpon_19 yang_24 'dag_29 shes_33 dang_38 
T10D4202:178b-27	klu'i rgyal po gnas dros po lags te deng song	klu_0 rgyal_6 po_12 gnas_15 dro_20 po_25 lags_28 te_33 deng_36 'gro_41 
T10D4202:178b-28	gi bar du yang mngon rtags dang mtshan ma dag	gi_0 ba_3 du_7 yang_10 mngon_15 rtags_21 dang_27 mtshan_32 ma_39 'dag_42 
T10D4202:178b-29	kyang 'byung ba'i phyir /	kyang_0 'byung_6 ba_13 phyir_18 
T10D4202:178b-30	li yul gyi gtsug lag khang bzhugs so 'tshal gyi nang na gtso bor bgyi ba lags /	li_0 yul_3 gyi_7 gtsug_11 lag_17 khang_21 bzhugs_27 so_34 'tshal_37 gyi_44 nang_48 na_53 gtso_56 'bor_61 bgyid_65 ba_70 lags_73 
T10D4202:178b-31	rgyal po bi dza ya b'iryas 'gum tir gyi gtsug	rgyal_0 po_6 bi_9 dza_12 ya_16 b_19 'gum_27 tir_32 gyi_36 gtsug_40 
T10D4202:178b-32	lag khang brtsigs tshun chad rgyal po rabs gnyis kyi	lag_0 khang_4 brtsigs_10 tshun_18 'chad_24 rgyal_29 po_35 rabs_38 gnyis_43 kyi_49 
T10D4202:178b-33	bar du gtsug lag khang gzhan ma brtsigs /	ba_0 du_4 gtsug_7 lag_13 khang_17 gzhan_23 ma_29 brtsigs_32 
T10D4202:178b-34	de nas de'i 'og tu rgyal po bi dza ya	de_0 nas_3 de_7 'og_12 tu_16 rgyal_19 po_25 bi_28 dza_31 ya_35 
T10D4202:178b-35	dza ya zhes bgyi bas rgya rje'i bu mo bu	dza_0 ya_4 zhes_7 bgyid_12 ba_17 rgya_21 rje_26 bu_32 mo_35 bu_38 
T10D4202:178b-36	nye shva ra zhes bgyi ba mchis 'brang du blangs	nye_0 shva_4 ra_9 zhes_12 bgyid_17 ba_22 mchis_25 'brang_31 du_38 blangs_41 
T10D4202:178b-37	nas rgya rje'i bu mo des li yul du srin	nas_0 rgya_4 rje_9 bu_15 mo_18 des_21 li_25 yul_28 du_32 srin_35 
T10D4202:178b-38	bu'i sa bon zhig 'tshal te mchis nas yul ma	bu_0 sa_5 bon_8 'jig_12 'tshal_17 te_24 mchis_27 nas_33 yul_37 ma_41 
T10D4202:178b-39	sha bgyi bar srin bu gsos pa dang /	sha_0 bgyid_4 ba_9 srin_13 bu_18 gsos_21 ba_26 dang_29 
T10D4202:178b-40	srin bu ma tshar ba'i skabs su blon po rgyus	srin_0 bu_5 ma_8 tshar_11 ba_17 skabs_22 su_28 blon_31 po_36 rgyus_39 
T10D4202:178b-41	ma 'tshal ba kha cig gis rgyal po bi dza	ma_0 'tshal_3 ba_10 kha_13 cig_17 gis_21 rgyal_25 po_31 bi_34 dza_37 
T10D4202:178b-42	ya dza ya rgya rje'i bu mo rgyal po'i btsun	ya_0 dza_3 ya_7 rgya_10 rje_15 bu_21 mo_24 rgyal_27 po_33 btsun_38 
T10D4202:178b-43	mo bgyid pa des sprul gdug pa mang po ma	mo_0 bgyid_3 ba_9 des_12 sprul_16 gdug_22 ba_27 mang_30 po_35 ma_38 
T10D4202:179a-0	zhar gso zhing mchis te chen por gyur @179a *	zhar_0 gso_5 zhing_9 mchis_15 te_21 chen_24 por_29 gyur_33 
T10D4202:179a-1	// pa dang /	ba_3 dang_6 
T10D4202:179a-2	yul phyogs su gnod par glo ba chung na ji	yul_0 phyogs_4 su_11 gnod_14 ba_19 glo_23 ba_27 chung_30 na_36 ji_39 
T10D4202:179a-3	ltar bgyi zhes blon po dag gis zhus pa dang	ltar_0 bgyid_5 zhes_10 blon_15 po_20 'dag_23 gis_27 zhus_31 ba_36 dang_39 
T10D4202:179a-4	/ sbrul gso ba'i khang par mes thong la kun sregs shig ces bsgo ba dang /	sbrul_2 gso_8 ba_12 khang_17 ba_23 mes_27 thong_31 la_37 kun_40 sregs_44 shig_50 ces_55 sgo_59 ba_64 dang_67 
T10D4202:179a-5	rgyal mos de thos nas 'phral du ni rgyal po la rgyus kyis bshad pa'i rdo ma thogs nas /	rgyal_0 mos_6 de_10 thos_13 nas_18 'phral_22 du_29 ni_32 rgyal_35 po_41 la_44 rgyus_47 kyis_53 'chad_58 ba_64 rdo_69 ma_73 thogs_76 nas_82 
T10D4202:179a-6	srin bu shas shig bskus te gsang thabs su gsos te /	srin_0 bu_5 shas_8 shig_13 skud_18 te_24 gsang_27 thabs_33 su_39 gsos_42 te_47 
T10D4202:179a-7	slad kyis kha cher dar dang srin bal phyung nas dar dang men dri btags te /	slad_0 kyis_5 kha_10 cher_14 dar_19 dang_23 srin_28 bal_33 'byin_37 nas_44 dar_48 dang_52 men_57 'dri_61 'dogs_65 te_71 
T10D4202:179a-8	rgyal po la bstan nas rgyus kyis zhib tu bshad pa dang /	rgyal_0 po_6 la_9 ston_12 nas_18 rgyus_22 kyis_28 zhib_33 tu_38 'chad_41 ba_47 dang_50 
T10D4202:179a-9	rgyal po yang 'gyod pa skyes te /	rgyal_0 po_6 yang_9 'gyod_14 ba_20 skye_23 te_29 
T10D4202:179a-10	rgya gar yul nas dge slong 'phags pa sang ghagho	rgya_0 gar_5 yul_9 nas_13 dge_17 slong_21 'phag_27 ba_34 sang_37 ghagho_42 
T10D4202:179a-11	sha zhes bgyi ba li yul du byon nas dge	sha_0 zhes_4 bgyid_9 ba_14 li_17 yul_20 du_24 'byon_27 nas_32 dge_36 
T10D4202:179a-12	ba'i bshes gnyen du spyan drangs te /	ba_0 bshes_5 gnyen_11 du_17 spyan_20 drangs_26 te_33 
T10D4202:179a-13	srin bu phal cher bkum pa'i dngos sdig bshags sbyang bgyis nas po tarya dang /	srin_0 bu_5 phal_8 cher_13 bkum_18 ba_23 dngos_28 sdig_34 'chags_39 sbyong_46 bgyid_53 nas_59 po_63 tarya_66 dang_72 
T10D4202:179a-14	ma zhi'i mchod rten dang /	ma_0 zhi_3 mchod_9 rten_15 dang_20 
T10D4202:179a-15	gtsug lag khang chen po brtsigs te /	gtsug_0 lag_6 khang_10 chen_16 po_21 brtsigs_24 te_32 
T10D4202:179a-16	de bzhin gshegs pa'i sku gdung sha ri ram mang po tsam zhig stsal te /	de_0 bzhin_3 gshegs_9 ba_16 sku_21 gdung_25 sha_31 ri_35 ram_38 mang_42 po_47 tsam_50 'jig_55 stsal_60 te_66 
T10D4202:179a-17	de'i slad du dpyid zla ra ba'i ngo thog thag	de_0 slad_5 du_10 dpyid_13 zla_19 ra_23 ba_26 ngo_31 thogs_35 thag_40 
T10D4202:179a-18	bcom ldan 'das sh'akya thub pa'i sku'i gzugs brnyan ma	'joms_0 ldan_5 'da'_10 sh_15 thub_23 ba_28 sku_33 gzugs_39 rnyan_45 ma_52 
T10D4202:179a-19	zho po tarya zhes bgyi ba'i gtsug lag khang na	zho_0 po_4 tarya_7 zhes_13 bgyid_18 ba_23 gtsug_28 lag_34 khang_38 na_44 
T10D4202:179a-20	bzhugs so zhes 'phags pa dag gis lung bstan pas	bzhugs_0 so_7 zhes_10 'phag_15 ba_22 'dag_25 gis_29 lung_33 ston_38 ba_44 
T10D4202:179a-21	deng sang gi bar du yang /	deng_0 sang_5 gi_10 ba_13 du_17 yang_20 
T10D4202:179a-22	li yul gyi dge 'dun sde gnyis dang /	li_0 yul_3 gyi_7 dge_11 'dun_15 sde_20 gnyis_24 dang_30 
T10D4202:179a-23	rgyal po dang /	rgyal_0 po_6 dang_9 
T10D4202:179a-24	blon po man chad 'bangs yan chad lo re zhing	blon_0 po_5 man_8 'chad_12 'bang_17 yan_24 'chad_28 lo_33 re_36 zhing_39 
T10D4202:179a-25	dpyid zla ra ba'i ngo la mchod par bgyid cing	dpyid_0 zla_6 ra_10 ba_13 ngo_18 la_22 mchod_25 ba_31 bgyid_35 cing_41 
T10D4202:179a-26	/ ril gyis po tarya'i gtsug lag khang du mchis te /	ril_2 gyis_6 po_11 tarya_14 gtsug_22 lag_28 khang_32 du_38 mchis_41 te_47 
T10D4202:179a-27	gtsug lag khang 'di yang gnyen zhing byin che rab ste /	gtsug_0 lag_6 khang_10 'di_16 yang_20 gnyen_25 zhing_31 byin_37 che_42 rab_46 ste_50 
T10D4202:179a-28	lha ratna ba la dang /	lha_0 ratna_4 ba_10 la_13 dang_16 
T10D4202:179a-29	ratna sh'u ra gnyis srung mar zhal gyis bzhes pa lags te /	ratna_0 sh_6 ra_11 gnyis_14 srung_20 mar_26 zhal_30 gyis_35 bzhes_40 ba_46 lags_49 te_54 
T10D4202:179a-30	deng song gi bar du yang dngos rtags dang mtshan ma dag kyang 'byung ngo //	deng_0 'gro_5 gi_10 ba_13 du_17 yang_20 dngos_25 rtags_31 dang_37 mtshan_42 ma_49 'dag_52 kyang_56 'byung_62 ngo_69 
T10D4202:179a-31	de nas rgyal po bi dza ya dza zhes bgyi ba la bu spun gsum mchis te /	de_0 nas_3 rgyal_7 po_13 bi_16 dza_19 ya_23 dza_26 zhes_30 bgyid_35 ba_40 la_43 bu_46 spun_49 gsum_54 mchis_59 te_65 
T10D4202:179a-32	phu bo rab 'dod 'dros zhes bgyi ba ni rgyal srid ma 'tshal te /	phu_0 'bo_4 rab_7 'dod_11 'dros_16 zhes_22 bgyid_27 ba_32 ni_35 rgyal_38 srid_44 ma_49 'tshal_52 te_59 
T10D4202:179a-33	bsod nams bgyid cing rgya gar yul du mchis /	bsod_0 nams_5 bgyid_10 cing_16 rgya_21 gar_26 yul_30 du_34 mchis_37 
T10D4202:179a-34	de'i nu bo bar ma yang rgyal srid ma 'tshal	de_0 nu_5 'bo_8 ba_11 ma_15 yang_18 rgyal_23 srid_29 ma_34 'tshal_37 
T10D4202:179a-35	nas bander zhugs te ming dharm'a nanda zhes btags nas	nas_0 bander_4 'jug_11 te_17 ming_20 dharm_25 nanda_33 zhes_39 'dogs_44 nas_50 
T10D4202:179a-36	rgya gar yul du chos slob tu mchis /	rgya_0 gar_5 yul_9 du_13 chos_16 slob_21 tu_26 mchis_29 
T10D4202:179a-37	nu bo tha chungs rgyal sar zhugs te ming bi	nu_0 'bo_3 tha_6 chungs_10 rgyal_17 sar_23 'jug_27 te_33 ming_36 bi_41 
T10D4202:179a-38	dza ya dharmar btags rgyal po bi dza ya dharma	dza_0 ya_4 dharmar_7 'dogs_15 rgyal_21 po_27 bi_30 dza_33 ya_37 dharma_40 
T10D4202:179a-39	de dpa' zhing rtsal chebs gsod rkyen dag la dga'	de_0 dpa'_3 zhing_8 rtsal_14 chebs_20 gsod_26 rkyen_31 'dag_37 la_41 dga'_44 
T10D4202:179b-0	nas / phu bo bande @179b dharm'annda rgya gar yul	nas_0 phu_6 'bo_10 bande_13 dharm_25 rgya_37 gar_42 yul_46 
T10D4202:179b-1	nas mchis pa chos mnyan zhing bslab nas bsgoms pas	nas_0 mchis_4 ba_10 chos_13 nyan_18 zhing_24 bslab_30 nas_36 sgom_40 ba_47 
T10D4202:179b-2	'phags pa dgra bcom par gyur te /	'phag_0 ba_7 dgra_10 'joms_15 ba_20 gyur_24 te_29 
T10D4202:179b-3	'phags pa dharm'a nandas rgya gar yul nas bltas na /	'phag_0 ba_7 dharm_10 nandas_18 rgya_25 gar_30 yul_34 nas_38 lta_42 na_48 
T10D4202:179b-4	nu bo rgyal po ba dzi ya dharma gsod rkyen	nu_0 'bo_3 rgyal_6 po_12 ba_15 dzi_18 ya_22 dharma_25 gsod_32 rkyen_37 
T10D4202:179b-5	bgyid cing sdig pa mi dge ba'i chos la zhen	bgyid_0 cing_6 sdig_11 ba_16 mi_19 dge_22 ba_26 chos_31 la_36 zhen_39 
T10D4202:179b-6	par mthong nas glo ba brjes te /	ba_0 mthong_4 nas_11 glo_15 ba_19 rje_22 te_28 
T10D4202:179b-7	dge ba'i bshes gnyen bgyi ba'i slad du rgya gar yul nas li yul du mchis te /	dge_0 ba_4 bshes_9 gnyen_15 bgyid_21 ba_26 slad_31 du_36 rgya_39 gar_44 yul_48 nas_52 li_56 yul_59 du_63 mchis_66 te_72 
T10D4202:179b-8	nyon bgyir gyi ri rtsa shel chab 'og ma dang /	nyon_0 bgyir_5 gyi_11 ri_15 rtsa_18 shel_23 chab_28 'og_33 ma_37 dang_40 
T10D4202:179b-9	nye ba zhig tu sbyil po bgyis te de na	nye_0 ba_4 'jig_7 tu_12 sbyil_15 po_21 bgyid_24 te_30 de_33 na_36 
T10D4202:179b-10	bsgom bzhugs pa las nyin gcig cig / phags pa de	bsgom_0 bzhugs_6 ba_13 las_16 nyin_20 gcig_25 cig_30 ba_42 de_45 
T10D4202:179b-11	sha ba gser gyi kha dog 'dra ba zhig tu	sha_0 ba_4 gser_7 gyi_12 kha_16 dog_20 'dra_24 ba_29 'jig_32 tu_37 
T10D4202:179b-12	sprul te ; 'u then gyi sku mkhar gyi slad	sprul_0 te_6 'u_11 then_14 gyi_19 sku_23 mkhar_27 gyi_33 slad_37 
T10D4202:179b-13	rol shar phyogs logs na 'gus no zhes bgyi ba'i	rol_0 'char_4 phyogs_9 logs_16 na_21 'gus_24 no_29 zhes_32 bgyid_37 ba_42 
T10D4202:179b-14	sgang bu zhig mchis pa'i khar byung ba dang /	sgang_0 bu_6 'jig_9 mchis_14 ba_20 khar_25 'byung_30 ba_36 dang_39 
T10D4202:179b-15	rgyal po bi dza ya dharmas srog mkhar gyi steng nas mthong nas mda' gcig 'phangs pa dang /	rgyal_0 po_6 bi_9 dza_12 ya_16 dharmas_19 srog_27 mkhar_32 gyi_38 steng_42 nas_48 mthong_52 nas_59 mda'_63 gcig_68 'phen_73 ba_81 dang_84 
T10D4202:179b-16	sha ba'i brlar phog nas sha ba ni bros /	sha_0 ba_4 brlar_9 'bogs_15 nas_20 sha_24 ba_28 ni_31 'bros_34 
T10D4202:179b-17	rgyal po ni slad bzhin du bsnyegs pa dang /	rgyal_0 po_6 ni_9 slad_12 bzhin_17 du_23 snyeg_26 ba_34 dang_37 
T10D4202:179b-18	sha ba de 'phags pa dharm'ananda'i sbyi la bu'i nang du mchis /	sha_0 ba_4 de_7 'phag_10 ba_17 dharm'i_20 sbyi_35 la_40 bu_43 nang_48 du_53 mchis_56 
T10D4202:179b-19	rgyal po slad bzhin du mchis pas bltas na spyil po'i nang na sha ba ni cang ma mchis /	rgyal_0 po_6 slad_9 bzhin_14 du_20 mchis_23 ba_29 lta_33 na_39 spyil_42 po_48 nang_53 na_58 sha_61 ba_65 ni_68 cang_71 ma_76 mchis_79 
T10D4202:179b-20	dge slong gcig brla la mdas phog pa 'byin cing mchis pa mthong nas /	dge_0 slong_4 gcig_10 brla_15 la_20 mdas_23 'bogs_28 ba_33 'byin_36 cing_42 mchis_47 ba_53 mthong_56 nas_63 
T10D4202:179b-21	phu bo lags par ni ngo ma 'tshal te /	phu_0 'bo_4 lags_7 ba_12 ni_16 ngo_19 ma_23 'tshal_26 te_33 
T10D4202:179b-22	phu bo dge slong dharm'a nandas byin gyis brlabs nas phu bo lags par gdong ngo 'tshal te /	phu_0 'bo_4 dge_7 slong_11 dharm_17 nandas_25 byin_32 gyis_37 brlabs_42 nas_49 phu_53 'bo_57 lags_60 ba_65 gdong_69 ngo_75 'tshal_79 te_86 
