T10D4202:182a-9	gu zan gyi rgyal po dang /	gu_0 zan_3 gyi_7 rgyal_11 po_17 dang_20 
T10D4202:182a-10	li rje rgyal po bi dza ya k'irti la sogs	li_0 rje_3 rgyal_7 po_13 bi_16 dza_19 ya_23 k_26 la_33 sogs_36 
T10D4202:182a-11	pas rgya gar yul du dmag drangs nas so ked	ba_0 rgya_4 gar_9 yul_13 du_17 dmag_20 drangs_25 nas_32 so_36 ked_39 
T10D4202:182a-12	ces bgyi ba'i grong khyer phab pa'i tshe /	ces_0 bgyid_4 ba_9 grong_14 'khyer_20 'bebs_26 ba_31 tshe_36 
T10D4202:182a-13	rgyal po bi dza ya k'irtis shar rim mang po	rgyal_0 po_6 bi_9 dza_12 ya_16 k_19 'char_27 rim_32 mang_36 po_41 
T10D4202:182a-14	zhig rnyed pa yang sru nyo'i mchod rten de'i nang	'jig_0 rnyed_5 ba_11 yang_14 sru_19 nyo_23 mchod_29 rten_35 de_40 nang_45 
T10D4202:182a-15	du stsal / thog ma dog sa rtog pa'i phur bu 'debs pa'i tshe /	du_0 stsal_3 thogs_11 ma_16 dog_19 sa_23 rtogs_26 ba_31 'phur_36 bu_41 'debs_44 ba_50 tshe_55 
T10D4202:182a-16	rgyal po bi dza ya k'irti la dge ba'i bshes	rgyal_0 po_6 bi_9 dza_12 ya_16 k_19 la_26 dge_29 ba_33 bshes_38 
T10D4202:182a-17	gnyen 'phags pa spyi bri'i zhal nas phur bu 'di	gnyen_0 'phag_6 ba_13 spyi_16 'bri_21 zhal_27 nas_32 'phur_36 bu_41 'di_44 
T10D4202:182a-18	la rgyal pos lag pa mas yar lan lngar bya	la_0 rgyal_3 pos_9 lag_13 ba_17 mas_20 yar_24 lan_28 lngar_32 byed_38 
T10D4202:182a-19	bas na mngon rtags 'byung ngo zhes bgyid pa dang	ba_0 na_4 mngon_7 rtags_13 'byung_19 ngo_26 zhes_30 bgyid_35 ba_41 dang_44 
T10D4202:182a-20	/ rgyal pos kyang dogs brtag pa'i shug pa'i phur bu la lhag pas lan lngar byabs pa dang /	rgyal_2 pos_8 kyang_12 dogs_18 rtog_23 ba_29 shug_34 ba_39 'phur_44 bu_49 la_52 lhag_55 ba_60 lan_64 lngar_68 byab_74 ba_80 dang_83 
T10D4202:182a-21	phur bu de la shug pa'i yal kha khru gang	'phur_0 bu_5 de_8 la_11 shug_14 ba_19 yal_24 kha_28 khru_32 gang_37 
T10D4202:182a-22	pa lnga de ma thag tu de'i nyin par skyes	ba_0 lnga_3 de_8 ma_11 thag_14 tu_19 de_22 nyin_27 ba_32 skye_36 
T10D4202:182a-23	nas slad kyis shug pa de'i drung du bande dag	nas_0 slad_4 kyis_9 shug_14 ba_19 de_22 drung_27 du_33 bande_36 'dag_42 
T10D4202:182a-24	gis dharma bklags pa dang shug pa de las chos	gis_0 dharma_4 bklags_11 ba_18 dang_21 shug_26 ba_31 de_34 las_37 chos_41 
T10D4202:182a-25	bshad pa'i sgra dag byung nas slad kyis bande gzhon	'chad_0 ba_6 sgra_11 'dag_16 'byung_20 nas_26 slad_30 kyis_35 bande_40 gzhon_46 
T10D4202:182a-26	nu dag dharma thogs te chos nyan pa mchis na	nu_0 'dag_3 dharma_7 thogs_14 te_20 chos_23 nyan_28 ba_33 mchis_36 na_42 
T10D4202:182a-27	yang / de bzhin du chos 'chad pa'i sgra dag	yang_0 de_7 bzhin_10 du_16 chos_19 'chad_24 ba_30 sgra_35 'dag_40 
T10D4202:182a-28	byung ba las slad kyis bande gcig gis dharma log	'byung_0 ba_6 las_9 slad_13 kyis_18 bande_23 gcig_29 gis_34 dharma_38 log_45 
T10D4202:182a-29	par bklags nas de ltar ma yin no zhes lhas	ba_0 bklags_4 nas_11 de_15 ltar_18 ma_23 yin_26 no_30 zhes_33 lhas_38 
T10D4202:182a-30	yang / bsgo ba dang / mnyan nas de tshun	yang_0 sgo_7 ba_12 dang_15 nyan_22 nas_28 de_32 tshun_35 
T10D4202:182a-31	chad chos bshad pa'i sgra yang ma byung slad kyis	'chad_0 chos_5 'chad_10 ba_16 sgra_21 yang_26 ma_31 'byung_34 slad_40 kyis_45 
T10D4202:182a-32	gtsug lag khang 'di'i chab ka chab kyis 'tshal te	gtsug_0 lag_6 khang_10 'di_16 chab_22 ka_27 chab_30 kyis_35 'tshal_40 te_47 
T10D4202:182a-33	chab ma byin nas gtsug lag khang zhig tu nye	chab_0 ma_5 byin_8 nas_13 gtsug_17 lag_23 khang_27 'jig_33 tu_38 nye_41 
T10D4202:182a-34	yang / bsgo ba dang / ba las / dge	yang_0 sgo_7 ba_12 dang_15 ba_22 las_25 dge_31 
T10D4202:182a-35	slong btsun pa sum pon zhes bgyi ba dgra bcom	slong_0 btsun_6 ba_12 sum_15 pon_19 zhes_23 bgyid_28 ba_33 dgra_36 'joms_41 
T10D4202:182a-36	du nye ba zhig gis gtsug lag khang de mi	du_0 nye_3 ba_7 'jig_10 gis_15 gtsug_19 lag_25 khang_29 de_35 mi_38 
T10D4202:182a-37	zhig par bgyi ba'i slad du dgra bcom par 'grub	'jig_0 ba_5 bgyid_9 ba_14 slad_19 du_24 dgra_27 'joms_32 ba_37 'grub_41 
T10D4202:182a-38	pa'i dge ba'i rtsa ba des klur skye bar smon	ba_0 dge_5 ba_9 rtsa_14 ba_19 des_22 klur_26 skye_31 ba_36 smon_40 
T10D4202:182a-39	lam btab nas de ma thag tu lus las chad	lam_0 'debs_4 nas_9 de_13 ma_16 thag_19 tu_24 lus_27 las_31 'chad_35 
T10D4202:182a-40	byung nas mi'i lus la 'phos par shel chu chung	'byung_0 nas_6 mi_10 lus_15 la_19 'pho_22 ba_28 shel_32 chu_37 chung_41 
T10D4202:182a-41	ngu'i klur gyur na dog sa'i 'og tu nub nas	ngu_0 klur_6 gyur_11 na_16 dog_19 sa_23 'og_28 tu_32 nub_35 nas_39 
T10D4202:182a-42	deng sang gi bar du gtsug lag khang de'i chab	deng_0 sang_5 gi_10 ba_13 du_17 gtsug_20 lag_26 khang_30 de_36 chab_41 
T10D4202:182a-43	shel chu chung ngu las drangs te /	shel_0 chu_5 chung_9 ngu_15 las_19 drangs_23 te_30 
T10D4202:182a-44	gtsug lag khang 'di yang deng sang gi bar du ma zhig ste /	gtsug_0 lag_6 khang_10 'di_16 yang_20 deng_25 sang_30 gi_35 ba_38 du_42 ma_45 'jig_48 ste_53 
T10D4202:182a-45	gnyan zhing byin che bar bgyid /	gnyan_0 zhing_6 byin_12 che_17 ba_21 bgyid_25 
T10D4202:182b-0	srung ma yang lha su dza @182b ya dang /	srung_0 ma_6 yang_9 lha_14 su_18 dza_21 ya_31 dang_34 
T10D4202:182b-1	phyag brnyan sing ha mu kha dang /	phyag_0 rnyan_6 sing_13 ha_18 mu_21 kha_24 dang_28 
T10D4202:182b-2	shel chab chung ngu'i klu sum pon gyis srung ngo /	shel_0 chab_5 chung_10 ngu_16 klu_22 sum_26 pon_30 gyis_34 srung_39 ngo_45 
T10D4202:182b-4	// / de nas de'i 'og tu rgyal po bi dza	de_5 nas_8 de_12 'og_17 tu_21 rgyal_24 po_30 bi_33 dza_36 
T10D4202:182b-5	ya k'irti'i bu rgyal po bi dza ya sang gra	ya_0 k'i_3 bu_12 rgyal_15 po_21 bi_24 dza_27 ya_31 sang_34 gra_39 
T10D4202:182b-6	ma zhes bgyi ba dpa' zhing rtsal che ba zhig	ma_0 zhes_3 bgyid_8 ba_13 dpa'_16 zhing_21 rtsal_27 che_33 ba_37 'jig_40 
T10D4202:182b-7	byung nas / phyi dgra mang po zhig la bsdos nas sems can phal cher bkum /	'byung_0 nas_6 phyi_12 dgra_17 mang_22 po_27 'jig_30 la_35 sdo_38 nas_44 sems_48 can_53 phal_57 cher_62 bkum_67 
T10D4202:182b-8	de'i 'og tu seng ge mi la rgol ba zhig byung ste /	de_0 'og_5 tu_9 seng_12 ge_17 mi_20 la_23 rgol_26 ba_31 'jig_34 'byung_39 ste_45 
T10D4202:182b-9	dmag gis btab na yang 'khums te rgyal po gcig	dmag_0 gis_5 'debs_9 na_14 yang_17 'khums_22 te_29 rgyal_32 po_38 gcig_41 
T10D4202:182b-10	pus seng ge de la brgal te zin nas bkum	pus_0 seng_4 ge_9 de_12 la_15 rgol_18 te_24 zin_27 nas_31 bkum_35 
T10D4202:182b-11	/ de nas rgyal po de'i ming yang seng ger btags /	de_2 nas_5 rgyal_9 po_15 de_18 ming_23 yang_28 seng_33 ger_38 'dogs_42 
T10D4202:182b-12	rgyal po de yang ri dags shor du mchis pa	rgyal_0 po_6 de_9 yang_12 ri_17 dags_20 'chor_25 du_30 mchis_33 ba_39 
T10D4202:182b-13	las shel chab chung ngu'i 'gram du tshal zhig tu	las_0 shel_4 chab_9 chung_14 ngu_20 'grams_26 du_32 tshal_35 'jig_41 tu_46 
T10D4202:182b-14	dgongs btab pas / de'i nub mo tshal de'i nang	dgongs_0 'debs_7 ba_12 de_18 nub_23 mo_27 tshal_30 de_36 nang_41 
T10D4202:182b-15	nas zhugs mar 'dra ba zhig rgyang nas gda' nas	nas_0 'jug_4 mar_10 'dra_14 ba_19 'jig_22 rgyang_27 nas_34 gda'_38 nas_43 
T10D4202:182b-16	slad de nang par bltas na /	slad_0 de_5 nang_8 ba_13 lta_17 na_23 
T10D4202:182b-17	dge slong 'phags pa dgra bcom pa dzny'a na ya	dge_0 slong_4 'phag_10 ba_17 dgra_20 'joms_25 ba_30 dzny_33 na_40 ya_43 
T10D4202:182b-18	sho de na bzhugs pa las 'od byung bar mthong	sho_0 de_4 na_7 bzhugs_10 ba_17 las_20 'od_24 'byung_28 ba_34 mthong_38 
T10D4202:182b-19	nas / dad pa skyes te mchod pa bgyis nas	nas_0 dad_6 ba_10 skye_13 te_19 mchod_22 ba_28 bgyid_31 nas_37 
T10D4202:182b-20	'phags pa 'di na ci mdzad ces zhus pa dang	'phag_0 ba_7 'di_10 na_14 ci_17 mdzad_20 ces_26 zhus_30 ba_35 dang_38 
T10D4202:182b-21	nas / / dgra bcom pa dzny'a na ya sho'i	nas_0 dgra_8 'joms_13 ba_18 dzny_21 na_28 ya_31 sho_34 
T10D4202:182b-22	zhal nas sa 'di yang sngon gyi de bzhin gshegs	zhal_0 nas_5 sa_9 'di_12 yang_16 sngon_21 gyi_27 de_31 bzhin_34 gshegs_40 
T10D4202:182b-23	pas byin gyis brlabs pa lags te /	ba_0 byin_4 gyis_9 brlabs_14 ba_21 lags_24 te_29 
T10D4202:182b-24	rgyal pos 'dir gtsug lag khang cig brtsig par rigs so zhes bgyis pa dang /	rgyal_0 pos_6 'dir_10 gtsug_15 lag_21 khang_25 cig_31 brtsig_35 ba_42 rigs_46 so_51 zhes_54 bgyid_59 ba_65 dang_68 
T10D4202:182b-25	rgyal pos kyang 'phags pa de la dad pa skye	rgyal_0 pos_6 kyang_10 'phag_16 ba_23 de_26 la_29 dad_32 ba_36 skye_39 
T10D4202:182b-26	ba'i slad du bsgo ba bzhin du mnyan nas sdig	ba_0 slad_5 du_10 sgo_13 ba_18 bzhin_21 du_27 nyan_30 nas_36 sdig_40 
T10D4202:182b-27	pa bshags / gtsug lag khang gi dogs brtag pa'i phur bu btab nas /	ba_0 'chags_3 gtsug_12 lag_18 khang_22 gi_28 dogs_31 rtog_36 ba_42 'phur_47 bu_52 'debs_55 nas_60 
T10D4202:182b-28	gser gyi gzhong ba cig spyi bo la bzung ste /	gser_0 gyi_5 gzhong_9 ba_16 cig_19 spyi_23 'bo_28 la_31 bzung_34 ste_40 
T10D4202:182b-29	da bdag gis brtsigs pa gtsug lag khang 'di yun	da_0 bdag_3 gis_8 brtsigs_12 ba_20 gtsug_23 lag_29 khang_33 'di_39 yun_43 
T10D4202:182b-30	du tshugs shing brtan par 'gyur na phyogs bcu na	du_0 tshugs_3 shing_10 brtan_16 ba_22 'gyur_26 na_32 phyogs_35 'chu_42 na_46 
T10D4202:182b-31	bzhugs pa'i 'phags pa rnams kyis byin gyis brlabs shing	bzhugs_0 ba_7 'phag_12 ba_19 rnams_22 kyis_28 byin_33 gyis_38 brlabs_43 shing_50 
T10D4202:182b-32	de bzhin gshegs pa'i sku gdung bdag gi gzhong pa	de_0 bzhin_3 gshegs_9 ba_16 sku_21 gdung_25 bdag_31 gi_36 gzhong_39 ba_46 
T10D4202:182b-33	'di'i nang du stsal bar ci gnang zhes smon lam	'di_0 nang_6 du_11 stsal_14 ba_20 ci_24 gnang_27 zhes_33 smon_38 lam_43 
T10D4202:182b-34	btab pa dang / nam mkha' las sha ri ram	'debs_0 ba_5 dang_8 nam_15 mkha'_19 las_25 sha_29 ri_33 ram_36 
T10D4202:182b-35	mang po tsam zhig gzhong pa'i nang du gshegs nas	mang_0 po_5 tsam_8 'jig_13 gzhong_18 ba_25 nang_30 du_35 gshegs_38 nas_45 
T10D4202:182b-36	rgyal po sngar bas lhag par dad pa skyes te	rgyal_0 po_6 sngar_9 ba_15 lhag_19 ba_24 dad_28 ba_32 skye_35 te_41 
T10D4202:182b-37	btab pa dang / / dge ba'i bshes gnyen ya	'debs_0 ba_5 dang_8 dge_17 ba_21 bshes_26 gnyen_32 ya_38 
T10D4202:182b-38	sho'i slad du dharma k'irtis gtsug lag khang mchod rten	sho_0 slad_6 du_11 dharma_14 k_21 gtsug_29 lag_35 khang_39 mchod_45 rten_51 
T10D4202:182b-39	chen po brtsigs te /	chen_0 po_5 brtsigs_8 te_16 
T10D4202:182b-40	nang du sha ri ram mang po tsam po zhig	nang_0 du_5 sha_8 ri_12 ram_15 mang_19 po_24 tsam_27 po_32 'jig_35 
T10D4202:182b-41	stsal bas gtsug lag khang 'di yang gnyan zhing byin	stsal_0 ba_6 gtsug_10 lag_16 khang_20 'di_26 yang_30 gnyan_35 zhing_41 byin_47 
T10D4202:182b-42	che bas srung ma rnam thos kyi sras dang /	che_0 ba_4 srung_8 ma_14 rnam_17 thos_22 kyi_27 sras_31 dang_36 
T10D4202:182b-43	lha ka pi las srung /	lha_0 ka_4 pi_7 las_10 srung_14 
T10D4202:183a-0	// / de nas rgyal po ba dzi ya dharmas rgyal srid bzung @183a * //	de_5 nas_8 rgyal_12 po_18 ba_21 dzi_24 ya_28 dharmas_31 rgyal_39 srid_45 bzung_50 
T10D4202:183a-1	ba man chad /	ba_0 man_3 'chad_7 
T10D4202:183a-2	bidza ya k'irtis rgyal bo bgyis pa yan chad /	bidza_0 ya_6 k_9 rgyal_17 'bo_23 bgyid_26 ba_32 yan_35 'chad_39 
T10D4202:183a-3	rgyal po rabs bcu bzhi'i bar du res 'ga' ni /	rgyal_0 po_6 rabs_9 'chu_14 bzhi_18 ba_25 du_29 res_32 'ga'_36 ni_41 
T10D4202:183a-4	yul du phyi dgra gzhan gyis dmag drangs te gtses /	yul_0 du_4 phyi_7 dgra_12 gzhan_17 gyis_23 dmag_28 drangs_33 te_40 gtses_43 
T10D4202:183a-5	res 'ga' ni li rje dag gis yul gzhan du dmag drangs nas 'bangs kyi tshigs gyur ;	res_0 'ga'_4 ni_9 li_12 rje_15 'dag_19 gis_23 yul_27 gzhan_31 du_37 dmag_40 drangs_45 nas_52 'bang_56 kyi_63 tshigs_67 gyur_74 
T10D4202:183a-6	de'i 'og tu dru gu aa no shod kyis li yul du dmag drangs nas /	de_0 'og_5 tu_9 dru_12 gu_16 aa_19 no_22 shod_25 kyis_30 li_35 yul_38 du_42 dmag_45 drangs_50 nas_57 
T10D4202:183a-7	goo to shan man chad kyi gtsug lag khang phal cher mes bsregs te yul dams /	goo_0 to_4 shan_7 man_12 'chad_16 kyi_21 gtsug_25 lag_31 khang_35 phal_41 cher_46 mes_51 bsregs_55 te_62 yul_65 dams_69 
T10D4202:183a-8	'bangs 'gribs nas gtsug lag khang gsar pa rtsig pa'i rngo ma thogs /	'bang_0 'gribs_7 nas_14 gtsug_18 lag_24 khang_28 gsar_34 ba_39 rtsig_42 ba_48 rngo_53 ma_58 thogs_61 
T10D4202:183a-9	de nas de'i 'og tu rgyal po bi dza yak'irti'i	de_0 nas_3 de_7 'og_12 tu_16 rgyal_19 po_25 bi_28 dza_31 yak'i_35 
T10D4202:183a-10	bu rgyal po bi dza ya sang gra ma zhes	bu_0 rgyal_3 po_9 bi_12 dza_15 ya_19 sang_22 gra_27 ma_31 zhes_34 
T10D4202:183a-11	bgyi ba dgung lo bdun lon pa zhig / rgyal	bgyid_0 ba_5 dgung_8 lo_14 bdun_17 lon_22 ba_26 'jig_29 rgyal_36 
T10D4202:183a-12	por zhugs nas slad kyis mi thur son pa dang	por_0 'jug_4 nas_10 slad_14 kyis_19 mi_24 thur_27 son_32 ba_36 dang_39 
T10D4202:183a-13	/ yul 'di sus bshig / ci'i slad du dams zhes /	yul_2 'di_6 sus_10 'jig_14 ci_22 slad_27 du_32 dams_35 zhes_40 
T10D4202:183a-14	dge 'dun rgan rabs dang //	dge_0 'dun_4 rgan_9 rabs_14 dang_19 
T10D4202:183a-15	blon po dag la smras pa las /	blon_0 po_5 'dag_8 la_12 smras_15 ba_21 las_24 
T10D4202:183a-16	dge 'dun dang /	dge_0 'dun_4 dang_9 
T10D4202:183a-17	blon po rnams kyang dru gu aa mo no shod	blon_0 po_5 rnams_8 kyang_14 dru_20 gu_24 aa_27 mo_30 no_33 shod_36 
T10D4202:183a-18	la sogs pas sngon yul ji ltar bshig pa'i lo	la_0 sogs_3 ba_8 sngon_12 yul_18 ji_22 ltar_25 'jig_30 ba_36 lo_41 
T10D4202:183a-19	rgyus zhib tu bshad pa dang /	rgyus_0 zhib_6 tu_11 'chad_14 ba_20 dang_23 
T10D4202:183a-20	rgyal po bi dza ya sang gra mas blon po	rgyal_0 po_6 bi_9 dza_12 ya_16 sang_19 gra_24 mas_28 blon_32 po_37 
T10D4202:183a-21	dag la dmag tshogs ci mchis pa sdus shig ces	'dag_0 la_4 dmag_7 tshogs_12 ci_19 mchis_22 ba_28 'thu_31 shig_36 ces_41 
T10D4202:183a-22	bsgo nas sngon gtses shing /	sgo_0 nas_5 sngon_9 gtses_15 shing_21 
T10D4202:183a-23	yul bshig pa'i rgyal po rnams kyi yul du dmag drangs te /	yul_0 'jig_4 ba_10 rgyal_15 po_21 rnams_24 kyi_30 yul_34 du_38 dmag_41 drangs_46 te_53 
T10D4202:183a-24	lan glan nas yul bshig / sems can phal cher bkum /	lan_0 glan_4 nas_9 yul_13 'jig_17 sems_25 can_30 phal_34 cher_39 bkum_44 
T10D4202:183a-25	de nas slar log nas shel chab 'og ma'i 'gram du mchis pa dang /	de_0 nas_3 slar_7 log_12 nas_16 shel_20 chab_25 'og_30 ma_34 'grams_39 du_45 mchis_48 ba_54 dang_57 
T10D4202:183a-26	dge slong bdun zhig chab kyi nang du khrus bgyid cing rtsed mo sna tshogs bgyid pa mthong nas /	dge_0 slong_4 bdun_10 'jig_15 chab_20 kyi_25 nang_29 du_34 'khru_37 bgyid_43 cing_49 rtsed_54 mo_60 sna_63 tshogs_67 bgyid_74 ba_80 mthong_83 nas_90 
T10D4202:183a-27	dge slong gis tshul ma yin par byed ces byas pa dang /	dge_0 slong_4 gis_10 tshul_14 ma_20 yin_23 ba_27 byed_31 ces_36 byed_40 ba_45 dang_48 
T10D4202:183a-28	dge slong de bdun yang de ma thag tu nam	dge_0 slong_4 de_10 bdun_13 yang_18 de_23 ma_26 thag_29 tu_34 nam_37 
T10D4202:183a-29	mkha' la lding nas rgyal po de la rdzu 'phrul	mkha'_0 la_6 lding_9 nas_15 rgyal_19 po_25 de_28 la_31 rdzu_34 'phrul_39 
T10D4202:183a-30	rnam pa bcu drug bstan pa dang /	rnam_0 ba_5 'chu_8 drug_12 ston_17 ba_23 dang_26 
T10D4202:183a-31	rgyal po de'i yid la bdag gis sngar yang sems can mang po zhig srog bcad de bkum /	rgyal_0 po_6 de_9 yid_14 la_18 bdag_21 gis_26 sngar_30 yang_36 sems_41 can_46 mang_50 po_55 'jig_58 srog_63 gcod_68 de_73 bkum_76 
T10D4202:183a-32	da yang 'phags pa de rnams la ngan sems bskyed	da_0 yang_3 'phag_8 ba_15 de_18 rnams_21 la_27 ngan_30 sems_35 skyed_40 
T10D4202:183a-33	pa rab tu nyes so snyam pa'i 'gyod pa cher	ba_0 rab_3 tu_7 nyes_10 so_15 snyam_18 ba_24 'gyod_29 ba_35 cher_38 
T10D4202:183a-34	skyes / 'phags pa de dag gis rdzu 'phrul rnam	skye_0 'phag_8 ba_15 de_18 'dag_21 gis_25 rdzu_29 'phrul_34 rnam_41 
T10D4202:183a-35	pa sna tshogs bstan pa mthong nas dad pa yang	ba_0 sna_3 tshogs_7 ston_14 ba_20 mthong_23 nas_30 dad_34 ba_38 yang_41 
T10D4202:183a-36	skyes / cher skyes te / 'phags pa de dag	skye_0 cher_8 skye_13 te_19 'phag_24 ba_31 de_34 'dag_37 
T10D4202:183a-37	ga la bzhugs pa'i drung du bsnyen nas mchod pa	ga_0 la_3 bzhugs_6 ba_13 drung_18 du_24 snyen_27 nas_34 mchod_38 ba_44 
T10D4202:183a-38	skyes / cher skyes te / dang / bshags sbyangs bgyis /	skye_0 cher_8 skye_13 te_19 dang_24 'chags_31 sbyong_38 bgyid_46 
T10D4202:183a-39	bzod par gsol nas 'phags pa dgra bcom pa po	bzod_0 ba_5 gsol_9 nas_14 'phag_18 ba_25 dgra_28 'joms_33 ba_38 po_41 
T10D4202:183b-0	nyan re ta la @183b sogs pa 'phags pa bdun	nyan_0 re_5 ta_8 la_11 sogs_20 ba_25 'phag_28 ba_35 bdun_38 
T10D4202:183b-1	gyi phyir 'gu zhan gyi gtsug lag khang brtsigs te	gyi_0 phyir_4 'gu_10 zhan_14 gyi_19 gtsug_23 lag_29 khang_33 brtsigs_39 te_47 
T10D4202:183b-2	/ 'phags pa dgra bcom pa bdun gyis kyang dog sa de byin gyis brlabs nas /	'phag_2 ba_9 dgra_12 'joms_17 ba_22 bdun_25 gyis_30 kyang_35 dog_41 sa_45 de_48 byin_51 gyis_56 brlabs_61 nas_68 
T10D4202:183b-3	zhi ba'i sa dgu zhan ta zhes bgyi bar gtsug lag khang gi mtshan ma yang brtags te /	zhi_0 ba_4 sa_9 dgu_12 zhan_16 ta_21 zhes_24 bgyid_29 ba_34 gtsug_38 lag_44 khang_48 gi_54 mtshan_57 ma_64 yang_67 rtog_72 te_79 
T10D4202:183b-4	gtsug lag khang 'di yang gnyan zhing byin che rab ste /	gtsug_0 lag_6 khang_10 'di_16 yang_20 gnyan_25 zhing_31 byin_37 che_42 rab_46 ste_50 
T10D4202:183b-5	lha dzi na ri sha ba dang /	lha_0 dzi_4 na_8 ri_11 sha_14 ba_18 dang_21 
T10D4202:183b-6	nor bu bzang po gnyis kyis srung ngo /	nor_0 bu_4 bzang_7 po_13 gnyis_16 kyis_22 srung_27 ngo_33 
T10D4202:183b-8	// / de nas de'i 'og tu rgyal po bi dza ya sang gra ma'i bu /	de_5 nas_8 de_12 'og_17 tu_21 rgyal_24 po_30 bi_33 dza_36 ya_40 sang_43 gra_48 ma_52 bu_57 
T10D4202:183b-9	rgyal po bi dza ya sing ha zhes bgyi bas rgyal por zhugs nas /	rgyal_0 po_6 bi_9 dza_12 ya_16 sing_19 ha_24 zhes_27 bgyid_32 ba_37 rgyal_41 por_47 'jug_51 nas_57 
T10D4202:183b-10	dge ba'i bshes gnyen 'phags pa dgra bcom pa dharma	dge_0 ba_4 bshes_9 gnyen_15 'phag_21 ba_28 dgra_31 'joms_36 ba_41 dharma_44 
T10D4202:183b-11	pa la la 'phags pa khyod la rdzu 'phrul ci	ba_0 la_3 la_6 'phag_9 ba_16 khyod_19 la_25 rdzu_28 'phrul_33 ci_40 
T10D4202:183b-12	mnga' ba bdag la bstan par ci gnang zhes gsol	mnga'_0 ba_6 bdag_9 la_14 ston_17 ba_23 ci_27 gnang_30 zhes_36 gsol_41 
T10D4202:183b-13	pa las / 'phags pa de'i rdzu 'phrul gyis rgyal	ba_0 las_3 'phag_9 ba_16 de_19 rdzu_24 'phrul_29 gyis_36 rgyal_41 
T10D4202:183b-14	po bi dza ya sing ha dga' ldan du khrid	po_0 bi_3 dza_6 ya_10 sing_13 ha_18 dga'_21 ldan_26 du_31 'khrid_34 
T10D4202:183b-15	pa las / de / 'phags pa byams pa bzhugs pa'i gnas dang /	ba_0 las_3 de_9 'phag_14 ba_21 byams_24 ba_30 bzhugs_33 ba_40 gnas_45 dang_50 
T10D4202:183b-16	zhal bstan nas slar mchis pa dang /	zhal_0 ston_5 nas_11 slar_15 mchis_20 ba_26 dang_29 
T10D4202:183b-17	rgyal po bi dza ya sing has bzha' ser ma'i gtsug lag khang rtsigs te /	rgyal_0 po_6 bi_9 dza_12 ya_16 sing_19 has_24 bzha'_28 ser_34 ma_38 gtsug_43 lag_49 khang_53 rtsigs_59 te_66 
T10D4202:183b-18	dga' ldan na byams pa 'khor dang bcas pa ji ltar bzhugs pa'i sku gzugs bgyis /	dga'_0 ldan_5 na_10 byams_13 ba_19 'khor_22 dang_28 'cha'_33 ba_38 ji_41 ltar_44 bzhugs_49 ba_56 sku_61 gzugs_65 bgyid_71 
T10D4202:183b-19	slad kyis byams pa la mchod pa'i slad du mgon po dang /	slad_0 kyis_5 byams_10 ba_16 la_19 mchod_22 ba_28 slad_33 du_38 mgon_41 po_46 dang_49 
T10D4202:183b-20	lha klu gshegs pa rnams kyis tshul ci 'dra ba	lha_0 klu_4 gshegs_8 ba_15 rnams_18 kyis_24 tshul_29 ci_35 'dra_38 ba_43 
T10D4202:183b-21	mgon po'i rten khang zhig brtsigs nas mgon po dang	mgon_0 po_5 rten_10 khang_15 'jig_21 brtsigs_26 nas_34 mgon_38 po_43 dang_46 
T10D4202:183b-22	/ lha klu'i gzugs bgyis pa da dung yang bzhugs te /	lha_2 klu_6 gzugs_12 bgyid_18 ba_24 da_27 dung_30 yang_35 bzhugs_40 te_47 
T10D4202:183b-23	gtsug lag khang 'di yang gnyan zhing byin che bar bgyi /	gtsug_0 lag_6 khang_10 'di_16 yang_20 gnyan_25 zhing_31 byin_37 che_42 ba_46 bgyid_50 
T10D4202:183b-24	lha gangs can dang /	lha_0 gangs_4 can_10 dang_14 
T10D4202:183b-25	'brog gnas zhes bgyi bas srung /	'brog_0 gnas_6 zhes_11 bgyid_16 ba_21 srung_25 
T10D4202:183b-26	deng sang gi bar du mngon rtags dang mtshan ma dag kyang 'byung ngo /	deng_0 sang_5 gi_10 ba_13 du_17 mngon_20 rtags_26 dang_32 mtshan_37 ma_44 'dag_47 kyang_51 'byung_57 ngo_64 
T10D4202:183b-28	// / de nas de'i 'og tu yang rgyal po bi dza ya ba la man chang /	de_5 nas_8 de_12 'og_17 tu_21 yang_24 rgyal_29 po_35 bi_38 dza_41 ya_45 ba_48 la_51 man_54 chang_58 
T10D4202:183b-29	rgyal rabs drug gi bar du gtsug lag khang gzhan ma brtsigs so //	rgyal_0 rabs_6 drug_11 gi_16 ba_19 du_23 gtsug_26 lag_32 khang_36 gzhan_42 ma_48 brtsigs_51 so_59 
T10D4202:183b-30	de nas de'i 'og tu yang rgyal po bi dza	de_0 nas_3 de_7 'og_12 tu_16 yang_19 rgyal_24 po_30 bi_33 dza_36 
T10D4202:183b-31	ya ba la zhes bya ba'i bu rgyal po bi	ya_0 ba_3 la_6 zhes_9 byed_14 ba_18 bu_23 rgyal_26 po_32 bi_35 
T10D4202:183b-32	dza ya sang gra ma zhes bgyi ba rgyal por	dza_0 ya_4 sang_7 gra_12 ma_16 zhes_19 bgyid_24 ba_29 rgyal_32 por_38 
T10D4202:183b-33	bgyid pa'i tshe / cu gu pan nas tshe'u pa na'i sku gzugs nam mkha' las lding ste /	bgyid_0 ba_6 tshe_11 cu_18 gu_21 pan_24 nas_28 tshe_32 ba_39 na_42 sku_47 gzugs_51 nam_57 mkha'_61 las_67 lding_71 ste_77 
T10D4202:183b-34	li yul du gshegs pa rgyal pos mthong nas dad	li_0 yul_3 du_7 gshegs_10 ba_17 rgyal_20 pos_26 mthong_30 nas_37 dad_41 
T10D4202:183b-35	pa'i shugs kyis sangs rgyas bzhugs pa'i dri gtsang khang	ba_0 shugs_5 kyis_11 sangs_16 rgya_22 bzhugs_28 ba_35 'dri_40 gtsang_44 khang_51 
T10D4202:183b-36	brtsigs / de nas slad kyis rgyal po de'u then	brtsigs_0 de_10 nas_13 slad_17 kyis_22 rgyal_27 po_33 de_36 then_41 
T10D4202:183b-37	gyi sku mkhar gyi steng gi / byang sgo'i sgo	gyi_0 sku_4 mkhar_8 gyi_14 steng_18 gi_24 byang_29 sgo_35 sgo_41 
T10D4202:184a-0	brtsigs / @184a * // khang na mchis pa zhig	brtsigs_0 khang_21 na_27 mchis_30 ba_36 'jig_39 
T10D4202:184a-1	gi tshe na ba lta na sku mkhar gyi slad	gi_0 tshe_3 na_8 ba_11 lta_14 na_18 sku_21 mkhar_25 gyi_31 slad_35 
T10D4202:184a-2	rol na dge slong cig khyim pa skye bo la	rol_0 na_4 dge_7 slong_11 cig_17 khyim_21 ba_27 skye_30 'bo_35 la_38 
T10D4202:184a-3	phyag 'tshal te bka' mchid mchi ba mthong nas do	phyag_0 'tshal_6 te_13 bka'_16 mchid_21 mchi_27 ba_32 mthong_35 nas_42 do_46 
T10D4202:184a-4	mtshar du mthong ste /	mtshar_0 du_7 mthong_10 ste_17 
T10D4202:184a-5	rgyal po des blon po zhig mngags nas zhib tu rtog tu btang ba las /	rgyal_0 po_6 des_9 blon_13 po_18 'jig_21 mngag_26 nas_33 zhib_37 tu_42 rtogs_45 tu_50 gtong_53 ba_59 las_62 
T10D4202:184a-6	blon po des dge slong dang /	blon_0 po_5 des_8 dge_12 slong_16 dang_22 
T10D4202:184a-7	skye bo la so sor rmas nas dge slong gi	skye_0 'bo_5 la_8 so_11 sor_14 rmas_18 nas_23 dge_27 slong_31 gi_37 
T10D4202:184a-8	mchid sa khyim pa skye bo 'di ni 'phags pa	mchid_0 sa_6 khyim_9 ba_15 skye_18 'bo_23 'di_26 ni_30 'phag_33 ba_40 
T10D4202:184a-9	'jam dpal gyi sprul pa lags zhes mchi /	'jam_0 dpal_5 gyi_10 sprul_14 ba_20 lags_23 zhes_28 mchi_33 
T10D4202:184a-10	khyim pa skye ba de'i mchid nas dge slong 'di	khyim_0 ba_6 skye_9 ba_14 de_17 mchid_22 nas_28 dge_32 slong_36 'di_42 
T10D4202:184a-11	'phags pa sa'i snying po'i sprul pa lags zhes mchi	'phag_0 ba_7 sa_10 snying_15 po_22 sprul_27 ba_33 lags_36 zhes_41 mchi_46 
T10D4202:184a-12	ba dang / blon po des kyang rgyal po la de bzhin du slar gsol ba dang /	ba_0 dang_3 blon_10 po_15 des_18 kyang_22 rgyal_28 po_34 la_37 de_40 bzhin_43 du_49 slar_52 gsol_57 ba_62 dang_65 
T10D4202:184a-13	rgyal po bi dza ya sang gram yang de ma	rgyal_0 po_6 bi_9 dza_12 ya_16 sang_19 'grams_24 yang_29 de_34 ma_37 
T10D4202:184a-14	thag tu 'phags pa de dag gi drung du bsnyen	thag_0 tu_5 'phag_8 ba_15 de_18 'dag_21 gi_25 drung_28 du_34 snyen_37 
T10D4202:184a-15	nas phyag 'tshal mchod pa bgyis nas /	nas_0 phyag_4 'tshal_10 mchod_17 ba_23 bgyid_26 nas_32 
T10D4202:184a-16	'phags pa dag ga las gshegs zhes zhus pa dang /	'phag_0 ba_7 'dag_10 ga_14 las_17 gshegs_21 zhes_28 zhus_33 ba_38 dang_41 
T10D4202:184a-17	'phags pa gnyis kyi zhal nas bdag cag gnyis kyang	'phag_0 ba_7 gnyis_10 kyi_16 zhal_20 nas_25 bdag_29 cag_34 gnyis_38 kyang_44 
T10D4202:184a-18	shar phyogs de bzhin gshegs pa mi 'khrugs pa'i sangs	'char_0 phyogs_5 de_12 bzhin_15 gshegs_21 ba_28 mi_31 'khrugs_34 ba_42 sangs_47 
T10D4202:184a-19	rgyas kyi zhing nas sems can gyi don la 'dir	rgya_0 kyi_6 zhing_10 nas_16 sems_20 can_25 gyi_29 don_33 la_37 'dir_40 
T10D4202:184a-20	'ongs so zhes 'byung ba dang /	'ongs_0 so_6 zhes_9 'byung_14 ba_21 dang_24 
T10D4202:184a-21	de nas rgyal po bi dza yas sad gra ma'i	de_0 nas_3 rgyal_7 po_13 bi_16 dza_19 yas_23 sad_27 gra_31 ma_35 
T10D4202:184a-22	mchid nas 'phags pa thugs rje dang ldan pa gnyis	mchid_0 nas_6 'phag_10 ba_17 thugs_20 rje_26 dang_30 ldan_35 ba_40 gnyis_43 
T10D4202:184a-23	kyis rdzu 'phrul gyi mthu stobs kyis /	kyis_0 rdzu_5 'phrul_10 gyi_17 mthu_21 stobs_26 kyis_32 
T10D4202:184a-24	de bzhin gshegs pa mi 'khrugs pa'i sangs rgyas kyi	de_0 bzhin_3 gshegs_9 ba_16 mi_19 'khrugs_22 ba_30 sangs_35 rgya_41 kyi_47 
T10D4202:184a-25	zhing bdag la bstan par ci gnang zhes gsol pa	zhing_0 bdag_6 la_11 ston_14 ba_20 ci_24 gnang_27 zhes_33 gsol_38 ba_43 
T10D4202:184a-26	dang / de bzhin du gnang nas de bzhin gshags pa mi 'khrugs pa'i zhal nas /	dang_0 de_7 bzhin_10 du_16 gnang_19 nas_25 de_29 bzhin_32 gshags_38 ba_45 mi_48 'khrugs_51 ba_59 zhal_64 nas_69 
T10D4202:184a-27	sangs rgyas kyi zhing yang bstan pa dang /	sangs_0 rgya_6 kyi_12 zhing_16 yang_22 ston_27 ba_33 dang_36 
T10D4202:184a-28	rgyal po des de bzhin gshegs pa'i sku dang /	rgyal_0 po_6 des_9 de_13 bzhin_16 gshegs_22 ba_29 sku_34 dang_38 
T10D4202:184a-29	sangs rgyas kyi zhing yang mthong /	sangs_0 rgya_6 kyi_12 zhing_16 yang_22 mthong_27 
T10D4202:184a-30	nam mkha' las shing rta'i steng nas sangs rgyas mang po zhig gshegs nas /	nam_0 mkha'_4 las_10 shing_14 rta_20 steng_26 nas_32 sangs_36 rgya_42 mang_48 po_53 'jig_56 gshegs_61 nas_68 
T10D4202:184a-31	de dag gis 'od zer btang brgyal po'i spyi bor rig par mthong ste /	de_0 'dag_3 gis_7 'od_11 zer_15 gtong_19 brgyal_25 po_32 spyi_37 'bor_42 rig_46 ba_50 mthong_54 ste_61 
