T10D4202:168b-0	@168b ` // li yul lung bstan pa bzhugs so//	li_11 yul_14 lung_18 ston_23 ba_29 bzhugs_32 
T10D4202:168b-2	# // li'i yul lung bstan pa /	li_5 yul_10 lung_14 ston_19 ba_25 
T10D4202:168b-3	dkon mchog gsum la phyag 'tshal lo //	dkon(d)_0 mchog_5 gsum_11 la_16 phyag_19 'tshal_25 lo_32 
T10D4202:168b-4	li yul byung nas li'i rgyal po rabs drug ni 'das /	li_0 yul_3 'byung_7 nas_13 li_17 rgyal_22 po_28 rabs_31 drug_36 ni_41 'da'_44 
T10D4202:168b-5	rabs bdun gyi rgyal po bi dza ya k'irti zhes bya ba'i tshe na /	rabs_0 bdun_5 gyi_10 rgyal_14 po_20 bi_23 dza_26 ya_30 k_33 zhes_40 byed_45 ba_49 tshe_54 na_59 
T10D4202:168b-6	sang ka ya pra ha na ya'i gtsug lag khang	sang_0 ka_5 ya_8 pra_11 ha_15 na_18 ya_21 gtsug_26 lag_32 khang_36 
T10D4202:168b-7	dang nye ba'i lung pa sa ka ya byi ri	dang_0 nye_5 ba_9 lung_14 ba_19 sa_22 ka_25 ya_28 'byi_31 ri_35 
T10D4202:168b-8	zhes bya ba na /	zhes_0 byed_5 ba_9 na_12 
T10D4202:168b-9	sang gha bardha na zhes bya ba'i dgra bcom pa zhig bzhugs te //	sang_0 gha_5 bardha_9 na_16 zhes_19 byed_24 ba_28 dgra_33 'joms_38 ba_43 'jig_46 bzhugs_51 te_58 
T10D4202:168b-10	de'i slob ma ban de zhig 'dul ba la slob ba las ban des tsandra garbha dang /	de_0 slob_5 ma_10 ban_13 de_17 'jig_20 'dul_25 ba_30 la_33 slob_36 ba_41 las_44 ban_48 des_52 tsandra_56 garbha_64 dang_71 
T10D4202:168b-11	'dul ba'i dar ma sangs rgyas kyi lung mthong nas dgra bcom pa la zhus pa /	'dul_0 ba_5 dar_10 ma_14 sangs_17 rgya_23 kyi_29 lung_33 mthong_38 nas_45 dgra_49 'joms_54 ba_59 la_62 zhus_65 ba_70 
T10D4202:168b-12	li yul dang /	li_0 yul_3 dang_7 
T10D4202:168b-13	shu lig dang /	shu_0 lig_4 dang_8 
T10D4202:168b-14	aan se 'di gsum na sangs rgyas mya ngan las	aan_0 se_4 'di_7 gsum_11 na_16 sangs_19 rgya_25 mya_31 ngan_35 las_40 
T10D4202:168b-15	'das pa'i 'og tu dam pa'i chos kyi gzugs brnyan	'da'_0 ba_5 'og_10 tu_14 dam_17 ba_21 chos_26 kyi_31 gzugs_35 rnyan_41 
T10D4202:168b-16	dang / mchod rten bzhugs pa rnams dus ji tsam zhig na nub /	dang_0 mchod_7 rten_13 bzhugs_18 ba_25 rnams_28 dus_34 ji_38 tsam_41 'jig_46 na_51 nub_54 
T10D4202:168b-17	sus ni bshig / mthar ji ltar 'chi ba bshad cing lung bstan par gsol pa las /	sus_0 ni_4 'jig_7 mthar_15 ji_21 ltar_24 'chi_29 ba_34 'chad_37 cing_43 lung_48 ston_53 ba_59 gsol_63 ba_68 las_71 
T10D4202:168b-18	dgra bcom pas bka' stsal pa /	dgra_0 'joms_5 ba_10 bka'_14 stsal_19 ba_25 
T10D4202:168b-19	'di lta bu'i the tshom zhus pa ni dge'o //	'di_0 lta_4 bu_8 the_13 tshom_17 zhus_23 ba_28 ni_31 dge_34 
T10D4202:168b-20	sangs rgyas sh'akya thub pa mya ngan las 'das pa'i	sangs_0 rgya_6 sh_12 thub_20 ba_25 mya_28 ngan_32 las_37 'da'_41 ba_46 
T10D4202:168b-21	'og tu chos kyi gzugs brnyan dang ring bsrel lo	'og_0 tu_4 chos_7 kyi_12 gzugs_16 rnyan_22 dang_29 ring_34 bsrel_39 lo_45 
T10D4202:168b-22	nyis stong du gnas nas nub par 'gyur ro //	nyis_0 stong_5 du_11 gnas_14 nas_19 nub_23 ba_27 'gyur_31 ro_37 
T10D4202:168b-23	yul 'di gsum du rgya dang /	yul_0 'di_4 gsum_8 du_13 rgya_16 dang_21 
T10D4202:168b-24	gdong dmar dang /	gdong_0 dmar_6 dang_11 
T10D4202:168b-25	so byi dang /	so_0 'byi_3 dang_7 
T10D4202:168b-26	drug gu dang /	drug_0 gu_5 dang_8 
T10D4202:168b-27	hor la sogs pa dgra phal cher g-yos nas rtsod cing 'khrug par 'ong ste /	hor_0 la_4 sogs_7 ba_12 dgra_15 phal_20 cher_25 g-yos_30 nas_36 rtsod_40 cing_46 'khrug_51 ba_58 'ong_62 ste_67 
T10D4202:168b-28	de bas na sangs rgyas kyis chos nyams shing mchod	de_0 ba_3 na_7 sangs_10 rgya_16 kyis_22 chos_27 nyams_32 shing_38 mchod_44 
T10D4202:168b-29	rten yang phal cher re'u rul du 'gyur ba bshig	rten_0 yang_5 phal_10 cher_15 re_20 rul_25 du_29 'gyur_32 ba_38 'jig_41 
T10D4202:168b-30	cing zhig ste / dge 'dun gyi 'tsho pa'i yo byad kyang 'chad par 'ong ngo //	cing_0 'jig_5 ste_10 dge_16 'dun_20 gyi_25 'tsho_29 ba_35 yo_40 byad_43 kyang_48 'chad_54 ba_60 'ong_64 ngo_69 
T10D4202:168b-31	yul 'di gsum la yang aan se dang /	yul_0 'di_4 gsum_8 la_13 yang_16 aan_21 se_25 dang_28 
T10D4202:168b-32	shul gi ni chos mi byed ba'i dgra mang pos dkrugs te /	shul_0 gi_5 ni_8 chos_11 mi_16 byed_19 ba_24 dgra_29 mang_34 pos_39 dkrug_43 te_50 
T10D4202:168b-33	phal cher ni bsregs bshig ste stongs par 'gyur ro //	phal_0 cher_5 ni_10 bsregs_13 'jig_20 ste_26 stongs_30 ba_37 'gyur_41 ro_47 
T10D4202:168b-34	gtsug lag khang 'di rnams kyi ban de yang phal cher li yul du 'ong ngo //	gtsug_0 lag_6 khang_10 'di_16 rnams_20 kyi_26 ban_30 de_34 yang_37 phal_42 cher_47 li_52 yul_55 du_59 'ong_62 ngo_67 
T10D4202:169a-0	li yul gyi gtsug lag khang @169a * //	li_0 yul_3 gyi_7 gtsug_11 lag_17 khang_21 
T10D4202:169a-1	dang mchod rten la sogs pa na byang chub sems dpa' lnga brgya bzhugs te /	dang_0 mchod_5 rten_11 la_16 sogs_19 ba_24 na_27 byang_30 chub_36 sems_41 dpa'_46 lnga_51 brgya_56 bzhugs_62 te_69 
T10D4202:169a-2	nyis brgya lnga bcu ni rab tu byung ba'i tshul du bzhugs /	nyis_0 brgya_5 lnga_11 'chu_16 ni_20 rab_23 tu_27 'byung_30 ba_36 tshul_41 du_47 bzhugs_50 
T10D4202:169a-3	nyis brgya lnga bcu ni khyim pa'i nang du skye ba blangs te bzhugs /	nyis_0 brgya_5 lnga_11 'chu_16 ni_20 khyim_23 ba_29 nang_34 du_39 skye_42 ba_47 blangs_50 te_57 bzhugs_60 
T10D4202:169a-4	'ge'u to shan gyi gtsug lag khang mi bskal pa	'ge_0 to_6 shan_9 gyi_14 gtsug_18 lag_24 khang_28 mi_34 bskal_37 ba_43 
T10D4202:169a-5	bzang po'i sangs rgyas stong rtsa lnga'i zhabs kyis bcags	bzang_0 po_6 sangs_11 rgya_17 stong_23 rtsa_29 lnga_34 zhabs_41 kyis_47 'jags_52 
T10D4202:169a-6	shing rgyun mi 'chad par gnas pa'i pho brang du	shing_0 rgyun_6 mi_12 'chad_15 ba_21 gnas_25 ba_30 pho_35 brang_39 du_45 
T10D4202:169a-7	'gyur ro // 'phags pa 'di rnams kyi che ba dang /	'gyur_0 ro_6 'phag_12 ba_19 'di_22 rnams_26 kyi_32 che_36 ba_40 dang_43 
T10D4202:169a-8	thugs rje dang /	thugs_0 rje_6 dang_10 
T10D4202:169a-9	byin gyi rlabs kyis li yul gyi mchod rten dang /	byin_0 gyi_5 rlabs_9 kyis_15 li_20 yul_23 gyi_27 mchod_31 rten_37 dang_42 
T10D4202:169a-10	dam pa'i chos spyod pa dang /	dam_0 ba_4 chos_9 spyod_14 ba_20 dang_23 
T10D4202:169a-11	yang yul gzhan las rgyas shing yun ring du gnas so ;	yang_0 yul_5 gzhan_9 las_15 rgya_19 shing_25 yun_31 ring_35 du_40 gnas_43 so_48 
T10D4202:169a-12	/ rgyal po phal po che li yul 'dod pa'i phyir rtsod cing 'thabs te /	rgyal_2 po_8 phal_11 po_16 che_19 li_23 yul_26 'dod_30 ba_35 phyir_40 rtsod_46 cing_52 'thabs_57 te_64 
T10D4202:169a-13	gang gis thob pa'i rgyal po de yang li yul gyi yon bdag chen por 'gyur te /	gang_0 gis_5 'thob_9 ba_14 rgyal_19 po_25 de_28 yang_31 li_36 yul_39 gyi_43 yon_47 bdag_51 chen_56 por_61 'gyur_65 te_71 
T10D4202:169a-14	mi bshig mi 'bri bar byed cing mchod par 'ong ngo //	mi_0 'jig_3 mi_9 'bri_12 ba_17 byed_21 cing_26 mchod_31 ba_37 'ong_41 ngo_46 
T10D4202:169a-15	de'i dus na gdong dmar gyi rgyal po zhes bya	de_0 dus_5 na_9 gdong_12 dmar_18 gyi_23 rgyal_27 po_33 zhes_36 byed_41 
T10D4202:169a-16	ba dbang thang dang mthu skyes nas yul khams gzhan	ba_0 dbang_3 thang_9 dang_15 mthu_20 skye_25 nas_31 yul_35 khams_39 gzhan_45 
T10D4202:169a-17	mang du phrogs bzung ngo //	mang_0 du_5 'phrog_8 bzung_15 ngo_21 
T10D4202:169a-18	de'i tshe na byang chub sems dpa' gcig gdong dmar gyi rgyal po'i skye ba blangs te /	de_0 tshe_5 na_10 byang_13 chub_19 sems_24 dpa'_29 gcig_34 gdong_39 dmar_45 gyi_50 rgyal_54 po_60 skye_65 ba_70 blangs_73 te_80 
T10D4202:169a-19	bod khams su dam pa'i chos 'byung ngo //	'bod_0 khams_4 su_10 dam_13 ba_17 chos_22 'byung_27 ngo_34 
T10D4202:169a-20	yul khams gzhan nas kyang chos kyi mkhan po dang /	yul_0 khams_4 gzhan_10 nas_16 kyang_20 chos_26 kyi_31 mkhan_35 po_41 dang_44 
T10D4202:169a-21	gsung rab mdo sde la sogs pa spyan drangs so //	gsung_0 rab_6 mdo_10 sde_14 la_18 sogs_21 ba_26 spyan_29 drangs_35 so_42 
T10D4202:169a-22	gdong dmar gyi yul du gtsug lag khang dang /	gdong_0 dmar_6 gyi_11 yul_15 du_19 gtsug_22 lag_28 khang_32 dang_38 
T10D4202:169a-23	mchod rten mang du brtsigs /	mchod_0 rten_6 mang_11 du_16 brtsigs_19 
T10D4202:169a-24	dge 'dun sde gnyis btsugs /	dge_0 'dun_4 sde_9 gnyis_13 btsugs_19 
T10D4202:169a-25	rgyal po dang blon po la sogs pa dkor ril gyis dam pa'i chos la spyod /	rgyal_0 po_6 dang_9 blon_14 po_19 la_22 sogs_25 ba_30 dkor_33 ril_38 gyis_42 dam_47 ba_51 chos_56 la_61 spyod_64 
T10D4202:169a-26	rgyal po gdong dmar de'i tshe li yul yang rgyal po de'i rigs su dbang bar 'gyur ro //	rgyal_0 po_6 gdong_9 dmar_15 de_20 tshe_25 li_30 yul_33 yang_37 rgyal_42 po_48 de_51 rigs_56 su_61 dbang_64 ba_70 'gyur_74 ro_80 
T10D4202:169a-27	dam pa'i chos dang /	dam_0 ba_4 chos_9 dang_14 
T10D4202:169a-28	mchod rten la sogs pa'i dkon mchog gsum gyi mnga' ris mi 'bri /	mchod_0 rten_6 la_11 sogs_14 ba_19 dkon(d)_24 mchog_29 gsum_35 gyi_40 mnga'_44 ris_50 mi_54 'bri_57 
T10D4202:169a-29	rgyas par btsugs shing mchod do //	rgya_0 ba_6 btsugs_10 shing_17 mchod_23 do_29 
T10D4202:169a-30	rgyal po gdong dmar gyi rgyud rabs bdun du dam pa'i chos spyod par 'gyur ro //	rgyal_0 po_6 gdong_9 dmar_15 gyi_20 brgyud_24 rabs_30 bdun_35 du_40 dam_43 ba_47 chos_52 spyod_57 ba_63 'gyur_67 ro_73 
T10D4202:169a-31	rgyal po 'di'i rabs bdun du yul khams gzhan na	rgyal_0 po_6 'di_9 rabs_15 bdun_20 du_25 yul_28 khams_32 gzhan_38 na_44 
T10D4202:169a-32	dkon mchog gsum gyi mchod rten bzhugs pa la ngan	dkon(d)_0 mchog_5 gsum_11 gyi_16 mchod_20 rten_26 bzhugs_31 ba_38 la_41 ngan_44 
T10D4202:169a-33	sems dang gnod pa mi byed do //	sems_0 dang_5 gnod_10 ba_15 mi_18 byed_21 do_26 
T10D4202:169a-34	de'i dus na li yul gyi dge 'dun yang tsan	de_0 dus_5 na_9 li_12 yul_15 gyi_19 dge_23 'dun_27 yang_32 tsan_37 
T10D4202:169a-35	dra garbha'i lung bstan pa las 'byung ba bzhin du	'dra_0 garbha_4 lung_13 ston_18 ba_24 las_27 'byung_31 ba_38 bzhin_41 du_47 
T10D4202:169a-36	dad pa bri / chos khrims dang mi ldan /	dad_0 ba_4 'bri_7 chos_13 khrims_18 dang_25 mi_30 ldan_33 
T10D4202:169a-37	'jig rten gyi khe dang grags pa tshol /	'jig_0 rten_5 gyi_10 khe_14 dang_18 grags_23 ba_29 tshol_32 
T10D4202:169a-38	rgyal po dang blon po'i dku gtsang gi nang du	rgyal_0 po_6 dang_9 blon_14 po_19 dku_24 gtsang_28 gi_35 nang_38 du_43 
T10D4202:169b-0	'jug cid dam pa'i chos dman par byed pa @169b	'jug_0 cid_5 dam_9 ba_13 chos_18 dman_23 ba_28 byed_32 ba_37 
T10D4202:169b-1	dag kyang mang du 'byung ste /	'dag_0 kyang_4 mang_10 du_15 'byung_18 ste_25 
T10D4202:169b-2	de'i tshe zhang blon dang /	de_0 tshe_5 zhang_10 blon_16 dang_21 
T10D4202:169b-3	zhang blon gyi bu tsha yang dad pa 'bri bar 'gyur ro //	zhang_0 blon_6 gyi_11 bu_15 tsha_18 yang_23 dad_28 ba_32 'bri_35 ba_40 'gyur_44 ro_50 
T10D4202:169b-4	dkon mchog gsum gyi mnga' ris kyang ban des spyad pas li yul gyi mchod rten dang /	dkon(d)_0 mchog_5 gsum_11 gyi_16 mnga'_20 ris_26 kyang_30 ban_36 des_40 spyod_44 ba_50 li_54 yul_57 gyi_61 mchod_65 rten_71 dang_76 
T10D4202:169b-5	dam pa'i chos la sogs pa dkon mchog gsum gyi mnga' ris kyang mngon pas 'brir 'ong ngo //	dam_0 ba_4 chos_9 la_14 sogs_17 ba_22 dkon(d)_25 mchog_30 gsum_36 gyi_41 mnga'_45 ris_51 kyang_55 mngon_61 ba_67 'brir_71 'ong_77 ngo_82 
T10D4202:169b-6	rgyal po dang ;	rgyal_0 po_6 dang_9 
T10D4202:169b-7	blon po yang ban de de la mi dga'o //	blon_0 po_5 yang_8 ban_13 de_17 de_20 la_23 mi_26 dga_29 
T10D4202:169b-8	de'i rjes la byang chub sems dpa' cig gdong dmar	de_0 rjes_5 la_10 byang_13 chub_19 sems_24 dpa'_29 cig_34 gdong_38 dmar_44 
T10D4202:169b-9	gyi rgyal po byas pa'i rgyud rabs bdun gyi tha	gyi_0 rgyal_4 po_10 byed_13 ba_18 brgyud_23 rabs_29 bdun_34 gyi_39 tha_43 
T10D4202:169b-10	ma la rgyal po de'i chung ma rgya yul nas	ma_0 la_3 rgyal_6 po_12 de_15 chung_20 ma_26 rgya_29 yul_34 nas_38 
T10D4202:169b-11	rgya rje'i bu mo kong co byang chub sems dpa'	rgya_0 rje_5 bu_11 mo_14 kong_17 co_22 byang_25 chub_31 sems_36 dpa'_41 
T10D4202:169b-12	yin pa zhig 'khor drug brgya dang gdong dmar gyi	yin_0 ba_4 'jig_7 'khor_12 drug_18 brgya_23 dang_29 gdong_34 dmar_40 gyi_45 
T10D4202:169b-13	yul du 'ongs so //	yul_0 du_4 'ongs_7 so_13 
T10D4202:169b-14	kong co de 'phags par chos la dad dbang thang	kong_0 co_5 de_8 'phag_11 ba_18 chos_22 la_27 dad_30 dbang_34 thang_40 
T10D4202:169b-15	che bas gdong dmar gyi rgyal po yang dad pa	che_0 ba_4 gdong_8 dmar_14 gyi_19 rgyal_23 po_29 yang_32 dad_37 ba_41 
T10D4202:169b-16	che ste / sngon bas kyang dam pa'i chos rgyas par 'gyur ro //	che_0 ste_4 sngon_10 ba_16 kyang_20 dam_26 ba_30 chos_35 rgya_40 ba_46 'gyur_50 ro_56 
T10D4202:169b-17	de'i dus na li yul gyi rgyal po gzhon zhing	de_0 dus_5 na_9 li_12 yul_15 gyi_19 rgyal_23 po_29 gzhon_32 zhing_38 
T10D4202:169b-18	chos mi spyod pa zhig gis li yul gyi dge	chos_0 mi_5 spyod_8 ba_14 'jig_17 gis_22 li_26 yul_29 gyi_33 dge_37 
T10D4202:169b-19	slong rnams la bsgo ba /	slong_0 rnams_6 la_12 sgo_15 ba_20 
T10D4202:169b-20	yang na ni skye bor bo pas shig /	yang_0 na_5 ni_8 skye_11 'bor_16 'bo_20 ba_23 shig_27 
T10D4202:169b-21	yang na ni gar dga' bar dengs shig ces bskrad	yang_0 na_5 ni_8 gar_11 dga'_15 ba_20 dengs_24 shig_30 ces_35 skrod_39 
T10D4202:169b-22	nas dge 'dun ril gyis tsar ma zhes bya ba'i	nas_0 dge_4 'dun_8 ril_13 gyis_17 tsar_22 ma_27 zhes_30 byed_35 ba_39 
T10D4202:169b-23	lha khang du 'dus nas gros byed pa'i tshe /	lha_0 khang_4 du_10 'du_13 nas_18 gros_22 byed_27 ba_32 tshe_37 
T10D4202:169b-24	lha khang gi nang 'khor 'dus pa'i dkyil nas gser	lha_0 khang_4 gi_10 nang_13 'khor_18 'du_24 ba_29 dkyil_34 nas_40 gser_44 
T10D4202:169b-25	gyi zan dad gser gyi 'khur ba cha bdun byung	gyi_0 zan_4 dad_8 gser_12 gyi_17 'khur_21 ba_27 cha_30 bdun_34 'byung_39 
T10D4202:169b-26	nas dge slong lnga stong rgyal pos 'tsho ba bcad	nas_0 dge_4 slong_8 lnga_14 stong_19 rgyal_25 pos_31 'tsho_35 ba_41 gcod_44 
T10D4202:169b-27	de / mi 'byor ba'i zla ba gsum du 'tsho ba'i zong du 'gyur /	de_0 mi_5 'byor_8 ba_14 zla_19 ba_23 gsum_26 du_31 'tsho_34 ba_40 zong_45 du_50 'gyur_53 
T10D4202:169b-28	de'i tshe de'i dus na la la ni skye por babs /	de_0 tshe_5 de_10 dus_15 na_19 la_22 la_25 ni_28 skye_31 por_36 'bab_40 
T10D4202:169b-29	ma babs pa gung du 'gro ba rnams kyang pha ma dang /	ma_0 'bab_3 ba_8 gung_11 du_16 'gro_19 ba_24 rnams_27 kyang_33 pha_39 ma_43 dang_46 
T10D4202:169b-30	gnyen 'dun dang /	gnyen_0 'dun_6 dang_11 
T10D4202:169b-31	yul sa dang 'bral ba mi dga' ste /	yul_0 sa_4 dang_7 'bral_12 ba_18 mi_21 dga'_24 ste_29 
T10D4202:169b-32	dud mo chen po 'byung ngo //	dud_0 mo_4 chen_7 po_12 'byung_15 ngo_22 
T10D4202:169b-33	dge 'dun phal mang po lam du zhugs te //	dge_0 'dun_4 phal_9 mang_14 po_19 lam_22 du_26 'jug_29 te_35 
T10D4202:169b-34	song ba las 'bong zhes bya ba'i lha khang du phyin pa dang /	'gro_0 ba_5 las_8 'bong_12 zhes_18 byed_23 ba_27 lha_32 khang_36 du_42 phyin_45 ba_51 dang_54 
T10D4202:169b-35	de na mchod rten chen po zhig bzhugs pa rlung gi rgyal po dad pa can gyis dral te /	de_0 na_3 mchod_6 rten_12 chen_17 po_22 'jig_25 bzhugs_30 ba_37 rlung_40 gi_46 rgyal_49 po_55 dad_58 ba_62 can_65 gyis_69 'dral_74 te_79 
T10D4202:169b-36	nang nas gser gyi phor pa mu tig gis bkang	nang_0 nas_5 gser_9 gyi_14 phor_18 ba_23 mu_26 tig_29 gis_33 'geng_37 
T10D4202:169b-37	ba zhig byung nas dge 'dun spyi la phul lo	ba_0 'jig_3 'byung_8 nas_14 dge_18 'dun_22 spyi_27 la_32 'bul_35 lo_40 
T10D4202:169b-38	// gzhan yon bdag dang pa can gyis 'tsho ba'i yo byad sna sna nas phul lo //	gzhan_3 yon_9 bdag_13 dang_18 ba_23 can_26 gyis_30 'tsho_35 ba_41 yo_46 byad_49 sna_54 sna_58 nas_62 'bul_66 lo_71 
T10D4202:169b-39	de nas dge 'dun rnams mdo li me skar gyi yul du phyin te /	de_0 nas_3 dge_7 'dun_11 rnams_16 mdo_22 li_26 me_29 skar_32 gyi_37 yul_41 du_45 phyin_48 te_54 
T10D4202:169b-40	mu tig gis zla ba phyed kyi 'tsho ba'i yo byad sbyar ro //	mu_0 tig_3 gis_7 zla_11 ba_15 phyed_18 kyi_24 'tsho_28 ba_34 yo_39 byad_42 sbyor_47 ro_53 
T10D4202:169b-41	me skar nas song te /	me_0 skar_3 nas_8 'gro_12 te_17 
T10D4202:169b-42	rkong nya zhes bya ba'i lha khang na dge 'dun bzhugs pa'i tshe bee shra ma na dang /	rkong_0 nya_6 zhes_10 byed_15 ba_19 lha_24 khang_28 na_34 dge_37 'dun_41 bzhugs_46 ba_53 tshe_58 bee_63 shra_67 ma_72 na_75 dang_78 
T10D4202:169b-43	dpal gyi lha mo mi khyo shug tu sprul nas yul de na 'dug ste /	dpal_0 gyi_5 lha_9 mo_13 mi_16 khyo_19 shug_24 tu_29 sprul_32 nas_38 yul_42 de_46 na_49 'dug_52 ste_57 
T10D4202:170a-0	@170a * // dge 'dun thams cad la bdag cag bsod nams bgyid do zhes gsol nas //	dge_11 'dun_15 thams_20 cad_26 la_30 bdag_33 cag_38 bsod_42 nams_47 bgyid_52 do_58 zhes_61 gsol_66 nas_71 
T10D4202:170a-1	zla ba phyed kyi bar du dge 'dun la mchod	zla_0 ba_4 phyed_7 kyi_13 ba_17 du_21 dge_24 'dun_28 la_33 mchod_36 
T10D4202:170a-2	ston gsol nas dpal gyi lha mos phu rung gang	ston_0 gsol_5 nas_10 dpal_14 gyi_19 lha_23 mos_27 phu_31 rung_35 gang_40 
T10D4202:170a-3	gi gser gyi dong rtse dge 'dun spyir phul te	gi_0 gser_3 gyi_8 'dong_12 rtse_17 dge_22 'dun_26 spyir_31 'bul_37 te_42 
T10D4202:170a-4	/ dge 'dun ril gyis gdong dmar gyi yul du kha bltas te song ba las /	dge_2 'dun_6 ril_11 gyis_15 gdong_20 dmar_26 gyi_31 yul_35 du_39 kha_42 lta_46 te_52 'gro_55 ba_60 las_63 
T10D4202:170a-5	yul pha shan gyi rong du gcan pa dang phrad de ma bkye'o //	yul_0 pha_4 shan_8 gyi_13 rong_17 du_22 gcan_25 ba_30 dang_33 'phrad_38 de_44 ma_47 'gyed_50 
T10D4202:170a-6	lam gzhan yod na song zhig ces zer to //	lam_0 gzhan_4 yod_10 na_14 'gro_17 'jig_22 ces_27 zer_31 to_35 
T10D4202:170a-7	de'i tshe bi shra ma na g-yag dkar po rgal	de_0 tshe_5 bi_10 shra_13 ma_18 na_21 g-yag_24 dkar_30 po_35 rgal_38 
T10D4202:170a-8	ba can snal chu yod pa zhig tu sprul pa	ba_0 can_3 snal_7 chu_12 yod_16 ba_20 'jig_23 tu_28 sprul_31 ba_37 
T10D4202:170a-9	dge 'dun gyis mthong ste /	dge_0 'dun_4 gyis_9 mthong_14 ste_21 
T10D4202:170a-10	g-yag rgal can 'di ni mi'i phyugs yin pas 'di	g-yag_0 rgal_6 can_11 'di_15 ni_19 mi_22 phyugs_27 yin_34 ba_38 'di_42 
T10D4202:170a-11	gar 'gro ba'i phyi bzhin du 'deng zhes zer ro	gar_0 'gro_4 ba_9 phyi_14 bzhin_19 du_25 'deng_28 zhes_34 zer_39 ro_43 
T10D4202:170a-12	// de'i tshe g-yag des nye lam du drangs te //	de_3 tshe_8 g-yag_13 des_19 nye_23 lam_27 du_31 drangs_34 te_41 
T10D4202:170a-13	zhag bzhi lngas ban de ril gyis gdong dmar gyi yul tshal byi zhes bya bar phyin to //	zhag_0 bzhi_5 lngas_10 ban_16 de_20 ril_23 gyis_27 gdong_32 dmar_38 gyi_43 yul_47 tshal_51 'byi_57 zhes_61 byed_66 ba_70 phyin_74 to_80 
T10D4202:170a-14	de'i tshe yul de'i dbang pos dge 'dun mang po	de_0 tshe_5 yul_10 de_14 dbang_19 pos_25 dge_29 'dun_33 mang_38 po_43 
T10D4202:170a-15	zhig stod phyogs nas byon to zhes gdong dmar gyi	'jig_0 stod_5 phyogs_10 nas_17 'byon_21 to_26 zhes_29 gdong_34 dmar_40 gyi_45 
T10D4202:170a-16	rgyal po la sbran to //	rgyal_0 po_6 la_9 sbron_12 to_18 
T10D4202:170a-17	de'i tshe rgyal po'i btsun mos rgyal po la stong	de_0 tshe_5 rgyal_10 po_16 btsun_21 mos_27 rgyal_31 po_37 la_40 stong_43 
T10D4202:170a-18	phyogs nas dge 'dun yul stor te 'khyams nas byon	phyogs_0 nas_7 dge_11 'dun_15 yul_20 stor_24 te_29 'khyam_32 nas_40 'byon_44 
T10D4202:170a-19	pa sun ma dang yo byad bdag sbyor na /	ba_0 sun_3 ma_7 dang_10 yo_15 byad_18 bdag_23 sbyor_28 na_34 
T10D4202:170a-20	gdong dmar gyi yul du spyan drangs bar ci gnang zhes gsol nas gnang ste /	gdong_0 dmar_6 gyi_11 yul_15 du_19 spyan_22 drangs_28 ba_35 ci_39 gnang_42 zhes_48 gsol_53 nas_58 gnang_62 ste_68 
T10D4202:170a-21	dge 'dun rnams bzhon pa dang 'tsho bas bsu nas gdong dmar gyi yul du phyin to //	dge_0 'dun_4 rnams_9 bzhon_15 ba_21 dang_24 'tsho_29 ba_35 bsu_39 nas_43 gdong_47 dmar_53 gyi_58 yul_62 du_66 phyin_69 to_75 
T10D4202:170a-22	de nas gdong dmar gyi rgyal po dang /	de_0 nas_3 gdong_7 dmar_13 gyi_18 rgyal_22 po_28 dang_31 
T10D4202:170a-23	kong co 'khor dang bcas pas mchod rten la phyag	kong_0 co_5 'khor_8 dang_14 'cha'_19 ba_24 mchod_28 rten_34 la_39 phyag_42 
T10D4202:170a-24	byas nas dge slong 'di'i nang na sde snod gsum	byed_0 nas_5 dge_9 slong_13 'di_19 nang_25 na_30 sde_33 snod_37 gsum_42 
T10D4202:170a-25	la mkhas pa'i mkhan po rnams ma gtogs par gzhan	la_0 mkhas_3 ba_9 mkhan_14 po_20 rnams_23 ma_29 gtogs_32 ba_38 gzhan_42 
T10D4202:170a-26	'di ltar mkhas pa bzhugs sam zhes dris pa dang	'di_0 ltar_4 mkhas_9 ba_15 bzhugs_18 sam_25 zhes_29 'dri_34 ba_39 dang_42 
T10D4202:170a-27	/ mkhan po na re aan se dang /	mkhan_2 po_8 na_11 re_14 aan_17 se_21 dang_24 
T10D4202:170a-28	shu lig dang /	shu_0 lig_4 dang_8 
T10D4202:170a-29	bru sha dang /	bru_0 sha_4 dang_8 
T10D4202:170a-30	kha che zhes bya ba'i yul na 'di 'dra bar	kha_0 che_4 zhes_8 byed_13 ba_17 yul_22 na_26 'di_29 'dra_33 ba_38 
T10D4202:170a-31	mkhas pa'i dge 'dun mang du yod do zhes smras	mkhas_0 ba_6 dge_11 'dun_15 mang_20 du_25 yod_28 do_32 zhes_35 smras_40 
T10D4202:170a-32	pa dang / de'i mod la 'gugs pa'i pho nya btang ste /	ba_0 dang_3 de_10 mod_15 la_19 'gugs_22 ba_28 pho_33 nya_37 gtong_41 ste_47 
T10D4202:170a-33	dge 'dun ril gyis gdong dmar gyi yul du spyan drangs so //	dge_0 'dun_4 ril_9 gyis_13 gdong_18 dmar_24 gyi_29 yul_33 du_37 spyan_40 drangs_46 so_53 
T10D4202:170a-34	de'i tshe gdong dmar gyi yul du gtsug lag khang bdun brtsigs so //	de_0 tshe_5 gdong_10 dmar_16 gyi_21 yul_25 du_29 gtsug_32 lag_38 khang_42 bdun_48 brtsigs_53 so_61 
T10D4202:170a-35	mchod pa'i yo byad dang /	mchod_0 ba_6 yo_11 byad_14 dang_19 
T10D4202:170a-36	dkon mchog gsum gyi mnga' ris kyang sngon bas bskyed	dkon(d)_0 mchog_5 gsum_11 gyi_16 mnga'_20 ris_26 kyang_30 sngon_36 ba_42 skyed_46 
T10D4202:170a-37	nas dge 'dun rnams kyang gtsug lag khang bdun gyi	nas_0 dge_4 'dun_8 rnams_13 kyang_19 gtsug_25 lag_31 khang_35 bdun_41 gyi_46 
T10D4202:170a-38	nang du so sor bzhugs so //	nang_0 du_5 so_8 sor_11 bzhugs_15 so_22 
T10D4202:170a-39	de'i rjes la lo gsum mam bzhin na kong co'i	de_0 rjes_5 la_10 lo_13 gsum_16 mam_21 bzhin_25 na_31 kong_34 co_39 
T10D4202:170a-40	snying gar 'brum chen byung nas na ba'i tshe kong	snying_0 gar_7 'brum_11 chen_17 'byung_22 nas_28 na_32 ba_35 tshe_40 kong_45 
T10D4202:170a-41	chos rgyal po la gsol pa /	chos_0 rgyal_5 po_11 la_14 gsol_17 ba_22 
T10D4202:170b-0	bdag @170b ni nad 'di las mi 'tsho ste /	bdag_0 ni_11 nad_14 'di_18 las_22 mi_26 'tsho_29 ste_35 
T10D4202:170b-1	nga 'gum na bdag gi bran dang /	nga_0 'gum_4 na_9 bdag_12 gi_17 bran_20 dang_25 
T10D4202:170b-2	nor phyugs rnams dkon mchog gsum la mgum par 'bul lo zhes gsol te phul lo //	nor_0 phyugs_4 rnams_11 dkon(d)_17 mchog_22 gsum_28 la_33 mgum_36 ba_41 'bul_45 lo_50 zhes_53 gsol_58 te_63 'bul_66 lo_71 
T10D4202:170b-3	'khor drug brgya yang dge bsnyen gyi mtshan mas btab ste rab tu phyung ngo //	'khor_0 drug_6 brgya_11 yang_17 dge_22 snyen_26 gyi_33 mtshan_37 mas_44 'debs_48 ste_53 rab_57 tu_61 'byin_64 ngo_71 
T10D4202:170b-4	de'i rjes la kong co 'das so //	de_0 rjes_5 la_10 kong_13 co_18 'da'_21 so_26 
T10D4202:170b-5	kong co 'das pa'i 'og tu rgyal po gdong dmar	kong_0 co_5 'da'_8 ba_13 'og_18 tu_22 rgyal_25 po_31 gdong_34 dmar_40 
T10D4202:170b-6	gyi khams su 'brum nad 'byung ste blon po dang	gyi_0 khams_4 su_10 'brum_13 nad_19 'byung_23 ste_30 blon_34 po_39 dang_42 
T10D4202:170b-7	/ zhang blon gyi bu tsha la sogs pa mang du 'chi'o //	zhang_2 blon_8 gyi_13 bu_17 tsha_20 la_25 sogs_28 ba_33 mang_36 du_41 'chi_44 
T10D4202:170b-8	de'i tshe blon po rnams 'dus te rgyal po la gsol pa /	de_0 tshe_5 blon_10 po_15 rnams_18 'du_24 te_29 rgyal_32 po_38 la_41 gsol_44 ba_49 
T10D4202:170b-9	sngon rgyal khams 'di na 'di 'dra ba'i 'brum nad ma byung na /	sngon_0 rgyal_6 khams_12 'di_18 na_22 'di_25 'dra_29 ba_34 'brum_39 nad_45 ma_49 'byung_52 na_58 
T10D4202:170b-10	nga ltar lto bal gyi dge slong 'khyams pa mang po 'ongs nas kong co yang 'das /	nga_0 ltar_4 lto_9 bal_13 gyi_17 dge_21 slong_25 'khyam_31 ba_39 mang_42 po_47 'ongs_50 nas_56 kong_60 co_65 yang_68 'da'_73 
T10D4202:170b-11	blon po dang zhang blon las kyang mang du gum	blon_0 po_5 dang_8 zhang_13 blon_19 las_24 kyang_28 mang_34 du_39 'gum_42 
T10D4202:170b-12	pas ban de 'di kun yang rgyal khams su mi	ba_0 ban_4 de_8 'di_11 kun_15 yang_19 rgyal_24 khams_30 su_36 mi_39 
T10D4202:170b-13	gzhag par bskrad pa'i rigs zhes gsol ba las rgyal	'jog_0 ba_6 skrod_10 ba_17 rigs_22 zhes_27 gsol_32 ba_37 las_40 rgyal_44 
T10D4202:170b-14	pos 'di bskrad pa'i rigs sam mi rigs da dung	pos_0 'di_4 skrod_8 ba_15 rigs_20 sam_25 mi_29 rigs_32 da_37 dung_40 
T10D4202:170b-15	zhib tu dpyod cig ces bsgo ba las blon po	zhib_0 tu_5 dpyod_8 cig_14 ces_18 sgo_22 ba_27 las_30 blon_34 po_39 
T10D4202:170b-16	rnams ban de bskrad par kha 'dus nas rgyal po	rnams_0 ban_6 de_10 skrod_13 ba_20 kha_24 'du_28 nas_33 rgyal_37 po_43 
T10D4202:170b-17	la gsol te / rgyal khams su ban de ril	la_0 gsol_3 te_8 rgyal_13 khams_19 su_25 ban_28 de_32 ril_35 
T10D4202:170b-18	gyis mi gnas par gros chad nas kun bskrad pa	gyis_0 mi_5 gnas_8 ba_13 gros_17 'chad_22 nas_27 kun_31 skrod_35 ba_42 
T10D4202:170b-19	las gdong dmar gyi dge slong khros te /	las_0 gdong_4 dmar_10 gyi_15 dge_19 slong_23 khro_29 te_35 
T10D4202:170b-20	dge slong 'di rnams bskrad nas bdag cag kyang 'di na mi 'dug go zhes byas pa dang /	dge_0 slong_4 'di_10 rnams_14 skrod_20 nas_27 bdag_31 cag_36 kyang_40 'di_46 na_50 mi_53 'dug_56 go_61 zhes_64 byed_69 ba_74 dang_77 
T10D4202:170b-21	blon po rnams khros nas khyed rnams kyang gang dga' bar dengs shig ces bsgo'o //	blon_0 po_5 rnams_8 khro_14 nas_20 'khyed_24 rnams_30 kyang_36 gang_42 dga'_47 ba_52 dengs_56 shig_62 ces_67 sgo_71 
T10D4202:170b-22	kong co gdong dmar gyi yul du 'ongs pa'i 'og	kong_0 co_5 gdong_8 dmar_14 gyi_19 yul_23 du_27 'ongs_30 ba_36 'og_41 
T10D4202:170b-23	tu rgyal pos te'u shi'i chos bzung nas rgya'i dge	tu_0 rgyal_3 pos_9 te_13 'chi_18 chos_24 bzung_29 nas_35 rgya_39 dge_46 
T10D4202:170b-24	slong yang ril gyis gdong dmar gyi yul du 'ongs	slong_0 yang_6 ril_11 gyis_15 gdong_20 dmar_26 gyi_31 yul_35 du_39 'ongs_42 
T10D4202:170b-25	so // de'i dus na rgyal khams de'i dge slong gis gdong dmar gyi khams kyi ring bsrel dang /	so_0 de_6 dus_11 na_15 rgyal_18 khams_24 de_30 dge_35 slong_39 gis_45 gdong_49 dmar_55 gyi_60 khams_64 kyi_70 ring_74 bsrel_79 dang_85 
T10D4202:170b-26	gsung rab dang /	gsung_0 rab_6 dang_10 
T10D4202:170b-27	mchod pa'i yo byad dkon mchog gi mnga' ris gcig	mchod_0 ba_6 yo_11 byad_14 dkon(d)_19 mchog_24 gi_30 mnga'_33 ris_39 gcig_43 
