T10D4202:173a-1	dge 'dun sde gnyis kyi grangs ni gna' thog ma	dge_0 'dun_4 sde_9 gnyis_13 kyi_19 grangs_23 ni_30 gna'_33 thogs_38 ma_43 
T10D4202:173a-2	sangs rgyas 'od srungs 'jig rten du byung ba'i tshe	sangs_0 rgya_6 'od_12 srungs_16 'jig_23 rten_28 du_33 'byung_36 ba_42 tshe_47 
T10D4202:173a-3	li yul yang de tsam na yul du gyur te	li_0 yul_3 yang_7 de_12 tsam_15 na_20 yul_23 du_27 gyur_30 te_35 
T10D4202:173a-4	/ de na gnas pa'i mi rnams kyang chos bgyid /	de_2 na_5 gnas_8 ba_13 mi_18 rnams_21 kyang_27 chos_33 bgyid_38 
T10D4202:173a-5	slad kyi sangs rgyas 'od srungs kyi chos bstan pa gzhag pa nub pa'i tshe /	slad_0 kyi_5 sangs_9 rgya_15 'od_21 srungs_25 kyi_32 chos_36 ston_41 ba_47 'jog_50 ba_56 nub_59 ba_63 tshe_68 
T10D4202:173a-6	li yul gyi chos kyang zhig nas drang srong khar shva dang /	li_0 yul_3 gyi_7 chos_11 kyang_16 'jig_22 nas_27 'dren_31 srong_37 khar_43 shva_48 dang_53 
T10D4202:173a-7	kha re'u steng zhes bgyi ba la sogs pa drang	kha_0 re_4 steng_9 zhes_15 bgyid_20 ba_25 la_28 sogs_31 ba_36 'dren_39 
T10D4202:173a-8	srong mang po'i yul mi ring ba zhig tu li	srong_0 mang_6 po_11 yul_16 mi_20 ring_23 ba_28 'jig_31 tu_36 li_39 
T10D4202:173a-9	yul phyogs kyi ri rtsa dag na gnas te /	yul_0 phyogs_4 kyi_11 ri_15 rtsa_18 'dag_23 na_27 gnas_30 te_35 
T10D4202:173a-10	des na dge ba'i bshes gnyen bgyid bgyid pa las	des_0 na_4 dge_7 ba_11 bshes_16 gnyen_22 bgyid_28 bgyid_34 ba_40 las_43 
T10D4202:173a-11	slad kyi drang srong de rnams la mi ngan kha	slad_0 kyi_5 'dren_9 srong_15 de_21 rnams_24 la_30 mi_33 ngan_36 kha_41 
T10D4202:173a-12	cig gis gtses nas rngan can bgyis /	cig_0 gis_4 gtses_8 nas_14 rngan_18 can_24 bgyid_28 
T10D4202:173a-13	bkur sti dang rim gro ma bgyis pas dang srong	bkur_0 sti_5 dang_9 rim_14 gro_18 ma_22 bgyid_25 ba_31 dang_35 srong_40 
T10D4202:173a-14	de rnams kyang mi dga' nas li yul spangs te	de_0 rnams_3 kyang_9 mi_15 dga'_18 nas_23 li_27 yul_30 spong_34 te_41 
T10D4202:173a-15	/ nam mkha' la ldings nas yul gzhan du mchis /	nam_2 mkha'_6 la_12 ldings_15 nas_22 yul_26 gzhan_30 du_36 mchis_39 
T10D4202:173a-16	de nas ni li yul gyi mi rnams kyang chos	de_0 nas_3 ni_7 li_10 yul_13 gyi_17 mi_21 rnams_24 kyang_30 chos_36 
T10D4202:173a-17	la ma dad de lta ba logs par gyur te	la_0 ma_3 dad_6 de_10 lta_13 ba_17 logs_20 ba_25 gyur_29 te_34 
T10D4202:173a-18	/ klu rnams mi dga' ste chab byung nas li yul yang mtshor gyur to //	klu_2 rnams_6 mi_12 dga'_15 ste_20 chab_24 'byung_29 nas_35 li_39 yul_42 yang_46 mtshor_51 gyur_58 to_63 
T10D4202:173a-19	yun ring mo zhig tu mtshor mchis mchis pa las	yun_0 ring_4 mo_9 'jig_12 tu_17 mtshor_20 mchis_27 mchis_33 ba_39 las_42 
T10D4202:173a-20	slad kyi yangs sangs rgyas sh'akya thub pa rgya gar	slad_0 kyi_5 yangs_9 sangs_15 rgya_21 sh_27 thub_35 ba_40 rgya_43 gar_48 
T10D4202:173a-21	yul du byung ste /	yul_0 du_4 'byung_7 ste_13 
T10D4202:173a-22	sems can gyi don mdzad cing chos kyi 'khor lo	sems_0 can_5 gyi_9 don_13 mdzad_17 cing_23 chos_28 kyi_33 'khor_37 lo_43 
T10D4202:173a-23	bskor ba la sogs pa sangs rgyas kyi phrin las	skor_0 ba_6 la_9 sogs_12 ba_17 sangs_20 rgya_26 kyi_32 phrin_36 las_42 
T10D4202:173a-24	su mdzad pa rnams mdzad nas mya ngan las 'da'	su_0 mdzad_3 ba_9 rnams_12 mdzad_18 nas_24 mya_28 ngan_32 las_37 'da'_41 
T10D4202:173a-25	bar bstan pa nye ba zhig gi dus na /	ba_0 ston_4 ba_10 nye_13 ba_17 'jig_20 gi_25 dus_28 na_32 
T10D4202:173a-26	sangs rgyas bcom ldan 'das sh'akya thub pa rgyal po'i	sangs_0 rgya_6 'joms_12 ldan_17 'da'_22 sh_27 thub_35 ba_40 rgyal_43 po_49 
T10D4202:173a-27	khab bya rgod phung po'i ri la bzhugs te zla	khab_0 byed_5 rgod_9 'phung_14 po_20 ri_25 la_28 bzhugs_31 te_38 zla_41 
T10D4202:173a-28	ba'i snying po gsungs pa'i tshe yul khams so so'i	ba_0 snying_5 po_12 gsungs_15 ba_22 tshe_27 yul_32 khams_36 so_42 so_45 
T10D4202:173a-29	mgon po dang / lha klu la sogs pa srung	mgon_0 po_5 dang_8 lha_15 klu_19 la_23 sogs_26 ba_31 srung_34 
T10D4202:173b-0	ma rnams la gtad pa'i @173b dus na li yul	ma_0 rnams_3 la_9 gtod_12 ba_17 dus_28 na_32 li_35 yul_38 
T10D4202:173b-1	yang lung bstan te /	yang_0 lung_5 ston_10 te_16 
T10D4202:173b-2	rnam thos kyi sras dang /	rnam_0 thos_5 kyi_10 sras_14 dang_19 
T10D4202:173b-3	gnod sbyin gyi sde dpon chen po la sogs yang dag shes dang /	gnod_0 sbyin_5 gyi_11 sde_15 dpon_19 chen_24 po_29 la_32 sogs_35 yang_40 'dag_45 shes_49 dang_54 
T10D4202:173b-4	rgyal po ma skyes dgra'i bu mo dri ma med pa'i 'od dang /	rgyal_0 po_6 ma_9 skye_12 dgra_18 bu_25 mo_28 'dri_31 ma_35 med_38 ba_42 'od_47 dang_51 
T10D4202:173b-5	gzhon nu rdo rje sde dang /	gzhon_0 nu_6 rdo_9 rje_13 sde_17 dang_21 
T10D4202:173b-6	lha'i bu mo blo rab brten dang /	lha_0 bu_6 mo_9 blo_12 rab_16 rten_20 dang_26 
T10D4202:173b-7	lha mo 'phrog ma la sogs pa 'khor dang bcas	lha_0 mo_4 'phrog_7 ma_14 la_17 sogs_20 ba_25 'khor_28 dang_34 'cha'_39 
T10D4202:173b-8	pa la gtad nas bcom ldan 'das nyid kyang 'khor	ba_0 la_3 gtod_6 nas_11 'joms_15 ldan_20 'da'_25 nyid_30 kyang_35 'khor_41 
T10D4202:173b-9	rnam bzhi 'bum phrag du ma dang nam mkha' la	rnam_0 bzhi_5 'bum_10 phrag_15 du_21 ma_24 dang_27 nam_32 mkha'_36 la_42 
T10D4202:173b-10	ldings nas li yul du gshegs te /	ldings_0 nas_7 li_11 yul_14 du_18 gshegs_21 te_28 
T10D4202:173b-11	da ltar 'gum tir gyi mchod rten chen po bzhugs	da_0 ltar_3 'gum_8 tir_13 gyi_17 mchod_21 rten_27 chen_32 po_37 bzhugs_40 
T10D4202:173b-12	pa'i thad kar mtsho'i steng du ta la bdun srid	ba_0 thad_5 kar_10 mtsho_14 steng_22 du_28 ta_31 la_34 bdun_37 srid_42 
T10D4202:173b-13	tsam gyi gnam 'phang gi nam mkha' la padma'i gdan	tsam_0 gyi_5 gnam_9 'phen_14 gi_21 nam_24 mkha'_28 la_34 padma_37 gdan_45 
T10D4202:173b-14	la bzhugs nas phyogs bcu'i sangs rgyas kyi zhing so	la_0 bzhugs_3 nas_10 phyogs_14 'chu_21 sangs_27 rgya_33 kyi_39 zhing_43 so_49 
T10D4202:173b-15	so nas de bzhin gshegs pa rnams kyis li yul	so_0 nas_3 de_7 bzhin_10 gshegs_16 ba_23 rnams_26 kyis_32 li_37 yul_40 
T10D4202:173b-16	byin gyis brlabs pa'i slad du bskul ba'i 'od zer	byin_0 gyis_5 brlabs_10 ba_17 slad_22 du_27 skul_30 ba_36 'od_41 zer_45 
T10D4202:173b-17	phyogs su khyab par btang /	phyogs_0 su_7 khyab_10 ba_16 gtong_20 
T10D4202:173b-18	phyogs bcu na bzhugs pa'i de bzhin gshegs pa thams	phyogs_0 'chu_7 na_11 bzhugs_14 ba_21 de_26 bzhin_29 gshegs_35 ba_42 thams_45 
T10D4202:173b-19	cad kyis kyang li yul byin gyis brlab pa'i slad	cad_0 kyis_4 kyang_9 li_15 yul_18 byin_22 gyis_27 brlab_32 ba_38 slad_43 
T10D4202:173b-20	du sangs rgyas kyi zhing so so nas sangs rgyas	du_0 sangs_3 rgya_9 kyi_15 zhing_19 so_25 so_28 nas_31 sangs_35 rgya_41 
T10D4202:173b-21	sh'akya thub pa la mchod pa bgyid pa'i byang chub	sh_0 thub_8 ba_13 la_16 mchod_19 ba_25 bgyid_28 ba_34 byang_39 chub_45 
T10D4202:173b-22	sems dpa'i 'khor dang yul 'khor bsrung zhing byin gyis	sems_0 dpa_5 'khor_11 dang_17 yul_22 'khor_26 bsrung_32 zhing_39 byin_45 gyis_50 
T10D4202:173b-23	brlab pa'i sngags kyi snying po dang /	brlab_0 ba_6 sngags_11 kyi_18 snying_22 po_29 dang_32 
T10D4202:173b-24	'od zer btang nas dus gcig tu sangs rgyas sh'akya	'od_0 zer_4 gtong_8 nas_14 dus_18 gcig_22 tu_27 sangs_30 rgya_36 sh_42 
T10D4202:173b-25	thub pa'i spyi gtsug tu 'dus par byin gyis brlabs	thub_0 ba_5 spyi_10 gtsug_15 tu_21 'du_24 ba_29 byin_33 gyis_38 brlabs_43 
T10D4202:173b-26	nas dge'o zhes bya ba'i sgra chen po byung ngo	nas_0 dge_4 zhes_10 byed_15 ba_19 sgra_24 chen_29 po_34 'byung_37 ngo_43 
T10D4202:173b-27	// de nas bcom ldan 'das sh'akya thub pas kyang	de_3 nas_6 'joms_10 ldan_15 'da'_20 sh_25 thub_33 ba_38 kyang_42 
T10D4202:173b-28	li yul mtshor gyur pa 'od zer gyis khyab par	li_0 yul_3 mtshor_7 gyur_14 ba_19 'od_22 zer_26 gyis_30 khyab_35 ba_41 
T10D4202:173b-29	mdzad nas 'od zer de dag las chu'i khar padma	mdzad_0 nas_6 'od_10 zer_14 de_18 'dag_21 las_25 chu_29 khar_35 padma_40 
T10D4202:173b-30	sum brgya drug cu rtsa gsum byung /	sum_0 brgya_4 drug_10 cu_15 rtsa_18 gsum_23 'byung_28 
T10D4202:173b-31	padma re re'i khar yang me mar kha re re	padma_0 re_6 re_9 khar_14 yang_19 me_24 mar_27 kha_31 re_35 re_38 
T10D4202:173b-32	byung de nas 'od zer de dag gcig tu 'dus	'byung_0 de_6 nas_9 'od_13 zer_17 de_21 'dag_24 gcig_28 tu_33 'du_36 
T10D4202:173b-33	nas chab kyi steng du g-yas phyogs su lan gsum	nas_0 chab_4 kyi_9 steng_13 du_19 g-yas_22 phyogs_28 su_35 lan_38 gsum_42 
T10D4202:173b-34	bskor nas chu'i dkyil du nub par 'gyur ro //	skor_0 nas_6 chu_10 dkyil_16 du_22 nub_25 ba_29 'gyur_33 ro_39 
T10D4202:173b-35	de nas bcom ldan 'das kyis 'phags pa'i sh'a ri'i bu dang /	de_0 nas_3 'joms_7 ldan_12 'da'_17 kyis_22 'phag_27 ba_34 sh_39 ri_44 bu_49 dang_52 
T10D4202:173b-36	rnam thos kyi sras la bka' stsal pa /	rnam_0 thos_5 kyi_10 sras_14 la_19 bka'_22 stsal_27 ba_33 
T10D4202:173b-37	khyed kyis mam sa bar na barba ta zhes bya	'khyed_0 kyis_6 mam_11 sa_15 ba_18 na_22 barba_25 ta_31 zhes_34 byed_39 
T10D4202:173b-38	ba'i ri snag gi kha dog 'dra ba'i mtsho 'di	ba_0 ri_5 snag_8 gi_13 kha_16 dog_20 'dra_24 ba_29 mtsho_34 'di_40 
T10D4202:173b-39	drol zhig ces bka' stsal nas /	drol_0 'jig_5 ces_10 bka'_14 stsal_19 nas_25 
T10D4202:173b-40	'phags pa sh'a ri'i bu'i gseg shang gi rtsa ba dang /	'phag_0 ba_7 sh_10 ri_15 bu_20 gseg_25 shang_30 gi_36 rtsa_39 ba_44 dang_47 
T10D4202:173b-41	rnam thos sras kyi mdung rtses mtsho dral nas /	rnam_0 thos_5 sras_10 kyi_15 mdung_19 rtses_25 mtsho_31 'dral_37 nas_42 
T10D4202:173b-42	bcom ldan 'das kyang glang mgo'i ri steng na sku	'joms_0 ldan_5 'da'_10 kyang_15 glang_21 mgo_27 ri_33 steng_36 na_42 sku_45 
T10D4202:173b-43	gzugs chen po bzhugs pa'i g-yon logs kyi lha khang	gzugs_0 chen_6 po_11 bzhugs_14 ba_21 g-yon_26 logs_32 kyi_37 lha_41 khang_45 
T10D4202:174a-0	gi nang @174a * //	gi_0 nang_3 
T10D4202:174a-1	nad ltar mchod rten chung du zhig bzhugs pa'i sar	nad_0 ltar_4 mchod_9 rten_15 chung_20 du_26 'jig_29 bzhugs_34 ba_41 sar_46 
T10D4202:174a-2	sems can gyi don mdzad pa'i slad du gdung bdun	sems_0 can_5 gyi_9 don_13 mdzad_17 ba_23 slad_28 du_33 gdung_36 bdun_42 
T10D4202:174a-3	de na bzhugs so //	de_0 na_3 bzhugs_6 so_13 
T10D4202:174a-4	de nas 'phags pa kun dga' bos bcom ldan 'das la zhus pa /	de_0 nas_3 'phag_7 ba_14 kun_17 dga'_21 'bod_26 'joms_30 ldan_35 'da'_40 la_45 zhus_48 ba_53 
T10D4202:174a-5	bcom ldan 'das ci'i rgyu /	'joms_0 ldan_5 'da'_10 ci_15 rgyu_20 
T10D4202:174a-6	ci'i rkyen gyis 'od zer dang /	ci_0 rkyen_5 gyis_11 'od_16 zer_20 dang_24 
T10D4202:174a-7	padmo dang /	padmo_0 dang_6 
T10D4202:174a-8	me mar 'di dag snang bar 'gyur //	me_0 mar_3 'di_7 'dag_11 snang_15 ba_21 'gyur_25 
T10D4202:174a-9	ci'i rgyu ci'i rkyen gyis 'od zer 'di rnams gcig	ci_0 rgyu_5 ci_10 rkyen_15 gyis_21 'od_26 zer_30 'di_34 rnams_38 gcig_44 
T10D4202:174a-10	tu 'dus nas g-yas logs su lan gsum bskor te	tu_0 'du_3 nas_8 g-yas_12 logs_18 su_23 lan_26 gsum_30 skor_35 te_41 
T10D4202:174a-11	chab kyi dkyil du nub /	chab_0 kyi_5 dkyil_9 du_15 nub_18 
T10D4202:174a-12	de nas bcom ldan 'das kyis kun dga' bo la bka' stsal pa /	de_0 nas_3 'joms_7 ldan_12 'da'_17 kyis_22 kun_27 dga'_31 'bo_36 la_39 bka'_42 stsal_47 ba_53 
T10D4202:174a-13	sh'a ri'i bus gseg shang gi rtsa ba dang /	sh_0 ri_5 'bud_10 gseg_14 shang_19 gi_25 rtsa_28 ba_33 dang_36 
T10D4202:174a-14	rnam thos sras kyi mdung rtses mtsho dral bas phyis	rnam_0 thos_5 sras_10 kyi_15 mdung_19 rtses_25 mtsho_31 'dral_37 ba_42 'byid_46 
T10D4202:174a-15	'tsho bskams nas nga mya ngan las 'das pa'i 'og	'tsho_0 skem_6 nas_13 nga_17 mya_21 ngan_25 las_30 'da'_34 ba_39 'og_44 
T10D4202:174a-16	tu yul li yul zhes bya ba 'di 'byung ste	tu_0 yul_3 li_7 yul_10 zhes_14 byed_19 ba_23 'di_26 'byung_30 ste_37 
T10D4202:174a-17	/ 'od zer lan gsum 'khor ba'i sar ni khor	'od_2 zer_6 lan_10 gsum_14 'khor_19 ba_25 sar_30 ni_34 khor_37 
T10D4202:174a-18	khor yug tu phyis 'u then gyis mkhar lnga ldan	khor_0 yug_5 tu_9 'byid_12 'u_18 then_21 gyis_26 mkhar_31 lnga_37 ldan_42 
T10D4202:174a-19	gyi grong khyer chen po brtsig par 'gyur ro //	gyi_0 grong_4 'khyer_10 chen_16 po_21 brtsig_24 ba_31 'gyur_35 ro_41 
T10D4202:174a-20	chu'i dkyil du 'od zer nub pa'i sar ni yul	chu_0 dkyil_6 du_12 'od_15 zer_19 nub_23 ba_27 sar_32 ni_36 yul_39 
T10D4202:174a-21	byin gyis rlob cing srung ba'i r'a dza gra ma'i	byin_0 gyis_5 rlob_10 cing_15 srung_20 ba_26 r_31 dza_35 gra_39 ma_43 
T10D4202:174a-22	sangs rgyas kyi sku gzugs ngas tsandan gyi nang du	sangs_0 rgya_6 kyi_12 sku_16 gzugs_20 ngas_26 tsandan_31 gyi_39 nang_43 du_48 
T10D4202:174a-23	sku'i grib ma nub par byin gyis brlabs te byas	sku_0 'grib_6 ma_11 nub_14 ba_18 byin_22 gyis_27 brlabs_32 te_39 byed_42 
T10D4202:174a-24	pa zhig rgya gar yul nas nam mkha' las gshegs	ba_0 'jig_3 rgya_8 gar_13 yul_17 nas_21 nam_25 mkha'_29 las_35 gshegs_39 
T10D4202:174a-25	te bzhugs par 'gyur ro //	te_0 bzhugs_3 ba_10 'gyur_14 ro_20 
T10D4202:174a-26	chu'i nang na padmo dang me mar byung ba'i sar	chu_0 nang_6 na_11 padmo_14 dang_20 me_25 mar_28 'byung_32 ba_38 sar_43 
T10D4202:174a-27	ni phyis theg pa chen po spyod pa'i dge slong	ni_0 'byid_3 theg_9 ba_14 chen_17 po_22 spyod_25 ba_31 dge_36 slong_40 
T10D4202:174a-28	pho mo gnas pa'i gtsug lag khang chen po sum	pho_0 mo_4 gnas_7 ba_12 gtsug_17 lag_23 khang_27 chen_33 po_38 sum_41 
T10D4202:174a-29	brgya drug cu rtsa gsum rgyal po la sogs pa	brgya_0 drug_6 cu_11 rtsa_14 gsum_19 rgyal_24 po_30 la_33 sogs_36 ba_41 
T10D4202:174a-30	yon bdag dad pa can rnams kyis brtsigs nas de	yon_0 bdag_4 dad_9 ba_13 can_16 rnams_20 kyis_26 brtsigs_31 nas_39 de_43 
T10D4202:174a-31	bzhin gshegs pa'i sku gdung la mchod pa byed pa'i	bzhin_0 gshegs_6 ba_13 sku_18 gdung_22 la_28 mchod_31 ba_37 byed_40 ba_45 
T10D4202:174a-32	byang chub sems dpa'i dge slong pho mo'i tshul dug	byang_0 chub_6 sems_11 dpa_16 dge_22 slong_26 pho_32 mo_36 tshul_41 dug_47 
T10D4202:174a-33	nas pa nyis brgya lnga bcu dang khyim pa skye	nas_0 ba_4 nyis_7 brgya_12 lnga_18 'chu_23 dang_27 khyim_32 ba_38 skye_41 
T10D4202:174a-34	bo'i tshul du gnas pa nyis brgya lnga bcu ste	'bo_0 tshul_5 du_11 gnas_14 ba_19 nyis_22 brgya_27 lnga_33 'chu_38 ste_42 
T10D4202:174a-35	lnga brgya rtag tu nags so //	lnga_0 brgya_5 rtag_11 tu_16 nags_19 so_24 
T10D4202:174a-36	gzhan yang phyir mi ldog pa'i la ngas pa'i byang	gzhan_0 yang_6 phyir_11 mi_17 ldog_20 ba_25 la_30 ngas_33 ba_38 byang_43 
T10D4202:174a-37	chub sems dpa' theg pa chen po'i chos la rgyas	chub_0 sems_5 dpa'_10 theg_15 ba_20 chen_23 po_28 chos_33 la_38 rgya_41 
T10D4202:174a-38	par spyod pa la phal cher gnas te /	ba_0 spyod_4 ba_10 la_13 phal_16 cher_21 gnas_26 te_31 
T10D4202:174a-39	'di ni dus gsum du gshegs pa'i sangs rgyas kyi	'di_0 ni_4 dus_7 gsum_11 du_16 gshegs_19 ba_26 sangs_31 rgya_37 kyi_43 
T10D4202:174a-40	zhing khud pa yin no zhes byang chub sems dpa'	zhing_0 khud_6 ba_11 yin_14 no_18 zhes_21 byang_26 chub_32 sems_37 dpa'_42 
T10D4202:174a-41	'jam dpal dang / spyan ras gzigs kyi dbang phyug la sogs pa byang chub sems dpa' brgyad dang /	'jam_0 dpal_5 dang_10 spyan_17 ras_23 gzigs_27 kyi_33 dbang_37 phyug_43 la_49 sogs_52 ba_57 byang_60 chub_66 sems_71 dpa'_76 brgyad_81 dang_88 
T10D4202:174a-42	rnam thos kyi sras dang /	rnam_0 thos_5 kyi_10 sras_14 dang_19 
T10D4202:174a-43	gnod sbyin gyi sde dpon chen po yang dag shes dang /	gnod_0 sbyin_5 gyi_11 sde_15 dpon_19 chen_24 po_29 yang_32 'dag_37 shes_41 dang_46 
T10D4202:174a-44	rigs kyi bu mo dri ma med pa'i 'od dang /	rigs_0 kyi_5 bu_9 mo_12 'dri_15 ma_19 med_22 ba_26 'od_31 dang_35 
T10D4202:174b-0	gzhon nu @174b rdo rje lam dral dang /	gzhon_0 nu_6 rdo_15 rje_19 lam_23 'dral_27 dang_32 
T10D4202:174b-1	lha klu la sogs pa la dus thams cad du srungs shig par de bzhin gshegs pas gtad do //	lha_0 klu_4 la_8 sogs_11 ba_16 la_19 dus_22 thams_26 cad_32 du_36 srungs_39 shig_46 ba_51 de_55 bzhin_58 gshegs_64 ba_71 gtod_75 do_80 
T10D4202:174b-2	de nas bcom ldan 'das la byang chub sems dpa' 'jam dpal dang /	de_0 nas_3 'joms_7 ldan_12 'da'_17 la_22 byang_25 chub_31 sems_36 dpa'_41 'jam_46 dpal_51 dang_56 
T10D4202:174b-3	byams pa dang /	byams_0 ba_6 dang_9 
T10D4202:174b-4	spyan ras gzigs kyi dbang phyug dang /	spyan_0 ras_6 gzigs_10 kyi_16 dbang_20 phyug_26 dang_32 
T10D4202:174b-5	nam mkha'i snying po dang /	nam_0 mkha_4 snying_11 po_18 dang_21 
T10D4202:174b-6	sa'i snying po dang /	sa_0 snying_5 po_12 dang_15 
T10D4202:174b-7	kun du bzang po dang /	kun_0 du_4 bzang_7 po_13 dang_16 
T10D4202:174b-8	mthu chen dang /	mthu_0 chen_5 dang_10 
T10D4202:174b-9	sman gyi rgyal po byang chub sems dpa' dang /	sman_0 gyi_5 rgyal_9 po_15 byang_18 chub_24 sems_29 dpa'_34 dang_39 
T10D4202:174b-10	rnam thos kyis ras 'khor gnod sbyin sum stong dang /	rnam_0 thos_5 kyis_10 ras_15 'khor_19 gnod_25 sbyin_30 sum_36 stong_40 dang_46 
T10D4202:174b-11	gnod sbyin gyi sde dpon yang dag shes 'khor khri phrag bcu dang /	gnod_0 sbyin_5 gyi_11 sde_15 dpon_19 yang_24 'dag_29 shes_33 'khor_38 khri_44 phrag_49 'chu_55 dang_59 
T10D4202:174b-12	lha gzhan gyis mi thub pa'i 'khro stong dang /	lha_0 gzhan_4 gyis_10 mi_15 thub_18 ba_23 'khro_28 stong_34 dang_40 
T10D4202:174b-13	nam mkha'i spyan 'khor brgyad stong dang ;	nam_0 mkha_4 spyan_11 'khor_17 brgyad_23 stong_30 dang_36 
T10D4202:174b-14	lha'i bu gser phreng 'khor lnga brgya dang /	lha_0 bu_6 gser_9 phreng_14 'khor_21 lnga_27 brgya_32 dang_38 
T10D4202:174b-15	klu'i rgyal po gnas dros po 'khor stong dang /	klu_0 rgyal_6 po_12 gnas_15 dro_20 po_25 'khor_28 stong_34 dang_40 
T10D4202:174b-16	lha mo lcags kyu can 'khor stong phrag bcu dang /	lha_0 mo_4 lcags_7 kyu_13 can_17 'khor_21 stong_27 phrag_33 'chu_39 dang_43 
T10D4202:174b-17	lha mo gnas ldan ma 'khor lnga stong dang /	lha_0 mo_4 gnas_7 ldan_12 ma_17 'khor_20 lnga_26 stong_31 dang_37 
T10D4202:174b-18	rigs kyi bu mo dri ma med pa'i 'od dang /	rigs_0 kyi_5 bu_9 mo_12 'dri_15 ma_19 med_22 ba_26 'od_31 dang_35 
T10D4202:174b-19	gzhon nu rdo rje sde dang /	gzhon_0 nu_6 rdo_9 rje_13 sde_17 dang_21 
T10D4202:174b-20	lha'i bu blo rab brtan dang /	lha_0 bu_6 blo_9 rab_13 brtan_17 dang_23 
T10D4202:174b-21	lha mo 'phrog ma 'khor dang bcas pa la sogs	lha_0 mo_4 'phrog_7 ma_14 'khor_17 dang_23 'cha'_28 ba_33 la_36 sogs_39 
T10D4202:174b-22	pas bcom ldan 'das kyi spyan sngar dam tshig bcas	ba_0 'joms_4 ldan_9 'da'_14 kyi_19 spyan_23 sngar_29 dam_35 tshig_39 'cha'_45 
T10D4202:174b-23	nas li yul bsrung bar zhal gyis bzhes te /	nas_0 li_4 yul_7 bsrung_11 ba_18 zhal_22 gyis_27 bzhes_32 te_38 
T10D4202:174b-24	deng sang gi bar du yang 'phags pa byang chub sems dpa' 'di brgyad dang /	deng_0 sang_5 gi_10 ba_13 du_17 yang_20 'phag_25 ba_32 byang_35 chub_41 sems_46 dpa'_51 'di_56 brgyad_60 dang_67 
T10D4202:174b-25	rnam thos kyi sras la sogs pa'i mgon po dang /	rnam_0 thos_5 kyi_10 sras_14 la_19 sogs_22 ba_27 mgon_32 po_37 dang_40 
T10D4202:174b-26	lha dang /	lha_0 dang_4 
T10D4202:174b-27	klu dang /	klu_0 dang_4 
T10D4202:174b-28	lha mo rnams thog ma sangs rgyas goo to shan	lha_0 mo_4 rnams_7 thogs_13 ma_18 sangs_21 rgya_27 goo_33 to_37 shan_40 
T10D4202:174b-29	du gshegs te 'khor mang pos bskor nas bzhugs pa'i	du_0 gshegs_3 te_10 'khor_13 mang_19 pos_24 skor_28 nas_34 bzhugs_38 ba_45 
T10D4202:174b-30	tshe byang chub sems dpa' 'di rnams dang /	tshe_0 byang_5 chub_11 sems_16 dpa'_21 'di_26 rnams_30 dang_36 
T10D4202:174b-31	mgon po dang lha klu rnams gal bzhugs bzhugs pa'i gnas dang /	mgon_0 po_5 dang_8 lha_13 klu_17 rnams_21 gal_27 bzhugs_31 bzhugs_38 ba_45 gnas_50 dang_55 
T10D4202:174b-32	dam tshig blangs pa'i sar da dung yang yul srung zhing byin gyis rlob /	dam_0 tshig_4 blangs_10 ba_17 sar_22 da_26 dung_29 yang_34 yul_39 srung_43 zhing_49 byin_55 gyis_60 rlob_65 
T10D4202:174b-33	mngon rtags dang mtshan ma dag kyang /	mngon_0 rtags_6 dang_12 mtshan_17 ma_24 'dag_27 kyang_31 
T10D4202:174b-34	'byung ;	'byung_0 
T10D4202:174b-35	de nas sangs rgyas mya ngan las 'das nas dgung	de_0 nas_3 sangs_7 rgya_13 mya_19 ngan_23 las_28 'da'_32 nas_37 dgung_41 
T10D4202:174b-36	lo nyis brgya sum cu rtsa bzhi lon pa'i 'og	lo_0 nyis_3 brgya_8 sum_14 cu_18 rtsa_21 bzhi_26 lon_31 ba_35 'og_40 
T10D4202:174b-37	tu rgya gar gyi rgyal po dharma aa sho ka	tu_0 rgya_3 gar_8 gyi_12 rgyal_16 po_22 dharma_25 aa_32 sho_35 ka_39 
T10D4202:174b-38	zhes bgyi ba zhig gis sngon sems can mang po	zhes_0 bgyid_5 ba_10 'jig_13 gis_18 sngon_22 sems_28 can_33 mang_37 po_42 
T10D4202:174b-39	zhig bkum pa las slad kyi 'phags pa dgra bcom	'jig_0 bkum_5 ba_10 las_13 slad_17 kyi_22 'phag_26 ba_33 dgra_36 'joms_41 
T10D4202:174b-40	pa ya sho zhes bgyi ba zhig gis dge ba'i	ba_0 ya_3 sho_6 zhes_10 bgyid_15 ba_20 'jig_23 gis_28 dge_32 ba_36 
T10D4202:174b-41	bshes gnyen bgyis nas /	bshes_0 gnyen_6 bgyid_12 nas_18 
T10D4202:174b-42	sngar sdig pa mi dge ba'i las ci bgyis pa mthol zhing bshags /	sngar_0 sdig_6 ba_11 mi_14 dge_17 ba_21 las_26 ci_30 bgyid_33 ba_39 mthol_42 zhing_48 'chags_54 
T10D4202:174b-43	slad kyis mi bgyi bar yang yi dam bcas /	slad_0 kyis_5 mi_10 bgyid_13 ba_18 yang_22 yi_27 dam_30 'cha'_34 
T10D4202:174b-44	'dzam bu'i gling na sangs rgyas sh'akya thub pas byin gyis brlabs pa'i gtsug lag khang dang /	'dzam_0 bu_6 gling_11 na_17 sangs_20 rgya_26 sh_32 thub_40 ba_45 byin_49 gyis_54 brlabs_59 ba_66 gtsug_71 lag_77 khang_81 dang_87 
T10D4202:174b-45	mchod rten bzhugs pa rnams su mchod pa bgyid cing /	mchod_0 rten_6 bzhugs_11 ba_18 rnams_21 su_27 mchod_30 ba_36 bgyid_39 cing_45 
T10D4202:175a-0	dogs @175a * //	dogs_0 
T10D4202:175a-1	byin can gnyen po byin gyis brlabs pa mchis so 'tshal du gtsug lag khang dang /	byin_0 can_5 gnyen_9 po_15 byin_18 gyis_23 brlabs_28 ba_35 mchis_38 so_44 'tshal_47 du_54 gtsug_57 lag_63 khang_67 dang_73 
T10D4202:175a-2	mchod rten brgyad khri bzhi stong brtsig tu mchis pa	mchod_0 rten_6 brgyad_11 khri_18 bzhi_23 stong_28 brtsig_34 tu_41 mchis_44 ba_50 
T10D4202:175a-3	las mtsho ba skams nas li yul yang stong du	las_0 mtsho_4 ba_10 skams_13 nas_19 li_23 yul_26 yang_30 stong_35 du_41 
T10D4202:175a-4	mchis pa'i tshe / da ltar 'u then gyi sku	mchis_0 ba_6 tshe_11 da_18 ltar_21 'u_26 then_29 gyi_34 sku_38 
T10D4202:175a-5	mkhar mchis ba'i dog sar kus po yin du shul	mkhar_0 mchis_6 ba_12 dog_17 sar_21 kus_25 po_29 yin_32 du_36 shul_39 
T10D4202:175a-6	phyung nas dro dgongs shig btab pa'i nub mo rgyal	'byin_0 nas_7 dro_11 dgongs_15 shig_22 'debs_27 ba_32 nub_37 mo_41 rgyal_44 
T10D4202:175a-7	po'i btsun mo dam pa las khye'u mtshan dang ldan	po_0 btsun_5 mo_11 dam_14 ba_18 las_21 khye_25 mtshan_32 dang_39 ldan_44 
T10D4202:175a-8	pa bzang po zhig btsas nas /	ba_0 bzang_3 po_9 'jig_12 btsas_17 nas_23 
T10D4202:175a-9	sngon rgyal po'i btsun mos de kun dga' ra ba'i skyed mos tshal du mchis pa las /	sngon_0 rgyal_6 po_12 btsun_17 mos_23 de_27 kun_30 dga'_34 ra_39 ba_42 skyed_47 mos_53 tshal_57 du_63 mchis_66 ba_72 las_75 
T10D4202:175a-10	rdzing bu'i nang du khrus bgyid cing mchis pa'i dus	rdzing_0 bu_7 nang_12 du_17 'khru_20 bgyid_26 cing_32 mchis_37 ba_43 dus_48 
T10D4202:175a-11	na rnam thos sras 'khor dang bcas pa nam mkha'	na_0 rnam_3 thos_8 sras_13 'khor_18 dang_24 'cha'_29 ba_34 nam_37 mkha'_41 
T10D4202:175a-12	la gshegs pas kyang gzigs /	la_0 gshegs_3 ba_10 kyang_14 gzigs_20 
T10D4202:175a-13	rgyal po'i btsun mos kyang rnam thos sras kyi sras	rgyal_0 po_6 btsun_11 mos_17 kyang_21 rnam_27 thos_32 sras_37 kyi_42 sras_46 
T10D4202:175a-14	byad bzhin bzang po mthong bas sems kyi bur chags	byad_0 bzhin_5 bzang_11 po_17 mthong_20 ba_27 sems_31 kyi_36 bur_40 chags_44 
T10D4202:175a-15	pas kus po yin du btsas nas /	ba_0 kus_4 po_8 yin_11 du_15 btsas_18 nas_24 
T10D4202:175a-16	rgyal po dharma aa sho kas ltas mkhan rnams bkug ste /	rgyal_0 po_6 dharma_9 aa_16 sho_19 kas_23 ltas_27 mkhan_32 rnams_38 'gugs_44 ste_49 
T10D4202:175a-17	bu 'di'i tshe ring ngam thung /	bu_0 'di_3 tshe_9 ring_14 ngam_19 thung_24 
T10D4202:175a-18	mtshan ma bzang ngan dang /	mtshan_0 ma_7 bzang_10 ngan_16 dang_21 
T10D4202:175a-19	dbang thad ci yod ces brtags na /	dbang_0 thad_6 ci_11 yod_14 ces_18 rtog_22 na_29 
T10D4202:175a-20	ltas mkhan rnams kyi mchid nas bu 'di mchan ma yang bzang /	ltas_0 mkhan_5 rnams_11 kyi_17 mchid_21 nas_27 bu_31 'di_34 mchan_38 ma_44 yang_47 bzang_52 
T10D4202:175a-21	dbang thang yang rab tu che ste /	dbang_0 thang_6 yang_12 rab_17 tu_21 che_24 ste_28 
T10D4202:175a-22	mi tha mal pa ma lags pas rgyal po yab	mi_0 tha_3 mal_7 ba_11 ma_14 lags_17 ba_22 rgyal_26 po_32 yab_35 
T10D4202:175a-23	sku tshe ma 'phos bar rgyal po bgyid par 'gyur	sku_0 tshe_4 ma_9 'pho_12 ba_18 rgyal_22 po_28 bgyid_31 ba_37 'gyur_41 
T10D4202:175a-24	zhes bgyis pa dang /	zhes_0 bgyid_5 ba_11 dang_14 
T10D4202:175a-25	rgyal po dharma aa sho ka phrag dog skyes te khros nas /	rgyal_0 po_6 dharma_9 aa_16 sho_19 ka_23 phrag_26 dog_32 skye_36 te_42 khro_45 nas_51 
T10D4202:175a-26	kho de ltar dbang thang che na kho bdag 'tsho zhing srid 'dzin grang /	kho_0 de_4 ltar_7 dbang_12 thang_18 che_24 na_28 kho_31 bdag_35 'tsho_40 zhing_46 srid_52 'dzin_57 grang_63 
T10D4202:175a-27	'di nga la mi dgos kyis bor cig ces mchis nas /	'di_0 nga_4 la_8 mi_11 dgos_14 kyis_19 'bor_24 cig_28 ces_32 mchis_36 nas_42 
T10D4202:175a-28	mas kyang bu 'di mi bor du ni rgyal po	mas_0 kyang_4 bu_10 'di_13 mi_17 'bor_20 du_24 ni_27 rgyal_30 po_36 
T10D4202:175a-29	khro zhing drag shul che bas bu bkum du dogs	khro_0 zhing_5 drag_11 shul_16 che_21 ba_25 bu_29 bkum_32 du_37 dogs_40 
T10D4202:175a-30	nas mas bu de bor ba las slad kyis sa	nas_0 mas_4 bu_8 de_11 'bor_14 ba_18 las_21 slad_25 kyis_30 sa_35 
T10D4202:175a-31	las nu ma byung nas de 'tshal ba las ma	las_0 nu_4 ma_7 'byung_10 nas_16 de_20 'tshal_23 ba_30 las_33 ma_37 
T10D4202:175a-32	gum nas ming yang phyis sa nur btags so //	'gum_0 nas_4 ming_8 yang_13 'byid_18 sa_24 nur_27 'dogs_31 so_37 
T10D4202:175a-33	de'i rjes la rgya rje byang chub sems dpa' chen po bu stong dbang ba cig byung ste /	de_0 rjes_5 la_10 rgya_13 rje_18 byang_22 chub_28 sems_33 dpa'_38 chen_43 po_48 bu_51 stong_54 dbang_60 ba_66 cig_69 'byung_73 ste_79 
T10D4202:175a-34	de la bu dgu brgya dgu bcu rtsa dgu ni mchis na /	de_0 la_3 bu_6 dgu_9 brgya_13 dgu_19 'chu_23 rtsa_27 dgu_32 ni_36 mchis_39 na_45 
T10D4202:175a-35	stong du bu gcig gis ma tshang bas rnam thos	stong_0 du_6 bu_9 gcig_12 gis_17 ma_21 tshang_24 ba_31 rnam_35 thos_40 
