T14D4315:8b-0	@8b # // rgya gar skad du //	rgya_9 gar_14 skad_18 du_23 
T14D4315:8b-1	sambuddha bha shi ta pra ti bimba laksha na bi barna n'a ma /	sambuddha_0 bha_10 'chi_14 ta_18 pra_21 ti_25 bimba_28 laksha_34 na_41 bi_44 barna_47 n_53 ma_57 
T14D4315:8b-2	bod skad du /	'bod_0 skad_4 du_9 
T14D4315:8b-3	rdzogs pa'i sangs rgyas kyis gsungs pa'i sku gzugs kyi mtshan nyid kyi rnam 'grel zhes bya ba //	rdzogs_0 ba_7 sangs_12 rgya_18 kyis_24 gsungs_29 ba_36 sku_41 gzugs_45 kyi_51 mtshan_55 nyid_62 kyi_67 rnam_71 'grel_76 zhes_82 byed_87 ba_91 
T14D4315:8b-4	thams cad mkhyen pa la phyag 'tshal lo //	thams_0 cad_6 mkhyen_10 ba_17 la_20 phyag_23 'tshal_29 lo_36 
T14D4315:8b-5	sku gnyis rjes skyes rgyal ba yi //	sku_0 gnyis_4 rjes_10 skye_15 rgyal_21 ba_27 yi_30 
T14D4315:8b-6	sku la phyag 'tshal de nas ni //	sku_0 la_4 phyag_7 'tshal_13 de_20 nas_23 ni_27 
T14D4315:8b-7	bdag gis nges pas mtshan nyid de //	bdag_0 gis_5 nges_9 ba_14 mtshan_18 nyid_25 de_30 
T14D4315:8b-8	ji ltar nus bzhin rnam 'grel bri //	ji_0 ltar_3 nus_8 bzhin_12 rnam_18 'grel_23 'bri_29 
T14D4315:8b-9	ji ltar bsnyen bkur bar bgyi zhes bya ba ni nye bar spyad pa ste //	ji_0 ltar_3 snyen_8 bkur_15 ba_20 bgyid_24 zhes_29 byed_34 ba_38 ni_41 nye_44 ba_48 spyod_52 ba_58 ste_61 
T14D4315:8b-10	bcom ldan 'das kyi sku'i cha shas kyi mtshan nyid	'joms_0 ldan_5 'da'_10 kyi_15 sku_19 cha_25 shas_29 kyi_34 mtshan_38 nyid_45 
T14D4315:8b-11	n+ya gro dha ltar chu zheng yongs su gab pa	n_0 ya_2 gro_5 dha_9 ltar_13 chu_18 zheng_22 yongs_28 su_34 gab_37 ba_41 
T14D4315:8b-12	zhes bya ba ni n+ya gro dha ni shing ljon	zhes_0 byed_5 ba_9 ni_12 n_15 ya_17 gro_20 dha_24 ni_28 shing_31 ljon_37 
T14D4315:8b-13	pa ste / de'i yal ga chu zheng gab pa lta bu'o //	ba_0 ste_3 de_9 yal_14 ga_18 chu_21 zheng_25 gab_31 ba_35 lta_38 bu_42 
T14D4315:8b-14	'di 'od kyi dkyil 'khor la rab tu gsungs so zhes bya ba kha cig go //	'di_0 'od_4 kyi_8 dkyil_12 'khor_18 la_24 rab_27 tu_31 gsungs_34 so_41 zhes_44 byed_49 ba_53 kha_56 cig_60 go_64 
T14D4315:8b-15	gzhan la ni 'di sku khyad par la gsungs pa'i	gzhan_0 la_6 ni_9 'di_12 sku_16 khyad_20 ba_26 la_30 gsungs_33 ba_40 
T14D4315:8b-16	phyir na phyag gnyis logs su brkyang ba ni 'dom	phyir_0 na_6 phyag_9 gnyis_15 logs_21 su_26 rkyong_29 ba_37 ni_40 'dom_43 
T14D4315:8b-17	gang ste / ji srid sku'i tshad de srid 'dom gyi srid du yang gsungs so //	gang_0 ste_5 ji_11 srid_14 sku_19 tshad_25 de_31 srid_34 'dom_39 gyi_44 srid_48 du_53 yang_56 gsungs_61 so_68 
T14D4315:8b-18	ji srid ces pa la sogs pa'i 'jam pa ni snum pa'i chos nyid do //	ji_0 srid_3 ces_8 ba_12 la_15 sogs_18 ba_23 'jam_28 ba_33 ni_36 snum_39 ba_44 chos_49 nyid_54 do_59 
T14D4315:8b-19	mdzes pa ni yid 'phrog pa'o //	mdzes_0 ba_6 ni_9 yid_12 'phrog_16 ba_23 
T14D4315:8b-20	'gying bag dang ldan pa ni gsum dgu la sogs pa'i yon tan no //	'gying_0 bag_7 dang_11 ldan_16 ba_21 ni_24 gsum_27 dgu_32 la_36 sogs_39 ba_44 yon_49 tan_53 no_57 
T14D4315:9a-0	bdun mtho ba zhes pa ni cha shas bdun stengs su @9a * //	bdun_0 mtho_5 ba_10 zhes_13 ba_18 ni_21 cha_24 shas_28 bdun_33 stengs_38 su_45 
T14D4315:9a-1	mtho ba ste /	mtho_0 ba_5 ste_8 
T14D4315:9a-2	gang las na zhabs gnyis drang phyag gnyis dang mgrin pa zhes so //	gang_0 las_5 na_9 zhabs_12 gnyis_18 'dren_24 phyag_30 gnyis_36 dang_42 mgrin_47 ba_53 zhes_56 so_61 
T14D4315:9a-3	de la zhes pa la sogs pas ni srid la	de_0 la_3 zhes_6 ba_11 la_14 sogs_17 ba_22 ni_26 srid_29 la_34 
T14D4315:9a-4	sogs pa lnga po rnams kyi tshad gsungs pa bshad	sogs_0 ba_5 lnga_8 po_13 rnams_16 kyi_22 tshad_26 gsungs_32 ba_39 'chad_42 
T14D4315:9a-5	par bya'o // byang chub sems dpa' zhes bya ba	ba_0 byed_4 byang_13 chub_19 sems_24 dpa'_29 zhes_34 byed_39 ba_43 
T14D4315:9a-6	la sogs pa ni ji ltar 'chad par 'gyur ba	la_0 sogs_3 ba_8 ni_11 ji_14 ltar_17 'chad_22 ba_28 'gyur_32 ba_38 
T14D4315:9a-7	nus pa nyon cig ces pa'o //	nus_0 ba_4 nyon_7 cig_12 ces_16 ba_20 
T14D4315:9a-8	dbu skra'i gnas dang de gnyis la zhes pa ni	dbu_0 skra_4 gnas_11 dang_16 de_21 gnyis_24 la_30 zhes_33 ba_38 ni_41 
T14D4315:9a-9	dpral ba'i steng dang gtsug gtor 'og la sor mo	dpral_0 ba_6 steng_11 dang_17 gtsug_22 'thor_28 'og_33 la_37 sor_40 mo_44 
T14D4315:9a-10	bzhi'o // gtsug la yang sor mo bzhi'o //	bzhi_0 gtsug_10 la_16 yang_19 sor_24 mo_28 bzhi_31 
T14D4315:9a-11	de gnyis ni sor mo bzhir gsungs so //	de_0 gnyis_3 ni_9 sor_12 mo_16 bzhir_19 gsungs_25 so_32 
T14D4315:9a-12	sor mo phyed dang bcu gsum zhal gyi dkyil 'khor la'o //	sor_0 mo_4 phyed_7 dang_13 'chu_18 gsum_22 zhal_27 gyi_32 dkyil_36 'khor_42 la_48 
T14D4315:9a-13	de'i sum cha dpral ba la sogs pa'i dbye ba las so //	de_0 sum_5 cha_9 dpral_13 ba_19 la_22 sogs_25 ba_30 'byed_35 ba_40 las_43 so_47 
T14D4315:9a-14	kos ko'i mtha' gang gi de'i kos ko'i mtha' dang //	kos_0 ko_4 mtha'_9 gang_15 gi_20 de_23 kos_28 ko_32 mtha'_37 dang_43 
T14D4315:9a-15	shangs kyi 'og ti mthar thug pa'i gnas la'o //	shangs_0 kyi_7 'og_11 ti_15 mthar_18 thug_24 ba_29 gnas_34 la_39 
T14D4315:9a-16	gos ko'i mtha' ni lhag bcas pa ni sor phyed kyis lhag pa nyid do //	gos_0 ko_4 mtha'_9 ni_15 lhag_18 'cha'_23 ba_28 ni_31 sor_34 phyed_38 kyis_44 lhag_49 ba_54 nyid_57 do_62 
T14D4315:9a-17	kos ko la ni sor gnyis ni logs kyi rgya ru ste //	kos_0 ko_4 la_7 ni_10 sor_13 gnyis_17 ni_23 logs_26 kyi_31 rgya_35 ru_40 ste_43 
T14D4315:9a-18	steng gi srid pa yin pa zhes so //	steng_0 gi_6 srid_9 ba_14 yin_17 ba_21 zhes_24 so_29 
T14D4315:9a-19	sor mo gsum po 'di srid du ste //	sor_0 mo_4 gsum_7 po_12 'di_15 srid_19 du_24 ste_27 
T14D4315:9a-20	ste cung zad mtho ba zhes khyad par gyi bsdu ba'o //	ste_0 cung_4 zad_9 mtho_13 ba_18 zhes_21 khyad_26 ba_32 gyi_36 sdud_40 ba_45 
T14D4315:9a-21	ltag dang bcas pa ni byang chub sems dpa' la sogs pa rnams la mthong ngo //	ltag_0 dang_5 'cha'_10 ba_15 ni_18 byang_21 chub_27 sems_32 dpa'_37 la_42 sogs_45 ba_50 rnams_53 la_59 mthong_62 ngo_69 
T14D4315:9a-22	'byung sa steng du cha yis zhes pa'i cha'i sgra yis sor mo gsum gyi sum char bshad de //	'byung_0 sa_7 steng_10 du_16 cha_19 yis_23 zhes_27 ba_32 cha_37 sgra_43 yis_48 sor_52 mo_56 gsum_59 gyi_64 sum_68 char_72 'chad_77 de_83 
T14D4315:9a-23	'byung sa mtho ba 'di'i cha la bim pa'i ri mo zhes te //	'byung_0 sa_7 mtho_10 ba_15 'di_18 cha_24 la_28 bim_31 ba_35 ri_40 mo_43 zhes_46 te_51 
T14D4315:9a-24	bim pa'i 'bras bu'i rnam pa'i ri mo zhes pa'i don to //	bim_0 ba_4 'bras_9 bu_15 rnam_20 ba_25 ri_30 mo_33 zhes_36 ba_41 don_46 to_50 
T14D4315:9a-25	zhal gyi grva ni cha gcig ste sor mo gcig go //	zhal_0 gyi_5 grva_9 ni_14 cha_17 gcig_21 ste_26 sor_30 mo_34 gcig_37 go_42 
T14D4315:9a-26	ji ltar byung ba ste ji ltar 'khrungs pa bzhin	ji_0 ltar_3 'byung_8 ba_14 ste_17 ji_21 ltar_24 'khrung_29 ba_38 bzhin_41 
T14D4315:9a-27	tshems kyi rgyal po la sogs pa rim pas gang	tshems_0 kyi_7 rgyal_11 po_17 la_20 sogs_23 ba_28 rim_31 ba_35 gang_39 
T14D4315:9a-28	ba rnams kyi rnam par bkod pa gsungs pa de	ba_0 rnams_3 kyi_9 rnam_13 ba_18 bkod_22 ba_27 gsungs_30 ba_37 de_40 
T14D4315:9a-29	bzhin du'o // sor mo'i sum cha zhes pa ni	bzhin_0 du_6 sor_14 mo_18 sum_23 cha_27 zhes_31 ba_36 ni_39 
T14D4315:9a-30	sor mo'i sum cha pad sgros te de bzhin du	sor_0 mo_4 sum_9 cha_13 pad_17 sgros_21 te_27 de_30 bzhin_33 du_39 
T14D4315:9a-31	sna'i rtse mo'i 'og tu'o //	sna_0 rtse_6 mo_11 'og_16 tu_20 
T14D4315:9a-32	mchu'i steng du chu 'bab pa'i rnam pa lta bu'i pad sgros so //	mchu_0 steng_7 du_13 chu_16 'bab_20 ba_25 rnam_30 ba_35 lta_38 bu_42 pad_47 sgros_51 so_57 
T14D4315:9a-33	sma ra'i gnas kyi dbus su mtshams 'dra ba'o //	sma_0 ra_4 gnas_9 kyi_14 dbus_18 su_23 mtshams_26 'dra_34 ba_39 
T14D4315:9a-34	sor mo phyed mnyam pa zhes khyad par gyi bsdu ba ste /	sor_0 mo_4 phyed_7 mnyam_13 ba_19 zhes_22 khyad_27 ba_33 gyi_37 sdud_41 ba_46 ste_49 
T14D4315:9a-35	shangs kyi bu ga zhes pa ni shangs kyi sbubs zlum por 'khyil ba'o //	shangs_0 kyi_7 bu_11 ga_14 zhes_17 ba_22 ni_25 shangs_28 kyi_35 sbub_39 zlum_45 por_50 'khyil_54 ba_61 
T14D4315:9a-36	shangs kyi rgyud dang shangs kyi rtse mo zhal dang mnyam pa'o //	shangs_0 kyi_7 brgyud_11 dang_17 shangs_22 kyi_29 rtse_33 mo_38 zhal_41 dang_46 mnyam_51 ba_57 
T14D4315:9a-37	cha phyed ni sor mo phyed do //	cha_0 phyed_4 ni_10 sor_13 mo_17 phyed_20 do_26 
T14D4315:9a-38	spyan gyi bar la zhes pa ni spyan dag gi	spyan_0 gyi_6 ba_10 la_14 zhes_17 ba_22 ni_25 spyan_28 'dag_34 gi_38 
T14D4315:9a-39	dbus la sor mo ste sor gcig gi tshad do	dbus_0 la_5 sor_8 mo_12 ste_15 sor_19 gcig_23 gi_28 tshad_31 do_37 
T14D4315:9a-40	// dpral ba'i 'og can gnyis kyi nye ba shangs	dpral_3 ba_9 'og_14 can_18 gnyis_22 kyi_28 nye_32 ba_36 shangs_39 
T14D4315:9a-41	kyi logs la re re ji srid pa zhes so	kyi_0 logs_4 la_9 re_12 re_15 ji_18 srid_21 ba_26 zhes_29 so_34 
T14D4315:9a-42	// // spyan gyi 'bras bu'i dbus kyi snying po	spyan_6 gyi_12 'bras_16 bu_22 dbus_27 kyi_32 snying_36 po_43 
T14D4315:9a-43	de la sor gnyis kyi lnga chas shes par bya'o	de_0 la_3 sor_6 gnyis_10 kyi_16 lnga_20 cha_25 shes_30 ba_35 byed_39 
T14D4315:9a-44	zhes pa ni kha cig go //	zhes_0 ba_5 ni_8 kha_11 cig_15 go_19 
T14D4315:9a-45	de bzhin sor gcig gi snga cha la byed do zhes te //	de_0 bzhin_3 sor_9 gcig_13 gi_18 snga_21 cha_26 la_30 byed_33 do_38 zhes_41 te_46 
T14D4315:9b-0	'di ni rigs pa'i rang bzhin du rtogs @9b so ;	'di_0 ni_4 rigs_7 ba_12 rang_17 bzhin_22 du_28 rtogs_31 so_41 
T14D4315:9b-1	/ sor gnyis sor gsum dag ces pa ni sor gnyis ni spyan gyi nor bu'i cha'o //	sor_2 gnyis_6 sor_12 gsum_16 'dag_21 ces_25 ba_29 ni_32 sor_35 gnyis_39 ni_45 spyan_48 gyi_54 nor_58 bu_62 cha_67 
T14D4315:9b-2	sor gsum ni spyan gyi zur dang nye ba ste //	sor_0 gsum_4 ni_9 spyan_12 gyi_18 zur_22 dang_26 nye_31 ba_35 ste_38 
T14D4315:9b-3	sha'i zlum dang lhan cig go //	sha_0 zlum_6 dang_11 lhan_16 cig_21 go_25 
T14D4315:9b-4	spyan la sor mo bzhi ni rang gi mtshams so //	spyan_0 la_6 sor_9 mo_13 bzhi_16 ni_21 rang_24 gi_29 mtshams_32 so_40 
T14D4315:9b-5	rnam par 'byung ba nas spyan gyi dbyibs su gsal ba'o //	rnam_0 ba_5 'byung_9 ba_16 nas_19 spyan_23 gyi_29 dbyibs_33 su_40 gsal_43 ba_48 
T14D4315:9b-6	rtog po ni legs par mtho ba'o //	rtogs_0 po_5 ni_8 legs_11 ba_16 mtho_20 ba_25 
T14D4315:9b-7	spyan gyi sbubs la sor mo gsum zhes pa ni smin ma'i 'og tu spyan 'bras nas brtsams te /	spyan_0 gyi_6 sbub_10 la_16 sor_19 mo_23 gsum_26 zhes_31 ba_36 ni_39 smin_42 ma_47 'og_52 tu_56 spyan_59 'bras_65 nas_71 brtsams_75 te_83 
T14D4315:9b-8	steng dang logs sor mo gsum mo //	steng_0 dang_6 logs_11 sor_16 mo_20 gsum_23 mo_28 
T14D4315:9b-9	spyan gyi zur dang shangs kyi logs dang spyan dag gi bar mnyam du bya'o //	spyan_0 gyi_6 zur_10 dang_14 shangs_19 kyi_26 logs_30 dang_35 spyan_40 'dag_46 gi_50 ba_53 mnyam_57 du_63 byed_66 
T14D4315:9b-10	kos ko'i zhes pa ni kos ko'i mtha' dang steng	kos_0 ko_4 zhes_9 ba_14 ni_17 kos_20 ko_24 mtha'_29 dang_35 steng_40 
T14D4315:9b-11	du spyan 'bras kyi logs nges par sbyar bar bya'o	du_0 spyan_3 'bras_9 kyi_15 logs_19 nges_24 ba_29 sbyor_33 ba_39 byed_43 
T14D4315:9b-12	// de ma yin pa zhal gyi zur gnyis kyang de bzhin bya'o //	de_3 ma_6 yin_9 ba_13 zhal_16 gyi_21 zur_25 gnyis_29 kyang_35 de_41 bzhin_44 byed_50 
T14D4315:9b-13	smin dbus ni smin ma'i bar du sor mo phyed dang gnyis so //	smin_0 dbus_5 ni_10 smin_13 ma_18 ba_23 du_27 sor_30 mo_34 phyed_37 dang_43 gnyis_48 so_54 
T14D4315:9b-14	rgyar ni zheng du bya'o //	rgyar_0 ni_6 zheng_9 du_15 byed_18 
T14D4315:9b-15	dbus su zhes pa ni smin ma'i dbus mdzod spur shes par bya'o //	dbus_0 su_5 zhes_8 ba_13 ni_16 smin_19 ma_24 dbus_29 mdzod_34 spur_40 shes_45 ba_50 byed_54 
T14D4315:9b-16	zla ba gang zhig mdzes pa ltar //	zla_0 ba_4 gang_7 'jig_12 mdzes_17 ba_23 ltar_26 
T14D4315:9b-17	shangs kyi rgyud dang mdzod spu'i thig / de bzhin gtsug tor dbyibs legs pa //	shangs_0 kyi_7 brgyud_11 dang_17 mdzod_22 spu_28 thig_34 de_41 bzhin_44 gtsug_50 tor_56 dbyibs_60 legs_67 ba_72 
T14D4315:9b-18	gtsug gi nor bu de shes bya //	gtsug_0 gi_6 nor_9 bu_13 de_16 shes_19 byed_24 
T14D4315:9b-19	zhes pa'i gtsug gi nor bu'i 'di dkyil gyi rnam pa'o //	zhes_0 ba_5 gtsug_10 gi_16 nor_19 bu_23 'di_28 dkyil_32 gyi_38 rnam_42 ba_47 
T14D4315:9b-20	gtsug tor yang de bzhin du'o //	gtsug_0 tor_6 yang_10 de_15 bzhin_18 du_24 
T14D4315:9b-21	snyan gyi rtser yang zhes bya'o //	snyan_0 gyi_6 rtser_10 yang_16 zhes_21 byed_26 
T14D4315:9b-22	bu ga'i steng du snyan ni sor mo bzhi'o //	bu_0 ga_3 steng_8 du_14 snyan_17 ni_23 sor_26 mo_30 bzhi_33 
T14D4315:9b-23	zheng du ni rgya ru ste 'dab ma'i zheng cha gcig go zhes so //	zheng_0 du_6 ni_9 rgya_12 ru_17 ste_20 'dab_24 ma_29 zheng_34 cha_40 gcig_44 go_49 zhes_52 so_57 
T14D4315:9b-24	snyan gyi rtse mo dag sor mo phyed kyi tshad ni 'dab mar brjod do //	snyan_0 gyi_6 rtse_10 mo_15 'dag_18 sor_22 mo_26 phyed_29 kyi_35 tshad_39 ni_45 'dab_48 mar_53 rjod_57 do_63 
T14D4315:9b-25	steng mtho zhes pa ni sor mo gcig / snyan gyi sbubs ni phyed cha ste //	steng_0 mtho_6 zhes_11 ba_16 ni_19 sor_22 mo_26 gcig_29 snyan_36 gyi_42 sbub_46 ni_52 phyed_55 cha_61 ste_65 
T14D4315:9b-26	sor phyed snyan gyi khung du 'jug pa la'o //	sor_0 phyed_4 snyan_10 gyi_16 khung_20 du_26 'jug_29 ba_34 la_37 
T14D4315:9b-27	'gram pa nas snyan ngag gi dbus me tog kha ma bye ba'i rnam par steng du 'khyil ba'o //	'grams_0 ba_6 nas_9 snyan_13 ngag_19 gi_24 dbus_27 me_32 tog_35 kha_39 ma_43 'bye_46 ba_50 rnam_55 ba_60 steng_64 du_70 'khyil_73 ba_80 
T14D4315:9b-28	sor phyed dang gsum gyis snyan du 'gyur te /	sor_0 phyed_4 dang_10 gsum_15 gyis_20 snyan_25 du_31 'gyur_34 te_40 
T14D4315:9b-29	'dab ma dang lhan cig phyed dang bcas pa'i sor mo gnyis te /	'dab_0 ma_5 dang_8 lhan_13 cig_18 phyed_22 dang_28 'cha'_33 ba_38 sor_43 mo_47 gnyis_50 te_56 
T14D4315:9b-30	nang gi cha zhes pa ni zheng du shar dang nub kyi mtha'o //	nang_0 gi_5 cha_8 zhes_12 ba_17 ni_20 zheng_23 du_29 'char_32 dang_37 nub_42 kyi_46 mtha_50 
T14D4315:9b-31	snyan gyi logs kyi 'dab ma la'o //	snyan_0 gyi_6 logs_10 kyi_15 'dab_19 ma_24 la_27 
T14D4315:9b-32	spyan mtha' las mtha' sor mo phyed dang lnga snyan kyi 'dab ma ste /	spyan_0 mtha'_6 las_12 mtha'_16 sor_22 mo_26 phyed_29 dang_35 lnga_40 snyan_45 kyi_51 'dab_55 ma_60 ste_63 
T14D4315:9b-33	snyan gyi 'dab ma dang bcas pa'o //	snyan_0 gyi_6 'dab_10 ma_15 dang_18 'cha'_23 ba_28 
T14D4315:9b-34	snyan nas brtsams te snyan gyi bar bdun gyi cha'i dbu la sor bco brgyad do //	snyan_0 nas_6 brtsams_10 te_18 snyan_21 gyi_27 ba_31 bdun_35 gyi_40 cha_44 dbu_50 la_54 sor_57 'chos_61 brgyad_65 do_72 
T14D4315:9b-35	rgyab du sor mo bcu bzhi ste //	rgyab_0 du_6 sor_9 mo_13 'chu_16 bzhi_20 ste_25 
T14D4315:9b-36	nub kyi cha'i dbu la'o //	nub_0 kyi_4 cha_8 dbu_14 la_18 
T14D4315:9b-37	de dag bar du ni nub kyi cha'i khyad par dang ngo //	de_0 'dag_3 ba_7 du_11 ni_14 nub_17 kyi_21 cha_25 khyad_31 ba_37 dang_41 ngo_46 
T14D4315:9b-38	sor mo sum cu rtsa gnyis ni zhes pa la sogs pa ni gcig tu bya bar gsungs so //	sor_0 mo_4 sum_7 cu_11 rtsa_14 gnyis_19 ni_25 zhes_28 ba_33 la_36 sogs_39 ba_44 ni_47 gcig_50 tu_55 byed_58 ba_62 gsungs_66 so_73 
T14D4315:9b-39	zlum po ni bskor ba'o //	zlum_0 po_5 ni_8 skor_11 ba_17 
T14D4315:9b-40	mgul ni cha bzhi ste sor bzhi'o //	mgul_0 ni_5 cha_8 bzhi_12 ste_17 sor_21 bzhi_25 
T14D4315:9b-41	mgul nas brtsams te snyan la steng du sor mo dgu'o //	mgul_0 nas_5 brtsams_9 te_17 snyan_20 la_26 steng_29 du_35 sor_38 mo_42 dgu_45 
T14D4315:9b-42	shar dang nub kyi cha la bskor ba'i phyir sor mo nyi shu rtsa bzhi mgul la'o //	'char_0 dang_5 nub_10 kyi_14 cha_18 la_22 skor_25 ba_31 phyir_36 sor_42 mo_46 nyi_49 shu_53 rtsa_57 bzhi_62 mgul_67 la_72 
T14D4315:10a-0	mgul ba las @10a * //	mgul_0 ba_5 las_8 
T14D4315:10a-1	mgul ba'i lhag ma la sor mo brgyad de //	mgul_0 ba_5 lhag_10 ma_15 la_18 sor_21 mo_25 brgyad_28 de_35 
T14D4315:10a-2	logs su snyan gyi nye bar sor bzhi 'dzin pas so //	logs_0 su_5 snyan_8 gyi_14 nye_18 ba_22 sor_26 bzhi_30 'dzin_35 ba_41 so_45 
T14D4315:10a-3	thal gong sor mo bcu gnyis so //	thal_0 gong_5 sor_10 mo_14 'chu_17 gnyis_21 so_27 
T14D4315:10a-4	snying ga'i bar zhes pa ni snying ga'i nye ba'i	snying_0 ga_7 ba_12 zhes_16 ba_21 ni_24 snying_27 ga_34 nye_39 ba_43 
T14D4315:10a-5	bar gyi cha shas nyid dang bral ba zhes pa'i	ba_0 gyi_4 cha_8 shas_12 nyid_17 dang_22 'bral_27 ba_32 zhes_35 ba_40 
T14D4315:10a-6	don to // gdong pa bzhi yi tshad kyis ni //	don_0 to_4 gdong_10 ba_16 bzhi_19 yi_24 tshad_27 kyis_33 ni_38 
T14D4315:10a-7	phyag gi srid du zhes te ring du'o //	phyag_0 gi_6 srid_9 du_14 zhes_17 te_22 ring_25 du_30 
T14D4315:10a-8	phyag gi srid ces pa ni 'dir phrag pa nas	phyag_0 gi_6 srid_9 ces_14 ba_18 ni_21 'dir_24 phrag_29 ba_35 nas_38 
T14D4315:10a-9	brtsams te phyag gi rtse mo ji srid pa phyag	brtsams_0 te_8 phyag_11 gi_17 rtse_20 mo_25 ji_28 srid_31 ba_36 phyag_39 
T14D4315:10a-10	tu gsungs so // 'dir phrag pa nas gru mo'i	tu_0 gsungs_3 so_10 'dir_16 phrag_21 ba_27 nas_30 gru_34 mo_38 
T14D4315:10a-11	steng yan chod sor mo nyi shu dpung pa la	steng_0 yan_6 chod_10 sor_15 mo_19 nyi_22 shu_26 dpung_30 ba_36 la_39 
T14D4315:10a-12	tu gsungs so // blta bar bya'o // gru mo'i	tu_0 gsungs_3 so_10 lta_16 ba_21 byed_25 gru_34 mo_38 
T14D4315:10a-13	'og nas sku mkhrig ma yan chod phyag ngar te	'og_0 nas_4 sku_8 mkhrig_12 ma_19 yan_22 chod_26 phyag_31 ngar_37 te_42 
T14D4315:10a-14	sor mo bcu drug go //	sor_0 mo_4 'chu_7 drug_11 go_16 
T14D4315:10a-15	mkhrig ma'i 'og nas phyag gi rtse mo yan chad	mkhrig_0 ma_7 'og_12 nas_16 phyag_20 gi_26 rtse_29 mo_34 yan_37 'chad_41 
T14D4315:10a-16	gru mo'i zur gyi bar phyag ngar du blta bar	gru_0 mo_4 zur_9 gyi_13 ba_17 phyag_21 ngar_27 du_32 lta_35 ba_40 
T14D4315:10a-17	bya'o zhes gsungs so //	byed_0 zhes_6 gsungs_11 so_18 
T14D4315:10a-18	mchan 'og nas brtsams te bar lhu'i cha dang po'i	mchan_0 'og_6 nas_10 brtsams_14 te_22 ba_25 lhu_29 cha_35 dang_39 po_44 
T14D4315:10a-19	tshigs kyi mtha' yongs su blta ba ni sor mo	tshigs_0 kyi_7 mtha'_11 yongs_17 su_23 lta_26 ba_31 ni_34 sor_37 mo_41 
T14D4315:10a-20	nyi shu'o // phrag pa'i mdun gyi mtha' nas brtsams	nyi_0 shu_4 phrag_13 ba_19 mdun_24 gyi_29 mtha'_33 nas_39 brtsams_43 
T14D4315:10a-21	te rgyab tu gsungs pa ni 'di gnyis mnyam du	te_0 rgyab_3 tu_9 gsungs_12 ba_19 ni_22 'di_25 gnyis_29 mnyam_35 du_41 
T14D4315:10a-22	bcu gnyis kyi tshigs so zhes so //	'chu_0 gnyis_4 kyi_10 tshigs_14 so_21 zhes_24 so_29 
T14D4315:10a-23	tshigs kyi phyogs zlum po la sor mo bcu gnyis so //	tshigs_0 kyi_7 phyogs_11 zlum_18 po_23 la_26 sor_29 mo_33 'chu_36 gnyis_40 so_46 
T14D4315:10a-24	phyag dag gi phyag gi srid du sor mo bdun gyi tshad do //	phyag_0 'dag_6 gi_10 phyag_13 gi_19 srid_22 du_27 sor_30 mo_34 bdun_37 gyi_42 tshad_46 do_52 
T14D4315:10a-25	phyag gi mthil la dbus su rgyar sor lnga'i tshad /	phyag_0 gi_6 mthil_9 la_15 dbus_18 su_23 rgyar_26 sor_32 lnga_36 tshad_43 
T14D4315:10a-26	grangs zhes bya ba la sogs pas bcom ldan 'das	grangs_0 zhes_7 byed_12 ba_16 la_19 sogs_22 ba_27 'joms_31 ldan_36 'da'_41 
T14D4315:10a-27	kyi phyag la mtshan rnams gsungs pa ni mtshan thams	kyi_0 phyag_4 la_10 mtshan_13 rnams_20 gsungs_26 ba_33 ni_36 mtshan_39 thams_46 
T14D4315:10a-28	cad pa ste // 'khor lo rtsibs stong pa la	cad_0 ba_4 ste_7 'khor_14 lo_20 rtsibs_23 stong_30 ba_36 la_39 
T14D4315:10a-29	sogs pas lhan cig pa'i gzugs zhes pa ni mtshan	sogs_0 ba_5 lhan_9 cig_14 ba_18 gzugs_23 zhes_29 ba_34 ni_37 mtshan_40 
T14D4315:10a-30	thams cad kyi gzugs so //	thams_0 cad_6 kyi_10 gzugs_14 so_20 
T14D4315:10a-31	gang yang ji lta ba'i ri mo'i rnam pa dang /	gang_0 yang_5 ji_10 lta_13 ba_17 ri_22 mo_25 rnam_30 ba_35 dang_38 
T14D4315:10a-32	gang yang bkra shis kyi rnam pa dang /	gang_0 yang_5 bkra_10 shis_15 kyi_20 rnam_24 ba_29 dang_32 
T14D4315:10a-33	gang yang rig pa'i rnam pa dang /	gang_0 yang_5 rig_10 ba_14 rnam_19 ba_24 dang_27 
T14D4315:10a-34	gang yang sa'i rnam pa dang /	gang_0 yang_5 sa_10 rnam_15 ba_20 dang_23 
T14D4315:10a-35	gang yang g-yung drung 'khyil ba'i rnam pa zhes bya ba la sogs pa'o //	gang_0 yang_5 g-yung_10 drung_17 'khyil_23 ba_30 rnam_35 ba_40 zhes_43 byed_48 ba_52 la_55 sogs_58 ba_63 
T14D4315:10a-36	shis pa'i yon tan med pa dang mi ldan pa'o //	shis_0 ba_5 yon_10 tan_14 med_18 ba_22 dang_25 mi_30 ldan_33 ba_38 
T14D4315:10a-37	kun gyi mtshan gyi gzugs su gyur pa'o //	kun_0 gyi_4 mtshan_8 gyi_15 gzugs_19 su_25 gyur_28 ba_33 
T14D4315:10a-38	rnam pa phan tshun so sor ma 'byar ba'o //	rnam_0 ba_5 phan_8 tshun_13 so_19 sor_22 ma_26 'byor_29 ba_35 
T14D4315:10a-39	phyag sor gung mo sor lnga'i srid du ring ba'o //	phyag_0 sor_6 gung_10 mo_15 sor_18 lnga_22 srid_29 du_34 ring_37 ba_42 
T14D4315:10a-40	gung mo las tshigs phyed kyis dman pa mdzub mo ste sdigs mdzub bo //	gung_0 mo_5 las_8 tshigs_12 phyed_19 kyis_25 dman_30 ba_35 mdzub_38 mo_44 ste_47 sdigs_51 mdzub_57 'bo_63 
T14D4315:10a-41	sor mo phyed kyis dman pa ni ming med do //	sor_0 mo_4 phyed_7 kyis_13 dman_18 ba_23 ni_26 ming_29 med_34 do_38 
T14D4315:10a-42	mtheb chung ni nye ba ste ming med las zhes te //	mtheb_0 chung_6 ni_12 nye_15 ba_19 ste_22 ming_26 med_31 las_35 zhes_39 te_44 
T14D4315:10a-43	ming med las tshigs gcig gis dman pa ni mtheb chung ngo //	ming_0 med_5 las_9 tshigs_13 gcig_20 gis_25 dman_29 ba_34 ni_37 mtheb_40 chung_46 ngo_52 
T14D4315:10a-44	de rnams tshigs phyed sen mos mdzes pa ni yid 'phrog pa'o //	de_0 rnams_3 tshigs_9 phyed_16 sen_22 mos_26 mdzes_30 ba_36 ni_39 yid_42 'phrog_46 ba_53 
T14D4315:10a-45	mkhrig ma'i steng /	mkhrig_0 ma_7 steng_12 
T14D4315:10a-46	'dir don gyis go bar bya ba'i phyir mtheb chung spangs nas bzhi'o //	'dir_0 don_5 gyis_9 go_14 ba_17 byed_21 ba_25 phyir_30 mtheb_36 chung_42 spong_48 nas_55 bzhi_59 
T14D4315:10a-47	lte ba yang de bzhin du de srid sor mo bzhi pa nyid do //	lte_0 ba_4 yang_7 de_12 bzhin_15 du_21 de_24 srid_27 sor_32 mo_36 bzhi_39 ba_44 nyid_47 do_52 
T14D4315:10a-48	mtheb chen tshigs gnyis so //	mtheb_0 chen_6 tshigs_11 gnyis_18 so_24 
T14D4315:10b-0	tshigs phyed du sen @10b mo'o //	tshigs_0 phyed_7 du_13 sen_16 mo_25 
T14D4315:10b-1	mtheb chen gyi rtsa ba dang /	mtheb_0 chen_6 gyi_11 rtsa_15 ba_20 dang_23 
T14D4315:10b-2	mdzub mo'i rtsa ba'i bar la sor mo gsum mo //	mdzub_0 mo_6 rtsa_11 ba_16 ba_21 la_25 sor_28 mo_32 gsum_35 mo_40 
T14D4315:10b-3	mtheb chung dang mkhrig ma dag gi dbus kyi cha	mtheb_0 chung_6 dang_12 mkhrig_17 ma_24 'dag_27 gi_31 dbus_34 kyi_39 cha_43 
T14D4315:10b-4	phyag gi cha la srid du ste ring du sor	phyag_0 gi_6 cha_9 la_13 srid_16 du_21 ste_24 ring_28 du_33 sor_36 
T14D4315:10b-5	mo lnga'o // 'dir don gyis go bar bya ba'i	mo_0 lnga_3 'dir_13 don_18 gyis_22 go_27 ba_30 byed_34 ba_38 
T14D4315:10b-6	phyir mtheb chung spangs nas phyag gnyis kyi dbus ma'i	phyir_0 mtheb_6 chung_12 spong_18 nas_25 phyag_29 gnyis_35 kyi_41 dbus_45 ma_50 
T14D4315:10b-7	nye bar ring du tshigs gsum gyi cha yis mtho	nye_0 ba_4 ring_8 du_13 tshigs_16 gsum_23 gyi_28 cha_32 yis_36 mtho_40 
T14D4315:10b-8	mo lnga'o // ba'o // de steng zhes pa ni	mo_0 lnga_3 ba_13 de_21 steng_24 zhes_30 ba_35 ni_38 
T14D4315:10b-9	mchan 'og gi steng du phrag pa'i mtshams su cha	mchan_0 'og_6 gi_10 steng_13 du_19 phrag_22 ba_28 mtshams_33 su_41 cha_44 
T14D4315:10b-10	mo lnga'o // ba'o // dgur bya'o // sor mo dgu po rnams kyi tshad do //	mo_0 lnga_3 ba_13 dgur_21 byed_26 sor_35 mo_39 dgu_42 po_46 rnams_49 kyi_55 tshad_59 do_65 
T14D4315:10b-11	brang dang sku rgyab ces pa ni sku brang dang	brang_0 dang_6 sku_11 rgyab_15 ces_21 ba_25 ni_28 sku_31 brang_35 dang_41 
T14D4315:10b-12	sku rgyab dag re re nyid la bskor ba ste	sku_0 rgyab_4 'dag_10 re_14 re_17 nyid_20 la_25 skor_28 ba_34 ste_37 
T14D4315:10b-13	yongs su zlum du sor mo lnga bcu rtsa drug	yongs_0 su_6 zlum_9 du_14 sor_17 mo_21 lnga_24 'chu_29 rtsa_33 drug_38 
T14D4315:10b-14	go // nu ma lte ba'i bar de bzhin zhes	go_0 nu_6 ma_9 lte_12 ba_16 ba_21 de_25 bzhin_28 zhes_34 
T14D4315:10b-15	pa ni nu ma dang lte ba'i bar la sor	ba_0 ni_3 nu_6 ma_9 dang_12 lte_17 ba_21 ba_26 la_30 sor_33 
T14D4315:10b-16	mo bcu drug go //	mo_0 'chu_3 drug_7 go_12 
T14D4315:10b-17	kun 'bigs zhes pa ste khung dang /	kun_0 'bigs_4 zhes_10 ba_15 ste_18 khung_22 dang_28 
T14D4315:10b-18	tshigs dag ces pa ste tshigs kyi mdud pa dag dang /	tshigs_0 'dag_7 ces_11 ba_15 ste_18 tshigs_22 kyi_29 mdud_33 ba_38 'dag_41 dang_45 
T14D4315:10b-19	lte ba gnyis kyi cha shas pa gas pa 'dus	lte_0 ba_4 gnyis_7 kyi_13 cha_17 shas_21 ba_26 'gas_29 ba_33 'du_36 
T14D4315:10b-20	pa de dag lhan cig lte ba'i khung ni sor	ba_0 de_3 'dag_6 lhan_10 cig_15 lte_19 ba_23 khung_28 ni_34 sor_37 
T14D4315:10b-21	mo gcig go // lte ba'i dbus su yongs su	mo_0 gcig_3 go_8 lte_14 ba_18 dbus_23 su_28 yongs_31 su_37 
T14D4315:10b-22	brtag pa ni lte ba nas brtsams te rgyab dang	rtog_0 ba_6 ni_9 lte_12 ba_16 nas_19 brtsams_23 te_31 rgyab_34 dang_40 
T14D4315:10b-23	lhan cig ji srid lte ba tshun chad zlum po	lhan_0 cig_5 ji_9 srid_12 lte_17 ba_21 tshun_24 'chad_30 zlum_35 po_40 
T14D4315:10b-24	la sor mo bzhi bcu rtsa drug go / srid	la_0 sor_3 mo_7 bzhi_10 'chu_15 rtsa_19 drug_24 go_29 srid_34 
T14D4315:10b-25	kyi rgya ru zlum po dag la pags pa'i 'og	kyi_0 rgya_4 ru_9 zlum_12 po_17 'dag_20 la_24 pags_27 ba_32 'og_37 
T14D4315:10b-26	tu sor mo bzhi 'chad pa'o //	tu_0 sor_3 mo_7 bzhi_10 'chad_15 ba_21 
T14D4315:10b-27	sgang gnyis kyi steng du sor gcig go / brla	sgang_0 gnyis_6 kyi_12 steng_16 du_22 sor_25 gcig_29 go_34 brla_39 
T14D4315:10b-28	zhes pa ni brla'i steng du mnyam gzhag yang dag	zhes_0 ba_5 ni_8 brla_11 steng_18 du_24 mnyam_27 'jog_33 yang_39 'dag_44 
T14D4315:10b-29	pa'i gzugs bya'o // de dag steng gi dbus kyi bar la sor bcu gnyis so //	ba_0 gzugs_5 byed_11 de_20 'dag_23 steng_27 gi_33 dbus_36 kyi_41 ba_45 la_49 sor_52 'chu_56 gnyis_60 so_66 
T14D4315:10b-30	brla'i rtsa ba'i zlum la sor mo sum cu rtsa	brla_0 rtsa_7 ba_12 zlum_17 la_22 sor_25 mo_29 sum_32 cu_36 rtsa_39 
T14D4315:10b-31	drug go / brla'i 'og gi dbus kyi zlum po	drug_0 go_5 brla_10 'og_17 gi_21 dbus_24 kyi_29 zlum_33 po_38 
T14D4315:10b-32	la sor mo sum cu rtsa gnyis so //	la_0 sor_3 mo_7 sum_10 cu_14 rtsa_17 gnyis_22 so_28 
T14D4315:10b-33	pus mo zhes pa ni pus mo'i rtsar yongs su	pus_0 mo_4 zhes_7 ba_12 ni_15 pus_18 mo_22 rtsar_27 yongs_33 su_39 
T14D4315:10b-34	bskor ba'i zlum la sor mo nyi shu rtsa brgyad	skor_0 ba_6 zlum_11 la_16 sor_19 mo_23 nyi_26 shu_30 rtsa_34 brgyad_39 
