T14D4315:10b-35	do // tshigs bcings pa sngon ma gnyis sor mo bzhi'o //	do_0 tshigs_6 'ching_13 ba_20 sngon_23 ma_29 gnyis_32 sor_38 mo_42 bzhi_45 
T14D4315:10b-36	pus mo 'og tu pus mo las sor mo ste long bu sor mo gnyis so //	pus_0 mo_4 'og_7 tu_11 pus_14 mo_18 las_21 sor_25 mo_29 ste_32 long_36 bu_41 sor_44 mo_48 gnyis_51 so_57 
T14D4315:10b-37	long bu mi mngon pa la sogs pa ni sor mo'i tshigs gnyis ni mngon pa dang /	long_0 bu_5 mi_8 mngon_11 ba_17 la_20 sogs_23 ba_28 ni_31 sor_34 mo_38 tshigs_43 gnyis_50 ni_56 mngon_59 ba_65 dang_68 
T14D4315:10b-38	sha yis 'khyil ba'o //	sha_0 yis_4 'khyil_8 ba_15 
T14D4315:10b-39	de'i phyir rtsa ni gnas par 'gyur ro //	de_0 phyir_5 rtsa_11 ni_16 gnas_19 ba_24 'gyur_28 ro_34 
T14D4315:10b-40	rje ngar dag ni dbus kyi 'khyil pa sor mo	rje_0 ngar_4 'dag_9 ni_13 dbus_16 kyi_21 'khyil_25 ba_32 sor_35 mo_39 
T14D4315:10b-41	nyi shu rtsa gcig gis yongs su zlum po nyid	nyi_0 shu_4 rtsa_8 gcig_13 gis_18 yongs_22 su_28 zlum_31 po_36 nyid_39 
T14D4315:10b-42	do // dbus kyi 'og tu sor mo bcu bzhis yongs su zlum pa'o //	do_0 dbus_6 kyi_11 'og_15 tu_19 sor_22 mo_26 'chu_29 bzhis_33 yongs_39 su_45 zlum_48 ba_53 
T14D4315:10b-43	long bu'i 'og tu zhes pa ni zhabs kyi long bu man chod la sor bzhi'o //	long_0 bu_5 'og_10 tu_14 zhes_17 ba_22 ni_25 zhabs_28 kyi_34 long_38 bu_43 man_46 chod_50 la_55 sor_58 bzhi_62 
T14D4315:10b-44	long bu'i phyi rol nas ji srid sen mo'i bar du zhabs kyi srid du sor bcu gnyis so //	long_0 bu_5 phyi_10 rol_15 nas_19 ji_23 srid_26 sen_31 mo_35 ba_40 du_44 zhabs_47 kyi_53 srid_57 du_62 sor_65 'chu_69 gnyis_73 so_79 
T14D4315:10b-45	zhabs kyi phyed kyi zheng du 'o zhes pa ni sor mo drug go //	zhabs_0 kyi_6 phyed_10 kyi_16 zheng_20 du_26 'o_29 zhes_32 ba_37 ni_40 sor_43 mo_47 drug_50 go_55 
T14D4315:10b-46	steng dang 'og gi rgyar sor mo gnyis so //	steng_0 dang_6 'og_11 gi_15 rgyar_18 sor_24 mo_28 gnyis_31 so_37 
T14D4315:11a-0	zhabs gnyis kyi logs zhabs kyi long bu'i 'og rting pa la steng dang 'og tu sor @11a * //	zhabs_0 gnyis_6 kyi_12 logs_16 zhabs_21 kyi_27 long_31 bu_36 'og_41 rting_45 ba_51 la_54 steng_57 dang_63 'og_68 tu_72 sor_75 
T14D4315:11a-1	bzhi 'o ;	bzhi_0 'o_5 
T14D4315:11a-2	/ sor mo drug gi rgya las ni zhes pa la sogs pas ni rgya ste /	sor_2 mo_6 drug_9 gi_14 rgya_17 las_22 ni_26 zhes_29 ba_34 la_37 sogs_40 ba_45 ni_49 rgya_52 ste_57 
T14D4315:11a-3	'phred la sum 'gyur gyis zlum po ste zhes pa	'phred_0 la_7 sum_10 'gyur_14 gyis_20 zlum_25 po_30 ste_33 zhes_37 ba_42 
T14D4315:11a-4	ni rting ba'i zur gcig nas gcig gi rting bar	ni_0 rting_3 ba_9 zur_14 gcig_18 nas_23 gcig_27 gi_32 rting_35 ba_41 
T14D4315:11a-5	du zhabs dang lhan cig du zlum po la sum	du_0 zhabs_3 dang_9 lhan_14 cig_19 du_23 zlum_26 po_31 la_34 sum_37 
T14D4315:11a-6	'gyur ni sor mo bco brgyad ces pa'i don to	'gyur_0 ni_6 sor_9 mo_13 'chos_16 brgyad_20 ces_27 ba_31 don_36 to_40 
T14D4315:11a-7	// zhabs kyi sor mo lnga po rnams ni tshigs	zhabs_3 kyi_9 sor_13 mo_17 lnga_20 po_25 rnams_28 ni_34 tshigs_37 
T14D4315:11a-8	gnyis pa rtse mo'i phyed du sen mos mdzes pa	gnyis_0 ba_6 rtse_9 mo_14 phyed_19 du_25 sen_28 mos_32 mdzes_36 ba_42 
T14D4315:11a-9	ni mtheb chen no //	ni_0 mtheb_3 chen_9 no_14 
T14D4315:11a-10	sor mo lnga po rnams ni yongs su zlum pa'o //	sor_0 mo_4 lnga_7 po_12 rnams_15 ni_21 yongs_24 su_30 zlum_33 ba_38 
T14D4315:11a-11	srid du sor mo gsum zhes pa ni ring du sor mo gsum mo //	srid_0 du_5 sor_8 mo_12 gsum_15 zhes_20 ba_25 ni_28 ring_31 du_36 sor_39 mo_43 gsum_46 mo_51 
T14D4315:11a-12	zhabs kyi mdzub mo ni srid du mtheb chen dang mnyam pa nyid do //	zhabs_0 kyi_6 mdzub_10 mo_16 ni_19 srid_22 du_27 mtheb_30 chen_36 dang_41 mnyam_46 ba_52 nyid_55 do_60 
T14D4315:11a-13	de'i phyir mtheb chen gyi srid du 'dzub mo'o //	de_0 phyir_5 mtheb_11 chen_17 gyi_22 srid_26 du_31 'dzub_34 mo_40 
T14D4315:11a-14	cha bcu drug gi dbus ma dman zhing thung ba'o ;	cha_0 'chu_4 drug_8 gi_13 dbus_16 ma_21 dman_24 zhing_29 thung_35 ba_41 
T14D4315:11a-15	/ gung mo las brgyad chas dman pa ni ming med do //	gung_2 mo_7 las_10 brgyad_14 cha_21 dman_26 ba_31 ni_34 ming_37 med_42 do_46 
T14D4315:11a-16	ming med las brgyad chas dman pa ni mtheb chung ngo //	ming_0 med_5 las_9 brgyad_13 cha_20 dman_25 ba_30 ni_33 mtheb_36 chung_42 ngo_48 
T14D4315:11a-17	sor mo rnams ni sor gcig gi dpangs su'o //	sor_0 mo_4 rnams_7 ni_13 sor_16 gcig_20 gi_25 dpangs_28 su_35 
T14D4315:11a-18	mtheb chen ni phyed dang bcas pa'i sor mo'i dpangs su'o //	mtheb_0 chen_6 ni_11 phyed_14 dang_20 'cha'_25 ba_30 sor_35 mo_39 dpangs_44 su_51 
T14D4315:11a-19	zhabs kyi phyed rgyab rus sbal gyi rgyab lta bu'o //	zhabs_0 kyi_6 phyed_10 rgyab_16 rus_22 sbal_26 gyi_31 rgyab_35 lta_41 bu_45 
T14D4315:11a-20	zhabs kyi mthil 'khor lo la sogs pas rnam par brgyan pa'o //	zhabs_0 kyi_6 mthil_10 'khor_16 lo_22 la_25 sogs_28 ba_33 rnam_37 ba_42 rgyan_46 ba_53 
T14D4315:11a-21	mnyam du 'brel pa ni ngang pa'i rkang pa ltar ma chad par 'brel pa'o //	mnyam_0 du_6 'brel_9 ba_15 ni_18 ngang_21 ba_27 rkang_32 ba_38 ltar_41 ma_46 'chad_49 ba_54 'brel_58 ba_64 
T14D4315:11a-22	bya'i sgo nga zhes bya ba la sogs pas ni zhal rnam pa bzhi ru gsungs so //	byed_0 sgo_6 nga_10 zhes_14 byed_19 ba_23 la_26 sogs_29 ba_34 ni_38 zhal_41 rnam_46 ba_51 bzhi_54 ru_59 gsungs_62 so_69 
T14D4315:11a-23	skyes bu chen po'i zhal ni bya'i sgo nga'i rnam pa'o //	skye_0 bu_6 chen_9 po_14 zhal_19 ni_24 byed_27 sgo_33 nga_37 rnam_43 ba_48 
T14D4315:11a-24	mandal gyi rnam pa'o ni khro bo rnams kyi yin no //	mandal_0 gyi_7 rnam_11 ba_16 ni_21 khro_24 'bo_29 rnams_32 kyi_38 yin_42 no_46 
T14D4315:11a-25	gru bzhi pa yang ngo //	gru_0 bzhi_4 ba_9 yang_12 ngo_17 
T14D4315:11a-26	rdzogs pa'i sangs rgyas rnams kyi rab tu zhi bar bya'o //	rdzogs_0 ba_7 sangs_12 rgya_18 rnams_24 kyi_30 rab_34 tu_38 zhi_41 ba_45 byed_49 
T14D4315:11a-27	spyan ni dangs par gyur pa ste /	spyan_0 ni_6 dangs_9 ba_15 gyur_19 ba_24 ste_27 
T14D4315:11a-28	thams cad la gzigs par byed pa thams cad mkhyen pa'i spyan no //	thams_0 cad_6 la_10 gzigs_13 ba_19 byed_23 ba_28 thams_31 cad_37 mkhyen_41 ba_48 spyan_53 no_59 
T14D4315:11a-29	steng du lta bar byed pa dang /	steng_0 du_6 lta_9 ba_13 byed_17 ba_22 dang_25 
T14D4315:11a-30	dman pa la brten pa dang /	dman_0 ba_5 la_8 rten_11 ba_17 dang_20 
T14D4315:11a-31	'og tu lta ba yang ma yin par ro //	'og_0 tu_4 lta_7 ba_11 yang_14 ma_19 yin_22 ba_26 ro_30 
T14D4315:11a-32	bdag gis rnam 'grel 'di byas bsod nams des //	bdag_0 gis_5 rnam_9 'grel_14 'di_20 byed_24 bsod_29 nams_34 des_39 
T14D4315:11a-33	sangs rgyas la sogs tshad ni rdzogs byas te //	sangs_0 rgya_6 la_12 sogs_15 tshad_20 ni_26 rdzogs_29 byed_36 te_41 
T14D4315:11a-34	rnam par mi rtog byang chub tshogs thob cing //	rnam_0 ba_5 mi_9 rtogs_12 byang_17 chub_23 tshogs_28 'thob_35 cing_40 
T14D4315:11a-35	skye dgu rnams kyis rgyal ba nyid thob shog /	skye_0 dgu_5 rnams_9 kyis_15 rgyal_20 ba_26 nyid_29 'thob_34 shog_39 
T14D4315:11a-36	yang dag par rdzogs pa'i sangs rgyas kyis gsungs pa'i	yang_0 'dag_5 ba_9 rdzogs_13 ba_20 sangs_25 rgya_31 kyis_37 gsungs_42 ba_49 
T14D4315:11a-37	sku gzugs kyi tshad kyi mtshan nyid kyi rnam 'grel	sku_0 gzugs_4 kyi_10 tshad_14 kyi_20 mtshan_24 nyid_31 kyi_36 rnam_40 'grel_45 
T14D4315:11a-38	rdzogs so / //	rdzogs_0 so_7 
T14D4315:11a-39	/ rgya gar gyi mkhan po dharma dha ra dang /	rgya_2 gar_7 gyi_11 mkhan_15 po_21 dharma_24 dha_31 ra_35 dang_38 
T14D4315:11a-40	lo ts'a ba yar klungs pa grags pa rgyal mtshan	lo_0 ts_3 ba_8 yar_11 klungs_15 ba_22 grags_25 ba_31 rgyal_34 mtshan_40 
T14D4315:11a-41	gyis mang yul gung thang gi rgyal sar bsgyur ba'o	gyis_0 mang_5 yul_10 gung_14 thang_19 gi_25 rgyal_28 sar_34 sgyur_38 ba_45 
T14D4315:11a-42	// grub pa kun mkhyen chos rgyal gyi //	'grub_3 ba_8 kun_11 mkhyen_15 chos_22 rgyal_27 gyi_33 
T14D4315:11a-43	gsung gi 'od zer snang ba brten //	gsung_0 gi_6 'od_9 zer_13 snang_17 ba_23 rten_26 
T14D4315:11a-44	mkhas chen bho ta pandi ta //	mkhas_0 chen_6 bho_11 ta_15 pandi_18 ta_24 
T14D4315:11a-45	dam chos 'dzin dag gsung brten nas //	dam_0 chos_4 'dzin_9 'dag_15 gsung_19 rten_25 nas_31 
T14D4315:11a-46	yar klungs grags pa rgyal mtshan gyis //	yar_0 klungs_4 grags_11 ba_17 rgyal_20 mtshan_26 gyis_33 
T14D4315:11a-47	gung thang rgyal sar legs par bsgyur//	gung_0 thang_5 rgyal_11 sar_17 legs_21 ba_26 
