T16D4392:323a-29	dbang dang mngon shes so sor rig pa dang //	dbang_0 dang_6 mngon_11 shes_17 so_22 sor_25 rig_29 ba_33 dang_36 
T16D4392:323a-30	gzungs dang rnam par thar ba'i sgo rtogs nas //	gzungs_0 dang_7 rnam_12 ba_17 thar_21 ba_26 sgo_31 rtogs_35 nas_41 
T16D4392:323a-31	'jig rten khams ni dpag tu ma mchis pa'i //	'jig_0 rten_5 khams_10 ni_16 dpog_19 tu_24 ma_27 mchis_30 ba_36 
T16D4392:323a-32	sems can rnams la phan pa dus gcig bgyi //	sems_0 can_5 rnams_9 la_15 phan_18 ba_23 dus_26 gcig_30 bgyid_35 
T16D4392:323a-33	sangs rgyas zhes bgyi'i sgra ni rna lam du //	sangs_0 rgya_6 zhes_12 bgyid_17 sgra_24 ni_29 rna_32 lam_36 du_40 
T16D4392:323a-34	thos ma gyur ba'i yul khams gang lags pa //	thos_0 ma_5 gyur_8 ba_13 yul_18 khams_22 gang_28 lags_33 ba_38 
T16D4392:323a-35	der ni thabs kyi rnam pa sna tshogs kyis //	der_0 ni_4 thabs_7 kyi_13 rnam_17 ba_22 sna_25 tshogs_29 kyis_36 
T16D4392:323a-36	sangs rgyas mdzad pa dag dang mthun par bgyi //	sangs_0 rgya_6 mdzad_12 ba_18 'dag_21 dang_25 mthun_30 ba_36 bgyid_40 
T16D4392:323a-37	nam zhig 'jig rten 'dir ni srid gsum gyi //	nam_0 'jig_4 'jig_9 rten_14 'dir_19 ni_24 srid_27 gsum_32 gyi_37 
T16D4392:323a-38	bla ma nyi ma shar bar ma gyur bar //	bla_0 ma_4 nyi_7 ma_11 'char_14 ba_19 ma_23 gyur_26 ba_31 
T16D4392:323a-39	der ni bdag gis nyi ma bzhin du ni //	der_0 ni_4 bdag_7 gis_12 nyi_16 ma_20 bzhin_23 du_29 ni_32 
T16D4392:323a-40	lus can kun gyi rab rib bsal bar bgyi //	lus_0 can_4 kun_8 gyi_12 rab_16 rib_20 bsal_24 ba_29 bgyid_33 
T16D4392:323a-41	bde gshegs rab tu mang pos spangs pa yi //	bde_0 gshegs_4 rab_11 tu_15 mang_18 pos_23 spong_27 ba_34 yi_37 
T16D4392:323a-42	yid dag sdig pas spags pa gang lags pa'i //	yid_0 'dag_4 sdig_8 ba_13 spog_17 ba_23 gang_26 lags_31 ba_36 
T16D4392:323b-0	'gro @323b ba de ni bdag gi tshig dag gis //	'gro_0 ba_11 de_14 ni_17 bdag_20 gi_25 tshig_28 'dag_34 gis_38 
T16D4392:323b-1	spyod yul rnams la brten nas 'dul bar shog / bdag ni 'jig rten ma lus pa dag gis //	spyod_0 yul_6 rnams_10 la_16 rten_19 nas_25 'dul_29 ba_34 shog_38 bdag_45 ni_50 'jig_53 rten_58 ma_63 lus_66 ba_70 'dag_73 gis_77 
T16D4392:323b-2	bsnyen bkur bgyid pa dag la nye du dang //	snyen_0 bkur_7 bgyid_12 ba_18 'dag_21 la_25 nye_28 du_32 dang_35 
T16D4392:323b-3	byams la mdza' bshes ma bzhin sgrub pa dang //	byams_0 la_6 mdza'_9 bshes_15 ma_21 bzhin_24 sgrub_30 ba_36 dang_39 
T16D4392:323b-4	pha bzhin phan pa'i gdams ngag 'doms par shog /	pha_0 bzhin_4 phan_10 ba_15 'doms_20 ngag_26 'doms_31 ba_37 shog_41 
T16D4392:323b-5	bdag gi ming ni dran pa tsam gyis kyang //	bdag_0 gi_5 ming_8 ni_13 dran_16 ba_21 tsam_24 gyis_29 kyang_34 
T16D4392:323b-6	'gro ba ma lus pa dag 'jigs pa las //	'gro_0 ba_5 ma_8 lus_11 ba_15 'dag_18 'jigs_22 ba_28 las_31 
T16D4392:323b-7	mod la skyob par gyur cig srid gsum gyi //	mod_0 la_4 skyob_7 ba_13 gyur_17 cig_22 srid_26 gsum_31 gyi_36 
T16D4392:323b-8	sdug bsngal ma lus pa dag spong bar shog / phongs pa brgya phrag bsten pa'i mi dag la //	sdug_0 sngal_5 ma_12 lus_15 ba_19 'dag_22 spong_26 ba_32 shog_36 'phong_43 ba_50 brgya_53 phrag_59 sten_65 ba_71 mi_76 'dag_79 la_83 
T16D4392:323b-9	bum pa bzang dang nad pa'i sman dag ni //	bum_0 ba_4 bzang_7 dang_13 nad_18 ba_22 sman_27 'dag_32 ni_36 
T16D4392:323b-10	yi dags sogs la rgyun mi 'chad par yang //	yi_0 dags_3 sogs_8 la_13 rgyun_16 mi_22 'chad_25 ba_31 yang_35 
T16D4392:323b-11	bdud rtsi'i chab kyi rdzing bu bzang por shog / bdag ni grang ba'i dmyal bar dro ba dang //	bdud_0 rtsi_5 chab_12 kyi_17 rdzing_21 bu_28 bzang_31 por_37 shog_41 bdag_48 ni_53 grang_56 ba_62 dmyal_67 ba_73 dro_77 ba_81 dang_84 
T16D4392:323b-12	tsha ba rdzi char bcas pa'i char 'bebs shing //	tsha_0 ba_5 rdzi_8 char_13 'cha'_18 ba_23 char_28 'bebs_33 shing_39 
T16D4392:323b-13	gzhan yang shin tu smad pa'i ngan 'gro dag / gnod pa ma lus zhi bar bgyid par shog /	gzhan_0 yang_6 shin_11 tu_16 smad_19 ba_24 ngan_29 'gro_34 'dag_39 gnod_45 ba_50 ma_53 lus_56 zhi_60 ba_64 bgyid_68 ba_74 shog_78 
T16D4392:323b-14	'gro bas bdag ni dran pa tsam gyis kyang //	'gro_0 ba_5 bdag_9 ni_14 dran_17 ba_22 tsam_25 gyis_30 kyang_35 
T16D4392:323b-15	phongs pa mngon sum gyur la gnyen bshes dang //	'phong_0 ba_7 mngon_10 sum_16 gyur_20 la_25 gnyen_28 bshes_34 dang_40 
T16D4392:323b-16	nyam thag mda' char 'bab la gos sra dang //	nyam_0 thag_5 mda'_10 char_15 'bab_20 la_25 gos_28 sra_32 dang_36 
T16D4392:323b-17	mya ngan mi la bsil ba'i chab gyur cig / gro ba dag gis dran na nyon mongs pa'i //	mya_0 ngan_4 mi_9 la_12 bsil_15 ba_20 chab_25 gyur_30 cig_35 ba_45 'dag_48 gis_52 dran_56 na_61 nyon_64 mongs_69 ba_75 
T16D4392:323b-18	dug gi gnyen por gyur cing srid gsum gyi ;	dug_0 gi_4 gnyen_7 por_13 gyur_17 cing_22 srid_27 gsum_32 gyi_37 
T16D4392:323b-19	/ chu bo dag la zam pa brtan po dang //	chu_2 'bo_6 'dag_9 la_13 zam_16 ba_20 brtan_23 po_29 dang_32 
T16D4392:323b-20	ngan song gnas kyi sgo gtan bgyid par shog / bdag gi ming tsam dran na'ang 'jus pa bzhin //	ngan_0 'gro_5 gnas_10 kyi_15 sgo_19 gtan_23 bgyid_28 ba_34 shog_38 bdag_45 gi_50 ming_53 tsam_58 dran_63 na_68 'ju_75 ba_80 bzhin_83 
T16D4392:323b-21	'gro ba ma lus srid pa'i g-yang sa ru //	'gro_0 ba_5 ma_8 lus_11 srid_15 ba_20 g-yang_25 sa_32 ru_35 
T16D4392:323b-22	lhung ba zhi ba dag gi rtse mo la //	lhung_0 ba_6 zhi_9 ba_13 'dag_16 gi_20 rtse_23 mo_28 la_31 
T16D4392:323b-23	'dzeg par gyur pa'i them skas gzhir gyur cig /	'dzeg_0 ba_6 gyur_10 ba_15 'thems_20 skas_25 gzhir_30 gyur_36 cig_41 
T16D4392:323b-24	skad cig tsam yang khro zhi dag gi ming //	skad_0 cig_5 tsam_9 yang_14 khro_19 zhi_24 'dag_28 gi_32 ming_35 
T16D4392:323b-25	blo la dran pa tsam zhig bgyid na yang //	blo_0 la_4 dran_7 ba_12 tsam_15 'jig_20 bgyid_25 na_31 yang_34 
T16D4392:323b-26	ngan song rnams su ltung bar mi 'gyur zhing //	ngan_0 'gro_5 rnams_10 su_16 ltung_19 ba_25 mi_29 'gyur_32 zhing_38 
T16D4392:323b-27	nges par byang chub yang dag sgrub par shog / bdag gi yon tan zla zer dri med ltar //	nges_0 ba_5 byang_9 chub_15 yang_20 'dag_25 sgrub_29 ba_35 shog_39 bdag_46 gi_51 yon_54 tan_58 zla_62 zer_66 'dri_70 med_74 ltar_78 
T16D4392:323b-28	'jig rten ma lus pa la bder gyur cig / dbugs tsam phyung ba rnams kyang pha rol la //	'jig_0 rten_5 ma_10 lus_13 ba_17 la_20 bder_23 gyur_28 cig_33 dbugs_39 tsam_45 'byin_50 ba_57 rnams_60 kyang_66 pha_72 rol_76 la_80 
T16D4392:323b-29	bde ba dpag med skyed par bgyid par shog / shin tu phan sum tshogs pa ma lus pa //	bde_0 ba_4 dpog_7 med_12 skyed_16 ba_22 bgyid_26 ba_32 shog_36 shin_43 tu_48 phan_51 sum_56 tshogs_60 ba_67 ma_70 lus_73 ba_77 
T16D4392:323b-30	mthar phyin pa yi sangs rgyas nyid thob nas //	mthar_0 phyin_6 ba_12 yi_15 sangs_18 rgya_24 nyid_30 'thob_35 nas_40 
T16D4392:323b-31	dam pa'i sangs rgyas de nyid kho na la //	dam_0 ba_4 sangs_9 rgya_15 de_21 nyid_24 kho_29 na_33 la_36 
T16D4392:323b-32	'gro ba ma lus pa yang sbyar bar bgyi //	'gro_0 ba_5 ma_8 lus_11 ba_15 yang_18 sbyor_23 ba_29 bgyid_33 
T16D4392:324a-0	de yi tshe @324a * //	de_0 yi_3 tshe_6 
T16D4392:324a-1	na su yi sems la yang //	na_0 su_3 yi_6 sems_9 la_14 yang_17 
T16D4392:324a-2	nyes byas phran tshogs tsam yang mi 'byung la //	nyes_0 byed_5 phran_10 tshogs_16 tsam_23 yang_28 mi_33 'byung_36 la_43 
T16D4392:324a-3	skye bo gzhan la rgyun du phan byed cing //	skye_0 'bo_5 gzhan_8 la_14 rgyun_17 du_23 phan_26 byed_31 cing_36 
T16D4392:324a-4	dge ba bcu yi lam la gnas par shog / su yang rung ste ngan song gnas rnams ni //	dge_0 ba_4 'chu_7 yi_11 lam_14 la_18 gnas_21 ba_26 shog_30 su_37 yang_40 rung_45 ste_50 ngan_54 'gro_59 gnas_64 rnams_69 ni_75 
T16D4392:324a-5	rmi lam na yang mthong bar mi 'gyur zhing //	rmi_0 lam_4 na_8 yang_11 mthong_16 ba_23 mi_27 'gyur_30 zhing_36 
T16D4392:324a-6	ngan 'gro rnams kyi gnas ni mtha' dag kyang //	ngan_0 'gro_5 rnams_10 kyi_16 gnas_20 ni_25 mtha'_28 'dag_34 kyang_38 
T16D4392:324a-7	lha yi 'jig rten bzhin du dga' bar shog / ji srid 'jig rten gsum gyi mi dge ba'i //	lha_0 yi_4 'jig_7 rten_12 bzhin_17 du_23 dga'_26 ba_31 shog_35 ji_42 srid_45 'jig_50 rten_55 gsum_60 gyi_65 mi_69 dge_72 ba_76 
T16D4392:324a-8	mtsho klung dbus su 'ga' zhig chud na yang //	mtsho_0 klung_6 dbus_12 su_17 'ga'_20 'jig_25 chud_30 na_35 yang_38 
T16D4392:324a-9	sangs rgyas bgyi ba yongs su mthar phyin kyang //	sangs_0 rgya_6 bgyid_12 ba_17 yongs_20 su_26 mthar_29 phyin_35 kyang_41 
T16D4392:324a-10	de srid de yi ched du bsdad par bgyi ;	de_0 srid_3 de_8 yi_11 ched_14 du_19 sdod_22 ba_28 bgyid_32 
T16D4392:324a-11	/ bdag ni mya ngan 'das 'gro ston pa na //	bdag_2 ni_7 mya_10 ngan_14 'da'_19 'gro_24 ston_29 ba_34 na_37 
T16D4392:324a-12	gsung rab rnams ni 'khrug par mi 'gyur zhing //	gsung_0 rab_6 rnams_10 ni_16 'khrug_19 ba_26 mi_30 'gyur_33 zhing_39 
T16D4392:324a-13	de la 'ga' yang som nyi'i dpyang thag la //	de_0 la_3 'ga'_6 yang_11 som_16 nyi_20 dpyong_26 thag_33 la_38 
T16D4392:324a-14	skad cig tsam yang 'ju bar ma gyur cig / de ltar rgyal ba'i sras kyi rnam 'phrul la //	skad_0 cig_5 tsam_9 yang_14 'ju_19 ba_23 ma_27 gyur_30 cig_35 de_41 ltar_44 rgyal_49 ba_55 sras_60 kyi_65 rnam_69 'phrul_74 la_81 
T16D4392:324a-15	mngon dgas bdag gis dge ba bsgrubs pa gang //	mngon_0 'gas_6 bdag_11 gis_16 dge_20 ba_24 sgrub_27 ba_35 gang_38 
T16D4392:324a-16	des ni 'gro ba ma lus de dag gi /	des_0 ni_4 'gro_7 ba_12 ma_15 lus_18 de_22 'dag_25 gi_29 
T16D4392:324a-17	ma lus par ni thun mong 'gyur bar shog /	ma_0 lus_3 ba_7 ni_11 thun_14 mong_19 'gyur_24 ba_30 shog_34 
T16D4392:324a-18	slob dpon btsun pa gzhan la phan pa'i dbyangs dgon	slob_0 dpon_5 btsun_10 ba_16 gzhan_19 la_25 phan_28 ba_33 dbyangs_38 dgon_46 
T16D4392:324a-19	pa ba gsung rab mtha' dag chub par byas pa	ba_0 ba_3 gsung_6 rab_12 mtha'_16 'dag_22 chub_26 ba_31 byed_35 ba_40 
T16D4392:324a-20	stag gis rang la bskyon te nags khung du phyin	stag_0 gis_5 rang_9 la_14 skyon_17 te_24 nags_27 khung_32 du_38 phyin_41 
T16D4392:324a-21	pa na snying rjes gdung ba'i yid kyis 'gro ba'i	ba_0 na_3 snying_6 rjes_13 gdung_18 ba_24 yid_29 kyis_33 'gro_38 ba_43 
T16D4392:324a-22	don sgrub pa'i smon lam bdun cu mdzad pa rdzogs	don_0 sgrub_4 ba_10 smon_15 lam_20 bdun_24 cu_29 mdzad_32 ba_38 rdzogs_41 
T16D4392:324a-23	so / //	so_0 
T16D4392:324a-24	/ pandi ta dharmm'a shr'i pra bh'a dang /	pandi_2 ta_8 dharmm_11 shr_20 pra_26 bh_30 dang_35 
T16D4392:324a-25	lo ts'a ba bande dpal gyi lhun po'i sdes bsgyur cing zhus te gtan la phab pa'o//	lo_0 ts_3 ba_8 bande_11 dpal_17 gyi_22 lhun_26 po_31 sdes_36 sgyur_41 cing_48 zhus_53 te_58 gtan_61 la_66 'bebs_69 
