T16D4392:320b-0	@320b # // rgya gar skad du /	rgya_11 gar_16 skad_20 du_25 
T16D4392:320b-1	pra ni dh'a na sapta ni n'a ma g'a th'a /	pra_0 ni_4 dh_7 na_12 sapta_15 ni_21 n_24 ma_28 g_31 th_35 
T16D4392:320b-2	bod skad du /	'bod_0 skad_4 du_9 
T16D4392:320b-3	smon lam bdun bcu pa zhes bya ba'i tshigs su bcad pa /	smon_0 lam_5 bdun_9 'chu_14 ba_18 zhes_21 byed_26 ba_30 tshigs_35 su_42 gcod_45 ba_50 
T16D4392:320b-4	byang chub sems dpa' kun tu bzang po la phyag 'tshal lo //	byang_0 chub_6 sems_11 dpa'_16 kun_21 tu_25 bzang_28 po_34 la_37 phyag_40 'tshal_46 lo_53 
T16D4392:320b-5	yon tan rin chen dpag med tshogs mnga' zhing //	yon_0 tan_4 rin_8 chen_12 dpog_17 med_22 tshogs_26 mnga'_33 zhing_39 
T16D4392:320b-6	nyes pa'i dug sdong mtha' dag drung phyung ba //	nyes_0 ba_5 dug_10 sdong_14 mtha'_20 'dag_26 drung_30 'byin_36 ba_43 
T16D4392:320b-7	phyogs bcu dag na dus gsum bzhugs pa yi //	phyogs_0 'chu_7 'dag_11 na_15 dus_18 gsum_22 bzhugs_27 ba_34 yi_37 
T16D4392:320b-8	bde bar gshegs pa rnams la phyag 'tshal lo //	bde_0 ba_4 gshegs_8 ba_15 rnams_18 la_24 phyag_27 'tshal_33 lo_40 
T16D4392:320b-9	mi shes pa yi rab rib sel mdzad pa'i //	mi_0 shes_3 ba_8 yi_11 rab_14 rib_18 sel_22 mdzad_26 ba_32 
T16D4392:320b-10	bag la nyal ba'i mda' dug 'byin pa'i thabs //	bag_0 la_4 nyal_7 ba_12 mda'_17 dug_22 'byin_26 ba_32 thabs_37 
T16D4392:320b-11	'gro ba gsum po kun gyi blo gros kyi //	'gro_0 ba_5 gsum_8 po_13 kun_16 gyi_20 blo_24 gros_28 kyi_33 
T16D4392:320b-12	mig 'byed pa yi chos la phyag 'tshal lo //	mig_0 'byed_4 ba_10 yi_13 chos_16 la_21 phyag_24 'tshal_30 lo_37 
T16D4392:320b-13	bde gshegs sras po dge 'dun mi bzlog pa //	bde_0 gshegs_4 sras_11 po_16 dge_19 'dun_23 mi_28 bzlog_31 ba_37 
T16D4392:320b-14	thugs rje chen pos yid ni drangs gyur te //	thugs_0 rje_6 chen_10 pos_15 yid_19 ni_23 drangs_26 gyur_33 te_38 
T16D4392:320b-15	blo can bye bar gyur ba ma lus la //	blo_0 can_4 'bye_8 ba_12 gyur_16 ba_21 ma_24 lus_27 la_31 
T16D4392:321a-0	rgyun mi 'chad par mgo bos phyag @321a * //	rgyun_0 mi_6 'chad_9 ba_15 mgo_19 'bod_23 phyag_27 
T16D4392:321a-1	'tshal lo //	'tshal_0 lo_7 
T16D4392:321a-2	'gro ba rnams su bdag gis mi dge gang //	'gro_0 ba_5 rnams_8 su_14 bdag_17 gis_22 mi_26 dge_29 gang_33 
T16D4392:321a-3	cung zad bgyis sam bgyid stsal rjes yi rang //	cung_0 zad_5 bgyid_9 sam_15 bgyid_19 stsal_25 rjes_31 yi_36 rang_39 
T16D4392:321a-4	rgyal ba rnams la de dag bshags nas ni //	rgyal_0 ba_6 rnams_9 la_15 de_18 'dag_21 'chags_25 nas_32 ni_36 
T16D4392:321a-5	slan chad mi bgyid pa yi sdom pa nod //	slan_0 'chad_5 mi_10 bgyid_13 ba_19 yi_22 sdom_25 ba_30 nod_33 
T16D4392:321a-6	bde gshegs rang rgyal dang ni nyan thos dang //	bde_0 gshegs_4 rang_11 rgyal_16 dang_22 ni_27 nyan_30 thos_35 dang_40 
T16D4392:321a-7	rgyal ba'i sras kyis dge ba bsags pa dang //	rgyal_0 ba_6 sras_11 kyis_16 dge_21 ba_25 bsags_28 ba_34 dang_37 
T16D4392:321a-8	'jig rten pa yis legs par spyad pa bzhin //	'jig_0 rten_5 ba_10 yis_13 legs_17 ba_22 spyod_26 ba_32 bzhin_35 
T16D4392:321a-9	ma lus pa yang bdag ni yi rang ngo //	ma_0 lus_3 ba_7 yang_10 bdag_15 ni_20 yi_23 rang_26 ngo_31 
T16D4392:321a-10	skye bo nyon mongs dug gis mgo rmongs pa //	skye_0 'bo_5 nyon_8 mongs_13 dug_19 gis_23 mgo_27 rmongs_31 ba_38 
T16D4392:321a-11	de dag rnams la mi dge gang mchis pa //	de_0 'dag_3 rnams_7 la_13 mi_16 dge_19 gang_23 mchis_28 ba_34 
T16D4392:321a-12	de ni bdag nyid kho na dga' bzhin du //	de_0 ni_3 bdag_6 nyid_11 kho_16 na_20 dga'_23 bzhin_28 du_34 
T16D4392:321a-13	ci nas dmyal ba rnams su gzhol bar bgyi //	ci_0 nas_3 dmyal_7 ba_13 rnams_16 su_22 gzhol_25 ba_31 bgyid_35 
T16D4392:321a-14	'jig rten rab zhi bde ba'i bdud rtsi yis //	'jig_0 rten_5 rab_10 zhi_14 bde_18 ba_22 bdud_27 rtsi_32 yis_37 
T16D4392:321a-15	tshim nas yid ni dge ba bgyid gyur cig / gro ba dag gis sdug bsngal ji snyed pa //	tshim_0 nas_6 yid_10 ni_14 dge_17 ba_21 bgyid_24 gyur_30 cig_35 ba_45 'dag_48 gis_52 sdug_56 sngal_61 ji_68 snyed_71 ba_77 
T16D4392:321a-16	de ni bdag gis dang du len par shog / gro ba 'di dag yid la myur du ni //	de_0 ni_3 bdag_6 gis_11 dang_15 du_20 len_23 ba_27 shog_31 ba_42 'di_45 'dag_49 yid_53 la_57 myur_60 du_65 ni_68 
T16D4392:321a-17	yang dag byang chub nyid ni skye gyur cig /	yang_0 'dag_5 byang_9 chub_15 nyid_20 ni_25 skye_28 gyur_33 cig_38 
T16D4392:321a-18	yid la byang chub dag ni bskyed pa dag /	yid_0 la_4 byang_7 chub_13 'dag_18 ni_22 skyed_25 ba_32 'dag_35 
T16D4392:321a-19	byang chub tshogs rnams yang dag sgrub par shog /	byang_0 chub_6 tshogs_11 rnams_18 yang_24 'dag_29 sgrub_33 ba_39 shog_43 
T16D4392:321a-20	dge ba'i tshogs sgrub nas ni sa thob cing //	dge_0 ba_4 tshogs_9 sgrub_16 nas_22 ni_26 sa_29 'thob_32 cing_37 
T16D4392:321a-21	srid pa gsum gyi mgon po'i gdung bzung nas //	srid_0 ba_5 gsum_8 gyi_13 mgon_17 po_22 gdung_27 bzung_33 nas_39 
T16D4392:321a-22	dgra rnams bcom nas 'jig rten gsum dag na //	dgra_0 rnams_5 'joms_11 nas_16 'jig_20 rten_25 gsum_30 'dag_35 na_39 
T16D4392:321a-23	chos kyi rgyal srid chen po'i gnas thob shog / byang chub shing drung sangs rgyas rang sangs rgyas //	chos_0 kyi_5 rgyal_9 srid_15 chen_20 po_25 gnas_30 'thob_35 shog_40 byang_47 chub_53 shing_58 drung_64 sangs_70 rgya_76 rang_82 sangs_87 rgya_93 
T16D4392:321a-24	nyin zhag ji snyed gzhes shing bzhugs pa dag / dpe ma mchis pa'i chos kyi bdud rtsi'i char //	nyin_0 zhag_5 ji_10 snyed_13 gzhes_19 shing_25 bzhugs_31 ba_38 'dag_41 dpe_47 ma_51 mchis_54 ba_60 chos_65 kyi_70 bdud_74 rtsi_79 char_86 
T16D4392:321a-25	'gro la dbab pa'i slad du gsol bar bgyi //	'gro_0 la_5 'bebs_8 ba_13 slad_18 du_23 gsol_26 ba_31 bgyid_35 
T16D4392:321a-26	gzhan don phun sum tshogs pa rdzogs byas nas //	gzhan_0 don_6 phun_10 sum_15 tshogs_19 ba_26 rdzogs_29 byed_36 nas_41 
T16D4392:321a-27	mya ngan 'das pa mchog te gshegs pa gang //	mya_0 ngan_4 'da'_9 ba_14 mchog_17 te_23 gshegs_26 ba_33 gang_36 
T16D4392:321a-28	gzhan la phan pa mdzad cing yun ring du //	gzhan_0 la_6 phan_9 ba_14 mdzad_17 cing_23 yun_28 ring_32 du_37 
T16D4392:321a-29	bzhugs par blo bzang de la gsol bar bgyi //	bzhugs_0 ba_7 blo_11 bzang_15 de_21 la_24 gsol_27 ba_32 bgyid_36 
T16D4392:321a-30	'jig rten gsum po thibs po der rgyu ba'i //	'jig_0 rten_5 gsum_10 po_15 thibs_18 po_24 der_27 rgyu_31 ba_36 
T16D4392:321a-31	sems can su dag ji snyed mchis pa dag / de dag rab tu zhi ba'i bde ba yi //	sems_0 can_5 su_9 'dag_12 ji_16 snyed_19 mchis_25 ba_31 'dag_34 de_40 'dag_43 rab_47 tu_51 zhi_54 ba_58 bde_63 ba_67 yi_70 
T16D4392:321a-32	bdud rtsi'i longs spyod mgron du gnyer bar bgyi //	bdud_0 rtsi_5 longs_12 spyod_18 mgron_24 du_30 gnyer_33 ba_39 bgyid_43 
T16D4392:321a-33	de ltar dge ba gang dag bsgrubs pa 'di //	de_0 ltar_3 dge_8 ba_12 gang_15 'dag_20 sgrub_24 ba_32 'di_35 
T16D4392:321a-34	ma lus yang dag byang chub bsngo bar bgyi //	ma_0 lus_3 yang_7 'dag_12 byang_16 chub_22 sngo_27 ba_33 bgyid_37 
T16D4392:321a-35	des ni bdag ni byang chub sems dang ni //	des_0 ni_4 bdag_7 ni_12 byang_15 chub_21 sems_26 dang_31 ni_36 
T16D4392:321a-36	skad cig tsam yang 'bral bar ma gyur cig / ji srid phun sum tshogs pa'i gzhir gyur pa //	skad_0 cig_5 tsam_9 yang_14 'bral_19 ba_25 ma_29 gyur_32 cig_37 ji_43 srid_46 phun_51 sum_56 tshogs_60 ba_67 gzhir_72 gyur_78 ba_83 
T16D4392:321b-0	bde @321b bar gshegs pa'i go 'phang ma mnan pa //	bde_0 ba_10 gshegs_14 ba_21 go_26 'phen_29 ma_36 gnon_39 ba_44 
T16D4392:321b-1	de srid du ni thub pa'i khyu mchog dang //	de_0 srid_3 du_8 ni_11 thub_14 ba_19 khyu_24 mchog_29 dang_35 
T16D4392:321b-2	byang chub sems dpa' rnams dang bral ma gyur //	byang_0 chub_6 sems_11 dpa'_16 rnams_21 dang_27 'bral_32 ma_37 gyur_40 
T16D4392:321b-3	de dag kho nas gzhan la dman pa yi //	de_0 'dag_3 kho_7 nas_11 gzhan_15 la_21 dman_24 ba_29 yi_32 
T16D4392:321b-4	spyod pa'i lam dag nye bar bstan pa la //	spyod_0 ba_6 lam_11 'dag_15 nye_19 ba_23 ston_27 ba_33 la_36 
T16D4392:321b-5	skyo ba ma mchis par ni sangs rgyas kyi //	skyo_0 ba_5 ma_8 mchis_11 ba_17 ni_21 sangs_24 rgya_30 kyi_36 
T16D4392:321b-6	sras kyi kun la yang ni sbyar bar bgyi //	sras_0 kyi_5 kun_9 la_13 yang_16 ni_21 sbyor_24 ba_30 bgyid_34 
T16D4392:321b-7	bdag gi lus kyi yan lag nying lag dag / tshang zhing skye bo kun gyis bstod 'os pa'i //	bdag_0 gi_5 lus_8 kyi_12 yan_16 lag_20 nying_24 lag_30 'dag_34 tshang_40 zhing_47 skye_53 'bo_58 kun_61 gyis_65 bstod_70 'os_76 ba_80 
T16D4392:321b-8	yon tan phung po tshe rabs dran pa dang //	yon_0 tan_4 'phung_8 po_14 tshe_17 rabs_22 dran_27 ba_32 dang_35 
T16D4392:321b-9	cho rigs btsun zhing lus ni mdzes par shog / gzhan phan spong zhing rang don lhur len pa //	cho_0 rigs_4 btsun_9 zhing_15 lus_21 ni_25 mdzes_28 ba_34 shog_38 gzhan_45 phan_51 spong_56 zhing_62 rang_68 don_73 lhur_77 len_82 ba_86 
T16D4392:321b-10	tha chad dug dang 'dra ba spangs nas su //	tha_0 'chad_4 dug_9 dang_13 'dra_18 ba_23 spong_26 nas_33 su_37 
T16D4392:321b-11	snying rjes gdungs pa'i yid kyis skye bo kun //	snying_0 rjes_7 gdung_12 ba_19 yid_24 kyis_28 skye_33 'bo_38 kun_41 
T16D4392:321b-12	gcig tu gzhol bar rjes su 'dzin par shog / bdag gis bdog pa rnams la gzhan gyis blo //	gcig_0 tu_5 gzhol_8 ba_14 rjes_18 su_23 'dzin_26 ba_32 shog_36 bdag_43 gis_48 bdog_52 ba_57 rnams_60 la_66 gzhan_69 gyis_75 blo_80 
T16D4392:321b-13	gzhan gyi nor snyam cung zad mi 'dzin cing //	gzhan_0 gyi_6 nor_10 snyam_14 cung_20 zad_25 mi_29 'dzin_32 cing_38 
T16D4392:321b-14	rang gi nor la som nyi ma mchis ltar //	rang_0 gi_5 nor_8 la_12 som_15 nyi_19 ma_23 mchis_26 ltar_32 
T16D4392:321b-15	bag yangs dag tu len cing spyod par shog / bdag gi sha zhig slong ba mchis na yang //	bag_0 yangs_4 'dag_10 tu_14 len_17 cing_21 spyod_26 ba_32 shog_36 bdag_43 gi_48 sha_51 'jig_55 slong_60 ba_66 mchis_69 na_75 yang_78 
T16D4392:321b-16	brod la 'dzum pa'i mig gis stsal bar bgyi //	brod_0 la_5 'dzum_8 ba_14 mig_19 gis_23 stsal_27 ba_33 bgyid_37 
T16D4392:321b-17	bdag gi rkang la sogs pa rtag tu yang //	bdag_0 gi_5 rkang_8 la_14 sogs_17 ba_22 rtag_25 tu_30 yang_33 
T16D4392:321b-18	lus can rnams kyi don du gtong bar shog / bdag ni yid bzhin nor bus 'gro ba yi //	lus_0 can_4 rnams_8 kyi_14 don_18 du_22 gtong_25 ba_31 shog_35 bdag_42 ni_47 yid_50 bzhin_54 nor_60 'bud_64 'gro_68 ba_73 yi_76 
T16D4392:321b-19	'dod pa'i dngos po mtha' dag sgrub pa dang //	'dod_0 ba_5 dngos_10 po_16 mtha'_19 'dag_25 sgrub_29 ba_35 dang_38 
T16D4392:321b-20	yid la re ba yongs rdzogs bgyid pa yi //	yid_0 la_4 re_7 ba_10 yongs_13 rdzogs_19 bgyid_26 ba_32 yi_35 
T16D4392:321b-21	dpag bsam gyi ni shing dang 'dra bar shog /	dpog_0 bsam_5 gyi_10 ni_14 shing_17 dang_23 'dra_28 ba_33 shog_37 
T16D4392:321b-22	bdag ni rang gi ngang gis sdig pa dag /	bdag_0 ni_5 rang_8 gi_13 ngang_16 gis_22 sdig_26 ba_31 'dag_34 
T16D4392:321b-23	mi gtsang ba ltar rgyang ring spong ba dang //	mi_0 gtsang_3 ba_10 ltar_13 rgyang_18 ring_25 spong_30 ba_36 dang_39 
T16D4392:321b-24	thub pa'i skyes mchog gis ni bslab bcas pa'i //	thub_0 ba_5 skye_10 mchog_16 gis_22 ni_26 bslab_29 'cha'_35 ba_40 
T16D4392:321b-25	chu lon 'dral bar bgyid par ma gyur cig / lus dang srog la lta ba rkyang bsring nas //	chu_0 lon_4 'dral_8 ba_14 bgyid_18 ba_24 ma_28 gyur_31 cig_36 lus_42 dang_46 srog_51 la_56 lta_59 ba_63 rkyang_66 bsring_73 nas_80 
T16D4392:321b-26	rtag par dgon pa rnams su dga' bar bgyi //	rtag_0 ba_5 dgon_9 ba_14 rnams_17 su_23 dga'_26 ba_31 bgyid_35 
T16D4392:321b-27	rnyed pa dag dang bkur sti mtha' dag la //	rnyed_0 ba_6 'dag_9 dang_13 bkur_18 sti_23 mtha'_27 'dag_33 la_37 
T16D4392:321b-28	slon pa'i zas bzhin blo ni bzlog par bgyi //	slon_0 ba_5 zas_10 bzhin_14 blo_20 ni_24 bzlog_27 ba_33 bgyid_37 
T16D4392:321b-29	'gro ba rnams la gdol ba'i phru gu bzhin //	'gro_0 ba_5 rnams_8 la_14 gdol_17 ba_22 'phru_27 gu_32 bzhin_35 
T16D4392:321b-30	rgyags dang nga rgyal dregs pa spangs pa dang //	rgyags_0 dang_7 nga_12 rgyal_16 dregs_22 ba_28 spong_31 ba_38 dang_41 
T16D4392:321b-31	rigs btsun pa yi nye du'i tshogs bzhin du //	rigs_0 btsun_5 ba_11 yi_14 nye_17 du_21 tshogs_26 bzhin_33 du_39 
T16D4392:321b-32	rjes su mthun pa sgrub cing spyad par bgyi //	rjes_0 su_5 mthun_8 ba_14 sgrub_17 cing_23 spyod_28 ba_34 bgyid_38 
T16D4392:321b-33	zla zer padma rtsal lag dri ma bral //	zla_0 zer_4 padma_8 rtsal_14 lag_20 'dri_24 ma_28 'bral_31 
T16D4392:321b-34	ma ral ma 'dres nag nog ma mchis la //	ma_0 ral_3 ma_7 'dre_10 nag_16 nogs_20 ma_24 mchis_27 la_33 
T16D4392:321b-35	ma lus rab tu zhi ba'i rgyur gyur pa'i //	ma_0 lus_3 rab_7 tu_11 zhi_14 ba_18 rgyur_23 gyur_29 ba_34 
T16D4392:322a-0	tshul khrims la ni bdag ni @322a * //	tshul_0 khrims_6 la_13 ni_16 bdag_19 ni_24 
T16D4392:322a-1	goms par bgyi //	goms_0 ba_5 bgyid_9 
T16D4392:322a-2	su dag nongs ma mchis par bdag gi mgo / sog les tshal ba brgyar ni gshags bgyid kyang //	su_0 'dag_3 nongs_7 ma_13 mchis_16 ba_22 bdag_26 gi_31 mgo_34 sog_40 les_44 tshal_48 ba_54 brgyar_57 ni_64 gshags_67 bgyid_74 kyang_80 
T16D4392:322a-3	de la 'ang bu gcig gces pa bzhin du'ang //	de_0 la_3 'ang_6 bu_11 gcig_14 gces_19 ba_24 bzhin_27 du_33 
T16D4392:322a-4	rgyun mi 'chad par sems ni phangs par bgyi //	rgyun_0 mi_6 'chad_9 ba_15 sems_19 ni_24 'phang_27 ba_34 bgyid_38 
T16D4392:322a-5	su dag snying nas bdag la khros gyur te ;	su_0 'dag_3 snying_7 nas_14 bdag_18 la_23 khro_26 gyur_32 te_37 
T16D4392:322a-6	/ dgos pa ma mchis bzhin du srog 'phrog na'ang //	dgos_2 ba_7 ma_10 mchis_13 bzhin_19 du_25 srog_28 'phrog_33 na_40 
T16D4392:322a-7	de la'ang las kyi 'bras bu mi bzad par //	de_0 la_3 las_10 kyi_14 'bras_18 bu_24 mi_27 bzad_30 ba_35 
T16D4392:322a-8	mi 'tshal ba dag 'byung bar ma gyur cig / khro ba dang ni gshe dang mtshang 'bru dang //	mi_0 'tshal_3 ba_10 'dag_13 'byung_17 ba_24 ma_28 gyur_31 cig_36 khro_42 ba_47 dang_50 ni_55 gshe_58 dang_63 mtshang_68 'bru_76 dang_81 
T16D4392:322a-9	brdeg par gyur kyang bzod pa mi btang ste //	brdeg_0 ba_6 gyur_10 kyang_15 bzod_21 ba_26 mi_29 gtong_32 ste_38 
T16D4392:322a-10	rgyal ba'i sras kyi spyod pa sgrub pa'i phyir ;	rgyal_0 ba_6 sras_11 kyi_16 spyod_20 ba_26 sgrub_29 ba_35 phyir_40 
T16D4392:322a-11	/ sdug bsngal ma lus pa dag dang du blang //	sdug_2 sngal_7 ma_14 lus_17 ba_21 'dag_24 dang_28 du_33 blang_36 
T16D4392:322a-12	sngon chad rnyed ma myong ba thub pa'i chos //	sngon_0 'chad_6 rnyed_11 ma_17 myong_20 ba_26 thub_29 ba_34 chos_39 
T16D4392:322a-13	shin tu zab cing rigs pa'i mchog la yang //	shin_0 tu_5 zab_8 cing_12 rigs_17 ba_22 mchog_27 la_33 yang_36 
T16D4392:322a-14	bdag gis sems la skad cig tsam yang ni //	bdag_0 gis_5 sems_9 la_14 skad_17 cig_22 tsam_26 yang_31 ni_36 
T16D4392:322a-15	som nyi'i dpyang thag g-yo bar ma gyur cig / bdag gi skye ba tshe rabs tshe rabs su //	som_0 nyi_4 dpyong_10 thag_17 g-yo_22 ba_27 ma_31 gyur_34 cig_39 bdag_45 gi_50 skye_53 ba_58 tshe_61 rabs_66 tshe_71 rabs_76 su_81 
T16D4392:322a-16	'gro ba kun la sman pa lhur spyod kyis //	'gro_0 ba_5 kun_8 la_12 sman_15 ba_20 lhur_23 spyod_28 kyis_34 
T16D4392:322a-17	skad cig tsam yang dge ba rgya chen po //	skad_0 cig_5 tsam_9 yang_14 dge_19 ba_23 rgya_26 chen_31 po_36 
T16D4392:322a-18	bgyid par mi 'gyur bar ni ma gyur cig / bran dang 'dra bar 'gro ba thams cad kyi //	bgyid_0 ba_6 mi_10 'gyur_13 ba_19 ni_23 ma_26 gyur_29 cig_34 bran_40 dang_45 'dra_50 ba_55 'gro_59 ba_64 thams_67 cad_73 kyi_77 
T16D4392:322a-19	bgyi ba ma lus pa dag bsgrub par bgyi //	bgyid_0 ba_5 ma_8 lus_11 ba_15 'dag_18 sgrub_22 ba_29 bgyid_33 
T16D4392:322a-20	bdag gis kun gyis bgyi ba'i khur spangs nas //	bdag_0 gis_5 kun_9 gyis_13 bgyid_18 ba_23 'khur_28 spong_33 nas_40 
T16D4392:322a-21	sems can rnams ni bde bar gnas par shog / lus ni gzhan gyi bran bgyid tshig smra na'ang //	sems_0 can_5 rnams_9 ni_15 bde_18 ba_22 gnas_26 ba_31 shog_35 lus_42 ni_46 gzhan_49 gyi_55 bran_59 bgyid_64 tshig_70 smra_76 na_81 
T16D4392:322a-22	gzhan la chos ston pa la dga' ba dang //	gzhan_0 la_6 chos_9 ston_14 ba_19 la_22 dga'_25 ba_30 dang_33 
T16D4392:322a-23	bdag gi yid kyang rtag tu gzhan dag la //	bdag_0 gi_5 yid_8 kyang_12 rtag_18 tu_23 gzhan_26 'dag_32 la_36 
T16D4392:322a-24	phan par sems pa'i dbang du bgyid par shog / gal te dmyal bar bskal ba grangs med du //	phan_0 ba_5 sems_9 ba_14 dbang_19 du_25 bgyid_28 ba_34 shog_38 gal_45 te_49 dmyal_52 ba_58 bskal_62 ba_68 grangs_71 med_78 du_82 
T16D4392:322a-25	gcig tu sdug bsngal nyams su myong na yang //	gcig_0 tu_5 sdug_8 sngal_13 nyams_20 su_26 myong_29 na_35 yang_38 
T16D4392:322a-26	'on kyang skyo ba dag ni ma mchis par //	'on_0 kyang_4 skyo_10 ba_15 'dag_18 ni_22 ma_25 mchis_28 ba_34 
T16D4392:322a-27	sems can yongs su smin par bgyid par shog / gcig nas sgrub pa'i rim pa 'di nyid kyis //	sems_0 can_5 yongs_9 su_15 smin_18 ba_23 bgyid_27 ba_33 shog_37 gcig_44 nas_49 sgrub_53 ba_59 rim_64 ba_68 'di_71 nyid_75 kyis_80 
T16D4392:322a-28	lus can rnams ni 'dul bar bgyi slad du //	lus_0 can_4 rnams_8 ni_14 'dul_17 ba_22 bgyid_26 slad_31 du_36 
T16D4392:322a-29	'gro ba gsum po yongs su smin bgyid pa'i //	'gro_0 ba_5 gsum_8 po_13 yongs_16 su_22 smin_25 bgyid_30 ba_36 
T16D4392:322a-30	go cha 'di nyid kyang ni bgo bar bgyi //	go_0 cha_3 'di_7 nyid_11 kyang_16 ni_22 bgod_25 ba_29 bgyid_33 
T16D4392:322a-31	me yi 'dag mas bar mtshams ma mchis pa'i //	me_0 yi_3 'dag_6 mas_11 ba_15 mtshams_19 ma_27 mchis_30 ba_36 
T16D4392:322a-32	'obs rnams gang las brgal nas legs gsungs pa'i //	'obs_0 rnams_5 gang_11 las_16 rgol_20 nas_26 legs_30 gsungs_35 ba_42 
T16D4392:322a-33	tshig gcig tsam yang mnyan pa'i ched du ni //	tshig_0 gcig_6 tsam_11 yang_16 nyan_21 ba_27 ched_32 du_37 ni_40 
T16D4392:322a-34	le lo ma mchis spro ba bgyid par shog /	le_0 lo_3 ma_6 mchis_9 spro_15 ba_20 bgyid_23 ba_29 shog_33 
T16D4392:322b-0	bsam gtan @322b gzugs med ting 'dzin mtha' dag ni	bsam_0 gtan_5 gzugs_16 med_22 ting_26 'dzin_31 mtha'_37 'dag_43 ni_47 
T16D4392:322b-1	// 'bras bu rnams la dga' ba spangs nas ni //	'bras_3 bu_9 rnams_12 la_18 dga'_21 ba_26 spong_29 nas_36 ni_40 
T16D4392:322b-2	rab tu mthar phyin pa yi gnas pa yis //	rab_0 tu_4 mthar_7 phyin_13 ba_19 yi_22 gnas_25 ba_30 yis_33 
T16D4392:322b-3	dga' bar 'gyur ba dag tu goms par bgyi //	dga'_0 ba_5 'gyur_9 ba_15 'dag_18 tu_22 goms_25 ba_30 bgyid_34 
T16D4392:322b-4	zhen pa ma mchis zhi gnas rta zhon nas //	zhen_0 ba_5 ma_8 mchis_11 zhi_17 gnas_21 rta_26 zhon_30 nas_35 
T16D4392:322b-5	rang bzhin g-yo ba'i sems kyi glang po che //	rang_0 bzhin_5 g-yo_11 ba_16 sems_21 kyi_26 glang_30 po_36 che_39 
T16D4392:322b-6	shin tu gdul bar dka' ba log pa yi //	shin_0 tu_5 gdul_8 ba_13 dka'_17 ba_22 log_25 ba_29 yi_32 
T16D4392:322b-7	lam du zhugs pa rnams ni 'dul bar bgyi //	lam_0 du_4 'jug_7 ba_13 rnams_16 ni_22 'dul_25 ba_30 bgyid_34 
T16D4392:322b-8	lha dbang dag dang 'khor los sgyur ba yi //	lha_0 dbang_4 'dag_10 dang_14 'khor_19 los_25 sgyur_29 ba_35 yi_38 
T16D4392:322b-9	'byor pa dam pa mchog dag mchis pa rnams //	'byor_0 ba_6 dam_9 ba_13 mchog_16 'dag_22 mchis_26 ba_32 rnams_35 
T16D4392:322b-10	'dod pa'i rang bzhin mi gtsang ba bzhin du //	'dod_0 ba_5 rang_10 bzhin_15 mi_21 gtsang_24 ba_31 bzhin_34 du_40 
T16D4392:322b-11	bdag gi yid ni ltos pa ma mchis shog /	bdag_0 gi_5 yid_8 ni_12 ltos_15 ba_20 ma_23 mchis_26 shog_32 
T16D4392:322b-12	lcags kyi khang pa 'bar ba 'dra ba yis //	lcags_0 kyi_6 khang_10 ba_16 'bar_19 ba_24 'dra_27 ba_32 yis_35 
T16D4392:322b-13	sreg par rgyu bar bdag ni dgar ma gyur //	sreg_0 ba_5 rgyu_9 ba_14 bdag_18 ni_23 dgar_26 ma_31 gyur_34 
T16D4392:322b-14	snying rjes drangs nas gzhan la sman pa dag /	snying_0 rjes_7 drangs_12 nas_19 gzhan_23 la_29 sman_32 ba_37 'dag_40 
T16D4392:322b-15	bgyis par rjes su mthun par skye bar shog / gro	bgyid_0 ba_6 rjes_10 su_15 mthun_18 ba_24 skye_28 ba_33 shog_37 
T16D4392:322b-16	ba'i mgon gyi sras po thams cad kyi //	ba_0 mgon_5 gyi_10 sras_14 po_19 thams_22 cad_28 kyi_32 
T16D4392:322b-17	ting 'dzin gang zhig la ni dbang brnyes pas //	ting_0 'dzin_5 gang_11 'jig_16 la_21 ni_24 dbang_27 brnyes_33 ba_40 
T16D4392:322b-18	rnam par bsgyings pa bsam gyis mi khyab pa //	rnam_0 ba_5 sgying_9 ba_18 bsam_21 gyis_26 mi_31 khyab_34 ba_40 
T16D4392:322b-19	dpa' bo rol pa sna tshogs mdzad pa yis //	dpa'_0 'bo_5 rol_8 ba_12 sna_15 tshogs_19 mdzad_26 ba_32 yis_35 
T16D4392:322b-20	dpa' bar 'gro ba dag dang nam mkha'i mdzod //	dpa'_0 ba_5 'gro_9 ba_14 'dag_17 dang_21 nam_26 mkha_30 mdzod_37 
T16D4392:322b-21	dri med la sogs ma lus thob bgyis nas //	'dri_0 med_4 la_8 sogs_11 ma_16 lus_19 'thob_23 bgyid_28 nas_34 
T16D4392:322b-22	'gro ba gsum po ma lus pa dag gis //	'gro_0 ba_5 gsum_8 po_13 ma_16 lus_19 ba_23 'dag_26 gis_30 
T16D4392:322b-23	bde ba gya nom bsgrubs nas cher stsal to //	bde_0 ba_4 'gyas_7 mnam_11 sgrub_15 nas_23 cher_27 stsal_32 to_38 
T16D4392:322b-24	bzo dang bstan bcos sgyu rtsal rgya mtsho dag / mchog tu pha mtha' phul du phyin pa dang //	bzo_0 dang_4 ston_9 'chos_15 sgyu_20 rtsal_25 rgya_31 mtsho_36 'dag_42 mchog_48 tu_54 pha_57 mtha'_61 'bul_67 du_72 phyin_75 ba_81 dang_84 
T16D4392:322b-25	sems can thams cad kyis ni tshig gi don //	sems_0 can_5 thams_9 cad_15 kyis_19 ni_24 tshig_27 gi_33 don_36 
T16D4392:322b-26	ma lus pa dag rtogs shing mkhas par shog / tshig don ma lus spyod pa'i shes rab ni //	ma_0 lus_3 ba_7 'dag_10 rtogs_14 shing_20 mkhas_26 ba_32 shog_36 tshig_43 don_49 ma_53 lus_56 spyod_60 ba_66 shes_71 rab_76 ni_80 
T16D4392:322b-27	dri med rnon po dpag tu med thob nas //	'dri_0 med_4 rnon_8 po_13 dpog_16 tu_21 med_24 'thob_28 nas_33 
T16D4392:322b-28	sems can rnams la shin tu zab pa yi //	sems_0 can_5 rnams_9 la_15 shin_18 tu_23 zab_26 ba_30 yi_33 
T16D4392:322b-29	rigs pa'i chos rnams kyi ni bgo bsha' bgyi //	rigs_0 ba_5 chos_10 rnams_15 kyi_21 ni_25 bgod_28 bsha'_32 bgyid_38 
T16D4392:322b-30	sangs rgyas gsung dag mthar phyin ma rtogs pa'i //	sangs_0 rgya_6 gsung_12 'dag_18 mthar_22 phyin_28 ma_34 rtogs_37 ba_43 
T16D4392:322b-31	sems can ma lus pa ni mtha' dag la //	sems_0 can_5 ma_9 lus_12 ba_16 ni_19 mtha'_22 'dag_28 la_32 
T16D4392:322b-32	sems la yi ge bris pa 'dra bar ni //	sems_0 la_5 yi_8 ge_11 'bri_14 ba_19 'dra_22 ba_27 ni_31 
T16D4392:322b-33	mang po dag gis rab tu bstan par bgyi //	mang_0 po_5 'dag_8 gis_12 rab_16 tu_20 ston_23 ba_29 bgyid_33 
T16D4392:322b-34	ci nas 'bras bur bcas pa'i stobs bcu yis //	ci_0 nas_3 'bras_7 bur_13 'cha'_17 ba_22 stobs_27 'chu_33 yis_37 
T16D4392:322b-35	go 'phang mngon par 'dzegs gnas 'gro ba'i don //	go_0 'phen_3 mngon_10 ba_16 'dzegs_20 gnas_27 'gro_32 ba_37 don_42 
T16D4392:322b-36	ma tshang ma lus 'bras mchis bgyid pa yi //	ma_0 tshang_3 ma_10 lus_13 'bras_17 mchis_23 bgyid_29 ba_35 yi_38 
T16D4392:322b-37	thabs kyis spyod pa de dag bsgrub par bgyi //	thabs_0 kyis_6 spyod_11 ba_17 de_20 'dag_23 sgrub_27 ba_34 bgyid_38 
T16D4392:323a-0	ji lta ji ltar sems can phan pa'i @323a * //	ji_0 lta_3 ji_7 ltar_10 sems_15 can_20 phan_24 ba_29 
T16D4392:323a-1	rgyu ;	rgyu_0 
T16D4392:323a-2	/ thub pa rnams kyi smon lam ma lus pa //	thub_2 ba_7 rnams_10 kyi_16 smon_20 lam_25 ma_29 lus_32 ba_36 
T16D4392:323a-3	de lta de ltar rgyun du smon lam gyi //	de_0 lta_3 de_7 ltar_10 rgyun_15 du_21 smon_24 lam_29 gyi_33 
T16D4392:323a-4	pha rol phyin pa dag ni thob par bgyi //	pha_0 rol_4 phyin_8 ba_14 'dag_17 ni_21 'thob_24 ba_29 bgyid_33 
T16D4392:323a-5	yul gyi dgra yi tshogs ni mi bzad pa //	yul_0 gyi_4 dgra_8 yi_13 tshogs_16 ni_23 mi_26 bzad_29 ba_34 
T16D4392:323a-6	mod la ma lus ci dgar zil mnan nas //	mod_0 la_4 ma_7 lus_10 ci_14 dgar_17 zil_22 gnon_26 nas_31 
T16D4392:323a-7	sems kyi spyod pa rnams ni mi g-yo zhing ;	sems_0 kyi_5 spyod_9 ba_15 rnams_18 ni_24 mi_27 g-yo_30 zhing_35 
T16D4392:323a-8	/ sa steng phan pa kho nas gnas par bgyi //	sa_2 steng_5 phan_11 ba_16 kho_19 nas_23 gnas_27 ba_32 bgyid_36 
T16D4392:323a-9	chos 'di dag ni sgyu ma smig rgyu dang //	chos_0 'di_5 'dag_9 ni_13 sgyu_16 ma_21 smig_24 rgyu_29 dang_34 
T16D4392:323a-10	sprul pa lta bur yang dag rtogs bgyis nas //	sprul_0 ba_6 lta_9 bur_13 yang_17 'dag_22 rtogs_26 bgyid_32 nas_38 
T16D4392:323a-11	rtog pa'i dri ma rnams ni spangs nas su //	rtogs_0 ba_5 'dri_10 ma_14 rnams_17 ni_23 spong_26 nas_33 su_37 
T16D4392:323a-12	'jig rten gsum la phan par bgyid gyur cig /	'jig_0 rten_5 gsum_10 la_15 phan_18 ba_23 bgyid_27 gyur_33 cig_38 
T16D4392:323a-13	pha dag bu gcig la hag par gces pa bzhin	pha_0 'dag_4 bu_8 gcig_11 la_16 hag_19 ba_23 gces_27 ba_32 bzhin_35 
T16D4392:323a-14	// nag nog ma lus pa dag spangs nas su //	nag_3 nogs_7 ma_11 lus_14 ba_18 'dag_21 spong_25 nas_32 su_36 
T16D4392:323a-15	rgyun mi 'chad par 'gro ba mtha' dag la //	rgyun_0 mi_6 'chad_9 ba_15 'gro_19 ba_24 mtha'_27 'dag_33 la_37 
T16D4392:323a-16	byams pa'i bsgom pa dag gis gnas par bgyi //	byams_0 ba_6 bsgom_11 ba_17 'dag_20 gis_24 gnas_28 ba_33 bgyid_37 
T16D4392:323a-17	ji ltar ma dag brtse ba'i khur lci ba'i //	ji_0 ltar_3 ma_8 'dag_11 brtse_15 ba_21 'khur_26 lci_31 ba_35 
T16D4392:323a-18	bun pa la rjes su mthun spyod pa //	bun_0 ba_4 la_7 rjes_10 su_15 mthun_18 spyod_24 ba_30 
T16D4392:323a-19	de bzhin bdag kyang 'gro ba sems can la ;	de_0 bzhin_3 bdag_9 kyang_14 'gro_20 ba_25 sems_28 can_33 la_37 
T16D4392:323a-20	/ snying rjes rgyas 'gyur so sor bgyid par shog	snying_2 rjes_9 rgya_14 'gyur_20 so_26 sor_29 bgyid_33 ba_39 shog_43 
T16D4392:323a-21	/ pha rol bde ba'i 'byor ba mthong nas ni	pha_2 rol_6 bde_10 ba_14 'byor_19 ba_25 mthong_28 nas_35 ni_39 
T16D4392:323a-22	// lhag par dga' ba mang po skyes nas su //	lhag_3 ba_8 dga'_12 ba_17 mang_20 po_25 skye_28 nas_34 su_38 
T16D4392:323a-23	snying gi bu gcig pa la bde skyed bzhin //	snying_0 gi_7 bu_10 gcig_13 ba_18 la_21 bde_24 skyed_28 bzhin_34 
T16D4392:323a-24	dga' ba'i bsgom pa dag gis gnas par bgyi //	dga'_0 ba_5 bsgom_10 ba_16 'dag_19 gis_23 gnas_27 ba_32 bgyid_36 
T16D4392:323a-25	sems can rnams la phan dang gnod pa'i rgyu //	sems_0 can_5 rnams_9 la_15 phan_18 dang_23 gnod_28 ba_33 rgyu_38 
T16D4392:323a-26	khong khro rjes su chags pa spangs nas ni //	khong_0 khro_6 rjes_11 su_16 chags_19 ba_25 spong_28 nas_35 ni_39 
T16D4392:323a-27	rang gi bu la bgyi ba bsgrub pa bzhin //	rang_0 gi_5 bu_8 la_11 bgyid_14 ba_19 sgrub_22 ba_29 bzhin_32 
T16D4392:323a-28	'jig rten gsum po kun gyi bgyi ba bsgrub //	'jig_0 rten_5 gsum_10 po_15 kun_18 gyi_22 bgyid_26 ba_31 sgrub_34 
